Unloading StdEnv/2020

Due to MODULEPATH changes, the following have been reloaded:
  1) mii/1.1.1


The following have been reloaded with a version change:
  1) python/3.8.2 => python/3.7.4

Using base prefix '/cvmfs/soft.computecanada.ca/easybuild/software/2017/Core/python/3.7.4'
New python executable in /localscratch/yinan.28739327.0/env/bin/python
Installing setuptools, pip, wheel...
done.
Ignoring pip: markers 'python_version < "3"' don't match your environment
Looking in links: /cvmfs/soft.computecanada.ca/custom/python/wheelhouse/nix/avx2, /cvmfs/soft.computecanada.ca/custom/python/wheelhouse/nix/generic, /cvmfs/soft.computecanada.ca/custom/python/wheelhouse/generic
Collecting pip
Installing collected packages: pip
  Found existing installation: pip 19.1.1
    Uninstalling pip-19.1.1:
      Successfully uninstalled pip-19.1.1
Successfully installed pip-21.2.3+computecanada
Looking in links: /cvmfs/soft.computecanada.ca/custom/python/wheelhouse/nix/avx2, /cvmfs/soft.computecanada.ca/custom/python/wheelhouse/nix/generic, /cvmfs/soft.computecanada.ca/custom/python/wheelhouse/generic
Processing /cvmfs/soft.computecanada.ca/custom/python/wheelhouse/generic/keras-2.8.0+computecanada-py2.py3-none-any.whl
Processing /cvmfs/soft.computecanada.ca/custom/python/wheelhouse/generic/Keras_Preprocessing-1.1.2+computecanada-py3-none-any.whl
Requirement already satisfied: matplotlib in /cvmfs/soft.computecanada.ca/easybuild/software/2017/Core/scipy-stack/2019a/lib/python3.7/site-packages (from -r requirements.txt (line 3)) (3.0.2)
Processing /cvmfs/soft.computecanada.ca/custom/python/wheelhouse/generic/nltk-3.6.5+computecanada-py3-none-any.whl
Processing /cvmfs/soft.computecanada.ca/custom/python/wheelhouse/generic/scikit_learn-0.22.1+computecanada-cp37-cp37m-linux_x86_64.whl
Processing /cvmfs/soft.computecanada.ca/custom/python/wheelhouse/generic/tensorboard-2.3.0+computecanada-py3-none-any.whl
Processing /cvmfs/soft.computecanada.ca/custom/python/wheelhouse/generic/tensorboard_plugin_wit-1.7.0+computecanada-py3-none-any.whl
Processing /cvmfs/soft.computecanada.ca/custom/python/wheelhouse/generic/tensorflow_gpu-2.3.0+computecanada-cp37-cp37m-linux_x86_64.whl
Processing /cvmfs/soft.computecanada.ca/custom/python/wheelhouse/generic/tensorflow_estimator-2.3.0+computecanada-py2.py3-none-any.whl
Processing /cvmfs/soft.computecanada.ca/custom/python/wheelhouse/generic/tokenizers-0.5.2+computecanada-cp37-cp37m-linux_x86_64.whl
Processing /cvmfs/soft.computecanada.ca/custom/python/wheelhouse/nix/avx2/torch-1.4.0+computecanada-cp37-cp37m-linux_x86_64.whl
Processing /cvmfs/soft.computecanada.ca/custom/python/wheelhouse/generic/torchtext-0.6.0+computecanada-py3-none-any.whl
Processing /cvmfs/soft.computecanada.ca/custom/python/wheelhouse/generic/torchvision-0.8.2+computecanada-cp37-cp37m-linux_x86_64.whl
Processing /cvmfs/soft.computecanada.ca/custom/python/wheelhouse/generic/transformers-2.5.1+computecanada-py3-none-any.whl
Processing /cvmfs/soft.computecanada.ca/custom/python/wheelhouse/generic/urllib3-1.26.7+computecanada-py2.py3-none-any.whl
Processing /cvmfs/soft.computecanada.ca/custom/python/wheelhouse/generic/joblib-1.1.0+computecanada-py2.py3-none-any.whl
Processing /cvmfs/soft.computecanada.ca/custom/python/wheelhouse/generic/click-8.0.3+computecanada-py3-none-any.whl
Processing /cvmfs/soft.computecanada.ca/custom/python/wheelhouse/generic/tqdm-4.63.0+computecanada-py2.py3-none-any.whl
ERROR: Could not find a version that satisfies the requirement regex>=2021.8.3 (from nltk) (from versions: 2018.1.10+computecanada, 2019.11.1+computecanada, 2020.11.13+computecanada)
ERROR: No matching distribution found for regex>=2021.8.3
Looking in links: /cvmfs/soft.computecanada.ca/custom/python/wheelhouse/nix/avx2, /cvmfs/soft.computecanada.ca/custom/python/wheelhouse/nix/generic, /cvmfs/soft.computecanada.ca/custom/python/wheelhouse/generic
ERROR: Could not find a version that satisfies the requirement numpy==1.20.0+computacanada (from versions: 1.15.0+computecanada, 1.15.2+computecanada, 1.15.4+computecanada, 1.16.0+computecanada, 1.16.2+computecanada, 1.16.3+computecanada, 1.17.4+computecanada, 1.18.1+computecanada, 1.18.4+computecanada, 1.19.1+computecanada, 1.19.2+computecanada, 1.20.2+computecanada)
ERROR: No matching distribution found for numpy==1.20.0+computacanada
Looking in links: /cvmfs/soft.computecanada.ca/custom/python/wheelhouse/nix/avx2, /cvmfs/soft.computecanada.ca/custom/python/wheelhouse/nix/generic, /cvmfs/soft.computecanada.ca/custom/python/wheelhouse/generic
Processing /cvmfs/soft.computecanada.ca/custom/python/wheelhouse/generic/wandb-0.12.5+computecanada-py2.py3-none-any.whl
Processing /cvmfs/soft.computecanada.ca/custom/python/wheelhouse/generic/sentry_sdk-1.5.0+computecanada-py2.py3-none-any.whl
Processing /cvmfs/soft.computecanada.ca/custom/python/wheelhouse/generic/yaspin-2.1.0+computecanada-py3-none-any.whl
Processing /cvmfs/soft.computecanada.ca/custom/python/wheelhouse/generic/shortuuid-1.0.1+computecanada-py3-none-any.whl
Processing /cvmfs/soft.computecanada.ca/custom/python/wheelhouse/generic/psutil-5.7.3+computecanada-cp37-cp37m-linux_x86_64.whl
Processing /cvmfs/soft.computecanada.ca/custom/python/wheelhouse/generic/docker_pycreds-0.4.0+computecanada-py2.py3-none-any.whl
Processing /cvmfs/soft.computecanada.ca/custom/python/wheelhouse/generic/protobuf-3.19.4+computecanada-py2.py3-none-any.whl
Processing /cvmfs/soft.computecanada.ca/custom/python/wheelhouse/generic/six-1.16.0+computecanada-py2.py3-none-any.whl
Processing /cvmfs/soft.computecanada.ca/custom/python/wheelhouse/generic/subprocess32-3.5.4+computecanada-py3-none-any.whl
Processing /cvmfs/soft.computecanada.ca/custom/python/wheelhouse/generic/PyYAML-5.3.1+computecanada-cp37-cp37m-linux_x86_64.whl
Processing /cvmfs/soft.computecanada.ca/custom/python/wheelhouse/generic/configparser-5.0.2+computecanada-py3-none-any.whl
Processing /cvmfs/soft.computecanada.ca/custom/python/wheelhouse/generic/click-8.0.3+computecanada-py3-none-any.whl
Requirement already satisfied: requests<3,>=2.0.0 in /cvmfs/soft.computecanada.ca/easybuild/software/2017/Core/scipy-stack/2019a/lib/python3.7/site-packages (from wandb) (2.21.0)
Processing /cvmfs/soft.computecanada.ca/custom/python/wheelhouse/generic/GitPython-3.1.24+computecanada-py3-none-any.whl
Processing /cvmfs/soft.computecanada.ca/custom/python/wheelhouse/generic/promise-2.3+computecanada-py3-none-any.whl
Processing /cvmfs/soft.computecanada.ca/custom/python/wheelhouse/generic/pathtools-0.1.2+computecanada-py3-none-any.whl
Requirement already satisfied: python-dateutil>=2.6.1 in /cvmfs/soft.computecanada.ca/easybuild/software/2017/Core/scipy-stack/2019a/lib/python3.7/site-packages (from wandb) (2.7.5)
Requirement already satisfied: importlib-metadata in /cvmfs/soft.computecanada.ca/easybuild/software/2017/Core/scipy-stack/2019a/lib/python3.7/site-packages (from Click!=8.0.0,>=7.0->wandb) (0.8)
Processing /cvmfs/soft.computecanada.ca/custom/python/wheelhouse/generic/typing_extensions-4.0.1+computecanada-py3-none-any.whl
Processing /cvmfs/soft.computecanada.ca/custom/python/wheelhouse/generic/gitdb-4.0.9+computecanada-py3-none-any.whl
Processing /cvmfs/soft.computecanada.ca/custom/python/wheelhouse/generic/smmap-5.0.0+computecanada-py3-none-any.whl
Requirement already satisfied: urllib3<1.25,>=1.21.1 in /cvmfs/soft.computecanada.ca/easybuild/software/2017/Core/scipy-stack/2019a/lib/python3.7/site-packages (from requests<3,>=2.0.0->wandb) (1.24.1)
Requirement already satisfied: idna<2.9,>=2.5 in /cvmfs/soft.computecanada.ca/easybuild/software/2017/Core/scipy-stack/2019a/lib/python3.7/site-packages (from requests<3,>=2.0.0->wandb) (2.8)
Requirement already satisfied: chardet<3.1.0,>=3.0.2 in /cvmfs/soft.computecanada.ca/easybuild/software/2017/Core/scipy-stack/2019a/lib/python3.7/site-packages (from requests<3,>=2.0.0->wandb) (3.0.4)
Requirement already satisfied: certifi>=2017.4.17 in /cvmfs/soft.computecanada.ca/easybuild/software/2017/Core/scipy-stack/2019a/lib/python3.7/site-packages (from requests<3,>=2.0.0->wandb) (2018.11.29)
Processing /cvmfs/soft.computecanada.ca/custom/python/wheelhouse/generic/termcolor-1.1.0+computecanada-py3-none-any.whl
Requirement already satisfied: zipp>=0.3.2 in /cvmfs/soft.computecanada.ca/easybuild/software/2017/Core/scipy-stack/2019a/lib/python3.7/site-packages (from importlib-metadata->Click!=8.0.0,>=7.0->wandb) (0.3.3)
Installing collected packages: smmap, typing-extensions, termcolor, six, gitdb, yaspin, subprocess32, shortuuid, sentry-sdk, PyYAML, psutil, protobuf, promise, pathtools, GitPython, docker-pycreds, configparser, Click, wandb
  Attempting uninstall: six
    Found existing installation: six 1.12.0
    Not uninstalling six at /cvmfs/soft.computecanada.ca/easybuild/software/2017/Core/scipy-stack/2019a/lib/python3.7/site-packages, outside environment /localscratch/yinan.28739327.0/env
    Can't uninstall 'six'. No files were found to uninstall.
Successfully installed Click-8.0.3+computecanada GitPython-3.1.24+computecanada PyYAML-5.3.1+computecanada configparser-5.0.2+computecanada docker-pycreds-0.4.0+computecanada gitdb-4.0.9+computecanada pathtools-0.1.2+computecanada promise-2.3+computecanada protobuf-3.19.4+computecanada psutil-5.7.3+computecanada sentry-sdk-1.5.0+computecanada shortuuid-1.0.1+computecanada six-1.16.0+computecanada smmap-5.0.0+computecanada subprocess32-3.5.4+computecanada termcolor-1.1.0+computecanada typing-extensions-4.0.1+computecanada wandb-0.12.5+computecanada yaspin-2.1.0+computecanada
Looking in links: /cvmfs/soft.computecanada.ca/custom/python/wheelhouse/nix/avx2, /cvmfs/soft.computecanada.ca/custom/python/wheelhouse/nix/generic, /cvmfs/soft.computecanada.ca/custom/python/wheelhouse/generic
ERROR: Could not find a version that satisfies the requirement sagemaker (from versions: none)
ERROR: No matching distribution found for sagemaker
Looking in links: /cvmfs/soft.computecanada.ca/custom/python/wheelhouse/nix/avx2, /cvmfs/soft.computecanada.ca/custom/python/wheelhouse/nix/generic, /cvmfs/soft.computecanada.ca/custom/python/wheelhouse/generic
Processing /cvmfs/soft.computecanada.ca/custom/python/wheelhouse/generic/torch-1.9.1+computecanada-cp37-cp37m-linux_x86_64.whl
Requirement already satisfied: typing-extensions in /localscratch/yinan.28739327.0/env/lib/python3.7/site-packages (from torch) (4.0.1+computecanada)
Installing collected packages: torch
Successfully installed torch-1.9.1+computecanada
Looking in links: /cvmfs/soft.computecanada.ca/custom/python/wheelhouse/nix/avx2, /cvmfs/soft.computecanada.ca/custom/python/wheelhouse/nix/generic, /cvmfs/soft.computecanada.ca/custom/python/wheelhouse/generic
Processing /cvmfs/soft.computecanada.ca/custom/python/wheelhouse/generic/transformers-2.5.1+computecanada-py3-none-any.whl
Processing /cvmfs/soft.computecanada.ca/custom/python/wheelhouse/generic/sentencepiece-0.1.91+computecanada-cp37-cp37m-linux_x86_64.whl
Processing /cvmfs/soft.computecanada.ca/custom/python/wheelhouse/generic/regex-2020.11.13+computecanada-cp37-cp37m-linux_x86_64.whl
Processing /cvmfs/soft.computecanada.ca/custom/python/wheelhouse/generic/tokenizers-0.5.2+computecanada-cp37-cp37m-linux_x86_64.whl
Requirement already satisfied: numpy in /cvmfs/soft.computecanada.ca/easybuild/software/2017/Core/scipy-stack/2019a/lib/python3.7/site-packages (from transformers==2.5.1+computecanada) (1.16.0)
Processing /cvmfs/soft.computecanada.ca/custom/python/wheelhouse/generic/sacremoses-0.0.46+computecanada-py3-none-any.whl
Processing /cvmfs/soft.computecanada.ca/custom/python/wheelhouse/generic/boto3-1.20.52+computecanada-py3-none-any.whl
Requirement already satisfied: requests in /cvmfs/soft.computecanada.ca/easybuild/software/2017/Core/scipy-stack/2019a/lib/python3.7/site-packages (from transformers==2.5.1+computecanada) (2.21.0)
Processing /cvmfs/soft.computecanada.ca/custom/python/wheelhouse/generic/filelock-3.4.2+computecanada-py3-none-any.whl
Processing /cvmfs/soft.computecanada.ca/custom/python/wheelhouse/generic/tqdm-4.63.0+computecanada-py2.py3-none-any.whl
Processing /cvmfs/soft.computecanada.ca/custom/python/wheelhouse/generic/s3transfer-0.5.1+computecanada-py3-none-any.whl
Processing /cvmfs/soft.computecanada.ca/custom/python/wheelhouse/generic/jmespath-0.10.0+computecanada-py2.py3-none-any.whl
Processing /cvmfs/soft.computecanada.ca/custom/python/wheelhouse/generic/botocore-1.23.52+computecanada-py3-none-any.whl
Requirement already satisfied: python-dateutil<3.0.0,>=2.1 in /cvmfs/soft.computecanada.ca/easybuild/software/2017/Core/scipy-stack/2019a/lib/python3.7/site-packages (from botocore<1.24.0,>=1.23.52->boto3->transformers==2.5.1+computecanada) (2.7.5)
Processing /cvmfs/soft.computecanada.ca/custom/python/wheelhouse/generic/urllib3-1.26.8+computecanada-py2.py3-none-any.whl
Requirement already satisfied: six>=1.5 in /localscratch/yinan.28739327.0/env/lib/python3.7/site-packages (from python-dateutil<3.0.0,>=2.1->botocore<1.24.0,>=1.23.52->boto3->transformers==2.5.1+computecanada) (1.16.0+computecanada)
Requirement already satisfied: idna<2.9,>=2.5 in /cvmfs/soft.computecanada.ca/easybuild/software/2017/Core/scipy-stack/2019a/lib/python3.7/site-packages (from requests->transformers==2.5.1+computecanada) (2.8)
Processing /cvmfs/soft.computecanada.ca/custom/python/wheelhouse/generic/requests-2.27.1+computecanada-py2.py3-none-any.whl
Processing /cvmfs/soft.computecanada.ca/custom/python/wheelhouse/generic/charset_normalizer-2.0.11+computecanada-py3-none-any.whl
Requirement already satisfied: certifi>=2017.4.17 in /cvmfs/soft.computecanada.ca/easybuild/software/2017/Core/scipy-stack/2019a/lib/python3.7/site-packages (from requests->transformers==2.5.1+computecanada) (2018.11.29)
Processing /cvmfs/soft.computecanada.ca/custom/python/wheelhouse/generic/joblib-1.1.0+computecanada-py2.py3-none-any.whl
Requirement already satisfied: click in /localscratch/yinan.28739327.0/env/lib/python3.7/site-packages (from sacremoses->transformers==2.5.1+computecanada) (8.0.3+computecanada)
Requirement already satisfied: importlib-metadata in /cvmfs/soft.computecanada.ca/easybuild/software/2017/Core/scipy-stack/2019a/lib/python3.7/site-packages (from click->sacremoses->transformers==2.5.1+computecanada) (0.8)
Requirement already satisfied: zipp>=0.3.2 in /cvmfs/soft.computecanada.ca/easybuild/software/2017/Core/scipy-stack/2019a/lib/python3.7/site-packages (from importlib-metadata->click->sacremoses->transformers==2.5.1+computecanada) (0.3.3)
Installing collected packages: urllib3, jmespath, botocore, tqdm, s3transfer, regex, joblib, charset-normalizer, tokenizers, sentencepiece, sacremoses, requests, filelock, boto3, transformers
  Attempting uninstall: urllib3
    Found existing installation: urllib3 1.24.1
    Not uninstalling urllib3 at /cvmfs/soft.computecanada.ca/easybuild/software/2017/Core/scipy-stack/2019a/lib/python3.7/site-packages, outside environment /localscratch/yinan.28739327.0/env
    Can't uninstall 'urllib3'. No files were found to uninstall.
  Attempting uninstall: requests
    Found existing installation: requests 2.21.0
    Not uninstalling requests at /cvmfs/soft.computecanada.ca/easybuild/software/2017/Core/scipy-stack/2019a/lib/python3.7/site-packages, outside environment /localscratch/yinan.28739327.0/env
    Can't uninstall 'requests'. No files were found to uninstall.
Successfully installed boto3-1.20.52+computecanada botocore-1.23.52+computecanada charset-normalizer-2.0.11+computecanada filelock-3.4.2+computecanada jmespath-0.10.0+computecanada joblib-1.1.0+computecanada regex-2020.11.13+computecanada requests-2.27.1+computecanada s3transfer-0.5.1+computecanada sacremoses-0.0.46+computecanada sentencepiece-0.1.91+computecanada tokenizers-0.5.2+computecanada tqdm-4.63.0+computecanada transformers-2.5.1+computecanada urllib3-1.26.8+computecanada
Looking in links: /cvmfs/soft.computecanada.ca/custom/python/wheelhouse/nix/avx2, /cvmfs/soft.computecanada.ca/custom/python/wheelhouse/nix/generic, /cvmfs/soft.computecanada.ca/custom/python/wheelhouse/generic
Processing /cvmfs/soft.computecanada.ca/custom/python/wheelhouse/generic/tensorflow_gpu-2.3.0+computecanada-cp37-cp37m-linux_x86_64.whl
Processing /cvmfs/soft.computecanada.ca/custom/python/wheelhouse/generic/google_pasta-0.2.0+computecanada-py3-none-any.whl
Processing /cvmfs/soft.computecanada.ca/custom/python/wheelhouse/generic/wrapt-1.11.2+computecanada-cp37-cp37m-linux_x86_64.whl
Requirement already satisfied: termcolor>=1.1.0 in /localscratch/yinan.28739327.0/env/lib/python3.7/site-packages (from tensorflow_gpu==2.3.0+computecanada) (1.1.0+computecanada)
Processing /cvmfs/soft.computecanada.ca/custom/python/wheelhouse/generic/tensorflow_estimator-2.3.0+computecanada-py2.py3-none-any.whl
Requirement already satisfied: numpy<1.19.0,>=1.16.0 in /cvmfs/soft.computecanada.ca/easybuild/software/2017/Core/scipy-stack/2019a/lib/python3.7/site-packages (from tensorflow_gpu==2.3.0+computecanada) (1.16.0)
Processing /cvmfs/soft.computecanada.ca/custom/python/wheelhouse/generic/opt_einsum-3.3.0+computecanada-py3-none-any.whl
Requirement already satisfied: wheel>=0.26 in /localscratch/yinan.28739327.0/env/lib/python3.7/site-packages (from tensorflow_gpu==2.3.0+computecanada) (0.33.4)
Requirement already satisfied: protobuf>=3.9.2 in /localscratch/yinan.28739327.0/env/lib/python3.7/site-packages (from tensorflow_gpu==2.3.0+computecanada) (3.19.4+computecanada)
Requirement already satisfied: six>=1.12.0 in /localscratch/yinan.28739327.0/env/lib/python3.7/site-packages (from tensorflow_gpu==2.3.0+computecanada) (1.16.0+computecanada)
Processing /cvmfs/soft.computecanada.ca/custom/python/wheelhouse/generic/grpcio-1.38.0+computecanada-cp37-cp37m-linux_x86_64.whl
Processing /cvmfs/soft.computecanada.ca/custom/python/wheelhouse/generic/gast-0.3.3+computecanada-py3-none-any.whl
Processing /cvmfs/soft.computecanada.ca/custom/python/wheelhouse/generic/tensorboard-2.8.0+computecanada-py3-none-any.whl
Processing /cvmfs/soft.computecanada.ca/custom/python/wheelhouse/nix/generic/scipy-1.4.1+computecanada-cp37-cp37m-linux_x86_64.whl
Processing /cvmfs/soft.computecanada.ca/custom/python/wheelhouse/nix/avx2/h5py-2.10.0+computecanada-cp37-cp37m-linux_x86_64.whl
Processing /cvmfs/soft.computecanada.ca/custom/python/wheelhouse/generic/absl_py-1.0.0+computecanada-py3-none-any.whl
Processing /cvmfs/soft.computecanada.ca/custom/python/wheelhouse/generic/astunparse-1.6.3+computecanada-py2.py3-none-any.whl
Processing /cvmfs/soft.computecanada.ca/custom/python/wheelhouse/generic/Keras_Preprocessing-1.1.2+computecanada-py3-none-any.whl
Requirement already satisfied: setuptools>=41.0.0 in /localscratch/yinan.28739327.0/env/lib/python3.7/site-packages (from tensorboard<3,>=2.3.0->tensorflow_gpu==2.3.0+computecanada) (41.0.1)
Processing /cvmfs/soft.computecanada.ca/custom/python/wheelhouse/generic/google_auth-2.3.3+computecanada-py2.py3-none-any.whl
Processing /cvmfs/soft.computecanada.ca/custom/python/wheelhouse/generic/google_auth_oauthlib-0.4.6+computecanada-py2.py3-none-any.whl
Processing /cvmfs/soft.computecanada.ca/custom/python/wheelhouse/generic/tensorboard_plugin_wit-1.8.0+computecanada-py3-none-any.whl
Processing /cvmfs/soft.computecanada.ca/custom/python/wheelhouse/generic/tensorboard_data_server-0.6.1+computecanada-py3-none-linux_x86_64.whl
Processing /cvmfs/soft.computecanada.ca/custom/python/wheelhouse/generic/Markdown-3.3.6+computecanada-py3-none-any.whl
Processing /cvmfs/soft.computecanada.ca/custom/python/wheelhouse/generic/Werkzeug-2.0.3+computecanada-py3-none-any.whl
Requirement already satisfied: requests<3,>=2.21.0 in /localscratch/yinan.28739327.0/env/lib/python3.7/site-packages (from tensorboard<3,>=2.3.0->tensorflow_gpu==2.3.0+computecanada) (2.27.1+computecanada)
Processing /cvmfs/soft.computecanada.ca/custom/python/wheelhouse/generic/pyasn1_modules-0.2.8+computecanada-py2.py3-none-any.whl
Processing /cvmfs/soft.computecanada.ca/custom/python/wheelhouse/generic/rsa-4.8+computecanada-py3-none-any.whl
Processing /cvmfs/soft.computecanada.ca/custom/python/wheelhouse/generic/cachetools-4.2.4+computecanada-py3-none-any.whl
Processing /cvmfs/soft.computecanada.ca/custom/python/wheelhouse/generic/requests_oauthlib-1.3.0+computecanada-py2.py3-none-any.whl
Processing /cvmfs/soft.computecanada.ca/custom/python/wheelhouse/generic/importlib_metadata-4.10.1+computecanada-py3-none-any.whl
Requirement already satisfied: typing-extensions>=3.6.4 in /localscratch/yinan.28739327.0/env/lib/python3.7/site-packages (from importlib-metadata>=4.4->markdown>=2.6.8->tensorboard<3,>=2.3.0->tensorflow_gpu==2.3.0+computecanada) (4.0.1+computecanada)
Processing /cvmfs/soft.computecanada.ca/custom/python/wheelhouse/generic/zipp-3.7.0+computecanada-py3-none-any.whl
Processing /cvmfs/soft.computecanada.ca/custom/python/wheelhouse/generic/pyasn1-0.4.8+computecanada-py2.py3-none-any.whl
Requirement already satisfied: charset-normalizer~=2.0.0 in /localscratch/yinan.28739327.0/env/lib/python3.7/site-packages (from requests<3,>=2.21.0->tensorboard<3,>=2.3.0->tensorflow_gpu==2.3.0+computecanada) (2.0.11+computecanada)
Requirement already satisfied: urllib3<1.27,>=1.21.1 in /localscratch/yinan.28739327.0/env/lib/python3.7/site-packages (from requests<3,>=2.21.0->tensorboard<3,>=2.3.0->tensorflow_gpu==2.3.0+computecanada) (1.26.8+computecanada)
Requirement already satisfied: certifi>=2017.4.17 in /cvmfs/soft.computecanada.ca/easybuild/software/2017/Core/scipy-stack/2019a/lib/python3.7/site-packages (from requests<3,>=2.21.0->tensorboard<3,>=2.3.0->tensorflow_gpu==2.3.0+computecanada) (2018.11.29)
Requirement already satisfied: idna<4,>=2.5 in /cvmfs/soft.computecanada.ca/easybuild/software/2017/Core/scipy-stack/2019a/lib/python3.7/site-packages (from requests<3,>=2.21.0->tensorboard<3,>=2.3.0->tensorflow_gpu==2.3.0+computecanada) (2.8)
Processing /cvmfs/soft.computecanada.ca/custom/python/wheelhouse/generic/oauthlib-3.1.1+computecanada-py2.py3-none-any.whl
Installing collected packages: pyasn1, zipp, rsa, pyasn1-modules, oauthlib, cachetools, requests-oauthlib, importlib-metadata, google-auth, werkzeug, tensorboard-plugin-wit, tensorboard-data-server, markdown, grpcio, google-auth-oauthlib, absl-py, wrapt, tensorflow-estimator, tensorboard, scipy, opt-einsum, keras-preprocessing, h5py, google-pasta, gast, astunparse, tensorflow-gpu
  Attempting uninstall: pyasn1
    Found existing installation: pyasn1 0.4.3
    Not uninstalling pyasn1 at /cvmfs/soft.computecanada.ca/easybuild/software/2017/Core/scipy-stack/2019a/lib/python3.7/site-packages, outside environment /localscratch/yinan.28739327.0/env
    Can't uninstall 'pyasn1'. No files were found to uninstall.
  Attempting uninstall: zipp
    Found existing installation: zipp 0.3.3
    Not uninstalling zipp at /cvmfs/soft.computecanada.ca/easybuild/software/2017/Core/scipy-stack/2019a/lib/python3.7/site-packages, outside environment /localscratch/yinan.28739327.0/env
    Can't uninstall 'zipp'. No files were found to uninstall.
  Attempting uninstall: importlib-metadata
    Found existing installation: importlib-metadata 0.8
    Not uninstalling importlib-metadata at /cvmfs/soft.computecanada.ca/easybuild/software/2017/Core/scipy-stack/2019a/lib/python3.7/site-packages, outside environment /localscratch/yinan.28739327.0/env
    Can't uninstall 'importlib-metadata'. No files were found to uninstall.
  Attempting uninstall: scipy
    Found existing installation: scipy 1.2.0
    Not uninstalling scipy at /cvmfs/soft.computecanada.ca/easybuild/software/2017/Core/scipy-stack/2019a/lib/python3.7/site-packages, outside environment /localscratch/yinan.28739327.0/env
    Can't uninstall 'scipy'. No files were found to uninstall.
Successfully installed absl-py-1.0.0+computecanada astunparse-1.6.3+computecanada cachetools-4.2.4+computecanada gast-0.3.3+computecanada google-auth-2.3.3+computecanada google-auth-oauthlib-0.4.6+computecanada google-pasta-0.2.0+computecanada grpcio-1.38.0+computecanada h5py-2.10.0+computecanada importlib-metadata-4.10.1+computecanada keras-preprocessing-1.1.2+computecanada markdown-3.3.6+computecanada oauthlib-3.1.1+computecanada opt-einsum-3.3.0+computecanada pyasn1-0.4.8+computecanada pyasn1-modules-0.2.8+computecanada requests-oauthlib-1.3.0+computecanada rsa-4.8+computecanada scipy-1.4.1+computecanada tensorboard-2.8.0+computecanada tensorboard-data-server-0.6.1+computecanada tensorboard-plugin-wit-1.8.0+computecanada tensorflow-estimator-2.3.0+computecanada tensorflow-gpu-2.3.0+computecanada werkzeug-2.0.3+computecanada wrapt-1.11.2+computecanada zipp-3.7.0+computecanada
Looking in links: /cvmfs/soft.computecanada.ca/custom/python/wheelhouse/nix/avx2, /cvmfs/soft.computecanada.ca/custom/python/wheelhouse/nix/generic, /cvmfs/soft.computecanada.ca/custom/python/wheelhouse/generic
Processing /cvmfs/soft.computecanada.ca/custom/python/wheelhouse/generic/keras-2.8.0+computecanada-py2.py3-none-any.whl
Installing collected packages: Keras
Successfully installed Keras-2.8.0+computecanada
Looking in links: /cvmfs/soft.computecanada.ca/custom/python/wheelhouse/nix/avx2, /cvmfs/soft.computecanada.ca/custom/python/wheelhouse/nix/generic, /cvmfs/soft.computecanada.ca/custom/python/wheelhouse/generic
Processing /cvmfs/soft.computecanada.ca/custom/python/wheelhouse/generic/urllib3-1.26.7+computecanada-py2.py3-none-any.whl
Installing collected packages: urllib3
  Attempting uninstall: urllib3
    Found existing installation: urllib3 1.26.8+computecanada
    Uninstalling urllib3-1.26.8+computecanada:
      Successfully uninstalled urllib3-1.26.8+computecanada
Successfully installed urllib3-1.26.7+computecanada
Looking in links: /cvmfs/soft.computecanada.ca/custom/python/wheelhouse/nix/avx2, /cvmfs/soft.computecanada.ca/custom/python/wheelhouse/nix/generic, /cvmfs/soft.computecanada.ca/custom/python/wheelhouse/generic
Processing /cvmfs/soft.computecanada.ca/custom/python/wheelhouse/generic/nltk-3.7+computecanada-py3-none-any.whl
Requirement already satisfied: click in /localscratch/yinan.28739327.0/env/lib/python3.7/site-packages (from nltk) (8.0.3+computecanada)
Processing /cvmfs/soft.computecanada.ca/custom/python/wheelhouse/generic/nltk-3.6.5+computecanada-py3-none-any.whl
Processing /cvmfs/soft.computecanada.ca/custom/python/wheelhouse/generic/nltk-3.6.3+computecanada-py3-none-any.whl
Requirement already satisfied: regex in /localscratch/yinan.28739327.0/env/lib/python3.7/site-packages (from nltk) (2020.11.13+computecanada)
Requirement already satisfied: joblib in /localscratch/yinan.28739327.0/env/lib/python3.7/site-packages (from nltk) (1.1.0+computecanada)
Requirement already satisfied: tqdm in /localscratch/yinan.28739327.0/env/lib/python3.7/site-packages (from nltk) (4.63.0+computecanada)
Requirement already satisfied: importlib-metadata in /localscratch/yinan.28739327.0/env/lib/python3.7/site-packages (from click->nltk) (4.10.1+computecanada)
Requirement already satisfied: zipp>=0.5 in /localscratch/yinan.28739327.0/env/lib/python3.7/site-packages (from importlib-metadata->click->nltk) (3.7.0+computecanada)
Requirement already satisfied: typing-extensions>=3.6.4 in /localscratch/yinan.28739327.0/env/lib/python3.7/site-packages (from importlib-metadata->click->nltk) (4.0.1+computecanada)
Installing collected packages: nltk
Successfully installed nltk-3.6.3+computecanada
Looking in links: /cvmfs/soft.computecanada.ca/custom/python/wheelhouse/nix/avx2, /cvmfs/soft.computecanada.ca/custom/python/wheelhouse/nix/generic, /cvmfs/soft.computecanada.ca/custom/python/wheelhouse/generic
Processing /cvmfs/soft.computecanada.ca/custom/python/wheelhouse/generic/scikit_learn-0.22.1+computecanada-cp37-cp37m-linux_x86_64.whl
Requirement already satisfied: joblib>=0.11 in /localscratch/yinan.28739327.0/env/lib/python3.7/site-packages (from scikit-learn==0.22.1) (1.1.0+computecanada)
Requirement already satisfied: numpy>=1.11.0 in /cvmfs/soft.computecanada.ca/easybuild/software/2017/Core/scipy-stack/2019a/lib/python3.7/site-packages (from scikit-learn==0.22.1) (1.16.0)
Requirement already satisfied: scipy>=0.17.0 in /localscratch/yinan.28739327.0/env/lib/python3.7/site-packages (from scikit-learn==0.22.1) (1.4.1+computecanada)
Installing collected packages: scikit-learn
Successfully installed scikit-learn-0.22.1+computecanada
Looking in links: /cvmfs/soft.computecanada.ca/custom/python/wheelhouse/nix/avx2, /cvmfs/soft.computecanada.ca/custom/python/wheelhouse/nix/generic, /cvmfs/soft.computecanada.ca/custom/python/wheelhouse/generic
Requirement already satisfied: tokenizers==0.5.2 in /localscratch/yinan.28739327.0/env/lib/python3.7/site-packages (0.5.2+computecanada)
wandb: Appending key for api.wandb.ai to your netrc file: /home/yinan/.netrc
Starting Task
2022-03-11 10:33:51.333547: I tensorflow/stream_executor/platform/default/dso_loader.cc:48] Successfully opened dynamic library libcudart.so.10.1
[nltk_data] Downloading package stopwords to /home/yinan/nltk_data...
[nltk_data]   Package stopwords is already up-to-date!
[nltk_data] Downloading package wordnet to /home/yinan/nltk_data...
[nltk_data]   Package wordnet is already up-to-date!
wandb: Currently logged in as: yinanazhou (use `wandb login --relogin` to force relogin)
wandb: wandb version 0.12.11 is available!  To upgrade, please run:
wandb:  $ pip install wandb --upgrade
2022-03-11 10:34:04.483863: I tensorflow/stream_executor/platform/default/dso_loader.cc:48] Successfully opened dynamic library libcudart.so.10.1
wandb: Tracking run with wandb version 0.12.5
wandb: Syncing run young-lion-1
wandb: ⭐️ View project at https://wandb.ai/yinanazhou/xl_512_bs_8_lr_1e07_es_5_lc_False_nr_False_sr_True_stem_False_lemma_True_repeat_1_fold_1
wandb: 🚀 View run at https://wandb.ai/yinanazhou/xl_512_bs_8_lr_1e07_es_5_lc_False_nr_False_sr_True_stem_False_lemma_True_repeat_1_fold_1/runs/1rhx2xgj
wandb: Run data is saved locally in /project/6002780/yinan/Thesis_MER_Lyrics/lyric-emotion/wandb/run-20220311_103402-1rhx2xgj
wandb: Run `wandb offline` to turn off syncing.

Validation loss decreased (inf --> 1.450006).  Saving model ...
Validation loss decreased (1.450006 --> 1.447274).  Saving model ...
Validation loss decreased (1.447274 --> 1.444439).  Saving model ...
Validation loss decreased (1.444439 --> 1.441727).  Saving model ...
Validation loss decreased (1.441727 --> 1.439149).  Saving model ...
Validation loss decreased (1.439149 --> 1.436497).  Saving model ...
Validation loss decreased (1.436497 --> 1.434017).  Saving model ...
Validation loss decreased (1.434017 --> 1.431699).  Saving model ...
Validation loss decreased (1.431699 --> 1.429553).  Saving model ...
Validation loss decreased (1.429553 --> 1.427264).  Saving model ...
Validation loss decreased (1.427264 --> 1.424949).  Saving model ...
Validation loss decreased (1.424949 --> 1.422919).  Saving model ...
Validation loss decreased (1.422919 --> 1.420805).  Saving model ...
Validation loss decreased (1.420805 --> 1.418751).  Saving model ...
Validation loss decreased (1.418751 --> 1.416825).  Saving model ...
Validation loss decreased (1.416825 --> 1.414858).  Saving model ...
Validation loss decreased (1.414858 --> 1.412981).  Saving model ...
Validation loss decreased (1.412981 --> 1.411046).  Saving model ...
Validation loss decreased (1.411046 --> 1.409202).  Saving model ...
Validation loss decreased (1.409202 --> 1.407443).  Saving model ...
Validation loss decreased (1.407443 --> 1.405571).  Saving model ...
Validation loss decreased (1.405571 --> 1.403865).  Saving model ...
Validation loss decreased (1.403865 --> 1.402277).  Saving model ...
Validation loss decreased (1.402277 --> 1.400769).  Saving model ...
Validation loss decreased (1.400769 --> 1.399210).  Saving model ...
Validation loss decreased (1.399210 --> 1.397636).  Saving model ...
Validation loss decreased (1.397636 --> 1.396174).  Saving model ...
Validation loss decreased (1.396174 --> 1.394693).  Saving model ...
Validation loss decreased (1.394693 --> 1.393366).  Saving model ...
Validation loss decreased (1.393366 --> 1.392033).  Saving model ...
Validation loss decreased (1.392033 --> 1.390706).  Saving model ...
Validation loss decreased (1.390706 --> 1.389349).  Saving model ...
Validation loss decreased (1.389349 --> 1.388111).  Saving model ...
Validation loss decreased (1.388111 --> 1.386837).  Saving model ...
Validation loss decreased (1.386837 --> 1.385637).  Saving model ...
Validation loss decreased (1.385637 --> 1.384421).  Saving model ...
Validation loss decreased (1.384421 --> 1.383182).  Saving model ...
Validation loss decreased (1.383182 --> 1.382088).  Saving model ...
Validation loss decreased (1.382088 --> 1.380930).  Saving model ...
Validation loss decreased (1.380930 --> 1.379760).  Saving model ...
Validation loss decreased (1.379760 --> 1.378688).  Saving model ...
Validation loss decreased (1.378688 --> 1.377622).  Saving model ...
Validation loss decreased (1.377622 --> 1.376585).  Saving model ...
Validation loss decreased (1.376585 --> 1.375581).  Saving model ...
Validation loss decreased (1.375581 --> 1.374406).  Saving model ...
Validation loss decreased (1.374406 --> 1.373481).  Saving model ...
Validation loss decreased (1.373481 --> 1.372508).  Saving model ...
Validation loss decreased (1.372508 --> 1.371526).  Saving model ...
Validation loss decreased (1.371526 --> 1.370569).  Saving model ...
Validation loss decreased (1.370569 --> 1.369625).  Saving model ...
Validation loss decreased (1.369625 --> 1.368806).  Saving model ...
Validation loss decreased (1.368806 --> 1.367959).  Saving model ...
Validation loss decreased (1.367959 --> 1.367017).  Saving model ...
Validation loss decreased (1.367017 --> 1.366043).  Saving model ...
Validation loss decreased (1.366043 --> 1.365207).  Saving model ...
Validation loss decreased (1.365207 --> 1.364378).  Saving model ...
Validation loss decreased (1.364378 --> 1.363486).  Saving model ...
Validation loss decreased (1.363486 --> 1.362615).  Saving model ...
Validation loss decreased (1.362615 --> 1.361736).  Saving model ...
Validation loss decreased (1.361736 --> 1.361009).  Saving model ...
Validation loss decreased (1.361009 --> 1.360194).  Saving model ...
Validation loss decreased (1.360194 --> 1.359427).  Saving model ...
Validation loss decreased (1.359427 --> 1.358634).  Saving model ...
Validation loss decreased (1.358634 --> 1.357886).  Saving model ...
Validation loss decreased (1.357886 --> 1.357132).  Saving model ...
Validation loss decreased (1.357132 --> 1.356340).  Saving model ...
Validation loss decreased (1.356340 --> 1.355672).  Saving model ...
Validation loss decreased (1.355672 --> 1.354958).  Saving model ...
Validation loss decreased (1.354958 --> 1.354285).  Saving model ...
Validation loss decreased (1.354285 --> 1.353629).  Saving model ...
Validation loss decreased (1.353629 --> 1.353006).  Saving model ...
Validation loss decreased (1.353006 --> 1.352275).  Saving model ...
Validation loss decreased (1.352275 --> 1.351511).  Saving model ...
Validation loss decreased (1.351511 --> 1.350828).  Saving model ...
Validation loss decreased (1.350828 --> 1.350179).  Saving model ...
Validation loss decreased (1.350179 --> 1.349534).  Saving model ...
Validation loss decreased (1.349534 --> 1.348886).  Saving model ...
Validation loss decreased (1.348886 --> 1.348272).  Saving model ...
Validation loss decreased (1.348272 --> 1.347639).  Saving model ...
Validation loss decreased (1.347639 --> 1.346984).  Saving model ...
Validation loss decreased (1.346984 --> 1.346403).  Saving model ...
Validation loss decreased (1.346403 --> 1.345736).  Saving model ...
Validation loss decreased (1.345736 --> 1.345056).  Saving model ...
Validation loss decreased (1.345056 --> 1.344526).  Saving model ...
Validation loss decreased (1.344526 --> 1.343962).  Saving model ...
Validation loss decreased (1.343962 --> 1.343252).  Saving model ...
Validation loss decreased (1.343252 --> 1.342579).  Saving model ...
Validation loss decreased (1.342579 --> 1.341918).  Saving model ...
Validation loss decreased (1.341918 --> 1.341281).  Saving model ...
Validation loss decreased (1.341281 --> 1.340727).  Saving model ...
Validation loss decreased (1.340727 --> 1.340126).  Saving model ...
Validation loss decreased (1.340126 --> 1.339527).  Saving model ...
Validation loss decreased (1.339527 --> 1.338880).  Saving model ...
Validation loss decreased (1.338880 --> 1.338275).  Saving model ...
Validation loss decreased (1.338275 --> 1.337623).  Saving model ...
Validation loss decreased (1.337623 --> 1.337075).  Saving model ...
Validation loss decreased (1.337075 --> 1.336458).  Saving model ...
Validation loss decreased (1.336458 --> 1.335885).  Saving model ...
Validation loss decreased (1.335885 --> 1.335298).  Saving model ...
Validation loss decreased (1.335298 --> 1.334762).  Saving model ...
Validation loss decreased (1.334762 --> 1.334194).  Saving model ...
Validation loss decreased (1.334194 --> 1.333598).  Saving model ...
Validation loss decreased (1.333598 --> 1.332998).  Saving model ...
Validation loss decreased (1.332998 --> 1.332461).  Saving model ...
Validation loss decreased (1.332461 --> 1.331862).  Saving model ...
Validation loss decreased (1.331862 --> 1.331286).  Saving model ...
Validation loss decreased (1.331286 --> 1.330734).  Saving model ...
Validation loss decreased (1.330734 --> 1.330178).  Saving model ...
Validation loss decreased (1.330178 --> 1.329583).  Saving model ...
Validation loss decreased (1.329583 --> 1.328960).  Saving model ...
Validation loss decreased (1.328960 --> 1.328387).  Saving model ...
Validation loss decreased (1.328387 --> 1.327888).  Saving model ...
Validation loss decreased (1.327888 --> 1.327341).  Saving model ...
Validation loss decreased (1.327341 --> 1.326786).  Saving model ...
Validation loss decreased (1.326786 --> 1.326252).  Saving model ...
Validation loss decreased (1.326252 --> 1.325677).  Saving model ...
Validation loss decreased (1.325677 --> 1.325123).  Saving model ...
Validation loss decreased (1.325123 --> 1.324588).  Saving model ...
Validation loss decreased (1.324588 --> 1.323948).  Saving model ...
Validation loss decreased (1.323948 --> 1.323358).  Saving model ...
Validation loss decreased (1.323358 --> 1.322865).  Saving model ...
Validation loss decreased (1.322865 --> 1.322285).  Saving model ...
Validation loss decreased (1.322285 --> 1.321713).  Saving model ...
Validation loss decreased (1.321713 --> 1.321030).  Saving model ...
Validation loss decreased (1.321030 --> 1.320488).  Saving model ...
Validation loss decreased (1.320488 --> 1.319882).  Saving model ...
Validation loss decreased (1.319882 --> 1.319350).  Saving model ...
Validation loss decreased (1.319350 --> 1.318669).  Saving model ...
Validation loss decreased (1.318669 --> 1.318049).  Saving model ...
Validation loss decreased (1.318049 --> 1.317429).  Saving model ...
Validation loss decreased (1.317429 --> 1.316836).  Saving model ...
Validation loss decreased (1.316836 --> 1.316241).  Saving model ...
Validation loss decreased (1.316241 --> 1.315634).  Saving model ...
Validation loss decreased (1.315634 --> 1.315074).  Saving model ...
Validation loss decreased (1.315074 --> 1.314415).  Saving model ...
Validation loss decreased (1.314415 --> 1.313793).  Saving model ...
Validation loss decreased (1.313793 --> 1.313240).  Saving model ...
Validation loss decreased (1.313240 --> 1.312647).  Saving model ...
Validation loss decreased (1.312647 --> 1.312086).  Saving model ...
Validation loss decreased (1.312086 --> 1.311442).  Saving model ...
Validation loss decreased (1.311442 --> 1.310832).  Saving model ...
Validation loss decreased (1.310832 --> 1.310244).  Saving model ...
Validation loss decreased (1.310244 --> 1.309649).  Saving model ...
Validation loss decreased (1.309649 --> 1.309070).  Saving model ...
Validation loss decreased (1.309070 --> 1.308458).  Saving model ...
Validation loss decreased (1.308458 --> 1.307926).  Saving model ...
Validation loss decreased (1.307926 --> 1.307278).  Saving model ...
Validation loss decreased (1.307278 --> 1.306608).  Saving model ...
Validation loss decreased (1.306608 --> 1.305984).  Saving model ...
Validation loss decreased (1.305984 --> 1.305298).  Saving model ...
Validation loss decreased (1.305298 --> 1.304727).  Saving model ...
Validation loss decreased (1.304727 --> 1.304126).  Saving model ...
Validation loss decreased (1.304126 --> 1.303543).  Saving model ...
Validation loss decreased (1.303543 --> 1.302884).  Saving model ...
Validation loss decreased (1.302884 --> 1.302278).  Saving model ...
Validation loss decreased (1.302278 --> 1.301577).  Saving model ...
Validation loss decreased (1.301577 --> 1.300934).  Saving model ...
Validation loss decreased (1.300934 --> 1.300314).  Saving model ...
Validation loss decreased (1.300314 --> 1.299681).  Saving model ...
Validation loss decreased (1.299681 --> 1.299069).  Saving model ...
Validation loss decreased (1.299069 --> 1.298464).  Saving model ...
Validation loss decreased (1.298464 --> 1.297867).  Saving model ...
Validation loss decreased (1.297867 --> 1.297264).  Saving model ...
Validation loss decreased (1.297264 --> 1.296560).  Saving model ...
Validation loss decreased (1.296560 --> 1.295929).  Saving model ...
Validation loss decreased (1.295929 --> 1.295249).  Saving model ...
Validation loss decreased (1.295249 --> 1.294616).  Saving model ...
Validation loss decreased (1.294616 --> 1.293900).  Saving model ...
Validation loss decreased (1.293900 --> 1.293279).  Saving model ...
Validation loss decreased (1.293279 --> 1.292599).  Saving model ...
Validation loss decreased (1.292599 --> 1.291822).  Saving model ...
Validation loss decreased (1.291822 --> 1.291190).  Saving model ...
Validation loss decreased (1.291190 --> 1.290537).  Saving model ...
Validation loss decreased (1.290537 --> 1.289829).  Saving model ...
Validation loss decreased (1.289829 --> 1.289186).  Saving model ...
Validation loss decreased (1.289186 --> 1.288552).  Saving model ...
Validation loss decreased (1.288552 --> 1.287837).  Saving model ...
Validation loss decreased (1.287837 --> 1.287102).  Saving model ...
Validation loss decreased (1.287102 --> 1.286414).  Saving model ...
Validation loss decreased (1.286414 --> 1.285686).  Saving model ...
Validation loss decreased (1.285686 --> 1.284904).  Saving model ...
Validation loss decreased (1.284904 --> 1.284134).  Saving model ...
Validation loss decreased (1.284134 --> 1.283316).  Saving model ...
Validation loss decreased (1.283316 --> 1.282599).  Saving model ...
Validation loss decreased (1.282599 --> 1.281885).  Saving model ...
Validation loss decreased (1.281885 --> 1.281194).  Saving model ...
Validation loss decreased (1.281194 --> 1.280592).  Saving model ...
Validation loss decreased (1.280592 --> 1.279970).  Saving model ...
Validation loss decreased (1.279970 --> 1.279359).  Saving model ...
Validation loss decreased (1.279359 --> 1.278612).  Saving model ...
Validation loss decreased (1.278612 --> 1.277938).  Saving model ...
Validation loss decreased (1.277938 --> 1.277240).  Saving model ...
Validation loss decreased (1.277240 --> 1.276588).  Saving model ...
Validation loss decreased (1.276588 --> 1.275823).  Saving model ...
Validation loss decreased (1.275823 --> 1.275088).  Saving model ...
Validation loss decreased (1.275088 --> 1.274472).  Saving model ...
Validation loss decreased (1.274472 --> 1.273858).  Saving model ...
Validation loss decreased (1.273858 --> 1.273128).  Saving model ...
Validation loss decreased (1.273128 --> 1.272185).  Saving model ...
Validation loss decreased (1.272185 --> 1.271359).  Saving model ...
Validation loss decreased (1.271359 --> 1.270739).  Saving model ...
Validation loss decreased (1.270739 --> 1.270252).  Saving model ...
Validation loss decreased (1.270252 --> 1.269529).  Saving model ...
Validation loss decreased (1.269529 --> 1.268854).  Saving model ...
Validation loss decreased (1.268854 --> 1.268284).  Saving model ...
Validation loss decreased (1.268284 --> 1.267649).  Saving model ...
Validation loss decreased (1.267649 --> 1.267053).  Saving model ...
Validation loss decreased (1.267053 --> 1.266505).  Saving model ...
Validation loss decreased (1.266505 --> 1.265941).  Saving model ...
Validation loss decreased (1.265941 --> 1.265145).  Saving model ...
Validation loss decreased (1.265145 --> 1.264433).  Saving model ...
Validation loss decreased (1.264433 --> 1.263532).  Saving model ...
Validation loss decreased (1.263532 --> 1.262963).  Saving model ...
Validation loss decreased (1.262963 --> 1.262493).  Saving model ...
Validation loss decreased (1.262493 --> 1.261785).  Saving model ...
Validation loss decreased (1.261785 --> 1.261138).  Saving model ...
Validation loss decreased (1.261138 --> 1.260441).  Saving model ...
Validation loss decreased (1.260441 --> 1.259606).  Saving model ...
Validation loss decreased (1.259606 --> 1.258934).  Saving model ...
Validation loss decreased (1.258934 --> 1.258171).  Saving model ...
Validation loss decreased (1.258171 --> 1.257374).  Saving model ...
Validation loss decreased (1.257374 --> 1.256574).  Saving model ...
Validation loss decreased (1.256574 --> 1.255874).  Saving model ...
Validation loss decreased (1.255874 --> 1.255203).  Saving model ...
Validation loss decreased (1.255203 --> 1.254324).  Saving model ...
Validation loss decreased (1.254324 --> 1.253701).  Saving model ...
Validation loss decreased (1.253701 --> 1.252950).  Saving model ...
Validation loss decreased (1.252950 --> 1.252301).  Saving model ...
Validation loss decreased (1.252301 --> 1.251700).  Saving model ...
Validation loss decreased (1.251700 --> 1.250853).  Saving model ...
Validation loss decreased (1.250853 --> 1.249947).  Saving model ...
Validation loss decreased (1.249947 --> 1.249306).  Saving model ...
Validation loss decreased (1.249306 --> 1.248631).  Saving model ...
Validation loss decreased (1.248631 --> 1.247915).  Saving model ...
Validation loss decreased (1.247915 --> 1.247294).  Saving model ...
Validation loss decreased (1.247294 --> 1.246643).  Saving model ...
Validation loss decreased (1.246643 --> 1.245948).  Saving model ...
Validation loss decreased (1.245948 --> 1.245255).  Saving model ...
Validation loss decreased (1.245255 --> 1.244463).  Saving model ...
Validation loss decreased (1.244463 --> 1.243768).  Saving model ...
Validation loss decreased (1.243768 --> 1.243237).  Saving model ...
Validation loss decreased (1.243237 --> 1.242550).  Saving model ...
Validation loss decreased (1.242550 --> 1.242053).  Saving model ...
Validation loss decreased (1.242053 --> 1.241188).  Saving model ...
Validation loss decreased (1.241188 --> 1.240538).  Saving model ...
Validation loss decreased (1.240538 --> 1.239661).  Saving model ...
Validation loss decreased (1.239661 --> 1.239164).  Saving model ...
Validation loss decreased (1.239164 --> 1.238603).  Saving model ...
Validation loss decreased (1.238603 --> 1.238082).  Saving model ...
Validation loss decreased (1.238082 --> 1.237512).  Saving model ...
Validation loss decreased (1.237512 --> 1.236887).  Saving model ...
Validation loss decreased (1.236887 --> 1.236298).  Saving model ...
Validation loss decreased (1.236298 --> 1.235484).  Saving model ...
Validation loss decreased (1.235484 --> 1.234793).  Saving model ...
Validation loss decreased (1.234793 --> 1.234167).  Saving model ...
Validation loss decreased (1.234167 --> 1.233495).  Saving model ...
Validation loss decreased (1.233495 --> 1.233161).  Saving model ...
Validation loss decreased (1.233161 --> 1.232676).  Saving model ...
Validation loss decreased (1.232676 --> 1.231812).  Saving model ...
Validation loss decreased (1.231812 --> 1.231359).  Saving model ...
Validation loss decreased (1.231359 --> 1.230676).  Saving model ...
Validation loss decreased (1.230676 --> 1.230073).  Saving model ...
Validation loss decreased (1.230073 --> 1.229454).  Saving model ...
Validation loss decreased (1.229454 --> 1.228703).  Saving model ...
Validation loss decreased (1.228703 --> 1.227939).  Saving model ...
Validation loss decreased (1.227939 --> 1.227394).  Saving model ...
Validation loss decreased (1.227394 --> 1.226821).  Saving model ...
Validation loss decreased (1.226821 --> 1.226280).  Saving model ...
Validation loss decreased (1.226280 --> 1.225661).  Saving model ...
Validation loss decreased (1.225661 --> 1.224859).  Saving model ...
Validation loss decreased (1.224859 --> 1.224304).  Saving model ...
Validation loss decreased (1.224304 --> 1.223431).  Saving model ...
Validation loss decreased (1.223431 --> 1.222914).  Saving model ...
Validation loss decreased (1.222914 --> 1.222090).  Saving model ...
Validation loss decreased (1.222090 --> 1.221494).  Saving model ...
Validation loss decreased (1.221494 --> 1.220862).  Saving model ...
Validation loss decreased (1.220862 --> 1.220484).  Saving model ...
Validation loss decreased (1.220484 --> 1.219778).  Saving model ...
Validation loss decreased (1.219778 --> 1.218975).  Saving model ...
Validation loss decreased (1.218975 --> 1.218352).  Saving model ...
Validation loss decreased (1.218352 --> 1.217622).  Saving model ...
Validation loss decreased (1.217622 --> 1.217088).  Saving model ...
Validation loss decreased (1.217088 --> 1.216684).  Saving model ...
Validation loss decreased (1.216684 --> 1.216215).  Saving model ...
Validation loss decreased (1.216215 --> 1.215757).  Saving model ...
Validation loss decreased (1.215757 --> 1.215291).  Saving model ...
Validation loss decreased (1.215291 --> 1.214736).  Saving model ...
Validation loss decreased (1.214736 --> 1.214285).  Saving model ...
Validation loss decreased (1.214285 --> 1.213873).  Saving model ...
Validation loss decreased (1.213873 --> 1.213266).  Saving model ...
Validation loss decreased (1.213266 --> 1.212480).  Saving model ...
Validation loss decreased (1.212480 --> 1.211729).  Saving model ...
Validation loss decreased (1.211729 --> 1.211380).  Saving model ...
Validation loss decreased (1.211380 --> 1.210933).  Saving model ...
Validation loss decreased (1.210933 --> 1.210324).  Saving model ...
Validation loss decreased (1.210324 --> 1.209873).  Saving model ...
Validation loss decreased (1.209873 --> 1.209509).  Saving model ...
Validation loss decreased (1.209509 --> 1.208866).  Saving model ...
Validation loss decreased (1.208866 --> 1.208391).  Saving model ...
Validation loss decreased (1.208391 --> 1.207777).  Saving model ...
Validation loss decreased (1.207777 --> 1.207296).  Saving model ...
Validation loss decreased (1.207296 --> 1.206520).  Saving model ...
Validation loss decreased (1.206520 --> 1.206118).  Saving model ...
Validation loss decreased (1.206118 --> 1.205524).  Saving model ...
Validation loss decreased (1.205524 --> 1.205010).  Saving model ...
Validation loss decreased (1.205010 --> 1.204506).  Saving model ...
Validation loss decreased (1.204506 --> 1.204038).  Saving model ...
Validation loss decreased (1.204038 --> 1.203543).  Saving model ...
Validation loss decreased (1.203543 --> 1.203204).  Saving model ...
Validation loss decreased (1.203204 --> 1.202540).  Saving model ...
Validation loss decreased (1.202540 --> 1.202106).  Saving model ...
Validation loss decreased (1.202106 --> 1.201505).  Saving model ...
Validation loss decreased (1.201505 --> 1.201085).  Saving model ...
Validation loss decreased (1.201085 --> 1.200668).  Saving model ...
Validation loss decreased (1.200668 --> 1.200150).  Saving model ...
Validation loss decreased (1.200150 --> 1.199517).  Saving model ...
Validation loss decreased (1.199517 --> 1.199063).  Saving model ...
Validation loss decreased (1.199063 --> 1.198766).  Saving model ...
Validation loss decreased (1.198766 --> 1.198161).  Saving model ...
Validation loss decreased (1.198161 --> 1.197653).  Saving model ...
Validation loss decreased (1.197653 --> 1.197440).  Saving model ...
Validation loss decreased (1.197440 --> 1.196643).  Saving model ...
Validation loss decreased (1.196643 --> 1.196100).  Saving model ...
Validation loss decreased (1.196100 --> 1.195671).  Saving model ...
Validation loss decreased (1.195671 --> 1.195060).  Saving model ...
Validation loss decreased (1.195060 --> 1.194530).  Saving model ...
Validation loss decreased (1.194530 --> 1.194084).  Saving model ...
Validation loss decreased (1.194084 --> 1.193773).  Saving model ...
Validation loss decreased (1.193773 --> 1.193143).  Saving model ...
Validation loss decreased (1.193143 --> 1.192853).  Saving model ...
Validation loss decreased (1.192853 --> 1.192468).  Saving model ...
Validation loss decreased (1.192468 --> 1.192060).  Saving model ...
Validation loss decreased (1.192060 --> 1.191657).  Saving model ...
Validation loss decreased (1.191657 --> 1.191293).  Saving model ...
Validation loss decreased (1.191293 --> 1.190835).  Saving model ...
Validation loss decreased (1.190835 --> 1.190284).  Saving model ...
Validation loss decreased (1.190284 --> 1.189847).  Saving model ...
Validation loss decreased (1.189847 --> 1.189477).  Saving model ...
Validation loss decreased (1.189477 --> 1.188889).  Saving model ...
Validation loss decreased (1.188889 --> 1.188220).  Saving model ...
Validation loss decreased (1.188220 --> 1.187778).  Saving model ...
Validation loss decreased (1.187778 --> 1.187259).  Saving model ...
Validation loss decreased (1.187259 --> 1.186787).  Saving model ...
Validation loss decreased (1.186787 --> 1.186406).  Saving model ...
Validation loss decreased (1.186406 --> 1.186115).  Saving model ...
Validation loss decreased (1.186115 --> 1.185864).  Saving model ...
Validation loss decreased (1.185864 --> 1.185189).  Saving model ...
Validation loss decreased (1.185189 --> 1.184742).  Saving model ...
Validation loss decreased (1.184742 --> 1.184415).  Saving model ...
Validation loss decreased (1.184415 --> 1.183927).  Saving model ...
Validation loss decreased (1.183927 --> 1.183423).  Saving model ...
Validation loss decreased (1.183423 --> 1.182626).  Saving model ...
Validation loss decreased (1.182626 --> 1.182254).  Saving model ...
Validation loss decreased (1.182254 --> 1.181906).  Saving model ...
Validation loss decreased (1.181906 --> 1.181373).  Saving model ...
Validation loss decreased (1.181373 --> 1.180863).  Saving model ...
Validation loss decreased (1.180863 --> 1.180189).  Saving model ...
Validation loss decreased (1.180189 --> 1.179714).  Saving model ...
Validation loss decreased (1.179714 --> 1.179180).  Saving model ...
Validation loss decreased (1.179180 --> 1.178636).  Saving model ...
Validation loss decreased (1.178636 --> 1.178191).  Saving model ...
Validation loss decreased (1.178191 --> 1.177893).  Saving model ...
Validation loss decreased (1.177893 --> 1.177389).  Saving model ...
Validation loss decreased (1.177389 --> 1.176915).  Saving model ...
Validation loss decreased (1.176915 --> 1.176558).  Saving model ...
Validation loss decreased (1.176558 --> 1.175991).  Saving model ...
Validation loss decreased (1.175991 --> 1.175347).  Saving model ...
Validation loss decreased (1.175347 --> 1.174810).  Saving model ...
Validation loss decreased (1.174810 --> 1.174340).  Saving model ...
Validation loss decreased (1.174340 --> 1.173773).  Saving model ...
Validation loss decreased (1.173773 --> 1.173391).  Saving model ...
Validation loss decreased (1.173391 --> 1.173122).  Saving model ...
Validation loss decreased (1.173122 --> 1.172840).  Saving model ...
Validation loss decreased (1.172840 --> 1.172336).  Saving model ...
Validation loss decreased (1.172336 --> 1.172113).  Saving model ...
Validation loss decreased (1.172113 --> 1.171734).  Saving model ...
Validation loss decreased (1.171734 --> 1.171382).  Saving model ...
Validation loss decreased (1.171382 --> 1.170736).  Saving model ...
Validation loss decreased (1.170736 --> 1.170274).  Saving model ...
Validation loss decreased (1.170274 --> 1.169875).  Saving model ...
Validation loss decreased (1.169875 --> 1.169487).  Saving model ...
Validation loss decreased (1.169487 --> 1.169083).  Saving model ...
Validation loss decreased (1.169083 --> 1.168876).  Saving model ...
Validation loss decreased (1.168876 --> 1.168456).  Saving model ...
Validation loss decreased (1.168456 --> 1.167999).  Saving model ...
Validation loss decreased (1.167999 --> 1.167721).  Saving model ...
Validation loss decreased (1.167721 --> 1.167291).  Saving model ...
Validation loss decreased (1.167291 --> 1.166726).  Saving model ...
Validation loss decreased (1.166726 --> 1.166203).  Saving model ...
Validation loss decreased (1.166203 --> 1.165657).  Saving model ...
Validation loss decreased (1.165657 --> 1.165320).  Saving model ...
Validation loss decreased (1.165320 --> 1.164970).  Saving model ...
Validation loss decreased (1.164970 --> 1.164509).  Saving model ...
Validation loss decreased (1.164509 --> 1.164211).  Saving model ...
Validation loss decreased (1.164211 --> 1.164013).  Saving model ...
Validation loss decreased (1.164013 --> 1.163643).  Saving model ...
Validation loss decreased (1.163643 --> 1.163328).  Saving model ...
Validation loss decreased (1.163328 --> 1.162927).  Saving model ...
Validation loss decreased (1.162927 --> 1.162564).  Saving model ...
Validation loss decreased (1.162564 --> 1.161833).  Saving model ...
Validation loss decreased (1.161833 --> 1.161323).  Saving model ...
Validation loss decreased (1.161323 --> 1.161115).  Saving model ...
Validation loss decreased (1.161115 --> 1.160824).  Saving model ...
Validation loss decreased (1.160824 --> 1.160276).  Saving model ...
Validation loss decreased (1.160276 --> 1.159859).  Saving model ...
Validation loss decreased (1.159859 --> 1.159379).  Saving model ...
Validation loss decreased (1.159379 --> 1.158907).  Saving model ...
Validation loss decreased (1.158907 --> 1.158399).  Saving model ...
Validation loss decreased (1.158399 --> 1.157973).  Saving model ...
Validation loss decreased (1.157973 --> 1.157115).  Saving model ...
Validation loss decreased (1.157115 --> 1.156767).  Saving model ...
Validation loss decreased (1.156767 --> 1.156183).  Saving model ...
Validation loss decreased (1.156183 --> 1.155932).  Saving model ...
Validation loss decreased (1.155932 --> 1.155815).  Saving model ...
Validation loss decreased (1.155815 --> 1.155535).  Saving model ...
Validation loss decreased (1.155535 --> 1.155078).  Saving model ...
Validation loss decreased (1.155078 --> 1.154797).  Saving model ...
Validation loss decreased (1.154797 --> 1.154393).  Saving model ...
Validation loss decreased (1.154393 --> 1.153857).  Saving model ...
Validation loss decreased (1.153857 --> 1.153437).  Saving model ...
Validation loss decreased (1.153437 --> 1.153203).  Saving model ...
Validation loss decreased (1.153203 --> 1.152950).  Saving model ...
Validation loss decreased (1.152950 --> 1.152570).  Saving model ...
Validation loss decreased (1.152570 --> 1.152266).  Saving model ...
Validation loss decreased (1.152266 --> 1.151691).  Saving model ...
Validation loss decreased (1.151691 --> 1.151561).  Saving model ...
Validation loss decreased (1.151561 --> 1.151418).  Saving model ...
Validation loss decreased (1.151418 --> 1.151112).  Saving model ...
Validation loss decreased (1.151112 --> 1.150555).  Saving model ...
Validation loss decreased (1.150555 --> 1.150303).  Saving model ...
Validation loss decreased (1.150303 --> 1.149795).  Saving model ...
Validation loss decreased (1.149795 --> 1.149408).  Saving model ...
Validation loss decreased (1.149408 --> 1.148960).  Saving model ...
Validation loss decreased (1.148960 --> 1.148598).  Saving model ...
Validation loss decreased (1.148598 --> 1.148354).  Saving model ...
Validation loss decreased (1.148354 --> 1.147737).  Saving model ...
Validation loss decreased (1.147737 --> 1.147370).  Saving model ...
Validation loss decreased (1.147370 --> 1.147035).  Saving model ...
Validation loss decreased (1.147035 --> 1.146889).  Saving model ...
Validation loss decreased (1.146889 --> 1.146263).  Saving model ...
Validation loss decreased (1.146263 --> 1.145545).  Saving model ...
Validation loss decreased (1.145545 --> 1.145210).  Saving model ...
Validation loss decreased (1.145210 --> 1.144867).  Saving model ...
Validation loss decreased (1.144867 --> 1.144316).  Saving model ...
Validation loss decreased (1.144316 --> 1.143941).  Saving model ...
Validation loss decreased (1.143941 --> 1.143275).  Saving model ...
Validation loss decreased (1.143275 --> 1.142623).  Saving model ...
Validation loss decreased (1.142623 --> 1.142136).  Saving model ...
Validation loss decreased (1.142136 --> 1.141541).  Saving model ...
Validation loss decreased (1.141541 --> 1.141295).  Saving model ...
Validation loss decreased (1.141295 --> 1.140965).  Saving model ...
Validation loss decreased (1.140965 --> 1.140722).  Saving model ...
Validation loss decreased (1.140722 --> 1.140256).  Saving model ...
Validation loss decreased (1.140256 --> 1.140008).  Saving model ...
Validation loss decreased (1.140008 --> 1.139679).  Saving model ...
Validation loss decreased (1.139679 --> 1.139503).  Saving model ...
Validation loss decreased (1.139503 --> 1.139380).  Saving model ...
Validation loss decreased (1.139380 --> 1.138990).  Saving model ...
Validation loss decreased (1.138990 --> 1.138485).  Saving model ...
Validation loss decreased (1.138485 --> 1.138271).  Saving model ...
Validation loss decreased (1.138271 --> 1.137974).  Saving model ...
Validation loss decreased (1.137974 --> 1.137358).  Saving model ...
Validation loss decreased (1.137358 --> 1.137020).  Saving model ...
Validation loss decreased (1.137020 --> 1.136657).  Saving model ...
Validation loss decreased (1.136657 --> 1.136271).  Saving model ...
Validation loss decreased (1.136271 --> 1.135792).  Saving model ...
Validation loss decreased (1.135792 --> 1.135255).  Saving model ...
Validation loss decreased (1.135255 --> 1.134797).  Saving model ...
Validation loss decreased (1.134797 --> 1.134283).  Saving model ...
Validation loss decreased (1.134283 --> 1.133654).  Saving model ...
Validation loss decreased (1.133654 --> 1.133292).  Saving model ...
Validation loss decreased (1.133292 --> 1.133081).  Saving model ...
Validation loss decreased (1.133081 --> 1.132876).  Saving model ...
Validation loss decreased (1.132876 --> 1.132633).  Saving model ...
Validation loss decreased (1.132633 --> 1.132306).  Saving model ...
Validation loss decreased (1.132306 --> 1.131952).  Saving model ...
Validation loss decreased (1.131952 --> 1.131742).  Saving model ...
Validation loss decreased (1.131742 --> 1.131442).  Saving model ...
Validation loss decreased (1.131442 --> 1.131280).  Saving model ...
Validation loss decreased (1.131280 --> 1.130791).  Saving model ...
Validation loss decreased (1.130791 --> 1.130315).  Saving model ...
Validation loss decreased (1.130315 --> 1.129890).  Saving model ...
Validation loss decreased (1.129890 --> 1.129422).  Saving model ...
Validation loss decreased (1.129422 --> 1.129198).  Saving model ...
Validation loss decreased (1.129198 --> 1.128327).  Saving model ...
Validation loss decreased (1.128327 --> 1.127749).  Saving model ...
Validation loss decreased (1.127749 --> 1.127001).  Saving model ...
Validation loss decreased (1.127001 --> 1.126698).  Saving model ...
Validation loss decreased (1.126698 --> 1.126622).  Saving model ...
Validation loss decreased (1.126622 --> 1.126412).  Saving model ...
Validation loss decreased (1.126412 --> 1.126000).  Saving model ...
Validation loss decreased (1.126000 --> 1.125792).  Saving model ...
Validation loss decreased (1.125792 --> 1.125617).  Saving model ...
Validation loss decreased (1.125617 --> 1.125052).  Saving model ...
Validation loss decreased (1.125052 --> 1.124554).  Saving model ...
EarlyStopping counter: 1 out of 5.0
Validation loss decreased (1.124554 --> 1.124127).  Saving model ...
Validation loss decreased (1.124127 --> 1.123761).  Saving model ...
Validation loss decreased (1.123761 --> 1.123444).  Saving model ...
Validation loss decreased (1.123444 --> 1.123025).  Saving model ...
/localscratch/yinan.28739327.0/env/lib/python3.7/site-packages/torch/nn/functional.py:1794: UserWarning: nn.functional.tanh is deprecated. Use torch.tanh instead.
  warnings.warn("nn.functional.tanh is deprecated. Use torch.tanh instead.")
/localscratch/yinan.28739327.0/env/lib/python3.7/site-packages/transformers/optimization.py:155: UserWarning: This overload of add_ is deprecated:
	add_(Number alpha, Tensor other)
Consider using one of the following signatures instead:
	add_(Tensor other, *, Number alpha) (Triggered internally at  ../torch/csrc/utils/python_arg_parser.cpp:1025.)
  exp_avg.mul_(beta1).add_(1.0 - beta1, grad)
wandb: Waiting for W&B process to finish, PID 208188... (success).
wandb: - 0.00MB of 0.00MB uploaded (0.00MB deduped)wandb: \ 0.00MB of 0.00MB uploaded (0.00MB deduped)wandb: | 0.00MB of 0.00MB uploaded (0.00MB deduped)wandb: / 0.00MB of 0.00MB uploaded (0.00MB deduped)wandb: - 0.00MB of 0.00MB uploaded (0.00MB deduped)wandb: \ 0.00MB of 0.00MB uploaded (0.00MB deduped)wandb: | 0.00MB of 0.00MB uploaded (0.00MB deduped)wandb: / 0.00MB of 0.00MB uploaded (0.00MB deduped)wandb: - 0.00MB of 0.00MB uploaded (0.00MB deduped)wandb: \ 0.00MB of 0.00MB uploaded (0.00MB deduped)wandb: | 0.00MB of 0.00MB uploaded (0.00MB deduped)wandb: / 0.00MB of 0.00MB uploaded (0.00MB deduped)wandb: - 0.00MB of 0.00MB uploaded (0.00MB deduped)wandb:                                                                                
wandb: Run history:
wandb:     e_F1 ▁▁▂▂▃▄▅▅▅▅▅▆▆▆▆▆▆▆▆▆▇▆▇▇▇▇▇▇▇▇██████████
wandb:   e_loss █▇▇▇▆▆▆▆▆▅▅▅▅▅▅▄▄▄▄▄▃▃▃▃▃▃▂▂▂▂▂▂▂▂▂▁▁▁▁▁
wandb:     t_F1 ▁▁▂▃▃▃▃▃▃▄▃▅▅▄▅▅▆▆▆▆▆▆▆▆▇▆▇▇▇▇▇▇▇▇▇█▇▇▇█
wandb:   t_loss ███▇▇▇▆▇▆▆▆▅▅▆▅▅▅▄▄▄▄▄▄▄▃▃▃▃▃▃▂▂▂▂▂▂▂▁▁▁
wandb: 
wandb: Run summary:
wandb:     e_F1 51.88717
wandb:   e_loss 1.12303
wandb:     t_F1 53.41678
wandb:   t_loss 1.07723
wandb: 
wandb: Synced 4 W&B file(s), 0 media file(s), 0 artifact file(s) and 0 other file(s)
wandb: Synced young-lion-1: https://wandb.ai/yinanazhou/xl_512_bs_8_lr_1e07_es_5_lc_False_nr_False_sr_True_stem_False_lemma_True_repeat_1_fold_1/runs/1rhx2xgj
wandb: Find logs at: ./wandb/run-20220311_103402-1rhx2xgj/logs/debug.log
wandb: 

wandb: wandb version 0.12.11 is available!  To upgrade, please run:
wandb:  $ pip install wandb --upgrade
2022-03-11 16:06:40.099278: I tensorflow/stream_executor/platform/default/dso_loader.cc:48] Successfully opened dynamic library libcudart.so.10.1
wandb: Tracking run with wandb version 0.12.5
wandb: Syncing run cerulean-gorge-1
wandb: ⭐️ View project at https://wandb.ai/yinanazhou/xl_512_bs_8_lr_1e07_es_5_lc_False_nr_False_sr_True_stem_False_lemma_True_repeat_1_fold_2
wandb: 🚀 View run at https://wandb.ai/yinanazhou/xl_512_bs_8_lr_1e07_es_5_lc_False_nr_False_sr_True_stem_False_lemma_True_repeat_1_fold_2/runs/2a9rwn6o
wandb: Run data is saved locally in /project/6002780/yinan/Thesis_MER_Lyrics/lyric-emotion/wandb/run-20220311_160636-2a9rwn6o
wandb: Run `wandb offline` to turn off syncing.
slurmstepd: error: *** JOB 28739327 ON cdr2612 CANCELLED AT 2022-03-11T20:30:22 DUE TO TIME LIMIT ***
