Unloading StdEnv/2020

Due to MODULEPATH changes, the following have been reloaded:
  1) mii/1.1.1


The following have been reloaded with a version change:
  1) python/3.8.2 => python/3.7.4

Using base prefix '/cvmfs/soft.computecanada.ca/easybuild/software/2017/Core/python/3.7.4'
New python executable in /localscratch/yinan.28285669.0/env/bin/python
Installing setuptools, pip, wheel...
done.
Ignoring pip: markers 'python_version < "3"' don't match your environment
Looking in links: /cvmfs/soft.computecanada.ca/custom/python/wheelhouse/nix/avx2, /cvmfs/soft.computecanada.ca/custom/python/wheelhouse/nix/generic, /cvmfs/soft.computecanada.ca/custom/python/wheelhouse/generic
Collecting pip
Installing collected packages: pip
  Found existing installation: pip 19.1.1
    Uninstalling pip-19.1.1:
      Successfully uninstalled pip-19.1.1
Successfully installed pip-21.2.3+computecanada
Looking in links: /cvmfs/soft.computecanada.ca/custom/python/wheelhouse/nix/avx2, /cvmfs/soft.computecanada.ca/custom/python/wheelhouse/nix/generic, /cvmfs/soft.computecanada.ca/custom/python/wheelhouse/generic
Processing /cvmfs/soft.computecanada.ca/custom/python/wheelhouse/generic/keras-2.8.0+computecanada-py2.py3-none-any.whl
Processing /cvmfs/soft.computecanada.ca/custom/python/wheelhouse/generic/Keras_Preprocessing-1.1.2+computecanada-py3-none-any.whl
Requirement already satisfied: matplotlib in /cvmfs/soft.computecanada.ca/easybuild/software/2017/Core/scipy-stack/2019a/lib/python3.7/site-packages (from -r requirements.txt (line 3)) (3.0.2)
Processing /cvmfs/soft.computecanada.ca/custom/python/wheelhouse/generic/nltk-3.6.5+computecanada-py3-none-any.whl
Processing /cvmfs/soft.computecanada.ca/custom/python/wheelhouse/generic/scikit_learn-0.22.1+computecanada-cp37-cp37m-linux_x86_64.whl
Processing /cvmfs/soft.computecanada.ca/custom/python/wheelhouse/generic/tensorboard-2.3.0+computecanada-py3-none-any.whl
Processing /cvmfs/soft.computecanada.ca/custom/python/wheelhouse/generic/tensorboard_plugin_wit-1.7.0+computecanada-py3-none-any.whl
Processing /cvmfs/soft.computecanada.ca/custom/python/wheelhouse/generic/tensorflow_gpu-2.3.0+computecanada-cp37-cp37m-linux_x86_64.whl
Processing /cvmfs/soft.computecanada.ca/custom/python/wheelhouse/generic/tensorflow_estimator-2.3.0+computecanada-py2.py3-none-any.whl
Processing /cvmfs/soft.computecanada.ca/custom/python/wheelhouse/generic/tokenizers-0.5.2+computecanada-cp37-cp37m-linux_x86_64.whl
Processing /cvmfs/soft.computecanada.ca/custom/python/wheelhouse/nix/avx2/torch-1.4.0+computecanada-cp37-cp37m-linux_x86_64.whl
Processing /cvmfs/soft.computecanada.ca/custom/python/wheelhouse/generic/torchtext-0.6.0+computecanada-py3-none-any.whl
Processing /cvmfs/soft.computecanada.ca/custom/python/wheelhouse/generic/torchvision-0.8.2+computecanada-cp37-cp37m-linux_x86_64.whl
Processing /cvmfs/soft.computecanada.ca/custom/python/wheelhouse/generic/transformers-2.5.1+computecanada-py3-none-any.whl
Processing /cvmfs/soft.computecanada.ca/custom/python/wheelhouse/generic/urllib3-1.26.7+computecanada-py2.py3-none-any.whl
Processing /cvmfs/soft.computecanada.ca/custom/python/wheelhouse/generic/tqdm-4.63.0+computecanada-py2.py3-none-any.whl
Processing /cvmfs/soft.computecanada.ca/custom/python/wheelhouse/generic/click-8.0.3+computecanada-py3-none-any.whl
ERROR: Could not find a version that satisfies the requirement regex>=2021.8.3 (from nltk) (from versions: 2018.1.10+computecanada, 2019.11.1+computecanada, 2020.11.13+computecanada)
ERROR: No matching distribution found for regex>=2021.8.3
Looking in links: /cvmfs/soft.computecanada.ca/custom/python/wheelhouse/nix/avx2, /cvmfs/soft.computecanada.ca/custom/python/wheelhouse/nix/generic, /cvmfs/soft.computecanada.ca/custom/python/wheelhouse/generic
ERROR: Could not find a version that satisfies the requirement numpy==1.20.0+computacanada (from versions: 1.15.0+computecanada, 1.15.2+computecanada, 1.15.4+computecanada, 1.16.0+computecanada, 1.16.2+computecanada, 1.16.3+computecanada, 1.17.4+computecanada, 1.18.1+computecanada, 1.18.4+computecanada, 1.19.1+computecanada, 1.19.2+computecanada, 1.20.2+computecanada)
ERROR: No matching distribution found for numpy==1.20.0+computacanada
Looking in links: /cvmfs/soft.computecanada.ca/custom/python/wheelhouse/nix/avx2, /cvmfs/soft.computecanada.ca/custom/python/wheelhouse/nix/generic, /cvmfs/soft.computecanada.ca/custom/python/wheelhouse/generic
Processing /cvmfs/soft.computecanada.ca/custom/python/wheelhouse/generic/wandb-0.12.5+computecanada-py2.py3-none-any.whl
Processing /cvmfs/soft.computecanada.ca/custom/python/wheelhouse/generic/configparser-5.0.2+computecanada-py3-none-any.whl
Processing /cvmfs/soft.computecanada.ca/custom/python/wheelhouse/generic/promise-2.3+computecanada-py3-none-any.whl
Processing /cvmfs/soft.computecanada.ca/custom/python/wheelhouse/generic/docker_pycreds-0.4.0+computecanada-py2.py3-none-any.whl
Processing /cvmfs/soft.computecanada.ca/custom/python/wheelhouse/generic/click-8.0.3+computecanada-py3-none-any.whl
Requirement already satisfied: requests<3,>=2.0.0 in /cvmfs/soft.computecanada.ca/easybuild/software/2017/Core/scipy-stack/2019a/lib/python3.7/site-packages (from wandb) (2.21.0)
Processing /cvmfs/soft.computecanada.ca/custom/python/wheelhouse/generic/shortuuid-1.0.1+computecanada-py3-none-any.whl
Processing /cvmfs/soft.computecanada.ca/custom/python/wheelhouse/generic/protobuf-3.19.3+computecanada-py2.py3-none-any.whl
Processing /cvmfs/soft.computecanada.ca/custom/python/wheelhouse/generic/pathtools-0.1.2+computecanada-py3-none-any.whl
Processing /cvmfs/soft.computecanada.ca/custom/python/wheelhouse/generic/six-1.16.0+computecanada-py2.py3-none-any.whl
Processing /cvmfs/soft.computecanada.ca/custom/python/wheelhouse/generic/sentry_sdk-1.5.0+computecanada-py2.py3-none-any.whl
Processing /cvmfs/soft.computecanada.ca/custom/python/wheelhouse/generic/GitPython-3.1.24+computecanada-py3-none-any.whl
Processing /cvmfs/soft.computecanada.ca/custom/python/wheelhouse/generic/psutil-5.7.3+computecanada-cp37-cp37m-linux_x86_64.whl
Processing /cvmfs/soft.computecanada.ca/custom/python/wheelhouse/generic/yaspin-2.1.0+computecanada-py3-none-any.whl
Processing /cvmfs/soft.computecanada.ca/custom/python/wheelhouse/generic/PyYAML-5.3.1+computecanada-cp37-cp37m-linux_x86_64.whl
Requirement already satisfied: python-dateutil>=2.6.1 in /cvmfs/soft.computecanada.ca/easybuild/software/2017/Core/scipy-stack/2019a/lib/python3.7/site-packages (from wandb) (2.7.5)
Processing /cvmfs/soft.computecanada.ca/custom/python/wheelhouse/generic/subprocess32-3.5.4+computecanada-py3-none-any.whl
Requirement already satisfied: importlib-metadata in /cvmfs/soft.computecanada.ca/easybuild/software/2017/Core/scipy-stack/2019a/lib/python3.7/site-packages (from Click!=8.0.0,>=7.0->wandb) (0.8)
Processing /cvmfs/soft.computecanada.ca/custom/python/wheelhouse/generic/typing_extensions-4.0.1+computecanada-py3-none-any.whl
Processing /cvmfs/soft.computecanada.ca/custom/python/wheelhouse/generic/gitdb-4.0.9+computecanada-py3-none-any.whl
Processing /cvmfs/soft.computecanada.ca/custom/python/wheelhouse/generic/smmap-5.0.0+computecanada-py3-none-any.whl
Requirement already satisfied: chardet<3.1.0,>=3.0.2 in /cvmfs/soft.computecanada.ca/easybuild/software/2017/Core/scipy-stack/2019a/lib/python3.7/site-packages (from requests<3,>=2.0.0->wandb) (3.0.4)
Requirement already satisfied: idna<2.9,>=2.5 in /cvmfs/soft.computecanada.ca/easybuild/software/2017/Core/scipy-stack/2019a/lib/python3.7/site-packages (from requests<3,>=2.0.0->wandb) (2.8)
Requirement already satisfied: certifi>=2017.4.17 in /cvmfs/soft.computecanada.ca/easybuild/software/2017/Core/scipy-stack/2019a/lib/python3.7/site-packages (from requests<3,>=2.0.0->wandb) (2018.11.29)
Requirement already satisfied: urllib3<1.25,>=1.21.1 in /cvmfs/soft.computecanada.ca/easybuild/software/2017/Core/scipy-stack/2019a/lib/python3.7/site-packages (from requests<3,>=2.0.0->wandb) (1.24.1)
Processing /cvmfs/soft.computecanada.ca/custom/python/wheelhouse/generic/termcolor-1.1.0+computecanada-py3-none-any.whl
Requirement already satisfied: zipp>=0.3.2 in /cvmfs/soft.computecanada.ca/easybuild/software/2017/Core/scipy-stack/2019a/lib/python3.7/site-packages (from importlib-metadata->Click!=8.0.0,>=7.0->wandb) (0.3.3)
Installing collected packages: smmap, typing-extensions, termcolor, six, gitdb, yaspin, subprocess32, shortuuid, sentry-sdk, PyYAML, psutil, protobuf, promise, pathtools, GitPython, docker-pycreds, configparser, Click, wandb
  Attempting uninstall: six
    Found existing installation: six 1.12.0
    Not uninstalling six at /cvmfs/soft.computecanada.ca/easybuild/software/2017/Core/scipy-stack/2019a/lib/python3.7/site-packages, outside environment /localscratch/yinan.28285669.0/env
    Can't uninstall 'six'. No files were found to uninstall.
Successfully installed Click-8.0.3+computecanada GitPython-3.1.24+computecanada PyYAML-5.3.1+computecanada configparser-5.0.2+computecanada docker-pycreds-0.4.0+computecanada gitdb-4.0.9+computecanada pathtools-0.1.2+computecanada promise-2.3+computecanada protobuf-3.19.3+computecanada psutil-5.7.3+computecanada sentry-sdk-1.5.0+computecanada shortuuid-1.0.1+computecanada six-1.16.0+computecanada smmap-5.0.0+computecanada subprocess32-3.5.4+computecanada termcolor-1.1.0+computecanada typing-extensions-4.0.1+computecanada wandb-0.12.5+computecanada yaspin-2.1.0+computecanada
Looking in links: /cvmfs/soft.computecanada.ca/custom/python/wheelhouse/nix/avx2, /cvmfs/soft.computecanada.ca/custom/python/wheelhouse/nix/generic, /cvmfs/soft.computecanada.ca/custom/python/wheelhouse/generic
ERROR: Could not find a version that satisfies the requirement sagemaker (from versions: none)
ERROR: No matching distribution found for sagemaker
Looking in links: /cvmfs/soft.computecanada.ca/custom/python/wheelhouse/nix/avx2, /cvmfs/soft.computecanada.ca/custom/python/wheelhouse/nix/generic, /cvmfs/soft.computecanada.ca/custom/python/wheelhouse/generic
Processing /cvmfs/soft.computecanada.ca/custom/python/wheelhouse/generic/torch-1.9.1+computecanada-cp37-cp37m-linux_x86_64.whl
Requirement already satisfied: typing-extensions in /localscratch/yinan.28285669.0/env/lib/python3.7/site-packages (from torch) (4.0.1+computecanada)
Installing collected packages: torch
Successfully installed torch-1.9.1+computecanada
Looking in links: /cvmfs/soft.computecanada.ca/custom/python/wheelhouse/nix/avx2, /cvmfs/soft.computecanada.ca/custom/python/wheelhouse/nix/generic, /cvmfs/soft.computecanada.ca/custom/python/wheelhouse/generic
Processing /cvmfs/soft.computecanada.ca/custom/python/wheelhouse/generic/transformers-2.5.1+computecanada-py3-none-any.whl
Processing /cvmfs/soft.computecanada.ca/custom/python/wheelhouse/generic/tqdm-4.63.0+computecanada-py2.py3-none-any.whl
Processing /cvmfs/soft.computecanada.ca/custom/python/wheelhouse/generic/filelock-3.4.2+computecanada-py3-none-any.whl
Requirement already satisfied: numpy in /cvmfs/soft.computecanada.ca/easybuild/software/2017/Core/scipy-stack/2019a/lib/python3.7/site-packages (from transformers==2.5.1+computecanada) (1.16.0)
Processing /cvmfs/soft.computecanada.ca/custom/python/wheelhouse/generic/sentencepiece-0.1.91+computecanada-cp37-cp37m-linux_x86_64.whl
Requirement already satisfied: requests in /cvmfs/soft.computecanada.ca/easybuild/software/2017/Core/scipy-stack/2019a/lib/python3.7/site-packages (from transformers==2.5.1+computecanada) (2.21.0)
Processing /cvmfs/soft.computecanada.ca/custom/python/wheelhouse/generic/sacremoses-0.0.46+computecanada-py3-none-any.whl
Processing /cvmfs/soft.computecanada.ca/custom/python/wheelhouse/generic/regex-2020.11.13+computecanada-cp37-cp37m-linux_x86_64.whl
Processing /cvmfs/soft.computecanada.ca/custom/python/wheelhouse/generic/tokenizers-0.5.2+computecanada-cp37-cp37m-linux_x86_64.whl
Processing /cvmfs/soft.computecanada.ca/custom/python/wheelhouse/generic/boto3-1.20.52+computecanada-py3-none-any.whl
Processing /cvmfs/soft.computecanada.ca/custom/python/wheelhouse/generic/botocore-1.23.52+computecanada-py3-none-any.whl
Processing /cvmfs/soft.computecanada.ca/custom/python/wheelhouse/generic/s3transfer-0.5.1+computecanada-py3-none-any.whl
Processing /cvmfs/soft.computecanada.ca/custom/python/wheelhouse/generic/jmespath-0.10.0+computecanada-py2.py3-none-any.whl
Processing /cvmfs/soft.computecanada.ca/custom/python/wheelhouse/generic/urllib3-1.26.8+computecanada-py2.py3-none-any.whl
Requirement already satisfied: python-dateutil<3.0.0,>=2.1 in /cvmfs/soft.computecanada.ca/easybuild/software/2017/Core/scipy-stack/2019a/lib/python3.7/site-packages (from botocore<1.24.0,>=1.23.52->boto3->transformers==2.5.1+computecanada) (2.7.5)
Requirement already satisfied: six>=1.5 in /localscratch/yinan.28285669.0/env/lib/python3.7/site-packages (from python-dateutil<3.0.0,>=2.1->botocore<1.24.0,>=1.23.52->boto3->transformers==2.5.1+computecanada) (1.16.0+computecanada)
Requirement already satisfied: certifi>=2017.4.17 in /cvmfs/soft.computecanada.ca/easybuild/software/2017/Core/scipy-stack/2019a/lib/python3.7/site-packages (from requests->transformers==2.5.1+computecanada) (2018.11.29)
Requirement already satisfied: chardet<3.1.0,>=3.0.2 in /cvmfs/soft.computecanada.ca/easybuild/software/2017/Core/scipy-stack/2019a/lib/python3.7/site-packages (from requests->transformers==2.5.1+computecanada) (3.0.4)
Processing /cvmfs/soft.computecanada.ca/custom/python/wheelhouse/generic/requests-2.27.1+computecanada-py2.py3-none-any.whl
Requirement already satisfied: idna<4,>=2.5 in /cvmfs/soft.computecanada.ca/easybuild/software/2017/Core/scipy-stack/2019a/lib/python3.7/site-packages (from requests->transformers==2.5.1+computecanada) (2.8)
Processing /cvmfs/soft.computecanada.ca/custom/python/wheelhouse/generic/charset_normalizer-2.0.11+computecanada-py3-none-any.whl
Requirement already satisfied: click in /localscratch/yinan.28285669.0/env/lib/python3.7/site-packages (from sacremoses->transformers==2.5.1+computecanada) (8.0.3+computecanada)
Processing /cvmfs/soft.computecanada.ca/custom/python/wheelhouse/generic/joblib-1.1.0+computecanada-py2.py3-none-any.whl
Requirement already satisfied: importlib-metadata in /cvmfs/soft.computecanada.ca/easybuild/software/2017/Core/scipy-stack/2019a/lib/python3.7/site-packages (from click->sacremoses->transformers==2.5.1+computecanada) (0.8)
Requirement already satisfied: zipp>=0.3.2 in /cvmfs/soft.computecanada.ca/easybuild/software/2017/Core/scipy-stack/2019a/lib/python3.7/site-packages (from importlib-metadata->click->sacremoses->transformers==2.5.1+computecanada) (0.3.3)
Installing collected packages: urllib3, jmespath, botocore, tqdm, s3transfer, regex, joblib, charset-normalizer, tokenizers, sentencepiece, sacremoses, requests, filelock, boto3, transformers
  Attempting uninstall: urllib3
    Found existing installation: urllib3 1.24.1
    Not uninstalling urllib3 at /cvmfs/soft.computecanada.ca/easybuild/software/2017/Core/scipy-stack/2019a/lib/python3.7/site-packages, outside environment /localscratch/yinan.28285669.0/env
    Can't uninstall 'urllib3'. No files were found to uninstall.
  Attempting uninstall: requests
    Found existing installation: requests 2.21.0
    Not uninstalling requests at /cvmfs/soft.computecanada.ca/easybuild/software/2017/Core/scipy-stack/2019a/lib/python3.7/site-packages, outside environment /localscratch/yinan.28285669.0/env
    Can't uninstall 'requests'. No files were found to uninstall.
Successfully installed boto3-1.20.52+computecanada botocore-1.23.52+computecanada charset-normalizer-2.0.11+computecanada filelock-3.4.2+computecanada jmespath-0.10.0+computecanada joblib-1.1.0+computecanada regex-2020.11.13+computecanada requests-2.27.1+computecanada s3transfer-0.5.1+computecanada sacremoses-0.0.46+computecanada sentencepiece-0.1.91+computecanada tokenizers-0.5.2+computecanada tqdm-4.63.0+computecanada transformers-2.5.1+computecanada urllib3-1.26.8+computecanada
Looking in links: /cvmfs/soft.computecanada.ca/custom/python/wheelhouse/nix/avx2, /cvmfs/soft.computecanada.ca/custom/python/wheelhouse/nix/generic, /cvmfs/soft.computecanada.ca/custom/python/wheelhouse/generic
Processing /cvmfs/soft.computecanada.ca/custom/python/wheelhouse/generic/tensorflow_gpu-2.3.0+computecanada-cp37-cp37m-linux_x86_64.whl
Processing /cvmfs/soft.computecanada.ca/custom/python/wheelhouse/nix/generic/scipy-1.4.1+computecanada-cp37-cp37m-linux_x86_64.whl
Processing /cvmfs/soft.computecanada.ca/custom/python/wheelhouse/generic/google_pasta-0.2.0+computecanada-py3-none-any.whl
Processing /cvmfs/soft.computecanada.ca/custom/python/wheelhouse/generic/gast-0.3.3+computecanada-py3-none-any.whl
Processing /cvmfs/soft.computecanada.ca/custom/python/wheelhouse/generic/astunparse-1.6.3+computecanada-py2.py3-none-any.whl
Processing /cvmfs/soft.computecanada.ca/custom/python/wheelhouse/generic/Keras_Preprocessing-1.1.2+computecanada-py3-none-any.whl
Requirement already satisfied: numpy<1.19.0,>=1.16.0 in /cvmfs/soft.computecanada.ca/easybuild/software/2017/Core/scipy-stack/2019a/lib/python3.7/site-packages (from tensorflow_gpu==2.3.0+computecanada) (1.16.0)
Requirement already satisfied: protobuf>=3.9.2 in /localscratch/yinan.28285669.0/env/lib/python3.7/site-packages (from tensorflow_gpu==2.3.0+computecanada) (3.19.3+computecanada)
Processing /cvmfs/soft.computecanada.ca/custom/python/wheelhouse/generic/wrapt-1.11.2+computecanada-cp37-cp37m-linux_x86_64.whl
Requirement already satisfied: wheel>=0.26 in /localscratch/yinan.28285669.0/env/lib/python3.7/site-packages (from tensorflow_gpu==2.3.0+computecanada) (0.33.4)
Requirement already satisfied: six>=1.12.0 in /localscratch/yinan.28285669.0/env/lib/python3.7/site-packages (from tensorflow_gpu==2.3.0+computecanada) (1.16.0+computecanada)
Processing /cvmfs/soft.computecanada.ca/custom/python/wheelhouse/generic/opt_einsum-3.3.0+computecanada-py3-none-any.whl
Processing /cvmfs/soft.computecanada.ca/custom/python/wheelhouse/nix/avx2/h5py-2.10.0+computecanada-cp37-cp37m-linux_x86_64.whl
Processing /cvmfs/soft.computecanada.ca/custom/python/wheelhouse/generic/grpcio-1.38.0+computecanada-cp37-cp37m-linux_x86_64.whl
Processing /cvmfs/soft.computecanada.ca/custom/python/wheelhouse/generic/tensorflow_estimator-2.3.0+computecanada-py2.py3-none-any.whl
Processing /cvmfs/soft.computecanada.ca/custom/python/wheelhouse/generic/absl_py-1.0.0+computecanada-py3-none-any.whl
Requirement already satisfied: termcolor>=1.1.0 in /localscratch/yinan.28285669.0/env/lib/python3.7/site-packages (from tensorflow_gpu==2.3.0+computecanada) (1.1.0+computecanada)
Processing /cvmfs/soft.computecanada.ca/custom/python/wheelhouse/generic/tensorboard-2.8.0+computecanada-py3-none-any.whl
Processing /cvmfs/soft.computecanada.ca/custom/python/wheelhouse/generic/google_auth_oauthlib-0.4.6+computecanada-py2.py3-none-any.whl
Requirement already satisfied: requests<3,>=2.21.0 in /localscratch/yinan.28285669.0/env/lib/python3.7/site-packages (from tensorboard<3,>=2.3.0->tensorflow_gpu==2.3.0+computecanada) (2.27.1+computecanada)
Processing /cvmfs/soft.computecanada.ca/custom/python/wheelhouse/generic/tensorboard_data_server-0.6.1+computecanada-py3-none-linux_x86_64.whl
Requirement already satisfied: setuptools>=41.0.0 in /localscratch/yinan.28285669.0/env/lib/python3.7/site-packages (from tensorboard<3,>=2.3.0->tensorflow_gpu==2.3.0+computecanada) (41.0.1)
Processing /cvmfs/soft.computecanada.ca/custom/python/wheelhouse/generic/Werkzeug-2.0.3+computecanada-py3-none-any.whl
Processing /cvmfs/soft.computecanada.ca/custom/python/wheelhouse/generic/Markdown-3.3.6+computecanada-py3-none-any.whl
Processing /cvmfs/soft.computecanada.ca/custom/python/wheelhouse/generic/tensorboard_plugin_wit-1.8.0+computecanada-py3-none-any.whl
Processing /cvmfs/soft.computecanada.ca/custom/python/wheelhouse/generic/google_auth-2.3.3+computecanada-py2.py3-none-any.whl
Processing /cvmfs/soft.computecanada.ca/custom/python/wheelhouse/generic/pyasn1_modules-0.2.8+computecanada-py2.py3-none-any.whl
Processing /cvmfs/soft.computecanada.ca/custom/python/wheelhouse/generic/rsa-4.8+computecanada-py3-none-any.whl
Processing /cvmfs/soft.computecanada.ca/custom/python/wheelhouse/generic/cachetools-4.2.4+computecanada-py3-none-any.whl
Processing /cvmfs/soft.computecanada.ca/custom/python/wheelhouse/generic/requests_oauthlib-1.3.0+computecanada-py2.py3-none-any.whl
Processing /cvmfs/soft.computecanada.ca/custom/python/wheelhouse/generic/importlib_metadata-4.10.1+computecanada-py3-none-any.whl
Requirement already satisfied: typing-extensions>=3.6.4 in /localscratch/yinan.28285669.0/env/lib/python3.7/site-packages (from importlib-metadata>=4.4->markdown>=2.6.8->tensorboard<3,>=2.3.0->tensorflow_gpu==2.3.0+computecanada) (4.0.1+computecanada)
Processing /cvmfs/soft.computecanada.ca/custom/python/wheelhouse/generic/zipp-3.7.0+computecanada-py3-none-any.whl
Processing /cvmfs/soft.computecanada.ca/custom/python/wheelhouse/generic/pyasn1-0.4.8+computecanada-py2.py3-none-any.whl
Requirement already satisfied: charset-normalizer~=2.0.0 in /localscratch/yinan.28285669.0/env/lib/python3.7/site-packages (from requests<3,>=2.21.0->tensorboard<3,>=2.3.0->tensorflow_gpu==2.3.0+computecanada) (2.0.11+computecanada)
Requirement already satisfied: certifi>=2017.4.17 in /cvmfs/soft.computecanada.ca/easybuild/software/2017/Core/scipy-stack/2019a/lib/python3.7/site-packages (from requests<3,>=2.21.0->tensorboard<3,>=2.3.0->tensorflow_gpu==2.3.0+computecanada) (2018.11.29)
Requirement already satisfied: urllib3<1.27,>=1.21.1 in /localscratch/yinan.28285669.0/env/lib/python3.7/site-packages (from requests<3,>=2.21.0->tensorboard<3,>=2.3.0->tensorflow_gpu==2.3.0+computecanada) (1.26.8+computecanada)
Requirement already satisfied: idna<4,>=2.5 in /cvmfs/soft.computecanada.ca/easybuild/software/2017/Core/scipy-stack/2019a/lib/python3.7/site-packages (from requests<3,>=2.21.0->tensorboard<3,>=2.3.0->tensorflow_gpu==2.3.0+computecanada) (2.8)
Processing /cvmfs/soft.computecanada.ca/custom/python/wheelhouse/generic/oauthlib-3.1.1+computecanada-py2.py3-none-any.whl
Installing collected packages: pyasn1, zipp, rsa, pyasn1-modules, oauthlib, cachetools, requests-oauthlib, importlib-metadata, google-auth, werkzeug, tensorboard-plugin-wit, tensorboard-data-server, markdown, grpcio, google-auth-oauthlib, absl-py, wrapt, tensorflow-estimator, tensorboard, scipy, opt-einsum, keras-preprocessing, h5py, google-pasta, gast, astunparse, tensorflow-gpu
  Attempting uninstall: pyasn1
    Found existing installation: pyasn1 0.4.3
    Not uninstalling pyasn1 at /cvmfs/soft.computecanada.ca/easybuild/software/2017/Core/scipy-stack/2019a/lib/python3.7/site-packages, outside environment /localscratch/yinan.28285669.0/env
    Can't uninstall 'pyasn1'. No files were found to uninstall.
  Attempting uninstall: zipp
    Found existing installation: zipp 0.3.3
    Not uninstalling zipp at /cvmfs/soft.computecanada.ca/easybuild/software/2017/Core/scipy-stack/2019a/lib/python3.7/site-packages, outside environment /localscratch/yinan.28285669.0/env
    Can't uninstall 'zipp'. No files were found to uninstall.
  Attempting uninstall: importlib-metadata
    Found existing installation: importlib-metadata 0.8
    Not uninstalling importlib-metadata at /cvmfs/soft.computecanada.ca/easybuild/software/2017/Core/scipy-stack/2019a/lib/python3.7/site-packages, outside environment /localscratch/yinan.28285669.0/env
    Can't uninstall 'importlib-metadata'. No files were found to uninstall.
  Attempting uninstall: scipy
    Found existing installation: scipy 1.2.0
    Not uninstalling scipy at /cvmfs/soft.computecanada.ca/easybuild/software/2017/Core/scipy-stack/2019a/lib/python3.7/site-packages, outside environment /localscratch/yinan.28285669.0/env
    Can't uninstall 'scipy'. No files were found to uninstall.
Successfully installed absl-py-1.0.0+computecanada astunparse-1.6.3+computecanada cachetools-4.2.4+computecanada gast-0.3.3+computecanada google-auth-2.3.3+computecanada google-auth-oauthlib-0.4.6+computecanada google-pasta-0.2.0+computecanada grpcio-1.38.0+computecanada h5py-2.10.0+computecanada importlib-metadata-4.10.1+computecanada keras-preprocessing-1.1.2+computecanada markdown-3.3.6+computecanada oauthlib-3.1.1+computecanada opt-einsum-3.3.0+computecanada pyasn1-0.4.8+computecanada pyasn1-modules-0.2.8+computecanada requests-oauthlib-1.3.0+computecanada rsa-4.8+computecanada scipy-1.4.1+computecanada tensorboard-2.8.0+computecanada tensorboard-data-server-0.6.1+computecanada tensorboard-plugin-wit-1.8.0+computecanada tensorflow-estimator-2.3.0+computecanada tensorflow-gpu-2.3.0+computecanada werkzeug-2.0.3+computecanada wrapt-1.11.2+computecanada zipp-3.7.0+computecanada
Looking in links: /cvmfs/soft.computecanada.ca/custom/python/wheelhouse/nix/avx2, /cvmfs/soft.computecanada.ca/custom/python/wheelhouse/nix/generic, /cvmfs/soft.computecanada.ca/custom/python/wheelhouse/generic
Processing /cvmfs/soft.computecanada.ca/custom/python/wheelhouse/generic/keras-2.8.0+computecanada-py2.py3-none-any.whl
Installing collected packages: Keras
Successfully installed Keras-2.8.0+computecanada
Looking in links: /cvmfs/soft.computecanada.ca/custom/python/wheelhouse/nix/avx2, /cvmfs/soft.computecanada.ca/custom/python/wheelhouse/nix/generic, /cvmfs/soft.computecanada.ca/custom/python/wheelhouse/generic
Processing /cvmfs/soft.computecanada.ca/custom/python/wheelhouse/generic/urllib3-1.26.7+computecanada-py2.py3-none-any.whl
Installing collected packages: urllib3
  Attempting uninstall: urllib3
    Found existing installation: urllib3 1.26.8+computecanada
    Uninstalling urllib3-1.26.8+computecanada:
      Successfully uninstalled urllib3-1.26.8+computecanada
Successfully installed urllib3-1.26.7+computecanada
Looking in links: /cvmfs/soft.computecanada.ca/custom/python/wheelhouse/nix/avx2, /cvmfs/soft.computecanada.ca/custom/python/wheelhouse/nix/generic, /cvmfs/soft.computecanada.ca/custom/python/wheelhouse/generic
Processing /cvmfs/soft.computecanada.ca/custom/python/wheelhouse/generic/nltk-3.7+computecanada-py3-none-any.whl
Requirement already satisfied: joblib in /localscratch/yinan.28285669.0/env/lib/python3.7/site-packages (from nltk) (1.1.0+computecanada)
Requirement already satisfied: click in /localscratch/yinan.28285669.0/env/lib/python3.7/site-packages (from nltk) (8.0.3+computecanada)
Processing /cvmfs/soft.computecanada.ca/custom/python/wheelhouse/generic/nltk-3.6.5+computecanada-py3-none-any.whl
Processing /cvmfs/soft.computecanada.ca/custom/python/wheelhouse/generic/nltk-3.6.3+computecanada-py3-none-any.whl
Requirement already satisfied: regex in /localscratch/yinan.28285669.0/env/lib/python3.7/site-packages (from nltk) (2020.11.13+computecanada)
Requirement already satisfied: tqdm in /localscratch/yinan.28285669.0/env/lib/python3.7/site-packages (from nltk) (4.63.0+computecanada)
Requirement already satisfied: importlib-metadata in /localscratch/yinan.28285669.0/env/lib/python3.7/site-packages (from click->nltk) (4.10.1+computecanada)
Requirement already satisfied: typing-extensions>=3.6.4 in /localscratch/yinan.28285669.0/env/lib/python3.7/site-packages (from importlib-metadata->click->nltk) (4.0.1+computecanada)
Requirement already satisfied: zipp>=0.5 in /localscratch/yinan.28285669.0/env/lib/python3.7/site-packages (from importlib-metadata->click->nltk) (3.7.0+computecanada)
Installing collected packages: nltk
Successfully installed nltk-3.6.3+computecanada
Looking in links: /cvmfs/soft.computecanada.ca/custom/python/wheelhouse/nix/avx2, /cvmfs/soft.computecanada.ca/custom/python/wheelhouse/nix/generic, /cvmfs/soft.computecanada.ca/custom/python/wheelhouse/generic
Processing /cvmfs/soft.computecanada.ca/custom/python/wheelhouse/generic/scikit_learn-0.22.1+computecanada-cp37-cp37m-linux_x86_64.whl
Requirement already satisfied: numpy>=1.11.0 in /cvmfs/soft.computecanada.ca/easybuild/software/2017/Core/scipy-stack/2019a/lib/python3.7/site-packages (from scikit-learn==0.22.1) (1.16.0)
Requirement already satisfied: scipy>=0.17.0 in /localscratch/yinan.28285669.0/env/lib/python3.7/site-packages (from scikit-learn==0.22.1) (1.4.1+computecanada)
Requirement already satisfied: joblib>=0.11 in /localscratch/yinan.28285669.0/env/lib/python3.7/site-packages (from scikit-learn==0.22.1) (1.1.0+computecanada)
Installing collected packages: scikit-learn
Successfully installed scikit-learn-0.22.1+computecanada
Looking in links: /cvmfs/soft.computecanada.ca/custom/python/wheelhouse/nix/avx2, /cvmfs/soft.computecanada.ca/custom/python/wheelhouse/nix/generic, /cvmfs/soft.computecanada.ca/custom/python/wheelhouse/generic
Requirement already satisfied: tokenizers==0.5.2 in /localscratch/yinan.28285669.0/env/lib/python3.7/site-packages (0.5.2+computecanada)
wandb: Appending key for api.wandb.ai to your netrc file: /home/yinan/.netrc
Starting Task
2022-03-05 06:50:25.583726: I tensorflow/stream_executor/platform/default/dso_loader.cc:48] Successfully opened dynamic library libcudart.so.10.1
[nltk_data] Downloading package stopwords to /home/yinan/nltk_data...
[nltk_data]   Package stopwords is already up-to-date!
[nltk_data] Downloading package wordnet to /home/yinan/nltk_data...
[nltk_data]   Package wordnet is already up-to-date!
wandb: Currently logged in as: yinanazhou (use `wandb login --relogin` to force relogin)
wandb: wandb version 0.12.11 is available!  To upgrade, please run:
wandb:  $ pip install wandb --upgrade
2022-03-05 06:50:36.119817: I tensorflow/stream_executor/platform/default/dso_loader.cc:48] Successfully opened dynamic library libcudart.so.10.1
wandb: Tracking run with wandb version 0.12.5
wandb: Syncing run floral-surf-2
wandb: ⭐️ View project at https://wandb.ai/yinanazhou/xl_512_bs_8_lr_1e05_es_20_lc_True_nr_False_stem_False_lemma_False_repeat_1_fold_1
wandb: 🚀 View run at https://wandb.ai/yinanazhou/xl_512_bs_8_lr_1e05_es_20_lc_True_nr_False_stem_False_lemma_False_repeat_1_fold_1/runs/2iglpfqc
wandb: Run data is saved locally in /project/6002780/yinan/Thesis_MER_Lyrics/lyric-emotion/wandb/run-20220305_065034-2iglpfqc
wandb: Run `wandb offline` to turn off syncing.

Validation loss decreased (inf --> 1.245732).  Saving model ...
Validation loss decreased (1.245732 --> 1.119229).  Saving model ...
Validation loss decreased (1.119229 --> 0.969193).  Saving model ...
EarlyStopping counter: 1 out of 20.0
EarlyStopping counter: 2 out of 20.0
EarlyStopping counter: 3 out of 20.0
EarlyStopping counter: 4 out of 20.0
EarlyStopping counter: 5 out of 20.0
EarlyStopping counter: 6 out of 20.0
EarlyStopping counter: 7 out of 20.0
EarlyStopping counter: 8 out of 20.0
EarlyStopping counter: 9 out of 20.0
EarlyStopping counter: 10 out of 20.0
EarlyStopping counter: 11 out of 20.0
EarlyStopping counter: 12 out of 20.0
EarlyStopping counter: 13 out of 20.0
EarlyStopping counter: 14 out of 20.0
EarlyStopping counter: 15 out of 20.0
EarlyStopping counter: 16 out of 20.0
EarlyStopping counter: 17 out of 20.0
EarlyStopping counter: 18 out of 20.0
EarlyStopping counter: 19 out of 20.0
EarlyStopping counter: 20 out of 20.0
/localscratch/yinan.28285669.0/env/lib/python3.7/site-packages/torch/nn/functional.py:1794: UserWarning: nn.functional.tanh is deprecated. Use torch.tanh instead.
  warnings.warn("nn.functional.tanh is deprecated. Use torch.tanh instead.")
/localscratch/yinan.28285669.0/env/lib/python3.7/site-packages/transformers/optimization.py:155: UserWarning: This overload of add_ is deprecated:
	add_(Number alpha, Tensor other)
Consider using one of the following signatures instead:
	add_(Tensor other, *, Number alpha) (Triggered internally at  ../torch/csrc/utils/python_arg_parser.cpp:1025.)
  exp_avg.mul_(beta1).add_(1.0 - beta1, grad)
wandb: Waiting for W&B process to finish, PID 150676... (success).
wandb: - 0.00MB of 0.00MB uploaded (0.00MB deduped)wandb: \ 0.00MB of 0.00MB uploaded (0.00MB deduped)wandb: | 0.00MB of 0.00MB uploaded (0.00MB deduped)wandb: / 0.00MB of 0.00MB uploaded (0.00MB deduped)wandb: - 0.00MB of 0.00MB uploaded (0.00MB deduped)wandb: \ 0.00MB of 0.00MB uploaded (0.00MB deduped)wandb: | 0.00MB of 0.00MB uploaded (0.00MB deduped)wandb: / 0.00MB of 0.00MB uploaded (0.00MB deduped)wandb: - 0.00MB of 0.00MB uploaded (0.00MB deduped)wandb: \ 0.00MB of 0.00MB uploaded (0.00MB deduped)wandb: | 0.00MB of 0.00MB uploaded (0.00MB deduped)wandb: / 0.00MB of 0.00MB uploaded (0.00MB deduped)wandb: - 0.00MB of 0.00MB uploaded (0.00MB deduped)wandb:                                                                                
wandb: Run history:
wandb:     e_F1 ▁▂▆▆▆▆▇▇▇▇▆▆▇▆▆▇▇██████
wandb:   e_loss ▃▂▁▂▁▂▂▃▅▅▆█▅▇██▇▇▇▇▇▇█
wandb:     t_F1 ▁▂▄▄▅▆▇▇▇▇▇▇███████████
wandb:   t_loss █▇▆▅▄▄▃▃▂▂▂▂▂▁▁▁▁▁▁▁▁▁▁
wandb: 
wandb: Run summary:
wandb:     e_F1 60.05246
wandb:   e_loss 1.73387
wandb:     t_F1 100.0
wandb:   t_loss 0.00458
wandb: 
wandb: Synced 4 W&B file(s), 0 media file(s), 0 artifact file(s) and 0 other file(s)
wandb: Synced floral-surf-2: https://wandb.ai/yinanazhou/xl_512_bs_8_lr_1e05_es_20_lc_True_nr_False_stem_False_lemma_False_repeat_1_fold_1/runs/2iglpfqc
wandb: Find logs at: ./wandb/run-20220305_065034-2iglpfqc/logs/debug.log
wandb: 

wandb: wandb version 0.12.11 is available!  To upgrade, please run:
wandb:  $ pip install wandb --upgrade
2022-03-05 07:12:33.049002: I tensorflow/stream_executor/platform/default/dso_loader.cc:48] Successfully opened dynamic library libcudart.so.10.1
wandb: Tracking run with wandb version 0.12.5
wandb: Syncing run polished-serenity-2
wandb: ⭐️ View project at https://wandb.ai/yinanazhou/xl_512_bs_8_lr_1e05_es_20_lc_True_nr_False_stem_False_lemma_False_repeat_1_fold_2
wandb: 🚀 View run at https://wandb.ai/yinanazhou/xl_512_bs_8_lr_1e05_es_20_lc_True_nr_False_stem_False_lemma_False_repeat_1_fold_2/runs/2yio97zx
wandb: Run data is saved locally in /project/6002780/yinan/Thesis_MER_Lyrics/lyric-emotion/wandb/run-20220305_071230-2yio97zx
wandb: Run `wandb offline` to turn off syncing.

Validation loss decreased (inf --> 1.297081).  Saving model ...
Validation loss decreased (1.297081 --> 1.042082).  Saving model ...
Validation loss decreased (1.042082 --> 0.940876).  Saving model ...
EarlyStopping counter: 1 out of 20.0
EarlyStopping counter: 2 out of 20.0
EarlyStopping counter: 3 out of 20.0
EarlyStopping counter: 4 out of 20.0
EarlyStopping counter: 5 out of 20.0
EarlyStopping counter: 6 out of 20.0
EarlyStopping counter: 7 out of 20.0
EarlyStopping counter: 8 out of 20.0
EarlyStopping counter: 9 out of 20.0
EarlyStopping counter: 10 out of 20.0
EarlyStopping counter: 11 out of 20.0
EarlyStopping counter: 12 out of 20.0
EarlyStopping counter: 13 out of 20.0
EarlyStopping counter: 14 out of 20.0
EarlyStopping counter: 15 out of 20.0
EarlyStopping counter: 16 out of 20.0
EarlyStopping counter: 17 out of 20.0
EarlyStopping counter: 18 out of 20.0
EarlyStopping counter: 19 out of 20.0
EarlyStopping counter: 20 out of 20.0
/localscratch/yinan.28285669.0/env/lib/python3.7/site-packages/torch/nn/functional.py:1794: UserWarning: nn.functional.tanh is deprecated. Use torch.tanh instead.
  warnings.warn("nn.functional.tanh is deprecated. Use torch.tanh instead.")
wandb: Waiting for W&B process to finish, PID 151921... (success).
wandb: - 0.00MB of 0.00MB uploaded (0.00MB deduped)wandb: \ 0.00MB of 0.00MB uploaded (0.00MB deduped)wandb: | 0.00MB of 0.00MB uploaded (0.00MB deduped)wandb: / 0.00MB of 0.00MB uploaded (0.00MB deduped)wandb: - 0.00MB of 0.00MB uploaded (0.00MB deduped)wandb:                                                                                
wandb: Run history:
wandb:     e_F1 ▁▄▇▇▇█▇▄▆▇██▆▇██▇▇▇▇▇▇▇
wandb:   e_loss ▃▂▁▁▂▂▃▆▅▅▅▅█▆▆▆▇▇▇▇███
wandb:     t_F1 ▁▃▄▅▇▇█████████████████
wandb:   t_loss █▇▆▄▃▂▂▂▁▁▁▁▁▁▁▁▁▁▁▁▁▁▁
wandb: 
wandb: Run summary:
wandb:     e_F1 59.05512
wandb:   e_loss 2.00882
wandb:     t_F1 100.0
wandb:   t_loss 0.00226
wandb: 
wandb: Synced 4 W&B file(s), 0 media file(s), 0 artifact file(s) and 0 other file(s)
wandb: Synced polished-serenity-2: https://wandb.ai/yinanazhou/xl_512_bs_8_lr_1e05_es_20_lc_True_nr_False_stem_False_lemma_False_repeat_1_fold_2/runs/2yio97zx
wandb: Find logs at: ./wandb/run-20220305_071230-2yio97zx/logs/debug.log
wandb: 

wandb: wandb version 0.12.11 is available!  To upgrade, please run:
wandb:  $ pip install wandb --upgrade
2022-03-05 07:34:13.814210: I tensorflow/stream_executor/platform/default/dso_loader.cc:48] Successfully opened dynamic library libcudart.so.10.1
wandb: Tracking run with wandb version 0.12.5
wandb: Syncing run daily-sea-2
wandb: ⭐️ View project at https://wandb.ai/yinanazhou/xl_512_bs_8_lr_1e05_es_20_lc_True_nr_False_stem_False_lemma_False_repeat_2_fold_1
wandb: 🚀 View run at https://wandb.ai/yinanazhou/xl_512_bs_8_lr_1e05_es_20_lc_True_nr_False_stem_False_lemma_False_repeat_2_fold_1/runs/2lc9l7cz
wandb: Run data is saved locally in /project/6002780/yinan/Thesis_MER_Lyrics/lyric-emotion/wandb/run-20220305_073410-2lc9l7cz
wandb: Run `wandb offline` to turn off syncing.

Validation loss decreased (inf --> 1.231743).  Saving model ...
Validation loss decreased (1.231743 --> 1.010337).  Saving model ...
Validation loss decreased (1.010337 --> 0.999524).  Saving model ...
EarlyStopping counter: 1 out of 20.0
EarlyStopping counter: 2 out of 20.0
EarlyStopping counter: 3 out of 20.0
EarlyStopping counter: 4 out of 20.0
EarlyStopping counter: 5 out of 20.0
EarlyStopping counter: 6 out of 20.0
EarlyStopping counter: 7 out of 20.0
EarlyStopping counter: 8 out of 20.0
EarlyStopping counter: 9 out of 20.0
EarlyStopping counter: 10 out of 20.0
EarlyStopping counter: 11 out of 20.0
EarlyStopping counter: 12 out of 20.0
EarlyStopping counter: 13 out of 20.0
EarlyStopping counter: 14 out of 20.0
EarlyStopping counter: 15 out of 20.0
EarlyStopping counter: 16 out of 20.0
EarlyStopping counter: 17 out of 20.0
EarlyStopping counter: 18 out of 20.0
EarlyStopping counter: 19 out of 20.0
EarlyStopping counter: 20 out of 20.0
/localscratch/yinan.28285669.0/env/lib/python3.7/site-packages/torch/nn/functional.py:1794: UserWarning: nn.functional.tanh is deprecated. Use torch.tanh instead.
  warnings.warn("nn.functional.tanh is deprecated. Use torch.tanh instead.")
wandb: Waiting for W&B process to finish, PID 153097... (success).
wandb: - 0.00MB of 0.00MB uploaded (0.00MB deduped)wandb: \ 0.00MB of 0.00MB uploaded (0.00MB deduped)wandb: | 0.00MB of 0.00MB uploaded (0.00MB deduped)wandb: / 0.00MB of 0.00MB uploaded (0.00MB deduped)wandb: - 0.00MB of 0.00MB uploaded (0.00MB deduped)wandb: \ 0.00MB of 0.00MB uploaded (0.00MB deduped)wandb: | 0.00MB of 0.00MB uploaded (0.00MB deduped)wandb: / 0.00MB of 0.00MB uploaded (0.00MB deduped)wandb: - 0.00MB of 0.00MB uploaded (0.00MB deduped)wandb: \ 0.00MB of 0.00MB uploaded (0.00MB deduped)wandb: | 0.00MB of 0.00MB uploaded (0.00MB deduped)wandb: / 0.00MB of 0.00MB uploaded (0.00MB deduped)wandb: - 0.00MB of 0.00MB uploaded (0.00MB deduped)wandb:                                                                                
wandb: Run history:
wandb:     e_F1 ▁▆▇▇▇██▇▇█▇▆█▆▇▅▇▇▇▇▇▇█
wandb:   e_loss ▂▁▁▁▁▂▂▄▃▄▅▅▅▇▆█▇▇▇▇▇▇▇
wandb:     t_F1 ▁▄▅▆▇▇█████████████████
wandb:   t_loss █▇▅▄▃▂▂▁▂▁▁▁▁▁▁▁▁▁▁▁▁▁▁
wandb: 
wandb: Run summary:
wandb:     e_F1 59.60245
wandb:   e_loss 2.04984
wandb:     t_F1 100.0
wandb:   t_loss 0.00226
wandb: 
wandb: Synced 4 W&B file(s), 0 media file(s), 0 artifact file(s) and 0 other file(s)
wandb: Synced daily-sea-2: https://wandb.ai/yinanazhou/xl_512_bs_8_lr_1e05_es_20_lc_True_nr_False_stem_False_lemma_False_repeat_2_fold_1/runs/2lc9l7cz
wandb: Find logs at: ./wandb/run-20220305_073410-2lc9l7cz/logs/debug.log
wandb: 

wandb: wandb version 0.12.11 is available!  To upgrade, please run:
wandb:  $ pip install wandb --upgrade
2022-03-05 07:56:02.676179: I tensorflow/stream_executor/platform/default/dso_loader.cc:48] Successfully opened dynamic library libcudart.so.10.1
wandb: Tracking run with wandb version 0.12.5
wandb: Syncing run frosty-bee-2
wandb: ⭐️ View project at https://wandb.ai/yinanazhou/xl_512_bs_8_lr_1e05_es_20_lc_True_nr_False_stem_False_lemma_False_repeat_2_fold_2
wandb: 🚀 View run at https://wandb.ai/yinanazhou/xl_512_bs_8_lr_1e05_es_20_lc_True_nr_False_stem_False_lemma_False_repeat_2_fold_2/runs/7od0fa9p
wandb: Run data is saved locally in /project/6002780/yinan/Thesis_MER_Lyrics/lyric-emotion/wandb/run-20220305_075559-7od0fa9p
wandb: Run `wandb offline` to turn off syncing.

Validation loss decreased (inf --> 1.205949).  Saving model ...
Validation loss decreased (1.205949 --> 0.962038).  Saving model ...
Validation loss decreased (0.962038 --> 0.884598).  Saving model ...
EarlyStopping counter: 1 out of 20.0
EarlyStopping counter: 2 out of 20.0
EarlyStopping counter: 3 out of 20.0
EarlyStopping counter: 4 out of 20.0
EarlyStopping counter: 5 out of 20.0
EarlyStopping counter: 6 out of 20.0
EarlyStopping counter: 7 out of 20.0
EarlyStopping counter: 8 out of 20.0
EarlyStopping counter: 9 out of 20.0
EarlyStopping counter: 10 out of 20.0
EarlyStopping counter: 11 out of 20.0
EarlyStopping counter: 12 out of 20.0
EarlyStopping counter: 13 out of 20.0
EarlyStopping counter: 14 out of 20.0
EarlyStopping counter: 15 out of 20.0
EarlyStopping counter: 16 out of 20.0
EarlyStopping counter: 17 out of 20.0
EarlyStopping counter: 18 out of 20.0
EarlyStopping counter: 19 out of 20.0
EarlyStopping counter: 20 out of 20.0
/localscratch/yinan.28285669.0/env/lib/python3.7/site-packages/torch/nn/functional.py:1794: UserWarning: nn.functional.tanh is deprecated. Use torch.tanh instead.
  warnings.warn("nn.functional.tanh is deprecated. Use torch.tanh instead.")
wandb: Waiting for W&B process to finish, PID 154302... (success).
wandb: - 0.00MB of 0.00MB uploaded (0.00MB deduped)wandb: \ 0.00MB of 0.00MB uploaded (0.00MB deduped)wandb: | 0.00MB of 0.00MB uploaded (0.00MB deduped)wandb: / 0.00MB of 0.00MB uploaded (0.00MB deduped)wandb: - 0.00MB of 0.00MB uploaded (0.00MB deduped)wandb: \ 0.00MB of 0.00MB uploaded (0.00MB deduped)wandb: | 0.00MB of 0.00MB uploaded (0.00MB deduped)wandb: / 0.00MB of 0.00MB uploaded (0.00MB deduped)wandb: - 0.00MB of 0.00MB uploaded (0.00MB deduped)wandb: \ 0.00MB of 0.00MB uploaded (0.00MB deduped)wandb: | 0.00MB of 0.00MB uploaded (0.00MB deduped)wandb: / 0.00MB of 0.00MB uploaded (0.00MB deduped)wandb: - 0.00MB of 0.00MB uploaded (0.00MB deduped)wandb:                                                                                
wandb: Run history:
wandb:     e_F1 ▁▆██▆▂▅▅▂▅▄▅▆▅▅▅▅▅▄▄▄▄▄
wandb:   e_loss ▃▁▁▁▂▃▃▄▅▄▅▆▆▆▇▇▇▇▇▇███
wandb:     t_F1 ▁▃▄▆▆▇▇▇▇██████████████
wandb:   t_loss █▇▅▄▃▃▃▂▂▂▁▁▁▁▁▁▁▁▁▁▁▁▁
wandb: 
wandb: Run summary:
wandb:     e_F1 58.6085
wandb:   e_loss 1.99067
wandb:     t_F1 100.0
wandb:   t_loss 0.00231
wandb: 
wandb: Synced 4 W&B file(s), 0 media file(s), 0 artifact file(s) and 0 other file(s)
wandb: Synced frosty-bee-2: https://wandb.ai/yinanazhou/xl_512_bs_8_lr_1e05_es_20_lc_True_nr_False_stem_False_lemma_False_repeat_2_fold_2/runs/7od0fa9p
wandb: Find logs at: ./wandb/run-20220305_075559-7od0fa9p/logs/debug.log
wandb: 

wandb: wandb version 0.12.11 is available!  To upgrade, please run:
wandb:  $ pip install wandb --upgrade
2022-03-05 08:17:50.041142: I tensorflow/stream_executor/platform/default/dso_loader.cc:48] Successfully opened dynamic library libcudart.so.10.1
wandb: Tracking run with wandb version 0.12.5
wandb: Syncing run young-night-2
wandb: ⭐️ View project at https://wandb.ai/yinanazhou/xl_512_bs_8_lr_1e05_es_20_lc_True_nr_False_stem_False_lemma_False_repeat_3_fold_1
wandb: 🚀 View run at https://wandb.ai/yinanazhou/xl_512_bs_8_lr_1e05_es_20_lc_True_nr_False_stem_False_lemma_False_repeat_3_fold_1/runs/17g2xmir
wandb: Run data is saved locally in /project/6002780/yinan/Thesis_MER_Lyrics/lyric-emotion/wandb/run-20220305_081746-17g2xmir
wandb: Run `wandb offline` to turn off syncing.

Validation loss decreased (inf --> 1.229590).  Saving model ...
Validation loss decreased (1.229590 --> 1.071029).  Saving model ...
Validation loss decreased (1.071029 --> 0.980392).  Saving model ...
Validation loss decreased (0.980392 --> 0.916212).  Saving model ...
EarlyStopping counter: 1 out of 20.0
EarlyStopping counter: 2 out of 20.0
EarlyStopping counter: 3 out of 20.0
EarlyStopping counter: 4 out of 20.0
EarlyStopping counter: 5 out of 20.0
EarlyStopping counter: 6 out of 20.0
EarlyStopping counter: 7 out of 20.0
EarlyStopping counter: 8 out of 20.0
EarlyStopping counter: 9 out of 20.0
EarlyStopping counter: 10 out of 20.0
EarlyStopping counter: 11 out of 20.0
EarlyStopping counter: 12 out of 20.0
EarlyStopping counter: 13 out of 20.0
EarlyStopping counter: 14 out of 20.0
EarlyStopping counter: 15 out of 20.0
EarlyStopping counter: 16 out of 20.0
EarlyStopping counter: 17 out of 20.0
EarlyStopping counter: 18 out of 20.0
EarlyStopping counter: 19 out of 20.0
EarlyStopping counter: 20 out of 20.0
/localscratch/yinan.28285669.0/env/lib/python3.7/site-packages/torch/nn/functional.py:1794: UserWarning: nn.functional.tanh is deprecated. Use torch.tanh instead.
  warnings.warn("nn.functional.tanh is deprecated. Use torch.tanh instead.")
wandb: Waiting for W&B process to finish, PID 155516... (success).
wandb: - 0.00MB of 0.00MB uploaded (0.00MB deduped)wandb: \ 0.00MB of 0.00MB uploaded (0.00MB deduped)wandb: | 0.00MB of 0.00MB uploaded (0.00MB deduped)wandb: / 0.00MB of 0.00MB uploaded (0.00MB deduped)wandb: - 0.00MB of 0.00MB uploaded (0.00MB deduped)wandb: \ 0.00MB of 0.00MB uploaded (0.00MB deduped)wandb: | 0.00MB of 0.00MB uploaded (0.00MB deduped)wandb: / 0.00MB of 0.00MB uploaded (0.00MB deduped)wandb: - 0.00MB of 0.00MB uploaded (0.00MB deduped)wandb: \ 0.00MB of 0.00MB uploaded (0.00MB deduped)wandb: | 0.00MB of 0.00MB uploaded (0.00MB deduped)wandb: / 0.00MB of 0.00MB uploaded (0.00MB deduped)wandb:                                                                                
wandb: Run history:
wandb:     e_F1 ▁▄▇██▇▆▅▆▆▆▆▆█▇▇▇█▇▇█▇██
wandb:   e_loss ▄▂▂▁▂▂▄▄▆▆▆▆▆▆▆▇▇▇▇▇████
wandb:     t_F1 ▁▂▄▅▅▆▇▇▇███████████████
wandb:   t_loss █▇▆▅▄▃▃▂▂▂▁▁▁▁▁▁▁▁▁▁▁▁▁▁
wandb: 
wandb: Run summary:
wandb:     e_F1 60.41795
wandb:   e_loss 1.7384
wandb:     t_F1 100.0
wandb:   t_loss 0.00259
wandb: 
wandb: Synced 4 W&B file(s), 0 media file(s), 0 artifact file(s) and 0 other file(s)
wandb: Synced young-night-2: https://wandb.ai/yinanazhou/xl_512_bs_8_lr_1e05_es_20_lc_True_nr_False_stem_False_lemma_False_repeat_3_fold_1/runs/17g2xmir
wandb: Find logs at: ./wandb/run-20220305_081746-17g2xmir/logs/debug.log
wandb: 

wandb: wandb version 0.12.11 is available!  To upgrade, please run:
wandb:  $ pip install wandb --upgrade
2022-03-05 08:40:38.236838: I tensorflow/stream_executor/platform/default/dso_loader.cc:48] Successfully opened dynamic library libcudart.so.10.1
wandb: Tracking run with wandb version 0.12.5
wandb: Syncing run stellar-shape-2
wandb: ⭐️ View project at https://wandb.ai/yinanazhou/xl_512_bs_8_lr_1e05_es_20_lc_True_nr_False_stem_False_lemma_False_repeat_3_fold_2
wandb: 🚀 View run at https://wandb.ai/yinanazhou/xl_512_bs_8_lr_1e05_es_20_lc_True_nr_False_stem_False_lemma_False_repeat_3_fold_2/runs/ugakowh5
wandb: Run data is saved locally in /project/6002780/yinan/Thesis_MER_Lyrics/lyric-emotion/wandb/run-20220305_084035-ugakowh5
wandb: Run `wandb offline` to turn off syncing.

Validation loss decreased (inf --> 1.232828).  Saving model ...
Validation loss decreased (1.232828 --> 0.994288).  Saving model ...
Validation loss decreased (0.994288 --> 0.953815).  Saving model ...
Validation loss decreased (0.953815 --> 0.943438).  Saving model ...
EarlyStopping counter: 1 out of 20.0
EarlyStopping counter: 2 out of 20.0
EarlyStopping counter: 3 out of 20.0
EarlyStopping counter: 4 out of 20.0
EarlyStopping counter: 5 out of 20.0
EarlyStopping counter: 6 out of 20.0
EarlyStopping counter: 7 out of 20.0
EarlyStopping counter: 8 out of 20.0
EarlyStopping counter: 9 out of 20.0
EarlyStopping counter: 10 out of 20.0
EarlyStopping counter: 11 out of 20.0
EarlyStopping counter: 12 out of 20.0
EarlyStopping counter: 13 out of 20.0
EarlyStopping counter: 14 out of 20.0
EarlyStopping counter: 15 out of 20.0
EarlyStopping counter: 16 out of 20.0
EarlyStopping counter: 17 out of 20.0
EarlyStopping counter: 18 out of 20.0
EarlyStopping counter: 19 out of 20.0
EarlyStopping counter: 20 out of 20.0
/localscratch/yinan.28285669.0/env/lib/python3.7/site-packages/torch/nn/functional.py:1794: UserWarning: nn.functional.tanh is deprecated. Use torch.tanh instead.
  warnings.warn("nn.functional.tanh is deprecated. Use torch.tanh instead.")
wandb: Waiting for W&B process to finish, PID 156771... (success).
wandb: - 0.00MB of 0.00MB uploaded (0.00MB deduped)wandb: \ 0.00MB of 0.00MB uploaded (0.00MB deduped)wandb: | 0.00MB of 0.00MB uploaded (0.00MB deduped)wandb: / 0.00MB of 0.00MB uploaded (0.00MB deduped)wandb: - 0.00MB of 0.00MB uploaded (0.00MB deduped)wandb: \ 0.00MB of 0.00MB uploaded (0.00MB deduped)wandb: | 0.00MB of 0.00MB uploaded (0.00MB deduped)wandb: / 0.00MB of 0.00MB uploaded (0.00MB deduped)wandb: - 0.00MB of 0.00MB uploaded (0.00MB deduped)wandb: \ 0.00MB of 0.00MB uploaded (0.00MB deduped)wandb: | 0.00MB of 0.00MB uploaded (0.00MB deduped)wandb: / 0.00MB of 0.00MB uploaded (0.00MB deduped)wandb: - 0.00MB of 0.00MB uploaded (0.00MB deduped)wandb:                                                                                
wandb: Run history:
wandb:     e_F1 ▁▆▇▇███▆▆▅▅▄▄▆▆▇▆▇▇▇▇▆▆▆
wandb:   e_loss ▃▁▁▁▁▂▂▅▅▅▇▇▇▆▅▆▆▇▇▇▇▇██
wandb:     t_F1 ▁▃▄▅▆▇▇▇▇█▇▇████████████
wandb:   t_loss █▇▆▅▄▃▃▂▂▂▂▂▂▂▁▁▁▁▁▁▁▁▁▁
wandb: 
wandb: Run summary:
wandb:     e_F1 58.19803
wandb:   e_loss 1.9076
wandb:     t_F1 100.0
wandb:   t_loss 0.00379
wandb: 
wandb: Synced 4 W&B file(s), 0 media file(s), 0 artifact file(s) and 0 other file(s)
wandb: Synced stellar-shape-2: https://wandb.ai/yinanazhou/xl_512_bs_8_lr_1e05_es_20_lc_True_nr_False_stem_False_lemma_False_repeat_3_fold_2/runs/ugakowh5
wandb: Find logs at: ./wandb/run-20220305_084035-ugakowh5/logs/debug.log
wandb: 

wandb: wandb version 0.12.11 is available!  To upgrade, please run:
wandb:  $ pip install wandb --upgrade
2022-03-05 09:03:30.636426: I tensorflow/stream_executor/platform/default/dso_loader.cc:48] Successfully opened dynamic library libcudart.so.10.1
wandb: Tracking run with wandb version 0.12.5
wandb: Syncing run upbeat-morning-2
wandb: ⭐️ View project at https://wandb.ai/yinanazhou/xl_512_bs_8_lr_1e05_es_20_lc_True_nr_False_stem_False_lemma_False_repeat_4_fold_1
wandb: 🚀 View run at https://wandb.ai/yinanazhou/xl_512_bs_8_lr_1e05_es_20_lc_True_nr_False_stem_False_lemma_False_repeat_4_fold_1/runs/2ixovxio
wandb: Run data is saved locally in /project/6002780/yinan/Thesis_MER_Lyrics/lyric-emotion/wandb/run-20220305_090327-2ixovxio
wandb: Run `wandb offline` to turn off syncing.

Validation loss decreased (inf --> 1.226327).  Saving model ...
Validation loss decreased (1.226327 --> 0.980766).  Saving model ...
Validation loss decreased (0.980766 --> 0.887446).  Saving model ...
EarlyStopping counter: 1 out of 20.0
EarlyStopping counter: 2 out of 20.0
EarlyStopping counter: 3 out of 20.0
EarlyStopping counter: 4 out of 20.0
EarlyStopping counter: 5 out of 20.0
EarlyStopping counter: 6 out of 20.0
EarlyStopping counter: 7 out of 20.0
EarlyStopping counter: 8 out of 20.0
EarlyStopping counter: 9 out of 20.0
EarlyStopping counter: 10 out of 20.0
EarlyStopping counter: 11 out of 20.0
EarlyStopping counter: 12 out of 20.0
EarlyStopping counter: 13 out of 20.0
EarlyStopping counter: 14 out of 20.0
EarlyStopping counter: 15 out of 20.0
EarlyStopping counter: 16 out of 20.0
EarlyStopping counter: 17 out of 20.0
EarlyStopping counter: 18 out of 20.0
EarlyStopping counter: 19 out of 20.0
EarlyStopping counter: 20 out of 20.0
/localscratch/yinan.28285669.0/env/lib/python3.7/site-packages/torch/nn/functional.py:1794: UserWarning: nn.functional.tanh is deprecated. Use torch.tanh instead.
  warnings.warn("nn.functional.tanh is deprecated. Use torch.tanh instead.")
wandb: Waiting for W&B process to finish, PID 158038... (success).
wandb: - 0.00MB of 0.00MB uploaded (0.00MB deduped)wandb: \ 0.00MB of 0.00MB uploaded (0.00MB deduped)wandb: | 0.00MB of 0.00MB uploaded (0.00MB deduped)wandb: / 0.00MB of 0.00MB uploaded (0.00MB deduped)wandb: - 0.00MB of 0.00MB uploaded (0.00MB deduped)wandb: \ 0.00MB of 0.00MB uploaded (0.00MB deduped)wandb: | 0.00MB of 0.00MB uploaded (0.00MB deduped)wandb: / 0.00MB of 0.00MB uploaded (0.00MB deduped)wandb: - 0.00MB of 0.00MB uploaded (0.00MB deduped)wandb: \ 0.00MB of 0.00MB uploaded (0.00MB deduped)wandb: | 0.00MB of 0.00MB uploaded (0.00MB deduped)wandb: / 0.00MB of 0.00MB uploaded (0.00MB deduped)wandb: - 0.00MB of 0.00MB uploaded (0.00MB deduped)wandb:                                                                                
wandb: Run history:
wandb:     e_F1 ▁▃▇▆▆▆▁▅▆▇█▇▇▇▇▇████▇██
wandb:   e_loss ▃▂▁▁▂▃▆▅▄▅▅▆▆▇▇▇▇▇▇████
wandb:     t_F1 ▁▃▄▆▆▇▇▇███████████████
wandb:   t_loss █▇▆▄▃▂▂▂▂▁▁▁▁▁▁▁▁▁▁▁▁▁▁
wandb: 
wandb: Run summary:
wandb:     e_F1 62.90122
wandb:   e_loss 1.92908
wandb:     t_F1 100.0
wandb:   t_loss 0.00225
wandb: 
wandb: Synced 4 W&B file(s), 0 media file(s), 0 artifact file(s) and 0 other file(s)
wandb: Synced upbeat-morning-2: https://wandb.ai/yinanazhou/xl_512_bs_8_lr_1e05_es_20_lc_True_nr_False_stem_False_lemma_False_repeat_4_fold_1/runs/2ixovxio
wandb: Find logs at: ./wandb/run-20220305_090327-2ixovxio/logs/debug.log
wandb: 

wandb: wandb version 0.12.11 is available!  To upgrade, please run:
wandb:  $ pip install wandb --upgrade
2022-03-05 09:25:22.178078: I tensorflow/stream_executor/platform/default/dso_loader.cc:48] Successfully opened dynamic library libcudart.so.10.1
wandb: Tracking run with wandb version 0.12.5
wandb: Syncing run effortless-forest-2
wandb: ⭐️ View project at https://wandb.ai/yinanazhou/xl_512_bs_8_lr_1e05_es_20_lc_True_nr_False_stem_False_lemma_False_repeat_4_fold_2
wandb: 🚀 View run at https://wandb.ai/yinanazhou/xl_512_bs_8_lr_1e05_es_20_lc_True_nr_False_stem_False_lemma_False_repeat_4_fold_2/runs/18bcc50w
wandb: Run data is saved locally in /project/6002780/yinan/Thesis_MER_Lyrics/lyric-emotion/wandb/run-20220305_092519-18bcc50w
wandb: Run `wandb offline` to turn off syncing.

Validation loss decreased (inf --> 1.255362).  Saving model ...
Validation loss decreased (1.255362 --> 1.152036).  Saving model ...
Validation loss decreased (1.152036 --> 1.021888).  Saving model ...
Validation loss decreased (1.021888 --> 1.008971).  Saving model ...
Validation loss decreased (1.008971 --> 1.001143).  Saving model ...
EarlyStopping counter: 1 out of 20.0
EarlyStopping counter: 2 out of 20.0
EarlyStopping counter: 3 out of 20.0
EarlyStopping counter: 4 out of 20.0
EarlyStopping counter: 5 out of 20.0
EarlyStopping counter: 6 out of 20.0
EarlyStopping counter: 7 out of 20.0
EarlyStopping counter: 8 out of 20.0
EarlyStopping counter: 9 out of 20.0
EarlyStopping counter: 10 out of 20.0
EarlyStopping counter: 11 out of 20.0
EarlyStopping counter: 12 out of 20.0
EarlyStopping counter: 13 out of 20.0
EarlyStopping counter: 14 out of 20.0
EarlyStopping counter: 15 out of 20.0
EarlyStopping counter: 16 out of 20.0
EarlyStopping counter: 17 out of 20.0
EarlyStopping counter: 18 out of 20.0
EarlyStopping counter: 19 out of 20.0
EarlyStopping counter: 20 out of 20.0
/localscratch/yinan.28285669.0/env/lib/python3.7/site-packages/torch/nn/functional.py:1794: UserWarning: nn.functional.tanh is deprecated. Use torch.tanh instead.
  warnings.warn("nn.functional.tanh is deprecated. Use torch.tanh instead.")
wandb: Waiting for W&B process to finish, PID 159217... (success).
wandb: - 0.00MB of 0.00MB uploaded (0.00MB deduped)wandb: \ 0.00MB of 0.00MB uploaded (0.00MB deduped)wandb: | 0.00MB of 0.00MB uploaded (0.00MB deduped)wandb: / 0.00MB of 0.00MB uploaded (0.00MB deduped)wandb: - 0.00MB of 0.00MB uploaded (0.00MB deduped)wandb: \ 0.00MB of 0.00MB uploaded (0.00MB deduped)wandb: | 0.00MB of 0.00MB uploaded (0.00MB deduped)wandb: / 0.00MB of 0.00MB uploaded (0.00MB deduped)wandb: - 0.00MB of 0.00MB uploaded (0.00MB deduped)wandb: \ 0.00MB of 0.00MB uploaded (0.00MB deduped)wandb: | 0.00MB of 0.00MB uploaded (0.00MB deduped)wandb: / 0.00MB of 0.00MB uploaded (0.00MB deduped)wandb:                                                                                
wandb: Run history:
wandb:     e_F1 ▁▃▅▇█▇████▇▄▆▇▇██▇▇█▇▇▇▇█
wandb:   e_loss ▃▂▁▁▁▁▂▂▃▄▄█▆▆▆▆▆▇▇▇▇████
wandb:     t_F1 ▁▂▄▄▆▆▇▇█████████████████
wandb:   t_loss █▇▆▅▄▃▃▂▂▂▁▁▁▁▁▁▁▁▁▁▁▁▁▁▁
wandb: 
wandb: Run summary:
wandb:     e_F1 60.70742
wandb:   e_loss 2.06273
wandb:     t_F1 100.0
wandb:   t_loss 0.00228
wandb: 
wandb: Synced 4 W&B file(s), 0 media file(s), 0 artifact file(s) and 0 other file(s)
wandb: Synced effortless-forest-2: https://wandb.ai/yinanazhou/xl_512_bs_8_lr_1e05_es_20_lc_True_nr_False_stem_False_lemma_False_repeat_4_fold_2/runs/18bcc50w
wandb: Find logs at: ./wandb/run-20220305_092519-18bcc50w/logs/debug.log
wandb: 

wandb: wandb version 0.12.11 is available!  To upgrade, please run:
wandb:  $ pip install wandb --upgrade
2022-03-05 09:49:03.161858: I tensorflow/stream_executor/platform/default/dso_loader.cc:48] Successfully opened dynamic library libcudart.so.10.1
wandb: Tracking run with wandb version 0.12.5
wandb: Syncing run peachy-bush-2
wandb: ⭐️ View project at https://wandb.ai/yinanazhou/xl_512_bs_8_lr_1e05_es_20_lc_True_nr_False_stem_False_lemma_False_repeat_5_fold_1
wandb: 🚀 View run at https://wandb.ai/yinanazhou/xl_512_bs_8_lr_1e05_es_20_lc_True_nr_False_stem_False_lemma_False_repeat_5_fold_1/runs/35nwboci
wandb: Run data is saved locally in /project/6002780/yinan/Thesis_MER_Lyrics/lyric-emotion/wandb/run-20220305_094900-35nwboci
wandb: Run `wandb offline` to turn off syncing.

Validation loss decreased (inf --> 1.397805).  Saving model ...
Validation loss decreased (1.397805 --> 1.393511).  Saving model ...
Validation loss decreased (1.393511 --> 1.353194).  Saving model ...
EarlyStopping counter: 1 out of 20.0
Validation loss decreased (1.353194 --> 1.348196).  Saving model ...
Validation loss decreased (1.348196 --> 1.332407).  Saving model ...
EarlyStopping counter: 1 out of 20.0
Validation loss decreased (1.332407 --> 1.319975).  Saving model ...
Validation loss decreased (1.319975 --> 1.298337).  Saving model ...
Validation loss decreased (1.298337 --> 1.251851).  Saving model ...
Validation loss decreased (1.251851 --> 1.080399).  Saving model ...
EarlyStopping counter: 1 out of 20.0
Validation loss decreased (1.080399 --> 0.940360).  Saving model ...
EarlyStopping counter: 1 out of 20.0
EarlyStopping counter: 2 out of 20.0
EarlyStopping counter: 3 out of 20.0
EarlyStopping counter: 4 out of 20.0
EarlyStopping counter: 5 out of 20.0
EarlyStopping counter: 6 out of 20.0
EarlyStopping counter: 7 out of 20.0
EarlyStopping counter: 8 out of 20.0
EarlyStopping counter: 9 out of 20.0
EarlyStopping counter: 10 out of 20.0
EarlyStopping counter: 11 out of 20.0
EarlyStopping counter: 12 out of 20.0
EarlyStopping counter: 13 out of 20.0
EarlyStopping counter: 14 out of 20.0
EarlyStopping counter: 15 out of 20.0
EarlyStopping counter: 16 out of 20.0
EarlyStopping counter: 17 out of 20.0
EarlyStopping counter: 18 out of 20.0
EarlyStopping counter: 19 out of 20.0
EarlyStopping counter: 20 out of 20.0
/localscratch/yinan.28285669.0/env/lib/python3.7/site-packages/torch/nn/functional.py:1794: UserWarning: nn.functional.tanh is deprecated. Use torch.tanh instead.
  warnings.warn("nn.functional.tanh is deprecated. Use torch.tanh instead.")
wandb: Waiting for W&B process to finish, PID 160507... (success).
wandb: - 0.00MB of 0.00MB uploaded (0.00MB deduped)wandb: \ 0.00MB of 0.00MB uploaded (0.00MB deduped)wandb: | 0.00MB of 0.00MB uploaded (0.00MB deduped)wandb: / 0.00MB of 0.00MB uploaded (0.00MB deduped)wandb: - 0.00MB of 0.00MB uploaded (0.00MB deduped)wandb: \ 0.00MB of 0.00MB uploaded (0.00MB deduped)wandb: | 0.00MB of 0.00MB uploaded (0.00MB deduped)wandb: / 0.00MB of 0.00MB uploaded (0.00MB deduped)wandb: - 0.00MB of 0.00MB uploaded (0.00MB deduped)wandb: \ 0.00MB of 0.00MB uploaded (0.00MB deduped)wandb: | 0.00MB of 0.00MB uploaded (0.00MB deduped)wandb: / 0.00MB of 0.00MB uploaded (0.00MB deduped)wandb: - 0.00MB of 0.00MB uploaded (0.00MB deduped)wandb:                                                                                
wandb: Run history:
wandb:     e_F1 ▃▁▂▁▂▂▂▄▅▅▆▇██▇▇▇██▇█▇███████████
wandb:   e_loss ▄▄▄▄▄▃▄▃▃▃▂▂▁▂▄▅▄▄▅▆▆▇▆█▇▆▇▇█████
wandb:     t_F1 ▂▁▁▁▁▂▂▂▂▃▃▄▅▆▇▇▇████████████████
wandb:   t_loss █████████▇▇▆▅▄▃▃▂▂▁▁▁▁▁▁▁▁▁▁▁▁▁▁▁
wandb: 
wandb: Run summary:
wandb:     e_F1 58.82715
wandb:   e_loss 2.03759
wandb:     t_F1 100.0
wandb:   t_loss 0.00213
wandb: 
wandb: Synced 4 W&B file(s), 0 media file(s), 0 artifact file(s) and 0 other file(s)
wandb: Synced peachy-bush-2: https://wandb.ai/yinanazhou/xl_512_bs_8_lr_1e05_es_20_lc_True_nr_False_stem_False_lemma_False_repeat_5_fold_1/runs/35nwboci
wandb: Find logs at: ./wandb/run-20220305_094900-35nwboci/logs/debug.log
wandb: 

wandb: wandb version 0.12.11 is available!  To upgrade, please run:
wandb:  $ pip install wandb --upgrade
2022-03-05 10:20:19.909323: I tensorflow/stream_executor/platform/default/dso_loader.cc:48] Successfully opened dynamic library libcudart.so.10.1
wandb: Tracking run with wandb version 0.12.5
wandb: Syncing run sweet-pond-2
wandb: ⭐️ View project at https://wandb.ai/yinanazhou/xl_512_bs_8_lr_1e05_es_20_lc_True_nr_False_stem_False_lemma_False_repeat_5_fold_2
wandb: 🚀 View run at https://wandb.ai/yinanazhou/xl_512_bs_8_lr_1e05_es_20_lc_True_nr_False_stem_False_lemma_False_repeat_5_fold_2/runs/1yl10i3x
wandb: Run data is saved locally in /project/6002780/yinan/Thesis_MER_Lyrics/lyric-emotion/wandb/run-20220305_102017-1yl10i3x
wandb: Run `wandb offline` to turn off syncing.

Validation loss decreased (inf --> 1.206903).  Saving model ...
Validation loss decreased (1.206903 --> 0.992570).  Saving model ...
Validation loss decreased (0.992570 --> 0.969198).  Saving model ...
EarlyStopping counter: 1 out of 20.0
Validation loss decreased (0.969198 --> 0.952449).  Saving model ...
EarlyStopping counter: 1 out of 20.0
EarlyStopping counter: 2 out of 20.0
EarlyStopping counter: 3 out of 20.0
EarlyStopping counter: 4 out of 20.0
EarlyStopping counter: 5 out of 20.0
EarlyStopping counter: 6 out of 20.0
EarlyStopping counter: 7 out of 20.0
EarlyStopping counter: 8 out of 20.0
EarlyStopping counter: 9 out of 20.0
EarlyStopping counter: 10 out of 20.0
EarlyStopping counter: 11 out of 20.0
EarlyStopping counter: 12 out of 20.0
EarlyStopping counter: 13 out of 20.0
EarlyStopping counter: 14 out of 20.0
EarlyStopping counter: 15 out of 20.0
EarlyStopping counter: 16 out of 20.0
EarlyStopping counter: 17 out of 20.0
EarlyStopping counter: 18 out of 20.0
EarlyStopping counter: 19 out of 20.0
EarlyStopping counter: 20 out of 20.0
/localscratch/yinan.28285669.0/env/lib/python3.7/site-packages/torch/nn/functional.py:1794: UserWarning: nn.functional.tanh is deprecated. Use torch.tanh instead.
  warnings.warn("nn.functional.tanh is deprecated. Use torch.tanh instead.")
wandb: Waiting for W&B process to finish, PID 162233... (success).
wandb: - 0.00MB of 0.00MB uploaded (0.00MB deduped)wandb: \ 0.00MB of 0.00MB uploaded (0.00MB deduped)wandb: | 0.00MB of 0.00MB uploaded (0.00MB deduped)wandb: / 0.00MB of 0.00MB uploaded (0.00MB deduped)wandb: - 0.00MB of 0.00MB uploaded (0.00MB deduped)wandb:                                                                                
wandb: Run history:
wandb:     e_F1 ▂▅▆▆█▇▇█▅▇▃▂▁▅▅▅█▇▆█▇▇▇▇▇
wandb:   e_loss ▂▁▁▁▁▂▂▂▅▄▇██▆▅▇▄▅▅▅▅▅▅▅▆
wandb:     t_F1 ▁▃▅▆▆▇███████████████████
wandb:   t_loss █▇▅▄▃▂▂▂▁▂▁▁▂▂▁▁▁▁▁▁▁▁▁▁▁
wandb: 
wandb: Run summary:
wandb:     e_F1 59.7344
wandb:   e_loss 1.87858
wandb:     t_F1 100.0
wandb:   t_loss 0.00201
wandb: 
wandb: Synced 4 W&B file(s), 0 media file(s), 0 artifact file(s) and 0 other file(s)
wandb: Synced sweet-pond-2: https://wandb.ai/yinanazhou/xl_512_bs_8_lr_1e05_es_20_lc_True_nr_False_stem_False_lemma_False_repeat_5_fold_2/runs/1yl10i3x
wandb: Find logs at: ./wandb/run-20220305_102017-1yl10i3x/logs/debug.log
wandb: 

