Unloading StdEnv/2020

Due to MODULEPATH changes, the following have been reloaded:
  1) mii/1.1.1


The following have been reloaded with a version change:
  1) python/3.8.2 => python/3.7.4

Using base prefix '/cvmfs/soft.computecanada.ca/easybuild/software/2017/Core/python/3.7.4'
New python executable in /localscratch/yinan.28735479.0/env/bin/python
Installing setuptools, pip, wheel...
done.
Ignoring pip: markers 'python_version < "3"' don't match your environment
Looking in links: /cvmfs/soft.computecanada.ca/custom/python/wheelhouse/nix/avx2, /cvmfs/soft.computecanada.ca/custom/python/wheelhouse/nix/generic, /cvmfs/soft.computecanada.ca/custom/python/wheelhouse/generic
Collecting pip
Installing collected packages: pip
  Found existing installation: pip 19.1.1
    Uninstalling pip-19.1.1:
      Successfully uninstalled pip-19.1.1
Successfully installed pip-21.2.3+computecanada
Looking in links: /cvmfs/soft.computecanada.ca/custom/python/wheelhouse/nix/avx2, /cvmfs/soft.computecanada.ca/custom/python/wheelhouse/nix/generic, /cvmfs/soft.computecanada.ca/custom/python/wheelhouse/generic
Processing /cvmfs/soft.computecanada.ca/custom/python/wheelhouse/generic/keras-2.8.0+computecanada-py2.py3-none-any.whl
Processing /cvmfs/soft.computecanada.ca/custom/python/wheelhouse/generic/Keras_Preprocessing-1.1.2+computecanada-py3-none-any.whl
Requirement already satisfied: matplotlib in /cvmfs/soft.computecanada.ca/easybuild/software/2017/Core/scipy-stack/2019a/lib/python3.7/site-packages (from -r requirements.txt (line 3)) (3.0.2)
Processing /cvmfs/soft.computecanada.ca/custom/python/wheelhouse/generic/nltk-3.6.5+computecanada-py3-none-any.whl
Processing /cvmfs/soft.computecanada.ca/custom/python/wheelhouse/generic/scikit_learn-0.22.1+computecanada-cp37-cp37m-linux_x86_64.whl
Processing /cvmfs/soft.computecanada.ca/custom/python/wheelhouse/generic/tensorboard-2.3.0+computecanada-py3-none-any.whl
Processing /cvmfs/soft.computecanada.ca/custom/python/wheelhouse/generic/tensorboard_plugin_wit-1.7.0+computecanada-py3-none-any.whl
Processing /cvmfs/soft.computecanada.ca/custom/python/wheelhouse/generic/tensorflow_gpu-2.3.0+computecanada-cp37-cp37m-linux_x86_64.whl
Processing /cvmfs/soft.computecanada.ca/custom/python/wheelhouse/generic/tensorflow_estimator-2.3.0+computecanada-py2.py3-none-any.whl
Processing /cvmfs/soft.computecanada.ca/custom/python/wheelhouse/generic/tokenizers-0.5.2+computecanada-cp37-cp37m-linux_x86_64.whl
Processing /cvmfs/soft.computecanada.ca/custom/python/wheelhouse/nix/avx2/torch-1.4.0+computecanada-cp37-cp37m-linux_x86_64.whl
Processing /cvmfs/soft.computecanada.ca/custom/python/wheelhouse/generic/torchtext-0.6.0+computecanada-py3-none-any.whl
Processing /cvmfs/soft.computecanada.ca/custom/python/wheelhouse/generic/torchvision-0.8.2+computecanada-cp37-cp37m-linux_x86_64.whl
Processing /cvmfs/soft.computecanada.ca/custom/python/wheelhouse/generic/transformers-2.5.1+computecanada-py3-none-any.whl
Processing /cvmfs/soft.computecanada.ca/custom/python/wheelhouse/generic/urllib3-1.26.7+computecanada-py2.py3-none-any.whl
Processing /cvmfs/soft.computecanada.ca/custom/python/wheelhouse/generic/click-8.0.3+computecanada-py3-none-any.whl
ERROR: Could not find a version that satisfies the requirement regex>=2021.8.3 (from nltk) (from versions: 2018.1.10+computecanada, 2019.11.1+computecanada, 2020.11.13+computecanada)
ERROR: No matching distribution found for regex>=2021.8.3
Looking in links: /cvmfs/soft.computecanada.ca/custom/python/wheelhouse/nix/avx2, /cvmfs/soft.computecanada.ca/custom/python/wheelhouse/nix/generic, /cvmfs/soft.computecanada.ca/custom/python/wheelhouse/generic
ERROR: Could not find a version that satisfies the requirement numpy==1.20.0+computacanada (from versions: 1.15.0+computecanada, 1.15.2+computecanada, 1.15.4+computecanada, 1.16.0+computecanada, 1.16.2+computecanada, 1.16.3+computecanada, 1.17.4+computecanada, 1.18.1+computecanada, 1.18.4+computecanada, 1.19.1+computecanada, 1.19.2+computecanada, 1.20.2+computecanada)
ERROR: No matching distribution found for numpy==1.20.0+computacanada
Looking in links: /cvmfs/soft.computecanada.ca/custom/python/wheelhouse/nix/avx2, /cvmfs/soft.computecanada.ca/custom/python/wheelhouse/nix/generic, /cvmfs/soft.computecanada.ca/custom/python/wheelhouse/generic
Processing /cvmfs/soft.computecanada.ca/custom/python/wheelhouse/generic/wandb-0.12.5+computecanada-py2.py3-none-any.whl
Processing /cvmfs/soft.computecanada.ca/custom/python/wheelhouse/generic/PyYAML-5.3.1+computecanada-cp37-cp37m-linux_x86_64.whl
Requirement already satisfied: requests<3,>=2.0.0 in /cvmfs/soft.computecanada.ca/easybuild/software/2017/Core/scipy-stack/2019a/lib/python3.7/site-packages (from wandb) (2.21.0)
Processing /cvmfs/soft.computecanada.ca/custom/python/wheelhouse/generic/shortuuid-1.0.1+computecanada-py3-none-any.whl
Processing /cvmfs/soft.computecanada.ca/custom/python/wheelhouse/generic/configparser-5.0.2+computecanada-py3-none-any.whl
Processing /cvmfs/soft.computecanada.ca/custom/python/wheelhouse/generic/yaspin-2.1.0+computecanada-py3-none-any.whl
Processing /cvmfs/soft.computecanada.ca/custom/python/wheelhouse/generic/GitPython-3.1.24+computecanada-py3-none-any.whl
Processing /cvmfs/soft.computecanada.ca/custom/python/wheelhouse/generic/six-1.16.0+computecanada-py2.py3-none-any.whl
Requirement already satisfied: python-dateutil>=2.6.1 in /cvmfs/soft.computecanada.ca/easybuild/software/2017/Core/scipy-stack/2019a/lib/python3.7/site-packages (from wandb) (2.7.5)
Processing /cvmfs/soft.computecanada.ca/custom/python/wheelhouse/generic/pathtools-0.1.2+computecanada-py3-none-any.whl
Processing /cvmfs/soft.computecanada.ca/custom/python/wheelhouse/generic/click-8.0.3+computecanada-py3-none-any.whl
Processing /cvmfs/soft.computecanada.ca/custom/python/wheelhouse/generic/sentry_sdk-1.5.0+computecanada-py2.py3-none-any.whl
Processing /cvmfs/soft.computecanada.ca/custom/python/wheelhouse/generic/protobuf-3.19.4+computecanada-py2.py3-none-any.whl
Processing /cvmfs/soft.computecanada.ca/custom/python/wheelhouse/generic/docker_pycreds-0.4.0+computecanada-py2.py3-none-any.whl
Processing /cvmfs/soft.computecanada.ca/custom/python/wheelhouse/generic/promise-2.3+computecanada-py3-none-any.whl
Processing /cvmfs/soft.computecanada.ca/custom/python/wheelhouse/generic/subprocess32-3.5.4+computecanada-py3-none-any.whl
Processing /cvmfs/soft.computecanada.ca/custom/python/wheelhouse/generic/psutil-5.7.3+computecanada-cp37-cp37m-linux_x86_64.whl
Requirement already satisfied: importlib-metadata in /cvmfs/soft.computecanada.ca/easybuild/software/2017/Core/scipy-stack/2019a/lib/python3.7/site-packages (from Click!=8.0.0,>=7.0->wandb) (0.8)
Processing /cvmfs/soft.computecanada.ca/custom/python/wheelhouse/generic/gitdb-4.0.9+computecanada-py3-none-any.whl
Processing /cvmfs/soft.computecanada.ca/custom/python/wheelhouse/generic/typing_extensions-4.0.1+computecanada-py3-none-any.whl
Processing /cvmfs/soft.computecanada.ca/custom/python/wheelhouse/generic/smmap-5.0.0+computecanada-py3-none-any.whl
Requirement already satisfied: certifi>=2017.4.17 in /cvmfs/soft.computecanada.ca/easybuild/software/2017/Core/scipy-stack/2019a/lib/python3.7/site-packages (from requests<3,>=2.0.0->wandb) (2018.11.29)
Requirement already satisfied: urllib3<1.25,>=1.21.1 in /cvmfs/soft.computecanada.ca/easybuild/software/2017/Core/scipy-stack/2019a/lib/python3.7/site-packages (from requests<3,>=2.0.0->wandb) (1.24.1)
Requirement already satisfied: chardet<3.1.0,>=3.0.2 in /cvmfs/soft.computecanada.ca/easybuild/software/2017/Core/scipy-stack/2019a/lib/python3.7/site-packages (from requests<3,>=2.0.0->wandb) (3.0.4)
Requirement already satisfied: idna<2.9,>=2.5 in /cvmfs/soft.computecanada.ca/easybuild/software/2017/Core/scipy-stack/2019a/lib/python3.7/site-packages (from requests<3,>=2.0.0->wandb) (2.8)
Processing /cvmfs/soft.computecanada.ca/custom/python/wheelhouse/generic/termcolor-1.1.0+computecanada-py3-none-any.whl
Requirement already satisfied: zipp>=0.3.2 in /cvmfs/soft.computecanada.ca/easybuild/software/2017/Core/scipy-stack/2019a/lib/python3.7/site-packages (from importlib-metadata->Click!=8.0.0,>=7.0->wandb) (0.3.3)
Installing collected packages: smmap, typing-extensions, termcolor, six, gitdb, yaspin, subprocess32, shortuuid, sentry-sdk, PyYAML, psutil, protobuf, promise, pathtools, GitPython, docker-pycreds, configparser, Click, wandb
  Attempting uninstall: six
    Found existing installation: six 1.12.0
    Not uninstalling six at /cvmfs/soft.computecanada.ca/easybuild/software/2017/Core/scipy-stack/2019a/lib/python3.7/site-packages, outside environment /localscratch/yinan.28735479.0/env
    Can't uninstall 'six'. No files were found to uninstall.
Successfully installed Click-8.0.3+computecanada GitPython-3.1.24+computecanada PyYAML-5.3.1+computecanada configparser-5.0.2+computecanada docker-pycreds-0.4.0+computecanada gitdb-4.0.9+computecanada pathtools-0.1.2+computecanada promise-2.3+computecanada protobuf-3.19.4+computecanada psutil-5.7.3+computecanada sentry-sdk-1.5.0+computecanada shortuuid-1.0.1+computecanada six-1.16.0+computecanada smmap-5.0.0+computecanada subprocess32-3.5.4+computecanada termcolor-1.1.0+computecanada typing-extensions-4.0.1+computecanada wandb-0.12.5+computecanada yaspin-2.1.0+computecanada
Looking in links: /cvmfs/soft.computecanada.ca/custom/python/wheelhouse/nix/avx2, /cvmfs/soft.computecanada.ca/custom/python/wheelhouse/nix/generic, /cvmfs/soft.computecanada.ca/custom/python/wheelhouse/generic
ERROR: Could not find a version that satisfies the requirement sagemaker (from versions: none)
ERROR: No matching distribution found for sagemaker
Looking in links: /cvmfs/soft.computecanada.ca/custom/python/wheelhouse/nix/avx2, /cvmfs/soft.computecanada.ca/custom/python/wheelhouse/nix/generic, /cvmfs/soft.computecanada.ca/custom/python/wheelhouse/generic
Processing /cvmfs/soft.computecanada.ca/custom/python/wheelhouse/generic/torch-1.9.1+computecanada-cp37-cp37m-linux_x86_64.whl
Requirement already satisfied: typing-extensions in /localscratch/yinan.28735479.0/env/lib/python3.7/site-packages (from torch) (4.0.1+computecanada)
Installing collected packages: torch
Successfully installed torch-1.9.1+computecanada
Looking in links: /cvmfs/soft.computecanada.ca/custom/python/wheelhouse/nix/avx2, /cvmfs/soft.computecanada.ca/custom/python/wheelhouse/nix/generic, /cvmfs/soft.computecanada.ca/custom/python/wheelhouse/generic
Processing /cvmfs/soft.computecanada.ca/custom/python/wheelhouse/generic/transformers-2.5.1+computecanada-py3-none-any.whl
Processing /cvmfs/soft.computecanada.ca/custom/python/wheelhouse/generic/tokenizers-0.5.2+computecanada-cp37-cp37m-linux_x86_64.whl
Requirement already satisfied: numpy in /cvmfs/soft.computecanada.ca/easybuild/software/2017/Core/scipy-stack/2019a/lib/python3.7/site-packages (from transformers==2.5.1+computecanada) (1.16.0)
Processing /cvmfs/soft.computecanada.ca/custom/python/wheelhouse/generic/sentencepiece-0.1.91+computecanada-cp37-cp37m-linux_x86_64.whl
Requirement already satisfied: requests in /cvmfs/soft.computecanada.ca/easybuild/software/2017/Core/scipy-stack/2019a/lib/python3.7/site-packages (from transformers==2.5.1+computecanada) (2.21.0)
Processing /cvmfs/soft.computecanada.ca/custom/python/wheelhouse/generic/regex-2020.11.13+computecanada-cp37-cp37m-linux_x86_64.whl
Processing /cvmfs/soft.computecanada.ca/custom/python/wheelhouse/generic/boto3-1.20.52+computecanada-py3-none-any.whl
Processing /cvmfs/soft.computecanada.ca/custom/python/wheelhouse/generic/filelock-3.4.2+computecanada-py3-none-any.whl
Processing /cvmfs/soft.computecanada.ca/custom/python/wheelhouse/generic/tqdm-4.63.0+computecanada-py2.py3-none-any.whl
Processing /cvmfs/soft.computecanada.ca/custom/python/wheelhouse/generic/sacremoses-0.0.46+computecanada-py3-none-any.whl
Processing /cvmfs/soft.computecanada.ca/custom/python/wheelhouse/generic/botocore-1.23.52+computecanada-py3-none-any.whl
Processing /cvmfs/soft.computecanada.ca/custom/python/wheelhouse/generic/jmespath-0.10.0+computecanada-py2.py3-none-any.whl
Processing /cvmfs/soft.computecanada.ca/custom/python/wheelhouse/generic/s3transfer-0.5.1+computecanada-py3-none-any.whl
Processing /cvmfs/soft.computecanada.ca/custom/python/wheelhouse/generic/urllib3-1.26.8+computecanada-py2.py3-none-any.whl
Requirement already satisfied: python-dateutil<3.0.0,>=2.1 in /cvmfs/soft.computecanada.ca/easybuild/software/2017/Core/scipy-stack/2019a/lib/python3.7/site-packages (from botocore<1.24.0,>=1.23.52->boto3->transformers==2.5.1+computecanada) (2.7.5)
Requirement already satisfied: six>=1.5 in /localscratch/yinan.28735479.0/env/lib/python3.7/site-packages (from python-dateutil<3.0.0,>=2.1->botocore<1.24.0,>=1.23.52->boto3->transformers==2.5.1+computecanada) (1.16.0+computecanada)
Processing /cvmfs/soft.computecanada.ca/custom/python/wheelhouse/generic/requests-2.27.1+computecanada-py2.py3-none-any.whl
Processing /cvmfs/soft.computecanada.ca/custom/python/wheelhouse/generic/charset_normalizer-2.0.11+computecanada-py3-none-any.whl
Requirement already satisfied: idna<4,>=2.5 in /cvmfs/soft.computecanada.ca/easybuild/software/2017/Core/scipy-stack/2019a/lib/python3.7/site-packages (from requests->transformers==2.5.1+computecanada) (2.8)
Requirement already satisfied: certifi>=2017.4.17 in /cvmfs/soft.computecanada.ca/easybuild/software/2017/Core/scipy-stack/2019a/lib/python3.7/site-packages (from requests->transformers==2.5.1+computecanada) (2018.11.29)
Processing /cvmfs/soft.computecanada.ca/custom/python/wheelhouse/generic/joblib-1.1.0+computecanada-py2.py3-none-any.whl
Requirement already satisfied: click in /localscratch/yinan.28735479.0/env/lib/python3.7/site-packages (from sacremoses->transformers==2.5.1+computecanada) (8.0.3+computecanada)
Requirement already satisfied: importlib-metadata in /cvmfs/soft.computecanada.ca/easybuild/software/2017/Core/scipy-stack/2019a/lib/python3.7/site-packages (from click->sacremoses->transformers==2.5.1+computecanada) (0.8)
Requirement already satisfied: zipp>=0.3.2 in /cvmfs/soft.computecanada.ca/easybuild/software/2017/Core/scipy-stack/2019a/lib/python3.7/site-packages (from importlib-metadata->click->sacremoses->transformers==2.5.1+computecanada) (0.3.3)
Installing collected packages: urllib3, jmespath, botocore, tqdm, s3transfer, regex, joblib, charset-normalizer, tokenizers, sentencepiece, sacremoses, requests, filelock, boto3, transformers
  Attempting uninstall: urllib3
    Found existing installation: urllib3 1.24.1
    Not uninstalling urllib3 at /cvmfs/soft.computecanada.ca/easybuild/software/2017/Core/scipy-stack/2019a/lib/python3.7/site-packages, outside environment /localscratch/yinan.28735479.0/env
    Can't uninstall 'urllib3'. No files were found to uninstall.
  Attempting uninstall: requests
    Found existing installation: requests 2.21.0
    Not uninstalling requests at /cvmfs/soft.computecanada.ca/easybuild/software/2017/Core/scipy-stack/2019a/lib/python3.7/site-packages, outside environment /localscratch/yinan.28735479.0/env
    Can't uninstall 'requests'. No files were found to uninstall.
Successfully installed boto3-1.20.52+computecanada botocore-1.23.52+computecanada charset-normalizer-2.0.11+computecanada filelock-3.4.2+computecanada jmespath-0.10.0+computecanada joblib-1.1.0+computecanada regex-2020.11.13+computecanada requests-2.27.1+computecanada s3transfer-0.5.1+computecanada sacremoses-0.0.46+computecanada sentencepiece-0.1.91+computecanada tokenizers-0.5.2+computecanada tqdm-4.63.0+computecanada transformers-2.5.1+computecanada urllib3-1.26.8+computecanada
Looking in links: /cvmfs/soft.computecanada.ca/custom/python/wheelhouse/nix/avx2, /cvmfs/soft.computecanada.ca/custom/python/wheelhouse/nix/generic, /cvmfs/soft.computecanada.ca/custom/python/wheelhouse/generic
Processing /cvmfs/soft.computecanada.ca/custom/python/wheelhouse/generic/tensorflow_gpu-2.3.0+computecanada-cp37-cp37m-linux_x86_64.whl
Requirement already satisfied: termcolor>=1.1.0 in /localscratch/yinan.28735479.0/env/lib/python3.7/site-packages (from tensorflow_gpu==2.3.0+computecanada) (1.1.0+computecanada)
Processing /cvmfs/soft.computecanada.ca/custom/python/wheelhouse/generic/google_pasta-0.2.0+computecanada-py3-none-any.whl
Requirement already satisfied: six>=1.12.0 in /localscratch/yinan.28735479.0/env/lib/python3.7/site-packages (from tensorflow_gpu==2.3.0+computecanada) (1.16.0+computecanada)
Processing /cvmfs/soft.computecanada.ca/custom/python/wheelhouse/generic/tensorflow_estimator-2.3.0+computecanada-py2.py3-none-any.whl
Processing /cvmfs/soft.computecanada.ca/custom/python/wheelhouse/generic/absl_py-1.0.0+computecanada-py3-none-any.whl
Processing /cvmfs/soft.computecanada.ca/custom/python/wheelhouse/nix/avx2/h5py-2.10.0+computecanada-cp37-cp37m-linux_x86_64.whl
Processing /cvmfs/soft.computecanada.ca/custom/python/wheelhouse/generic/opt_einsum-3.3.0+computecanada-py3-none-any.whl
Processing /cvmfs/soft.computecanada.ca/custom/python/wheelhouse/generic/grpcio-1.38.0+computecanada-cp37-cp37m-linux_x86_64.whl
Processing /cvmfs/soft.computecanada.ca/custom/python/wheelhouse/generic/astunparse-1.6.3+computecanada-py2.py3-none-any.whl
Requirement already satisfied: numpy<1.19.0,>=1.16.0 in /cvmfs/soft.computecanada.ca/easybuild/software/2017/Core/scipy-stack/2019a/lib/python3.7/site-packages (from tensorflow_gpu==2.3.0+computecanada) (1.16.0)
Processing /cvmfs/soft.computecanada.ca/custom/python/wheelhouse/generic/tensorboard-2.8.0+computecanada-py3-none-any.whl
Requirement already satisfied: protobuf>=3.9.2 in /localscratch/yinan.28735479.0/env/lib/python3.7/site-packages (from tensorflow_gpu==2.3.0+computecanada) (3.19.4+computecanada)
Processing /cvmfs/soft.computecanada.ca/custom/python/wheelhouse/nix/generic/scipy-1.4.1+computecanada-cp37-cp37m-linux_x86_64.whl
Processing /cvmfs/soft.computecanada.ca/custom/python/wheelhouse/generic/gast-0.3.3+computecanada-py3-none-any.whl
Processing /cvmfs/soft.computecanada.ca/custom/python/wheelhouse/generic/Keras_Preprocessing-1.1.2+computecanada-py3-none-any.whl
Requirement already satisfied: wheel>=0.26 in /localscratch/yinan.28735479.0/env/lib/python3.7/site-packages (from tensorflow_gpu==2.3.0+computecanada) (0.33.4)
Processing /cvmfs/soft.computecanada.ca/custom/python/wheelhouse/generic/wrapt-1.11.2+computecanada-cp37-cp37m-linux_x86_64.whl
Processing /cvmfs/soft.computecanada.ca/custom/python/wheelhouse/generic/tensorboard_plugin_wit-1.8.0+computecanada-py3-none-any.whl
Processing /cvmfs/soft.computecanada.ca/custom/python/wheelhouse/generic/google_auth-2.3.3+computecanada-py2.py3-none-any.whl
Processing /cvmfs/soft.computecanada.ca/custom/python/wheelhouse/generic/Werkzeug-2.0.3+computecanada-py3-none-any.whl
Processing /cvmfs/soft.computecanada.ca/custom/python/wheelhouse/generic/tensorboard_data_server-0.6.1+computecanada-py3-none-linux_x86_64.whl
Processing /cvmfs/soft.computecanada.ca/custom/python/wheelhouse/generic/google_auth_oauthlib-0.4.6+computecanada-py2.py3-none-any.whl
Requirement already satisfied: setuptools>=41.0.0 in /localscratch/yinan.28735479.0/env/lib/python3.7/site-packages (from tensorboard<3,>=2.3.0->tensorflow_gpu==2.3.0+computecanada) (41.0.1)
Requirement already satisfied: requests<3,>=2.21.0 in /localscratch/yinan.28735479.0/env/lib/python3.7/site-packages (from tensorboard<3,>=2.3.0->tensorflow_gpu==2.3.0+computecanada) (2.27.1+computecanada)
Processing /cvmfs/soft.computecanada.ca/custom/python/wheelhouse/generic/Markdown-3.3.6+computecanada-py3-none-any.whl
Processing /cvmfs/soft.computecanada.ca/custom/python/wheelhouse/generic/pyasn1_modules-0.2.8+computecanada-py2.py3-none-any.whl
Processing /cvmfs/soft.computecanada.ca/custom/python/wheelhouse/generic/rsa-4.8+computecanada-py3-none-any.whl
Processing /cvmfs/soft.computecanada.ca/custom/python/wheelhouse/generic/cachetools-4.2.4+computecanada-py3-none-any.whl
Processing /cvmfs/soft.computecanada.ca/custom/python/wheelhouse/generic/requests_oauthlib-1.3.0+computecanada-py2.py3-none-any.whl
Processing /cvmfs/soft.computecanada.ca/custom/python/wheelhouse/generic/importlib_metadata-4.10.1+computecanada-py3-none-any.whl
Requirement already satisfied: typing-extensions>=3.6.4 in /localscratch/yinan.28735479.0/env/lib/python3.7/site-packages (from importlib-metadata>=4.4->markdown>=2.6.8->tensorboard<3,>=2.3.0->tensorflow_gpu==2.3.0+computecanada) (4.0.1+computecanada)
Processing /cvmfs/soft.computecanada.ca/custom/python/wheelhouse/generic/zipp-3.7.0+computecanada-py3-none-any.whl
Processing /cvmfs/soft.computecanada.ca/custom/python/wheelhouse/generic/pyasn1-0.4.8+computecanada-py2.py3-none-any.whl
Requirement already satisfied: certifi>=2017.4.17 in /cvmfs/soft.computecanada.ca/easybuild/software/2017/Core/scipy-stack/2019a/lib/python3.7/site-packages (from requests<3,>=2.21.0->tensorboard<3,>=2.3.0->tensorflow_gpu==2.3.0+computecanada) (2018.11.29)
Requirement already satisfied: idna<4,>=2.5 in /cvmfs/soft.computecanada.ca/easybuild/software/2017/Core/scipy-stack/2019a/lib/python3.7/site-packages (from requests<3,>=2.21.0->tensorboard<3,>=2.3.0->tensorflow_gpu==2.3.0+computecanada) (2.8)
Requirement already satisfied: urllib3<1.27,>=1.21.1 in /localscratch/yinan.28735479.0/env/lib/python3.7/site-packages (from requests<3,>=2.21.0->tensorboard<3,>=2.3.0->tensorflow_gpu==2.3.0+computecanada) (1.26.8+computecanada)
Requirement already satisfied: charset-normalizer~=2.0.0 in /localscratch/yinan.28735479.0/env/lib/python3.7/site-packages (from requests<3,>=2.21.0->tensorboard<3,>=2.3.0->tensorflow_gpu==2.3.0+computecanada) (2.0.11+computecanada)
Processing /cvmfs/soft.computecanada.ca/custom/python/wheelhouse/generic/oauthlib-3.1.1+computecanada-py2.py3-none-any.whl
Installing collected packages: pyasn1, zipp, rsa, pyasn1-modules, oauthlib, cachetools, requests-oauthlib, importlib-metadata, google-auth, werkzeug, tensorboard-plugin-wit, tensorboard-data-server, markdown, grpcio, google-auth-oauthlib, absl-py, wrapt, tensorflow-estimator, tensorboard, scipy, opt-einsum, keras-preprocessing, h5py, google-pasta, gast, astunparse, tensorflow-gpu
  Attempting uninstall: pyasn1
    Found existing installation: pyasn1 0.4.3
    Not uninstalling pyasn1 at /cvmfs/soft.computecanada.ca/easybuild/software/2017/Core/scipy-stack/2019a/lib/python3.7/site-packages, outside environment /localscratch/yinan.28735479.0/env
    Can't uninstall 'pyasn1'. No files were found to uninstall.
  Attempting uninstall: zipp
    Found existing installation: zipp 0.3.3
    Not uninstalling zipp at /cvmfs/soft.computecanada.ca/easybuild/software/2017/Core/scipy-stack/2019a/lib/python3.7/site-packages, outside environment /localscratch/yinan.28735479.0/env
    Can't uninstall 'zipp'. No files were found to uninstall.
  Attempting uninstall: importlib-metadata
    Found existing installation: importlib-metadata 0.8
    Not uninstalling importlib-metadata at /cvmfs/soft.computecanada.ca/easybuild/software/2017/Core/scipy-stack/2019a/lib/python3.7/site-packages, outside environment /localscratch/yinan.28735479.0/env
    Can't uninstall 'importlib-metadata'. No files were found to uninstall.
  Attempting uninstall: scipy
    Found existing installation: scipy 1.2.0
    Not uninstalling scipy at /cvmfs/soft.computecanada.ca/easybuild/software/2017/Core/scipy-stack/2019a/lib/python3.7/site-packages, outside environment /localscratch/yinan.28735479.0/env
    Can't uninstall 'scipy'. No files were found to uninstall.
Successfully installed absl-py-1.0.0+computecanada astunparse-1.6.3+computecanada cachetools-4.2.4+computecanada gast-0.3.3+computecanada google-auth-2.3.3+computecanada google-auth-oauthlib-0.4.6+computecanada google-pasta-0.2.0+computecanada grpcio-1.38.0+computecanada h5py-2.10.0+computecanada importlib-metadata-4.10.1+computecanada keras-preprocessing-1.1.2+computecanada markdown-3.3.6+computecanada oauthlib-3.1.1+computecanada opt-einsum-3.3.0+computecanada pyasn1-0.4.8+computecanada pyasn1-modules-0.2.8+computecanada requests-oauthlib-1.3.0+computecanada rsa-4.8+computecanada scipy-1.4.1+computecanada tensorboard-2.8.0+computecanada tensorboard-data-server-0.6.1+computecanada tensorboard-plugin-wit-1.8.0+computecanada tensorflow-estimator-2.3.0+computecanada tensorflow-gpu-2.3.0+computecanada werkzeug-2.0.3+computecanada wrapt-1.11.2+computecanada zipp-3.7.0+computecanada
Looking in links: /cvmfs/soft.computecanada.ca/custom/python/wheelhouse/nix/avx2, /cvmfs/soft.computecanada.ca/custom/python/wheelhouse/nix/generic, /cvmfs/soft.computecanada.ca/custom/python/wheelhouse/generic
Processing /cvmfs/soft.computecanada.ca/custom/python/wheelhouse/generic/keras-2.8.0+computecanada-py2.py3-none-any.whl
Installing collected packages: Keras
Successfully installed Keras-2.8.0+computecanada
Looking in links: /cvmfs/soft.computecanada.ca/custom/python/wheelhouse/nix/avx2, /cvmfs/soft.computecanada.ca/custom/python/wheelhouse/nix/generic, /cvmfs/soft.computecanada.ca/custom/python/wheelhouse/generic
Processing /cvmfs/soft.computecanada.ca/custom/python/wheelhouse/generic/urllib3-1.26.7+computecanada-py2.py3-none-any.whl
Installing collected packages: urllib3
  Attempting uninstall: urllib3
    Found existing installation: urllib3 1.26.8+computecanada
    Uninstalling urllib3-1.26.8+computecanada:
      Successfully uninstalled urllib3-1.26.8+computecanada
Successfully installed urllib3-1.26.7+computecanada
Looking in links: /cvmfs/soft.computecanada.ca/custom/python/wheelhouse/nix/avx2, /cvmfs/soft.computecanada.ca/custom/python/wheelhouse/nix/generic, /cvmfs/soft.computecanada.ca/custom/python/wheelhouse/generic
Processing /cvmfs/soft.computecanada.ca/custom/python/wheelhouse/generic/nltk-3.7+computecanada-py3-none-any.whl
Requirement already satisfied: joblib in /localscratch/yinan.28735479.0/env/lib/python3.7/site-packages (from nltk) (1.1.0+computecanada)
Requirement already satisfied: tqdm in /localscratch/yinan.28735479.0/env/lib/python3.7/site-packages (from nltk) (4.63.0+computecanada)
Processing /cvmfs/soft.computecanada.ca/custom/python/wheelhouse/generic/nltk-3.6.5+computecanada-py3-none-any.whl
Processing /cvmfs/soft.computecanada.ca/custom/python/wheelhouse/generic/nltk-3.6.3+computecanada-py3-none-any.whl
Requirement already satisfied: regex in /localscratch/yinan.28735479.0/env/lib/python3.7/site-packages (from nltk) (2020.11.13+computecanada)
Requirement already satisfied: click in /localscratch/yinan.28735479.0/env/lib/python3.7/site-packages (from nltk) (8.0.3+computecanada)
Requirement already satisfied: importlib-metadata in /localscratch/yinan.28735479.0/env/lib/python3.7/site-packages (from click->nltk) (4.10.1+computecanada)
Requirement already satisfied: zipp>=0.5 in /localscratch/yinan.28735479.0/env/lib/python3.7/site-packages (from importlib-metadata->click->nltk) (3.7.0+computecanada)
Requirement already satisfied: typing-extensions>=3.6.4 in /localscratch/yinan.28735479.0/env/lib/python3.7/site-packages (from importlib-metadata->click->nltk) (4.0.1+computecanada)
Installing collected packages: nltk
Successfully installed nltk-3.6.3+computecanada
Looking in links: /cvmfs/soft.computecanada.ca/custom/python/wheelhouse/nix/avx2, /cvmfs/soft.computecanada.ca/custom/python/wheelhouse/nix/generic, /cvmfs/soft.computecanada.ca/custom/python/wheelhouse/generic
Processing /cvmfs/soft.computecanada.ca/custom/python/wheelhouse/generic/scikit_learn-0.22.1+computecanada-cp37-cp37m-linux_x86_64.whl
Requirement already satisfied: numpy>=1.11.0 in /cvmfs/soft.computecanada.ca/easybuild/software/2017/Core/scipy-stack/2019a/lib/python3.7/site-packages (from scikit-learn==0.22.1) (1.16.0)
Requirement already satisfied: joblib>=0.11 in /localscratch/yinan.28735479.0/env/lib/python3.7/site-packages (from scikit-learn==0.22.1) (1.1.0+computecanada)
Requirement already satisfied: scipy>=0.17.0 in /localscratch/yinan.28735479.0/env/lib/python3.7/site-packages (from scikit-learn==0.22.1) (1.4.1+computecanada)
Installing collected packages: scikit-learn
Successfully installed scikit-learn-0.22.1+computecanada
Looking in links: /cvmfs/soft.computecanada.ca/custom/python/wheelhouse/nix/avx2, /cvmfs/soft.computecanada.ca/custom/python/wheelhouse/nix/generic, /cvmfs/soft.computecanada.ca/custom/python/wheelhouse/generic
Requirement already satisfied: tokenizers==0.5.2 in /localscratch/yinan.28735479.0/env/lib/python3.7/site-packages (0.5.2+computecanada)
wandb: Appending key for api.wandb.ai to your netrc file: /home/yinan/.netrc
Starting Task
2022-03-11 09:23:50.680359: I tensorflow/stream_executor/platform/default/dso_loader.cc:48] Successfully opened dynamic library libcudart.so.10.1
[nltk_data] Downloading package stopwords to /home/yinan/nltk_data...
[nltk_data]   Package stopwords is already up-to-date!
[nltk_data] Downloading package wordnet to /home/yinan/nltk_data...
[nltk_data]   Package wordnet is already up-to-date!
wandb: Currently logged in as: yinanazhou (use `wandb login --relogin` to force relogin)
wandb: wandb version 0.12.11 is available!  To upgrade, please run:
wandb:  $ pip install wandb --upgrade
2022-03-11 09:24:03.772025: I tensorflow/stream_executor/platform/default/dso_loader.cc:48] Successfully opened dynamic library libcudart.so.10.1
wandb: Tracking run with wandb version 0.12.5
wandb: Syncing run honest-smoke-1
wandb: ⭐️ View project at https://wandb.ai/yinanazhou/xl_512_bs_8_lr_1e07_es_10_lc_False_nr_True_sr_True_stem_True_lemma_False_repeat_1_fold_1
wandb: 🚀 View run at https://wandb.ai/yinanazhou/xl_512_bs_8_lr_1e07_es_10_lc_False_nr_True_sr_True_stem_True_lemma_False_repeat_1_fold_1/runs/2odzktdf
wandb: Run data is saved locally in /project/6002780/yinan/Thesis_MER_Lyrics/lyric-emotion/wandb/run-20220311_092401-2odzktdf
wandb: Run `wandb offline` to turn off syncing.

Validation loss decreased (inf --> 1.450412).  Saving model ...
Validation loss decreased (1.450412 --> 1.447887).  Saving model ...
Validation loss decreased (1.447887 --> 1.445317).  Saving model ...
Validation loss decreased (1.445317 --> 1.442676).  Saving model ...
Validation loss decreased (1.442676 --> 1.440216).  Saving model ...
Validation loss decreased (1.440216 --> 1.437743).  Saving model ...
Validation loss decreased (1.437743 --> 1.435455).  Saving model ...
Validation loss decreased (1.435455 --> 1.433297).  Saving model ...
Validation loss decreased (1.433297 --> 1.431219).  Saving model ...
Validation loss decreased (1.431219 --> 1.429092).  Saving model ...
Validation loss decreased (1.429092 --> 1.426930).  Saving model ...
Validation loss decreased (1.426930 --> 1.424940).  Saving model ...
Validation loss decreased (1.424940 --> 1.422964).  Saving model ...
Validation loss decreased (1.422964 --> 1.420980).  Saving model ...
Validation loss decreased (1.420980 --> 1.419079).  Saving model ...
Validation loss decreased (1.419079 --> 1.417283).  Saving model ...
Validation loss decreased (1.417283 --> 1.415526).  Saving model ...
Validation loss decreased (1.415526 --> 1.413736).  Saving model ...
Validation loss decreased (1.413736 --> 1.412022).  Saving model ...
Validation loss decreased (1.412022 --> 1.410352).  Saving model ...
Validation loss decreased (1.410352 --> 1.408687).  Saving model ...
Validation loss decreased (1.408687 --> 1.407161).  Saving model ...
Validation loss decreased (1.407161 --> 1.405620).  Saving model ...
Validation loss decreased (1.405620 --> 1.404269).  Saving model ...
Validation loss decreased (1.404269 --> 1.402809).  Saving model ...
Validation loss decreased (1.402809 --> 1.401390).  Saving model ...
Validation loss decreased (1.401390 --> 1.400003).  Saving model ...
Validation loss decreased (1.400003 --> 1.398589).  Saving model ...
Validation loss decreased (1.398589 --> 1.397307).  Saving model ...
Validation loss decreased (1.397307 --> 1.396032).  Saving model ...
Validation loss decreased (1.396032 --> 1.394790).  Saving model ...
Validation loss decreased (1.394790 --> 1.393532).  Saving model ...
Validation loss decreased (1.393532 --> 1.392412).  Saving model ...
Validation loss decreased (1.392412 --> 1.391251).  Saving model ...
Validation loss decreased (1.391251 --> 1.390179).  Saving model ...
Validation loss decreased (1.390179 --> 1.388989).  Saving model ...
Validation loss decreased (1.388989 --> 1.387847).  Saving model ...
Validation loss decreased (1.387847 --> 1.386900).  Saving model ...
Validation loss decreased (1.386900 --> 1.385841).  Saving model ...
Validation loss decreased (1.385841 --> 1.384788).  Saving model ...
Validation loss decreased (1.384788 --> 1.383796).  Saving model ...
Validation loss decreased (1.383796 --> 1.382783).  Saving model ...
Validation loss decreased (1.382783 --> 1.381814).  Saving model ...
Validation loss decreased (1.381814 --> 1.380843).  Saving model ...
Validation loss decreased (1.380843 --> 1.379801).  Saving model ...
Validation loss decreased (1.379801 --> 1.378954).  Saving model ...
Validation loss decreased (1.378954 --> 1.378121).  Saving model ...
Validation loss decreased (1.378121 --> 1.377242).  Saving model ...
Validation loss decreased (1.377242 --> 1.376409).  Saving model ...
Validation loss decreased (1.376409 --> 1.375551).  Saving model ...
Validation loss decreased (1.375551 --> 1.374751).  Saving model ...
Validation loss decreased (1.374751 --> 1.374001).  Saving model ...
Validation loss decreased (1.374001 --> 1.373146).  Saving model ...
Validation loss decreased (1.373146 --> 1.372331).  Saving model ...
Validation loss decreased (1.372331 --> 1.371577).  Saving model ...
Validation loss decreased (1.371577 --> 1.370825).  Saving model ...
Validation loss decreased (1.370825 --> 1.370021).  Saving model ...
Validation loss decreased (1.370021 --> 1.369261).  Saving model ...
Validation loss decreased (1.369261 --> 1.368444).  Saving model ...
Validation loss decreased (1.368444 --> 1.367774).  Saving model ...
Validation loss decreased (1.367774 --> 1.367055).  Saving model ...
Validation loss decreased (1.367055 --> 1.366375).  Saving model ...
Validation loss decreased (1.366375 --> 1.365644).  Saving model ...
Validation loss decreased (1.365644 --> 1.364958).  Saving model ...
Validation loss decreased (1.364958 --> 1.364311).  Saving model ...
Validation loss decreased (1.364311 --> 1.363590).  Saving model ...
Validation loss decreased (1.363590 --> 1.362978).  Saving model ...
Validation loss decreased (1.362978 --> 1.362383).  Saving model ...
Validation loss decreased (1.362383 --> 1.361760).  Saving model ...
Validation loss decreased (1.361760 --> 1.361175).  Saving model ...
Validation loss decreased (1.361175 --> 1.360624).  Saving model ...
Validation loss decreased (1.360624 --> 1.359980).  Saving model ...
Validation loss decreased (1.359980 --> 1.359376).  Saving model ...
Validation loss decreased (1.359376 --> 1.358808).  Saving model ...
Validation loss decreased (1.358808 --> 1.358224).  Saving model ...
Validation loss decreased (1.358224 --> 1.357664).  Saving model ...
Validation loss decreased (1.357664 --> 1.357091).  Saving model ...
Validation loss decreased (1.357091 --> 1.356529).  Saving model ...
Validation loss decreased (1.356529 --> 1.355954).  Saving model ...
Validation loss decreased (1.355954 --> 1.355419).  Saving model ...
Validation loss decreased (1.355419 --> 1.354919).  Saving model ...
Validation loss decreased (1.354919 --> 1.354358).  Saving model ...
Validation loss decreased (1.354358 --> 1.353813).  Saving model ...
Validation loss decreased (1.353813 --> 1.353288).  Saving model ...
Validation loss decreased (1.353288 --> 1.352775).  Saving model ...
Validation loss decreased (1.352775 --> 1.352252).  Saving model ...
Validation loss decreased (1.352252 --> 1.351720).  Saving model ...
Validation loss decreased (1.351720 --> 1.351160).  Saving model ...
Validation loss decreased (1.351160 --> 1.350634).  Saving model ...
Validation loss decreased (1.350634 --> 1.350200).  Saving model ...
Validation loss decreased (1.350200 --> 1.349712).  Saving model ...
Validation loss decreased (1.349712 --> 1.349224).  Saving model ...
Validation loss decreased (1.349224 --> 1.348709).  Saving model ...
Validation loss decreased (1.348709 --> 1.348225).  Saving model ...
Validation loss decreased (1.348225 --> 1.347701).  Saving model ...
Validation loss decreased (1.347701 --> 1.347205).  Saving model ...
Validation loss decreased (1.347205 --> 1.346706).  Saving model ...
Validation loss decreased (1.346706 --> 1.346166).  Saving model ...
Validation loss decreased (1.346166 --> 1.345662).  Saving model ...
Validation loss decreased (1.345662 --> 1.345208).  Saving model ...
Validation loss decreased (1.345208 --> 1.344685).  Saving model ...
Validation loss decreased (1.344685 --> 1.344240).  Saving model ...
Validation loss decreased (1.344240 --> 1.343711).  Saving model ...
Validation loss decreased (1.343711 --> 1.343246).  Saving model ...
Validation loss decreased (1.343246 --> 1.342695).  Saving model ...
Validation loss decreased (1.342695 --> 1.342243).  Saving model ...
Validation loss decreased (1.342243 --> 1.341783).  Saving model ...
Validation loss decreased (1.341783 --> 1.341328).  Saving model ...
Validation loss decreased (1.341328 --> 1.340835).  Saving model ...
Validation loss decreased (1.340835 --> 1.340349).  Saving model ...
Validation loss decreased (1.340349 --> 1.339844).  Saving model ...
Validation loss decreased (1.339844 --> 1.339384).  Saving model ...
Validation loss decreased (1.339384 --> 1.338896).  Saving model ...
Validation loss decreased (1.338896 --> 1.338407).  Saving model ...
Validation loss decreased (1.338407 --> 1.337932).  Saving model ...
Validation loss decreased (1.337932 --> 1.337442).  Saving model ...
Validation loss decreased (1.337442 --> 1.336959).  Saving model ...
Validation loss decreased (1.336959 --> 1.336445).  Saving model ...
Validation loss decreased (1.336445 --> 1.335952).  Saving model ...
Validation loss decreased (1.335952 --> 1.335495).  Saving model ...
Validation loss decreased (1.335495 --> 1.335038).  Saving model ...
Validation loss decreased (1.335038 --> 1.334532).  Saving model ...
Validation loss decreased (1.334532 --> 1.334137).  Saving model ...
Validation loss decreased (1.334137 --> 1.333635).  Saving model ...
Validation loss decreased (1.333635 --> 1.333193).  Saving model ...
Validation loss decreased (1.333193 --> 1.332686).  Saving model ...
Validation loss decreased (1.332686 --> 1.332246).  Saving model ...
Validation loss decreased (1.332246 --> 1.331751).  Saving model ...
Validation loss decreased (1.331751 --> 1.331267).  Saving model ...
Validation loss decreased (1.331267 --> 1.330771).  Saving model ...
Validation loss decreased (1.330771 --> 1.330281).  Saving model ...
Validation loss decreased (1.330281 --> 1.329793).  Saving model ...
Validation loss decreased (1.329793 --> 1.329297).  Saving model ...
Validation loss decreased (1.329297 --> 1.328814).  Saving model ...
Validation loss decreased (1.328814 --> 1.328334).  Saving model ...
Validation loss decreased (1.328334 --> 1.327885).  Saving model ...
Validation loss decreased (1.327885 --> 1.327408).  Saving model ...
Validation loss decreased (1.327408 --> 1.326858).  Saving model ...
Validation loss decreased (1.326858 --> 1.326360).  Saving model ...
Validation loss decreased (1.326360 --> 1.325924).  Saving model ...
Validation loss decreased (1.325924 --> 1.325415).  Saving model ...
Validation loss decreased (1.325415 --> 1.324947).  Saving model ...
Validation loss decreased (1.324947 --> 1.324535).  Saving model ...
Validation loss decreased (1.324535 --> 1.324038).  Saving model ...
Validation loss decreased (1.324038 --> 1.323503).  Saving model ...
Validation loss decreased (1.323503 --> 1.322994).  Saving model ...
Validation loss decreased (1.322994 --> 1.322532).  Saving model ...
Validation loss decreased (1.322532 --> 1.321990).  Saving model ...
Validation loss decreased (1.321990 --> 1.321491).  Saving model ...
Validation loss decreased (1.321491 --> 1.320956).  Saving model ...
Validation loss decreased (1.320956 --> 1.320443).  Saving model ...
Validation loss decreased (1.320443 --> 1.319991).  Saving model ...
Validation loss decreased (1.319991 --> 1.319527).  Saving model ...
Validation loss decreased (1.319527 --> 1.319093).  Saving model ...
Validation loss decreased (1.319093 --> 1.318667).  Saving model ...
Validation loss decreased (1.318667 --> 1.318215).  Saving model ...
Validation loss decreased (1.318215 --> 1.317736).  Saving model ...
Validation loss decreased (1.317736 --> 1.317269).  Saving model ...
Validation loss decreased (1.317269 --> 1.316743).  Saving model ...
Validation loss decreased (1.316743 --> 1.316273).  Saving model ...
Validation loss decreased (1.316273 --> 1.315748).  Saving model ...
Validation loss decreased (1.315748 --> 1.315305).  Saving model ...
Validation loss decreased (1.315305 --> 1.314813).  Saving model ...
Validation loss decreased (1.314813 --> 1.314278).  Saving model ...
Validation loss decreased (1.314278 --> 1.313716).  Saving model ...
Validation loss decreased (1.313716 --> 1.313233).  Saving model ...
Validation loss decreased (1.313233 --> 1.312738).  Saving model ...
Validation loss decreased (1.312738 --> 1.312219).  Saving model ...
Validation loss decreased (1.312219 --> 1.311742).  Saving model ...
Validation loss decreased (1.311742 --> 1.311236).  Saving model ...
Validation loss decreased (1.311236 --> 1.310739).  Saving model ...
Validation loss decreased (1.310739 --> 1.310244).  Saving model ...
Validation loss decreased (1.310244 --> 1.309757).  Saving model ...
Validation loss decreased (1.309757 --> 1.309317).  Saving model ...
Validation loss decreased (1.309317 --> 1.308814).  Saving model ...
Validation loss decreased (1.308814 --> 1.308351).  Saving model ...
Validation loss decreased (1.308351 --> 1.307776).  Saving model ...
Validation loss decreased (1.307776 --> 1.307224).  Saving model ...
Validation loss decreased (1.307224 --> 1.306691).  Saving model ...
Validation loss decreased (1.306691 --> 1.306168).  Saving model ...
Validation loss decreased (1.306168 --> 1.305614).  Saving model ...
Validation loss decreased (1.305614 --> 1.305142).  Saving model ...
Validation loss decreased (1.305142 --> 1.304681).  Saving model ...
Validation loss decreased (1.304681 --> 1.304172).  Saving model ...
Validation loss decreased (1.304172 --> 1.303710).  Saving model ...
Validation loss decreased (1.303710 --> 1.303161).  Saving model ...
Validation loss decreased (1.303161 --> 1.302733).  Saving model ...
Validation loss decreased (1.302733 --> 1.302177).  Saving model ...
Validation loss decreased (1.302177 --> 1.301618).  Saving model ...
Validation loss decreased (1.301618 --> 1.301123).  Saving model ...
Validation loss decreased (1.301123 --> 1.300606).  Saving model ...
Validation loss decreased (1.300606 --> 1.300102).  Saving model ...
Validation loss decreased (1.300102 --> 1.299731).  Saving model ...
Validation loss decreased (1.299731 --> 1.299282).  Saving model ...
Validation loss decreased (1.299282 --> 1.298798).  Saving model ...
Validation loss decreased (1.298798 --> 1.298284).  Saving model ...
Validation loss decreased (1.298284 --> 1.297777).  Saving model ...
Validation loss decreased (1.297777 --> 1.297321).  Saving model ...
Validation loss decreased (1.297321 --> 1.296729).  Saving model ...
Validation loss decreased (1.296729 --> 1.296182).  Saving model ...
Validation loss decreased (1.296182 --> 1.295788).  Saving model ...
Validation loss decreased (1.295788 --> 1.295356).  Saving model ...
Validation loss decreased (1.295356 --> 1.294836).  Saving model ...
Validation loss decreased (1.294836 --> 1.294289).  Saving model ...
Validation loss decreased (1.294289 --> 1.293913).  Saving model ...
Validation loss decreased (1.293913 --> 1.293535).  Saving model ...
Validation loss decreased (1.293535 --> 1.293148).  Saving model ...
Validation loss decreased (1.293148 --> 1.292752).  Saving model ...
Validation loss decreased (1.292752 --> 1.292320).  Saving model ...
Validation loss decreased (1.292320 --> 1.291775).  Saving model ...
Validation loss decreased (1.291775 --> 1.291294).  Saving model ...
Validation loss decreased (1.291294 --> 1.290811).  Saving model ...
Validation loss decreased (1.290811 --> 1.290412).  Saving model ...
Validation loss decreased (1.290412 --> 1.289942).  Saving model ...
Validation loss decreased (1.289942 --> 1.289514).  Saving model ...
Validation loss decreased (1.289514 --> 1.289102).  Saving model ...
Validation loss decreased (1.289102 --> 1.288712).  Saving model ...
Validation loss decreased (1.288712 --> 1.288207).  Saving model ...
Validation loss decreased (1.288207 --> 1.287737).  Saving model ...
Validation loss decreased (1.287737 --> 1.287250).  Saving model ...
Validation loss decreased (1.287250 --> 1.286803).  Saving model ...
Validation loss decreased (1.286803 --> 1.286338).  Saving model ...
Validation loss decreased (1.286338 --> 1.285891).  Saving model ...
Validation loss decreased (1.285891 --> 1.285403).  Saving model ...
Validation loss decreased (1.285403 --> 1.284882).  Saving model ...
Validation loss decreased (1.284882 --> 1.284475).  Saving model ...
Validation loss decreased (1.284475 --> 1.283979).  Saving model ...
Validation loss decreased (1.283979 --> 1.283537).  Saving model ...
Validation loss decreased (1.283537 --> 1.283196).  Saving model ...
Validation loss decreased (1.283196 --> 1.282790).  Saving model ...
Validation loss decreased (1.282790 --> 1.282270).  Saving model ...
Validation loss decreased (1.282270 --> 1.281789).  Saving model ...
Validation loss decreased (1.281789 --> 1.281479).  Saving model ...
Validation loss decreased (1.281479 --> 1.281027).  Saving model ...
Validation loss decreased (1.281027 --> 1.280613).  Saving model ...
Validation loss decreased (1.280613 --> 1.280141).  Saving model ...
Validation loss decreased (1.280141 --> 1.279647).  Saving model ...
Validation loss decreased (1.279647 --> 1.279150).  Saving model ...
Validation loss decreased (1.279150 --> 1.278780).  Saving model ...
Validation loss decreased (1.278780 --> 1.278353).  Saving model ...
Validation loss decreased (1.278353 --> 1.277960).  Saving model ...
Validation loss decreased (1.277960 --> 1.277568).  Saving model ...
Validation loss decreased (1.277568 --> 1.277164).  Saving model ...
Validation loss decreased (1.277164 --> 1.276580).  Saving model ...
Validation loss decreased (1.276580 --> 1.276294).  Saving model ...
Validation loss decreased (1.276294 --> 1.275777).  Saving model ...
Validation loss decreased (1.275777 --> 1.275385).  Saving model ...
Validation loss decreased (1.275385 --> 1.275024).  Saving model ...
Validation loss decreased (1.275024 --> 1.274592).  Saving model ...
Validation loss decreased (1.274592 --> 1.274229).  Saving model ...
Validation loss decreased (1.274229 --> 1.273805).  Saving model ...
Validation loss decreased (1.273805 --> 1.273502).  Saving model ...
Validation loss decreased (1.273502 --> 1.273102).  Saving model ...
Validation loss decreased (1.273102 --> 1.272717).  Saving model ...
Validation loss decreased (1.272717 --> 1.272260).  Saving model ...
Validation loss decreased (1.272260 --> 1.271913).  Saving model ...
Validation loss decreased (1.271913 --> 1.271713).  Saving model ...
Validation loss decreased (1.271713 --> 1.271365).  Saving model ...
Validation loss decreased (1.271365 --> 1.270717).  Saving model ...
Validation loss decreased (1.270717 --> 1.270367).  Saving model ...
Validation loss decreased (1.270367 --> 1.269978).  Saving model ...
Validation loss decreased (1.269978 --> 1.269680).  Saving model ...
Validation loss decreased (1.269680 --> 1.269255).  Saving model ...
Validation loss decreased (1.269255 --> 1.268662).  Saving model ...
Validation loss decreased (1.268662 --> 1.268163).  Saving model ...
Validation loss decreased (1.268163 --> 1.267741).  Saving model ...
Validation loss decreased (1.267741 --> 1.267392).  Saving model ...
Validation loss decreased (1.267392 --> 1.266937).  Saving model ...
Validation loss decreased (1.266937 --> 1.266407).  Saving model ...
Validation loss decreased (1.266407 --> 1.265959).  Saving model ...
Validation loss decreased (1.265959 --> 1.265655).  Saving model ...
Validation loss decreased (1.265655 --> 1.265243).  Saving model ...
Validation loss decreased (1.265243 --> 1.264861).  Saving model ...
Validation loss decreased (1.264861 --> 1.264399).  Saving model ...
Validation loss decreased (1.264399 --> 1.264010).  Saving model ...
Validation loss decreased (1.264010 --> 1.263559).  Saving model ...
Validation loss decreased (1.263559 --> 1.263201).  Saving model ...
Validation loss decreased (1.263201 --> 1.262860).  Saving model ...
Validation loss decreased (1.262860 --> 1.262372).  Saving model ...
Validation loss decreased (1.262372 --> 1.261920).  Saving model ...
Validation loss decreased (1.261920 --> 1.261446).  Saving model ...
Validation loss decreased (1.261446 --> 1.261038).  Saving model ...
Validation loss decreased (1.261038 --> 1.260712).  Saving model ...
Validation loss decreased (1.260712 --> 1.260388).  Saving model ...
Validation loss decreased (1.260388 --> 1.260046).  Saving model ...
Validation loss decreased (1.260046 --> 1.259709).  Saving model ...
Validation loss decreased (1.259709 --> 1.259241).  Saving model ...
Validation loss decreased (1.259241 --> 1.258901).  Saving model ...
Validation loss decreased (1.258901 --> 1.258663).  Saving model ...
Validation loss decreased (1.258663 --> 1.258316).  Saving model ...
Validation loss decreased (1.258316 --> 1.257889).  Saving model ...
Validation loss decreased (1.257889 --> 1.257399).  Saving model ...
Validation loss decreased (1.257399 --> 1.256993).  Saving model ...
Validation loss decreased (1.256993 --> 1.256838).  Saving model ...
Validation loss decreased (1.256838 --> 1.256442).  Saving model ...
Validation loss decreased (1.256442 --> 1.256149).  Saving model ...
Validation loss decreased (1.256149 --> 1.255840).  Saving model ...
Validation loss decreased (1.255840 --> 1.255459).  Saving model ...
Validation loss decreased (1.255459 --> 1.255141).  Saving model ...
Validation loss decreased (1.255141 --> 1.254806).  Saving model ...
Validation loss decreased (1.254806 --> 1.254309).  Saving model ...
Validation loss decreased (1.254309 --> 1.253743).  Saving model ...
Validation loss decreased (1.253743 --> 1.253439).  Saving model ...
Validation loss decreased (1.253439 --> 1.252989).  Saving model ...
Validation loss decreased (1.252989 --> 1.252610).  Saving model ...
Validation loss decreased (1.252610 --> 1.252262).  Saving model ...
Validation loss decreased (1.252262 --> 1.251989).  Saving model ...
Validation loss decreased (1.251989 --> 1.251684).  Saving model ...
Validation loss decreased (1.251684 --> 1.251284).  Saving model ...
Validation loss decreased (1.251284 --> 1.250774).  Saving model ...
Validation loss decreased (1.250774 --> 1.250476).  Saving model ...
Validation loss decreased (1.250476 --> 1.250181).  Saving model ...
Validation loss decreased (1.250181 --> 1.249898).  Saving model ...
Validation loss decreased (1.249898 --> 1.249715).  Saving model ...
Validation loss decreased (1.249715 --> 1.249408).  Saving model ...
Validation loss decreased (1.249408 --> 1.249038).  Saving model ...
Validation loss decreased (1.249038 --> 1.248722).  Saving model ...
Validation loss decreased (1.248722 --> 1.248455).  Saving model ...
Validation loss decreased (1.248455 --> 1.248063).  Saving model ...
Validation loss decreased (1.248063 --> 1.247832).  Saving model ...
Validation loss decreased (1.247832 --> 1.247661).  Saving model ...
Validation loss decreased (1.247661 --> 1.247171).  Saving model ...
Validation loss decreased (1.247171 --> 1.246637).  Saving model ...
Validation loss decreased (1.246637 --> 1.246260).  Saving model ...
Validation loss decreased (1.246260 --> 1.245965).  Saving model ...
Validation loss decreased (1.245965 --> 1.245590).  Saving model ...
Validation loss decreased (1.245590 --> 1.245286).  Saving model ...
Validation loss decreased (1.245286 --> 1.245100).  Saving model ...
Validation loss decreased (1.245100 --> 1.244738).  Saving model ...
Validation loss decreased (1.244738 --> 1.244466).  Saving model ...
Validation loss decreased (1.244466 --> 1.244187).  Saving model ...
Validation loss decreased (1.244187 --> 1.243923).  Saving model ...
Validation loss decreased (1.243923 --> 1.243587).  Saving model ...
Validation loss decreased (1.243587 --> 1.243306).  Saving model ...
Validation loss decreased (1.243306 --> 1.243031).  Saving model ...
Validation loss decreased (1.243031 --> 1.242684).  Saving model ...
Validation loss decreased (1.242684 --> 1.242468).  Saving model ...
Validation loss decreased (1.242468 --> 1.242311).  Saving model ...
Validation loss decreased (1.242311 --> 1.241805).  Saving model ...
Validation loss decreased (1.241805 --> 1.241529).  Saving model ...
Validation loss decreased (1.241529 --> 1.241361).  Saving model ...
Validation loss decreased (1.241361 --> 1.240933).  Saving model ...
Validation loss decreased (1.240933 --> 1.240645).  Saving model ...
Validation loss decreased (1.240645 --> 1.240240).  Saving model ...
Validation loss decreased (1.240240 --> 1.240033).  Saving model ...
Validation loss decreased (1.240033 --> 1.239681).  Saving model ...
Validation loss decreased (1.239681 --> 1.239289).  Saving model ...
Validation loss decreased (1.239289 --> 1.238910).  Saving model ...
Validation loss decreased (1.238910 --> 1.238720).  Saving model ...
Validation loss decreased (1.238720 --> 1.238445).  Saving model ...
Validation loss decreased (1.238445 --> 1.238085).  Saving model ...
Validation loss decreased (1.238085 --> 1.237550).  Saving model ...
Validation loss decreased (1.237550 --> 1.237152).  Saving model ...
Validation loss decreased (1.237152 --> 1.236989).  Saving model ...
Validation loss decreased (1.236989 --> 1.236517).  Saving model ...
Validation loss decreased (1.236517 --> 1.236015).  Saving model ...
Validation loss decreased (1.236015 --> 1.235562).  Saving model ...
Validation loss decreased (1.235562 --> 1.235259).  Saving model ...
Validation loss decreased (1.235259 --> 1.234899).  Saving model ...
Validation loss decreased (1.234899 --> 1.234631).  Saving model ...
Validation loss decreased (1.234631 --> 1.234404).  Saving model ...
Validation loss decreased (1.234404 --> 1.234003).  Saving model ...
Validation loss decreased (1.234003 --> 1.233709).  Saving model ...
Validation loss decreased (1.233709 --> 1.233271).  Saving model ...
Validation loss decreased (1.233271 --> 1.233026).  Saving model ...
Validation loss decreased (1.233026 --> 1.232653).  Saving model ...
Validation loss decreased (1.232653 --> 1.232120).  Saving model ...
Validation loss decreased (1.232120 --> 1.231648).  Saving model ...
Validation loss decreased (1.231648 --> 1.231307).  Saving model ...
Validation loss decreased (1.231307 --> 1.230801).  Saving model ...
Validation loss decreased (1.230801 --> 1.230320).  Saving model ...
Validation loss decreased (1.230320 --> 1.229991).  Saving model ...
Validation loss decreased (1.229991 --> 1.229587).  Saving model ...
Validation loss decreased (1.229587 --> 1.229475).  Saving model ...
Validation loss decreased (1.229475 --> 1.229225).  Saving model ...
Validation loss decreased (1.229225 --> 1.229011).  Saving model ...
Validation loss decreased (1.229011 --> 1.228803).  Saving model ...
Validation loss decreased (1.228803 --> 1.228312).  Saving model ...
Validation loss decreased (1.228312 --> 1.228074).  Saving model ...
Validation loss decreased (1.228074 --> 1.227798).  Saving model ...
Validation loss decreased (1.227798 --> 1.227321).  Saving model ...
Validation loss decreased (1.227321 --> 1.226718).  Saving model ...
Validation loss decreased (1.226718 --> 1.226604).  Saving model ...
Validation loss decreased (1.226604 --> 1.226397).  Saving model ...
Validation loss decreased (1.226397 --> 1.226019).  Saving model ...
Validation loss decreased (1.226019 --> 1.225891).  Saving model ...
Validation loss decreased (1.225891 --> 1.225624).  Saving model ...
Validation loss decreased (1.225624 --> 1.225134).  Saving model ...
Validation loss decreased (1.225134 --> 1.224956).  Saving model ...
Validation loss decreased (1.224956 --> 1.224730).  Saving model ...
Validation loss decreased (1.224730 --> 1.224554).  Saving model ...
Validation loss decreased (1.224554 --> 1.224416).  Saving model ...
Validation loss decreased (1.224416 --> 1.224039).  Saving model ...
Validation loss decreased (1.224039 --> 1.223791).  Saving model ...
Validation loss decreased (1.223791 --> 1.223577).  Saving model ...
Validation loss decreased (1.223577 --> 1.223124).  Saving model ...
Validation loss decreased (1.223124 --> 1.222879).  Saving model ...
Validation loss decreased (1.222879 --> 1.222458).  Saving model ...
Validation loss decreased (1.222458 --> 1.222164).  Saving model ...
Validation loss decreased (1.222164 --> 1.221678).  Saving model ...
Validation loss decreased (1.221678 --> 1.221458).  Saving model ...
Validation loss decreased (1.221458 --> 1.221260).  Saving model ...
Validation loss decreased (1.221260 --> 1.221052).  Saving model ...
Validation loss decreased (1.221052 --> 1.220735).  Saving model ...
Validation loss decreased (1.220735 --> 1.220373).  Saving model ...
Validation loss decreased (1.220373 --> 1.220176).  Saving model ...
Validation loss decreased (1.220176 --> 1.219907).  Saving model ...
Validation loss decreased (1.219907 --> 1.219735).  Saving model ...
Validation loss decreased (1.219735 --> 1.219449).  Saving model ...
Validation loss decreased (1.219449 --> 1.218915).  Saving model ...
Validation loss decreased (1.218915 --> 1.218423).  Saving model ...
Validation loss decreased (1.218423 --> 1.217910).  Saving model ...
Validation loss decreased (1.217910 --> 1.217544).  Saving model ...
Validation loss decreased (1.217544 --> 1.217285).  Saving model ...
Validation loss decreased (1.217285 --> 1.217099).  Saving model ...
Validation loss decreased (1.217099 --> 1.216908).  Saving model ...
Validation loss decreased (1.216908 --> 1.216698).  Saving model ...
Validation loss decreased (1.216698 --> 1.216446).  Saving model ...
Validation loss decreased (1.216446 --> 1.216008).  Saving model ...
Validation loss decreased (1.216008 --> 1.215692).  Saving model ...
Validation loss decreased (1.215692 --> 1.215374).  Saving model ...
Validation loss decreased (1.215374 --> 1.215041).  Saving model ...
Validation loss decreased (1.215041 --> 1.214596).  Saving model ...
Validation loss decreased (1.214596 --> 1.214303).  Saving model ...
Validation loss decreased (1.214303 --> 1.213799).  Saving model ...
Validation loss decreased (1.213799 --> 1.213457).  Saving model ...
Validation loss decreased (1.213457 --> 1.213307).  Saving model ...
Validation loss decreased (1.213307 --> 1.212977).  Saving model ...
Validation loss decreased (1.212977 --> 1.212830).  Saving model ...
Validation loss decreased (1.212830 --> 1.212585).  Saving model ...
Validation loss decreased (1.212585 --> 1.212263).  Saving model ...
Validation loss decreased (1.212263 --> 1.211941).  Saving model ...
Validation loss decreased (1.211941 --> 1.211598).  Saving model ...
Validation loss decreased (1.211598 --> 1.211351).  Saving model ...
Validation loss decreased (1.211351 --> 1.211020).  Saving model ...
Validation loss decreased (1.211020 --> 1.210514).  Saving model ...
Validation loss decreased (1.210514 --> 1.210275).  Saving model ...
Validation loss decreased (1.210275 --> 1.209943).  Saving model ...
Validation loss decreased (1.209943 --> 1.209752).  Saving model ...
Validation loss decreased (1.209752 --> 1.209363).  Saving model ...
Validation loss decreased (1.209363 --> 1.208767).  Saving model ...
Validation loss decreased (1.208767 --> 1.208488).  Saving model ...
Validation loss decreased (1.208488 --> 1.208130).  Saving model ...
Validation loss decreased (1.208130 --> 1.207694).  Saving model ...
Validation loss decreased (1.207694 --> 1.207498).  Saving model ...
Validation loss decreased (1.207498 --> 1.207137).  Saving model ...
Validation loss decreased (1.207137 --> 1.206883).  Saving model ...
Validation loss decreased (1.206883 --> 1.206527).  Saving model ...
Validation loss decreased (1.206527 --> 1.206278).  Saving model ...
Validation loss decreased (1.206278 --> 1.206175).  Saving model ...
Validation loss decreased (1.206175 --> 1.206011).  Saving model ...
Validation loss decreased (1.206011 --> 1.205742).  Saving model ...
Validation loss decreased (1.205742 --> 1.205659).  Saving model ...
Validation loss decreased (1.205659 --> 1.205515).  Saving model ...
Validation loss decreased (1.205515 --> 1.205430).  Saving model ...
Validation loss decreased (1.205430 --> 1.205118).  Saving model ...
Validation loss decreased (1.205118 --> 1.204933).  Saving model ...
Validation loss decreased (1.204933 --> 1.204631).  Saving model ...
Validation loss decreased (1.204631 --> 1.204405).  Saving model ...
Validation loss decreased (1.204405 --> 1.204025).  Saving model ...
Validation loss decreased (1.204025 --> 1.203791).  Saving model ...
Validation loss decreased (1.203791 --> 1.203318).  Saving model ...
Validation loss decreased (1.203318 --> 1.202953).  Saving model ...
Validation loss decreased (1.202953 --> 1.202684).  Saving model ...
Validation loss decreased (1.202684 --> 1.202334).  Saving model ...
Validation loss decreased (1.202334 --> 1.201877).  Saving model ...
Validation loss decreased (1.201877 --> 1.201423).  Saving model ...
Validation loss decreased (1.201423 --> 1.201099).  Saving model ...
Validation loss decreased (1.201099 --> 1.200744).  Saving model ...
Validation loss decreased (1.200744 --> 1.200278).  Saving model ...
Validation loss decreased (1.200278 --> 1.200114).  Saving model ...
Validation loss decreased (1.200114 --> 1.199994).  Saving model ...
Validation loss decreased (1.199994 --> 1.199502).  Saving model ...
Validation loss decreased (1.199502 --> 1.199075).  Saving model ...
Validation loss decreased (1.199075 --> 1.198687).  Saving model ...
Validation loss decreased (1.198687 --> 1.198247).  Saving model ...
Validation loss decreased (1.198247 --> 1.198190).  Saving model ...
Validation loss decreased (1.198190 --> 1.197946).  Saving model ...
Validation loss decreased (1.197946 --> 1.197914).  Saving model ...
Validation loss decreased (1.197914 --> 1.197609).  Saving model ...
Validation loss decreased (1.197609 --> 1.197296).  Saving model ...
Validation loss decreased (1.197296 --> 1.196977).  Saving model ...
Validation loss decreased (1.196977 --> 1.196737).  Saving model ...
Validation loss decreased (1.196737 --> 1.196497).  Saving model ...
Validation loss decreased (1.196497 --> 1.196113).  Saving model ...
Validation loss decreased (1.196113 --> 1.195825).  Saving model ...
Validation loss decreased (1.195825 --> 1.195333).  Saving model ...
Validation loss decreased (1.195333 --> 1.195172).  Saving model ...
Validation loss decreased (1.195172 --> 1.195116).  Saving model ...
Validation loss decreased (1.195116 --> 1.194862).  Saving model ...
Validation loss decreased (1.194862 --> 1.194800).  Saving model ...
Validation loss decreased (1.194800 --> 1.194457).  Saving model ...
Validation loss decreased (1.194457 --> 1.194117).  Saving model ...
Validation loss decreased (1.194117 --> 1.193672).  Saving model ...
Validation loss decreased (1.193672 --> 1.193102).  Saving model ...
Validation loss decreased (1.193102 --> 1.193075).  Saving model ...
Validation loss decreased (1.193075 --> 1.192949).  Saving model ...
Validation loss decreased (1.192949 --> 1.192519).  Saving model ...
Validation loss decreased (1.192519 --> 1.192341).  Saving model ...
Validation loss decreased (1.192341 --> 1.191895).  Saving model ...
/localscratch/yinan.28735479.0/env/lib/python3.7/site-packages/torch/nn/functional.py:1794: UserWarning: nn.functional.tanh is deprecated. Use torch.tanh instead.
  warnings.warn("nn.functional.tanh is deprecated. Use torch.tanh instead.")
/localscratch/yinan.28735479.0/env/lib/python3.7/site-packages/transformers/optimization.py:155: UserWarning: This overload of add_ is deprecated:
	add_(Number alpha, Tensor other)
Consider using one of the following signatures instead:
	add_(Tensor other, *, Number alpha) (Triggered internally at  ../torch/csrc/utils/python_arg_parser.cpp:1025.)
  exp_avg.mul_(beta1).add_(1.0 - beta1, grad)
wandb: Waiting for W&B process to finish, PID 111154... (success).
wandb: - 0.00MB of 0.00MB uploaded (0.00MB deduped)wandb: \ 0.00MB of 0.00MB uploaded (0.00MB deduped)wandb: | 0.00MB of 0.00MB uploaded (0.00MB deduped)wandb: / 0.00MB of 0.00MB uploaded (0.00MB deduped)wandb: - 0.00MB of 0.00MB uploaded (0.00MB deduped)wandb: \ 0.00MB of 0.00MB uploaded (0.00MB deduped)wandb: | 0.00MB of 0.00MB uploaded (0.00MB deduped)wandb: / 0.00MB of 0.00MB uploaded (0.00MB deduped)wandb: - 0.00MB of 0.00MB uploaded (0.00MB deduped)wandb: \ 0.00MB of 0.00MB uploaded (0.00MB deduped)wandb: | 0.00MB of 0.00MB uploaded (0.00MB deduped)wandb: / 0.00MB of 0.00MB uploaded (0.00MB deduped)wandb: - 0.00MB of 0.00MB uploaded (0.00MB deduped)wandb:                                                                                
wandb: Run history:
wandb:     e_F1 ▁▁▂▃▃▄▅▅▅▅▅▆▆▆▆▇▇▇▇▇▇▇▇▇▇▇▇▇████████████
wandb:   e_loss █▇▇▆▆▆▆▅▅▅▅▅▅▄▄▄▄▄▃▃▃▃▃▃▃▃▂▂▂▂▂▂▂▂▁▁▁▁▁▁
wandb:     t_F1 ▁▁▂▂▃▃▄▃▄▄▄▆▄▅▅▆▆▆▆▇▇▆▆▆▇▇▇▇▇▇▇▇▇███████
wandb:   t_loss ██▇▇▇▇▆▆▆▆▆▅▅▅▅▅▄▄▄▄▄▄▄▄▃▃▃▃▃▃▂▃▂▂▂▂▂▂▁▁
wandb: 
wandb: Run summary:
wandb:     e_F1 46.39148
wandb:   e_loss 1.19189
wandb:     t_F1 51.37251
wandb:   t_loss 1.10685
wandb: 
wandb: Synced 4 W&B file(s), 0 media file(s), 0 artifact file(s) and 0 other file(s)
wandb: Synced honest-smoke-1: https://wandb.ai/yinanazhou/xl_512_bs_8_lr_1e07_es_10_lc_False_nr_True_sr_True_stem_True_lemma_False_repeat_1_fold_1/runs/2odzktdf
wandb: Find logs at: ./wandb/run-20220311_092401-2odzktdf/logs/debug.log
wandb: 

wandb: wandb version 0.12.11 is available!  To upgrade, please run:
wandb:  $ pip install wandb --upgrade
2022-03-11 14:51:25.707776: I tensorflow/stream_executor/platform/default/dso_loader.cc:48] Successfully opened dynamic library libcudart.so.10.1
wandb: Tracking run with wandb version 0.12.5
wandb: Syncing run decent-armadillo-1
wandb: ⭐️ View project at https://wandb.ai/yinanazhou/xl_512_bs_8_lr_1e07_es_10_lc_False_nr_True_sr_True_stem_True_lemma_False_repeat_1_fold_2
wandb: 🚀 View run at https://wandb.ai/yinanazhou/xl_512_bs_8_lr_1e07_es_10_lc_False_nr_True_sr_True_stem_True_lemma_False_repeat_1_fold_2/runs/1k19go89
wandb: Run data is saved locally in /project/6002780/yinan/Thesis_MER_Lyrics/lyric-emotion/wandb/run-20220311_145122-1k19go89
wandb: Run `wandb offline` to turn off syncing.
slurmstepd: error: *** JOB 28735479 ON cdr2592 CANCELLED AT 2022-03-11T19:22:48 DUE TO TIME LIMIT ***
