Unloading StdEnv/2020

Due to MODULEPATH changes, the following have been reloaded:
  1) mii/1.1.1


The following have been reloaded with a version change:
  1) python/3.8.2 => python/3.7.4

Using base prefix '/cvmfs/soft.computecanada.ca/easybuild/software/2017/Core/python/3.7.4'
New python executable in /localscratch/yinan.27794538.0/env/bin/python
Installing setuptools, pip, wheel...
done.
Ignoring pip: markers 'python_version < "3"' don't match your environment
Looking in links: /cvmfs/soft.computecanada.ca/custom/python/wheelhouse/nix/avx2, /cvmfs/soft.computecanada.ca/custom/python/wheelhouse/nix/generic, /cvmfs/soft.computecanada.ca/custom/python/wheelhouse/generic
Collecting pip
Installing collected packages: pip
  Found existing installation: pip 19.1.1
    Uninstalling pip-19.1.1:
      Successfully uninstalled pip-19.1.1
Successfully installed pip-21.2.3+computecanada
Looking in links: /cvmfs/soft.computecanada.ca/custom/python/wheelhouse/nix/avx2, /cvmfs/soft.computecanada.ca/custom/python/wheelhouse/nix/generic, /cvmfs/soft.computecanada.ca/custom/python/wheelhouse/generic
Processing /cvmfs/soft.computecanada.ca/custom/python/wheelhouse/generic/keras-2.7.0+computecanada-py2.py3-none-any.whl
Processing /cvmfs/soft.computecanada.ca/custom/python/wheelhouse/generic/Keras_Preprocessing-1.1.2+computecanada-py3-none-any.whl
Requirement already satisfied: matplotlib in /cvmfs/soft.computecanada.ca/easybuild/software/2017/Core/scipy-stack/2019a/lib/python3.7/site-packages (from -r requirements.txt (line 3)) (3.0.2)
Processing /cvmfs/soft.computecanada.ca/custom/python/wheelhouse/generic/nltk-3.6.5+computecanada-py3-none-any.whl
Processing /cvmfs/soft.computecanada.ca/custom/python/wheelhouse/generic/scikit_learn-0.22.1+computecanada-cp37-cp37m-linux_x86_64.whl
Processing /cvmfs/soft.computecanada.ca/custom/python/wheelhouse/generic/tensorboard-2.3.0+computecanada-py3-none-any.whl
Processing /cvmfs/soft.computecanada.ca/custom/python/wheelhouse/generic/tensorboard_plugin_wit-1.7.0+computecanada-py3-none-any.whl
Processing /cvmfs/soft.computecanada.ca/custom/python/wheelhouse/generic/tensorflow_gpu-2.3.0+computecanada-cp37-cp37m-linux_x86_64.whl
Processing /cvmfs/soft.computecanada.ca/custom/python/wheelhouse/generic/tensorflow_estimator-2.3.0+computecanada-py2.py3-none-any.whl
Processing /cvmfs/soft.computecanada.ca/custom/python/wheelhouse/generic/tokenizers-0.5.2+computecanada-cp37-cp37m-linux_x86_64.whl
Processing /cvmfs/soft.computecanada.ca/custom/python/wheelhouse/nix/avx2/torch-1.4.0+computecanada-cp37-cp37m-linux_x86_64.whl
Processing /cvmfs/soft.computecanada.ca/custom/python/wheelhouse/generic/torchtext-0.6.0+computecanada-py3-none-any.whl
Processing /cvmfs/soft.computecanada.ca/custom/python/wheelhouse/generic/torchvision-0.8.2+computecanada-cp37-cp37m-linux_x86_64.whl
Processing /cvmfs/soft.computecanada.ca/custom/python/wheelhouse/generic/transformers-2.5.1+computecanada-py3-none-any.whl
Processing /cvmfs/soft.computecanada.ca/custom/python/wheelhouse/generic/urllib3-1.26.7+computecanada-py2.py3-none-any.whl
ERROR: Could not find a version that satisfies the requirement regex>=2021.8.3 (from nltk) (from versions: 2018.1.10+computecanada, 2019.11.1+computecanada, 2020.11.13+computecanada)
ERROR: No matching distribution found for regex>=2021.8.3
Looking in links: /cvmfs/soft.computecanada.ca/custom/python/wheelhouse/nix/avx2, /cvmfs/soft.computecanada.ca/custom/python/wheelhouse/nix/generic, /cvmfs/soft.computecanada.ca/custom/python/wheelhouse/generic
ERROR: Could not find a version that satisfies the requirement numpy==1.20.0+computacanada (from versions: 1.15.0+computecanada, 1.15.2+computecanada, 1.15.4+computecanada, 1.16.0+computecanada, 1.16.2+computecanada, 1.16.3+computecanada, 1.17.4+computecanada, 1.18.1+computecanada, 1.18.4+computecanada, 1.19.1+computecanada, 1.19.2+computecanada, 1.20.2+computecanada)
ERROR: No matching distribution found for numpy==1.20.0+computacanada
Looking in links: /cvmfs/soft.computecanada.ca/custom/python/wheelhouse/nix/avx2, /cvmfs/soft.computecanada.ca/custom/python/wheelhouse/nix/generic, /cvmfs/soft.computecanada.ca/custom/python/wheelhouse/generic
Processing /cvmfs/soft.computecanada.ca/custom/python/wheelhouse/generic/wandb-0.12.5+computecanada-py2.py3-none-any.whl
Processing /cvmfs/soft.computecanada.ca/custom/python/wheelhouse/generic/pathtools-0.1.2+computecanada-py3-none-any.whl
Processing /cvmfs/soft.computecanada.ca/custom/python/wheelhouse/generic/protobuf-3.19.3+computecanada-py2.py3-none-any.whl
Processing /cvmfs/soft.computecanada.ca/custom/python/wheelhouse/generic/GitPython-3.1.24+computecanada-py3-none-any.whl
Processing /cvmfs/soft.computecanada.ca/custom/python/wheelhouse/generic/docker_pycreds-0.4.0+computecanada-py2.py3-none-any.whl
Processing /cvmfs/soft.computecanada.ca/custom/python/wheelhouse/generic/PyYAML-5.3.1+computecanada-cp37-cp37m-linux_x86_64.whl
Processing /cvmfs/soft.computecanada.ca/custom/python/wheelhouse/generic/click-8.0.3+computecanada-py3-none-any.whl
Processing /cvmfs/soft.computecanada.ca/custom/python/wheelhouse/generic/configparser-5.0.2+computecanada-py3-none-any.whl
Processing /cvmfs/soft.computecanada.ca/custom/python/wheelhouse/generic/shortuuid-1.0.1+computecanada-py3-none-any.whl
Processing /cvmfs/soft.computecanada.ca/custom/python/wheelhouse/generic/sentry_sdk-1.5.0+computecanada-py2.py3-none-any.whl
Processing /cvmfs/soft.computecanada.ca/custom/python/wheelhouse/generic/subprocess32-3.5.4+computecanada-py3-none-any.whl
Requirement already satisfied: python-dateutil>=2.6.1 in /cvmfs/soft.computecanada.ca/easybuild/software/2017/Core/scipy-stack/2019a/lib/python3.7/site-packages (from wandb) (2.7.5)
Processing /cvmfs/soft.computecanada.ca/custom/python/wheelhouse/generic/psutil-5.7.3+computecanada-cp37-cp37m-linux_x86_64.whl
Requirement already satisfied: requests<3,>=2.0.0 in /cvmfs/soft.computecanada.ca/easybuild/software/2017/Core/scipy-stack/2019a/lib/python3.7/site-packages (from wandb) (2.21.0)
Processing /cvmfs/soft.computecanada.ca/custom/python/wheelhouse/generic/yaspin-2.1.0+computecanada-py3-none-any.whl
Processing /cvmfs/soft.computecanada.ca/custom/python/wheelhouse/generic/promise-2.3+computecanada-py3-none-any.whl
Processing /cvmfs/soft.computecanada.ca/custom/python/wheelhouse/generic/six-1.16.0+computecanada-py2.py3-none-any.whl
Requirement already satisfied: importlib-metadata in /cvmfs/soft.computecanada.ca/easybuild/software/2017/Core/scipy-stack/2019a/lib/python3.7/site-packages (from Click!=8.0.0,>=7.0->wandb) (0.8)
Processing /cvmfs/soft.computecanada.ca/custom/python/wheelhouse/generic/gitdb-4.0.9+computecanada-py3-none-any.whl
Processing /cvmfs/soft.computecanada.ca/custom/python/wheelhouse/generic/typing_extensions-4.0.1+computecanada-py3-none-any.whl
Processing /cvmfs/soft.computecanada.ca/custom/python/wheelhouse/generic/smmap-5.0.0+computecanada-py3-none-any.whl
Requirement already satisfied: chardet<3.1.0,>=3.0.2 in /cvmfs/soft.computecanada.ca/easybuild/software/2017/Core/scipy-stack/2019a/lib/python3.7/site-packages (from requests<3,>=2.0.0->wandb) (3.0.4)
Requirement already satisfied: certifi>=2017.4.17 in /cvmfs/soft.computecanada.ca/easybuild/software/2017/Core/scipy-stack/2019a/lib/python3.7/site-packages (from requests<3,>=2.0.0->wandb) (2018.11.29)
Requirement already satisfied: idna<2.9,>=2.5 in /cvmfs/soft.computecanada.ca/easybuild/software/2017/Core/scipy-stack/2019a/lib/python3.7/site-packages (from requests<3,>=2.0.0->wandb) (2.8)
Requirement already satisfied: urllib3<1.25,>=1.21.1 in /cvmfs/soft.computecanada.ca/easybuild/software/2017/Core/scipy-stack/2019a/lib/python3.7/site-packages (from requests<3,>=2.0.0->wandb) (1.24.1)
Processing /cvmfs/soft.computecanada.ca/custom/python/wheelhouse/generic/termcolor-1.1.0+computecanada-py3-none-any.whl
Requirement already satisfied: zipp>=0.3.2 in /cvmfs/soft.computecanada.ca/easybuild/software/2017/Core/scipy-stack/2019a/lib/python3.7/site-packages (from importlib-metadata->Click!=8.0.0,>=7.0->wandb) (0.3.3)
Installing collected packages: smmap, typing-extensions, termcolor, six, gitdb, yaspin, subprocess32, shortuuid, sentry-sdk, PyYAML, psutil, protobuf, promise, pathtools, GitPython, docker-pycreds, configparser, Click, wandb
  Attempting uninstall: six
    Found existing installation: six 1.12.0
    Not uninstalling six at /cvmfs/soft.computecanada.ca/easybuild/software/2017/Core/scipy-stack/2019a/lib/python3.7/site-packages, outside environment /localscratch/yinan.27794538.0/env
    Can't uninstall 'six'. No files were found to uninstall.
Successfully installed Click-8.0.3+computecanada GitPython-3.1.24+computecanada PyYAML-5.3.1+computecanada configparser-5.0.2+computecanada docker-pycreds-0.4.0+computecanada gitdb-4.0.9+computecanada pathtools-0.1.2+computecanada promise-2.3+computecanada protobuf-3.19.3+computecanada psutil-5.7.3+computecanada sentry-sdk-1.5.0+computecanada shortuuid-1.0.1+computecanada six-1.16.0+computecanada smmap-5.0.0+computecanada subprocess32-3.5.4+computecanada termcolor-1.1.0+computecanada typing-extensions-4.0.1+computecanada wandb-0.12.5+computecanada yaspin-2.1.0+computecanada
Looking in links: /cvmfs/soft.computecanada.ca/custom/python/wheelhouse/nix/avx2, /cvmfs/soft.computecanada.ca/custom/python/wheelhouse/nix/generic, /cvmfs/soft.computecanada.ca/custom/python/wheelhouse/generic
ERROR: Could not find a version that satisfies the requirement sagemaker (from versions: none)
ERROR: No matching distribution found for sagemaker
Looking in links: /cvmfs/soft.computecanada.ca/custom/python/wheelhouse/nix/avx2, /cvmfs/soft.computecanada.ca/custom/python/wheelhouse/nix/generic, /cvmfs/soft.computecanada.ca/custom/python/wheelhouse/generic
Processing /cvmfs/soft.computecanada.ca/custom/python/wheelhouse/generic/torch-1.9.1+computecanada-cp37-cp37m-linux_x86_64.whl
Requirement already satisfied: typing-extensions in /localscratch/yinan.27794538.0/env/lib/python3.7/site-packages (from torch) (4.0.1+computecanada)
Installing collected packages: torch
Successfully installed torch-1.9.1+computecanada
Looking in links: /cvmfs/soft.computecanada.ca/custom/python/wheelhouse/nix/avx2, /cvmfs/soft.computecanada.ca/custom/python/wheelhouse/nix/generic, /cvmfs/soft.computecanada.ca/custom/python/wheelhouse/generic
Processing /cvmfs/soft.computecanada.ca/custom/python/wheelhouse/generic/transformers-2.5.1+computecanada-py3-none-any.whl
Requirement already satisfied: requests in /cvmfs/soft.computecanada.ca/easybuild/software/2017/Core/scipy-stack/2019a/lib/python3.7/site-packages (from transformers==2.5.1+computecanada) (2.21.0)
Processing /cvmfs/soft.computecanada.ca/custom/python/wheelhouse/generic/sacremoses-0.0.46+computecanada-py3-none-any.whl
Processing /cvmfs/soft.computecanada.ca/custom/python/wheelhouse/generic/tqdm-4.62.3+computecanada-py2.py3-none-any.whl
Processing /cvmfs/soft.computecanada.ca/custom/python/wheelhouse/generic/sentencepiece-0.1.91+computecanada-cp37-cp37m-linux_x86_64.whl
Processing /cvmfs/soft.computecanada.ca/custom/python/wheelhouse/generic/tokenizers-0.5.2+computecanada-cp37-cp37m-linux_x86_64.whl
Processing /cvmfs/soft.computecanada.ca/custom/python/wheelhouse/generic/filelock-3.4.2+computecanada-py3-none-any.whl
Processing /cvmfs/soft.computecanada.ca/custom/python/wheelhouse/generic/boto3-1.20.52+computecanada-py3-none-any.whl
Processing /cvmfs/soft.computecanada.ca/custom/python/wheelhouse/generic/regex-2020.11.13+computecanada-cp37-cp37m-linux_x86_64.whl
Requirement already satisfied: numpy in /cvmfs/soft.computecanada.ca/easybuild/software/2017/Core/scipy-stack/2019a/lib/python3.7/site-packages (from transformers==2.5.1+computecanada) (1.16.0)
Processing /cvmfs/soft.computecanada.ca/custom/python/wheelhouse/generic/botocore-1.23.52+computecanada-py3-none-any.whl
Processing /cvmfs/soft.computecanada.ca/custom/python/wheelhouse/generic/s3transfer-0.5.1+computecanada-py3-none-any.whl
Processing /cvmfs/soft.computecanada.ca/custom/python/wheelhouse/generic/jmespath-0.10.0+computecanada-py2.py3-none-any.whl
Requirement already satisfied: python-dateutil<3.0.0,>=2.1 in /cvmfs/soft.computecanada.ca/easybuild/software/2017/Core/scipy-stack/2019a/lib/python3.7/site-packages (from botocore<1.24.0,>=1.23.52->boto3->transformers==2.5.1+computecanada) (2.7.5)
Processing /cvmfs/soft.computecanada.ca/custom/python/wheelhouse/generic/urllib3-1.26.8+computecanada-py2.py3-none-any.whl
Requirement already satisfied: six>=1.5 in /localscratch/yinan.27794538.0/env/lib/python3.7/site-packages (from python-dateutil<3.0.0,>=2.1->botocore<1.24.0,>=1.23.52->boto3->transformers==2.5.1+computecanada) (1.16.0+computecanada)
Requirement already satisfied: chardet<3.1.0,>=3.0.2 in /cvmfs/soft.computecanada.ca/easybuild/software/2017/Core/scipy-stack/2019a/lib/python3.7/site-packages (from requests->transformers==2.5.1+computecanada) (3.0.4)
Requirement already satisfied: certifi>=2017.4.17 in /cvmfs/soft.computecanada.ca/easybuild/software/2017/Core/scipy-stack/2019a/lib/python3.7/site-packages (from requests->transformers==2.5.1+computecanada) (2018.11.29)
Requirement already satisfied: idna<2.9,>=2.5 in /cvmfs/soft.computecanada.ca/easybuild/software/2017/Core/scipy-stack/2019a/lib/python3.7/site-packages (from requests->transformers==2.5.1+computecanada) (2.8)
Processing /cvmfs/soft.computecanada.ca/custom/python/wheelhouse/generic/requests-2.27.1+computecanada-py2.py3-none-any.whl
Processing /cvmfs/soft.computecanada.ca/custom/python/wheelhouse/generic/charset_normalizer-2.0.11+computecanada-py3-none-any.whl
Requirement already satisfied: click in /localscratch/yinan.27794538.0/env/lib/python3.7/site-packages (from sacremoses->transformers==2.5.1+computecanada) (8.0.3+computecanada)
Processing /cvmfs/soft.computecanada.ca/custom/python/wheelhouse/generic/joblib-1.1.0+computecanada-py2.py3-none-any.whl
Requirement already satisfied: importlib-metadata in /cvmfs/soft.computecanada.ca/easybuild/software/2017/Core/scipy-stack/2019a/lib/python3.7/site-packages (from click->sacremoses->transformers==2.5.1+computecanada) (0.8)
Requirement already satisfied: zipp>=0.3.2 in /cvmfs/soft.computecanada.ca/easybuild/software/2017/Core/scipy-stack/2019a/lib/python3.7/site-packages (from importlib-metadata->click->sacremoses->transformers==2.5.1+computecanada) (0.3.3)
Installing collected packages: urllib3, jmespath, botocore, tqdm, s3transfer, regex, joblib, charset-normalizer, tokenizers, sentencepiece, sacremoses, requests, filelock, boto3, transformers
  Attempting uninstall: urllib3
    Found existing installation: urllib3 1.24.1
    Not uninstalling urllib3 at /cvmfs/soft.computecanada.ca/easybuild/software/2017/Core/scipy-stack/2019a/lib/python3.7/site-packages, outside environment /localscratch/yinan.27794538.0/env
    Can't uninstall 'urllib3'. No files were found to uninstall.
  Attempting uninstall: requests
    Found existing installation: requests 2.21.0
    Not uninstalling requests at /cvmfs/soft.computecanada.ca/easybuild/software/2017/Core/scipy-stack/2019a/lib/python3.7/site-packages, outside environment /localscratch/yinan.27794538.0/env
    Can't uninstall 'requests'. No files were found to uninstall.
Successfully installed boto3-1.20.52+computecanada botocore-1.23.52+computecanada charset-normalizer-2.0.11+computecanada filelock-3.4.2+computecanada jmespath-0.10.0+computecanada joblib-1.1.0+computecanada regex-2020.11.13+computecanada requests-2.27.1+computecanada s3transfer-0.5.1+computecanada sacremoses-0.0.46+computecanada sentencepiece-0.1.91+computecanada tokenizers-0.5.2+computecanada tqdm-4.62.3+computecanada transformers-2.5.1+computecanada urllib3-1.26.8+computecanada
Looking in links: /cvmfs/soft.computecanada.ca/custom/python/wheelhouse/nix/avx2, /cvmfs/soft.computecanada.ca/custom/python/wheelhouse/nix/generic, /cvmfs/soft.computecanada.ca/custom/python/wheelhouse/generic
Processing /cvmfs/soft.computecanada.ca/custom/python/wheelhouse/generic/tensorflow_gpu-2.3.0+computecanada-cp37-cp37m-linux_x86_64.whl
Processing /cvmfs/soft.computecanada.ca/custom/python/wheelhouse/generic/opt_einsum-3.3.0+computecanada-py3-none-any.whl
Processing /cvmfs/soft.computecanada.ca/custom/python/wheelhouse/generic/Keras_Preprocessing-1.1.2+computecanada-py3-none-any.whl
Processing /cvmfs/soft.computecanada.ca/custom/python/wheelhouse/nix/generic/scipy-1.4.1+computecanada-cp37-cp37m-linux_x86_64.whl
Processing /cvmfs/soft.computecanada.ca/custom/python/wheelhouse/generic/gast-0.3.3+computecanada-py3-none-any.whl
Processing /cvmfs/soft.computecanada.ca/custom/python/wheelhouse/generic/astunparse-1.6.3+computecanada-py2.py3-none-any.whl
Requirement already satisfied: numpy<1.19.0,>=1.16.0 in /cvmfs/soft.computecanada.ca/easybuild/software/2017/Core/scipy-stack/2019a/lib/python3.7/site-packages (from tensorflow_gpu==2.3.0+computecanada) (1.16.0)
Processing /cvmfs/soft.computecanada.ca/custom/python/wheelhouse/generic/wrapt-1.11.2+computecanada-cp37-cp37m-linux_x86_64.whl
Requirement already satisfied: termcolor>=1.1.0 in /localscratch/yinan.27794538.0/env/lib/python3.7/site-packages (from tensorflow_gpu==2.3.0+computecanada) (1.1.0+computecanada)
Requirement already satisfied: wheel>=0.26 in /localscratch/yinan.27794538.0/env/lib/python3.7/site-packages (from tensorflow_gpu==2.3.0+computecanada) (0.33.4)
Processing /cvmfs/soft.computecanada.ca/custom/python/wheelhouse/generic/grpcio-1.38.0+computecanada-cp37-cp37m-linux_x86_64.whl
Processing /cvmfs/soft.computecanada.ca/custom/python/wheelhouse/generic/tensorboard-2.6.0+computecanada-py3-none-any.whl
Processing /cvmfs/soft.computecanada.ca/custom/python/wheelhouse/generic/absl_py-1.0.0+computecanada-py3-none-any.whl
Processing /cvmfs/soft.computecanada.ca/custom/python/wheelhouse/nix/avx2/h5py-2.10.0+computecanada-cp37-cp37m-linux_x86_64.whl
Requirement already satisfied: protobuf>=3.9.2 in /localscratch/yinan.27794538.0/env/lib/python3.7/site-packages (from tensorflow_gpu==2.3.0+computecanada) (3.19.3+computecanada)
Requirement already satisfied: six>=1.12.0 in /localscratch/yinan.27794538.0/env/lib/python3.7/site-packages (from tensorflow_gpu==2.3.0+computecanada) (1.16.0+computecanada)
Processing /cvmfs/soft.computecanada.ca/custom/python/wheelhouse/generic/google_pasta-0.2.0+computecanada-py3-none-any.whl
Processing /cvmfs/soft.computecanada.ca/custom/python/wheelhouse/generic/tensorflow_estimator-2.3.0+computecanada-py2.py3-none-any.whl
Requirement already satisfied: setuptools>=41.0.0 in /localscratch/yinan.27794538.0/env/lib/python3.7/site-packages (from tensorboard<3,>=2.3.0->tensorflow_gpu==2.3.0+computecanada) (41.0.1)
Processing /cvmfs/soft.computecanada.ca/custom/python/wheelhouse/generic/tensorboard_data_server-0.6.1+computecanada-py3-none-linux_x86_64.whl
Processing /cvmfs/soft.computecanada.ca/custom/python/wheelhouse/generic/tensorboard_plugin_wit-1.8.0+computecanada-py3-none-any.whl
Processing /cvmfs/soft.computecanada.ca/custom/python/wheelhouse/generic/google_auth_oauthlib-0.4.6+computecanada-py2.py3-none-any.whl
Requirement already satisfied: requests<3,>=2.21.0 in /localscratch/yinan.27794538.0/env/lib/python3.7/site-packages (from tensorboard<3,>=2.3.0->tensorflow_gpu==2.3.0+computecanada) (2.27.1+computecanada)
Processing /cvmfs/soft.computecanada.ca/custom/python/wheelhouse/generic/Werkzeug-2.0.3+computecanada-py3-none-any.whl
Processing /cvmfs/soft.computecanada.ca/custom/python/wheelhouse/generic/google_auth-1.35.0+computecanada-py2.py3-none-any.whl
Processing /cvmfs/soft.computecanada.ca/custom/python/wheelhouse/generic/Markdown-3.3.6+computecanada-py3-none-any.whl
Processing /cvmfs/soft.computecanada.ca/custom/python/wheelhouse/generic/rsa-4.8+computecanada-py3-none-any.whl
Processing /cvmfs/soft.computecanada.ca/custom/python/wheelhouse/generic/pyasn1_modules-0.2.8+computecanada-py2.py3-none-any.whl
Processing /cvmfs/soft.computecanada.ca/custom/python/wheelhouse/generic/cachetools-4.2.4+computecanada-py3-none-any.whl
Processing /cvmfs/soft.computecanada.ca/custom/python/wheelhouse/generic/requests_oauthlib-1.3.0+computecanada-py2.py3-none-any.whl
Processing /cvmfs/soft.computecanada.ca/custom/python/wheelhouse/generic/importlib_metadata-4.10.1+computecanada-py3-none-any.whl
Requirement already satisfied: typing-extensions>=3.6.4 in /localscratch/yinan.27794538.0/env/lib/python3.7/site-packages (from importlib-metadata>=4.4->markdown>=2.6.8->tensorboard<3,>=2.3.0->tensorflow_gpu==2.3.0+computecanada) (4.0.1+computecanada)
Processing /cvmfs/soft.computecanada.ca/custom/python/wheelhouse/generic/zipp-3.7.0+computecanada-py3-none-any.whl
Processing /cvmfs/soft.computecanada.ca/custom/python/wheelhouse/generic/pyasn1-0.4.8+computecanada-py2.py3-none-any.whl
Requirement already satisfied: certifi>=2017.4.17 in /cvmfs/soft.computecanada.ca/easybuild/software/2017/Core/scipy-stack/2019a/lib/python3.7/site-packages (from requests<3,>=2.21.0->tensorboard<3,>=2.3.0->tensorflow_gpu==2.3.0+computecanada) (2018.11.29)
Requirement already satisfied: urllib3<1.27,>=1.21.1 in /localscratch/yinan.27794538.0/env/lib/python3.7/site-packages (from requests<3,>=2.21.0->tensorboard<3,>=2.3.0->tensorflow_gpu==2.3.0+computecanada) (1.26.8+computecanada)
Requirement already satisfied: charset-normalizer~=2.0.0 in /localscratch/yinan.27794538.0/env/lib/python3.7/site-packages (from requests<3,>=2.21.0->tensorboard<3,>=2.3.0->tensorflow_gpu==2.3.0+computecanada) (2.0.11+computecanada)
Requirement already satisfied: idna<4,>=2.5 in /cvmfs/soft.computecanada.ca/easybuild/software/2017/Core/scipy-stack/2019a/lib/python3.7/site-packages (from requests<3,>=2.21.0->tensorboard<3,>=2.3.0->tensorflow_gpu==2.3.0+computecanada) (2.8)
Processing /cvmfs/soft.computecanada.ca/custom/python/wheelhouse/generic/oauthlib-3.1.1+computecanada-py2.py3-none-any.whl
Installing collected packages: pyasn1, zipp, rsa, pyasn1-modules, oauthlib, cachetools, requests-oauthlib, importlib-metadata, google-auth, werkzeug, tensorboard-plugin-wit, tensorboard-data-server, markdown, grpcio, google-auth-oauthlib, absl-py, wrapt, tensorflow-estimator, tensorboard, scipy, opt-einsum, keras-preprocessing, h5py, google-pasta, gast, astunparse, tensorflow-gpu
  Attempting uninstall: pyasn1
    Found existing installation: pyasn1 0.4.3
    Not uninstalling pyasn1 at /cvmfs/soft.computecanada.ca/easybuild/software/2017/Core/scipy-stack/2019a/lib/python3.7/site-packages, outside environment /localscratch/yinan.27794538.0/env
    Can't uninstall 'pyasn1'. No files were found to uninstall.
  Attempting uninstall: zipp
    Found existing installation: zipp 0.3.3
    Not uninstalling zipp at /cvmfs/soft.computecanada.ca/easybuild/software/2017/Core/scipy-stack/2019a/lib/python3.7/site-packages, outside environment /localscratch/yinan.27794538.0/env
    Can't uninstall 'zipp'. No files were found to uninstall.
  Attempting uninstall: importlib-metadata
    Found existing installation: importlib-metadata 0.8
    Not uninstalling importlib-metadata at /cvmfs/soft.computecanada.ca/easybuild/software/2017/Core/scipy-stack/2019a/lib/python3.7/site-packages, outside environment /localscratch/yinan.27794538.0/env
    Can't uninstall 'importlib-metadata'. No files were found to uninstall.
  Attempting uninstall: scipy
    Found existing installation: scipy 1.2.0
    Not uninstalling scipy at /cvmfs/soft.computecanada.ca/easybuild/software/2017/Core/scipy-stack/2019a/lib/python3.7/site-packages, outside environment /localscratch/yinan.27794538.0/env
    Can't uninstall 'scipy'. No files were found to uninstall.
Successfully installed absl-py-1.0.0+computecanada astunparse-1.6.3+computecanada cachetools-4.2.4+computecanada gast-0.3.3+computecanada google-auth-1.35.0+computecanada google-auth-oauthlib-0.4.6+computecanada google-pasta-0.2.0+computecanada grpcio-1.38.0+computecanada h5py-2.10.0+computecanada importlib-metadata-4.10.1+computecanada keras-preprocessing-1.1.2+computecanada markdown-3.3.6+computecanada oauthlib-3.1.1+computecanada opt-einsum-3.3.0+computecanada pyasn1-0.4.8+computecanada pyasn1-modules-0.2.8+computecanada requests-oauthlib-1.3.0+computecanada rsa-4.8+computecanada scipy-1.4.1+computecanada tensorboard-2.6.0+computecanada tensorboard-data-server-0.6.1+computecanada tensorboard-plugin-wit-1.8.0+computecanada tensorflow-estimator-2.3.0+computecanada tensorflow-gpu-2.3.0+computecanada werkzeug-2.0.3+computecanada wrapt-1.11.2+computecanada zipp-3.7.0+computecanada
Looking in links: /cvmfs/soft.computecanada.ca/custom/python/wheelhouse/nix/avx2, /cvmfs/soft.computecanada.ca/custom/python/wheelhouse/nix/generic, /cvmfs/soft.computecanada.ca/custom/python/wheelhouse/generic
Processing /cvmfs/soft.computecanada.ca/custom/python/wheelhouse/generic/keras-2.7.0+computecanada-py2.py3-none-any.whl
Installing collected packages: Keras
Successfully installed Keras-2.7.0+computecanada
Looking in links: /cvmfs/soft.computecanada.ca/custom/python/wheelhouse/nix/avx2, /cvmfs/soft.computecanada.ca/custom/python/wheelhouse/nix/generic, /cvmfs/soft.computecanada.ca/custom/python/wheelhouse/generic
Processing /cvmfs/soft.computecanada.ca/custom/python/wheelhouse/generic/urllib3-1.26.7+computecanada-py2.py3-none-any.whl
Installing collected packages: urllib3
  Attempting uninstall: urllib3
    Found existing installation: urllib3 1.26.8+computecanada
    Uninstalling urllib3-1.26.8+computecanada:
      Successfully uninstalled urllib3-1.26.8+computecanada
Successfully installed urllib3-1.26.7+computecanada
Looking in links: /cvmfs/soft.computecanada.ca/custom/python/wheelhouse/nix/avx2, /cvmfs/soft.computecanada.ca/custom/python/wheelhouse/nix/generic, /cvmfs/soft.computecanada.ca/custom/python/wheelhouse/generic
Processing /cvmfs/soft.computecanada.ca/custom/python/wheelhouse/generic/nltk-3.7+computecanada-py3-none-any.whl
Processing /cvmfs/soft.computecanada.ca/custom/python/wheelhouse/generic/nltk-3.6.5+computecanada-py3-none-any.whl
Processing /cvmfs/soft.computecanada.ca/custom/python/wheelhouse/generic/nltk-3.6.3+computecanada-py3-none-any.whl
Requirement already satisfied: regex in /localscratch/yinan.27794538.0/env/lib/python3.7/site-packages (from nltk) (2020.11.13+computecanada)
Requirement already satisfied: click in /localscratch/yinan.27794538.0/env/lib/python3.7/site-packages (from nltk) (8.0.3+computecanada)
Requirement already satisfied: tqdm in /localscratch/yinan.27794538.0/env/lib/python3.7/site-packages (from nltk) (4.62.3+computecanada)
Requirement already satisfied: joblib in /localscratch/yinan.27794538.0/env/lib/python3.7/site-packages (from nltk) (1.1.0+computecanada)
Requirement already satisfied: importlib-metadata in /localscratch/yinan.27794538.0/env/lib/python3.7/site-packages (from click->nltk) (4.10.1+computecanada)
Requirement already satisfied: zipp>=0.5 in /localscratch/yinan.27794538.0/env/lib/python3.7/site-packages (from importlib-metadata->click->nltk) (3.7.0+computecanada)
Requirement already satisfied: typing-extensions>=3.6.4 in /localscratch/yinan.27794538.0/env/lib/python3.7/site-packages (from importlib-metadata->click->nltk) (4.0.1+computecanada)
Installing collected packages: nltk
Successfully installed nltk-3.6.3+computecanada
Looking in links: /cvmfs/soft.computecanada.ca/custom/python/wheelhouse/nix/avx2, /cvmfs/soft.computecanada.ca/custom/python/wheelhouse/nix/generic, /cvmfs/soft.computecanada.ca/custom/python/wheelhouse/generic
Processing /cvmfs/soft.computecanada.ca/custom/python/wheelhouse/generic/scikit_learn-0.22.1+computecanada-cp37-cp37m-linux_x86_64.whl
Requirement already satisfied: scipy>=0.17.0 in /localscratch/yinan.27794538.0/env/lib/python3.7/site-packages (from scikit-learn==0.22.1) (1.4.1+computecanada)
Requirement already satisfied: numpy>=1.11.0 in /cvmfs/soft.computecanada.ca/easybuild/software/2017/Core/scipy-stack/2019a/lib/python3.7/site-packages (from scikit-learn==0.22.1) (1.16.0)
Requirement already satisfied: joblib>=0.11 in /localscratch/yinan.27794538.0/env/lib/python3.7/site-packages (from scikit-learn==0.22.1) (1.1.0+computecanada)
Installing collected packages: scikit-learn
Successfully installed scikit-learn-0.22.1+computecanada
Looking in links: /cvmfs/soft.computecanada.ca/custom/python/wheelhouse/nix/avx2, /cvmfs/soft.computecanada.ca/custom/python/wheelhouse/nix/generic, /cvmfs/soft.computecanada.ca/custom/python/wheelhouse/generic
Requirement already satisfied: tokenizers==0.5.2 in /localscratch/yinan.27794538.0/env/lib/python3.7/site-packages (0.5.2+computecanada)
wandb: Appending key for api.wandb.ai to your netrc file: /home/yinan/.netrc
Starting Task
2022-02-25 10:39:33.251344: I tensorflow/stream_executor/platform/default/dso_loader.cc:48] Successfully opened dynamic library libcudart.so.10.1
[nltk_data] Downloading package stopwords to /home/yinan/nltk_data...
[nltk_data]   Package stopwords is already up-to-date!
[nltk_data] Downloading package wordnet to /home/yinan/nltk_data...
[nltk_data]   Package wordnet is already up-to-date!
wandb: W&B API key is configured (use `wandb login --relogin` to force relogin)
wandb: wandb version 0.12.10 is available!  To upgrade, please run:
wandb:  $ pip install wandb --upgrade
2022-02-25 10:39:43.840822: I tensorflow/stream_executor/platform/default/dso_loader.cc:48] Successfully opened dynamic library libcudart.so.10.1
wandb: Tracking run with wandb version 0.12.5
wandb: Syncing run generous-firebrand-1
wandb: ⭐️ View project at https://wandb.ai/yinanazhou/xl_512_bs_8_lr_1e07_es_40_lc_False_nr_False_stem_False_lemma_False_repeat_1_fold_1
wandb: 🚀 View run at https://wandb.ai/yinanazhou/xl_512_bs_8_lr_1e07_es_40_lc_False_nr_False_stem_False_lemma_False_repeat_1_fold_1/runs/36ke47t2
wandb: Run data is saved locally in /project/6002780/yinan/Thesis_MER_Lyrics/lyric-emotion/wandb/run-20220225_103941-36ke47t2
wandb: Run `wandb offline` to turn off syncing.

Validation loss decreased (inf --> 1.447266).  Saving model ...
Validation loss decreased (1.447266 --> 1.437970).  Saving model ...
Validation loss decreased (1.437970 --> 1.428082).  Saving model ...
Validation loss decreased (1.428082 --> 1.419422).  Saving model ...
Validation loss decreased (1.419422 --> 1.410801).  Saving model ...
Validation loss decreased (1.410801 --> 1.403790).  Saving model ...
Validation loss decreased (1.403790 --> 1.396325).  Saving model ...
Validation loss decreased (1.396325 --> 1.389933).  Saving model ...
Validation loss decreased (1.389933 --> 1.384976).  Saving model ...
Validation loss decreased (1.384976 --> 1.378998).  Saving model ...
Validation loss decreased (1.378998 --> 1.372438).  Saving model ...
Validation loss decreased (1.372438 --> 1.367018).  Saving model ...
Validation loss decreased (1.367018 --> 1.361318).  Saving model ...
Validation loss decreased (1.361318 --> 1.357056).  Saving model ...
Validation loss decreased (1.357056 --> 1.352462).  Saving model ...
Validation loss decreased (1.352462 --> 1.347467).  Saving model ...
Validation loss decreased (1.347467 --> 1.343710).  Saving model ...
Validation loss decreased (1.343710 --> 1.339687).  Saving model ...
Validation loss decreased (1.339687 --> 1.335850).  Saving model ...
Validation loss decreased (1.335850 --> 1.331873).  Saving model ...
Validation loss decreased (1.331873 --> 1.327640).  Saving model ...
Validation loss decreased (1.327640 --> 1.324385).  Saving model ...
Validation loss decreased (1.324385 --> 1.320620).  Saving model ...
Validation loss decreased (1.320620 --> 1.316456).  Saving model ...
Validation loss decreased (1.316456 --> 1.312808).  Saving model ...
Validation loss decreased (1.312808 --> 1.309726).  Saving model ...
Validation loss decreased (1.309726 --> 1.306804).  Saving model ...
Validation loss decreased (1.306804 --> 1.303609).  Saving model ...
Validation loss decreased (1.303609 --> 1.300115).  Saving model ...
Validation loss decreased (1.300115 --> 1.296964).  Saving model ...
Validation loss decreased (1.296964 --> 1.294100).  Saving model ...
Validation loss decreased (1.294100 --> 1.291073).  Saving model ...
Validation loss decreased (1.291073 --> 1.288614).  Saving model ...
Validation loss decreased (1.288614 --> 1.285543).  Saving model ...
Validation loss decreased (1.285543 --> 1.282380).  Saving model ...
Validation loss decreased (1.282380 --> 1.279665).  Saving model ...
Validation loss decreased (1.279665 --> 1.277156).  Saving model ...
Validation loss decreased (1.277156 --> 1.274100).  Saving model ...
Validation loss decreased (1.274100 --> 1.271296).  Saving model ...
Validation loss decreased (1.271296 --> 1.268631).  Saving model ...
Validation loss decreased (1.268631 --> 1.265496).  Saving model ...
Validation loss decreased (1.265496 --> 1.262232).  Saving model ...
Validation loss decreased (1.262232 --> 1.259580).  Saving model ...
Validation loss decreased (1.259580 --> 1.257002).  Saving model ...
Validation loss decreased (1.257002 --> 1.254105).  Saving model ...
Validation loss decreased (1.254105 --> 1.250817).  Saving model ...
Validation loss decreased (1.250817 --> 1.248023).  Saving model ...
Validation loss decreased (1.248023 --> 1.245421).  Saving model ...
Validation loss decreased (1.245421 --> 1.242726).  Saving model ...
Validation loss decreased (1.242726 --> 1.240046).  Saving model ...
Validation loss decreased (1.240046 --> 1.236974).  Saving model ...
Validation loss decreased (1.236974 --> 1.234185).  Saving model ...
Validation loss decreased (1.234185 --> 1.232467).  Saving model ...
Validation loss decreased (1.232467 --> 1.230033).  Saving model ...
Validation loss decreased (1.230033 --> 1.227734).  Saving model ...
Validation loss decreased (1.227734 --> 1.225117).  Saving model ...
Validation loss decreased (1.225117 --> 1.222807).  Saving model ...
Validation loss decreased (1.222807 --> 1.220420).  Saving model ...
Validation loss decreased (1.220420 --> 1.217257).  Saving model ...
Validation loss decreased (1.217257 --> 1.214080).  Saving model ...
Validation loss decreased (1.214080 --> 1.211504).  Saving model ...
Validation loss decreased (1.211504 --> 1.209025).  Saving model ...
Validation loss decreased (1.209025 --> 1.206252).  Saving model ...
Validation loss decreased (1.206252 --> 1.203766).  Saving model ...
Validation loss decreased (1.203766 --> 1.201381).  Saving model ...
Validation loss decreased (1.201381 --> 1.199346).  Saving model ...
Validation loss decreased (1.199346 --> 1.195874).  Saving model ...
Validation loss decreased (1.195874 --> 1.193373).  Saving model ...
Validation loss decreased (1.193373 --> 1.190509).  Saving model ...
Validation loss decreased (1.190509 --> 1.188051).  Saving model ...
Validation loss decreased (1.188051 --> 1.185908).  Saving model ...
Validation loss decreased (1.185908 --> 1.182441).  Saving model ...
Validation loss decreased (1.182441 --> 1.180518).  Saving model ...
Validation loss decreased (1.180518 --> 1.177906).  Saving model ...
Validation loss decreased (1.177906 --> 1.175591).  Saving model ...
Validation loss decreased (1.175591 --> 1.172585).  Saving model ...
Validation loss decreased (1.172585 --> 1.170681).  Saving model ...
Validation loss decreased (1.170681 --> 1.168675).  Saving model ...
Validation loss decreased (1.168675 --> 1.165697).  Saving model ...
Validation loss decreased (1.165697 --> 1.162733).  Saving model ...
Validation loss decreased (1.162733 --> 1.160420).  Saving model ...
Validation loss decreased (1.160420 --> 1.157852).  Saving model ...
Validation loss decreased (1.157852 --> 1.154953).  Saving model ...
Validation loss decreased (1.154953 --> 1.152608).  Saving model ...
Validation loss decreased (1.152608 --> 1.150433).  Saving model ...
Validation loss decreased (1.150433 --> 1.146321).  Saving model ...
Validation loss decreased (1.146321 --> 1.144510).  Saving model ...
Validation loss decreased (1.144510 --> 1.142464).  Saving model ...
Validation loss decreased (1.142464 --> 1.140439).  Saving model ...
Validation loss decreased (1.140439 --> 1.137561).  Saving model ...
Validation loss decreased (1.137561 --> 1.134989).  Saving model ...
Validation loss decreased (1.134989 --> 1.132545).  Saving model ...
Validation loss decreased (1.132545 --> 1.129488).  Saving model ...
Validation loss decreased (1.129488 --> 1.125604).  Saving model ...
Validation loss decreased (1.125604 --> 1.123842).  Saving model ...
Validation loss decreased (1.123842 --> 1.120446).  Saving model ...
Validation loss decreased (1.120446 --> 1.119579).  Saving model ...
Validation loss decreased (1.119579 --> 1.116534).  Saving model ...
Validation loss decreased (1.116534 --> 1.113922).  Saving model ...
Validation loss decreased (1.113922 --> 1.111873).  Saving model ...
Validation loss decreased (1.111873 --> 1.109070).  Saving model ...
Validation loss decreased (1.109070 --> 1.105903).  Saving model ...
Validation loss decreased (1.105903 --> 1.102078).  Saving model ...
Validation loss decreased (1.102078 --> 1.100934).  Saving model ...
EarlyStopping counter: 1 out of 40.0
EarlyStopping counter: 2 out of 40.0
Validation loss decreased (1.100934 --> 1.097475).  Saving model ...
Validation loss decreased (1.097475 --> 1.090840).  Saving model ...
Validation loss decreased (1.090840 --> 1.088853).  Saving model ...
Validation loss decreased (1.088853 --> 1.087111).  Saving model ...
Validation loss decreased (1.087111 --> 1.086100).  Saving model ...
Validation loss decreased (1.086100 --> 1.085459).  Saving model ...
EarlyStopping counter: 1 out of 40.0
Validation loss decreased (1.085459 --> 1.082830).  Saving model ...
Validation loss decreased (1.082830 --> 1.076488).  Saving model ...
Validation loss decreased (1.076488 --> 1.075228).  Saving model ...
Validation loss decreased (1.075228 --> 1.072619).  Saving model ...
Validation loss decreased (1.072619 --> 1.068811).  Saving model ...
EarlyStopping counter: 1 out of 40.0
Validation loss decreased (1.068811 --> 1.067721).  Saving model ...
Validation loss decreased (1.067721 --> 1.066020).  Saving model ...
Validation loss decreased (1.066020 --> 1.063806).  Saving model ...
Validation loss decreased (1.063806 --> 1.061452).  Saving model ...
Validation loss decreased (1.061452 --> 1.060221).  Saving model ...
Validation loss decreased (1.060221 --> 1.057816).  Saving model ...
Validation loss decreased (1.057816 --> 1.056333).  Saving model ...
Validation loss decreased (1.056333 --> 1.054592).  Saving model ...
EarlyStopping counter: 1 out of 40.0
Validation loss decreased (1.054592 --> 1.052147).  Saving model ...
Validation loss decreased (1.052147 --> 1.049725).  Saving model ...
Validation loss decreased (1.049725 --> 1.046112).  Saving model ...
EarlyStopping counter: 1 out of 40.0
EarlyStopping counter: 2 out of 40.0
EarlyStopping counter: 3 out of 40.0
EarlyStopping counter: 4 out of 40.0
Validation loss decreased (1.046112 --> 1.043559).  Saving model ...
Validation loss decreased (1.043559 --> 1.040102).  Saving model ...
EarlyStopping counter: 1 out of 40.0
EarlyStopping counter: 2 out of 40.0
Validation loss decreased (1.040102 --> 1.036209).  Saving model ...
Validation loss decreased (1.036209 --> 1.033615).  Saving model ...
EarlyStopping counter: 1 out of 40.0
Validation loss decreased (1.033615 --> 1.032157).  Saving model ...
Validation loss decreased (1.032157 --> 1.032104).  Saving model ...
Validation loss decreased (1.032104 --> 1.028753).  Saving model ...
Validation loss decreased (1.028753 --> 1.027747).  Saving model ...
Validation loss decreased (1.027747 --> 1.024468).  Saving model ...
Validation loss decreased (1.024468 --> 1.024419).  Saving model ...
Validation loss decreased (1.024419 --> 1.020536).  Saving model ...
EarlyStopping counter: 1 out of 40.0
EarlyStopping counter: 2 out of 40.0
Validation loss decreased (1.020536 --> 1.019872).  Saving model ...
Validation loss decreased (1.019872 --> 1.015223).  Saving model ...
Validation loss decreased (1.015223 --> 1.015153).  Saving model ...
EarlyStopping counter: 1 out of 40.0
EarlyStopping counter: 2 out of 40.0
Validation loss decreased (1.015153 --> 1.014514).  Saving model ...
Validation loss decreased (1.014514 --> 1.012840).  Saving model ...
Validation loss decreased (1.012840 --> 1.007441).  Saving model ...
EarlyStopping counter: 1 out of 40.0
EarlyStopping counter: 2 out of 40.0
EarlyStopping counter: 3 out of 40.0
EarlyStopping counter: 4 out of 40.0
EarlyStopping counter: 5 out of 40.0
EarlyStopping counter: 6 out of 40.0
Validation loss decreased (1.007441 --> 1.006093).  Saving model ...
EarlyStopping counter: 1 out of 40.0
EarlyStopping counter: 2 out of 40.0
EarlyStopping counter: 3 out of 40.0
Validation loss decreased (1.006093 --> 1.003951).  Saving model ...
EarlyStopping counter: 1 out of 40.0
Validation loss decreased (1.003951 --> 0.999011).  Saving model ...
EarlyStopping counter: 1 out of 40.0
EarlyStopping counter: 2 out of 40.0
Validation loss decreased (0.999011 --> 0.998733).  Saving model ...
Validation loss decreased (0.998733 --> 0.997306).  Saving model ...
Validation loss decreased (0.997306 --> 0.995317).  Saving model ...
Validation loss decreased (0.995317 --> 0.993892).  Saving model ...
EarlyStopping counter: 1 out of 40.0
EarlyStopping counter: 2 out of 40.0
Validation loss decreased (0.993892 --> 0.992318).  Saving model ...
EarlyStopping counter: 1 out of 40.0
EarlyStopping counter: 2 out of 40.0
Validation loss decreased (0.992318 --> 0.990441).  Saving model ...
Validation loss decreased (0.990441 --> 0.990026).  Saving model ...
Validation loss decreased (0.990026 --> 0.988669).  Saving model ...
EarlyStopping counter: 1 out of 40.0
Validation loss decreased (0.988669 --> 0.988235).  Saving model ...
Validation loss decreased (0.988235 --> 0.987834).  Saving model ...
EarlyStopping counter: 1 out of 40.0
Validation loss decreased (0.987834 --> 0.987612).  Saving model ...
Validation loss decreased (0.987612 --> 0.987303).  Saving model ...
Validation loss decreased (0.987303 --> 0.983879).  Saving model ...
Validation loss decreased (0.983879 --> 0.982175).  Saving model ...
Validation loss decreased (0.982175 --> 0.981865).  Saving model ...
Validation loss decreased (0.981865 --> 0.981380).  Saving model ...
EarlyStopping counter: 1 out of 40.0
Validation loss decreased (0.981380 --> 0.980810).  Saving model ...
Validation loss decreased (0.980810 --> 0.980567).  Saving model ...
EarlyStopping counter: 1 out of 40.0
Validation loss decreased (0.980567 --> 0.980537).  Saving model ...
Validation loss decreased (0.980537 --> 0.977889).  Saving model ...
EarlyStopping counter: 1 out of 40.0
EarlyStopping counter: 2 out of 40.0
Validation loss decreased (0.977889 --> 0.977818).  Saving model ...
EarlyStopping counter: 1 out of 40.0
EarlyStopping counter: 2 out of 40.0
Validation loss decreased (0.977818 --> 0.976537).  Saving model ...
EarlyStopping counter: 1 out of 40.0
EarlyStopping counter: 2 out of 40.0
EarlyStopping counter: 3 out of 40.0
EarlyStopping counter: 4 out of 40.0
EarlyStopping counter: 5 out of 40.0
EarlyStopping counter: 6 out of 40.0
EarlyStopping counter: 7 out of 40.0
Validation loss decreased (0.976537 --> 0.974283).  Saving model ...
Validation loss decreased (0.974283 --> 0.972175).  Saving model ...
Validation loss decreased (0.972175 --> 0.971662).  Saving model ...
Validation loss decreased (0.971662 --> 0.970684).  Saving model ...
EarlyStopping counter: 1 out of 40.0
Validation loss decreased (0.970684 --> 0.969559).  Saving model ...
EarlyStopping counter: 1 out of 40.0
Validation loss decreased (0.969559 --> 0.968793).  Saving model ...
Validation loss decreased (0.968793 --> 0.967654).  Saving model ...
EarlyStopping counter: 1 out of 40.0
Validation loss decreased (0.967654 --> 0.966751).  Saving model ...
EarlyStopping counter: 1 out of 40.0
EarlyStopping counter: 2 out of 40.0
EarlyStopping counter: 3 out of 40.0
EarlyStopping counter: 4 out of 40.0
Validation loss decreased (0.966751 --> 0.965659).  Saving model ...
Validation loss decreased (0.965659 --> 0.965253).  Saving model ...
Validation loss decreased (0.965253 --> 0.964719).  Saving model ...
EarlyStopping counter: 1 out of 40.0
Validation loss decreased (0.964719 --> 0.963148).  Saving model ...
EarlyStopping counter: 1 out of 40.0
EarlyStopping counter: 2 out of 40.0
Validation loss decreased (0.963148 --> 0.961735).  Saving model ...
EarlyStopping counter: 1 out of 40.0
EarlyStopping counter: 2 out of 40.0
EarlyStopping counter: 3 out of 40.0
Validation loss decreased (0.961735 --> 0.961624).  Saving model ...
EarlyStopping counter: 1 out of 40.0
EarlyStopping counter: 2 out of 40.0
EarlyStopping counter: 3 out of 40.0
Validation loss decreased (0.961624 --> 0.960949).  Saving model ...
EarlyStopping counter: 1 out of 40.0
EarlyStopping counter: 2 out of 40.0
EarlyStopping counter: 3 out of 40.0
EarlyStopping counter: 4 out of 40.0
EarlyStopping counter: 5 out of 40.0
Validation loss decreased (0.960949 --> 0.960329).  Saving model ...
EarlyStopping counter: 1 out of 40.0
EarlyStopping counter: 2 out of 40.0
EarlyStopping counter: 3 out of 40.0
EarlyStopping counter: 4 out of 40.0
EarlyStopping counter: 5 out of 40.0
EarlyStopping counter: 6 out of 40.0
EarlyStopping counter: 7 out of 40.0
EarlyStopping counter: 8 out of 40.0
EarlyStopping counter: 9 out of 40.0
EarlyStopping counter: 10 out of 40.0
EarlyStopping counter: 11 out of 40.0
EarlyStopping counter: 12 out of 40.0
EarlyStopping counter: 13 out of 40.0
EarlyStopping counter: 14 out of 40.0
EarlyStopping counter: 15 out of 40.0
EarlyStopping counter: 16 out of 40.0
EarlyStopping counter: 17 out of 40.0
EarlyStopping counter: 18 out of 40.0
EarlyStopping counter: 19 out of 40.0
EarlyStopping counter: 20 out of 40.0
EarlyStopping counter: 21 out of 40.0
EarlyStopping counter: 22 out of 40.0
EarlyStopping counter: 23 out of 40.0
EarlyStopping counter: 24 out of 40.0
EarlyStopping counter: 25 out of 40.0
EarlyStopping counter: 26 out of 40.0
EarlyStopping counter: 27 out of 40.0
EarlyStopping counter: 28 out of 40.0
EarlyStopping counter: 29 out of 40.0
EarlyStopping counter: 30 out of 40.0
EarlyStopping counter: 31 out of 40.0
EarlyStopping counter: 32 out of 40.0
EarlyStopping counter: 33 out of 40.0
EarlyStopping counter: 34 out of 40.0
EarlyStopping counter: 35 out of 40.0
EarlyStopping counter: 36 out of 40.0
EarlyStopping counter: 37 out of 40.0
EarlyStopping counter: 38 out of 40.0
EarlyStopping counter: 39 out of 40.0
EarlyStopping counter: 40 out of 40.0
/localscratch/yinan.27794538.0/env/lib/python3.7/site-packages/torch/nn/functional.py:1794: UserWarning: nn.functional.tanh is deprecated. Use torch.tanh instead.
  warnings.warn("nn.functional.tanh is deprecated. Use torch.tanh instead.")
/localscratch/yinan.27794538.0/env/lib/python3.7/site-packages/transformers/optimization.py:155: UserWarning: This overload of add_ is deprecated:
	add_(Number alpha, Tensor other)
Consider using one of the following signatures instead:
	add_(Tensor other, *, Number alpha) (Triggered internally at  ../torch/csrc/utils/python_arg_parser.cpp:1025.)
  exp_avg.mul_(beta1).add_(1.0 - beta1, grad)
wandb: Waiting for W&B process to finish, PID 122186... (success).
wandb: - 0.00MB of 0.00MB uploaded (0.00MB deduped)wandb: \ 0.00MB of 0.00MB uploaded (0.00MB deduped)wandb: | 0.00MB of 0.00MB uploaded (0.00MB deduped)wandb: / 0.00MB of 0.00MB uploaded (0.00MB deduped)wandb: - 0.00MB of 0.00MB uploaded (0.00MB deduped)wandb: \ 0.00MB of 0.00MB uploaded (0.00MB deduped)wandb: | 0.00MB of 0.00MB uploaded (0.00MB deduped)wandb: / 0.00MB of 0.00MB uploaded (0.00MB deduped)wandb: - 0.00MB of 0.00MB uploaded (0.00MB deduped)wandb: \ 0.00MB of 0.00MB uploaded (0.00MB deduped)wandb: | 0.00MB of 0.00MB uploaded (0.00MB deduped)wandb: / 0.00MB of 0.00MB uploaded (0.00MB deduped)wandb:                                                                                
wandb: Run history:
wandb:     e_F1 ▁▂▃▄▅▅▅▆▆▆▆▆▆▇▇▇▇▇▇▇████████████████████
wandb:   e_loss ██▇▆▆▆▅▅▅▅▄▄▄▃▃▃▃▂▂▂▂▂▂▂▂▁▁▁▁▁▁▁▁▁▁▁▁▁▁▁
wandb:     t_F1 ▁▁▂▂▃▃▃▄▄▄▄▅▅▅▅▅▅▅▆▆▆▆▇▆▆▆▇▇▇▇▇▇▇▇▇█▇███
wandb:   t_loss ███▇▇▇▇▆▆▆▆▅▅▅▅▅▄▄▄▄▄▄▃▃▃▃▃▃▂▃▂▂▂▂▂▂▂▁▁▁
wandb: 
wandb: Run summary:
wandb:     e_F1 58.74874
wandb:   e_loss 0.96448
wandb:     t_F1 82.48451
wandb:   t_loss 0.57807
wandb: 
wandb: Synced 4 W&B file(s), 0 media file(s), 0 artifact file(s) and 0 other file(s)
wandb: Synced generous-firebrand-1: https://wandb.ai/yinanazhou/xl_512_bs_8_lr_1e07_es_40_lc_False_nr_False_stem_False_lemma_False_repeat_1_fold_1/runs/36ke47t2
wandb: Find logs at: ./wandb/run-20220225_103941-36ke47t2/logs/debug.log
wandb: 

wandb: wandb version 0.12.10 is available!  To upgrade, please run:
wandb:  $ pip install wandb --upgrade
2022-02-25 15:15:43.687329: I tensorflow/stream_executor/platform/default/dso_loader.cc:48] Successfully opened dynamic library libcudart.so.10.1
wandb: Tracking run with wandb version 0.12.5
wandb: Syncing run fine-sea-1
wandb: ⭐️ View project at https://wandb.ai/yinanazhou/xl_512_bs_8_lr_1e07_es_40_lc_False_nr_False_stem_False_lemma_False_repeat_1_fold_2
wandb: 🚀 View run at https://wandb.ai/yinanazhou/xl_512_bs_8_lr_1e07_es_40_lc_False_nr_False_stem_False_lemma_False_repeat_1_fold_2/runs/1rzba3bj
wandb: Run data is saved locally in /project/6002780/yinan/Thesis_MER_Lyrics/lyric-emotion/wandb/run-20220225_151540-1rzba3bj
wandb: Run `wandb offline` to turn off syncing.

Validation loss decreased (inf --> 1.461774).  Saving model ...
Validation loss decreased (1.461774 --> 1.453400).  Saving model ...
Validation loss decreased (1.453400 --> 1.445269).  Saving model ...
Validation loss decreased (1.445269 --> 1.437805).  Saving model ...
Validation loss decreased (1.437805 --> 1.431305).  Saving model ...
Validation loss decreased (1.431305 --> 1.425368).  Saving model ...
Validation loss decreased (1.425368 --> 1.419653).  Saving model ...
Validation loss decreased (1.419653 --> 1.414221).  Saving model ...
Validation loss decreased (1.414221 --> 1.409058).  Saving model ...
Validation loss decreased (1.409058 --> 1.404521).  Saving model ...
Validation loss decreased (1.404521 --> 1.400427).  Saving model ...
Validation loss decreased (1.400427 --> 1.396650).  Saving model ...
Validation loss decreased (1.396650 --> 1.392965).  Saving model ...
Validation loss decreased (1.392965 --> 1.389308).  Saving model ...
Validation loss decreased (1.389308 --> 1.385408).  Saving model ...
Validation loss decreased (1.385408 --> 1.381813).  Saving model ...
Validation loss decreased (1.381813 --> 1.378467).  Saving model ...
Validation loss decreased (1.378467 --> 1.374893).  Saving model ...
Validation loss decreased (1.374893 --> 1.371557).  Saving model ...
Validation loss decreased (1.371557 --> 1.368677).  Saving model ...
Validation loss decreased (1.368677 --> 1.365539).  Saving model ...
Validation loss decreased (1.365539 --> 1.362869).  Saving model ...
Validation loss decreased (1.362869 --> 1.360330).  Saving model ...
Validation loss decreased (1.360330 --> 1.357950).  Saving model ...
Validation loss decreased (1.357950 --> 1.355106).  Saving model ...
Validation loss decreased (1.355106 --> 1.352754).  Saving model ...
Validation loss decreased (1.352754 --> 1.350340).  Saving model ...
Validation loss decreased (1.350340 --> 1.347841).  Saving model ...
Validation loss decreased (1.347841 --> 1.345412).  Saving model ...
Validation loss decreased (1.345412 --> 1.342621).  Saving model ...
Validation loss decreased (1.342621 --> 1.340244).  Saving model ...
Validation loss decreased (1.340244 --> 1.336265).  Saving model ...
Validation loss decreased (1.336265 --> 1.333723).  Saving model ...
Validation loss decreased (1.333723 --> 1.330770).  Saving model ...
Validation loss decreased (1.330770 --> 1.327739).  Saving model ...
Validation loss decreased (1.327739 --> 1.324915).  Saving model ...
Validation loss decreased (1.324915 --> 1.322186).  Saving model ...
Validation loss decreased (1.322186 --> 1.319209).  Saving model ...
Validation loss decreased (1.319209 --> 1.316322).  Saving model ...
Validation loss decreased (1.316322 --> 1.313021).  Saving model ...
Validation loss decreased (1.313021 --> 1.309545).  Saving model ...
Validation loss decreased (1.309545 --> 1.306217).  Saving model ...
Validation loss decreased (1.306217 --> 1.303847).  Saving model ...
Validation loss decreased (1.303847 --> 1.300881).  Saving model ...
Validation loss decreased (1.300881 --> 1.297225).  Saving model ...
Validation loss decreased (1.297225 --> 1.294104).  Saving model ...
Validation loss decreased (1.294104 --> 1.291025).  Saving model ...
Validation loss decreased (1.291025 --> 1.287642).  Saving model ...
Validation loss decreased (1.287642 --> 1.284141).  Saving model ...
Validation loss decreased (1.284141 --> 1.280577).  Saving model ...
Validation loss decreased (1.280577 --> 1.277095).  Saving model ...
Validation loss decreased (1.277095 --> 1.273512).  Saving model ...
Validation loss decreased (1.273512 --> 1.270387).  Saving model ...
Validation loss decreased (1.270387 --> 1.266739).  Saving model ...
Validation loss decreased (1.266739 --> 1.262793).  Saving model ...
Validation loss decreased (1.262793 --> 1.259135).  Saving model ...
Validation loss decreased (1.259135 --> 1.256383).  Saving model ...
Validation loss decreased (1.256383 --> 1.252785).  Saving model ...
Validation loss decreased (1.252785 --> 1.249376).  Saving model ...
Validation loss decreased (1.249376 --> 1.245849).  Saving model ...
Validation loss decreased (1.245849 --> 1.242044).  Saving model ...
Validation loss decreased (1.242044 --> 1.238548).  Saving model ...
Validation loss decreased (1.238548 --> 1.234910).  Saving model ...
Validation loss decreased (1.234910 --> 1.231572).  Saving model ...
Validation loss decreased (1.231572 --> 1.228379).  Saving model ...
Validation loss decreased (1.228379 --> 1.225400).  Saving model ...
Validation loss decreased (1.225400 --> 1.222188).  Saving model ...
Validation loss decreased (1.222188 --> 1.218834).  Saving model ...
Validation loss decreased (1.218834 --> 1.215198).  Saving model ...
Validation loss decreased (1.215198 --> 1.211022).  Saving model ...
Validation loss decreased (1.211022 --> 1.207091).  Saving model ...
Validation loss decreased (1.207091 --> 1.204021).  Saving model ...
Validation loss decreased (1.204021 --> 1.200643).  Saving model ...
Validation loss decreased (1.200643 --> 1.197123).  Saving model ...
Validation loss decreased (1.197123 --> 1.193584).  Saving model ...
Validation loss decreased (1.193584 --> 1.189673).  Saving model ...
Validation loss decreased (1.189673 --> 1.185951).  Saving model ...
Validation loss decreased (1.185951 --> 1.182727).  Saving model ...
Validation loss decreased (1.182727 --> 1.178833).  Saving model ...
Validation loss decreased (1.178833 --> 1.174929).  Saving model ...
Validation loss decreased (1.174929 --> 1.171489).  Saving model ...
Validation loss decreased (1.171489 --> 1.167437).  Saving model ...
Validation loss decreased (1.167437 --> 1.163020).  Saving model ...
Validation loss decreased (1.163020 --> 1.158562).  Saving model ...
Validation loss decreased (1.158562 --> 1.155680).  Saving model ...
Validation loss decreased (1.155680 --> 1.151000).  Saving model ...
Validation loss decreased (1.151000 --> 1.147241).  Saving model ...
Validation loss decreased (1.147241 --> 1.144048).  Saving model ...
Validation loss decreased (1.144048 --> 1.140694).  Saving model ...
Validation loss decreased (1.140694 --> 1.137095).  Saving model ...
Validation loss decreased (1.137095 --> 1.134810).  Saving model ...
Validation loss decreased (1.134810 --> 1.130315).  Saving model ...
Validation loss decreased (1.130315 --> 1.126437).  Saving model ...
Validation loss decreased (1.126437 --> 1.123032).  Saving model ...
Validation loss decreased (1.123032 --> 1.118600).  Saving model ...
Validation loss decreased (1.118600 --> 1.115711).  Saving model ...
Validation loss decreased (1.115711 --> 1.112860).  Saving model ...
Validation loss decreased (1.112860 --> 1.108650).  Saving model ...
Validation loss decreased (1.108650 --> 1.104822).  Saving model ...
Validation loss decreased (1.104822 --> 1.098693).  Saving model ...
Validation loss decreased (1.098693 --> 1.095281).  Saving model ...
Validation loss decreased (1.095281 --> 1.092573).  Saving model ...
Validation loss decreased (1.092573 --> 1.089086).  Saving model ...
Validation loss decreased (1.089086 --> 1.085790).  Saving model ...
Validation loss decreased (1.085790 --> 1.082231).  Saving model ...
Validation loss decreased (1.082231 --> 1.079451).  Saving model ...
Validation loss decreased (1.079451 --> 1.076545).  Saving model ...
Validation loss decreased (1.076545 --> 1.073990).  Saving model ...
Validation loss decreased (1.073990 --> 1.071030).  Saving model ...
Validation loss decreased (1.071030 --> 1.068218).  Saving model ...
Validation loss decreased (1.068218 --> 1.065608).  Saving model ...
Validation loss decreased (1.065608 --> 1.062915).  Saving model ...
Validation loss decreased (1.062915 --> 1.060237).  Saving model ...
Validation loss decreased (1.060237 --> 1.056863).  Saving model ...
Validation loss decreased (1.056863 --> 1.054467).  Saving model ...
Validation loss decreased (1.054467 --> 1.052053).  Saving model ...
Validation loss decreased (1.052053 --> 1.049768).  Saving model ...
Validation loss decreased (1.049768 --> 1.047965).  Saving model ...
Validation loss decreased (1.047965 --> 1.044591).  Saving model ...
Validation loss decreased (1.044591 --> 1.043062).  Saving model ...
Validation loss decreased (1.043062 --> 1.039560).  Saving model ...
Validation loss decreased (1.039560 --> 1.037795).  Saving model ...
Validation loss decreased (1.037795 --> 1.035055).  Saving model ...
Validation loss decreased (1.035055 --> 1.033783).  Saving model ...
Validation loss decreased (1.033783 --> 1.030382).  Saving model ...
Validation loss decreased (1.030382 --> 1.028759).  Saving model ...
Validation loss decreased (1.028759 --> 1.027521).  Saving model ...
Validation loss decreased (1.027521 --> 1.024888).  Saving model ...
Validation loss decreased (1.024888 --> 1.022991).  Saving model ...
Validation loss decreased (1.022991 --> 1.020234).  Saving model ...
Validation loss decreased (1.020234 --> 1.018571).  Saving model ...
Validation loss decreased (1.018571 --> 1.016494).  Saving model ...
Validation loss decreased (1.016494 --> 1.014394).  Saving model ...
Validation loss decreased (1.014394 --> 1.011537).  Saving model ...
Validation loss decreased (1.011537 --> 1.008953).  Saving model ...
Validation loss decreased (1.008953 --> 1.006735).  Saving model ...
Validation loss decreased (1.006735 --> 1.003867).  Saving model ...
Validation loss decreased (1.003867 --> 1.001654).  Saving model ...
Validation loss decreased (1.001654 --> 1.001011).  Saving model ...
Validation loss decreased (1.001011 --> 0.998186).  Saving model ...
Validation loss decreased (0.998186 --> 0.997370).  Saving model ...
Validation loss decreased (0.997370 --> 0.995721).  Saving model ...
Validation loss decreased (0.995721 --> 0.993297).  Saving model ...
Validation loss decreased (0.993297 --> 0.991026).  Saving model ...
Validation loss decreased (0.991026 --> 0.989323).  Saving model ...
Validation loss decreased (0.989323 --> 0.988405).  Saving model ...
Validation loss decreased (0.988405 --> 0.986816).  Saving model ...
Validation loss decreased (0.986816 --> 0.985115).  Saving model ...
Validation loss decreased (0.985115 --> 0.983181).  Saving model ...
Validation loss decreased (0.983181 --> 0.981819).  Saving model ...
Validation loss decreased (0.981819 --> 0.980010).  Saving model ...
Validation loss decreased (0.980010 --> 0.978056).  Saving model ...
Validation loss decreased (0.978056 --> 0.975569).  Saving model ...
Validation loss decreased (0.975569 --> 0.973875).  Saving model ...
Validation loss decreased (0.973875 --> 0.971596).  Saving model ...
Validation loss decreased (0.971596 --> 0.969237).  Saving model ...
Validation loss decreased (0.969237 --> 0.967480).  Saving model ...
Validation loss decreased (0.967480 --> 0.967227).  Saving model ...
Validation loss decreased (0.967227 --> 0.966440).  Saving model ...
Validation loss decreased (0.966440 --> 0.964625).  Saving model ...
Validation loss decreased (0.964625 --> 0.962533).  Saving model ...
Validation loss decreased (0.962533 --> 0.960827).  Saving model ...
Validation loss decreased (0.960827 --> 0.960215).  Saving model ...
Validation loss decreased (0.960215 --> 0.958052).  Saving model ...
Validation loss decreased (0.958052 --> 0.956567).  Saving model ...
Validation loss decreased (0.956567 --> 0.955789).  Saving model ...
Validation loss decreased (0.955789 --> 0.953800).  Saving model ...
Validation loss decreased (0.953800 --> 0.951141).  Saving model ...
Validation loss decreased (0.951141 --> 0.950391).  Saving model ...
Validation loss decreased (0.950391 --> 0.949221).  Saving model ...
Validation loss decreased (0.949221 --> 0.948245).  Saving model ...
Validation loss decreased (0.948245 --> 0.947215).  Saving model ...
Validation loss decreased (0.947215 --> 0.946153).  Saving model ...
Validation loss decreased (0.946153 --> 0.944434).  Saving model ...
Validation loss decreased (0.944434 --> 0.944140).  Saving model ...
Validation loss decreased (0.944140 --> 0.943111).  Saving model ...
Validation loss decreased (0.943111 --> 0.941077).  Saving model ...
Validation loss decreased (0.941077 --> 0.939957).  Saving model ...
Validation loss decreased (0.939957 --> 0.938839).  Saving model ...
Validation loss decreased (0.938839 --> 0.937868).  Saving model ...
Validation loss decreased (0.937868 --> 0.936359).  Saving model ...
Validation loss decreased (0.936359 --> 0.935978).  Saving model ...
Validation loss decreased (0.935978 --> 0.933132).  Saving model ...
Validation loss decreased (0.933132 --> 0.932132).  Saving model ...
Validation loss decreased (0.932132 --> 0.931724).  Saving model ...
Validation loss decreased (0.931724 --> 0.930620).  Saving model ...
EarlyStopping counter: 1 out of 40.0
Validation loss decreased (0.930620 --> 0.930237).  Saving model ...
Validation loss decreased (0.930237 --> 0.929002).  Saving model ...
Validation loss decreased (0.929002 --> 0.927226).  Saving model ...
EarlyStopping counter: 1 out of 40.0
Validation loss decreased (0.927226 --> 0.925860).  Saving model ...
Validation loss decreased (0.925860 --> 0.924773).  Saving model ...
Validation loss decreased (0.924773 --> 0.924301).  Saving model ...
Validation loss decreased (0.924301 --> 0.922994).  Saving model ...
Validation loss decreased (0.922994 --> 0.922461).  Saving model ...
Validation loss decreased (0.922461 --> 0.921297).  Saving model ...
Validation loss decreased (0.921297 --> 0.920600).  Saving model ...
Validation loss decreased (0.920600 --> 0.919885).  Saving model ...
Validation loss decreased (0.919885 --> 0.918956).  Saving model ...
Validation loss decreased (0.918956 --> 0.918423).  Saving model ...
Validation loss decreased (0.918423 --> 0.918382).  Saving model ...
Validation loss decreased (0.918382 --> 0.918010).  Saving model ...
Validation loss decreased (0.918010 --> 0.917186).  Saving model ...
EarlyStopping counter: 1 out of 40.0
EarlyStopping counter: 2 out of 40.0
EarlyStopping counter: 3 out of 40.0
EarlyStopping counter: 4 out of 40.0
EarlyStopping counter: 5 out of 40.0
EarlyStopping counter: 6 out of 40.0
EarlyStopping counter: 7 out of 40.0
Validation loss decreased (0.917186 --> 0.916369).  Saving model ...
EarlyStopping counter: 1 out of 40.0
EarlyStopping counter: 2 out of 40.0
EarlyStopping counter: 3 out of 40.0
EarlyStopping counter: 4 out of 40.0
EarlyStopping counter: 5 out of 40.0
Validation loss decreased (0.916369 --> 0.915612).  Saving model ...
EarlyStopping counter: 1 out of 40.0
Validation loss decreased (0.915612 --> 0.915424).  Saving model ...
EarlyStopping counter: 1 out of 40.0
Validation loss decreased (0.915424 --> 0.914746).  Saving model ...
Validation loss decreased (0.914746 --> 0.914448).  Saving model ...
Validation loss decreased (0.914448 --> 0.913263).  Saving model ...
Validation loss decreased (0.913263 --> 0.912689).  Saving model ...
Validation loss decreased (0.912689 --> 0.912277).  Saving model ...
EarlyStopping counter: 1 out of 40.0
EarlyStopping counter: 2 out of 40.0
EarlyStopping counter: 3 out of 40.0
Validation loss decreased (0.912277 --> 0.911095).  Saving model ...
EarlyStopping counter: 1 out of 40.0
EarlyStopping counter: 2 out of 40.0
EarlyStopping counter: 3 out of 40.0
Validation loss decreased (0.911095 --> 0.910178).  Saving model ...
EarlyStopping counter: 1 out of 40.0
EarlyStopping counter: 2 out of 40.0
Validation loss decreased (0.910178 --> 0.909268).  Saving model ...
Validation loss decreased (0.909268 --> 0.908897).  Saving model ...
EarlyStopping counter: 1 out of 40.0
EarlyStopping counter: 2 out of 40.0
EarlyStopping counter: 3 out of 40.0
Validation loss decreased (0.908897 --> 0.908785).  Saving model ...
EarlyStopping counter: 1 out of 40.0
EarlyStopping counter: 2 out of 40.0
EarlyStopping counter: 3 out of 40.0
EarlyStopping counter: 4 out of 40.0
EarlyStopping counter: 5 out of 40.0
EarlyStopping counter: 6 out of 40.0
EarlyStopping counter: 7 out of 40.0
EarlyStopping counter: 8 out of 40.0
EarlyStopping counter: 9 out of 40.0
EarlyStopping counter: 10 out of 40.0
EarlyStopping counter: 11 out of 40.0
EarlyStopping counter: 12 out of 40.0
EarlyStopping counter: 13 out of 40.0
EarlyStopping counter: 14 out of 40.0
EarlyStopping counter: 15 out of 40.0
EarlyStopping counter: 16 out of 40.0
EarlyStopping counter: 17 out of 40.0
EarlyStopping counter: 18 out of 40.0
EarlyStopping counter: 19 out of 40.0
EarlyStopping counter: 20 out of 40.0
EarlyStopping counter: 21 out of 40.0
EarlyStopping counter: 22 out of 40.0
EarlyStopping counter: 23 out of 40.0
EarlyStopping counter: 24 out of 40.0
EarlyStopping counter: 25 out of 40.0
EarlyStopping counter: 26 out of 40.0
EarlyStopping counter: 27 out of 40.0
EarlyStopping counter: 28 out of 40.0
EarlyStopping counter: 29 out of 40.0
EarlyStopping counter: 30 out of 40.0
EarlyStopping counter: 31 out of 40.0
EarlyStopping counter: 32 out of 40.0
EarlyStopping counter: 33 out of 40.0
EarlyStopping counter: 34 out of 40.0
EarlyStopping counter: 35 out of 40.0
EarlyStopping counter: 36 out of 40.0
EarlyStopping counter: 37 out of 40.0
EarlyStopping counter: 38 out of 40.0
EarlyStopping counter: 39 out of 40.0
EarlyStopping counter: 40 out of 40.0
/localscratch/yinan.27794538.0/env/lib/python3.7/site-packages/torch/nn/functional.py:1794: UserWarning: nn.functional.tanh is deprecated. Use torch.tanh instead.
  warnings.warn("nn.functional.tanh is deprecated. Use torch.tanh instead.")
wandb: Waiting for W&B process to finish, PID 136927... (success).
wandb: - 0.00MB of 0.00MB uploaded (0.00MB deduped)wandb: \ 0.00MB of 0.00MB uploaded (0.00MB deduped)wandb: | 0.00MB of 0.00MB uploaded (0.00MB deduped)wandb: / 0.00MB of 0.00MB uploaded (0.00MB deduped)wandb: - 0.00MB of 0.00MB uploaded (0.00MB deduped)wandb: \ 0.00MB of 0.00MB uploaded (0.00MB deduped)wandb: | 0.00MB of 0.00MB uploaded (0.00MB deduped)wandb: / 0.00MB of 0.00MB uploaded (0.00MB deduped)wandb: - 0.00MB of 0.00MB uploaded (0.00MB deduped)wandb: \ 0.00MB of 0.00MB uploaded (0.00MB deduped)wandb: | 0.00MB of 0.00MB uploaded (0.00MB deduped)wandb: / 0.00MB of 0.00MB uploaded (0.00MB deduped)wandb: - 0.00MB of 0.00MB uploaded (0.00MB deduped)wandb: \ 0.00MB of 0.00MB uploaded (0.00MB deduped)wandb:                                                                                
wandb: Run history:
wandb:     e_F1 ▁▂▃▃▄▄▅▅▆▆▇▇▇▇▇█████████████████████████
wandb:   e_loss ██▇▇▇▇▆▆▅▅▅▅▄▄▄▃▃▃▃▂▂▂▂▂▁▁▁▁▁▁▁▁▁▁▁▁▁▁▁▁
wandb:     t_F1 ▁▂▂▂▃▃▃▃▄▅▄▄▅▅▅▅▆▆▆▆▆▆▆▇▇▇▇▇▇▇▇▇▇██▇████
wandb:   t_loss ██▇█▇▇▇▇▇▆▆▆▆▆▅▅▅▅▅▄▄▄▄▄▃▃▃▃▃▃▂▂▂▂▂▂▂▁▁▁
wandb: 
wandb: Run summary:
wandb:     e_F1 62.46422
wandb:   e_loss 0.91883
wandb:     t_F1 80.06347
wandb:   t_loss 0.59498
wandb: 
wandb: Synced 4 W&B file(s), 0 media file(s), 0 artifact file(s) and 0 other file(s)
wandb: Synced fine-sea-1: https://wandb.ai/yinanazhou/xl_512_bs_8_lr_1e07_es_40_lc_False_nr_False_stem_False_lemma_False_repeat_1_fold_2/runs/1rzba3bj
wandb: Find logs at: ./wandb/run-20220225_151540-1rzba3bj/logs/debug.log
wandb: 

wandb: wandb version 0.12.10 is available!  To upgrade, please run:
wandb:  $ pip install wandb --upgrade
2022-02-25 19:43:01.428752: I tensorflow/stream_executor/platform/default/dso_loader.cc:48] Successfully opened dynamic library libcudart.so.10.1
wandb: Tracking run with wandb version 0.12.5
wandb: Syncing run sweet-voice-1
wandb: ⭐️ View project at https://wandb.ai/yinanazhou/xl_512_bs_8_lr_1e07_es_40_lc_False_nr_False_stem_False_lemma_False_repeat_2_fold_1
wandb: 🚀 View run at https://wandb.ai/yinanazhou/xl_512_bs_8_lr_1e07_es_40_lc_False_nr_False_stem_False_lemma_False_repeat_2_fold_1/runs/2nlpwx3d
wandb: Run data is saved locally in /project/6002780/yinan/Thesis_MER_Lyrics/lyric-emotion/wandb/run-20220225_194258-2nlpwx3d
wandb: Run `wandb offline` to turn off syncing.
slurmstepd: error: *** JOB 27794538 ON cdr2582 CANCELLED AT 2022-02-25T20:35:25 DUE TO TIME LIMIT ***
