Unloading StdEnv/2020

Due to MODULEPATH changes, the following have been reloaded:
  1) mii/1.1.1


The following have been reloaded with a version change:
  1) python/3.8.2 => python/3.7.4

Using base prefix '/cvmfs/soft.computecanada.ca/easybuild/software/2017/Core/python/3.7.4'
New python executable in /localscratch/yinan.28724298.0/env/bin/python
Installing setuptools, pip, wheel...
done.
Ignoring pip: markers 'python_version < "3"' don't match your environment
Looking in links: /cvmfs/soft.computecanada.ca/custom/python/wheelhouse/nix/avx2, /cvmfs/soft.computecanada.ca/custom/python/wheelhouse/nix/generic, /cvmfs/soft.computecanada.ca/custom/python/wheelhouse/generic
Collecting pip
Installing collected packages: pip
  Found existing installation: pip 19.1.1
    Uninstalling pip-19.1.1:
      Successfully uninstalled pip-19.1.1
Successfully installed pip-21.2.3+computecanada
Looking in links: /cvmfs/soft.computecanada.ca/custom/python/wheelhouse/nix/avx2, /cvmfs/soft.computecanada.ca/custom/python/wheelhouse/nix/generic, /cvmfs/soft.computecanada.ca/custom/python/wheelhouse/generic
Processing /cvmfs/soft.computecanada.ca/custom/python/wheelhouse/generic/keras-2.8.0+computecanada-py2.py3-none-any.whl
Processing /cvmfs/soft.computecanada.ca/custom/python/wheelhouse/generic/Keras_Preprocessing-1.1.2+computecanada-py3-none-any.whl
Requirement already satisfied: matplotlib in /cvmfs/soft.computecanada.ca/easybuild/software/2017/Core/scipy-stack/2019a/lib/python3.7/site-packages (from -r requirements.txt (line 3)) (3.0.2)
Processing /cvmfs/soft.computecanada.ca/custom/python/wheelhouse/generic/nltk-3.6.5+computecanada-py3-none-any.whl
Processing /cvmfs/soft.computecanada.ca/custom/python/wheelhouse/generic/scikit_learn-0.22.1+computecanada-cp37-cp37m-linux_x86_64.whl
Processing /cvmfs/soft.computecanada.ca/custom/python/wheelhouse/generic/tensorboard-2.3.0+computecanada-py3-none-any.whl
Processing /cvmfs/soft.computecanada.ca/custom/python/wheelhouse/generic/tensorboard_plugin_wit-1.7.0+computecanada-py3-none-any.whl
Processing /cvmfs/soft.computecanada.ca/custom/python/wheelhouse/generic/tensorflow_gpu-2.3.0+computecanada-cp37-cp37m-linux_x86_64.whl
Processing /cvmfs/soft.computecanada.ca/custom/python/wheelhouse/generic/tensorflow_estimator-2.3.0+computecanada-py2.py3-none-any.whl
Processing /cvmfs/soft.computecanada.ca/custom/python/wheelhouse/generic/tokenizers-0.5.2+computecanada-cp37-cp37m-linux_x86_64.whl
Processing /cvmfs/soft.computecanada.ca/custom/python/wheelhouse/nix/avx2/torch-1.4.0+computecanada-cp37-cp37m-linux_x86_64.whl
Processing /cvmfs/soft.computecanada.ca/custom/python/wheelhouse/generic/torchtext-0.6.0+computecanada-py3-none-any.whl
Processing /cvmfs/soft.computecanada.ca/custom/python/wheelhouse/generic/torchvision-0.8.2+computecanada-cp37-cp37m-linux_x86_64.whl
Processing /cvmfs/soft.computecanada.ca/custom/python/wheelhouse/generic/transformers-2.5.1+computecanada-py3-none-any.whl
Processing /cvmfs/soft.computecanada.ca/custom/python/wheelhouse/generic/urllib3-1.26.7+computecanada-py2.py3-none-any.whl
ERROR: Could not find a version that satisfies the requirement regex>=2021.8.3 (from nltk) (from versions: 2018.1.10+computecanada, 2019.11.1+computecanada, 2020.11.13+computecanada)
ERROR: No matching distribution found for regex>=2021.8.3
Looking in links: /cvmfs/soft.computecanada.ca/custom/python/wheelhouse/nix/avx2, /cvmfs/soft.computecanada.ca/custom/python/wheelhouse/nix/generic, /cvmfs/soft.computecanada.ca/custom/python/wheelhouse/generic
ERROR: Could not find a version that satisfies the requirement numpy==1.20.0+computacanada (from versions: 1.15.0+computecanada, 1.15.2+computecanada, 1.15.4+computecanada, 1.16.0+computecanada, 1.16.2+computecanada, 1.16.3+computecanada, 1.17.4+computecanada, 1.18.1+computecanada, 1.18.4+computecanada, 1.19.1+computecanada, 1.19.2+computecanada, 1.20.2+computecanada)
ERROR: No matching distribution found for numpy==1.20.0+computacanada
Looking in links: /cvmfs/soft.computecanada.ca/custom/python/wheelhouse/nix/avx2, /cvmfs/soft.computecanada.ca/custom/python/wheelhouse/nix/generic, /cvmfs/soft.computecanada.ca/custom/python/wheelhouse/generic
Processing /cvmfs/soft.computecanada.ca/custom/python/wheelhouse/generic/wandb-0.12.5+computecanada-py2.py3-none-any.whl
Requirement already satisfied: python-dateutil>=2.6.1 in /cvmfs/soft.computecanada.ca/easybuild/software/2017/Core/scipy-stack/2019a/lib/python3.7/site-packages (from wandb) (2.7.5)
Processing /cvmfs/soft.computecanada.ca/custom/python/wheelhouse/generic/configparser-5.0.2+computecanada-py3-none-any.whl
Processing /cvmfs/soft.computecanada.ca/custom/python/wheelhouse/generic/protobuf-3.19.4+computecanada-py2.py3-none-any.whl
Processing /cvmfs/soft.computecanada.ca/custom/python/wheelhouse/generic/pathtools-0.1.2+computecanada-py3-none-any.whl
Processing /cvmfs/soft.computecanada.ca/custom/python/wheelhouse/generic/six-1.16.0+computecanada-py2.py3-none-any.whl
Processing /cvmfs/soft.computecanada.ca/custom/python/wheelhouse/generic/shortuuid-1.0.1+computecanada-py3-none-any.whl
Processing /cvmfs/soft.computecanada.ca/custom/python/wheelhouse/generic/sentry_sdk-1.5.0+computecanada-py2.py3-none-any.whl
Requirement already satisfied: requests<3,>=2.0.0 in /cvmfs/soft.computecanada.ca/easybuild/software/2017/Core/scipy-stack/2019a/lib/python3.7/site-packages (from wandb) (2.21.0)
Processing /cvmfs/soft.computecanada.ca/custom/python/wheelhouse/generic/GitPython-3.1.24+computecanada-py3-none-any.whl
Processing /cvmfs/soft.computecanada.ca/custom/python/wheelhouse/generic/psutil-5.7.3+computecanada-cp37-cp37m-linux_x86_64.whl
Processing /cvmfs/soft.computecanada.ca/custom/python/wheelhouse/generic/subprocess32-3.5.4+computecanada-py3-none-any.whl
Processing /cvmfs/soft.computecanada.ca/custom/python/wheelhouse/generic/yaspin-2.1.0+computecanada-py3-none-any.whl
Processing /cvmfs/soft.computecanada.ca/custom/python/wheelhouse/generic/PyYAML-5.3.1+computecanada-cp37-cp37m-linux_x86_64.whl
Processing /cvmfs/soft.computecanada.ca/custom/python/wheelhouse/generic/docker_pycreds-0.4.0+computecanada-py2.py3-none-any.whl
Processing /cvmfs/soft.computecanada.ca/custom/python/wheelhouse/generic/promise-2.3+computecanada-py3-none-any.whl
Processing /cvmfs/soft.computecanada.ca/custom/python/wheelhouse/generic/click-8.0.3+computecanada-py3-none-any.whl
Requirement already satisfied: importlib-metadata in /cvmfs/soft.computecanada.ca/easybuild/software/2017/Core/scipy-stack/2019a/lib/python3.7/site-packages (from Click!=8.0.0,>=7.0->wandb) (0.8)
Processing /cvmfs/soft.computecanada.ca/custom/python/wheelhouse/generic/gitdb-4.0.9+computecanada-py3-none-any.whl
Processing /cvmfs/soft.computecanada.ca/custom/python/wheelhouse/generic/typing_extensions-4.0.1+computecanada-py3-none-any.whl
Processing /cvmfs/soft.computecanada.ca/custom/python/wheelhouse/generic/smmap-5.0.0+computecanada-py3-none-any.whl
Requirement already satisfied: chardet<3.1.0,>=3.0.2 in /cvmfs/soft.computecanada.ca/easybuild/software/2017/Core/scipy-stack/2019a/lib/python3.7/site-packages (from requests<3,>=2.0.0->wandb) (3.0.4)
Requirement already satisfied: idna<2.9,>=2.5 in /cvmfs/soft.computecanada.ca/easybuild/software/2017/Core/scipy-stack/2019a/lib/python3.7/site-packages (from requests<3,>=2.0.0->wandb) (2.8)
Requirement already satisfied: urllib3<1.25,>=1.21.1 in /cvmfs/soft.computecanada.ca/easybuild/software/2017/Core/scipy-stack/2019a/lib/python3.7/site-packages (from requests<3,>=2.0.0->wandb) (1.24.1)
Requirement already satisfied: certifi>=2017.4.17 in /cvmfs/soft.computecanada.ca/easybuild/software/2017/Core/scipy-stack/2019a/lib/python3.7/site-packages (from requests<3,>=2.0.0->wandb) (2018.11.29)
Processing /cvmfs/soft.computecanada.ca/custom/python/wheelhouse/generic/termcolor-1.1.0+computecanada-py3-none-any.whl
Requirement already satisfied: zipp>=0.3.2 in /cvmfs/soft.computecanada.ca/easybuild/software/2017/Core/scipy-stack/2019a/lib/python3.7/site-packages (from importlib-metadata->Click!=8.0.0,>=7.0->wandb) (0.3.3)
Installing collected packages: smmap, typing-extensions, termcolor, six, gitdb, yaspin, subprocess32, shortuuid, sentry-sdk, PyYAML, psutil, protobuf, promise, pathtools, GitPython, docker-pycreds, configparser, Click, wandb
  Attempting uninstall: six
    Found existing installation: six 1.12.0
    Not uninstalling six at /cvmfs/soft.computecanada.ca/easybuild/software/2017/Core/scipy-stack/2019a/lib/python3.7/site-packages, outside environment /localscratch/yinan.28724298.0/env
    Can't uninstall 'six'. No files were found to uninstall.
Successfully installed Click-8.0.3+computecanada GitPython-3.1.24+computecanada PyYAML-5.3.1+computecanada configparser-5.0.2+computecanada docker-pycreds-0.4.0+computecanada gitdb-4.0.9+computecanada pathtools-0.1.2+computecanada promise-2.3+computecanada protobuf-3.19.4+computecanada psutil-5.7.3+computecanada sentry-sdk-1.5.0+computecanada shortuuid-1.0.1+computecanada six-1.16.0+computecanada smmap-5.0.0+computecanada subprocess32-3.5.4+computecanada termcolor-1.1.0+computecanada typing-extensions-4.0.1+computecanada wandb-0.12.5+computecanada yaspin-2.1.0+computecanada
Looking in links: /cvmfs/soft.computecanada.ca/custom/python/wheelhouse/nix/avx2, /cvmfs/soft.computecanada.ca/custom/python/wheelhouse/nix/generic, /cvmfs/soft.computecanada.ca/custom/python/wheelhouse/generic
ERROR: Could not find a version that satisfies the requirement sagemaker (from versions: none)
ERROR: No matching distribution found for sagemaker
Looking in links: /cvmfs/soft.computecanada.ca/custom/python/wheelhouse/nix/avx2, /cvmfs/soft.computecanada.ca/custom/python/wheelhouse/nix/generic, /cvmfs/soft.computecanada.ca/custom/python/wheelhouse/generic
Processing /cvmfs/soft.computecanada.ca/custom/python/wheelhouse/generic/torch-1.9.1+computecanada-cp37-cp37m-linux_x86_64.whl
Requirement already satisfied: typing-extensions in /localscratch/yinan.28724298.0/env/lib/python3.7/site-packages (from torch) (4.0.1+computecanada)
Installing collected packages: torch
Successfully installed torch-1.9.1+computecanada
Looking in links: /cvmfs/soft.computecanada.ca/custom/python/wheelhouse/nix/avx2, /cvmfs/soft.computecanada.ca/custom/python/wheelhouse/nix/generic, /cvmfs/soft.computecanada.ca/custom/python/wheelhouse/generic
Processing /cvmfs/soft.computecanada.ca/custom/python/wheelhouse/generic/transformers-2.5.1+computecanada-py3-none-any.whl
Processing /cvmfs/soft.computecanada.ca/custom/python/wheelhouse/generic/sacremoses-0.0.46+computecanada-py3-none-any.whl
Requirement already satisfied: numpy in /cvmfs/soft.computecanada.ca/easybuild/software/2017/Core/scipy-stack/2019a/lib/python3.7/site-packages (from transformers==2.5.1+computecanada) (1.16.0)
Processing /cvmfs/soft.computecanada.ca/custom/python/wheelhouse/generic/regex-2020.11.13+computecanada-cp37-cp37m-linux_x86_64.whl
Processing /cvmfs/soft.computecanada.ca/custom/python/wheelhouse/generic/boto3-1.20.52+computecanada-py3-none-any.whl
Processing /cvmfs/soft.computecanada.ca/custom/python/wheelhouse/generic/filelock-3.4.2+computecanada-py3-none-any.whl
Processing /cvmfs/soft.computecanada.ca/custom/python/wheelhouse/generic/tqdm-4.63.0+computecanada-py2.py3-none-any.whl
Processing /cvmfs/soft.computecanada.ca/custom/python/wheelhouse/generic/sentencepiece-0.1.91+computecanada-cp37-cp37m-linux_x86_64.whl
Requirement already satisfied: requests in /cvmfs/soft.computecanada.ca/easybuild/software/2017/Core/scipy-stack/2019a/lib/python3.7/site-packages (from transformers==2.5.1+computecanada) (2.21.0)
Processing /cvmfs/soft.computecanada.ca/custom/python/wheelhouse/generic/tokenizers-0.5.2+computecanada-cp37-cp37m-linux_x86_64.whl
Processing /cvmfs/soft.computecanada.ca/custom/python/wheelhouse/generic/botocore-1.23.52+computecanada-py3-none-any.whl
Processing /cvmfs/soft.computecanada.ca/custom/python/wheelhouse/generic/jmespath-0.10.0+computecanada-py2.py3-none-any.whl
Processing /cvmfs/soft.computecanada.ca/custom/python/wheelhouse/generic/s3transfer-0.5.1+computecanada-py3-none-any.whl
Processing /cvmfs/soft.computecanada.ca/custom/python/wheelhouse/generic/urllib3-1.26.8+computecanada-py2.py3-none-any.whl
Requirement already satisfied: python-dateutil<3.0.0,>=2.1 in /cvmfs/soft.computecanada.ca/easybuild/software/2017/Core/scipy-stack/2019a/lib/python3.7/site-packages (from botocore<1.24.0,>=1.23.52->boto3->transformers==2.5.1+computecanada) (2.7.5)
Requirement already satisfied: six>=1.5 in /localscratch/yinan.28724298.0/env/lib/python3.7/site-packages (from python-dateutil<3.0.0,>=2.1->botocore<1.24.0,>=1.23.52->boto3->transformers==2.5.1+computecanada) (1.16.0+computecanada)
Requirement already satisfied: certifi>=2017.4.17 in /cvmfs/soft.computecanada.ca/easybuild/software/2017/Core/scipy-stack/2019a/lib/python3.7/site-packages (from requests->transformers==2.5.1+computecanada) (2018.11.29)
Requirement already satisfied: idna<2.9,>=2.5 in /cvmfs/soft.computecanada.ca/easybuild/software/2017/Core/scipy-stack/2019a/lib/python3.7/site-packages (from requests->transformers==2.5.1+computecanada) (2.8)
Processing /cvmfs/soft.computecanada.ca/custom/python/wheelhouse/generic/requests-2.27.1+computecanada-py2.py3-none-any.whl
Processing /cvmfs/soft.computecanada.ca/custom/python/wheelhouse/generic/charset_normalizer-2.0.11+computecanada-py3-none-any.whl
Requirement already satisfied: click in /localscratch/yinan.28724298.0/env/lib/python3.7/site-packages (from sacremoses->transformers==2.5.1+computecanada) (8.0.3+computecanada)
Processing /cvmfs/soft.computecanada.ca/custom/python/wheelhouse/generic/joblib-1.1.0+computecanada-py2.py3-none-any.whl
Requirement already satisfied: importlib-metadata in /cvmfs/soft.computecanada.ca/easybuild/software/2017/Core/scipy-stack/2019a/lib/python3.7/site-packages (from click->sacremoses->transformers==2.5.1+computecanada) (0.8)
Requirement already satisfied: zipp>=0.3.2 in /cvmfs/soft.computecanada.ca/easybuild/software/2017/Core/scipy-stack/2019a/lib/python3.7/site-packages (from importlib-metadata->click->sacremoses->transformers==2.5.1+computecanada) (0.3.3)
Installing collected packages: urllib3, jmespath, botocore, tqdm, s3transfer, regex, joblib, charset-normalizer, tokenizers, sentencepiece, sacremoses, requests, filelock, boto3, transformers
  Attempting uninstall: urllib3
    Found existing installation: urllib3 1.24.1
    Not uninstalling urllib3 at /cvmfs/soft.computecanada.ca/easybuild/software/2017/Core/scipy-stack/2019a/lib/python3.7/site-packages, outside environment /localscratch/yinan.28724298.0/env
    Can't uninstall 'urllib3'. No files were found to uninstall.
  Attempting uninstall: requests
    Found existing installation: requests 2.21.0
    Not uninstalling requests at /cvmfs/soft.computecanada.ca/easybuild/software/2017/Core/scipy-stack/2019a/lib/python3.7/site-packages, outside environment /localscratch/yinan.28724298.0/env
    Can't uninstall 'requests'. No files were found to uninstall.
Successfully installed boto3-1.20.52+computecanada botocore-1.23.52+computecanada charset-normalizer-2.0.11+computecanada filelock-3.4.2+computecanada jmespath-0.10.0+computecanada joblib-1.1.0+computecanada regex-2020.11.13+computecanada requests-2.27.1+computecanada s3transfer-0.5.1+computecanada sacremoses-0.0.46+computecanada sentencepiece-0.1.91+computecanada tokenizers-0.5.2+computecanada tqdm-4.63.0+computecanada transformers-2.5.1+computecanada urllib3-1.26.8+computecanada
Looking in links: /cvmfs/soft.computecanada.ca/custom/python/wheelhouse/nix/avx2, /cvmfs/soft.computecanada.ca/custom/python/wheelhouse/nix/generic, /cvmfs/soft.computecanada.ca/custom/python/wheelhouse/generic
Processing /cvmfs/soft.computecanada.ca/custom/python/wheelhouse/generic/tensorflow_gpu-2.3.0+computecanada-cp37-cp37m-linux_x86_64.whl
Processing /cvmfs/soft.computecanada.ca/custom/python/wheelhouse/nix/generic/scipy-1.4.1+computecanada-cp37-cp37m-linux_x86_64.whl
Processing /cvmfs/soft.computecanada.ca/custom/python/wheelhouse/nix/avx2/h5py-2.10.0+computecanada-cp37-cp37m-linux_x86_64.whl
Requirement already satisfied: wheel>=0.26 in /localscratch/yinan.28724298.0/env/lib/python3.7/site-packages (from tensorflow_gpu==2.3.0+computecanada) (0.33.4)
Requirement already satisfied: protobuf>=3.9.2 in /localscratch/yinan.28724298.0/env/lib/python3.7/site-packages (from tensorflow_gpu==2.3.0+computecanada) (3.19.4+computecanada)
Requirement already satisfied: termcolor>=1.1.0 in /localscratch/yinan.28724298.0/env/lib/python3.7/site-packages (from tensorflow_gpu==2.3.0+computecanada) (1.1.0+computecanada)
Processing /cvmfs/soft.computecanada.ca/custom/python/wheelhouse/generic/gast-0.3.3+computecanada-py3-none-any.whl
Processing /cvmfs/soft.computecanada.ca/custom/python/wheelhouse/generic/astunparse-1.6.3+computecanada-py2.py3-none-any.whl
Processing /cvmfs/soft.computecanada.ca/custom/python/wheelhouse/generic/absl_py-1.0.0+computecanada-py3-none-any.whl
Requirement already satisfied: numpy<1.19.0,>=1.16.0 in /cvmfs/soft.computecanada.ca/easybuild/software/2017/Core/scipy-stack/2019a/lib/python3.7/site-packages (from tensorflow_gpu==2.3.0+computecanada) (1.16.0)
Processing /cvmfs/soft.computecanada.ca/custom/python/wheelhouse/generic/Keras_Preprocessing-1.1.2+computecanada-py3-none-any.whl
Processing /cvmfs/soft.computecanada.ca/custom/python/wheelhouse/generic/opt_einsum-3.3.0+computecanada-py3-none-any.whl
Requirement already satisfied: six>=1.12.0 in /localscratch/yinan.28724298.0/env/lib/python3.7/site-packages (from tensorflow_gpu==2.3.0+computecanada) (1.16.0+computecanada)
Processing /cvmfs/soft.computecanada.ca/custom/python/wheelhouse/generic/tensorboard-2.8.0+computecanada-py3-none-any.whl
Processing /cvmfs/soft.computecanada.ca/custom/python/wheelhouse/generic/google_pasta-0.2.0+computecanada-py3-none-any.whl
Processing /cvmfs/soft.computecanada.ca/custom/python/wheelhouse/generic/grpcio-1.38.0+computecanada-cp37-cp37m-linux_x86_64.whl
Processing /cvmfs/soft.computecanada.ca/custom/python/wheelhouse/generic/wrapt-1.11.2+computecanada-cp37-cp37m-linux_x86_64.whl
Processing /cvmfs/soft.computecanada.ca/custom/python/wheelhouse/generic/tensorflow_estimator-2.3.0+computecanada-py2.py3-none-any.whl
Processing /cvmfs/soft.computecanada.ca/custom/python/wheelhouse/generic/Markdown-3.3.6+computecanada-py3-none-any.whl
Requirement already satisfied: setuptools>=41.0.0 in /localscratch/yinan.28724298.0/env/lib/python3.7/site-packages (from tensorboard<3,>=2.3.0->tensorflow_gpu==2.3.0+computecanada) (41.0.1)
Processing /cvmfs/soft.computecanada.ca/custom/python/wheelhouse/generic/tensorboard_data_server-0.6.1+computecanada-py3-none-linux_x86_64.whl
Processing /cvmfs/soft.computecanada.ca/custom/python/wheelhouse/generic/google_auth_oauthlib-0.4.6+computecanada-py2.py3-none-any.whl
Processing /cvmfs/soft.computecanada.ca/custom/python/wheelhouse/generic/Werkzeug-2.0.3+computecanada-py3-none-any.whl
Requirement already satisfied: requests<3,>=2.21.0 in /localscratch/yinan.28724298.0/env/lib/python3.7/site-packages (from tensorboard<3,>=2.3.0->tensorflow_gpu==2.3.0+computecanada) (2.27.1+computecanada)
Processing /cvmfs/soft.computecanada.ca/custom/python/wheelhouse/generic/google_auth-2.3.3+computecanada-py2.py3-none-any.whl
Processing /cvmfs/soft.computecanada.ca/custom/python/wheelhouse/generic/tensorboard_plugin_wit-1.8.0+computecanada-py3-none-any.whl
Processing /cvmfs/soft.computecanada.ca/custom/python/wheelhouse/generic/pyasn1_modules-0.2.8+computecanada-py2.py3-none-any.whl
Processing /cvmfs/soft.computecanada.ca/custom/python/wheelhouse/generic/rsa-4.8+computecanada-py3-none-any.whl
Processing /cvmfs/soft.computecanada.ca/custom/python/wheelhouse/generic/cachetools-4.2.4+computecanada-py3-none-any.whl
Processing /cvmfs/soft.computecanada.ca/custom/python/wheelhouse/generic/requests_oauthlib-1.3.0+computecanada-py2.py3-none-any.whl
Processing /cvmfs/soft.computecanada.ca/custom/python/wheelhouse/generic/importlib_metadata-4.10.1+computecanada-py3-none-any.whl
Processing /cvmfs/soft.computecanada.ca/custom/python/wheelhouse/generic/zipp-3.7.0+computecanada-py3-none-any.whl
Requirement already satisfied: typing-extensions>=3.6.4 in /localscratch/yinan.28724298.0/env/lib/python3.7/site-packages (from importlib-metadata>=4.4->markdown>=2.6.8->tensorboard<3,>=2.3.0->tensorflow_gpu==2.3.0+computecanada) (4.0.1+computecanada)
Processing /cvmfs/soft.computecanada.ca/custom/python/wheelhouse/generic/pyasn1-0.4.8+computecanada-py2.py3-none-any.whl
Requirement already satisfied: urllib3<1.27,>=1.21.1 in /localscratch/yinan.28724298.0/env/lib/python3.7/site-packages (from requests<3,>=2.21.0->tensorboard<3,>=2.3.0->tensorflow_gpu==2.3.0+computecanada) (1.26.8+computecanada)
Requirement already satisfied: certifi>=2017.4.17 in /cvmfs/soft.computecanada.ca/easybuild/software/2017/Core/scipy-stack/2019a/lib/python3.7/site-packages (from requests<3,>=2.21.0->tensorboard<3,>=2.3.0->tensorflow_gpu==2.3.0+computecanada) (2018.11.29)
Requirement already satisfied: idna<4,>=2.5 in /cvmfs/soft.computecanada.ca/easybuild/software/2017/Core/scipy-stack/2019a/lib/python3.7/site-packages (from requests<3,>=2.21.0->tensorboard<3,>=2.3.0->tensorflow_gpu==2.3.0+computecanada) (2.8)
Requirement already satisfied: charset-normalizer~=2.0.0 in /localscratch/yinan.28724298.0/env/lib/python3.7/site-packages (from requests<3,>=2.21.0->tensorboard<3,>=2.3.0->tensorflow_gpu==2.3.0+computecanada) (2.0.11+computecanada)
Processing /cvmfs/soft.computecanada.ca/custom/python/wheelhouse/generic/oauthlib-3.1.1+computecanada-py2.py3-none-any.whl
Installing collected packages: pyasn1, zipp, rsa, pyasn1-modules, oauthlib, cachetools, requests-oauthlib, importlib-metadata, google-auth, werkzeug, tensorboard-plugin-wit, tensorboard-data-server, markdown, grpcio, google-auth-oauthlib, absl-py, wrapt, tensorflow-estimator, tensorboard, scipy, opt-einsum, keras-preprocessing, h5py, google-pasta, gast, astunparse, tensorflow-gpu
  Attempting uninstall: pyasn1
    Found existing installation: pyasn1 0.4.3
    Not uninstalling pyasn1 at /cvmfs/soft.computecanada.ca/easybuild/software/2017/Core/scipy-stack/2019a/lib/python3.7/site-packages, outside environment /localscratch/yinan.28724298.0/env
    Can't uninstall 'pyasn1'. No files were found to uninstall.
  Attempting uninstall: zipp
    Found existing installation: zipp 0.3.3
    Not uninstalling zipp at /cvmfs/soft.computecanada.ca/easybuild/software/2017/Core/scipy-stack/2019a/lib/python3.7/site-packages, outside environment /localscratch/yinan.28724298.0/env
    Can't uninstall 'zipp'. No files were found to uninstall.
  Attempting uninstall: importlib-metadata
    Found existing installation: importlib-metadata 0.8
    Not uninstalling importlib-metadata at /cvmfs/soft.computecanada.ca/easybuild/software/2017/Core/scipy-stack/2019a/lib/python3.7/site-packages, outside environment /localscratch/yinan.28724298.0/env
    Can't uninstall 'importlib-metadata'. No files were found to uninstall.
  Attempting uninstall: scipy
    Found existing installation: scipy 1.2.0
    Not uninstalling scipy at /cvmfs/soft.computecanada.ca/easybuild/software/2017/Core/scipy-stack/2019a/lib/python3.7/site-packages, outside environment /localscratch/yinan.28724298.0/env
    Can't uninstall 'scipy'. No files were found to uninstall.
Successfully installed absl-py-1.0.0+computecanada astunparse-1.6.3+computecanada cachetools-4.2.4+computecanada gast-0.3.3+computecanada google-auth-2.3.3+computecanada google-auth-oauthlib-0.4.6+computecanada google-pasta-0.2.0+computecanada grpcio-1.38.0+computecanada h5py-2.10.0+computecanada importlib-metadata-4.10.1+computecanada keras-preprocessing-1.1.2+computecanada markdown-3.3.6+computecanada oauthlib-3.1.1+computecanada opt-einsum-3.3.0+computecanada pyasn1-0.4.8+computecanada pyasn1-modules-0.2.8+computecanada requests-oauthlib-1.3.0+computecanada rsa-4.8+computecanada scipy-1.4.1+computecanada tensorboard-2.8.0+computecanada tensorboard-data-server-0.6.1+computecanada tensorboard-plugin-wit-1.8.0+computecanada tensorflow-estimator-2.3.0+computecanada tensorflow-gpu-2.3.0+computecanada werkzeug-2.0.3+computecanada wrapt-1.11.2+computecanada zipp-3.7.0+computecanada
Looking in links: /cvmfs/soft.computecanada.ca/custom/python/wheelhouse/nix/avx2, /cvmfs/soft.computecanada.ca/custom/python/wheelhouse/nix/generic, /cvmfs/soft.computecanada.ca/custom/python/wheelhouse/generic
Processing /cvmfs/soft.computecanada.ca/custom/python/wheelhouse/generic/keras-2.8.0+computecanada-py2.py3-none-any.whl
Installing collected packages: Keras
Successfully installed Keras-2.8.0+computecanada
Looking in links: /cvmfs/soft.computecanada.ca/custom/python/wheelhouse/nix/avx2, /cvmfs/soft.computecanada.ca/custom/python/wheelhouse/nix/generic, /cvmfs/soft.computecanada.ca/custom/python/wheelhouse/generic
Processing /cvmfs/soft.computecanada.ca/custom/python/wheelhouse/generic/urllib3-1.26.7+computecanada-py2.py3-none-any.whl
Installing collected packages: urllib3
  Attempting uninstall: urllib3
    Found existing installation: urllib3 1.26.8+computecanada
    Uninstalling urllib3-1.26.8+computecanada:
      Successfully uninstalled urllib3-1.26.8+computecanada
Successfully installed urllib3-1.26.7+computecanada
Looking in links: /cvmfs/soft.computecanada.ca/custom/python/wheelhouse/nix/avx2, /cvmfs/soft.computecanada.ca/custom/python/wheelhouse/nix/generic, /cvmfs/soft.computecanada.ca/custom/python/wheelhouse/generic
Processing /cvmfs/soft.computecanada.ca/custom/python/wheelhouse/generic/nltk-3.7+computecanada-py3-none-any.whl
Requirement already satisfied: joblib in /localscratch/yinan.28724298.0/env/lib/python3.7/site-packages (from nltk) (1.1.0+computecanada)
Processing /cvmfs/soft.computecanada.ca/custom/python/wheelhouse/generic/nltk-3.6.5+computecanada-py3-none-any.whl
Processing /cvmfs/soft.computecanada.ca/custom/python/wheelhouse/generic/nltk-3.6.3+computecanada-py3-none-any.whl
Requirement already satisfied: regex in /localscratch/yinan.28724298.0/env/lib/python3.7/site-packages (from nltk) (2020.11.13+computecanada)
Requirement already satisfied: tqdm in /localscratch/yinan.28724298.0/env/lib/python3.7/site-packages (from nltk) (4.63.0+computecanada)
Requirement already satisfied: click in /localscratch/yinan.28724298.0/env/lib/python3.7/site-packages (from nltk) (8.0.3+computecanada)
Requirement already satisfied: importlib-metadata in /localscratch/yinan.28724298.0/env/lib/python3.7/site-packages (from click->nltk) (4.10.1+computecanada)
Requirement already satisfied: typing-extensions>=3.6.4 in /localscratch/yinan.28724298.0/env/lib/python3.7/site-packages (from importlib-metadata->click->nltk) (4.0.1+computecanada)
Requirement already satisfied: zipp>=0.5 in /localscratch/yinan.28724298.0/env/lib/python3.7/site-packages (from importlib-metadata->click->nltk) (3.7.0+computecanada)
Installing collected packages: nltk
Successfully installed nltk-3.6.3+computecanada
Looking in links: /cvmfs/soft.computecanada.ca/custom/python/wheelhouse/nix/avx2, /cvmfs/soft.computecanada.ca/custom/python/wheelhouse/nix/generic, /cvmfs/soft.computecanada.ca/custom/python/wheelhouse/generic
Processing /cvmfs/soft.computecanada.ca/custom/python/wheelhouse/generic/scikit_learn-0.22.1+computecanada-cp37-cp37m-linux_x86_64.whl
Requirement already satisfied: scipy>=0.17.0 in /localscratch/yinan.28724298.0/env/lib/python3.7/site-packages (from scikit-learn==0.22.1) (1.4.1+computecanada)
Requirement already satisfied: numpy>=1.11.0 in /cvmfs/soft.computecanada.ca/easybuild/software/2017/Core/scipy-stack/2019a/lib/python3.7/site-packages (from scikit-learn==0.22.1) (1.16.0)
Requirement already satisfied: joblib>=0.11 in /localscratch/yinan.28724298.0/env/lib/python3.7/site-packages (from scikit-learn==0.22.1) (1.1.0+computecanada)
Installing collected packages: scikit-learn
Successfully installed scikit-learn-0.22.1+computecanada
Looking in links: /cvmfs/soft.computecanada.ca/custom/python/wheelhouse/nix/avx2, /cvmfs/soft.computecanada.ca/custom/python/wheelhouse/nix/generic, /cvmfs/soft.computecanada.ca/custom/python/wheelhouse/generic
Requirement already satisfied: tokenizers==0.5.2 in /localscratch/yinan.28724298.0/env/lib/python3.7/site-packages (0.5.2+computecanada)
wandb: Appending key for api.wandb.ai to your netrc file: /home/yinan/.netrc
Starting Task
2022-03-11 06:59:16.917534: I tensorflow/stream_executor/platform/default/dso_loader.cc:48] Successfully opened dynamic library libcudart.so.10.1
[nltk_data] Downloading package stopwords to /home/yinan/nltk_data...
[nltk_data]   Package stopwords is already up-to-date!
[nltk_data] Downloading package wordnet to /home/yinan/nltk_data...
[nltk_data]   Package wordnet is already up-to-date!
wandb: Currently logged in as: yinanazhou (use `wandb login --relogin` to force relogin)
wandb: wandb version 0.12.11 is available!  To upgrade, please run:
wandb:  $ pip install wandb --upgrade
2022-03-11 06:59:31.157538: I tensorflow/stream_executor/platform/default/dso_loader.cc:48] Successfully opened dynamic library libcudart.so.10.1
wandb: Tracking run with wandb version 0.12.5
wandb: Syncing run cool-galaxy-1
wandb: ⭐️ View project at https://wandb.ai/yinanazhou/xl_512_bs_8_lr_1e07_es_10_lc_False_nr_False_sr_False_stem_False_lemma_True_repeat_1_fold_1
wandb: 🚀 View run at https://wandb.ai/yinanazhou/xl_512_bs_8_lr_1e07_es_10_lc_False_nr_False_sr_False_stem_False_lemma_True_repeat_1_fold_1/runs/3vimpjlg
wandb: Run data is saved locally in /project/6002780/yinan/Thesis_MER_Lyrics/lyric-emotion/wandb/run-20220311_065928-3vimpjlg
wandb: Run `wandb offline` to turn off syncing.

Validation loss decreased (inf --> 1.454695).  Saving model ...
Validation loss decreased (1.454695 --> 1.452011).  Saving model ...
Validation loss decreased (1.452011 --> 1.449280).  Saving model ...
Validation loss decreased (1.449280 --> 1.446593).  Saving model ...
Validation loss decreased (1.446593 --> 1.444049).  Saving model ...
Validation loss decreased (1.444049 --> 1.441585).  Saving model ...
Validation loss decreased (1.441585 --> 1.439128).  Saving model ...
Validation loss decreased (1.439128 --> 1.436821).  Saving model ...
Validation loss decreased (1.436821 --> 1.434722).  Saving model ...
Validation loss decreased (1.434722 --> 1.432451).  Saving model ...
Validation loss decreased (1.432451 --> 1.430203).  Saving model ...
Validation loss decreased (1.430203 --> 1.428191).  Saving model ...
Validation loss decreased (1.428191 --> 1.426110).  Saving model ...
Validation loss decreased (1.426110 --> 1.424131).  Saving model ...
Validation loss decreased (1.424131 --> 1.422200).  Saving model ...
Validation loss decreased (1.422200 --> 1.420308).  Saving model ...
Validation loss decreased (1.420308 --> 1.418474).  Saving model ...
Validation loss decreased (1.418474 --> 1.416650).  Saving model ...
Validation loss decreased (1.416650 --> 1.414877).  Saving model ...
Validation loss decreased (1.414877 --> 1.413097).  Saving model ...
Validation loss decreased (1.413097 --> 1.411246).  Saving model ...
Validation loss decreased (1.411246 --> 1.409584).  Saving model ...
Validation loss decreased (1.409584 --> 1.407967).  Saving model ...
Validation loss decreased (1.407967 --> 1.406426).  Saving model ...
Validation loss decreased (1.406426 --> 1.404857).  Saving model ...
Validation loss decreased (1.404857 --> 1.403321).  Saving model ...
Validation loss decreased (1.403321 --> 1.401875).  Saving model ...
Validation loss decreased (1.401875 --> 1.400404).  Saving model ...
Validation loss decreased (1.400404 --> 1.399038).  Saving model ...
Validation loss decreased (1.399038 --> 1.397701).  Saving model ...
Validation loss decreased (1.397701 --> 1.396314).  Saving model ...
Validation loss decreased (1.396314 --> 1.394939).  Saving model ...
Validation loss decreased (1.394939 --> 1.393675).  Saving model ...
Validation loss decreased (1.393675 --> 1.392399).  Saving model ...
Validation loss decreased (1.392399 --> 1.391208).  Saving model ...
Validation loss decreased (1.391208 --> 1.389898).  Saving model ...
Validation loss decreased (1.389898 --> 1.388637).  Saving model ...
Validation loss decreased (1.388637 --> 1.387570).  Saving model ...
Validation loss decreased (1.387570 --> 1.386434).  Saving model ...
Validation loss decreased (1.386434 --> 1.385347).  Saving model ...
Validation loss decreased (1.385347 --> 1.384289).  Saving model ...
Validation loss decreased (1.384289 --> 1.383167).  Saving model ...
Validation loss decreased (1.383167 --> 1.382103).  Saving model ...
Validation loss decreased (1.382103 --> 1.381099).  Saving model ...
Validation loss decreased (1.381099 --> 1.380001).  Saving model ...
Validation loss decreased (1.380001 --> 1.379066).  Saving model ...
Validation loss decreased (1.379066 --> 1.378115).  Saving model ...
Validation loss decreased (1.378115 --> 1.377080).  Saving model ...
Validation loss decreased (1.377080 --> 1.376153).  Saving model ...
Validation loss decreased (1.376153 --> 1.375144).  Saving model ...
Validation loss decreased (1.375144 --> 1.374300).  Saving model ...
Validation loss decreased (1.374300 --> 1.373460).  Saving model ...
Validation loss decreased (1.373460 --> 1.372543).  Saving model ...
Validation loss decreased (1.372543 --> 1.371678).  Saving model ...
Validation loss decreased (1.371678 --> 1.370822).  Saving model ...
Validation loss decreased (1.370822 --> 1.369981).  Saving model ...
Validation loss decreased (1.369981 --> 1.369085).  Saving model ...
Validation loss decreased (1.369085 --> 1.368211).  Saving model ...
Validation loss decreased (1.368211 --> 1.367370).  Saving model ...
Validation loss decreased (1.367370 --> 1.366597).  Saving model ...
Validation loss decreased (1.366597 --> 1.365762).  Saving model ...
Validation loss decreased (1.365762 --> 1.364947).  Saving model ...
Validation loss decreased (1.364947 --> 1.364074).  Saving model ...
Validation loss decreased (1.364074 --> 1.363277).  Saving model ...
Validation loss decreased (1.363277 --> 1.362552).  Saving model ...
Validation loss decreased (1.362552 --> 1.361769).  Saving model ...
Validation loss decreased (1.361769 --> 1.361054).  Saving model ...
Validation loss decreased (1.361054 --> 1.360365).  Saving model ...
Validation loss decreased (1.360365 --> 1.359718).  Saving model ...
Validation loss decreased (1.359718 --> 1.359095).  Saving model ...
Validation loss decreased (1.359095 --> 1.358453).  Saving model ...
Validation loss decreased (1.358453 --> 1.357706).  Saving model ...
Validation loss decreased (1.357706 --> 1.357054).  Saving model ...
Validation loss decreased (1.357054 --> 1.356382).  Saving model ...
Validation loss decreased (1.356382 --> 1.355768).  Saving model ...
Validation loss decreased (1.355768 --> 1.355094).  Saving model ...
Validation loss decreased (1.355094 --> 1.354482).  Saving model ...
Validation loss decreased (1.354482 --> 1.353841).  Saving model ...
Validation loss decreased (1.353841 --> 1.353196).  Saving model ...
Validation loss decreased (1.353196 --> 1.352561).  Saving model ...
Validation loss decreased (1.352561 --> 1.351933).  Saving model ...
Validation loss decreased (1.351933 --> 1.351394).  Saving model ...
Validation loss decreased (1.351394 --> 1.350757).  Saving model ...
Validation loss decreased (1.350757 --> 1.350196).  Saving model ...
Validation loss decreased (1.350196 --> 1.349613).  Saving model ...
Validation loss decreased (1.349613 --> 1.348931).  Saving model ...
Validation loss decreased (1.348931 --> 1.348332).  Saving model ...
Validation loss decreased (1.348332 --> 1.347669).  Saving model ...
Validation loss decreased (1.347669 --> 1.347096).  Saving model ...
Validation loss decreased (1.347096 --> 1.346541).  Saving model ...
Validation loss decreased (1.346541 --> 1.345971).  Saving model ...
Validation loss decreased (1.345971 --> 1.345397).  Saving model ...
Validation loss decreased (1.345397 --> 1.344759).  Saving model ...
Validation loss decreased (1.344759 --> 1.344141).  Saving model ...
Validation loss decreased (1.344141 --> 1.343540).  Saving model ...
Validation loss decreased (1.343540 --> 1.342989).  Saving model ...
Validation loss decreased (1.342989 --> 1.342389).  Saving model ...
Validation loss decreased (1.342389 --> 1.341732).  Saving model ...
Validation loss decreased (1.341732 --> 1.341120).  Saving model ...
Validation loss decreased (1.341120 --> 1.340617).  Saving model ...
Validation loss decreased (1.340617 --> 1.340015).  Saving model ...
Validation loss decreased (1.340015 --> 1.339413).  Saving model ...
Validation loss decreased (1.339413 --> 1.338857).  Saving model ...
Validation loss decreased (1.338857 --> 1.338331).  Saving model ...
Validation loss decreased (1.338331 --> 1.337768).  Saving model ...
Validation loss decreased (1.337768 --> 1.337170).  Saving model ...
Validation loss decreased (1.337170 --> 1.336682).  Saving model ...
Validation loss decreased (1.336682 --> 1.336117).  Saving model ...
Validation loss decreased (1.336117 --> 1.335542).  Saving model ...
Validation loss decreased (1.335542 --> 1.334922).  Saving model ...
Validation loss decreased (1.334922 --> 1.334324).  Saving model ...
Validation loss decreased (1.334324 --> 1.333850).  Saving model ...
Validation loss decreased (1.333850 --> 1.333334).  Saving model ...
Validation loss decreased (1.333334 --> 1.332793).  Saving model ...
Validation loss decreased (1.332793 --> 1.332222).  Saving model ...
Validation loss decreased (1.332222 --> 1.331707).  Saving model ...
Validation loss decreased (1.331707 --> 1.331143).  Saving model ...
Validation loss decreased (1.331143 --> 1.330671).  Saving model ...
Validation loss decreased (1.330671 --> 1.330150).  Saving model ...
Validation loss decreased (1.330150 --> 1.329582).  Saving model ...
Validation loss decreased (1.329582 --> 1.329050).  Saving model ...
Validation loss decreased (1.329050 --> 1.328488).  Saving model ...
Validation loss decreased (1.328488 --> 1.327951).  Saving model ...
Validation loss decreased (1.327951 --> 1.327390).  Saving model ...
Validation loss decreased (1.327390 --> 1.326933).  Saving model ...
Validation loss decreased (1.326933 --> 1.326384).  Saving model ...
Validation loss decreased (1.326384 --> 1.325891).  Saving model ...
Validation loss decreased (1.325891 --> 1.325352).  Saving model ...
Validation loss decreased (1.325352 --> 1.324789).  Saving model ...
Validation loss decreased (1.324789 --> 1.324187).  Saving model ...
Validation loss decreased (1.324187 --> 1.323666).  Saving model ...
Validation loss decreased (1.323666 --> 1.323193).  Saving model ...
Validation loss decreased (1.323193 --> 1.322640).  Saving model ...
Validation loss decreased (1.322640 --> 1.322112).  Saving model ...
Validation loss decreased (1.322112 --> 1.321587).  Saving model ...
Validation loss decreased (1.321587 --> 1.321027).  Saving model ...
Validation loss decreased (1.321027 --> 1.320517).  Saving model ...
Validation loss decreased (1.320517 --> 1.319926).  Saving model ...
Validation loss decreased (1.319926 --> 1.319365).  Saving model ...
Validation loss decreased (1.319365 --> 1.318816).  Saving model ...
Validation loss decreased (1.318816 --> 1.318245).  Saving model ...
Validation loss decreased (1.318245 --> 1.317676).  Saving model ...
Validation loss decreased (1.317676 --> 1.317119).  Saving model ...
Validation loss decreased (1.317119 --> 1.316528).  Saving model ...
Validation loss decreased (1.316528 --> 1.315923).  Saving model ...
Validation loss decreased (1.315923 --> 1.315370).  Saving model ...
Validation loss decreased (1.315370 --> 1.314794).  Saving model ...
Validation loss decreased (1.314794 --> 1.314209).  Saving model ...
Validation loss decreased (1.314209 --> 1.313627).  Saving model ...
Validation loss decreased (1.313627 --> 1.313003).  Saving model ...
Validation loss decreased (1.313003 --> 1.312435).  Saving model ...
Validation loss decreased (1.312435 --> 1.311881).  Saving model ...
Validation loss decreased (1.311881 --> 1.311341).  Saving model ...
Validation loss decreased (1.311341 --> 1.310771).  Saving model ...
Validation loss decreased (1.310771 --> 1.310177).  Saving model ...
Validation loss decreased (1.310177 --> 1.309634).  Saving model ...
Validation loss decreased (1.309634 --> 1.309057).  Saving model ...
Validation loss decreased (1.309057 --> 1.308463).  Saving model ...
Validation loss decreased (1.308463 --> 1.307957).  Saving model ...
Validation loss decreased (1.307957 --> 1.307424).  Saving model ...
Validation loss decreased (1.307424 --> 1.306789).  Saving model ...
Validation loss decreased (1.306789 --> 1.306272).  Saving model ...
Validation loss decreased (1.306272 --> 1.305707).  Saving model ...
Validation loss decreased (1.305707 --> 1.305048).  Saving model ...
Validation loss decreased (1.305048 --> 1.304403).  Saving model ...
Validation loss decreased (1.304403 --> 1.303827).  Saving model ...
Validation loss decreased (1.303827 --> 1.303279).  Saving model ...
Validation loss decreased (1.303279 --> 1.302708).  Saving model ...
Validation loss decreased (1.302708 --> 1.302116).  Saving model ...
Validation loss decreased (1.302116 --> 1.301589).  Saving model ...
Validation loss decreased (1.301589 --> 1.300979).  Saving model ...
Validation loss decreased (1.300979 --> 1.300403).  Saving model ...
Validation loss decreased (1.300403 --> 1.299861).  Saving model ...
Validation loss decreased (1.299861 --> 1.299157).  Saving model ...
Validation loss decreased (1.299157 --> 1.298556).  Saving model ...
Validation loss decreased (1.298556 --> 1.297944).  Saving model ...
Validation loss decreased (1.297944 --> 1.297307).  Saving model ...
Validation loss decreased (1.297307 --> 1.296667).  Saving model ...
Validation loss decreased (1.296667 --> 1.296157).  Saving model ...
Validation loss decreased (1.296157 --> 1.295498).  Saving model ...
Validation loss decreased (1.295498 --> 1.294810).  Saving model ...
Validation loss decreased (1.294810 --> 1.294163).  Saving model ...
Validation loss decreased (1.294163 --> 1.293545).  Saving model ...
Validation loss decreased (1.293545 --> 1.292947).  Saving model ...
Validation loss decreased (1.292947 --> 1.292244).  Saving model ...
Validation loss decreased (1.292244 --> 1.291555).  Saving model ...
Validation loss decreased (1.291555 --> 1.291013).  Saving model ...
Validation loss decreased (1.291013 --> 1.290580).  Saving model ...
Validation loss decreased (1.290580 --> 1.289981).  Saving model ...
Validation loss decreased (1.289981 --> 1.289456).  Saving model ...
Validation loss decreased (1.289456 --> 1.288948).  Saving model ...
Validation loss decreased (1.288948 --> 1.288280).  Saving model ...
Validation loss decreased (1.288280 --> 1.287704).  Saving model ...
Validation loss decreased (1.287704 --> 1.287089).  Saving model ...
Validation loss decreased (1.287089 --> 1.286346).  Saving model ...
Validation loss decreased (1.286346 --> 1.285766).  Saving model ...
Validation loss decreased (1.285766 --> 1.285174).  Saving model ...
Validation loss decreased (1.285174 --> 1.284660).  Saving model ...
Validation loss decreased (1.284660 --> 1.283912).  Saving model ...
Validation loss decreased (1.283912 --> 1.283207).  Saving model ...
Validation loss decreased (1.283207 --> 1.282544).  Saving model ...
Validation loss decreased (1.282544 --> 1.282008).  Saving model ...
Validation loss decreased (1.282008 --> 1.281377).  Saving model ...
Validation loss decreased (1.281377 --> 1.280839).  Saving model ...
Validation loss decreased (1.280839 --> 1.280323).  Saving model ...
Validation loss decreased (1.280323 --> 1.279689).  Saving model ...
Validation loss decreased (1.279689 --> 1.278997).  Saving model ...
Validation loss decreased (1.278997 --> 1.278368).  Saving model ...
Validation loss decreased (1.278368 --> 1.277875).  Saving model ...
Validation loss decreased (1.277875 --> 1.277242).  Saving model ...
Validation loss decreased (1.277242 --> 1.276502).  Saving model ...
Validation loss decreased (1.276502 --> 1.275710).  Saving model ...
Validation loss decreased (1.275710 --> 1.275185).  Saving model ...
Validation loss decreased (1.275185 --> 1.274490).  Saving model ...
Validation loss decreased (1.274490 --> 1.273783).  Saving model ...
Validation loss decreased (1.273783 --> 1.273233).  Saving model ...
Validation loss decreased (1.273233 --> 1.272619).  Saving model ...
Validation loss decreased (1.272619 --> 1.271834).  Saving model ...
Validation loss decreased (1.271834 --> 1.271153).  Saving model ...
Validation loss decreased (1.271153 --> 1.270388).  Saving model ...
Validation loss decreased (1.270388 --> 1.269534).  Saving model ...
Validation loss decreased (1.269534 --> 1.268579).  Saving model ...
Validation loss decreased (1.268579 --> 1.267737).  Saving model ...
Validation loss decreased (1.267737 --> 1.267022).  Saving model ...
Validation loss decreased (1.267022 --> 1.266257).  Saving model ...
Validation loss decreased (1.266257 --> 1.265610).  Saving model ...
Validation loss decreased (1.265610 --> 1.264889).  Saving model ...
Validation loss decreased (1.264889 --> 1.264284).  Saving model ...
Validation loss decreased (1.264284 --> 1.263577).  Saving model ...
Validation loss decreased (1.263577 --> 1.262715).  Saving model ...
Validation loss decreased (1.262715 --> 1.261926).  Saving model ...
Validation loss decreased (1.261926 --> 1.261207).  Saving model ...
Validation loss decreased (1.261207 --> 1.260487).  Saving model ...
Validation loss decreased (1.260487 --> 1.259790).  Saving model ...
Validation loss decreased (1.259790 --> 1.259031).  Saving model ...
Validation loss decreased (1.259031 --> 1.258349).  Saving model ...
Validation loss decreased (1.258349 --> 1.257627).  Saving model ...
Validation loss decreased (1.257627 --> 1.257006).  Saving model ...
Validation loss decreased (1.257006 --> 1.256256).  Saving model ...
Validation loss decreased (1.256256 --> 1.255493).  Saving model ...
Validation loss decreased (1.255493 --> 1.254800).  Saving model ...
Validation loss decreased (1.254800 --> 1.254123).  Saving model ...
Validation loss decreased (1.254123 --> 1.253414).  Saving model ...
Validation loss decreased (1.253414 --> 1.252595).  Saving model ...
Validation loss decreased (1.252595 --> 1.251754).  Saving model ...
Validation loss decreased (1.251754 --> 1.250912).  Saving model ...
Validation loss decreased (1.250912 --> 1.250365).  Saving model ...
Validation loss decreased (1.250365 --> 1.249792).  Saving model ...
Validation loss decreased (1.249792 --> 1.249088).  Saving model ...
Validation loss decreased (1.249088 --> 1.248559).  Saving model ...
Validation loss decreased (1.248559 --> 1.247851).  Saving model ...
Validation loss decreased (1.247851 --> 1.247184).  Saving model ...
Validation loss decreased (1.247184 --> 1.246510).  Saving model ...
Validation loss decreased (1.246510 --> 1.245905).  Saving model ...
Validation loss decreased (1.245905 --> 1.245193).  Saving model ...
Validation loss decreased (1.245193 --> 1.244430).  Saving model ...
Validation loss decreased (1.244430 --> 1.244027).  Saving model ...
Validation loss decreased (1.244027 --> 1.243371).  Saving model ...
Validation loss decreased (1.243371 --> 1.242488).  Saving model ...
Validation loss decreased (1.242488 --> 1.241871).  Saving model ...
Validation loss decreased (1.241871 --> 1.241131).  Saving model ...
Validation loss decreased (1.241131 --> 1.240511).  Saving model ...
Validation loss decreased (1.240511 --> 1.239844).  Saving model ...
Validation loss decreased (1.239844 --> 1.238980).  Saving model ...
Validation loss decreased (1.238980 --> 1.238191).  Saving model ...
Validation loss decreased (1.238191 --> 1.237534).  Saving model ...
Validation loss decreased (1.237534 --> 1.236982).  Saving model ...
Validation loss decreased (1.236982 --> 1.236384).  Saving model ...
Validation loss decreased (1.236384 --> 1.235683).  Saving model ...
Validation loss decreased (1.235683 --> 1.234849).  Saving model ...
Validation loss decreased (1.234849 --> 1.234296).  Saving model ...
Validation loss decreased (1.234296 --> 1.233421).  Saving model ...
Validation loss decreased (1.233421 --> 1.232829).  Saving model ...
Validation loss decreased (1.232829 --> 1.231894).  Saving model ...
Validation loss decreased (1.231894 --> 1.231242).  Saving model ...
Validation loss decreased (1.231242 --> 1.230517).  Saving model ...
Validation loss decreased (1.230517 --> 1.229708).  Saving model ...
Validation loss decreased (1.229708 --> 1.228876).  Saving model ...
Validation loss decreased (1.228876 --> 1.228245).  Saving model ...
Validation loss decreased (1.228245 --> 1.227434).  Saving model ...
Validation loss decreased (1.227434 --> 1.226789).  Saving model ...
Validation loss decreased (1.226789 --> 1.226250).  Saving model ...
Validation loss decreased (1.226250 --> 1.225627).  Saving model ...
Validation loss decreased (1.225627 --> 1.225014).  Saving model ...
Validation loss decreased (1.225014 --> 1.224624).  Saving model ...
Validation loss decreased (1.224624 --> 1.224281).  Saving model ...
Validation loss decreased (1.224281 --> 1.223554).  Saving model ...
Validation loss decreased (1.223554 --> 1.223000).  Saving model ...
Validation loss decreased (1.223000 --> 1.222654).  Saving model ...
Validation loss decreased (1.222654 --> 1.222257).  Saving model ...
Validation loss decreased (1.222257 --> 1.221692).  Saving model ...
Validation loss decreased (1.221692 --> 1.221059).  Saving model ...
Validation loss decreased (1.221059 --> 1.220603).  Saving model ...
Validation loss decreased (1.220603 --> 1.220191).  Saving model ...
Validation loss decreased (1.220191 --> 1.219397).  Saving model ...
Validation loss decreased (1.219397 --> 1.218765).  Saving model ...
Validation loss decreased (1.218765 --> 1.218297).  Saving model ...
Validation loss decreased (1.218297 --> 1.217766).  Saving model ...
Validation loss decreased (1.217766 --> 1.217230).  Saving model ...
Validation loss decreased (1.217230 --> 1.216605).  Saving model ...
Validation loss decreased (1.216605 --> 1.215978).  Saving model ...
Validation loss decreased (1.215978 --> 1.215093).  Saving model ...
Validation loss decreased (1.215093 --> 1.214499).  Saving model ...
Validation loss decreased (1.214499 --> 1.213906).  Saving model ...
Validation loss decreased (1.213906 --> 1.213401).  Saving model ...
Validation loss decreased (1.213401 --> 1.213050).  Saving model ...
Validation loss decreased (1.213050 --> 1.212376).  Saving model ...
Validation loss decreased (1.212376 --> 1.211763).  Saving model ...
Validation loss decreased (1.211763 --> 1.211200).  Saving model ...
Validation loss decreased (1.211200 --> 1.210413).  Saving model ...
Validation loss decreased (1.210413 --> 1.209739).  Saving model ...
Validation loss decreased (1.209739 --> 1.209089).  Saving model ...
Validation loss decreased (1.209089 --> 1.208519).  Saving model ...
Validation loss decreased (1.208519 --> 1.207957).  Saving model ...
Validation loss decreased (1.207957 --> 1.207572).  Saving model ...
Validation loss decreased (1.207572 --> 1.206924).  Saving model ...
Validation loss decreased (1.206924 --> 1.206332).  Saving model ...
Validation loss decreased (1.206332 --> 1.205893).  Saving model ...
Validation loss decreased (1.205893 --> 1.205582).  Saving model ...
Validation loss decreased (1.205582 --> 1.205176).  Saving model ...
Validation loss decreased (1.205176 --> 1.204880).  Saving model ...
Validation loss decreased (1.204880 --> 1.204105).  Saving model ...
Validation loss decreased (1.204105 --> 1.203497).  Saving model ...
Validation loss decreased (1.203497 --> 1.202962).  Saving model ...
Validation loss decreased (1.202962 --> 1.202394).  Saving model ...
Validation loss decreased (1.202394 --> 1.202043).  Saving model ...
Validation loss decreased (1.202043 --> 1.201553).  Saving model ...
Validation loss decreased (1.201553 --> 1.201094).  Saving model ...
Validation loss decreased (1.201094 --> 1.200428).  Saving model ...
Validation loss decreased (1.200428 --> 1.200019).  Saving model ...
Validation loss decreased (1.200019 --> 1.199612).  Saving model ...
Validation loss decreased (1.199612 --> 1.199383).  Saving model ...
Validation loss decreased (1.199383 --> 1.199117).  Saving model ...
Validation loss decreased (1.199117 --> 1.198837).  Saving model ...
Validation loss decreased (1.198837 --> 1.198491).  Saving model ...
Validation loss decreased (1.198491 --> 1.197866).  Saving model ...
Validation loss decreased (1.197866 --> 1.197334).  Saving model ...
Validation loss decreased (1.197334 --> 1.197022).  Saving model ...
Validation loss decreased (1.197022 --> 1.196261).  Saving model ...
Validation loss decreased (1.196261 --> 1.195452).  Saving model ...
Validation loss decreased (1.195452 --> 1.195059).  Saving model ...
Validation loss decreased (1.195059 --> 1.194500).  Saving model ...
Validation loss decreased (1.194500 --> 1.194040).  Saving model ...
Validation loss decreased (1.194040 --> 1.193547).  Saving model ...
Validation loss decreased (1.193547 --> 1.193224).  Saving model ...
Validation loss decreased (1.193224 --> 1.192953).  Saving model ...
Validation loss decreased (1.192953 --> 1.192551).  Saving model ...
Validation loss decreased (1.192551 --> 1.192100).  Saving model ...
Validation loss decreased (1.192100 --> 1.191603).  Saving model ...
Validation loss decreased (1.191603 --> 1.190961).  Saving model ...
Validation loss decreased (1.190961 --> 1.190510).  Saving model ...
Validation loss decreased (1.190510 --> 1.189784).  Saving model ...
Validation loss decreased (1.189784 --> 1.189406).  Saving model ...
Validation loss decreased (1.189406 --> 1.189083).  Saving model ...
Validation loss decreased (1.189083 --> 1.188575).  Saving model ...
Validation loss decreased (1.188575 --> 1.188223).  Saving model ...
Validation loss decreased (1.188223 --> 1.187467).  Saving model ...
Validation loss decreased (1.187467 --> 1.186836).  Saving model ...
Validation loss decreased (1.186836 --> 1.186302).  Saving model ...
Validation loss decreased (1.186302 --> 1.185853).  Saving model ...
Validation loss decreased (1.185853 --> 1.185455).  Saving model ...
Validation loss decreased (1.185455 --> 1.185000).  Saving model ...
Validation loss decreased (1.185000 --> 1.184233).  Saving model ...
Validation loss decreased (1.184233 --> 1.183714).  Saving model ...
Validation loss decreased (1.183714 --> 1.183358).  Saving model ...
Validation loss decreased (1.183358 --> 1.182922).  Saving model ...
Validation loss decreased (1.182922 --> 1.182222).  Saving model ...
Validation loss decreased (1.182222 --> 1.181637).  Saving model ...
Validation loss decreased (1.181637 --> 1.181302).  Saving model ...
Validation loss decreased (1.181302 --> 1.180826).  Saving model ...
Validation loss decreased (1.180826 --> 1.180349).  Saving model ...
Validation loss decreased (1.180349 --> 1.179856).  Saving model ...
Validation loss decreased (1.179856 --> 1.179264).  Saving model ...
Validation loss decreased (1.179264 --> 1.178880).  Saving model ...
Validation loss decreased (1.178880 --> 1.178543).  Saving model ...
Validation loss decreased (1.178543 --> 1.178188).  Saving model ...
Validation loss decreased (1.178188 --> 1.177760).  Saving model ...
Validation loss decreased (1.177760 --> 1.177158).  Saving model ...
Validation loss decreased (1.177158 --> 1.176699).  Saving model ...
Validation loss decreased (1.176699 --> 1.176245).  Saving model ...
Validation loss decreased (1.176245 --> 1.175704).  Saving model ...
Validation loss decreased (1.175704 --> 1.175238).  Saving model ...
Validation loss decreased (1.175238 --> 1.175054).  Saving model ...
Validation loss decreased (1.175054 --> 1.174710).  Saving model ...
Validation loss decreased (1.174710 --> 1.174242).  Saving model ...
Validation loss decreased (1.174242 --> 1.173981).  Saving model ...
Validation loss decreased (1.173981 --> 1.173835).  Saving model ...
Validation loss decreased (1.173835 --> 1.173436).  Saving model ...
Validation loss decreased (1.173436 --> 1.173080).  Saving model ...
Validation loss decreased (1.173080 --> 1.172591).  Saving model ...
Validation loss decreased (1.172591 --> 1.172283).  Saving model ...
Validation loss decreased (1.172283 --> 1.171992).  Saving model ...
Validation loss decreased (1.171992 --> 1.171644).  Saving model ...
Validation loss decreased (1.171644 --> 1.171637).  Saving model ...
Validation loss decreased (1.171637 --> 1.171387).  Saving model ...
Validation loss decreased (1.171387 --> 1.171020).  Saving model ...
Validation loss decreased (1.171020 --> 1.170647).  Saving model ...
Validation loss decreased (1.170647 --> 1.170199).  Saving model ...
Validation loss decreased (1.170199 --> 1.169653).  Saving model ...
Validation loss decreased (1.169653 --> 1.168932).  Saving model ...
Validation loss decreased (1.168932 --> 1.168405).  Saving model ...
Validation loss decreased (1.168405 --> 1.168114).  Saving model ...
Validation loss decreased (1.168114 --> 1.167932).  Saving model ...
Validation loss decreased (1.167932 --> 1.167253).  Saving model ...
Validation loss decreased (1.167253 --> 1.166712).  Saving model ...
Validation loss decreased (1.166712 --> 1.166301).  Saving model ...
Validation loss decreased (1.166301 --> 1.165864).  Saving model ...
Validation loss decreased (1.165864 --> 1.165307).  Saving model ...
Validation loss decreased (1.165307 --> 1.164756).  Saving model ...
Validation loss decreased (1.164756 --> 1.163959).  Saving model ...
Validation loss decreased (1.163959 --> 1.163613).  Saving model ...
Validation loss decreased (1.163613 --> 1.163381).  Saving model ...
Validation loss decreased (1.163381 --> 1.162821).  Saving model ...
Validation loss decreased (1.162821 --> 1.162643).  Saving model ...
Validation loss decreased (1.162643 --> 1.162534).  Saving model ...
Validation loss decreased (1.162534 --> 1.162265).  Saving model ...
Validation loss decreased (1.162265 --> 1.161931).  Saving model ...
Validation loss decreased (1.161931 --> 1.161527).  Saving model ...
Validation loss decreased (1.161527 --> 1.160963).  Saving model ...
Validation loss decreased (1.160963 --> 1.160522).  Saving model ...
Validation loss decreased (1.160522 --> 1.160234).  Saving model ...
Validation loss decreased (1.160234 --> 1.159848).  Saving model ...
Validation loss decreased (1.159848 --> 1.159043).  Saving model ...
Validation loss decreased (1.159043 --> 1.158564).  Saving model ...
Validation loss decreased (1.158564 --> 1.158066).  Saving model ...
Validation loss decreased (1.158066 --> 1.157853).  Saving model ...
Validation loss decreased (1.157853 --> 1.157436).  Saving model ...
Validation loss decreased (1.157436 --> 1.157056).  Saving model ...
Validation loss decreased (1.157056 --> 1.156662).  Saving model ...
Validation loss decreased (1.156662 --> 1.156545).  Saving model ...
Validation loss decreased (1.156545 --> 1.156000).  Saving model ...
Validation loss decreased (1.156000 --> 1.155597).  Saving model ...
Validation loss decreased (1.155597 --> 1.155335).  Saving model ...
Validation loss decreased (1.155335 --> 1.154962).  Saving model ...
Validation loss decreased (1.154962 --> 1.154516).  Saving model ...
Validation loss decreased (1.154516 --> 1.154008).  Saving model ...
Validation loss decreased (1.154008 --> 1.153519).  Saving model ...
Validation loss decreased (1.153519 --> 1.153019).  Saving model ...
Validation loss decreased (1.153019 --> 1.152877).  Saving model ...
Validation loss decreased (1.152877 --> 1.152380).  Saving model ...
Validation loss decreased (1.152380 --> 1.151839).  Saving model ...
Validation loss decreased (1.151839 --> 1.151438).  Saving model ...
Validation loss decreased (1.151438 --> 1.151074).  Saving model ...
Validation loss decreased (1.151074 --> 1.150525).  Saving model ...
Validation loss decreased (1.150525 --> 1.149858).  Saving model ...
Validation loss decreased (1.149858 --> 1.149281).  Saving model ...
Validation loss decreased (1.149281 --> 1.148628).  Saving model ...
Validation loss decreased (1.148628 --> 1.148247).  Saving model ...
Validation loss decreased (1.148247 --> 1.147809).  Saving model ...
Validation loss decreased (1.147809 --> 1.147553).  Saving model ...
Validation loss decreased (1.147553 --> 1.147355).  Saving model ...
Validation loss decreased (1.147355 --> 1.146933).  Saving model ...
Validation loss decreased (1.146933 --> 1.146427).  Saving model ...
Validation loss decreased (1.146427 --> 1.145860).  Saving model ...
Validation loss decreased (1.145860 --> 1.145531).  Saving model ...
Validation loss decreased (1.145531 --> 1.145174).  Saving model ...
Validation loss decreased (1.145174 --> 1.145041).  Saving model ...
Validation loss decreased (1.145041 --> 1.144600).  Saving model ...
Validation loss decreased (1.144600 --> 1.144168).  Saving model ...
Validation loss decreased (1.144168 --> 1.144022).  Saving model ...
Validation loss decreased (1.144022 --> 1.143494).  Saving model ...
Validation loss decreased (1.143494 --> 1.142745).  Saving model ...
Validation loss decreased (1.142745 --> 1.142400).  Saving model ...
Validation loss decreased (1.142400 --> 1.142096).  Saving model ...
Validation loss decreased (1.142096 --> 1.141579).  Saving model ...
Validation loss decreased (1.141579 --> 1.140971).  Saving model ...
Validation loss decreased (1.140971 --> 1.140353).  Saving model ...
Validation loss decreased (1.140353 --> 1.140040).  Saving model ...
Validation loss decreased (1.140040 --> 1.139603).  Saving model ...
Validation loss decreased (1.139603 --> 1.138939).  Saving model ...
Validation loss decreased (1.138939 --> 1.138708).  Saving model ...
Validation loss decreased (1.138708 --> 1.138346).  Saving model ...
Validation loss decreased (1.138346 --> 1.138030).  Saving model ...
Validation loss decreased (1.138030 --> 1.137693).  Saving model ...
Validation loss decreased (1.137693 --> 1.137072).  Saving model ...
Validation loss decreased (1.137072 --> 1.136584).  Saving model ...
Validation loss decreased (1.136584 --> 1.136339).  Saving model ...
Validation loss decreased (1.136339 --> 1.136223).  Saving model ...
Validation loss decreased (1.136223 --> 1.135881).  Saving model ...
Validation loss decreased (1.135881 --> 1.135596).  Saving model ...
Validation loss decreased (1.135596 --> 1.135272).  Saving model ...
Validation loss decreased (1.135272 --> 1.134782).  Saving model ...
Validation loss decreased (1.134782 --> 1.134234).  Saving model ...
Validation loss decreased (1.134234 --> 1.133874).  Saving model ...
Validation loss decreased (1.133874 --> 1.133291).  Saving model ...
Validation loss decreased (1.133291 --> 1.132657).  Saving model ...
Validation loss decreased (1.132657 --> 1.131830).  Saving model ...
Validation loss decreased (1.131830 --> 1.131587).  Saving model ...
Validation loss decreased (1.131587 --> 1.131424).  Saving model ...
Validation loss decreased (1.131424 --> 1.131007).  Saving model ...
Validation loss decreased (1.131007 --> 1.130648).  Saving model ...
Validation loss decreased (1.130648 --> 1.130274).  Saving model ...
Validation loss decreased (1.130274 --> 1.130092).  Saving model ...
Validation loss decreased (1.130092 --> 1.129703).  Saving model ...
Validation loss decreased (1.129703 --> 1.129236).  Saving model ...
EarlyStopping counter: 1 out of 10.0
Validation loss decreased (1.129236 --> 1.128999).  Saving model ...
Validation loss decreased (1.128999 --> 1.128646).  Saving model ...
Validation loss decreased (1.128646 --> 1.128311).  Saving model ...
Validation loss decreased (1.128311 --> 1.127871).  Saving model ...
/localscratch/yinan.28724298.0/env/lib/python3.7/site-packages/torch/nn/functional.py:1794: UserWarning: nn.functional.tanh is deprecated. Use torch.tanh instead.
  warnings.warn("nn.functional.tanh is deprecated. Use torch.tanh instead.")
/localscratch/yinan.28724298.0/env/lib/python3.7/site-packages/transformers/optimization.py:155: UserWarning: This overload of add_ is deprecated:
	add_(Number alpha, Tensor other)
Consider using one of the following signatures instead:
	add_(Tensor other, *, Number alpha) (Triggered internally at  ../torch/csrc/utils/python_arg_parser.cpp:1025.)
  exp_avg.mul_(beta1).add_(1.0 - beta1, grad)
wandb: Waiting for W&B process to finish, PID 229243... (success).
wandb: - 0.00MB of 0.00MB uploaded (0.00MB deduped)wandb: \ 0.00MB of 0.00MB uploaded (0.00MB deduped)wandb: | 0.00MB of 0.00MB uploaded (0.00MB deduped)wandb: / 0.00MB of 0.00MB uploaded (0.00MB deduped)wandb: - 0.00MB of 0.00MB uploaded (0.00MB deduped)wandb: \ 0.00MB of 0.00MB uploaded (0.00MB deduped)wandb: | 0.00MB of 0.00MB uploaded (0.00MB deduped)wandb: / 0.00MB of 0.00MB uploaded (0.00MB deduped)wandb: - 0.00MB of 0.00MB uploaded (0.00MB deduped)wandb: \ 0.00MB of 0.00MB uploaded (0.00MB deduped)wandb: | 0.00MB of 0.00MB uploaded (0.00MB deduped)wandb: / 0.00MB of 0.00MB uploaded (0.00MB deduped)wandb: - 0.00MB of 0.00MB uploaded (0.00MB deduped)wandb:                                                                                
wandb: Run history:
wandb:     e_F1 ▁▁▂▂▂▃▄▅▅▅▅▆▆▆▆▆▆▆▆▆▇▇▇▇▇▇▇▇▇▇██████████
wandb:   e_loss █▇▇▇▆▆▆▆▆▅▅▅▅▅▅▅▄▄▄▄▄▃▃▃▃▃▃▂▂▂▂▂▂▂▂▁▁▁▁▁
wandb:     t_F1 ▁▁▂▂▃▂▃▂▃▃▃▄▄▄▅▅▅▅▅▆▆▅▆▅▆▆▆▆▆▆▆▇▇▇▇█▇▇█▇
wandb:   t_loss ██▇▇▇▇▇▇▆▆▆▅▆▆▅▅▅▅▄▄▄▄▄▄▃▃▃▃▃▃▃▃▂▂▂▁▂▂▁▁
wandb: 
wandb: Run summary:
wandb:     e_F1 51.93544
wandb:   e_loss 1.12787
wandb:     t_F1 56.15479
wandb:   t_loss 1.06501
wandb: 
wandb: Synced 4 W&B file(s), 0 media file(s), 0 artifact file(s) and 0 other file(s)
wandb: Synced cool-galaxy-1: https://wandb.ai/yinanazhou/xl_512_bs_8_lr_1e07_es_10_lc_False_nr_False_sr_False_stem_False_lemma_True_repeat_1_fold_1/runs/3vimpjlg
wandb: Find logs at: ./wandb/run-20220311_065928-3vimpjlg/logs/debug.log
wandb: 

wandb: wandb version 0.12.11 is available!  To upgrade, please run:
wandb:  $ pip install wandb --upgrade
2022-03-11 12:22:15.715999: I tensorflow/stream_executor/platform/default/dso_loader.cc:48] Successfully opened dynamic library libcudart.so.10.1
wandb: Tracking run with wandb version 0.12.5
wandb: Syncing run likely-plasma-1
wandb: ⭐️ View project at https://wandb.ai/yinanazhou/xl_512_bs_8_lr_1e07_es_10_lc_False_nr_False_sr_False_stem_False_lemma_True_repeat_1_fold_2
wandb: 🚀 View run at https://wandb.ai/yinanazhou/xl_512_bs_8_lr_1e07_es_10_lc_False_nr_False_sr_False_stem_False_lemma_True_repeat_1_fold_2/runs/2e1p82ii
wandb: Run data is saved locally in /project/6002780/yinan/Thesis_MER_Lyrics/lyric-emotion/wandb/run-20220311_122211-2e1p82ii
wandb: Run `wandb offline` to turn off syncing.
slurmstepd: error: *** JOB 28724298 ON cdr2603 CANCELLED AT 2022-03-11T16:55:46 DUE TO TIME LIMIT ***
