Unloading StdEnv/2020

Due to MODULEPATH changes, the following have been reloaded:
  1) mii/1.1.1


The following have been reloaded with a version change:
  1) python/3.8.2 => python/3.7.4

Using base prefix '/cvmfs/soft.computecanada.ca/easybuild/software/2017/Core/python/3.7.4'
New python executable in /localscratch/yinan.28706214.0/env/bin/python
Installing setuptools, pip, wheel...
done.
Ignoring pip: markers 'python_version < "3"' don't match your environment
Looking in links: /cvmfs/soft.computecanada.ca/custom/python/wheelhouse/nix/avx2, /cvmfs/soft.computecanada.ca/custom/python/wheelhouse/nix/generic, /cvmfs/soft.computecanada.ca/custom/python/wheelhouse/generic
Collecting pip
Installing collected packages: pip
  Found existing installation: pip 19.1.1
    Uninstalling pip-19.1.1:
      Successfully uninstalled pip-19.1.1
Successfully installed pip-21.2.3+computecanada
Looking in links: /cvmfs/soft.computecanada.ca/custom/python/wheelhouse/nix/avx2, /cvmfs/soft.computecanada.ca/custom/python/wheelhouse/nix/generic, /cvmfs/soft.computecanada.ca/custom/python/wheelhouse/generic
Processing /cvmfs/soft.computecanada.ca/custom/python/wheelhouse/generic/keras-2.8.0+computecanada-py2.py3-none-any.whl
Processing /cvmfs/soft.computecanada.ca/custom/python/wheelhouse/generic/Keras_Preprocessing-1.1.2+computecanada-py3-none-any.whl
Requirement already satisfied: matplotlib in /cvmfs/soft.computecanada.ca/easybuild/software/2017/Core/scipy-stack/2019a/lib/python3.7/site-packages (from -r requirements.txt (line 3)) (3.0.2)
Processing /cvmfs/soft.computecanada.ca/custom/python/wheelhouse/generic/nltk-3.6.5+computecanada-py3-none-any.whl
Processing /cvmfs/soft.computecanada.ca/custom/python/wheelhouse/generic/scikit_learn-0.22.1+computecanada-cp37-cp37m-linux_x86_64.whl
Processing /cvmfs/soft.computecanada.ca/custom/python/wheelhouse/generic/tensorboard-2.3.0+computecanada-py3-none-any.whl
Processing /cvmfs/soft.computecanada.ca/custom/python/wheelhouse/generic/tensorboard_plugin_wit-1.7.0+computecanada-py3-none-any.whl
Processing /cvmfs/soft.computecanada.ca/custom/python/wheelhouse/generic/tensorflow_gpu-2.3.0+computecanada-cp37-cp37m-linux_x86_64.whl
Processing /cvmfs/soft.computecanada.ca/custom/python/wheelhouse/generic/tensorflow_estimator-2.3.0+computecanada-py2.py3-none-any.whl
Processing /cvmfs/soft.computecanada.ca/custom/python/wheelhouse/generic/tokenizers-0.5.2+computecanada-cp37-cp37m-linux_x86_64.whl
Processing /cvmfs/soft.computecanada.ca/custom/python/wheelhouse/nix/avx2/torch-1.4.0+computecanada-cp37-cp37m-linux_x86_64.whl
Processing /cvmfs/soft.computecanada.ca/custom/python/wheelhouse/generic/torchtext-0.6.0+computecanada-py3-none-any.whl
Processing /cvmfs/soft.computecanada.ca/custom/python/wheelhouse/generic/torchvision-0.8.2+computecanada-cp37-cp37m-linux_x86_64.whl
Processing /cvmfs/soft.computecanada.ca/custom/python/wheelhouse/generic/transformers-2.5.1+computecanada-py3-none-any.whl
Processing /cvmfs/soft.computecanada.ca/custom/python/wheelhouse/generic/urllib3-1.26.7+computecanada-py2.py3-none-any.whl
Processing /cvmfs/soft.computecanada.ca/custom/python/wheelhouse/generic/tqdm-4.63.0+computecanada-py2.py3-none-any.whl
Processing /cvmfs/soft.computecanada.ca/custom/python/wheelhouse/generic/click-8.0.3+computecanada-py3-none-any.whl
Processing /cvmfs/soft.computecanada.ca/custom/python/wheelhouse/generic/joblib-1.1.0+computecanada-py2.py3-none-any.whl
ERROR: Could not find a version that satisfies the requirement regex>=2021.8.3 (from nltk) (from versions: 2018.1.10+computecanada, 2019.11.1+computecanada, 2020.11.13+computecanada)
ERROR: No matching distribution found for regex>=2021.8.3
Looking in links: /cvmfs/soft.computecanada.ca/custom/python/wheelhouse/nix/avx2, /cvmfs/soft.computecanada.ca/custom/python/wheelhouse/nix/generic, /cvmfs/soft.computecanada.ca/custom/python/wheelhouse/generic
ERROR: Could not find a version that satisfies the requirement numpy==1.20.0+computacanada (from versions: 1.15.0+computecanada, 1.15.2+computecanada, 1.15.4+computecanada, 1.16.0+computecanada, 1.16.2+computecanada, 1.16.3+computecanada, 1.17.4+computecanada, 1.18.1+computecanada, 1.18.4+computecanada, 1.19.1+computecanada, 1.19.2+computecanada, 1.20.2+computecanada)
ERROR: No matching distribution found for numpy==1.20.0+computacanada
Looking in links: /cvmfs/soft.computecanada.ca/custom/python/wheelhouse/nix/avx2, /cvmfs/soft.computecanada.ca/custom/python/wheelhouse/nix/generic, /cvmfs/soft.computecanada.ca/custom/python/wheelhouse/generic
Processing /cvmfs/soft.computecanada.ca/custom/python/wheelhouse/generic/wandb-0.12.5+computecanada-py2.py3-none-any.whl
Processing /cvmfs/soft.computecanada.ca/custom/python/wheelhouse/generic/PyYAML-5.3.1+computecanada-cp37-cp37m-linux_x86_64.whl
Processing /cvmfs/soft.computecanada.ca/custom/python/wheelhouse/generic/psutil-5.7.3+computecanada-cp37-cp37m-linux_x86_64.whl
Requirement already satisfied: python-dateutil>=2.6.1 in /cvmfs/soft.computecanada.ca/easybuild/software/2017/Core/scipy-stack/2019a/lib/python3.7/site-packages (from wandb) (2.7.5)
Processing /cvmfs/soft.computecanada.ca/custom/python/wheelhouse/generic/shortuuid-1.0.1+computecanada-py3-none-any.whl
Processing /cvmfs/soft.computecanada.ca/custom/python/wheelhouse/generic/pathtools-0.1.2+computecanada-py3-none-any.whl
Processing /cvmfs/soft.computecanada.ca/custom/python/wheelhouse/generic/yaspin-2.1.0+computecanada-py3-none-any.whl
Processing /cvmfs/soft.computecanada.ca/custom/python/wheelhouse/generic/configparser-5.0.2+computecanada-py3-none-any.whl
Processing /cvmfs/soft.computecanada.ca/custom/python/wheelhouse/generic/GitPython-3.1.24+computecanada-py3-none-any.whl
Processing /cvmfs/soft.computecanada.ca/custom/python/wheelhouse/generic/sentry_sdk-1.5.0+computecanada-py2.py3-none-any.whl
Processing /cvmfs/soft.computecanada.ca/custom/python/wheelhouse/generic/subprocess32-3.5.4+computecanada-py3-none-any.whl
Processing /cvmfs/soft.computecanada.ca/custom/python/wheelhouse/generic/docker_pycreds-0.4.0+computecanada-py2.py3-none-any.whl
Processing /cvmfs/soft.computecanada.ca/custom/python/wheelhouse/generic/six-1.16.0+computecanada-py2.py3-none-any.whl
Processing /cvmfs/soft.computecanada.ca/custom/python/wheelhouse/generic/click-8.0.3+computecanada-py3-none-any.whl
Processing /cvmfs/soft.computecanada.ca/custom/python/wheelhouse/generic/protobuf-3.19.4+computecanada-py2.py3-none-any.whl
Requirement already satisfied: requests<3,>=2.0.0 in /cvmfs/soft.computecanada.ca/easybuild/software/2017/Core/scipy-stack/2019a/lib/python3.7/site-packages (from wandb) (2.21.0)
Processing /cvmfs/soft.computecanada.ca/custom/python/wheelhouse/generic/promise-2.3+computecanada-py3-none-any.whl
Requirement already satisfied: importlib-metadata in /cvmfs/soft.computecanada.ca/easybuild/software/2017/Core/scipy-stack/2019a/lib/python3.7/site-packages (from Click!=8.0.0,>=7.0->wandb) (0.8)
Processing /cvmfs/soft.computecanada.ca/custom/python/wheelhouse/generic/gitdb-4.0.9+computecanada-py3-none-any.whl
Processing /cvmfs/soft.computecanada.ca/custom/python/wheelhouse/generic/typing_extensions-4.0.1+computecanada-py3-none-any.whl
Processing /cvmfs/soft.computecanada.ca/custom/python/wheelhouse/generic/smmap-5.0.0+computecanada-py3-none-any.whl
Requirement already satisfied: idna<2.9,>=2.5 in /cvmfs/soft.computecanada.ca/easybuild/software/2017/Core/scipy-stack/2019a/lib/python3.7/site-packages (from requests<3,>=2.0.0->wandb) (2.8)
Requirement already satisfied: urllib3<1.25,>=1.21.1 in /cvmfs/soft.computecanada.ca/easybuild/software/2017/Core/scipy-stack/2019a/lib/python3.7/site-packages (from requests<3,>=2.0.0->wandb) (1.24.1)
Requirement already satisfied: certifi>=2017.4.17 in /cvmfs/soft.computecanada.ca/easybuild/software/2017/Core/scipy-stack/2019a/lib/python3.7/site-packages (from requests<3,>=2.0.0->wandb) (2018.11.29)
Requirement already satisfied: chardet<3.1.0,>=3.0.2 in /cvmfs/soft.computecanada.ca/easybuild/software/2017/Core/scipy-stack/2019a/lib/python3.7/site-packages (from requests<3,>=2.0.0->wandb) (3.0.4)
Processing /cvmfs/soft.computecanada.ca/custom/python/wheelhouse/generic/termcolor-1.1.0+computecanada-py3-none-any.whl
Requirement already satisfied: zipp>=0.3.2 in /cvmfs/soft.computecanada.ca/easybuild/software/2017/Core/scipy-stack/2019a/lib/python3.7/site-packages (from importlib-metadata->Click!=8.0.0,>=7.0->wandb) (0.3.3)
Installing collected packages: smmap, typing-extensions, termcolor, six, gitdb, yaspin, subprocess32, shortuuid, sentry-sdk, PyYAML, psutil, protobuf, promise, pathtools, GitPython, docker-pycreds, configparser, Click, wandb
  Attempting uninstall: six
    Found existing installation: six 1.12.0
    Not uninstalling six at /cvmfs/soft.computecanada.ca/easybuild/software/2017/Core/scipy-stack/2019a/lib/python3.7/site-packages, outside environment /localscratch/yinan.28706214.0/env
    Can't uninstall 'six'. No files were found to uninstall.
Successfully installed Click-8.0.3+computecanada GitPython-3.1.24+computecanada PyYAML-5.3.1+computecanada configparser-5.0.2+computecanada docker-pycreds-0.4.0+computecanada gitdb-4.0.9+computecanada pathtools-0.1.2+computecanada promise-2.3+computecanada protobuf-3.19.4+computecanada psutil-5.7.3+computecanada sentry-sdk-1.5.0+computecanada shortuuid-1.0.1+computecanada six-1.16.0+computecanada smmap-5.0.0+computecanada subprocess32-3.5.4+computecanada termcolor-1.1.0+computecanada typing-extensions-4.0.1+computecanada wandb-0.12.5+computecanada yaspin-2.1.0+computecanada
Looking in links: /cvmfs/soft.computecanada.ca/custom/python/wheelhouse/nix/avx2, /cvmfs/soft.computecanada.ca/custom/python/wheelhouse/nix/generic, /cvmfs/soft.computecanada.ca/custom/python/wheelhouse/generic
ERROR: Could not find a version that satisfies the requirement sagemaker (from versions: none)
ERROR: No matching distribution found for sagemaker
Looking in links: /cvmfs/soft.computecanada.ca/custom/python/wheelhouse/nix/avx2, /cvmfs/soft.computecanada.ca/custom/python/wheelhouse/nix/generic, /cvmfs/soft.computecanada.ca/custom/python/wheelhouse/generic
Processing /cvmfs/soft.computecanada.ca/custom/python/wheelhouse/generic/torch-1.9.1+computecanada-cp37-cp37m-linux_x86_64.whl
Requirement already satisfied: typing-extensions in /localscratch/yinan.28706214.0/env/lib/python3.7/site-packages (from torch) (4.0.1+computecanada)
Installing collected packages: torch
Successfully installed torch-1.9.1+computecanada
Looking in links: /cvmfs/soft.computecanada.ca/custom/python/wheelhouse/nix/avx2, /cvmfs/soft.computecanada.ca/custom/python/wheelhouse/nix/generic, /cvmfs/soft.computecanada.ca/custom/python/wheelhouse/generic
Processing /cvmfs/soft.computecanada.ca/custom/python/wheelhouse/generic/transformers-2.5.1+computecanada-py3-none-any.whl
Processing /cvmfs/soft.computecanada.ca/custom/python/wheelhouse/generic/regex-2020.11.13+computecanada-cp37-cp37m-linux_x86_64.whl
Processing /cvmfs/soft.computecanada.ca/custom/python/wheelhouse/generic/sacremoses-0.0.46+computecanada-py3-none-any.whl
Processing /cvmfs/soft.computecanada.ca/custom/python/wheelhouse/generic/boto3-1.20.52+computecanada-py3-none-any.whl
Requirement already satisfied: numpy in /cvmfs/soft.computecanada.ca/easybuild/software/2017/Core/scipy-stack/2019a/lib/python3.7/site-packages (from transformers==2.5.1+computecanada) (1.16.0)
Processing /cvmfs/soft.computecanada.ca/custom/python/wheelhouse/generic/tokenizers-0.5.2+computecanada-cp37-cp37m-linux_x86_64.whl
Requirement already satisfied: requests in /cvmfs/soft.computecanada.ca/easybuild/software/2017/Core/scipy-stack/2019a/lib/python3.7/site-packages (from transformers==2.5.1+computecanada) (2.21.0)
Processing /cvmfs/soft.computecanada.ca/custom/python/wheelhouse/generic/tqdm-4.63.0+computecanada-py2.py3-none-any.whl
Processing /cvmfs/soft.computecanada.ca/custom/python/wheelhouse/generic/sentencepiece-0.1.91+computecanada-cp37-cp37m-linux_x86_64.whl
Processing /cvmfs/soft.computecanada.ca/custom/python/wheelhouse/generic/filelock-3.4.2+computecanada-py3-none-any.whl
Processing /cvmfs/soft.computecanada.ca/custom/python/wheelhouse/generic/botocore-1.23.52+computecanada-py3-none-any.whl
Processing /cvmfs/soft.computecanada.ca/custom/python/wheelhouse/generic/jmespath-0.10.0+computecanada-py2.py3-none-any.whl
Processing /cvmfs/soft.computecanada.ca/custom/python/wheelhouse/generic/s3transfer-0.5.1+computecanada-py3-none-any.whl
Requirement already satisfied: python-dateutil<3.0.0,>=2.1 in /cvmfs/soft.computecanada.ca/easybuild/software/2017/Core/scipy-stack/2019a/lib/python3.7/site-packages (from botocore<1.24.0,>=1.23.52->boto3->transformers==2.5.1+computecanada) (2.7.5)
Processing /cvmfs/soft.computecanada.ca/custom/python/wheelhouse/generic/urllib3-1.26.8+computecanada-py2.py3-none-any.whl
Requirement already satisfied: six>=1.5 in /localscratch/yinan.28706214.0/env/lib/python3.7/site-packages (from python-dateutil<3.0.0,>=2.1->botocore<1.24.0,>=1.23.52->boto3->transformers==2.5.1+computecanada) (1.16.0+computecanada)
Requirement already satisfied: idna<2.9,>=2.5 in /cvmfs/soft.computecanada.ca/easybuild/software/2017/Core/scipy-stack/2019a/lib/python3.7/site-packages (from requests->transformers==2.5.1+computecanada) (2.8)
Requirement already satisfied: certifi>=2017.4.17 in /cvmfs/soft.computecanada.ca/easybuild/software/2017/Core/scipy-stack/2019a/lib/python3.7/site-packages (from requests->transformers==2.5.1+computecanada) (2018.11.29)
Requirement already satisfied: chardet<3.1.0,>=3.0.2 in /cvmfs/soft.computecanada.ca/easybuild/software/2017/Core/scipy-stack/2019a/lib/python3.7/site-packages (from requests->transformers==2.5.1+computecanada) (3.0.4)
Processing /cvmfs/soft.computecanada.ca/custom/python/wheelhouse/generic/requests-2.27.1+computecanada-py2.py3-none-any.whl
Processing /cvmfs/soft.computecanada.ca/custom/python/wheelhouse/generic/charset_normalizer-2.0.11+computecanada-py3-none-any.whl
Processing /cvmfs/soft.computecanada.ca/custom/python/wheelhouse/generic/joblib-1.1.0+computecanada-py2.py3-none-any.whl
Requirement already satisfied: click in /localscratch/yinan.28706214.0/env/lib/python3.7/site-packages (from sacremoses->transformers==2.5.1+computecanada) (8.0.3+computecanada)
Requirement already satisfied: importlib-metadata in /cvmfs/soft.computecanada.ca/easybuild/software/2017/Core/scipy-stack/2019a/lib/python3.7/site-packages (from click->sacremoses->transformers==2.5.1+computecanada) (0.8)
Requirement already satisfied: zipp>=0.3.2 in /cvmfs/soft.computecanada.ca/easybuild/software/2017/Core/scipy-stack/2019a/lib/python3.7/site-packages (from importlib-metadata->click->sacremoses->transformers==2.5.1+computecanada) (0.3.3)
Installing collected packages: urllib3, jmespath, botocore, tqdm, s3transfer, regex, joblib, charset-normalizer, tokenizers, sentencepiece, sacremoses, requests, filelock, boto3, transformers
  Attempting uninstall: urllib3
    Found existing installation: urllib3 1.24.1
    Not uninstalling urllib3 at /cvmfs/soft.computecanada.ca/easybuild/software/2017/Core/scipy-stack/2019a/lib/python3.7/site-packages, outside environment /localscratch/yinan.28706214.0/env
    Can't uninstall 'urllib3'. No files were found to uninstall.
  Attempting uninstall: requests
    Found existing installation: requests 2.21.0
    Not uninstalling requests at /cvmfs/soft.computecanada.ca/easybuild/software/2017/Core/scipy-stack/2019a/lib/python3.7/site-packages, outside environment /localscratch/yinan.28706214.0/env
    Can't uninstall 'requests'. No files were found to uninstall.
Successfully installed boto3-1.20.52+computecanada botocore-1.23.52+computecanada charset-normalizer-2.0.11+computecanada filelock-3.4.2+computecanada jmespath-0.10.0+computecanada joblib-1.1.0+computecanada regex-2020.11.13+computecanada requests-2.27.1+computecanada s3transfer-0.5.1+computecanada sacremoses-0.0.46+computecanada sentencepiece-0.1.91+computecanada tokenizers-0.5.2+computecanada tqdm-4.63.0+computecanada transformers-2.5.1+computecanada urllib3-1.26.8+computecanada
Looking in links: /cvmfs/soft.computecanada.ca/custom/python/wheelhouse/nix/avx2, /cvmfs/soft.computecanada.ca/custom/python/wheelhouse/nix/generic, /cvmfs/soft.computecanada.ca/custom/python/wheelhouse/generic
Processing /cvmfs/soft.computecanada.ca/custom/python/wheelhouse/generic/tensorflow_gpu-2.3.0+computecanada-cp37-cp37m-linux_x86_64.whl
Requirement already satisfied: wheel>=0.26 in /localscratch/yinan.28706214.0/env/lib/python3.7/site-packages (from tensorflow_gpu==2.3.0+computecanada) (0.33.4)
Requirement already satisfied: six>=1.12.0 in /localscratch/yinan.28706214.0/env/lib/python3.7/site-packages (from tensorflow_gpu==2.3.0+computecanada) (1.16.0+computecanada)
Processing /cvmfs/soft.computecanada.ca/custom/python/wheelhouse/generic/grpcio-1.38.0+computecanada-cp37-cp37m-linux_x86_64.whl
Processing /cvmfs/soft.computecanada.ca/custom/python/wheelhouse/nix/generic/scipy-1.4.1+computecanada-cp37-cp37m-linux_x86_64.whl
Processing /cvmfs/soft.computecanada.ca/custom/python/wheelhouse/nix/avx2/h5py-2.10.0+computecanada-cp37-cp37m-linux_x86_64.whl
Processing /cvmfs/soft.computecanada.ca/custom/python/wheelhouse/generic/astunparse-1.6.3+computecanada-py2.py3-none-any.whl
Processing /cvmfs/soft.computecanada.ca/custom/python/wheelhouse/generic/Keras_Preprocessing-1.1.2+computecanada-py3-none-any.whl
Processing /cvmfs/soft.computecanada.ca/custom/python/wheelhouse/generic/wrapt-1.11.2+computecanada-cp37-cp37m-linux_x86_64.whl
Processing /cvmfs/soft.computecanada.ca/custom/python/wheelhouse/generic/tensorboard-2.8.0+computecanada-py3-none-any.whl
Processing /cvmfs/soft.computecanada.ca/custom/python/wheelhouse/generic/tensorflow_estimator-2.3.0+computecanada-py2.py3-none-any.whl
Processing /cvmfs/soft.computecanada.ca/custom/python/wheelhouse/generic/gast-0.3.3+computecanada-py3-none-any.whl
Requirement already satisfied: termcolor>=1.1.0 in /localscratch/yinan.28706214.0/env/lib/python3.7/site-packages (from tensorflow_gpu==2.3.0+computecanada) (1.1.0+computecanada)
Requirement already satisfied: numpy<1.19.0,>=1.16.0 in /cvmfs/soft.computecanada.ca/easybuild/software/2017/Core/scipy-stack/2019a/lib/python3.7/site-packages (from tensorflow_gpu==2.3.0+computecanada) (1.16.0)
Processing /cvmfs/soft.computecanada.ca/custom/python/wheelhouse/generic/opt_einsum-3.3.0+computecanada-py3-none-any.whl
Requirement already satisfied: protobuf>=3.9.2 in /localscratch/yinan.28706214.0/env/lib/python3.7/site-packages (from tensorflow_gpu==2.3.0+computecanada) (3.19.4+computecanada)
Processing /cvmfs/soft.computecanada.ca/custom/python/wheelhouse/generic/absl_py-1.0.0+computecanada-py3-none-any.whl
Processing /cvmfs/soft.computecanada.ca/custom/python/wheelhouse/generic/google_pasta-0.2.0+computecanada-py3-none-any.whl
Requirement already satisfied: setuptools>=41.0.0 in /localscratch/yinan.28706214.0/env/lib/python3.7/site-packages (from tensorboard<3,>=2.3.0->tensorflow_gpu==2.3.0+computecanada) (41.0.1)
Processing /cvmfs/soft.computecanada.ca/custom/python/wheelhouse/generic/google_auth-2.3.3+computecanada-py2.py3-none-any.whl
Processing /cvmfs/soft.computecanada.ca/custom/python/wheelhouse/generic/Werkzeug-2.0.3+computecanada-py3-none-any.whl
Requirement already satisfied: requests<3,>=2.21.0 in /localscratch/yinan.28706214.0/env/lib/python3.7/site-packages (from tensorboard<3,>=2.3.0->tensorflow_gpu==2.3.0+computecanada) (2.27.1+computecanada)
Processing /cvmfs/soft.computecanada.ca/custom/python/wheelhouse/generic/Markdown-3.3.6+computecanada-py3-none-any.whl
Processing /cvmfs/soft.computecanada.ca/custom/python/wheelhouse/generic/tensorboard_plugin_wit-1.8.0+computecanada-py3-none-any.whl
Processing /cvmfs/soft.computecanada.ca/custom/python/wheelhouse/generic/google_auth_oauthlib-0.4.6+computecanada-py2.py3-none-any.whl
Processing /cvmfs/soft.computecanada.ca/custom/python/wheelhouse/generic/tensorboard_data_server-0.6.1+computecanada-py3-none-linux_x86_64.whl
Processing /cvmfs/soft.computecanada.ca/custom/python/wheelhouse/generic/pyasn1_modules-0.2.8+computecanada-py2.py3-none-any.whl
Processing /cvmfs/soft.computecanada.ca/custom/python/wheelhouse/generic/cachetools-4.2.4+computecanada-py3-none-any.whl
Processing /cvmfs/soft.computecanada.ca/custom/python/wheelhouse/generic/rsa-4.8+computecanada-py3-none-any.whl
Processing /cvmfs/soft.computecanada.ca/custom/python/wheelhouse/generic/requests_oauthlib-1.3.0+computecanada-py2.py3-none-any.whl
Processing /cvmfs/soft.computecanada.ca/custom/python/wheelhouse/generic/importlib_metadata-4.10.1+computecanada-py3-none-any.whl
Requirement already satisfied: typing-extensions>=3.6.4 in /localscratch/yinan.28706214.0/env/lib/python3.7/site-packages (from importlib-metadata>=4.4->markdown>=2.6.8->tensorboard<3,>=2.3.0->tensorflow_gpu==2.3.0+computecanada) (4.0.1+computecanada)
Processing /cvmfs/soft.computecanada.ca/custom/python/wheelhouse/generic/zipp-3.7.0+computecanada-py3-none-any.whl
Processing /cvmfs/soft.computecanada.ca/custom/python/wheelhouse/generic/pyasn1-0.4.8+computecanada-py2.py3-none-any.whl
Requirement already satisfied: charset-normalizer~=2.0.0 in /localscratch/yinan.28706214.0/env/lib/python3.7/site-packages (from requests<3,>=2.21.0->tensorboard<3,>=2.3.0->tensorflow_gpu==2.3.0+computecanada) (2.0.11+computecanada)
Requirement already satisfied: idna<4,>=2.5 in /cvmfs/soft.computecanada.ca/easybuild/software/2017/Core/scipy-stack/2019a/lib/python3.7/site-packages (from requests<3,>=2.21.0->tensorboard<3,>=2.3.0->tensorflow_gpu==2.3.0+computecanada) (2.8)
Requirement already satisfied: urllib3<1.27,>=1.21.1 in /localscratch/yinan.28706214.0/env/lib/python3.7/site-packages (from requests<3,>=2.21.0->tensorboard<3,>=2.3.0->tensorflow_gpu==2.3.0+computecanada) (1.26.8+computecanada)
Requirement already satisfied: certifi>=2017.4.17 in /cvmfs/soft.computecanada.ca/easybuild/software/2017/Core/scipy-stack/2019a/lib/python3.7/site-packages (from requests<3,>=2.21.0->tensorboard<3,>=2.3.0->tensorflow_gpu==2.3.0+computecanada) (2018.11.29)
Processing /cvmfs/soft.computecanada.ca/custom/python/wheelhouse/generic/oauthlib-3.1.1+computecanada-py2.py3-none-any.whl
Installing collected packages: pyasn1, zipp, rsa, pyasn1-modules, oauthlib, cachetools, requests-oauthlib, importlib-metadata, google-auth, werkzeug, tensorboard-plugin-wit, tensorboard-data-server, markdown, grpcio, google-auth-oauthlib, absl-py, wrapt, tensorflow-estimator, tensorboard, scipy, opt-einsum, keras-preprocessing, h5py, google-pasta, gast, astunparse, tensorflow-gpu
  Attempting uninstall: pyasn1
    Found existing installation: pyasn1 0.4.3
    Not uninstalling pyasn1 at /cvmfs/soft.computecanada.ca/easybuild/software/2017/Core/scipy-stack/2019a/lib/python3.7/site-packages, outside environment /localscratch/yinan.28706214.0/env
    Can't uninstall 'pyasn1'. No files were found to uninstall.
  Attempting uninstall: zipp
    Found existing installation: zipp 0.3.3
    Not uninstalling zipp at /cvmfs/soft.computecanada.ca/easybuild/software/2017/Core/scipy-stack/2019a/lib/python3.7/site-packages, outside environment /localscratch/yinan.28706214.0/env
    Can't uninstall 'zipp'. No files were found to uninstall.
  Attempting uninstall: importlib-metadata
    Found existing installation: importlib-metadata 0.8
    Not uninstalling importlib-metadata at /cvmfs/soft.computecanada.ca/easybuild/software/2017/Core/scipy-stack/2019a/lib/python3.7/site-packages, outside environment /localscratch/yinan.28706214.0/env
    Can't uninstall 'importlib-metadata'. No files were found to uninstall.
  Attempting uninstall: scipy
    Found existing installation: scipy 1.2.0
    Not uninstalling scipy at /cvmfs/soft.computecanada.ca/easybuild/software/2017/Core/scipy-stack/2019a/lib/python3.7/site-packages, outside environment /localscratch/yinan.28706214.0/env
    Can't uninstall 'scipy'. No files were found to uninstall.
Successfully installed absl-py-1.0.0+computecanada astunparse-1.6.3+computecanada cachetools-4.2.4+computecanada gast-0.3.3+computecanada google-auth-2.3.3+computecanada google-auth-oauthlib-0.4.6+computecanada google-pasta-0.2.0+computecanada grpcio-1.38.0+computecanada h5py-2.10.0+computecanada importlib-metadata-4.10.1+computecanada keras-preprocessing-1.1.2+computecanada markdown-3.3.6+computecanada oauthlib-3.1.1+computecanada opt-einsum-3.3.0+computecanada pyasn1-0.4.8+computecanada pyasn1-modules-0.2.8+computecanada requests-oauthlib-1.3.0+computecanada rsa-4.8+computecanada scipy-1.4.1+computecanada tensorboard-2.8.0+computecanada tensorboard-data-server-0.6.1+computecanada tensorboard-plugin-wit-1.8.0+computecanada tensorflow-estimator-2.3.0+computecanada tensorflow-gpu-2.3.0+computecanada werkzeug-2.0.3+computecanada wrapt-1.11.2+computecanada zipp-3.7.0+computecanada
Looking in links: /cvmfs/soft.computecanada.ca/custom/python/wheelhouse/nix/avx2, /cvmfs/soft.computecanada.ca/custom/python/wheelhouse/nix/generic, /cvmfs/soft.computecanada.ca/custom/python/wheelhouse/generic
Processing /cvmfs/soft.computecanada.ca/custom/python/wheelhouse/generic/keras-2.8.0+computecanada-py2.py3-none-any.whl
Installing collected packages: Keras
Successfully installed Keras-2.8.0+computecanada
Looking in links: /cvmfs/soft.computecanada.ca/custom/python/wheelhouse/nix/avx2, /cvmfs/soft.computecanada.ca/custom/python/wheelhouse/nix/generic, /cvmfs/soft.computecanada.ca/custom/python/wheelhouse/generic
Processing /cvmfs/soft.computecanada.ca/custom/python/wheelhouse/generic/urllib3-1.26.7+computecanada-py2.py3-none-any.whl
Installing collected packages: urllib3
  Attempting uninstall: urllib3
    Found existing installation: urllib3 1.26.8+computecanada
    Uninstalling urllib3-1.26.8+computecanada:
      Successfully uninstalled urllib3-1.26.8+computecanada
Successfully installed urllib3-1.26.7+computecanada
Looking in links: /cvmfs/soft.computecanada.ca/custom/python/wheelhouse/nix/avx2, /cvmfs/soft.computecanada.ca/custom/python/wheelhouse/nix/generic, /cvmfs/soft.computecanada.ca/custom/python/wheelhouse/generic
Processing /cvmfs/soft.computecanada.ca/custom/python/wheelhouse/generic/nltk-3.7+computecanada-py3-none-any.whl
Requirement already satisfied: click in /localscratch/yinan.28706214.0/env/lib/python3.7/site-packages (from nltk) (8.0.3+computecanada)
Requirement already satisfied: tqdm in /localscratch/yinan.28706214.0/env/lib/python3.7/site-packages (from nltk) (4.63.0+computecanada)
Processing /cvmfs/soft.computecanada.ca/custom/python/wheelhouse/generic/nltk-3.6.5+computecanada-py3-none-any.whl
Processing /cvmfs/soft.computecanada.ca/custom/python/wheelhouse/generic/nltk-3.6.3+computecanada-py3-none-any.whl
Requirement already satisfied: regex in /localscratch/yinan.28706214.0/env/lib/python3.7/site-packages (from nltk) (2020.11.13+computecanada)
Requirement already satisfied: joblib in /localscratch/yinan.28706214.0/env/lib/python3.7/site-packages (from nltk) (1.1.0+computecanada)
Requirement already satisfied: importlib-metadata in /localscratch/yinan.28706214.0/env/lib/python3.7/site-packages (from click->nltk) (4.10.1+computecanada)
Requirement already satisfied: zipp>=0.5 in /localscratch/yinan.28706214.0/env/lib/python3.7/site-packages (from importlib-metadata->click->nltk) (3.7.0+computecanada)
Requirement already satisfied: typing-extensions>=3.6.4 in /localscratch/yinan.28706214.0/env/lib/python3.7/site-packages (from importlib-metadata->click->nltk) (4.0.1+computecanada)
Installing collected packages: nltk
Successfully installed nltk-3.6.3+computecanada
Looking in links: /cvmfs/soft.computecanada.ca/custom/python/wheelhouse/nix/avx2, /cvmfs/soft.computecanada.ca/custom/python/wheelhouse/nix/generic, /cvmfs/soft.computecanada.ca/custom/python/wheelhouse/generic
Processing /cvmfs/soft.computecanada.ca/custom/python/wheelhouse/generic/scikit_learn-0.22.1+computecanada-cp37-cp37m-linux_x86_64.whl
Requirement already satisfied: numpy>=1.11.0 in /cvmfs/soft.computecanada.ca/easybuild/software/2017/Core/scipy-stack/2019a/lib/python3.7/site-packages (from scikit-learn==0.22.1) (1.16.0)
Requirement already satisfied: scipy>=0.17.0 in /localscratch/yinan.28706214.0/env/lib/python3.7/site-packages (from scikit-learn==0.22.1) (1.4.1+computecanada)
Requirement already satisfied: joblib>=0.11 in /localscratch/yinan.28706214.0/env/lib/python3.7/site-packages (from scikit-learn==0.22.1) (1.1.0+computecanada)
Installing collected packages: scikit-learn
Successfully installed scikit-learn-0.22.1+computecanada
Looking in links: /cvmfs/soft.computecanada.ca/custom/python/wheelhouse/nix/avx2, /cvmfs/soft.computecanada.ca/custom/python/wheelhouse/nix/generic, /cvmfs/soft.computecanada.ca/custom/python/wheelhouse/generic
Requirement already satisfied: tokenizers==0.5.2 in /localscratch/yinan.28706214.0/env/lib/python3.7/site-packages (0.5.2+computecanada)
wandb: Appending key for api.wandb.ai to your netrc file: /home/yinan/.netrc
Starting Task
2022-03-11 00:31:28.071138: I tensorflow/stream_executor/platform/default/dso_loader.cc:48] Successfully opened dynamic library libcudart.so.10.1
[nltk_data] Downloading package stopwords to /home/yinan/nltk_data...
[nltk_data]   Package stopwords is already up-to-date!
[nltk_data] Downloading package wordnet to /home/yinan/nltk_data...
[nltk_data]   Package wordnet is already up-to-date!
wandb: Currently logged in as: yinanazhou (use `wandb login --relogin` to force relogin)
wandb: wandb version 0.12.11 is available!  To upgrade, please run:
wandb:  $ pip install wandb --upgrade
2022-03-11 00:31:46.747864: I tensorflow/stream_executor/platform/default/dso_loader.cc:48] Successfully opened dynamic library libcudart.so.10.1
wandb: Tracking run with wandb version 0.12.5
wandb: Syncing run divine-lion-1
wandb: ⭐️ View project at https://wandb.ai/yinanazhou/xl_512_bs_8_lr_1e07_es_5_lc_True_nr_True_sr_True_stem_True_lemma_False_repeat_1_fold_1
wandb: 🚀 View run at https://wandb.ai/yinanazhou/xl_512_bs_8_lr_1e07_es_5_lc_True_nr_True_sr_True_stem_True_lemma_False_repeat_1_fold_1/runs/35mtpb2i
wandb: Run data is saved locally in /project/6002780/yinan/Thesis_MER_Lyrics/lyric-emotion/wandb/run-20220311_003144-35mtpb2i
wandb: Run `wandb offline` to turn off syncing.

Validation loss decreased (inf --> 1.452827).  Saving model ...
Validation loss decreased (1.452827 --> 1.450302).  Saving model ...
Validation loss decreased (1.450302 --> 1.447626).  Saving model ...
Validation loss decreased (1.447626 --> 1.445090).  Saving model ...
Validation loss decreased (1.445090 --> 1.442641).  Saving model ...
Validation loss decreased (1.442641 --> 1.440195).  Saving model ...
Validation loss decreased (1.440195 --> 1.438005).  Saving model ...
Validation loss decreased (1.438005 --> 1.435891).  Saving model ...
Validation loss decreased (1.435891 --> 1.433807).  Saving model ...
Validation loss decreased (1.433807 --> 1.431565).  Saving model ...
Validation loss decreased (1.431565 --> 1.429418).  Saving model ...
Validation loss decreased (1.429418 --> 1.427523).  Saving model ...
Validation loss decreased (1.427523 --> 1.425655).  Saving model ...
Validation loss decreased (1.425655 --> 1.423738).  Saving model ...
Validation loss decreased (1.423738 --> 1.421854).  Saving model ...
Validation loss decreased (1.421854 --> 1.420050).  Saving model ...
Validation loss decreased (1.420050 --> 1.418272).  Saving model ...
Validation loss decreased (1.418272 --> 1.416563).  Saving model ...
Validation loss decreased (1.416563 --> 1.414934).  Saving model ...
Validation loss decreased (1.414934 --> 1.413330).  Saving model ...
Validation loss decreased (1.413330 --> 1.411727).  Saving model ...
Validation loss decreased (1.411727 --> 1.410186).  Saving model ...
Validation loss decreased (1.410186 --> 1.408676).  Saving model ...
Validation loss decreased (1.408676 --> 1.407204).  Saving model ...
Validation loss decreased (1.407204 --> 1.405659).  Saving model ...
Validation loss decreased (1.405659 --> 1.404286).  Saving model ...
Validation loss decreased (1.404286 --> 1.402932).  Saving model ...
Validation loss decreased (1.402932 --> 1.401603).  Saving model ...
Validation loss decreased (1.401603 --> 1.400398).  Saving model ...
Validation loss decreased (1.400398 --> 1.399175).  Saving model ...
Validation loss decreased (1.399175 --> 1.397914).  Saving model ...
Validation loss decreased (1.397914 --> 1.396676).  Saving model ...
Validation loss decreased (1.396676 --> 1.395557).  Saving model ...
Validation loss decreased (1.395557 --> 1.394411).  Saving model ...
Validation loss decreased (1.394411 --> 1.393349).  Saving model ...
Validation loss decreased (1.393349 --> 1.392153).  Saving model ...
Validation loss decreased (1.392153 --> 1.391068).  Saving model ...
Validation loss decreased (1.391068 --> 1.390133).  Saving model ...
Validation loss decreased (1.390133 --> 1.389091).  Saving model ...
Validation loss decreased (1.389091 --> 1.388129).  Saving model ...
Validation loss decreased (1.388129 --> 1.387177).  Saving model ...
Validation loss decreased (1.387177 --> 1.386178).  Saving model ...
Validation loss decreased (1.386178 --> 1.385239).  Saving model ...
Validation loss decreased (1.385239 --> 1.384335).  Saving model ...
Validation loss decreased (1.384335 --> 1.383335).  Saving model ...
Validation loss decreased (1.383335 --> 1.382511).  Saving model ...
Validation loss decreased (1.382511 --> 1.381636).  Saving model ...
Validation loss decreased (1.381636 --> 1.380795).  Saving model ...
Validation loss decreased (1.380795 --> 1.380009).  Saving model ...
Validation loss decreased (1.380009 --> 1.379194).  Saving model ...
Validation loss decreased (1.379194 --> 1.378473).  Saving model ...
Validation loss decreased (1.378473 --> 1.377752).  Saving model ...
Validation loss decreased (1.377752 --> 1.376970).  Saving model ...
Validation loss decreased (1.376970 --> 1.376172).  Saving model ...
Validation loss decreased (1.376172 --> 1.375446).  Saving model ...
Validation loss decreased (1.375446 --> 1.374705).  Saving model ...
Validation loss decreased (1.374705 --> 1.373956).  Saving model ...
Validation loss decreased (1.373956 --> 1.373234).  Saving model ...
Validation loss decreased (1.373234 --> 1.372496).  Saving model ...
Validation loss decreased (1.372496 --> 1.371905).  Saving model ...
Validation loss decreased (1.371905 --> 1.371209).  Saving model ...
Validation loss decreased (1.371209 --> 1.370548).  Saving model ...
Validation loss decreased (1.370548 --> 1.369863).  Saving model ...
Validation loss decreased (1.369863 --> 1.369198).  Saving model ...
Validation loss decreased (1.369198 --> 1.368628).  Saving model ...
Validation loss decreased (1.368628 --> 1.367915).  Saving model ...
Validation loss decreased (1.367915 --> 1.367317).  Saving model ...
Validation loss decreased (1.367317 --> 1.366707).  Saving model ...
Validation loss decreased (1.366707 --> 1.366187).  Saving model ...
Validation loss decreased (1.366187 --> 1.365658).  Saving model ...
Validation loss decreased (1.365658 --> 1.365116).  Saving model ...
Validation loss decreased (1.365116 --> 1.364571).  Saving model ...
Validation loss decreased (1.364571 --> 1.364024).  Saving model ...
Validation loss decreased (1.364024 --> 1.363435).  Saving model ...
Validation loss decreased (1.363435 --> 1.362904).  Saving model ...
Validation loss decreased (1.362904 --> 1.362375).  Saving model ...
Validation loss decreased (1.362375 --> 1.361852).  Saving model ...
Validation loss decreased (1.361852 --> 1.361326).  Saving model ...
Validation loss decreased (1.361326 --> 1.360792).  Saving model ...
Validation loss decreased (1.360792 --> 1.360245).  Saving model ...
Validation loss decreased (1.360245 --> 1.359768).  Saving model ...
Validation loss decreased (1.359768 --> 1.359292).  Saving model ...
Validation loss decreased (1.359292 --> 1.358834).  Saving model ...
Validation loss decreased (1.358834 --> 1.358409).  Saving model ...
Validation loss decreased (1.358409 --> 1.357910).  Saving model ...
Validation loss decreased (1.357910 --> 1.357423).  Saving model ...
Validation loss decreased (1.357423 --> 1.356927).  Saving model ...
Validation loss decreased (1.356927 --> 1.356403).  Saving model ...
Validation loss decreased (1.356403 --> 1.355953).  Saving model ...
Validation loss decreased (1.355953 --> 1.355561).  Saving model ...
Validation loss decreased (1.355561 --> 1.355143).  Saving model ...
Validation loss decreased (1.355143 --> 1.354764).  Saving model ...
Validation loss decreased (1.354764 --> 1.354334).  Saving model ...
Validation loss decreased (1.354334 --> 1.353904).  Saving model ...
Validation loss decreased (1.353904 --> 1.353473).  Saving model ...
Validation loss decreased (1.353473 --> 1.353068).  Saving model ...
Validation loss decreased (1.353068 --> 1.352650).  Saving model ...
Validation loss decreased (1.352650 --> 1.352217).  Saving model ...
Validation loss decreased (1.352217 --> 1.351779).  Saving model ...
Validation loss decreased (1.351779 --> 1.351353).  Saving model ...
Validation loss decreased (1.351353 --> 1.350926).  Saving model ...
Validation loss decreased (1.350926 --> 1.350505).  Saving model ...
Validation loss decreased (1.350505 --> 1.350087).  Saving model ...
Validation loss decreased (1.350087 --> 1.349660).  Saving model ...
Validation loss decreased (1.349660 --> 1.349199).  Saving model ...
Validation loss decreased (1.349199 --> 1.348773).  Saving model ...
Validation loss decreased (1.348773 --> 1.348366).  Saving model ...
Validation loss decreased (1.348366 --> 1.347986).  Saving model ...
Validation loss decreased (1.347986 --> 1.347580).  Saving model ...
Validation loss decreased (1.347580 --> 1.347162).  Saving model ...
Validation loss decreased (1.347162 --> 1.346792).  Saving model ...
Validation loss decreased (1.346792 --> 1.346417).  Saving model ...
Validation loss decreased (1.346417 --> 1.346020).  Saving model ...
Validation loss decreased (1.346020 --> 1.345644).  Saving model ...
Validation loss decreased (1.345644 --> 1.345265).  Saving model ...
Validation loss decreased (1.345265 --> 1.344827).  Saving model ...
Validation loss decreased (1.344827 --> 1.344429).  Saving model ...
Validation loss decreased (1.344429 --> 1.344035).  Saving model ...
Validation loss decreased (1.344035 --> 1.343654).  Saving model ...
Validation loss decreased (1.343654 --> 1.343228).  Saving model ...
Validation loss decreased (1.343228 --> 1.342860).  Saving model ...
Validation loss decreased (1.342860 --> 1.342462).  Saving model ...
Validation loss decreased (1.342462 --> 1.342111).  Saving model ...
Validation loss decreased (1.342111 --> 1.341733).  Saving model ...
Validation loss decreased (1.341733 --> 1.341373).  Saving model ...
Validation loss decreased (1.341373 --> 1.341002).  Saving model ...
Validation loss decreased (1.341002 --> 1.340643).  Saving model ...
Validation loss decreased (1.340643 --> 1.340239).  Saving model ...
Validation loss decreased (1.340239 --> 1.339888).  Saving model ...
Validation loss decreased (1.339888 --> 1.339554).  Saving model ...
Validation loss decreased (1.339554 --> 1.339197).  Saving model ...
Validation loss decreased (1.339197 --> 1.338819).  Saving model ...
Validation loss decreased (1.338819 --> 1.338399).  Saving model ...
Validation loss decreased (1.338399 --> 1.338000).  Saving model ...
Validation loss decreased (1.338000 --> 1.337641).  Saving model ...
Validation loss decreased (1.337641 --> 1.337274).  Saving model ...
Validation loss decreased (1.337274 --> 1.336890).  Saving model ...
Validation loss decreased (1.336890 --> 1.336475).  Saving model ...
Validation loss decreased (1.336475 --> 1.336059).  Saving model ...
Validation loss decreased (1.336059 --> 1.335644).  Saving model ...
Validation loss decreased (1.335644 --> 1.335242).  Saving model ...
Validation loss decreased (1.335242 --> 1.334861).  Saving model ...
Validation loss decreased (1.334861 --> 1.334428).  Saving model ...
Validation loss decreased (1.334428 --> 1.334002).  Saving model ...
Validation loss decreased (1.334002 --> 1.333562).  Saving model ...
Validation loss decreased (1.333562 --> 1.333171).  Saving model ...
Validation loss decreased (1.333171 --> 1.332753).  Saving model ...
Validation loss decreased (1.332753 --> 1.332333).  Saving model ...
Validation loss decreased (1.332333 --> 1.331911).  Saving model ...
Validation loss decreased (1.331911 --> 1.331564).  Saving model ...
Validation loss decreased (1.331564 --> 1.331210).  Saving model ...
Validation loss decreased (1.331210 --> 1.330827).  Saving model ...
Validation loss decreased (1.330827 --> 1.330413).  Saving model ...
Validation loss decreased (1.330413 --> 1.330041).  Saving model ...
Validation loss decreased (1.330041 --> 1.329633).  Saving model ...
Validation loss decreased (1.329633 --> 1.329323).  Saving model ...
Validation loss decreased (1.329323 --> 1.328959).  Saving model ...
Validation loss decreased (1.328959 --> 1.328576).  Saving model ...
Validation loss decreased (1.328576 --> 1.328127).  Saving model ...
Validation loss decreased (1.328127 --> 1.327742).  Saving model ...
Validation loss decreased (1.327742 --> 1.327371).  Saving model ...
Validation loss decreased (1.327371 --> 1.327005).  Saving model ...
Validation loss decreased (1.327005 --> 1.326634).  Saving model ...
Validation loss decreased (1.326634 --> 1.326198).  Saving model ...
Validation loss decreased (1.326198 --> 1.325796).  Saving model ...
Validation loss decreased (1.325796 --> 1.325364).  Saving model ...
Validation loss decreased (1.325364 --> 1.324902).  Saving model ...
Validation loss decreased (1.324902 --> 1.324491).  Saving model ...
Validation loss decreased (1.324491 --> 1.324119).  Saving model ...
Validation loss decreased (1.324119 --> 1.323728).  Saving model ...
Validation loss decreased (1.323728 --> 1.323275).  Saving model ...
Validation loss decreased (1.323275 --> 1.322917).  Saving model ...
Validation loss decreased (1.322917 --> 1.322539).  Saving model ...
Validation loss decreased (1.322539 --> 1.322149).  Saving model ...
Validation loss decreased (1.322149 --> 1.321739).  Saving model ...
Validation loss decreased (1.321739 --> 1.321343).  Saving model ...
Validation loss decreased (1.321343 --> 1.320888).  Saving model ...
Validation loss decreased (1.320888 --> 1.320531).  Saving model ...
Validation loss decreased (1.320531 --> 1.320200).  Saving model ...
Validation loss decreased (1.320200 --> 1.319880).  Saving model ...
Validation loss decreased (1.319880 --> 1.319456).  Saving model ...
Validation loss decreased (1.319456 --> 1.318947).  Saving model ...
Validation loss decreased (1.318947 --> 1.318518).  Saving model ...
Validation loss decreased (1.318518 --> 1.318150).  Saving model ...
Validation loss decreased (1.318150 --> 1.317723).  Saving model ...
Validation loss decreased (1.317723 --> 1.317227).  Saving model ...
Validation loss decreased (1.317227 --> 1.316925).  Saving model ...
Validation loss decreased (1.316925 --> 1.316531).  Saving model ...
Validation loss decreased (1.316531 --> 1.316149).  Saving model ...
Validation loss decreased (1.316149 --> 1.315766).  Saving model ...
Validation loss decreased (1.315766 --> 1.315350).  Saving model ...
Validation loss decreased (1.315350 --> 1.314957).  Saving model ...
Validation loss decreased (1.314957 --> 1.314592).  Saving model ...
Validation loss decreased (1.314592 --> 1.314175).  Saving model ...
Validation loss decreased (1.314175 --> 1.313760).  Saving model ...
Validation loss decreased (1.313760 --> 1.313407).  Saving model ...
Validation loss decreased (1.313407 --> 1.312975).  Saving model ...
Validation loss decreased (1.312975 --> 1.312539).  Saving model ...
Validation loss decreased (1.312539 --> 1.312009).  Saving model ...
Validation loss decreased (1.312009 --> 1.311562).  Saving model ...
Validation loss decreased (1.311562 --> 1.311155).  Saving model ...
Validation loss decreased (1.311155 --> 1.310710).  Saving model ...
Validation loss decreased (1.310710 --> 1.310352).  Saving model ...
Validation loss decreased (1.310352 --> 1.309889).  Saving model ...
Validation loss decreased (1.309889 --> 1.309477).  Saving model ...
Validation loss decreased (1.309477 --> 1.309112).  Saving model ...
Validation loss decreased (1.309112 --> 1.308778).  Saving model ...
Validation loss decreased (1.308778 --> 1.308456).  Saving model ...
Validation loss decreased (1.308456 --> 1.308129).  Saving model ...
Validation loss decreased (1.308129 --> 1.307819).  Saving model ...
Validation loss decreased (1.307819 --> 1.307332).  Saving model ...
Validation loss decreased (1.307332 --> 1.306851).  Saving model ...
Validation loss decreased (1.306851 --> 1.306528).  Saving model ...
Validation loss decreased (1.306528 --> 1.306124).  Saving model ...
Validation loss decreased (1.306124 --> 1.305712).  Saving model ...
Validation loss decreased (1.305712 --> 1.305273).  Saving model ...
Validation loss decreased (1.305273 --> 1.304869).  Saving model ...
Validation loss decreased (1.304869 --> 1.304449).  Saving model ...
Validation loss decreased (1.304449 --> 1.304018).  Saving model ...
Validation loss decreased (1.304018 --> 1.303549).  Saving model ...
Validation loss decreased (1.303549 --> 1.303076).  Saving model ...
Validation loss decreased (1.303076 --> 1.302571).  Saving model ...
Validation loss decreased (1.302571 --> 1.302184).  Saving model ...
Validation loss decreased (1.302184 --> 1.301748).  Saving model ...
Validation loss decreased (1.301748 --> 1.301226).  Saving model ...
Validation loss decreased (1.301226 --> 1.300847).  Saving model ...
Validation loss decreased (1.300847 --> 1.300403).  Saving model ...
Validation loss decreased (1.300403 --> 1.300053).  Saving model ...
Validation loss decreased (1.300053 --> 1.299631).  Saving model ...
Validation loss decreased (1.299631 --> 1.299266).  Saving model ...
Validation loss decreased (1.299266 --> 1.298833).  Saving model ...
Validation loss decreased (1.298833 --> 1.298381).  Saving model ...
Validation loss decreased (1.298381 --> 1.297973).  Saving model ...
Validation loss decreased (1.297973 --> 1.297616).  Saving model ...
Validation loss decreased (1.297616 --> 1.297236).  Saving model ...
Validation loss decreased (1.297236 --> 1.296847).  Saving model ...
Validation loss decreased (1.296847 --> 1.296388).  Saving model ...
Validation loss decreased (1.296388 --> 1.296010).  Saving model ...
Validation loss decreased (1.296010 --> 1.295572).  Saving model ...
Validation loss decreased (1.295572 --> 1.295186).  Saving model ...
Validation loss decreased (1.295186 --> 1.294827).  Saving model ...
Validation loss decreased (1.294827 --> 1.294518).  Saving model ...
Validation loss decreased (1.294518 --> 1.294159).  Saving model ...
Validation loss decreased (1.294159 --> 1.293692).  Saving model ...
Validation loss decreased (1.293692 --> 1.293412).  Saving model ...
Validation loss decreased (1.293412 --> 1.292954).  Saving model ...
Validation loss decreased (1.292954 --> 1.292682).  Saving model ...
Validation loss decreased (1.292682 --> 1.292373).  Saving model ...
Validation loss decreased (1.292373 --> 1.291993).  Saving model ...
Validation loss decreased (1.291993 --> 1.291637).  Saving model ...
Validation loss decreased (1.291637 --> 1.291342).  Saving model ...
Validation loss decreased (1.291342 --> 1.290968).  Saving model ...
Validation loss decreased (1.290968 --> 1.290668).  Saving model ...
Validation loss decreased (1.290668 --> 1.290295).  Saving model ...
Validation loss decreased (1.290295 --> 1.289933).  Saving model ...
Validation loss decreased (1.289933 --> 1.289622).  Saving model ...
Validation loss decreased (1.289622 --> 1.289315).  Saving model ...
Validation loss decreased (1.289315 --> 1.288926).  Saving model ...
Validation loss decreased (1.288926 --> 1.288449).  Saving model ...
Validation loss decreased (1.288449 --> 1.288056).  Saving model ...
Validation loss decreased (1.288056 --> 1.287629).  Saving model ...
Validation loss decreased (1.287629 --> 1.287175).  Saving model ...
Validation loss decreased (1.287175 --> 1.286719).  Saving model ...
Validation loss decreased (1.286719 --> 1.286380).  Saving model ...
Validation loss decreased (1.286380 --> 1.285917).  Saving model ...
Validation loss decreased (1.285917 --> 1.285458).  Saving model ...
Validation loss decreased (1.285458 --> 1.285130).  Saving model ...
Validation loss decreased (1.285130 --> 1.284827).  Saving model ...
Validation loss decreased (1.284827 --> 1.284495).  Saving model ...
Validation loss decreased (1.284495 --> 1.284201).  Saving model ...
Validation loss decreased (1.284201 --> 1.283783).  Saving model ...
Validation loss decreased (1.283783 --> 1.283317).  Saving model ...
Validation loss decreased (1.283317 --> 1.282938).  Saving model ...
Validation loss decreased (1.282938 --> 1.282411).  Saving model ...
Validation loss decreased (1.282411 --> 1.282040).  Saving model ...
Validation loss decreased (1.282040 --> 1.281731).  Saving model ...
Validation loss decreased (1.281731 --> 1.281372).  Saving model ...
Validation loss decreased (1.281372 --> 1.281069).  Saving model ...
Validation loss decreased (1.281069 --> 1.280623).  Saving model ...
Validation loss decreased (1.280623 --> 1.280345).  Saving model ...
Validation loss decreased (1.280345 --> 1.279865).  Saving model ...
Validation loss decreased (1.279865 --> 1.279524).  Saving model ...
Validation loss decreased (1.279524 --> 1.279187).  Saving model ...
Validation loss decreased (1.279187 --> 1.278814).  Saving model ...
Validation loss decreased (1.278814 --> 1.278450).  Saving model ...
Validation loss decreased (1.278450 --> 1.278213).  Saving model ...
Validation loss decreased (1.278213 --> 1.277717).  Saving model ...
Validation loss decreased (1.277717 --> 1.277138).  Saving model ...
Validation loss decreased (1.277138 --> 1.276940).  Saving model ...
Validation loss decreased (1.276940 --> 1.276702).  Saving model ...
Validation loss decreased (1.276702 --> 1.276382).  Saving model ...
Validation loss decreased (1.276382 --> 1.276047).  Saving model ...
Validation loss decreased (1.276047 --> 1.275717).  Saving model ...
Validation loss decreased (1.275717 --> 1.275581).  Saving model ...
Validation loss decreased (1.275581 --> 1.275174).  Saving model ...
Validation loss decreased (1.275174 --> 1.274931).  Saving model ...
Validation loss decreased (1.274931 --> 1.274656).  Saving model ...
Validation loss decreased (1.274656 --> 1.274260).  Saving model ...
Validation loss decreased (1.274260 --> 1.274071).  Saving model ...
Validation loss decreased (1.274071 --> 1.273729).  Saving model ...
Validation loss decreased (1.273729 --> 1.273266).  Saving model ...
Validation loss decreased (1.273266 --> 1.272823).  Saving model ...
Validation loss decreased (1.272823 --> 1.272615).  Saving model ...
Validation loss decreased (1.272615 --> 1.272274).  Saving model ...
Validation loss decreased (1.272274 --> 1.271769).  Saving model ...
Validation loss decreased (1.271769 --> 1.271526).  Saving model ...
Validation loss decreased (1.271526 --> 1.271436).  Saving model ...
Validation loss decreased (1.271436 --> 1.271251).  Saving model ...
Validation loss decreased (1.271251 --> 1.270853).  Saving model ...
Validation loss decreased (1.270853 --> 1.270389).  Saving model ...
Validation loss decreased (1.270389 --> 1.270057).  Saving model ...
Validation loss decreased (1.270057 --> 1.269693).  Saving model ...
Validation loss decreased (1.269693 --> 1.269337).  Saving model ...
Validation loss decreased (1.269337 --> 1.269144).  Saving model ...
Validation loss decreased (1.269144 --> 1.268778).  Saving model ...
Validation loss decreased (1.268778 --> 1.268489).  Saving model ...
Validation loss decreased (1.268489 --> 1.268268).  Saving model ...
Validation loss decreased (1.268268 --> 1.267988).  Saving model ...
Validation loss decreased (1.267988 --> 1.267842).  Saving model ...
Validation loss decreased (1.267842 --> 1.267749).  Saving model ...
EarlyStopping counter: 1 out of 5.0
Validation loss decreased (1.267749 --> 1.267416).  Saving model ...
Validation loss decreased (1.267416 --> 1.267161).  Saving model ...
Validation loss decreased (1.267161 --> 1.266923).  Saving model ...
Validation loss decreased (1.266923 --> 1.266639).  Saving model ...
Validation loss decreased (1.266639 --> 1.266479).  Saving model ...
Validation loss decreased (1.266479 --> 1.266064).  Saving model ...
Validation loss decreased (1.266064 --> 1.265776).  Saving model ...
Validation loss decreased (1.265776 --> 1.265416).  Saving model ...
Validation loss decreased (1.265416 --> 1.265262).  Saving model ...
Validation loss decreased (1.265262 --> 1.265056).  Saving model ...
Validation loss decreased (1.265056 --> 1.264821).  Saving model ...
Validation loss decreased (1.264821 --> 1.264473).  Saving model ...
Validation loss decreased (1.264473 --> 1.264138).  Saving model ...
Validation loss decreased (1.264138 --> 1.263873).  Saving model ...
Validation loss decreased (1.263873 --> 1.263614).  Saving model ...
Validation loss decreased (1.263614 --> 1.263261).  Saving model ...
Validation loss decreased (1.263261 --> 1.263167).  Saving model ...
Validation loss decreased (1.263167 --> 1.262752).  Saving model ...
Validation loss decreased (1.262752 --> 1.262531).  Saving model ...
Validation loss decreased (1.262531 --> 1.262400).  Saving model ...
Validation loss decreased (1.262400 --> 1.262035).  Saving model ...
Validation loss decreased (1.262035 --> 1.261847).  Saving model ...
Validation loss decreased (1.261847 --> 1.261737).  Saving model ...
Validation loss decreased (1.261737 --> 1.261638).  Saving model ...
Validation loss decreased (1.261638 --> 1.261419).  Saving model ...
Validation loss decreased (1.261419 --> 1.261210).  Saving model ...
Validation loss decreased (1.261210 --> 1.260695).  Saving model ...
Validation loss decreased (1.260695 --> 1.260547).  Saving model ...
Validation loss decreased (1.260547 --> 1.260299).  Saving model ...
Validation loss decreased (1.260299 --> 1.259977).  Saving model ...
Validation loss decreased (1.259977 --> 1.259320).  Saving model ...
Validation loss decreased (1.259320 --> 1.259201).  Saving model ...
Validation loss decreased (1.259201 --> 1.259130).  Saving model ...
Validation loss decreased (1.259130 --> 1.258629).  Saving model ...
Validation loss decreased (1.258629 --> 1.258462).  Saving model ...
Validation loss decreased (1.258462 --> 1.258118).  Saving model ...
Validation loss decreased (1.258118 --> 1.257845).  Saving model ...
Validation loss decreased (1.257845 --> 1.257542).  Saving model ...
Validation loss decreased (1.257542 --> 1.257333).  Saving model ...
Validation loss decreased (1.257333 --> 1.257231).  Saving model ...
Validation loss decreased (1.257231 --> 1.257023).  Saving model ...
Validation loss decreased (1.257023 --> 1.256759).  Saving model ...
Validation loss decreased (1.256759 --> 1.256473).  Saving model ...
Validation loss decreased (1.256473 --> 1.256324).  Saving model ...
Validation loss decreased (1.256324 --> 1.255891).  Saving model ...
Validation loss decreased (1.255891 --> 1.255391).  Saving model ...
Validation loss decreased (1.255391 --> 1.255017).  Saving model ...
EarlyStopping counter: 1 out of 5.0
Validation loss decreased (1.255017 --> 1.254671).  Saving model ...
Validation loss decreased (1.254671 --> 1.254294).  Saving model ...
Validation loss decreased (1.254294 --> 1.254172).  Saving model ...
Validation loss decreased (1.254172 --> 1.253714).  Saving model ...
EarlyStopping counter: 1 out of 5.0
Validation loss decreased (1.253714 --> 1.253653).  Saving model ...
Validation loss decreased (1.253653 --> 1.253448).  Saving model ...
Validation loss decreased (1.253448 --> 1.253380).  Saving model ...
Validation loss decreased (1.253380 --> 1.253220).  Saving model ...
Validation loss decreased (1.253220 --> 1.252801).  Saving model ...
Validation loss decreased (1.252801 --> 1.252371).  Saving model ...
Validation loss decreased (1.252371 --> 1.251995).  Saving model ...
Validation loss decreased (1.251995 --> 1.251532).  Saving model ...
Validation loss decreased (1.251532 --> 1.251474).  Saving model ...
Validation loss decreased (1.251474 --> 1.251178).  Saving model ...
Validation loss decreased (1.251178 --> 1.250962).  Saving model ...
Validation loss decreased (1.250962 --> 1.250814).  Saving model ...
Validation loss decreased (1.250814 --> 1.250765).  Saving model ...
Validation loss decreased (1.250765 --> 1.250380).  Saving model ...
Validation loss decreased (1.250380 --> 1.250313).  Saving model ...
Validation loss decreased (1.250313 --> 1.250125).  Saving model ...
Validation loss decreased (1.250125 --> 1.250005).  Saving model ...
Validation loss decreased (1.250005 --> 1.249828).  Saving model ...
Validation loss decreased (1.249828 --> 1.249720).  Saving model ...
Validation loss decreased (1.249720 --> 1.249587).  Saving model ...
Validation loss decreased (1.249587 --> 1.249308).  Saving model ...
Validation loss decreased (1.249308 --> 1.249091).  Saving model ...
Validation loss decreased (1.249091 --> 1.248930).  Saving model ...
Validation loss decreased (1.248930 --> 1.248653).  Saving model ...
Validation loss decreased (1.248653 --> 1.248399).  Saving model ...
Validation loss decreased (1.248399 --> 1.248099).  Saving model ...
Validation loss decreased (1.248099 --> 1.247859).  Saving model ...
EarlyStopping counter: 1 out of 5.0
EarlyStopping counter: 2 out of 5.0
Validation loss decreased (1.247859 --> 1.247650).  Saving model ...
EarlyStopping counter: 1 out of 5.0
Validation loss decreased (1.247650 --> 1.247529).  Saving model ...
Validation loss decreased (1.247529 --> 1.247296).  Saving model ...
Validation loss decreased (1.247296 --> 1.247147).  Saving model ...
Validation loss decreased (1.247147 --> 1.247054).  Saving model ...
Validation loss decreased (1.247054 --> 1.246690).  Saving model ...
Validation loss decreased (1.246690 --> 1.246468).  Saving model ...
Validation loss decreased (1.246468 --> 1.246244).  Saving model ...
Validation loss decreased (1.246244 --> 1.245902).  Saving model ...
Validation loss decreased (1.245902 --> 1.245668).  Saving model ...
Validation loss decreased (1.245668 --> 1.245363).  Saving model ...
Validation loss decreased (1.245363 --> 1.244985).  Saving model ...
Validation loss decreased (1.244985 --> 1.244622).  Saving model ...
Validation loss decreased (1.244622 --> 1.244193).  Saving model ...
Validation loss decreased (1.244193 --> 1.243803).  Saving model ...
Validation loss decreased (1.243803 --> 1.243706).  Saving model ...
Validation loss decreased (1.243706 --> 1.243346).  Saving model ...
Validation loss decreased (1.243346 --> 1.243226).  Saving model ...
Validation loss decreased (1.243226 --> 1.243064).  Saving model ...
Validation loss decreased (1.243064 --> 1.242886).  Saving model ...
Validation loss decreased (1.242886 --> 1.242482).  Saving model ...
Validation loss decreased (1.242482 --> 1.242393).  Saving model ...
Validation loss decreased (1.242393 --> 1.242066).  Saving model ...
Validation loss decreased (1.242066 --> 1.241923).  Saving model ...
Validation loss decreased (1.241923 --> 1.241590).  Saving model ...
Validation loss decreased (1.241590 --> 1.241375).  Saving model ...
Validation loss decreased (1.241375 --> 1.241064).  Saving model ...
Validation loss decreased (1.241064 --> 1.240711).  Saving model ...
Validation loss decreased (1.240711 --> 1.240480).  Saving model ...
Validation loss decreased (1.240480 --> 1.240359).  Saving model ...
Validation loss decreased (1.240359 --> 1.239980).  Saving model ...
Validation loss decreased (1.239980 --> 1.239703).  Saving model ...
Validation loss decreased (1.239703 --> 1.239551).  Saving model ...
Validation loss decreased (1.239551 --> 1.239517).  Saving model ...
EarlyStopping counter: 1 out of 5.0
Validation loss decreased (1.239517 --> 1.239032).  Saving model ...
Validation loss decreased (1.239032 --> 1.238646).  Saving model ...
Validation loss decreased (1.238646 --> 1.238434).  Saving model ...
Validation loss decreased (1.238434 --> 1.238363).  Saving model ...
Validation loss decreased (1.238363 --> 1.238210).  Saving model ...
Validation loss decreased (1.238210 --> 1.237765).  Saving model ...
Validation loss decreased (1.237765 --> 1.237210).  Saving model ...
Validation loss decreased (1.237210 --> 1.236924).  Saving model ...
Validation loss decreased (1.236924 --> 1.236581).  Saving model ...
Validation loss decreased (1.236581 --> 1.236503).  Saving model ...
Validation loss decreased (1.236503 --> 1.236437).  Saving model ...
Validation loss decreased (1.236437 --> 1.236356).  Saving model ...
Validation loss decreased (1.236356 --> 1.236192).  Saving model ...
Validation loss decreased (1.236192 --> 1.236063).  Saving model ...
Validation loss decreased (1.236063 --> 1.236025).  Saving model ...
Validation loss decreased (1.236025 --> 1.235969).  Saving model ...
EarlyStopping counter: 1 out of 5.0
Validation loss decreased (1.235969 --> 1.235777).  Saving model ...
Validation loss decreased (1.235777 --> 1.235560).  Saving model ...
Validation loss decreased (1.235560 --> 1.235136).  Saving model ...
Validation loss decreased (1.235136 --> 1.234768).  Saving model ...
Validation loss decreased (1.234768 --> 1.234513).  Saving model ...
Validation loss decreased (1.234513 --> 1.234076).  Saving model ...
EarlyStopping counter: 1 out of 5.0
Validation loss decreased (1.234076 --> 1.233669).  Saving model ...
Validation loss decreased (1.233669 --> 1.233354).  Saving model ...
Validation loss decreased (1.233354 --> 1.232986).  Saving model ...
Validation loss decreased (1.232986 --> 1.232573).  Saving model ...
Validation loss decreased (1.232573 --> 1.232474).  Saving model ...
Validation loss decreased (1.232474 --> 1.232287).  Saving model ...
Validation loss decreased (1.232287 --> 1.231823).  Saving model ...
Validation loss decreased (1.231823 --> 1.231747).  Saving model ...
EarlyStopping counter: 1 out of 5.0
Validation loss decreased (1.231747 --> 1.231512).  Saving model ...
Validation loss decreased (1.231512 --> 1.231273).  Saving model ...
Validation loss decreased (1.231273 --> 1.231199).  Saving model ...
EarlyStopping counter: 1 out of 5.0
EarlyStopping counter: 2 out of 5.0
EarlyStopping counter: 3 out of 5.0
Validation loss decreased (1.231199 --> 1.230930).  Saving model ...
Validation loss decreased (1.230930 --> 1.230835).  Saving model ...
Validation loss decreased (1.230835 --> 1.230639).  Saving model ...
Validation loss decreased (1.230639 --> 1.230207).  Saving model ...
Validation loss decreased (1.230207 --> 1.229908).  Saving model ...
EarlyStopping counter: 1 out of 5.0
Validation loss decreased (1.229908 --> 1.229749).  Saving model ...
Validation loss decreased (1.229749 --> 1.229315).  Saving model ...
Validation loss decreased (1.229315 --> 1.228861).  Saving model ...
Validation loss decreased (1.228861 --> 1.228759).  Saving model ...
Validation loss decreased (1.228759 --> 1.228610).  Saving model ...
Validation loss decreased (1.228610 --> 1.228313).  Saving model ...
Validation loss decreased (1.228313 --> 1.227892).  Saving model ...
Validation loss decreased (1.227892 --> 1.227719).  Saving model ...
Validation loss decreased (1.227719 --> 1.227719).  Saving model ...
Validation loss decreased (1.227719 --> 1.227133).  Saving model ...
Validation loss decreased (1.227133 --> 1.226640).  Saving model ...
EarlyStopping counter: 1 out of 5.0
Validation loss decreased (1.226640 --> 1.226551).  Saving model ...
Validation loss decreased (1.226551 --> 1.226485).  Saving model ...
Validation loss decreased (1.226485 --> 1.226374).  Saving model ...
Validation loss decreased (1.226374 --> 1.225876).  Saving model ...
/localscratch/yinan.28706214.0/env/lib/python3.7/site-packages/torch/nn/functional.py:1794: UserWarning: nn.functional.tanh is deprecated. Use torch.tanh instead.
  warnings.warn("nn.functional.tanh is deprecated. Use torch.tanh instead.")
/localscratch/yinan.28706214.0/env/lib/python3.7/site-packages/transformers/optimization.py:155: UserWarning: This overload of add_ is deprecated:
	add_(Number alpha, Tensor other)
Consider using one of the following signatures instead:
	add_(Tensor other, *, Number alpha) (Triggered internally at  ../torch/csrc/utils/python_arg_parser.cpp:1025.)
  exp_avg.mul_(beta1).add_(1.0 - beta1, grad)
wandb: Waiting for W&B process to finish, PID 127070... (success).
wandb: - 0.00MB of 0.00MB uploaded (0.00MB deduped)wandb: \ 0.00MB of 0.00MB uploaded (0.00MB deduped)wandb: | 0.00MB of 0.00MB uploaded (0.00MB deduped)wandb: / 0.00MB of 0.00MB uploaded (0.00MB deduped)wandb: - 0.00MB of 0.00MB uploaded (0.00MB deduped)wandb: \ 0.00MB of 0.00MB uploaded (0.00MB deduped)wandb: | 0.00MB of 0.00MB uploaded (0.00MB deduped)wandb: / 0.00MB of 0.00MB uploaded (0.00MB deduped)wandb: - 0.00MB of 0.00MB uploaded (0.00MB deduped)wandb: \ 0.00MB of 0.00MB uploaded (0.00MB deduped)wandb: | 0.00MB of 0.00MB uploaded (0.00MB deduped)wandb: / 0.00MB of 0.00MB uploaded (0.00MB deduped)wandb: - 0.00MB of 0.00MB uploaded (0.00MB deduped)wandb: \ 0.00MB of 0.00MB uploaded (0.00MB deduped)wandb: | 0.00MB of 0.00MB uploaded (0.00MB deduped)wandb: / 0.00MB of 0.00MB uploaded (0.00MB deduped)wandb: - 0.00MB of 0.00MB uploaded (0.00MB deduped)wandb: \ 0.00MB of 0.00MB uploaded (0.00MB deduped)wandb: | 0.00MB of 0.00MB uploaded (0.00MB deduped)wandb: / 0.00MB of 0.00MB uploaded (0.00MB deduped)wandb: - 0.00MB of 0.00MB uploaded (0.00MB deduped)wandb: \ 0.00MB of 0.00MB uploaded (0.00MB deduped)wandb: | 0.00MB of 0.00MB uploaded (0.00MB deduped)wandb: / 0.00MB of 0.00MB uploaded (0.00MB deduped)wandb: - 0.00MB of 0.00MB uploaded (0.00MB deduped)wandb: \ 0.00MB of 0.00MB uploaded (0.00MB deduped)wandb: | 0.00MB of 0.00MB uploaded (0.00MB deduped)wandb: / 0.00MB of 0.00MB uploaded (0.00MB deduped)wandb: - 0.00MB of 0.00MB uploaded (0.00MB deduped)wandb: \ 0.00MB of 0.00MB uploaded (0.00MB deduped)wandb: | 0.00MB of 0.00MB uploaded (0.00MB deduped)wandb: / 0.00MB of 0.00MB uploaded (0.00MB deduped)wandb: - 0.00MB of 0.00MB uploaded (0.00MB deduped)wandb: \ 0.00MB of 0.00MB uploaded (0.00MB deduped)wandb: | 0.00MB of 0.00MB uploaded (0.00MB deduped)wandb: / 0.00MB of 0.00MB uploaded (0.00MB deduped)wandb: - 0.00MB of 0.00MB uploaded (0.00MB deduped)wandb: \ 0.00MB of 0.00MB uploaded (0.00MB deduped)wandb: | 0.00MB of 0.00MB uploaded (0.00MB deduped)wandb: / 0.00MB of 0.00MB uploaded (0.00MB deduped)wandb: - 0.00MB of 0.00MB uploaded (0.00MB deduped)wandb: \ 0.00MB of 0.00MB uploaded (0.00MB deduped)wandb: | 0.00MB of 0.00MB uploaded (0.00MB deduped)wandb: / 0.00MB of 0.00MB uploaded (0.00MB deduped)wandb: - 0.00MB of 0.00MB uploaded (0.00MB deduped)wandb: \ 0.00MB of 0.00MB uploaded (0.00MB deduped)wandb: | 0.00MB of 0.00MB uploaded (0.00MB deduped)wandb: / 0.00MB of 0.00MB uploaded (0.00MB deduped)wandb: - 0.00MB of 0.00MB uploaded (0.00MB deduped)wandb: \ 0.00MB of 0.00MB uploaded (0.00MB deduped)wandb: | 0.00MB of 0.00MB uploaded (0.00MB deduped)wandb: / 0.00MB of 0.00MB uploaded (0.00MB deduped)wandb: - 0.00MB of 0.00MB uploaded (0.00MB deduped)wandb: \ 0.00MB of 0.00MB uploaded (0.00MB deduped)wandb: | 0.00MB of 0.00MB uploaded (0.00MB deduped)wandb: / 0.00MB of 0.00MB uploaded (0.00MB deduped)wandb: - 0.00MB of 0.00MB uploaded (0.00MB deduped)wandb: \ 0.00MB of 0.00MB uploaded (0.00MB deduped)wandb: | 0.00MB of 0.00MB uploaded (0.00MB deduped)wandb: / 0.00MB of 0.00MB uploaded (0.00MB deduped)wandb:                                                                                
wandb: Run history:
wandb:     e_F1 ▁▁▂▃▃▄▅▅▆▆▆▆▆▇▆▆▆▆▆▇▆▇▇▇▇▇▇▇▇▇▇▇▇███████
wandb:   e_loss █▇▇▆▆▆▅▅▅▅▅▄▄▄▄▄▄▃▃▃▃▃▃▃▂▂▂▂▂▂▂▂▂▂▁▁▁▁▁▁
wandb:     t_F1 ▁▂▂▂▂▃▃▃▄▃▃▅▄▅▄▅▅▅▅▆▆▆▆▆▆▆▇▇▇▇▇▆▇█▇█▇▇██
wandb:   t_loss █▇▇▇▇▆▆▆▆▆▆▅▆▆▅▅▄▄▄▄▄▄▄▄▃▃▃▃▃▃▂▂▂▂▂▁▂▁▁▁
wandb: 
wandb: Run summary:
wandb:     e_F1 41.76416
wandb:   e_loss 1.22588
wandb:     t_F1 51.69515
wandb:   t_loss 1.14786
wandb: 
wandb: Synced 4 W&B file(s), 0 media file(s), 0 artifact file(s) and 0 other file(s)
wandb: Synced divine-lion-1: https://wandb.ai/yinanazhou/xl_512_bs_8_lr_1e07_es_5_lc_True_nr_True_sr_True_stem_True_lemma_False_repeat_1_fold_1/runs/35mtpb2i
wandb: Find logs at: ./wandb/run-20220311_003144-35mtpb2i/logs/debug.log
wandb: 

wandb: wandb version 0.12.11 is available!  To upgrade, please run:
wandb:  $ pip install wandb --upgrade
2022-03-11 05:51:02.255514: I tensorflow/stream_executor/platform/default/dso_loader.cc:48] Successfully opened dynamic library libcudart.so.10.1
wandb: Tracking run with wandb version 0.12.5
wandb: Syncing run true-snowflake-1
wandb: ⭐️ View project at https://wandb.ai/yinanazhou/xl_512_bs_8_lr_1e07_es_5_lc_True_nr_True_sr_True_stem_True_lemma_False_repeat_1_fold_2
wandb: 🚀 View run at https://wandb.ai/yinanazhou/xl_512_bs_8_lr_1e07_es_5_lc_True_nr_True_sr_True_stem_True_lemma_False_repeat_1_fold_2/runs/rs3q0c0i
wandb: Run data is saved locally in /project/6002780/yinan/Thesis_MER_Lyrics/lyric-emotion/wandb/run-20220311_055059-rs3q0c0i
wandb: Run `wandb offline` to turn off syncing.
slurmstepd: error: *** JOB 28706214 ON cdr2616 CANCELLED AT 2022-03-11T10:27:40 DUE TO TIME LIMIT ***
