Unloading StdEnv/2020

Due to MODULEPATH changes, the following have been reloaded:
  1) mii/1.1.1


The following have been reloaded with a version change:
  1) python/3.8.2 => python/3.7.4

Using base prefix '/cvmfs/soft.computecanada.ca/easybuild/software/2017/Core/python/3.7.4'
New python executable in /localscratch/yinan.28698625.0/env/bin/python
Installing setuptools, pip, wheel...
done.
Ignoring pip: markers 'python_version < "3"' don't match your environment
Looking in links: /cvmfs/soft.computecanada.ca/custom/python/wheelhouse/nix/avx2, /cvmfs/soft.computecanada.ca/custom/python/wheelhouse/nix/generic, /cvmfs/soft.computecanada.ca/custom/python/wheelhouse/generic
Collecting pip
Installing collected packages: pip
  Found existing installation: pip 19.1.1
    Uninstalling pip-19.1.1:
      Successfully uninstalled pip-19.1.1
Successfully installed pip-21.2.3+computecanada
Looking in links: /cvmfs/soft.computecanada.ca/custom/python/wheelhouse/nix/avx2, /cvmfs/soft.computecanada.ca/custom/python/wheelhouse/nix/generic, /cvmfs/soft.computecanada.ca/custom/python/wheelhouse/generic
Processing /cvmfs/soft.computecanada.ca/custom/python/wheelhouse/generic/keras-2.8.0+computecanada-py2.py3-none-any.whl
Processing /cvmfs/soft.computecanada.ca/custom/python/wheelhouse/generic/Keras_Preprocessing-1.1.2+computecanada-py3-none-any.whl
Requirement already satisfied: matplotlib in /cvmfs/soft.computecanada.ca/easybuild/software/2017/Core/scipy-stack/2019a/lib/python3.7/site-packages (from -r requirements.txt (line 3)) (3.0.2)
Processing /cvmfs/soft.computecanada.ca/custom/python/wheelhouse/generic/nltk-3.6.5+computecanada-py3-none-any.whl
Processing /cvmfs/soft.computecanada.ca/custom/python/wheelhouse/generic/scikit_learn-0.22.1+computecanada-cp37-cp37m-linux_x86_64.whl
Processing /cvmfs/soft.computecanada.ca/custom/python/wheelhouse/generic/tensorboard-2.3.0+computecanada-py3-none-any.whl
Processing /cvmfs/soft.computecanada.ca/custom/python/wheelhouse/generic/tensorboard_plugin_wit-1.7.0+computecanada-py3-none-any.whl
Processing /cvmfs/soft.computecanada.ca/custom/python/wheelhouse/generic/tensorflow_gpu-2.3.0+computecanada-cp37-cp37m-linux_x86_64.whl
Processing /cvmfs/soft.computecanada.ca/custom/python/wheelhouse/generic/tensorflow_estimator-2.3.0+computecanada-py2.py3-none-any.whl
Processing /cvmfs/soft.computecanada.ca/custom/python/wheelhouse/generic/tokenizers-0.5.2+computecanada-cp37-cp37m-linux_x86_64.whl
Processing /cvmfs/soft.computecanada.ca/custom/python/wheelhouse/nix/avx2/torch-1.4.0+computecanada-cp37-cp37m-linux_x86_64.whl
Processing /cvmfs/soft.computecanada.ca/custom/python/wheelhouse/generic/torchtext-0.6.0+computecanada-py3-none-any.whl
Processing /cvmfs/soft.computecanada.ca/custom/python/wheelhouse/generic/torchvision-0.8.2+computecanada-cp37-cp37m-linux_x86_64.whl
Processing /cvmfs/soft.computecanada.ca/custom/python/wheelhouse/generic/transformers-2.5.1+computecanada-py3-none-any.whl
Processing /cvmfs/soft.computecanada.ca/custom/python/wheelhouse/generic/urllib3-1.26.7+computecanada-py2.py3-none-any.whl
Processing /cvmfs/soft.computecanada.ca/custom/python/wheelhouse/generic/click-8.0.3+computecanada-py3-none-any.whl
ERROR: Could not find a version that satisfies the requirement regex>=2021.8.3 (from nltk) (from versions: 2018.1.10+computecanada, 2019.11.1+computecanada, 2020.11.13+computecanada)
ERROR: No matching distribution found for regex>=2021.8.3
Looking in links: /cvmfs/soft.computecanada.ca/custom/python/wheelhouse/nix/avx2, /cvmfs/soft.computecanada.ca/custom/python/wheelhouse/nix/generic, /cvmfs/soft.computecanada.ca/custom/python/wheelhouse/generic
ERROR: Could not find a version that satisfies the requirement numpy==1.20.0+computacanada (from versions: 1.15.0+computecanada, 1.15.2+computecanada, 1.15.4+computecanada, 1.16.0+computecanada, 1.16.2+computecanada, 1.16.3+computecanada, 1.17.4+computecanada, 1.18.1+computecanada, 1.18.4+computecanada, 1.19.1+computecanada, 1.19.2+computecanada, 1.20.2+computecanada)
ERROR: No matching distribution found for numpy==1.20.0+computacanada
Looking in links: /cvmfs/soft.computecanada.ca/custom/python/wheelhouse/nix/avx2, /cvmfs/soft.computecanada.ca/custom/python/wheelhouse/nix/generic, /cvmfs/soft.computecanada.ca/custom/python/wheelhouse/generic
Processing /cvmfs/soft.computecanada.ca/custom/python/wheelhouse/generic/wandb-0.12.5+computecanada-py2.py3-none-any.whl
Processing /cvmfs/soft.computecanada.ca/custom/python/wheelhouse/generic/protobuf-3.19.4+computecanada-py2.py3-none-any.whl
Processing /cvmfs/soft.computecanada.ca/custom/python/wheelhouse/generic/six-1.16.0+computecanada-py2.py3-none-any.whl
Requirement already satisfied: python-dateutil>=2.6.1 in /cvmfs/soft.computecanada.ca/easybuild/software/2017/Core/scipy-stack/2019a/lib/python3.7/site-packages (from wandb) (2.7.5)
Processing /cvmfs/soft.computecanada.ca/custom/python/wheelhouse/generic/promise-2.3+computecanada-py3-none-any.whl
Processing /cvmfs/soft.computecanada.ca/custom/python/wheelhouse/generic/PyYAML-5.3.1+computecanada-cp37-cp37m-linux_x86_64.whl
Processing /cvmfs/soft.computecanada.ca/custom/python/wheelhouse/generic/configparser-5.0.2+computecanada-py3-none-any.whl
Processing /cvmfs/soft.computecanada.ca/custom/python/wheelhouse/generic/click-8.0.3+computecanada-py3-none-any.whl
Processing /cvmfs/soft.computecanada.ca/custom/python/wheelhouse/generic/psutil-5.7.3+computecanada-cp37-cp37m-linux_x86_64.whl
Processing /cvmfs/soft.computecanada.ca/custom/python/wheelhouse/generic/pathtools-0.1.2+computecanada-py3-none-any.whl
Processing /cvmfs/soft.computecanada.ca/custom/python/wheelhouse/generic/subprocess32-3.5.4+computecanada-py3-none-any.whl
Requirement already satisfied: requests<3,>=2.0.0 in /cvmfs/soft.computecanada.ca/easybuild/software/2017/Core/scipy-stack/2019a/lib/python3.7/site-packages (from wandb) (2.21.0)
Processing /cvmfs/soft.computecanada.ca/custom/python/wheelhouse/generic/yaspin-2.1.0+computecanada-py3-none-any.whl
Processing /cvmfs/soft.computecanada.ca/custom/python/wheelhouse/generic/docker_pycreds-0.4.0+computecanada-py2.py3-none-any.whl
Processing /cvmfs/soft.computecanada.ca/custom/python/wheelhouse/generic/sentry_sdk-1.5.0+computecanada-py2.py3-none-any.whl
Processing /cvmfs/soft.computecanada.ca/custom/python/wheelhouse/generic/GitPython-3.1.24+computecanada-py3-none-any.whl
Processing /cvmfs/soft.computecanada.ca/custom/python/wheelhouse/generic/shortuuid-1.0.1+computecanada-py3-none-any.whl
Requirement already satisfied: importlib-metadata in /cvmfs/soft.computecanada.ca/easybuild/software/2017/Core/scipy-stack/2019a/lib/python3.7/site-packages (from Click!=8.0.0,>=7.0->wandb) (0.8)
Processing /cvmfs/soft.computecanada.ca/custom/python/wheelhouse/generic/gitdb-4.0.9+computecanada-py3-none-any.whl
Processing /cvmfs/soft.computecanada.ca/custom/python/wheelhouse/generic/typing_extensions-4.0.1+computecanada-py3-none-any.whl
Processing /cvmfs/soft.computecanada.ca/custom/python/wheelhouse/generic/smmap-5.0.0+computecanada-py3-none-any.whl
Requirement already satisfied: urllib3<1.25,>=1.21.1 in /cvmfs/soft.computecanada.ca/easybuild/software/2017/Core/scipy-stack/2019a/lib/python3.7/site-packages (from requests<3,>=2.0.0->wandb) (1.24.1)
Requirement already satisfied: idna<2.9,>=2.5 in /cvmfs/soft.computecanada.ca/easybuild/software/2017/Core/scipy-stack/2019a/lib/python3.7/site-packages (from requests<3,>=2.0.0->wandb) (2.8)
Requirement already satisfied: chardet<3.1.0,>=3.0.2 in /cvmfs/soft.computecanada.ca/easybuild/software/2017/Core/scipy-stack/2019a/lib/python3.7/site-packages (from requests<3,>=2.0.0->wandb) (3.0.4)
Requirement already satisfied: certifi>=2017.4.17 in /cvmfs/soft.computecanada.ca/easybuild/software/2017/Core/scipy-stack/2019a/lib/python3.7/site-packages (from requests<3,>=2.0.0->wandb) (2018.11.29)
Processing /cvmfs/soft.computecanada.ca/custom/python/wheelhouse/generic/termcolor-1.1.0+computecanada-py3-none-any.whl
Requirement already satisfied: zipp>=0.3.2 in /cvmfs/soft.computecanada.ca/easybuild/software/2017/Core/scipy-stack/2019a/lib/python3.7/site-packages (from importlib-metadata->Click!=8.0.0,>=7.0->wandb) (0.3.3)
Installing collected packages: smmap, typing-extensions, termcolor, six, gitdb, yaspin, subprocess32, shortuuid, sentry-sdk, PyYAML, psutil, protobuf, promise, pathtools, GitPython, docker-pycreds, configparser, Click, wandb
  Attempting uninstall: six
    Found existing installation: six 1.12.0
    Not uninstalling six at /cvmfs/soft.computecanada.ca/easybuild/software/2017/Core/scipy-stack/2019a/lib/python3.7/site-packages, outside environment /localscratch/yinan.28698625.0/env
    Can't uninstall 'six'. No files were found to uninstall.
Successfully installed Click-8.0.3+computecanada GitPython-3.1.24+computecanada PyYAML-5.3.1+computecanada configparser-5.0.2+computecanada docker-pycreds-0.4.0+computecanada gitdb-4.0.9+computecanada pathtools-0.1.2+computecanada promise-2.3+computecanada protobuf-3.19.4+computecanada psutil-5.7.3+computecanada sentry-sdk-1.5.0+computecanada shortuuid-1.0.1+computecanada six-1.16.0+computecanada smmap-5.0.0+computecanada subprocess32-3.5.4+computecanada termcolor-1.1.0+computecanada typing-extensions-4.0.1+computecanada wandb-0.12.5+computecanada yaspin-2.1.0+computecanada
Looking in links: /cvmfs/soft.computecanada.ca/custom/python/wheelhouse/nix/avx2, /cvmfs/soft.computecanada.ca/custom/python/wheelhouse/nix/generic, /cvmfs/soft.computecanada.ca/custom/python/wheelhouse/generic
ERROR: Could not find a version that satisfies the requirement sagemaker (from versions: none)
ERROR: No matching distribution found for sagemaker
Looking in links: /cvmfs/soft.computecanada.ca/custom/python/wheelhouse/nix/avx2, /cvmfs/soft.computecanada.ca/custom/python/wheelhouse/nix/generic, /cvmfs/soft.computecanada.ca/custom/python/wheelhouse/generic
Processing /cvmfs/soft.computecanada.ca/custom/python/wheelhouse/generic/torch-1.9.1+computecanada-cp37-cp37m-linux_x86_64.whl
Requirement already satisfied: typing-extensions in /localscratch/yinan.28698625.0/env/lib/python3.7/site-packages (from torch) (4.0.1+computecanada)
Installing collected packages: torch
Successfully installed torch-1.9.1+computecanada
Looking in links: /cvmfs/soft.computecanada.ca/custom/python/wheelhouse/nix/avx2, /cvmfs/soft.computecanada.ca/custom/python/wheelhouse/nix/generic, /cvmfs/soft.computecanada.ca/custom/python/wheelhouse/generic
Processing /cvmfs/soft.computecanada.ca/custom/python/wheelhouse/generic/transformers-2.5.1+computecanada-py3-none-any.whl
Processing /cvmfs/soft.computecanada.ca/custom/python/wheelhouse/generic/tokenizers-0.5.2+computecanada-cp37-cp37m-linux_x86_64.whl
Requirement already satisfied: numpy in /cvmfs/soft.computecanada.ca/easybuild/software/2017/Core/scipy-stack/2019a/lib/python3.7/site-packages (from transformers==2.5.1+computecanada) (1.16.0)
Processing /cvmfs/soft.computecanada.ca/custom/python/wheelhouse/generic/sentencepiece-0.1.91+computecanada-cp37-cp37m-linux_x86_64.whl
Processing /cvmfs/soft.computecanada.ca/custom/python/wheelhouse/generic/filelock-3.4.2+computecanada-py3-none-any.whl
Processing /cvmfs/soft.computecanada.ca/custom/python/wheelhouse/generic/boto3-1.20.52+computecanada-py3-none-any.whl
Requirement already satisfied: requests in /cvmfs/soft.computecanada.ca/easybuild/software/2017/Core/scipy-stack/2019a/lib/python3.7/site-packages (from transformers==2.5.1+computecanada) (2.21.0)
Processing /cvmfs/soft.computecanada.ca/custom/python/wheelhouse/generic/regex-2020.11.13+computecanada-cp37-cp37m-linux_x86_64.whl
Processing /cvmfs/soft.computecanada.ca/custom/python/wheelhouse/generic/tqdm-4.63.0+computecanada-py2.py3-none-any.whl
Processing /cvmfs/soft.computecanada.ca/custom/python/wheelhouse/generic/sacremoses-0.0.46+computecanada-py3-none-any.whl
Processing /cvmfs/soft.computecanada.ca/custom/python/wheelhouse/generic/jmespath-0.10.0+computecanada-py2.py3-none-any.whl
Processing /cvmfs/soft.computecanada.ca/custom/python/wheelhouse/generic/s3transfer-0.5.1+computecanada-py3-none-any.whl
Processing /cvmfs/soft.computecanada.ca/custom/python/wheelhouse/generic/botocore-1.23.52+computecanada-py3-none-any.whl
Processing /cvmfs/soft.computecanada.ca/custom/python/wheelhouse/generic/urllib3-1.26.8+computecanada-py2.py3-none-any.whl
Requirement already satisfied: python-dateutil<3.0.0,>=2.1 in /cvmfs/soft.computecanada.ca/easybuild/software/2017/Core/scipy-stack/2019a/lib/python3.7/site-packages (from botocore<1.24.0,>=1.23.52->boto3->transformers==2.5.1+computecanada) (2.7.5)
Requirement already satisfied: six>=1.5 in /localscratch/yinan.28698625.0/env/lib/python3.7/site-packages (from python-dateutil<3.0.0,>=2.1->botocore<1.24.0,>=1.23.52->boto3->transformers==2.5.1+computecanada) (1.16.0+computecanada)
Requirement already satisfied: chardet<3.1.0,>=3.0.2 in /cvmfs/soft.computecanada.ca/easybuild/software/2017/Core/scipy-stack/2019a/lib/python3.7/site-packages (from requests->transformers==2.5.1+computecanada) (3.0.4)
Requirement already satisfied: idna<2.9,>=2.5 in /cvmfs/soft.computecanada.ca/easybuild/software/2017/Core/scipy-stack/2019a/lib/python3.7/site-packages (from requests->transformers==2.5.1+computecanada) (2.8)
Processing /cvmfs/soft.computecanada.ca/custom/python/wheelhouse/generic/requests-2.27.1+computecanada-py2.py3-none-any.whl
Processing /cvmfs/soft.computecanada.ca/custom/python/wheelhouse/generic/charset_normalizer-2.0.11+computecanada-py3-none-any.whl
Requirement already satisfied: certifi>=2017.4.17 in /cvmfs/soft.computecanada.ca/easybuild/software/2017/Core/scipy-stack/2019a/lib/python3.7/site-packages (from requests->transformers==2.5.1+computecanada) (2018.11.29)
Requirement already satisfied: click in /localscratch/yinan.28698625.0/env/lib/python3.7/site-packages (from sacremoses->transformers==2.5.1+computecanada) (8.0.3+computecanada)
Processing /cvmfs/soft.computecanada.ca/custom/python/wheelhouse/generic/joblib-1.1.0+computecanada-py2.py3-none-any.whl
Requirement already satisfied: importlib-metadata in /cvmfs/soft.computecanada.ca/easybuild/software/2017/Core/scipy-stack/2019a/lib/python3.7/site-packages (from click->sacremoses->transformers==2.5.1+computecanada) (0.8)
Requirement already satisfied: zipp>=0.3.2 in /cvmfs/soft.computecanada.ca/easybuild/software/2017/Core/scipy-stack/2019a/lib/python3.7/site-packages (from importlib-metadata->click->sacremoses->transformers==2.5.1+computecanada) (0.3.3)
Installing collected packages: urllib3, jmespath, botocore, tqdm, s3transfer, regex, joblib, charset-normalizer, tokenizers, sentencepiece, sacremoses, requests, filelock, boto3, transformers
  Attempting uninstall: urllib3
    Found existing installation: urllib3 1.24.1
    Not uninstalling urllib3 at /cvmfs/soft.computecanada.ca/easybuild/software/2017/Core/scipy-stack/2019a/lib/python3.7/site-packages, outside environment /localscratch/yinan.28698625.0/env
    Can't uninstall 'urllib3'. No files were found to uninstall.
  Attempting uninstall: requests
    Found existing installation: requests 2.21.0
    Not uninstalling requests at /cvmfs/soft.computecanada.ca/easybuild/software/2017/Core/scipy-stack/2019a/lib/python3.7/site-packages, outside environment /localscratch/yinan.28698625.0/env
    Can't uninstall 'requests'. No files were found to uninstall.
Successfully installed boto3-1.20.52+computecanada botocore-1.23.52+computecanada charset-normalizer-2.0.11+computecanada filelock-3.4.2+computecanada jmespath-0.10.0+computecanada joblib-1.1.0+computecanada regex-2020.11.13+computecanada requests-2.27.1+computecanada s3transfer-0.5.1+computecanada sacremoses-0.0.46+computecanada sentencepiece-0.1.91+computecanada tokenizers-0.5.2+computecanada tqdm-4.63.0+computecanada transformers-2.5.1+computecanada urllib3-1.26.8+computecanada
Looking in links: /cvmfs/soft.computecanada.ca/custom/python/wheelhouse/nix/avx2, /cvmfs/soft.computecanada.ca/custom/python/wheelhouse/nix/generic, /cvmfs/soft.computecanada.ca/custom/python/wheelhouse/generic
Processing /cvmfs/soft.computecanada.ca/custom/python/wheelhouse/generic/tensorflow_gpu-2.3.0+computecanada-cp37-cp37m-linux_x86_64.whl
Processing /cvmfs/soft.computecanada.ca/custom/python/wheelhouse/generic/grpcio-1.38.0+computecanada-cp37-cp37m-linux_x86_64.whl
Requirement already satisfied: wheel>=0.26 in /localscratch/yinan.28698625.0/env/lib/python3.7/site-packages (from tensorflow_gpu==2.3.0+computecanada) (0.33.4)
Processing /cvmfs/soft.computecanada.ca/custom/python/wheelhouse/nix/avx2/h5py-2.10.0+computecanada-cp37-cp37m-linux_x86_64.whl
Requirement already satisfied: protobuf>=3.9.2 in /localscratch/yinan.28698625.0/env/lib/python3.7/site-packages (from tensorflow_gpu==2.3.0+computecanada) (3.19.4+computecanada)
Requirement already satisfied: termcolor>=1.1.0 in /localscratch/yinan.28698625.0/env/lib/python3.7/site-packages (from tensorflow_gpu==2.3.0+computecanada) (1.1.0+computecanada)
Requirement already satisfied: six>=1.12.0 in /localscratch/yinan.28698625.0/env/lib/python3.7/site-packages (from tensorflow_gpu==2.3.0+computecanada) (1.16.0+computecanada)
Requirement already satisfied: numpy<1.19.0,>=1.16.0 in /cvmfs/soft.computecanada.ca/easybuild/software/2017/Core/scipy-stack/2019a/lib/python3.7/site-packages (from tensorflow_gpu==2.3.0+computecanada) (1.16.0)
Processing /cvmfs/soft.computecanada.ca/custom/python/wheelhouse/generic/wrapt-1.11.2+computecanada-cp37-cp37m-linux_x86_64.whl
Processing /cvmfs/soft.computecanada.ca/custom/python/wheelhouse/generic/gast-0.3.3+computecanada-py3-none-any.whl
Processing /cvmfs/soft.computecanada.ca/custom/python/wheelhouse/generic/google_pasta-0.2.0+computecanada-py3-none-any.whl
Processing /cvmfs/soft.computecanada.ca/custom/python/wheelhouse/generic/tensorflow_estimator-2.3.0+computecanada-py2.py3-none-any.whl
Processing /cvmfs/soft.computecanada.ca/custom/python/wheelhouse/generic/Keras_Preprocessing-1.1.2+computecanada-py3-none-any.whl
Processing /cvmfs/soft.computecanada.ca/custom/python/wheelhouse/generic/absl_py-1.0.0+computecanada-py3-none-any.whl
Processing /cvmfs/soft.computecanada.ca/custom/python/wheelhouse/generic/astunparse-1.6.3+computecanada-py2.py3-none-any.whl
Processing /cvmfs/soft.computecanada.ca/custom/python/wheelhouse/generic/tensorboard-2.8.0+computecanada-py3-none-any.whl
Processing /cvmfs/soft.computecanada.ca/custom/python/wheelhouse/nix/generic/scipy-1.4.1+computecanada-cp37-cp37m-linux_x86_64.whl
Processing /cvmfs/soft.computecanada.ca/custom/python/wheelhouse/generic/opt_einsum-3.3.0+computecanada-py3-none-any.whl
Processing /cvmfs/soft.computecanada.ca/custom/python/wheelhouse/generic/tensorboard_plugin_wit-1.8.0+computecanada-py3-none-any.whl
Processing /cvmfs/soft.computecanada.ca/custom/python/wheelhouse/generic/google_auth-2.3.3+computecanada-py2.py3-none-any.whl
Processing /cvmfs/soft.computecanada.ca/custom/python/wheelhouse/generic/google_auth_oauthlib-0.4.6+computecanada-py2.py3-none-any.whl
Processing /cvmfs/soft.computecanada.ca/custom/python/wheelhouse/generic/Werkzeug-2.0.3+computecanada-py3-none-any.whl
Requirement already satisfied: requests<3,>=2.21.0 in /localscratch/yinan.28698625.0/env/lib/python3.7/site-packages (from tensorboard<3,>=2.3.0->tensorflow_gpu==2.3.0+computecanada) (2.27.1+computecanada)
Requirement already satisfied: setuptools>=41.0.0 in /localscratch/yinan.28698625.0/env/lib/python3.7/site-packages (from tensorboard<3,>=2.3.0->tensorflow_gpu==2.3.0+computecanada) (41.0.1)
Processing /cvmfs/soft.computecanada.ca/custom/python/wheelhouse/generic/Markdown-3.3.6+computecanada-py3-none-any.whl
Processing /cvmfs/soft.computecanada.ca/custom/python/wheelhouse/generic/tensorboard_data_server-0.6.1+computecanada-py3-none-linux_x86_64.whl
Processing /cvmfs/soft.computecanada.ca/custom/python/wheelhouse/generic/rsa-4.8+computecanada-py3-none-any.whl
Processing /cvmfs/soft.computecanada.ca/custom/python/wheelhouse/generic/pyasn1_modules-0.2.8+computecanada-py2.py3-none-any.whl
Processing /cvmfs/soft.computecanada.ca/custom/python/wheelhouse/generic/cachetools-4.2.4+computecanada-py3-none-any.whl
Processing /cvmfs/soft.computecanada.ca/custom/python/wheelhouse/generic/requests_oauthlib-1.3.0+computecanada-py2.py3-none-any.whl
Processing /cvmfs/soft.computecanada.ca/custom/python/wheelhouse/generic/importlib_metadata-4.10.1+computecanada-py3-none-any.whl
Processing /cvmfs/soft.computecanada.ca/custom/python/wheelhouse/generic/zipp-3.7.0+computecanada-py3-none-any.whl
Requirement already satisfied: typing-extensions>=3.6.4 in /localscratch/yinan.28698625.0/env/lib/python3.7/site-packages (from importlib-metadata>=4.4->markdown>=2.6.8->tensorboard<3,>=2.3.0->tensorflow_gpu==2.3.0+computecanada) (4.0.1+computecanada)
Processing /cvmfs/soft.computecanada.ca/custom/python/wheelhouse/generic/pyasn1-0.4.8+computecanada-py2.py3-none-any.whl
Requirement already satisfied: urllib3<1.27,>=1.21.1 in /localscratch/yinan.28698625.0/env/lib/python3.7/site-packages (from requests<3,>=2.21.0->tensorboard<3,>=2.3.0->tensorflow_gpu==2.3.0+computecanada) (1.26.8+computecanada)
Requirement already satisfied: idna<4,>=2.5 in /cvmfs/soft.computecanada.ca/easybuild/software/2017/Core/scipy-stack/2019a/lib/python3.7/site-packages (from requests<3,>=2.21.0->tensorboard<3,>=2.3.0->tensorflow_gpu==2.3.0+computecanada) (2.8)
Requirement already satisfied: charset-normalizer~=2.0.0 in /localscratch/yinan.28698625.0/env/lib/python3.7/site-packages (from requests<3,>=2.21.0->tensorboard<3,>=2.3.0->tensorflow_gpu==2.3.0+computecanada) (2.0.11+computecanada)
Requirement already satisfied: certifi>=2017.4.17 in /cvmfs/soft.computecanada.ca/easybuild/software/2017/Core/scipy-stack/2019a/lib/python3.7/site-packages (from requests<3,>=2.21.0->tensorboard<3,>=2.3.0->tensorflow_gpu==2.3.0+computecanada) (2018.11.29)
Processing /cvmfs/soft.computecanada.ca/custom/python/wheelhouse/generic/oauthlib-3.1.1+computecanada-py2.py3-none-any.whl
Installing collected packages: pyasn1, zipp, rsa, pyasn1-modules, oauthlib, cachetools, requests-oauthlib, importlib-metadata, google-auth, werkzeug, tensorboard-plugin-wit, tensorboard-data-server, markdown, grpcio, google-auth-oauthlib, absl-py, wrapt, tensorflow-estimator, tensorboard, scipy, opt-einsum, keras-preprocessing, h5py, google-pasta, gast, astunparse, tensorflow-gpu
  Attempting uninstall: pyasn1
    Found existing installation: pyasn1 0.4.3
    Not uninstalling pyasn1 at /cvmfs/soft.computecanada.ca/easybuild/software/2017/Core/scipy-stack/2019a/lib/python3.7/site-packages, outside environment /localscratch/yinan.28698625.0/env
    Can't uninstall 'pyasn1'. No files were found to uninstall.
  Attempting uninstall: zipp
    Found existing installation: zipp 0.3.3
    Not uninstalling zipp at /cvmfs/soft.computecanada.ca/easybuild/software/2017/Core/scipy-stack/2019a/lib/python3.7/site-packages, outside environment /localscratch/yinan.28698625.0/env
    Can't uninstall 'zipp'. No files were found to uninstall.
  Attempting uninstall: importlib-metadata
    Found existing installation: importlib-metadata 0.8
    Not uninstalling importlib-metadata at /cvmfs/soft.computecanada.ca/easybuild/software/2017/Core/scipy-stack/2019a/lib/python3.7/site-packages, outside environment /localscratch/yinan.28698625.0/env
    Can't uninstall 'importlib-metadata'. No files were found to uninstall.
  Attempting uninstall: scipy
    Found existing installation: scipy 1.2.0
    Not uninstalling scipy at /cvmfs/soft.computecanada.ca/easybuild/software/2017/Core/scipy-stack/2019a/lib/python3.7/site-packages, outside environment /localscratch/yinan.28698625.0/env
    Can't uninstall 'scipy'. No files were found to uninstall.
Successfully installed absl-py-1.0.0+computecanada astunparse-1.6.3+computecanada cachetools-4.2.4+computecanada gast-0.3.3+computecanada google-auth-2.3.3+computecanada google-auth-oauthlib-0.4.6+computecanada google-pasta-0.2.0+computecanada grpcio-1.38.0+computecanada h5py-2.10.0+computecanada importlib-metadata-4.10.1+computecanada keras-preprocessing-1.1.2+computecanada markdown-3.3.6+computecanada oauthlib-3.1.1+computecanada opt-einsum-3.3.0+computecanada pyasn1-0.4.8+computecanada pyasn1-modules-0.2.8+computecanada requests-oauthlib-1.3.0+computecanada rsa-4.8+computecanada scipy-1.4.1+computecanada tensorboard-2.8.0+computecanada tensorboard-data-server-0.6.1+computecanada tensorboard-plugin-wit-1.8.0+computecanada tensorflow-estimator-2.3.0+computecanada tensorflow-gpu-2.3.0+computecanada werkzeug-2.0.3+computecanada wrapt-1.11.2+computecanada zipp-3.7.0+computecanada
Looking in links: /cvmfs/soft.computecanada.ca/custom/python/wheelhouse/nix/avx2, /cvmfs/soft.computecanada.ca/custom/python/wheelhouse/nix/generic, /cvmfs/soft.computecanada.ca/custom/python/wheelhouse/generic
Processing /cvmfs/soft.computecanada.ca/custom/python/wheelhouse/generic/keras-2.8.0+computecanada-py2.py3-none-any.whl
Installing collected packages: Keras
Successfully installed Keras-2.8.0+computecanada
Looking in links: /cvmfs/soft.computecanada.ca/custom/python/wheelhouse/nix/avx2, /cvmfs/soft.computecanada.ca/custom/python/wheelhouse/nix/generic, /cvmfs/soft.computecanada.ca/custom/python/wheelhouse/generic
Processing /cvmfs/soft.computecanada.ca/custom/python/wheelhouse/generic/urllib3-1.26.7+computecanada-py2.py3-none-any.whl
Installing collected packages: urllib3
  Attempting uninstall: urllib3
    Found existing installation: urllib3 1.26.8+computecanada
    Uninstalling urllib3-1.26.8+computecanada:
      Successfully uninstalled urllib3-1.26.8+computecanada
Successfully installed urllib3-1.26.7+computecanada
Looking in links: /cvmfs/soft.computecanada.ca/custom/python/wheelhouse/nix/avx2, /cvmfs/soft.computecanada.ca/custom/python/wheelhouse/nix/generic, /cvmfs/soft.computecanada.ca/custom/python/wheelhouse/generic
Processing /cvmfs/soft.computecanada.ca/custom/python/wheelhouse/generic/nltk-3.7+computecanada-py3-none-any.whl
Requirement already satisfied: tqdm in /localscratch/yinan.28698625.0/env/lib/python3.7/site-packages (from nltk) (4.63.0+computecanada)
Requirement already satisfied: joblib in /localscratch/yinan.28698625.0/env/lib/python3.7/site-packages (from nltk) (1.1.0+computecanada)
Requirement already satisfied: click in /localscratch/yinan.28698625.0/env/lib/python3.7/site-packages (from nltk) (8.0.3+computecanada)
Processing /cvmfs/soft.computecanada.ca/custom/python/wheelhouse/generic/nltk-3.6.5+computecanada-py3-none-any.whl
Processing /cvmfs/soft.computecanada.ca/custom/python/wheelhouse/generic/nltk-3.6.3+computecanada-py3-none-any.whl
Requirement already satisfied: regex in /localscratch/yinan.28698625.0/env/lib/python3.7/site-packages (from nltk) (2020.11.13+computecanada)
Requirement already satisfied: importlib-metadata in /localscratch/yinan.28698625.0/env/lib/python3.7/site-packages (from click->nltk) (4.10.1+computecanada)
Requirement already satisfied: zipp>=0.5 in /localscratch/yinan.28698625.0/env/lib/python3.7/site-packages (from importlib-metadata->click->nltk) (3.7.0+computecanada)
Requirement already satisfied: typing-extensions>=3.6.4 in /localscratch/yinan.28698625.0/env/lib/python3.7/site-packages (from importlib-metadata->click->nltk) (4.0.1+computecanada)
Installing collected packages: nltk
Successfully installed nltk-3.6.3+computecanada
Looking in links: /cvmfs/soft.computecanada.ca/custom/python/wheelhouse/nix/avx2, /cvmfs/soft.computecanada.ca/custom/python/wheelhouse/nix/generic, /cvmfs/soft.computecanada.ca/custom/python/wheelhouse/generic
Processing /cvmfs/soft.computecanada.ca/custom/python/wheelhouse/generic/scikit_learn-0.22.1+computecanada-cp37-cp37m-linux_x86_64.whl
Requirement already satisfied: joblib>=0.11 in /localscratch/yinan.28698625.0/env/lib/python3.7/site-packages (from scikit-learn==0.22.1) (1.1.0+computecanada)
Requirement already satisfied: numpy>=1.11.0 in /cvmfs/soft.computecanada.ca/easybuild/software/2017/Core/scipy-stack/2019a/lib/python3.7/site-packages (from scikit-learn==0.22.1) (1.16.0)
Requirement already satisfied: scipy>=0.17.0 in /localscratch/yinan.28698625.0/env/lib/python3.7/site-packages (from scikit-learn==0.22.1) (1.4.1+computecanada)
Installing collected packages: scikit-learn
Successfully installed scikit-learn-0.22.1+computecanada
Looking in links: /cvmfs/soft.computecanada.ca/custom/python/wheelhouse/nix/avx2, /cvmfs/soft.computecanada.ca/custom/python/wheelhouse/nix/generic, /cvmfs/soft.computecanada.ca/custom/python/wheelhouse/generic
Requirement already satisfied: tokenizers==0.5.2 in /localscratch/yinan.28698625.0/env/lib/python3.7/site-packages (0.5.2+computecanada)
wandb: Appending key for api.wandb.ai to your netrc file: /home/yinan/.netrc
Starting Task
2022-03-11 04:09:29.444484: I tensorflow/stream_executor/platform/default/dso_loader.cc:48] Successfully opened dynamic library libcudart.so.10.1
[nltk_data] Downloading package stopwords to /home/yinan/nltk_data...
[nltk_data]   Package stopwords is already up-to-date!
[nltk_data] Downloading package wordnet to /home/yinan/nltk_data...
[nltk_data]   Package wordnet is already up-to-date!
wandb: Currently logged in as: yinanazhou (use `wandb login --relogin` to force relogin)
wandb: wandb version 0.12.11 is available!  To upgrade, please run:
wandb:  $ pip install wandb --upgrade
2022-03-11 04:09:41.115011: I tensorflow/stream_executor/platform/default/dso_loader.cc:48] Successfully opened dynamic library libcudart.so.10.1
wandb: Tracking run with wandb version 0.12.5
wandb: Syncing run fiery-flower-1
wandb: ⭐️ View project at https://wandb.ai/yinanazhou/xl_512_bs_8_lr_1e07_es_15_lc_True_nr_False_sr_True_stem_False_lemma_False_repeat_1_fold_1
wandb: 🚀 View run at https://wandb.ai/yinanazhou/xl_512_bs_8_lr_1e07_es_15_lc_True_nr_False_sr_True_stem_False_lemma_False_repeat_1_fold_1/runs/16txcegf
wandb: Run data is saved locally in /project/6002780/yinan/Thesis_MER_Lyrics/lyric-emotion/wandb/run-20220311_040938-16txcegf
wandb: Run `wandb offline` to turn off syncing.

Validation loss decreased (inf --> 1.460959).  Saving model ...
Validation loss decreased (1.460959 --> 1.458269).  Saving model ...
Validation loss decreased (1.458269 --> 1.455638).  Saving model ...
Validation loss decreased (1.455638 --> 1.452981).  Saving model ...
Validation loss decreased (1.452981 --> 1.450490).  Saving model ...
Validation loss decreased (1.450490 --> 1.448019).  Saving model ...
Validation loss decreased (1.448019 --> 1.445647).  Saving model ...
Validation loss decreased (1.445647 --> 1.443405).  Saving model ...
Validation loss decreased (1.443405 --> 1.441189).  Saving model ...
Validation loss decreased (1.441189 --> 1.438886).  Saving model ...
Validation loss decreased (1.438886 --> 1.436620).  Saving model ...
Validation loss decreased (1.436620 --> 1.434534).  Saving model ...
Validation loss decreased (1.434534 --> 1.432540).  Saving model ...
Validation loss decreased (1.432540 --> 1.430511).  Saving model ...
Validation loss decreased (1.430511 --> 1.428537).  Saving model ...
Validation loss decreased (1.428537 --> 1.426635).  Saving model ...
Validation loss decreased (1.426635 --> 1.424721).  Saving model ...
Validation loss decreased (1.424721 --> 1.422912).  Saving model ...
Validation loss decreased (1.422912 --> 1.421105).  Saving model ...
Validation loss decreased (1.421105 --> 1.419335).  Saving model ...
Validation loss decreased (1.419335 --> 1.417514).  Saving model ...
Validation loss decreased (1.417514 --> 1.415823).  Saving model ...
Validation loss decreased (1.415823 --> 1.414207).  Saving model ...
Validation loss decreased (1.414207 --> 1.412659).  Saving model ...
Validation loss decreased (1.412659 --> 1.411080).  Saving model ...
Validation loss decreased (1.411080 --> 1.409556).  Saving model ...
Validation loss decreased (1.409556 --> 1.408085).  Saving model ...
Validation loss decreased (1.408085 --> 1.406643).  Saving model ...
Validation loss decreased (1.406643 --> 1.405349).  Saving model ...
Validation loss decreased (1.405349 --> 1.403986).  Saving model ...
Validation loss decreased (1.403986 --> 1.402646).  Saving model ...
Validation loss decreased (1.402646 --> 1.401245).  Saving model ...
Validation loss decreased (1.401245 --> 1.399952).  Saving model ...
Validation loss decreased (1.399952 --> 1.398669).  Saving model ...
Validation loss decreased (1.398669 --> 1.397478).  Saving model ...
Validation loss decreased (1.397478 --> 1.396182).  Saving model ...
Validation loss decreased (1.396182 --> 1.394899).  Saving model ...
Validation loss decreased (1.394899 --> 1.393815).  Saving model ...
Validation loss decreased (1.393815 --> 1.392660).  Saving model ...
Validation loss decreased (1.392660 --> 1.391570).  Saving model ...
Validation loss decreased (1.391570 --> 1.390450).  Saving model ...
Validation loss decreased (1.390450 --> 1.389272).  Saving model ...
Validation loss decreased (1.389272 --> 1.388203).  Saving model ...
Validation loss decreased (1.388203 --> 1.387146).  Saving model ...
Validation loss decreased (1.387146 --> 1.385995).  Saving model ...
Validation loss decreased (1.385995 --> 1.384993).  Saving model ...
Validation loss decreased (1.384993 --> 1.384019).  Saving model ...
Validation loss decreased (1.384019 --> 1.383026).  Saving model ...
Validation loss decreased (1.383026 --> 1.382045).  Saving model ...
Validation loss decreased (1.382045 --> 1.381069).  Saving model ...
Validation loss decreased (1.381069 --> 1.380194).  Saving model ...
Validation loss decreased (1.380194 --> 1.379334).  Saving model ...
Validation loss decreased (1.379334 --> 1.378376).  Saving model ...
Validation loss decreased (1.378376 --> 1.377498).  Saving model ...
Validation loss decreased (1.377498 --> 1.376650).  Saving model ...
Validation loss decreased (1.376650 --> 1.375779).  Saving model ...
Validation loss decreased (1.375779 --> 1.374842).  Saving model ...
Validation loss decreased (1.374842 --> 1.373998).  Saving model ...
Validation loss decreased (1.373998 --> 1.373112).  Saving model ...
Validation loss decreased (1.373112 --> 1.372308).  Saving model ...
Validation loss decreased (1.372308 --> 1.371451).  Saving model ...
Validation loss decreased (1.371451 --> 1.370587).  Saving model ...
Validation loss decreased (1.370587 --> 1.369794).  Saving model ...
Validation loss decreased (1.369794 --> 1.369014).  Saving model ...
Validation loss decreased (1.369014 --> 1.368258).  Saving model ...
Validation loss decreased (1.368258 --> 1.367467).  Saving model ...
Validation loss decreased (1.367467 --> 1.366774).  Saving model ...
Validation loss decreased (1.366774 --> 1.366017).  Saving model ...
Validation loss decreased (1.366017 --> 1.365305).  Saving model ...
Validation loss decreased (1.365305 --> 1.364642).  Saving model ...
Validation loss decreased (1.364642 --> 1.363960).  Saving model ...
Validation loss decreased (1.363960 --> 1.363227).  Saving model ...
Validation loss decreased (1.363227 --> 1.362438).  Saving model ...
Validation loss decreased (1.362438 --> 1.361723).  Saving model ...
Validation loss decreased (1.361723 --> 1.361065).  Saving model ...
Validation loss decreased (1.361065 --> 1.360342).  Saving model ...
Validation loss decreased (1.360342 --> 1.359747).  Saving model ...
Validation loss decreased (1.359747 --> 1.359111).  Saving model ...
Validation loss decreased (1.359111 --> 1.358462).  Saving model ...
Validation loss decreased (1.358462 --> 1.357773).  Saving model ...
Validation loss decreased (1.357773 --> 1.357068).  Saving model ...
Validation loss decreased (1.357068 --> 1.356460).  Saving model ...
Validation loss decreased (1.356460 --> 1.355813).  Saving model ...
Validation loss decreased (1.355813 --> 1.355221).  Saving model ...
Validation loss decreased (1.355221 --> 1.354602).  Saving model ...
Validation loss decreased (1.354602 --> 1.353968).  Saving model ...
Validation loss decreased (1.353968 --> 1.353298).  Saving model ...
Validation loss decreased (1.353298 --> 1.352578).  Saving model ...
Validation loss decreased (1.352578 --> 1.351990).  Saving model ...
Validation loss decreased (1.351990 --> 1.351382).  Saving model ...
Validation loss decreased (1.351382 --> 1.350782).  Saving model ...
Validation loss decreased (1.350782 --> 1.350212).  Saving model ...
Validation loss decreased (1.350212 --> 1.349647).  Saving model ...
Validation loss decreased (1.349647 --> 1.349026).  Saving model ...
Validation loss decreased (1.349026 --> 1.348392).  Saving model ...
Validation loss decreased (1.348392 --> 1.347786).  Saving model ...
Validation loss decreased (1.347786 --> 1.347169).  Saving model ...
Validation loss decreased (1.347169 --> 1.346565).  Saving model ...
Validation loss decreased (1.346565 --> 1.346016).  Saving model ...
Validation loss decreased (1.346016 --> 1.345400).  Saving model ...
Validation loss decreased (1.345400 --> 1.344751).  Saving model ...
Validation loss decreased (1.344751 --> 1.344158).  Saving model ...
Validation loss decreased (1.344158 --> 1.343518).  Saving model ...
Validation loss decreased (1.343518 --> 1.342915).  Saving model ...
Validation loss decreased (1.342915 --> 1.342275).  Saving model ...
Validation loss decreased (1.342275 --> 1.341659).  Saving model ...
Validation loss decreased (1.341659 --> 1.341096).  Saving model ...
Validation loss decreased (1.341096 --> 1.340501).  Saving model ...
Validation loss decreased (1.340501 --> 1.339905).  Saving model ...
Validation loss decreased (1.339905 --> 1.339291).  Saving model ...
Validation loss decreased (1.339291 --> 1.338692).  Saving model ...
Validation loss decreased (1.338692 --> 1.338110).  Saving model ...
Validation loss decreased (1.338110 --> 1.337524).  Saving model ...
Validation loss decreased (1.337524 --> 1.336953).  Saving model ...
Validation loss decreased (1.336953 --> 1.336421).  Saving model ...
Validation loss decreased (1.336421 --> 1.335924).  Saving model ...
Validation loss decreased (1.335924 --> 1.335337).  Saving model ...
Validation loss decreased (1.335337 --> 1.334748).  Saving model ...
Validation loss decreased (1.334748 --> 1.334149).  Saving model ...
Validation loss decreased (1.334149 --> 1.333571).  Saving model ...
Validation loss decreased (1.333571 --> 1.333010).  Saving model ...
Validation loss decreased (1.333010 --> 1.332377).  Saving model ...
Validation loss decreased (1.332377 --> 1.331764).  Saving model ...
Validation loss decreased (1.331764 --> 1.331138).  Saving model ...
Validation loss decreased (1.331138 --> 1.330599).  Saving model ...
Validation loss decreased (1.330599 --> 1.330025).  Saving model ...
Validation loss decreased (1.330025 --> 1.329499).  Saving model ...
Validation loss decreased (1.329499 --> 1.328840).  Saving model ...
Validation loss decreased (1.328840 --> 1.328225).  Saving model ...
Validation loss decreased (1.328225 --> 1.327600).  Saving model ...
Validation loss decreased (1.327600 --> 1.327078).  Saving model ...
Validation loss decreased (1.327078 --> 1.326567).  Saving model ...
Validation loss decreased (1.326567 --> 1.326004).  Saving model ...
Validation loss decreased (1.326004 --> 1.325421).  Saving model ...
Validation loss decreased (1.325421 --> 1.324766).  Saving model ...
Validation loss decreased (1.324766 --> 1.324085).  Saving model ...
Validation loss decreased (1.324085 --> 1.323542).  Saving model ...
Validation loss decreased (1.323542 --> 1.322864).  Saving model ...
Validation loss decreased (1.322864 --> 1.322195).  Saving model ...
Validation loss decreased (1.322195 --> 1.321588).  Saving model ...
Validation loss decreased (1.321588 --> 1.321000).  Saving model ...
Validation loss decreased (1.321000 --> 1.320364).  Saving model ...
Validation loss decreased (1.320364 --> 1.319756).  Saving model ...
Validation loss decreased (1.319756 --> 1.319198).  Saving model ...
Validation loss decreased (1.319198 --> 1.318509).  Saving model ...
Validation loss decreased (1.318509 --> 1.317921).  Saving model ...
Validation loss decreased (1.317921 --> 1.317275).  Saving model ...
Validation loss decreased (1.317275 --> 1.316620).  Saving model ...
Validation loss decreased (1.316620 --> 1.315990).  Saving model ...
Validation loss decreased (1.315990 --> 1.315376).  Saving model ...
Validation loss decreased (1.315376 --> 1.314836).  Saving model ...
Validation loss decreased (1.314836 --> 1.314251).  Saving model ...
Validation loss decreased (1.314251 --> 1.313596).  Saving model ...
Validation loss decreased (1.313596 --> 1.312997).  Saving model ...
Validation loss decreased (1.312997 --> 1.312366).  Saving model ...
Validation loss decreased (1.312366 --> 1.311823).  Saving model ...
Validation loss decreased (1.311823 --> 1.311271).  Saving model ...
Validation loss decreased (1.311271 --> 1.310628).  Saving model ...
Validation loss decreased (1.310628 --> 1.310017).  Saving model ...
Validation loss decreased (1.310017 --> 1.309444).  Saving model ...
Validation loss decreased (1.309444 --> 1.308865).  Saving model ...
Validation loss decreased (1.308865 --> 1.308281).  Saving model ...
Validation loss decreased (1.308281 --> 1.307701).  Saving model ...
Validation loss decreased (1.307701 --> 1.306990).  Saving model ...
Validation loss decreased (1.306990 --> 1.306324).  Saving model ...
Validation loss decreased (1.306324 --> 1.305642).  Saving model ...
Validation loss decreased (1.305642 --> 1.304965).  Saving model ...
Validation loss decreased (1.304965 --> 1.304309).  Saving model ...
Validation loss decreased (1.304309 --> 1.303696).  Saving model ...
Validation loss decreased (1.303696 --> 1.303082).  Saving model ...
Validation loss decreased (1.303082 --> 1.302433).  Saving model ...
Validation loss decreased (1.302433 --> 1.301823).  Saving model ...
Validation loss decreased (1.301823 --> 1.301214).  Saving model ...
Validation loss decreased (1.301214 --> 1.300610).  Saving model ...
Validation loss decreased (1.300610 --> 1.299942).  Saving model ...
Validation loss decreased (1.299942 --> 1.299360).  Saving model ...
Validation loss decreased (1.299360 --> 1.298689).  Saving model ...
Validation loss decreased (1.298689 --> 1.298006).  Saving model ...
Validation loss decreased (1.298006 --> 1.297418).  Saving model ...
Validation loss decreased (1.297418 --> 1.296861).  Saving model ...
Validation loss decreased (1.296861 --> 1.296215).  Saving model ...
Validation loss decreased (1.296215 --> 1.295513).  Saving model ...
Validation loss decreased (1.295513 --> 1.294818).  Saving model ...
Validation loss decreased (1.294818 --> 1.294170).  Saving model ...
Validation loss decreased (1.294170 --> 1.293529).  Saving model ...
Validation loss decreased (1.293529 --> 1.292888).  Saving model ...
Validation loss decreased (1.292888 --> 1.292313).  Saving model ...
Validation loss decreased (1.292313 --> 1.291772).  Saving model ...
Validation loss decreased (1.291772 --> 1.291236).  Saving model ...
Validation loss decreased (1.291236 --> 1.290645).  Saving model ...
Validation loss decreased (1.290645 --> 1.290072).  Saving model ...
Validation loss decreased (1.290072 --> 1.289464).  Saving model ...
Validation loss decreased (1.289464 --> 1.288852).  Saving model ...
Validation loss decreased (1.288852 --> 1.288267).  Saving model ...
Validation loss decreased (1.288267 --> 1.287691).  Saving model ...
Validation loss decreased (1.287691 --> 1.287099).  Saving model ...
Validation loss decreased (1.287099 --> 1.286494).  Saving model ...
Validation loss decreased (1.286494 --> 1.285832).  Saving model ...
Validation loss decreased (1.285832 --> 1.285189).  Saving model ...
Validation loss decreased (1.285189 --> 1.284482).  Saving model ...
Validation loss decreased (1.284482 --> 1.283805).  Saving model ...
Validation loss decreased (1.283805 --> 1.283314).  Saving model ...
Validation loss decreased (1.283314 --> 1.282750).  Saving model ...
Validation loss decreased (1.282750 --> 1.282129).  Saving model ...
Validation loss decreased (1.282129 --> 1.281575).  Saving model ...
Validation loss decreased (1.281575 --> 1.281055).  Saving model ...
Validation loss decreased (1.281055 --> 1.280371).  Saving model ...
Validation loss decreased (1.280371 --> 1.279783).  Saving model ...
Validation loss decreased (1.279783 --> 1.279288).  Saving model ...
Validation loss decreased (1.279288 --> 1.278682).  Saving model ...
Validation loss decreased (1.278682 --> 1.277980).  Saving model ...
Validation loss decreased (1.277980 --> 1.277175).  Saving model ...
Validation loss decreased (1.277175 --> 1.276504).  Saving model ...
Validation loss decreased (1.276504 --> 1.275876).  Saving model ...
Validation loss decreased (1.275876 --> 1.275214).  Saving model ...
Validation loss decreased (1.275214 --> 1.274529).  Saving model ...
Validation loss decreased (1.274529 --> 1.273908).  Saving model ...
Validation loss decreased (1.273908 --> 1.273242).  Saving model ...
Validation loss decreased (1.273242 --> 1.272651).  Saving model ...
Validation loss decreased (1.272651 --> 1.271997).  Saving model ...
Validation loss decreased (1.271997 --> 1.271342).  Saving model ...
Validation loss decreased (1.271342 --> 1.270669).  Saving model ...
Validation loss decreased (1.270669 --> 1.270080).  Saving model ...
Validation loss decreased (1.270080 --> 1.269488).  Saving model ...
Validation loss decreased (1.269488 --> 1.268653).  Saving model ...
Validation loss decreased (1.268653 --> 1.267930).  Saving model ...
Validation loss decreased (1.267930 --> 1.267255).  Saving model ...
Validation loss decreased (1.267255 --> 1.266748).  Saving model ...
Validation loss decreased (1.266748 --> 1.266161).  Saving model ...
Validation loss decreased (1.266161 --> 1.265458).  Saving model ...
Validation loss decreased (1.265458 --> 1.264706).  Saving model ...
Validation loss decreased (1.264706 --> 1.263793).  Saving model ...
Validation loss decreased (1.263793 --> 1.263127).  Saving model ...
Validation loss decreased (1.263127 --> 1.262675).  Saving model ...
Validation loss decreased (1.262675 --> 1.262187).  Saving model ...
Validation loss decreased (1.262187 --> 1.261633).  Saving model ...
Validation loss decreased (1.261633 --> 1.260943).  Saving model ...
Validation loss decreased (1.260943 --> 1.260240).  Saving model ...
Validation loss decreased (1.260240 --> 1.259633).  Saving model ...
Validation loss decreased (1.259633 --> 1.258962).  Saving model ...
Validation loss decreased (1.258962 --> 1.258366).  Saving model ...
Validation loss decreased (1.258366 --> 1.257725).  Saving model ...
Validation loss decreased (1.257725 --> 1.257136).  Saving model ...
Validation loss decreased (1.257136 --> 1.256492).  Saving model ...
Validation loss decreased (1.256492 --> 1.255916).  Saving model ...
Validation loss decreased (1.255916 --> 1.255258).  Saving model ...
Validation loss decreased (1.255258 --> 1.254634).  Saving model ...
Validation loss decreased (1.254634 --> 1.254108).  Saving model ...
Validation loss decreased (1.254108 --> 1.253574).  Saving model ...
Validation loss decreased (1.253574 --> 1.252983).  Saving model ...
Validation loss decreased (1.252983 --> 1.252380).  Saving model ...
Validation loss decreased (1.252380 --> 1.251807).  Saving model ...
Validation loss decreased (1.251807 --> 1.251187).  Saving model ...
Validation loss decreased (1.251187 --> 1.250689).  Saving model ...
Validation loss decreased (1.250689 --> 1.249933).  Saving model ...
Validation loss decreased (1.249933 --> 1.249405).  Saving model ...
Validation loss decreased (1.249405 --> 1.249023).  Saving model ...
Validation loss decreased (1.249023 --> 1.248524).  Saving model ...
Validation loss decreased (1.248524 --> 1.247842).  Saving model ...
Validation loss decreased (1.247842 --> 1.247130).  Saving model ...
Validation loss decreased (1.247130 --> 1.246542).  Saving model ...
Validation loss decreased (1.246542 --> 1.246051).  Saving model ...
Validation loss decreased (1.246051 --> 1.245358).  Saving model ...
Validation loss decreased (1.245358 --> 1.244846).  Saving model ...
Validation loss decreased (1.244846 --> 1.244336).  Saving model ...
Validation loss decreased (1.244336 --> 1.243741).  Saving model ...
Validation loss decreased (1.243741 --> 1.243197).  Saving model ...
Validation loss decreased (1.243197 --> 1.242706).  Saving model ...
Validation loss decreased (1.242706 --> 1.242247).  Saving model ...
Validation loss decreased (1.242247 --> 1.241669).  Saving model ...
Validation loss decreased (1.241669 --> 1.241069).  Saving model ...
Validation loss decreased (1.241069 --> 1.240397).  Saving model ...
Validation loss decreased (1.240397 --> 1.239954).  Saving model ...
Validation loss decreased (1.239954 --> 1.239293).  Saving model ...
Validation loss decreased (1.239293 --> 1.238667).  Saving model ...
Validation loss decreased (1.238667 --> 1.238122).  Saving model ...
Validation loss decreased (1.238122 --> 1.237499).  Saving model ...
Validation loss decreased (1.237499 --> 1.236937).  Saving model ...
Validation loss decreased (1.236937 --> 1.236328).  Saving model ...
Validation loss decreased (1.236328 --> 1.235730).  Saving model ...
Validation loss decreased (1.235730 --> 1.235075).  Saving model ...
Validation loss decreased (1.235075 --> 1.234628).  Saving model ...
Validation loss decreased (1.234628 --> 1.234134).  Saving model ...
Validation loss decreased (1.234134 --> 1.233572).  Saving model ...
Validation loss decreased (1.233572 --> 1.233089).  Saving model ...
Validation loss decreased (1.233089 --> 1.232695).  Saving model ...
Validation loss decreased (1.232695 --> 1.232135).  Saving model ...
Validation loss decreased (1.232135 --> 1.231469).  Saving model ...
Validation loss decreased (1.231469 --> 1.230960).  Saving model ...
Validation loss decreased (1.230960 --> 1.230458).  Saving model ...
Validation loss decreased (1.230458 --> 1.229812).  Saving model ...
Validation loss decreased (1.229812 --> 1.229216).  Saving model ...
Validation loss decreased (1.229216 --> 1.228688).  Saving model ...
Validation loss decreased (1.228688 --> 1.228153).  Saving model ...
Validation loss decreased (1.228153 --> 1.227624).  Saving model ...
Validation loss decreased (1.227624 --> 1.227045).  Saving model ...
Validation loss decreased (1.227045 --> 1.226437).  Saving model ...
Validation loss decreased (1.226437 --> 1.225946).  Saving model ...
Validation loss decreased (1.225946 --> 1.225651).  Saving model ...
Validation loss decreased (1.225651 --> 1.225179).  Saving model ...
Validation loss decreased (1.225179 --> 1.224658).  Saving model ...
Validation loss decreased (1.224658 --> 1.224143).  Saving model ...
Validation loss decreased (1.224143 --> 1.223658).  Saving model ...
Validation loss decreased (1.223658 --> 1.223154).  Saving model ...
Validation loss decreased (1.223154 --> 1.222463).  Saving model ...
Validation loss decreased (1.222463 --> 1.221855).  Saving model ...
Validation loss decreased (1.221855 --> 1.221628).  Saving model ...
Validation loss decreased (1.221628 --> 1.221164).  Saving model ...
Validation loss decreased (1.221164 --> 1.220634).  Saving model ...
Validation loss decreased (1.220634 --> 1.219945).  Saving model ...
Validation loss decreased (1.219945 --> 1.219372).  Saving model ...
Validation loss decreased (1.219372 --> 1.218771).  Saving model ...
Validation loss decreased (1.218771 --> 1.218248).  Saving model ...
Validation loss decreased (1.218248 --> 1.217797).  Saving model ...
Validation loss decreased (1.217797 --> 1.217391).  Saving model ...
Validation loss decreased (1.217391 --> 1.216864).  Saving model ...
Validation loss decreased (1.216864 --> 1.216254).  Saving model ...
Validation loss decreased (1.216254 --> 1.215883).  Saving model ...
Validation loss decreased (1.215883 --> 1.215378).  Saving model ...
Validation loss decreased (1.215378 --> 1.214878).  Saving model ...
Validation loss decreased (1.214878 --> 1.214605).  Saving model ...
Validation loss decreased (1.214605 --> 1.213992).  Saving model ...
Validation loss decreased (1.213992 --> 1.213573).  Saving model ...
Validation loss decreased (1.213573 --> 1.213161).  Saving model ...
Validation loss decreased (1.213161 --> 1.212603).  Saving model ...
Validation loss decreased (1.212603 --> 1.212062).  Saving model ...
Validation loss decreased (1.212062 --> 1.211703).  Saving model ...
Validation loss decreased (1.211703 --> 1.211147).  Saving model ...
Validation loss decreased (1.211147 --> 1.210558).  Saving model ...
Validation loss decreased (1.210558 --> 1.210025).  Saving model ...
Validation loss decreased (1.210025 --> 1.209430).  Saving model ...
Validation loss decreased (1.209430 --> 1.209172).  Saving model ...
Validation loss decreased (1.209172 --> 1.208783).  Saving model ...
Validation loss decreased (1.208783 --> 1.208381).  Saving model ...
Validation loss decreased (1.208381 --> 1.207857).  Saving model ...
Validation loss decreased (1.207857 --> 1.207528).  Saving model ...
Validation loss decreased (1.207528 --> 1.206950).  Saving model ...
Validation loss decreased (1.206950 --> 1.206548).  Saving model ...
Validation loss decreased (1.206548 --> 1.206112).  Saving model ...
Validation loss decreased (1.206112 --> 1.205600).  Saving model ...
Validation loss decreased (1.205600 --> 1.205317).  Saving model ...
Validation loss decreased (1.205317 --> 1.204897).  Saving model ...
Validation loss decreased (1.204897 --> 1.204537).  Saving model ...
Validation loss decreased (1.204537 --> 1.204110).  Saving model ...
Validation loss decreased (1.204110 --> 1.203802).  Saving model ...
Validation loss decreased (1.203802 --> 1.203598).  Saving model ...
Validation loss decreased (1.203598 --> 1.203184).  Saving model ...
Validation loss decreased (1.203184 --> 1.202803).  Saving model ...
Validation loss decreased (1.202803 --> 1.202302).  Saving model ...
Validation loss decreased (1.202302 --> 1.201855).  Saving model ...
Validation loss decreased (1.201855 --> 1.201348).  Saving model ...
Validation loss decreased (1.201348 --> 1.200452).  Saving model ...
Validation loss decreased (1.200452 --> 1.200010).  Saving model ...
Validation loss decreased (1.200010 --> 1.199771).  Saving model ...
Validation loss decreased (1.199771 --> 1.199239).  Saving model ...
Validation loss decreased (1.199239 --> 1.198745).  Saving model ...
Validation loss decreased (1.198745 --> 1.198059).  Saving model ...
Validation loss decreased (1.198059 --> 1.197644).  Saving model ...
Validation loss decreased (1.197644 --> 1.197181).  Saving model ...
Validation loss decreased (1.197181 --> 1.196900).  Saving model ...
Validation loss decreased (1.196900 --> 1.196657).  Saving model ...
Validation loss decreased (1.196657 --> 1.196241).  Saving model ...
Validation loss decreased (1.196241 --> 1.195694).  Saving model ...
Validation loss decreased (1.195694 --> 1.195231).  Saving model ...
Validation loss decreased (1.195231 --> 1.194866).  Saving model ...
Validation loss decreased (1.194866 --> 1.194509).  Saving model ...
Validation loss decreased (1.194509 --> 1.194069).  Saving model ...
Validation loss decreased (1.194069 --> 1.193561).  Saving model ...
Validation loss decreased (1.193561 --> 1.193222).  Saving model ...
Validation loss decreased (1.193222 --> 1.192814).  Saving model ...
Validation loss decreased (1.192814 --> 1.192192).  Saving model ...
Validation loss decreased (1.192192 --> 1.191995).  Saving model ...
Validation loss decreased (1.191995 --> 1.191547).  Saving model ...
Validation loss decreased (1.191547 --> 1.191044).  Saving model ...
Validation loss decreased (1.191044 --> 1.190807).  Saving model ...
Validation loss decreased (1.190807 --> 1.190236).  Saving model ...
Validation loss decreased (1.190236 --> 1.189982).  Saving model ...
Validation loss decreased (1.189982 --> 1.189471).  Saving model ...
Validation loss decreased (1.189471 --> 1.188930).  Saving model ...
Validation loss decreased (1.188930 --> 1.188394).  Saving model ...
Validation loss decreased (1.188394 --> 1.187907).  Saving model ...
Validation loss decreased (1.187907 --> 1.187402).  Saving model ...
Validation loss decreased (1.187402 --> 1.187146).  Saving model ...
Validation loss decreased (1.187146 --> 1.186700).  Saving model ...
Validation loss decreased (1.186700 --> 1.186180).  Saving model ...
Validation loss decreased (1.186180 --> 1.185804).  Saving model ...
Validation loss decreased (1.185804 --> 1.185482).  Saving model ...
Validation loss decreased (1.185482 --> 1.184981).  Saving model ...
Validation loss decreased (1.184981 --> 1.184674).  Saving model ...
Validation loss decreased (1.184674 --> 1.184409).  Saving model ...
Validation loss decreased (1.184409 --> 1.183980).  Saving model ...
Validation loss decreased (1.183980 --> 1.183465).  Saving model ...
Validation loss decreased (1.183465 --> 1.183122).  Saving model ...
Validation loss decreased (1.183122 --> 1.182950).  Saving model ...
Validation loss decreased (1.182950 --> 1.182660).  Saving model ...
Validation loss decreased (1.182660 --> 1.182231).  Saving model ...
Validation loss decreased (1.182231 --> 1.181839).  Saving model ...
Validation loss decreased (1.181839 --> 1.181208).  Saving model ...
Validation loss decreased (1.181208 --> 1.180683).  Saving model ...
Validation loss decreased (1.180683 --> 1.180190).  Saving model ...
Validation loss decreased (1.180190 --> 1.179879).  Saving model ...
Validation loss decreased (1.179879 --> 1.179702).  Saving model ...
Validation loss decreased (1.179702 --> 1.179325).  Saving model ...
Validation loss decreased (1.179325 --> 1.178983).  Saving model ...
Validation loss decreased (1.178983 --> 1.178599).  Saving model ...
Validation loss decreased (1.178599 --> 1.178124).  Saving model ...
Validation loss decreased (1.178124 --> 1.177605).  Saving model ...
Validation loss decreased (1.177605 --> 1.177416).  Saving model ...
Validation loss decreased (1.177416 --> 1.177209).  Saving model ...
Validation loss decreased (1.177209 --> 1.176835).  Saving model ...
Validation loss decreased (1.176835 --> 1.176655).  Saving model ...
Validation loss decreased (1.176655 --> 1.176334).  Saving model ...
Validation loss decreased (1.176334 --> 1.175990).  Saving model ...
Validation loss decreased (1.175990 --> 1.175721).  Saving model ...
Validation loss decreased (1.175721 --> 1.175334).  Saving model ...
Validation loss decreased (1.175334 --> 1.175121).  Saving model ...
Validation loss decreased (1.175121 --> 1.174550).  Saving model ...
Validation loss decreased (1.174550 --> 1.174155).  Saving model ...
Validation loss decreased (1.174155 --> 1.173728).  Saving model ...
Validation loss decreased (1.173728 --> 1.173471).  Saving model ...
Validation loss decreased (1.173471 --> 1.173057).  Saving model ...
Validation loss decreased (1.173057 --> 1.172697).  Saving model ...
Validation loss decreased (1.172697 --> 1.172339).  Saving model ...
Validation loss decreased (1.172339 --> 1.171982).  Saving model ...
Validation loss decreased (1.171982 --> 1.171324).  Saving model ...
Validation loss decreased (1.171324 --> 1.171114).  Saving model ...
Validation loss decreased (1.171114 --> 1.170757).  Saving model ...
Validation loss decreased (1.170757 --> 1.170508).  Saving model ...
Validation loss decreased (1.170508 --> 1.170236).  Saving model ...
Validation loss decreased (1.170236 --> 1.169702).  Saving model ...
Validation loss decreased (1.169702 --> 1.169375).  Saving model ...
Validation loss decreased (1.169375 --> 1.168871).  Saving model ...
Validation loss decreased (1.168871 --> 1.168370).  Saving model ...
Validation loss decreased (1.168370 --> 1.167985).  Saving model ...
Validation loss decreased (1.167985 --> 1.167687).  Saving model ...
Validation loss decreased (1.167687 --> 1.167097).  Saving model ...
Validation loss decreased (1.167097 --> 1.166816).  Saving model ...
Validation loss decreased (1.166816 --> 1.166483).  Saving model ...
Validation loss decreased (1.166483 --> 1.166142).  Saving model ...
Validation loss decreased (1.166142 --> 1.165456).  Saving model ...
Validation loss decreased (1.165456 --> 1.164939).  Saving model ...
Validation loss decreased (1.164939 --> 1.164538).  Saving model ...
Validation loss decreased (1.164538 --> 1.164142).  Saving model ...
Validation loss decreased (1.164142 --> 1.163744).  Saving model ...
Validation loss decreased (1.163744 --> 1.163229).  Saving model ...
Validation loss decreased (1.163229 --> 1.162741).  Saving model ...
Validation loss decreased (1.162741 --> 1.162088).  Saving model ...
Validation loss decreased (1.162088 --> 1.161641).  Saving model ...
Validation loss decreased (1.161641 --> 1.161476).  Saving model ...
Validation loss decreased (1.161476 --> 1.161217).  Saving model ...
Validation loss decreased (1.161217 --> 1.161130).  Saving model ...
Validation loss decreased (1.161130 --> 1.160747).  Saving model ...
Validation loss decreased (1.160747 --> 1.160455).  Saving model ...
Validation loss decreased (1.160455 --> 1.159983).  Saving model ...
Validation loss decreased (1.159983 --> 1.159596).  Saving model ...
Validation loss decreased (1.159596 --> 1.159329).  Saving model ...
Validation loss decreased (1.159329 --> 1.158876).  Saving model ...
Validation loss decreased (1.158876 --> 1.158428).  Saving model ...
Validation loss decreased (1.158428 --> 1.157950).  Saving model ...
Validation loss decreased (1.157950 --> 1.157511).  Saving model ...
Validation loss decreased (1.157511 --> 1.157286).  Saving model ...
Validation loss decreased (1.157286 --> 1.156975).  Saving model ...
Validation loss decreased (1.156975 --> 1.156875).  Saving model ...
Validation loss decreased (1.156875 --> 1.156373).  Saving model ...
Validation loss decreased (1.156373 --> 1.155795).  Saving model ...
Validation loss decreased (1.155795 --> 1.155393).  Saving model ...
Validation loss decreased (1.155393 --> 1.154842).  Saving model ...
Validation loss decreased (1.154842 --> 1.154516).  Saving model ...
Validation loss decreased (1.154516 --> 1.154317).  Saving model ...
Validation loss decreased (1.154317 --> 1.153879).  Saving model ...
Validation loss decreased (1.153879 --> 1.153515).  Saving model ...
Validation loss decreased (1.153515 --> 1.153091).  Saving model ...
Validation loss decreased (1.153091 --> 1.152736).  Saving model ...
Validation loss decreased (1.152736 --> 1.152267).  Saving model ...
Validation loss decreased (1.152267 --> 1.151910).  Saving model ...
Validation loss decreased (1.151910 --> 1.151558).  Saving model ...
Validation loss decreased (1.151558 --> 1.151405).  Saving model ...
Validation loss decreased (1.151405 --> 1.151043).  Saving model ...
Validation loss decreased (1.151043 --> 1.150744).  Saving model ...
Validation loss decreased (1.150744 --> 1.150379).  Saving model ...
Validation loss decreased (1.150379 --> 1.149986).  Saving model ...
Validation loss decreased (1.149986 --> 1.149634).  Saving model ...
Validation loss decreased (1.149634 --> 1.149292).  Saving model ...
Validation loss decreased (1.149292 --> 1.149034).  Saving model ...
Validation loss decreased (1.149034 --> 1.148651).  Saving model ...
Validation loss decreased (1.148651 --> 1.148044).  Saving model ...
Validation loss decreased (1.148044 --> 1.147595).  Saving model ...
Validation loss decreased (1.147595 --> 1.147268).  Saving model ...
Validation loss decreased (1.147268 --> 1.146883).  Saving model ...
Validation loss decreased (1.146883 --> 1.146621).  Saving model ...
Validation loss decreased (1.146621 --> 1.146315).  Saving model ...
Validation loss decreased (1.146315 --> 1.146083).  Saving model ...
Validation loss decreased (1.146083 --> 1.145874).  Saving model ...
Validation loss decreased (1.145874 --> 1.145434).  Saving model ...
Validation loss decreased (1.145434 --> 1.145056).  Saving model ...
EarlyStopping counter: 1 out of 15.0
Validation loss decreased (1.145056 --> 1.144661).  Saving model ...
Validation loss decreased (1.144661 --> 1.144233).  Saving model ...
Validation loss decreased (1.144233 --> 1.143727).  Saving model ...
Validation loss decreased (1.143727 --> 1.143332).  Saving model ...
/localscratch/yinan.28698625.0/env/lib/python3.7/site-packages/torch/nn/functional.py:1794: UserWarning: nn.functional.tanh is deprecated. Use torch.tanh instead.
  warnings.warn("nn.functional.tanh is deprecated. Use torch.tanh instead.")
/localscratch/yinan.28698625.0/env/lib/python3.7/site-packages/transformers/optimization.py:155: UserWarning: This overload of add_ is deprecated:
	add_(Number alpha, Tensor other)
Consider using one of the following signatures instead:
	add_(Tensor other, *, Number alpha) (Triggered internally at  ../torch/csrc/utils/python_arg_parser.cpp:1025.)
  exp_avg.mul_(beta1).add_(1.0 - beta1, grad)
wandb: Waiting for W&B process to finish, PID 256571... (success).
wandb: - 0.00MB of 0.00MB uploaded (0.00MB deduped)wandb: \ 0.00MB of 0.00MB uploaded (0.00MB deduped)wandb: | 0.00MB of 0.00MB uploaded (0.00MB deduped)wandb: / 0.00MB of 0.00MB uploaded (0.00MB deduped)wandb: - 0.00MB of 0.00MB uploaded (0.00MB deduped)wandb: \ 0.00MB of 0.00MB uploaded (0.00MB deduped)wandb: | 0.00MB of 0.00MB uploaded (0.00MB deduped)wandb: / 0.00MB of 0.00MB uploaded (0.00MB deduped)wandb: - 0.00MB of 0.00MB uploaded (0.00MB deduped)wandb: \ 0.00MB of 0.00MB uploaded (0.00MB deduped)wandb: | 0.00MB of 0.00MB uploaded (0.00MB deduped)wandb: / 0.00MB of 0.00MB uploaded (0.00MB deduped)wandb: - 0.00MB of 0.00MB uploaded (0.00MB deduped)wandb: \ 0.00MB of 0.00MB uploaded (0.00MB deduped)wandb:                                                                                
wandb: Run history:
wandb:     e_F1 ▁▁▂▂▂▃▄▅▅▅▅▆▆▆▆▆▆▇▇▇▇▇▇▇▇▇▇▇▇▇██████████
wandb:   e_loss █▇▇▇▆▆▆▆▅▅▅▅▅▅▄▄▄▄▄▄▃▃▃▃▃▃▂▂▂▂▂▂▂▂▁▁▁▁▁▁
wandb:     t_F1 ▁▁▂▃▃▃▃▃▃▃▄▅▄▄▄▄▆▅▆▆▅▆▆▆▆▇▇▇▆▆█▇██▇▇▇█▇█
wandb:   t_loss ██▇▇▇▆▆▆▆▆▆▅▅▆▅▅▄▄▄▄▄▄▄▄▃▃▃▃▃▃▂▂▂▂▂▂▂▁▁▁
wandb: 
wandb: Run summary:
wandb:     e_F1 48.72008
wandb:   e_loss 1.14333
wandb:     t_F1 53.62107
wandb:   t_loss 1.07072
wandb: 
wandb: Synced 4 W&B file(s), 0 media file(s), 0 artifact file(s) and 0 other file(s)
wandb: Synced fiery-flower-1: https://wandb.ai/yinanazhou/xl_512_bs_8_lr_1e07_es_15_lc_True_nr_False_sr_True_stem_False_lemma_False_repeat_1_fold_1/runs/16txcegf
wandb: Find logs at: ./wandb/run-20220311_040938-16txcegf/logs/debug.log
wandb: 

wandb: wandb version 0.12.11 is available!  To upgrade, please run:
wandb:  $ pip install wandb --upgrade
2022-03-11 09:41:06.055216: I tensorflow/stream_executor/platform/default/dso_loader.cc:48] Successfully opened dynamic library libcudart.so.10.1
wandb: Tracking run with wandb version 0.12.5
wandb: Syncing run prime-silence-1
wandb: ⭐️ View project at https://wandb.ai/yinanazhou/xl_512_bs_8_lr_1e07_es_15_lc_True_nr_False_sr_True_stem_False_lemma_False_repeat_1_fold_2
wandb: 🚀 View run at https://wandb.ai/yinanazhou/xl_512_bs_8_lr_1e07_es_15_lc_True_nr_False_sr_True_stem_False_lemma_False_repeat_1_fold_2/runs/5cgphokn
wandb: Run data is saved locally in /project/6002780/yinan/Thesis_MER_Lyrics/lyric-emotion/wandb/run-20220311_094102-5cgphokn
wandb: Run `wandb offline` to turn off syncing.
slurmstepd: error: *** JOB 28698625 ON cdr2628 CANCELLED AT 2022-03-11T14:05:30 DUE TO TIME LIMIT ***
