Unloading StdEnv/2020

Due to MODULEPATH changes, the following have been reloaded:
  1) mii/1.1.1


The following have been reloaded with a version change:
  1) python/3.8.2 => python/3.7.4

Using base prefix '/cvmfs/soft.computecanada.ca/easybuild/software/2017/Core/python/3.7.4'
New python executable in /localscratch/yinan.28698715.0/env/bin/python
Installing setuptools, pip, wheel...
done.
Ignoring pip: markers 'python_version < "3"' don't match your environment
Looking in links: /cvmfs/soft.computecanada.ca/custom/python/wheelhouse/nix/avx2, /cvmfs/soft.computecanada.ca/custom/python/wheelhouse/nix/generic, /cvmfs/soft.computecanada.ca/custom/python/wheelhouse/generic
Collecting pip
Installing collected packages: pip
  Found existing installation: pip 19.1.1
    Uninstalling pip-19.1.1:
      Successfully uninstalled pip-19.1.1
Successfully installed pip-21.2.3+computecanada
Looking in links: /cvmfs/soft.computecanada.ca/custom/python/wheelhouse/nix/avx2, /cvmfs/soft.computecanada.ca/custom/python/wheelhouse/nix/generic, /cvmfs/soft.computecanada.ca/custom/python/wheelhouse/generic
Processing /cvmfs/soft.computecanada.ca/custom/python/wheelhouse/generic/keras-2.8.0+computecanada-py2.py3-none-any.whl
Processing /cvmfs/soft.computecanada.ca/custom/python/wheelhouse/generic/Keras_Preprocessing-1.1.2+computecanada-py3-none-any.whl
Requirement already satisfied: matplotlib in /cvmfs/soft.computecanada.ca/easybuild/software/2017/Core/scipy-stack/2019a/lib/python3.7/site-packages (from -r requirements.txt (line 3)) (3.0.2)
Processing /cvmfs/soft.computecanada.ca/custom/python/wheelhouse/generic/nltk-3.6.5+computecanada-py3-none-any.whl
Processing /cvmfs/soft.computecanada.ca/custom/python/wheelhouse/generic/scikit_learn-0.22.1+computecanada-cp37-cp37m-linux_x86_64.whl
Processing /cvmfs/soft.computecanada.ca/custom/python/wheelhouse/generic/tensorboard-2.3.0+computecanada-py3-none-any.whl
Processing /cvmfs/soft.computecanada.ca/custom/python/wheelhouse/generic/tensorboard_plugin_wit-1.7.0+computecanada-py3-none-any.whl
Processing /cvmfs/soft.computecanada.ca/custom/python/wheelhouse/generic/tensorflow_gpu-2.3.0+computecanada-cp37-cp37m-linux_x86_64.whl
Processing /cvmfs/soft.computecanada.ca/custom/python/wheelhouse/generic/tensorflow_estimator-2.3.0+computecanada-py2.py3-none-any.whl
Processing /cvmfs/soft.computecanada.ca/custom/python/wheelhouse/generic/tokenizers-0.5.2+computecanada-cp37-cp37m-linux_x86_64.whl
Processing /cvmfs/soft.computecanada.ca/custom/python/wheelhouse/nix/avx2/torch-1.4.0+computecanada-cp37-cp37m-linux_x86_64.whl
Processing /cvmfs/soft.computecanada.ca/custom/python/wheelhouse/generic/torchtext-0.6.0+computecanada-py3-none-any.whl
Processing /cvmfs/soft.computecanada.ca/custom/python/wheelhouse/generic/torchvision-0.8.2+computecanada-cp37-cp37m-linux_x86_64.whl
Processing /cvmfs/soft.computecanada.ca/custom/python/wheelhouse/generic/transformers-2.5.1+computecanada-py3-none-any.whl
Processing /cvmfs/soft.computecanada.ca/custom/python/wheelhouse/generic/urllib3-1.26.7+computecanada-py2.py3-none-any.whl
Processing /cvmfs/soft.computecanada.ca/custom/python/wheelhouse/generic/joblib-1.1.0+computecanada-py2.py3-none-any.whl
ERROR: Could not find a version that satisfies the requirement regex>=2021.8.3 (from nltk) (from versions: 2018.1.10+computecanada, 2019.11.1+computecanada, 2020.11.13+computecanada)
ERROR: No matching distribution found for regex>=2021.8.3
Looking in links: /cvmfs/soft.computecanada.ca/custom/python/wheelhouse/nix/avx2, /cvmfs/soft.computecanada.ca/custom/python/wheelhouse/nix/generic, /cvmfs/soft.computecanada.ca/custom/python/wheelhouse/generic
ERROR: Could not find a version that satisfies the requirement numpy==1.20.0+computacanada (from versions: 1.15.0+computecanada, 1.15.2+computecanada, 1.15.4+computecanada, 1.16.0+computecanada, 1.16.2+computecanada, 1.16.3+computecanada, 1.17.4+computecanada, 1.18.1+computecanada, 1.18.4+computecanada, 1.19.1+computecanada, 1.19.2+computecanada, 1.20.2+computecanada)
ERROR: No matching distribution found for numpy==1.20.0+computacanada
Looking in links: /cvmfs/soft.computecanada.ca/custom/python/wheelhouse/nix/avx2, /cvmfs/soft.computecanada.ca/custom/python/wheelhouse/nix/generic, /cvmfs/soft.computecanada.ca/custom/python/wheelhouse/generic
Processing /cvmfs/soft.computecanada.ca/custom/python/wheelhouse/generic/wandb-0.12.5+computecanada-py2.py3-none-any.whl
Requirement already satisfied: requests<3,>=2.0.0 in /cvmfs/soft.computecanada.ca/easybuild/software/2017/Core/scipy-stack/2019a/lib/python3.7/site-packages (from wandb) (2.21.0)
Processing /cvmfs/soft.computecanada.ca/custom/python/wheelhouse/generic/GitPython-3.1.24+computecanada-py3-none-any.whl
Requirement already satisfied: python-dateutil>=2.6.1 in /cvmfs/soft.computecanada.ca/easybuild/software/2017/Core/scipy-stack/2019a/lib/python3.7/site-packages (from wandb) (2.7.5)
Processing /cvmfs/soft.computecanada.ca/custom/python/wheelhouse/generic/sentry_sdk-1.5.0+computecanada-py2.py3-none-any.whl
Processing /cvmfs/soft.computecanada.ca/custom/python/wheelhouse/generic/psutil-5.7.3+computecanada-cp37-cp37m-linux_x86_64.whl
Processing /cvmfs/soft.computecanada.ca/custom/python/wheelhouse/generic/promise-2.3+computecanada-py3-none-any.whl
Processing /cvmfs/soft.computecanada.ca/custom/python/wheelhouse/generic/shortuuid-1.0.1+computecanada-py3-none-any.whl
Processing /cvmfs/soft.computecanada.ca/custom/python/wheelhouse/generic/yaspin-2.1.0+computecanada-py3-none-any.whl
Processing /cvmfs/soft.computecanada.ca/custom/python/wheelhouse/generic/PyYAML-5.3.1+computecanada-cp37-cp37m-linux_x86_64.whl
Processing /cvmfs/soft.computecanada.ca/custom/python/wheelhouse/generic/docker_pycreds-0.4.0+computecanada-py2.py3-none-any.whl
Processing /cvmfs/soft.computecanada.ca/custom/python/wheelhouse/generic/configparser-5.0.2+computecanada-py3-none-any.whl
Processing /cvmfs/soft.computecanada.ca/custom/python/wheelhouse/generic/click-8.0.3+computecanada-py3-none-any.whl
Processing /cvmfs/soft.computecanada.ca/custom/python/wheelhouse/generic/protobuf-3.19.4+computecanada-py2.py3-none-any.whl
Processing /cvmfs/soft.computecanada.ca/custom/python/wheelhouse/generic/subprocess32-3.5.4+computecanada-py3-none-any.whl
Processing /cvmfs/soft.computecanada.ca/custom/python/wheelhouse/generic/pathtools-0.1.2+computecanada-py3-none-any.whl
Processing /cvmfs/soft.computecanada.ca/custom/python/wheelhouse/generic/six-1.16.0+computecanada-py2.py3-none-any.whl
Requirement already satisfied: importlib-metadata in /cvmfs/soft.computecanada.ca/easybuild/software/2017/Core/scipy-stack/2019a/lib/python3.7/site-packages (from Click!=8.0.0,>=7.0->wandb) (0.8)
Processing /cvmfs/soft.computecanada.ca/custom/python/wheelhouse/generic/typing_extensions-4.0.1+computecanada-py3-none-any.whl
Processing /cvmfs/soft.computecanada.ca/custom/python/wheelhouse/generic/gitdb-4.0.9+computecanada-py3-none-any.whl
Processing /cvmfs/soft.computecanada.ca/custom/python/wheelhouse/generic/smmap-5.0.0+computecanada-py3-none-any.whl
Requirement already satisfied: urllib3<1.25,>=1.21.1 in /cvmfs/soft.computecanada.ca/easybuild/software/2017/Core/scipy-stack/2019a/lib/python3.7/site-packages (from requests<3,>=2.0.0->wandb) (1.24.1)
Requirement already satisfied: certifi>=2017.4.17 in /cvmfs/soft.computecanada.ca/easybuild/software/2017/Core/scipy-stack/2019a/lib/python3.7/site-packages (from requests<3,>=2.0.0->wandb) (2018.11.29)
Requirement already satisfied: chardet<3.1.0,>=3.0.2 in /cvmfs/soft.computecanada.ca/easybuild/software/2017/Core/scipy-stack/2019a/lib/python3.7/site-packages (from requests<3,>=2.0.0->wandb) (3.0.4)
Requirement already satisfied: idna<2.9,>=2.5 in /cvmfs/soft.computecanada.ca/easybuild/software/2017/Core/scipy-stack/2019a/lib/python3.7/site-packages (from requests<3,>=2.0.0->wandb) (2.8)
Processing /cvmfs/soft.computecanada.ca/custom/python/wheelhouse/generic/termcolor-1.1.0+computecanada-py3-none-any.whl
Requirement already satisfied: zipp>=0.3.2 in /cvmfs/soft.computecanada.ca/easybuild/software/2017/Core/scipy-stack/2019a/lib/python3.7/site-packages (from importlib-metadata->Click!=8.0.0,>=7.0->wandb) (0.3.3)
Installing collected packages: smmap, typing-extensions, termcolor, six, gitdb, yaspin, subprocess32, shortuuid, sentry-sdk, PyYAML, psutil, protobuf, promise, pathtools, GitPython, docker-pycreds, configparser, Click, wandb
  Attempting uninstall: six
    Found existing installation: six 1.12.0
    Not uninstalling six at /cvmfs/soft.computecanada.ca/easybuild/software/2017/Core/scipy-stack/2019a/lib/python3.7/site-packages, outside environment /localscratch/yinan.28698715.0/env
    Can't uninstall 'six'. No files were found to uninstall.
Successfully installed Click-8.0.3+computecanada GitPython-3.1.24+computecanada PyYAML-5.3.1+computecanada configparser-5.0.2+computecanada docker-pycreds-0.4.0+computecanada gitdb-4.0.9+computecanada pathtools-0.1.2+computecanada promise-2.3+computecanada protobuf-3.19.4+computecanada psutil-5.7.3+computecanada sentry-sdk-1.5.0+computecanada shortuuid-1.0.1+computecanada six-1.16.0+computecanada smmap-5.0.0+computecanada subprocess32-3.5.4+computecanada termcolor-1.1.0+computecanada typing-extensions-4.0.1+computecanada wandb-0.12.5+computecanada yaspin-2.1.0+computecanada
Looking in links: /cvmfs/soft.computecanada.ca/custom/python/wheelhouse/nix/avx2, /cvmfs/soft.computecanada.ca/custom/python/wheelhouse/nix/generic, /cvmfs/soft.computecanada.ca/custom/python/wheelhouse/generic
ERROR: Could not find a version that satisfies the requirement sagemaker (from versions: none)
ERROR: No matching distribution found for sagemaker
Looking in links: /cvmfs/soft.computecanada.ca/custom/python/wheelhouse/nix/avx2, /cvmfs/soft.computecanada.ca/custom/python/wheelhouse/nix/generic, /cvmfs/soft.computecanada.ca/custom/python/wheelhouse/generic
Processing /cvmfs/soft.computecanada.ca/custom/python/wheelhouse/generic/torch-1.9.1+computecanada-cp37-cp37m-linux_x86_64.whl
Requirement already satisfied: typing-extensions in /localscratch/yinan.28698715.0/env/lib/python3.7/site-packages (from torch) (4.0.1+computecanada)
Installing collected packages: torch
Successfully installed torch-1.9.1+computecanada
Looking in links: /cvmfs/soft.computecanada.ca/custom/python/wheelhouse/nix/avx2, /cvmfs/soft.computecanada.ca/custom/python/wheelhouse/nix/generic, /cvmfs/soft.computecanada.ca/custom/python/wheelhouse/generic
Processing /cvmfs/soft.computecanada.ca/custom/python/wheelhouse/generic/transformers-2.5.1+computecanada-py3-none-any.whl
Processing /cvmfs/soft.computecanada.ca/custom/python/wheelhouse/generic/tqdm-4.63.0+computecanada-py2.py3-none-any.whl
Processing /cvmfs/soft.computecanada.ca/custom/python/wheelhouse/generic/boto3-1.20.52+computecanada-py3-none-any.whl
Processing /cvmfs/soft.computecanada.ca/custom/python/wheelhouse/generic/filelock-3.4.2+computecanada-py3-none-any.whl
Processing /cvmfs/soft.computecanada.ca/custom/python/wheelhouse/generic/sacremoses-0.0.46+computecanada-py3-none-any.whl
Processing /cvmfs/soft.computecanada.ca/custom/python/wheelhouse/generic/regex-2020.11.13+computecanada-cp37-cp37m-linux_x86_64.whl
Processing /cvmfs/soft.computecanada.ca/custom/python/wheelhouse/generic/sentencepiece-0.1.91+computecanada-cp37-cp37m-linux_x86_64.whl
Requirement already satisfied: numpy in /cvmfs/soft.computecanada.ca/easybuild/software/2017/Core/scipy-stack/2019a/lib/python3.7/site-packages (from transformers==2.5.1+computecanada) (1.16.0)
Processing /cvmfs/soft.computecanada.ca/custom/python/wheelhouse/generic/tokenizers-0.5.2+computecanada-cp37-cp37m-linux_x86_64.whl
Requirement already satisfied: requests in /cvmfs/soft.computecanada.ca/easybuild/software/2017/Core/scipy-stack/2019a/lib/python3.7/site-packages (from transformers==2.5.1+computecanada) (2.21.0)
Processing /cvmfs/soft.computecanada.ca/custom/python/wheelhouse/generic/botocore-1.23.52+computecanada-py3-none-any.whl
Processing /cvmfs/soft.computecanada.ca/custom/python/wheelhouse/generic/jmespath-0.10.0+computecanada-py2.py3-none-any.whl
Processing /cvmfs/soft.computecanada.ca/custom/python/wheelhouse/generic/s3transfer-0.5.1+computecanada-py3-none-any.whl
Requirement already satisfied: python-dateutil<3.0.0,>=2.1 in /cvmfs/soft.computecanada.ca/easybuild/software/2017/Core/scipy-stack/2019a/lib/python3.7/site-packages (from botocore<1.24.0,>=1.23.52->boto3->transformers==2.5.1+computecanada) (2.7.5)
Processing /cvmfs/soft.computecanada.ca/custom/python/wheelhouse/generic/urllib3-1.26.8+computecanada-py2.py3-none-any.whl
Requirement already satisfied: six>=1.5 in /localscratch/yinan.28698715.0/env/lib/python3.7/site-packages (from python-dateutil<3.0.0,>=2.1->botocore<1.24.0,>=1.23.52->boto3->transformers==2.5.1+computecanada) (1.16.0+computecanada)
Requirement already satisfied: idna<2.9,>=2.5 in /cvmfs/soft.computecanada.ca/easybuild/software/2017/Core/scipy-stack/2019a/lib/python3.7/site-packages (from requests->transformers==2.5.1+computecanada) (2.8)
Requirement already satisfied: certifi>=2017.4.17 in /cvmfs/soft.computecanada.ca/easybuild/software/2017/Core/scipy-stack/2019a/lib/python3.7/site-packages (from requests->transformers==2.5.1+computecanada) (2018.11.29)
Requirement already satisfied: chardet<3.1.0,>=3.0.2 in /cvmfs/soft.computecanada.ca/easybuild/software/2017/Core/scipy-stack/2019a/lib/python3.7/site-packages (from requests->transformers==2.5.1+computecanada) (3.0.4)
Processing /cvmfs/soft.computecanada.ca/custom/python/wheelhouse/generic/requests-2.27.1+computecanada-py2.py3-none-any.whl
Processing /cvmfs/soft.computecanada.ca/custom/python/wheelhouse/generic/charset_normalizer-2.0.11+computecanada-py3-none-any.whl
Requirement already satisfied: click in /localscratch/yinan.28698715.0/env/lib/python3.7/site-packages (from sacremoses->transformers==2.5.1+computecanada) (8.0.3+computecanada)
Processing /cvmfs/soft.computecanada.ca/custom/python/wheelhouse/generic/joblib-1.1.0+computecanada-py2.py3-none-any.whl
Requirement already satisfied: importlib-metadata in /cvmfs/soft.computecanada.ca/easybuild/software/2017/Core/scipy-stack/2019a/lib/python3.7/site-packages (from click->sacremoses->transformers==2.5.1+computecanada) (0.8)
Requirement already satisfied: zipp>=0.3.2 in /cvmfs/soft.computecanada.ca/easybuild/software/2017/Core/scipy-stack/2019a/lib/python3.7/site-packages (from importlib-metadata->click->sacremoses->transformers==2.5.1+computecanada) (0.3.3)
Installing collected packages: urllib3, jmespath, botocore, tqdm, s3transfer, regex, joblib, charset-normalizer, tokenizers, sentencepiece, sacremoses, requests, filelock, boto3, transformers
  Attempting uninstall: urllib3
    Found existing installation: urllib3 1.24.1
    Not uninstalling urllib3 at /cvmfs/soft.computecanada.ca/easybuild/software/2017/Core/scipy-stack/2019a/lib/python3.7/site-packages, outside environment /localscratch/yinan.28698715.0/env
    Can't uninstall 'urllib3'. No files were found to uninstall.
  Attempting uninstall: requests
    Found existing installation: requests 2.21.0
    Not uninstalling requests at /cvmfs/soft.computecanada.ca/easybuild/software/2017/Core/scipy-stack/2019a/lib/python3.7/site-packages, outside environment /localscratch/yinan.28698715.0/env
    Can't uninstall 'requests'. No files were found to uninstall.
Successfully installed boto3-1.20.52+computecanada botocore-1.23.52+computecanada charset-normalizer-2.0.11+computecanada filelock-3.4.2+computecanada jmespath-0.10.0+computecanada joblib-1.1.0+computecanada regex-2020.11.13+computecanada requests-2.27.1+computecanada s3transfer-0.5.1+computecanada sacremoses-0.0.46+computecanada sentencepiece-0.1.91+computecanada tokenizers-0.5.2+computecanada tqdm-4.63.0+computecanada transformers-2.5.1+computecanada urllib3-1.26.8+computecanada
Looking in links: /cvmfs/soft.computecanada.ca/custom/python/wheelhouse/nix/avx2, /cvmfs/soft.computecanada.ca/custom/python/wheelhouse/nix/generic, /cvmfs/soft.computecanada.ca/custom/python/wheelhouse/generic
Processing /cvmfs/soft.computecanada.ca/custom/python/wheelhouse/generic/tensorflow_gpu-2.3.0+computecanada-cp37-cp37m-linux_x86_64.whl
Processing /cvmfs/soft.computecanada.ca/custom/python/wheelhouse/nix/generic/scipy-1.4.1+computecanada-cp37-cp37m-linux_x86_64.whl
Processing /cvmfs/soft.computecanada.ca/custom/python/wheelhouse/generic/gast-0.3.3+computecanada-py3-none-any.whl
Requirement already satisfied: wheel>=0.26 in /localscratch/yinan.28698715.0/env/lib/python3.7/site-packages (from tensorflow_gpu==2.3.0+computecanada) (0.33.4)
Requirement already satisfied: protobuf>=3.9.2 in /localscratch/yinan.28698715.0/env/lib/python3.7/site-packages (from tensorflow_gpu==2.3.0+computecanada) (3.19.4+computecanada)
Processing /cvmfs/soft.computecanada.ca/custom/python/wheelhouse/generic/astunparse-1.6.3+computecanada-py2.py3-none-any.whl
Requirement already satisfied: six>=1.12.0 in /localscratch/yinan.28698715.0/env/lib/python3.7/site-packages (from tensorflow_gpu==2.3.0+computecanada) (1.16.0+computecanada)
Processing /cvmfs/soft.computecanada.ca/custom/python/wheelhouse/generic/absl_py-1.0.0+computecanada-py3-none-any.whl
Requirement already satisfied: numpy<1.19.0,>=1.16.0 in /cvmfs/soft.computecanada.ca/easybuild/software/2017/Core/scipy-stack/2019a/lib/python3.7/site-packages (from tensorflow_gpu==2.3.0+computecanada) (1.16.0)
Processing /cvmfs/soft.computecanada.ca/custom/python/wheelhouse/generic/tensorboard-2.8.0+computecanada-py3-none-any.whl
Processing /cvmfs/soft.computecanada.ca/custom/python/wheelhouse/generic/wrapt-1.11.2+computecanada-cp37-cp37m-linux_x86_64.whl
Processing /cvmfs/soft.computecanada.ca/custom/python/wheelhouse/generic/opt_einsum-3.3.0+computecanada-py3-none-any.whl
Processing /cvmfs/soft.computecanada.ca/custom/python/wheelhouse/generic/grpcio-1.38.0+computecanada-cp37-cp37m-linux_x86_64.whl
Processing /cvmfs/soft.computecanada.ca/custom/python/wheelhouse/generic/tensorflow_estimator-2.3.0+computecanada-py2.py3-none-any.whl
Processing /cvmfs/soft.computecanada.ca/custom/python/wheelhouse/generic/Keras_Preprocessing-1.1.2+computecanada-py3-none-any.whl
Processing /cvmfs/soft.computecanada.ca/custom/python/wheelhouse/generic/google_pasta-0.2.0+computecanada-py3-none-any.whl
Processing /cvmfs/soft.computecanada.ca/custom/python/wheelhouse/nix/avx2/h5py-2.10.0+computecanada-cp37-cp37m-linux_x86_64.whl
Requirement already satisfied: termcolor>=1.1.0 in /localscratch/yinan.28698715.0/env/lib/python3.7/site-packages (from tensorflow_gpu==2.3.0+computecanada) (1.1.0+computecanada)
Processing /cvmfs/soft.computecanada.ca/custom/python/wheelhouse/generic/google_auth-2.3.3+computecanada-py2.py3-none-any.whl
Requirement already satisfied: setuptools>=41.0.0 in /localscratch/yinan.28698715.0/env/lib/python3.7/site-packages (from tensorboard<3,>=2.3.0->tensorflow_gpu==2.3.0+computecanada) (41.0.1)
Processing /cvmfs/soft.computecanada.ca/custom/python/wheelhouse/generic/Werkzeug-2.0.3+computecanada-py3-none-any.whl
Processing /cvmfs/soft.computecanada.ca/custom/python/wheelhouse/generic/Markdown-3.3.6+computecanada-py3-none-any.whl
Requirement already satisfied: requests<3,>=2.21.0 in /localscratch/yinan.28698715.0/env/lib/python3.7/site-packages (from tensorboard<3,>=2.3.0->tensorflow_gpu==2.3.0+computecanada) (2.27.1+computecanada)
Processing /cvmfs/soft.computecanada.ca/custom/python/wheelhouse/generic/tensorboard_data_server-0.6.1+computecanada-py3-none-linux_x86_64.whl
Processing /cvmfs/soft.computecanada.ca/custom/python/wheelhouse/generic/google_auth_oauthlib-0.4.6+computecanada-py2.py3-none-any.whl
Processing /cvmfs/soft.computecanada.ca/custom/python/wheelhouse/generic/tensorboard_plugin_wit-1.8.0+computecanada-py3-none-any.whl
Processing /cvmfs/soft.computecanada.ca/custom/python/wheelhouse/generic/pyasn1_modules-0.2.8+computecanada-py2.py3-none-any.whl
Processing /cvmfs/soft.computecanada.ca/custom/python/wheelhouse/generic/rsa-4.8+computecanada-py3-none-any.whl
Processing /cvmfs/soft.computecanada.ca/custom/python/wheelhouse/generic/cachetools-4.2.4+computecanada-py3-none-any.whl
Processing /cvmfs/soft.computecanada.ca/custom/python/wheelhouse/generic/requests_oauthlib-1.3.0+computecanada-py2.py3-none-any.whl
Processing /cvmfs/soft.computecanada.ca/custom/python/wheelhouse/generic/importlib_metadata-4.10.1+computecanada-py3-none-any.whl
Processing /cvmfs/soft.computecanada.ca/custom/python/wheelhouse/generic/zipp-3.7.0+computecanada-py3-none-any.whl
Requirement already satisfied: typing-extensions>=3.6.4 in /localscratch/yinan.28698715.0/env/lib/python3.7/site-packages (from importlib-metadata>=4.4->markdown>=2.6.8->tensorboard<3,>=2.3.0->tensorflow_gpu==2.3.0+computecanada) (4.0.1+computecanada)
Processing /cvmfs/soft.computecanada.ca/custom/python/wheelhouse/generic/pyasn1-0.4.8+computecanada-py2.py3-none-any.whl
Requirement already satisfied: charset-normalizer~=2.0.0 in /localscratch/yinan.28698715.0/env/lib/python3.7/site-packages (from requests<3,>=2.21.0->tensorboard<3,>=2.3.0->tensorflow_gpu==2.3.0+computecanada) (2.0.11+computecanada)
Requirement already satisfied: idna<4,>=2.5 in /cvmfs/soft.computecanada.ca/easybuild/software/2017/Core/scipy-stack/2019a/lib/python3.7/site-packages (from requests<3,>=2.21.0->tensorboard<3,>=2.3.0->tensorflow_gpu==2.3.0+computecanada) (2.8)
Requirement already satisfied: urllib3<1.27,>=1.21.1 in /localscratch/yinan.28698715.0/env/lib/python3.7/site-packages (from requests<3,>=2.21.0->tensorboard<3,>=2.3.0->tensorflow_gpu==2.3.0+computecanada) (1.26.8+computecanada)
Requirement already satisfied: certifi>=2017.4.17 in /cvmfs/soft.computecanada.ca/easybuild/software/2017/Core/scipy-stack/2019a/lib/python3.7/site-packages (from requests<3,>=2.21.0->tensorboard<3,>=2.3.0->tensorflow_gpu==2.3.0+computecanada) (2018.11.29)
Processing /cvmfs/soft.computecanada.ca/custom/python/wheelhouse/generic/oauthlib-3.1.1+computecanada-py2.py3-none-any.whl
Installing collected packages: pyasn1, zipp, rsa, pyasn1-modules, oauthlib, cachetools, requests-oauthlib, importlib-metadata, google-auth, werkzeug, tensorboard-plugin-wit, tensorboard-data-server, markdown, grpcio, google-auth-oauthlib, absl-py, wrapt, tensorflow-estimator, tensorboard, scipy, opt-einsum, keras-preprocessing, h5py, google-pasta, gast, astunparse, tensorflow-gpu
  Attempting uninstall: pyasn1
    Found existing installation: pyasn1 0.4.3
    Not uninstalling pyasn1 at /cvmfs/soft.computecanada.ca/easybuild/software/2017/Core/scipy-stack/2019a/lib/python3.7/site-packages, outside environment /localscratch/yinan.28698715.0/env
    Can't uninstall 'pyasn1'. No files were found to uninstall.
  Attempting uninstall: zipp
    Found existing installation: zipp 0.3.3
    Not uninstalling zipp at /cvmfs/soft.computecanada.ca/easybuild/software/2017/Core/scipy-stack/2019a/lib/python3.7/site-packages, outside environment /localscratch/yinan.28698715.0/env
    Can't uninstall 'zipp'. No files were found to uninstall.
  Attempting uninstall: importlib-metadata
    Found existing installation: importlib-metadata 0.8
    Not uninstalling importlib-metadata at /cvmfs/soft.computecanada.ca/easybuild/software/2017/Core/scipy-stack/2019a/lib/python3.7/site-packages, outside environment /localscratch/yinan.28698715.0/env
    Can't uninstall 'importlib-metadata'. No files were found to uninstall.
  Attempting uninstall: scipy
    Found existing installation: scipy 1.2.0
    Not uninstalling scipy at /cvmfs/soft.computecanada.ca/easybuild/software/2017/Core/scipy-stack/2019a/lib/python3.7/site-packages, outside environment /localscratch/yinan.28698715.0/env
    Can't uninstall 'scipy'. No files were found to uninstall.
Successfully installed absl-py-1.0.0+computecanada astunparse-1.6.3+computecanada cachetools-4.2.4+computecanada gast-0.3.3+computecanada google-auth-2.3.3+computecanada google-auth-oauthlib-0.4.6+computecanada google-pasta-0.2.0+computecanada grpcio-1.38.0+computecanada h5py-2.10.0+computecanada importlib-metadata-4.10.1+computecanada keras-preprocessing-1.1.2+computecanada markdown-3.3.6+computecanada oauthlib-3.1.1+computecanada opt-einsum-3.3.0+computecanada pyasn1-0.4.8+computecanada pyasn1-modules-0.2.8+computecanada requests-oauthlib-1.3.0+computecanada rsa-4.8+computecanada scipy-1.4.1+computecanada tensorboard-2.8.0+computecanada tensorboard-data-server-0.6.1+computecanada tensorboard-plugin-wit-1.8.0+computecanada tensorflow-estimator-2.3.0+computecanada tensorflow-gpu-2.3.0+computecanada werkzeug-2.0.3+computecanada wrapt-1.11.2+computecanada zipp-3.7.0+computecanada
Looking in links: /cvmfs/soft.computecanada.ca/custom/python/wheelhouse/nix/avx2, /cvmfs/soft.computecanada.ca/custom/python/wheelhouse/nix/generic, /cvmfs/soft.computecanada.ca/custom/python/wheelhouse/generic
Processing /cvmfs/soft.computecanada.ca/custom/python/wheelhouse/generic/keras-2.8.0+computecanada-py2.py3-none-any.whl
Installing collected packages: Keras
Successfully installed Keras-2.8.0+computecanada
Looking in links: /cvmfs/soft.computecanada.ca/custom/python/wheelhouse/nix/avx2, /cvmfs/soft.computecanada.ca/custom/python/wheelhouse/nix/generic, /cvmfs/soft.computecanada.ca/custom/python/wheelhouse/generic
Processing /cvmfs/soft.computecanada.ca/custom/python/wheelhouse/generic/urllib3-1.26.7+computecanada-py2.py3-none-any.whl
Installing collected packages: urllib3
  Attempting uninstall: urllib3
    Found existing installation: urllib3 1.26.8+computecanada
    Uninstalling urllib3-1.26.8+computecanada:
      Successfully uninstalled urllib3-1.26.8+computecanada
Successfully installed urllib3-1.26.7+computecanada
Looking in links: /cvmfs/soft.computecanada.ca/custom/python/wheelhouse/nix/avx2, /cvmfs/soft.computecanada.ca/custom/python/wheelhouse/nix/generic, /cvmfs/soft.computecanada.ca/custom/python/wheelhouse/generic
Processing /cvmfs/soft.computecanada.ca/custom/python/wheelhouse/generic/nltk-3.7+computecanada-py3-none-any.whl
Requirement already satisfied: joblib in /localscratch/yinan.28698715.0/env/lib/python3.7/site-packages (from nltk) (1.1.0+computecanada)
Requirement already satisfied: click in /localscratch/yinan.28698715.0/env/lib/python3.7/site-packages (from nltk) (8.0.3+computecanada)
Processing /cvmfs/soft.computecanada.ca/custom/python/wheelhouse/generic/nltk-3.6.5+computecanada-py3-none-any.whl
Processing /cvmfs/soft.computecanada.ca/custom/python/wheelhouse/generic/nltk-3.6.3+computecanada-py3-none-any.whl
Requirement already satisfied: regex in /localscratch/yinan.28698715.0/env/lib/python3.7/site-packages (from nltk) (2020.11.13+computecanada)
Requirement already satisfied: tqdm in /localscratch/yinan.28698715.0/env/lib/python3.7/site-packages (from nltk) (4.63.0+computecanada)
Requirement already satisfied: importlib-metadata in /localscratch/yinan.28698715.0/env/lib/python3.7/site-packages (from click->nltk) (4.10.1+computecanada)
Requirement already satisfied: typing-extensions>=3.6.4 in /localscratch/yinan.28698715.0/env/lib/python3.7/site-packages (from importlib-metadata->click->nltk) (4.0.1+computecanada)
Requirement already satisfied: zipp>=0.5 in /localscratch/yinan.28698715.0/env/lib/python3.7/site-packages (from importlib-metadata->click->nltk) (3.7.0+computecanada)
Installing collected packages: nltk
Successfully installed nltk-3.6.3+computecanada
Looking in links: /cvmfs/soft.computecanada.ca/custom/python/wheelhouse/nix/avx2, /cvmfs/soft.computecanada.ca/custom/python/wheelhouse/nix/generic, /cvmfs/soft.computecanada.ca/custom/python/wheelhouse/generic
Processing /cvmfs/soft.computecanada.ca/custom/python/wheelhouse/generic/scikit_learn-0.22.1+computecanada-cp37-cp37m-linux_x86_64.whl
Requirement already satisfied: numpy>=1.11.0 in /cvmfs/soft.computecanada.ca/easybuild/software/2017/Core/scipy-stack/2019a/lib/python3.7/site-packages (from scikit-learn==0.22.1) (1.16.0)
Requirement already satisfied: scipy>=0.17.0 in /localscratch/yinan.28698715.0/env/lib/python3.7/site-packages (from scikit-learn==0.22.1) (1.4.1+computecanada)
Requirement already satisfied: joblib>=0.11 in /localscratch/yinan.28698715.0/env/lib/python3.7/site-packages (from scikit-learn==0.22.1) (1.1.0+computecanada)
Installing collected packages: scikit-learn
Successfully installed scikit-learn-0.22.1+computecanada
Looking in links: /cvmfs/soft.computecanada.ca/custom/python/wheelhouse/nix/avx2, /cvmfs/soft.computecanada.ca/custom/python/wheelhouse/nix/generic, /cvmfs/soft.computecanada.ca/custom/python/wheelhouse/generic
Requirement already satisfied: tokenizers==0.5.2 in /localscratch/yinan.28698715.0/env/lib/python3.7/site-packages (0.5.2+computecanada)
wandb: Appending key for api.wandb.ai to your netrc file: /home/yinan/.netrc
Starting Task
2022-03-11 09:24:52.545245: I tensorflow/stream_executor/platform/default/dso_loader.cc:48] Successfully opened dynamic library libcudart.so.10.1
[nltk_data] Downloading package stopwords to /home/yinan/nltk_data...
[nltk_data]   Package stopwords is already up-to-date!
[nltk_data] Downloading package wordnet to /home/yinan/nltk_data...
[nltk_data]   Package wordnet is already up-to-date!
wandb: Currently logged in as: yinanazhou (use `wandb login --relogin` to force relogin)
wandb: wandb version 0.12.11 is available!  To upgrade, please run:
wandb:  $ pip install wandb --upgrade
2022-03-11 09:25:02.530632: I tensorflow/stream_executor/platform/default/dso_loader.cc:48] Successfully opened dynamic library libcudart.so.10.1
wandb: Tracking run with wandb version 0.12.5
wandb: Syncing run bright-bee-1
wandb: ⭐️ View project at https://wandb.ai/yinanazhou/xl_512_bs_8_lr_1e07_es_15_lc_False_nr_True_sr_True_stem_False_lemma_False_repeat_1_fold_1
wandb: 🚀 View run at https://wandb.ai/yinanazhou/xl_512_bs_8_lr_1e07_es_15_lc_False_nr_True_sr_True_stem_False_lemma_False_repeat_1_fold_1/runs/21lwmrti
wandb: Run data is saved locally in /project/6002780/yinan/Thesis_MER_Lyrics/lyric-emotion/wandb/run-20220311_092500-21lwmrti
wandb: Run `wandb offline` to turn off syncing.

Validation loss decreased (inf --> 1.452513).  Saving model ...
Validation loss decreased (1.452513 --> 1.449839).  Saving model ...
Validation loss decreased (1.449839 --> 1.447053).  Saving model ...
Validation loss decreased (1.447053 --> 1.444238).  Saving model ...
Validation loss decreased (1.444238 --> 1.441635).  Saving model ...
Validation loss decreased (1.441635 --> 1.439047).  Saving model ...
Validation loss decreased (1.439047 --> 1.436606).  Saving model ...
Validation loss decreased (1.436606 --> 1.434318).  Saving model ...
Validation loss decreased (1.434318 --> 1.432099).  Saving model ...
Validation loss decreased (1.432099 --> 1.429807).  Saving model ...
Validation loss decreased (1.429807 --> 1.427508).  Saving model ...
Validation loss decreased (1.427508 --> 1.425392).  Saving model ...
Validation loss decreased (1.425392 --> 1.423254).  Saving model ...
Validation loss decreased (1.423254 --> 1.421171).  Saving model ...
Validation loss decreased (1.421171 --> 1.419222).  Saving model ...
Validation loss decreased (1.419222 --> 1.417267).  Saving model ...
Validation loss decreased (1.417267 --> 1.415319).  Saving model ...
Validation loss decreased (1.415319 --> 1.413352).  Saving model ...
Validation loss decreased (1.413352 --> 1.411594).  Saving model ...
Validation loss decreased (1.411594 --> 1.409867).  Saving model ...
Validation loss decreased (1.409867 --> 1.408129).  Saving model ...
Validation loss decreased (1.408129 --> 1.406470).  Saving model ...
Validation loss decreased (1.406470 --> 1.404852).  Saving model ...
Validation loss decreased (1.404852 --> 1.403383).  Saving model ...
Validation loss decreased (1.403383 --> 1.401828).  Saving model ...
Validation loss decreased (1.401828 --> 1.400361).  Saving model ...
Validation loss decreased (1.400361 --> 1.398875).  Saving model ...
Validation loss decreased (1.398875 --> 1.397380).  Saving model ...
Validation loss decreased (1.397380 --> 1.396012).  Saving model ...
Validation loss decreased (1.396012 --> 1.394650).  Saving model ...
Validation loss decreased (1.394650 --> 1.393323).  Saving model ...
Validation loss decreased (1.393323 --> 1.391950).  Saving model ...
Validation loss decreased (1.391950 --> 1.390743).  Saving model ...
Validation loss decreased (1.390743 --> 1.389499).  Saving model ...
Validation loss decreased (1.389499 --> 1.388332).  Saving model ...
Validation loss decreased (1.388332 --> 1.387043).  Saving model ...
Validation loss decreased (1.387043 --> 1.385904).  Saving model ...
Validation loss decreased (1.385904 --> 1.384890).  Saving model ...
Validation loss decreased (1.384890 --> 1.383753).  Saving model ...
Validation loss decreased (1.383753 --> 1.382639).  Saving model ...
Validation loss decreased (1.382639 --> 1.381582).  Saving model ...
Validation loss decreased (1.381582 --> 1.380498).  Saving model ...
Validation loss decreased (1.380498 --> 1.379469).  Saving model ...
Validation loss decreased (1.379469 --> 1.378455).  Saving model ...
Validation loss decreased (1.378455 --> 1.377292).  Saving model ...
Validation loss decreased (1.377292 --> 1.376338).  Saving model ...
Validation loss decreased (1.376338 --> 1.375385).  Saving model ...
Validation loss decreased (1.375385 --> 1.374409).  Saving model ...
Validation loss decreased (1.374409 --> 1.373557).  Saving model ...
Validation loss decreased (1.373557 --> 1.372682).  Saving model ...
Validation loss decreased (1.372682 --> 1.371876).  Saving model ...
Validation loss decreased (1.371876 --> 1.371029).  Saving model ...
Validation loss decreased (1.371029 --> 1.370116).  Saving model ...
Validation loss decreased (1.370116 --> 1.369215).  Saving model ...
Validation loss decreased (1.369215 --> 1.368444).  Saving model ...
Validation loss decreased (1.368444 --> 1.367660).  Saving model ...
Validation loss decreased (1.367660 --> 1.366797).  Saving model ...
Validation loss decreased (1.366797 --> 1.365994).  Saving model ...
Validation loss decreased (1.365994 --> 1.365137).  Saving model ...
Validation loss decreased (1.365137 --> 1.364417).  Saving model ...
Validation loss decreased (1.364417 --> 1.363647).  Saving model ...
Validation loss decreased (1.363647 --> 1.362869).  Saving model ...
Validation loss decreased (1.362869 --> 1.362100).  Saving model ...
Validation loss decreased (1.362100 --> 1.361311).  Saving model ...
Validation loss decreased (1.361311 --> 1.360634).  Saving model ...
Validation loss decreased (1.360634 --> 1.359816).  Saving model ...
Validation loss decreased (1.359816 --> 1.359152).  Saving model ...
Validation loss decreased (1.359152 --> 1.358494).  Saving model ...
Validation loss decreased (1.358494 --> 1.357820).  Saving model ...
Validation loss decreased (1.357820 --> 1.357176).  Saving model ...
Validation loss decreased (1.357176 --> 1.356526).  Saving model ...
Validation loss decreased (1.356526 --> 1.355814).  Saving model ...
Validation loss decreased (1.355814 --> 1.355155).  Saving model ...
Validation loss decreased (1.355155 --> 1.354531).  Saving model ...
Validation loss decreased (1.354531 --> 1.353871).  Saving model ...
Validation loss decreased (1.353871 --> 1.353281).  Saving model ...
Validation loss decreased (1.353281 --> 1.352655).  Saving model ...
Validation loss decreased (1.352655 --> 1.352013).  Saving model ...
Validation loss decreased (1.352013 --> 1.351380).  Saving model ...
Validation loss decreased (1.351380 --> 1.350796).  Saving model ...
Validation loss decreased (1.350796 --> 1.350231).  Saving model ...
Validation loss decreased (1.350231 --> 1.349606).  Saving model ...
Validation loss decreased (1.349606 --> 1.348987).  Saving model ...
Validation loss decreased (1.348987 --> 1.348431).  Saving model ...
Validation loss decreased (1.348431 --> 1.347853).  Saving model ...
Validation loss decreased (1.347853 --> 1.347222).  Saving model ...
Validation loss decreased (1.347222 --> 1.346621).  Saving model ...
Validation loss decreased (1.346621 --> 1.345951).  Saving model ...
Validation loss decreased (1.345951 --> 1.345349).  Saving model ...
Validation loss decreased (1.345349 --> 1.344807).  Saving model ...
Validation loss decreased (1.344807 --> 1.344211).  Saving model ...
Validation loss decreased (1.344211 --> 1.343590).  Saving model ...
Validation loss decreased (1.343590 --> 1.342978).  Saving model ...
Validation loss decreased (1.342978 --> 1.342386).  Saving model ...
Validation loss decreased (1.342386 --> 1.341720).  Saving model ...
Validation loss decreased (1.341720 --> 1.341162).  Saving model ...
Validation loss decreased (1.341162 --> 1.340582).  Saving model ...
Validation loss decreased (1.340582 --> 1.339951).  Saving model ...
Validation loss decreased (1.339951 --> 1.339343).  Saving model ...
Validation loss decreased (1.339343 --> 1.338802).  Saving model ...
Validation loss decreased (1.338802 --> 1.338212).  Saving model ...
Validation loss decreased (1.338212 --> 1.337599).  Saving model ...
Validation loss decreased (1.337599 --> 1.337025).  Saving model ...
Validation loss decreased (1.337025 --> 1.336480).  Saving model ...
Validation loss decreased (1.336480 --> 1.335819).  Saving model ...
Validation loss decreased (1.335819 --> 1.335264).  Saving model ...
Validation loss decreased (1.335264 --> 1.334663).  Saving model ...
Validation loss decreased (1.334663 --> 1.334078).  Saving model ...
Validation loss decreased (1.334078 --> 1.333424).  Saving model ...
Validation loss decreased (1.333424 --> 1.332834).  Saving model ...
Validation loss decreased (1.332834 --> 1.332250).  Saving model ...
Validation loss decreased (1.332250 --> 1.331626).  Saving model ...
Validation loss decreased (1.331626 --> 1.331057).  Saving model ...
Validation loss decreased (1.331057 --> 1.330496).  Saving model ...
Validation loss decreased (1.330496 --> 1.329872).  Saving model ...
Validation loss decreased (1.329872 --> 1.329291).  Saving model ...
Validation loss decreased (1.329291 --> 1.328689).  Saving model ...
Validation loss decreased (1.328689 --> 1.328088).  Saving model ...
Validation loss decreased (1.328088 --> 1.327428).  Saving model ...
Validation loss decreased (1.327428 --> 1.326794).  Saving model ...
Validation loss decreased (1.326794 --> 1.326174).  Saving model ...
Validation loss decreased (1.326174 --> 1.325576).  Saving model ...
Validation loss decreased (1.325576 --> 1.325013).  Saving model ...
Validation loss decreased (1.325013 --> 1.324338).  Saving model ...
Validation loss decreased (1.324338 --> 1.323780).  Saving model ...
Validation loss decreased (1.323780 --> 1.323126).  Saving model ...
Validation loss decreased (1.323126 --> 1.322477).  Saving model ...
Validation loss decreased (1.322477 --> 1.321848).  Saving model ...
Validation loss decreased (1.321848 --> 1.321266).  Saving model ...
Validation loss decreased (1.321266 --> 1.320671).  Saving model ...
Validation loss decreased (1.320671 --> 1.320029).  Saving model ...
Validation loss decreased (1.320029 --> 1.319409).  Saving model ...
Validation loss decreased (1.319409 --> 1.318790).  Saving model ...
Validation loss decreased (1.318790 --> 1.318171).  Saving model ...
Validation loss decreased (1.318171 --> 1.317545).  Saving model ...
Validation loss decreased (1.317545 --> 1.316941).  Saving model ...
Validation loss decreased (1.316941 --> 1.316334).  Saving model ...
Validation loss decreased (1.316334 --> 1.315668).  Saving model ...
Validation loss decreased (1.315668 --> 1.315034).  Saving model ...
Validation loss decreased (1.315034 --> 1.314486).  Saving model ...
Validation loss decreased (1.314486 --> 1.313874).  Saving model ...
Validation loss decreased (1.313874 --> 1.313229).  Saving model ...
Validation loss decreased (1.313229 --> 1.312675).  Saving model ...
Validation loss decreased (1.312675 --> 1.312027).  Saving model ...
Validation loss decreased (1.312027 --> 1.311339).  Saving model ...
Validation loss decreased (1.311339 --> 1.310668).  Saving model ...
Validation loss decreased (1.310668 --> 1.309968).  Saving model ...
Validation loss decreased (1.309968 --> 1.309232).  Saving model ...
Validation loss decreased (1.309232 --> 1.308541).  Saving model ...
Validation loss decreased (1.308541 --> 1.307829).  Saving model ...
Validation loss decreased (1.307829 --> 1.307246).  Saving model ...
Validation loss decreased (1.307246 --> 1.306663).  Saving model ...
Validation loss decreased (1.306663 --> 1.305978).  Saving model ...
Validation loss decreased (1.305978 --> 1.305423).  Saving model ...
Validation loss decreased (1.305423 --> 1.304854).  Saving model ...
Validation loss decreased (1.304854 --> 1.304311).  Saving model ...
Validation loss decreased (1.304311 --> 1.303680).  Saving model ...
Validation loss decreased (1.303680 --> 1.303094).  Saving model ...
Validation loss decreased (1.303094 --> 1.302415).  Saving model ...
Validation loss decreased (1.302415 --> 1.301730).  Saving model ...
Validation loss decreased (1.301730 --> 1.301036).  Saving model ...
Validation loss decreased (1.301036 --> 1.300387).  Saving model ...
Validation loss decreased (1.300387 --> 1.299808).  Saving model ...
Validation loss decreased (1.299808 --> 1.299099).  Saving model ...
Validation loss decreased (1.299099 --> 1.298311).  Saving model ...
Validation loss decreased (1.298311 --> 1.297681).  Saving model ...
Validation loss decreased (1.297681 --> 1.297014).  Saving model ...
Validation loss decreased (1.297014 --> 1.296343).  Saving model ...
Validation loss decreased (1.296343 --> 1.295792).  Saving model ...
Validation loss decreased (1.295792 --> 1.295053).  Saving model ...
Validation loss decreased (1.295053 --> 1.294356).  Saving model ...
Validation loss decreased (1.294356 --> 1.293762).  Saving model ...
Validation loss decreased (1.293762 --> 1.293141).  Saving model ...
Validation loss decreased (1.293141 --> 1.292574).  Saving model ...
Validation loss decreased (1.292574 --> 1.291938).  Saving model ...
Validation loss decreased (1.291938 --> 1.291319).  Saving model ...
Validation loss decreased (1.291319 --> 1.290715).  Saving model ...
Validation loss decreased (1.290715 --> 1.290040).  Saving model ...
Validation loss decreased (1.290040 --> 1.289376).  Saving model ...
Validation loss decreased (1.289376 --> 1.288772).  Saving model ...
Validation loss decreased (1.288772 --> 1.288130).  Saving model ...
Validation loss decreased (1.288130 --> 1.287436).  Saving model ...
Validation loss decreased (1.287436 --> 1.286759).  Saving model ...
Validation loss decreased (1.286759 --> 1.286122).  Saving model ...
Validation loss decreased (1.286122 --> 1.285480).  Saving model ...
Validation loss decreased (1.285480 --> 1.284862).  Saving model ...
Validation loss decreased (1.284862 --> 1.284375).  Saving model ...
Validation loss decreased (1.284375 --> 1.283757).  Saving model ...
Validation loss decreased (1.283757 --> 1.283056).  Saving model ...
Validation loss decreased (1.283056 --> 1.282402).  Saving model ...
Validation loss decreased (1.282402 --> 1.281807).  Saving model ...
Validation loss decreased (1.281807 --> 1.281172).  Saving model ...
Validation loss decreased (1.281172 --> 1.280687).  Saving model ...
Validation loss decreased (1.280687 --> 1.280132).  Saving model ...
Validation loss decreased (1.280132 --> 1.279542).  Saving model ...
Validation loss decreased (1.279542 --> 1.278981).  Saving model ...
Validation loss decreased (1.278981 --> 1.278434).  Saving model ...
Validation loss decreased (1.278434 --> 1.277929).  Saving model ...
Validation loss decreased (1.277929 --> 1.277250).  Saving model ...
Validation loss decreased (1.277250 --> 1.276623).  Saving model ...
Validation loss decreased (1.276623 --> 1.276006).  Saving model ...
Validation loss decreased (1.276006 --> 1.275439).  Saving model ...
Validation loss decreased (1.275439 --> 1.274874).  Saving model ...
Validation loss decreased (1.274874 --> 1.274254).  Saving model ...
Validation loss decreased (1.274254 --> 1.273723).  Saving model ...
Validation loss decreased (1.273723 --> 1.273208).  Saving model ...
Validation loss decreased (1.273208 --> 1.272665).  Saving model ...
Validation loss decreased (1.272665 --> 1.272187).  Saving model ...
Validation loss decreased (1.272187 --> 1.271754).  Saving model ...
Validation loss decreased (1.271754 --> 1.271196).  Saving model ...
Validation loss decreased (1.271196 --> 1.270555).  Saving model ...
Validation loss decreased (1.270555 --> 1.269904).  Saving model ...
Validation loss decreased (1.269904 --> 1.269419).  Saving model ...
Validation loss decreased (1.269419 --> 1.268871).  Saving model ...
Validation loss decreased (1.268871 --> 1.268289).  Saving model ...
Validation loss decreased (1.268289 --> 1.267682).  Saving model ...
Validation loss decreased (1.267682 --> 1.267215).  Saving model ...
Validation loss decreased (1.267215 --> 1.266585).  Saving model ...
Validation loss decreased (1.266585 --> 1.266032).  Saving model ...
Validation loss decreased (1.266032 --> 1.265517).  Saving model ...
Validation loss decreased (1.265517 --> 1.264873).  Saving model ...
Validation loss decreased (1.264873 --> 1.264294).  Saving model ...
Validation loss decreased (1.264294 --> 1.263703).  Saving model ...
Validation loss decreased (1.263703 --> 1.263191).  Saving model ...
Validation loss decreased (1.263191 --> 1.262541).  Saving model ...
Validation loss decreased (1.262541 --> 1.262127).  Saving model ...
Validation loss decreased (1.262127 --> 1.261612).  Saving model ...
Validation loss decreased (1.261612 --> 1.261158).  Saving model ...
Validation loss decreased (1.261158 --> 1.260665).  Saving model ...
Validation loss decreased (1.260665 --> 1.260124).  Saving model ...
Validation loss decreased (1.260124 --> 1.259628).  Saving model ...
Validation loss decreased (1.259628 --> 1.259091).  Saving model ...
Validation loss decreased (1.259091 --> 1.258754).  Saving model ...
Validation loss decreased (1.258754 --> 1.258182).  Saving model ...
Validation loss decreased (1.258182 --> 1.257762).  Saving model ...
Validation loss decreased (1.257762 --> 1.257379).  Saving model ...
Validation loss decreased (1.257379 --> 1.256882).  Saving model ...
Validation loss decreased (1.256882 --> 1.256437).  Saving model ...
Validation loss decreased (1.256437 --> 1.255922).  Saving model ...
Validation loss decreased (1.255922 --> 1.255365).  Saving model ...
Validation loss decreased (1.255365 --> 1.254942).  Saving model ...
Validation loss decreased (1.254942 --> 1.254505).  Saving model ...
Validation loss decreased (1.254505 --> 1.254027).  Saving model ...
Validation loss decreased (1.254027 --> 1.253387).  Saving model ...
Validation loss decreased (1.253387 --> 1.252950).  Saving model ...
Validation loss decreased (1.252950 --> 1.252363).  Saving model ...
Validation loss decreased (1.252363 --> 1.251871).  Saving model ...
Validation loss decreased (1.251871 --> 1.251520).  Saving model ...
Validation loss decreased (1.251520 --> 1.250994).  Saving model ...
Validation loss decreased (1.250994 --> 1.250604).  Saving model ...
Validation loss decreased (1.250604 --> 1.250131).  Saving model ...
Validation loss decreased (1.250131 --> 1.249714).  Saving model ...
Validation loss decreased (1.249714 --> 1.249236).  Saving model ...
Validation loss decreased (1.249236 --> 1.248835).  Saving model ...
Validation loss decreased (1.248835 --> 1.248341).  Saving model ...
Validation loss decreased (1.248341 --> 1.247847).  Saving model ...
Validation loss decreased (1.247847 --> 1.247584).  Saving model ...
Validation loss decreased (1.247584 --> 1.247182).  Saving model ...
Validation loss decreased (1.247182 --> 1.246491).  Saving model ...
Validation loss decreased (1.246491 --> 1.246060).  Saving model ...
Validation loss decreased (1.246060 --> 1.245639).  Saving model ...
Validation loss decreased (1.245639 --> 1.245315).  Saving model ...
Validation loss decreased (1.245315 --> 1.244856).  Saving model ...
Validation loss decreased (1.244856 --> 1.244270).  Saving model ...
Validation loss decreased (1.244270 --> 1.243680).  Saving model ...
Validation loss decreased (1.243680 --> 1.243214).  Saving model ...
Validation loss decreased (1.243214 --> 1.242963).  Saving model ...
Validation loss decreased (1.242963 --> 1.242537).  Saving model ...
Validation loss decreased (1.242537 --> 1.242055).  Saving model ...
Validation loss decreased (1.242055 --> 1.241563).  Saving model ...
Validation loss decreased (1.241563 --> 1.241164).  Saving model ...
Validation loss decreased (1.241164 --> 1.240668).  Saving model ...
Validation loss decreased (1.240668 --> 1.240147).  Saving model ...
Validation loss decreased (1.240147 --> 1.239611).  Saving model ...
Validation loss decreased (1.239611 --> 1.239114).  Saving model ...
Validation loss decreased (1.239114 --> 1.238640).  Saving model ...
Validation loss decreased (1.238640 --> 1.238315).  Saving model ...
Validation loss decreased (1.238315 --> 1.237746).  Saving model ...
Validation loss decreased (1.237746 --> 1.237250).  Saving model ...
Validation loss decreased (1.237250 --> 1.236885).  Saving model ...
Validation loss decreased (1.236885 --> 1.236368).  Saving model ...
Validation loss decreased (1.236368 --> 1.235922).  Saving model ...
Validation loss decreased (1.235922 --> 1.235603).  Saving model ...
Validation loss decreased (1.235603 --> 1.235212).  Saving model ...
Validation loss decreased (1.235212 --> 1.234893).  Saving model ...
Validation loss decreased (1.234893 --> 1.234550).  Saving model ...
Validation loss decreased (1.234550 --> 1.233902).  Saving model ...
Validation loss decreased (1.233902 --> 1.233567).  Saving model ...
Validation loss decreased (1.233567 --> 1.233302).  Saving model ...
Validation loss decreased (1.233302 --> 1.232911).  Saving model ...
Validation loss decreased (1.232911 --> 1.232503).  Saving model ...
Validation loss decreased (1.232503 --> 1.231971).  Saving model ...
Validation loss decreased (1.231971 --> 1.231577).  Saving model ...
Validation loss decreased (1.231577 --> 1.231349).  Saving model ...
Validation loss decreased (1.231349 --> 1.230835).  Saving model ...
Validation loss decreased (1.230835 --> 1.230422).  Saving model ...
Validation loss decreased (1.230422 --> 1.230039).  Saving model ...
Validation loss decreased (1.230039 --> 1.229537).  Saving model ...
Validation loss decreased (1.229537 --> 1.229196).  Saving model ...
Validation loss decreased (1.229196 --> 1.228799).  Saving model ...
Validation loss decreased (1.228799 --> 1.228374).  Saving model ...
Validation loss decreased (1.228374 --> 1.227700).  Saving model ...
Validation loss decreased (1.227700 --> 1.227299).  Saving model ...
Validation loss decreased (1.227299 --> 1.226829).  Saving model ...
Validation loss decreased (1.226829 --> 1.226416).  Saving model ...
Validation loss decreased (1.226416 --> 1.226125).  Saving model ...
Validation loss decreased (1.226125 --> 1.225791).  Saving model ...
Validation loss decreased (1.225791 --> 1.225420).  Saving model ...
Validation loss decreased (1.225420 --> 1.225067).  Saving model ...
Validation loss decreased (1.225067 --> 1.224535).  Saving model ...
Validation loss decreased (1.224535 --> 1.224205).  Saving model ...
Validation loss decreased (1.224205 --> 1.223860).  Saving model ...
Validation loss decreased (1.223860 --> 1.223452).  Saving model ...
Validation loss decreased (1.223452 --> 1.223214).  Saving model ...
Validation loss decreased (1.223214 --> 1.222970).  Saving model ...
Validation loss decreased (1.222970 --> 1.222498).  Saving model ...
Validation loss decreased (1.222498 --> 1.222130).  Saving model ...
Validation loss decreased (1.222130 --> 1.221826).  Saving model ...
Validation loss decreased (1.221826 --> 1.221407).  Saving model ...
Validation loss decreased (1.221407 --> 1.221020).  Saving model ...
Validation loss decreased (1.221020 --> 1.220749).  Saving model ...
Validation loss decreased (1.220749 --> 1.220208).  Saving model ...
Validation loss decreased (1.220208 --> 1.219664).  Saving model ...
Validation loss decreased (1.219664 --> 1.219336).  Saving model ...
Validation loss decreased (1.219336 --> 1.218915).  Saving model ...
Validation loss decreased (1.218915 --> 1.218471).  Saving model ...
Validation loss decreased (1.218471 --> 1.218022).  Saving model ...
Validation loss decreased (1.218022 --> 1.217905).  Saving model ...
Validation loss decreased (1.217905 --> 1.217499).  Saving model ...
Validation loss decreased (1.217499 --> 1.217163).  Saving model ...
Validation loss decreased (1.217163 --> 1.216855).  Saving model ...
Validation loss decreased (1.216855 --> 1.216497).  Saving model ...
Validation loss decreased (1.216497 --> 1.216230).  Saving model ...
Validation loss decreased (1.216230 --> 1.215873).  Saving model ...
Validation loss decreased (1.215873 --> 1.215470).  Saving model ...
Validation loss decreased (1.215470 --> 1.214939).  Saving model ...
Validation loss decreased (1.214939 --> 1.214602).  Saving model ...
Validation loss decreased (1.214602 --> 1.214406).  Saving model ...
Validation loss decreased (1.214406 --> 1.213753).  Saving model ...
Validation loss decreased (1.213753 --> 1.213467).  Saving model ...
Validation loss decreased (1.213467 --> 1.213146).  Saving model ...
Validation loss decreased (1.213146 --> 1.212632).  Saving model ...
Validation loss decreased (1.212632 --> 1.212514).  Saving model ...
Validation loss decreased (1.212514 --> 1.212126).  Saving model ...
Validation loss decreased (1.212126 --> 1.211953).  Saving model ...
Validation loss decreased (1.211953 --> 1.211634).  Saving model ...
Validation loss decreased (1.211634 --> 1.211036).  Saving model ...
Validation loss decreased (1.211036 --> 1.210671).  Saving model ...
Validation loss decreased (1.210671 --> 1.210468).  Saving model ...
Validation loss decreased (1.210468 --> 1.210089).  Saving model ...
Validation loss decreased (1.210089 --> 1.209653).  Saving model ...
Validation loss decreased (1.209653 --> 1.208928).  Saving model ...
Validation loss decreased (1.208928 --> 1.208562).  Saving model ...
Validation loss decreased (1.208562 --> 1.208479).  Saving model ...
Validation loss decreased (1.208479 --> 1.207951).  Saving model ...
Validation loss decreased (1.207951 --> 1.207551).  Saving model ...
Validation loss decreased (1.207551 --> 1.207020).  Saving model ...
Validation loss decreased (1.207020 --> 1.206639).  Saving model ...
Validation loss decreased (1.206639 --> 1.206008).  Saving model ...
Validation loss decreased (1.206008 --> 1.205713).  Saving model ...
Validation loss decreased (1.205713 --> 1.205370).  Saving model ...
Validation loss decreased (1.205370 --> 1.205051).  Saving model ...
Validation loss decreased (1.205051 --> 1.204589).  Saving model ...
Validation loss decreased (1.204589 --> 1.204048).  Saving model ...
Validation loss decreased (1.204048 --> 1.203623).  Saving model ...
Validation loss decreased (1.203623 --> 1.203107).  Saving model ...
Validation loss decreased (1.203107 --> 1.202616).  Saving model ...
Validation loss decreased (1.202616 --> 1.202264).  Saving model ...
Validation loss decreased (1.202264 --> 1.202071).  Saving model ...
Validation loss decreased (1.202071 --> 1.201605).  Saving model ...
Validation loss decreased (1.201605 --> 1.201167).  Saving model ...
Validation loss decreased (1.201167 --> 1.200802).  Saving model ...
Validation loss decreased (1.200802 --> 1.200283).  Saving model ...
Validation loss decreased (1.200283 --> 1.200011).  Saving model ...
Validation loss decreased (1.200011 --> 1.199808).  Saving model ...
Validation loss decreased (1.199808 --> 1.199638).  Saving model ...
Validation loss decreased (1.199638 --> 1.199256).  Saving model ...
Validation loss decreased (1.199256 --> 1.198713).  Saving model ...
Validation loss decreased (1.198713 --> 1.198219).  Saving model ...
Validation loss decreased (1.198219 --> 1.197939).  Saving model ...
Validation loss decreased (1.197939 --> 1.197562).  Saving model ...
Validation loss decreased (1.197562 --> 1.197124).  Saving model ...
Validation loss decreased (1.197124 --> 1.196907).  Saving model ...
Validation loss decreased (1.196907 --> 1.196431).  Saving model ...
Validation loss decreased (1.196431 --> 1.196008).  Saving model ...
Validation loss decreased (1.196008 --> 1.195771).  Saving model ...
Validation loss decreased (1.195771 --> 1.195427).  Saving model ...
Validation loss decreased (1.195427 --> 1.194826).  Saving model ...
Validation loss decreased (1.194826 --> 1.194718).  Saving model ...
Validation loss decreased (1.194718 --> 1.194546).  Saving model ...
Validation loss decreased (1.194546 --> 1.194314).  Saving model ...
Validation loss decreased (1.194314 --> 1.194046).  Saving model ...
Validation loss decreased (1.194046 --> 1.193758).  Saving model ...
Validation loss decreased (1.193758 --> 1.193427).  Saving model ...
Validation loss decreased (1.193427 --> 1.193130).  Saving model ...
Validation loss decreased (1.193130 --> 1.192743).  Saving model ...
Validation loss decreased (1.192743 --> 1.192514).  Saving model ...
Validation loss decreased (1.192514 --> 1.192112).  Saving model ...
Validation loss decreased (1.192112 --> 1.191720).  Saving model ...
Validation loss decreased (1.191720 --> 1.191095).  Saving model ...
Validation loss decreased (1.191095 --> 1.190796).  Saving model ...
Validation loss decreased (1.190796 --> 1.190671).  Saving model ...
Validation loss decreased (1.190671 --> 1.190423).  Saving model ...
Validation loss decreased (1.190423 --> 1.190022).  Saving model ...
Validation loss decreased (1.190022 --> 1.189616).  Saving model ...
Validation loss decreased (1.189616 --> 1.189297).  Saving model ...
Validation loss decreased (1.189297 --> 1.188800).  Saving model ...
Validation loss decreased (1.188800 --> 1.188417).  Saving model ...
Validation loss decreased (1.188417 --> 1.188108).  Saving model ...
Validation loss decreased (1.188108 --> 1.187549).  Saving model ...
Validation loss decreased (1.187549 --> 1.187053).  Saving model ...
Validation loss decreased (1.187053 --> 1.186672).  Saving model ...
Validation loss decreased (1.186672 --> 1.186323).  Saving model ...
Validation loss decreased (1.186323 --> 1.186002).  Saving model ...
Validation loss decreased (1.186002 --> 1.185856).  Saving model ...
Validation loss decreased (1.185856 --> 1.185523).  Saving model ...
Validation loss decreased (1.185523 --> 1.185235).  Saving model ...
Validation loss decreased (1.185235 --> 1.184745).  Saving model ...
Validation loss decreased (1.184745 --> 1.184121).  Saving model ...
Validation loss decreased (1.184121 --> 1.183821).  Saving model ...
Validation loss decreased (1.183821 --> 1.183466).  Saving model ...
Validation loss decreased (1.183466 --> 1.182971).  Saving model ...
Validation loss decreased (1.182971 --> 1.182575).  Saving model ...
Validation loss decreased (1.182575 --> 1.182317).  Saving model ...
Validation loss decreased (1.182317 --> 1.181777).  Saving model ...
Validation loss decreased (1.181777 --> 1.181658).  Saving model ...
Validation loss decreased (1.181658 --> 1.181521).  Saving model ...
Validation loss decreased (1.181521 --> 1.181151).  Saving model ...
Validation loss decreased (1.181151 --> 1.180901).  Saving model ...
Validation loss decreased (1.180901 --> 1.180837).  Saving model ...
Validation loss decreased (1.180837 --> 1.180352).  Saving model ...
Validation loss decreased (1.180352 --> 1.180040).  Saving model ...
Validation loss decreased (1.180040 --> 1.179567).  Saving model ...
Validation loss decreased (1.179567 --> 1.179252).  Saving model ...
Validation loss decreased (1.179252 --> 1.178887).  Saving model ...
Validation loss decreased (1.178887 --> 1.178349).  Saving model ...
Validation loss decreased (1.178349 --> 1.177972).  Saving model ...
Validation loss decreased (1.177972 --> 1.177721).  Saving model ...
Validation loss decreased (1.177721 --> 1.177553).  Saving model ...
Validation loss decreased (1.177553 --> 1.177007).  Saving model ...
Validation loss decreased (1.177007 --> 1.176486).  Saving model ...
Validation loss decreased (1.176486 --> 1.176314).  Saving model ...
Validation loss decreased (1.176314 --> 1.175930).  Saving model ...
Validation loss decreased (1.175930 --> 1.175508).  Saving model ...
Validation loss decreased (1.175508 --> 1.175037).  Saving model ...
Validation loss decreased (1.175037 --> 1.174493).  Saving model ...
Validation loss decreased (1.174493 --> 1.174074).  Saving model ...
Validation loss decreased (1.174074 --> 1.173639).  Saving model ...
Validation loss decreased (1.173639 --> 1.173315).  Saving model ...
Validation loss decreased (1.173315 --> 1.173087).  Saving model ...
Validation loss decreased (1.173087 --> 1.172803).  Saving model ...
Validation loss decreased (1.172803 --> 1.172349).  Saving model ...
Validation loss decreased (1.172349 --> 1.172036).  Saving model ...
Validation loss decreased (1.172036 --> 1.171827).  Saving model ...
Validation loss decreased (1.171827 --> 1.171383).  Saving model ...
Validation loss decreased (1.171383 --> 1.171003).  Saving model ...
Validation loss decreased (1.171003 --> 1.170762).  Saving model ...
Validation loss decreased (1.170762 --> 1.170569).  Saving model ...
Validation loss decreased (1.170569 --> 1.170327).  Saving model ...
Validation loss decreased (1.170327 --> 1.170125).  Saving model ...
Validation loss decreased (1.170125 --> 1.169965).  Saving model ...
Validation loss decreased (1.169965 --> 1.169399).  Saving model ...
Validation loss decreased (1.169399 --> 1.169095).  Saving model ...
Validation loss decreased (1.169095 --> 1.168737).  Saving model ...
Validation loss decreased (1.168737 --> 1.168369).  Saving model ...
Validation loss decreased (1.168369 --> 1.167979).  Saving model ...
Validation loss decreased (1.167979 --> 1.167285).  Saving model ...
Validation loss decreased (1.167285 --> 1.166912).  Saving model ...
Validation loss decreased (1.166912 --> 1.166535).  Saving model ...
Validation loss decreased (1.166535 --> 1.165920).  Saving model ...
Validation loss decreased (1.165920 --> 1.165615).  Saving model ...
Validation loss decreased (1.165615 --> 1.165560).  Saving model ...
Validation loss decreased (1.165560 --> 1.165216).  Saving model ...
Validation loss decreased (1.165216 --> 1.164937).  Saving model ...
Validation loss decreased (1.164937 --> 1.164521).  Saving model ...
Validation loss decreased (1.164521 --> 1.164133).  Saving model ...
EarlyStopping counter: 1 out of 15.0
Validation loss decreased (1.164133 --> 1.163938).  Saving model ...
Validation loss decreased (1.163938 --> 1.163702).  Saving model ...
Validation loss decreased (1.163702 --> 1.163404).  Saving model ...
Validation loss decreased (1.163404 --> 1.162964).  Saving model ...
Validation loss decreased (1.162964 --> 1.162645).  Saving model ...
Validation loss decreased (1.162645 --> 1.162218).  Saving model ...
Validation loss decreased (1.162218 --> 1.161791).  Saving model ...
Validation loss decreased (1.161791 --> 1.161479).  Saving model ...
Validation loss decreased (1.161479 --> 1.161037).  Saving model ...
Validation loss decreased (1.161037 --> 1.160347).  Saving model ...
Validation loss decreased (1.160347 --> 1.160168).  Saving model ...
EarlyStopping counter: 1 out of 15.0
Validation loss decreased (1.160168 --> 1.159886).  Saving model ...
Validation loss decreased (1.159886 --> 1.159747).  Saving model ...
Validation loss decreased (1.159747 --> 1.159588).  Saving model ...
Validation loss decreased (1.159588 --> 1.159286).  Saving model ...
Validation loss decreased (1.159286 --> 1.158914).  Saving model ...
Validation loss decreased (1.158914 --> 1.158309).  Saving model ...
EarlyStopping counter: 1 out of 15.0
Validation loss decreased (1.158309 --> 1.158124).  Saving model ...
Validation loss decreased (1.158124 --> 1.157670).  Saving model ...
Validation loss decreased (1.157670 --> 1.157285).  Saving model ...
Validation loss decreased (1.157285 --> 1.156781).  Saving model ...
/localscratch/yinan.28698715.0/env/lib/python3.7/site-packages/torch/nn/functional.py:1794: UserWarning: nn.functional.tanh is deprecated. Use torch.tanh instead.
  warnings.warn("nn.functional.tanh is deprecated. Use torch.tanh instead.")
/localscratch/yinan.28698715.0/env/lib/python3.7/site-packages/transformers/optimization.py:155: UserWarning: This overload of add_ is deprecated:
	add_(Number alpha, Tensor other)
Consider using one of the following signatures instead:
	add_(Tensor other, *, Number alpha) (Triggered internally at  ../torch/csrc/utils/python_arg_parser.cpp:1025.)
  exp_avg.mul_(beta1).add_(1.0 - beta1, grad)
wandb: Waiting for W&B process to finish, PID 117718... (success).
wandb: - 0.00MB of 0.00MB uploaded (0.00MB deduped)wandb: \ 0.00MB of 0.00MB uploaded (0.00MB deduped)wandb: | 0.00MB of 0.00MB uploaded (0.00MB deduped)wandb: / 0.00MB of 0.00MB uploaded (0.00MB deduped)wandb: - 0.00MB of 0.00MB uploaded (0.00MB deduped)wandb: \ 0.00MB of 0.00MB uploaded (0.00MB deduped)wandb: | 0.00MB of 0.00MB uploaded (0.00MB deduped)wandb: / 0.00MB of 0.00MB uploaded (0.00MB deduped)wandb: - 0.00MB of 0.00MB uploaded (0.00MB deduped)wandb: \ 0.00MB of 0.00MB uploaded (0.00MB deduped)wandb: | 0.00MB of 0.00MB uploaded (0.00MB deduped)wandb: / 0.00MB of 0.00MB uploaded (0.00MB deduped)wandb:                                                                                
wandb: Run history:
wandb:     e_F1 ▁▁▂▃▃▄▄▅▅▅▅▅▅▅▆▆▆▆▆▇▇▇▇▇▇▇▇▇▇▇▇▇▇▇██████
wandb:   e_loss █▇▇▆▆▆▆▆▅▅▅▅▅▄▄▄▄▄▃▃▃▃▃▃▃▃▂▂▂▂▂▂▂▂▁▁▁▁▁▁
wandb:     t_F1 ▁▁▂▂▃▃▃▃▃▄▄▅▅▅▅▅▆▆▆▇▇▆▅▆▆▇▆▆▇▆▇▇▇█▇█████
wandb:   t_loss ██▇▇▇▇▆▆▆▆▆▅▅▅▅▅▄▄▄▄▄▄▄▄▃▃▃▃▃▃▂▃▂▂▂▂▁▁▁▁
wandb: 
wandb: Run summary:
wandb:     e_F1 48.30628
wandb:   e_loss 1.15678
wandb:     t_F1 56.12727
wandb:   t_loss 1.07869
wandb: 
wandb: Synced 4 W&B file(s), 0 media file(s), 0 artifact file(s) and 0 other file(s)
wandb: Synced bright-bee-1: https://wandb.ai/yinanazhou/xl_512_bs_8_lr_1e07_es_15_lc_False_nr_True_sr_True_stem_False_lemma_False_repeat_1_fold_1/runs/21lwmrti
wandb: Find logs at: ./wandb/run-20220311_092500-21lwmrti/logs/debug.log
wandb: 

wandb: wandb version 0.12.11 is available!  To upgrade, please run:
wandb:  $ pip install wandb --upgrade
2022-03-11 14:47:39.099919: I tensorflow/stream_executor/platform/default/dso_loader.cc:48] Successfully opened dynamic library libcudart.so.10.1
wandb: Tracking run with wandb version 0.12.5
wandb: Syncing run drawn-durian-1
wandb: ⭐️ View project at https://wandb.ai/yinanazhou/xl_512_bs_8_lr_1e07_es_15_lc_False_nr_True_sr_True_stem_False_lemma_False_repeat_1_fold_2
wandb: 🚀 View run at https://wandb.ai/yinanazhou/xl_512_bs_8_lr_1e07_es_15_lc_False_nr_True_sr_True_stem_False_lemma_False_repeat_1_fold_2/runs/1t6pmauy
wandb: Run data is saved locally in /project/6002780/yinan/Thesis_MER_Lyrics/lyric-emotion/wandb/run-20220311_144736-1t6pmauy
wandb: Run `wandb offline` to turn off syncing.
slurmstepd: error: *** JOB 28698715 ON cdr2574 CANCELLED AT 2022-03-11T19:22:48 DUE TO TIME LIMIT ***
