Unloading StdEnv/2020

Due to MODULEPATH changes, the following have been reloaded:
  1) mii/1.1.1


The following have been reloaded with a version change:
  1) python/3.8.2 => python/3.7.4

Using base prefix '/cvmfs/soft.computecanada.ca/easybuild/software/2017/Core/python/3.7.4'
New python executable in /localscratch/yinan.28716726.0/env/bin/python
Installing setuptools, pip, wheel...
done.
Ignoring pip: markers 'python_version < "3"' don't match your environment
Looking in links: /cvmfs/soft.computecanada.ca/custom/python/wheelhouse/nix/avx2, /cvmfs/soft.computecanada.ca/custom/python/wheelhouse/nix/generic, /cvmfs/soft.computecanada.ca/custom/python/wheelhouse/generic
Collecting pip
Installing collected packages: pip
  Found existing installation: pip 19.1.1
    Uninstalling pip-19.1.1:
      Successfully uninstalled pip-19.1.1
Successfully installed pip-21.2.3+computecanada
Looking in links: /cvmfs/soft.computecanada.ca/custom/python/wheelhouse/nix/avx2, /cvmfs/soft.computecanada.ca/custom/python/wheelhouse/nix/generic, /cvmfs/soft.computecanada.ca/custom/python/wheelhouse/generic
Processing /cvmfs/soft.computecanada.ca/custom/python/wheelhouse/generic/keras-2.8.0+computecanada-py2.py3-none-any.whl
Processing /cvmfs/soft.computecanada.ca/custom/python/wheelhouse/generic/Keras_Preprocessing-1.1.2+computecanada-py3-none-any.whl
Requirement already satisfied: matplotlib in /cvmfs/soft.computecanada.ca/easybuild/software/2017/Core/scipy-stack/2019a/lib/python3.7/site-packages (from -r requirements.txt (line 3)) (3.0.2)
Processing /cvmfs/soft.computecanada.ca/custom/python/wheelhouse/generic/nltk-3.6.5+computecanada-py3-none-any.whl
Processing /cvmfs/soft.computecanada.ca/custom/python/wheelhouse/generic/scikit_learn-0.22.1+computecanada-cp37-cp37m-linux_x86_64.whl
Processing /cvmfs/soft.computecanada.ca/custom/python/wheelhouse/generic/tensorboard-2.3.0+computecanada-py3-none-any.whl
Processing /cvmfs/soft.computecanada.ca/custom/python/wheelhouse/generic/tensorboard_plugin_wit-1.7.0+computecanada-py3-none-any.whl
Processing /cvmfs/soft.computecanada.ca/custom/python/wheelhouse/generic/tensorflow_gpu-2.3.0+computecanada-cp37-cp37m-linux_x86_64.whl
Processing /cvmfs/soft.computecanada.ca/custom/python/wheelhouse/generic/tensorflow_estimator-2.3.0+computecanada-py2.py3-none-any.whl
Processing /cvmfs/soft.computecanada.ca/custom/python/wheelhouse/generic/tokenizers-0.5.2+computecanada-cp37-cp37m-linux_x86_64.whl
Processing /cvmfs/soft.computecanada.ca/custom/python/wheelhouse/nix/avx2/torch-1.4.0+computecanada-cp37-cp37m-linux_x86_64.whl
Processing /cvmfs/soft.computecanada.ca/custom/python/wheelhouse/generic/torchtext-0.6.0+computecanada-py3-none-any.whl
Processing /cvmfs/soft.computecanada.ca/custom/python/wheelhouse/generic/torchvision-0.8.2+computecanada-cp37-cp37m-linux_x86_64.whl
Processing /cvmfs/soft.computecanada.ca/custom/python/wheelhouse/generic/transformers-2.5.1+computecanada-py3-none-any.whl
Processing /cvmfs/soft.computecanada.ca/custom/python/wheelhouse/generic/urllib3-1.26.7+computecanada-py2.py3-none-any.whl
Processing /cvmfs/soft.computecanada.ca/custom/python/wheelhouse/generic/joblib-1.1.0+computecanada-py2.py3-none-any.whl
ERROR: Could not find a version that satisfies the requirement regex>=2021.8.3 (from nltk) (from versions: 2018.1.10+computecanada, 2019.11.1+computecanada, 2020.11.13+computecanada)
ERROR: No matching distribution found for regex>=2021.8.3
Looking in links: /cvmfs/soft.computecanada.ca/custom/python/wheelhouse/nix/avx2, /cvmfs/soft.computecanada.ca/custom/python/wheelhouse/nix/generic, /cvmfs/soft.computecanada.ca/custom/python/wheelhouse/generic
ERROR: Could not find a version that satisfies the requirement numpy==1.20.0+computacanada (from versions: 1.15.0+computecanada, 1.15.2+computecanada, 1.15.4+computecanada, 1.16.0+computecanada, 1.16.2+computecanada, 1.16.3+computecanada, 1.17.4+computecanada, 1.18.1+computecanada, 1.18.4+computecanada, 1.19.1+computecanada, 1.19.2+computecanada, 1.20.2+computecanada)
ERROR: No matching distribution found for numpy==1.20.0+computacanada
Looking in links: /cvmfs/soft.computecanada.ca/custom/python/wheelhouse/nix/avx2, /cvmfs/soft.computecanada.ca/custom/python/wheelhouse/nix/generic, /cvmfs/soft.computecanada.ca/custom/python/wheelhouse/generic
Processing /cvmfs/soft.computecanada.ca/custom/python/wheelhouse/generic/wandb-0.12.5+computecanada-py2.py3-none-any.whl
Requirement already satisfied: python-dateutil>=2.6.1 in /cvmfs/soft.computecanada.ca/easybuild/software/2017/Core/scipy-stack/2019a/lib/python3.7/site-packages (from wandb) (2.7.5)
Processing /cvmfs/soft.computecanada.ca/custom/python/wheelhouse/generic/shortuuid-1.0.1+computecanada-py3-none-any.whl
Processing /cvmfs/soft.computecanada.ca/custom/python/wheelhouse/generic/protobuf-3.19.4+computecanada-py2.py3-none-any.whl
Processing /cvmfs/soft.computecanada.ca/custom/python/wheelhouse/generic/subprocess32-3.5.4+computecanada-py3-none-any.whl
Processing /cvmfs/soft.computecanada.ca/custom/python/wheelhouse/generic/GitPython-3.1.24+computecanada-py3-none-any.whl
Processing /cvmfs/soft.computecanada.ca/custom/python/wheelhouse/generic/promise-2.3+computecanada-py3-none-any.whl
Processing /cvmfs/soft.computecanada.ca/custom/python/wheelhouse/generic/six-1.16.0+computecanada-py2.py3-none-any.whl
Processing /cvmfs/soft.computecanada.ca/custom/python/wheelhouse/generic/click-8.0.3+computecanada-py3-none-any.whl
Processing /cvmfs/soft.computecanada.ca/custom/python/wheelhouse/generic/sentry_sdk-1.5.0+computecanada-py2.py3-none-any.whl
Processing /cvmfs/soft.computecanada.ca/custom/python/wheelhouse/generic/configparser-5.0.2+computecanada-py3-none-any.whl
Processing /cvmfs/soft.computecanada.ca/custom/python/wheelhouse/generic/PyYAML-5.3.1+computecanada-cp37-cp37m-linux_x86_64.whl
Processing /cvmfs/soft.computecanada.ca/custom/python/wheelhouse/generic/psutil-5.7.3+computecanada-cp37-cp37m-linux_x86_64.whl
Processing /cvmfs/soft.computecanada.ca/custom/python/wheelhouse/generic/yaspin-2.1.0+computecanada-py3-none-any.whl
Requirement already satisfied: requests<3,>=2.0.0 in /cvmfs/soft.computecanada.ca/easybuild/software/2017/Core/scipy-stack/2019a/lib/python3.7/site-packages (from wandb) (2.21.0)
Processing /cvmfs/soft.computecanada.ca/custom/python/wheelhouse/generic/pathtools-0.1.2+computecanada-py3-none-any.whl
Processing /cvmfs/soft.computecanada.ca/custom/python/wheelhouse/generic/docker_pycreds-0.4.0+computecanada-py2.py3-none-any.whl
Requirement already satisfied: importlib-metadata in /cvmfs/soft.computecanada.ca/easybuild/software/2017/Core/scipy-stack/2019a/lib/python3.7/site-packages (from Click!=8.0.0,>=7.0->wandb) (0.8)
Processing /cvmfs/soft.computecanada.ca/custom/python/wheelhouse/generic/typing_extensions-4.0.1+computecanada-py3-none-any.whl
Processing /cvmfs/soft.computecanada.ca/custom/python/wheelhouse/generic/gitdb-4.0.9+computecanada-py3-none-any.whl
Processing /cvmfs/soft.computecanada.ca/custom/python/wheelhouse/generic/smmap-5.0.0+computecanada-py3-none-any.whl
Requirement already satisfied: chardet<3.1.0,>=3.0.2 in /cvmfs/soft.computecanada.ca/easybuild/software/2017/Core/scipy-stack/2019a/lib/python3.7/site-packages (from requests<3,>=2.0.0->wandb) (3.0.4)
Requirement already satisfied: certifi>=2017.4.17 in /cvmfs/soft.computecanada.ca/easybuild/software/2017/Core/scipy-stack/2019a/lib/python3.7/site-packages (from requests<3,>=2.0.0->wandb) (2018.11.29)
Requirement already satisfied: urllib3<1.25,>=1.21.1 in /cvmfs/soft.computecanada.ca/easybuild/software/2017/Core/scipy-stack/2019a/lib/python3.7/site-packages (from requests<3,>=2.0.0->wandb) (1.24.1)
Requirement already satisfied: idna<2.9,>=2.5 in /cvmfs/soft.computecanada.ca/easybuild/software/2017/Core/scipy-stack/2019a/lib/python3.7/site-packages (from requests<3,>=2.0.0->wandb) (2.8)
Processing /cvmfs/soft.computecanada.ca/custom/python/wheelhouse/generic/termcolor-1.1.0+computecanada-py3-none-any.whl
Requirement already satisfied: zipp>=0.3.2 in /cvmfs/soft.computecanada.ca/easybuild/software/2017/Core/scipy-stack/2019a/lib/python3.7/site-packages (from importlib-metadata->Click!=8.0.0,>=7.0->wandb) (0.3.3)
Installing collected packages: smmap, typing-extensions, termcolor, six, gitdb, yaspin, subprocess32, shortuuid, sentry-sdk, PyYAML, psutil, protobuf, promise, pathtools, GitPython, docker-pycreds, configparser, Click, wandb
  Attempting uninstall: six
    Found existing installation: six 1.12.0
    Not uninstalling six at /cvmfs/soft.computecanada.ca/easybuild/software/2017/Core/scipy-stack/2019a/lib/python3.7/site-packages, outside environment /localscratch/yinan.28716726.0/env
    Can't uninstall 'six'. No files were found to uninstall.
Successfully installed Click-8.0.3+computecanada GitPython-3.1.24+computecanada PyYAML-5.3.1+computecanada configparser-5.0.2+computecanada docker-pycreds-0.4.0+computecanada gitdb-4.0.9+computecanada pathtools-0.1.2+computecanada promise-2.3+computecanada protobuf-3.19.4+computecanada psutil-5.7.3+computecanada sentry-sdk-1.5.0+computecanada shortuuid-1.0.1+computecanada six-1.16.0+computecanada smmap-5.0.0+computecanada subprocess32-3.5.4+computecanada termcolor-1.1.0+computecanada typing-extensions-4.0.1+computecanada wandb-0.12.5+computecanada yaspin-2.1.0+computecanada
Looking in links: /cvmfs/soft.computecanada.ca/custom/python/wheelhouse/nix/avx2, /cvmfs/soft.computecanada.ca/custom/python/wheelhouse/nix/generic, /cvmfs/soft.computecanada.ca/custom/python/wheelhouse/generic
ERROR: Could not find a version that satisfies the requirement sagemaker (from versions: none)
ERROR: No matching distribution found for sagemaker
Looking in links: /cvmfs/soft.computecanada.ca/custom/python/wheelhouse/nix/avx2, /cvmfs/soft.computecanada.ca/custom/python/wheelhouse/nix/generic, /cvmfs/soft.computecanada.ca/custom/python/wheelhouse/generic
Processing /cvmfs/soft.computecanada.ca/custom/python/wheelhouse/generic/torch-1.9.1+computecanada-cp37-cp37m-linux_x86_64.whl
Requirement already satisfied: typing-extensions in /localscratch/yinan.28716726.0/env/lib/python3.7/site-packages (from torch) (4.0.1+computecanada)
Installing collected packages: torch
Successfully installed torch-1.9.1+computecanada
Looking in links: /cvmfs/soft.computecanada.ca/custom/python/wheelhouse/nix/avx2, /cvmfs/soft.computecanada.ca/custom/python/wheelhouse/nix/generic, /cvmfs/soft.computecanada.ca/custom/python/wheelhouse/generic
Processing /cvmfs/soft.computecanada.ca/custom/python/wheelhouse/generic/transformers-2.5.1+computecanada-py3-none-any.whl
Processing /cvmfs/soft.computecanada.ca/custom/python/wheelhouse/generic/sentencepiece-0.1.91+computecanada-cp37-cp37m-linux_x86_64.whl
Requirement already satisfied: numpy in /cvmfs/soft.computecanada.ca/easybuild/software/2017/Core/scipy-stack/2019a/lib/python3.7/site-packages (from transformers==2.5.1+computecanada) (1.16.0)
Processing /cvmfs/soft.computecanada.ca/custom/python/wheelhouse/generic/sacremoses-0.0.46+computecanada-py3-none-any.whl
Processing /cvmfs/soft.computecanada.ca/custom/python/wheelhouse/generic/tqdm-4.63.0+computecanada-py2.py3-none-any.whl
Processing /cvmfs/soft.computecanada.ca/custom/python/wheelhouse/generic/tokenizers-0.5.2+computecanada-cp37-cp37m-linux_x86_64.whl
Processing /cvmfs/soft.computecanada.ca/custom/python/wheelhouse/generic/boto3-1.20.52+computecanada-py3-none-any.whl
Requirement already satisfied: requests in /cvmfs/soft.computecanada.ca/easybuild/software/2017/Core/scipy-stack/2019a/lib/python3.7/site-packages (from transformers==2.5.1+computecanada) (2.21.0)
Processing /cvmfs/soft.computecanada.ca/custom/python/wheelhouse/generic/regex-2020.11.13+computecanada-cp37-cp37m-linux_x86_64.whl
Processing /cvmfs/soft.computecanada.ca/custom/python/wheelhouse/generic/filelock-3.4.2+computecanada-py3-none-any.whl
Processing /cvmfs/soft.computecanada.ca/custom/python/wheelhouse/generic/botocore-1.23.52+computecanada-py3-none-any.whl
Processing /cvmfs/soft.computecanada.ca/custom/python/wheelhouse/generic/s3transfer-0.5.1+computecanada-py3-none-any.whl
Processing /cvmfs/soft.computecanada.ca/custom/python/wheelhouse/generic/jmespath-0.10.0+computecanada-py2.py3-none-any.whl
Requirement already satisfied: python-dateutil<3.0.0,>=2.1 in /cvmfs/soft.computecanada.ca/easybuild/software/2017/Core/scipy-stack/2019a/lib/python3.7/site-packages (from botocore<1.24.0,>=1.23.52->boto3->transformers==2.5.1+computecanada) (2.7.5)
Processing /cvmfs/soft.computecanada.ca/custom/python/wheelhouse/generic/urllib3-1.26.8+computecanada-py2.py3-none-any.whl
Requirement already satisfied: six>=1.5 in /localscratch/yinan.28716726.0/env/lib/python3.7/site-packages (from python-dateutil<3.0.0,>=2.1->botocore<1.24.0,>=1.23.52->boto3->transformers==2.5.1+computecanada) (1.16.0+computecanada)
Requirement already satisfied: certifi>=2017.4.17 in /cvmfs/soft.computecanada.ca/easybuild/software/2017/Core/scipy-stack/2019a/lib/python3.7/site-packages (from requests->transformers==2.5.1+computecanada) (2018.11.29)
Requirement already satisfied: chardet<3.1.0,>=3.0.2 in /cvmfs/soft.computecanada.ca/easybuild/software/2017/Core/scipy-stack/2019a/lib/python3.7/site-packages (from requests->transformers==2.5.1+computecanada) (3.0.4)
Requirement already satisfied: idna<2.9,>=2.5 in /cvmfs/soft.computecanada.ca/easybuild/software/2017/Core/scipy-stack/2019a/lib/python3.7/site-packages (from requests->transformers==2.5.1+computecanada) (2.8)
Processing /cvmfs/soft.computecanada.ca/custom/python/wheelhouse/generic/requests-2.27.1+computecanada-py2.py3-none-any.whl
Processing /cvmfs/soft.computecanada.ca/custom/python/wheelhouse/generic/charset_normalizer-2.0.11+computecanada-py3-none-any.whl
Processing /cvmfs/soft.computecanada.ca/custom/python/wheelhouse/generic/joblib-1.1.0+computecanada-py2.py3-none-any.whl
Requirement already satisfied: click in /localscratch/yinan.28716726.0/env/lib/python3.7/site-packages (from sacremoses->transformers==2.5.1+computecanada) (8.0.3+computecanada)
Requirement already satisfied: importlib-metadata in /cvmfs/soft.computecanada.ca/easybuild/software/2017/Core/scipy-stack/2019a/lib/python3.7/site-packages (from click->sacremoses->transformers==2.5.1+computecanada) (0.8)
Requirement already satisfied: zipp>=0.3.2 in /cvmfs/soft.computecanada.ca/easybuild/software/2017/Core/scipy-stack/2019a/lib/python3.7/site-packages (from importlib-metadata->click->sacremoses->transformers==2.5.1+computecanada) (0.3.3)
Installing collected packages: urllib3, jmespath, botocore, tqdm, s3transfer, regex, joblib, charset-normalizer, tokenizers, sentencepiece, sacremoses, requests, filelock, boto3, transformers
  Attempting uninstall: urllib3
    Found existing installation: urllib3 1.24.1
    Not uninstalling urllib3 at /cvmfs/soft.computecanada.ca/easybuild/software/2017/Core/scipy-stack/2019a/lib/python3.7/site-packages, outside environment /localscratch/yinan.28716726.0/env
    Can't uninstall 'urllib3'. No files were found to uninstall.
  Attempting uninstall: requests
    Found existing installation: requests 2.21.0
    Not uninstalling requests at /cvmfs/soft.computecanada.ca/easybuild/software/2017/Core/scipy-stack/2019a/lib/python3.7/site-packages, outside environment /localscratch/yinan.28716726.0/env
    Can't uninstall 'requests'. No files were found to uninstall.
Successfully installed boto3-1.20.52+computecanada botocore-1.23.52+computecanada charset-normalizer-2.0.11+computecanada filelock-3.4.2+computecanada jmespath-0.10.0+computecanada joblib-1.1.0+computecanada regex-2020.11.13+computecanada requests-2.27.1+computecanada s3transfer-0.5.1+computecanada sacremoses-0.0.46+computecanada sentencepiece-0.1.91+computecanada tokenizers-0.5.2+computecanada tqdm-4.63.0+computecanada transformers-2.5.1+computecanada urllib3-1.26.8+computecanada
Looking in links: /cvmfs/soft.computecanada.ca/custom/python/wheelhouse/nix/avx2, /cvmfs/soft.computecanada.ca/custom/python/wheelhouse/nix/generic, /cvmfs/soft.computecanada.ca/custom/python/wheelhouse/generic
Processing /cvmfs/soft.computecanada.ca/custom/python/wheelhouse/generic/tensorflow_gpu-2.3.0+computecanada-cp37-cp37m-linux_x86_64.whl
Processing /cvmfs/soft.computecanada.ca/custom/python/wheelhouse/generic/tensorflow_estimator-2.3.0+computecanada-py2.py3-none-any.whl
Processing /cvmfs/soft.computecanada.ca/custom/python/wheelhouse/generic/tensorboard-2.8.0+computecanada-py3-none-any.whl
Processing /cvmfs/soft.computecanada.ca/custom/python/wheelhouse/generic/opt_einsum-3.3.0+computecanada-py3-none-any.whl
Processing /cvmfs/soft.computecanada.ca/custom/python/wheelhouse/generic/absl_py-1.0.0+computecanada-py3-none-any.whl
Requirement already satisfied: termcolor>=1.1.0 in /localscratch/yinan.28716726.0/env/lib/python3.7/site-packages (from tensorflow_gpu==2.3.0+computecanada) (1.1.0+computecanada)
Requirement already satisfied: numpy<1.19.0,>=1.16.0 in /cvmfs/soft.computecanada.ca/easybuild/software/2017/Core/scipy-stack/2019a/lib/python3.7/site-packages (from tensorflow_gpu==2.3.0+computecanada) (1.16.0)
Processing /cvmfs/soft.computecanada.ca/custom/python/wheelhouse/nix/avx2/h5py-2.10.0+computecanada-cp37-cp37m-linux_x86_64.whl
Processing /cvmfs/soft.computecanada.ca/custom/python/wheelhouse/generic/google_pasta-0.2.0+computecanada-py3-none-any.whl
Processing /cvmfs/soft.computecanada.ca/custom/python/wheelhouse/generic/Keras_Preprocessing-1.1.2+computecanada-py3-none-any.whl
Processing /cvmfs/soft.computecanada.ca/custom/python/wheelhouse/generic/wrapt-1.11.2+computecanada-cp37-cp37m-linux_x86_64.whl
Requirement already satisfied: wheel>=0.26 in /localscratch/yinan.28716726.0/env/lib/python3.7/site-packages (from tensorflow_gpu==2.3.0+computecanada) (0.33.4)
Processing /cvmfs/soft.computecanada.ca/custom/python/wheelhouse/generic/grpcio-1.38.0+computecanada-cp37-cp37m-linux_x86_64.whl
Requirement already satisfied: protobuf>=3.9.2 in /localscratch/yinan.28716726.0/env/lib/python3.7/site-packages (from tensorflow_gpu==2.3.0+computecanada) (3.19.4+computecanada)
Processing /cvmfs/soft.computecanada.ca/custom/python/wheelhouse/nix/generic/scipy-1.4.1+computecanada-cp37-cp37m-linux_x86_64.whl
Processing /cvmfs/soft.computecanada.ca/custom/python/wheelhouse/generic/gast-0.3.3+computecanada-py3-none-any.whl
Processing /cvmfs/soft.computecanada.ca/custom/python/wheelhouse/generic/astunparse-1.6.3+computecanada-py2.py3-none-any.whl
Requirement already satisfied: six>=1.12.0 in /localscratch/yinan.28716726.0/env/lib/python3.7/site-packages (from tensorflow_gpu==2.3.0+computecanada) (1.16.0+computecanada)
Processing /cvmfs/soft.computecanada.ca/custom/python/wheelhouse/generic/Werkzeug-2.0.3+computecanada-py3-none-any.whl
Processing /cvmfs/soft.computecanada.ca/custom/python/wheelhouse/generic/tensorboard_data_server-0.6.1+computecanada-py3-none-linux_x86_64.whl
Processing /cvmfs/soft.computecanada.ca/custom/python/wheelhouse/generic/google_auth_oauthlib-0.4.6+computecanada-py2.py3-none-any.whl
Processing /cvmfs/soft.computecanada.ca/custom/python/wheelhouse/generic/Markdown-3.3.6+computecanada-py3-none-any.whl
Requirement already satisfied: setuptools>=41.0.0 in /localscratch/yinan.28716726.0/env/lib/python3.7/site-packages (from tensorboard<3,>=2.3.0->tensorflow_gpu==2.3.0+computecanada) (41.0.1)
Processing /cvmfs/soft.computecanada.ca/custom/python/wheelhouse/generic/google_auth-2.3.3+computecanada-py2.py3-none-any.whl
Requirement already satisfied: requests<3,>=2.21.0 in /localscratch/yinan.28716726.0/env/lib/python3.7/site-packages (from tensorboard<3,>=2.3.0->tensorflow_gpu==2.3.0+computecanada) (2.27.1+computecanada)
Processing /cvmfs/soft.computecanada.ca/custom/python/wheelhouse/generic/tensorboard_plugin_wit-1.8.0+computecanada-py3-none-any.whl
Processing /cvmfs/soft.computecanada.ca/custom/python/wheelhouse/generic/rsa-4.8+computecanada-py3-none-any.whl
Processing /cvmfs/soft.computecanada.ca/custom/python/wheelhouse/generic/pyasn1_modules-0.2.8+computecanada-py2.py3-none-any.whl
Processing /cvmfs/soft.computecanada.ca/custom/python/wheelhouse/generic/cachetools-4.2.4+computecanada-py3-none-any.whl
Processing /cvmfs/soft.computecanada.ca/custom/python/wheelhouse/generic/requests_oauthlib-1.3.0+computecanada-py2.py3-none-any.whl
Processing /cvmfs/soft.computecanada.ca/custom/python/wheelhouse/generic/importlib_metadata-4.10.1+computecanada-py3-none-any.whl
Requirement already satisfied: typing-extensions>=3.6.4 in /localscratch/yinan.28716726.0/env/lib/python3.7/site-packages (from importlib-metadata>=4.4->markdown>=2.6.8->tensorboard<3,>=2.3.0->tensorflow_gpu==2.3.0+computecanada) (4.0.1+computecanada)
Processing /cvmfs/soft.computecanada.ca/custom/python/wheelhouse/generic/zipp-3.7.0+computecanada-py3-none-any.whl
Processing /cvmfs/soft.computecanada.ca/custom/python/wheelhouse/generic/pyasn1-0.4.8+computecanada-py2.py3-none-any.whl
Requirement already satisfied: idna<4,>=2.5 in /cvmfs/soft.computecanada.ca/easybuild/software/2017/Core/scipy-stack/2019a/lib/python3.7/site-packages (from requests<3,>=2.21.0->tensorboard<3,>=2.3.0->tensorflow_gpu==2.3.0+computecanada) (2.8)
Requirement already satisfied: charset-normalizer~=2.0.0 in /localscratch/yinan.28716726.0/env/lib/python3.7/site-packages (from requests<3,>=2.21.0->tensorboard<3,>=2.3.0->tensorflow_gpu==2.3.0+computecanada) (2.0.11+computecanada)
Requirement already satisfied: certifi>=2017.4.17 in /cvmfs/soft.computecanada.ca/easybuild/software/2017/Core/scipy-stack/2019a/lib/python3.7/site-packages (from requests<3,>=2.21.0->tensorboard<3,>=2.3.0->tensorflow_gpu==2.3.0+computecanada) (2018.11.29)
Requirement already satisfied: urllib3<1.27,>=1.21.1 in /localscratch/yinan.28716726.0/env/lib/python3.7/site-packages (from requests<3,>=2.21.0->tensorboard<3,>=2.3.0->tensorflow_gpu==2.3.0+computecanada) (1.26.8+computecanada)
Processing /cvmfs/soft.computecanada.ca/custom/python/wheelhouse/generic/oauthlib-3.1.1+computecanada-py2.py3-none-any.whl
Installing collected packages: pyasn1, zipp, rsa, pyasn1-modules, oauthlib, cachetools, requests-oauthlib, importlib-metadata, google-auth, werkzeug, tensorboard-plugin-wit, tensorboard-data-server, markdown, grpcio, google-auth-oauthlib, absl-py, wrapt, tensorflow-estimator, tensorboard, scipy, opt-einsum, keras-preprocessing, h5py, google-pasta, gast, astunparse, tensorflow-gpu
  Attempting uninstall: pyasn1
    Found existing installation: pyasn1 0.4.3
    Not uninstalling pyasn1 at /cvmfs/soft.computecanada.ca/easybuild/software/2017/Core/scipy-stack/2019a/lib/python3.7/site-packages, outside environment /localscratch/yinan.28716726.0/env
    Can't uninstall 'pyasn1'. No files were found to uninstall.
  Attempting uninstall: zipp
    Found existing installation: zipp 0.3.3
    Not uninstalling zipp at /cvmfs/soft.computecanada.ca/easybuild/software/2017/Core/scipy-stack/2019a/lib/python3.7/site-packages, outside environment /localscratch/yinan.28716726.0/env
    Can't uninstall 'zipp'. No files were found to uninstall.
  Attempting uninstall: importlib-metadata
    Found existing installation: importlib-metadata 0.8
    Not uninstalling importlib-metadata at /cvmfs/soft.computecanada.ca/easybuild/software/2017/Core/scipy-stack/2019a/lib/python3.7/site-packages, outside environment /localscratch/yinan.28716726.0/env
    Can't uninstall 'importlib-metadata'. No files were found to uninstall.
  Attempting uninstall: scipy
    Found existing installation: scipy 1.2.0
    Not uninstalling scipy at /cvmfs/soft.computecanada.ca/easybuild/software/2017/Core/scipy-stack/2019a/lib/python3.7/site-packages, outside environment /localscratch/yinan.28716726.0/env
    Can't uninstall 'scipy'. No files were found to uninstall.
Successfully installed absl-py-1.0.0+computecanada astunparse-1.6.3+computecanada cachetools-4.2.4+computecanada gast-0.3.3+computecanada google-auth-2.3.3+computecanada google-auth-oauthlib-0.4.6+computecanada google-pasta-0.2.0+computecanada grpcio-1.38.0+computecanada h5py-2.10.0+computecanada importlib-metadata-4.10.1+computecanada keras-preprocessing-1.1.2+computecanada markdown-3.3.6+computecanada oauthlib-3.1.1+computecanada opt-einsum-3.3.0+computecanada pyasn1-0.4.8+computecanada pyasn1-modules-0.2.8+computecanada requests-oauthlib-1.3.0+computecanada rsa-4.8+computecanada scipy-1.4.1+computecanada tensorboard-2.8.0+computecanada tensorboard-data-server-0.6.1+computecanada tensorboard-plugin-wit-1.8.0+computecanada tensorflow-estimator-2.3.0+computecanada tensorflow-gpu-2.3.0+computecanada werkzeug-2.0.3+computecanada wrapt-1.11.2+computecanada zipp-3.7.0+computecanada
Looking in links: /cvmfs/soft.computecanada.ca/custom/python/wheelhouse/nix/avx2, /cvmfs/soft.computecanada.ca/custom/python/wheelhouse/nix/generic, /cvmfs/soft.computecanada.ca/custom/python/wheelhouse/generic
Processing /cvmfs/soft.computecanada.ca/custom/python/wheelhouse/generic/keras-2.8.0+computecanada-py2.py3-none-any.whl
Installing collected packages: Keras
Successfully installed Keras-2.8.0+computecanada
Looking in links: /cvmfs/soft.computecanada.ca/custom/python/wheelhouse/nix/avx2, /cvmfs/soft.computecanada.ca/custom/python/wheelhouse/nix/generic, /cvmfs/soft.computecanada.ca/custom/python/wheelhouse/generic
Processing /cvmfs/soft.computecanada.ca/custom/python/wheelhouse/generic/urllib3-1.26.7+computecanada-py2.py3-none-any.whl
Installing collected packages: urllib3
  Attempting uninstall: urllib3
    Found existing installation: urllib3 1.26.8+computecanada
    Uninstalling urllib3-1.26.8+computecanada:
      Successfully uninstalled urllib3-1.26.8+computecanada
Successfully installed urllib3-1.26.7+computecanada
Looking in links: /cvmfs/soft.computecanada.ca/custom/python/wheelhouse/nix/avx2, /cvmfs/soft.computecanada.ca/custom/python/wheelhouse/nix/generic, /cvmfs/soft.computecanada.ca/custom/python/wheelhouse/generic
Processing /cvmfs/soft.computecanada.ca/custom/python/wheelhouse/generic/nltk-3.7+computecanada-py3-none-any.whl
Requirement already satisfied: joblib in /localscratch/yinan.28716726.0/env/lib/python3.7/site-packages (from nltk) (1.1.0+computecanada)
Requirement already satisfied: tqdm in /localscratch/yinan.28716726.0/env/lib/python3.7/site-packages (from nltk) (4.63.0+computecanada)
Requirement already satisfied: click in /localscratch/yinan.28716726.0/env/lib/python3.7/site-packages (from nltk) (8.0.3+computecanada)
Processing /cvmfs/soft.computecanada.ca/custom/python/wheelhouse/generic/nltk-3.6.5+computecanada-py3-none-any.whl
Processing /cvmfs/soft.computecanada.ca/custom/python/wheelhouse/generic/nltk-3.6.3+computecanada-py3-none-any.whl
Requirement already satisfied: regex in /localscratch/yinan.28716726.0/env/lib/python3.7/site-packages (from nltk) (2020.11.13+computecanada)
Requirement already satisfied: importlib-metadata in /localscratch/yinan.28716726.0/env/lib/python3.7/site-packages (from click->nltk) (4.10.1+computecanada)
Requirement already satisfied: zipp>=0.5 in /localscratch/yinan.28716726.0/env/lib/python3.7/site-packages (from importlib-metadata->click->nltk) (3.7.0+computecanada)
Requirement already satisfied: typing-extensions>=3.6.4 in /localscratch/yinan.28716726.0/env/lib/python3.7/site-packages (from importlib-metadata->click->nltk) (4.0.1+computecanada)
Installing collected packages: nltk
Successfully installed nltk-3.6.3+computecanada
Looking in links: /cvmfs/soft.computecanada.ca/custom/python/wheelhouse/nix/avx2, /cvmfs/soft.computecanada.ca/custom/python/wheelhouse/nix/generic, /cvmfs/soft.computecanada.ca/custom/python/wheelhouse/generic
Processing /cvmfs/soft.computecanada.ca/custom/python/wheelhouse/generic/scikit_learn-0.22.1+computecanada-cp37-cp37m-linux_x86_64.whl
Requirement already satisfied: numpy>=1.11.0 in /cvmfs/soft.computecanada.ca/easybuild/software/2017/Core/scipy-stack/2019a/lib/python3.7/site-packages (from scikit-learn==0.22.1) (1.16.0)
Requirement already satisfied: joblib>=0.11 in /localscratch/yinan.28716726.0/env/lib/python3.7/site-packages (from scikit-learn==0.22.1) (1.1.0+computecanada)
Requirement already satisfied: scipy>=0.17.0 in /localscratch/yinan.28716726.0/env/lib/python3.7/site-packages (from scikit-learn==0.22.1) (1.4.1+computecanada)
Installing collected packages: scikit-learn
Successfully installed scikit-learn-0.22.1+computecanada
Looking in links: /cvmfs/soft.computecanada.ca/custom/python/wheelhouse/nix/avx2, /cvmfs/soft.computecanada.ca/custom/python/wheelhouse/nix/generic, /cvmfs/soft.computecanada.ca/custom/python/wheelhouse/generic
Requirement already satisfied: tokenizers==0.5.2 in /localscratch/yinan.28716726.0/env/lib/python3.7/site-packages (0.5.2+computecanada)
wandb: Appending key for api.wandb.ai to your netrc file: /home/yinan/.netrc
Starting Task
2022-03-11 04:28:45.360090: I tensorflow/stream_executor/platform/default/dso_loader.cc:48] Successfully opened dynamic library libcudart.so.10.1
[nltk_data] Downloading package stopwords to /home/yinan/nltk_data...
[nltk_data]   Package stopwords is already up-to-date!
[nltk_data] Downloading package wordnet to /home/yinan/nltk_data...
[nltk_data]   Package wordnet is already up-to-date!
wandb: Currently logged in as: yinanazhou (use `wandb login --relogin` to force relogin)
wandb: wandb version 0.12.11 is available!  To upgrade, please run:
wandb:  $ pip install wandb --upgrade
2022-03-11 04:28:59.427958: I tensorflow/stream_executor/platform/default/dso_loader.cc:48] Successfully opened dynamic library libcudart.so.10.1
wandb: Tracking run with wandb version 0.12.5
wandb: Syncing run golden-glade-1
wandb: ⭐️ View project at https://wandb.ai/yinanazhou/xl_512_bs_8_lr_1e07_es_10_lc_True_nr_False_sr_True_stem_False_lemma_True_repeat_1_fold_1
wandb: 🚀 View run at https://wandb.ai/yinanazhou/xl_512_bs_8_lr_1e07_es_10_lc_True_nr_False_sr_True_stem_False_lemma_True_repeat_1_fold_1/runs/1hmn461g
wandb: Run data is saved locally in /project/6002780/yinan/Thesis_MER_Lyrics/lyric-emotion/wandb/run-20220311_042857-1hmn461g
wandb: Run `wandb offline` to turn off syncing.

Validation loss decreased (inf --> 1.460821).  Saving model ...
Validation loss decreased (1.460821 --> 1.458138).  Saving model ...
Validation loss decreased (1.458138 --> 1.455514).  Saving model ...
Validation loss decreased (1.455514 --> 1.452858).  Saving model ...
Validation loss decreased (1.452858 --> 1.450369).  Saving model ...
Validation loss decreased (1.450369 --> 1.447899).  Saving model ...
Validation loss decreased (1.447899 --> 1.445537).  Saving model ...
Validation loss decreased (1.445537 --> 1.443302).  Saving model ...
Validation loss decreased (1.443302 --> 1.441092).  Saving model ...
Validation loss decreased (1.441092 --> 1.438798).  Saving model ...
Validation loss decreased (1.438798 --> 1.436546).  Saving model ...
Validation loss decreased (1.436546 --> 1.434470).  Saving model ...
Validation loss decreased (1.434470 --> 1.432479).  Saving model ...
Validation loss decreased (1.432479 --> 1.430457).  Saving model ...
Validation loss decreased (1.430457 --> 1.428485).  Saving model ...
Validation loss decreased (1.428485 --> 1.426590).  Saving model ...
Validation loss decreased (1.426590 --> 1.424677).  Saving model ...
Validation loss decreased (1.424677 --> 1.422869).  Saving model ...
Validation loss decreased (1.422869 --> 1.421059).  Saving model ...
Validation loss decreased (1.421059 --> 1.419300).  Saving model ...
Validation loss decreased (1.419300 --> 1.417481).  Saving model ...
Validation loss decreased (1.417481 --> 1.415791).  Saving model ...
Validation loss decreased (1.415791 --> 1.414181).  Saving model ...
Validation loss decreased (1.414181 --> 1.412646).  Saving model ...
Validation loss decreased (1.412646 --> 1.411077).  Saving model ...
Validation loss decreased (1.411077 --> 1.409556).  Saving model ...
Validation loss decreased (1.409556 --> 1.408088).  Saving model ...
Validation loss decreased (1.408088 --> 1.406654).  Saving model ...
Validation loss decreased (1.406654 --> 1.405363).  Saving model ...
Validation loss decreased (1.405363 --> 1.404002).  Saving model ...
Validation loss decreased (1.404002 --> 1.402662).  Saving model ...
Validation loss decreased (1.402662 --> 1.401263).  Saving model ...
Validation loss decreased (1.401263 --> 1.399977).  Saving model ...
Validation loss decreased (1.399977 --> 1.398699).  Saving model ...
Validation loss decreased (1.398699 --> 1.397509).  Saving model ...
Validation loss decreased (1.397509 --> 1.396221).  Saving model ...
Validation loss decreased (1.396221 --> 1.394945).  Saving model ...
Validation loss decreased (1.394945 --> 1.393863).  Saving model ...
Validation loss decreased (1.393863 --> 1.392715).  Saving model ...
Validation loss decreased (1.392715 --> 1.391629).  Saving model ...
Validation loss decreased (1.391629 --> 1.390514).  Saving model ...
Validation loss decreased (1.390514 --> 1.389344).  Saving model ...
Validation loss decreased (1.389344 --> 1.388282).  Saving model ...
Validation loss decreased (1.388282 --> 1.387232).  Saving model ...
Validation loss decreased (1.387232 --> 1.386093).  Saving model ...
Validation loss decreased (1.386093 --> 1.385094).  Saving model ...
Validation loss decreased (1.385094 --> 1.384127).  Saving model ...
Validation loss decreased (1.384127 --> 1.383142).  Saving model ...
Validation loss decreased (1.383142 --> 1.382159).  Saving model ...
Validation loss decreased (1.382159 --> 1.381185).  Saving model ...
Validation loss decreased (1.381185 --> 1.380315).  Saving model ...
Validation loss decreased (1.380315 --> 1.379452).  Saving model ...
Validation loss decreased (1.379452 --> 1.378503).  Saving model ...
Validation loss decreased (1.378503 --> 1.377634).  Saving model ...
Validation loss decreased (1.377634 --> 1.376796).  Saving model ...
Validation loss decreased (1.376796 --> 1.375935).  Saving model ...
Validation loss decreased (1.375935 --> 1.375007).  Saving model ...
Validation loss decreased (1.375007 --> 1.374166).  Saving model ...
Validation loss decreased (1.374166 --> 1.373287).  Saving model ...
Validation loss decreased (1.373287 --> 1.372496).  Saving model ...
Validation loss decreased (1.372496 --> 1.371644).  Saving model ...
Validation loss decreased (1.371644 --> 1.370787).  Saving model ...
Validation loss decreased (1.370787 --> 1.369998).  Saving model ...
Validation loss decreased (1.369998 --> 1.369225).  Saving model ...
Validation loss decreased (1.369225 --> 1.368478).  Saving model ...
Validation loss decreased (1.368478 --> 1.367696).  Saving model ...
Validation loss decreased (1.367696 --> 1.367009).  Saving model ...
Validation loss decreased (1.367009 --> 1.366260).  Saving model ...
Validation loss decreased (1.366260 --> 1.365552).  Saving model ...
Validation loss decreased (1.365552 --> 1.364893).  Saving model ...
Validation loss decreased (1.364893 --> 1.364220).  Saving model ...
Validation loss decreased (1.364220 --> 1.363497).  Saving model ...
Validation loss decreased (1.363497 --> 1.362718).  Saving model ...
Validation loss decreased (1.362718 --> 1.362009).  Saving model ...
Validation loss decreased (1.362009 --> 1.361345).  Saving model ...
Validation loss decreased (1.361345 --> 1.360629).  Saving model ...
Validation loss decreased (1.360629 --> 1.360040).  Saving model ...
Validation loss decreased (1.360040 --> 1.359411).  Saving model ...
Validation loss decreased (1.359411 --> 1.358764).  Saving model ...
Validation loss decreased (1.358764 --> 1.358087).  Saving model ...
Validation loss decreased (1.358087 --> 1.357394).  Saving model ...
Validation loss decreased (1.357394 --> 1.356786).  Saving model ...
Validation loss decreased (1.356786 --> 1.356145).  Saving model ...
Validation loss decreased (1.356145 --> 1.355568).  Saving model ...
Validation loss decreased (1.355568 --> 1.354948).  Saving model ...
Validation loss decreased (1.354948 --> 1.354315).  Saving model ...
Validation loss decreased (1.354315 --> 1.353658).  Saving model ...
Validation loss decreased (1.353658 --> 1.352951).  Saving model ...
Validation loss decreased (1.352951 --> 1.352372).  Saving model ...
Validation loss decreased (1.352372 --> 1.351774).  Saving model ...
Validation loss decreased (1.351774 --> 1.351181).  Saving model ...
Validation loss decreased (1.351181 --> 1.350621).  Saving model ...
Validation loss decreased (1.350621 --> 1.350059).  Saving model ...
Validation loss decreased (1.350059 --> 1.349452).  Saving model ...
Validation loss decreased (1.349452 --> 1.348825).  Saving model ...
Validation loss decreased (1.348825 --> 1.348234).  Saving model ...
Validation loss decreased (1.348234 --> 1.347621).  Saving model ...
Validation loss decreased (1.347621 --> 1.347019).  Saving model ...
Validation loss decreased (1.347019 --> 1.346472).  Saving model ...
Validation loss decreased (1.346472 --> 1.345858).  Saving model ...
Validation loss decreased (1.345858 --> 1.345218).  Saving model ...
Validation loss decreased (1.345218 --> 1.344636).  Saving model ...
Validation loss decreased (1.344636 --> 1.344005).  Saving model ...
Validation loss decreased (1.344005 --> 1.343404).  Saving model ...
Validation loss decreased (1.343404 --> 1.342775).  Saving model ...
Validation loss decreased (1.342775 --> 1.342162).  Saving model ...
Validation loss decreased (1.342162 --> 1.341606).  Saving model ...
Validation loss decreased (1.341606 --> 1.341016).  Saving model ...
Validation loss decreased (1.341016 --> 1.340434).  Saving model ...
Validation loss decreased (1.340434 --> 1.339831).  Saving model ...
Validation loss decreased (1.339831 --> 1.339240).  Saving model ...
Validation loss decreased (1.339240 --> 1.338668).  Saving model ...
Validation loss decreased (1.338668 --> 1.338099).  Saving model ...
Validation loss decreased (1.338099 --> 1.337534).  Saving model ...
Validation loss decreased (1.337534 --> 1.337007).  Saving model ...
Validation loss decreased (1.337007 --> 1.336520).  Saving model ...
Validation loss decreased (1.336520 --> 1.335947).  Saving model ...
Validation loss decreased (1.335947 --> 1.335380).  Saving model ...
Validation loss decreased (1.335380 --> 1.334788).  Saving model ...
Validation loss decreased (1.334788 --> 1.334222).  Saving model ...
Validation loss decreased (1.334222 --> 1.333661).  Saving model ...
Validation loss decreased (1.333661 --> 1.333038).  Saving model ...
Validation loss decreased (1.333038 --> 1.332440).  Saving model ...
Validation loss decreased (1.332440 --> 1.331827).  Saving model ...
Validation loss decreased (1.331827 --> 1.331299).  Saving model ...
Validation loss decreased (1.331299 --> 1.330729).  Saving model ...
Validation loss decreased (1.330729 --> 1.330214).  Saving model ...
Validation loss decreased (1.330214 --> 1.329565).  Saving model ...
Validation loss decreased (1.329565 --> 1.328954).  Saving model ...
Validation loss decreased (1.328954 --> 1.328346).  Saving model ...
Validation loss decreased (1.328346 --> 1.327828).  Saving model ...
Validation loss decreased (1.327828 --> 1.327326).  Saving model ...
Validation loss decreased (1.327326 --> 1.326774).  Saving model ...
Validation loss decreased (1.326774 --> 1.326207).  Saving model ...
Validation loss decreased (1.326207 --> 1.325567).  Saving model ...
Validation loss decreased (1.325567 --> 1.324900).  Saving model ...
Validation loss decreased (1.324900 --> 1.324366).  Saving model ...
Validation loss decreased (1.324366 --> 1.323704).  Saving model ...
Validation loss decreased (1.323704 --> 1.323043).  Saving model ...
Validation loss decreased (1.323043 --> 1.322440).  Saving model ...
Validation loss decreased (1.322440 --> 1.321865).  Saving model ...
Validation loss decreased (1.321865 --> 1.321234).  Saving model ...
Validation loss decreased (1.321234 --> 1.320634).  Saving model ...
Validation loss decreased (1.320634 --> 1.320088).  Saving model ...
Validation loss decreased (1.320088 --> 1.319416).  Saving model ...
Validation loss decreased (1.319416 --> 1.318844).  Saving model ...
Validation loss decreased (1.318844 --> 1.318212).  Saving model ...
Validation loss decreased (1.318212 --> 1.317565).  Saving model ...
Validation loss decreased (1.317565 --> 1.316947).  Saving model ...
Validation loss decreased (1.316947 --> 1.316333).  Saving model ...
Validation loss decreased (1.316333 --> 1.315798).  Saving model ...
Validation loss decreased (1.315798 --> 1.315227).  Saving model ...
Validation loss decreased (1.315227 --> 1.314583).  Saving model ...
Validation loss decreased (1.314583 --> 1.313997).  Saving model ...
Validation loss decreased (1.313997 --> 1.313375).  Saving model ...
Validation loss decreased (1.313375 --> 1.312842).  Saving model ...
Validation loss decreased (1.312842 --> 1.312294).  Saving model ...
Validation loss decreased (1.312294 --> 1.311660).  Saving model ...
Validation loss decreased (1.311660 --> 1.311049).  Saving model ...
Validation loss decreased (1.311049 --> 1.310475).  Saving model ...
Validation loss decreased (1.310475 --> 1.309906).  Saving model ...
Validation loss decreased (1.309906 --> 1.309319).  Saving model ...
Validation loss decreased (1.309319 --> 1.308744).  Saving model ...
Validation loss decreased (1.308744 --> 1.308041).  Saving model ...
Validation loss decreased (1.308041 --> 1.307379).  Saving model ...
Validation loss decreased (1.307379 --> 1.306707).  Saving model ...
Validation loss decreased (1.306707 --> 1.306031).  Saving model ...
Validation loss decreased (1.306031 --> 1.305384).  Saving model ...
Validation loss decreased (1.305384 --> 1.304780).  Saving model ...
Validation loss decreased (1.304780 --> 1.304172).  Saving model ...
Validation loss decreased (1.304172 --> 1.303531).  Saving model ...
Validation loss decreased (1.303531 --> 1.302928).  Saving model ...
Validation loss decreased (1.302928 --> 1.302333).  Saving model ...
Validation loss decreased (1.302333 --> 1.301740).  Saving model ...
Validation loss decreased (1.301740 --> 1.301081).  Saving model ...
Validation loss decreased (1.301081 --> 1.300505).  Saving model ...
Validation loss decreased (1.300505 --> 1.299842).  Saving model ...
Validation loss decreased (1.299842 --> 1.299168).  Saving model ...
Validation loss decreased (1.299168 --> 1.298583).  Saving model ...
Validation loss decreased (1.298583 --> 1.298028).  Saving model ...
Validation loss decreased (1.298028 --> 1.297383).  Saving model ...
Validation loss decreased (1.297383 --> 1.296679).  Saving model ...
Validation loss decreased (1.296679 --> 1.295985).  Saving model ...
Validation loss decreased (1.295985 --> 1.295345).  Saving model ...
Validation loss decreased (1.295345 --> 1.294706).  Saving model ...
Validation loss decreased (1.294706 --> 1.294067).  Saving model ...
Validation loss decreased (1.294067 --> 1.293503).  Saving model ...
Validation loss decreased (1.293503 --> 1.292957).  Saving model ...
Validation loss decreased (1.292957 --> 1.292406).  Saving model ...
Validation loss decreased (1.292406 --> 1.291825).  Saving model ...
Validation loss decreased (1.291825 --> 1.291255).  Saving model ...
Validation loss decreased (1.291255 --> 1.290629).  Saving model ...
Validation loss decreased (1.290629 --> 1.290010).  Saving model ...
Validation loss decreased (1.290010 --> 1.289423).  Saving model ...
Validation loss decreased (1.289423 --> 1.288845).  Saving model ...
Validation loss decreased (1.288845 --> 1.288262).  Saving model ...
Validation loss decreased (1.288262 --> 1.287668).  Saving model ...
Validation loss decreased (1.287668 --> 1.287005).  Saving model ...
Validation loss decreased (1.287005 --> 1.286359).  Saving model ...
Validation loss decreased (1.286359 --> 1.285646).  Saving model ...
Validation loss decreased (1.285646 --> 1.284964).  Saving model ...
Validation loss decreased (1.284964 --> 1.284465).  Saving model ...
Validation loss decreased (1.284465 --> 1.283895).  Saving model ...
Validation loss decreased (1.283895 --> 1.283279).  Saving model ...
Validation loss decreased (1.283279 --> 1.282728).  Saving model ...
Validation loss decreased (1.282728 --> 1.282205).  Saving model ...
Validation loss decreased (1.282205 --> 1.281520).  Saving model ...
Validation loss decreased (1.281520 --> 1.280936).  Saving model ...
Validation loss decreased (1.280936 --> 1.280428).  Saving model ...
Validation loss decreased (1.280428 --> 1.279817).  Saving model ...
Validation loss decreased (1.279817 --> 1.279125).  Saving model ...
Validation loss decreased (1.279125 --> 1.278327).  Saving model ...
Validation loss decreased (1.278327 --> 1.277653).  Saving model ...
Validation loss decreased (1.277653 --> 1.277024).  Saving model ...
Validation loss decreased (1.277024 --> 1.276357).  Saving model ...
Validation loss decreased (1.276357 --> 1.275675).  Saving model ...
Validation loss decreased (1.275675 --> 1.275055).  Saving model ...
Validation loss decreased (1.275055 --> 1.274380).  Saving model ...
Validation loss decreased (1.274380 --> 1.273776).  Saving model ...
Validation loss decreased (1.273776 --> 1.273112).  Saving model ...
Validation loss decreased (1.273112 --> 1.272464).  Saving model ...
Validation loss decreased (1.272464 --> 1.271792).  Saving model ...
Validation loss decreased (1.271792 --> 1.271206).  Saving model ...
Validation loss decreased (1.271206 --> 1.270626).  Saving model ...
Validation loss decreased (1.270626 --> 1.269788).  Saving model ...
Validation loss decreased (1.269788 --> 1.269070).  Saving model ...
Validation loss decreased (1.269070 --> 1.268400).  Saving model ...
Validation loss decreased (1.268400 --> 1.267904).  Saving model ...
Validation loss decreased (1.267904 --> 1.267311).  Saving model ...
Validation loss decreased (1.267311 --> 1.266607).  Saving model ...
Validation loss decreased (1.266607 --> 1.265840).  Saving model ...
Validation loss decreased (1.265840 --> 1.264934).  Saving model ...
Validation loss decreased (1.264934 --> 1.264266).  Saving model ...
Validation loss decreased (1.264266 --> 1.263813).  Saving model ...
Validation loss decreased (1.263813 --> 1.263308).  Saving model ...
Validation loss decreased (1.263308 --> 1.262753).  Saving model ...
Validation loss decreased (1.262753 --> 1.262060).  Saving model ...
Validation loss decreased (1.262060 --> 1.261354).  Saving model ...
Validation loss decreased (1.261354 --> 1.260732).  Saving model ...
Validation loss decreased (1.260732 --> 1.260069).  Saving model ...
Validation loss decreased (1.260069 --> 1.259488).  Saving model ...
Validation loss decreased (1.259488 --> 1.258841).  Saving model ...
Validation loss decreased (1.258841 --> 1.258239).  Saving model ...
Validation loss decreased (1.258239 --> 1.257587).  Saving model ...
Validation loss decreased (1.257587 --> 1.257017).  Saving model ...
Validation loss decreased (1.257017 --> 1.256365).  Saving model ...
Validation loss decreased (1.256365 --> 1.255732).  Saving model ...
Validation loss decreased (1.255732 --> 1.255195).  Saving model ...
Validation loss decreased (1.255195 --> 1.254655).  Saving model ...
Validation loss decreased (1.254655 --> 1.254062).  Saving model ...
Validation loss decreased (1.254062 --> 1.253446).  Saving model ...
Validation loss decreased (1.253446 --> 1.252878).  Saving model ...
Validation loss decreased (1.252878 --> 1.252252).  Saving model ...
Validation loss decreased (1.252252 --> 1.251726).  Saving model ...
Validation loss decreased (1.251726 --> 1.250964).  Saving model ...
Validation loss decreased (1.250964 --> 1.250448).  Saving model ...
Validation loss decreased (1.250448 --> 1.250051).  Saving model ...
Validation loss decreased (1.250051 --> 1.249547).  Saving model ...
Validation loss decreased (1.249547 --> 1.248864).  Saving model ...
Validation loss decreased (1.248864 --> 1.248146).  Saving model ...
Validation loss decreased (1.248146 --> 1.247562).  Saving model ...
Validation loss decreased (1.247562 --> 1.247063).  Saving model ...
Validation loss decreased (1.247063 --> 1.246378).  Saving model ...
Validation loss decreased (1.246378 --> 1.245853).  Saving model ...
Validation loss decreased (1.245853 --> 1.245330).  Saving model ...
Validation loss decreased (1.245330 --> 1.244731).  Saving model ...
Validation loss decreased (1.244731 --> 1.244176).  Saving model ...
Validation loss decreased (1.244176 --> 1.243684).  Saving model ...
Validation loss decreased (1.243684 --> 1.243220).  Saving model ...
Validation loss decreased (1.243220 --> 1.242642).  Saving model ...
Validation loss decreased (1.242642 --> 1.242035).  Saving model ...
Validation loss decreased (1.242035 --> 1.241355).  Saving model ...
Validation loss decreased (1.241355 --> 1.240916).  Saving model ...
Validation loss decreased (1.240916 --> 1.240250).  Saving model ...
Validation loss decreased (1.240250 --> 1.239629).  Saving model ...
Validation loss decreased (1.239629 --> 1.239084).  Saving model ...
Validation loss decreased (1.239084 --> 1.238462).  Saving model ...
Validation loss decreased (1.238462 --> 1.237908).  Saving model ...
Validation loss decreased (1.237908 --> 1.237291).  Saving model ...
Validation loss decreased (1.237291 --> 1.236673).  Saving model ...
Validation loss decreased (1.236673 --> 1.236035).  Saving model ...
Validation loss decreased (1.236035 --> 1.235577).  Saving model ...
Validation loss decreased (1.235577 --> 1.235087).  Saving model ...
Validation loss decreased (1.235087 --> 1.234519).  Saving model ...
Validation loss decreased (1.234519 --> 1.234036).  Saving model ...
Validation loss decreased (1.234036 --> 1.233636).  Saving model ...
Validation loss decreased (1.233636 --> 1.233085).  Saving model ...
Validation loss decreased (1.233085 --> 1.232462).  Saving model ...
Validation loss decreased (1.232462 --> 1.231971).  Saving model ...
Validation loss decreased (1.231971 --> 1.231487).  Saving model ...
Validation loss decreased (1.231487 --> 1.230822).  Saving model ...
Validation loss decreased (1.230822 --> 1.230221).  Saving model ...
Validation loss decreased (1.230221 --> 1.229689).  Saving model ...
Validation loss decreased (1.229689 --> 1.229138).  Saving model ...
Validation loss decreased (1.229138 --> 1.228601).  Saving model ...
Validation loss decreased (1.228601 --> 1.228035).  Saving model ...
Validation loss decreased (1.228035 --> 1.227427).  Saving model ...
Validation loss decreased (1.227427 --> 1.226929).  Saving model ...
Validation loss decreased (1.226929 --> 1.226628).  Saving model ...
Validation loss decreased (1.226628 --> 1.226157).  Saving model ...
Validation loss decreased (1.226157 --> 1.225630).  Saving model ...
Validation loss decreased (1.225630 --> 1.225119).  Saving model ...
Validation loss decreased (1.225119 --> 1.224633).  Saving model ...
Validation loss decreased (1.224633 --> 1.224133).  Saving model ...
Validation loss decreased (1.224133 --> 1.223425).  Saving model ...
Validation loss decreased (1.223425 --> 1.222808).  Saving model ...
Validation loss decreased (1.222808 --> 1.222579).  Saving model ...
Validation loss decreased (1.222579 --> 1.222116).  Saving model ...
Validation loss decreased (1.222116 --> 1.221571).  Saving model ...
Validation loss decreased (1.221571 --> 1.220872).  Saving model ...
Validation loss decreased (1.220872 --> 1.220291).  Saving model ...
Validation loss decreased (1.220291 --> 1.219695).  Saving model ...
Validation loss decreased (1.219695 --> 1.219168).  Saving model ...
Validation loss decreased (1.219168 --> 1.218731).  Saving model ...
Validation loss decreased (1.218731 --> 1.218326).  Saving model ...
Validation loss decreased (1.218326 --> 1.217822).  Saving model ...
Validation loss decreased (1.217822 --> 1.217214).  Saving model ...
Validation loss decreased (1.217214 --> 1.216833).  Saving model ...
Validation loss decreased (1.216833 --> 1.216326).  Saving model ...
Validation loss decreased (1.216326 --> 1.215832).  Saving model ...
Validation loss decreased (1.215832 --> 1.215551).  Saving model ...
Validation loss decreased (1.215551 --> 1.214943).  Saving model ...
Validation loss decreased (1.214943 --> 1.214510).  Saving model ...
Validation loss decreased (1.214510 --> 1.214099).  Saving model ...
Validation loss decreased (1.214099 --> 1.213547).  Saving model ...
Validation loss decreased (1.213547 --> 1.213015).  Saving model ...
Validation loss decreased (1.213015 --> 1.212653).  Saving model ...
Validation loss decreased (1.212653 --> 1.212105).  Saving model ...
Validation loss decreased (1.212105 --> 1.211533).  Saving model ...
Validation loss decreased (1.211533 --> 1.211020).  Saving model ...
Validation loss decreased (1.211020 --> 1.210419).  Saving model ...
Validation loss decreased (1.210419 --> 1.210154).  Saving model ...
Validation loss decreased (1.210154 --> 1.209746).  Saving model ...
Validation loss decreased (1.209746 --> 1.209356).  Saving model ...
Validation loss decreased (1.209356 --> 1.208821).  Saving model ...
Validation loss decreased (1.208821 --> 1.208499).  Saving model ...
Validation loss decreased (1.208499 --> 1.207912).  Saving model ...
Validation loss decreased (1.207912 --> 1.207510).  Saving model ...
Validation loss decreased (1.207510 --> 1.207062).  Saving model ...
Validation loss decreased (1.207062 --> 1.206536).  Saving model ...
Validation loss decreased (1.206536 --> 1.206247).  Saving model ...
Validation loss decreased (1.206247 --> 1.205830).  Saving model ...
Validation loss decreased (1.205830 --> 1.205477).  Saving model ...
Validation loss decreased (1.205477 --> 1.205037).  Saving model ...
Validation loss decreased (1.205037 --> 1.204722).  Saving model ...
Validation loss decreased (1.204722 --> 1.204504).  Saving model ...
Validation loss decreased (1.204504 --> 1.204083).  Saving model ...
Validation loss decreased (1.204083 --> 1.203711).  Saving model ...
Validation loss decreased (1.203711 --> 1.203222).  Saving model ...
Validation loss decreased (1.203222 --> 1.202778).  Saving model ...
Validation loss decreased (1.202778 --> 1.202267).  Saving model ...
Validation loss decreased (1.202267 --> 1.201378).  Saving model ...
Validation loss decreased (1.201378 --> 1.200923).  Saving model ...
Validation loss decreased (1.200923 --> 1.200675).  Saving model ...
Validation loss decreased (1.200675 --> 1.200136).  Saving model ...
Validation loss decreased (1.200136 --> 1.199635).  Saving model ...
Validation loss decreased (1.199635 --> 1.198956).  Saving model ...
Validation loss decreased (1.198956 --> 1.198561).  Saving model ...
Validation loss decreased (1.198561 --> 1.198104).  Saving model ...
Validation loss decreased (1.198104 --> 1.197809).  Saving model ...
Validation loss decreased (1.197809 --> 1.197545).  Saving model ...
Validation loss decreased (1.197545 --> 1.197145).  Saving model ...
Validation loss decreased (1.197145 --> 1.196598).  Saving model ...
Validation loss decreased (1.196598 --> 1.196143).  Saving model ...
Validation loss decreased (1.196143 --> 1.195750).  Saving model ...
Validation loss decreased (1.195750 --> 1.195370).  Saving model ...
Validation loss decreased (1.195370 --> 1.194924).  Saving model ...
Validation loss decreased (1.194924 --> 1.194417).  Saving model ...
Validation loss decreased (1.194417 --> 1.194085).  Saving model ...
Validation loss decreased (1.194085 --> 1.193671).  Saving model ...
Validation loss decreased (1.193671 --> 1.193028).  Saving model ...
Validation loss decreased (1.193028 --> 1.192816).  Saving model ...
Validation loss decreased (1.192816 --> 1.192361).  Saving model ...
Validation loss decreased (1.192361 --> 1.191863).  Saving model ...
Validation loss decreased (1.191863 --> 1.191626).  Saving model ...
Validation loss decreased (1.191626 --> 1.191070).  Saving model ...
Validation loss decreased (1.191070 --> 1.190811).  Saving model ...
Validation loss decreased (1.190811 --> 1.190321).  Saving model ...
Validation loss decreased (1.190321 --> 1.189800).  Saving model ...
Validation loss decreased (1.189800 --> 1.189267).  Saving model ...
Validation loss decreased (1.189267 --> 1.188782).  Saving model ...
Validation loss decreased (1.188782 --> 1.188278).  Saving model ...
Validation loss decreased (1.188278 --> 1.188024).  Saving model ...
Validation loss decreased (1.188024 --> 1.187578).  Saving model ...
Validation loss decreased (1.187578 --> 1.187086).  Saving model ...
Validation loss decreased (1.187086 --> 1.186712).  Saving model ...
Validation loss decreased (1.186712 --> 1.186405).  Saving model ...
Validation loss decreased (1.186405 --> 1.185880).  Saving model ...
Validation loss decreased (1.185880 --> 1.185564).  Saving model ...
Validation loss decreased (1.185564 --> 1.185292).  Saving model ...
Validation loss decreased (1.185292 --> 1.184865).  Saving model ...
Validation loss decreased (1.184865 --> 1.184345).  Saving model ...
Validation loss decreased (1.184345 --> 1.183976).  Saving model ...
Validation loss decreased (1.183976 --> 1.183799).  Saving model ...
Validation loss decreased (1.183799 --> 1.183510).  Saving model ...
Validation loss decreased (1.183510 --> 1.183081).  Saving model ...
Validation loss decreased (1.183081 --> 1.182689).  Saving model ...
Validation loss decreased (1.182689 --> 1.182068).  Saving model ...
Validation loss decreased (1.182068 --> 1.181548).  Saving model ...
Validation loss decreased (1.181548 --> 1.181043).  Saving model ...
Validation loss decreased (1.181043 --> 1.180723).  Saving model ...
Validation loss decreased (1.180723 --> 1.180545).  Saving model ...
Validation loss decreased (1.180545 --> 1.180192).  Saving model ...
Validation loss decreased (1.180192 --> 1.179870).  Saving model ...
Validation loss decreased (1.179870 --> 1.179495).  Saving model ...
Validation loss decreased (1.179495 --> 1.179019).  Saving model ...
Validation loss decreased (1.179019 --> 1.178530).  Saving model ...
Validation loss decreased (1.178530 --> 1.178338).  Saving model ...
Validation loss decreased (1.178338 --> 1.178102).  Saving model ...
Validation loss decreased (1.178102 --> 1.177730).  Saving model ...
Validation loss decreased (1.177730 --> 1.177536).  Saving model ...
Validation loss decreased (1.177536 --> 1.177192).  Saving model ...
Validation loss decreased (1.177192 --> 1.176840).  Saving model ...
Validation loss decreased (1.176840 --> 1.176569).  Saving model ...
Validation loss decreased (1.176569 --> 1.176185).  Saving model ...
Validation loss decreased (1.176185 --> 1.175977).  Saving model ...
Validation loss decreased (1.175977 --> 1.175432).  Saving model ...
Validation loss decreased (1.175432 --> 1.175044).  Saving model ...
Validation loss decreased (1.175044 --> 1.174631).  Saving model ...
Validation loss decreased (1.174631 --> 1.174382).  Saving model ...
Validation loss decreased (1.174382 --> 1.173967).  Saving model ...
Validation loss decreased (1.173967 --> 1.173619).  Saving model ...
Validation loss decreased (1.173619 --> 1.173271).  Saving model ...
Validation loss decreased (1.173271 --> 1.172893).  Saving model ...
Validation loss decreased (1.172893 --> 1.172235).  Saving model ...
Validation loss decreased (1.172235 --> 1.172042).  Saving model ...
Validation loss decreased (1.172042 --> 1.171707).  Saving model ...
Validation loss decreased (1.171707 --> 1.171461).  Saving model ...
Validation loss decreased (1.171461 --> 1.171185).  Saving model ...
Validation loss decreased (1.171185 --> 1.170646).  Saving model ...
Validation loss decreased (1.170646 --> 1.170326).  Saving model ...
Validation loss decreased (1.170326 --> 1.169821).  Saving model ...
Validation loss decreased (1.169821 --> 1.169322).  Saving model ...
Validation loss decreased (1.169322 --> 1.168926).  Saving model ...
Validation loss decreased (1.168926 --> 1.168622).  Saving model ...
Validation loss decreased (1.168622 --> 1.168039).  Saving model ...
Validation loss decreased (1.168039 --> 1.167759).  Saving model ...
Validation loss decreased (1.167759 --> 1.167444).  Saving model ...
Validation loss decreased (1.167444 --> 1.167122).  Saving model ...
Validation loss decreased (1.167122 --> 1.166445).  Saving model ...
Validation loss decreased (1.166445 --> 1.165941).  Saving model ...
Validation loss decreased (1.165941 --> 1.165525).  Saving model ...
Validation loss decreased (1.165525 --> 1.165132).  Saving model ...
Validation loss decreased (1.165132 --> 1.164753).  Saving model ...
Validation loss decreased (1.164753 --> 1.164257).  Saving model ...
Validation loss decreased (1.164257 --> 1.163760).  Saving model ...
Validation loss decreased (1.163760 --> 1.163097).  Saving model ...
Validation loss decreased (1.163097 --> 1.162632).  Saving model ...
Validation loss decreased (1.162632 --> 1.162455).  Saving model ...
Validation loss decreased (1.162455 --> 1.162188).  Saving model ...
Validation loss decreased (1.162188 --> 1.162121).  Saving model ...
Validation loss decreased (1.162121 --> 1.161739).  Saving model ...
Validation loss decreased (1.161739 --> 1.161432).  Saving model ...
Validation loss decreased (1.161432 --> 1.160952).  Saving model ...
Validation loss decreased (1.160952 --> 1.160566).  Saving model ...
Validation loss decreased (1.160566 --> 1.160269).  Saving model ...
Validation loss decreased (1.160269 --> 1.159841).  Saving model ...
Validation loss decreased (1.159841 --> 1.159398).  Saving model ...
Validation loss decreased (1.159398 --> 1.158919).  Saving model ...
Validation loss decreased (1.158919 --> 1.158466).  Saving model ...
Validation loss decreased (1.158466 --> 1.158241).  Saving model ...
Validation loss decreased (1.158241 --> 1.157896).  Saving model ...
Validation loss decreased (1.157896 --> 1.157794).  Saving model ...
Validation loss decreased (1.157794 --> 1.157285).  Saving model ...
Validation loss decreased (1.157285 --> 1.156730).  Saving model ...
Validation loss decreased (1.156730 --> 1.156345).  Saving model ...
Validation loss decreased (1.156345 --> 1.155799).  Saving model ...
Validation loss decreased (1.155799 --> 1.155474).  Saving model ...
Validation loss decreased (1.155474 --> 1.155271).  Saving model ...
Validation loss decreased (1.155271 --> 1.154835).  Saving model ...
Validation loss decreased (1.154835 --> 1.154493).  Saving model ...
Validation loss decreased (1.154493 --> 1.154076).  Saving model ...
Validation loss decreased (1.154076 --> 1.153709).  Saving model ...
Validation loss decreased (1.153709 --> 1.153253).  Saving model ...
Validation loss decreased (1.153253 --> 1.152901).  Saving model ...
Validation loss decreased (1.152901 --> 1.152547).  Saving model ...
Validation loss decreased (1.152547 --> 1.152396).  Saving model ...
Validation loss decreased (1.152396 --> 1.152044).  Saving model ...
Validation loss decreased (1.152044 --> 1.151732).  Saving model ...
Validation loss decreased (1.151732 --> 1.151345).  Saving model ...
Validation loss decreased (1.151345 --> 1.150958).  Saving model ...
Validation loss decreased (1.150958 --> 1.150591).  Saving model ...
Validation loss decreased (1.150591 --> 1.150243).  Saving model ...
Validation loss decreased (1.150243 --> 1.150002).  Saving model ...
Validation loss decreased (1.150002 --> 1.149616).  Saving model ...
Validation loss decreased (1.149616 --> 1.149022).  Saving model ...
Validation loss decreased (1.149022 --> 1.148581).  Saving model ...
Validation loss decreased (1.148581 --> 1.148253).  Saving model ...
Validation loss decreased (1.148253 --> 1.147872).  Saving model ...
Validation loss decreased (1.147872 --> 1.147596).  Saving model ...
Validation loss decreased (1.147596 --> 1.147264).  Saving model ...
Validation loss decreased (1.147264 --> 1.147025).  Saving model ...
Validation loss decreased (1.147025 --> 1.146818).  Saving model ...
Validation loss decreased (1.146818 --> 1.146395).  Saving model ...
Validation loss decreased (1.146395 --> 1.146046).  Saving model ...
EarlyStopping counter: 1 out of 10.0
Validation loss decreased (1.146046 --> 1.145626).  Saving model ...
Validation loss decreased (1.145626 --> 1.145163).  Saving model ...
Validation loss decreased (1.145163 --> 1.144671).  Saving model ...
Validation loss decreased (1.144671 --> 1.144284).  Saving model ...
/localscratch/yinan.28716726.0/env/lib/python3.7/site-packages/torch/nn/functional.py:1794: UserWarning: nn.functional.tanh is deprecated. Use torch.tanh instead.
  warnings.warn("nn.functional.tanh is deprecated. Use torch.tanh instead.")
/localscratch/yinan.28716726.0/env/lib/python3.7/site-packages/transformers/optimization.py:155: UserWarning: This overload of add_ is deprecated:
	add_(Number alpha, Tensor other)
Consider using one of the following signatures instead:
	add_(Tensor other, *, Number alpha) (Triggered internally at  ../torch/csrc/utils/python_arg_parser.cpp:1025.)
  exp_avg.mul_(beta1).add_(1.0 - beta1, grad)
wandb: Waiting for W&B process to finish, PID 157870... (success).
wandb: - 0.00MB of 0.00MB uploaded (0.00MB deduped)wandb: \ 0.00MB of 0.00MB uploaded (0.00MB deduped)wandb: | 0.00MB of 0.00MB uploaded (0.00MB deduped)wandb: / 0.00MB of 0.00MB uploaded (0.00MB deduped)wandb: - 0.00MB of 0.00MB uploaded (0.00MB deduped)wandb: \ 0.00MB of 0.00MB uploaded (0.00MB deduped)wandb: | 0.00MB of 0.00MB uploaded (0.00MB deduped)wandb: / 0.00MB of 0.00MB uploaded (0.00MB deduped)wandb: - 0.00MB of 0.00MB uploaded (0.00MB deduped)wandb: \ 0.00MB of 0.00MB uploaded (0.00MB deduped)wandb: | 0.00MB of 0.00MB uploaded (0.00MB deduped)wandb: / 0.00MB of 0.00MB uploaded (0.00MB deduped)wandb: - 0.00MB of 0.00MB uploaded (0.00MB deduped)wandb: \ 0.00MB of 0.00MB uploaded (0.00MB deduped)wandb: | 0.00MB of 0.00MB uploaded (0.00MB deduped)wandb:                                                                                
wandb: Run history:
wandb:     e_F1 ▁▁▂▂▂▃▄▅▅▅▅▆▆▆▆▆▆▇▇▇▇▇▇▇▇▇▇▇▇▇██████████
wandb:   e_loss █▇▇▇▆▆▆▆▆▅▅▅▅▅▄▄▄▄▄▄▃▃▃▃▃▃▂▂▂▂▂▂▂▂▁▁▁▁▁▁
wandb:     t_F1 ▁▂▂▃▃▃▃▃▃▃▄▅▄▄▄▅▆▅▆▆▅▆▆▆▆▇▇▇▆▇█▇█▇▇▇▇█▇█
wandb:   t_loss ██▇▇▇▆▆▆▆▆▆▅▅▆▅▅▄▄▄▄▄▄▄▄▃▃▃▃▃▃▂▂▂▂▂▂▂▁▁▁
wandb: 
wandb: Run summary:
wandb:     e_F1 48.52898
wandb:   e_loss 1.14428
wandb:     t_F1 53.0717
wandb:   t_loss 1.07345
wandb: 
wandb: Synced 4 W&B file(s), 0 media file(s), 0 artifact file(s) and 0 other file(s)
wandb: Synced golden-glade-1: https://wandb.ai/yinanazhou/xl_512_bs_8_lr_1e07_es_10_lc_True_nr_False_sr_True_stem_False_lemma_True_repeat_1_fold_1/runs/1hmn461g
wandb: Find logs at: ./wandb/run-20220311_042857-1hmn461g/logs/debug.log
wandb: 

wandb: wandb version 0.12.11 is available!  To upgrade, please run:
wandb:  $ pip install wandb --upgrade
2022-03-11 09:58:40.950128: I tensorflow/stream_executor/platform/default/dso_loader.cc:48] Successfully opened dynamic library libcudart.so.10.1
wandb: Tracking run with wandb version 0.12.5
wandb: Syncing run mild-dust-1
wandb: ⭐️ View project at https://wandb.ai/yinanazhou/xl_512_bs_8_lr_1e07_es_10_lc_True_nr_False_sr_True_stem_False_lemma_True_repeat_1_fold_2
wandb: 🚀 View run at https://wandb.ai/yinanazhou/xl_512_bs_8_lr_1e07_es_10_lc_True_nr_False_sr_True_stem_False_lemma_True_repeat_1_fold_2/runs/5u1apzt1
wandb: Run data is saved locally in /project/6002780/yinan/Thesis_MER_Lyrics/lyric-emotion/wandb/run-20220311_095836-5u1apzt1
wandb: Run `wandb offline` to turn off syncing.
slurmstepd: error: *** JOB 28716726 ON cdr2630 CANCELLED AT 2022-03-11T14:26:19 DUE TO TIME LIMIT ***
