Unloading StdEnv/2020

Due to MODULEPATH changes, the following have been reloaded:
  1) mii/1.1.1


The following have been reloaded with a version change:
  1) python/3.8.2 => python/3.7.4

Using base prefix '/cvmfs/soft.computecanada.ca/easybuild/software/2017/Core/python/3.7.4'
New python executable in /localscratch/yinan.27794532.0/env/bin/python
Installing setuptools, pip, wheel...
done.
Ignoring pip: markers 'python_version < "3"' don't match your environment
Looking in links: /cvmfs/soft.computecanada.ca/custom/python/wheelhouse/nix/avx2, /cvmfs/soft.computecanada.ca/custom/python/wheelhouse/nix/generic, /cvmfs/soft.computecanada.ca/custom/python/wheelhouse/generic
Collecting pip
Installing collected packages: pip
  Found existing installation: pip 19.1.1
    Uninstalling pip-19.1.1:
      Successfully uninstalled pip-19.1.1
Successfully installed pip-21.2.3+computecanada
Looking in links: /cvmfs/soft.computecanada.ca/custom/python/wheelhouse/nix/avx2, /cvmfs/soft.computecanada.ca/custom/python/wheelhouse/nix/generic, /cvmfs/soft.computecanada.ca/custom/python/wheelhouse/generic
Processing /cvmfs/soft.computecanada.ca/custom/python/wheelhouse/generic/keras-2.7.0+computecanada-py2.py3-none-any.whl
Processing /cvmfs/soft.computecanada.ca/custom/python/wheelhouse/generic/Keras_Preprocessing-1.1.2+computecanada-py3-none-any.whl
Requirement already satisfied: matplotlib in /cvmfs/soft.computecanada.ca/easybuild/software/2017/Core/scipy-stack/2019a/lib/python3.7/site-packages (from -r requirements.txt (line 3)) (3.0.2)
Processing /cvmfs/soft.computecanada.ca/custom/python/wheelhouse/generic/nltk-3.6.5+computecanada-py3-none-any.whl
Processing /cvmfs/soft.computecanada.ca/custom/python/wheelhouse/generic/scikit_learn-0.22.1+computecanada-cp37-cp37m-linux_x86_64.whl
Processing /cvmfs/soft.computecanada.ca/custom/python/wheelhouse/generic/tensorboard-2.3.0+computecanada-py3-none-any.whl
Processing /cvmfs/soft.computecanada.ca/custom/python/wheelhouse/generic/tensorboard_plugin_wit-1.7.0+computecanada-py3-none-any.whl
Processing /cvmfs/soft.computecanada.ca/custom/python/wheelhouse/generic/tensorflow_gpu-2.3.0+computecanada-cp37-cp37m-linux_x86_64.whl
Processing /cvmfs/soft.computecanada.ca/custom/python/wheelhouse/generic/tensorflow_estimator-2.3.0+computecanada-py2.py3-none-any.whl
Processing /cvmfs/soft.computecanada.ca/custom/python/wheelhouse/generic/tokenizers-0.5.2+computecanada-cp37-cp37m-linux_x86_64.whl
Processing /cvmfs/soft.computecanada.ca/custom/python/wheelhouse/nix/avx2/torch-1.4.0+computecanada-cp37-cp37m-linux_x86_64.whl
Processing /cvmfs/soft.computecanada.ca/custom/python/wheelhouse/generic/torchtext-0.6.0+computecanada-py3-none-any.whl
Processing /cvmfs/soft.computecanada.ca/custom/python/wheelhouse/generic/torchvision-0.8.2+computecanada-cp37-cp37m-linux_x86_64.whl
Processing /cvmfs/soft.computecanada.ca/custom/python/wheelhouse/generic/transformers-2.5.1+computecanada-py3-none-any.whl
Processing /cvmfs/soft.computecanada.ca/custom/python/wheelhouse/generic/urllib3-1.26.7+computecanada-py2.py3-none-any.whl
ERROR: Could not find a version that satisfies the requirement regex>=2021.8.3 (from nltk) (from versions: 2018.1.10+computecanada, 2019.11.1+computecanada, 2020.11.13+computecanada)
ERROR: No matching distribution found for regex>=2021.8.3
Looking in links: /cvmfs/soft.computecanada.ca/custom/python/wheelhouse/nix/avx2, /cvmfs/soft.computecanada.ca/custom/python/wheelhouse/nix/generic, /cvmfs/soft.computecanada.ca/custom/python/wheelhouse/generic
ERROR: Could not find a version that satisfies the requirement numpy==1.20.0+computacanada (from versions: 1.15.0+computecanada, 1.15.2+computecanada, 1.15.4+computecanada, 1.16.0+computecanada, 1.16.2+computecanada, 1.16.3+computecanada, 1.17.4+computecanada, 1.18.1+computecanada, 1.18.4+computecanada, 1.19.1+computecanada, 1.19.2+computecanada, 1.20.2+computecanada)
ERROR: No matching distribution found for numpy==1.20.0+computacanada
Looking in links: /cvmfs/soft.computecanada.ca/custom/python/wheelhouse/nix/avx2, /cvmfs/soft.computecanada.ca/custom/python/wheelhouse/nix/generic, /cvmfs/soft.computecanada.ca/custom/python/wheelhouse/generic
Processing /cvmfs/soft.computecanada.ca/custom/python/wheelhouse/generic/wandb-0.12.5+computecanada-py2.py3-none-any.whl
Requirement already satisfied: python-dateutil>=2.6.1 in /cvmfs/soft.computecanada.ca/easybuild/software/2017/Core/scipy-stack/2019a/lib/python3.7/site-packages (from wandb) (2.7.5)
Processing /cvmfs/soft.computecanada.ca/custom/python/wheelhouse/generic/shortuuid-1.0.1+computecanada-py3-none-any.whl
Processing /cvmfs/soft.computecanada.ca/custom/python/wheelhouse/generic/configparser-5.0.2+computecanada-py3-none-any.whl
Processing /cvmfs/soft.computecanada.ca/custom/python/wheelhouse/generic/click-8.0.3+computecanada-py3-none-any.whl
Processing /cvmfs/soft.computecanada.ca/custom/python/wheelhouse/generic/GitPython-3.1.24+computecanada-py3-none-any.whl
Processing /cvmfs/soft.computecanada.ca/custom/python/wheelhouse/generic/docker_pycreds-0.4.0+computecanada-py2.py3-none-any.whl
Processing /cvmfs/soft.computecanada.ca/custom/python/wheelhouse/generic/sentry_sdk-1.5.0+computecanada-py2.py3-none-any.whl
Processing /cvmfs/soft.computecanada.ca/custom/python/wheelhouse/generic/subprocess32-3.5.4+computecanada-py3-none-any.whl
Processing /cvmfs/soft.computecanada.ca/custom/python/wheelhouse/generic/psutil-5.7.3+computecanada-cp37-cp37m-linux_x86_64.whl
Processing /cvmfs/soft.computecanada.ca/custom/python/wheelhouse/generic/protobuf-3.19.3+computecanada-py2.py3-none-any.whl
Requirement already satisfied: requests<3,>=2.0.0 in /cvmfs/soft.computecanada.ca/easybuild/software/2017/Core/scipy-stack/2019a/lib/python3.7/site-packages (from wandb) (2.21.0)
Processing /cvmfs/soft.computecanada.ca/custom/python/wheelhouse/generic/promise-2.3+computecanada-py3-none-any.whl
Processing /cvmfs/soft.computecanada.ca/custom/python/wheelhouse/generic/pathtools-0.1.2+computecanada-py3-none-any.whl
Processing /cvmfs/soft.computecanada.ca/custom/python/wheelhouse/generic/yaspin-2.1.0+computecanada-py3-none-any.whl
Processing /cvmfs/soft.computecanada.ca/custom/python/wheelhouse/generic/PyYAML-5.3.1+computecanada-cp37-cp37m-linux_x86_64.whl
Processing /cvmfs/soft.computecanada.ca/custom/python/wheelhouse/generic/six-1.16.0+computecanada-py2.py3-none-any.whl
Requirement already satisfied: importlib-metadata in /cvmfs/soft.computecanada.ca/easybuild/software/2017/Core/scipy-stack/2019a/lib/python3.7/site-packages (from Click!=8.0.0,>=7.0->wandb) (0.8)
Processing /cvmfs/soft.computecanada.ca/custom/python/wheelhouse/generic/gitdb-4.0.9+computecanada-py3-none-any.whl
Processing /cvmfs/soft.computecanada.ca/custom/python/wheelhouse/generic/typing_extensions-4.0.1+computecanada-py3-none-any.whl
Processing /cvmfs/soft.computecanada.ca/custom/python/wheelhouse/generic/smmap-5.0.0+computecanada-py3-none-any.whl
Requirement already satisfied: chardet<3.1.0,>=3.0.2 in /cvmfs/soft.computecanada.ca/easybuild/software/2017/Core/scipy-stack/2019a/lib/python3.7/site-packages (from requests<3,>=2.0.0->wandb) (3.0.4)
Requirement already satisfied: idna<2.9,>=2.5 in /cvmfs/soft.computecanada.ca/easybuild/software/2017/Core/scipy-stack/2019a/lib/python3.7/site-packages (from requests<3,>=2.0.0->wandb) (2.8)
Requirement already satisfied: urllib3<1.25,>=1.21.1 in /cvmfs/soft.computecanada.ca/easybuild/software/2017/Core/scipy-stack/2019a/lib/python3.7/site-packages (from requests<3,>=2.0.0->wandb) (1.24.1)
Requirement already satisfied: certifi>=2017.4.17 in /cvmfs/soft.computecanada.ca/easybuild/software/2017/Core/scipy-stack/2019a/lib/python3.7/site-packages (from requests<3,>=2.0.0->wandb) (2018.11.29)
Processing /cvmfs/soft.computecanada.ca/custom/python/wheelhouse/generic/termcolor-1.1.0+computecanada-py3-none-any.whl
Requirement already satisfied: zipp>=0.3.2 in /cvmfs/soft.computecanada.ca/easybuild/software/2017/Core/scipy-stack/2019a/lib/python3.7/site-packages (from importlib-metadata->Click!=8.0.0,>=7.0->wandb) (0.3.3)
Installing collected packages: smmap, typing-extensions, termcolor, six, gitdb, yaspin, subprocess32, shortuuid, sentry-sdk, PyYAML, psutil, protobuf, promise, pathtools, GitPython, docker-pycreds, configparser, Click, wandb
  Attempting uninstall: six
    Found existing installation: six 1.12.0
    Not uninstalling six at /cvmfs/soft.computecanada.ca/easybuild/software/2017/Core/scipy-stack/2019a/lib/python3.7/site-packages, outside environment /localscratch/yinan.27794532.0/env
    Can't uninstall 'six'. No files were found to uninstall.
Successfully installed Click-8.0.3+computecanada GitPython-3.1.24+computecanada PyYAML-5.3.1+computecanada configparser-5.0.2+computecanada docker-pycreds-0.4.0+computecanada gitdb-4.0.9+computecanada pathtools-0.1.2+computecanada promise-2.3+computecanada protobuf-3.19.3+computecanada psutil-5.7.3+computecanada sentry-sdk-1.5.0+computecanada shortuuid-1.0.1+computecanada six-1.16.0+computecanada smmap-5.0.0+computecanada subprocess32-3.5.4+computecanada termcolor-1.1.0+computecanada typing-extensions-4.0.1+computecanada wandb-0.12.5+computecanada yaspin-2.1.0+computecanada
Looking in links: /cvmfs/soft.computecanada.ca/custom/python/wheelhouse/nix/avx2, /cvmfs/soft.computecanada.ca/custom/python/wheelhouse/nix/generic, /cvmfs/soft.computecanada.ca/custom/python/wheelhouse/generic
ERROR: Could not find a version that satisfies the requirement sagemaker (from versions: none)
ERROR: No matching distribution found for sagemaker
Looking in links: /cvmfs/soft.computecanada.ca/custom/python/wheelhouse/nix/avx2, /cvmfs/soft.computecanada.ca/custom/python/wheelhouse/nix/generic, /cvmfs/soft.computecanada.ca/custom/python/wheelhouse/generic
Processing /cvmfs/soft.computecanada.ca/custom/python/wheelhouse/generic/torch-1.9.1+computecanada-cp37-cp37m-linux_x86_64.whl
Requirement already satisfied: typing-extensions in /localscratch/yinan.27794532.0/env/lib/python3.7/site-packages (from torch) (4.0.1+computecanada)
Installing collected packages: torch
Successfully installed torch-1.9.1+computecanada
Looking in links: /cvmfs/soft.computecanada.ca/custom/python/wheelhouse/nix/avx2, /cvmfs/soft.computecanada.ca/custom/python/wheelhouse/nix/generic, /cvmfs/soft.computecanada.ca/custom/python/wheelhouse/generic
Processing /cvmfs/soft.computecanada.ca/custom/python/wheelhouse/generic/transformers-2.5.1+computecanada-py3-none-any.whl
Requirement already satisfied: requests in /cvmfs/soft.computecanada.ca/easybuild/software/2017/Core/scipy-stack/2019a/lib/python3.7/site-packages (from transformers==2.5.1+computecanada) (2.21.0)
Processing /cvmfs/soft.computecanada.ca/custom/python/wheelhouse/generic/sacremoses-0.0.46+computecanada-py3-none-any.whl
Processing /cvmfs/soft.computecanada.ca/custom/python/wheelhouse/generic/filelock-3.4.2+computecanada-py3-none-any.whl
Processing /cvmfs/soft.computecanada.ca/custom/python/wheelhouse/generic/regex-2020.11.13+computecanada-cp37-cp37m-linux_x86_64.whl
Processing /cvmfs/soft.computecanada.ca/custom/python/wheelhouse/generic/sentencepiece-0.1.91+computecanada-cp37-cp37m-linux_x86_64.whl
Processing /cvmfs/soft.computecanada.ca/custom/python/wheelhouse/generic/tqdm-4.62.3+computecanada-py2.py3-none-any.whl
Processing /cvmfs/soft.computecanada.ca/custom/python/wheelhouse/generic/boto3-1.20.52+computecanada-py3-none-any.whl
Processing /cvmfs/soft.computecanada.ca/custom/python/wheelhouse/generic/tokenizers-0.5.2+computecanada-cp37-cp37m-linux_x86_64.whl
Requirement already satisfied: numpy in /cvmfs/soft.computecanada.ca/easybuild/software/2017/Core/scipy-stack/2019a/lib/python3.7/site-packages (from transformers==2.5.1+computecanada) (1.16.0)
Processing /cvmfs/soft.computecanada.ca/custom/python/wheelhouse/generic/botocore-1.23.52+computecanada-py3-none-any.whl
Processing /cvmfs/soft.computecanada.ca/custom/python/wheelhouse/generic/jmespath-0.10.0+computecanada-py2.py3-none-any.whl
Processing /cvmfs/soft.computecanada.ca/custom/python/wheelhouse/generic/s3transfer-0.5.1+computecanada-py3-none-any.whl
Processing /cvmfs/soft.computecanada.ca/custom/python/wheelhouse/generic/urllib3-1.26.8+computecanada-py2.py3-none-any.whl
Requirement already satisfied: python-dateutil<3.0.0,>=2.1 in /cvmfs/soft.computecanada.ca/easybuild/software/2017/Core/scipy-stack/2019a/lib/python3.7/site-packages (from botocore<1.24.0,>=1.23.52->boto3->transformers==2.5.1+computecanada) (2.7.5)
Requirement already satisfied: six>=1.5 in /localscratch/yinan.27794532.0/env/lib/python3.7/site-packages (from python-dateutil<3.0.0,>=2.1->botocore<1.24.0,>=1.23.52->boto3->transformers==2.5.1+computecanada) (1.16.0+computecanada)
Requirement already satisfied: certifi>=2017.4.17 in /cvmfs/soft.computecanada.ca/easybuild/software/2017/Core/scipy-stack/2019a/lib/python3.7/site-packages (from requests->transformers==2.5.1+computecanada) (2018.11.29)
Requirement already satisfied: chardet<3.1.0,>=3.0.2 in /cvmfs/soft.computecanada.ca/easybuild/software/2017/Core/scipy-stack/2019a/lib/python3.7/site-packages (from requests->transformers==2.5.1+computecanada) (3.0.4)
Processing /cvmfs/soft.computecanada.ca/custom/python/wheelhouse/generic/requests-2.27.1+computecanada-py2.py3-none-any.whl
Requirement already satisfied: idna<4,>=2.5 in /cvmfs/soft.computecanada.ca/easybuild/software/2017/Core/scipy-stack/2019a/lib/python3.7/site-packages (from requests->transformers==2.5.1+computecanada) (2.8)
Processing /cvmfs/soft.computecanada.ca/custom/python/wheelhouse/generic/charset_normalizer-2.0.11+computecanada-py3-none-any.whl
Processing /cvmfs/soft.computecanada.ca/custom/python/wheelhouse/generic/joblib-1.1.0+computecanada-py2.py3-none-any.whl
Requirement already satisfied: click in /localscratch/yinan.27794532.0/env/lib/python3.7/site-packages (from sacremoses->transformers==2.5.1+computecanada) (8.0.3+computecanada)
Requirement already satisfied: importlib-metadata in /cvmfs/soft.computecanada.ca/easybuild/software/2017/Core/scipy-stack/2019a/lib/python3.7/site-packages (from click->sacremoses->transformers==2.5.1+computecanada) (0.8)
Requirement already satisfied: zipp>=0.3.2 in /cvmfs/soft.computecanada.ca/easybuild/software/2017/Core/scipy-stack/2019a/lib/python3.7/site-packages (from importlib-metadata->click->sacremoses->transformers==2.5.1+computecanada) (0.3.3)
Installing collected packages: urllib3, jmespath, botocore, tqdm, s3transfer, regex, joblib, charset-normalizer, tokenizers, sentencepiece, sacremoses, requests, filelock, boto3, transformers
  Attempting uninstall: urllib3
    Found existing installation: urllib3 1.24.1
    Not uninstalling urllib3 at /cvmfs/soft.computecanada.ca/easybuild/software/2017/Core/scipy-stack/2019a/lib/python3.7/site-packages, outside environment /localscratch/yinan.27794532.0/env
    Can't uninstall 'urllib3'. No files were found to uninstall.
  Attempting uninstall: requests
    Found existing installation: requests 2.21.0
    Not uninstalling requests at /cvmfs/soft.computecanada.ca/easybuild/software/2017/Core/scipy-stack/2019a/lib/python3.7/site-packages, outside environment /localscratch/yinan.27794532.0/env
    Can't uninstall 'requests'. No files were found to uninstall.
Successfully installed boto3-1.20.52+computecanada botocore-1.23.52+computecanada charset-normalizer-2.0.11+computecanada filelock-3.4.2+computecanada jmespath-0.10.0+computecanada joblib-1.1.0+computecanada regex-2020.11.13+computecanada requests-2.27.1+computecanada s3transfer-0.5.1+computecanada sacremoses-0.0.46+computecanada sentencepiece-0.1.91+computecanada tokenizers-0.5.2+computecanada tqdm-4.62.3+computecanada transformers-2.5.1+computecanada urllib3-1.26.8+computecanada
Looking in links: /cvmfs/soft.computecanada.ca/custom/python/wheelhouse/nix/avx2, /cvmfs/soft.computecanada.ca/custom/python/wheelhouse/nix/generic, /cvmfs/soft.computecanada.ca/custom/python/wheelhouse/generic
Processing /cvmfs/soft.computecanada.ca/custom/python/wheelhouse/generic/tensorflow_gpu-2.3.0+computecanada-cp37-cp37m-linux_x86_64.whl
Processing /cvmfs/soft.computecanada.ca/custom/python/wheelhouse/generic/gast-0.3.3+computecanada-py3-none-any.whl
Processing /cvmfs/soft.computecanada.ca/custom/python/wheelhouse/generic/grpcio-1.38.0+computecanada-cp37-cp37m-linux_x86_64.whl
Requirement already satisfied: numpy<1.19.0,>=1.16.0 in /cvmfs/soft.computecanada.ca/easybuild/software/2017/Core/scipy-stack/2019a/lib/python3.7/site-packages (from tensorflow_gpu==2.3.0+computecanada) (1.16.0)
Requirement already satisfied: wheel>=0.26 in /localscratch/yinan.27794532.0/env/lib/python3.7/site-packages (from tensorflow_gpu==2.3.0+computecanada) (0.33.4)
Requirement already satisfied: termcolor>=1.1.0 in /localscratch/yinan.27794532.0/env/lib/python3.7/site-packages (from tensorflow_gpu==2.3.0+computecanada) (1.1.0+computecanada)
Processing /cvmfs/soft.computecanada.ca/custom/python/wheelhouse/generic/absl_py-1.0.0+computecanada-py3-none-any.whl
Processing /cvmfs/soft.computecanada.ca/custom/python/wheelhouse/generic/astunparse-1.6.3+computecanada-py2.py3-none-any.whl
Requirement already satisfied: six>=1.12.0 in /localscratch/yinan.27794532.0/env/lib/python3.7/site-packages (from tensorflow_gpu==2.3.0+computecanada) (1.16.0+computecanada)
Processing /cvmfs/soft.computecanada.ca/custom/python/wheelhouse/generic/google_pasta-0.2.0+computecanada-py3-none-any.whl
Processing /cvmfs/soft.computecanada.ca/custom/python/wheelhouse/generic/tensorboard-2.6.0+computecanada-py3-none-any.whl
Processing /cvmfs/soft.computecanada.ca/custom/python/wheelhouse/generic/wrapt-1.11.2+computecanada-cp37-cp37m-linux_x86_64.whl
Requirement already satisfied: protobuf>=3.9.2 in /localscratch/yinan.27794532.0/env/lib/python3.7/site-packages (from tensorflow_gpu==2.3.0+computecanada) (3.19.3+computecanada)
Processing /cvmfs/soft.computecanada.ca/custom/python/wheelhouse/generic/opt_einsum-3.3.0+computecanada-py3-none-any.whl
Processing /cvmfs/soft.computecanada.ca/custom/python/wheelhouse/generic/tensorflow_estimator-2.3.0+computecanada-py2.py3-none-any.whl
Processing /cvmfs/soft.computecanada.ca/custom/python/wheelhouse/generic/Keras_Preprocessing-1.1.2+computecanada-py3-none-any.whl
Processing /cvmfs/soft.computecanada.ca/custom/python/wheelhouse/nix/avx2/h5py-2.10.0+computecanada-cp37-cp37m-linux_x86_64.whl
Processing /cvmfs/soft.computecanada.ca/custom/python/wheelhouse/nix/generic/scipy-1.4.1+computecanada-cp37-cp37m-linux_x86_64.whl
Processing /cvmfs/soft.computecanada.ca/custom/python/wheelhouse/generic/tensorboard_plugin_wit-1.8.0+computecanada-py3-none-any.whl
Processing /cvmfs/soft.computecanada.ca/custom/python/wheelhouse/generic/google_auth-1.35.0+computecanada-py2.py3-none-any.whl
Processing /cvmfs/soft.computecanada.ca/custom/python/wheelhouse/generic/google_auth_oauthlib-0.4.6+computecanada-py2.py3-none-any.whl
Processing /cvmfs/soft.computecanada.ca/custom/python/wheelhouse/generic/tensorboard_data_server-0.6.1+computecanada-py3-none-linux_x86_64.whl
Requirement already satisfied: requests<3,>=2.21.0 in /localscratch/yinan.27794532.0/env/lib/python3.7/site-packages (from tensorboard<3,>=2.3.0->tensorflow_gpu==2.3.0+computecanada) (2.27.1+computecanada)
Processing /cvmfs/soft.computecanada.ca/custom/python/wheelhouse/generic/Werkzeug-2.0.3+computecanada-py3-none-any.whl
Processing /cvmfs/soft.computecanada.ca/custom/python/wheelhouse/generic/Markdown-3.3.6+computecanada-py3-none-any.whl
Requirement already satisfied: setuptools>=41.0.0 in /localscratch/yinan.27794532.0/env/lib/python3.7/site-packages (from tensorboard<3,>=2.3.0->tensorflow_gpu==2.3.0+computecanada) (41.0.1)
Processing /cvmfs/soft.computecanada.ca/custom/python/wheelhouse/generic/pyasn1_modules-0.2.8+computecanada-py2.py3-none-any.whl
Processing /cvmfs/soft.computecanada.ca/custom/python/wheelhouse/generic/rsa-4.8+computecanada-py3-none-any.whl
Processing /cvmfs/soft.computecanada.ca/custom/python/wheelhouse/generic/cachetools-4.2.4+computecanada-py3-none-any.whl
Processing /cvmfs/soft.computecanada.ca/custom/python/wheelhouse/generic/requests_oauthlib-1.3.0+computecanada-py2.py3-none-any.whl
Processing /cvmfs/soft.computecanada.ca/custom/python/wheelhouse/generic/importlib_metadata-4.10.1+computecanada-py3-none-any.whl
Processing /cvmfs/soft.computecanada.ca/custom/python/wheelhouse/generic/zipp-3.7.0+computecanada-py3-none-any.whl
Requirement already satisfied: typing-extensions>=3.6.4 in /localscratch/yinan.27794532.0/env/lib/python3.7/site-packages (from importlib-metadata>=4.4->markdown>=2.6.8->tensorboard<3,>=2.3.0->tensorflow_gpu==2.3.0+computecanada) (4.0.1+computecanada)
Processing /cvmfs/soft.computecanada.ca/custom/python/wheelhouse/generic/pyasn1-0.4.8+computecanada-py2.py3-none-any.whl
Requirement already satisfied: charset-normalizer~=2.0.0 in /localscratch/yinan.27794532.0/env/lib/python3.7/site-packages (from requests<3,>=2.21.0->tensorboard<3,>=2.3.0->tensorflow_gpu==2.3.0+computecanada) (2.0.11+computecanada)
Requirement already satisfied: certifi>=2017.4.17 in /cvmfs/soft.computecanada.ca/easybuild/software/2017/Core/scipy-stack/2019a/lib/python3.7/site-packages (from requests<3,>=2.21.0->tensorboard<3,>=2.3.0->tensorflow_gpu==2.3.0+computecanada) (2018.11.29)
Requirement already satisfied: urllib3<1.27,>=1.21.1 in /localscratch/yinan.27794532.0/env/lib/python3.7/site-packages (from requests<3,>=2.21.0->tensorboard<3,>=2.3.0->tensorflow_gpu==2.3.0+computecanada) (1.26.8+computecanada)
Requirement already satisfied: idna<4,>=2.5 in /cvmfs/soft.computecanada.ca/easybuild/software/2017/Core/scipy-stack/2019a/lib/python3.7/site-packages (from requests<3,>=2.21.0->tensorboard<3,>=2.3.0->tensorflow_gpu==2.3.0+computecanada) (2.8)
Processing /cvmfs/soft.computecanada.ca/custom/python/wheelhouse/generic/oauthlib-3.1.1+computecanada-py2.py3-none-any.whl
Installing collected packages: pyasn1, zipp, rsa, pyasn1-modules, oauthlib, cachetools, requests-oauthlib, importlib-metadata, google-auth, werkzeug, tensorboard-plugin-wit, tensorboard-data-server, markdown, grpcio, google-auth-oauthlib, absl-py, wrapt, tensorflow-estimator, tensorboard, scipy, opt-einsum, keras-preprocessing, h5py, google-pasta, gast, astunparse, tensorflow-gpu
  Attempting uninstall: pyasn1
    Found existing installation: pyasn1 0.4.3
    Not uninstalling pyasn1 at /cvmfs/soft.computecanada.ca/easybuild/software/2017/Core/scipy-stack/2019a/lib/python3.7/site-packages, outside environment /localscratch/yinan.27794532.0/env
    Can't uninstall 'pyasn1'. No files were found to uninstall.
  Attempting uninstall: zipp
    Found existing installation: zipp 0.3.3
    Not uninstalling zipp at /cvmfs/soft.computecanada.ca/easybuild/software/2017/Core/scipy-stack/2019a/lib/python3.7/site-packages, outside environment /localscratch/yinan.27794532.0/env
    Can't uninstall 'zipp'. No files were found to uninstall.
  Attempting uninstall: importlib-metadata
    Found existing installation: importlib-metadata 0.8
    Not uninstalling importlib-metadata at /cvmfs/soft.computecanada.ca/easybuild/software/2017/Core/scipy-stack/2019a/lib/python3.7/site-packages, outside environment /localscratch/yinan.27794532.0/env
    Can't uninstall 'importlib-metadata'. No files were found to uninstall.
  Attempting uninstall: scipy
    Found existing installation: scipy 1.2.0
    Not uninstalling scipy at /cvmfs/soft.computecanada.ca/easybuild/software/2017/Core/scipy-stack/2019a/lib/python3.7/site-packages, outside environment /localscratch/yinan.27794532.0/env
    Can't uninstall 'scipy'. No files were found to uninstall.
Successfully installed absl-py-1.0.0+computecanada astunparse-1.6.3+computecanada cachetools-4.2.4+computecanada gast-0.3.3+computecanada google-auth-1.35.0+computecanada google-auth-oauthlib-0.4.6+computecanada google-pasta-0.2.0+computecanada grpcio-1.38.0+computecanada h5py-2.10.0+computecanada importlib-metadata-4.10.1+computecanada keras-preprocessing-1.1.2+computecanada markdown-3.3.6+computecanada oauthlib-3.1.1+computecanada opt-einsum-3.3.0+computecanada pyasn1-0.4.8+computecanada pyasn1-modules-0.2.8+computecanada requests-oauthlib-1.3.0+computecanada rsa-4.8+computecanada scipy-1.4.1+computecanada tensorboard-2.6.0+computecanada tensorboard-data-server-0.6.1+computecanada tensorboard-plugin-wit-1.8.0+computecanada tensorflow-estimator-2.3.0+computecanada tensorflow-gpu-2.3.0+computecanada werkzeug-2.0.3+computecanada wrapt-1.11.2+computecanada zipp-3.7.0+computecanada
Looking in links: /cvmfs/soft.computecanada.ca/custom/python/wheelhouse/nix/avx2, /cvmfs/soft.computecanada.ca/custom/python/wheelhouse/nix/generic, /cvmfs/soft.computecanada.ca/custom/python/wheelhouse/generic
Processing /cvmfs/soft.computecanada.ca/custom/python/wheelhouse/generic/keras-2.7.0+computecanada-py2.py3-none-any.whl
Installing collected packages: Keras
Successfully installed Keras-2.7.0+computecanada
Looking in links: /cvmfs/soft.computecanada.ca/custom/python/wheelhouse/nix/avx2, /cvmfs/soft.computecanada.ca/custom/python/wheelhouse/nix/generic, /cvmfs/soft.computecanada.ca/custom/python/wheelhouse/generic
Processing /cvmfs/soft.computecanada.ca/custom/python/wheelhouse/generic/urllib3-1.26.7+computecanada-py2.py3-none-any.whl
Installing collected packages: urllib3
  Attempting uninstall: urllib3
    Found existing installation: urllib3 1.26.8+computecanada
    Uninstalling urllib3-1.26.8+computecanada:
      Successfully uninstalled urllib3-1.26.8+computecanada
Successfully installed urllib3-1.26.7+computecanada
Looking in links: /cvmfs/soft.computecanada.ca/custom/python/wheelhouse/nix/avx2, /cvmfs/soft.computecanada.ca/custom/python/wheelhouse/nix/generic, /cvmfs/soft.computecanada.ca/custom/python/wheelhouse/generic
Processing /cvmfs/soft.computecanada.ca/custom/python/wheelhouse/generic/nltk-3.7+computecanada-py3-none-any.whl
Requirement already satisfied: joblib in /localscratch/yinan.27794532.0/env/lib/python3.7/site-packages (from nltk) (1.1.0+computecanada)
Requirement already satisfied: click in /localscratch/yinan.27794532.0/env/lib/python3.7/site-packages (from nltk) (8.0.3+computecanada)
Requirement already satisfied: tqdm in /localscratch/yinan.27794532.0/env/lib/python3.7/site-packages (from nltk) (4.62.3+computecanada)
Processing /cvmfs/soft.computecanada.ca/custom/python/wheelhouse/generic/nltk-3.6.5+computecanada-py3-none-any.whl
Processing /cvmfs/soft.computecanada.ca/custom/python/wheelhouse/generic/nltk-3.6.3+computecanada-py3-none-any.whl
Requirement already satisfied: regex in /localscratch/yinan.27794532.0/env/lib/python3.7/site-packages (from nltk) (2020.11.13+computecanada)
Requirement already satisfied: importlib-metadata in /localscratch/yinan.27794532.0/env/lib/python3.7/site-packages (from click->nltk) (4.10.1+computecanada)
Requirement already satisfied: typing-extensions>=3.6.4 in /localscratch/yinan.27794532.0/env/lib/python3.7/site-packages (from importlib-metadata->click->nltk) (4.0.1+computecanada)
Requirement already satisfied: zipp>=0.5 in /localscratch/yinan.27794532.0/env/lib/python3.7/site-packages (from importlib-metadata->click->nltk) (3.7.0+computecanada)
Installing collected packages: nltk
Successfully installed nltk-3.6.3+computecanada
Looking in links: /cvmfs/soft.computecanada.ca/custom/python/wheelhouse/nix/avx2, /cvmfs/soft.computecanada.ca/custom/python/wheelhouse/nix/generic, /cvmfs/soft.computecanada.ca/custom/python/wheelhouse/generic
Processing /cvmfs/soft.computecanada.ca/custom/python/wheelhouse/generic/scikit_learn-0.22.1+computecanada-cp37-cp37m-linux_x86_64.whl
Requirement already satisfied: joblib>=0.11 in /localscratch/yinan.27794532.0/env/lib/python3.7/site-packages (from scikit-learn==0.22.1) (1.1.0+computecanada)
Requirement already satisfied: numpy>=1.11.0 in /cvmfs/soft.computecanada.ca/easybuild/software/2017/Core/scipy-stack/2019a/lib/python3.7/site-packages (from scikit-learn==0.22.1) (1.16.0)
Requirement already satisfied: scipy>=0.17.0 in /localscratch/yinan.27794532.0/env/lib/python3.7/site-packages (from scikit-learn==0.22.1) (1.4.1+computecanada)
Installing collected packages: scikit-learn
Successfully installed scikit-learn-0.22.1+computecanada
Looking in links: /cvmfs/soft.computecanada.ca/custom/python/wheelhouse/nix/avx2, /cvmfs/soft.computecanada.ca/custom/python/wheelhouse/nix/generic, /cvmfs/soft.computecanada.ca/custom/python/wheelhouse/generic
Requirement already satisfied: tokenizers==0.5.2 in /localscratch/yinan.27794532.0/env/lib/python3.7/site-packages (0.5.2+computecanada)
wandb: Appending key for api.wandb.ai to your netrc file: /home/yinan/.netrc
Starting Task
2022-02-25 10:39:34.186584: I tensorflow/stream_executor/platform/default/dso_loader.cc:48] Successfully opened dynamic library libcudart.so.10.1
[nltk_data] Downloading package stopwords to /home/yinan/nltk_data...
[nltk_data]   Package stopwords is already up-to-date!
[nltk_data] Downloading package wordnet to /home/yinan/nltk_data...
[nltk_data]   Package wordnet is already up-to-date!
wandb: Currently logged in as: yinanazhou (use `wandb login --relogin` to force relogin)
wandb: wandb version 0.12.10 is available!  To upgrade, please run:
wandb:  $ pip install wandb --upgrade
2022-02-25 10:39:45.481519: I tensorflow/stream_executor/platform/default/dso_loader.cc:48] Successfully opened dynamic library libcudart.so.10.1
wandb: Tracking run with wandb version 0.12.5
wandb: Syncing run genial-haze-1
wandb: ⭐️ View project at https://wandb.ai/yinanazhou/xl_512_bs_8_lr_1e07_es_10_lc_False_nr_False_stem_False_lemma_False_repeat_1_fold_1
wandb: 🚀 View run at https://wandb.ai/yinanazhou/xl_512_bs_8_lr_1e07_es_10_lc_False_nr_False_stem_False_lemma_False_repeat_1_fold_1/runs/4h7relxp
wandb: Run data is saved locally in /project/6002780/yinan/Thesis_MER_Lyrics/lyric-emotion/wandb/run-20220225_103942-4h7relxp
wandb: Run `wandb offline` to turn off syncing.

Validation loss decreased (inf --> 1.447266).  Saving model ...
Validation loss decreased (1.447266 --> 1.437970).  Saving model ...
Validation loss decreased (1.437970 --> 1.428082).  Saving model ...
Validation loss decreased (1.428082 --> 1.419422).  Saving model ...
Validation loss decreased (1.419422 --> 1.410801).  Saving model ...
Validation loss decreased (1.410801 --> 1.403790).  Saving model ...
Validation loss decreased (1.403790 --> 1.396325).  Saving model ...
Validation loss decreased (1.396325 --> 1.389933).  Saving model ...
Validation loss decreased (1.389933 --> 1.384976).  Saving model ...
Validation loss decreased (1.384976 --> 1.378998).  Saving model ...
Validation loss decreased (1.378998 --> 1.372438).  Saving model ...
Validation loss decreased (1.372438 --> 1.367018).  Saving model ...
Validation loss decreased (1.367018 --> 1.361318).  Saving model ...
Validation loss decreased (1.361318 --> 1.357056).  Saving model ...
Validation loss decreased (1.357056 --> 1.352462).  Saving model ...
Validation loss decreased (1.352462 --> 1.347467).  Saving model ...
Validation loss decreased (1.347467 --> 1.343710).  Saving model ...
Validation loss decreased (1.343710 --> 1.339687).  Saving model ...
Validation loss decreased (1.339687 --> 1.335850).  Saving model ...
Validation loss decreased (1.335850 --> 1.331873).  Saving model ...
Validation loss decreased (1.331873 --> 1.327640).  Saving model ...
Validation loss decreased (1.327640 --> 1.324385).  Saving model ...
Validation loss decreased (1.324385 --> 1.320620).  Saving model ...
Validation loss decreased (1.320620 --> 1.316456).  Saving model ...
Validation loss decreased (1.316456 --> 1.312808).  Saving model ...
Validation loss decreased (1.312808 --> 1.309726).  Saving model ...
Validation loss decreased (1.309726 --> 1.306804).  Saving model ...
Validation loss decreased (1.306804 --> 1.303609).  Saving model ...
Validation loss decreased (1.303609 --> 1.300115).  Saving model ...
Validation loss decreased (1.300115 --> 1.296964).  Saving model ...
Validation loss decreased (1.296964 --> 1.294100).  Saving model ...
Validation loss decreased (1.294100 --> 1.291073).  Saving model ...
Validation loss decreased (1.291073 --> 1.288614).  Saving model ...
Validation loss decreased (1.288614 --> 1.285543).  Saving model ...
Validation loss decreased (1.285543 --> 1.282380).  Saving model ...
Validation loss decreased (1.282380 --> 1.279665).  Saving model ...
Validation loss decreased (1.279665 --> 1.277156).  Saving model ...
Validation loss decreased (1.277156 --> 1.274100).  Saving model ...
Validation loss decreased (1.274100 --> 1.271296).  Saving model ...
Validation loss decreased (1.271296 --> 1.268631).  Saving model ...
Validation loss decreased (1.268631 --> 1.265496).  Saving model ...
Validation loss decreased (1.265496 --> 1.262232).  Saving model ...
Validation loss decreased (1.262232 --> 1.259580).  Saving model ...
Validation loss decreased (1.259580 --> 1.257002).  Saving model ...
Validation loss decreased (1.257002 --> 1.254105).  Saving model ...
Validation loss decreased (1.254105 --> 1.250817).  Saving model ...
Validation loss decreased (1.250817 --> 1.248023).  Saving model ...
Validation loss decreased (1.248023 --> 1.245421).  Saving model ...
Validation loss decreased (1.245421 --> 1.242726).  Saving model ...
Validation loss decreased (1.242726 --> 1.240046).  Saving model ...
Validation loss decreased (1.240046 --> 1.236974).  Saving model ...
Validation loss decreased (1.236974 --> 1.234185).  Saving model ...
Validation loss decreased (1.234185 --> 1.232467).  Saving model ...
Validation loss decreased (1.232467 --> 1.230033).  Saving model ...
Validation loss decreased (1.230033 --> 1.227734).  Saving model ...
Validation loss decreased (1.227734 --> 1.225117).  Saving model ...
Validation loss decreased (1.225117 --> 1.222807).  Saving model ...
Validation loss decreased (1.222807 --> 1.220420).  Saving model ...
Validation loss decreased (1.220420 --> 1.217257).  Saving model ...
Validation loss decreased (1.217257 --> 1.214080).  Saving model ...
Validation loss decreased (1.214080 --> 1.211504).  Saving model ...
Validation loss decreased (1.211504 --> 1.209025).  Saving model ...
Validation loss decreased (1.209025 --> 1.206252).  Saving model ...
Validation loss decreased (1.206252 --> 1.203766).  Saving model ...
Validation loss decreased (1.203766 --> 1.201381).  Saving model ...
Validation loss decreased (1.201381 --> 1.199346).  Saving model ...
Validation loss decreased (1.199346 --> 1.195874).  Saving model ...
Validation loss decreased (1.195874 --> 1.193373).  Saving model ...
Validation loss decreased (1.193373 --> 1.190509).  Saving model ...
Validation loss decreased (1.190509 --> 1.188051).  Saving model ...
Validation loss decreased (1.188051 --> 1.185908).  Saving model ...
Validation loss decreased (1.185908 --> 1.182441).  Saving model ...
Validation loss decreased (1.182441 --> 1.180518).  Saving model ...
Validation loss decreased (1.180518 --> 1.177906).  Saving model ...
Validation loss decreased (1.177906 --> 1.175591).  Saving model ...
Validation loss decreased (1.175591 --> 1.172585).  Saving model ...
Validation loss decreased (1.172585 --> 1.170681).  Saving model ...
Validation loss decreased (1.170681 --> 1.168675).  Saving model ...
Validation loss decreased (1.168675 --> 1.165697).  Saving model ...
Validation loss decreased (1.165697 --> 1.162733).  Saving model ...
Validation loss decreased (1.162733 --> 1.160420).  Saving model ...
Validation loss decreased (1.160420 --> 1.157852).  Saving model ...
Validation loss decreased (1.157852 --> 1.154953).  Saving model ...
Validation loss decreased (1.154953 --> 1.152608).  Saving model ...
Validation loss decreased (1.152608 --> 1.150433).  Saving model ...
Validation loss decreased (1.150433 --> 1.146321).  Saving model ...
Validation loss decreased (1.146321 --> 1.144510).  Saving model ...
Validation loss decreased (1.144510 --> 1.142464).  Saving model ...
Validation loss decreased (1.142464 --> 1.140439).  Saving model ...
Validation loss decreased (1.140439 --> 1.137561).  Saving model ...
Validation loss decreased (1.137561 --> 1.134989).  Saving model ...
Validation loss decreased (1.134989 --> 1.132545).  Saving model ...
Validation loss decreased (1.132545 --> 1.129488).  Saving model ...
Validation loss decreased (1.129488 --> 1.125604).  Saving model ...
Validation loss decreased (1.125604 --> 1.123842).  Saving model ...
Validation loss decreased (1.123842 --> 1.120446).  Saving model ...
Validation loss decreased (1.120446 --> 1.119579).  Saving model ...
Validation loss decreased (1.119579 --> 1.116534).  Saving model ...
Validation loss decreased (1.116534 --> 1.113922).  Saving model ...
Validation loss decreased (1.113922 --> 1.111873).  Saving model ...
Validation loss decreased (1.111873 --> 1.109070).  Saving model ...
Validation loss decreased (1.109070 --> 1.105903).  Saving model ...
Validation loss decreased (1.105903 --> 1.102078).  Saving model ...
Validation loss decreased (1.102078 --> 1.100934).  Saving model ...
EarlyStopping counter: 1 out of 10.0
EarlyStopping counter: 2 out of 10.0
Validation loss decreased (1.100934 --> 1.097475).  Saving model ...
Validation loss decreased (1.097475 --> 1.090840).  Saving model ...
Validation loss decreased (1.090840 --> 1.088853).  Saving model ...
Validation loss decreased (1.088853 --> 1.087111).  Saving model ...
Validation loss decreased (1.087111 --> 1.086100).  Saving model ...
Validation loss decreased (1.086100 --> 1.085459).  Saving model ...
EarlyStopping counter: 1 out of 10.0
Validation loss decreased (1.085459 --> 1.082830).  Saving model ...
Validation loss decreased (1.082830 --> 1.076488).  Saving model ...
Validation loss decreased (1.076488 --> 1.075228).  Saving model ...
Validation loss decreased (1.075228 --> 1.072619).  Saving model ...
Validation loss decreased (1.072619 --> 1.068811).  Saving model ...
EarlyStopping counter: 1 out of 10.0
Validation loss decreased (1.068811 --> 1.067721).  Saving model ...
Validation loss decreased (1.067721 --> 1.066020).  Saving model ...
Validation loss decreased (1.066020 --> 1.063806).  Saving model ...
Validation loss decreased (1.063806 --> 1.061452).  Saving model ...
Validation loss decreased (1.061452 --> 1.060221).  Saving model ...
Validation loss decreased (1.060221 --> 1.057816).  Saving model ...
Validation loss decreased (1.057816 --> 1.056333).  Saving model ...
Validation loss decreased (1.056333 --> 1.054592).  Saving model ...
EarlyStopping counter: 1 out of 10.0
Validation loss decreased (1.054592 --> 1.052147).  Saving model ...
Validation loss decreased (1.052147 --> 1.049725).  Saving model ...
Validation loss decreased (1.049725 --> 1.046112).  Saving model ...
EarlyStopping counter: 1 out of 10.0
EarlyStopping counter: 2 out of 10.0
EarlyStopping counter: 3 out of 10.0
EarlyStopping counter: 4 out of 10.0
Validation loss decreased (1.046112 --> 1.043559).  Saving model ...
Validation loss decreased (1.043559 --> 1.040102).  Saving model ...
EarlyStopping counter: 1 out of 10.0
EarlyStopping counter: 2 out of 10.0
Validation loss decreased (1.040102 --> 1.036209).  Saving model ...
Validation loss decreased (1.036209 --> 1.033615).  Saving model ...
EarlyStopping counter: 1 out of 10.0
Validation loss decreased (1.033615 --> 1.032157).  Saving model ...
Validation loss decreased (1.032157 --> 1.032104).  Saving model ...
Validation loss decreased (1.032104 --> 1.028753).  Saving model ...
Validation loss decreased (1.028753 --> 1.027747).  Saving model ...
Validation loss decreased (1.027747 --> 1.024468).  Saving model ...
Validation loss decreased (1.024468 --> 1.024419).  Saving model ...
Validation loss decreased (1.024419 --> 1.020536).  Saving model ...
EarlyStopping counter: 1 out of 10.0
EarlyStopping counter: 2 out of 10.0
Validation loss decreased (1.020536 --> 1.019872).  Saving model ...
Validation loss decreased (1.019872 --> 1.015223).  Saving model ...
Validation loss decreased (1.015223 --> 1.015153).  Saving model ...
EarlyStopping counter: 1 out of 10.0
EarlyStopping counter: 2 out of 10.0
Validation loss decreased (1.015153 --> 1.014514).  Saving model ...
Validation loss decreased (1.014514 --> 1.012840).  Saving model ...
Validation loss decreased (1.012840 --> 1.007441).  Saving model ...
EarlyStopping counter: 1 out of 10.0
EarlyStopping counter: 2 out of 10.0
EarlyStopping counter: 3 out of 10.0
EarlyStopping counter: 4 out of 10.0
EarlyStopping counter: 5 out of 10.0
EarlyStopping counter: 6 out of 10.0
Validation loss decreased (1.007441 --> 1.006093).  Saving model ...
EarlyStopping counter: 1 out of 10.0
EarlyStopping counter: 2 out of 10.0
EarlyStopping counter: 3 out of 10.0
Validation loss decreased (1.006093 --> 1.003951).  Saving model ...
EarlyStopping counter: 1 out of 10.0
Validation loss decreased (1.003951 --> 0.999011).  Saving model ...
EarlyStopping counter: 1 out of 10.0
EarlyStopping counter: 2 out of 10.0
Validation loss decreased (0.999011 --> 0.998733).  Saving model ...
Validation loss decreased (0.998733 --> 0.997306).  Saving model ...
Validation loss decreased (0.997306 --> 0.995317).  Saving model ...
Validation loss decreased (0.995317 --> 0.993892).  Saving model ...
EarlyStopping counter: 1 out of 10.0
EarlyStopping counter: 2 out of 10.0
Validation loss decreased (0.993892 --> 0.992318).  Saving model ...
EarlyStopping counter: 1 out of 10.0
EarlyStopping counter: 2 out of 10.0
Validation loss decreased (0.992318 --> 0.990441).  Saving model ...
Validation loss decreased (0.990441 --> 0.990026).  Saving model ...
Validation loss decreased (0.990026 --> 0.988669).  Saving model ...
EarlyStopping counter: 1 out of 10.0
Validation loss decreased (0.988669 --> 0.988235).  Saving model ...
Validation loss decreased (0.988235 --> 0.987834).  Saving model ...
EarlyStopping counter: 1 out of 10.0
Validation loss decreased (0.987834 --> 0.987612).  Saving model ...
Validation loss decreased (0.987612 --> 0.987303).  Saving model ...
Validation loss decreased (0.987303 --> 0.983879).  Saving model ...
Validation loss decreased (0.983879 --> 0.982175).  Saving model ...
Validation loss decreased (0.982175 --> 0.981865).  Saving model ...
Validation loss decreased (0.981865 --> 0.981380).  Saving model ...
EarlyStopping counter: 1 out of 10.0
Validation loss decreased (0.981380 --> 0.980810).  Saving model ...
Validation loss decreased (0.980810 --> 0.980567).  Saving model ...
EarlyStopping counter: 1 out of 10.0
Validation loss decreased (0.980567 --> 0.980537).  Saving model ...
Validation loss decreased (0.980537 --> 0.977889).  Saving model ...
EarlyStopping counter: 1 out of 10.0
EarlyStopping counter: 2 out of 10.0
Validation loss decreased (0.977889 --> 0.977818).  Saving model ...
EarlyStopping counter: 1 out of 10.0
EarlyStopping counter: 2 out of 10.0
Validation loss decreased (0.977818 --> 0.976537).  Saving model ...
EarlyStopping counter: 1 out of 10.0
EarlyStopping counter: 2 out of 10.0
EarlyStopping counter: 3 out of 10.0
EarlyStopping counter: 4 out of 10.0
EarlyStopping counter: 5 out of 10.0
EarlyStopping counter: 6 out of 10.0
EarlyStopping counter: 7 out of 10.0
Validation loss decreased (0.976537 --> 0.974283).  Saving model ...
Validation loss decreased (0.974283 --> 0.972175).  Saving model ...
Validation loss decreased (0.972175 --> 0.971662).  Saving model ...
Validation loss decreased (0.971662 --> 0.970684).  Saving model ...
EarlyStopping counter: 1 out of 10.0
Validation loss decreased (0.970684 --> 0.969559).  Saving model ...
EarlyStopping counter: 1 out of 10.0
Validation loss decreased (0.969559 --> 0.968793).  Saving model ...
Validation loss decreased (0.968793 --> 0.967654).  Saving model ...
EarlyStopping counter: 1 out of 10.0
Validation loss decreased (0.967654 --> 0.966751).  Saving model ...
EarlyStopping counter: 1 out of 10.0
EarlyStopping counter: 2 out of 10.0
EarlyStopping counter: 3 out of 10.0
EarlyStopping counter: 4 out of 10.0
Validation loss decreased (0.966751 --> 0.965659).  Saving model ...
Validation loss decreased (0.965659 --> 0.965253).  Saving model ...
Validation loss decreased (0.965253 --> 0.964719).  Saving model ...
EarlyStopping counter: 1 out of 10.0
Validation loss decreased (0.964719 --> 0.963148).  Saving model ...
EarlyStopping counter: 1 out of 10.0
EarlyStopping counter: 2 out of 10.0
Validation loss decreased (0.963148 --> 0.961735).  Saving model ...
EarlyStopping counter: 1 out of 10.0
EarlyStopping counter: 2 out of 10.0
EarlyStopping counter: 3 out of 10.0
Validation loss decreased (0.961735 --> 0.961624).  Saving model ...
EarlyStopping counter: 1 out of 10.0
EarlyStopping counter: 2 out of 10.0
EarlyStopping counter: 3 out of 10.0
Validation loss decreased (0.961624 --> 0.960949).  Saving model ...
EarlyStopping counter: 1 out of 10.0
EarlyStopping counter: 2 out of 10.0
EarlyStopping counter: 3 out of 10.0
EarlyStopping counter: 4 out of 10.0
EarlyStopping counter: 5 out of 10.0
Validation loss decreased (0.960949 --> 0.960329).  Saving model ...
EarlyStopping counter: 1 out of 10.0
EarlyStopping counter: 2 out of 10.0
EarlyStopping counter: 3 out of 10.0
EarlyStopping counter: 4 out of 10.0
EarlyStopping counter: 5 out of 10.0
EarlyStopping counter: 6 out of 10.0
EarlyStopping counter: 7 out of 10.0
EarlyStopping counter: 8 out of 10.0
EarlyStopping counter: 9 out of 10.0
EarlyStopping counter: 10 out of 10.0
/localscratch/yinan.27794532.0/env/lib/python3.7/site-packages/torch/nn/functional.py:1794: UserWarning: nn.functional.tanh is deprecated. Use torch.tanh instead.
  warnings.warn("nn.functional.tanh is deprecated. Use torch.tanh instead.")
/localscratch/yinan.27794532.0/env/lib/python3.7/site-packages/transformers/optimization.py:155: UserWarning: This overload of add_ is deprecated:
	add_(Number alpha, Tensor other)
Consider using one of the following signatures instead:
	add_(Tensor other, *, Number alpha) (Triggered internally at  ../torch/csrc/utils/python_arg_parser.cpp:1025.)
  exp_avg.mul_(beta1).add_(1.0 - beta1, grad)
wandb: Waiting for W&B process to finish, PID 123221... (success).
wandb: - 0.00MB of 0.00MB uploaded (0.00MB deduped)wandb: \ 0.00MB of 0.00MB uploaded (0.00MB deduped)wandb: | 0.00MB of 0.00MB uploaded (0.00MB deduped)wandb: / 0.00MB of 0.00MB uploaded (0.00MB deduped)wandb: - 0.00MB of 0.00MB uploaded (0.00MB deduped)wandb: \ 0.00MB of 0.00MB uploaded (0.00MB deduped)wandb: | 0.00MB of 0.00MB uploaded (0.00MB deduped)wandb: / 0.00MB of 0.00MB uploaded (0.00MB deduped)wandb: - 0.00MB of 0.00MB uploaded (0.00MB deduped)wandb: \ 0.00MB of 0.00MB uploaded (0.00MB deduped)wandb: | 0.00MB of 0.00MB uploaded (0.00MB deduped)wandb: / 0.00MB of 0.00MB uploaded (0.00MB deduped)wandb: - 0.00MB of 0.00MB uploaded (0.00MB deduped)wandb:                                                                                
wandb: Run history:
wandb:     e_F1 ▁▂▃▄▅▅▅▆▆▆▆▆▆▇▇▇▇▇▇▇████████████████████
wandb:   e_loss ██▇▇▆▆▆▅▅▅▅▄▄▄▄▃▃▃▃▂▂▂▂▂▂▂▂▂▁▁▁▁▁▁▁▁▁▁▁▁
wandb:     t_F1 ▁▁▂▂▃▃▃▄▄▅▄▅▅▅▅▅▆▅▆▆▆▆▆▇▇▇▇▇▇▇▇▇▇▇██████
wandb:   t_loss ███▇▇▇▇▆▆▆▆▅▅▅▅▅▄▄▄▄▄▄▃▃▃▃▃▃▃▂▂▂▂▂▂▁▁▁▁▁
wandb: 
wandb: Run summary:
wandb:     e_F1 58.5373
wandb:   e_loss 0.96103
wandb:     t_F1 77.16888
wandb:   t_loss 0.63755
wandb: 
wandb: Synced 4 W&B file(s), 0 media file(s), 0 artifact file(s) and 0 other file(s)
wandb: Synced genial-haze-1: https://wandb.ai/yinanazhou/xl_512_bs_8_lr_1e07_es_10_lc_False_nr_False_stem_False_lemma_False_repeat_1_fold_1/runs/4h7relxp
wandb: Find logs at: ./wandb/run-20220225_103942-4h7relxp/logs/debug.log
wandb: 

wandb: wandb version 0.12.10 is available!  To upgrade, please run:
wandb:  $ pip install wandb --upgrade
2022-02-25 14:47:41.157608: I tensorflow/stream_executor/platform/default/dso_loader.cc:48] Successfully opened dynamic library libcudart.so.10.1
wandb: Tracking run with wandb version 0.12.5
wandb: Syncing run cerulean-totem-1
wandb: ⭐️ View project at https://wandb.ai/yinanazhou/xl_512_bs_8_lr_1e07_es_10_lc_False_nr_False_stem_False_lemma_False_repeat_1_fold_2
wandb: 🚀 View run at https://wandb.ai/yinanazhou/xl_512_bs_8_lr_1e07_es_10_lc_False_nr_False_stem_False_lemma_False_repeat_1_fold_2/runs/x3mdixvp
wandb: Run data is saved locally in /project/6002780/yinan/Thesis_MER_Lyrics/lyric-emotion/wandb/run-20220225_144737-x3mdixvp
wandb: Run `wandb offline` to turn off syncing.

Validation loss decreased (inf --> 1.471611).  Saving model ...
Validation loss decreased (1.471611 --> 1.459824).  Saving model ...
Validation loss decreased (1.459824 --> 1.449031).  Saving model ...
Validation loss decreased (1.449031 --> 1.438756).  Saving model ...
Validation loss decreased (1.438756 --> 1.429081).  Saving model ...
Validation loss decreased (1.429081 --> 1.420327).  Saving model ...
Validation loss decreased (1.420327 --> 1.411313).  Saving model ...
Validation loss decreased (1.411313 --> 1.402381).  Saving model ...
Validation loss decreased (1.402381 --> 1.394340).  Saving model ...
Validation loss decreased (1.394340 --> 1.387250).  Saving model ...
Validation loss decreased (1.387250 --> 1.379759).  Saving model ...
Validation loss decreased (1.379759 --> 1.372811).  Saving model ...
Validation loss decreased (1.372811 --> 1.365835).  Saving model ...
Validation loss decreased (1.365835 --> 1.359647).  Saving model ...
Validation loss decreased (1.359647 --> 1.353745).  Saving model ...
Validation loss decreased (1.353745 --> 1.347401).  Saving model ...
Validation loss decreased (1.347401 --> 1.342317).  Saving model ...
Validation loss decreased (1.342317 --> 1.338168).  Saving model ...
Validation loss decreased (1.338168 --> 1.333785).  Saving model ...
Validation loss decreased (1.333785 --> 1.330018).  Saving model ...
Validation loss decreased (1.330018 --> 1.326530).  Saving model ...
Validation loss decreased (1.326530 --> 1.323052).  Saving model ...
Validation loss decreased (1.323052 --> 1.319943).  Saving model ...
Validation loss decreased (1.319943 --> 1.316844).  Saving model ...
Validation loss decreased (1.316844 --> 1.313744).  Saving model ...
Validation loss decreased (1.313744 --> 1.310190).  Saving model ...
Validation loss decreased (1.310190 --> 1.307414).  Saving model ...
Validation loss decreased (1.307414 --> 1.305047).  Saving model ...
Validation loss decreased (1.305047 --> 1.301817).  Saving model ...
Validation loss decreased (1.301817 --> 1.299536).  Saving model ...
Validation loss decreased (1.299536 --> 1.297047).  Saving model ...
Validation loss decreased (1.297047 --> 1.294143).  Saving model ...
Validation loss decreased (1.294143 --> 1.291610).  Saving model ...
Validation loss decreased (1.291610 --> 1.289048).  Saving model ...
Validation loss decreased (1.289048 --> 1.286250).  Saving model ...
Validation loss decreased (1.286250 --> 1.283174).  Saving model ...
Validation loss decreased (1.283174 --> 1.280452).  Saving model ...
Validation loss decreased (1.280452 --> 1.277839).  Saving model ...
Validation loss decreased (1.277839 --> 1.275028).  Saving model ...
Validation loss decreased (1.275028 --> 1.271853).  Saving model ...
Validation loss decreased (1.271853 --> 1.269825).  Saving model ...
Validation loss decreased (1.269825 --> 1.268458).  Saving model ...
Validation loss decreased (1.268458 --> 1.266699).  Saving model ...
Validation loss decreased (1.266699 --> 1.264243).  Saving model ...
Validation loss decreased (1.264243 --> 1.261413).  Saving model ...
Validation loss decreased (1.261413 --> 1.259001).  Saving model ...
Validation loss decreased (1.259001 --> 1.255883).  Saving model ...
Validation loss decreased (1.255883 --> 1.253359).  Saving model ...
Validation loss decreased (1.253359 --> 1.250031).  Saving model ...
Validation loss decreased (1.250031 --> 1.247277).  Saving model ...
Validation loss decreased (1.247277 --> 1.245180).  Saving model ...
Validation loss decreased (1.245180 --> 1.241749).  Saving model ...
Validation loss decreased (1.241749 --> 1.238577).  Saving model ...
Validation loss decreased (1.238577 --> 1.237009).  Saving model ...
Validation loss decreased (1.237009 --> 1.235270).  Saving model ...
Validation loss decreased (1.235270 --> 1.230913).  Saving model ...
Validation loss decreased (1.230913 --> 1.228746).  Saving model ...
Validation loss decreased (1.228746 --> 1.224875).  Saving model ...
Validation loss decreased (1.224875 --> 1.220659).  Saving model ...
Validation loss decreased (1.220659 --> 1.217866).  Saving model ...
Validation loss decreased (1.217866 --> 1.215169).  Saving model ...
Validation loss decreased (1.215169 --> 1.212130).  Saving model ...
Validation loss decreased (1.212130 --> 1.210100).  Saving model ...
Validation loss decreased (1.210100 --> 1.205716).  Saving model ...
Validation loss decreased (1.205716 --> 1.203000).  Saving model ...
Validation loss decreased (1.203000 --> 1.199941).  Saving model ...
Validation loss decreased (1.199941 --> 1.197705).  Saving model ...
Validation loss decreased (1.197705 --> 1.193719).  Saving model ...
Validation loss decreased (1.193719 --> 1.189432).  Saving model ...
Validation loss decreased (1.189432 --> 1.185383).  Saving model ...
Validation loss decreased (1.185383 --> 1.183160).  Saving model ...
Validation loss decreased (1.183160 --> 1.180645).  Saving model ...
Validation loss decreased (1.180645 --> 1.177294).  Saving model ...
Validation loss decreased (1.177294 --> 1.175095).  Saving model ...
Validation loss decreased (1.175095 --> 1.173054).  Saving model ...
Validation loss decreased (1.173054 --> 1.169987).  Saving model ...
Validation loss decreased (1.169987 --> 1.165936).  Saving model ...
Validation loss decreased (1.165936 --> 1.163023).  Saving model ...
Validation loss decreased (1.163023 --> 1.160892).  Saving model ...
Validation loss decreased (1.160892 --> 1.159809).  Saving model ...
Validation loss decreased (1.159809 --> 1.156047).  Saving model ...
Validation loss decreased (1.156047 --> 1.152469).  Saving model ...
Validation loss decreased (1.152469 --> 1.147403).  Saving model ...
Validation loss decreased (1.147403 --> 1.145693).  Saving model ...
Validation loss decreased (1.145693 --> 1.143499).  Saving model ...
Validation loss decreased (1.143499 --> 1.143228).  Saving model ...
Validation loss decreased (1.143228 --> 1.140115).  Saving model ...
Validation loss decreased (1.140115 --> 1.136218).  Saving model ...
Validation loss decreased (1.136218 --> 1.133746).  Saving model ...
Validation loss decreased (1.133746 --> 1.130616).  Saving model ...
Validation loss decreased (1.130616 --> 1.126427).  Saving model ...
Validation loss decreased (1.126427 --> 1.122261).  Saving model ...
Validation loss decreased (1.122261 --> 1.121152).  Saving model ...
Validation loss decreased (1.121152 --> 1.119809).  Saving model ...
Validation loss decreased (1.119809 --> 1.116415).  Saving model ...
Validation loss decreased (1.116415 --> 1.113007).  Saving model ...
Validation loss decreased (1.113007 --> 1.110916).  Saving model ...
Validation loss decreased (1.110916 --> 1.109665).  Saving model ...
Validation loss decreased (1.109665 --> 1.106961).  Saving model ...
Validation loss decreased (1.106961 --> 1.105553).  Saving model ...
Validation loss decreased (1.105553 --> 1.104397).  Saving model ...
Validation loss decreased (1.104397 --> 1.101172).  Saving model ...
Validation loss decreased (1.101172 --> 1.096953).  Saving model ...
Validation loss decreased (1.096953 --> 1.095106).  Saving model ...
Validation loss decreased (1.095106 --> 1.092181).  Saving model ...
Validation loss decreased (1.092181 --> 1.089880).  Saving model ...
Validation loss decreased (1.089880 --> 1.087694).  Saving model ...
Validation loss decreased (1.087694 --> 1.084054).  Saving model ...
Validation loss decreased (1.084054 --> 1.083656).  Saving model ...
Validation loss decreased (1.083656 --> 1.080525).  Saving model ...
Validation loss decreased (1.080525 --> 1.079537).  Saving model ...
Validation loss decreased (1.079537 --> 1.078025).  Saving model ...
EarlyStopping counter: 1 out of 10.0
Validation loss decreased (1.078025 --> 1.076189).  Saving model ...
Validation loss decreased (1.076189 --> 1.074459).  Saving model ...
Validation loss decreased (1.074459 --> 1.071966).  Saving model ...
Validation loss decreased (1.071966 --> 1.070507).  Saving model ...
Validation loss decreased (1.070507 --> 1.067412).  Saving model ...
Validation loss decreased (1.067412 --> 1.064557).  Saving model ...
Validation loss decreased (1.064557 --> 1.061119).  Saving model ...
Validation loss decreased (1.061119 --> 1.059410).  Saving model ...
Validation loss decreased (1.059410 --> 1.057674).  Saving model ...
Validation loss decreased (1.057674 --> 1.053197).  Saving model ...
Validation loss decreased (1.053197 --> 1.051332).  Saving model ...
Validation loss decreased (1.051332 --> 1.049565).  Saving model ...
Validation loss decreased (1.049565 --> 1.046581).  Saving model ...
Validation loss decreased (1.046581 --> 1.043931).  Saving model ...
Validation loss decreased (1.043931 --> 1.042595).  Saving model ...
EarlyStopping counter: 1 out of 10.0
Validation loss decreased (1.042595 --> 1.041640).  Saving model ...
Validation loss decreased (1.041640 --> 1.040303).  Saving model ...
Validation loss decreased (1.040303 --> 1.039083).  Saving model ...
Validation loss decreased (1.039083 --> 1.036693).  Saving model ...
Validation loss decreased (1.036693 --> 1.032489).  Saving model ...
EarlyStopping counter: 1 out of 10.0
EarlyStopping counter: 2 out of 10.0
Validation loss decreased (1.032489 --> 1.030580).  Saving model ...
Validation loss decreased (1.030580 --> 1.028624).  Saving model ...
Validation loss decreased (1.028624 --> 1.026533).  Saving model ...
Validation loss decreased (1.026533 --> 1.025127).  Saving model ...
EarlyStopping counter: 1 out of 10.0
EarlyStopping counter: 2 out of 10.0
Validation loss decreased (1.025127 --> 1.023513).  Saving model ...
Validation loss decreased (1.023513 --> 1.020502).  Saving model ...
Validation loss decreased (1.020502 --> 1.017693).  Saving model ...
Validation loss decreased (1.017693 --> 1.017387).  Saving model ...
Validation loss decreased (1.017387 --> 1.015504).  Saving model ...
Validation loss decreased (1.015504 --> 1.014003).  Saving model ...
Validation loss decreased (1.014003 --> 1.010700).  Saving model ...
EarlyStopping counter: 1 out of 10.0
Validation loss decreased (1.010700 --> 1.009994).  Saving model ...
Validation loss decreased (1.009994 --> 1.007992).  Saving model ...
Validation loss decreased (1.007992 --> 1.006779).  Saving model ...
Validation loss decreased (1.006779 --> 1.004811).  Saving model ...
Validation loss decreased (1.004811 --> 1.002591).  Saving model ...
Validation loss decreased (1.002591 --> 1.001886).  Saving model ...
Validation loss decreased (1.001886 --> 1.000936).  Saving model ...
Validation loss decreased (1.000936 --> 0.998254).  Saving model ...
Validation loss decreased (0.998254 --> 0.997576).  Saving model ...
Validation loss decreased (0.997576 --> 0.996118).  Saving model ...
Validation loss decreased (0.996118 --> 0.995994).  Saving model ...
EarlyStopping counter: 1 out of 10.0
EarlyStopping counter: 2 out of 10.0
EarlyStopping counter: 3 out of 10.0
Validation loss decreased (0.995994 --> 0.994036).  Saving model ...
Validation loss decreased (0.994036 --> 0.991365).  Saving model ...
Validation loss decreased (0.991365 --> 0.989042).  Saving model ...
Validation loss decreased (0.989042 --> 0.988351).  Saving model ...
Validation loss decreased (0.988351 --> 0.987991).  Saving model ...
Validation loss decreased (0.987991 --> 0.986196).  Saving model ...
Validation loss decreased (0.986196 --> 0.985621).  Saving model ...
Validation loss decreased (0.985621 --> 0.984024).  Saving model ...
Validation loss decreased (0.984024 --> 0.983262).  Saving model ...
Validation loss decreased (0.983262 --> 0.979501).  Saving model ...
Validation loss decreased (0.979501 --> 0.979152).  Saving model ...
EarlyStopping counter: 1 out of 10.0
Validation loss decreased (0.979152 --> 0.978289).  Saving model ...
Validation loss decreased (0.978289 --> 0.976772).  Saving model ...
Validation loss decreased (0.976772 --> 0.975298).  Saving model ...
Validation loss decreased (0.975298 --> 0.974002).  Saving model ...
Validation loss decreased (0.974002 --> 0.973441).  Saving model ...
EarlyStopping counter: 1 out of 10.0
EarlyStopping counter: 2 out of 10.0
Validation loss decreased (0.973441 --> 0.971662).  Saving model ...
Validation loss decreased (0.971662 --> 0.970313).  Saving model ...
EarlyStopping counter: 1 out of 10.0
EarlyStopping counter: 2 out of 10.0
Validation loss decreased (0.970313 --> 0.969790).  Saving model ...
Validation loss decreased (0.969790 --> 0.968276).  Saving model ...
Validation loss decreased (0.968276 --> 0.967096).  Saving model ...
Validation loss decreased (0.967096 --> 0.965590).  Saving model ...
EarlyStopping counter: 1 out of 10.0
EarlyStopping counter: 2 out of 10.0
Validation loss decreased (0.965590 --> 0.963848).  Saving model ...
Validation loss decreased (0.963848 --> 0.962840).  Saving model ...
Validation loss decreased (0.962840 --> 0.961153).  Saving model ...
EarlyStopping counter: 1 out of 10.0
Validation loss decreased (0.961153 --> 0.960244).  Saving model ...
Validation loss decreased (0.960244 --> 0.958707).  Saving model ...
Validation loss decreased (0.958707 --> 0.958171).  Saving model ...
EarlyStopping counter: 1 out of 10.0
EarlyStopping counter: 2 out of 10.0
EarlyStopping counter: 3 out of 10.0
Validation loss decreased (0.958171 --> 0.957725).  Saving model ...
Validation loss decreased (0.957725 --> 0.957271).  Saving model ...
Validation loss decreased (0.957271 --> 0.956027).  Saving model ...
Validation loss decreased (0.956027 --> 0.955886).  Saving model ...
Validation loss decreased (0.955886 --> 0.954829).  Saving model ...
Validation loss decreased (0.954829 --> 0.954240).  Saving model ...
Validation loss decreased (0.954240 --> 0.953221).  Saving model ...
EarlyStopping counter: 1 out of 10.0
Validation loss decreased (0.953221 --> 0.952537).  Saving model ...
Validation loss decreased (0.952537 --> 0.951292).  Saving model ...
Validation loss decreased (0.951292 --> 0.950372).  Saving model ...
EarlyStopping counter: 1 out of 10.0
Validation loss decreased (0.950372 --> 0.949715).  Saving model ...
EarlyStopping counter: 1 out of 10.0
Validation loss decreased (0.949715 --> 0.948756).  Saving model ...
EarlyStopping counter: 1 out of 10.0
EarlyStopping counter: 2 out of 10.0
EarlyStopping counter: 3 out of 10.0
Validation loss decreased (0.948756 --> 0.948115).  Saving model ...
Validation loss decreased (0.948115 --> 0.947655).  Saving model ...
EarlyStopping counter: 1 out of 10.0
EarlyStopping counter: 2 out of 10.0
EarlyStopping counter: 3 out of 10.0
Validation loss decreased (0.947655 --> 0.946948).  Saving model ...
EarlyStopping counter: 1 out of 10.0
EarlyStopping counter: 2 out of 10.0
Validation loss decreased (0.946948 --> 0.945578).  Saving model ...
Validation loss decreased (0.945578 --> 0.945262).  Saving model ...
Validation loss decreased (0.945262 --> 0.945219).  Saving model ...
EarlyStopping counter: 1 out of 10.0
Validation loss decreased (0.945219 --> 0.944603).  Saving model ...
EarlyStopping counter: 1 out of 10.0
EarlyStopping counter: 2 out of 10.0
EarlyStopping counter: 3 out of 10.0
EarlyStopping counter: 4 out of 10.0
EarlyStopping counter: 5 out of 10.0
EarlyStopping counter: 6 out of 10.0
EarlyStopping counter: 7 out of 10.0
EarlyStopping counter: 8 out of 10.0
EarlyStopping counter: 9 out of 10.0
EarlyStopping counter: 10 out of 10.0
/localscratch/yinan.27794532.0/env/lib/python3.7/site-packages/torch/nn/functional.py:1794: UserWarning: nn.functional.tanh is deprecated. Use torch.tanh instead.
  warnings.warn("nn.functional.tanh is deprecated. Use torch.tanh instead.")
wandb: Waiting for W&B process to finish, PID 136359... (success).
wandb: - 0.00MB of 0.00MB uploaded (0.00MB deduped)wandb: \ 0.00MB of 0.00MB uploaded (0.00MB deduped)wandb: | 0.00MB of 0.00MB uploaded (0.00MB deduped)wandb: / 0.00MB of 0.00MB uploaded (0.00MB deduped)wandb: - 0.00MB of 0.00MB uploaded (0.00MB deduped)wandb: \ 0.00MB of 0.00MB uploaded (0.00MB deduped)wandb: | 0.00MB of 0.00MB uploaded (0.00MB deduped)wandb: / 0.00MB of 0.00MB uploaded (0.00MB deduped)wandb: - 0.00MB of 0.00MB uploaded (0.00MB deduped)wandb: \ 0.00MB of 0.00MB uploaded (0.00MB deduped)wandb: | 0.00MB of 0.00MB uploaded (0.00MB deduped)wandb: / 0.00MB of 0.00MB uploaded (0.00MB deduped)wandb: - 0.00MB of 0.00MB uploaded (0.00MB deduped)wandb:                                                                                
wandb: Run history:
wandb:     e_F1 ▁▂▃▄▅▅▅▅▆▆▆▆▆▆▆▆▆▇▇▇▇▇▇▇▇▇▇▇████████████
wandb:   e_loss █▇▇▆▆▆▆▅▅▅▅▄▄▄▄▃▃▃▃▃▂▂▂▂▂▂▂▂▁▁▁▁▁▁▁▁▁▁▁▁
wandb:     t_F1 ▁▁▂▂▃▃▃▃▃▄▄▅▅▅▅▅▅▆▆▆▆▆▆▆▇▆▇▇▇▇▇▇▇█▇█████
wandb:   t_loss ██▇▇▇▇▇▆▆▆▆▆▅▅▅▅▅▅▄▄▄▄▄▄▃▃▃▃▃▂▂▂▂▂▂▁▁▁▁▁
wandb: 
wandb: Run summary:
wandb:     e_F1 60.81091
wandb:   e_loss 0.94567
wandb:     t_F1 76.43303
wandb:   t_loss 0.68622
wandb: 
wandb: Synced 4 W&B file(s), 0 media file(s), 0 artifact file(s) and 0 other file(s)
wandb: Synced cerulean-totem-1: https://wandb.ai/yinanazhou/xl_512_bs_8_lr_1e07_es_10_lc_False_nr_False_stem_False_lemma_False_repeat_1_fold_2/runs/x3mdixvp
wandb: Find logs at: ./wandb/run-20220225_144737-x3mdixvp/logs/debug.log
wandb: 

wandb: wandb version 0.12.10 is available!  To upgrade, please run:
wandb:  $ pip install wandb --upgrade
2022-02-25 18:39:28.458436: I tensorflow/stream_executor/platform/default/dso_loader.cc:48] Successfully opened dynamic library libcudart.so.10.1
wandb: Tracking run with wandb version 0.12.5
wandb: Syncing run super-voice-1
wandb: ⭐️ View project at https://wandb.ai/yinanazhou/xl_512_bs_8_lr_1e07_es_10_lc_False_nr_False_stem_False_lemma_False_repeat_2_fold_1
wandb: 🚀 View run at https://wandb.ai/yinanazhou/xl_512_bs_8_lr_1e07_es_10_lc_False_nr_False_stem_False_lemma_False_repeat_2_fold_1/runs/go8p5dsh
wandb: Run data is saved locally in /project/6002780/yinan/Thesis_MER_Lyrics/lyric-emotion/wandb/run-20220225_183925-go8p5dsh
wandb: Run `wandb offline` to turn off syncing.
slurmstepd: error: *** JOB 27794532 ON cdr2642 CANCELLED AT 2022-02-25T20:35:25 DUE TO TIME LIMIT ***
