Unloading StdEnv/2020

Due to MODULEPATH changes, the following have been reloaded:
  1) mii/1.1.1


The following have been reloaded with a version change:
  1) python/3.8.2 => python/3.7.4

Using base prefix '/cvmfs/soft.computecanada.ca/easybuild/software/2017/Core/python/3.7.4'
New python executable in /localscratch/yinan.28736311.0/env/bin/python
Installing setuptools, pip, wheel...
done.
Ignoring pip: markers 'python_version < "3"' don't match your environment
Looking in links: /cvmfs/soft.computecanada.ca/custom/python/wheelhouse/nix/avx2, /cvmfs/soft.computecanada.ca/custom/python/wheelhouse/nix/generic, /cvmfs/soft.computecanada.ca/custom/python/wheelhouse/generic
Collecting pip
Installing collected packages: pip
  Found existing installation: pip 19.1.1
    Uninstalling pip-19.1.1:
      Successfully uninstalled pip-19.1.1
Successfully installed pip-21.2.3+computecanada
Looking in links: /cvmfs/soft.computecanada.ca/custom/python/wheelhouse/nix/avx2, /cvmfs/soft.computecanada.ca/custom/python/wheelhouse/nix/generic, /cvmfs/soft.computecanada.ca/custom/python/wheelhouse/generic
Processing /cvmfs/soft.computecanada.ca/custom/python/wheelhouse/generic/keras-2.8.0+computecanada-py2.py3-none-any.whl
Processing /cvmfs/soft.computecanada.ca/custom/python/wheelhouse/generic/Keras_Preprocessing-1.1.2+computecanada-py3-none-any.whl
Requirement already satisfied: matplotlib in /cvmfs/soft.computecanada.ca/easybuild/software/2017/Core/scipy-stack/2019a/lib/python3.7/site-packages (from -r requirements.txt (line 3)) (3.0.2)
Processing /cvmfs/soft.computecanada.ca/custom/python/wheelhouse/generic/nltk-3.6.5+computecanada-py3-none-any.whl
Processing /cvmfs/soft.computecanada.ca/custom/python/wheelhouse/generic/scikit_learn-0.22.1+computecanada-cp37-cp37m-linux_x86_64.whl
Processing /cvmfs/soft.computecanada.ca/custom/python/wheelhouse/generic/tensorboard-2.3.0+computecanada-py3-none-any.whl
Processing /cvmfs/soft.computecanada.ca/custom/python/wheelhouse/generic/tensorboard_plugin_wit-1.7.0+computecanada-py3-none-any.whl
Processing /cvmfs/soft.computecanada.ca/custom/python/wheelhouse/generic/tensorflow_gpu-2.3.0+computecanada-cp37-cp37m-linux_x86_64.whl
Processing /cvmfs/soft.computecanada.ca/custom/python/wheelhouse/generic/tensorflow_estimator-2.3.0+computecanada-py2.py3-none-any.whl
Processing /cvmfs/soft.computecanada.ca/custom/python/wheelhouse/generic/tokenizers-0.5.2+computecanada-cp37-cp37m-linux_x86_64.whl
Processing /cvmfs/soft.computecanada.ca/custom/python/wheelhouse/nix/avx2/torch-1.4.0+computecanada-cp37-cp37m-linux_x86_64.whl
Processing /cvmfs/soft.computecanada.ca/custom/python/wheelhouse/generic/torchtext-0.6.0+computecanada-py3-none-any.whl
Processing /cvmfs/soft.computecanada.ca/custom/python/wheelhouse/generic/torchvision-0.8.2+computecanada-cp37-cp37m-linux_x86_64.whl
Processing /cvmfs/soft.computecanada.ca/custom/python/wheelhouse/generic/transformers-2.5.1+computecanada-py3-none-any.whl
Processing /cvmfs/soft.computecanada.ca/custom/python/wheelhouse/generic/urllib3-1.26.7+computecanada-py2.py3-none-any.whl
ERROR: Could not find a version that satisfies the requirement regex>=2021.8.3 (from nltk) (from versions: 2018.1.10+computecanada, 2019.11.1+computecanada, 2020.11.13+computecanada)
ERROR: No matching distribution found for regex>=2021.8.3
Looking in links: /cvmfs/soft.computecanada.ca/custom/python/wheelhouse/nix/avx2, /cvmfs/soft.computecanada.ca/custom/python/wheelhouse/nix/generic, /cvmfs/soft.computecanada.ca/custom/python/wheelhouse/generic
ERROR: Could not find a version that satisfies the requirement numpy==1.20.0+computacanada (from versions: 1.15.0+computecanada, 1.15.2+computecanada, 1.15.4+computecanada, 1.16.0+computecanada, 1.16.2+computecanada, 1.16.3+computecanada, 1.17.4+computecanada, 1.18.1+computecanada, 1.18.4+computecanada, 1.19.1+computecanada, 1.19.2+computecanada, 1.20.2+computecanada)
ERROR: No matching distribution found for numpy==1.20.0+computacanada
Looking in links: /cvmfs/soft.computecanada.ca/custom/python/wheelhouse/nix/avx2, /cvmfs/soft.computecanada.ca/custom/python/wheelhouse/nix/generic, /cvmfs/soft.computecanada.ca/custom/python/wheelhouse/generic
Processing /cvmfs/soft.computecanada.ca/custom/python/wheelhouse/generic/wandb-0.12.5+computecanada-py2.py3-none-any.whl
Processing /cvmfs/soft.computecanada.ca/custom/python/wheelhouse/generic/psutil-5.7.3+computecanada-cp37-cp37m-linux_x86_64.whl
Processing /cvmfs/soft.computecanada.ca/custom/python/wheelhouse/generic/protobuf-3.19.4+computecanada-py2.py3-none-any.whl
Processing /cvmfs/soft.computecanada.ca/custom/python/wheelhouse/generic/GitPython-3.1.24+computecanada-py3-none-any.whl
Processing /cvmfs/soft.computecanada.ca/custom/python/wheelhouse/generic/sentry_sdk-1.5.0+computecanada-py2.py3-none-any.whl
Processing /cvmfs/soft.computecanada.ca/custom/python/wheelhouse/generic/PyYAML-5.3.1+computecanada-cp37-cp37m-linux_x86_64.whl
Processing /cvmfs/soft.computecanada.ca/custom/python/wheelhouse/generic/yaspin-2.1.0+computecanada-py3-none-any.whl
Processing /cvmfs/soft.computecanada.ca/custom/python/wheelhouse/generic/six-1.16.0+computecanada-py2.py3-none-any.whl
Processing /cvmfs/soft.computecanada.ca/custom/python/wheelhouse/generic/docker_pycreds-0.4.0+computecanada-py2.py3-none-any.whl
Processing /cvmfs/soft.computecanada.ca/custom/python/wheelhouse/generic/configparser-5.0.2+computecanada-py3-none-any.whl
Requirement already satisfied: python-dateutil>=2.6.1 in /cvmfs/soft.computecanada.ca/easybuild/software/2017/Core/scipy-stack/2019a/lib/python3.7/site-packages (from wandb) (2.7.5)
Processing /cvmfs/soft.computecanada.ca/custom/python/wheelhouse/generic/shortuuid-1.0.1+computecanada-py3-none-any.whl
Processing /cvmfs/soft.computecanada.ca/custom/python/wheelhouse/generic/subprocess32-3.5.4+computecanada-py3-none-any.whl
Processing /cvmfs/soft.computecanada.ca/custom/python/wheelhouse/generic/click-8.0.3+computecanada-py3-none-any.whl
Requirement already satisfied: requests<3,>=2.0.0 in /cvmfs/soft.computecanada.ca/easybuild/software/2017/Core/scipy-stack/2019a/lib/python3.7/site-packages (from wandb) (2.21.0)
Processing /cvmfs/soft.computecanada.ca/custom/python/wheelhouse/generic/pathtools-0.1.2+computecanada-py3-none-any.whl
Processing /cvmfs/soft.computecanada.ca/custom/python/wheelhouse/generic/promise-2.3+computecanada-py3-none-any.whl
Requirement already satisfied: importlib-metadata in /cvmfs/soft.computecanada.ca/easybuild/software/2017/Core/scipy-stack/2019a/lib/python3.7/site-packages (from Click!=8.0.0,>=7.0->wandb) (0.8)
Processing /cvmfs/soft.computecanada.ca/custom/python/wheelhouse/generic/gitdb-4.0.9+computecanada-py3-none-any.whl
Processing /cvmfs/soft.computecanada.ca/custom/python/wheelhouse/generic/typing_extensions-4.0.1+computecanada-py3-none-any.whl
Processing /cvmfs/soft.computecanada.ca/custom/python/wheelhouse/generic/smmap-5.0.0+computecanada-py3-none-any.whl
Requirement already satisfied: chardet<3.1.0,>=3.0.2 in /cvmfs/soft.computecanada.ca/easybuild/software/2017/Core/scipy-stack/2019a/lib/python3.7/site-packages (from requests<3,>=2.0.0->wandb) (3.0.4)
Requirement already satisfied: urllib3<1.25,>=1.21.1 in /cvmfs/soft.computecanada.ca/easybuild/software/2017/Core/scipy-stack/2019a/lib/python3.7/site-packages (from requests<3,>=2.0.0->wandb) (1.24.1)
Requirement already satisfied: certifi>=2017.4.17 in /cvmfs/soft.computecanada.ca/easybuild/software/2017/Core/scipy-stack/2019a/lib/python3.7/site-packages (from requests<3,>=2.0.0->wandb) (2018.11.29)
Requirement already satisfied: idna<2.9,>=2.5 in /cvmfs/soft.computecanada.ca/easybuild/software/2017/Core/scipy-stack/2019a/lib/python3.7/site-packages (from requests<3,>=2.0.0->wandb) (2.8)
Processing /cvmfs/soft.computecanada.ca/custom/python/wheelhouse/generic/termcolor-1.1.0+computecanada-py3-none-any.whl
Requirement already satisfied: zipp>=0.3.2 in /cvmfs/soft.computecanada.ca/easybuild/software/2017/Core/scipy-stack/2019a/lib/python3.7/site-packages (from importlib-metadata->Click!=8.0.0,>=7.0->wandb) (0.3.3)
Installing collected packages: smmap, typing-extensions, termcolor, six, gitdb, yaspin, subprocess32, shortuuid, sentry-sdk, PyYAML, psutil, protobuf, promise, pathtools, GitPython, docker-pycreds, configparser, Click, wandb
  Attempting uninstall: six
    Found existing installation: six 1.12.0
    Not uninstalling six at /cvmfs/soft.computecanada.ca/easybuild/software/2017/Core/scipy-stack/2019a/lib/python3.7/site-packages, outside environment /localscratch/yinan.28736311.0/env
    Can't uninstall 'six'. No files were found to uninstall.
Successfully installed Click-8.0.3+computecanada GitPython-3.1.24+computecanada PyYAML-5.3.1+computecanada configparser-5.0.2+computecanada docker-pycreds-0.4.0+computecanada gitdb-4.0.9+computecanada pathtools-0.1.2+computecanada promise-2.3+computecanada protobuf-3.19.4+computecanada psutil-5.7.3+computecanada sentry-sdk-1.5.0+computecanada shortuuid-1.0.1+computecanada six-1.16.0+computecanada smmap-5.0.0+computecanada subprocess32-3.5.4+computecanada termcolor-1.1.0+computecanada typing-extensions-4.0.1+computecanada wandb-0.12.5+computecanada yaspin-2.1.0+computecanada
Looking in links: /cvmfs/soft.computecanada.ca/custom/python/wheelhouse/nix/avx2, /cvmfs/soft.computecanada.ca/custom/python/wheelhouse/nix/generic, /cvmfs/soft.computecanada.ca/custom/python/wheelhouse/generic
ERROR: Could not find a version that satisfies the requirement sagemaker (from versions: none)
ERROR: No matching distribution found for sagemaker
Looking in links: /cvmfs/soft.computecanada.ca/custom/python/wheelhouse/nix/avx2, /cvmfs/soft.computecanada.ca/custom/python/wheelhouse/nix/generic, /cvmfs/soft.computecanada.ca/custom/python/wheelhouse/generic
Processing /cvmfs/soft.computecanada.ca/custom/python/wheelhouse/generic/torch-1.9.1+computecanada-cp37-cp37m-linux_x86_64.whl
Requirement already satisfied: typing-extensions in /localscratch/yinan.28736311.0/env/lib/python3.7/site-packages (from torch) (4.0.1+computecanada)
Installing collected packages: torch
Successfully installed torch-1.9.1+computecanada
Looking in links: /cvmfs/soft.computecanada.ca/custom/python/wheelhouse/nix/avx2, /cvmfs/soft.computecanada.ca/custom/python/wheelhouse/nix/generic, /cvmfs/soft.computecanada.ca/custom/python/wheelhouse/generic
Processing /cvmfs/soft.computecanada.ca/custom/python/wheelhouse/generic/transformers-2.5.1+computecanada-py3-none-any.whl
Requirement already satisfied: requests in /cvmfs/soft.computecanada.ca/easybuild/software/2017/Core/scipy-stack/2019a/lib/python3.7/site-packages (from transformers==2.5.1+computecanada) (2.21.0)
Processing /cvmfs/soft.computecanada.ca/custom/python/wheelhouse/generic/sacremoses-0.0.46+computecanada-py3-none-any.whl
Processing /cvmfs/soft.computecanada.ca/custom/python/wheelhouse/generic/tqdm-4.63.0+computecanada-py2.py3-none-any.whl
Processing /cvmfs/soft.computecanada.ca/custom/python/wheelhouse/generic/tokenizers-0.5.2+computecanada-cp37-cp37m-linux_x86_64.whl
Requirement already satisfied: numpy in /cvmfs/soft.computecanada.ca/easybuild/software/2017/Core/scipy-stack/2019a/lib/python3.7/site-packages (from transformers==2.5.1+computecanada) (1.16.0)
Processing /cvmfs/soft.computecanada.ca/custom/python/wheelhouse/generic/boto3-1.20.52+computecanada-py3-none-any.whl
Processing /cvmfs/soft.computecanada.ca/custom/python/wheelhouse/generic/sentencepiece-0.1.91+computecanada-cp37-cp37m-linux_x86_64.whl
Processing /cvmfs/soft.computecanada.ca/custom/python/wheelhouse/generic/regex-2020.11.13+computecanada-cp37-cp37m-linux_x86_64.whl
Processing /cvmfs/soft.computecanada.ca/custom/python/wheelhouse/generic/filelock-3.4.2+computecanada-py3-none-any.whl
Processing /cvmfs/soft.computecanada.ca/custom/python/wheelhouse/generic/botocore-1.23.52+computecanada-py3-none-any.whl
Processing /cvmfs/soft.computecanada.ca/custom/python/wheelhouse/generic/jmespath-0.10.0+computecanada-py2.py3-none-any.whl
Processing /cvmfs/soft.computecanada.ca/custom/python/wheelhouse/generic/s3transfer-0.5.1+computecanada-py3-none-any.whl
Processing /cvmfs/soft.computecanada.ca/custom/python/wheelhouse/generic/urllib3-1.26.8+computecanada-py2.py3-none-any.whl
Requirement already satisfied: python-dateutil<3.0.0,>=2.1 in /cvmfs/soft.computecanada.ca/easybuild/software/2017/Core/scipy-stack/2019a/lib/python3.7/site-packages (from botocore<1.24.0,>=1.23.52->boto3->transformers==2.5.1+computecanada) (2.7.5)
Requirement already satisfied: six>=1.5 in /localscratch/yinan.28736311.0/env/lib/python3.7/site-packages (from python-dateutil<3.0.0,>=2.1->botocore<1.24.0,>=1.23.52->boto3->transformers==2.5.1+computecanada) (1.16.0+computecanada)
Requirement already satisfied: idna<2.9,>=2.5 in /cvmfs/soft.computecanada.ca/easybuild/software/2017/Core/scipy-stack/2019a/lib/python3.7/site-packages (from requests->transformers==2.5.1+computecanada) (2.8)
Requirement already satisfied: chardet<3.1.0,>=3.0.2 in /cvmfs/soft.computecanada.ca/easybuild/software/2017/Core/scipy-stack/2019a/lib/python3.7/site-packages (from requests->transformers==2.5.1+computecanada) (3.0.4)
Processing /cvmfs/soft.computecanada.ca/custom/python/wheelhouse/generic/requests-2.27.1+computecanada-py2.py3-none-any.whl
Processing /cvmfs/soft.computecanada.ca/custom/python/wheelhouse/generic/charset_normalizer-2.0.11+computecanada-py3-none-any.whl
Requirement already satisfied: certifi>=2017.4.17 in /cvmfs/soft.computecanada.ca/easybuild/software/2017/Core/scipy-stack/2019a/lib/python3.7/site-packages (from requests->transformers==2.5.1+computecanada) (2018.11.29)
Processing /cvmfs/soft.computecanada.ca/custom/python/wheelhouse/generic/joblib-1.1.0+computecanada-py2.py3-none-any.whl
Requirement already satisfied: click in /localscratch/yinan.28736311.0/env/lib/python3.7/site-packages (from sacremoses->transformers==2.5.1+computecanada) (8.0.3+computecanada)
Requirement already satisfied: importlib-metadata in /cvmfs/soft.computecanada.ca/easybuild/software/2017/Core/scipy-stack/2019a/lib/python3.7/site-packages (from click->sacremoses->transformers==2.5.1+computecanada) (0.8)
Requirement already satisfied: zipp>=0.3.2 in /cvmfs/soft.computecanada.ca/easybuild/software/2017/Core/scipy-stack/2019a/lib/python3.7/site-packages (from importlib-metadata->click->sacremoses->transformers==2.5.1+computecanada) (0.3.3)
Installing collected packages: urllib3, jmespath, botocore, tqdm, s3transfer, regex, joblib, charset-normalizer, tokenizers, sentencepiece, sacremoses, requests, filelock, boto3, transformers
  Attempting uninstall: urllib3
    Found existing installation: urllib3 1.24.1
    Not uninstalling urllib3 at /cvmfs/soft.computecanada.ca/easybuild/software/2017/Core/scipy-stack/2019a/lib/python3.7/site-packages, outside environment /localscratch/yinan.28736311.0/env
    Can't uninstall 'urllib3'. No files were found to uninstall.
  Attempting uninstall: requests
    Found existing installation: requests 2.21.0
    Not uninstalling requests at /cvmfs/soft.computecanada.ca/easybuild/software/2017/Core/scipy-stack/2019a/lib/python3.7/site-packages, outside environment /localscratch/yinan.28736311.0/env
    Can't uninstall 'requests'. No files were found to uninstall.
Successfully installed boto3-1.20.52+computecanada botocore-1.23.52+computecanada charset-normalizer-2.0.11+computecanada filelock-3.4.2+computecanada jmespath-0.10.0+computecanada joblib-1.1.0+computecanada regex-2020.11.13+computecanada requests-2.27.1+computecanada s3transfer-0.5.1+computecanada sacremoses-0.0.46+computecanada sentencepiece-0.1.91+computecanada tokenizers-0.5.2+computecanada tqdm-4.63.0+computecanada transformers-2.5.1+computecanada urllib3-1.26.8+computecanada
Looking in links: /cvmfs/soft.computecanada.ca/custom/python/wheelhouse/nix/avx2, /cvmfs/soft.computecanada.ca/custom/python/wheelhouse/nix/generic, /cvmfs/soft.computecanada.ca/custom/python/wheelhouse/generic
Processing /cvmfs/soft.computecanada.ca/custom/python/wheelhouse/generic/tensorflow_gpu-2.3.0+computecanada-cp37-cp37m-linux_x86_64.whl
Processing /cvmfs/soft.computecanada.ca/custom/python/wheelhouse/generic/wrapt-1.11.2+computecanada-cp37-cp37m-linux_x86_64.whl
Processing /cvmfs/soft.computecanada.ca/custom/python/wheelhouse/nix/avx2/h5py-2.10.0+computecanada-cp37-cp37m-linux_x86_64.whl
Requirement already satisfied: termcolor>=1.1.0 in /localscratch/yinan.28736311.0/env/lib/python3.7/site-packages (from tensorflow_gpu==2.3.0+computecanada) (1.1.0+computecanada)
Processing /cvmfs/soft.computecanada.ca/custom/python/wheelhouse/generic/tensorboard-2.8.0+computecanada-py3-none-any.whl
Processing /cvmfs/soft.computecanada.ca/custom/python/wheelhouse/nix/generic/scipy-1.4.1+computecanada-cp37-cp37m-linux_x86_64.whl
Requirement already satisfied: six>=1.12.0 in /localscratch/yinan.28736311.0/env/lib/python3.7/site-packages (from tensorflow_gpu==2.3.0+computecanada) (1.16.0+computecanada)
Processing /cvmfs/soft.computecanada.ca/custom/python/wheelhouse/generic/gast-0.3.3+computecanada-py3-none-any.whl
Processing /cvmfs/soft.computecanada.ca/custom/python/wheelhouse/generic/Keras_Preprocessing-1.1.2+computecanada-py3-none-any.whl
Processing /cvmfs/soft.computecanada.ca/custom/python/wheelhouse/generic/tensorflow_estimator-2.3.0+computecanada-py2.py3-none-any.whl
Requirement already satisfied: wheel>=0.26 in /localscratch/yinan.28736311.0/env/lib/python3.7/site-packages (from tensorflow_gpu==2.3.0+computecanada) (0.33.4)
Requirement already satisfied: protobuf>=3.9.2 in /localscratch/yinan.28736311.0/env/lib/python3.7/site-packages (from tensorflow_gpu==2.3.0+computecanada) (3.19.4+computecanada)
Processing /cvmfs/soft.computecanada.ca/custom/python/wheelhouse/generic/google_pasta-0.2.0+computecanada-py3-none-any.whl
Requirement already satisfied: numpy<1.19.0,>=1.16.0 in /cvmfs/soft.computecanada.ca/easybuild/software/2017/Core/scipy-stack/2019a/lib/python3.7/site-packages (from tensorflow_gpu==2.3.0+computecanada) (1.16.0)
Processing /cvmfs/soft.computecanada.ca/custom/python/wheelhouse/generic/opt_einsum-3.3.0+computecanada-py3-none-any.whl
Processing /cvmfs/soft.computecanada.ca/custom/python/wheelhouse/generic/grpcio-1.38.0+computecanada-cp37-cp37m-linux_x86_64.whl
Processing /cvmfs/soft.computecanada.ca/custom/python/wheelhouse/generic/absl_py-1.0.0+computecanada-py3-none-any.whl
Processing /cvmfs/soft.computecanada.ca/custom/python/wheelhouse/generic/astunparse-1.6.3+computecanada-py2.py3-none-any.whl
Processing /cvmfs/soft.computecanada.ca/custom/python/wheelhouse/generic/tensorboard_data_server-0.6.1+computecanada-py3-none-linux_x86_64.whl
Processing /cvmfs/soft.computecanada.ca/custom/python/wheelhouse/generic/tensorboard_plugin_wit-1.8.0+computecanada-py3-none-any.whl
Requirement already satisfied: requests<3,>=2.21.0 in /localscratch/yinan.28736311.0/env/lib/python3.7/site-packages (from tensorboard<3,>=2.3.0->tensorflow_gpu==2.3.0+computecanada) (2.27.1+computecanada)
Processing /cvmfs/soft.computecanada.ca/custom/python/wheelhouse/generic/Markdown-3.3.6+computecanada-py3-none-any.whl
Processing /cvmfs/soft.computecanada.ca/custom/python/wheelhouse/generic/Werkzeug-2.0.3+computecanada-py3-none-any.whl
Processing /cvmfs/soft.computecanada.ca/custom/python/wheelhouse/generic/google_auth-2.3.3+computecanada-py2.py3-none-any.whl
Requirement already satisfied: setuptools>=41.0.0 in /localscratch/yinan.28736311.0/env/lib/python3.7/site-packages (from tensorboard<3,>=2.3.0->tensorflow_gpu==2.3.0+computecanada) (41.0.1)
Processing /cvmfs/soft.computecanada.ca/custom/python/wheelhouse/generic/google_auth_oauthlib-0.4.6+computecanada-py2.py3-none-any.whl
Processing /cvmfs/soft.computecanada.ca/custom/python/wheelhouse/generic/rsa-4.8+computecanada-py3-none-any.whl
Processing /cvmfs/soft.computecanada.ca/custom/python/wheelhouse/generic/pyasn1_modules-0.2.8+computecanada-py2.py3-none-any.whl
Processing /cvmfs/soft.computecanada.ca/custom/python/wheelhouse/generic/cachetools-4.2.4+computecanada-py3-none-any.whl
Processing /cvmfs/soft.computecanada.ca/custom/python/wheelhouse/generic/requests_oauthlib-1.3.0+computecanada-py2.py3-none-any.whl
Processing /cvmfs/soft.computecanada.ca/custom/python/wheelhouse/generic/importlib_metadata-4.10.1+computecanada-py3-none-any.whl
Requirement already satisfied: typing-extensions>=3.6.4 in /localscratch/yinan.28736311.0/env/lib/python3.7/site-packages (from importlib-metadata>=4.4->markdown>=2.6.8->tensorboard<3,>=2.3.0->tensorflow_gpu==2.3.0+computecanada) (4.0.1+computecanada)
Processing /cvmfs/soft.computecanada.ca/custom/python/wheelhouse/generic/zipp-3.7.0+computecanada-py3-none-any.whl
Processing /cvmfs/soft.computecanada.ca/custom/python/wheelhouse/generic/pyasn1-0.4.8+computecanada-py2.py3-none-any.whl
Requirement already satisfied: certifi>=2017.4.17 in /cvmfs/soft.computecanada.ca/easybuild/software/2017/Core/scipy-stack/2019a/lib/python3.7/site-packages (from requests<3,>=2.21.0->tensorboard<3,>=2.3.0->tensorflow_gpu==2.3.0+computecanada) (2018.11.29)
Requirement already satisfied: urllib3<1.27,>=1.21.1 in /localscratch/yinan.28736311.0/env/lib/python3.7/site-packages (from requests<3,>=2.21.0->tensorboard<3,>=2.3.0->tensorflow_gpu==2.3.0+computecanada) (1.26.8+computecanada)
Requirement already satisfied: charset-normalizer~=2.0.0 in /localscratch/yinan.28736311.0/env/lib/python3.7/site-packages (from requests<3,>=2.21.0->tensorboard<3,>=2.3.0->tensorflow_gpu==2.3.0+computecanada) (2.0.11+computecanada)
Requirement already satisfied: idna<4,>=2.5 in /cvmfs/soft.computecanada.ca/easybuild/software/2017/Core/scipy-stack/2019a/lib/python3.7/site-packages (from requests<3,>=2.21.0->tensorboard<3,>=2.3.0->tensorflow_gpu==2.3.0+computecanada) (2.8)
Processing /cvmfs/soft.computecanada.ca/custom/python/wheelhouse/generic/oauthlib-3.1.1+computecanada-py2.py3-none-any.whl
Installing collected packages: pyasn1, zipp, rsa, pyasn1-modules, oauthlib, cachetools, requests-oauthlib, importlib-metadata, google-auth, werkzeug, tensorboard-plugin-wit, tensorboard-data-server, markdown, grpcio, google-auth-oauthlib, absl-py, wrapt, tensorflow-estimator, tensorboard, scipy, opt-einsum, keras-preprocessing, h5py, google-pasta, gast, astunparse, tensorflow-gpu
  Attempting uninstall: pyasn1
    Found existing installation: pyasn1 0.4.3
    Not uninstalling pyasn1 at /cvmfs/soft.computecanada.ca/easybuild/software/2017/Core/scipy-stack/2019a/lib/python3.7/site-packages, outside environment /localscratch/yinan.28736311.0/env
    Can't uninstall 'pyasn1'. No files were found to uninstall.
  Attempting uninstall: zipp
    Found existing installation: zipp 0.3.3
    Not uninstalling zipp at /cvmfs/soft.computecanada.ca/easybuild/software/2017/Core/scipy-stack/2019a/lib/python3.7/site-packages, outside environment /localscratch/yinan.28736311.0/env
    Can't uninstall 'zipp'. No files were found to uninstall.
  Attempting uninstall: importlib-metadata
    Found existing installation: importlib-metadata 0.8
    Not uninstalling importlib-metadata at /cvmfs/soft.computecanada.ca/easybuild/software/2017/Core/scipy-stack/2019a/lib/python3.7/site-packages, outside environment /localscratch/yinan.28736311.0/env
    Can't uninstall 'importlib-metadata'. No files were found to uninstall.
  Attempting uninstall: scipy
    Found existing installation: scipy 1.2.0
    Not uninstalling scipy at /cvmfs/soft.computecanada.ca/easybuild/software/2017/Core/scipy-stack/2019a/lib/python3.7/site-packages, outside environment /localscratch/yinan.28736311.0/env
    Can't uninstall 'scipy'. No files were found to uninstall.
Successfully installed absl-py-1.0.0+computecanada astunparse-1.6.3+computecanada cachetools-4.2.4+computecanada gast-0.3.3+computecanada google-auth-2.3.3+computecanada google-auth-oauthlib-0.4.6+computecanada google-pasta-0.2.0+computecanada grpcio-1.38.0+computecanada h5py-2.10.0+computecanada importlib-metadata-4.10.1+computecanada keras-preprocessing-1.1.2+computecanada markdown-3.3.6+computecanada oauthlib-3.1.1+computecanada opt-einsum-3.3.0+computecanada pyasn1-0.4.8+computecanada pyasn1-modules-0.2.8+computecanada requests-oauthlib-1.3.0+computecanada rsa-4.8+computecanada scipy-1.4.1+computecanada tensorboard-2.8.0+computecanada tensorboard-data-server-0.6.1+computecanada tensorboard-plugin-wit-1.8.0+computecanada tensorflow-estimator-2.3.0+computecanada tensorflow-gpu-2.3.0+computecanada werkzeug-2.0.3+computecanada wrapt-1.11.2+computecanada zipp-3.7.0+computecanada
Looking in links: /cvmfs/soft.computecanada.ca/custom/python/wheelhouse/nix/avx2, /cvmfs/soft.computecanada.ca/custom/python/wheelhouse/nix/generic, /cvmfs/soft.computecanada.ca/custom/python/wheelhouse/generic
Processing /cvmfs/soft.computecanada.ca/custom/python/wheelhouse/generic/keras-2.8.0+computecanada-py2.py3-none-any.whl
Installing collected packages: Keras
Successfully installed Keras-2.8.0+computecanada
Looking in links: /cvmfs/soft.computecanada.ca/custom/python/wheelhouse/nix/avx2, /cvmfs/soft.computecanada.ca/custom/python/wheelhouse/nix/generic, /cvmfs/soft.computecanada.ca/custom/python/wheelhouse/generic
Processing /cvmfs/soft.computecanada.ca/custom/python/wheelhouse/generic/urllib3-1.26.7+computecanada-py2.py3-none-any.whl
Installing collected packages: urllib3
  Attempting uninstall: urllib3
    Found existing installation: urllib3 1.26.8+computecanada
    Uninstalling urllib3-1.26.8+computecanada:
      Successfully uninstalled urllib3-1.26.8+computecanada
Successfully installed urllib3-1.26.7+computecanada
Looking in links: /cvmfs/soft.computecanada.ca/custom/python/wheelhouse/nix/avx2, /cvmfs/soft.computecanada.ca/custom/python/wheelhouse/nix/generic, /cvmfs/soft.computecanada.ca/custom/python/wheelhouse/generic
Processing /cvmfs/soft.computecanada.ca/custom/python/wheelhouse/generic/nltk-3.7+computecanada-py3-none-any.whl
Requirement already satisfied: tqdm in /localscratch/yinan.28736311.0/env/lib/python3.7/site-packages (from nltk) (4.63.0+computecanada)
Processing /cvmfs/soft.computecanada.ca/custom/python/wheelhouse/generic/nltk-3.6.5+computecanada-py3-none-any.whl
Processing /cvmfs/soft.computecanada.ca/custom/python/wheelhouse/generic/nltk-3.6.3+computecanada-py3-none-any.whl
Requirement already satisfied: regex in /localscratch/yinan.28736311.0/env/lib/python3.7/site-packages (from nltk) (2020.11.13+computecanada)
Requirement already satisfied: joblib in /localscratch/yinan.28736311.0/env/lib/python3.7/site-packages (from nltk) (1.1.0+computecanada)
Requirement already satisfied: click in /localscratch/yinan.28736311.0/env/lib/python3.7/site-packages (from nltk) (8.0.3+computecanada)
Requirement already satisfied: importlib-metadata in /localscratch/yinan.28736311.0/env/lib/python3.7/site-packages (from click->nltk) (4.10.1+computecanada)
Requirement already satisfied: typing-extensions>=3.6.4 in /localscratch/yinan.28736311.0/env/lib/python3.7/site-packages (from importlib-metadata->click->nltk) (4.0.1+computecanada)
Requirement already satisfied: zipp>=0.5 in /localscratch/yinan.28736311.0/env/lib/python3.7/site-packages (from importlib-metadata->click->nltk) (3.7.0+computecanada)
Installing collected packages: nltk
Successfully installed nltk-3.6.3+computecanada
Looking in links: /cvmfs/soft.computecanada.ca/custom/python/wheelhouse/nix/avx2, /cvmfs/soft.computecanada.ca/custom/python/wheelhouse/nix/generic, /cvmfs/soft.computecanada.ca/custom/python/wheelhouse/generic
Processing /cvmfs/soft.computecanada.ca/custom/python/wheelhouse/generic/scikit_learn-0.22.1+computecanada-cp37-cp37m-linux_x86_64.whl
Requirement already satisfied: numpy>=1.11.0 in /cvmfs/soft.computecanada.ca/easybuild/software/2017/Core/scipy-stack/2019a/lib/python3.7/site-packages (from scikit-learn==0.22.1) (1.16.0)
Requirement already satisfied: scipy>=0.17.0 in /localscratch/yinan.28736311.0/env/lib/python3.7/site-packages (from scikit-learn==0.22.1) (1.4.1+computecanada)
Requirement already satisfied: joblib>=0.11 in /localscratch/yinan.28736311.0/env/lib/python3.7/site-packages (from scikit-learn==0.22.1) (1.1.0+computecanada)
Installing collected packages: scikit-learn
Successfully installed scikit-learn-0.22.1+computecanada
Looking in links: /cvmfs/soft.computecanada.ca/custom/python/wheelhouse/nix/avx2, /cvmfs/soft.computecanada.ca/custom/python/wheelhouse/nix/generic, /cvmfs/soft.computecanada.ca/custom/python/wheelhouse/generic
Requirement already satisfied: tokenizers==0.5.2 in /localscratch/yinan.28736311.0/env/lib/python3.7/site-packages (0.5.2+computecanada)
wandb: Appending key for api.wandb.ai to your netrc file: /home/yinan/.netrc
Starting Task
2022-03-11 09:41:28.154316: I tensorflow/stream_executor/platform/default/dso_loader.cc:48] Successfully opened dynamic library libcudart.so.10.1
[nltk_data] Downloading package stopwords to /home/yinan/nltk_data...
[nltk_data]   Package stopwords is already up-to-date!
[nltk_data] Downloading package wordnet to /home/yinan/nltk_data...
[nltk_data]   Package wordnet is already up-to-date!
wandb: Currently logged in as: yinanazhou (use `wandb login --relogin` to force relogin)
wandb: wandb version 0.12.11 is available!  To upgrade, please run:
wandb:  $ pip install wandb --upgrade
2022-03-11 09:41:38.646183: I tensorflow/stream_executor/platform/default/dso_loader.cc:48] Successfully opened dynamic library libcudart.so.10.1
wandb: Tracking run with wandb version 0.12.5
wandb: Syncing run azure-aardvark-1
wandb: ⭐️ View project at https://wandb.ai/yinanazhou/xl_512_bs_8_lr_1e07_es_5_lc_False_nr_False_sr_True_stem_False_lemma_False_repeat_1_fold_1
wandb: 🚀 View run at https://wandb.ai/yinanazhou/xl_512_bs_8_lr_1e07_es_5_lc_False_nr_False_sr_True_stem_False_lemma_False_repeat_1_fold_1/runs/2ppmw0u8
wandb: Run data is saved locally in /project/6002780/yinan/Thesis_MER_Lyrics/lyric-emotion/wandb/run-20220311_094136-2ppmw0u8
wandb: Run `wandb offline` to turn off syncing.

Validation loss decreased (inf --> 1.450129).  Saving model ...
Validation loss decreased (1.450129 --> 1.447385).  Saving model ...
Validation loss decreased (1.447385 --> 1.444542).  Saving model ...
Validation loss decreased (1.444542 --> 1.441833).  Saving model ...
Validation loss decreased (1.441833 --> 1.439253).  Saving model ...
Validation loss decreased (1.439253 --> 1.436603).  Saving model ...
Validation loss decreased (1.436603 --> 1.434118).  Saving model ...
Validation loss decreased (1.434118 --> 1.431794).  Saving model ...
Validation loss decreased (1.431794 --> 1.429651).  Saving model ...
Validation loss decreased (1.429651 --> 1.427355).  Saving model ...
Validation loss decreased (1.427355 --> 1.425030).  Saving model ...
Validation loss decreased (1.425030 --> 1.422999).  Saving model ...
Validation loss decreased (1.422999 --> 1.420872).  Saving model ...
Validation loss decreased (1.420872 --> 1.418813).  Saving model ...
Validation loss decreased (1.418813 --> 1.416885).  Saving model ...
Validation loss decreased (1.416885 --> 1.414907).  Saving model ...
Validation loss decreased (1.414907 --> 1.413021).  Saving model ...
Validation loss decreased (1.413021 --> 1.411084).  Saving model ...
Validation loss decreased (1.411084 --> 1.409243).  Saving model ...
Validation loss decreased (1.409243 --> 1.407477).  Saving model ...
Validation loss decreased (1.407477 --> 1.405598).  Saving model ...
Validation loss decreased (1.405598 --> 1.403890).  Saving model ...
Validation loss decreased (1.403890 --> 1.402297).  Saving model ...
Validation loss decreased (1.402297 --> 1.400789).  Saving model ...
Validation loss decreased (1.400789 --> 1.399225).  Saving model ...
Validation loss decreased (1.399225 --> 1.397650).  Saving model ...
Validation loss decreased (1.397650 --> 1.396191).  Saving model ...
Validation loss decreased (1.396191 --> 1.394712).  Saving model ...
Validation loss decreased (1.394712 --> 1.393385).  Saving model ...
Validation loss decreased (1.393385 --> 1.392049).  Saving model ...
Validation loss decreased (1.392049 --> 1.390718).  Saving model ...
Validation loss decreased (1.390718 --> 1.389357).  Saving model ...
Validation loss decreased (1.389357 --> 1.388116).  Saving model ...
Validation loss decreased (1.388116 --> 1.386844).  Saving model ...
Validation loss decreased (1.386844 --> 1.385643).  Saving model ...
Validation loss decreased (1.385643 --> 1.384427).  Saving model ...
Validation loss decreased (1.384427 --> 1.383183).  Saving model ...
Validation loss decreased (1.383183 --> 1.382088).  Saving model ...
Validation loss decreased (1.382088 --> 1.380933).  Saving model ...
Validation loss decreased (1.380933 --> 1.379765).  Saving model ...
Validation loss decreased (1.379765 --> 1.378689).  Saving model ...
Validation loss decreased (1.378689 --> 1.377625).  Saving model ...
Validation loss decreased (1.377625 --> 1.376591).  Saving model ...
Validation loss decreased (1.376591 --> 1.375585).  Saving model ...
Validation loss decreased (1.375585 --> 1.374411).  Saving model ...
Validation loss decreased (1.374411 --> 1.373484).  Saving model ...
Validation loss decreased (1.373484 --> 1.372507).  Saving model ...
Validation loss decreased (1.372507 --> 1.371518).  Saving model ...
Validation loss decreased (1.371518 --> 1.370557).  Saving model ...
Validation loss decreased (1.370557 --> 1.369607).  Saving model ...
Validation loss decreased (1.369607 --> 1.368785).  Saving model ...
Validation loss decreased (1.368785 --> 1.367930).  Saving model ...
Validation loss decreased (1.367930 --> 1.366980).  Saving model ...
Validation loss decreased (1.366980 --> 1.366002).  Saving model ...
Validation loss decreased (1.366002 --> 1.365164).  Saving model ...
Validation loss decreased (1.365164 --> 1.364334).  Saving model ...
Validation loss decreased (1.364334 --> 1.363438).  Saving model ...
Validation loss decreased (1.363438 --> 1.362566).  Saving model ...
Validation loss decreased (1.362566 --> 1.361680).  Saving model ...
Validation loss decreased (1.361680 --> 1.360955).  Saving model ...
Validation loss decreased (1.360955 --> 1.360141).  Saving model ...
Validation loss decreased (1.360141 --> 1.359374).  Saving model ...
Validation loss decreased (1.359374 --> 1.358577).  Saving model ...
Validation loss decreased (1.358577 --> 1.357828).  Saving model ...
Validation loss decreased (1.357828 --> 1.357072).  Saving model ...
Validation loss decreased (1.357072 --> 1.356282).  Saving model ...
Validation loss decreased (1.356282 --> 1.355604).  Saving model ...
Validation loss decreased (1.355604 --> 1.354890).  Saving model ...
Validation loss decreased (1.354890 --> 1.354212).  Saving model ...
Validation loss decreased (1.354212 --> 1.353558).  Saving model ...
Validation loss decreased (1.353558 --> 1.352931).  Saving model ...
Validation loss decreased (1.352931 --> 1.352200).  Saving model ...
Validation loss decreased (1.352200 --> 1.351438).  Saving model ...
Validation loss decreased (1.351438 --> 1.350753).  Saving model ...
Validation loss decreased (1.350753 --> 1.350099).  Saving model ...
Validation loss decreased (1.350099 --> 1.349451).  Saving model ...
Validation loss decreased (1.349451 --> 1.348795).  Saving model ...
Validation loss decreased (1.348795 --> 1.348179).  Saving model ...
Validation loss decreased (1.348179 --> 1.347543).  Saving model ...
Validation loss decreased (1.347543 --> 1.346882).  Saving model ...
Validation loss decreased (1.346882 --> 1.346298).  Saving model ...
Validation loss decreased (1.346298 --> 1.345620).  Saving model ...
Validation loss decreased (1.345620 --> 1.344941).  Saving model ...
Validation loss decreased (1.344941 --> 1.344407).  Saving model ...
Validation loss decreased (1.344407 --> 1.343836).  Saving model ...
Validation loss decreased (1.343836 --> 1.343132).  Saving model ...
Validation loss decreased (1.343132 --> 1.342461).  Saving model ...
Validation loss decreased (1.342461 --> 1.341796).  Saving model ...
Validation loss decreased (1.341796 --> 1.341160).  Saving model ...
Validation loss decreased (1.341160 --> 1.340603).  Saving model ...
Validation loss decreased (1.340603 --> 1.340007).  Saving model ...
Validation loss decreased (1.340007 --> 1.339408).  Saving model ...
Validation loss decreased (1.339408 --> 1.338755).  Saving model ...
Validation loss decreased (1.338755 --> 1.338150).  Saving model ...
Validation loss decreased (1.338150 --> 1.337497).  Saving model ...
Validation loss decreased (1.337497 --> 1.336950).  Saving model ...
Validation loss decreased (1.336950 --> 1.336334).  Saving model ...
Validation loss decreased (1.336334 --> 1.335760).  Saving model ...
Validation loss decreased (1.335760 --> 1.335169).  Saving model ...
Validation loss decreased (1.335169 --> 1.334626).  Saving model ...
Validation loss decreased (1.334626 --> 1.334055).  Saving model ...
Validation loss decreased (1.334055 --> 1.333456).  Saving model ...
Validation loss decreased (1.333456 --> 1.332851).  Saving model ...
Validation loss decreased (1.332851 --> 1.332314).  Saving model ...
Validation loss decreased (1.332314 --> 1.331714).  Saving model ...
Validation loss decreased (1.331714 --> 1.331133).  Saving model ...
Validation loss decreased (1.331133 --> 1.330585).  Saving model ...
Validation loss decreased (1.330585 --> 1.330030).  Saving model ...
Validation loss decreased (1.330030 --> 1.329431).  Saving model ...
Validation loss decreased (1.329431 --> 1.328805).  Saving model ...
Validation loss decreased (1.328805 --> 1.328223).  Saving model ...
Validation loss decreased (1.328223 --> 1.327725).  Saving model ...
Validation loss decreased (1.327725 --> 1.327174).  Saving model ...
Validation loss decreased (1.327174 --> 1.326614).  Saving model ...
Validation loss decreased (1.326614 --> 1.326073).  Saving model ...
Validation loss decreased (1.326073 --> 1.325489).  Saving model ...
Validation loss decreased (1.325489 --> 1.324924).  Saving model ...
Validation loss decreased (1.324924 --> 1.324385).  Saving model ...
Validation loss decreased (1.324385 --> 1.323745).  Saving model ...
Validation loss decreased (1.323745 --> 1.323148).  Saving model ...
Validation loss decreased (1.323148 --> 1.322651).  Saving model ...
Validation loss decreased (1.322651 --> 1.322070).  Saving model ...
Validation loss decreased (1.322070 --> 1.321503).  Saving model ...
Validation loss decreased (1.321503 --> 1.320815).  Saving model ...
Validation loss decreased (1.320815 --> 1.320276).  Saving model ...
Validation loss decreased (1.320276 --> 1.319663).  Saving model ...
Validation loss decreased (1.319663 --> 1.319132).  Saving model ...
Validation loss decreased (1.319132 --> 1.318447).  Saving model ...
Validation loss decreased (1.318447 --> 1.317820).  Saving model ...
Validation loss decreased (1.317820 --> 1.317196).  Saving model ...
Validation loss decreased (1.317196 --> 1.316594).  Saving model ...
Validation loss decreased (1.316594 --> 1.315996).  Saving model ...
Validation loss decreased (1.315996 --> 1.315388).  Saving model ...
Validation loss decreased (1.315388 --> 1.314834).  Saving model ...
Validation loss decreased (1.314834 --> 1.314174).  Saving model ...
Validation loss decreased (1.314174 --> 1.313555).  Saving model ...
Validation loss decreased (1.313555 --> 1.313000).  Saving model ...
Validation loss decreased (1.313000 --> 1.312402).  Saving model ...
Validation loss decreased (1.312402 --> 1.311841).  Saving model ...
Validation loss decreased (1.311841 --> 1.311196).  Saving model ...
Validation loss decreased (1.311196 --> 1.310588).  Saving model ...
Validation loss decreased (1.310588 --> 1.310002).  Saving model ...
Validation loss decreased (1.310002 --> 1.309409).  Saving model ...
Validation loss decreased (1.309409 --> 1.308823).  Saving model ...
Validation loss decreased (1.308823 --> 1.308207).  Saving model ...
Validation loss decreased (1.308207 --> 1.307677).  Saving model ...
Validation loss decreased (1.307677 --> 1.307032).  Saving model ...
Validation loss decreased (1.307032 --> 1.306359).  Saving model ...
Validation loss decreased (1.306359 --> 1.305740).  Saving model ...
Validation loss decreased (1.305740 --> 1.305046).  Saving model ...
Validation loss decreased (1.305046 --> 1.304472).  Saving model ...
Validation loss decreased (1.304472 --> 1.303867).  Saving model ...
Validation loss decreased (1.303867 --> 1.303287).  Saving model ...
Validation loss decreased (1.303287 --> 1.302624).  Saving model ...
Validation loss decreased (1.302624 --> 1.302007).  Saving model ...
Validation loss decreased (1.302007 --> 1.301310).  Saving model ...
Validation loss decreased (1.301310 --> 1.300677).  Saving model ...
Validation loss decreased (1.300677 --> 1.300055).  Saving model ...
Validation loss decreased (1.300055 --> 1.299429).  Saving model ...
Validation loss decreased (1.299429 --> 1.298815).  Saving model ...
Validation loss decreased (1.298815 --> 1.298210).  Saving model ...
Validation loss decreased (1.298210 --> 1.297618).  Saving model ...
Validation loss decreased (1.297618 --> 1.297013).  Saving model ...
Validation loss decreased (1.297013 --> 1.296311).  Saving model ...
Validation loss decreased (1.296311 --> 1.295681).  Saving model ...
Validation loss decreased (1.295681 --> 1.295002).  Saving model ...
Validation loss decreased (1.295002 --> 1.294374).  Saving model ...
Validation loss decreased (1.294374 --> 1.293657).  Saving model ...
Validation loss decreased (1.293657 --> 1.293038).  Saving model ...
Validation loss decreased (1.293038 --> 1.292356).  Saving model ...
Validation loss decreased (1.292356 --> 1.291586).  Saving model ...
Validation loss decreased (1.291586 --> 1.290954).  Saving model ...
Validation loss decreased (1.290954 --> 1.290295).  Saving model ...
Validation loss decreased (1.290295 --> 1.289594).  Saving model ...
Validation loss decreased (1.289594 --> 1.288938).  Saving model ...
Validation loss decreased (1.288938 --> 1.288312).  Saving model ...
Validation loss decreased (1.288312 --> 1.287606).  Saving model ...
Validation loss decreased (1.287606 --> 1.286861).  Saving model ...
Validation loss decreased (1.286861 --> 1.286179).  Saving model ...
Validation loss decreased (1.286179 --> 1.285459).  Saving model ...
Validation loss decreased (1.285459 --> 1.284677).  Saving model ...
Validation loss decreased (1.284677 --> 1.283898).  Saving model ...
Validation loss decreased (1.283898 --> 1.283076).  Saving model ...
Validation loss decreased (1.283076 --> 1.282353).  Saving model ...
Validation loss decreased (1.282353 --> 1.281643).  Saving model ...
Validation loss decreased (1.281643 --> 1.280947).  Saving model ...
Validation loss decreased (1.280947 --> 1.280343).  Saving model ...
Validation loss decreased (1.280343 --> 1.279718).  Saving model ...
Validation loss decreased (1.279718 --> 1.279114).  Saving model ...
Validation loss decreased (1.279114 --> 1.278381).  Saving model ...
Validation loss decreased (1.278381 --> 1.277715).  Saving model ...
Validation loss decreased (1.277715 --> 1.277020).  Saving model ...
Validation loss decreased (1.277020 --> 1.276386).  Saving model ...
Validation loss decreased (1.276386 --> 1.275624).  Saving model ...
Validation loss decreased (1.275624 --> 1.274904).  Saving model ...
Validation loss decreased (1.274904 --> 1.274296).  Saving model ...
Validation loss decreased (1.274296 --> 1.273682).  Saving model ...
Validation loss decreased (1.273682 --> 1.272963).  Saving model ...
Validation loss decreased (1.272963 --> 1.272007).  Saving model ...
Validation loss decreased (1.272007 --> 1.271172).  Saving model ...
Validation loss decreased (1.271172 --> 1.270569).  Saving model ...
Validation loss decreased (1.270569 --> 1.270096).  Saving model ...
Validation loss decreased (1.270096 --> 1.269380).  Saving model ...
Validation loss decreased (1.269380 --> 1.268706).  Saving model ...
Validation loss decreased (1.268706 --> 1.268144).  Saving model ...
Validation loss decreased (1.268144 --> 1.267519).  Saving model ...
Validation loss decreased (1.267519 --> 1.266926).  Saving model ...
Validation loss decreased (1.266926 --> 1.266379).  Saving model ...
Validation loss decreased (1.266379 --> 1.265823).  Saving model ...
Validation loss decreased (1.265823 --> 1.265035).  Saving model ...
Validation loss decreased (1.265035 --> 1.264327).  Saving model ...
Validation loss decreased (1.264327 --> 1.263418).  Saving model ...
Validation loss decreased (1.263418 --> 1.262863).  Saving model ...
Validation loss decreased (1.262863 --> 1.262397).  Saving model ...
Validation loss decreased (1.262397 --> 1.261706).  Saving model ...
Validation loss decreased (1.261706 --> 1.261054).  Saving model ...
Validation loss decreased (1.261054 --> 1.260362).  Saving model ...
Validation loss decreased (1.260362 --> 1.259525).  Saving model ...
Validation loss decreased (1.259525 --> 1.258870).  Saving model ...
Validation loss decreased (1.258870 --> 1.258107).  Saving model ...
Validation loss decreased (1.258107 --> 1.257317).  Saving model ...
Validation loss decreased (1.257317 --> 1.256530).  Saving model ...
Validation loss decreased (1.256530 --> 1.255838).  Saving model ...
Validation loss decreased (1.255838 --> 1.255165).  Saving model ...
Validation loss decreased (1.255165 --> 1.254320).  Saving model ...
Validation loss decreased (1.254320 --> 1.253696).  Saving model ...
Validation loss decreased (1.253696 --> 1.252946).  Saving model ...
Validation loss decreased (1.252946 --> 1.252288).  Saving model ...
Validation loss decreased (1.252288 --> 1.251701).  Saving model ...
Validation loss decreased (1.251701 --> 1.250851).  Saving model ...
Validation loss decreased (1.250851 --> 1.249938).  Saving model ...
Validation loss decreased (1.249938 --> 1.249288).  Saving model ...
Validation loss decreased (1.249288 --> 1.248615).  Saving model ...
Validation loss decreased (1.248615 --> 1.247898).  Saving model ...
Validation loss decreased (1.247898 --> 1.247277).  Saving model ...
Validation loss decreased (1.247277 --> 1.246617).  Saving model ...
Validation loss decreased (1.246617 --> 1.245926).  Saving model ...
Validation loss decreased (1.245926 --> 1.245234).  Saving model ...
Validation loss decreased (1.245234 --> 1.244455).  Saving model ...
Validation loss decreased (1.244455 --> 1.243773).  Saving model ...
Validation loss decreased (1.243773 --> 1.243229).  Saving model ...
Validation loss decreased (1.243229 --> 1.242552).  Saving model ...
Validation loss decreased (1.242552 --> 1.242049).  Saving model ...
Validation loss decreased (1.242049 --> 1.241173).  Saving model ...
Validation loss decreased (1.241173 --> 1.240531).  Saving model ...
Validation loss decreased (1.240531 --> 1.239665).  Saving model ...
Validation loss decreased (1.239665 --> 1.239165).  Saving model ...
Validation loss decreased (1.239165 --> 1.238554).  Saving model ...
Validation loss decreased (1.238554 --> 1.238018).  Saving model ...
Validation loss decreased (1.238018 --> 1.237447).  Saving model ...
Validation loss decreased (1.237447 --> 1.236829).  Saving model ...
Validation loss decreased (1.236829 --> 1.236246).  Saving model ...
Validation loss decreased (1.236246 --> 1.235426).  Saving model ...
Validation loss decreased (1.235426 --> 1.234735).  Saving model ...
Validation loss decreased (1.234735 --> 1.234115).  Saving model ...
Validation loss decreased (1.234115 --> 1.233448).  Saving model ...
Validation loss decreased (1.233448 --> 1.233122).  Saving model ...
Validation loss decreased (1.233122 --> 1.232622).  Saving model ...
Validation loss decreased (1.232622 --> 1.231769).  Saving model ...
Validation loss decreased (1.231769 --> 1.231319).  Saving model ...
Validation loss decreased (1.231319 --> 1.230640).  Saving model ...
Validation loss decreased (1.230640 --> 1.230030).  Saving model ...
Validation loss decreased (1.230030 --> 1.229391).  Saving model ...
Validation loss decreased (1.229391 --> 1.228626).  Saving model ...
Validation loss decreased (1.228626 --> 1.227849).  Saving model ...
Validation loss decreased (1.227849 --> 1.227306).  Saving model ...
Validation loss decreased (1.227306 --> 1.226745).  Saving model ...
Validation loss decreased (1.226745 --> 1.226197).  Saving model ...
Validation loss decreased (1.226197 --> 1.225581).  Saving model ...
Validation loss decreased (1.225581 --> 1.224785).  Saving model ...
Validation loss decreased (1.224785 --> 1.224235).  Saving model ...
Validation loss decreased (1.224235 --> 1.223344).  Saving model ...
Validation loss decreased (1.223344 --> 1.222836).  Saving model ...
Validation loss decreased (1.222836 --> 1.222001).  Saving model ...
Validation loss decreased (1.222001 --> 1.221399).  Saving model ...
Validation loss decreased (1.221399 --> 1.220782).  Saving model ...
Validation loss decreased (1.220782 --> 1.220406).  Saving model ...
Validation loss decreased (1.220406 --> 1.219692).  Saving model ...
Validation loss decreased (1.219692 --> 1.218877).  Saving model ...
Validation loss decreased (1.218877 --> 1.218247).  Saving model ...
Validation loss decreased (1.218247 --> 1.217508).  Saving model ...
Validation loss decreased (1.217508 --> 1.216983).  Saving model ...
Validation loss decreased (1.216983 --> 1.216577).  Saving model ...
Validation loss decreased (1.216577 --> 1.216085).  Saving model ...
Validation loss decreased (1.216085 --> 1.215636).  Saving model ...
Validation loss decreased (1.215636 --> 1.215168).  Saving model ...
Validation loss decreased (1.215168 --> 1.214614).  Saving model ...
Validation loss decreased (1.214614 --> 1.214148).  Saving model ...
Validation loss decreased (1.214148 --> 1.213735).  Saving model ...
Validation loss decreased (1.213735 --> 1.213121).  Saving model ...
Validation loss decreased (1.213121 --> 1.212357).  Saving model ...
Validation loss decreased (1.212357 --> 1.211611).  Saving model ...
Validation loss decreased (1.211611 --> 1.211262).  Saving model ...
Validation loss decreased (1.211262 --> 1.210821).  Saving model ...
Validation loss decreased (1.210821 --> 1.210213).  Saving model ...
Validation loss decreased (1.210213 --> 1.209761).  Saving model ...
Validation loss decreased (1.209761 --> 1.209385).  Saving model ...
Validation loss decreased (1.209385 --> 1.208745).  Saving model ...
Validation loss decreased (1.208745 --> 1.208265).  Saving model ...
Validation loss decreased (1.208265 --> 1.207650).  Saving model ...
Validation loss decreased (1.207650 --> 1.207192).  Saving model ...
Validation loss decreased (1.207192 --> 1.206439).  Saving model ...
Validation loss decreased (1.206439 --> 1.206037).  Saving model ...
Validation loss decreased (1.206037 --> 1.205435).  Saving model ...
Validation loss decreased (1.205435 --> 1.204909).  Saving model ...
Validation loss decreased (1.204909 --> 1.204410).  Saving model ...
Validation loss decreased (1.204410 --> 1.203935).  Saving model ...
Validation loss decreased (1.203935 --> 1.203440).  Saving model ...
Validation loss decreased (1.203440 --> 1.203068).  Saving model ...
Validation loss decreased (1.203068 --> 1.202396).  Saving model ...
Validation loss decreased (1.202396 --> 1.201972).  Saving model ...
Validation loss decreased (1.201972 --> 1.201380).  Saving model ...
Validation loss decreased (1.201380 --> 1.200971).  Saving model ...
Validation loss decreased (1.200971 --> 1.200545).  Saving model ...
Validation loss decreased (1.200545 --> 1.200016).  Saving model ...
Validation loss decreased (1.200016 --> 1.199423).  Saving model ...
Validation loss decreased (1.199423 --> 1.198980).  Saving model ...
Validation loss decreased (1.198980 --> 1.198699).  Saving model ...
Validation loss decreased (1.198699 --> 1.198097).  Saving model ...
Validation loss decreased (1.198097 --> 1.197610).  Saving model ...
Validation loss decreased (1.197610 --> 1.197420).  Saving model ...
Validation loss decreased (1.197420 --> 1.196634).  Saving model ...
Validation loss decreased (1.196634 --> 1.196091).  Saving model ...
Validation loss decreased (1.196091 --> 1.195644).  Saving model ...
Validation loss decreased (1.195644 --> 1.195012).  Saving model ...
Validation loss decreased (1.195012 --> 1.194489).  Saving model ...
Validation loss decreased (1.194489 --> 1.194073).  Saving model ...
Validation loss decreased (1.194073 --> 1.193758).  Saving model ...
Validation loss decreased (1.193758 --> 1.193117).  Saving model ...
Validation loss decreased (1.193117 --> 1.192822).  Saving model ...
Validation loss decreased (1.192822 --> 1.192448).  Saving model ...
Validation loss decreased (1.192448 --> 1.192061).  Saving model ...
Validation loss decreased (1.192061 --> 1.191625).  Saving model ...
Validation loss decreased (1.191625 --> 1.191250).  Saving model ...
Validation loss decreased (1.191250 --> 1.190775).  Saving model ...
Validation loss decreased (1.190775 --> 1.190225).  Saving model ...
Validation loss decreased (1.190225 --> 1.189777).  Saving model ...
Validation loss decreased (1.189777 --> 1.189399).  Saving model ...
Validation loss decreased (1.189399 --> 1.188825).  Saving model ...
Validation loss decreased (1.188825 --> 1.188173).  Saving model ...
Validation loss decreased (1.188173 --> 1.187749).  Saving model ...
Validation loss decreased (1.187749 --> 1.187222).  Saving model ...
Validation loss decreased (1.187222 --> 1.186751).  Saving model ...
Validation loss decreased (1.186751 --> 1.186350).  Saving model ...
Validation loss decreased (1.186350 --> 1.186047).  Saving model ...
Validation loss decreased (1.186047 --> 1.185806).  Saving model ...
Validation loss decreased (1.185806 --> 1.185148).  Saving model ...
Validation loss decreased (1.185148 --> 1.184676).  Saving model ...
Validation loss decreased (1.184676 --> 1.184333).  Saving model ...
Validation loss decreased (1.184333 --> 1.183846).  Saving model ...
Validation loss decreased (1.183846 --> 1.183360).  Saving model ...
Validation loss decreased (1.183360 --> 1.182574).  Saving model ...
Validation loss decreased (1.182574 --> 1.182187).  Saving model ...
Validation loss decreased (1.182187 --> 1.181832).  Saving model ...
Validation loss decreased (1.181832 --> 1.181285).  Saving model ...
Validation loss decreased (1.181285 --> 1.180773).  Saving model ...
Validation loss decreased (1.180773 --> 1.180114).  Saving model ...
Validation loss decreased (1.180114 --> 1.179628).  Saving model ...
Validation loss decreased (1.179628 --> 1.179092).  Saving model ...
Validation loss decreased (1.179092 --> 1.178551).  Saving model ...
Validation loss decreased (1.178551 --> 1.178119).  Saving model ...
Validation loss decreased (1.178119 --> 1.177843).  Saving model ...
Validation loss decreased (1.177843 --> 1.177340).  Saving model ...
Validation loss decreased (1.177340 --> 1.176859).  Saving model ...
Validation loss decreased (1.176859 --> 1.176510).  Saving model ...
Validation loss decreased (1.176510 --> 1.175955).  Saving model ...
Validation loss decreased (1.175955 --> 1.175316).  Saving model ...
Validation loss decreased (1.175316 --> 1.174772).  Saving model ...
Validation loss decreased (1.174772 --> 1.174291).  Saving model ...
Validation loss decreased (1.174291 --> 1.173732).  Saving model ...
Validation loss decreased (1.173732 --> 1.173337).  Saving model ...
Validation loss decreased (1.173337 --> 1.173029).  Saving model ...
Validation loss decreased (1.173029 --> 1.172761).  Saving model ...
Validation loss decreased (1.172761 --> 1.172272).  Saving model ...
Validation loss decreased (1.172272 --> 1.172045).  Saving model ...
Validation loss decreased (1.172045 --> 1.171687).  Saving model ...
Validation loss decreased (1.171687 --> 1.171350).  Saving model ...
Validation loss decreased (1.171350 --> 1.170694).  Saving model ...
Validation loss decreased (1.170694 --> 1.170217).  Saving model ...
Validation loss decreased (1.170217 --> 1.169818).  Saving model ...
Validation loss decreased (1.169818 --> 1.169420).  Saving model ...
Validation loss decreased (1.169420 --> 1.169017).  Saving model ...
Validation loss decreased (1.169017 --> 1.168781).  Saving model ...
Validation loss decreased (1.168781 --> 1.168378).  Saving model ...
Validation loss decreased (1.168378 --> 1.167951).  Saving model ...
Validation loss decreased (1.167951 --> 1.167689).  Saving model ...
Validation loss decreased (1.167689 --> 1.167277).  Saving model ...
Validation loss decreased (1.167277 --> 1.166693).  Saving model ...
Validation loss decreased (1.166693 --> 1.166160).  Saving model ...
Validation loss decreased (1.166160 --> 1.165616).  Saving model ...
Validation loss decreased (1.165616 --> 1.165278).  Saving model ...
Validation loss decreased (1.165278 --> 1.164934).  Saving model ...
Validation loss decreased (1.164934 --> 1.164451).  Saving model ...
Validation loss decreased (1.164451 --> 1.164178).  Saving model ...
Validation loss decreased (1.164178 --> 1.163971).  Saving model ...
Validation loss decreased (1.163971 --> 1.163595).  Saving model ...
Validation loss decreased (1.163595 --> 1.163279).  Saving model ...
Validation loss decreased (1.163279 --> 1.162884).  Saving model ...
Validation loss decreased (1.162884 --> 1.162495).  Saving model ...
Validation loss decreased (1.162495 --> 1.161788).  Saving model ...
Validation loss decreased (1.161788 --> 1.161270).  Saving model ...
Validation loss decreased (1.161270 --> 1.161046).  Saving model ...
Validation loss decreased (1.161046 --> 1.160756).  Saving model ...
Validation loss decreased (1.160756 --> 1.160244).  Saving model ...
Validation loss decreased (1.160244 --> 1.159863).  Saving model ...
Validation loss decreased (1.159863 --> 1.159372).  Saving model ...
Validation loss decreased (1.159372 --> 1.158882).  Saving model ...
Validation loss decreased (1.158882 --> 1.158374).  Saving model ...
Validation loss decreased (1.158374 --> 1.157949).  Saving model ...
Validation loss decreased (1.157949 --> 1.157075).  Saving model ...
Validation loss decreased (1.157075 --> 1.156737).  Saving model ...
Validation loss decreased (1.156737 --> 1.156141).  Saving model ...
Validation loss decreased (1.156141 --> 1.155869).  Saving model ...
Validation loss decreased (1.155869 --> 1.155723).  Saving model ...
Validation loss decreased (1.155723 --> 1.155431).  Saving model ...
Validation loss decreased (1.155431 --> 1.154976).  Saving model ...
Validation loss decreased (1.154976 --> 1.154679).  Saving model ...
Validation loss decreased (1.154679 --> 1.154287).  Saving model ...
Validation loss decreased (1.154287 --> 1.153776).  Saving model ...
Validation loss decreased (1.153776 --> 1.153363).  Saving model ...
Validation loss decreased (1.153363 --> 1.153148).  Saving model ...
Validation loss decreased (1.153148 --> 1.152922).  Saving model ...
Validation loss decreased (1.152922 --> 1.152567).  Saving model ...
Validation loss decreased (1.152567 --> 1.152242).  Saving model ...
Validation loss decreased (1.152242 --> 1.151663).  Saving model ...
Validation loss decreased (1.151663 --> 1.151527).  Saving model ...
Validation loss decreased (1.151527 --> 1.151366).  Saving model ...
Validation loss decreased (1.151366 --> 1.151076).  Saving model ...
Validation loss decreased (1.151076 --> 1.150525).  Saving model ...
Validation loss decreased (1.150525 --> 1.150274).  Saving model ...
Validation loss decreased (1.150274 --> 1.149765).  Saving model ...
Validation loss decreased (1.149765 --> 1.149392).  Saving model ...
Validation loss decreased (1.149392 --> 1.148922).  Saving model ...
Validation loss decreased (1.148922 --> 1.148562).  Saving model ...
Validation loss decreased (1.148562 --> 1.148292).  Saving model ...
Validation loss decreased (1.148292 --> 1.147685).  Saving model ...
Validation loss decreased (1.147685 --> 1.147332).  Saving model ...
Validation loss decreased (1.147332 --> 1.146980).  Saving model ...
Validation loss decreased (1.146980 --> 1.146812).  Saving model ...
Validation loss decreased (1.146812 --> 1.146172).  Saving model ...
Validation loss decreased (1.146172 --> 1.145454).  Saving model ...
Validation loss decreased (1.145454 --> 1.145129).  Saving model ...
Validation loss decreased (1.145129 --> 1.144784).  Saving model ...
Validation loss decreased (1.144784 --> 1.144260).  Saving model ...
Validation loss decreased (1.144260 --> 1.143872).  Saving model ...
Validation loss decreased (1.143872 --> 1.143213).  Saving model ...
Validation loss decreased (1.143213 --> 1.142551).  Saving model ...
Validation loss decreased (1.142551 --> 1.142050).  Saving model ...
Validation loss decreased (1.142050 --> 1.141449).  Saving model ...
Validation loss decreased (1.141449 --> 1.141197).  Saving model ...
Validation loss decreased (1.141197 --> 1.140860).  Saving model ...
Validation loss decreased (1.140860 --> 1.140598).  Saving model ...
Validation loss decreased (1.140598 --> 1.140111).  Saving model ...
Validation loss decreased (1.140111 --> 1.139860).  Saving model ...
Validation loss decreased (1.139860 --> 1.139535).  Saving model ...
Validation loss decreased (1.139535 --> 1.139329).  Saving model ...
Validation loss decreased (1.139329 --> 1.139157).  Saving model ...
Validation loss decreased (1.139157 --> 1.138781).  Saving model ...
Validation loss decreased (1.138781 --> 1.138298).  Saving model ...
Validation loss decreased (1.138298 --> 1.138091).  Saving model ...
Validation loss decreased (1.138091 --> 1.137809).  Saving model ...
Validation loss decreased (1.137809 --> 1.137184).  Saving model ...
Validation loss decreased (1.137184 --> 1.136836).  Saving model ...
Validation loss decreased (1.136836 --> 1.136485).  Saving model ...
Validation loss decreased (1.136485 --> 1.136085).  Saving model ...
Validation loss decreased (1.136085 --> 1.135598).  Saving model ...
Validation loss decreased (1.135598 --> 1.135052).  Saving model ...
Validation loss decreased (1.135052 --> 1.134597).  Saving model ...
Validation loss decreased (1.134597 --> 1.134082).  Saving model ...
Validation loss decreased (1.134082 --> 1.133453).  Saving model ...
Validation loss decreased (1.133453 --> 1.133076).  Saving model ...
Validation loss decreased (1.133076 --> 1.132860).  Saving model ...
Validation loss decreased (1.132860 --> 1.132647).  Saving model ...
Validation loss decreased (1.132647 --> 1.132390).  Saving model ...
Validation loss decreased (1.132390 --> 1.132081).  Saving model ...
Validation loss decreased (1.132081 --> 1.131695).  Saving model ...
Validation loss decreased (1.131695 --> 1.131466).  Saving model ...
Validation loss decreased (1.131466 --> 1.131170).  Saving model ...
Validation loss decreased (1.131170 --> 1.131015).  Saving model ...
Validation loss decreased (1.131015 --> 1.130540).  Saving model ...
Validation loss decreased (1.130540 --> 1.130055).  Saving model ...
Validation loss decreased (1.130055 --> 1.129634).  Saving model ...
Validation loss decreased (1.129634 --> 1.129140).  Saving model ...
Validation loss decreased (1.129140 --> 1.128906).  Saving model ...
Validation loss decreased (1.128906 --> 1.128041).  Saving model ...
Validation loss decreased (1.128041 --> 1.127503).  Saving model ...
Validation loss decreased (1.127503 --> 1.126770).  Saving model ...
Validation loss decreased (1.126770 --> 1.126493).  Saving model ...
Validation loss decreased (1.126493 --> 1.126418).  Saving model ...
Validation loss decreased (1.126418 --> 1.126219).  Saving model ...
Validation loss decreased (1.126219 --> 1.125814).  Saving model ...
Validation loss decreased (1.125814 --> 1.125575).  Saving model ...
Validation loss decreased (1.125575 --> 1.125401).  Saving model ...
Validation loss decreased (1.125401 --> 1.124842).  Saving model ...
Validation loss decreased (1.124842 --> 1.124341).  Saving model ...
EarlyStopping counter: 1 out of 5.0
Validation loss decreased (1.124341 --> 1.123930).  Saving model ...
Validation loss decreased (1.123930 --> 1.123539).  Saving model ...
Validation loss decreased (1.123539 --> 1.123198).  Saving model ...
Validation loss decreased (1.123198 --> 1.122762).  Saving model ...
/localscratch/yinan.28736311.0/env/lib/python3.7/site-packages/torch/nn/functional.py:1794: UserWarning: nn.functional.tanh is deprecated. Use torch.tanh instead.
  warnings.warn("nn.functional.tanh is deprecated. Use torch.tanh instead.")
/localscratch/yinan.28736311.0/env/lib/python3.7/site-packages/transformers/optimization.py:155: UserWarning: This overload of add_ is deprecated:
	add_(Number alpha, Tensor other)
Consider using one of the following signatures instead:
	add_(Tensor other, *, Number alpha) (Triggered internally at  ../torch/csrc/utils/python_arg_parser.cpp:1025.)
  exp_avg.mul_(beta1).add_(1.0 - beta1, grad)
wandb: Waiting for W&B process to finish, PID 186843... (success).
wandb: - 0.00MB of 0.00MB uploaded (0.00MB deduped)wandb: \ 0.00MB of 0.00MB uploaded (0.00MB deduped)wandb: | 0.00MB of 0.00MB uploaded (0.00MB deduped)wandb: / 0.00MB of 0.00MB uploaded (0.00MB deduped)wandb: - 0.00MB of 0.00MB uploaded (0.00MB deduped)wandb: \ 0.00MB of 0.00MB uploaded (0.00MB deduped)wandb: | 0.00MB of 0.00MB uploaded (0.00MB deduped)wandb: / 0.00MB of 0.00MB uploaded (0.00MB deduped)wandb: - 0.00MB of 0.00MB uploaded (0.00MB deduped)wandb: \ 0.00MB of 0.00MB uploaded (0.00MB deduped)wandb: | 0.00MB of 0.00MB uploaded (0.00MB deduped)wandb: / 0.00MB of 0.00MB uploaded (0.00MB deduped)wandb: - 0.00MB of 0.00MB uploaded (0.00MB deduped)wandb:                                                                                
wandb: Run history:
wandb:     e_F1 ▁▁▂▂▃▄▄▅▅▅▅▆▆▆▆▆▆▆▆▆▇▆▆▇▇▇▇▇████████████
wandb:   e_loss █▇▇▇▆▆▆▆▆▅▅▅▅▅▅▄▄▄▄▄▃▃▃▃▃▃▂▂▂▂▂▂▂▂▂▁▁▁▁▁
wandb:     t_F1 ▁▁▂▃▃▃▃▃▃▄▃▅▅▄▅▅▆▆▆▆▆▆▆▆▆▇▇▇▇▇▇▇▇▇▇█▇▇▇█
wandb:   t_loss ███▇▇▇▆▇▆▆▆▅▅▆▅▅▅▄▄▄▄▄▄▄▃▃▃▃▃▃▂▂▂▂▂▂▂▁▁▁
wandb: 
wandb: Run summary:
wandb:     e_F1 52.09035
wandb:   e_loss 1.12276
wandb:     t_F1 53.42602
wandb:   t_loss 1.07575
wandb: 
wandb: Synced 4 W&B file(s), 0 media file(s), 0 artifact file(s) and 0 other file(s)
wandb: Synced azure-aardvark-1: https://wandb.ai/yinanazhou/xl_512_bs_8_lr_1e07_es_5_lc_False_nr_False_sr_True_stem_False_lemma_False_repeat_1_fold_1/runs/2ppmw0u8
wandb: Find logs at: ./wandb/run-20220311_094136-2ppmw0u8/logs/debug.log
wandb: 

wandb: wandb version 0.12.11 is available!  To upgrade, please run:
wandb:  $ pip install wandb --upgrade
2022-03-11 15:03:22.753790: I tensorflow/stream_executor/platform/default/dso_loader.cc:48] Successfully opened dynamic library libcudart.so.10.1
wandb: Tracking run with wandb version 0.12.5
wandb: Syncing run volcanic-tree-1
wandb: ⭐️ View project at https://wandb.ai/yinanazhou/xl_512_bs_8_lr_1e07_es_5_lc_False_nr_False_sr_True_stem_False_lemma_False_repeat_1_fold_2
wandb: 🚀 View run at https://wandb.ai/yinanazhou/xl_512_bs_8_lr_1e07_es_5_lc_False_nr_False_sr_True_stem_False_lemma_False_repeat_1_fold_2/runs/d2mt8h1w
wandb: Run data is saved locally in /project/6002780/yinan/Thesis_MER_Lyrics/lyric-emotion/wandb/run-20220311_150319-d2mt8h1w
wandb: Run `wandb offline` to turn off syncing.
slurmstepd: error: *** JOB 28736311 ON cdr2588 CANCELLED AT 2022-03-11T19:37:57 DUE TO TIME LIMIT ***
