Unloading StdEnv/2020

Due to MODULEPATH changes, the following have been reloaded:
  1) mii/1.1.1


The following have been reloaded with a version change:
  1) python/3.8.2 => python/3.7.4

Using base prefix '/cvmfs/soft.computecanada.ca/easybuild/software/2017/Core/python/3.7.4'
New python executable in /localscratch/yinan.29785241.0/env/bin/python
Installing setuptools, pip, wheel...
done.
Ignoring pip: markers 'python_version < "3"' don't match your environment
Looking in links: /cvmfs/soft.computecanada.ca/custom/python/wheelhouse/nix/avx2, /cvmfs/soft.computecanada.ca/custom/python/wheelhouse/nix/generic, /cvmfs/soft.computecanada.ca/custom/python/wheelhouse/generic
Collecting pip
Installing collected packages: pip
  Found existing installation: pip 19.1.1
    Uninstalling pip-19.1.1:
      Successfully uninstalled pip-19.1.1
Successfully installed pip-21.2.3+computecanada
Looking in links: /cvmfs/soft.computecanada.ca/custom/python/wheelhouse/nix/avx2, /cvmfs/soft.computecanada.ca/custom/python/wheelhouse/nix/generic, /cvmfs/soft.computecanada.ca/custom/python/wheelhouse/generic
Processing /cvmfs/soft.computecanada.ca/custom/python/wheelhouse/generic/keras-2.8.0+computecanada-py2.py3-none-any.whl
Processing /cvmfs/soft.computecanada.ca/custom/python/wheelhouse/generic/Keras_Preprocessing-1.1.2+computecanada-py3-none-any.whl
Requirement already satisfied: matplotlib in /cvmfs/soft.computecanada.ca/easybuild/software/2017/Core/scipy-stack/2019a/lib/python3.7/site-packages (from -r requirements.txt (line 3)) (3.0.2)
Processing /cvmfs/soft.computecanada.ca/custom/python/wheelhouse/generic/nltk-3.6.5+computecanada-py3-none-any.whl
Processing /cvmfs/soft.computecanada.ca/custom/python/wheelhouse/generic/scikit_learn-0.22.1+computecanada-cp37-cp37m-linux_x86_64.whl
Processing /cvmfs/soft.computecanada.ca/custom/python/wheelhouse/generic/tensorboard-2.3.0+computecanada-py3-none-any.whl
Processing /cvmfs/soft.computecanada.ca/custom/python/wheelhouse/generic/tensorboard_plugin_wit-1.7.0+computecanada-py3-none-any.whl
Processing /cvmfs/soft.computecanada.ca/custom/python/wheelhouse/generic/tensorflow_gpu-2.3.0+computecanada-cp37-cp37m-linux_x86_64.whl
Processing /cvmfs/soft.computecanada.ca/custom/python/wheelhouse/generic/tensorflow_estimator-2.3.0+computecanada-py2.py3-none-any.whl
Processing /cvmfs/soft.computecanada.ca/custom/python/wheelhouse/generic/tokenizers-0.5.2+computecanada-cp37-cp37m-linux_x86_64.whl
Processing /cvmfs/soft.computecanada.ca/custom/python/wheelhouse/nix/avx2/torch-1.4.0+computecanada-cp37-cp37m-linux_x86_64.whl
Processing /cvmfs/soft.computecanada.ca/custom/python/wheelhouse/generic/torchtext-0.6.0+computecanada-py3-none-any.whl
Processing /cvmfs/soft.computecanada.ca/custom/python/wheelhouse/generic/torchvision-0.8.2+computecanada-cp37-cp37m-linux_x86_64.whl
Processing /cvmfs/soft.computecanada.ca/custom/python/wheelhouse/generic/transformers-2.5.1+computecanada-py3-none-any.whl
Processing /cvmfs/soft.computecanada.ca/custom/python/wheelhouse/generic/urllib3-1.26.7+computecanada-py2.py3-none-any.whl
Processing /cvmfs/soft.computecanada.ca/custom/python/wheelhouse/generic/tqdm-4.63.1+computecanada-py2.py3-none-any.whl
Processing /cvmfs/soft.computecanada.ca/custom/python/wheelhouse/generic/joblib-1.1.0+computecanada-py2.py3-none-any.whl
Processing /cvmfs/soft.computecanada.ca/custom/python/wheelhouse/generic/click-8.1.0+computecanada-py3-none-any.whl
ERROR: Could not find a version that satisfies the requirement regex>=2021.8.3 (from nltk) (from versions: 2018.1.10+computecanada, 2019.11.1+computecanada, 2020.11.13+computecanada)
ERROR: No matching distribution found for regex>=2021.8.3
Looking in links: /cvmfs/soft.computecanada.ca/custom/python/wheelhouse/nix/avx2, /cvmfs/soft.computecanada.ca/custom/python/wheelhouse/nix/generic, /cvmfs/soft.computecanada.ca/custom/python/wheelhouse/generic
ERROR: Could not find a version that satisfies the requirement numpy==1.20.0+computacanada (from versions: 1.15.0+computecanada, 1.15.2+computecanada, 1.15.4+computecanada, 1.16.0+computecanada, 1.16.2+computecanada, 1.16.3+computecanada, 1.17.4+computecanada, 1.18.1+computecanada, 1.18.4+computecanada, 1.19.1+computecanada, 1.19.2+computecanada, 1.20.2+computecanada)
ERROR: No matching distribution found for numpy==1.20.0+computacanada
Looking in links: /cvmfs/soft.computecanada.ca/custom/python/wheelhouse/nix/avx2, /cvmfs/soft.computecanada.ca/custom/python/wheelhouse/nix/generic, /cvmfs/soft.computecanada.ca/custom/python/wheelhouse/generic
Processing /cvmfs/soft.computecanada.ca/custom/python/wheelhouse/generic/wandb-0.12.5+computecanada-py2.py3-none-any.whl
Processing /cvmfs/soft.computecanada.ca/custom/python/wheelhouse/generic/subprocess32-3.5.4+computecanada-py3-none-any.whl
Processing /cvmfs/soft.computecanada.ca/custom/python/wheelhouse/generic/shortuuid-1.0.1+computecanada-py3-none-any.whl
Processing /cvmfs/soft.computecanada.ca/custom/python/wheelhouse/generic/configparser-5.0.2+computecanada-py3-none-any.whl
Processing /cvmfs/soft.computecanada.ca/custom/python/wheelhouse/generic/click-8.1.0+computecanada-py3-none-any.whl
Processing /cvmfs/soft.computecanada.ca/custom/python/wheelhouse/generic/docker_pycreds-0.4.0+computecanada-py2.py3-none-any.whl
Processing /cvmfs/soft.computecanada.ca/custom/python/wheelhouse/generic/PyYAML-5.3.1+computecanada-cp37-cp37m-linux_x86_64.whl
Processing /cvmfs/soft.computecanada.ca/custom/python/wheelhouse/generic/GitPython-3.1.24+computecanada-py3-none-any.whl
Processing /cvmfs/soft.computecanada.ca/custom/python/wheelhouse/generic/psutil-5.7.3+computecanada-cp37-cp37m-linux_x86_64.whl
Processing /cvmfs/soft.computecanada.ca/custom/python/wheelhouse/generic/sentry_sdk-1.5.0+computecanada-py2.py3-none-any.whl
Requirement already satisfied: python-dateutil>=2.6.1 in /cvmfs/soft.computecanada.ca/easybuild/software/2017/Core/scipy-stack/2019a/lib/python3.7/site-packages (from wandb) (2.7.5)
Processing /cvmfs/soft.computecanada.ca/custom/python/wheelhouse/generic/six-1.16.0+computecanada-py2.py3-none-any.whl
Processing /cvmfs/soft.computecanada.ca/custom/python/wheelhouse/generic/pathtools-0.1.2+computecanada-py3-none-any.whl
Requirement already satisfied: requests<3,>=2.0.0 in /cvmfs/soft.computecanada.ca/easybuild/software/2017/Core/scipy-stack/2019a/lib/python3.7/site-packages (from wandb) (2.21.0)
Processing /cvmfs/soft.computecanada.ca/custom/python/wheelhouse/generic/promise-2.3+computecanada-py3-none-any.whl
Processing /cvmfs/soft.computecanada.ca/custom/python/wheelhouse/generic/protobuf-3.19.4+computecanada-py2.py3-none-any.whl
Processing /cvmfs/soft.computecanada.ca/custom/python/wheelhouse/generic/yaspin-2.1.0+computecanada-py3-none-any.whl
Requirement already satisfied: importlib-metadata in /cvmfs/soft.computecanada.ca/easybuild/software/2017/Core/scipy-stack/2019a/lib/python3.7/site-packages (from Click!=8.0.0,>=7.0->wandb) (0.8)
Processing /cvmfs/soft.computecanada.ca/custom/python/wheelhouse/generic/gitdb-4.0.9+computecanada-py3-none-any.whl
Processing /cvmfs/soft.computecanada.ca/custom/python/wheelhouse/generic/typing_extensions-4.1.1+computecanada-py3-none-any.whl
Processing /cvmfs/soft.computecanada.ca/custom/python/wheelhouse/generic/smmap-5.0.0+computecanada-py3-none-any.whl
Requirement already satisfied: certifi>=2017.4.17 in /cvmfs/soft.computecanada.ca/easybuild/software/2017/Core/scipy-stack/2019a/lib/python3.7/site-packages (from requests<3,>=2.0.0->wandb) (2018.11.29)
Requirement already satisfied: urllib3<1.25,>=1.21.1 in /cvmfs/soft.computecanada.ca/easybuild/software/2017/Core/scipy-stack/2019a/lib/python3.7/site-packages (from requests<3,>=2.0.0->wandb) (1.24.1)
Requirement already satisfied: idna<2.9,>=2.5 in /cvmfs/soft.computecanada.ca/easybuild/software/2017/Core/scipy-stack/2019a/lib/python3.7/site-packages (from requests<3,>=2.0.0->wandb) (2.8)
Requirement already satisfied: chardet<3.1.0,>=3.0.2 in /cvmfs/soft.computecanada.ca/easybuild/software/2017/Core/scipy-stack/2019a/lib/python3.7/site-packages (from requests<3,>=2.0.0->wandb) (3.0.4)
Processing /cvmfs/soft.computecanada.ca/custom/python/wheelhouse/generic/termcolor-1.1.0+computecanada-py3-none-any.whl
Requirement already satisfied: zipp>=0.3.2 in /cvmfs/soft.computecanada.ca/easybuild/software/2017/Core/scipy-stack/2019a/lib/python3.7/site-packages (from importlib-metadata->Click!=8.0.0,>=7.0->wandb) (0.3.3)
Installing collected packages: smmap, typing-extensions, termcolor, six, gitdb, yaspin, subprocess32, shortuuid, sentry-sdk, PyYAML, psutil, protobuf, promise, pathtools, GitPython, docker-pycreds, configparser, Click, wandb
  Attempting uninstall: six
    Found existing installation: six 1.12.0
    Not uninstalling six at /cvmfs/soft.computecanada.ca/easybuild/software/2017/Core/scipy-stack/2019a/lib/python3.7/site-packages, outside environment /localscratch/yinan.29785241.0/env
    Can't uninstall 'six'. No files were found to uninstall.
Successfully installed Click-8.1.0+computecanada GitPython-3.1.24+computecanada PyYAML-5.3.1+computecanada configparser-5.0.2+computecanada docker-pycreds-0.4.0+computecanada gitdb-4.0.9+computecanada pathtools-0.1.2+computecanada promise-2.3+computecanada protobuf-3.19.4+computecanada psutil-5.7.3+computecanada sentry-sdk-1.5.0+computecanada shortuuid-1.0.1+computecanada six-1.16.0+computecanada smmap-5.0.0+computecanada subprocess32-3.5.4+computecanada termcolor-1.1.0+computecanada typing-extensions-4.1.1+computecanada wandb-0.12.5+computecanada yaspin-2.1.0+computecanada
Looking in links: /cvmfs/soft.computecanada.ca/custom/python/wheelhouse/nix/avx2, /cvmfs/soft.computecanada.ca/custom/python/wheelhouse/nix/generic, /cvmfs/soft.computecanada.ca/custom/python/wheelhouse/generic
ERROR: Could not find a version that satisfies the requirement sagemaker (from versions: none)
ERROR: No matching distribution found for sagemaker
Looking in links: /cvmfs/soft.computecanada.ca/custom/python/wheelhouse/nix/avx2, /cvmfs/soft.computecanada.ca/custom/python/wheelhouse/nix/generic, /cvmfs/soft.computecanada.ca/custom/python/wheelhouse/generic
Processing /cvmfs/soft.computecanada.ca/custom/python/wheelhouse/generic/torch-1.9.1+computecanada-cp37-cp37m-linux_x86_64.whl
Requirement already satisfied: typing-extensions in /localscratch/yinan.29785241.0/env/lib/python3.7/site-packages (from torch) (4.1.1+computecanada)
Installing collected packages: torch
Successfully installed torch-1.9.1+computecanada
Looking in links: /cvmfs/soft.computecanada.ca/custom/python/wheelhouse/nix/avx2, /cvmfs/soft.computecanada.ca/custom/python/wheelhouse/nix/generic, /cvmfs/soft.computecanada.ca/custom/python/wheelhouse/generic
Processing /cvmfs/soft.computecanada.ca/custom/python/wheelhouse/generic/transformers-2.5.1+computecanada-py3-none-any.whl
Requirement already satisfied: requests in /cvmfs/soft.computecanada.ca/easybuild/software/2017/Core/scipy-stack/2019a/lib/python3.7/site-packages (from transformers==2.5.1+computecanada) (2.21.0)
Processing /cvmfs/soft.computecanada.ca/custom/python/wheelhouse/generic/tqdm-4.63.1+computecanada-py2.py3-none-any.whl
Processing /cvmfs/soft.computecanada.ca/custom/python/wheelhouse/generic/sentencepiece-0.1.91+computecanada-cp37-cp37m-linux_x86_64.whl
Processing /cvmfs/soft.computecanada.ca/custom/python/wheelhouse/generic/boto3-1.21.14+computecanada-py3-none-any.whl
Processing /cvmfs/soft.computecanada.ca/custom/python/wheelhouse/generic/filelock-3.4.2+computecanada-py3-none-any.whl
Processing /cvmfs/soft.computecanada.ca/custom/python/wheelhouse/generic/tokenizers-0.5.2+computecanada-cp37-cp37m-linux_x86_64.whl
Processing /cvmfs/soft.computecanada.ca/custom/python/wheelhouse/generic/sacremoses-0.0.49+computecanada-py3-none-any.whl
Processing /cvmfs/soft.computecanada.ca/custom/python/wheelhouse/generic/regex-2020.11.13+computecanada-cp37-cp37m-linux_x86_64.whl
Requirement already satisfied: numpy in /cvmfs/soft.computecanada.ca/easybuild/software/2017/Core/scipy-stack/2019a/lib/python3.7/site-packages (from transformers==2.5.1+computecanada) (1.16.0)
Processing /cvmfs/soft.computecanada.ca/custom/python/wheelhouse/generic/botocore-1.24.14+computecanada-py3-none-any.whl
Processing /cvmfs/soft.computecanada.ca/custom/python/wheelhouse/generic/s3transfer-0.5.1+computecanada-py3-none-any.whl
Processing /cvmfs/soft.computecanada.ca/custom/python/wheelhouse/generic/jmespath-0.10.0+computecanada-py2.py3-none-any.whl
Processing /cvmfs/soft.computecanada.ca/custom/python/wheelhouse/generic/urllib3-1.26.9+computecanada-py2.py3-none-any.whl
Requirement already satisfied: python-dateutil<3.0.0,>=2.1 in /cvmfs/soft.computecanada.ca/easybuild/software/2017/Core/scipy-stack/2019a/lib/python3.7/site-packages (from botocore<1.25.0,>=1.24.14->boto3->transformers==2.5.1+computecanada) (2.7.5)
Requirement already satisfied: six>=1.5 in /localscratch/yinan.29785241.0/env/lib/python3.7/site-packages (from python-dateutil<3.0.0,>=2.1->botocore<1.25.0,>=1.24.14->boto3->transformers==2.5.1+computecanada) (1.16.0+computecanada)
Requirement already satisfied: chardet<3.1.0,>=3.0.2 in /cvmfs/soft.computecanada.ca/easybuild/software/2017/Core/scipy-stack/2019a/lib/python3.7/site-packages (from requests->transformers==2.5.1+computecanada) (3.0.4)
Requirement already satisfied: certifi>=2017.4.17 in /cvmfs/soft.computecanada.ca/easybuild/software/2017/Core/scipy-stack/2019a/lib/python3.7/site-packages (from requests->transformers==2.5.1+computecanada) (2018.11.29)
Processing /cvmfs/soft.computecanada.ca/custom/python/wheelhouse/generic/requests-2.27.1+computecanada-py2.py3-none-any.whl
Requirement already satisfied: idna<4,>=2.5 in /cvmfs/soft.computecanada.ca/easybuild/software/2017/Core/scipy-stack/2019a/lib/python3.7/site-packages (from requests->transformers==2.5.1+computecanada) (2.8)
Processing /cvmfs/soft.computecanada.ca/custom/python/wheelhouse/generic/charset_normalizer-2.0.12+computecanada-py3-none-any.whl
Processing /cvmfs/soft.computecanada.ca/custom/python/wheelhouse/generic/joblib-1.1.0+computecanada-py2.py3-none-any.whl
Requirement already satisfied: click in /localscratch/yinan.29785241.0/env/lib/python3.7/site-packages (from sacremoses->transformers==2.5.1+computecanada) (8.1.0+computecanada)
Requirement already satisfied: importlib-metadata in /cvmfs/soft.computecanada.ca/easybuild/software/2017/Core/scipy-stack/2019a/lib/python3.7/site-packages (from click->sacremoses->transformers==2.5.1+computecanada) (0.8)
Requirement already satisfied: zipp>=0.3.2 in /cvmfs/soft.computecanada.ca/easybuild/software/2017/Core/scipy-stack/2019a/lib/python3.7/site-packages (from importlib-metadata->click->sacremoses->transformers==2.5.1+computecanada) (0.3.3)
Installing collected packages: urllib3, jmespath, botocore, tqdm, s3transfer, regex, joblib, charset-normalizer, tokenizers, sentencepiece, sacremoses, requests, filelock, boto3, transformers
  Attempting uninstall: urllib3
    Found existing installation: urllib3 1.24.1
    Not uninstalling urllib3 at /cvmfs/soft.computecanada.ca/easybuild/software/2017/Core/scipy-stack/2019a/lib/python3.7/site-packages, outside environment /localscratch/yinan.29785241.0/env
    Can't uninstall 'urllib3'. No files were found to uninstall.
  Attempting uninstall: requests
    Found existing installation: requests 2.21.0
    Not uninstalling requests at /cvmfs/soft.computecanada.ca/easybuild/software/2017/Core/scipy-stack/2019a/lib/python3.7/site-packages, outside environment /localscratch/yinan.29785241.0/env
    Can't uninstall 'requests'. No files were found to uninstall.
Successfully installed boto3-1.21.14+computecanada botocore-1.24.14+computecanada charset-normalizer-2.0.12+computecanada filelock-3.4.2+computecanada jmespath-0.10.0+computecanada joblib-1.1.0+computecanada regex-2020.11.13+computecanada requests-2.27.1+computecanada s3transfer-0.5.1+computecanada sacremoses-0.0.49+computecanada sentencepiece-0.1.91+computecanada tokenizers-0.5.2+computecanada tqdm-4.63.1+computecanada transformers-2.5.1+computecanada urllib3-1.26.9+computecanada
Looking in links: /cvmfs/soft.computecanada.ca/custom/python/wheelhouse/nix/avx2, /cvmfs/soft.computecanada.ca/custom/python/wheelhouse/nix/generic, /cvmfs/soft.computecanada.ca/custom/python/wheelhouse/generic
Processing /cvmfs/soft.computecanada.ca/custom/python/wheelhouse/generic/tensorflow_gpu-2.3.0+computecanada-cp37-cp37m-linux_x86_64.whl
Processing /cvmfs/soft.computecanada.ca/custom/python/wheelhouse/generic/astunparse-1.6.3+computecanada-py2.py3-none-any.whl
Processing /cvmfs/soft.computecanada.ca/custom/python/wheelhouse/generic/google_pasta-0.2.0+computecanada-py3-none-any.whl
Processing /cvmfs/soft.computecanada.ca/custom/python/wheelhouse/generic/opt_einsum-3.3.0+computecanada-py3-none-any.whl
Processing /cvmfs/soft.computecanada.ca/custom/python/wheelhouse/generic/absl_py-1.0.0+computecanada-py3-none-any.whl
Requirement already satisfied: six>=1.12.0 in /localscratch/yinan.29785241.0/env/lib/python3.7/site-packages (from tensorflow_gpu==2.3.0+computecanada) (1.16.0+computecanada)
Processing /cvmfs/soft.computecanada.ca/custom/python/wheelhouse/generic/wrapt-1.11.2+computecanada-cp37-cp37m-linux_x86_64.whl
Requirement already satisfied: numpy<1.19.0,>=1.16.0 in /cvmfs/soft.computecanada.ca/easybuild/software/2017/Core/scipy-stack/2019a/lib/python3.7/site-packages (from tensorflow_gpu==2.3.0+computecanada) (1.16.0)
Processing /cvmfs/soft.computecanada.ca/custom/python/wheelhouse/generic/grpcio-1.38.0+computecanada-cp37-cp37m-linux_x86_64.whl
Requirement already satisfied: termcolor>=1.1.0 in /localscratch/yinan.29785241.0/env/lib/python3.7/site-packages (from tensorflow_gpu==2.3.0+computecanada) (1.1.0+computecanada)
Processing /cvmfs/soft.computecanada.ca/custom/python/wheelhouse/generic/gast-0.3.3+computecanada-py3-none-any.whl
Processing /cvmfs/soft.computecanada.ca/custom/python/wheelhouse/generic/tensorboard-2.8.0+computecanada-py3-none-any.whl
Requirement already satisfied: protobuf>=3.9.2 in /localscratch/yinan.29785241.0/env/lib/python3.7/site-packages (from tensorflow_gpu==2.3.0+computecanada) (3.19.4+computecanada)
Processing /cvmfs/soft.computecanada.ca/custom/python/wheelhouse/generic/tensorflow_estimator-2.3.0+computecanada-py2.py3-none-any.whl
Requirement already satisfied: wheel>=0.26 in /localscratch/yinan.29785241.0/env/lib/python3.7/site-packages (from tensorflow_gpu==2.3.0+computecanada) (0.33.4)
Processing /cvmfs/soft.computecanada.ca/custom/python/wheelhouse/nix/generic/scipy-1.4.1+computecanada-cp37-cp37m-linux_x86_64.whl
Processing /cvmfs/soft.computecanada.ca/custom/python/wheelhouse/nix/avx2/h5py-2.10.0+computecanada-cp37-cp37m-linux_x86_64.whl
Processing /cvmfs/soft.computecanada.ca/custom/python/wheelhouse/generic/Keras_Preprocessing-1.1.2+computecanada-py3-none-any.whl
Processing /cvmfs/soft.computecanada.ca/custom/python/wheelhouse/generic/Werkzeug-2.0.3+computecanada-py3-none-any.whl
Processing /cvmfs/soft.computecanada.ca/custom/python/wheelhouse/generic/google_auth-2.3.3+computecanada-py2.py3-none-any.whl
Requirement already satisfied: requests<3,>=2.21.0 in /localscratch/yinan.29785241.0/env/lib/python3.7/site-packages (from tensorboard<3,>=2.3.0->tensorflow_gpu==2.3.0+computecanada) (2.27.1+computecanada)
Requirement already satisfied: setuptools>=41.0.0 in /localscratch/yinan.29785241.0/env/lib/python3.7/site-packages (from tensorboard<3,>=2.3.0->tensorflow_gpu==2.3.0+computecanada) (41.0.1)
Processing /cvmfs/soft.computecanada.ca/custom/python/wheelhouse/generic/tensorboard_data_server-0.6.1+computecanada-py3-none-linux_x86_64.whl
Processing /cvmfs/soft.computecanada.ca/custom/python/wheelhouse/generic/Markdown-3.3.6+computecanada-py3-none-any.whl
Processing /cvmfs/soft.computecanada.ca/custom/python/wheelhouse/generic/tensorboard_plugin_wit-1.8.0+computecanada-py3-none-any.whl
Processing /cvmfs/soft.computecanada.ca/custom/python/wheelhouse/generic/google_auth_oauthlib-0.4.6+computecanada-py2.py3-none-any.whl
Processing /cvmfs/soft.computecanada.ca/custom/python/wheelhouse/generic/rsa-4.8+computecanada-py3-none-any.whl
Processing /cvmfs/soft.computecanada.ca/custom/python/wheelhouse/generic/pyasn1_modules-0.2.8+computecanada-py2.py3-none-any.whl
Processing /cvmfs/soft.computecanada.ca/custom/python/wheelhouse/generic/cachetools-4.2.4+computecanada-py3-none-any.whl
Processing /cvmfs/soft.computecanada.ca/custom/python/wheelhouse/generic/requests_oauthlib-1.3.0+computecanada-py2.py3-none-any.whl
Processing /cvmfs/soft.computecanada.ca/custom/python/wheelhouse/generic/importlib_metadata-4.10.1+computecanada-py3-none-any.whl
Processing /cvmfs/soft.computecanada.ca/custom/python/wheelhouse/generic/zipp-3.7.0+computecanada-py3-none-any.whl
Requirement already satisfied: typing-extensions>=3.6.4 in /localscratch/yinan.29785241.0/env/lib/python3.7/site-packages (from importlib-metadata>=4.4->markdown>=2.6.8->tensorboard<3,>=2.3.0->tensorflow_gpu==2.3.0+computecanada) (4.1.1+computecanada)
Processing /cvmfs/soft.computecanada.ca/custom/python/wheelhouse/generic/pyasn1-0.4.8+computecanada-py2.py3-none-any.whl
Requirement already satisfied: idna<4,>=2.5 in /cvmfs/soft.computecanada.ca/easybuild/software/2017/Core/scipy-stack/2019a/lib/python3.7/site-packages (from requests<3,>=2.21.0->tensorboard<3,>=2.3.0->tensorflow_gpu==2.3.0+computecanada) (2.8)
Requirement already satisfied: certifi>=2017.4.17 in /cvmfs/soft.computecanada.ca/easybuild/software/2017/Core/scipy-stack/2019a/lib/python3.7/site-packages (from requests<3,>=2.21.0->tensorboard<3,>=2.3.0->tensorflow_gpu==2.3.0+computecanada) (2018.11.29)
Requirement already satisfied: urllib3<1.27,>=1.21.1 in /localscratch/yinan.29785241.0/env/lib/python3.7/site-packages (from requests<3,>=2.21.0->tensorboard<3,>=2.3.0->tensorflow_gpu==2.3.0+computecanada) (1.26.9+computecanada)
Requirement already satisfied: charset-normalizer~=2.0.0 in /localscratch/yinan.29785241.0/env/lib/python3.7/site-packages (from requests<3,>=2.21.0->tensorboard<3,>=2.3.0->tensorflow_gpu==2.3.0+computecanada) (2.0.12+computecanada)
Processing /cvmfs/soft.computecanada.ca/custom/python/wheelhouse/generic/oauthlib-3.1.1+computecanada-py2.py3-none-any.whl
Installing collected packages: pyasn1, zipp, rsa, pyasn1-modules, oauthlib, cachetools, requests-oauthlib, importlib-metadata, google-auth, werkzeug, tensorboard-plugin-wit, tensorboard-data-server, markdown, grpcio, google-auth-oauthlib, absl-py, wrapt, tensorflow-estimator, tensorboard, scipy, opt-einsum, keras-preprocessing, h5py, google-pasta, gast, astunparse, tensorflow-gpu
  Attempting uninstall: pyasn1
    Found existing installation: pyasn1 0.4.3
    Not uninstalling pyasn1 at /cvmfs/soft.computecanada.ca/easybuild/software/2017/Core/scipy-stack/2019a/lib/python3.7/site-packages, outside environment /localscratch/yinan.29785241.0/env
    Can't uninstall 'pyasn1'. No files were found to uninstall.
  Attempting uninstall: zipp
    Found existing installation: zipp 0.3.3
    Not uninstalling zipp at /cvmfs/soft.computecanada.ca/easybuild/software/2017/Core/scipy-stack/2019a/lib/python3.7/site-packages, outside environment /localscratch/yinan.29785241.0/env
    Can't uninstall 'zipp'. No files were found to uninstall.
  Attempting uninstall: importlib-metadata
    Found existing installation: importlib-metadata 0.8
    Not uninstalling importlib-metadata at /cvmfs/soft.computecanada.ca/easybuild/software/2017/Core/scipy-stack/2019a/lib/python3.7/site-packages, outside environment /localscratch/yinan.29785241.0/env
    Can't uninstall 'importlib-metadata'. No files were found to uninstall.
  Attempting uninstall: scipy
    Found existing installation: scipy 1.2.0
    Not uninstalling scipy at /cvmfs/soft.computecanada.ca/easybuild/software/2017/Core/scipy-stack/2019a/lib/python3.7/site-packages, outside environment /localscratch/yinan.29785241.0/env
    Can't uninstall 'scipy'. No files were found to uninstall.
Successfully installed absl-py-1.0.0+computecanada astunparse-1.6.3+computecanada cachetools-4.2.4+computecanada gast-0.3.3+computecanada google-auth-2.3.3+computecanada google-auth-oauthlib-0.4.6+computecanada google-pasta-0.2.0+computecanada grpcio-1.38.0+computecanada h5py-2.10.0+computecanada importlib-metadata-4.10.1+computecanada keras-preprocessing-1.1.2+computecanada markdown-3.3.6+computecanada oauthlib-3.1.1+computecanada opt-einsum-3.3.0+computecanada pyasn1-0.4.8+computecanada pyasn1-modules-0.2.8+computecanada requests-oauthlib-1.3.0+computecanada rsa-4.8+computecanada scipy-1.4.1+computecanada tensorboard-2.8.0+computecanada tensorboard-data-server-0.6.1+computecanada tensorboard-plugin-wit-1.8.0+computecanada tensorflow-estimator-2.3.0+computecanada tensorflow-gpu-2.3.0+computecanada werkzeug-2.0.3+computecanada wrapt-1.11.2+computecanada zipp-3.7.0+computecanada
Looking in links: /cvmfs/soft.computecanada.ca/custom/python/wheelhouse/nix/avx2, /cvmfs/soft.computecanada.ca/custom/python/wheelhouse/nix/generic, /cvmfs/soft.computecanada.ca/custom/python/wheelhouse/generic
Processing /cvmfs/soft.computecanada.ca/custom/python/wheelhouse/generic/keras-2.8.0+computecanada-py2.py3-none-any.whl
Installing collected packages: Keras
Successfully installed Keras-2.8.0+computecanada
Looking in links: /cvmfs/soft.computecanada.ca/custom/python/wheelhouse/nix/avx2, /cvmfs/soft.computecanada.ca/custom/python/wheelhouse/nix/generic, /cvmfs/soft.computecanada.ca/custom/python/wheelhouse/generic
Processing /cvmfs/soft.computecanada.ca/custom/python/wheelhouse/generic/urllib3-1.26.7+computecanada-py2.py3-none-any.whl
Installing collected packages: urllib3
  Attempting uninstall: urllib3
    Found existing installation: urllib3 1.26.9+computecanada
    Uninstalling urllib3-1.26.9+computecanada:
      Successfully uninstalled urllib3-1.26.9+computecanada
Successfully installed urllib3-1.26.7+computecanada
Looking in links: /cvmfs/soft.computecanada.ca/custom/python/wheelhouse/nix/avx2, /cvmfs/soft.computecanada.ca/custom/python/wheelhouse/nix/generic, /cvmfs/soft.computecanada.ca/custom/python/wheelhouse/generic
Processing /cvmfs/soft.computecanada.ca/custom/python/wheelhouse/generic/nltk-3.7+computecanada-py3-none-any.whl
Requirement already satisfied: joblib in /localscratch/yinan.29785241.0/env/lib/python3.7/site-packages (from nltk) (1.1.0+computecanada)
Processing /cvmfs/soft.computecanada.ca/custom/python/wheelhouse/generic/nltk-3.6.5+computecanada-py3-none-any.whl
Processing /cvmfs/soft.computecanada.ca/custom/python/wheelhouse/generic/nltk-3.6.3+computecanada-py3-none-any.whl
Requirement already satisfied: tqdm in /localscratch/yinan.29785241.0/env/lib/python3.7/site-packages (from nltk) (4.63.1+computecanada)
Requirement already satisfied: click in /localscratch/yinan.29785241.0/env/lib/python3.7/site-packages (from nltk) (8.1.0+computecanada)
Requirement already satisfied: regex in /localscratch/yinan.29785241.0/env/lib/python3.7/site-packages (from nltk) (2020.11.13+computecanada)
Requirement already satisfied: importlib-metadata in /localscratch/yinan.29785241.0/env/lib/python3.7/site-packages (from click->nltk) (4.10.1+computecanada)
Requirement already satisfied: typing-extensions>=3.6.4 in /localscratch/yinan.29785241.0/env/lib/python3.7/site-packages (from importlib-metadata->click->nltk) (4.1.1+computecanada)
Requirement already satisfied: zipp>=0.5 in /localscratch/yinan.29785241.0/env/lib/python3.7/site-packages (from importlib-metadata->click->nltk) (3.7.0+computecanada)
Installing collected packages: nltk
Successfully installed nltk-3.6.3+computecanada
Looking in links: /cvmfs/soft.computecanada.ca/custom/python/wheelhouse/nix/avx2, /cvmfs/soft.computecanada.ca/custom/python/wheelhouse/nix/generic, /cvmfs/soft.computecanada.ca/custom/python/wheelhouse/generic
Processing /cvmfs/soft.computecanada.ca/custom/python/wheelhouse/generic/scikit_learn-0.22.1+computecanada-cp37-cp37m-linux_x86_64.whl
Requirement already satisfied: joblib>=0.11 in /localscratch/yinan.29785241.0/env/lib/python3.7/site-packages (from scikit-learn==0.22.1) (1.1.0+computecanada)
Requirement already satisfied: numpy>=1.11.0 in /cvmfs/soft.computecanada.ca/easybuild/software/2017/Core/scipy-stack/2019a/lib/python3.7/site-packages (from scikit-learn==0.22.1) (1.16.0)
Requirement already satisfied: scipy>=0.17.0 in /localscratch/yinan.29785241.0/env/lib/python3.7/site-packages (from scikit-learn==0.22.1) (1.4.1+computecanada)
Installing collected packages: scikit-learn
Successfully installed scikit-learn-0.22.1+computecanada
Looking in links: /cvmfs/soft.computecanada.ca/custom/python/wheelhouse/nix/avx2, /cvmfs/soft.computecanada.ca/custom/python/wheelhouse/nix/generic, /cvmfs/soft.computecanada.ca/custom/python/wheelhouse/generic
Requirement already satisfied: tokenizers==0.5.2 in /localscratch/yinan.29785241.0/env/lib/python3.7/site-packages (0.5.2+computecanada)
wandb: Appending key for api.wandb.ai to your netrc file: /home/yinan/.netrc
Starting Task
2022-03-31 15:09:12.392756: I tensorflow/stream_executor/platform/default/dso_loader.cc:48] Successfully opened dynamic library libcudart.so.10.1
[nltk_data] Downloading package stopwords to /home/yinan/nltk_data...
[nltk_data]   Package stopwords is already up-to-date!
[nltk_data] Downloading package wordnet to /home/yinan/nltk_data...
[nltk_data]   Package wordnet is already up-to-date!
wandb: Currently logged in as: yinanazhou (use `wandb login --relogin` to force relogin)
wandb: wandb version 0.12.11 is available!  To upgrade, please run:
wandb:  $ pip install wandb --upgrade
2022-03-31 15:09:31.701646: I tensorflow/stream_executor/platform/default/dso_loader.cc:48] Successfully opened dynamic library libcudart.so.10.1
wandb: Tracking run with wandb version 0.12.5
wandb: Syncing run elated-dew-2
wandb: ⭐️ View project at https://wandb.ai/yinanazhou/xl_512_bs_8_lr_1e06_es_3_lc_True_nr_False_sr_True_stem_True_lemma_False_repeat_1_fold_1
wandb: 🚀 View run at https://wandb.ai/yinanazhou/xl_512_bs_8_lr_1e06_es_3_lc_True_nr_False_sr_True_stem_True_lemma_False_repeat_1_fold_1/runs/148mvrsa
wandb: Run data is saved locally in /project/6002780/yinan/Thesis_MER_Lyrics/lyric-emotion/wandb/run-20220331_150929-148mvrsa
wandb: Run `wandb offline` to turn off syncing.

Validation loss decreased (inf --> 1.430210).  Saving model ...
Validation loss decreased (1.430210 --> 1.412249).  Saving model ...
Validation loss decreased (1.412249 --> 1.397505).  Saving model ...
Validation loss decreased (1.397505 --> 1.384806).  Saving model ...
Validation loss decreased (1.384806 --> 1.375036).  Saving model ...
Validation loss decreased (1.375036 --> 1.366992).  Saving model ...
Validation loss decreased (1.366992 --> 1.360318).  Saving model ...
Validation loss decreased (1.360318 --> 1.354317).  Saving model ...
Validation loss decreased (1.354317 --> 1.349033).  Saving model ...
Validation loss decreased (1.349033 --> 1.343130).  Saving model ...
Validation loss decreased (1.343130 --> 1.337345).  Saving model ...
Validation loss decreased (1.337345 --> 1.332209).  Saving model ...
Validation loss decreased (1.332209 --> 1.326985).  Saving model ...
Validation loss decreased (1.326985 --> 1.322089).  Saving model ...
Validation loss decreased (1.322089 --> 1.316468).  Saving model ...
Validation loss decreased (1.316468 --> 1.311502).  Saving model ...
Validation loss decreased (1.311502 --> 1.306029).  Saving model ...
Validation loss decreased (1.306029 --> 1.300590).  Saving model ...
Validation loss decreased (1.300590 --> 1.295294).  Saving model ...
Validation loss decreased (1.295294 --> 1.289089).  Saving model ...
Validation loss decreased (1.289089 --> 1.283232).  Saving model ...
Validation loss decreased (1.283232 --> 1.277649).  Saving model ...
Validation loss decreased (1.277649 --> 1.271788).  Saving model ...
Validation loss decreased (1.271788 --> 1.266046).  Saving model ...
Validation loss decreased (1.266046 --> 1.260479).  Saving model ...
Validation loss decreased (1.260479 --> 1.255159).  Saving model ...
Validation loss decreased (1.255159 --> 1.249375).  Saving model ...
Validation loss decreased (1.249375 --> 1.244089).  Saving model ...
Validation loss decreased (1.244089 --> 1.239751).  Saving model ...
Validation loss decreased (1.239751 --> 1.234297).  Saving model ...
Validation loss decreased (1.234297 --> 1.229342).  Saving model ...
Validation loss decreased (1.229342 --> 1.224513).  Saving model ...
Validation loss decreased (1.224513 --> 1.219727).  Saving model ...
Validation loss decreased (1.219727 --> 1.214424).  Saving model ...
Validation loss decreased (1.214424 --> 1.210924).  Saving model ...
Validation loss decreased (1.210924 --> 1.206348).  Saving model ...
Validation loss decreased (1.206348 --> 1.201905).  Saving model ...
Validation loss decreased (1.201905 --> 1.197582).  Saving model ...
Validation loss decreased (1.197582 --> 1.194820).  Saving model ...
Validation loss decreased (1.194820 --> 1.190910).  Saving model ...
Validation loss decreased (1.190910 --> 1.184925).  Saving model ...
Validation loss decreased (1.184925 --> 1.182018).  Saving model ...
Validation loss decreased (1.182018 --> 1.179328).  Saving model ...
Validation loss decreased (1.179328 --> 1.175264).  Saving model ...
Validation loss decreased (1.175264 --> 1.172412).  Saving model ...
Validation loss decreased (1.172412 --> 1.167712).  Saving model ...
Validation loss decreased (1.167712 --> 1.163357).  Saving model ...
Validation loss decreased (1.163357 --> 1.162127).  Saving model ...
Validation loss decreased (1.162127 --> 1.156737).  Saving model ...
Validation loss decreased (1.156737 --> 1.151515).  Saving model ...
Validation loss decreased (1.151515 --> 1.148340).  Saving model ...
Validation loss decreased (1.148340 --> 1.145097).  Saving model ...
Validation loss decreased (1.145097 --> 1.142837).  Saving model ...
Validation loss decreased (1.142837 --> 1.141051).  Saving model ...
Validation loss decreased (1.141051 --> 1.138547).  Saving model ...
Validation loss decreased (1.138547 --> 1.131931).  Saving model ...
Validation loss decreased (1.131931 --> 1.129908).  Saving model ...
Validation loss decreased (1.129908 --> 1.126883).  Saving model ...
Validation loss decreased (1.126883 --> 1.121798).  Saving model ...
Validation loss decreased (1.121798 --> 1.120669).  Saving model ...
Validation loss decreased (1.120669 --> 1.118011).  Saving model ...
Validation loss decreased (1.118011 --> 1.116920).  Saving model ...
Validation loss decreased (1.116920 --> 1.112071).  Saving model ...
Validation loss decreased (1.112071 --> 1.109591).  Saving model ...
EarlyStopping counter: 1 out of 3.0
Validation loss decreased (1.109591 --> 1.106922).  Saving model ...
Validation loss decreased (1.106922 --> 1.103593).  Saving model ...
Validation loss decreased (1.103593 --> 1.098547).  Saving model ...
Validation loss decreased (1.098547 --> 1.095867).  Saving model ...
Validation loss decreased (1.095867 --> 1.092458).  Saving model ...
Validation loss decreased (1.092458 --> 1.088707).  Saving model ...
EarlyStopping counter: 1 out of 3.0
Validation loss decreased (1.088707 --> 1.085272).  Saving model ...
Validation loss decreased (1.085272 --> 1.082917).  Saving model ...
Validation loss decreased (1.082917 --> 1.080597).  Saving model ...
Validation loss decreased (1.080597 --> 1.079706).  Saving model ...
Validation loss decreased (1.079706 --> 1.079162).  Saving model ...
Validation loss decreased (1.079162 --> 1.076865).  Saving model ...
Validation loss decreased (1.076865 --> 1.071596).  Saving model ...
Validation loss decreased (1.071596 --> 1.068601).  Saving model ...
Validation loss decreased (1.068601 --> 1.068073).  Saving model ...
Validation loss decreased (1.068073 --> 1.066345).  Saving model ...
Validation loss decreased (1.066345 --> 1.064647).  Saving model ...
EarlyStopping counter: 1 out of 3.0
Validation loss decreased (1.064647 --> 1.060166).  Saving model ...
Validation loss decreased (1.060166 --> 1.059190).  Saving model ...
Validation loss decreased (1.059190 --> 1.056568).  Saving model ...
EarlyStopping counter: 1 out of 3.0
Validation loss decreased (1.056568 --> 1.054544).  Saving model ...
Validation loss decreased (1.054544 --> 1.050973).  Saving model ...
EarlyStopping counter: 1 out of 3.0
Validation loss decreased (1.050973 --> 1.050481).  Saving model ...
Validation loss decreased (1.050481 --> 1.048481).  Saving model ...
EarlyStopping counter: 1 out of 3.0
EarlyStopping counter: 2 out of 3.0
Validation loss decreased (1.048481 --> 1.047805).  Saving model ...
Validation loss decreased (1.047805 --> 1.044778).  Saving model ...
Validation loss decreased (1.044778 --> 1.040265).  Saving model ...
Validation loss decreased (1.040265 --> 1.038755).  Saving model ...
EarlyStopping counter: 1 out of 3.0
Validation loss decreased (1.038755 --> 1.037378).  Saving model ...
Validation loss decreased (1.037378 --> 1.036332).  Saving model ...
EarlyStopping counter: 1 out of 3.0
EarlyStopping counter: 2 out of 3.0
EarlyStopping counter: 3 out of 3.0
/localscratch/yinan.29785241.0/env/lib/python3.7/site-packages/torch/nn/functional.py:1794: UserWarning: nn.functional.tanh is deprecated. Use torch.tanh instead.
  warnings.warn("nn.functional.tanh is deprecated. Use torch.tanh instead.")
/localscratch/yinan.29785241.0/env/lib/python3.7/site-packages/transformers/optimization.py:155: UserWarning: This overload of add_ is deprecated:
	add_(Number alpha, Tensor other)
Consider using one of the following signatures instead:
	add_(Tensor other, *, Number alpha) (Triggered internally at  ../torch/csrc/utils/python_arg_parser.cpp:1025.)
  exp_avg.mul_(beta1).add_(1.0 - beta1, grad)
wandb: Waiting for W&B process to finish, PID 25091... (success).
wandb: - 0.00MB of 0.00MB uploaded (0.00MB deduped)wandb: \ 0.00MB of 0.00MB uploaded (0.00MB deduped)wandb: | 0.00MB of 0.00MB uploaded (0.00MB deduped)wandb: / 0.00MB of 0.00MB uploaded (0.00MB deduped)wandb: - 0.00MB of 0.00MB uploaded (0.00MB deduped)wandb: \ 0.00MB of 0.00MB uploaded (0.00MB deduped)wandb: | 0.00MB of 0.00MB uploaded (0.00MB deduped)wandb: / 0.00MB of 0.00MB uploaded (0.00MB deduped)wandb: - 0.00MB of 0.00MB uploaded (0.00MB deduped)wandb: \ 0.00MB of 0.00MB uploaded (0.00MB deduped)wandb: | 0.00MB of 0.00MB uploaded (0.00MB deduped)wandb: / 0.00MB of 0.00MB uploaded (0.00MB deduped)wandb: - 0.00MB of 0.00MB uploaded (0.00MB deduped)wandb:                                                                                
wandb: Run history:
wandb:     e_F1 ▁▂▃▄▅▅▅▅▆▆▆▆▆▆▆▇▆▇▇▇▇▇▇▇▇▇▇▇▇▇█▇████████
wandb:   e_loss █▇▇▇▆▆▆▆▅▅▅▅▄▄▄▄▄▃▃▃▃▃▃▂▂▂▂▂▂▂▂▂▁▁▁▁▁▁▁▁
wandb:     t_F1 ▁▂▂▃▃▄▄▄▄▅▅▅▅▅▆▆▆▅▆▆▆▇▇▇▇▆▇▇▇▇▇▇▇█▇█▇▇██
wandb:   t_loss ██▇▇▇▇▆▆▆▆▅▅▅▅▅▄▄▄▄▄▃▃▃▃▃▃▃▂▂▂▂▂▂▂▁▁▁▁▁▁
wandb: 
wandb: Run summary:
wandb:     e_F1 54.71284
wandb:   e_loss 1.03761
wandb:     t_F1 67.81968
wandb:   t_loss 0.85451
wandb: 
wandb: Synced 4 W&B file(s), 0 media file(s), 0 artifact file(s) and 0 other file(s)
wandb: Synced elated-dew-2: https://wandb.ai/yinanazhou/xl_512_bs_8_lr_1e06_es_3_lc_True_nr_False_sr_True_stem_True_lemma_False_repeat_1_fold_1/runs/148mvrsa
wandb: Find logs at: ./wandb/run-20220331_150929-148mvrsa/logs/debug.log
wandb: 

wandb: wandb version 0.12.11 is available!  To upgrade, please run:
wandb:  $ pip install wandb --upgrade
2022-03-31 16:19:13.827753: I tensorflow/stream_executor/platform/default/dso_loader.cc:48] Successfully opened dynamic library libcudart.so.10.1
wandb: Tracking run with wandb version 0.12.5
wandb: Syncing run ethereal-wildflower-2
wandb: ⭐️ View project at https://wandb.ai/yinanazhou/xl_512_bs_8_lr_1e06_es_3_lc_True_nr_False_sr_True_stem_True_lemma_False_repeat_1_fold_2
wandb: 🚀 View run at https://wandb.ai/yinanazhou/xl_512_bs_8_lr_1e06_es_3_lc_True_nr_False_sr_True_stem_True_lemma_False_repeat_1_fold_2/runs/1p0qx5n7
wandb: Run data is saved locally in /project/6002780/yinan/Thesis_MER_Lyrics/lyric-emotion/wandb/run-20220331_161911-1p0qx5n7
wandb: Run `wandb offline` to turn off syncing.

Validation loss decreased (inf --> 1.449151).  Saving model ...
Validation loss decreased (1.449151 --> 1.419466).  Saving model ...
Validation loss decreased (1.419466 --> 1.397904).  Saving model ...
Validation loss decreased (1.397904 --> 1.382130).  Saving model ...
Validation loss decreased (1.382130 --> 1.368683).  Saving model ...
Validation loss decreased (1.368683 --> 1.359242).  Saving model ...
Validation loss decreased (1.359242 --> 1.351004).  Saving model ...
Validation loss decreased (1.351004 --> 1.344659).  Saving model ...
Validation loss decreased (1.344659 --> 1.339468).  Saving model ...
Validation loss decreased (1.339468 --> 1.334824).  Saving model ...
Validation loss decreased (1.334824 --> 1.330968).  Saving model ...
Validation loss decreased (1.330968 --> 1.327141).  Saving model ...
Validation loss decreased (1.327141 --> 1.323896).  Saving model ...
Validation loss decreased (1.323896 --> 1.320577).  Saving model ...
Validation loss decreased (1.320577 --> 1.316966).  Saving model ...
Validation loss decreased (1.316966 --> 1.313313).  Saving model ...
Validation loss decreased (1.313313 --> 1.309687).  Saving model ...
Validation loss decreased (1.309687 --> 1.306282).  Saving model ...
Validation loss decreased (1.306282 --> 1.302728).  Saving model ...
Validation loss decreased (1.302728 --> 1.298514).  Saving model ...
Validation loss decreased (1.298514 --> 1.294273).  Saving model ...
Validation loss decreased (1.294273 --> 1.289262).  Saving model ...
Validation loss decreased (1.289262 --> 1.285086).  Saving model ...
Validation loss decreased (1.285086 --> 1.280212).  Saving model ...
Validation loss decreased (1.280212 --> 1.275819).  Saving model ...
Validation loss decreased (1.275819 --> 1.270594).  Saving model ...
Validation loss decreased (1.270594 --> 1.265139).  Saving model ...
Validation loss decreased (1.265139 --> 1.259304).  Saving model ...
Validation loss decreased (1.259304 --> 1.253308).  Saving model ...
Validation loss decreased (1.253308 --> 1.247948).  Saving model ...
Validation loss decreased (1.247948 --> 1.241442).  Saving model ...
Validation loss decreased (1.241442 --> 1.235452).  Saving model ...
Validation loss decreased (1.235452 --> 1.229829).  Saving model ...
Validation loss decreased (1.229829 --> 1.223600).  Saving model ...
Validation loss decreased (1.223600 --> 1.216247).  Saving model ...
Validation loss decreased (1.216247 --> 1.210174).  Saving model ...
Validation loss decreased (1.210174 --> 1.204155).  Saving model ...
Validation loss decreased (1.204155 --> 1.197284).  Saving model ...
Validation loss decreased (1.197284 --> 1.191338).  Saving model ...
Validation loss decreased (1.191338 --> 1.185552).  Saving model ...
Validation loss decreased (1.185552 --> 1.180128).  Saving model ...
Validation loss decreased (1.180128 --> 1.173786).  Saving model ...
Validation loss decreased (1.173786 --> 1.168404).  Saving model ...
Validation loss decreased (1.168404 --> 1.163065).  Saving model ...
Validation loss decreased (1.163065 --> 1.156262).  Saving model ...
Validation loss decreased (1.156262 --> 1.150909).  Saving model ...
Validation loss decreased (1.150909 --> 1.145744).  Saving model ...
Validation loss decreased (1.145744 --> 1.141353).  Saving model ...
Validation loss decreased (1.141353 --> 1.136061).  Saving model ...
Validation loss decreased (1.136061 --> 1.130287).  Saving model ...
Validation loss decreased (1.130287 --> 1.124627).  Saving model ...
Validation loss decreased (1.124627 --> 1.119406).  Saving model ...
Validation loss decreased (1.119406 --> 1.114084).  Saving model ...
Validation loss decreased (1.114084 --> 1.108571).  Saving model ...
Validation loss decreased (1.108571 --> 1.104325).  Saving model ...
Validation loss decreased (1.104325 --> 1.099389).  Saving model ...
Validation loss decreased (1.099389 --> 1.094483).  Saving model ...
Validation loss decreased (1.094483 --> 1.090930).  Saving model ...
Validation loss decreased (1.090930 --> 1.086158).  Saving model ...
Validation loss decreased (1.086158 --> 1.081202).  Saving model ...
Validation loss decreased (1.081202 --> 1.077296).  Saving model ...
Validation loss decreased (1.077296 --> 1.072818).  Saving model ...
Validation loss decreased (1.072818 --> 1.068248).  Saving model ...
Validation loss decreased (1.068248 --> 1.063626).  Saving model ...
Validation loss decreased (1.063626 --> 1.061374).  Saving model ...
Validation loss decreased (1.061374 --> 1.056198).  Saving model ...
Validation loss decreased (1.056198 --> 1.051953).  Saving model ...
Validation loss decreased (1.051953 --> 1.047327).  Saving model ...
Validation loss decreased (1.047327 --> 1.042584).  Saving model ...
Validation loss decreased (1.042584 --> 1.039600).  Saving model ...
Validation loss decreased (1.039600 --> 1.036383).  Saving model ...
Validation loss decreased (1.036383 --> 1.033321).  Saving model ...
Validation loss decreased (1.033321 --> 1.029240).  Saving model ...
Validation loss decreased (1.029240 --> 1.026326).  Saving model ...
Validation loss decreased (1.026326 --> 1.023407).  Saving model ...
Validation loss decreased (1.023407 --> 1.019405).  Saving model ...
Validation loss decreased (1.019405 --> 1.016161).  Saving model ...
Validation loss decreased (1.016161 --> 1.012742).  Saving model ...
Validation loss decreased (1.012742 --> 1.008668).  Saving model ...
Validation loss decreased (1.008668 --> 1.005840).  Saving model ...
Validation loss decreased (1.005840 --> 1.002887).  Saving model ...
Validation loss decreased (1.002887 --> 0.999711).  Saving model ...
Validation loss decreased (0.999711 --> 0.997145).  Saving model ...
Validation loss decreased (0.997145 --> 0.993466).  Saving model ...
Validation loss decreased (0.993466 --> 0.992110).  Saving model ...
Validation loss decreased (0.992110 --> 0.990334).  Saving model ...
Validation loss decreased (0.990334 --> 0.989255).  Saving model ...
Validation loss decreased (0.989255 --> 0.985479).  Saving model ...
Validation loss decreased (0.985479 --> 0.983471).  Saving model ...
Validation loss decreased (0.983471 --> 0.981302).  Saving model ...
Validation loss decreased (0.981302 --> 0.978190).  Saving model ...
Validation loss decreased (0.978190 --> 0.976149).  Saving model ...
Validation loss decreased (0.976149 --> 0.974204).  Saving model ...
Validation loss decreased (0.974204 --> 0.971816).  Saving model ...
Validation loss decreased (0.971816 --> 0.969993).  Saving model ...
Validation loss decreased (0.969993 --> 0.967419).  Saving model ...
Validation loss decreased (0.967419 --> 0.966250).  Saving model ...
Validation loss decreased (0.966250 --> 0.966094).  Saving model ...
Validation loss decreased (0.966094 --> 0.964133).  Saving model ...
Validation loss decreased (0.964133 --> 0.961737).  Saving model ...
Validation loss decreased (0.961737 --> 0.961106).  Saving model ...
Validation loss decreased (0.961106 --> 0.958685).  Saving model ...
Validation loss decreased (0.958685 --> 0.956029).  Saving model ...
Validation loss decreased (0.956029 --> 0.954733).  Saving model ...
Validation loss decreased (0.954733 --> 0.953534).  Saving model ...
Validation loss decreased (0.953534 --> 0.952655).  Saving model ...
Validation loss decreased (0.952655 --> 0.949186).  Saving model ...
Validation loss decreased (0.949186 --> 0.945250).  Saving model ...
Validation loss decreased (0.945250 --> 0.944468).  Saving model ...
Validation loss decreased (0.944468 --> 0.943341).  Saving model ...
Validation loss decreased (0.943341 --> 0.942419).  Saving model ...
Validation loss decreased (0.942419 --> 0.941603).  Saving model ...
EarlyStopping counter: 1 out of 3.0
Validation loss decreased (0.941603 --> 0.938878).  Saving model ...
EarlyStopping counter: 1 out of 3.0
EarlyStopping counter: 2 out of 3.0
Validation loss decreased (0.938878 --> 0.935750).  Saving model ...
Validation loss decreased (0.935750 --> 0.935525).  Saving model ...
Validation loss decreased (0.935525 --> 0.934677).  Saving model ...
Validation loss decreased (0.934677 --> 0.930840).  Saving model ...
EarlyStopping counter: 1 out of 3.0
EarlyStopping counter: 2 out of 3.0
EarlyStopping counter: 3 out of 3.0
/localscratch/yinan.29785241.0/env/lib/python3.7/site-packages/torch/nn/functional.py:1794: UserWarning: nn.functional.tanh is deprecated. Use torch.tanh instead.
  warnings.warn("nn.functional.tanh is deprecated. Use torch.tanh instead.")
wandb: Waiting for W&B process to finish, PID 28860... (success).
wandb: - 0.00MB of 0.00MB uploaded (0.00MB deduped)wandb: \ 0.00MB of 0.00MB uploaded (0.00MB deduped)wandb: | 0.00MB of 0.00MB uploaded (0.00MB deduped)wandb: / 0.00MB of 0.00MB uploaded (0.00MB deduped)wandb: - 0.00MB of 0.00MB uploaded (0.00MB deduped)wandb: \ 0.00MB of 0.00MB uploaded (0.00MB deduped)wandb: | 0.00MB of 0.00MB uploaded (0.00MB deduped)wandb: / 0.00MB of 0.00MB uploaded (0.00MB deduped)wandb: - 0.00MB of 0.00MB uploaded (0.00MB deduped)wandb: \ 0.00MB of 0.00MB uploaded (0.00MB deduped)wandb: | 0.00MB of 0.00MB uploaded (0.00MB deduped)wandb: / 0.00MB of 0.00MB uploaded (0.00MB deduped)wandb:                                                                                
wandb: Run history:
wandb:     e_F1 ▁▂▄▅▅▅▅▅▅▆▆▆▇▇▇▇▇▇▇▇▇▇▇▇▇███████████████
wandb:   e_loss █▇▇▆▆▆▆▆▆▅▅▅▅▄▄▄▄▃▃▃▃▃▃▂▂▂▂▂▂▂▂▁▁▁▁▁▁▁▁▁
wandb:     t_F1 ▁▂▃▃▃▄▄▄▄▄▅▅▅▅▅▆▆▆▆▆▇▆▆▇▇▇▇▇▇█▇▇▇███████
wandb:   t_loss █▇▇▇▇▆▆▆▆▆▆▅▅▅▅▅▄▄▄▄▄▄▄▃▃▃▃▃▃▂▂▂▂▂▂▂▁▁▁▁
wandb: 
wandb: Run summary:
wandb:     e_F1 60.25128
wandb:   e_loss 0.93158
wandb:     t_F1 66.89418
wandb:   t_loss 0.84817
wandb: 
wandb: Synced 4 W&B file(s), 0 media file(s), 0 artifact file(s) and 0 other file(s)
wandb: Synced ethereal-wildflower-2: https://wandb.ai/yinanazhou/xl_512_bs_8_lr_1e06_es_3_lc_True_nr_False_sr_True_stem_True_lemma_False_repeat_1_fold_2/runs/1p0qx5n7
wandb: Find logs at: ./wandb/run-20220331_161911-1p0qx5n7/logs/debug.log
wandb: 

wandb: wandb version 0.12.11 is available!  To upgrade, please run:
wandb:  $ pip install wandb --upgrade
2022-03-31 17:39:12.257283: I tensorflow/stream_executor/platform/default/dso_loader.cc:48] Successfully opened dynamic library libcudart.so.10.1
wandb: Tracking run with wandb version 0.12.5
wandb: Syncing run pious-wildflower-2
wandb: ⭐️ View project at https://wandb.ai/yinanazhou/xl_512_bs_8_lr_1e06_es_3_lc_True_nr_False_sr_True_stem_True_lemma_False_repeat_2_fold_1
wandb: 🚀 View run at https://wandb.ai/yinanazhou/xl_512_bs_8_lr_1e06_es_3_lc_True_nr_False_sr_True_stem_True_lemma_False_repeat_2_fold_1/runs/26b9eid4
wandb: Run data is saved locally in /project/6002780/yinan/Thesis_MER_Lyrics/lyric-emotion/wandb/run-20220331_173909-26b9eid4
wandb: Run `wandb offline` to turn off syncing.

Validation loss decreased (inf --> 1.429267).  Saving model ...
Validation loss decreased (1.429267 --> 1.417353).  Saving model ...
Validation loss decreased (1.417353 --> 1.407098).  Saving model ...
Validation loss decreased (1.407098 --> 1.398524).  Saving model ...
Validation loss decreased (1.398524 --> 1.391335).  Saving model ...
Validation loss decreased (1.391335 --> 1.385740).  Saving model ...
Validation loss decreased (1.385740 --> 1.380240).  Saving model ...
Validation loss decreased (1.380240 --> 1.375027).  Saving model ...
Validation loss decreased (1.375027 --> 1.370308).  Saving model ...
Validation loss decreased (1.370308 --> 1.365499).  Saving model ...
Validation loss decreased (1.365499 --> 1.361244).  Saving model ...
Validation loss decreased (1.361244 --> 1.357379).  Saving model ...
Validation loss decreased (1.357379 --> 1.353691).  Saving model ...
Validation loss decreased (1.353691 --> 1.349668).  Saving model ...
Validation loss decreased (1.349668 --> 1.345596).  Saving model ...
Validation loss decreased (1.345596 --> 1.341833).  Saving model ...
Validation loss decreased (1.341833 --> 1.337586).  Saving model ...
Validation loss decreased (1.337586 --> 1.333514).  Saving model ...
Validation loss decreased (1.333514 --> 1.329547).  Saving model ...
Validation loss decreased (1.329547 --> 1.324875).  Saving model ...
Validation loss decreased (1.324875 --> 1.319847).  Saving model ...
Validation loss decreased (1.319847 --> 1.315345).  Saving model ...
Validation loss decreased (1.315345 --> 1.310580).  Saving model ...
Validation loss decreased (1.310580 --> 1.305812).  Saving model ...
Validation loss decreased (1.305812 --> 1.299919).  Saving model ...
Validation loss decreased (1.299919 --> 1.294290).  Saving model ...
Validation loss decreased (1.294290 --> 1.289225).  Saving model ...
Validation loss decreased (1.289225 --> 1.283083).  Saving model ...
Validation loss decreased (1.283083 --> 1.276591).  Saving model ...
Validation loss decreased (1.276591 --> 1.270695).  Saving model ...
Validation loss decreased (1.270695 --> 1.264716).  Saving model ...
Validation loss decreased (1.264716 --> 1.258048).  Saving model ...
Validation loss decreased (1.258048 --> 1.250652).  Saving model ...
Validation loss decreased (1.250652 --> 1.243497).  Saving model ...
Validation loss decreased (1.243497 --> 1.236422).  Saving model ...
Validation loss decreased (1.236422 --> 1.228656).  Saving model ...
Validation loss decreased (1.228656 --> 1.221335).  Saving model ...
Validation loss decreased (1.221335 --> 1.212651).  Saving model ...
Validation loss decreased (1.212651 --> 1.205071).  Saving model ...
Validation loss decreased (1.205071 --> 1.196140).  Saving model ...
Validation loss decreased (1.196140 --> 1.187718).  Saving model ...
Validation loss decreased (1.187718 --> 1.178707).  Saving model ...
Validation loss decreased (1.178707 --> 1.171966).  Saving model ...
Validation loss decreased (1.171966 --> 1.162485).  Saving model ...
Validation loss decreased (1.162485 --> 1.155174).  Saving model ...
Validation loss decreased (1.155174 --> 1.147013).  Saving model ...
Validation loss decreased (1.147013 --> 1.140836).  Saving model ...
Validation loss decreased (1.140836 --> 1.135045).  Saving model ...
Validation loss decreased (1.135045 --> 1.128267).  Saving model ...
Validation loss decreased (1.128267 --> 1.121121).  Saving model ...
Validation loss decreased (1.121121 --> 1.114501).  Saving model ...
Validation loss decreased (1.114501 --> 1.108568).  Saving model ...
Validation loss decreased (1.108568 --> 1.103226).  Saving model ...
Validation loss decreased (1.103226 --> 1.098185).  Saving model ...
Validation loss decreased (1.098185 --> 1.093179).  Saving model ...
Validation loss decreased (1.093179 --> 1.087358).  Saving model ...
Validation loss decreased (1.087358 --> 1.083296).  Saving model ...
Validation loss decreased (1.083296 --> 1.079007).  Saving model ...
Validation loss decreased (1.079007 --> 1.073838).  Saving model ...
Validation loss decreased (1.073838 --> 1.068965).  Saving model ...
Validation loss decreased (1.068965 --> 1.064898).  Saving model ...
Validation loss decreased (1.064898 --> 1.060213).  Saving model ...
Validation loss decreased (1.060213 --> 1.056996).  Saving model ...
Validation loss decreased (1.056996 --> 1.054136).  Saving model ...
Validation loss decreased (1.054136 --> 1.049896).  Saving model ...
Validation loss decreased (1.049896 --> 1.045444).  Saving model ...
Validation loss decreased (1.045444 --> 1.041827).  Saving model ...
Validation loss decreased (1.041827 --> 1.038571).  Saving model ...
Validation loss decreased (1.038571 --> 1.035755).  Saving model ...
Validation loss decreased (1.035755 --> 1.032459).  Saving model ...
Validation loss decreased (1.032459 --> 1.029954).  Saving model ...
Validation loss decreased (1.029954 --> 1.026757).  Saving model ...
Validation loss decreased (1.026757 --> 1.023611).  Saving model ...
Validation loss decreased (1.023611 --> 1.021251).  Saving model ...
Validation loss decreased (1.021251 --> 1.018425).  Saving model ...
Validation loss decreased (1.018425 --> 1.015950).  Saving model ...
Validation loss decreased (1.015950 --> 1.014421).  Saving model ...
Validation loss decreased (1.014421 --> 1.011337).  Saving model ...
Validation loss decreased (1.011337 --> 1.008678).  Saving model ...
Validation loss decreased (1.008678 --> 1.006427).  Saving model ...
Validation loss decreased (1.006427 --> 1.005516).  Saving model ...
Validation loss decreased (1.005516 --> 1.003552).  Saving model ...
Validation loss decreased (1.003552 --> 0.999634).  Saving model ...
Validation loss decreased (0.999634 --> 0.997785).  Saving model ...
Validation loss decreased (0.997785 --> 0.995679).  Saving model ...
Validation loss decreased (0.995679 --> 0.994399).  Saving model ...
Validation loss decreased (0.994399 --> 0.993450).  Saving model ...
Validation loss decreased (0.993450 --> 0.991505).  Saving model ...
Validation loss decreased (0.991505 --> 0.990853).  Saving model ...
Validation loss decreased (0.990853 --> 0.987460).  Saving model ...
Validation loss decreased (0.987460 --> 0.986543).  Saving model ...
Validation loss decreased (0.986543 --> 0.985239).  Saving model ...
Validation loss decreased (0.985239 --> 0.984688).  Saving model ...
Validation loss decreased (0.984688 --> 0.983774).  Saving model ...
Validation loss decreased (0.983774 --> 0.982584).  Saving model ...
Validation loss decreased (0.982584 --> 0.982572).  Saving model ...
Validation loss decreased (0.982572 --> 0.980187).  Saving model ...
Validation loss decreased (0.980187 --> 0.979203).  Saving model ...
Validation loss decreased (0.979203 --> 0.978174).  Saving model ...
Validation loss decreased (0.978174 --> 0.977397).  Saving model ...
Validation loss decreased (0.977397 --> 0.976374).  Saving model ...
Validation loss decreased (0.976374 --> 0.975587).  Saving model ...
Validation loss decreased (0.975587 --> 0.975217).  Saving model ...
Validation loss decreased (0.975217 --> 0.974267).  Saving model ...
Validation loss decreased (0.974267 --> 0.973481).  Saving model ...
Validation loss decreased (0.973481 --> 0.972870).  Saving model ...
Validation loss decreased (0.972870 --> 0.971855).  Saving model ...
Validation loss decreased (0.971855 --> 0.971265).  Saving model ...
EarlyStopping counter: 1 out of 3.0
Validation loss decreased (0.971265 --> 0.970254).  Saving model ...
Validation loss decreased (0.970254 --> 0.969295).  Saving model ...
EarlyStopping counter: 1 out of 3.0
EarlyStopping counter: 2 out of 3.0
Validation loss decreased (0.969295 --> 0.969177).  Saving model ...
Validation loss decreased (0.969177 --> 0.968733).  Saving model ...
Validation loss decreased (0.968733 --> 0.968596).  Saving model ...
EarlyStopping counter: 1 out of 3.0
Validation loss decreased (0.968596 --> 0.968055).  Saving model ...
EarlyStopping counter: 1 out of 3.0
Validation loss decreased (0.968055 --> 0.966405).  Saving model ...
Validation loss decreased (0.966405 --> 0.966402).  Saving model ...
EarlyStopping counter: 1 out of 3.0
EarlyStopping counter: 2 out of 3.0
EarlyStopping counter: 3 out of 3.0
/localscratch/yinan.29785241.0/env/lib/python3.7/site-packages/torch/nn/functional.py:1794: UserWarning: nn.functional.tanh is deprecated. Use torch.tanh instead.
  warnings.warn("nn.functional.tanh is deprecated. Use torch.tanh instead.")
wandb: Waiting for W&B process to finish, PID 33120... (success).
wandb: - 0.00MB of 0.00MB uploaded (0.00MB deduped)wandb: \ 0.00MB of 0.00MB uploaded (0.00MB deduped)wandb: | 0.00MB of 0.00MB uploaded (0.00MB deduped)wandb: / 0.00MB of 0.00MB uploaded (0.00MB deduped)wandb: - 0.00MB of 0.00MB uploaded (0.00MB deduped)wandb: \ 0.00MB of 0.00MB uploaded (0.00MB deduped)wandb: | 0.00MB of 0.00MB uploaded (0.00MB deduped)wandb: / 0.00MB of 0.00MB uploaded (0.00MB deduped)wandb: - 0.00MB of 0.00MB uploaded (0.00MB deduped)wandb: \ 0.00MB of 0.00MB uploaded (0.00MB deduped)wandb: | 0.00MB of 0.00MB uploaded (0.00MB deduped)wandb: / 0.00MB of 0.00MB uploaded (0.00MB deduped)wandb: - 0.00MB of 0.00MB uploaded (0.00MB deduped)wandb:                                                                                
wandb: Run history:
wandb:     e_F1 ▁▂▃▃▄▅▅▅▅▆▆▆▆▆▇▇▇▇▇▇▇▇▇▇▇▇▇▇▇█▇▇████████
wandb:   e_loss ██▇▇▇▇▆▆▆▆▅▅▅▄▄▄▃▃▃▃▂▂▂▂▂▂▂▁▁▁▁▁▁▁▁▁▁▁▁▁
wandb:     t_F1 ▁▂▂▂▃▃▃▃▄▄▅▄▅▅▅▅▆▆▆▇▆▆▆▇▇▇▇▇█▇▇▇█▇██████
wandb:   t_loss ██▇▇▇▇▇▇▇▆▆▆▆▅▅▅▅▄▄▄▄▄▄▃▃▃▃▃▂▂▂▂▂▂▂▂▂▁▁▁
wandb: 
wandb: Run summary:
wandb:     e_F1 59.41413
wandb:   e_loss 0.96672
wandb:     t_F1 70.42755
wandb:   t_loss 0.77547
wandb: 
wandb: Synced 4 W&B file(s), 0 media file(s), 0 artifact file(s) and 0 other file(s)
wandb: Synced pious-wildflower-2: https://wandb.ai/yinanazhou/xl_512_bs_8_lr_1e06_es_3_lc_True_nr_False_sr_True_stem_True_lemma_False_repeat_2_fold_1/runs/26b9eid4
wandb: Find logs at: ./wandb/run-20220331_173909-26b9eid4/logs/debug.log
wandb: 

wandb: wandb version 0.12.11 is available!  To upgrade, please run:
wandb:  $ pip install wandb --upgrade
2022-03-31 19:01:24.770399: I tensorflow/stream_executor/platform/default/dso_loader.cc:48] Successfully opened dynamic library libcudart.so.10.1
wandb: Tracking run with wandb version 0.12.5
wandb: Syncing run noble-serenity-2
wandb: ⭐️ View project at https://wandb.ai/yinanazhou/xl_512_bs_8_lr_1e06_es_3_lc_True_nr_False_sr_True_stem_True_lemma_False_repeat_2_fold_2
wandb: 🚀 View run at https://wandb.ai/yinanazhou/xl_512_bs_8_lr_1e06_es_3_lc_True_nr_False_sr_True_stem_True_lemma_False_repeat_2_fold_2/runs/3qydtc85
wandb: Run data is saved locally in /project/6002780/yinan/Thesis_MER_Lyrics/lyric-emotion/wandb/run-20220331_190122-3qydtc85
wandb: Run `wandb offline` to turn off syncing.
slurmstepd: error: *** JOB 29785241 ON cdr2630 CANCELLED AT 2022-03-31T19:26:38 ***
