Unloading StdEnv/2020

Due to MODULEPATH changes, the following have been reloaded:
  1) mii/1.1.1


The following have been reloaded with a version change:
  1) python/3.8.2 => python/3.7.4

Using base prefix '/cvmfs/soft.computecanada.ca/easybuild/software/2017/Core/python/3.7.4'
New python executable in /localscratch/yinan.28698742.0/env/bin/python
Installing setuptools, pip, wheel...
done.
Ignoring pip: markers 'python_version < "3"' don't match your environment
Looking in links: /cvmfs/soft.computecanada.ca/custom/python/wheelhouse/nix/avx2, /cvmfs/soft.computecanada.ca/custom/python/wheelhouse/nix/generic, /cvmfs/soft.computecanada.ca/custom/python/wheelhouse/generic
Collecting pip
Installing collected packages: pip
  Found existing installation: pip 19.1.1
    Uninstalling pip-19.1.1:
      Successfully uninstalled pip-19.1.1
Successfully installed pip-21.2.3+computecanada
Looking in links: /cvmfs/soft.computecanada.ca/custom/python/wheelhouse/nix/avx2, /cvmfs/soft.computecanada.ca/custom/python/wheelhouse/nix/generic, /cvmfs/soft.computecanada.ca/custom/python/wheelhouse/generic
Processing /cvmfs/soft.computecanada.ca/custom/python/wheelhouse/generic/keras-2.8.0+computecanada-py2.py3-none-any.whl
Processing /cvmfs/soft.computecanada.ca/custom/python/wheelhouse/generic/Keras_Preprocessing-1.1.2+computecanada-py3-none-any.whl
Requirement already satisfied: matplotlib in /cvmfs/soft.computecanada.ca/easybuild/software/2017/Core/scipy-stack/2019a/lib/python3.7/site-packages (from -r requirements.txt (line 3)) (3.0.2)
Processing /cvmfs/soft.computecanada.ca/custom/python/wheelhouse/generic/nltk-3.6.5+computecanada-py3-none-any.whl
Processing /cvmfs/soft.computecanada.ca/custom/python/wheelhouse/generic/scikit_learn-0.22.1+computecanada-cp37-cp37m-linux_x86_64.whl
Processing /cvmfs/soft.computecanada.ca/custom/python/wheelhouse/generic/tensorboard-2.3.0+computecanada-py3-none-any.whl
Processing /cvmfs/soft.computecanada.ca/custom/python/wheelhouse/generic/tensorboard_plugin_wit-1.7.0+computecanada-py3-none-any.whl
Processing /cvmfs/soft.computecanada.ca/custom/python/wheelhouse/generic/tensorflow_gpu-2.3.0+computecanada-cp37-cp37m-linux_x86_64.whl
Processing /cvmfs/soft.computecanada.ca/custom/python/wheelhouse/generic/tensorflow_estimator-2.3.0+computecanada-py2.py3-none-any.whl
Processing /cvmfs/soft.computecanada.ca/custom/python/wheelhouse/generic/tokenizers-0.5.2+computecanada-cp37-cp37m-linux_x86_64.whl
Processing /cvmfs/soft.computecanada.ca/custom/python/wheelhouse/nix/avx2/torch-1.4.0+computecanada-cp37-cp37m-linux_x86_64.whl
Processing /cvmfs/soft.computecanada.ca/custom/python/wheelhouse/generic/torchtext-0.6.0+computecanada-py3-none-any.whl
Processing /cvmfs/soft.computecanada.ca/custom/python/wheelhouse/generic/torchvision-0.8.2+computecanada-cp37-cp37m-linux_x86_64.whl
Processing /cvmfs/soft.computecanada.ca/custom/python/wheelhouse/generic/transformers-2.5.1+computecanada-py3-none-any.whl
Processing /cvmfs/soft.computecanada.ca/custom/python/wheelhouse/generic/urllib3-1.26.7+computecanada-py2.py3-none-any.whl
Processing /cvmfs/soft.computecanada.ca/custom/python/wheelhouse/generic/tqdm-4.63.0+computecanada-py2.py3-none-any.whl
ERROR: Could not find a version that satisfies the requirement regex>=2021.8.3 (from nltk) (from versions: 2018.1.10+computecanada, 2019.11.1+computecanada, 2020.11.13+computecanada)
ERROR: No matching distribution found for regex>=2021.8.3
Looking in links: /cvmfs/soft.computecanada.ca/custom/python/wheelhouse/nix/avx2, /cvmfs/soft.computecanada.ca/custom/python/wheelhouse/nix/generic, /cvmfs/soft.computecanada.ca/custom/python/wheelhouse/generic
ERROR: Could not find a version that satisfies the requirement numpy==1.20.0+computacanada (from versions: 1.15.0+computecanada, 1.15.2+computecanada, 1.15.4+computecanada, 1.16.0+computecanada, 1.16.2+computecanada, 1.16.3+computecanada, 1.17.4+computecanada, 1.18.1+computecanada, 1.18.4+computecanada, 1.19.1+computecanada, 1.19.2+computecanada, 1.20.2+computecanada)
ERROR: No matching distribution found for numpy==1.20.0+computacanada
Looking in links: /cvmfs/soft.computecanada.ca/custom/python/wheelhouse/nix/avx2, /cvmfs/soft.computecanada.ca/custom/python/wheelhouse/nix/generic, /cvmfs/soft.computecanada.ca/custom/python/wheelhouse/generic
Processing /cvmfs/soft.computecanada.ca/custom/python/wheelhouse/generic/wandb-0.12.5+computecanada-py2.py3-none-any.whl
Processing /cvmfs/soft.computecanada.ca/custom/python/wheelhouse/generic/pathtools-0.1.2+computecanada-py3-none-any.whl
Processing /cvmfs/soft.computecanada.ca/custom/python/wheelhouse/generic/docker_pycreds-0.4.0+computecanada-py2.py3-none-any.whl
Processing /cvmfs/soft.computecanada.ca/custom/python/wheelhouse/generic/promise-2.3+computecanada-py3-none-any.whl
Processing /cvmfs/soft.computecanada.ca/custom/python/wheelhouse/generic/protobuf-3.19.4+computecanada-py2.py3-none-any.whl
Requirement already satisfied: requests<3,>=2.0.0 in /cvmfs/soft.computecanada.ca/easybuild/software/2017/Core/scipy-stack/2019a/lib/python3.7/site-packages (from wandb) (2.21.0)
Requirement already satisfied: python-dateutil>=2.6.1 in /cvmfs/soft.computecanada.ca/easybuild/software/2017/Core/scipy-stack/2019a/lib/python3.7/site-packages (from wandb) (2.7.5)
Processing /cvmfs/soft.computecanada.ca/custom/python/wheelhouse/generic/PyYAML-5.3.1+computecanada-cp37-cp37m-linux_x86_64.whl
Processing /cvmfs/soft.computecanada.ca/custom/python/wheelhouse/generic/click-8.0.3+computecanada-py3-none-any.whl
Processing /cvmfs/soft.computecanada.ca/custom/python/wheelhouse/generic/configparser-5.0.2+computecanada-py3-none-any.whl
Processing /cvmfs/soft.computecanada.ca/custom/python/wheelhouse/generic/six-1.16.0+computecanada-py2.py3-none-any.whl
Processing /cvmfs/soft.computecanada.ca/custom/python/wheelhouse/generic/psutil-5.7.3+computecanada-cp37-cp37m-linux_x86_64.whl
Processing /cvmfs/soft.computecanada.ca/custom/python/wheelhouse/generic/GitPython-3.1.24+computecanada-py3-none-any.whl
Processing /cvmfs/soft.computecanada.ca/custom/python/wheelhouse/generic/sentry_sdk-1.5.0+computecanada-py2.py3-none-any.whl
Processing /cvmfs/soft.computecanada.ca/custom/python/wheelhouse/generic/shortuuid-1.0.1+computecanada-py3-none-any.whl
Processing /cvmfs/soft.computecanada.ca/custom/python/wheelhouse/generic/subprocess32-3.5.4+computecanada-py3-none-any.whl
Processing /cvmfs/soft.computecanada.ca/custom/python/wheelhouse/generic/yaspin-2.1.0+computecanada-py3-none-any.whl
Requirement already satisfied: importlib-metadata in /cvmfs/soft.computecanada.ca/easybuild/software/2017/Core/scipy-stack/2019a/lib/python3.7/site-packages (from Click!=8.0.0,>=7.0->wandb) (0.8)
Processing /cvmfs/soft.computecanada.ca/custom/python/wheelhouse/generic/gitdb-4.0.9+computecanada-py3-none-any.whl
Processing /cvmfs/soft.computecanada.ca/custom/python/wheelhouse/generic/typing_extensions-4.0.1+computecanada-py3-none-any.whl
Processing /cvmfs/soft.computecanada.ca/custom/python/wheelhouse/generic/smmap-5.0.0+computecanada-py3-none-any.whl
Requirement already satisfied: idna<2.9,>=2.5 in /cvmfs/soft.computecanada.ca/easybuild/software/2017/Core/scipy-stack/2019a/lib/python3.7/site-packages (from requests<3,>=2.0.0->wandb) (2.8)
Requirement already satisfied: certifi>=2017.4.17 in /cvmfs/soft.computecanada.ca/easybuild/software/2017/Core/scipy-stack/2019a/lib/python3.7/site-packages (from requests<3,>=2.0.0->wandb) (2018.11.29)
Requirement already satisfied: urllib3<1.25,>=1.21.1 in /cvmfs/soft.computecanada.ca/easybuild/software/2017/Core/scipy-stack/2019a/lib/python3.7/site-packages (from requests<3,>=2.0.0->wandb) (1.24.1)
Requirement already satisfied: chardet<3.1.0,>=3.0.2 in /cvmfs/soft.computecanada.ca/easybuild/software/2017/Core/scipy-stack/2019a/lib/python3.7/site-packages (from requests<3,>=2.0.0->wandb) (3.0.4)
Processing /cvmfs/soft.computecanada.ca/custom/python/wheelhouse/generic/termcolor-1.1.0+computecanada-py3-none-any.whl
Requirement already satisfied: zipp>=0.3.2 in /cvmfs/soft.computecanada.ca/easybuild/software/2017/Core/scipy-stack/2019a/lib/python3.7/site-packages (from importlib-metadata->Click!=8.0.0,>=7.0->wandb) (0.3.3)
Installing collected packages: smmap, typing-extensions, termcolor, six, gitdb, yaspin, subprocess32, shortuuid, sentry-sdk, PyYAML, psutil, protobuf, promise, pathtools, GitPython, docker-pycreds, configparser, Click, wandb
  Attempting uninstall: six
    Found existing installation: six 1.12.0
    Not uninstalling six at /cvmfs/soft.computecanada.ca/easybuild/software/2017/Core/scipy-stack/2019a/lib/python3.7/site-packages, outside environment /localscratch/yinan.28698742.0/env
    Can't uninstall 'six'. No files were found to uninstall.
Successfully installed Click-8.0.3+computecanada GitPython-3.1.24+computecanada PyYAML-5.3.1+computecanada configparser-5.0.2+computecanada docker-pycreds-0.4.0+computecanada gitdb-4.0.9+computecanada pathtools-0.1.2+computecanada promise-2.3+computecanada protobuf-3.19.4+computecanada psutil-5.7.3+computecanada sentry-sdk-1.5.0+computecanada shortuuid-1.0.1+computecanada six-1.16.0+computecanada smmap-5.0.0+computecanada subprocess32-3.5.4+computecanada termcolor-1.1.0+computecanada typing-extensions-4.0.1+computecanada wandb-0.12.5+computecanada yaspin-2.1.0+computecanada
Looking in links: /cvmfs/soft.computecanada.ca/custom/python/wheelhouse/nix/avx2, /cvmfs/soft.computecanada.ca/custom/python/wheelhouse/nix/generic, /cvmfs/soft.computecanada.ca/custom/python/wheelhouse/generic
ERROR: Could not find a version that satisfies the requirement sagemaker (from versions: none)
ERROR: No matching distribution found for sagemaker
Looking in links: /cvmfs/soft.computecanada.ca/custom/python/wheelhouse/nix/avx2, /cvmfs/soft.computecanada.ca/custom/python/wheelhouse/nix/generic, /cvmfs/soft.computecanada.ca/custom/python/wheelhouse/generic
Processing /cvmfs/soft.computecanada.ca/custom/python/wheelhouse/generic/torch-1.9.1+computecanada-cp37-cp37m-linux_x86_64.whl
Requirement already satisfied: typing-extensions in /localscratch/yinan.28698742.0/env/lib/python3.7/site-packages (from torch) (4.0.1+computecanada)
Installing collected packages: torch
Successfully installed torch-1.9.1+computecanada
Looking in links: /cvmfs/soft.computecanada.ca/custom/python/wheelhouse/nix/avx2, /cvmfs/soft.computecanada.ca/custom/python/wheelhouse/nix/generic, /cvmfs/soft.computecanada.ca/custom/python/wheelhouse/generic
Processing /cvmfs/soft.computecanada.ca/custom/python/wheelhouse/generic/transformers-2.5.1+computecanada-py3-none-any.whl
Processing /cvmfs/soft.computecanada.ca/custom/python/wheelhouse/generic/filelock-3.4.2+computecanada-py3-none-any.whl
Processing /cvmfs/soft.computecanada.ca/custom/python/wheelhouse/generic/tokenizers-0.5.2+computecanada-cp37-cp37m-linux_x86_64.whl
Requirement already satisfied: requests in /cvmfs/soft.computecanada.ca/easybuild/software/2017/Core/scipy-stack/2019a/lib/python3.7/site-packages (from transformers==2.5.1+computecanada) (2.21.0)
Requirement already satisfied: numpy in /cvmfs/soft.computecanada.ca/easybuild/software/2017/Core/scipy-stack/2019a/lib/python3.7/site-packages (from transformers==2.5.1+computecanada) (1.16.0)
Processing /cvmfs/soft.computecanada.ca/custom/python/wheelhouse/generic/sentencepiece-0.1.91+computecanada-cp37-cp37m-linux_x86_64.whl
Processing /cvmfs/soft.computecanada.ca/custom/python/wheelhouse/generic/tqdm-4.63.0+computecanada-py2.py3-none-any.whl
Processing /cvmfs/soft.computecanada.ca/custom/python/wheelhouse/generic/boto3-1.20.52+computecanada-py3-none-any.whl
Processing /cvmfs/soft.computecanada.ca/custom/python/wheelhouse/generic/regex-2020.11.13+computecanada-cp37-cp37m-linux_x86_64.whl
Processing /cvmfs/soft.computecanada.ca/custom/python/wheelhouse/generic/sacremoses-0.0.46+computecanada-py3-none-any.whl
Processing /cvmfs/soft.computecanada.ca/custom/python/wheelhouse/generic/s3transfer-0.5.1+computecanada-py3-none-any.whl
Processing /cvmfs/soft.computecanada.ca/custom/python/wheelhouse/generic/jmespath-0.10.0+computecanada-py2.py3-none-any.whl
Processing /cvmfs/soft.computecanada.ca/custom/python/wheelhouse/generic/botocore-1.23.52+computecanada-py3-none-any.whl
Requirement already satisfied: python-dateutil<3.0.0,>=2.1 in /cvmfs/soft.computecanada.ca/easybuild/software/2017/Core/scipy-stack/2019a/lib/python3.7/site-packages (from botocore<1.24.0,>=1.23.52->boto3->transformers==2.5.1+computecanada) (2.7.5)
Processing /cvmfs/soft.computecanada.ca/custom/python/wheelhouse/generic/urllib3-1.26.8+computecanada-py2.py3-none-any.whl
Requirement already satisfied: six>=1.5 in /localscratch/yinan.28698742.0/env/lib/python3.7/site-packages (from python-dateutil<3.0.0,>=2.1->botocore<1.24.0,>=1.23.52->boto3->transformers==2.5.1+computecanada) (1.16.0+computecanada)
Processing /cvmfs/soft.computecanada.ca/custom/python/wheelhouse/generic/requests-2.27.1+computecanada-py2.py3-none-any.whl
Processing /cvmfs/soft.computecanada.ca/custom/python/wheelhouse/generic/charset_normalizer-2.0.11+computecanada-py3-none-any.whl
Requirement already satisfied: certifi>=2017.4.17 in /cvmfs/soft.computecanada.ca/easybuild/software/2017/Core/scipy-stack/2019a/lib/python3.7/site-packages (from requests->transformers==2.5.1+computecanada) (2018.11.29)
Requirement already satisfied: idna<4,>=2.5 in /cvmfs/soft.computecanada.ca/easybuild/software/2017/Core/scipy-stack/2019a/lib/python3.7/site-packages (from requests->transformers==2.5.1+computecanada) (2.8)
Requirement already satisfied: click in /localscratch/yinan.28698742.0/env/lib/python3.7/site-packages (from sacremoses->transformers==2.5.1+computecanada) (8.0.3+computecanada)
Processing /cvmfs/soft.computecanada.ca/custom/python/wheelhouse/generic/joblib-1.1.0+computecanada-py2.py3-none-any.whl
Requirement already satisfied: importlib-metadata in /cvmfs/soft.computecanada.ca/easybuild/software/2017/Core/scipy-stack/2019a/lib/python3.7/site-packages (from click->sacremoses->transformers==2.5.1+computecanada) (0.8)
Requirement already satisfied: zipp>=0.3.2 in /cvmfs/soft.computecanada.ca/easybuild/software/2017/Core/scipy-stack/2019a/lib/python3.7/site-packages (from importlib-metadata->click->sacremoses->transformers==2.5.1+computecanada) (0.3.3)
Installing collected packages: urllib3, jmespath, botocore, tqdm, s3transfer, regex, joblib, charset-normalizer, tokenizers, sentencepiece, sacremoses, requests, filelock, boto3, transformers
  Attempting uninstall: urllib3
    Found existing installation: urllib3 1.24.1
    Not uninstalling urllib3 at /cvmfs/soft.computecanada.ca/easybuild/software/2017/Core/scipy-stack/2019a/lib/python3.7/site-packages, outside environment /localscratch/yinan.28698742.0/env
    Can't uninstall 'urllib3'. No files were found to uninstall.
  Attempting uninstall: requests
    Found existing installation: requests 2.21.0
    Not uninstalling requests at /cvmfs/soft.computecanada.ca/easybuild/software/2017/Core/scipy-stack/2019a/lib/python3.7/site-packages, outside environment /localscratch/yinan.28698742.0/env
    Can't uninstall 'requests'. No files were found to uninstall.
Successfully installed boto3-1.20.52+computecanada botocore-1.23.52+computecanada charset-normalizer-2.0.11+computecanada filelock-3.4.2+computecanada jmespath-0.10.0+computecanada joblib-1.1.0+computecanada regex-2020.11.13+computecanada requests-2.27.1+computecanada s3transfer-0.5.1+computecanada sacremoses-0.0.46+computecanada sentencepiece-0.1.91+computecanada tokenizers-0.5.2+computecanada tqdm-4.63.0+computecanada transformers-2.5.1+computecanada urllib3-1.26.8+computecanada
Looking in links: /cvmfs/soft.computecanada.ca/custom/python/wheelhouse/nix/avx2, /cvmfs/soft.computecanada.ca/custom/python/wheelhouse/nix/generic, /cvmfs/soft.computecanada.ca/custom/python/wheelhouse/generic
Processing /cvmfs/soft.computecanada.ca/custom/python/wheelhouse/generic/tensorflow_gpu-2.3.0+computecanada-cp37-cp37m-linux_x86_64.whl
Processing /cvmfs/soft.computecanada.ca/custom/python/wheelhouse/generic/opt_einsum-3.3.0+computecanada-py3-none-any.whl
Requirement already satisfied: six>=1.12.0 in /localscratch/yinan.28698742.0/env/lib/python3.7/site-packages (from tensorflow_gpu==2.3.0+computecanada) (1.16.0+computecanada)
Requirement already satisfied: termcolor>=1.1.0 in /localscratch/yinan.28698742.0/env/lib/python3.7/site-packages (from tensorflow_gpu==2.3.0+computecanada) (1.1.0+computecanada)
Processing /cvmfs/soft.computecanada.ca/custom/python/wheelhouse/nix/avx2/h5py-2.10.0+computecanada-cp37-cp37m-linux_x86_64.whl
Processing /cvmfs/soft.computecanada.ca/custom/python/wheelhouse/generic/absl_py-1.0.0+computecanada-py3-none-any.whl
Requirement already satisfied: protobuf>=3.9.2 in /localscratch/yinan.28698742.0/env/lib/python3.7/site-packages (from tensorflow_gpu==2.3.0+computecanada) (3.19.4+computecanada)
Requirement already satisfied: wheel>=0.26 in /localscratch/yinan.28698742.0/env/lib/python3.7/site-packages (from tensorflow_gpu==2.3.0+computecanada) (0.33.4)
Processing /cvmfs/soft.computecanada.ca/custom/python/wheelhouse/generic/gast-0.3.3+computecanada-py3-none-any.whl
Requirement already satisfied: numpy<1.19.0,>=1.16.0 in /cvmfs/soft.computecanada.ca/easybuild/software/2017/Core/scipy-stack/2019a/lib/python3.7/site-packages (from tensorflow_gpu==2.3.0+computecanada) (1.16.0)
Processing /cvmfs/soft.computecanada.ca/custom/python/wheelhouse/generic/tensorflow_estimator-2.3.0+computecanada-py2.py3-none-any.whl
Processing /cvmfs/soft.computecanada.ca/custom/python/wheelhouse/nix/generic/scipy-1.4.1+computecanada-cp37-cp37m-linux_x86_64.whl
Processing /cvmfs/soft.computecanada.ca/custom/python/wheelhouse/generic/grpcio-1.38.0+computecanada-cp37-cp37m-linux_x86_64.whl
Processing /cvmfs/soft.computecanada.ca/custom/python/wheelhouse/generic/astunparse-1.6.3+computecanada-py2.py3-none-any.whl
Processing /cvmfs/soft.computecanada.ca/custom/python/wheelhouse/generic/tensorboard-2.8.0+computecanada-py3-none-any.whl
Processing /cvmfs/soft.computecanada.ca/custom/python/wheelhouse/generic/wrapt-1.11.2+computecanada-cp37-cp37m-linux_x86_64.whl
Processing /cvmfs/soft.computecanada.ca/custom/python/wheelhouse/generic/Keras_Preprocessing-1.1.2+computecanada-py3-none-any.whl
Processing /cvmfs/soft.computecanada.ca/custom/python/wheelhouse/generic/google_pasta-0.2.0+computecanada-py3-none-any.whl
Processing /cvmfs/soft.computecanada.ca/custom/python/wheelhouse/generic/tensorboard_plugin_wit-1.8.0+computecanada-py3-none-any.whl
Processing /cvmfs/soft.computecanada.ca/custom/python/wheelhouse/generic/Werkzeug-2.0.3+computecanada-py3-none-any.whl
Requirement already satisfied: requests<3,>=2.21.0 in /localscratch/yinan.28698742.0/env/lib/python3.7/site-packages (from tensorboard<3,>=2.3.0->tensorflow_gpu==2.3.0+computecanada) (2.27.1+computecanada)
Processing /cvmfs/soft.computecanada.ca/custom/python/wheelhouse/generic/tensorboard_data_server-0.6.1+computecanada-py3-none-linux_x86_64.whl
Processing /cvmfs/soft.computecanada.ca/custom/python/wheelhouse/generic/Markdown-3.3.6+computecanada-py3-none-any.whl
Requirement already satisfied: setuptools>=41.0.0 in /localscratch/yinan.28698742.0/env/lib/python3.7/site-packages (from tensorboard<3,>=2.3.0->tensorflow_gpu==2.3.0+computecanada) (41.0.1)
Processing /cvmfs/soft.computecanada.ca/custom/python/wheelhouse/generic/google_auth-2.3.3+computecanada-py2.py3-none-any.whl
Processing /cvmfs/soft.computecanada.ca/custom/python/wheelhouse/generic/google_auth_oauthlib-0.4.6+computecanada-py2.py3-none-any.whl
Processing /cvmfs/soft.computecanada.ca/custom/python/wheelhouse/generic/cachetools-4.2.4+computecanada-py3-none-any.whl
Processing /cvmfs/soft.computecanada.ca/custom/python/wheelhouse/generic/rsa-4.8+computecanada-py3-none-any.whl
Processing /cvmfs/soft.computecanada.ca/custom/python/wheelhouse/generic/pyasn1_modules-0.2.8+computecanada-py2.py3-none-any.whl
Processing /cvmfs/soft.computecanada.ca/custom/python/wheelhouse/generic/requests_oauthlib-1.3.0+computecanada-py2.py3-none-any.whl
Processing /cvmfs/soft.computecanada.ca/custom/python/wheelhouse/generic/importlib_metadata-4.10.1+computecanada-py3-none-any.whl
Processing /cvmfs/soft.computecanada.ca/custom/python/wheelhouse/generic/zipp-3.7.0+computecanada-py3-none-any.whl
Requirement already satisfied: typing-extensions>=3.6.4 in /localscratch/yinan.28698742.0/env/lib/python3.7/site-packages (from importlib-metadata>=4.4->markdown>=2.6.8->tensorboard<3,>=2.3.0->tensorflow_gpu==2.3.0+computecanada) (4.0.1+computecanada)
Processing /cvmfs/soft.computecanada.ca/custom/python/wheelhouse/generic/pyasn1-0.4.8+computecanada-py2.py3-none-any.whl
Requirement already satisfied: certifi>=2017.4.17 in /cvmfs/soft.computecanada.ca/easybuild/software/2017/Core/scipy-stack/2019a/lib/python3.7/site-packages (from requests<3,>=2.21.0->tensorboard<3,>=2.3.0->tensorflow_gpu==2.3.0+computecanada) (2018.11.29)
Requirement already satisfied: idna<4,>=2.5 in /cvmfs/soft.computecanada.ca/easybuild/software/2017/Core/scipy-stack/2019a/lib/python3.7/site-packages (from requests<3,>=2.21.0->tensorboard<3,>=2.3.0->tensorflow_gpu==2.3.0+computecanada) (2.8)
Requirement already satisfied: charset-normalizer~=2.0.0 in /localscratch/yinan.28698742.0/env/lib/python3.7/site-packages (from requests<3,>=2.21.0->tensorboard<3,>=2.3.0->tensorflow_gpu==2.3.0+computecanada) (2.0.11+computecanada)
Requirement already satisfied: urllib3<1.27,>=1.21.1 in /localscratch/yinan.28698742.0/env/lib/python3.7/site-packages (from requests<3,>=2.21.0->tensorboard<3,>=2.3.0->tensorflow_gpu==2.3.0+computecanada) (1.26.8+computecanada)
Processing /cvmfs/soft.computecanada.ca/custom/python/wheelhouse/generic/oauthlib-3.1.1+computecanada-py2.py3-none-any.whl
Installing collected packages: pyasn1, zipp, rsa, pyasn1-modules, oauthlib, cachetools, requests-oauthlib, importlib-metadata, google-auth, werkzeug, tensorboard-plugin-wit, tensorboard-data-server, markdown, grpcio, google-auth-oauthlib, absl-py, wrapt, tensorflow-estimator, tensorboard, scipy, opt-einsum, keras-preprocessing, h5py, google-pasta, gast, astunparse, tensorflow-gpu
  Attempting uninstall: pyasn1
    Found existing installation: pyasn1 0.4.3
    Not uninstalling pyasn1 at /cvmfs/soft.computecanada.ca/easybuild/software/2017/Core/scipy-stack/2019a/lib/python3.7/site-packages, outside environment /localscratch/yinan.28698742.0/env
    Can't uninstall 'pyasn1'. No files were found to uninstall.
  Attempting uninstall: zipp
    Found existing installation: zipp 0.3.3
    Not uninstalling zipp at /cvmfs/soft.computecanada.ca/easybuild/software/2017/Core/scipy-stack/2019a/lib/python3.7/site-packages, outside environment /localscratch/yinan.28698742.0/env
    Can't uninstall 'zipp'. No files were found to uninstall.
  Attempting uninstall: importlib-metadata
    Found existing installation: importlib-metadata 0.8
    Not uninstalling importlib-metadata at /cvmfs/soft.computecanada.ca/easybuild/software/2017/Core/scipy-stack/2019a/lib/python3.7/site-packages, outside environment /localscratch/yinan.28698742.0/env
    Can't uninstall 'importlib-metadata'. No files were found to uninstall.
  Attempting uninstall: scipy
    Found existing installation: scipy 1.2.0
    Not uninstalling scipy at /cvmfs/soft.computecanada.ca/easybuild/software/2017/Core/scipy-stack/2019a/lib/python3.7/site-packages, outside environment /localscratch/yinan.28698742.0/env
    Can't uninstall 'scipy'. No files were found to uninstall.
Successfully installed absl-py-1.0.0+computecanada astunparse-1.6.3+computecanada cachetools-4.2.4+computecanada gast-0.3.3+computecanada google-auth-2.3.3+computecanada google-auth-oauthlib-0.4.6+computecanada google-pasta-0.2.0+computecanada grpcio-1.38.0+computecanada h5py-2.10.0+computecanada importlib-metadata-4.10.1+computecanada keras-preprocessing-1.1.2+computecanada markdown-3.3.6+computecanada oauthlib-3.1.1+computecanada opt-einsum-3.3.0+computecanada pyasn1-0.4.8+computecanada pyasn1-modules-0.2.8+computecanada requests-oauthlib-1.3.0+computecanada rsa-4.8+computecanada scipy-1.4.1+computecanada tensorboard-2.8.0+computecanada tensorboard-data-server-0.6.1+computecanada tensorboard-plugin-wit-1.8.0+computecanada tensorflow-estimator-2.3.0+computecanada tensorflow-gpu-2.3.0+computecanada werkzeug-2.0.3+computecanada wrapt-1.11.2+computecanada zipp-3.7.0+computecanada
Looking in links: /cvmfs/soft.computecanada.ca/custom/python/wheelhouse/nix/avx2, /cvmfs/soft.computecanada.ca/custom/python/wheelhouse/nix/generic, /cvmfs/soft.computecanada.ca/custom/python/wheelhouse/generic
Processing /cvmfs/soft.computecanada.ca/custom/python/wheelhouse/generic/keras-2.8.0+computecanada-py2.py3-none-any.whl
Installing collected packages: Keras
Successfully installed Keras-2.8.0+computecanada
Looking in links: /cvmfs/soft.computecanada.ca/custom/python/wheelhouse/nix/avx2, /cvmfs/soft.computecanada.ca/custom/python/wheelhouse/nix/generic, /cvmfs/soft.computecanada.ca/custom/python/wheelhouse/generic
Processing /cvmfs/soft.computecanada.ca/custom/python/wheelhouse/generic/urllib3-1.26.7+computecanada-py2.py3-none-any.whl
Installing collected packages: urllib3
  Attempting uninstall: urllib3
    Found existing installation: urllib3 1.26.8+computecanada
    Uninstalling urllib3-1.26.8+computecanada:
      Successfully uninstalled urllib3-1.26.8+computecanada
Successfully installed urllib3-1.26.7+computecanada
Looking in links: /cvmfs/soft.computecanada.ca/custom/python/wheelhouse/nix/avx2, /cvmfs/soft.computecanada.ca/custom/python/wheelhouse/nix/generic, /cvmfs/soft.computecanada.ca/custom/python/wheelhouse/generic
Processing /cvmfs/soft.computecanada.ca/custom/python/wheelhouse/generic/nltk-3.7+computecanada-py3-none-any.whl
Processing /cvmfs/soft.computecanada.ca/custom/python/wheelhouse/generic/nltk-3.6.5+computecanada-py3-none-any.whl
Processing /cvmfs/soft.computecanada.ca/custom/python/wheelhouse/generic/nltk-3.6.3+computecanada-py3-none-any.whl
Requirement already satisfied: regex in /localscratch/yinan.28698742.0/env/lib/python3.7/site-packages (from nltk) (2020.11.13+computecanada)
Requirement already satisfied: tqdm in /localscratch/yinan.28698742.0/env/lib/python3.7/site-packages (from nltk) (4.63.0+computecanada)
Requirement already satisfied: click in /localscratch/yinan.28698742.0/env/lib/python3.7/site-packages (from nltk) (8.0.3+computecanada)
Requirement already satisfied: joblib in /localscratch/yinan.28698742.0/env/lib/python3.7/site-packages (from nltk) (1.1.0+computecanada)
Requirement already satisfied: importlib-metadata in /localscratch/yinan.28698742.0/env/lib/python3.7/site-packages (from click->nltk) (4.10.1+computecanada)
Requirement already satisfied: zipp>=0.5 in /localscratch/yinan.28698742.0/env/lib/python3.7/site-packages (from importlib-metadata->click->nltk) (3.7.0+computecanada)
Requirement already satisfied: typing-extensions>=3.6.4 in /localscratch/yinan.28698742.0/env/lib/python3.7/site-packages (from importlib-metadata->click->nltk) (4.0.1+computecanada)
Installing collected packages: nltk
Successfully installed nltk-3.6.3+computecanada
Looking in links: /cvmfs/soft.computecanada.ca/custom/python/wheelhouse/nix/avx2, /cvmfs/soft.computecanada.ca/custom/python/wheelhouse/nix/generic, /cvmfs/soft.computecanada.ca/custom/python/wheelhouse/generic
Processing /cvmfs/soft.computecanada.ca/custom/python/wheelhouse/generic/scikit_learn-0.22.1+computecanada-cp37-cp37m-linux_x86_64.whl
Requirement already satisfied: numpy>=1.11.0 in /cvmfs/soft.computecanada.ca/easybuild/software/2017/Core/scipy-stack/2019a/lib/python3.7/site-packages (from scikit-learn==0.22.1) (1.16.0)
Requirement already satisfied: joblib>=0.11 in /localscratch/yinan.28698742.0/env/lib/python3.7/site-packages (from scikit-learn==0.22.1) (1.1.0+computecanada)
Requirement already satisfied: scipy>=0.17.0 in /localscratch/yinan.28698742.0/env/lib/python3.7/site-packages (from scikit-learn==0.22.1) (1.4.1+computecanada)
Installing collected packages: scikit-learn
Successfully installed scikit-learn-0.22.1+computecanada
Looking in links: /cvmfs/soft.computecanada.ca/custom/python/wheelhouse/nix/avx2, /cvmfs/soft.computecanada.ca/custom/python/wheelhouse/nix/generic, /cvmfs/soft.computecanada.ca/custom/python/wheelhouse/generic
Requirement already satisfied: tokenizers==0.5.2 in /localscratch/yinan.28698742.0/env/lib/python3.7/site-packages (0.5.2+computecanada)
wandb: Appending key for api.wandb.ai to your netrc file: /home/yinan/.netrc
Starting Task
2022-03-11 10:16:08.817390: I tensorflow/stream_executor/platform/default/dso_loader.cc:48] Successfully opened dynamic library libcudart.so.10.1
[nltk_data] Downloading package stopwords to /home/yinan/nltk_data...
[nltk_data]   Package stopwords is already up-to-date!
[nltk_data] Downloading package wordnet to /home/yinan/nltk_data...
[nltk_data]   Package wordnet is already up-to-date!
wandb: Currently logged in as: yinanazhou (use `wandb login --relogin` to force relogin)
wandb: wandb version 0.12.11 is available!  To upgrade, please run:
wandb:  $ pip install wandb --upgrade
2022-03-11 10:16:28.192831: I tensorflow/stream_executor/platform/default/dso_loader.cc:48] Successfully opened dynamic library libcudart.so.10.1
wandb: Tracking run with wandb version 0.12.5
wandb: Syncing run lively-waterfall-1
wandb: ⭐️ View project at https://wandb.ai/yinanazhou/xl_512_bs_8_lr_1e07_es_15_lc_False_nr_True_sr_False_stem_True_lemma_False_repeat_1_fold_1
wandb: 🚀 View run at https://wandb.ai/yinanazhou/xl_512_bs_8_lr_1e07_es_15_lc_False_nr_True_sr_False_stem_True_lemma_False_repeat_1_fold_1/runs/uyhv394i
wandb: Run data is saved locally in /project/6002780/yinan/Thesis_MER_Lyrics/lyric-emotion/wandb/run-20220311_101625-uyhv394i
wandb: Run `wandb offline` to turn off syncing.

Validation loss decreased (inf --> 1.451984).  Saving model ...
Validation loss decreased (1.451984 --> 1.449365).  Saving model ...
Validation loss decreased (1.449365 --> 1.446598).  Saving model ...
Validation loss decreased (1.446598 --> 1.443856).  Saving model ...
Validation loss decreased (1.443856 --> 1.441258).  Saving model ...
Validation loss decreased (1.441258 --> 1.438756).  Saving model ...
Validation loss decreased (1.438756 --> 1.436372).  Saving model ...
Validation loss decreased (1.436372 --> 1.434169).  Saving model ...
Validation loss decreased (1.434169 --> 1.431962).  Saving model ...
Validation loss decreased (1.431962 --> 1.429605).  Saving model ...
Validation loss decreased (1.429605 --> 1.427371).  Saving model ...
Validation loss decreased (1.427371 --> 1.425307).  Saving model ...
Validation loss decreased (1.425307 --> 1.423272).  Saving model ...
Validation loss decreased (1.423272 --> 1.421205).  Saving model ...
Validation loss decreased (1.421205 --> 1.419191).  Saving model ...
Validation loss decreased (1.419191 --> 1.417343).  Saving model ...
Validation loss decreased (1.417343 --> 1.415448).  Saving model ...
Validation loss decreased (1.415448 --> 1.413552).  Saving model ...
Validation loss decreased (1.413552 --> 1.411746).  Saving model ...
Validation loss decreased (1.411746 --> 1.409929).  Saving model ...
Validation loss decreased (1.409929 --> 1.408088).  Saving model ...
Validation loss decreased (1.408088 --> 1.406433).  Saving model ...
Validation loss decreased (1.406433 --> 1.404797).  Saving model ...
Validation loss decreased (1.404797 --> 1.403320).  Saving model ...
Validation loss decreased (1.403320 --> 1.401847).  Saving model ...
Validation loss decreased (1.401847 --> 1.400287).  Saving model ...
Validation loss decreased (1.400287 --> 1.398847).  Saving model ...
Validation loss decreased (1.398847 --> 1.397353).  Saving model ...
Validation loss decreased (1.397353 --> 1.395989).  Saving model ...
Validation loss decreased (1.395989 --> 1.394646).  Saving model ...
Validation loss decreased (1.394646 --> 1.393344).  Saving model ...
Validation loss decreased (1.393344 --> 1.391931).  Saving model ...
Validation loss decreased (1.391931 --> 1.390693).  Saving model ...
Validation loss decreased (1.390693 --> 1.389435).  Saving model ...
Validation loss decreased (1.389435 --> 1.388248).  Saving model ...
Validation loss decreased (1.388248 --> 1.386976).  Saving model ...
Validation loss decreased (1.386976 --> 1.385804).  Saving model ...
Validation loss decreased (1.385804 --> 1.384681).  Saving model ...
Validation loss decreased (1.384681 --> 1.383472).  Saving model ...
Validation loss decreased (1.383472 --> 1.382373).  Saving model ...
Validation loss decreased (1.382373 --> 1.381318).  Saving model ...
Validation loss decreased (1.381318 --> 1.380243).  Saving model ...
Validation loss decreased (1.380243 --> 1.379209).  Saving model ...
Validation loss decreased (1.379209 --> 1.378176).  Saving model ...
Validation loss decreased (1.378176 --> 1.377027).  Saving model ...
Validation loss decreased (1.377027 --> 1.376035).  Saving model ...
Validation loss decreased (1.376035 --> 1.375026).  Saving model ...
Validation loss decreased (1.375026 --> 1.374100).  Saving model ...
Validation loss decreased (1.374100 --> 1.373143).  Saving model ...
Validation loss decreased (1.373143 --> 1.372257).  Saving model ...
Validation loss decreased (1.372257 --> 1.371394).  Saving model ...
Validation loss decreased (1.371394 --> 1.370605).  Saving model ...
Validation loss decreased (1.370605 --> 1.369666).  Saving model ...
Validation loss decreased (1.369666 --> 1.368759).  Saving model ...
Validation loss decreased (1.368759 --> 1.367942).  Saving model ...
Validation loss decreased (1.367942 --> 1.367130).  Saving model ...
Validation loss decreased (1.367130 --> 1.366268).  Saving model ...
Validation loss decreased (1.366268 --> 1.365406).  Saving model ...
Validation loss decreased (1.365406 --> 1.364504).  Saving model ...
Validation loss decreased (1.364504 --> 1.363799).  Saving model ...
Validation loss decreased (1.363799 --> 1.363000).  Saving model ...
Validation loss decreased (1.363000 --> 1.362213).  Saving model ...
Validation loss decreased (1.362213 --> 1.361411).  Saving model ...
Validation loss decreased (1.361411 --> 1.360611).  Saving model ...
Validation loss decreased (1.360611 --> 1.359924).  Saving model ...
Validation loss decreased (1.359924 --> 1.359118).  Saving model ...
Validation loss decreased (1.359118 --> 1.358467).  Saving model ...
Validation loss decreased (1.358467 --> 1.357790).  Saving model ...
Validation loss decreased (1.357790 --> 1.357092).  Saving model ...
Validation loss decreased (1.357092 --> 1.356463).  Saving model ...
Validation loss decreased (1.356463 --> 1.355809).  Saving model ...
Validation loss decreased (1.355809 --> 1.355107).  Saving model ...
Validation loss decreased (1.355107 --> 1.354446).  Saving model ...
Validation loss decreased (1.354446 --> 1.353769).  Saving model ...
Validation loss decreased (1.353769 --> 1.353155).  Saving model ...
Validation loss decreased (1.353155 --> 1.352556).  Saving model ...
Validation loss decreased (1.352556 --> 1.351975).  Saving model ...
Validation loss decreased (1.351975 --> 1.351363).  Saving model ...
Validation loss decreased (1.351363 --> 1.350745).  Saving model ...
Validation loss decreased (1.350745 --> 1.350104).  Saving model ...
Validation loss decreased (1.350104 --> 1.349559).  Saving model ...
Validation loss decreased (1.349559 --> 1.348981).  Saving model ...
Validation loss decreased (1.348981 --> 1.348356).  Saving model ...
Validation loss decreased (1.348356 --> 1.347765).  Saving model ...
Validation loss decreased (1.347765 --> 1.347225).  Saving model ...
Validation loss decreased (1.347225 --> 1.346643).  Saving model ...
Validation loss decreased (1.346643 --> 1.346053).  Saving model ...
Validation loss decreased (1.346053 --> 1.345444).  Saving model ...
Validation loss decreased (1.345444 --> 1.344921).  Saving model ...
Validation loss decreased (1.344921 --> 1.344460).  Saving model ...
Validation loss decreased (1.344460 --> 1.343986).  Saving model ...
Validation loss decreased (1.343986 --> 1.343446).  Saving model ...
Validation loss decreased (1.343446 --> 1.342887).  Saving model ...
Validation loss decreased (1.342887 --> 1.342333).  Saving model ...
Validation loss decreased (1.342333 --> 1.341724).  Saving model ...
Validation loss decreased (1.341724 --> 1.341160).  Saving model ...
Validation loss decreased (1.341160 --> 1.340637).  Saving model ...
Validation loss decreased (1.340637 --> 1.340061).  Saving model ...
Validation loss decreased (1.340061 --> 1.339534).  Saving model ...
Validation loss decreased (1.339534 --> 1.339105).  Saving model ...
Validation loss decreased (1.339105 --> 1.338559).  Saving model ...
Validation loss decreased (1.338559 --> 1.338028).  Saving model ...
Validation loss decreased (1.338028 --> 1.337497).  Saving model ...
Validation loss decreased (1.337497 --> 1.337002).  Saving model ...
Validation loss decreased (1.337002 --> 1.336450).  Saving model ...
Validation loss decreased (1.336450 --> 1.335916).  Saving model ...
Validation loss decreased (1.335916 --> 1.335342).  Saving model ...
Validation loss decreased (1.335342 --> 1.334810).  Saving model ...
Validation loss decreased (1.334810 --> 1.334290).  Saving model ...
Validation loss decreased (1.334290 --> 1.333764).  Saving model ...
Validation loss decreased (1.333764 --> 1.333282).  Saving model ...
Validation loss decreased (1.333282 --> 1.332824).  Saving model ...
Validation loss decreased (1.332824 --> 1.332307).  Saving model ...
Validation loss decreased (1.332307 --> 1.331803).  Saving model ...
Validation loss decreased (1.331803 --> 1.331270).  Saving model ...
Validation loss decreased (1.331270 --> 1.330727).  Saving model ...
Validation loss decreased (1.330727 --> 1.330209).  Saving model ...
Validation loss decreased (1.330209 --> 1.329703).  Saving model ...
Validation loss decreased (1.329703 --> 1.329183).  Saving model ...
Validation loss decreased (1.329183 --> 1.328637).  Saving model ...
Validation loss decreased (1.328637 --> 1.328147).  Saving model ...
Validation loss decreased (1.328147 --> 1.327638).  Saving model ...
Validation loss decreased (1.327638 --> 1.327145).  Saving model ...
Validation loss decreased (1.327145 --> 1.326582).  Saving model ...
Validation loss decreased (1.326582 --> 1.326073).  Saving model ...
Validation loss decreased (1.326073 --> 1.325517).  Saving model ...
Validation loss decreased (1.325517 --> 1.325041).  Saving model ...
Validation loss decreased (1.325041 --> 1.324504).  Saving model ...
Validation loss decreased (1.324504 --> 1.323983).  Saving model ...
Validation loss decreased (1.323983 --> 1.323462).  Saving model ...
Validation loss decreased (1.323462 --> 1.322938).  Saving model ...
Validation loss decreased (1.322938 --> 1.322455).  Saving model ...
Validation loss decreased (1.322455 --> 1.321940).  Saving model ...
Validation loss decreased (1.321940 --> 1.321425).  Saving model ...
Validation loss decreased (1.321425 --> 1.320900).  Saving model ...
Validation loss decreased (1.320900 --> 1.320398).  Saving model ...
Validation loss decreased (1.320398 --> 1.319963).  Saving model ...
Validation loss decreased (1.319963 --> 1.319394).  Saving model ...
Validation loss decreased (1.319394 --> 1.318884).  Saving model ...
Validation loss decreased (1.318884 --> 1.318389).  Saving model ...
Validation loss decreased (1.318389 --> 1.317839).  Saving model ...
Validation loss decreased (1.317839 --> 1.317329).  Saving model ...
Validation loss decreased (1.317329 --> 1.316808).  Saving model ...
Validation loss decreased (1.316808 --> 1.316261).  Saving model ...
Validation loss decreased (1.316261 --> 1.315657).  Saving model ...
Validation loss decreased (1.315657 --> 1.315090).  Saving model ...
Validation loss decreased (1.315090 --> 1.314584).  Saving model ...
Validation loss decreased (1.314584 --> 1.313953).  Saving model ...
Validation loss decreased (1.313953 --> 1.313348).  Saving model ...
Validation loss decreased (1.313348 --> 1.312808).  Saving model ...
Validation loss decreased (1.312808 --> 1.312292).  Saving model ...
Validation loss decreased (1.312292 --> 1.311773).  Saving model ...
Validation loss decreased (1.311773 --> 1.311262).  Saving model ...
Validation loss decreased (1.311262 --> 1.310787).  Saving model ...
Validation loss decreased (1.310787 --> 1.310320).  Saving model ...
Validation loss decreased (1.310320 --> 1.309857).  Saving model ...
Validation loss decreased (1.309857 --> 1.309305).  Saving model ...
Validation loss decreased (1.309305 --> 1.308722).  Saving model ...
Validation loss decreased (1.308722 --> 1.308195).  Saving model ...
Validation loss decreased (1.308195 --> 1.307672).  Saving model ...
Validation loss decreased (1.307672 --> 1.307109).  Saving model ...
Validation loss decreased (1.307109 --> 1.306600).  Saving model ...
Validation loss decreased (1.306600 --> 1.306003).  Saving model ...
Validation loss decreased (1.306003 --> 1.305324).  Saving model ...
Validation loss decreased (1.305324 --> 1.304701).  Saving model ...
Validation loss decreased (1.304701 --> 1.304123).  Saving model ...
Validation loss decreased (1.304123 --> 1.303575).  Saving model ...
Validation loss decreased (1.303575 --> 1.303064).  Saving model ...
Validation loss decreased (1.303064 --> 1.302568).  Saving model ...
Validation loss decreased (1.302568 --> 1.302001).  Saving model ...
Validation loss decreased (1.302001 --> 1.301416).  Saving model ...
Validation loss decreased (1.301416 --> 1.300848).  Saving model ...
Validation loss decreased (1.300848 --> 1.300269).  Saving model ...
Validation loss decreased (1.300269 --> 1.299740).  Saving model ...
Validation loss decreased (1.299740 --> 1.299182).  Saving model ...
Validation loss decreased (1.299182 --> 1.298694).  Saving model ...
Validation loss decreased (1.298694 --> 1.298087).  Saving model ...
Validation loss decreased (1.298087 --> 1.297463).  Saving model ...
Validation loss decreased (1.297463 --> 1.296898).  Saving model ...
Validation loss decreased (1.296898 --> 1.296287).  Saving model ...
Validation loss decreased (1.296287 --> 1.295594).  Saving model ...
Validation loss decreased (1.295594 --> 1.295004).  Saving model ...
Validation loss decreased (1.295004 --> 1.294384).  Saving model ...
Validation loss decreased (1.294384 --> 1.293793).  Saving model ...
Validation loss decreased (1.293793 --> 1.293255).  Saving model ...
Validation loss decreased (1.293255 --> 1.292609).  Saving model ...
Validation loss decreased (1.292609 --> 1.292078).  Saving model ...
Validation loss decreased (1.292078 --> 1.291632).  Saving model ...
Validation loss decreased (1.291632 --> 1.291101).  Saving model ...
Validation loss decreased (1.291101 --> 1.290619).  Saving model ...
Validation loss decreased (1.290619 --> 1.290110).  Saving model ...
Validation loss decreased (1.290110 --> 1.289599).  Saving model ...
Validation loss decreased (1.289599 --> 1.289108).  Saving model ...
Validation loss decreased (1.289108 --> 1.288550).  Saving model ...
Validation loss decreased (1.288550 --> 1.287897).  Saving model ...
Validation loss decreased (1.287897 --> 1.287378).  Saving model ...
Validation loss decreased (1.287378 --> 1.286796).  Saving model ...
Validation loss decreased (1.286796 --> 1.286224).  Saving model ...
Validation loss decreased (1.286224 --> 1.285580).  Saving model ...
Validation loss decreased (1.285580 --> 1.284945).  Saving model ...
Validation loss decreased (1.284945 --> 1.284431).  Saving model ...
Validation loss decreased (1.284431 --> 1.284006).  Saving model ...
Validation loss decreased (1.284006 --> 1.283453).  Saving model ...
Validation loss decreased (1.283453 --> 1.282830).  Saving model ...
Validation loss decreased (1.282830 --> 1.282376).  Saving model ...
Validation loss decreased (1.282376 --> 1.281905).  Saving model ...
Validation loss decreased (1.281905 --> 1.281380).  Saving model ...
Validation loss decreased (1.281380 --> 1.280767).  Saving model ...
Validation loss decreased (1.280767 --> 1.280348).  Saving model ...
Validation loss decreased (1.280348 --> 1.279747).  Saving model ...
Validation loss decreased (1.279747 --> 1.279218).  Saving model ...
Validation loss decreased (1.279218 --> 1.278555).  Saving model ...
Validation loss decreased (1.278555 --> 1.278127).  Saving model ...
Validation loss decreased (1.278127 --> 1.277563).  Saving model ...
Validation loss decreased (1.277563 --> 1.276968).  Saving model ...
Validation loss decreased (1.276968 --> 1.276381).  Saving model ...
Validation loss decreased (1.276381 --> 1.275853).  Saving model ...
Validation loss decreased (1.275853 --> 1.275277).  Saving model ...
Validation loss decreased (1.275277 --> 1.274808).  Saving model ...
Validation loss decreased (1.274808 --> 1.274251).  Saving model ...
Validation loss decreased (1.274251 --> 1.273682).  Saving model ...
Validation loss decreased (1.273682 --> 1.273070).  Saving model ...
Validation loss decreased (1.273070 --> 1.272490).  Saving model ...
Validation loss decreased (1.272490 --> 1.271859).  Saving model ...
Validation loss decreased (1.271859 --> 1.271270).  Saving model ...
Validation loss decreased (1.271270 --> 1.270841).  Saving model ...
Validation loss decreased (1.270841 --> 1.270309).  Saving model ...
Validation loss decreased (1.270309 --> 1.269719).  Saving model ...
Validation loss decreased (1.269719 --> 1.269211).  Saving model ...
Validation loss decreased (1.269211 --> 1.268666).  Saving model ...
Validation loss decreased (1.268666 --> 1.268062).  Saving model ...
Validation loss decreased (1.268062 --> 1.267480).  Saving model ...
Validation loss decreased (1.267480 --> 1.267070).  Saving model ...
Validation loss decreased (1.267070 --> 1.266587).  Saving model ...
Validation loss decreased (1.266587 --> 1.266102).  Saving model ...
Validation loss decreased (1.266102 --> 1.265617).  Saving model ...
Validation loss decreased (1.265617 --> 1.265066).  Saving model ...
Validation loss decreased (1.265066 --> 1.264568).  Saving model ...
Validation loss decreased (1.264568 --> 1.264103).  Saving model ...
Validation loss decreased (1.264103 --> 1.263641).  Saving model ...
Validation loss decreased (1.263641 --> 1.263170).  Saving model ...
Validation loss decreased (1.263170 --> 1.262629).  Saving model ...
Validation loss decreased (1.262629 --> 1.262241).  Saving model ...
Validation loss decreased (1.262241 --> 1.261570).  Saving model ...
Validation loss decreased (1.261570 --> 1.261055).  Saving model ...
Validation loss decreased (1.261055 --> 1.260438).  Saving model ...
Validation loss decreased (1.260438 --> 1.260041).  Saving model ...
Validation loss decreased (1.260041 --> 1.259708).  Saving model ...
Validation loss decreased (1.259708 --> 1.259217).  Saving model ...
Validation loss decreased (1.259217 --> 1.258770).  Saving model ...
Validation loss decreased (1.258770 --> 1.258243).  Saving model ...
Validation loss decreased (1.258243 --> 1.257709).  Saving model ...
Validation loss decreased (1.257709 --> 1.257234).  Saving model ...
Validation loss decreased (1.257234 --> 1.256680).  Saving model ...
Validation loss decreased (1.256680 --> 1.256307).  Saving model ...
Validation loss decreased (1.256307 --> 1.255902).  Saving model ...
Validation loss decreased (1.255902 --> 1.255576).  Saving model ...
Validation loss decreased (1.255576 --> 1.255256).  Saving model ...
Validation loss decreased (1.255256 --> 1.254663).  Saving model ...
Validation loss decreased (1.254663 --> 1.254216).  Saving model ...
Validation loss decreased (1.254216 --> 1.253826).  Saving model ...
Validation loss decreased (1.253826 --> 1.253378).  Saving model ...
Validation loss decreased (1.253378 --> 1.252844).  Saving model ...
Validation loss decreased (1.252844 --> 1.252379).  Saving model ...
Validation loss decreased (1.252379 --> 1.251914).  Saving model ...
Validation loss decreased (1.251914 --> 1.251432).  Saving model ...
Validation loss decreased (1.251432 --> 1.251075).  Saving model ...
Validation loss decreased (1.251075 --> 1.250650).  Saving model ...
Validation loss decreased (1.250650 --> 1.250169).  Saving model ...
Validation loss decreased (1.250169 --> 1.249522).  Saving model ...
Validation loss decreased (1.249522 --> 1.249037).  Saving model ...
Validation loss decreased (1.249037 --> 1.248542).  Saving model ...
Validation loss decreased (1.248542 --> 1.248084).  Saving model ...
Validation loss decreased (1.248084 --> 1.247506).  Saving model ...
Validation loss decreased (1.247506 --> 1.247039).  Saving model ...
Validation loss decreased (1.247039 --> 1.246618).  Saving model ...
Validation loss decreased (1.246618 --> 1.246292).  Saving model ...
Validation loss decreased (1.246292 --> 1.245844).  Saving model ...
Validation loss decreased (1.245844 --> 1.245377).  Saving model ...
Validation loss decreased (1.245377 --> 1.244958).  Saving model ...
Validation loss decreased (1.244958 --> 1.244570).  Saving model ...
Validation loss decreased (1.244570 --> 1.244176).  Saving model ...
Validation loss decreased (1.244176 --> 1.243861).  Saving model ...
Validation loss decreased (1.243861 --> 1.243492).  Saving model ...
Validation loss decreased (1.243492 --> 1.243193).  Saving model ...
Validation loss decreased (1.243193 --> 1.243098).  Saving model ...
Validation loss decreased (1.243098 --> 1.242594).  Saving model ...
Validation loss decreased (1.242594 --> 1.242249).  Saving model ...
Validation loss decreased (1.242249 --> 1.241926).  Saving model ...
Validation loss decreased (1.241926 --> 1.241473).  Saving model ...
Validation loss decreased (1.241473 --> 1.241194).  Saving model ...
Validation loss decreased (1.241194 --> 1.240757).  Saving model ...
Validation loss decreased (1.240757 --> 1.240417).  Saving model ...
Validation loss decreased (1.240417 --> 1.240220).  Saving model ...
Validation loss decreased (1.240220 --> 1.239723).  Saving model ...
Validation loss decreased (1.239723 --> 1.239287).  Saving model ...
Validation loss decreased (1.239287 --> 1.239017).  Saving model ...
Validation loss decreased (1.239017 --> 1.238726).  Saving model ...
Validation loss decreased (1.238726 --> 1.238446).  Saving model ...
Validation loss decreased (1.238446 --> 1.238138).  Saving model ...
Validation loss decreased (1.238138 --> 1.237841).  Saving model ...
Validation loss decreased (1.237841 --> 1.237329).  Saving model ...
Validation loss decreased (1.237329 --> 1.237062).  Saving model ...
Validation loss decreased (1.237062 --> 1.236617).  Saving model ...
Validation loss decreased (1.236617 --> 1.236171).  Saving model ...
Validation loss decreased (1.236171 --> 1.235817).  Saving model ...
Validation loss decreased (1.235817 --> 1.235471).  Saving model ...
Validation loss decreased (1.235471 --> 1.235044).  Saving model ...
Validation loss decreased (1.235044 --> 1.234734).  Saving model ...
Validation loss decreased (1.234734 --> 1.234137).  Saving model ...
Validation loss decreased (1.234137 --> 1.233773).  Saving model ...
Validation loss decreased (1.233773 --> 1.233368).  Saving model ...
Validation loss decreased (1.233368 --> 1.233033).  Saving model ...
Validation loss decreased (1.233033 --> 1.232765).  Saving model ...
Validation loss decreased (1.232765 --> 1.232587).  Saving model ...
Validation loss decreased (1.232587 --> 1.232238).  Saving model ...
Validation loss decreased (1.232238 --> 1.231863).  Saving model ...
Validation loss decreased (1.231863 --> 1.231600).  Saving model ...
Validation loss decreased (1.231600 --> 1.231224).  Saving model ...
Validation loss decreased (1.231224 --> 1.230912).  Saving model ...
Validation loss decreased (1.230912 --> 1.230686).  Saving model ...
Validation loss decreased (1.230686 --> 1.230058).  Saving model ...
Validation loss decreased (1.230058 --> 1.229571).  Saving model ...
Validation loss decreased (1.229571 --> 1.229137).  Saving model ...
Validation loss decreased (1.229137 --> 1.228668).  Saving model ...
Validation loss decreased (1.228668 --> 1.228280).  Saving model ...
Validation loss decreased (1.228280 --> 1.227845).  Saving model ...
Validation loss decreased (1.227845 --> 1.227588).  Saving model ...
Validation loss decreased (1.227588 --> 1.227144).  Saving model ...
Validation loss decreased (1.227144 --> 1.226862).  Saving model ...
Validation loss decreased (1.226862 --> 1.226507).  Saving model ...
Validation loss decreased (1.226507 --> 1.226298).  Saving model ...
Validation loss decreased (1.226298 --> 1.225943).  Saving model ...
Validation loss decreased (1.225943 --> 1.225751).  Saving model ...
Validation loss decreased (1.225751 --> 1.225505).  Saving model ...
Validation loss decreased (1.225505 --> 1.225167).  Saving model ...
Validation loss decreased (1.225167 --> 1.224923).  Saving model ...
Validation loss decreased (1.224923 --> 1.224694).  Saving model ...
Validation loss decreased (1.224694 --> 1.224057).  Saving model ...
Validation loss decreased (1.224057 --> 1.223664).  Saving model ...
Validation loss decreased (1.223664 --> 1.223453).  Saving model ...
Validation loss decreased (1.223453 --> 1.223041).  Saving model ...
Validation loss decreased (1.223041 --> 1.222902).  Saving model ...
Validation loss decreased (1.222902 --> 1.222546).  Saving model ...
Validation loss decreased (1.222546 --> 1.222217).  Saving model ...
Validation loss decreased (1.222217 --> 1.221946).  Saving model ...
Validation loss decreased (1.221946 --> 1.221711).  Saving model ...
Validation loss decreased (1.221711 --> 1.221400).  Saving model ...
Validation loss decreased (1.221400 --> 1.220947).  Saving model ...
Validation loss decreased (1.220947 --> 1.220555).  Saving model ...
Validation loss decreased (1.220555 --> 1.220273).  Saving model ...
Validation loss decreased (1.220273 --> 1.219700).  Saving model ...
Validation loss decreased (1.219700 --> 1.219267).  Saving model ...
Validation loss decreased (1.219267 --> 1.219018).  Saving model ...
Validation loss decreased (1.219018 --> 1.218720).  Saving model ...
Validation loss decreased (1.218720 --> 1.218298).  Saving model ...
Validation loss decreased (1.218298 --> 1.217774).  Saving model ...
Validation loss decreased (1.217774 --> 1.217461).  Saving model ...
Validation loss decreased (1.217461 --> 1.217181).  Saving model ...
Validation loss decreased (1.217181 --> 1.216883).  Saving model ...
Validation loss decreased (1.216883 --> 1.216687).  Saving model ...
Validation loss decreased (1.216687 --> 1.216305).  Saving model ...
Validation loss decreased (1.216305 --> 1.216097).  Saving model ...
Validation loss decreased (1.216097 --> 1.215619).  Saving model ...
Validation loss decreased (1.215619 --> 1.215307).  Saving model ...
Validation loss decreased (1.215307 --> 1.214927).  Saving model ...
Validation loss decreased (1.214927 --> 1.214410).  Saving model ...
Validation loss decreased (1.214410 --> 1.213908).  Saving model ...
Validation loss decreased (1.213908 --> 1.213580).  Saving model ...
Validation loss decreased (1.213580 --> 1.213146).  Saving model ...
Validation loss decreased (1.213146 --> 1.212764).  Saving model ...
Validation loss decreased (1.212764 --> 1.212597).  Saving model ...
Validation loss decreased (1.212597 --> 1.212255).  Saving model ...
Validation loss decreased (1.212255 --> 1.212118).  Saving model ...
Validation loss decreased (1.212118 --> 1.211921).  Saving model ...
Validation loss decreased (1.211921 --> 1.211582).  Saving model ...
Validation loss decreased (1.211582 --> 1.211151).  Saving model ...
Validation loss decreased (1.211151 --> 1.210803).  Saving model ...
Validation loss decreased (1.210803 --> 1.210642).  Saving model ...
Validation loss decreased (1.210642 --> 1.210371).  Saving model ...
Validation loss decreased (1.210371 --> 1.209846).  Saving model ...
Validation loss decreased (1.209846 --> 1.209591).  Saving model ...
Validation loss decreased (1.209591 --> 1.209449).  Saving model ...
Validation loss decreased (1.209449 --> 1.209232).  Saving model ...
Validation loss decreased (1.209232 --> 1.208891).  Saving model ...
Validation loss decreased (1.208891 --> 1.208440).  Saving model ...
Validation loss decreased (1.208440 --> 1.208345).  Saving model ...
Validation loss decreased (1.208345 --> 1.207873).  Saving model ...
Validation loss decreased (1.207873 --> 1.207676).  Saving model ...
Validation loss decreased (1.207676 --> 1.207332).  Saving model ...
Validation loss decreased (1.207332 --> 1.207090).  Saving model ...
Validation loss decreased (1.207090 --> 1.206918).  Saving model ...
Validation loss decreased (1.206918 --> 1.206531).  Saving model ...
Validation loss decreased (1.206531 --> 1.206326).  Saving model ...
Validation loss decreased (1.206326 --> 1.205967).  Saving model ...
Validation loss decreased (1.205967 --> 1.205662).  Saving model ...
Validation loss decreased (1.205662 --> 1.205366).  Saving model ...
Validation loss decreased (1.205366 --> 1.204999).  Saving model ...
Validation loss decreased (1.204999 --> 1.204743).  Saving model ...
Validation loss decreased (1.204743 --> 1.204310).  Saving model ...
Validation loss decreased (1.204310 --> 1.203981).  Saving model ...
Validation loss decreased (1.203981 --> 1.203826).  Saving model ...
Validation loss decreased (1.203826 --> 1.203611).  Saving model ...
Validation loss decreased (1.203611 --> 1.203126).  Saving model ...
Validation loss decreased (1.203126 --> 1.202617).  Saving model ...
Validation loss decreased (1.202617 --> 1.202439).  Saving model ...
Validation loss decreased (1.202439 --> 1.202156).  Saving model ...
Validation loss decreased (1.202156 --> 1.201892).  Saving model ...
Validation loss decreased (1.201892 --> 1.201632).  Saving model ...
Validation loss decreased (1.201632 --> 1.201060).  Saving model ...
Validation loss decreased (1.201060 --> 1.200915).  Saving model ...
Validation loss decreased (1.200915 --> 1.200486).  Saving model ...
Validation loss decreased (1.200486 --> 1.200022).  Saving model ...
Validation loss decreased (1.200022 --> 1.199852).  Saving model ...
Validation loss decreased (1.199852 --> 1.199552).  Saving model ...
Validation loss decreased (1.199552 --> 1.199226).  Saving model ...
Validation loss decreased (1.199226 --> 1.199074).  Saving model ...
Validation loss decreased (1.199074 --> 1.198864).  Saving model ...
Validation loss decreased (1.198864 --> 1.198477).  Saving model ...
Validation loss decreased (1.198477 --> 1.197965).  Saving model ...
Validation loss decreased (1.197965 --> 1.197806).  Saving model ...
Validation loss decreased (1.197806 --> 1.197511).  Saving model ...
Validation loss decreased (1.197511 --> 1.197211).  Saving model ...
Validation loss decreased (1.197211 --> 1.196808).  Saving model ...
Validation loss decreased (1.196808 --> 1.196187).  Saving model ...
Validation loss decreased (1.196187 --> 1.195895).  Saving model ...
Validation loss decreased (1.195895 --> 1.195643).  Saving model ...
Validation loss decreased (1.195643 --> 1.195372).  Saving model ...
Validation loss decreased (1.195372 --> 1.195141).  Saving model ...
Validation loss decreased (1.195141 --> 1.194931).  Saving model ...
Validation loss decreased (1.194931 --> 1.194657).  Saving model ...
Validation loss decreased (1.194657 --> 1.194362).  Saving model ...
Validation loss decreased (1.194362 --> 1.193996).  Saving model ...
Validation loss decreased (1.193996 --> 1.193727).  Saving model ...
Validation loss decreased (1.193727 --> 1.193478).  Saving model ...
Validation loss decreased (1.193478 --> 1.193074).  Saving model ...
Validation loss decreased (1.193074 --> 1.192825).  Saving model ...
Validation loss decreased (1.192825 --> 1.192527).  Saving model ...
EarlyStopping counter: 1 out of 15.0
Validation loss decreased (1.192527 --> 1.192024).  Saving model ...
Validation loss decreased (1.192024 --> 1.191446).  Saving model ...
Validation loss decreased (1.191446 --> 1.191013).  Saving model ...
Validation loss decreased (1.191013 --> 1.190936).  Saving model ...
Validation loss decreased (1.190936 --> 1.190661).  Saving model ...
Validation loss decreased (1.190661 --> 1.190456).  Saving model ...
Validation loss decreased (1.190456 --> 1.190008).  Saving model ...
Validation loss decreased (1.190008 --> 1.189597).  Saving model ...
Validation loss decreased (1.189597 --> 1.189404).  Saving model ...
Validation loss decreased (1.189404 --> 1.189259).  Saving model ...
Validation loss decreased (1.189259 --> 1.189186).  Saving model ...
Validation loss decreased (1.189186 --> 1.188983).  Saving model ...
Validation loss decreased (1.188983 --> 1.188604).  Saving model ...
Validation loss decreased (1.188604 --> 1.188317).  Saving model ...
Validation loss decreased (1.188317 --> 1.188059).  Saving model ...
Validation loss decreased (1.188059 --> 1.187774).  Saving model ...
Validation loss decreased (1.187774 --> 1.187562).  Saving model ...
Validation loss decreased (1.187562 --> 1.187342).  Saving model ...
Validation loss decreased (1.187342 --> 1.187015).  Saving model ...
Validation loss decreased (1.187015 --> 1.186831).  Saving model ...
Validation loss decreased (1.186831 --> 1.186562).  Saving model ...
Validation loss decreased (1.186562 --> 1.186248).  Saving model ...
Validation loss decreased (1.186248 --> 1.185847).  Saving model ...
Validation loss decreased (1.185847 --> 1.185563).  Saving model ...
Validation loss decreased (1.185563 --> 1.185224).  Saving model ...
Validation loss decreased (1.185224 --> 1.184847).  Saving model ...
Validation loss decreased (1.184847 --> 1.184426).  Saving model ...
Validation loss decreased (1.184426 --> 1.183806).  Saving model ...
Validation loss decreased (1.183806 --> 1.183604).  Saving model ...
Validation loss decreased (1.183604 --> 1.183322).  Saving model ...
Validation loss decreased (1.183322 --> 1.182934).  Saving model ...
Validation loss decreased (1.182934 --> 1.182845).  Saving model ...
Validation loss decreased (1.182845 --> 1.182669).  Saving model ...
Validation loss decreased (1.182669 --> 1.182393).  Saving model ...
Validation loss decreased (1.182393 --> 1.182099).  Saving model ...
Validation loss decreased (1.182099 --> 1.181864).  Saving model ...
Validation loss decreased (1.181864 --> 1.181534).  Saving model ...
Validation loss decreased (1.181534 --> 1.181407).  Saving model ...
Validation loss decreased (1.181407 --> 1.181196).  Saving model ...
Validation loss decreased (1.181196 --> 1.181042).  Saving model ...
Validation loss decreased (1.181042 --> 1.180770).  Saving model ...
Validation loss decreased (1.180770 --> 1.180111).  Saving model ...
Validation loss decreased (1.180111 --> 1.179832).  Saving model ...
Validation loss decreased (1.179832 --> 1.179587).  Saving model ...
Validation loss decreased (1.179587 --> 1.179322).  Saving model ...
Validation loss decreased (1.179322 --> 1.178901).  Saving model ...
Validation loss decreased (1.178901 --> 1.178615).  Saving model ...
Validation loss decreased (1.178615 --> 1.178065).  Saving model ...
Validation loss decreased (1.178065 --> 1.177841).  Saving model ...
Validation loss decreased (1.177841 --> 1.177736).  Saving model ...
Validation loss decreased (1.177736 --> 1.177576).  Saving model ...
Validation loss decreased (1.177576 --> 1.177346).  Saving model ...
Validation loss decreased (1.177346 --> 1.177258).  Saving model ...
Validation loss decreased (1.177258 --> 1.177182).  Saving model ...
Validation loss decreased (1.177182 --> 1.176702).  Saving model ...
Validation loss decreased (1.176702 --> 1.176287).  Saving model ...
Validation loss decreased (1.176287 --> 1.176202).  Saving model ...
Validation loss decreased (1.176202 --> 1.176015).  Saving model ...
Validation loss decreased (1.176015 --> 1.175567).  Saving model ...
Validation loss decreased (1.175567 --> 1.175479).  Saving model ...
Validation loss decreased (1.175479 --> 1.175206).  Saving model ...
/localscratch/yinan.28698742.0/env/lib/python3.7/site-packages/torch/nn/functional.py:1794: UserWarning: nn.functional.tanh is deprecated. Use torch.tanh instead.
  warnings.warn("nn.functional.tanh is deprecated. Use torch.tanh instead.")
/localscratch/yinan.28698742.0/env/lib/python3.7/site-packages/transformers/optimization.py:155: UserWarning: This overload of add_ is deprecated:
	add_(Number alpha, Tensor other)
Consider using one of the following signatures instead:
	add_(Tensor other, *, Number alpha) (Triggered internally at  ../torch/csrc/utils/python_arg_parser.cpp:1025.)
  exp_avg.mul_(beta1).add_(1.0 - beta1, grad)
wandb: Waiting for W&B process to finish, PID 248168... (success).
wandb: - 0.00MB of 0.00MB uploaded (0.00MB deduped)wandb: \ 0.00MB of 0.00MB uploaded (0.00MB deduped)wandb: | 0.00MB of 0.00MB uploaded (0.00MB deduped)wandb: / 0.00MB of 0.00MB uploaded (0.00MB deduped)wandb: - 0.00MB of 0.00MB uploaded (0.00MB deduped)wandb: \ 0.00MB of 0.00MB uploaded (0.00MB deduped)wandb: | 0.00MB of 0.00MB uploaded (0.00MB deduped)wandb: / 0.00MB of 0.00MB uploaded (0.00MB deduped)wandb: - 0.00MB of 0.00MB uploaded (0.00MB deduped)wandb: \ 0.00MB of 0.00MB uploaded (0.00MB deduped)wandb: | 0.00MB of 0.00MB uploaded (0.00MB deduped)wandb: / 0.00MB of 0.00MB uploaded (0.00MB deduped)wandb: - 0.00MB of 0.00MB uploaded (0.00MB deduped)wandb:                                                                                
wandb: Run history:
wandb:     e_F1 ▁▁▂▂▃▄▅▅▆▆▆▆▆▆▆▇▇▇▇▇▇▇▇▇▇▇▇█████████████
wandb:   e_loss █▇▇▆▆▆▆▅▅▅▅▅▄▄▄▄▄▄▃▃▃▃▃▃▃▂▂▂▂▂▂▂▂▂▁▁▁▁▁▁
wandb:     t_F1 ▁▁▂▃▃▃▃▃▃▄▄▅▄▄▅▆▅▆▆▆▆▆▆▆▆▇▇▆▇▇▇▇▇▇▇█████
wandb:   t_loss ██▇▇▇▆▆▆▆▆▆▅▅▆▅▅▅▄▄▄▄▄▄▄▃▃▃▃▃▃▂▂▂▂▂▂▂▂▁▁
wandb: 
wandb: Run summary:
wandb:     e_F1 49.29015
wandb:   e_loss 1.17521
wandb:     t_F1 50.56787
wandb:   t_loss 1.10738
wandb: 
wandb: Synced 4 W&B file(s), 0 media file(s), 0 artifact file(s) and 0 other file(s)
wandb: Synced lively-waterfall-1: https://wandb.ai/yinanazhou/xl_512_bs_8_lr_1e07_es_15_lc_False_nr_True_sr_False_stem_True_lemma_False_repeat_1_fold_1/runs/uyhv394i
wandb: Find logs at: ./wandb/run-20220311_101625-uyhv394i/logs/debug.log
wandb: 

wandb: wandb version 0.12.11 is available!  To upgrade, please run:
wandb:  $ pip install wandb --upgrade
2022-03-11 15:39:39.325875: I tensorflow/stream_executor/platform/default/dso_loader.cc:48] Successfully opened dynamic library libcudart.so.10.1
wandb: Tracking run with wandb version 0.12.5
wandb: Syncing run usual-totem-1
wandb: ⭐️ View project at https://wandb.ai/yinanazhou/xl_512_bs_8_lr_1e07_es_15_lc_False_nr_True_sr_False_stem_True_lemma_False_repeat_1_fold_2
wandb: 🚀 View run at https://wandb.ai/yinanazhou/xl_512_bs_8_lr_1e07_es_15_lc_False_nr_True_sr_False_stem_True_lemma_False_repeat_1_fold_2/runs/2gklb7gq
wandb: Run data is saved locally in /project/6002780/yinan/Thesis_MER_Lyrics/lyric-emotion/wandb/run-20220311_153936-2gklb7gq
wandb: Run `wandb offline` to turn off syncing.
slurmstepd: error: *** JOB 28698742 ON cdr2578 CANCELLED AT 2022-03-11T20:12:13 DUE TO TIME LIMIT ***
