Unloading StdEnv/2020

Due to MODULEPATH changes, the following have been reloaded:
  1) mii/1.1.1


The following have been reloaded with a version change:
  1) python/3.8.2 => python/3.7.4

Using base prefix '/cvmfs/soft.computecanada.ca/easybuild/software/2017/Core/python/3.7.4'
New python executable in /localscratch/yinan.29323967.0/env/bin/python
Installing setuptools, pip, wheel...
done.
Ignoring pip: markers 'python_version < "3"' don't match your environment
Looking in links: /cvmfs/soft.computecanada.ca/custom/python/wheelhouse/nix/avx2, /cvmfs/soft.computecanada.ca/custom/python/wheelhouse/nix/generic, /cvmfs/soft.computecanada.ca/custom/python/wheelhouse/generic
Collecting pip
Installing collected packages: pip
  Found existing installation: pip 19.1.1
    Uninstalling pip-19.1.1:
      Successfully uninstalled pip-19.1.1
Successfully installed pip-21.2.3+computecanada
Looking in links: /cvmfs/soft.computecanada.ca/custom/python/wheelhouse/nix/avx2, /cvmfs/soft.computecanada.ca/custom/python/wheelhouse/nix/generic, /cvmfs/soft.computecanada.ca/custom/python/wheelhouse/generic
Processing /cvmfs/soft.computecanada.ca/custom/python/wheelhouse/generic/keras-2.8.0+computecanada-py2.py3-none-any.whl
Processing /cvmfs/soft.computecanada.ca/custom/python/wheelhouse/generic/Keras_Preprocessing-1.1.2+computecanada-py3-none-any.whl
Requirement already satisfied: matplotlib in /cvmfs/soft.computecanada.ca/easybuild/software/2017/Core/scipy-stack/2019a/lib/python3.7/site-packages (from -r requirements.txt (line 3)) (3.0.2)
Processing /cvmfs/soft.computecanada.ca/custom/python/wheelhouse/generic/nltk-3.6.5+computecanada-py3-none-any.whl
Processing /cvmfs/soft.computecanada.ca/custom/python/wheelhouse/generic/scikit_learn-0.22.1+computecanada-cp37-cp37m-linux_x86_64.whl
Processing /cvmfs/soft.computecanada.ca/custom/python/wheelhouse/generic/tensorboard-2.3.0+computecanada-py3-none-any.whl
Processing /cvmfs/soft.computecanada.ca/custom/python/wheelhouse/generic/tensorboard_plugin_wit-1.7.0+computecanada-py3-none-any.whl
Processing /cvmfs/soft.computecanada.ca/custom/python/wheelhouse/generic/tensorflow_gpu-2.3.0+computecanada-cp37-cp37m-linux_x86_64.whl
Processing /cvmfs/soft.computecanada.ca/custom/python/wheelhouse/generic/tensorflow_estimator-2.3.0+computecanada-py2.py3-none-any.whl
Processing /cvmfs/soft.computecanada.ca/custom/python/wheelhouse/generic/tokenizers-0.5.2+computecanada-cp37-cp37m-linux_x86_64.whl
Processing /cvmfs/soft.computecanada.ca/custom/python/wheelhouse/nix/avx2/torch-1.4.0+computecanada-cp37-cp37m-linux_x86_64.whl
Processing /cvmfs/soft.computecanada.ca/custom/python/wheelhouse/generic/torchtext-0.6.0+computecanada-py3-none-any.whl
Processing /cvmfs/soft.computecanada.ca/custom/python/wheelhouse/generic/torchvision-0.8.2+computecanada-cp37-cp37m-linux_x86_64.whl
Processing /cvmfs/soft.computecanada.ca/custom/python/wheelhouse/generic/transformers-2.5.1+computecanada-py3-none-any.whl
Processing /cvmfs/soft.computecanada.ca/custom/python/wheelhouse/generic/urllib3-1.26.7+computecanada-py2.py3-none-any.whl
Processing /cvmfs/soft.computecanada.ca/custom/python/wheelhouse/generic/tqdm-4.63.0+computecanada-py2.py3-none-any.whl
Processing /cvmfs/soft.computecanada.ca/custom/python/wheelhouse/generic/joblib-1.1.0+computecanada-py2.py3-none-any.whl
ERROR: Could not find a version that satisfies the requirement regex>=2021.8.3 (from nltk) (from versions: 2018.1.10+computecanada, 2019.11.1+computecanada, 2020.11.13+computecanada)
ERROR: No matching distribution found for regex>=2021.8.3
Looking in links: /cvmfs/soft.computecanada.ca/custom/python/wheelhouse/nix/avx2, /cvmfs/soft.computecanada.ca/custom/python/wheelhouse/nix/generic, /cvmfs/soft.computecanada.ca/custom/python/wheelhouse/generic
ERROR: Could not find a version that satisfies the requirement numpy==1.20.0+computacanada (from versions: 1.15.0+computecanada, 1.15.2+computecanada, 1.15.4+computecanada, 1.16.0+computecanada, 1.16.2+computecanada, 1.16.3+computecanada, 1.17.4+computecanada, 1.18.1+computecanada, 1.18.4+computecanada, 1.19.1+computecanada, 1.19.2+computecanada, 1.20.2+computecanada)
ERROR: No matching distribution found for numpy==1.20.0+computacanada
Looking in links: /cvmfs/soft.computecanada.ca/custom/python/wheelhouse/nix/avx2, /cvmfs/soft.computecanada.ca/custom/python/wheelhouse/nix/generic, /cvmfs/soft.computecanada.ca/custom/python/wheelhouse/generic
Processing /cvmfs/soft.computecanada.ca/custom/python/wheelhouse/generic/wandb-0.12.5+computecanada-py2.py3-none-any.whl
Processing /cvmfs/soft.computecanada.ca/custom/python/wheelhouse/generic/subprocess32-3.5.4+computecanada-py3-none-any.whl
Processing /cvmfs/soft.computecanada.ca/custom/python/wheelhouse/generic/click-8.0.4+computecanada-py3-none-any.whl
Processing /cvmfs/soft.computecanada.ca/custom/python/wheelhouse/generic/configparser-5.0.2+computecanada-py3-none-any.whl
Processing /cvmfs/soft.computecanada.ca/custom/python/wheelhouse/generic/yaspin-2.1.0+computecanada-py3-none-any.whl
Processing /cvmfs/soft.computecanada.ca/custom/python/wheelhouse/generic/PyYAML-5.3.1+computecanada-cp37-cp37m-linux_x86_64.whl
Processing /cvmfs/soft.computecanada.ca/custom/python/wheelhouse/generic/promise-2.3+computecanada-py3-none-any.whl
Processing /cvmfs/soft.computecanada.ca/custom/python/wheelhouse/generic/psutil-5.7.3+computecanada-cp37-cp37m-linux_x86_64.whl
Processing /cvmfs/soft.computecanada.ca/custom/python/wheelhouse/generic/docker_pycreds-0.4.0+computecanada-py2.py3-none-any.whl
Processing /cvmfs/soft.computecanada.ca/custom/python/wheelhouse/generic/GitPython-3.1.24+computecanada-py3-none-any.whl
Requirement already satisfied: python-dateutil>=2.6.1 in /cvmfs/soft.computecanada.ca/easybuild/software/2017/Core/scipy-stack/2019a/lib/python3.7/site-packages (from wandb) (2.7.5)
Processing /cvmfs/soft.computecanada.ca/custom/python/wheelhouse/generic/pathtools-0.1.2+computecanada-py3-none-any.whl
Processing /cvmfs/soft.computecanada.ca/custom/python/wheelhouse/generic/protobuf-3.19.4+computecanada-py2.py3-none-any.whl
Processing /cvmfs/soft.computecanada.ca/custom/python/wheelhouse/generic/sentry_sdk-1.5.0+computecanada-py2.py3-none-any.whl
Processing /cvmfs/soft.computecanada.ca/custom/python/wheelhouse/generic/shortuuid-1.0.1+computecanada-py3-none-any.whl
Requirement already satisfied: requests<3,>=2.0.0 in /cvmfs/soft.computecanada.ca/easybuild/software/2017/Core/scipy-stack/2019a/lib/python3.7/site-packages (from wandb) (2.21.0)
Processing /cvmfs/soft.computecanada.ca/custom/python/wheelhouse/generic/six-1.16.0+computecanada-py2.py3-none-any.whl
Requirement already satisfied: importlib-metadata in /cvmfs/soft.computecanada.ca/easybuild/software/2017/Core/scipy-stack/2019a/lib/python3.7/site-packages (from Click!=8.0.0,>=7.0->wandb) (0.8)
Processing /cvmfs/soft.computecanada.ca/custom/python/wheelhouse/generic/gitdb-4.0.9+computecanada-py3-none-any.whl
Processing /cvmfs/soft.computecanada.ca/custom/python/wheelhouse/generic/typing_extensions-4.0.1+computecanada-py3-none-any.whl
Processing /cvmfs/soft.computecanada.ca/custom/python/wheelhouse/generic/smmap-5.0.0+computecanada-py3-none-any.whl
Requirement already satisfied: chardet<3.1.0,>=3.0.2 in /cvmfs/soft.computecanada.ca/easybuild/software/2017/Core/scipy-stack/2019a/lib/python3.7/site-packages (from requests<3,>=2.0.0->wandb) (3.0.4)
Requirement already satisfied: urllib3<1.25,>=1.21.1 in /cvmfs/soft.computecanada.ca/easybuild/software/2017/Core/scipy-stack/2019a/lib/python3.7/site-packages (from requests<3,>=2.0.0->wandb) (1.24.1)
Requirement already satisfied: idna<2.9,>=2.5 in /cvmfs/soft.computecanada.ca/easybuild/software/2017/Core/scipy-stack/2019a/lib/python3.7/site-packages (from requests<3,>=2.0.0->wandb) (2.8)
Requirement already satisfied: certifi>=2017.4.17 in /cvmfs/soft.computecanada.ca/easybuild/software/2017/Core/scipy-stack/2019a/lib/python3.7/site-packages (from requests<3,>=2.0.0->wandb) (2018.11.29)
Processing /cvmfs/soft.computecanada.ca/custom/python/wheelhouse/generic/termcolor-1.1.0+computecanada-py3-none-any.whl
Requirement already satisfied: zipp>=0.3.2 in /cvmfs/soft.computecanada.ca/easybuild/software/2017/Core/scipy-stack/2019a/lib/python3.7/site-packages (from importlib-metadata->Click!=8.0.0,>=7.0->wandb) (0.3.3)
Installing collected packages: smmap, typing-extensions, termcolor, six, gitdb, yaspin, subprocess32, shortuuid, sentry-sdk, PyYAML, psutil, protobuf, promise, pathtools, GitPython, docker-pycreds, configparser, Click, wandb
  Attempting uninstall: six
    Found existing installation: six 1.12.0
    Not uninstalling six at /cvmfs/soft.computecanada.ca/easybuild/software/2017/Core/scipy-stack/2019a/lib/python3.7/site-packages, outside environment /localscratch/yinan.29323967.0/env
    Can't uninstall 'six'. No files were found to uninstall.
Successfully installed Click-8.0.4+computecanada GitPython-3.1.24+computecanada PyYAML-5.3.1+computecanada configparser-5.0.2+computecanada docker-pycreds-0.4.0+computecanada gitdb-4.0.9+computecanada pathtools-0.1.2+computecanada promise-2.3+computecanada protobuf-3.19.4+computecanada psutil-5.7.3+computecanada sentry-sdk-1.5.0+computecanada shortuuid-1.0.1+computecanada six-1.16.0+computecanada smmap-5.0.0+computecanada subprocess32-3.5.4+computecanada termcolor-1.1.0+computecanada typing-extensions-4.0.1+computecanada wandb-0.12.5+computecanada yaspin-2.1.0+computecanada
Looking in links: /cvmfs/soft.computecanada.ca/custom/python/wheelhouse/nix/avx2, /cvmfs/soft.computecanada.ca/custom/python/wheelhouse/nix/generic, /cvmfs/soft.computecanada.ca/custom/python/wheelhouse/generic
ERROR: Could not find a version that satisfies the requirement sagemaker (from versions: none)
ERROR: No matching distribution found for sagemaker
Looking in links: /cvmfs/soft.computecanada.ca/custom/python/wheelhouse/nix/avx2, /cvmfs/soft.computecanada.ca/custom/python/wheelhouse/nix/generic, /cvmfs/soft.computecanada.ca/custom/python/wheelhouse/generic
Processing /cvmfs/soft.computecanada.ca/custom/python/wheelhouse/generic/torch-1.9.1+computecanada-cp37-cp37m-linux_x86_64.whl
Requirement already satisfied: typing-extensions in /localscratch/yinan.29323967.0/env/lib/python3.7/site-packages (from torch) (4.0.1+computecanada)
Installing collected packages: torch
Successfully installed torch-1.9.1+computecanada
Looking in links: /cvmfs/soft.computecanada.ca/custom/python/wheelhouse/nix/avx2, /cvmfs/soft.computecanada.ca/custom/python/wheelhouse/nix/generic, /cvmfs/soft.computecanada.ca/custom/python/wheelhouse/generic
Processing /cvmfs/soft.computecanada.ca/custom/python/wheelhouse/generic/transformers-2.5.1+computecanada-py3-none-any.whl
Processing /cvmfs/soft.computecanada.ca/custom/python/wheelhouse/generic/tokenizers-0.5.2+computecanada-cp37-cp37m-linux_x86_64.whl
Processing /cvmfs/soft.computecanada.ca/custom/python/wheelhouse/generic/filelock-3.4.2+computecanada-py3-none-any.whl
Processing /cvmfs/soft.computecanada.ca/custom/python/wheelhouse/generic/sacremoses-0.0.46+computecanada-py3-none-any.whl
Processing /cvmfs/soft.computecanada.ca/custom/python/wheelhouse/generic/sentencepiece-0.1.91+computecanada-cp37-cp37m-linux_x86_64.whl
Requirement already satisfied: numpy in /cvmfs/soft.computecanada.ca/easybuild/software/2017/Core/scipy-stack/2019a/lib/python3.7/site-packages (from transformers==2.5.1+computecanada) (1.16.0)
Processing /cvmfs/soft.computecanada.ca/custom/python/wheelhouse/generic/boto3-1.21.14+computecanada-py3-none-any.whl
Processing /cvmfs/soft.computecanada.ca/custom/python/wheelhouse/generic/tqdm-4.63.0+computecanada-py2.py3-none-any.whl
Requirement already satisfied: requests in /cvmfs/soft.computecanada.ca/easybuild/software/2017/Core/scipy-stack/2019a/lib/python3.7/site-packages (from transformers==2.5.1+computecanada) (2.21.0)
Processing /cvmfs/soft.computecanada.ca/custom/python/wheelhouse/generic/regex-2020.11.13+computecanada-cp37-cp37m-linux_x86_64.whl
Processing /cvmfs/soft.computecanada.ca/custom/python/wheelhouse/generic/jmespath-0.10.0+computecanada-py2.py3-none-any.whl
Processing /cvmfs/soft.computecanada.ca/custom/python/wheelhouse/generic/botocore-1.24.14+computecanada-py3-none-any.whl
Processing /cvmfs/soft.computecanada.ca/custom/python/wheelhouse/generic/s3transfer-0.5.1+computecanada-py3-none-any.whl
Processing /cvmfs/soft.computecanada.ca/custom/python/wheelhouse/generic/urllib3-1.26.8+computecanada-py2.py3-none-any.whl
Requirement already satisfied: python-dateutil<3.0.0,>=2.1 in /cvmfs/soft.computecanada.ca/easybuild/software/2017/Core/scipy-stack/2019a/lib/python3.7/site-packages (from botocore<1.25.0,>=1.24.14->boto3->transformers==2.5.1+computecanada) (2.7.5)
Requirement already satisfied: six>=1.5 in /localscratch/yinan.29323967.0/env/lib/python3.7/site-packages (from python-dateutil<3.0.0,>=2.1->botocore<1.25.0,>=1.24.14->boto3->transformers==2.5.1+computecanada) (1.16.0+computecanada)
Requirement already satisfied: chardet<3.1.0,>=3.0.2 in /cvmfs/soft.computecanada.ca/easybuild/software/2017/Core/scipy-stack/2019a/lib/python3.7/site-packages (from requests->transformers==2.5.1+computecanada) (3.0.4)
Requirement already satisfied: idna<2.9,>=2.5 in /cvmfs/soft.computecanada.ca/easybuild/software/2017/Core/scipy-stack/2019a/lib/python3.7/site-packages (from requests->transformers==2.5.1+computecanada) (2.8)
Processing /cvmfs/soft.computecanada.ca/custom/python/wheelhouse/generic/requests-2.27.1+computecanada-py2.py3-none-any.whl
Processing /cvmfs/soft.computecanada.ca/custom/python/wheelhouse/generic/charset_normalizer-2.0.12+computecanada-py3-none-any.whl
Requirement already satisfied: certifi>=2017.4.17 in /cvmfs/soft.computecanada.ca/easybuild/software/2017/Core/scipy-stack/2019a/lib/python3.7/site-packages (from requests->transformers==2.5.1+computecanada) (2018.11.29)
Processing /cvmfs/soft.computecanada.ca/custom/python/wheelhouse/generic/joblib-1.1.0+computecanada-py2.py3-none-any.whl
Requirement already satisfied: click in /localscratch/yinan.29323967.0/env/lib/python3.7/site-packages (from sacremoses->transformers==2.5.1+computecanada) (8.0.4+computecanada)
Requirement already satisfied: importlib-metadata in /cvmfs/soft.computecanada.ca/easybuild/software/2017/Core/scipy-stack/2019a/lib/python3.7/site-packages (from click->sacremoses->transformers==2.5.1+computecanada) (0.8)
Requirement already satisfied: zipp>=0.3.2 in /cvmfs/soft.computecanada.ca/easybuild/software/2017/Core/scipy-stack/2019a/lib/python3.7/site-packages (from importlib-metadata->click->sacremoses->transformers==2.5.1+computecanada) (0.3.3)
Installing collected packages: urllib3, jmespath, botocore, tqdm, s3transfer, regex, joblib, charset-normalizer, tokenizers, sentencepiece, sacremoses, requests, filelock, boto3, transformers
  Attempting uninstall: urllib3
    Found existing installation: urllib3 1.24.1
    Not uninstalling urllib3 at /cvmfs/soft.computecanada.ca/easybuild/software/2017/Core/scipy-stack/2019a/lib/python3.7/site-packages, outside environment /localscratch/yinan.29323967.0/env
    Can't uninstall 'urllib3'. No files were found to uninstall.
  Attempting uninstall: requests
    Found existing installation: requests 2.21.0
    Not uninstalling requests at /cvmfs/soft.computecanada.ca/easybuild/software/2017/Core/scipy-stack/2019a/lib/python3.7/site-packages, outside environment /localscratch/yinan.29323967.0/env
    Can't uninstall 'requests'. No files were found to uninstall.
Successfully installed boto3-1.21.14+computecanada botocore-1.24.14+computecanada charset-normalizer-2.0.12+computecanada filelock-3.4.2+computecanada jmespath-0.10.0+computecanada joblib-1.1.0+computecanada regex-2020.11.13+computecanada requests-2.27.1+computecanada s3transfer-0.5.1+computecanada sacremoses-0.0.46+computecanada sentencepiece-0.1.91+computecanada tokenizers-0.5.2+computecanada tqdm-4.63.0+computecanada transformers-2.5.1+computecanada urllib3-1.26.8+computecanada
Looking in links: /cvmfs/soft.computecanada.ca/custom/python/wheelhouse/nix/avx2, /cvmfs/soft.computecanada.ca/custom/python/wheelhouse/nix/generic, /cvmfs/soft.computecanada.ca/custom/python/wheelhouse/generic
Processing /cvmfs/soft.computecanada.ca/custom/python/wheelhouse/generic/tensorflow_gpu-2.3.0+computecanada-cp37-cp37m-linux_x86_64.whl
Processing /cvmfs/soft.computecanada.ca/custom/python/wheelhouse/generic/absl_py-1.0.0+computecanada-py3-none-any.whl
Requirement already satisfied: protobuf>=3.9.2 in /localscratch/yinan.29323967.0/env/lib/python3.7/site-packages (from tensorflow_gpu==2.3.0+computecanada) (3.19.4+computecanada)
Requirement already satisfied: termcolor>=1.1.0 in /localscratch/yinan.29323967.0/env/lib/python3.7/site-packages (from tensorflow_gpu==2.3.0+computecanada) (1.1.0+computecanada)
Requirement already satisfied: wheel>=0.26 in /localscratch/yinan.29323967.0/env/lib/python3.7/site-packages (from tensorflow_gpu==2.3.0+computecanada) (0.33.4)
Processing /cvmfs/soft.computecanada.ca/custom/python/wheelhouse/generic/astunparse-1.6.3+computecanada-py2.py3-none-any.whl
Processing /cvmfs/soft.computecanada.ca/custom/python/wheelhouse/generic/tensorboard-2.8.0+computecanada-py3-none-any.whl
Processing /cvmfs/soft.computecanada.ca/custom/python/wheelhouse/generic/opt_einsum-3.3.0+computecanada-py3-none-any.whl
Processing /cvmfs/soft.computecanada.ca/custom/python/wheelhouse/generic/grpcio-1.38.0+computecanada-cp37-cp37m-linux_x86_64.whl
Processing /cvmfs/soft.computecanada.ca/custom/python/wheelhouse/generic/gast-0.3.3+computecanada-py3-none-any.whl
Processing /cvmfs/soft.computecanada.ca/custom/python/wheelhouse/generic/google_pasta-0.2.0+computecanada-py3-none-any.whl
Requirement already satisfied: numpy<1.19.0,>=1.16.0 in /cvmfs/soft.computecanada.ca/easybuild/software/2017/Core/scipy-stack/2019a/lib/python3.7/site-packages (from tensorflow_gpu==2.3.0+computecanada) (1.16.0)
Processing /cvmfs/soft.computecanada.ca/custom/python/wheelhouse/nix/avx2/h5py-2.10.0+computecanada-cp37-cp37m-linux_x86_64.whl
Processing /cvmfs/soft.computecanada.ca/custom/python/wheelhouse/nix/generic/scipy-1.4.1+computecanada-cp37-cp37m-linux_x86_64.whl
Processing /cvmfs/soft.computecanada.ca/custom/python/wheelhouse/generic/Keras_Preprocessing-1.1.2+computecanada-py3-none-any.whl
Processing /cvmfs/soft.computecanada.ca/custom/python/wheelhouse/generic/tensorflow_estimator-2.3.0+computecanada-py2.py3-none-any.whl
Processing /cvmfs/soft.computecanada.ca/custom/python/wheelhouse/generic/wrapt-1.11.2+computecanada-cp37-cp37m-linux_x86_64.whl
Requirement already satisfied: six>=1.12.0 in /localscratch/yinan.29323967.0/env/lib/python3.7/site-packages (from tensorflow_gpu==2.3.0+computecanada) (1.16.0+computecanada)
Processing /cvmfs/soft.computecanada.ca/custom/python/wheelhouse/generic/tensorboard_plugin_wit-1.8.0+computecanada-py3-none-any.whl
Requirement already satisfied: requests<3,>=2.21.0 in /localscratch/yinan.29323967.0/env/lib/python3.7/site-packages (from tensorboard<3,>=2.3.0->tensorflow_gpu==2.3.0+computecanada) (2.27.1+computecanada)
Processing /cvmfs/soft.computecanada.ca/custom/python/wheelhouse/generic/google_auth_oauthlib-0.4.6+computecanada-py2.py3-none-any.whl
Processing /cvmfs/soft.computecanada.ca/custom/python/wheelhouse/generic/tensorboard_data_server-0.6.1+computecanada-py3-none-linux_x86_64.whl
Processing /cvmfs/soft.computecanada.ca/custom/python/wheelhouse/generic/google_auth-2.3.3+computecanada-py2.py3-none-any.whl
Requirement already satisfied: setuptools>=41.0.0 in /localscratch/yinan.29323967.0/env/lib/python3.7/site-packages (from tensorboard<3,>=2.3.0->tensorflow_gpu==2.3.0+computecanada) (41.0.1)
Processing /cvmfs/soft.computecanada.ca/custom/python/wheelhouse/generic/Werkzeug-2.0.3+computecanada-py3-none-any.whl
Processing /cvmfs/soft.computecanada.ca/custom/python/wheelhouse/generic/Markdown-3.3.6+computecanada-py3-none-any.whl
Processing /cvmfs/soft.computecanada.ca/custom/python/wheelhouse/generic/pyasn1_modules-0.2.8+computecanada-py2.py3-none-any.whl
Processing /cvmfs/soft.computecanada.ca/custom/python/wheelhouse/generic/cachetools-4.2.4+computecanada-py3-none-any.whl
Processing /cvmfs/soft.computecanada.ca/custom/python/wheelhouse/generic/rsa-4.8+computecanada-py3-none-any.whl
Processing /cvmfs/soft.computecanada.ca/custom/python/wheelhouse/generic/requests_oauthlib-1.3.0+computecanada-py2.py3-none-any.whl
Processing /cvmfs/soft.computecanada.ca/custom/python/wheelhouse/generic/importlib_metadata-4.10.1+computecanada-py3-none-any.whl
Processing /cvmfs/soft.computecanada.ca/custom/python/wheelhouse/generic/zipp-3.7.0+computecanada-py3-none-any.whl
Requirement already satisfied: typing-extensions>=3.6.4 in /localscratch/yinan.29323967.0/env/lib/python3.7/site-packages (from importlib-metadata>=4.4->markdown>=2.6.8->tensorboard<3,>=2.3.0->tensorflow_gpu==2.3.0+computecanada) (4.0.1+computecanada)
Processing /cvmfs/soft.computecanada.ca/custom/python/wheelhouse/generic/pyasn1-0.4.8+computecanada-py2.py3-none-any.whl
Requirement already satisfied: urllib3<1.27,>=1.21.1 in /localscratch/yinan.29323967.0/env/lib/python3.7/site-packages (from requests<3,>=2.21.0->tensorboard<3,>=2.3.0->tensorflow_gpu==2.3.0+computecanada) (1.26.8+computecanada)
Requirement already satisfied: idna<4,>=2.5 in /cvmfs/soft.computecanada.ca/easybuild/software/2017/Core/scipy-stack/2019a/lib/python3.7/site-packages (from requests<3,>=2.21.0->tensorboard<3,>=2.3.0->tensorflow_gpu==2.3.0+computecanada) (2.8)
Requirement already satisfied: charset-normalizer~=2.0.0 in /localscratch/yinan.29323967.0/env/lib/python3.7/site-packages (from requests<3,>=2.21.0->tensorboard<3,>=2.3.0->tensorflow_gpu==2.3.0+computecanada) (2.0.12+computecanada)
Requirement already satisfied: certifi>=2017.4.17 in /cvmfs/soft.computecanada.ca/easybuild/software/2017/Core/scipy-stack/2019a/lib/python3.7/site-packages (from requests<3,>=2.21.0->tensorboard<3,>=2.3.0->tensorflow_gpu==2.3.0+computecanada) (2018.11.29)
Processing /cvmfs/soft.computecanada.ca/custom/python/wheelhouse/generic/oauthlib-3.1.1+computecanada-py2.py3-none-any.whl
Installing collected packages: pyasn1, zipp, rsa, pyasn1-modules, oauthlib, cachetools, requests-oauthlib, importlib-metadata, google-auth, werkzeug, tensorboard-plugin-wit, tensorboard-data-server, markdown, grpcio, google-auth-oauthlib, absl-py, wrapt, tensorflow-estimator, tensorboard, scipy, opt-einsum, keras-preprocessing, h5py, google-pasta, gast, astunparse, tensorflow-gpu
  Attempting uninstall: pyasn1
    Found existing installation: pyasn1 0.4.3
    Not uninstalling pyasn1 at /cvmfs/soft.computecanada.ca/easybuild/software/2017/Core/scipy-stack/2019a/lib/python3.7/site-packages, outside environment /localscratch/yinan.29323967.0/env
    Can't uninstall 'pyasn1'. No files were found to uninstall.
  Attempting uninstall: zipp
    Found existing installation: zipp 0.3.3
    Not uninstalling zipp at /cvmfs/soft.computecanada.ca/easybuild/software/2017/Core/scipy-stack/2019a/lib/python3.7/site-packages, outside environment /localscratch/yinan.29323967.0/env
    Can't uninstall 'zipp'. No files were found to uninstall.
  Attempting uninstall: importlib-metadata
    Found existing installation: importlib-metadata 0.8
    Not uninstalling importlib-metadata at /cvmfs/soft.computecanada.ca/easybuild/software/2017/Core/scipy-stack/2019a/lib/python3.7/site-packages, outside environment /localscratch/yinan.29323967.0/env
    Can't uninstall 'importlib-metadata'. No files were found to uninstall.
  Attempting uninstall: scipy
    Found existing installation: scipy 1.2.0
    Not uninstalling scipy at /cvmfs/soft.computecanada.ca/easybuild/software/2017/Core/scipy-stack/2019a/lib/python3.7/site-packages, outside environment /localscratch/yinan.29323967.0/env
    Can't uninstall 'scipy'. No files were found to uninstall.
Successfully installed absl-py-1.0.0+computecanada astunparse-1.6.3+computecanada cachetools-4.2.4+computecanada gast-0.3.3+computecanada google-auth-2.3.3+computecanada google-auth-oauthlib-0.4.6+computecanada google-pasta-0.2.0+computecanada grpcio-1.38.0+computecanada h5py-2.10.0+computecanada importlib-metadata-4.10.1+computecanada keras-preprocessing-1.1.2+computecanada markdown-3.3.6+computecanada oauthlib-3.1.1+computecanada opt-einsum-3.3.0+computecanada pyasn1-0.4.8+computecanada pyasn1-modules-0.2.8+computecanada requests-oauthlib-1.3.0+computecanada rsa-4.8+computecanada scipy-1.4.1+computecanada tensorboard-2.8.0+computecanada tensorboard-data-server-0.6.1+computecanada tensorboard-plugin-wit-1.8.0+computecanada tensorflow-estimator-2.3.0+computecanada tensorflow-gpu-2.3.0+computecanada werkzeug-2.0.3+computecanada wrapt-1.11.2+computecanada zipp-3.7.0+computecanada
Looking in links: /cvmfs/soft.computecanada.ca/custom/python/wheelhouse/nix/avx2, /cvmfs/soft.computecanada.ca/custom/python/wheelhouse/nix/generic, /cvmfs/soft.computecanada.ca/custom/python/wheelhouse/generic
Processing /cvmfs/soft.computecanada.ca/custom/python/wheelhouse/generic/keras-2.8.0+computecanada-py2.py3-none-any.whl
Installing collected packages: Keras
Successfully installed Keras-2.8.0+computecanada
Looking in links: /cvmfs/soft.computecanada.ca/custom/python/wheelhouse/nix/avx2, /cvmfs/soft.computecanada.ca/custom/python/wheelhouse/nix/generic, /cvmfs/soft.computecanada.ca/custom/python/wheelhouse/generic
Processing /cvmfs/soft.computecanada.ca/custom/python/wheelhouse/generic/urllib3-1.26.7+computecanada-py2.py3-none-any.whl
Installing collected packages: urllib3
  Attempting uninstall: urllib3
    Found existing installation: urllib3 1.26.8+computecanada
    Uninstalling urllib3-1.26.8+computecanada:
      Successfully uninstalled urllib3-1.26.8+computecanada
Successfully installed urllib3-1.26.7+computecanada
Looking in links: /cvmfs/soft.computecanada.ca/custom/python/wheelhouse/nix/avx2, /cvmfs/soft.computecanada.ca/custom/python/wheelhouse/nix/generic, /cvmfs/soft.computecanada.ca/custom/python/wheelhouse/generic
Processing /cvmfs/soft.computecanada.ca/custom/python/wheelhouse/generic/nltk-3.7+computecanada-py3-none-any.whl
Requirement already satisfied: joblib in /localscratch/yinan.29323967.0/env/lib/python3.7/site-packages (from nltk) (1.1.0+computecanada)
Requirement already satisfied: click in /localscratch/yinan.29323967.0/env/lib/python3.7/site-packages (from nltk) (8.0.4+computecanada)
Processing /cvmfs/soft.computecanada.ca/custom/python/wheelhouse/generic/nltk-3.6.5+computecanada-py3-none-any.whl
Processing /cvmfs/soft.computecanada.ca/custom/python/wheelhouse/generic/nltk-3.6.3+computecanada-py3-none-any.whl
Requirement already satisfied: regex in /localscratch/yinan.29323967.0/env/lib/python3.7/site-packages (from nltk) (2020.11.13+computecanada)
Requirement already satisfied: tqdm in /localscratch/yinan.29323967.0/env/lib/python3.7/site-packages (from nltk) (4.63.0+computecanada)
Requirement already satisfied: importlib-metadata in /localscratch/yinan.29323967.0/env/lib/python3.7/site-packages (from click->nltk) (4.10.1+computecanada)
Requirement already satisfied: zipp>=0.5 in /localscratch/yinan.29323967.0/env/lib/python3.7/site-packages (from importlib-metadata->click->nltk) (3.7.0+computecanada)
Requirement already satisfied: typing-extensions>=3.6.4 in /localscratch/yinan.29323967.0/env/lib/python3.7/site-packages (from importlib-metadata->click->nltk) (4.0.1+computecanada)
Installing collected packages: nltk
Successfully installed nltk-3.6.3+computecanada
Looking in links: /cvmfs/soft.computecanada.ca/custom/python/wheelhouse/nix/avx2, /cvmfs/soft.computecanada.ca/custom/python/wheelhouse/nix/generic, /cvmfs/soft.computecanada.ca/custom/python/wheelhouse/generic
Processing /cvmfs/soft.computecanada.ca/custom/python/wheelhouse/generic/scikit_learn-0.22.1+computecanada-cp37-cp37m-linux_x86_64.whl
Requirement already satisfied: joblib>=0.11 in /localscratch/yinan.29323967.0/env/lib/python3.7/site-packages (from scikit-learn==0.22.1) (1.1.0+computecanada)
Requirement already satisfied: scipy>=0.17.0 in /localscratch/yinan.29323967.0/env/lib/python3.7/site-packages (from scikit-learn==0.22.1) (1.4.1+computecanada)
Requirement already satisfied: numpy>=1.11.0 in /cvmfs/soft.computecanada.ca/easybuild/software/2017/Core/scipy-stack/2019a/lib/python3.7/site-packages (from scikit-learn==0.22.1) (1.16.0)
Installing collected packages: scikit-learn
Successfully installed scikit-learn-0.22.1+computecanada
Looking in links: /cvmfs/soft.computecanada.ca/custom/python/wheelhouse/nix/avx2, /cvmfs/soft.computecanada.ca/custom/python/wheelhouse/nix/generic, /cvmfs/soft.computecanada.ca/custom/python/wheelhouse/generic
Requirement already satisfied: tokenizers==0.5.2 in /localscratch/yinan.29323967.0/env/lib/python3.7/site-packages (0.5.2+computecanada)
wandb: Appending key for api.wandb.ai to your netrc file: /home/yinan/.netrc
Starting Task
2022-03-24 01:08:01.395044: I tensorflow/stream_executor/platform/default/dso_loader.cc:48] Successfully opened dynamic library libcudart.so.10.1
[nltk_data] Downloading package stopwords to /home/yinan/nltk_data...
[nltk_data]   Package stopwords is already up-to-date!
[nltk_data] Downloading package wordnet to /home/yinan/nltk_data...
[nltk_data]   Package wordnet is already up-to-date!
wandb: Currently logged in as: yinanazhou (use `wandb login --relogin` to force relogin)
wandb: wandb version 0.12.11 is available!  To upgrade, please run:
wandb:  $ pip install wandb --upgrade
2022-03-24 01:08:18.489040: I tensorflow/stream_executor/platform/default/dso_loader.cc:48] Successfully opened dynamic library libcudart.so.10.1
wandb: Tracking run with wandb version 0.12.5
wandb: Syncing run legendary-darkness-4
wandb: ⭐️ View project at https://wandb.ai/yinanazhou/xl_512_bs_8_lr_1e06_es_10_lc_True_nr_False_sr_False_stem_False_lemma_True_repeat_1_fold_1
wandb: 🚀 View run at https://wandb.ai/yinanazhou/xl_512_bs_8_lr_1e06_es_10_lc_True_nr_False_sr_False_stem_False_lemma_True_repeat_1_fold_1/runs/7n09e51x
wandb: Run data is saved locally in /project/6002780/yinan/Thesis_MER_Lyrics/lyric-emotion/wandb/run-20220324_010816-7n09e51x
wandb: Run `wandb offline` to turn off syncing.

Validation loss decreased (inf --> 1.433387).  Saving model ...
Validation loss decreased (1.433387 --> 1.413981).  Saving model ...
Validation loss decreased (1.413981 --> 1.397822).  Saving model ...
Validation loss decreased (1.397822 --> 1.384927).  Saving model ...
Validation loss decreased (1.384927 --> 1.374721).  Saving model ...
Validation loss decreased (1.374721 --> 1.365957).  Saving model ...
Validation loss decreased (1.365957 --> 1.358616).  Saving model ...
Validation loss decreased (1.358616 --> 1.352624).  Saving model ...
Validation loss decreased (1.352624 --> 1.347371).  Saving model ...
Validation loss decreased (1.347371 --> 1.341487).  Saving model ...
Validation loss decreased (1.341487 --> 1.335491).  Saving model ...
Validation loss decreased (1.335491 --> 1.330084).  Saving model ...
Validation loss decreased (1.330084 --> 1.324555).  Saving model ...
Validation loss decreased (1.324555 --> 1.319240).  Saving model ...
Validation loss decreased (1.319240 --> 1.314237).  Saving model ...
Validation loss decreased (1.314237 --> 1.308590).  Saving model ...
Validation loss decreased (1.308590 --> 1.303107).  Saving model ...
Validation loss decreased (1.303107 --> 1.296859).  Saving model ...
Validation loss decreased (1.296859 --> 1.290189).  Saving model ...
Validation loss decreased (1.290189 --> 1.282792).  Saving model ...
Validation loss decreased (1.282792 --> 1.275819).  Saving model ...
Validation loss decreased (1.275819 --> 1.268752).  Saving model ...
Validation loss decreased (1.268752 --> 1.262562).  Saving model ...
Validation loss decreased (1.262562 --> 1.255516).  Saving model ...
Validation loss decreased (1.255516 --> 1.247164).  Saving model ...
Validation loss decreased (1.247164 --> 1.239761).  Saving model ...
Validation loss decreased (1.239761 --> 1.233390).  Saving model ...
Validation loss decreased (1.233390 --> 1.226658).  Saving model ...
Validation loss decreased (1.226658 --> 1.220915).  Saving model ...
Validation loss decreased (1.220915 --> 1.215830).  Saving model ...
Validation loss decreased (1.215830 --> 1.207669).  Saving model ...
Validation loss decreased (1.207669 --> 1.203214).  Saving model ...
Validation loss decreased (1.203214 --> 1.200058).  Saving model ...
Validation loss decreased (1.200058 --> 1.193948).  Saving model ...
Validation loss decreased (1.193948 --> 1.186832).  Saving model ...
Validation loss decreased (1.186832 --> 1.183043).  Saving model ...
Validation loss decreased (1.183043 --> 1.175233).  Saving model ...
Validation loss decreased (1.175233 --> 1.170703).  Saving model ...
Validation loss decreased (1.170703 --> 1.168870).  Saving model ...
Validation loss decreased (1.168870 --> 1.166053).  Saving model ...
Validation loss decreased (1.166053 --> 1.161387).  Saving model ...
Validation loss decreased (1.161387 --> 1.154649).  Saving model ...
Validation loss decreased (1.154649 --> 1.151328).  Saving model ...
Validation loss decreased (1.151328 --> 1.147662).  Saving model ...
Validation loss decreased (1.147662 --> 1.144545).  Saving model ...
Validation loss decreased (1.144545 --> 1.139429).  Saving model ...
Validation loss decreased (1.139429 --> 1.135583).  Saving model ...
Validation loss decreased (1.135583 --> 1.132313).  Saving model ...
Validation loss decreased (1.132313 --> 1.126347).  Saving model ...
Validation loss decreased (1.126347 --> 1.123219).  Saving model ...
Validation loss decreased (1.123219 --> 1.117370).  Saving model ...
Validation loss decreased (1.117370 --> 1.114682).  Saving model ...
Validation loss decreased (1.114682 --> 1.112565).  Saving model ...
Validation loss decreased (1.112565 --> 1.108434).  Saving model ...
EarlyStopping counter: 1 out of 10.0
Validation loss decreased (1.108434 --> 1.104441).  Saving model ...
Validation loss decreased (1.104441 --> 1.099149).  Saving model ...
Validation loss decreased (1.099149 --> 1.093575).  Saving model ...
Validation loss decreased (1.093575 --> 1.088544).  Saving model ...
EarlyStopping counter: 1 out of 10.0
Validation loss decreased (1.088544 --> 1.088525).  Saving model ...
Validation loss decreased (1.088525 --> 1.084370).  Saving model ...
Validation loss decreased (1.084370 --> 1.080092).  Saving model ...
Validation loss decreased (1.080092 --> 1.076291).  Saving model ...
Validation loss decreased (1.076291 --> 1.076033).  Saving model ...
Validation loss decreased (1.076033 --> 1.072529).  Saving model ...
Validation loss decreased (1.072529 --> 1.070793).  Saving model ...
Validation loss decreased (1.070793 --> 1.066482).  Saving model ...
Validation loss decreased (1.066482 --> 1.062048).  Saving model ...
Validation loss decreased (1.062048 --> 1.059040).  Saving model ...
Validation loss decreased (1.059040 --> 1.055943).  Saving model ...
Validation loss decreased (1.055943 --> 1.053744).  Saving model ...
Validation loss decreased (1.053744 --> 1.053065).  Saving model ...
Validation loss decreased (1.053065 --> 1.049087).  Saving model ...
Validation loss decreased (1.049087 --> 1.046876).  Saving model ...
Validation loss decreased (1.046876 --> 1.045297).  Saving model ...
Validation loss decreased (1.045297 --> 1.042906).  Saving model ...
Validation loss decreased (1.042906 --> 1.040165).  Saving model ...
Validation loss decreased (1.040165 --> 1.037659).  Saving model ...
Validation loss decreased (1.037659 --> 1.034924).  Saving model ...
EarlyStopping counter: 1 out of 10.0
EarlyStopping counter: 2 out of 10.0
EarlyStopping counter: 3 out of 10.0
Validation loss decreased (1.034924 --> 1.032577).  Saving model ...
Validation loss decreased (1.032577 --> 1.028134).  Saving model ...
Validation loss decreased (1.028134 --> 1.025002).  Saving model ...
Validation loss decreased (1.025002 --> 1.021671).  Saving model ...
EarlyStopping counter: 1 out of 10.0
Validation loss decreased (1.021671 --> 1.021181).  Saving model ...
Validation loss decreased (1.021181 --> 1.019643).  Saving model ...
Validation loss decreased (1.019643 --> 1.015952).  Saving model ...
Validation loss decreased (1.015952 --> 1.011357).  Saving model ...
EarlyStopping counter: 1 out of 10.0
EarlyStopping counter: 2 out of 10.0
EarlyStopping counter: 3 out of 10.0
Validation loss decreased (1.011357 --> 1.010495).  Saving model ...
Validation loss decreased (1.010495 --> 1.009749).  Saving model ...
Validation loss decreased (1.009749 --> 1.006114).  Saving model ...
EarlyStopping counter: 1 out of 10.0
Validation loss decreased (1.006114 --> 1.005783).  Saving model ...
Validation loss decreased (1.005783 --> 1.003774).  Saving model ...
EarlyStopping counter: 1 out of 10.0
EarlyStopping counter: 2 out of 10.0
EarlyStopping counter: 3 out of 10.0
Validation loss decreased (1.003774 --> 1.002238).  Saving model ...
Validation loss decreased (1.002238 --> 0.998459).  Saving model ...
EarlyStopping counter: 1 out of 10.0
EarlyStopping counter: 2 out of 10.0
Validation loss decreased (0.998459 --> 0.996030).  Saving model ...
Validation loss decreased (0.996030 --> 0.992690).  Saving model ...
Validation loss decreased (0.992690 --> 0.991956).  Saving model ...
EarlyStopping counter: 1 out of 10.0
EarlyStopping counter: 2 out of 10.0
EarlyStopping counter: 3 out of 10.0
EarlyStopping counter: 4 out of 10.0
EarlyStopping counter: 5 out of 10.0
Validation loss decreased (0.991956 --> 0.990560).  Saving model ...
Validation loss decreased (0.990560 --> 0.989200).  Saving model ...
EarlyStopping counter: 1 out of 10.0
Validation loss decreased (0.989200 --> 0.986148).  Saving model ...
Validation loss decreased (0.986148 --> 0.985434).  Saving model ...
Validation loss decreased (0.985434 --> 0.984380).  Saving model ...
Validation loss decreased (0.984380 --> 0.982830).  Saving model ...
EarlyStopping counter: 1 out of 10.0
Validation loss decreased (0.982830 --> 0.982290).  Saving model ...
EarlyStopping counter: 1 out of 10.0
EarlyStopping counter: 2 out of 10.0
EarlyStopping counter: 3 out of 10.0
EarlyStopping counter: 4 out of 10.0
EarlyStopping counter: 5 out of 10.0
EarlyStopping counter: 6 out of 10.0
EarlyStopping counter: 7 out of 10.0
Validation loss decreased (0.982290 --> 0.982124).  Saving model ...
Validation loss decreased (0.982124 --> 0.979782).  Saving model ...
EarlyStopping counter: 1 out of 10.0
EarlyStopping counter: 2 out of 10.0
EarlyStopping counter: 3 out of 10.0
EarlyStopping counter: 4 out of 10.0
EarlyStopping counter: 5 out of 10.0
EarlyStopping counter: 6 out of 10.0
EarlyStopping counter: 7 out of 10.0
EarlyStopping counter: 8 out of 10.0
EarlyStopping counter: 9 out of 10.0
EarlyStopping counter: 10 out of 10.0
/localscratch/yinan.29323967.0/env/lib/python3.7/site-packages/torch/nn/functional.py:1794: UserWarning: nn.functional.tanh is deprecated. Use torch.tanh instead.
  warnings.warn("nn.functional.tanh is deprecated. Use torch.tanh instead.")
/localscratch/yinan.29323967.0/env/lib/python3.7/site-packages/transformers/optimization.py:155: UserWarning: This overload of add_ is deprecated:
	add_(Number alpha, Tensor other)
Consider using one of the following signatures instead:
	add_(Tensor other, *, Number alpha) (Triggered internally at  ../torch/csrc/utils/python_arg_parser.cpp:1025.)
  exp_avg.mul_(beta1).add_(1.0 - beta1, grad)
wandb: Waiting for W&B process to finish, PID 25130... (success).
wandb: - 0.00MB of 0.00MB uploaded (0.00MB deduped)wandb: \ 0.00MB of 0.00MB uploaded (0.00MB deduped)wandb: | 0.00MB of 0.00MB uploaded (0.00MB deduped)wandb: / 0.00MB of 0.00MB uploaded (0.00MB deduped)wandb: - 0.00MB of 0.00MB uploaded (0.00MB deduped)wandb: \ 0.00MB of 0.00MB uploaded (0.00MB deduped)wandb: | 0.00MB of 0.00MB uploaded (0.00MB deduped)wandb: / 0.00MB of 0.00MB uploaded (0.00MB deduped)wandb: - 0.00MB of 0.00MB uploaded (0.00MB deduped)wandb: \ 0.00MB of 0.00MB uploaded (0.00MB deduped)wandb: | 0.00MB of 0.00MB uploaded (0.00MB deduped)wandb: / 0.00MB of 0.00MB uploaded (0.00MB deduped)wandb: - 0.00MB of 0.00MB uploaded (0.00MB deduped)wandb:                                                                                
wandb: Run history:
wandb:     e_F1 ▁▂▃▄▅▆▆▆▆▆▆▆▆▇▇▇▇▇▇▇▇▇▇▇▇▇▇▇████████████
wandb:   e_loss ██▇▇▆▆▆▅▅▄▄▄▄▃▃▃▃▃▂▂▂▂▂▂▂▂▁▁▁▁▁▁▁▁▁▁▁▁▁▁
wandb:     t_F1 ▁▁▂▃▃▄▄▅▅▅▅▅▅▆▆▅▆▆▆▆▆▇▆▇▇▇▇▇▇▇█▇▇█▇▇████
wandb:   t_loss ██▇▇▇▆▆▆▆▅▅▅▅▄▄▄▄▄▃▃▃▃▃▃▂▂▂▂▂▂▂▂▂▂▁▁▁▁▁▁
wandb: 
wandb: Run summary:
wandb:     e_F1 59.99516
wandb:   e_loss 0.98373
wandb:     t_F1 74.65099
wandb:   t_loss 0.71104
wandb: 
wandb: Synced 4 W&B file(s), 0 media file(s), 0 artifact file(s) and 0 other file(s)
wandb: Synced legendary-darkness-4: https://wandb.ai/yinanazhou/xl_512_bs_8_lr_1e06_es_10_lc_True_nr_False_sr_False_stem_False_lemma_True_repeat_1_fold_1/runs/7n09e51x
wandb: Find logs at: ./wandb/run-20220324_010816-7n09e51x/logs/debug.log
wandb: 

wandb: wandb version 0.12.11 is available!  To upgrade, please run:
wandb:  $ pip install wandb --upgrade
2022-03-24 02:43:05.477040: I tensorflow/stream_executor/platform/default/dso_loader.cc:48] Successfully opened dynamic library libcudart.so.10.1
wandb: Tracking run with wandb version 0.12.5
wandb: Syncing run dazzling-shadow-4
wandb: ⭐️ View project at https://wandb.ai/yinanazhou/xl_512_bs_8_lr_1e06_es_10_lc_True_nr_False_sr_False_stem_False_lemma_True_repeat_1_fold_2
wandb: 🚀 View run at https://wandb.ai/yinanazhou/xl_512_bs_8_lr_1e06_es_10_lc_True_nr_False_sr_False_stem_False_lemma_True_repeat_1_fold_2/runs/25xfzdet
wandb: Run data is saved locally in /project/6002780/yinan/Thesis_MER_Lyrics/lyric-emotion/wandb/run-20220324_024302-25xfzdet
wandb: Run `wandb offline` to turn off syncing.

Validation loss decreased (inf --> 1.637617).  Saving model ...
Validation loss decreased (1.637617 --> 1.569711).  Saving model ...
Validation loss decreased (1.569711 --> 1.517678).  Saving model ...
Validation loss decreased (1.517678 --> 1.481642).  Saving model ...
Validation loss decreased (1.481642 --> 1.451533).  Saving model ...
Validation loss decreased (1.451533 --> 1.430918).  Saving model ...
Validation loss decreased (1.430918 --> 1.415539).  Saving model ...
Validation loss decreased (1.415539 --> 1.404095).  Saving model ...
Validation loss decreased (1.404095 --> 1.395169).  Saving model ...
Validation loss decreased (1.395169 --> 1.387975).  Saving model ...
Validation loss decreased (1.387975 --> 1.381084).  Saving model ...
Validation loss decreased (1.381084 --> 1.374122).  Saving model ...
Validation loss decreased (1.374122 --> 1.367167).  Saving model ...
Validation loss decreased (1.367167 --> 1.360463).  Saving model ...
Validation loss decreased (1.360463 --> 1.352800).  Saving model ...
Validation loss decreased (1.352800 --> 1.346209).  Saving model ...
Validation loss decreased (1.346209 --> 1.339175).  Saving model ...
Validation loss decreased (1.339175 --> 1.333028).  Saving model ...
Validation loss decreased (1.333028 --> 1.326323).  Saving model ...
Validation loss decreased (1.326323 --> 1.318548).  Saving model ...
Validation loss decreased (1.318548 --> 1.309664).  Saving model ...
Validation loss decreased (1.309664 --> 1.299358).  Saving model ...
Validation loss decreased (1.299358 --> 1.289752).  Saving model ...
Validation loss decreased (1.289752 --> 1.282007).  Saving model ...
Validation loss decreased (1.282007 --> 1.273056).  Saving model ...
Validation loss decreased (1.273056 --> 1.264568).  Saving model ...
Validation loss decreased (1.264568 --> 1.255350).  Saving model ...
Validation loss decreased (1.255350 --> 1.245576).  Saving model ...
Validation loss decreased (1.245576 --> 1.237645).  Saving model ...
Validation loss decreased (1.237645 --> 1.229916).  Saving model ...
Validation loss decreased (1.229916 --> 1.222482).  Saving model ...
Validation loss decreased (1.222482 --> 1.214064).  Saving model ...
Validation loss decreased (1.214064 --> 1.206682).  Saving model ...
Validation loss decreased (1.206682 --> 1.199418).  Saving model ...
Validation loss decreased (1.199418 --> 1.191753).  Saving model ...
Validation loss decreased (1.191753 --> 1.184694).  Saving model ...
Validation loss decreased (1.184694 --> 1.177800).  Saving model ...
Validation loss decreased (1.177800 --> 1.170446).  Saving model ...
Validation loss decreased (1.170446 --> 1.163320).  Saving model ...
Validation loss decreased (1.163320 --> 1.157689).  Saving model ...
Validation loss decreased (1.157689 --> 1.151255).  Saving model ...
Validation loss decreased (1.151255 --> 1.145451).  Saving model ...
Validation loss decreased (1.145451 --> 1.138705).  Saving model ...
Validation loss decreased (1.138705 --> 1.133162).  Saving model ...
Validation loss decreased (1.133162 --> 1.126811).  Saving model ...
Validation loss decreased (1.126811 --> 1.123277).  Saving model ...
Validation loss decreased (1.123277 --> 1.115582).  Saving model ...
Validation loss decreased (1.115582 --> 1.110202).  Saving model ...
Validation loss decreased (1.110202 --> 1.105627).  Saving model ...
Validation loss decreased (1.105627 --> 1.099573).  Saving model ...
Validation loss decreased (1.099573 --> 1.092196).  Saving model ...
Validation loss decreased (1.092196 --> 1.089481).  Saving model ...
Validation loss decreased (1.089481 --> 1.085281).  Saving model ...
Validation loss decreased (1.085281 --> 1.079250).  Saving model ...
Validation loss decreased (1.079250 --> 1.073706).  Saving model ...
Validation loss decreased (1.073706 --> 1.068999).  Saving model ...
Validation loss decreased (1.068999 --> 1.064306).  Saving model ...
Validation loss decreased (1.064306 --> 1.058283).  Saving model ...
Validation loss decreased (1.058283 --> 1.055811).  Saving model ...
Validation loss decreased (1.055811 --> 1.053210).  Saving model ...
Validation loss decreased (1.053210 --> 1.051516).  Saving model ...
Validation loss decreased (1.051516 --> 1.049545).  Saving model ...
Validation loss decreased (1.049545 --> 1.042098).  Saving model ...
Validation loss decreased (1.042098 --> 1.037204).  Saving model ...
Validation loss decreased (1.037204 --> 1.036592).  Saving model ...
Validation loss decreased (1.036592 --> 1.032813).  Saving model ...
Validation loss decreased (1.032813 --> 1.027213).  Saving model ...
Validation loss decreased (1.027213 --> 1.023811).  Saving model ...
Validation loss decreased (1.023811 --> 1.018100).  Saving model ...
Validation loss decreased (1.018100 --> 1.016113).  Saving model ...
Validation loss decreased (1.016113 --> 1.011980).  Saving model ...
Validation loss decreased (1.011980 --> 1.011124).  Saving model ...
Validation loss decreased (1.011124 --> 1.007389).  Saving model ...
Validation loss decreased (1.007389 --> 1.002698).  Saving model ...
Validation loss decreased (1.002698 --> 1.000930).  Saving model ...
Validation loss decreased (1.000930 --> 0.996922).  Saving model ...
Validation loss decreased (0.996922 --> 0.993681).  Saving model ...
Validation loss decreased (0.993681 --> 0.993175).  Saving model ...
Validation loss decreased (0.993175 --> 0.990607).  Saving model ...
Validation loss decreased (0.990607 --> 0.988494).  Saving model ...
Validation loss decreased (0.988494 --> 0.986232).  Saving model ...
Validation loss decreased (0.986232 --> 0.982886).  Saving model ...
Validation loss decreased (0.982886 --> 0.981323).  Saving model ...
Validation loss decreased (0.981323 --> 0.978591).  Saving model ...
Validation loss decreased (0.978591 --> 0.975818).  Saving model ...
EarlyStopping counter: 1 out of 10.0
Validation loss decreased (0.975818 --> 0.973748).  Saving model ...
Validation loss decreased (0.973748 --> 0.972569).  Saving model ...
Validation loss decreased (0.972569 --> 0.971096).  Saving model ...
Validation loss decreased (0.971096 --> 0.968443).  Saving model ...
EarlyStopping counter: 1 out of 10.0
Validation loss decreased (0.968443 --> 0.967268).  Saving model ...
Validation loss decreased (0.967268 --> 0.967132).  Saving model ...
Validation loss decreased (0.967132 --> 0.962529).  Saving model ...
Validation loss decreased (0.962529 --> 0.960666).  Saving model ...
Validation loss decreased (0.960666 --> 0.958585).  Saving model ...
Validation loss decreased (0.958585 --> 0.956729).  Saving model ...
Validation loss decreased (0.956729 --> 0.956077).  Saving model ...
Validation loss decreased (0.956077 --> 0.953676).  Saving model ...
Validation loss decreased (0.953676 --> 0.952287).  Saving model ...
EarlyStopping counter: 1 out of 10.0
EarlyStopping counter: 2 out of 10.0
EarlyStopping counter: 3 out of 10.0
EarlyStopping counter: 4 out of 10.0
Validation loss decreased (0.952287 --> 0.952191).  Saving model ...
Validation loss decreased (0.952191 --> 0.950223).  Saving model ...
Validation loss decreased (0.950223 --> 0.950220).  Saving model ...
Validation loss decreased (0.950220 --> 0.950003).  Saving model ...
Validation loss decreased (0.950003 --> 0.949670).  Saving model ...
EarlyStopping counter: 1 out of 10.0
Validation loss decreased (0.949670 --> 0.949658).  Saving model ...
Validation loss decreased (0.949658 --> 0.949193).  Saving model ...
EarlyStopping counter: 1 out of 10.0
EarlyStopping counter: 2 out of 10.0
Validation loss decreased (0.949193 --> 0.948504).  Saving model ...
Validation loss decreased (0.948504 --> 0.945773).  Saving model ...
Validation loss decreased (0.945773 --> 0.944670).  Saving model ...
EarlyStopping counter: 1 out of 10.0
EarlyStopping counter: 2 out of 10.0
EarlyStopping counter: 3 out of 10.0
EarlyStopping counter: 4 out of 10.0
EarlyStopping counter: 5 out of 10.0
EarlyStopping counter: 6 out of 10.0
EarlyStopping counter: 7 out of 10.0
EarlyStopping counter: 8 out of 10.0
EarlyStopping counter: 9 out of 10.0
EarlyStopping counter: 10 out of 10.0
/localscratch/yinan.29323967.0/env/lib/python3.7/site-packages/torch/nn/functional.py:1794: UserWarning: nn.functional.tanh is deprecated. Use torch.tanh instead.
  warnings.warn("nn.functional.tanh is deprecated. Use torch.tanh instead.")
wandb: Waiting for W&B process to finish, PID 30378... (success).
wandb: - 0.00MB of 0.00MB uploaded (0.00MB deduped)wandb: \ 0.00MB of 0.00MB uploaded (0.00MB deduped)wandb: | 0.00MB of 0.00MB uploaded (0.00MB deduped)wandb: / 0.00MB of 0.00MB uploaded (0.00MB deduped)wandb: - 0.00MB of 0.00MB uploaded (0.00MB deduped)wandb: \ 0.00MB of 0.00MB uploaded (0.00MB deduped)wandb: | 0.00MB of 0.00MB uploaded (0.00MB deduped)wandb: / 0.00MB of 0.00MB uploaded (0.00MB deduped)wandb: - 0.00MB of 0.00MB uploaded (0.00MB deduped)wandb: \ 0.00MB of 0.00MB uploaded (0.00MB deduped)wandb: | 0.00MB of 0.00MB uploaded (0.00MB deduped)wandb: / 0.00MB of 0.00MB uploaded (0.00MB deduped)wandb: - 0.00MB of 0.00MB uploaded (0.00MB deduped)wandb:                                                                                
wandb: Run history:
wandb:     e_F1 ▁▁▂▃▄▅▅▆▆▇▇▇▇▇▇▇▇▇▇█▇███████████████████
wandb:   e_loss █▆▆▅▅▅▅▄▄▄▄▃▃▃▃▃▂▂▂▂▂▂▂▂▁▁▁▁▁▁▁▁▁▁▁▁▁▁▁▁
wandb:     t_F1 ▁▂▂▃▃▃▄▄▄▄▄▅▅▅▆▆▆▆▆▆▇▇▇▇▇▇▇▇▇▇▇▇████████
wandb:   t_loss █▇▆▆▆▆▅▅▅▅▅▅▅▄▄▄▄▄▃▃▃▃▃▃▂▃▂▂▂▂▂▂▂▂▁▁▁▁▁▁
wandb: 
wandb: Run summary:
wandb:     e_F1 59.82529
wandb:   e_loss 0.9492
wandb:     t_F1 70.95621
wandb:   t_loss 0.74282
wandb: 
wandb: Synced 4 W&B file(s), 0 media file(s), 0 artifact file(s) and 0 other file(s)
wandb: Synced dazzling-shadow-4: https://wandb.ai/yinanazhou/xl_512_bs_8_lr_1e06_es_10_lc_True_nr_False_sr_False_stem_False_lemma_True_repeat_1_fold_2/runs/25xfzdet
wandb: Find logs at: ./wandb/run-20220324_024302-25xfzdet/logs/debug.log
wandb: 

wandb: wandb version 0.12.11 is available!  To upgrade, please run:
wandb:  $ pip install wandb --upgrade
2022-03-24 04:02:38.222264: I tensorflow/stream_executor/platform/default/dso_loader.cc:48] Successfully opened dynamic library libcudart.so.10.1
wandb: Tracking run with wandb version 0.12.5
wandb: Syncing run woven-dream-4
wandb: ⭐️ View project at https://wandb.ai/yinanazhou/xl_512_bs_8_lr_1e06_es_10_lc_True_nr_False_sr_False_stem_False_lemma_True_repeat_2_fold_1
wandb: 🚀 View run at https://wandb.ai/yinanazhou/xl_512_bs_8_lr_1e06_es_10_lc_True_nr_False_sr_False_stem_False_lemma_True_repeat_2_fold_1/runs/2amu86a3
wandb: Run data is saved locally in /project/6002780/yinan/Thesis_MER_Lyrics/lyric-emotion/wandb/run-20220324_040235-2amu86a3
wandb: Run `wandb offline` to turn off syncing.

Validation loss decreased (inf --> 1.437048).  Saving model ...
Validation loss decreased (1.437048 --> 1.418369).  Saving model ...
Validation loss decreased (1.418369 --> 1.403020).  Saving model ...
Validation loss decreased (1.403020 --> 1.390938).  Saving model ...
Validation loss decreased (1.390938 --> 1.381492).  Saving model ...
Validation loss decreased (1.381492 --> 1.373631).  Saving model ...
Validation loss decreased (1.373631 --> 1.366051).  Saving model ...
Validation loss decreased (1.366051 --> 1.360034).  Saving model ...
Validation loss decreased (1.360034 --> 1.354503).  Saving model ...
Validation loss decreased (1.354503 --> 1.349172).  Saving model ...
Validation loss decreased (1.349172 --> 1.343556).  Saving model ...
Validation loss decreased (1.343556 --> 1.338175).  Saving model ...
Validation loss decreased (1.338175 --> 1.332215).  Saving model ...
Validation loss decreased (1.332215 --> 1.327251).  Saving model ...
Validation loss decreased (1.327251 --> 1.322155).  Saving model ...
Validation loss decreased (1.322155 --> 1.315851).  Saving model ...
Validation loss decreased (1.315851 --> 1.310039).  Saving model ...
Validation loss decreased (1.310039 --> 1.303581).  Saving model ...
Validation loss decreased (1.303581 --> 1.297680).  Saving model ...
Validation loss decreased (1.297680 --> 1.290901).  Saving model ...
Validation loss decreased (1.290901 --> 1.284077).  Saving model ...
Validation loss decreased (1.284077 --> 1.276513).  Saving model ...
Validation loss decreased (1.276513 --> 1.268677).  Saving model ...
Validation loss decreased (1.268677 --> 1.261140).  Saving model ...
Validation loss decreased (1.261140 --> 1.255531).  Saving model ...
Validation loss decreased (1.255531 --> 1.249760).  Saving model ...
Validation loss decreased (1.249760 --> 1.243560).  Saving model ...
Validation loss decreased (1.243560 --> 1.237974).  Saving model ...
Validation loss decreased (1.237974 --> 1.231415).  Saving model ...
Validation loss decreased (1.231415 --> 1.224477).  Saving model ...
Validation loss decreased (1.224477 --> 1.217676).  Saving model ...
Validation loss decreased (1.217676 --> 1.210981).  Saving model ...
Validation loss decreased (1.210981 --> 1.206487).  Saving model ...
Validation loss decreased (1.206487 --> 1.200468).  Saving model ...
Validation loss decreased (1.200468 --> 1.194617).  Saving model ...
Validation loss decreased (1.194617 --> 1.189555).  Saving model ...
Validation loss decreased (1.189555 --> 1.184155).  Saving model ...
Validation loss decreased (1.184155 --> 1.177746).  Saving model ...
Validation loss decreased (1.177746 --> 1.172045).  Saving model ...
Validation loss decreased (1.172045 --> 1.166595).  Saving model ...
Validation loss decreased (1.166595 --> 1.161519).  Saving model ...
Validation loss decreased (1.161519 --> 1.155543).  Saving model ...
Validation loss decreased (1.155543 --> 1.149725).  Saving model ...
Validation loss decreased (1.149725 --> 1.144333).  Saving model ...
Validation loss decreased (1.144333 --> 1.138982).  Saving model ...
Validation loss decreased (1.138982 --> 1.134487).  Saving model ...
Validation loss decreased (1.134487 --> 1.129537).  Saving model ...
Validation loss decreased (1.129537 --> 1.124406).  Saving model ...
Validation loss decreased (1.124406 --> 1.119564).  Saving model ...
Validation loss decreased (1.119564 --> 1.114420).  Saving model ...
Validation loss decreased (1.114420 --> 1.108849).  Saving model ...
Validation loss decreased (1.108849 --> 1.103893).  Saving model ...
Validation loss decreased (1.103893 --> 1.101589).  Saving model ...
Validation loss decreased (1.101589 --> 1.097265).  Saving model ...
Validation loss decreased (1.097265 --> 1.091609).  Saving model ...
Validation loss decreased (1.091609 --> 1.087555).  Saving model ...
Validation loss decreased (1.087555 --> 1.084143).  Saving model ...
Validation loss decreased (1.084143 --> 1.078821).  Saving model ...
Validation loss decreased (1.078821 --> 1.074864).  Saving model ...
Validation loss decreased (1.074864 --> 1.071371).  Saving model ...
Validation loss decreased (1.071371 --> 1.067720).  Saving model ...
Validation loss decreased (1.067720 --> 1.064270).  Saving model ...
Validation loss decreased (1.064270 --> 1.059624).  Saving model ...
Validation loss decreased (1.059624 --> 1.057027).  Saving model ...
Validation loss decreased (1.057027 --> 1.052478).  Saving model ...
Validation loss decreased (1.052478 --> 1.049077).  Saving model ...
Validation loss decreased (1.049077 --> 1.044327).  Saving model ...
Validation loss decreased (1.044327 --> 1.042608).  Saving model ...
Validation loss decreased (1.042608 --> 1.038998).  Saving model ...
Validation loss decreased (1.038998 --> 1.035164).  Saving model ...
Validation loss decreased (1.035164 --> 1.032672).  Saving model ...
Validation loss decreased (1.032672 --> 1.030601).  Saving model ...
Validation loss decreased (1.030601 --> 1.028998).  Saving model ...
Validation loss decreased (1.028998 --> 1.026120).  Saving model ...
Validation loss decreased (1.026120 --> 1.023560).  Saving model ...
Validation loss decreased (1.023560 --> 1.020979).  Saving model ...
Validation loss decreased (1.020979 --> 1.019806).  Saving model ...
Validation loss decreased (1.019806 --> 1.017987).  Saving model ...
Validation loss decreased (1.017987 --> 1.014303).  Saving model ...
Validation loss decreased (1.014303 --> 1.011155).  Saving model ...
Validation loss decreased (1.011155 --> 1.010068).  Saving model ...
Validation loss decreased (1.010068 --> 1.008360).  Saving model ...
Validation loss decreased (1.008360 --> 1.005768).  Saving model ...
Validation loss decreased (1.005768 --> 1.004706).  Saving model ...
Validation loss decreased (1.004706 --> 1.004668).  Saving model ...
Validation loss decreased (1.004668 --> 1.002985).  Saving model ...
Validation loss decreased (1.002985 --> 1.000414).  Saving model ...
Validation loss decreased (1.000414 --> 0.998953).  Saving model ...
Validation loss decreased (0.998953 --> 0.995742).  Saving model ...
EarlyStopping counter: 1 out of 10.0
Validation loss decreased (0.995742 --> 0.994968).  Saving model ...
Validation loss decreased (0.994968 --> 0.992247).  Saving model ...
Validation loss decreased (0.992247 --> 0.990365).  Saving model ...
Validation loss decreased (0.990365 --> 0.988408).  Saving model ...
Validation loss decreased (0.988408 --> 0.987237).  Saving model ...
EarlyStopping counter: 1 out of 10.0
Validation loss decreased (0.987237 --> 0.986176).  Saving model ...
Validation loss decreased (0.986176 --> 0.984082).  Saving model ...
Validation loss decreased (0.984082 --> 0.982046).  Saving model ...
Validation loss decreased (0.982046 --> 0.980907).  Saving model ...
Validation loss decreased (0.980907 --> 0.980088).  Saving model ...
Validation loss decreased (0.980088 --> 0.979719).  Saving model ...
Validation loss decreased (0.979719 --> 0.977835).  Saving model ...
Validation loss decreased (0.977835 --> 0.977716).  Saving model ...
Validation loss decreased (0.977716 --> 0.976041).  Saving model ...
EarlyStopping counter: 1 out of 10.0
Validation loss decreased (0.976041 --> 0.974163).  Saving model ...
Validation loss decreased (0.974163 --> 0.973355).  Saving model ...
EarlyStopping counter: 1 out of 10.0
Validation loss decreased (0.973355 --> 0.972487).  Saving model ...
Validation loss decreased (0.972487 --> 0.971558).  Saving model ...
EarlyStopping counter: 1 out of 10.0
Validation loss decreased (0.971558 --> 0.971505).  Saving model ...
EarlyStopping counter: 1 out of 10.0
Validation loss decreased (0.971505 --> 0.970326).  Saving model ...
Validation loss decreased (0.970326 --> 0.969137).  Saving model ...
EarlyStopping counter: 1 out of 10.0
EarlyStopping counter: 2 out of 10.0
EarlyStopping counter: 3 out of 10.0
Validation loss decreased (0.969137 --> 0.968991).  Saving model ...
EarlyStopping counter: 1 out of 10.0
EarlyStopping counter: 2 out of 10.0
EarlyStopping counter: 3 out of 10.0
EarlyStopping counter: 4 out of 10.0
Validation loss decreased (0.968991 --> 0.968492).  Saving model ...
Validation loss decreased (0.968492 --> 0.968420).  Saving model ...
EarlyStopping counter: 1 out of 10.0
EarlyStopping counter: 2 out of 10.0
EarlyStopping counter: 3 out of 10.0
EarlyStopping counter: 4 out of 10.0
EarlyStopping counter: 5 out of 10.0
EarlyStopping counter: 6 out of 10.0
EarlyStopping counter: 7 out of 10.0
Validation loss decreased (0.968420 --> 0.968354).  Saving model ...
EarlyStopping counter: 1 out of 10.0
EarlyStopping counter: 2 out of 10.0
EarlyStopping counter: 3 out of 10.0
EarlyStopping counter: 4 out of 10.0
EarlyStopping counter: 5 out of 10.0
EarlyStopping counter: 6 out of 10.0
EarlyStopping counter: 7 out of 10.0
EarlyStopping counter: 8 out of 10.0
EarlyStopping counter: 9 out of 10.0
EarlyStopping counter: 10 out of 10.0
/localscratch/yinan.29323967.0/env/lib/python3.7/site-packages/torch/nn/functional.py:1794: UserWarning: nn.functional.tanh is deprecated. Use torch.tanh instead.
  warnings.warn("nn.functional.tanh is deprecated. Use torch.tanh instead.")
wandb: Waiting for W&B process to finish, PID 34656... (success).
wandb: - 0.00MB of 0.00MB uploaded (0.00MB deduped)wandb: \ 0.00MB of 0.00MB uploaded (0.00MB deduped)wandb: | 0.00MB of 0.00MB uploaded (0.00MB deduped)wandb: / 0.00MB of 0.00MB uploaded (0.00MB deduped)wandb: - 0.00MB of 0.00MB uploaded (0.00MB deduped)wandb: \ 0.00MB of 0.00MB uploaded (0.00MB deduped)wandb: | 0.00MB of 0.00MB uploaded (0.00MB deduped)wandb: / 0.00MB of 0.00MB uploaded (0.00MB deduped)wandb: - 0.00MB of 0.00MB uploaded (0.00MB deduped)wandb: \ 0.00MB of 0.00MB uploaded (0.00MB deduped)wandb: | 0.00MB of 0.00MB uploaded (0.00MB deduped)wandb: / 0.00MB of 0.00MB uploaded (0.00MB deduped)wandb: - 0.00MB of 0.00MB uploaded (0.00MB deduped)wandb:                                                                                
wandb: Run history:
wandb:     e_F1 ▁▂▃▄▄▄▄▅▅▆▆▆▆▆▇▇▇▇▇▇▇▇▇▇▇▇▇▇████████████
wandb:   e_loss ██▇▇▆▆▆▅▅▅▄▄▄▃▃▃▃▂▂▂▂▂▂▂▁▁▁▁▁▁▁▁▁▁▁▁▁▁▁▁
wandb:     t_F1 ▁▁▂▂▃▃▄▄▅▅▅▅▅▅▆▆▆▆▆▇▇▇▇▇▇▇█▇▇█▇▇▇███████
wandb:   t_loss ██▇▇▇▇▇▆▆▆▅▅▅▅▅▄▄▄▄▄▃▃▃▃▃▃▂▂▂▂▂▂▂▂▁▁▁▁▁▁
wandb: 
wandb: Run summary:
wandb:     e_F1 62.66072
wandb:   e_loss 0.97479
wandb:     t_F1 72.55894
wandb:   t_loss 0.69293
wandb: 
wandb: Synced 4 W&B file(s), 0 media file(s), 0 artifact file(s) and 0 other file(s)
wandb: Synced woven-dream-4: https://wandb.ai/yinanazhou/xl_512_bs_8_lr_1e06_es_10_lc_True_nr_False_sr_False_stem_False_lemma_True_repeat_2_fold_1/runs/2amu86a3
wandb: Find logs at: ./wandb/run-20220324_040235-2amu86a3/logs/debug.log
wandb: 

wandb: wandb version 0.12.11 is available!  To upgrade, please run:
wandb:  $ pip install wandb --upgrade
2022-03-24 05:37:11.110203: I tensorflow/stream_executor/platform/default/dso_loader.cc:48] Successfully opened dynamic library libcudart.so.10.1
wandb: Tracking run with wandb version 0.12.5
wandb: Syncing run electric-pond-3
wandb: ⭐️ View project at https://wandb.ai/yinanazhou/xl_512_bs_8_lr_1e06_es_10_lc_True_nr_False_sr_False_stem_False_lemma_True_repeat_2_fold_2
wandb: 🚀 View run at https://wandb.ai/yinanazhou/xl_512_bs_8_lr_1e06_es_10_lc_True_nr_False_sr_False_stem_False_lemma_True_repeat_2_fold_2/runs/1ekmqy7j
wandb: Run data is saved locally in /project/6002780/yinan/Thesis_MER_Lyrics/lyric-emotion/wandb/run-20220324_053708-1ekmqy7j
wandb: Run `wandb offline` to turn off syncing.
slurmstepd: error: *** JOB 29323967 ON cdr2575 CANCELLED AT 2022-03-24T06:34:56 ***
