Unloading StdEnv/2020

Due to MODULEPATH changes, the following have been reloaded:
  1) mii/1.1.1


The following have been reloaded with a version change:
  1) python/3.8.2 => python/3.7.4

Using base prefix '/cvmfs/soft.computecanada.ca/easybuild/software/2017/Core/python/3.7.4'
New python executable in /localscratch/yinan.28726715.0/env/bin/python
Installing setuptools, pip, wheel...
done.
Ignoring pip: markers 'python_version < "3"' don't match your environment
Looking in links: /cvmfs/soft.computecanada.ca/custom/python/wheelhouse/nix/avx2, /cvmfs/soft.computecanada.ca/custom/python/wheelhouse/nix/generic, /cvmfs/soft.computecanada.ca/custom/python/wheelhouse/generic
Collecting pip
Installing collected packages: pip
  Found existing installation: pip 19.1.1
    Uninstalling pip-19.1.1:
      Successfully uninstalled pip-19.1.1
Successfully installed pip-21.2.3+computecanada
Looking in links: /cvmfs/soft.computecanada.ca/custom/python/wheelhouse/nix/avx2, /cvmfs/soft.computecanada.ca/custom/python/wheelhouse/nix/generic, /cvmfs/soft.computecanada.ca/custom/python/wheelhouse/generic
Processing /cvmfs/soft.computecanada.ca/custom/python/wheelhouse/generic/keras-2.8.0+computecanada-py2.py3-none-any.whl
Processing /cvmfs/soft.computecanada.ca/custom/python/wheelhouse/generic/Keras_Preprocessing-1.1.2+computecanada-py3-none-any.whl
Requirement already satisfied: matplotlib in /cvmfs/soft.computecanada.ca/easybuild/software/2017/Core/scipy-stack/2019a/lib/python3.7/site-packages (from -r requirements.txt (line 3)) (3.0.2)
Processing /cvmfs/soft.computecanada.ca/custom/python/wheelhouse/generic/nltk-3.6.5+computecanada-py3-none-any.whl
Processing /cvmfs/soft.computecanada.ca/custom/python/wheelhouse/generic/scikit_learn-0.22.1+computecanada-cp37-cp37m-linux_x86_64.whl
Processing /cvmfs/soft.computecanada.ca/custom/python/wheelhouse/generic/tensorboard-2.3.0+computecanada-py3-none-any.whl
Processing /cvmfs/soft.computecanada.ca/custom/python/wheelhouse/generic/tensorboard_plugin_wit-1.7.0+computecanada-py3-none-any.whl
Processing /cvmfs/soft.computecanada.ca/custom/python/wheelhouse/generic/tensorflow_gpu-2.3.0+computecanada-cp37-cp37m-linux_x86_64.whl
Processing /cvmfs/soft.computecanada.ca/custom/python/wheelhouse/generic/tensorflow_estimator-2.3.0+computecanada-py2.py3-none-any.whl
Processing /cvmfs/soft.computecanada.ca/custom/python/wheelhouse/generic/tokenizers-0.5.2+computecanada-cp37-cp37m-linux_x86_64.whl
Processing /cvmfs/soft.computecanada.ca/custom/python/wheelhouse/nix/avx2/torch-1.4.0+computecanada-cp37-cp37m-linux_x86_64.whl
Processing /cvmfs/soft.computecanada.ca/custom/python/wheelhouse/generic/torchtext-0.6.0+computecanada-py3-none-any.whl
Processing /cvmfs/soft.computecanada.ca/custom/python/wheelhouse/generic/torchvision-0.8.2+computecanada-cp37-cp37m-linux_x86_64.whl
Processing /cvmfs/soft.computecanada.ca/custom/python/wheelhouse/generic/transformers-2.5.1+computecanada-py3-none-any.whl
Processing /cvmfs/soft.computecanada.ca/custom/python/wheelhouse/generic/urllib3-1.26.7+computecanada-py2.py3-none-any.whl
Processing /cvmfs/soft.computecanada.ca/custom/python/wheelhouse/generic/tqdm-4.63.0+computecanada-py2.py3-none-any.whl
Processing /cvmfs/soft.computecanada.ca/custom/python/wheelhouse/generic/click-8.0.3+computecanada-py3-none-any.whl
ERROR: Could not find a version that satisfies the requirement regex>=2021.8.3 (from nltk) (from versions: 2018.1.10+computecanada, 2019.11.1+computecanada, 2020.11.13+computecanada)
ERROR: No matching distribution found for regex>=2021.8.3
Looking in links: /cvmfs/soft.computecanada.ca/custom/python/wheelhouse/nix/avx2, /cvmfs/soft.computecanada.ca/custom/python/wheelhouse/nix/generic, /cvmfs/soft.computecanada.ca/custom/python/wheelhouse/generic
ERROR: Could not find a version that satisfies the requirement numpy==1.20.0+computacanada (from versions: 1.15.0+computecanada, 1.15.2+computecanada, 1.15.4+computecanada, 1.16.0+computecanada, 1.16.2+computecanada, 1.16.3+computecanada, 1.17.4+computecanada, 1.18.1+computecanada, 1.18.4+computecanada, 1.19.1+computecanada, 1.19.2+computecanada, 1.20.2+computecanada)
ERROR: No matching distribution found for numpy==1.20.0+computacanada
Looking in links: /cvmfs/soft.computecanada.ca/custom/python/wheelhouse/nix/avx2, /cvmfs/soft.computecanada.ca/custom/python/wheelhouse/nix/generic, /cvmfs/soft.computecanada.ca/custom/python/wheelhouse/generic
Processing /cvmfs/soft.computecanada.ca/custom/python/wheelhouse/generic/wandb-0.12.5+computecanada-py2.py3-none-any.whl
Processing /cvmfs/soft.computecanada.ca/custom/python/wheelhouse/generic/yaspin-2.1.0+computecanada-py3-none-any.whl
Requirement already satisfied: python-dateutil>=2.6.1 in /cvmfs/soft.computecanada.ca/easybuild/software/2017/Core/scipy-stack/2019a/lib/python3.7/site-packages (from wandb) (2.7.5)
Processing /cvmfs/soft.computecanada.ca/custom/python/wheelhouse/generic/promise-2.3+computecanada-py3-none-any.whl
Processing /cvmfs/soft.computecanada.ca/custom/python/wheelhouse/generic/shortuuid-1.0.1+computecanada-py3-none-any.whl
Processing /cvmfs/soft.computecanada.ca/custom/python/wheelhouse/generic/psutil-5.7.3+computecanada-cp37-cp37m-linux_x86_64.whl
Requirement already satisfied: requests<3,>=2.0.0 in /cvmfs/soft.computecanada.ca/easybuild/software/2017/Core/scipy-stack/2019a/lib/python3.7/site-packages (from wandb) (2.21.0)
Processing /cvmfs/soft.computecanada.ca/custom/python/wheelhouse/generic/docker_pycreds-0.4.0+computecanada-py2.py3-none-any.whl
Processing /cvmfs/soft.computecanada.ca/custom/python/wheelhouse/generic/click-8.0.3+computecanada-py3-none-any.whl
Processing /cvmfs/soft.computecanada.ca/custom/python/wheelhouse/generic/six-1.16.0+computecanada-py2.py3-none-any.whl
Processing /cvmfs/soft.computecanada.ca/custom/python/wheelhouse/generic/sentry_sdk-1.5.0+computecanada-py2.py3-none-any.whl
Processing /cvmfs/soft.computecanada.ca/custom/python/wheelhouse/generic/subprocess32-3.5.4+computecanada-py3-none-any.whl
Processing /cvmfs/soft.computecanada.ca/custom/python/wheelhouse/generic/protobuf-3.19.4+computecanada-py2.py3-none-any.whl
Processing /cvmfs/soft.computecanada.ca/custom/python/wheelhouse/generic/configparser-5.0.2+computecanada-py3-none-any.whl
Processing /cvmfs/soft.computecanada.ca/custom/python/wheelhouse/generic/pathtools-0.1.2+computecanada-py3-none-any.whl
Processing /cvmfs/soft.computecanada.ca/custom/python/wheelhouse/generic/GitPython-3.1.24+computecanada-py3-none-any.whl
Processing /cvmfs/soft.computecanada.ca/custom/python/wheelhouse/generic/PyYAML-5.3.1+computecanada-cp37-cp37m-linux_x86_64.whl
Requirement already satisfied: importlib-metadata in /cvmfs/soft.computecanada.ca/easybuild/software/2017/Core/scipy-stack/2019a/lib/python3.7/site-packages (from Click!=8.0.0,>=7.0->wandb) (0.8)
Processing /cvmfs/soft.computecanada.ca/custom/python/wheelhouse/generic/gitdb-4.0.9+computecanada-py3-none-any.whl
Processing /cvmfs/soft.computecanada.ca/custom/python/wheelhouse/generic/typing_extensions-4.0.1+computecanada-py3-none-any.whl
Processing /cvmfs/soft.computecanada.ca/custom/python/wheelhouse/generic/smmap-5.0.0+computecanada-py3-none-any.whl
Requirement already satisfied: chardet<3.1.0,>=3.0.2 in /cvmfs/soft.computecanada.ca/easybuild/software/2017/Core/scipy-stack/2019a/lib/python3.7/site-packages (from requests<3,>=2.0.0->wandb) (3.0.4)
Requirement already satisfied: certifi>=2017.4.17 in /cvmfs/soft.computecanada.ca/easybuild/software/2017/Core/scipy-stack/2019a/lib/python3.7/site-packages (from requests<3,>=2.0.0->wandb) (2018.11.29)
Requirement already satisfied: urllib3<1.25,>=1.21.1 in /cvmfs/soft.computecanada.ca/easybuild/software/2017/Core/scipy-stack/2019a/lib/python3.7/site-packages (from requests<3,>=2.0.0->wandb) (1.24.1)
Requirement already satisfied: idna<2.9,>=2.5 in /cvmfs/soft.computecanada.ca/easybuild/software/2017/Core/scipy-stack/2019a/lib/python3.7/site-packages (from requests<3,>=2.0.0->wandb) (2.8)
Processing /cvmfs/soft.computecanada.ca/custom/python/wheelhouse/generic/termcolor-1.1.0+computecanada-py3-none-any.whl
Requirement already satisfied: zipp>=0.3.2 in /cvmfs/soft.computecanada.ca/easybuild/software/2017/Core/scipy-stack/2019a/lib/python3.7/site-packages (from importlib-metadata->Click!=8.0.0,>=7.0->wandb) (0.3.3)
Installing collected packages: smmap, typing-extensions, termcolor, six, gitdb, yaspin, subprocess32, shortuuid, sentry-sdk, PyYAML, psutil, protobuf, promise, pathtools, GitPython, docker-pycreds, configparser, Click, wandb
  Attempting uninstall: six
    Found existing installation: six 1.12.0
    Not uninstalling six at /cvmfs/soft.computecanada.ca/easybuild/software/2017/Core/scipy-stack/2019a/lib/python3.7/site-packages, outside environment /localscratch/yinan.28726715.0/env
    Can't uninstall 'six'. No files were found to uninstall.
Successfully installed Click-8.0.3+computecanada GitPython-3.1.24+computecanada PyYAML-5.3.1+computecanada configparser-5.0.2+computecanada docker-pycreds-0.4.0+computecanada gitdb-4.0.9+computecanada pathtools-0.1.2+computecanada promise-2.3+computecanada protobuf-3.19.4+computecanada psutil-5.7.3+computecanada sentry-sdk-1.5.0+computecanada shortuuid-1.0.1+computecanada six-1.16.0+computecanada smmap-5.0.0+computecanada subprocess32-3.5.4+computecanada termcolor-1.1.0+computecanada typing-extensions-4.0.1+computecanada wandb-0.12.5+computecanada yaspin-2.1.0+computecanada
Looking in links: /cvmfs/soft.computecanada.ca/custom/python/wheelhouse/nix/avx2, /cvmfs/soft.computecanada.ca/custom/python/wheelhouse/nix/generic, /cvmfs/soft.computecanada.ca/custom/python/wheelhouse/generic
ERROR: Could not find a version that satisfies the requirement sagemaker (from versions: none)
ERROR: No matching distribution found for sagemaker
Looking in links: /cvmfs/soft.computecanada.ca/custom/python/wheelhouse/nix/avx2, /cvmfs/soft.computecanada.ca/custom/python/wheelhouse/nix/generic, /cvmfs/soft.computecanada.ca/custom/python/wheelhouse/generic
Processing /cvmfs/soft.computecanada.ca/custom/python/wheelhouse/generic/torch-1.9.1+computecanada-cp37-cp37m-linux_x86_64.whl
Requirement already satisfied: typing-extensions in /localscratch/yinan.28726715.0/env/lib/python3.7/site-packages (from torch) (4.0.1+computecanada)
Installing collected packages: torch
Successfully installed torch-1.9.1+computecanada
Looking in links: /cvmfs/soft.computecanada.ca/custom/python/wheelhouse/nix/avx2, /cvmfs/soft.computecanada.ca/custom/python/wheelhouse/nix/generic, /cvmfs/soft.computecanada.ca/custom/python/wheelhouse/generic
Processing /cvmfs/soft.computecanada.ca/custom/python/wheelhouse/generic/transformers-2.5.1+computecanada-py3-none-any.whl
Processing /cvmfs/soft.computecanada.ca/custom/python/wheelhouse/generic/tqdm-4.63.0+computecanada-py2.py3-none-any.whl
Processing /cvmfs/soft.computecanada.ca/custom/python/wheelhouse/generic/tokenizers-0.5.2+computecanada-cp37-cp37m-linux_x86_64.whl
Requirement already satisfied: numpy in /cvmfs/soft.computecanada.ca/easybuild/software/2017/Core/scipy-stack/2019a/lib/python3.7/site-packages (from transformers==2.5.1+computecanada) (1.16.0)
Processing /cvmfs/soft.computecanada.ca/custom/python/wheelhouse/generic/sacremoses-0.0.46+computecanada-py3-none-any.whl
Processing /cvmfs/soft.computecanada.ca/custom/python/wheelhouse/generic/sentencepiece-0.1.91+computecanada-cp37-cp37m-linux_x86_64.whl
Processing /cvmfs/soft.computecanada.ca/custom/python/wheelhouse/generic/boto3-1.20.52+computecanada-py3-none-any.whl
Processing /cvmfs/soft.computecanada.ca/custom/python/wheelhouse/generic/filelock-3.4.2+computecanada-py3-none-any.whl
Processing /cvmfs/soft.computecanada.ca/custom/python/wheelhouse/generic/regex-2020.11.13+computecanada-cp37-cp37m-linux_x86_64.whl
Requirement already satisfied: requests in /cvmfs/soft.computecanada.ca/easybuild/software/2017/Core/scipy-stack/2019a/lib/python3.7/site-packages (from transformers==2.5.1+computecanada) (2.21.0)
Processing /cvmfs/soft.computecanada.ca/custom/python/wheelhouse/generic/botocore-1.23.52+computecanada-py3-none-any.whl
Processing /cvmfs/soft.computecanada.ca/custom/python/wheelhouse/generic/s3transfer-0.5.1+computecanada-py3-none-any.whl
Processing /cvmfs/soft.computecanada.ca/custom/python/wheelhouse/generic/jmespath-0.10.0+computecanada-py2.py3-none-any.whl
Requirement already satisfied: python-dateutil<3.0.0,>=2.1 in /cvmfs/soft.computecanada.ca/easybuild/software/2017/Core/scipy-stack/2019a/lib/python3.7/site-packages (from botocore<1.24.0,>=1.23.52->boto3->transformers==2.5.1+computecanada) (2.7.5)
Processing /cvmfs/soft.computecanada.ca/custom/python/wheelhouse/generic/urllib3-1.26.8+computecanada-py2.py3-none-any.whl
Requirement already satisfied: six>=1.5 in /localscratch/yinan.28726715.0/env/lib/python3.7/site-packages (from python-dateutil<3.0.0,>=2.1->botocore<1.24.0,>=1.23.52->boto3->transformers==2.5.1+computecanada) (1.16.0+computecanada)
Requirement already satisfied: certifi>=2017.4.17 in /cvmfs/soft.computecanada.ca/easybuild/software/2017/Core/scipy-stack/2019a/lib/python3.7/site-packages (from requests->transformers==2.5.1+computecanada) (2018.11.29)
Processing /cvmfs/soft.computecanada.ca/custom/python/wheelhouse/generic/requests-2.27.1+computecanada-py2.py3-none-any.whl
Requirement already satisfied: idna<4,>=2.5 in /cvmfs/soft.computecanada.ca/easybuild/software/2017/Core/scipy-stack/2019a/lib/python3.7/site-packages (from requests->transformers==2.5.1+computecanada) (2.8)
Processing /cvmfs/soft.computecanada.ca/custom/python/wheelhouse/generic/charset_normalizer-2.0.11+computecanada-py3-none-any.whl
Requirement already satisfied: click in /localscratch/yinan.28726715.0/env/lib/python3.7/site-packages (from sacremoses->transformers==2.5.1+computecanada) (8.0.3+computecanada)
Processing /cvmfs/soft.computecanada.ca/custom/python/wheelhouse/generic/joblib-1.1.0+computecanada-py2.py3-none-any.whl
Requirement already satisfied: importlib-metadata in /cvmfs/soft.computecanada.ca/easybuild/software/2017/Core/scipy-stack/2019a/lib/python3.7/site-packages (from click->sacremoses->transformers==2.5.1+computecanada) (0.8)
Requirement already satisfied: zipp>=0.3.2 in /cvmfs/soft.computecanada.ca/easybuild/software/2017/Core/scipy-stack/2019a/lib/python3.7/site-packages (from importlib-metadata->click->sacremoses->transformers==2.5.1+computecanada) (0.3.3)
Installing collected packages: urllib3, jmespath, botocore, tqdm, s3transfer, regex, joblib, charset-normalizer, tokenizers, sentencepiece, sacremoses, requests, filelock, boto3, transformers
  Attempting uninstall: urllib3
    Found existing installation: urllib3 1.24.1
    Not uninstalling urllib3 at /cvmfs/soft.computecanada.ca/easybuild/software/2017/Core/scipy-stack/2019a/lib/python3.7/site-packages, outside environment /localscratch/yinan.28726715.0/env
    Can't uninstall 'urllib3'. No files were found to uninstall.
  Attempting uninstall: requests
    Found existing installation: requests 2.21.0
    Not uninstalling requests at /cvmfs/soft.computecanada.ca/easybuild/software/2017/Core/scipy-stack/2019a/lib/python3.7/site-packages, outside environment /localscratch/yinan.28726715.0/env
    Can't uninstall 'requests'. No files were found to uninstall.
Successfully installed boto3-1.20.52+computecanada botocore-1.23.52+computecanada charset-normalizer-2.0.11+computecanada filelock-3.4.2+computecanada jmespath-0.10.0+computecanada joblib-1.1.0+computecanada regex-2020.11.13+computecanada requests-2.27.1+computecanada s3transfer-0.5.1+computecanada sacremoses-0.0.46+computecanada sentencepiece-0.1.91+computecanada tokenizers-0.5.2+computecanada tqdm-4.63.0+computecanada transformers-2.5.1+computecanada urllib3-1.26.8+computecanada
Looking in links: /cvmfs/soft.computecanada.ca/custom/python/wheelhouse/nix/avx2, /cvmfs/soft.computecanada.ca/custom/python/wheelhouse/nix/generic, /cvmfs/soft.computecanada.ca/custom/python/wheelhouse/generic
Processing /cvmfs/soft.computecanada.ca/custom/python/wheelhouse/generic/tensorflow_gpu-2.3.0+computecanada-cp37-cp37m-linux_x86_64.whl
Processing /cvmfs/soft.computecanada.ca/custom/python/wheelhouse/generic/astunparse-1.6.3+computecanada-py2.py3-none-any.whl
Processing /cvmfs/soft.computecanada.ca/custom/python/wheelhouse/generic/google_pasta-0.2.0+computecanada-py3-none-any.whl
Requirement already satisfied: numpy<1.19.0,>=1.16.0 in /cvmfs/soft.computecanada.ca/easybuild/software/2017/Core/scipy-stack/2019a/lib/python3.7/site-packages (from tensorflow_gpu==2.3.0+computecanada) (1.16.0)
Processing /cvmfs/soft.computecanada.ca/custom/python/wheelhouse/generic/grpcio-1.38.0+computecanada-cp37-cp37m-linux_x86_64.whl
Processing /cvmfs/soft.computecanada.ca/custom/python/wheelhouse/generic/gast-0.3.3+computecanada-py3-none-any.whl
Processing /cvmfs/soft.computecanada.ca/custom/python/wheelhouse/generic/tensorboard-2.8.0+computecanada-py3-none-any.whl
Requirement already satisfied: protobuf>=3.9.2 in /localscratch/yinan.28726715.0/env/lib/python3.7/site-packages (from tensorflow_gpu==2.3.0+computecanada) (3.19.4+computecanada)
Processing /cvmfs/soft.computecanada.ca/custom/python/wheelhouse/generic/tensorflow_estimator-2.3.0+computecanada-py2.py3-none-any.whl
Requirement already satisfied: termcolor>=1.1.0 in /localscratch/yinan.28726715.0/env/lib/python3.7/site-packages (from tensorflow_gpu==2.3.0+computecanada) (1.1.0+computecanada)
Processing /cvmfs/soft.computecanada.ca/custom/python/wheelhouse/generic/wrapt-1.11.2+computecanada-cp37-cp37m-linux_x86_64.whl
Requirement already satisfied: wheel>=0.26 in /localscratch/yinan.28726715.0/env/lib/python3.7/site-packages (from tensorflow_gpu==2.3.0+computecanada) (0.33.4)
Requirement already satisfied: six>=1.12.0 in /localscratch/yinan.28726715.0/env/lib/python3.7/site-packages (from tensorflow_gpu==2.3.0+computecanada) (1.16.0+computecanada)
Processing /cvmfs/soft.computecanada.ca/custom/python/wheelhouse/generic/opt_einsum-3.3.0+computecanada-py3-none-any.whl
Processing /cvmfs/soft.computecanada.ca/custom/python/wheelhouse/nix/generic/scipy-1.4.1+computecanada-cp37-cp37m-linux_x86_64.whl
Processing /cvmfs/soft.computecanada.ca/custom/python/wheelhouse/generic/Keras_Preprocessing-1.1.2+computecanada-py3-none-any.whl
Processing /cvmfs/soft.computecanada.ca/custom/python/wheelhouse/nix/avx2/h5py-2.10.0+computecanada-cp37-cp37m-linux_x86_64.whl
Processing /cvmfs/soft.computecanada.ca/custom/python/wheelhouse/generic/absl_py-1.0.0+computecanada-py3-none-any.whl
Processing /cvmfs/soft.computecanada.ca/custom/python/wheelhouse/generic/Markdown-3.3.6+computecanada-py3-none-any.whl
Processing /cvmfs/soft.computecanada.ca/custom/python/wheelhouse/generic/tensorboard_data_server-0.6.1+computecanada-py3-none-linux_x86_64.whl
Processing /cvmfs/soft.computecanada.ca/custom/python/wheelhouse/generic/Werkzeug-2.0.3+computecanada-py3-none-any.whl
Processing /cvmfs/soft.computecanada.ca/custom/python/wheelhouse/generic/google_auth-2.3.3+computecanada-py2.py3-none-any.whl
Processing /cvmfs/soft.computecanada.ca/custom/python/wheelhouse/generic/tensorboard_plugin_wit-1.8.0+computecanada-py3-none-any.whl
Processing /cvmfs/soft.computecanada.ca/custom/python/wheelhouse/generic/google_auth_oauthlib-0.4.6+computecanada-py2.py3-none-any.whl
Requirement already satisfied: requests<3,>=2.21.0 in /localscratch/yinan.28726715.0/env/lib/python3.7/site-packages (from tensorboard<3,>=2.3.0->tensorflow_gpu==2.3.0+computecanada) (2.27.1+computecanada)
Requirement already satisfied: setuptools>=41.0.0 in /localscratch/yinan.28726715.0/env/lib/python3.7/site-packages (from tensorboard<3,>=2.3.0->tensorflow_gpu==2.3.0+computecanada) (41.0.1)
Processing /cvmfs/soft.computecanada.ca/custom/python/wheelhouse/generic/rsa-4.8+computecanada-py3-none-any.whl
Processing /cvmfs/soft.computecanada.ca/custom/python/wheelhouse/generic/pyasn1_modules-0.2.8+computecanada-py2.py3-none-any.whl
Processing /cvmfs/soft.computecanada.ca/custom/python/wheelhouse/generic/cachetools-4.2.4+computecanada-py3-none-any.whl
Processing /cvmfs/soft.computecanada.ca/custom/python/wheelhouse/generic/requests_oauthlib-1.3.0+computecanada-py2.py3-none-any.whl
Processing /cvmfs/soft.computecanada.ca/custom/python/wheelhouse/generic/importlib_metadata-4.10.1+computecanada-py3-none-any.whl
Requirement already satisfied: typing-extensions>=3.6.4 in /localscratch/yinan.28726715.0/env/lib/python3.7/site-packages (from importlib-metadata>=4.4->markdown>=2.6.8->tensorboard<3,>=2.3.0->tensorflow_gpu==2.3.0+computecanada) (4.0.1+computecanada)
Processing /cvmfs/soft.computecanada.ca/custom/python/wheelhouse/generic/zipp-3.7.0+computecanada-py3-none-any.whl
Processing /cvmfs/soft.computecanada.ca/custom/python/wheelhouse/generic/pyasn1-0.4.8+computecanada-py2.py3-none-any.whl
Requirement already satisfied: charset-normalizer~=2.0.0 in /localscratch/yinan.28726715.0/env/lib/python3.7/site-packages (from requests<3,>=2.21.0->tensorboard<3,>=2.3.0->tensorflow_gpu==2.3.0+computecanada) (2.0.11+computecanada)
Requirement already satisfied: urllib3<1.27,>=1.21.1 in /localscratch/yinan.28726715.0/env/lib/python3.7/site-packages (from requests<3,>=2.21.0->tensorboard<3,>=2.3.0->tensorflow_gpu==2.3.0+computecanada) (1.26.8+computecanada)
Requirement already satisfied: certifi>=2017.4.17 in /cvmfs/soft.computecanada.ca/easybuild/software/2017/Core/scipy-stack/2019a/lib/python3.7/site-packages (from requests<3,>=2.21.0->tensorboard<3,>=2.3.0->tensorflow_gpu==2.3.0+computecanada) (2018.11.29)
Requirement already satisfied: idna<4,>=2.5 in /cvmfs/soft.computecanada.ca/easybuild/software/2017/Core/scipy-stack/2019a/lib/python3.7/site-packages (from requests<3,>=2.21.0->tensorboard<3,>=2.3.0->tensorflow_gpu==2.3.0+computecanada) (2.8)
Processing /cvmfs/soft.computecanada.ca/custom/python/wheelhouse/generic/oauthlib-3.1.1+computecanada-py2.py3-none-any.whl
Installing collected packages: pyasn1, zipp, rsa, pyasn1-modules, oauthlib, cachetools, requests-oauthlib, importlib-metadata, google-auth, werkzeug, tensorboard-plugin-wit, tensorboard-data-server, markdown, grpcio, google-auth-oauthlib, absl-py, wrapt, tensorflow-estimator, tensorboard, scipy, opt-einsum, keras-preprocessing, h5py, google-pasta, gast, astunparse, tensorflow-gpu
  Attempting uninstall: pyasn1
    Found existing installation: pyasn1 0.4.3
    Not uninstalling pyasn1 at /cvmfs/soft.computecanada.ca/easybuild/software/2017/Core/scipy-stack/2019a/lib/python3.7/site-packages, outside environment /localscratch/yinan.28726715.0/env
    Can't uninstall 'pyasn1'. No files were found to uninstall.
  Attempting uninstall: zipp
    Found existing installation: zipp 0.3.3
    Not uninstalling zipp at /cvmfs/soft.computecanada.ca/easybuild/software/2017/Core/scipy-stack/2019a/lib/python3.7/site-packages, outside environment /localscratch/yinan.28726715.0/env
    Can't uninstall 'zipp'. No files were found to uninstall.
  Attempting uninstall: importlib-metadata
    Found existing installation: importlib-metadata 0.8
    Not uninstalling importlib-metadata at /cvmfs/soft.computecanada.ca/easybuild/software/2017/Core/scipy-stack/2019a/lib/python3.7/site-packages, outside environment /localscratch/yinan.28726715.0/env
    Can't uninstall 'importlib-metadata'. No files were found to uninstall.
  Attempting uninstall: scipy
    Found existing installation: scipy 1.2.0
    Not uninstalling scipy at /cvmfs/soft.computecanada.ca/easybuild/software/2017/Core/scipy-stack/2019a/lib/python3.7/site-packages, outside environment /localscratch/yinan.28726715.0/env
    Can't uninstall 'scipy'. No files were found to uninstall.
Successfully installed absl-py-1.0.0+computecanada astunparse-1.6.3+computecanada cachetools-4.2.4+computecanada gast-0.3.3+computecanada google-auth-2.3.3+computecanada google-auth-oauthlib-0.4.6+computecanada google-pasta-0.2.0+computecanada grpcio-1.38.0+computecanada h5py-2.10.0+computecanada importlib-metadata-4.10.1+computecanada keras-preprocessing-1.1.2+computecanada markdown-3.3.6+computecanada oauthlib-3.1.1+computecanada opt-einsum-3.3.0+computecanada pyasn1-0.4.8+computecanada pyasn1-modules-0.2.8+computecanada requests-oauthlib-1.3.0+computecanada rsa-4.8+computecanada scipy-1.4.1+computecanada tensorboard-2.8.0+computecanada tensorboard-data-server-0.6.1+computecanada tensorboard-plugin-wit-1.8.0+computecanada tensorflow-estimator-2.3.0+computecanada tensorflow-gpu-2.3.0+computecanada werkzeug-2.0.3+computecanada wrapt-1.11.2+computecanada zipp-3.7.0+computecanada
Looking in links: /cvmfs/soft.computecanada.ca/custom/python/wheelhouse/nix/avx2, /cvmfs/soft.computecanada.ca/custom/python/wheelhouse/nix/generic, /cvmfs/soft.computecanada.ca/custom/python/wheelhouse/generic
Processing /cvmfs/soft.computecanada.ca/custom/python/wheelhouse/generic/keras-2.8.0+computecanada-py2.py3-none-any.whl
Installing collected packages: Keras
Successfully installed Keras-2.8.0+computecanada
Looking in links: /cvmfs/soft.computecanada.ca/custom/python/wheelhouse/nix/avx2, /cvmfs/soft.computecanada.ca/custom/python/wheelhouse/nix/generic, /cvmfs/soft.computecanada.ca/custom/python/wheelhouse/generic
Processing /cvmfs/soft.computecanada.ca/custom/python/wheelhouse/generic/urllib3-1.26.7+computecanada-py2.py3-none-any.whl
Installing collected packages: urllib3
  Attempting uninstall: urllib3
    Found existing installation: urllib3 1.26.8+computecanada
    Uninstalling urllib3-1.26.8+computecanada:
      Successfully uninstalled urllib3-1.26.8+computecanada
Successfully installed urllib3-1.26.7+computecanada
Looking in links: /cvmfs/soft.computecanada.ca/custom/python/wheelhouse/nix/avx2, /cvmfs/soft.computecanada.ca/custom/python/wheelhouse/nix/generic, /cvmfs/soft.computecanada.ca/custom/python/wheelhouse/generic
Processing /cvmfs/soft.computecanada.ca/custom/python/wheelhouse/generic/nltk-3.7+computecanada-py3-none-any.whl
Requirement already satisfied: joblib in /localscratch/yinan.28726715.0/env/lib/python3.7/site-packages (from nltk) (1.1.0+computecanada)
Requirement already satisfied: tqdm in /localscratch/yinan.28726715.0/env/lib/python3.7/site-packages (from nltk) (4.63.0+computecanada)
Requirement already satisfied: click in /localscratch/yinan.28726715.0/env/lib/python3.7/site-packages (from nltk) (8.0.3+computecanada)
Processing /cvmfs/soft.computecanada.ca/custom/python/wheelhouse/generic/nltk-3.6.5+computecanada-py3-none-any.whl
Processing /cvmfs/soft.computecanada.ca/custom/python/wheelhouse/generic/nltk-3.6.3+computecanada-py3-none-any.whl
Requirement already satisfied: regex in /localscratch/yinan.28726715.0/env/lib/python3.7/site-packages (from nltk) (2020.11.13+computecanada)
Requirement already satisfied: importlib-metadata in /localscratch/yinan.28726715.0/env/lib/python3.7/site-packages (from click->nltk) (4.10.1+computecanada)
Requirement already satisfied: typing-extensions>=3.6.4 in /localscratch/yinan.28726715.0/env/lib/python3.7/site-packages (from importlib-metadata->click->nltk) (4.0.1+computecanada)
Requirement already satisfied: zipp>=0.5 in /localscratch/yinan.28726715.0/env/lib/python3.7/site-packages (from importlib-metadata->click->nltk) (3.7.0+computecanada)
Installing collected packages: nltk
Successfully installed nltk-3.6.3+computecanada
Looking in links: /cvmfs/soft.computecanada.ca/custom/python/wheelhouse/nix/avx2, /cvmfs/soft.computecanada.ca/custom/python/wheelhouse/nix/generic, /cvmfs/soft.computecanada.ca/custom/python/wheelhouse/generic
Processing /cvmfs/soft.computecanada.ca/custom/python/wheelhouse/generic/scikit_learn-0.22.1+computecanada-cp37-cp37m-linux_x86_64.whl
Requirement already satisfied: joblib>=0.11 in /localscratch/yinan.28726715.0/env/lib/python3.7/site-packages (from scikit-learn==0.22.1) (1.1.0+computecanada)
Requirement already satisfied: numpy>=1.11.0 in /cvmfs/soft.computecanada.ca/easybuild/software/2017/Core/scipy-stack/2019a/lib/python3.7/site-packages (from scikit-learn==0.22.1) (1.16.0)
Requirement already satisfied: scipy>=0.17.0 in /localscratch/yinan.28726715.0/env/lib/python3.7/site-packages (from scikit-learn==0.22.1) (1.4.1+computecanada)
Installing collected packages: scikit-learn
Successfully installed scikit-learn-0.22.1+computecanada
Looking in links: /cvmfs/soft.computecanada.ca/custom/python/wheelhouse/nix/avx2, /cvmfs/soft.computecanada.ca/custom/python/wheelhouse/nix/generic, /cvmfs/soft.computecanada.ca/custom/python/wheelhouse/generic
Requirement already satisfied: tokenizers==0.5.2 in /localscratch/yinan.28726715.0/env/lib/python3.7/site-packages (0.5.2+computecanada)
wandb: Appending key for api.wandb.ai to your netrc file: /home/yinan/.netrc
Starting Task
2022-03-11 07:38:12.331826: I tensorflow/stream_executor/platform/default/dso_loader.cc:48] Successfully opened dynamic library libcudart.so.10.1
[nltk_data] Downloading package stopwords to /home/yinan/nltk_data...
[nltk_data]   Package stopwords is already up-to-date!
[nltk_data] Downloading package wordnet to /home/yinan/nltk_data...
[nltk_data]   Package wordnet is already up-to-date!
wandb: Currently logged in as: yinanazhou (use `wandb login --relogin` to force relogin)
wandb: wandb version 0.12.11 is available!  To upgrade, please run:
wandb:  $ pip install wandb --upgrade
2022-03-11 07:38:21.880019: I tensorflow/stream_executor/platform/default/dso_loader.cc:48] Successfully opened dynamic library libcudart.so.10.1
wandb: Tracking run with wandb version 0.12.5
wandb: Syncing run radiant-bird-1
wandb: ⭐️ View project at https://wandb.ai/yinanazhou/xl_512_bs_8_lr_1e07_es_5_lc_False_nr_True_sr_False_stem_False_lemma_False_repeat_1_fold_1
wandb: 🚀 View run at https://wandb.ai/yinanazhou/xl_512_bs_8_lr_1e07_es_5_lc_False_nr_True_sr_False_stem_False_lemma_False_repeat_1_fold_1/runs/12nc36oo
wandb: Run data is saved locally in /project/6002780/yinan/Thesis_MER_Lyrics/lyric-emotion/wandb/run-20220311_073819-12nc36oo
wandb: Run `wandb offline` to turn off syncing.

Validation loss decreased (inf --> 1.456761).  Saving model ...
Validation loss decreased (1.456761 --> 1.453963).  Saving model ...
Validation loss decreased (1.453963 --> 1.451098).  Saving model ...
Validation loss decreased (1.451098 --> 1.448241).  Saving model ...
Validation loss decreased (1.448241 --> 1.445517).  Saving model ...
Validation loss decreased (1.445517 --> 1.442874).  Saving model ...
Validation loss decreased (1.442874 --> 1.440349).  Saving model ...
Validation loss decreased (1.440349 --> 1.437912).  Saving model ...
Validation loss decreased (1.437912 --> 1.435553).  Saving model ...
Validation loss decreased (1.435553 --> 1.433138).  Saving model ...
Validation loss decreased (1.433138 --> 1.430746).  Saving model ...
Validation loss decreased (1.430746 --> 1.428621).  Saving model ...
Validation loss decreased (1.428621 --> 1.426485).  Saving model ...
Validation loss decreased (1.426485 --> 1.424351).  Saving model ...
Validation loss decreased (1.424351 --> 1.422316).  Saving model ...
Validation loss decreased (1.422316 --> 1.420267).  Saving model ...
Validation loss decreased (1.420267 --> 1.418333).  Saving model ...
Validation loss decreased (1.418333 --> 1.416343).  Saving model ...
Validation loss decreased (1.416343 --> 1.414359).  Saving model ...
Validation loss decreased (1.414359 --> 1.412422).  Saving model ...
Validation loss decreased (1.412422 --> 1.410477).  Saving model ...
Validation loss decreased (1.410477 --> 1.408756).  Saving model ...
Validation loss decreased (1.408756 --> 1.407086).  Saving model ...
Validation loss decreased (1.407086 --> 1.405509).  Saving model ...
Validation loss decreased (1.405509 --> 1.403927).  Saving model ...
Validation loss decreased (1.403927 --> 1.402291).  Saving model ...
Validation loss decreased (1.402291 --> 1.400779).  Saving model ...
Validation loss decreased (1.400779 --> 1.399223).  Saving model ...
Validation loss decreased (1.399223 --> 1.397789).  Saving model ...
Validation loss decreased (1.397789 --> 1.396371).  Saving model ...
Validation loss decreased (1.396371 --> 1.394960).  Saving model ...
Validation loss decreased (1.394960 --> 1.393526).  Saving model ...
Validation loss decreased (1.393526 --> 1.392201).  Saving model ...
Validation loss decreased (1.392201 --> 1.390860).  Saving model ...
Validation loss decreased (1.390860 --> 1.389622).  Saving model ...
Validation loss decreased (1.389622 --> 1.388351).  Saving model ...
Validation loss decreased (1.388351 --> 1.387117).  Saving model ...
Validation loss decreased (1.387117 --> 1.386001).  Saving model ...
Validation loss decreased (1.386001 --> 1.384778).  Saving model ...
Validation loss decreased (1.384778 --> 1.383583).  Saving model ...
Validation loss decreased (1.383583 --> 1.382467).  Saving model ...
Validation loss decreased (1.382467 --> 1.381324).  Saving model ...
Validation loss decreased (1.381324 --> 1.380201).  Saving model ...
Validation loss decreased (1.380201 --> 1.379176).  Saving model ...
Validation loss decreased (1.379176 --> 1.377975).  Saving model ...
Validation loss decreased (1.377975 --> 1.376949).  Saving model ...
Validation loss decreased (1.376949 --> 1.375901).  Saving model ...
Validation loss decreased (1.375901 --> 1.374872).  Saving model ...
Validation loss decreased (1.374872 --> 1.373883).  Saving model ...
Validation loss decreased (1.373883 --> 1.372923).  Saving model ...
Validation loss decreased (1.372923 --> 1.371989).  Saving model ...
Validation loss decreased (1.371989 --> 1.371157).  Saving model ...
Validation loss decreased (1.371157 --> 1.370166).  Saving model ...
Validation loss decreased (1.370166 --> 1.369213).  Saving model ...
Validation loss decreased (1.369213 --> 1.368374).  Saving model ...
Validation loss decreased (1.368374 --> 1.367519).  Saving model ...
Validation loss decreased (1.367519 --> 1.366592).  Saving model ...
Validation loss decreased (1.366592 --> 1.365700).  Saving model ...
Validation loss decreased (1.365700 --> 1.364787).  Saving model ...
Validation loss decreased (1.364787 --> 1.364009).  Saving model ...
Validation loss decreased (1.364009 --> 1.363157).  Saving model ...
Validation loss decreased (1.363157 --> 1.362363).  Saving model ...
Validation loss decreased (1.362363 --> 1.361534).  Saving model ...
Validation loss decreased (1.361534 --> 1.360628).  Saving model ...
Validation loss decreased (1.360628 --> 1.359900).  Saving model ...
Validation loss decreased (1.359900 --> 1.359062).  Saving model ...
Validation loss decreased (1.359062 --> 1.358363).  Saving model ...
Validation loss decreased (1.358363 --> 1.357610).  Saving model ...
Validation loss decreased (1.357610 --> 1.356887).  Saving model ...
Validation loss decreased (1.356887 --> 1.356227).  Saving model ...
Validation loss decreased (1.356227 --> 1.355579).  Saving model ...
Validation loss decreased (1.355579 --> 1.354833).  Saving model ...
Validation loss decreased (1.354833 --> 1.354095).  Saving model ...
Validation loss decreased (1.354095 --> 1.353407).  Saving model ...
Validation loss decreased (1.353407 --> 1.352732).  Saving model ...
Validation loss decreased (1.352732 --> 1.352081).  Saving model ...
Validation loss decreased (1.352081 --> 1.351415).  Saving model ...
Validation loss decreased (1.351415 --> 1.350734).  Saving model ...
Validation loss decreased (1.350734 --> 1.350032).  Saving model ...
Validation loss decreased (1.350032 --> 1.349361).  Saving model ...
Validation loss decreased (1.349361 --> 1.348766).  Saving model ...
Validation loss decreased (1.348766 --> 1.348109).  Saving model ...
Validation loss decreased (1.348109 --> 1.347411).  Saving model ...
Validation loss decreased (1.347411 --> 1.346728).  Saving model ...
Validation loss decreased (1.346728 --> 1.346144).  Saving model ...
Validation loss decreased (1.346144 --> 1.345461).  Saving model ...
Validation loss decreased (1.345461 --> 1.344856).  Saving model ...
Validation loss decreased (1.344856 --> 1.344180).  Saving model ...
Validation loss decreased (1.344180 --> 1.343582).  Saving model ...
Validation loss decreased (1.343582 --> 1.343038).  Saving model ...
Validation loss decreased (1.343038 --> 1.342433).  Saving model ...
Validation loss decreased (1.342433 --> 1.341797).  Saving model ...
Validation loss decreased (1.341797 --> 1.341108).  Saving model ...
Validation loss decreased (1.341108 --> 1.340440).  Saving model ...
Validation loss decreased (1.340440 --> 1.339739).  Saving model ...
Validation loss decreased (1.339739 --> 1.339133).  Saving model ...
Validation loss decreased (1.339133 --> 1.338540).  Saving model ...
Validation loss decreased (1.338540 --> 1.337866).  Saving model ...
Validation loss decreased (1.337866 --> 1.337278).  Saving model ...
Validation loss decreased (1.337278 --> 1.336755).  Saving model ...
Validation loss decreased (1.336755 --> 1.336105).  Saving model ...
Validation loss decreased (1.336105 --> 1.335447).  Saving model ...
Validation loss decreased (1.335447 --> 1.334842).  Saving model ...
Validation loss decreased (1.334842 --> 1.334280).  Saving model ...
Validation loss decreased (1.334280 --> 1.333592).  Saving model ...
Validation loss decreased (1.333592 --> 1.332970).  Saving model ...
Validation loss decreased (1.332970 --> 1.332342).  Saving model ...
Validation loss decreased (1.332342 --> 1.331762).  Saving model ...
Validation loss decreased (1.331762 --> 1.331124).  Saving model ...
Validation loss decreased (1.331124 --> 1.330507).  Saving model ...
Validation loss decreased (1.330507 --> 1.329911).  Saving model ...
Validation loss decreased (1.329911 --> 1.329380).  Saving model ...
Validation loss decreased (1.329380 --> 1.328799).  Saving model ...
Validation loss decreased (1.328799 --> 1.328199).  Saving model ...
Validation loss decreased (1.328199 --> 1.327522).  Saving model ...
Validation loss decreased (1.327522 --> 1.326912).  Saving model ...
Validation loss decreased (1.326912 --> 1.326275).  Saving model ...
Validation loss decreased (1.326275 --> 1.325685).  Saving model ...
Validation loss decreased (1.325685 --> 1.325036).  Saving model ...
Validation loss decreased (1.325036 --> 1.324364).  Saving model ...
Validation loss decreased (1.324364 --> 1.323790).  Saving model ...
Validation loss decreased (1.323790 --> 1.323170).  Saving model ...
Validation loss decreased (1.323170 --> 1.322638).  Saving model ...
Validation loss decreased (1.322638 --> 1.321938).  Saving model ...
Validation loss decreased (1.321938 --> 1.321319).  Saving model ...
Validation loss decreased (1.321319 --> 1.320653).  Saving model ...
Validation loss decreased (1.320653 --> 1.320060).  Saving model ...
Validation loss decreased (1.320060 --> 1.319408).  Saving model ...
Validation loss decreased (1.319408 --> 1.318752).  Saving model ...
Validation loss decreased (1.318752 --> 1.318107).  Saving model ...
Validation loss decreased (1.318107 --> 1.317489).  Saving model ...
Validation loss decreased (1.317489 --> 1.316863).  Saving model ...
Validation loss decreased (1.316863 --> 1.316259).  Saving model ...
Validation loss decreased (1.316259 --> 1.315674).  Saving model ...
Validation loss decreased (1.315674 --> 1.315032).  Saving model ...
Validation loss decreased (1.315032 --> 1.314347).  Saving model ...
Validation loss decreased (1.314347 --> 1.313748).  Saving model ...
Validation loss decreased (1.313748 --> 1.313060).  Saving model ...
Validation loss decreased (1.313060 --> 1.312430).  Saving model ...
Validation loss decreased (1.312430 --> 1.311865).  Saving model ...
Validation loss decreased (1.311865 --> 1.311205).  Saving model ...
Validation loss decreased (1.311205 --> 1.310582).  Saving model ...
Validation loss decreased (1.310582 --> 1.310002).  Saving model ...
Validation loss decreased (1.310002 --> 1.309353).  Saving model ...
Validation loss decreased (1.309353 --> 1.308676).  Saving model ...
Validation loss decreased (1.308676 --> 1.308026).  Saving model ...
Validation loss decreased (1.308026 --> 1.307344).  Saving model ...
Validation loss decreased (1.307344 --> 1.306512).  Saving model ...
Validation loss decreased (1.306512 --> 1.305884).  Saving model ...
Validation loss decreased (1.305884 --> 1.305166).  Saving model ...
Validation loss decreased (1.305166 --> 1.304532).  Saving model ...
Validation loss decreased (1.304532 --> 1.303918).  Saving model ...
Validation loss decreased (1.303918 --> 1.303312).  Saving model ...
Validation loss decreased (1.303312 --> 1.302768).  Saving model ...
Validation loss decreased (1.302768 --> 1.302192).  Saving model ...
Validation loss decreased (1.302192 --> 1.301622).  Saving model ...
Validation loss decreased (1.301622 --> 1.300972).  Saving model ...
Validation loss decreased (1.300972 --> 1.300311).  Saving model ...
Validation loss decreased (1.300311 --> 1.299697).  Saving model ...
Validation loss decreased (1.299697 --> 1.298998).  Saving model ...
Validation loss decreased (1.298998 --> 1.298303).  Saving model ...
Validation loss decreased (1.298303 --> 1.297627).  Saving model ...
Validation loss decreased (1.297627 --> 1.296932).  Saving model ...
Validation loss decreased (1.296932 --> 1.296075).  Saving model ...
Validation loss decreased (1.296075 --> 1.295324).  Saving model ...
Validation loss decreased (1.295324 --> 1.294579).  Saving model ...
Validation loss decreased (1.294579 --> 1.294023).  Saving model ...
Validation loss decreased (1.294023 --> 1.293410).  Saving model ...
Validation loss decreased (1.293410 --> 1.292810).  Saving model ...
Validation loss decreased (1.292810 --> 1.292155).  Saving model ...
Validation loss decreased (1.292155 --> 1.291437).  Saving model ...
Validation loss decreased (1.291437 --> 1.290869).  Saving model ...
Validation loss decreased (1.290869 --> 1.290197).  Saving model ...
Validation loss decreased (1.290197 --> 1.289542).  Saving model ...
Validation loss decreased (1.289542 --> 1.288828).  Saving model ...
Validation loss decreased (1.288828 --> 1.288288).  Saving model ...
Validation loss decreased (1.288288 --> 1.287608).  Saving model ...
Validation loss decreased (1.287608 --> 1.286918).  Saving model ...
Validation loss decreased (1.286918 --> 1.286277).  Saving model ...
Validation loss decreased (1.286277 --> 1.285510).  Saving model ...
Validation loss decreased (1.285510 --> 1.284668).  Saving model ...
Validation loss decreased (1.284668 --> 1.283898).  Saving model ...
Validation loss decreased (1.283898 --> 1.283201).  Saving model ...
Validation loss decreased (1.283201 --> 1.282509).  Saving model ...
Validation loss decreased (1.282509 --> 1.281908).  Saving model ...
Validation loss decreased (1.281908 --> 1.281187).  Saving model ...
Validation loss decreased (1.281187 --> 1.280667).  Saving model ...
Validation loss decreased (1.280667 --> 1.280089).  Saving model ...
Validation loss decreased (1.280089 --> 1.279421).  Saving model ...
Validation loss decreased (1.279421 --> 1.278784).  Saving model ...
Validation loss decreased (1.278784 --> 1.278189).  Saving model ...
Validation loss decreased (1.278189 --> 1.277568).  Saving model ...
Validation loss decreased (1.277568 --> 1.277002).  Saving model ...
Validation loss decreased (1.277002 --> 1.276260).  Saving model ...
Validation loss decreased (1.276260 --> 1.275527).  Saving model ...
Validation loss decreased (1.275527 --> 1.274994).  Saving model ...
Validation loss decreased (1.274994 --> 1.274367).  Saving model ...
Validation loss decreased (1.274367 --> 1.273833).  Saving model ...
Validation loss decreased (1.273833 --> 1.273015).  Saving model ...
Validation loss decreased (1.273015 --> 1.272271).  Saving model ...
Validation loss decreased (1.272271 --> 1.271731).  Saving model ...
Validation loss decreased (1.271731 --> 1.271288).  Saving model ...
Validation loss decreased (1.271288 --> 1.270639).  Saving model ...
Validation loss decreased (1.270639 --> 1.270033).  Saving model ...
Validation loss decreased (1.270033 --> 1.269702).  Saving model ...
Validation loss decreased (1.269702 --> 1.269177).  Saving model ...
Validation loss decreased (1.269177 --> 1.268502).  Saving model ...
Validation loss decreased (1.268502 --> 1.267881).  Saving model ...
Validation loss decreased (1.267881 --> 1.267443).  Saving model ...
Validation loss decreased (1.267443 --> 1.266680).  Saving model ...
Validation loss decreased (1.266680 --> 1.266144).  Saving model ...
Validation loss decreased (1.266144 --> 1.265450).  Saving model ...
Validation loss decreased (1.265450 --> 1.265003).  Saving model ...
Validation loss decreased (1.265003 --> 1.264394).  Saving model ...
Validation loss decreased (1.264394 --> 1.263784).  Saving model ...
Validation loss decreased (1.263784 --> 1.263172).  Saving model ...
Validation loss decreased (1.263172 --> 1.262590).  Saving model ...
Validation loss decreased (1.262590 --> 1.262062).  Saving model ...
Validation loss decreased (1.262062 --> 1.261477).  Saving model ...
Validation loss decreased (1.261477 --> 1.261011).  Saving model ...
Validation loss decreased (1.261011 --> 1.260517).  Saving model ...
Validation loss decreased (1.260517 --> 1.259849).  Saving model ...
Validation loss decreased (1.259849 --> 1.259202).  Saving model ...
Validation loss decreased (1.259202 --> 1.258603).  Saving model ...
Validation loss decreased (1.258603 --> 1.258044).  Saving model ...
Validation loss decreased (1.258044 --> 1.257581).  Saving model ...
Validation loss decreased (1.257581 --> 1.257030).  Saving model ...
Validation loss decreased (1.257030 --> 1.256560).  Saving model ...
Validation loss decreased (1.256560 --> 1.255984).  Saving model ...
Validation loss decreased (1.255984 --> 1.255406).  Saving model ...
Validation loss decreased (1.255406 --> 1.254837).  Saving model ...
Validation loss decreased (1.254837 --> 1.254123).  Saving model ...
Validation loss decreased (1.254123 --> 1.253778).  Saving model ...
Validation loss decreased (1.253778 --> 1.253232).  Saving model ...
Validation loss decreased (1.253232 --> 1.252683).  Saving model ...
Validation loss decreased (1.252683 --> 1.252263).  Saving model ...
Validation loss decreased (1.252263 --> 1.251708).  Saving model ...
Validation loss decreased (1.251708 --> 1.251284).  Saving model ...
Validation loss decreased (1.251284 --> 1.250720).  Saving model ...
Validation loss decreased (1.250720 --> 1.250165).  Saving model ...
Validation loss decreased (1.250165 --> 1.249814).  Saving model ...
Validation loss decreased (1.249814 --> 1.249284).  Saving model ...
Validation loss decreased (1.249284 --> 1.248822).  Saving model ...
Validation loss decreased (1.248822 --> 1.248188).  Saving model ...
Validation loss decreased (1.248188 --> 1.247675).  Saving model ...
Validation loss decreased (1.247675 --> 1.247127).  Saving model ...
Validation loss decreased (1.247127 --> 1.246682).  Saving model ...
Validation loss decreased (1.246682 --> 1.246326).  Saving model ...
Validation loss decreased (1.246326 --> 1.245889).  Saving model ...
Validation loss decreased (1.245889 --> 1.245462).  Saving model ...
Validation loss decreased (1.245462 --> 1.244862).  Saving model ...
Validation loss decreased (1.244862 --> 1.244362).  Saving model ...
Validation loss decreased (1.244362 --> 1.243839).  Saving model ...
Validation loss decreased (1.243839 --> 1.243378).  Saving model ...
Validation loss decreased (1.243378 --> 1.242986).  Saving model ...
Validation loss decreased (1.242986 --> 1.242434).  Saving model ...
Validation loss decreased (1.242434 --> 1.242040).  Saving model ...
Validation loss decreased (1.242040 --> 1.241785).  Saving model ...
Validation loss decreased (1.241785 --> 1.241086).  Saving model ...
Validation loss decreased (1.241086 --> 1.240658).  Saving model ...
Validation loss decreased (1.240658 --> 1.240174).  Saving model ...
Validation loss decreased (1.240174 --> 1.239756).  Saving model ...
Validation loss decreased (1.239756 --> 1.239353).  Saving model ...
Validation loss decreased (1.239353 --> 1.238736).  Saving model ...
Validation loss decreased (1.238736 --> 1.238164).  Saving model ...
Validation loss decreased (1.238164 --> 1.237640).  Saving model ...
Validation loss decreased (1.237640 --> 1.237290).  Saving model ...
Validation loss decreased (1.237290 --> 1.236931).  Saving model ...
Validation loss decreased (1.236931 --> 1.236513).  Saving model ...
Validation loss decreased (1.236513 --> 1.235926).  Saving model ...
Validation loss decreased (1.235926 --> 1.235554).  Saving model ...
Validation loss decreased (1.235554 --> 1.234997).  Saving model ...
Validation loss decreased (1.234997 --> 1.234509).  Saving model ...
Validation loss decreased (1.234509 --> 1.233876).  Saving model ...
Validation loss decreased (1.233876 --> 1.233382).  Saving model ...
Validation loss decreased (1.233382 --> 1.232908).  Saving model ...
Validation loss decreased (1.232908 --> 1.232558).  Saving model ...
Validation loss decreased (1.232558 --> 1.232009).  Saving model ...
Validation loss decreased (1.232009 --> 1.231457).  Saving model ...
Validation loss decreased (1.231457 --> 1.230943).  Saving model ...
Validation loss decreased (1.230943 --> 1.230487).  Saving model ...
Validation loss decreased (1.230487 --> 1.230066).  Saving model ...
Validation loss decreased (1.230066 --> 1.229774).  Saving model ...
Validation loss decreased (1.229774 --> 1.229465).  Saving model ...
Validation loss decreased (1.229465 --> 1.229226).  Saving model ...
Validation loss decreased (1.229226 --> 1.229047).  Saving model ...
Validation loss decreased (1.229047 --> 1.228411).  Saving model ...
Validation loss decreased (1.228411 --> 1.228114).  Saving model ...
Validation loss decreased (1.228114 --> 1.227807).  Saving model ...
Validation loss decreased (1.227807 --> 1.227347).  Saving model ...
Validation loss decreased (1.227347 --> 1.226988).  Saving model ...
Validation loss decreased (1.226988 --> 1.226464).  Saving model ...
Validation loss decreased (1.226464 --> 1.226017).  Saving model ...
Validation loss decreased (1.226017 --> 1.225593).  Saving model ...
Validation loss decreased (1.225593 --> 1.224990).  Saving model ...
Validation loss decreased (1.224990 --> 1.224575).  Saving model ...
Validation loss decreased (1.224575 --> 1.224306).  Saving model ...
Validation loss decreased (1.224306 --> 1.223892).  Saving model ...
Validation loss decreased (1.223892 --> 1.223625).  Saving model ...
Validation loss decreased (1.223625 --> 1.223354).  Saving model ...
Validation loss decreased (1.223354 --> 1.223041).  Saving model ...
Validation loss decreased (1.223041 --> 1.222415).  Saving model ...
Validation loss decreased (1.222415 --> 1.221995).  Saving model ...
Validation loss decreased (1.221995 --> 1.221526).  Saving model ...
Validation loss decreased (1.221526 --> 1.221111).  Saving model ...
Validation loss decreased (1.221111 --> 1.220883).  Saving model ...
Validation loss decreased (1.220883 --> 1.220505).  Saving model ...
Validation loss decreased (1.220505 --> 1.220084).  Saving model ...
Validation loss decreased (1.220084 --> 1.219812).  Saving model ...
Validation loss decreased (1.219812 --> 1.219287).  Saving model ...
Validation loss decreased (1.219287 --> 1.219080).  Saving model ...
Validation loss decreased (1.219080 --> 1.218722).  Saving model ...
Validation loss decreased (1.218722 --> 1.218330).  Saving model ...
Validation loss decreased (1.218330 --> 1.218001).  Saving model ...
Validation loss decreased (1.218001 --> 1.217742).  Saving model ...
Validation loss decreased (1.217742 --> 1.217228).  Saving model ...
Validation loss decreased (1.217228 --> 1.216782).  Saving model ...
Validation loss decreased (1.216782 --> 1.216376).  Saving model ...
Validation loss decreased (1.216376 --> 1.216006).  Saving model ...
Validation loss decreased (1.216006 --> 1.215699).  Saving model ...
Validation loss decreased (1.215699 --> 1.215481).  Saving model ...
Validation loss decreased (1.215481 --> 1.214749).  Saving model ...
Validation loss decreased (1.214749 --> 1.214186).  Saving model ...
Validation loss decreased (1.214186 --> 1.213621).  Saving model ...
Validation loss decreased (1.213621 --> 1.213089).  Saving model ...
Validation loss decreased (1.213089 --> 1.212679).  Saving model ...
Validation loss decreased (1.212679 --> 1.212375).  Saving model ...
Validation loss decreased (1.212375 --> 1.212169).  Saving model ...
Validation loss decreased (1.212169 --> 1.211856).  Saving model ...
Validation loss decreased (1.211856 --> 1.211482).  Saving model ...
Validation loss decreased (1.211482 --> 1.211199).  Saving model ...
Validation loss decreased (1.211199 --> 1.211016).  Saving model ...
Validation loss decreased (1.211016 --> 1.210625).  Saving model ...
Validation loss decreased (1.210625 --> 1.210398).  Saving model ...
Validation loss decreased (1.210398 --> 1.210234).  Saving model ...
Validation loss decreased (1.210234 --> 1.209856).  Saving model ...
Validation loss decreased (1.209856 --> 1.209591).  Saving model ...
Validation loss decreased (1.209591 --> 1.209459).  Saving model ...
Validation loss decreased (1.209459 --> 1.208798).  Saving model ...
Validation loss decreased (1.208798 --> 1.208336).  Saving model ...
Validation loss decreased (1.208336 --> 1.208165).  Saving model ...
Validation loss decreased (1.208165 --> 1.207775).  Saving model ...
Validation loss decreased (1.207775 --> 1.207570).  Saving model ...
Validation loss decreased (1.207570 --> 1.207213).  Saving model ...
Validation loss decreased (1.207213 --> 1.206962).  Saving model ...
Validation loss decreased (1.206962 --> 1.206637).  Saving model ...
Validation loss decreased (1.206637 --> 1.206235).  Saving model ...
Validation loss decreased (1.206235 --> 1.205741).  Saving model ...
Validation loss decreased (1.205741 --> 1.205230).  Saving model ...
Validation loss decreased (1.205230 --> 1.204793).  Saving model ...
Validation loss decreased (1.204793 --> 1.204390).  Saving model ...
Validation loss decreased (1.204390 --> 1.203686).  Saving model ...
Validation loss decreased (1.203686 --> 1.203355).  Saving model ...
Validation loss decreased (1.203355 --> 1.203114).  Saving model ...
Validation loss decreased (1.203114 --> 1.202574).  Saving model ...
Validation loss decreased (1.202574 --> 1.202073).  Saving model ...
Validation loss decreased (1.202073 --> 1.201589).  Saving model ...
Validation loss decreased (1.201589 --> 1.201150).  Saving model ...
Validation loss decreased (1.201150 --> 1.200800).  Saving model ...
Validation loss decreased (1.200800 --> 1.200512).  Saving model ...
Validation loss decreased (1.200512 --> 1.200176).  Saving model ...
Validation loss decreased (1.200176 --> 1.199811).  Saving model ...
Validation loss decreased (1.199811 --> 1.199544).  Saving model ...
Validation loss decreased (1.199544 --> 1.198940).  Saving model ...
Validation loss decreased (1.198940 --> 1.198700).  Saving model ...
Validation loss decreased (1.198700 --> 1.198359).  Saving model ...
Validation loss decreased (1.198359 --> 1.197873).  Saving model ...
Validation loss decreased (1.197873 --> 1.197323).  Saving model ...
Validation loss decreased (1.197323 --> 1.197066).  Saving model ...
Validation loss decreased (1.197066 --> 1.196634).  Saving model ...
Validation loss decreased (1.196634 --> 1.196224).  Saving model ...
Validation loss decreased (1.196224 --> 1.196129).  Saving model ...
Validation loss decreased (1.196129 --> 1.195857).  Saving model ...
Validation loss decreased (1.195857 --> 1.195687).  Saving model ...
Validation loss decreased (1.195687 --> 1.195559).  Saving model ...
Validation loss decreased (1.195559 --> 1.195281).  Saving model ...
Validation loss decreased (1.195281 --> 1.194725).  Saving model ...
Validation loss decreased (1.194725 --> 1.194064).  Saving model ...
Validation loss decreased (1.194064 --> 1.193674).  Saving model ...
Validation loss decreased (1.193674 --> 1.193219).  Saving model ...
Validation loss decreased (1.193219 --> 1.192678).  Saving model ...
Validation loss decreased (1.192678 --> 1.192513).  Saving model ...
Validation loss decreased (1.192513 --> 1.192362).  Saving model ...
Validation loss decreased (1.192362 --> 1.192062).  Saving model ...
Validation loss decreased (1.192062 --> 1.191650).  Saving model ...
Validation loss decreased (1.191650 --> 1.191385).  Saving model ...
Validation loss decreased (1.191385 --> 1.191232).  Saving model ...
Validation loss decreased (1.191232 --> 1.190768).  Saving model ...
Validation loss decreased (1.190768 --> 1.190554).  Saving model ...
Validation loss decreased (1.190554 --> 1.190143).  Saving model ...
Validation loss decreased (1.190143 --> 1.189716).  Saving model ...
Validation loss decreased (1.189716 --> 1.189309).  Saving model ...
Validation loss decreased (1.189309 --> 1.189057).  Saving model ...
Validation loss decreased (1.189057 --> 1.189036).  Saving model ...
Validation loss decreased (1.189036 --> 1.188690).  Saving model ...
Validation loss decreased (1.188690 --> 1.188295).  Saving model ...
Validation loss decreased (1.188295 --> 1.188240).  Saving model ...
Validation loss decreased (1.188240 --> 1.187976).  Saving model ...
Validation loss decreased (1.187976 --> 1.187435).  Saving model ...
Validation loss decreased (1.187435 --> 1.186846).  Saving model ...
Validation loss decreased (1.186846 --> 1.186503).  Saving model ...
Validation loss decreased (1.186503 --> 1.186450).  Saving model ...
Validation loss decreased (1.186450 --> 1.186114).  Saving model ...
Validation loss decreased (1.186114 --> 1.185606).  Saving model ...
Validation loss decreased (1.185606 --> 1.185124).  Saving model ...
Validation loss decreased (1.185124 --> 1.184734).  Saving model ...
Validation loss decreased (1.184734 --> 1.184303).  Saving model ...
Validation loss decreased (1.184303 --> 1.183931).  Saving model ...
Validation loss decreased (1.183931 --> 1.183832).  Saving model ...
Validation loss decreased (1.183832 --> 1.183023).  Saving model ...
Validation loss decreased (1.183023 --> 1.182636).  Saving model ...
Validation loss decreased (1.182636 --> 1.182219).  Saving model ...
Validation loss decreased (1.182219 --> 1.181715).  Saving model ...
Validation loss decreased (1.181715 --> 1.181517).  Saving model ...
Validation loss decreased (1.181517 --> 1.181229).  Saving model ...
Validation loss decreased (1.181229 --> 1.180848).  Saving model ...
Validation loss decreased (1.180848 --> 1.180686).  Saving model ...
Validation loss decreased (1.180686 --> 1.180411).  Saving model ...
Validation loss decreased (1.180411 --> 1.179870).  Saving model ...
Validation loss decreased (1.179870 --> 1.179455).  Saving model ...
Validation loss decreased (1.179455 --> 1.179280).  Saving model ...
Validation loss decreased (1.179280 --> 1.178972).  Saving model ...
Validation loss decreased (1.178972 --> 1.178482).  Saving model ...
Validation loss decreased (1.178482 --> 1.178086).  Saving model ...
Validation loss decreased (1.178086 --> 1.177579).  Saving model ...
Validation loss decreased (1.177579 --> 1.177548).  Saving model ...
Validation loss decreased (1.177548 --> 1.177341).  Saving model ...
Validation loss decreased (1.177341 --> 1.177090).  Saving model ...
Validation loss decreased (1.177090 --> 1.176792).  Saving model ...
Validation loss decreased (1.176792 --> 1.176727).  Saving model ...
Validation loss decreased (1.176727 --> 1.176261).  Saving model ...
Validation loss decreased (1.176261 --> 1.176043).  Saving model ...
Validation loss decreased (1.176043 --> 1.175575).  Saving model ...
Validation loss decreased (1.175575 --> 1.175303).  Saving model ...
Validation loss decreased (1.175303 --> 1.174889).  Saving model ...
Validation loss decreased (1.174889 --> 1.174394).  Saving model ...
Validation loss decreased (1.174394 --> 1.173957).  Saving model ...
Validation loss decreased (1.173957 --> 1.173653).  Saving model ...
Validation loss decreased (1.173653 --> 1.173646).  Saving model ...
Validation loss decreased (1.173646 --> 1.173081).  Saving model ...
Validation loss decreased (1.173081 --> 1.172433).  Saving model ...
Validation loss decreased (1.172433 --> 1.172067).  Saving model ...
Validation loss decreased (1.172067 --> 1.171824).  Saving model ...
Validation loss decreased (1.171824 --> 1.171495).  Saving model ...
Validation loss decreased (1.171495 --> 1.171058).  Saving model ...
Validation loss decreased (1.171058 --> 1.170583).  Saving model ...
Validation loss decreased (1.170583 --> 1.170094).  Saving model ...
Validation loss decreased (1.170094 --> 1.169612).  Saving model ...
Validation loss decreased (1.169612 --> 1.169219).  Saving model ...
Validation loss decreased (1.169219 --> 1.169176).  Saving model ...
Validation loss decreased (1.169176 --> 1.168900).  Saving model ...
Validation loss decreased (1.168900 --> 1.168524).  Saving model ...
Validation loss decreased (1.168524 --> 1.168091).  Saving model ...
Validation loss decreased (1.168091 --> 1.167960).  Saving model ...
Validation loss decreased (1.167960 --> 1.167732).  Saving model ...
Validation loss decreased (1.167732 --> 1.167550).  Saving model ...
Validation loss decreased (1.167550 --> 1.167523).  Saving model ...
Validation loss decreased (1.167523 --> 1.167353).  Saving model ...
Validation loss decreased (1.167353 --> 1.167106).  Saving model ...
Validation loss decreased (1.167106 --> 1.166837).  Saving model ...
Validation loss decreased (1.166837 --> 1.166309).  Saving model ...
Validation loss decreased (1.166309 --> 1.165757).  Saving model ...
Validation loss decreased (1.165757 --> 1.165539).  Saving model ...
Validation loss decreased (1.165539 --> 1.165079).  Saving model ...
Validation loss decreased (1.165079 --> 1.164437).  Saving model ...
Validation loss decreased (1.164437 --> 1.164000).  Saving model ...
Validation loss decreased (1.164000 --> 1.163154).  Saving model ...
Validation loss decreased (1.163154 --> 1.162749).  Saving model ...
Validation loss decreased (1.162749 --> 1.162432).  Saving model ...
Validation loss decreased (1.162432 --> 1.162035).  Saving model ...
Validation loss decreased (1.162035 --> 1.161769).  Saving model ...
Validation loss decreased (1.161769 --> 1.161560).  Saving model ...
Validation loss decreased (1.161560 --> 1.161366).  Saving model ...
Validation loss decreased (1.161366 --> 1.161079).  Saving model ...
Validation loss decreased (1.161079 --> 1.160800).  Saving model ...
Validation loss decreased (1.160800 --> 1.160376).  Saving model ...
Validation loss decreased (1.160376 --> 1.160170).  Saving model ...
Validation loss decreased (1.160170 --> 1.159915).  Saving model ...
Validation loss decreased (1.159915 --> 1.159835).  Saving model ...
Validation loss decreased (1.159835 --> 1.159537).  Saving model ...
Validation loss decreased (1.159537 --> 1.159044).  Saving model ...
Validation loss decreased (1.159044 --> 1.158663).  Saving model ...
Validation loss decreased (1.158663 --> 1.158294).  Saving model ...
Validation loss decreased (1.158294 --> 1.157995).  Saving model ...
Validation loss decreased (1.157995 --> 1.157616).  Saving model ...
Validation loss decreased (1.157616 --> 1.157395).  Saving model ...
Validation loss decreased (1.157395 --> 1.156772).  Saving model ...
Validation loss decreased (1.156772 --> 1.156506).  Saving model ...
Validation loss decreased (1.156506 --> 1.156273).  Saving model ...
Validation loss decreased (1.156273 --> 1.156019).  Saving model ...
Validation loss decreased (1.156019 --> 1.155803).  Saving model ...
Validation loss decreased (1.155803 --> 1.155719).  Saving model ...
Validation loss decreased (1.155719 --> 1.155488).  Saving model ...
Validation loss decreased (1.155488 --> 1.155064).  Saving model ...
Validation loss decreased (1.155064 --> 1.154754).  Saving model ...
EarlyStopping counter: 1 out of 5.0
Validation loss decreased (1.154754 --> 1.154370).  Saving model ...
Validation loss decreased (1.154370 --> 1.153832).  Saving model ...
Validation loss decreased (1.153832 --> 1.153715).  Saving model ...
Validation loss decreased (1.153715 --> 1.153246).  Saving model ...
/localscratch/yinan.28726715.0/env/lib/python3.7/site-packages/torch/nn/functional.py:1794: UserWarning: nn.functional.tanh is deprecated. Use torch.tanh instead.
  warnings.warn("nn.functional.tanh is deprecated. Use torch.tanh instead.")
/localscratch/yinan.28726715.0/env/lib/python3.7/site-packages/transformers/optimization.py:155: UserWarning: This overload of add_ is deprecated:
	add_(Number alpha, Tensor other)
Consider using one of the following signatures instead:
	add_(Tensor other, *, Number alpha) (Triggered internally at  ../torch/csrc/utils/python_arg_parser.cpp:1025.)
  exp_avg.mul_(beta1).add_(1.0 - beta1, grad)
wandb: Waiting for W&B process to finish, PID 86383... (success).
wandb: - 0.00MB of 0.00MB uploaded (0.00MB deduped)wandb: \ 0.00MB of 0.00MB uploaded (0.00MB deduped)wandb: | 0.00MB of 0.00MB uploaded (0.00MB deduped)wandb: / 0.00MB of 0.00MB uploaded (0.00MB deduped)wandb: - 0.00MB of 0.00MB uploaded (0.00MB deduped)wandb: \ 0.00MB of 0.00MB uploaded (0.00MB deduped)wandb: | 0.00MB of 0.00MB uploaded (0.00MB deduped)wandb: / 0.00MB of 0.00MB uploaded (0.00MB deduped)wandb: - 0.00MB of 0.00MB uploaded (0.00MB deduped)wandb: \ 0.00MB of 0.00MB uploaded (0.00MB deduped)wandb: | 0.00MB of 0.00MB uploaded (0.00MB deduped)wandb: / 0.00MB of 0.00MB uploaded (0.00MB deduped)wandb: - 0.00MB of 0.00MB uploaded (0.00MB deduped)wandb:                                                                                
wandb: Run history:
wandb:     e_F1 ▁▁▂▃▃▄▅▅▅▅▅▆▆▆▆▆▆▇▇▇▇▇▇▇▇▇▇▇▇███████████
wandb:   e_loss █▇▇▆▆▆▆▅▅▅▅▅▅▄▄▄▄▄▃▃▃▃▃▃▃▂▂▂▂▂▂▂▂▂▁▁▁▁▁▁
wandb:     t_F1 ▁▁▂▂▃▃▃▃▃▄▄▅▅▄▅▆▆▅▆▆▆▆▆▆▆▇▇▇▇▆▇▇▇▇▇█▇▇▇▇
wandb:   t_loss ██▇▇▇▆▆▆▆▆▆▅▅▆▅▅▄▄▄▄▄▄▄▄▃▃▃▃▃▃▂▂▂▂▂▁▂▁▁▁
wandb: 
wandb: Run summary:
wandb:     e_F1 49.35401
wandb:   e_loss 1.15325
wandb:     t_F1 53.618
wandb:   t_loss 1.08258
wandb: 
wandb: Synced 4 W&B file(s), 0 media file(s), 0 artifact file(s) and 0 other file(s)
wandb: Synced radiant-bird-1: https://wandb.ai/yinanazhou/xl_512_bs_8_lr_1e07_es_5_lc_False_nr_True_sr_False_stem_False_lemma_False_repeat_1_fold_1/runs/12nc36oo
wandb: Find logs at: ./wandb/run-20220311_073819-12nc36oo/logs/debug.log
wandb: 

wandb: wandb version 0.12.11 is available!  To upgrade, please run:
wandb:  $ pip install wandb --upgrade
2022-03-11 13:09:47.747870: I tensorflow/stream_executor/platform/default/dso_loader.cc:48] Successfully opened dynamic library libcudart.so.10.1
wandb: Tracking run with wandb version 0.12.5
wandb: Syncing run pleasant-donkey-1
wandb: ⭐️ View project at https://wandb.ai/yinanazhou/xl_512_bs_8_lr_1e07_es_5_lc_False_nr_True_sr_False_stem_False_lemma_False_repeat_1_fold_2
wandb: 🚀 View run at https://wandb.ai/yinanazhou/xl_512_bs_8_lr_1e07_es_5_lc_False_nr_True_sr_False_stem_False_lemma_False_repeat_1_fold_2/runs/35onilko
wandb: Run data is saved locally in /project/6002780/yinan/Thesis_MER_Lyrics/lyric-emotion/wandb/run-20220311_130944-35onilko
wandb: Run `wandb offline` to turn off syncing.
slurmstepd: error: *** JOB 28726715 ON cdr2627 CANCELLED AT 2022-03-11T17:34:44 DUE TO TIME LIMIT ***
