Unloading StdEnv/2020

Due to MODULEPATH changes, the following have been reloaded:
  1) mii/1.1.1


The following have been reloaded with a version change:
  1) python/3.8.2 => python/3.7.4

Using base prefix '/cvmfs/soft.computecanada.ca/easybuild/software/2017/Core/python/3.7.4'
New python executable in /localscratch/yinan.28706188.0/env/bin/python
Installing setuptools, pip, wheel...
done.
Ignoring pip: markers 'python_version < "3"' don't match your environment
Looking in links: /cvmfs/soft.computecanada.ca/custom/python/wheelhouse/nix/avx2, /cvmfs/soft.computecanada.ca/custom/python/wheelhouse/nix/generic, /cvmfs/soft.computecanada.ca/custom/python/wheelhouse/generic
Collecting pip
Installing collected packages: pip
  Found existing installation: pip 19.1.1
    Uninstalling pip-19.1.1:
      Successfully uninstalled pip-19.1.1
Successfully installed pip-21.2.3+computecanada
Looking in links: /cvmfs/soft.computecanada.ca/custom/python/wheelhouse/nix/avx2, /cvmfs/soft.computecanada.ca/custom/python/wheelhouse/nix/generic, /cvmfs/soft.computecanada.ca/custom/python/wheelhouse/generic
Processing /cvmfs/soft.computecanada.ca/custom/python/wheelhouse/generic/keras-2.8.0+computecanada-py2.py3-none-any.whl
Processing /cvmfs/soft.computecanada.ca/custom/python/wheelhouse/generic/Keras_Preprocessing-1.1.2+computecanada-py3-none-any.whl
Requirement already satisfied: matplotlib in /cvmfs/soft.computecanada.ca/easybuild/software/2017/Core/scipy-stack/2019a/lib/python3.7/site-packages (from -r requirements.txt (line 3)) (3.0.2)
Processing /cvmfs/soft.computecanada.ca/custom/python/wheelhouse/generic/nltk-3.6.5+computecanada-py3-none-any.whl
Processing /cvmfs/soft.computecanada.ca/custom/python/wheelhouse/generic/scikit_learn-0.22.1+computecanada-cp37-cp37m-linux_x86_64.whl
Processing /cvmfs/soft.computecanada.ca/custom/python/wheelhouse/generic/tensorboard-2.3.0+computecanada-py3-none-any.whl
Processing /cvmfs/soft.computecanada.ca/custom/python/wheelhouse/generic/tensorboard_plugin_wit-1.7.0+computecanada-py3-none-any.whl
Processing /cvmfs/soft.computecanada.ca/custom/python/wheelhouse/generic/tensorflow_gpu-2.3.0+computecanada-cp37-cp37m-linux_x86_64.whl
Processing /cvmfs/soft.computecanada.ca/custom/python/wheelhouse/generic/tensorflow_estimator-2.3.0+computecanada-py2.py3-none-any.whl
Processing /cvmfs/soft.computecanada.ca/custom/python/wheelhouse/generic/tokenizers-0.5.2+computecanada-cp37-cp37m-linux_x86_64.whl
Processing /cvmfs/soft.computecanada.ca/custom/python/wheelhouse/nix/avx2/torch-1.4.0+computecanada-cp37-cp37m-linux_x86_64.whl
Processing /cvmfs/soft.computecanada.ca/custom/python/wheelhouse/generic/torchtext-0.6.0+computecanada-py3-none-any.whl
Processing /cvmfs/soft.computecanada.ca/custom/python/wheelhouse/generic/torchvision-0.8.2+computecanada-cp37-cp37m-linux_x86_64.whl
Processing /cvmfs/soft.computecanada.ca/custom/python/wheelhouse/generic/transformers-2.5.1+computecanada-py3-none-any.whl
Processing /cvmfs/soft.computecanada.ca/custom/python/wheelhouse/generic/urllib3-1.26.7+computecanada-py2.py3-none-any.whl
Processing /cvmfs/soft.computecanada.ca/custom/python/wheelhouse/generic/tqdm-4.63.0+computecanada-py2.py3-none-any.whl
Processing /cvmfs/soft.computecanada.ca/custom/python/wheelhouse/generic/joblib-1.1.0+computecanada-py2.py3-none-any.whl
ERROR: Could not find a version that satisfies the requirement regex>=2021.8.3 (from nltk) (from versions: 2018.1.10+computecanada, 2019.11.1+computecanada, 2020.11.13+computecanada)
ERROR: No matching distribution found for regex>=2021.8.3
Looking in links: /cvmfs/soft.computecanada.ca/custom/python/wheelhouse/nix/avx2, /cvmfs/soft.computecanada.ca/custom/python/wheelhouse/nix/generic, /cvmfs/soft.computecanada.ca/custom/python/wheelhouse/generic
ERROR: Could not find a version that satisfies the requirement numpy==1.20.0+computacanada (from versions: 1.15.0+computecanada, 1.15.2+computecanada, 1.15.4+computecanada, 1.16.0+computecanada, 1.16.2+computecanada, 1.16.3+computecanada, 1.17.4+computecanada, 1.18.1+computecanada, 1.18.4+computecanada, 1.19.1+computecanada, 1.19.2+computecanada, 1.20.2+computecanada)
ERROR: No matching distribution found for numpy==1.20.0+computacanada
Looking in links: /cvmfs/soft.computecanada.ca/custom/python/wheelhouse/nix/avx2, /cvmfs/soft.computecanada.ca/custom/python/wheelhouse/nix/generic, /cvmfs/soft.computecanada.ca/custom/python/wheelhouse/generic
Processing /cvmfs/soft.computecanada.ca/custom/python/wheelhouse/generic/wandb-0.12.5+computecanada-py2.py3-none-any.whl
Processing /cvmfs/soft.computecanada.ca/custom/python/wheelhouse/generic/configparser-5.0.2+computecanada-py3-none-any.whl
Processing /cvmfs/soft.computecanada.ca/custom/python/wheelhouse/generic/promise-2.3+computecanada-py3-none-any.whl
Processing /cvmfs/soft.computecanada.ca/custom/python/wheelhouse/generic/six-1.16.0+computecanada-py2.py3-none-any.whl
Processing /cvmfs/soft.computecanada.ca/custom/python/wheelhouse/generic/psutil-5.7.3+computecanada-cp37-cp37m-linux_x86_64.whl
Processing /cvmfs/soft.computecanada.ca/custom/python/wheelhouse/generic/sentry_sdk-1.5.0+computecanada-py2.py3-none-any.whl
Processing /cvmfs/soft.computecanada.ca/custom/python/wheelhouse/generic/shortuuid-1.0.1+computecanada-py3-none-any.whl
Processing /cvmfs/soft.computecanada.ca/custom/python/wheelhouse/generic/subprocess32-3.5.4+computecanada-py3-none-any.whl
Processing /cvmfs/soft.computecanada.ca/custom/python/wheelhouse/generic/docker_pycreds-0.4.0+computecanada-py2.py3-none-any.whl
Processing /cvmfs/soft.computecanada.ca/custom/python/wheelhouse/generic/GitPython-3.1.24+computecanada-py3-none-any.whl
Requirement already satisfied: python-dateutil>=2.6.1 in /cvmfs/soft.computecanada.ca/easybuild/software/2017/Core/scipy-stack/2019a/lib/python3.7/site-packages (from wandb) (2.7.5)
Processing /cvmfs/soft.computecanada.ca/custom/python/wheelhouse/generic/pathtools-0.1.2+computecanada-py3-none-any.whl
Processing /cvmfs/soft.computecanada.ca/custom/python/wheelhouse/generic/protobuf-3.19.4+computecanada-py2.py3-none-any.whl
Processing /cvmfs/soft.computecanada.ca/custom/python/wheelhouse/generic/yaspin-2.1.0+computecanada-py3-none-any.whl
Processing /cvmfs/soft.computecanada.ca/custom/python/wheelhouse/generic/click-8.0.3+computecanada-py3-none-any.whl
Requirement already satisfied: requests<3,>=2.0.0 in /cvmfs/soft.computecanada.ca/easybuild/software/2017/Core/scipy-stack/2019a/lib/python3.7/site-packages (from wandb) (2.21.0)
Processing /cvmfs/soft.computecanada.ca/custom/python/wheelhouse/generic/PyYAML-5.3.1+computecanada-cp37-cp37m-linux_x86_64.whl
Requirement already satisfied: importlib-metadata in /cvmfs/soft.computecanada.ca/easybuild/software/2017/Core/scipy-stack/2019a/lib/python3.7/site-packages (from Click!=8.0.0,>=7.0->wandb) (0.8)
Processing /cvmfs/soft.computecanada.ca/custom/python/wheelhouse/generic/typing_extensions-4.0.1+computecanada-py3-none-any.whl
Processing /cvmfs/soft.computecanada.ca/custom/python/wheelhouse/generic/gitdb-4.0.9+computecanada-py3-none-any.whl
Processing /cvmfs/soft.computecanada.ca/custom/python/wheelhouse/generic/smmap-5.0.0+computecanada-py3-none-any.whl
Requirement already satisfied: idna<2.9,>=2.5 in /cvmfs/soft.computecanada.ca/easybuild/software/2017/Core/scipy-stack/2019a/lib/python3.7/site-packages (from requests<3,>=2.0.0->wandb) (2.8)
Requirement already satisfied: urllib3<1.25,>=1.21.1 in /cvmfs/soft.computecanada.ca/easybuild/software/2017/Core/scipy-stack/2019a/lib/python3.7/site-packages (from requests<3,>=2.0.0->wandb) (1.24.1)
Requirement already satisfied: certifi>=2017.4.17 in /cvmfs/soft.computecanada.ca/easybuild/software/2017/Core/scipy-stack/2019a/lib/python3.7/site-packages (from requests<3,>=2.0.0->wandb) (2018.11.29)
Requirement already satisfied: chardet<3.1.0,>=3.0.2 in /cvmfs/soft.computecanada.ca/easybuild/software/2017/Core/scipy-stack/2019a/lib/python3.7/site-packages (from requests<3,>=2.0.0->wandb) (3.0.4)
Processing /cvmfs/soft.computecanada.ca/custom/python/wheelhouse/generic/termcolor-1.1.0+computecanada-py3-none-any.whl
Requirement already satisfied: zipp>=0.3.2 in /cvmfs/soft.computecanada.ca/easybuild/software/2017/Core/scipy-stack/2019a/lib/python3.7/site-packages (from importlib-metadata->Click!=8.0.0,>=7.0->wandb) (0.3.3)
Installing collected packages: smmap, typing-extensions, termcolor, six, gitdb, yaspin, subprocess32, shortuuid, sentry-sdk, PyYAML, psutil, protobuf, promise, pathtools, GitPython, docker-pycreds, configparser, Click, wandb
  Attempting uninstall: six
    Found existing installation: six 1.12.0
    Not uninstalling six at /cvmfs/soft.computecanada.ca/easybuild/software/2017/Core/scipy-stack/2019a/lib/python3.7/site-packages, outside environment /localscratch/yinan.28706188.0/env
    Can't uninstall 'six'. No files were found to uninstall.
Successfully installed Click-8.0.3+computecanada GitPython-3.1.24+computecanada PyYAML-5.3.1+computecanada configparser-5.0.2+computecanada docker-pycreds-0.4.0+computecanada gitdb-4.0.9+computecanada pathtools-0.1.2+computecanada promise-2.3+computecanada protobuf-3.19.4+computecanada psutil-5.7.3+computecanada sentry-sdk-1.5.0+computecanada shortuuid-1.0.1+computecanada six-1.16.0+computecanada smmap-5.0.0+computecanada subprocess32-3.5.4+computecanada termcolor-1.1.0+computecanada typing-extensions-4.0.1+computecanada wandb-0.12.5+computecanada yaspin-2.1.0+computecanada
Looking in links: /cvmfs/soft.computecanada.ca/custom/python/wheelhouse/nix/avx2, /cvmfs/soft.computecanada.ca/custom/python/wheelhouse/nix/generic, /cvmfs/soft.computecanada.ca/custom/python/wheelhouse/generic
ERROR: Could not find a version that satisfies the requirement sagemaker (from versions: none)
ERROR: No matching distribution found for sagemaker
Looking in links: /cvmfs/soft.computecanada.ca/custom/python/wheelhouse/nix/avx2, /cvmfs/soft.computecanada.ca/custom/python/wheelhouse/nix/generic, /cvmfs/soft.computecanada.ca/custom/python/wheelhouse/generic
Processing /cvmfs/soft.computecanada.ca/custom/python/wheelhouse/generic/torch-1.9.1+computecanada-cp37-cp37m-linux_x86_64.whl
Requirement already satisfied: typing-extensions in /localscratch/yinan.28706188.0/env/lib/python3.7/site-packages (from torch) (4.0.1+computecanada)
Installing collected packages: torch
Successfully installed torch-1.9.1+computecanada
Looking in links: /cvmfs/soft.computecanada.ca/custom/python/wheelhouse/nix/avx2, /cvmfs/soft.computecanada.ca/custom/python/wheelhouse/nix/generic, /cvmfs/soft.computecanada.ca/custom/python/wheelhouse/generic
Processing /cvmfs/soft.computecanada.ca/custom/python/wheelhouse/generic/transformers-2.5.1+computecanada-py3-none-any.whl
Processing /cvmfs/soft.computecanada.ca/custom/python/wheelhouse/generic/sentencepiece-0.1.91+computecanada-cp37-cp37m-linux_x86_64.whl
Requirement already satisfied: requests in /cvmfs/soft.computecanada.ca/easybuild/software/2017/Core/scipy-stack/2019a/lib/python3.7/site-packages (from transformers==2.5.1+computecanada) (2.21.0)
Processing /cvmfs/soft.computecanada.ca/custom/python/wheelhouse/generic/filelock-3.4.2+computecanada-py3-none-any.whl
Processing /cvmfs/soft.computecanada.ca/custom/python/wheelhouse/generic/regex-2020.11.13+computecanada-cp37-cp37m-linux_x86_64.whl
Processing /cvmfs/soft.computecanada.ca/custom/python/wheelhouse/generic/tokenizers-0.5.2+computecanada-cp37-cp37m-linux_x86_64.whl
Processing /cvmfs/soft.computecanada.ca/custom/python/wheelhouse/generic/tqdm-4.63.0+computecanada-py2.py3-none-any.whl
Processing /cvmfs/soft.computecanada.ca/custom/python/wheelhouse/generic/boto3-1.20.52+computecanada-py3-none-any.whl
Processing /cvmfs/soft.computecanada.ca/custom/python/wheelhouse/generic/sacremoses-0.0.46+computecanada-py3-none-any.whl
Requirement already satisfied: numpy in /cvmfs/soft.computecanada.ca/easybuild/software/2017/Core/scipy-stack/2019a/lib/python3.7/site-packages (from transformers==2.5.1+computecanada) (1.16.0)
Processing /cvmfs/soft.computecanada.ca/custom/python/wheelhouse/generic/s3transfer-0.5.1+computecanada-py3-none-any.whl
Processing /cvmfs/soft.computecanada.ca/custom/python/wheelhouse/generic/jmespath-0.10.0+computecanada-py2.py3-none-any.whl
Processing /cvmfs/soft.computecanada.ca/custom/python/wheelhouse/generic/botocore-1.23.52+computecanada-py3-none-any.whl
Requirement already satisfied: python-dateutil<3.0.0,>=2.1 in /cvmfs/soft.computecanada.ca/easybuild/software/2017/Core/scipy-stack/2019a/lib/python3.7/site-packages (from botocore<1.24.0,>=1.23.52->boto3->transformers==2.5.1+computecanada) (2.7.5)
Processing /cvmfs/soft.computecanada.ca/custom/python/wheelhouse/generic/urllib3-1.26.8+computecanada-py2.py3-none-any.whl
Requirement already satisfied: six>=1.5 in /localscratch/yinan.28706188.0/env/lib/python3.7/site-packages (from python-dateutil<3.0.0,>=2.1->botocore<1.24.0,>=1.23.52->boto3->transformers==2.5.1+computecanada) (1.16.0+computecanada)
Requirement already satisfied: chardet<3.1.0,>=3.0.2 in /cvmfs/soft.computecanada.ca/easybuild/software/2017/Core/scipy-stack/2019a/lib/python3.7/site-packages (from requests->transformers==2.5.1+computecanada) (3.0.4)
Processing /cvmfs/soft.computecanada.ca/custom/python/wheelhouse/generic/requests-2.27.1+computecanada-py2.py3-none-any.whl
Requirement already satisfied: idna<4,>=2.5 in /cvmfs/soft.computecanada.ca/easybuild/software/2017/Core/scipy-stack/2019a/lib/python3.7/site-packages (from requests->transformers==2.5.1+computecanada) (2.8)
Processing /cvmfs/soft.computecanada.ca/custom/python/wheelhouse/generic/charset_normalizer-2.0.11+computecanada-py3-none-any.whl
Requirement already satisfied: certifi>=2017.4.17 in /cvmfs/soft.computecanada.ca/easybuild/software/2017/Core/scipy-stack/2019a/lib/python3.7/site-packages (from requests->transformers==2.5.1+computecanada) (2018.11.29)
Processing /cvmfs/soft.computecanada.ca/custom/python/wheelhouse/generic/joblib-1.1.0+computecanada-py2.py3-none-any.whl
Requirement already satisfied: click in /localscratch/yinan.28706188.0/env/lib/python3.7/site-packages (from sacremoses->transformers==2.5.1+computecanada) (8.0.3+computecanada)
Requirement already satisfied: importlib-metadata in /cvmfs/soft.computecanada.ca/easybuild/software/2017/Core/scipy-stack/2019a/lib/python3.7/site-packages (from click->sacremoses->transformers==2.5.1+computecanada) (0.8)
Requirement already satisfied: zipp>=0.3.2 in /cvmfs/soft.computecanada.ca/easybuild/software/2017/Core/scipy-stack/2019a/lib/python3.7/site-packages (from importlib-metadata->click->sacremoses->transformers==2.5.1+computecanada) (0.3.3)
Installing collected packages: urllib3, jmespath, botocore, tqdm, s3transfer, regex, joblib, charset-normalizer, tokenizers, sentencepiece, sacremoses, requests, filelock, boto3, transformers
  Attempting uninstall: urllib3
    Found existing installation: urllib3 1.24.1
    Not uninstalling urllib3 at /cvmfs/soft.computecanada.ca/easybuild/software/2017/Core/scipy-stack/2019a/lib/python3.7/site-packages, outside environment /localscratch/yinan.28706188.0/env
    Can't uninstall 'urllib3'. No files were found to uninstall.
  Attempting uninstall: requests
    Found existing installation: requests 2.21.0
    Not uninstalling requests at /cvmfs/soft.computecanada.ca/easybuild/software/2017/Core/scipy-stack/2019a/lib/python3.7/site-packages, outside environment /localscratch/yinan.28706188.0/env
    Can't uninstall 'requests'. No files were found to uninstall.
Successfully installed boto3-1.20.52+computecanada botocore-1.23.52+computecanada charset-normalizer-2.0.11+computecanada filelock-3.4.2+computecanada jmespath-0.10.0+computecanada joblib-1.1.0+computecanada regex-2020.11.13+computecanada requests-2.27.1+computecanada s3transfer-0.5.1+computecanada sacremoses-0.0.46+computecanada sentencepiece-0.1.91+computecanada tokenizers-0.5.2+computecanada tqdm-4.63.0+computecanada transformers-2.5.1+computecanada urllib3-1.26.8+computecanada
Looking in links: /cvmfs/soft.computecanada.ca/custom/python/wheelhouse/nix/avx2, /cvmfs/soft.computecanada.ca/custom/python/wheelhouse/nix/generic, /cvmfs/soft.computecanada.ca/custom/python/wheelhouse/generic
Processing /cvmfs/soft.computecanada.ca/custom/python/wheelhouse/generic/tensorflow_gpu-2.3.0+computecanada-cp37-cp37m-linux_x86_64.whl
Processing /cvmfs/soft.computecanada.ca/custom/python/wheelhouse/generic/absl_py-1.0.0+computecanada-py3-none-any.whl
Processing /cvmfs/soft.computecanada.ca/custom/python/wheelhouse/nix/generic/scipy-1.4.1+computecanada-cp37-cp37m-linux_x86_64.whl
Requirement already satisfied: six>=1.12.0 in /localscratch/yinan.28706188.0/env/lib/python3.7/site-packages (from tensorflow_gpu==2.3.0+computecanada) (1.16.0+computecanada)
Processing /cvmfs/soft.computecanada.ca/custom/python/wheelhouse/generic/tensorflow_estimator-2.3.0+computecanada-py2.py3-none-any.whl
Processing /cvmfs/soft.computecanada.ca/custom/python/wheelhouse/generic/grpcio-1.38.0+computecanada-cp37-cp37m-linux_x86_64.whl
Processing /cvmfs/soft.computecanada.ca/custom/python/wheelhouse/generic/astunparse-1.6.3+computecanada-py2.py3-none-any.whl
Processing /cvmfs/soft.computecanada.ca/custom/python/wheelhouse/generic/google_pasta-0.2.0+computecanada-py3-none-any.whl
Processing /cvmfs/soft.computecanada.ca/custom/python/wheelhouse/nix/avx2/h5py-2.10.0+computecanada-cp37-cp37m-linux_x86_64.whl
Requirement already satisfied: wheel>=0.26 in /localscratch/yinan.28706188.0/env/lib/python3.7/site-packages (from tensorflow_gpu==2.3.0+computecanada) (0.33.4)
Processing /cvmfs/soft.computecanada.ca/custom/python/wheelhouse/generic/tensorboard-2.8.0+computecanada-py3-none-any.whl
Requirement already satisfied: termcolor>=1.1.0 in /localscratch/yinan.28706188.0/env/lib/python3.7/site-packages (from tensorflow_gpu==2.3.0+computecanada) (1.1.0+computecanada)
Requirement already satisfied: numpy<1.19.0,>=1.16.0 in /cvmfs/soft.computecanada.ca/easybuild/software/2017/Core/scipy-stack/2019a/lib/python3.7/site-packages (from tensorflow_gpu==2.3.0+computecanada) (1.16.0)
Processing /cvmfs/soft.computecanada.ca/custom/python/wheelhouse/generic/Keras_Preprocessing-1.1.2+computecanada-py3-none-any.whl
Processing /cvmfs/soft.computecanada.ca/custom/python/wheelhouse/generic/wrapt-1.11.2+computecanada-cp37-cp37m-linux_x86_64.whl
Requirement already satisfied: protobuf>=3.9.2 in /localscratch/yinan.28706188.0/env/lib/python3.7/site-packages (from tensorflow_gpu==2.3.0+computecanada) (3.19.4+computecanada)
Processing /cvmfs/soft.computecanada.ca/custom/python/wheelhouse/generic/opt_einsum-3.3.0+computecanada-py3-none-any.whl
Processing /cvmfs/soft.computecanada.ca/custom/python/wheelhouse/generic/gast-0.3.3+computecanada-py3-none-any.whl
Processing /cvmfs/soft.computecanada.ca/custom/python/wheelhouse/generic/Werkzeug-2.0.3+computecanada-py3-none-any.whl
Processing /cvmfs/soft.computecanada.ca/custom/python/wheelhouse/generic/Markdown-3.3.6+computecanada-py3-none-any.whl
Processing /cvmfs/soft.computecanada.ca/custom/python/wheelhouse/generic/google_auth_oauthlib-0.4.6+computecanada-py2.py3-none-any.whl
Requirement already satisfied: setuptools>=41.0.0 in /localscratch/yinan.28706188.0/env/lib/python3.7/site-packages (from tensorboard<3,>=2.3.0->tensorflow_gpu==2.3.0+computecanada) (41.0.1)
Processing /cvmfs/soft.computecanada.ca/custom/python/wheelhouse/generic/google_auth-2.3.3+computecanada-py2.py3-none-any.whl
Processing /cvmfs/soft.computecanada.ca/custom/python/wheelhouse/generic/tensorboard_data_server-0.6.1+computecanada-py3-none-linux_x86_64.whl
Processing /cvmfs/soft.computecanada.ca/custom/python/wheelhouse/generic/tensorboard_plugin_wit-1.8.0+computecanada-py3-none-any.whl
Requirement already satisfied: requests<3,>=2.21.0 in /localscratch/yinan.28706188.0/env/lib/python3.7/site-packages (from tensorboard<3,>=2.3.0->tensorflow_gpu==2.3.0+computecanada) (2.27.1+computecanada)
Processing /cvmfs/soft.computecanada.ca/custom/python/wheelhouse/generic/pyasn1_modules-0.2.8+computecanada-py2.py3-none-any.whl
Processing /cvmfs/soft.computecanada.ca/custom/python/wheelhouse/generic/cachetools-4.2.4+computecanada-py3-none-any.whl
Processing /cvmfs/soft.computecanada.ca/custom/python/wheelhouse/generic/rsa-4.8+computecanada-py3-none-any.whl
Processing /cvmfs/soft.computecanada.ca/custom/python/wheelhouse/generic/requests_oauthlib-1.3.0+computecanada-py2.py3-none-any.whl
Processing /cvmfs/soft.computecanada.ca/custom/python/wheelhouse/generic/importlib_metadata-4.10.1+computecanada-py3-none-any.whl
Processing /cvmfs/soft.computecanada.ca/custom/python/wheelhouse/generic/zipp-3.7.0+computecanada-py3-none-any.whl
Requirement already satisfied: typing-extensions>=3.6.4 in /localscratch/yinan.28706188.0/env/lib/python3.7/site-packages (from importlib-metadata>=4.4->markdown>=2.6.8->tensorboard<3,>=2.3.0->tensorflow_gpu==2.3.0+computecanada) (4.0.1+computecanada)
Processing /cvmfs/soft.computecanada.ca/custom/python/wheelhouse/generic/pyasn1-0.4.8+computecanada-py2.py3-none-any.whl
Requirement already satisfied: charset-normalizer~=2.0.0 in /localscratch/yinan.28706188.0/env/lib/python3.7/site-packages (from requests<3,>=2.21.0->tensorboard<3,>=2.3.0->tensorflow_gpu==2.3.0+computecanada) (2.0.11+computecanada)
Requirement already satisfied: idna<4,>=2.5 in /cvmfs/soft.computecanada.ca/easybuild/software/2017/Core/scipy-stack/2019a/lib/python3.7/site-packages (from requests<3,>=2.21.0->tensorboard<3,>=2.3.0->tensorflow_gpu==2.3.0+computecanada) (2.8)
Requirement already satisfied: urllib3<1.27,>=1.21.1 in /localscratch/yinan.28706188.0/env/lib/python3.7/site-packages (from requests<3,>=2.21.0->tensorboard<3,>=2.3.0->tensorflow_gpu==2.3.0+computecanada) (1.26.8+computecanada)
Requirement already satisfied: certifi>=2017.4.17 in /cvmfs/soft.computecanada.ca/easybuild/software/2017/Core/scipy-stack/2019a/lib/python3.7/site-packages (from requests<3,>=2.21.0->tensorboard<3,>=2.3.0->tensorflow_gpu==2.3.0+computecanada) (2018.11.29)
Processing /cvmfs/soft.computecanada.ca/custom/python/wheelhouse/generic/oauthlib-3.1.1+computecanada-py2.py3-none-any.whl
Installing collected packages: pyasn1, zipp, rsa, pyasn1-modules, oauthlib, cachetools, requests-oauthlib, importlib-metadata, google-auth, werkzeug, tensorboard-plugin-wit, tensorboard-data-server, markdown, grpcio, google-auth-oauthlib, absl-py, wrapt, tensorflow-estimator, tensorboard, scipy, opt-einsum, keras-preprocessing, h5py, google-pasta, gast, astunparse, tensorflow-gpu
  Attempting uninstall: pyasn1
    Found existing installation: pyasn1 0.4.3
    Not uninstalling pyasn1 at /cvmfs/soft.computecanada.ca/easybuild/software/2017/Core/scipy-stack/2019a/lib/python3.7/site-packages, outside environment /localscratch/yinan.28706188.0/env
    Can't uninstall 'pyasn1'. No files were found to uninstall.
  Attempting uninstall: zipp
    Found existing installation: zipp 0.3.3
    Not uninstalling zipp at /cvmfs/soft.computecanada.ca/easybuild/software/2017/Core/scipy-stack/2019a/lib/python3.7/site-packages, outside environment /localscratch/yinan.28706188.0/env
    Can't uninstall 'zipp'. No files were found to uninstall.
  Attempting uninstall: importlib-metadata
    Found existing installation: importlib-metadata 0.8
    Not uninstalling importlib-metadata at /cvmfs/soft.computecanada.ca/easybuild/software/2017/Core/scipy-stack/2019a/lib/python3.7/site-packages, outside environment /localscratch/yinan.28706188.0/env
    Can't uninstall 'importlib-metadata'. No files were found to uninstall.
  Attempting uninstall: scipy
    Found existing installation: scipy 1.2.0
    Not uninstalling scipy at /cvmfs/soft.computecanada.ca/easybuild/software/2017/Core/scipy-stack/2019a/lib/python3.7/site-packages, outside environment /localscratch/yinan.28706188.0/env
    Can't uninstall 'scipy'. No files were found to uninstall.
Successfully installed absl-py-1.0.0+computecanada astunparse-1.6.3+computecanada cachetools-4.2.4+computecanada gast-0.3.3+computecanada google-auth-2.3.3+computecanada google-auth-oauthlib-0.4.6+computecanada google-pasta-0.2.0+computecanada grpcio-1.38.0+computecanada h5py-2.10.0+computecanada importlib-metadata-4.10.1+computecanada keras-preprocessing-1.1.2+computecanada markdown-3.3.6+computecanada oauthlib-3.1.1+computecanada opt-einsum-3.3.0+computecanada pyasn1-0.4.8+computecanada pyasn1-modules-0.2.8+computecanada requests-oauthlib-1.3.0+computecanada rsa-4.8+computecanada scipy-1.4.1+computecanada tensorboard-2.8.0+computecanada tensorboard-data-server-0.6.1+computecanada tensorboard-plugin-wit-1.8.0+computecanada tensorflow-estimator-2.3.0+computecanada tensorflow-gpu-2.3.0+computecanada werkzeug-2.0.3+computecanada wrapt-1.11.2+computecanada zipp-3.7.0+computecanada
Looking in links: /cvmfs/soft.computecanada.ca/custom/python/wheelhouse/nix/avx2, /cvmfs/soft.computecanada.ca/custom/python/wheelhouse/nix/generic, /cvmfs/soft.computecanada.ca/custom/python/wheelhouse/generic
Processing /cvmfs/soft.computecanada.ca/custom/python/wheelhouse/generic/keras-2.8.0+computecanada-py2.py3-none-any.whl
Installing collected packages: Keras
Successfully installed Keras-2.8.0+computecanada
Looking in links: /cvmfs/soft.computecanada.ca/custom/python/wheelhouse/nix/avx2, /cvmfs/soft.computecanada.ca/custom/python/wheelhouse/nix/generic, /cvmfs/soft.computecanada.ca/custom/python/wheelhouse/generic
Processing /cvmfs/soft.computecanada.ca/custom/python/wheelhouse/generic/urllib3-1.26.7+computecanada-py2.py3-none-any.whl
Installing collected packages: urllib3
  Attempting uninstall: urllib3
    Found existing installation: urllib3 1.26.8+computecanada
    Uninstalling urllib3-1.26.8+computecanada:
      Successfully uninstalled urllib3-1.26.8+computecanada
Successfully installed urllib3-1.26.7+computecanada
Looking in links: /cvmfs/soft.computecanada.ca/custom/python/wheelhouse/nix/avx2, /cvmfs/soft.computecanada.ca/custom/python/wheelhouse/nix/generic, /cvmfs/soft.computecanada.ca/custom/python/wheelhouse/generic
Processing /cvmfs/soft.computecanada.ca/custom/python/wheelhouse/generic/nltk-3.7+computecanada-py3-none-any.whl
Requirement already satisfied: tqdm in /localscratch/yinan.28706188.0/env/lib/python3.7/site-packages (from nltk) (4.63.0+computecanada)
Requirement already satisfied: click in /localscratch/yinan.28706188.0/env/lib/python3.7/site-packages (from nltk) (8.0.3+computecanada)
Processing /cvmfs/soft.computecanada.ca/custom/python/wheelhouse/generic/nltk-3.6.5+computecanada-py3-none-any.whl
Processing /cvmfs/soft.computecanada.ca/custom/python/wheelhouse/generic/nltk-3.6.3+computecanada-py3-none-any.whl
Requirement already satisfied: regex in /localscratch/yinan.28706188.0/env/lib/python3.7/site-packages (from nltk) (2020.11.13+computecanada)
Requirement already satisfied: joblib in /localscratch/yinan.28706188.0/env/lib/python3.7/site-packages (from nltk) (1.1.0+computecanada)
Requirement already satisfied: importlib-metadata in /localscratch/yinan.28706188.0/env/lib/python3.7/site-packages (from click->nltk) (4.10.1+computecanada)
Requirement already satisfied: typing-extensions>=3.6.4 in /localscratch/yinan.28706188.0/env/lib/python3.7/site-packages (from importlib-metadata->click->nltk) (4.0.1+computecanada)
Requirement already satisfied: zipp>=0.5 in /localscratch/yinan.28706188.0/env/lib/python3.7/site-packages (from importlib-metadata->click->nltk) (3.7.0+computecanada)
Installing collected packages: nltk
Successfully installed nltk-3.6.3+computecanada
Looking in links: /cvmfs/soft.computecanada.ca/custom/python/wheelhouse/nix/avx2, /cvmfs/soft.computecanada.ca/custom/python/wheelhouse/nix/generic, /cvmfs/soft.computecanada.ca/custom/python/wheelhouse/generic
Processing /cvmfs/soft.computecanada.ca/custom/python/wheelhouse/generic/scikit_learn-0.22.1+computecanada-cp37-cp37m-linux_x86_64.whl
Requirement already satisfied: numpy>=1.11.0 in /cvmfs/soft.computecanada.ca/easybuild/software/2017/Core/scipy-stack/2019a/lib/python3.7/site-packages (from scikit-learn==0.22.1) (1.16.0)
Requirement already satisfied: joblib>=0.11 in /localscratch/yinan.28706188.0/env/lib/python3.7/site-packages (from scikit-learn==0.22.1) (1.1.0+computecanada)
Requirement already satisfied: scipy>=0.17.0 in /localscratch/yinan.28706188.0/env/lib/python3.7/site-packages (from scikit-learn==0.22.1) (1.4.1+computecanada)
Installing collected packages: scikit-learn
Successfully installed scikit-learn-0.22.1+computecanada
Looking in links: /cvmfs/soft.computecanada.ca/custom/python/wheelhouse/nix/avx2, /cvmfs/soft.computecanada.ca/custom/python/wheelhouse/nix/generic, /cvmfs/soft.computecanada.ca/custom/python/wheelhouse/generic
Requirement already satisfied: tokenizers==0.5.2 in /localscratch/yinan.28706188.0/env/lib/python3.7/site-packages (0.5.2+computecanada)
wandb: Appending key for api.wandb.ai to your netrc file: /home/yinan/.netrc
Starting Task
2022-03-11 00:30:24.403817: I tensorflow/stream_executor/platform/default/dso_loader.cc:48] Successfully opened dynamic library libcudart.so.10.1
[nltk_data] Downloading package stopwords to /home/yinan/nltk_data...
[nltk_data]   Package stopwords is already up-to-date!
[nltk_data] Downloading package wordnet to /home/yinan/nltk_data...
[nltk_data]   Package wordnet is already up-to-date!
wandb: Currently logged in as: yinanazhou (use `wandb login --relogin` to force relogin)
wandb: wandb version 0.12.11 is available!  To upgrade, please run:
wandb:  $ pip install wandb --upgrade
2022-03-11 00:30:38.997807: I tensorflow/stream_executor/platform/default/dso_loader.cc:48] Successfully opened dynamic library libcudart.so.10.1
wandb: Tracking run with wandb version 0.12.5
wandb: Syncing run worldly-salad-1
wandb: ⭐️ View project at https://wandb.ai/yinanazhou/xl_512_bs_8_lr_1e07_es_5_lc_True_nr_True_sr_True_stem_False_lemma_True_repeat_1_fold_1
wandb: 🚀 View run at https://wandb.ai/yinanazhou/xl_512_bs_8_lr_1e07_es_5_lc_True_nr_True_sr_True_stem_False_lemma_True_repeat_1_fold_1/runs/2df6jw7a
wandb: Run data is saved locally in /project/6002780/yinan/Thesis_MER_Lyrics/lyric-emotion/wandb/run-20220311_003036-2df6jw7a
wandb: Run `wandb offline` to turn off syncing.

Validation loss decreased (inf --> 1.463465).  Saving model ...
Validation loss decreased (1.463465 --> 1.460874).  Saving model ...
Validation loss decreased (1.460874 --> 1.458158).  Saving model ...
Validation loss decreased (1.458158 --> 1.455459).  Saving model ...
Validation loss decreased (1.455459 --> 1.452867).  Saving model ...
Validation loss decreased (1.452867 --> 1.450337).  Saving model ...
Validation loss decreased (1.450337 --> 1.448073).  Saving model ...
Validation loss decreased (1.448073 --> 1.445887).  Saving model ...
Validation loss decreased (1.445887 --> 1.443678).  Saving model ...
Validation loss decreased (1.443678 --> 1.441375).  Saving model ...
Validation loss decreased (1.441375 --> 1.439151).  Saving model ...
Validation loss decreased (1.439151 --> 1.437148).  Saving model ...
Validation loss decreased (1.437148 --> 1.435162).  Saving model ...
Validation loss decreased (1.435162 --> 1.433120).  Saving model ...
Validation loss decreased (1.433120 --> 1.431197).  Saving model ...
Validation loss decreased (1.431197 --> 1.429363).  Saving model ...
Validation loss decreased (1.429363 --> 1.427550).  Saving model ...
Validation loss decreased (1.427550 --> 1.425760).  Saving model ...
Validation loss decreased (1.425760 --> 1.424063).  Saving model ...
Validation loss decreased (1.424063 --> 1.422348).  Saving model ...
Validation loss decreased (1.422348 --> 1.420669).  Saving model ...
Validation loss decreased (1.420669 --> 1.419040).  Saving model ...
Validation loss decreased (1.419040 --> 1.417460).  Saving model ...
Validation loss decreased (1.417460 --> 1.415962).  Saving model ...
Validation loss decreased (1.415962 --> 1.414417).  Saving model ...
Validation loss decreased (1.414417 --> 1.412954).  Saving model ...
Validation loss decreased (1.412954 --> 1.411527).  Saving model ...
Validation loss decreased (1.411527 --> 1.410112).  Saving model ...
Validation loss decreased (1.410112 --> 1.408847).  Saving model ...
Validation loss decreased (1.408847 --> 1.407607).  Saving model ...
Validation loss decreased (1.407607 --> 1.406296).  Saving model ...
Validation loss decreased (1.406296 --> 1.405009).  Saving model ...
Validation loss decreased (1.405009 --> 1.403864).  Saving model ...
Validation loss decreased (1.403864 --> 1.402647).  Saving model ...
Validation loss decreased (1.402647 --> 1.401529).  Saving model ...
Validation loss decreased (1.401529 --> 1.400280).  Saving model ...
Validation loss decreased (1.400280 --> 1.399094).  Saving model ...
Validation loss decreased (1.399094 --> 1.398081).  Saving model ...
Validation loss decreased (1.398081 --> 1.396990).  Saving model ...
Validation loss decreased (1.396990 --> 1.396030).  Saving model ...
Validation loss decreased (1.396030 --> 1.395039).  Saving model ...
Validation loss decreased (1.395039 --> 1.393958).  Saving model ...
Validation loss decreased (1.393958 --> 1.392969).  Saving model ...
Validation loss decreased (1.392969 --> 1.391981).  Saving model ...
Validation loss decreased (1.391981 --> 1.390986).  Saving model ...
Validation loss decreased (1.390986 --> 1.390099).  Saving model ...
Validation loss decreased (1.390099 --> 1.389221).  Saving model ...
Validation loss decreased (1.389221 --> 1.388315).  Saving model ...
Validation loss decreased (1.388315 --> 1.387444).  Saving model ...
Validation loss decreased (1.387444 --> 1.386574).  Saving model ...
Validation loss decreased (1.386574 --> 1.385794).  Saving model ...
Validation loss decreased (1.385794 --> 1.385052).  Saving model ...
Validation loss decreased (1.385052 --> 1.384258).  Saving model ...
Validation loss decreased (1.384258 --> 1.383434).  Saving model ...
Validation loss decreased (1.383434 --> 1.382706).  Saving model ...
Validation loss decreased (1.382706 --> 1.381946).  Saving model ...
Validation loss decreased (1.381946 --> 1.381173).  Saving model ...
Validation loss decreased (1.381173 --> 1.380463).  Saving model ...
Validation loss decreased (1.380463 --> 1.379718).  Saving model ...
Validation loss decreased (1.379718 --> 1.379077).  Saving model ...
Validation loss decreased (1.379077 --> 1.378373).  Saving model ...
Validation loss decreased (1.378373 --> 1.377642).  Saving model ...
Validation loss decreased (1.377642 --> 1.376926).  Saving model ...
Validation loss decreased (1.376926 --> 1.376244).  Saving model ...
Validation loss decreased (1.376244 --> 1.375668).  Saving model ...
Validation loss decreased (1.375668 --> 1.374980).  Saving model ...
Validation loss decreased (1.374980 --> 1.374404).  Saving model ...
Validation loss decreased (1.374404 --> 1.373761).  Saving model ...
Validation loss decreased (1.373761 --> 1.373217).  Saving model ...
Validation loss decreased (1.373217 --> 1.372671).  Saving model ...
Validation loss decreased (1.372671 --> 1.372111).  Saving model ...
Validation loss decreased (1.372111 --> 1.371492).  Saving model ...
Validation loss decreased (1.371492 --> 1.370879).  Saving model ...
Validation loss decreased (1.370879 --> 1.370251).  Saving model ...
Validation loss decreased (1.370251 --> 1.369700).  Saving model ...
Validation loss decreased (1.369700 --> 1.369159).  Saving model ...
Validation loss decreased (1.369159 --> 1.368620).  Saving model ...
Validation loss decreased (1.368620 --> 1.368075).  Saving model ...
Validation loss decreased (1.368075 --> 1.367516).  Saving model ...
Validation loss decreased (1.367516 --> 1.366959).  Saving model ...
Validation loss decreased (1.366959 --> 1.366423).  Saving model ...
Validation loss decreased (1.366423 --> 1.365911).  Saving model ...
Validation loss decreased (1.365911 --> 1.365378).  Saving model ...
Validation loss decreased (1.365378 --> 1.364903).  Saving model ...
Validation loss decreased (1.364903 --> 1.364402).  Saving model ...
Validation loss decreased (1.364402 --> 1.363875).  Saving model ...
Validation loss decreased (1.363875 --> 1.363373).  Saving model ...
Validation loss decreased (1.363373 --> 1.362786).  Saving model ...
Validation loss decreased (1.362786 --> 1.362339).  Saving model ...
Validation loss decreased (1.362339 --> 1.361870).  Saving model ...
Validation loss decreased (1.361870 --> 1.361398).  Saving model ...
Validation loss decreased (1.361398 --> 1.360965).  Saving model ...
Validation loss decreased (1.360965 --> 1.360505).  Saving model ...
Validation loss decreased (1.360505 --> 1.360018).  Saving model ...
Validation loss decreased (1.360018 --> 1.359548).  Saving model ...
Validation loss decreased (1.359548 --> 1.359125).  Saving model ...
Validation loss decreased (1.359125 --> 1.358668).  Saving model ...
Validation loss decreased (1.358668 --> 1.358187).  Saving model ...
Validation loss decreased (1.358187 --> 1.357730).  Saving model ...
Validation loss decreased (1.357730 --> 1.357294).  Saving model ...
Validation loss decreased (1.357294 --> 1.356816).  Saving model ...
Validation loss decreased (1.356816 --> 1.356336).  Saving model ...
Validation loss decreased (1.356336 --> 1.355883).  Saving model ...
Validation loss decreased (1.355883 --> 1.355410).  Saving model ...
Validation loss decreased (1.355410 --> 1.354913).  Saving model ...
Validation loss decreased (1.354913 --> 1.354482).  Saving model ...
Validation loss decreased (1.354482 --> 1.354016).  Saving model ...
Validation loss decreased (1.354016 --> 1.353562).  Saving model ...
Validation loss decreased (1.353562 --> 1.353067).  Saving model ...
Validation loss decreased (1.353067 --> 1.352627).  Saving model ...
Validation loss decreased (1.352627 --> 1.352189).  Saving model ...
Validation loss decreased (1.352189 --> 1.351738).  Saving model ...
Validation loss decreased (1.351738 --> 1.351316).  Saving model ...
Validation loss decreased (1.351316 --> 1.350919).  Saving model ...
Validation loss decreased (1.350919 --> 1.350486).  Saving model ...
Validation loss decreased (1.350486 --> 1.350047).  Saving model ...
Validation loss decreased (1.350047 --> 1.349581).  Saving model ...
Validation loss decreased (1.349581 --> 1.349147).  Saving model ...
Validation loss decreased (1.349147 --> 1.348721).  Saving model ...
Validation loss decreased (1.348721 --> 1.348249).  Saving model ...
Validation loss decreased (1.348249 --> 1.347861).  Saving model ...
Validation loss decreased (1.347861 --> 1.347394).  Saving model ...
Validation loss decreased (1.347394 --> 1.347015).  Saving model ...
Validation loss decreased (1.347015 --> 1.346584).  Saving model ...
Validation loss decreased (1.346584 --> 1.346152).  Saving model ...
Validation loss decreased (1.346152 --> 1.345692).  Saving model ...
Validation loss decreased (1.345692 --> 1.345264).  Saving model ...
Validation loss decreased (1.345264 --> 1.344780).  Saving model ...
Validation loss decreased (1.344780 --> 1.344360).  Saving model ...
Validation loss decreased (1.344360 --> 1.343974).  Saving model ...
Validation loss decreased (1.343974 --> 1.343526).  Saving model ...
Validation loss decreased (1.343526 --> 1.343066).  Saving model ...
Validation loss decreased (1.343066 --> 1.342573).  Saving model ...
Validation loss decreased (1.342573 --> 1.342135).  Saving model ...
Validation loss decreased (1.342135 --> 1.341677).  Saving model ...
Validation loss decreased (1.341677 --> 1.341215).  Saving model ...
Validation loss decreased (1.341215 --> 1.340808).  Saving model ...
Validation loss decreased (1.340808 --> 1.340376).  Saving model ...
Validation loss decreased (1.340376 --> 1.339873).  Saving model ...
Validation loss decreased (1.339873 --> 1.339432).  Saving model ...
Validation loss decreased (1.339432 --> 1.339000).  Saving model ...
Validation loss decreased (1.339000 --> 1.338560).  Saving model ...
Validation loss decreased (1.338560 --> 1.338073).  Saving model ...
Validation loss decreased (1.338073 --> 1.337647).  Saving model ...
Validation loss decreased (1.337647 --> 1.337142).  Saving model ...
Validation loss decreased (1.337142 --> 1.336704).  Saving model ...
Validation loss decreased (1.336704 --> 1.336259).  Saving model ...
Validation loss decreased (1.336259 --> 1.335765).  Saving model ...
Validation loss decreased (1.335765 --> 1.335315).  Saving model ...
Validation loss decreased (1.335315 --> 1.334856).  Saving model ...
Validation loss decreased (1.334856 --> 1.334420).  Saving model ...
Validation loss decreased (1.334420 --> 1.334033).  Saving model ...
Validation loss decreased (1.334033 --> 1.333585).  Saving model ...
Validation loss decreased (1.333585 --> 1.333170).  Saving model ...
Validation loss decreased (1.333170 --> 1.332680).  Saving model ...
Validation loss decreased (1.332680 --> 1.332280).  Saving model ...
Validation loss decreased (1.332280 --> 1.331856).  Saving model ...
Validation loss decreased (1.331856 --> 1.331358).  Saving model ...
Validation loss decreased (1.331358 --> 1.330851).  Saving model ...
Validation loss decreased (1.330851 --> 1.330398).  Saving model ...
Validation loss decreased (1.330398 --> 1.329917).  Saving model ...
Validation loss decreased (1.329917 --> 1.329468).  Saving model ...
Validation loss decreased (1.329468 --> 1.328998).  Saving model ...
Validation loss decreased (1.328998 --> 1.328504).  Saving model ...
Validation loss decreased (1.328504 --> 1.328056).  Saving model ...
Validation loss decreased (1.328056 --> 1.327623).  Saving model ...
Validation loss decreased (1.327623 --> 1.327136).  Saving model ...
Validation loss decreased (1.327136 --> 1.326678).  Saving model ...
Validation loss decreased (1.326678 --> 1.326262).  Saving model ...
Validation loss decreased (1.326262 --> 1.325765).  Saving model ...
Validation loss decreased (1.325765 --> 1.325244).  Saving model ...
Validation loss decreased (1.325244 --> 1.324826).  Saving model ...
Validation loss decreased (1.324826 --> 1.324402).  Saving model ...
Validation loss decreased (1.324402 --> 1.323962).  Saving model ...
Validation loss decreased (1.323962 --> 1.323510).  Saving model ...
Validation loss decreased (1.323510 --> 1.323037).  Saving model ...
Validation loss decreased (1.323037 --> 1.322477).  Saving model ...
Validation loss decreased (1.322477 --> 1.321988).  Saving model ...
Validation loss decreased (1.321988 --> 1.321606).  Saving model ...
Validation loss decreased (1.321606 --> 1.321191).  Saving model ...
Validation loss decreased (1.321191 --> 1.320721).  Saving model ...
Validation loss decreased (1.320721 --> 1.320169).  Saving model ...
Validation loss decreased (1.320169 --> 1.319678).  Saving model ...
Validation loss decreased (1.319678 --> 1.319216).  Saving model ...
Validation loss decreased (1.319216 --> 1.318725).  Saving model ...
Validation loss decreased (1.318725 --> 1.318110).  Saving model ...
Validation loss decreased (1.318110 --> 1.317734).  Saving model ...
Validation loss decreased (1.317734 --> 1.317333).  Saving model ...
Validation loss decreased (1.317333 --> 1.316811).  Saving model ...
Validation loss decreased (1.316811 --> 1.316349).  Saving model ...
Validation loss decreased (1.316349 --> 1.315936).  Saving model ...
Validation loss decreased (1.315936 --> 1.315536).  Saving model ...
Validation loss decreased (1.315536 --> 1.315153).  Saving model ...
Validation loss decreased (1.315153 --> 1.314658).  Saving model ...
Validation loss decreased (1.314658 --> 1.314198).  Saving model ...
Validation loss decreased (1.314198 --> 1.313778).  Saving model ...
Validation loss decreased (1.313778 --> 1.313296).  Saving model ...
Validation loss decreased (1.313296 --> 1.312779).  Saving model ...
Validation loss decreased (1.312779 --> 1.312156).  Saving model ...
Validation loss decreased (1.312156 --> 1.311550).  Saving model ...
Validation loss decreased (1.311550 --> 1.311090).  Saving model ...
Validation loss decreased (1.311090 --> 1.310595).  Saving model ...
Validation loss decreased (1.310595 --> 1.310186).  Saving model ...
Validation loss decreased (1.310186 --> 1.309706).  Saving model ...
Validation loss decreased (1.309706 --> 1.309330).  Saving model ...
Validation loss decreased (1.309330 --> 1.308893).  Saving model ...
Validation loss decreased (1.308893 --> 1.308407).  Saving model ...
Validation loss decreased (1.308407 --> 1.308004).  Saving model ...
Validation loss decreased (1.308004 --> 1.307624).  Saving model ...
Validation loss decreased (1.307624 --> 1.307236).  Saving model ...
Validation loss decreased (1.307236 --> 1.306723).  Saving model ...
Validation loss decreased (1.306723 --> 1.306173).  Saving model ...
Validation loss decreased (1.306173 --> 1.305740).  Saving model ...
Validation loss decreased (1.305740 --> 1.305205).  Saving model ...
Validation loss decreased (1.305205 --> 1.304764).  Saving model ...
Validation loss decreased (1.304764 --> 1.304285).  Saving model ...
Validation loss decreased (1.304285 --> 1.303884).  Saving model ...
Validation loss decreased (1.303884 --> 1.303387).  Saving model ...
Validation loss decreased (1.303387 --> 1.302961).  Saving model ...
Validation loss decreased (1.302961 --> 1.302507).  Saving model ...
Validation loss decreased (1.302507 --> 1.301973).  Saving model ...
Validation loss decreased (1.301973 --> 1.301496).  Saving model ...
Validation loss decreased (1.301496 --> 1.300950).  Saving model ...
Validation loss decreased (1.300950 --> 1.300425).  Saving model ...
Validation loss decreased (1.300425 --> 1.299935).  Saving model ...
Validation loss decreased (1.299935 --> 1.299470).  Saving model ...
Validation loss decreased (1.299470 --> 1.299076).  Saving model ...
Validation loss decreased (1.299076 --> 1.298630).  Saving model ...
Validation loss decreased (1.298630 --> 1.298129).  Saving model ...
Validation loss decreased (1.298129 --> 1.297656).  Saving model ...
Validation loss decreased (1.297656 --> 1.297092).  Saving model ...
Validation loss decreased (1.297092 --> 1.296585).  Saving model ...
Validation loss decreased (1.296585 --> 1.296139).  Saving model ...
Validation loss decreased (1.296139 --> 1.295645).  Saving model ...
Validation loss decreased (1.295645 --> 1.295197).  Saving model ...
Validation loss decreased (1.295197 --> 1.294757).  Saving model ...
Validation loss decreased (1.294757 --> 1.294307).  Saving model ...
Validation loss decreased (1.294307 --> 1.293921).  Saving model ...
Validation loss decreased (1.293921 --> 1.293481).  Saving model ...
Validation loss decreased (1.293481 --> 1.293112).  Saving model ...
Validation loss decreased (1.293112 --> 1.292741).  Saving model ...
Validation loss decreased (1.292741 --> 1.292375).  Saving model ...
Validation loss decreased (1.292375 --> 1.292033).  Saving model ...
Validation loss decreased (1.292033 --> 1.291591).  Saving model ...
Validation loss decreased (1.291591 --> 1.291300).  Saving model ...
Validation loss decreased (1.291300 --> 1.290847).  Saving model ...
Validation loss decreased (1.290847 --> 1.290612).  Saving model ...
Validation loss decreased (1.290612 --> 1.290255).  Saving model ...
Validation loss decreased (1.290255 --> 1.289898).  Saving model ...
Validation loss decreased (1.289898 --> 1.289488).  Saving model ...
Validation loss decreased (1.289488 --> 1.288996).  Saving model ...
Validation loss decreased (1.288996 --> 1.288623).  Saving model ...
Validation loss decreased (1.288623 --> 1.288316).  Saving model ...
Validation loss decreased (1.288316 --> 1.287914).  Saving model ...
Validation loss decreased (1.287914 --> 1.287555).  Saving model ...
Validation loss decreased (1.287555 --> 1.287183).  Saving model ...
Validation loss decreased (1.287183 --> 1.286824).  Saving model ...
Validation loss decreased (1.286824 --> 1.286409).  Saving model ...
Validation loss decreased (1.286409 --> 1.285841).  Saving model ...
Validation loss decreased (1.285841 --> 1.285427).  Saving model ...
Validation loss decreased (1.285427 --> 1.285012).  Saving model ...
Validation loss decreased (1.285012 --> 1.284581).  Saving model ...
Validation loss decreased (1.284581 --> 1.284065).  Saving model ...
Validation loss decreased (1.284065 --> 1.283668).  Saving model ...
Validation loss decreased (1.283668 --> 1.283143).  Saving model ...
Validation loss decreased (1.283143 --> 1.282698).  Saving model ...
Validation loss decreased (1.282698 --> 1.282414).  Saving model ...
Validation loss decreased (1.282414 --> 1.282129).  Saving model ...
Validation loss decreased (1.282129 --> 1.281727).  Saving model ...
Validation loss decreased (1.281727 --> 1.281316).  Saving model ...
Validation loss decreased (1.281316 --> 1.280911).  Saving model ...
Validation loss decreased (1.280911 --> 1.280357).  Saving model ...
Validation loss decreased (1.280357 --> 1.280032).  Saving model ...
Validation loss decreased (1.280032 --> 1.279477).  Saving model ...
Validation loss decreased (1.279477 --> 1.279042).  Saving model ...
Validation loss decreased (1.279042 --> 1.278748).  Saving model ...
Validation loss decreased (1.278748 --> 1.278498).  Saving model ...
Validation loss decreased (1.278498 --> 1.278040).  Saving model ...
Validation loss decreased (1.278040 --> 1.277554).  Saving model ...
Validation loss decreased (1.277554 --> 1.277147).  Saving model ...
Validation loss decreased (1.277147 --> 1.276640).  Saving model ...
Validation loss decreased (1.276640 --> 1.276315).  Saving model ...
Validation loss decreased (1.276315 --> 1.276051).  Saving model ...
Validation loss decreased (1.276051 --> 1.275620).  Saving model ...
Validation loss decreased (1.275620 --> 1.275279).  Saving model ...
Validation loss decreased (1.275279 --> 1.275055).  Saving model ...
Validation loss decreased (1.275055 --> 1.274577).  Saving model ...
Validation loss decreased (1.274577 --> 1.274156).  Saving model ...
Validation loss decreased (1.274156 --> 1.273780).  Saving model ...
Validation loss decreased (1.273780 --> 1.273537).  Saving model ...
Validation loss decreased (1.273537 --> 1.273099).  Saving model ...
Validation loss decreased (1.273099 --> 1.272700).  Saving model ...
Validation loss decreased (1.272700 --> 1.272340).  Saving model ...
Validation loss decreased (1.272340 --> 1.272103).  Saving model ...
Validation loss decreased (1.272103 --> 1.271645).  Saving model ...
Validation loss decreased (1.271645 --> 1.271310).  Saving model ...
Validation loss decreased (1.271310 --> 1.270959).  Saving model ...
Validation loss decreased (1.270959 --> 1.270398).  Saving model ...
Validation loss decreased (1.270398 --> 1.270191).  Saving model ...
Validation loss decreased (1.270191 --> 1.269849).  Saving model ...
Validation loss decreased (1.269849 --> 1.269414).  Saving model ...
Validation loss decreased (1.269414 --> 1.269002).  Saving model ...
Validation loss decreased (1.269002 --> 1.268887).  Saving model ...
Validation loss decreased (1.268887 --> 1.268476).  Saving model ...
Validation loss decreased (1.268476 --> 1.267895).  Saving model ...
Validation loss decreased (1.267895 --> 1.267553).  Saving model ...
Validation loss decreased (1.267553 --> 1.267379).  Saving model ...
Validation loss decreased (1.267379 --> 1.267136).  Saving model ...
Validation loss decreased (1.267136 --> 1.266870).  Saving model ...
Validation loss decreased (1.266870 --> 1.266203).  Saving model ...
Validation loss decreased (1.266203 --> 1.266077).  Saving model ...
Validation loss decreased (1.266077 --> 1.265815).  Saving model ...
Validation loss decreased (1.265815 --> 1.265521).  Saving model ...
Validation loss decreased (1.265521 --> 1.265343).  Saving model ...
Validation loss decreased (1.265343 --> 1.265091).  Saving model ...
Validation loss decreased (1.265091 --> 1.264729).  Saving model ...
Validation loss decreased (1.264729 --> 1.264442).  Saving model ...
Validation loss decreased (1.264442 --> 1.264075).  Saving model ...
Validation loss decreased (1.264075 --> 1.263718).  Saving model ...
Validation loss decreased (1.263718 --> 1.263507).  Saving model ...
Validation loss decreased (1.263507 --> 1.263399).  Saving model ...
Validation loss decreased (1.263399 --> 1.262989).  Saving model ...
Validation loss decreased (1.262989 --> 1.262677).  Saving model ...
Validation loss decreased (1.262677 --> 1.262520).  Saving model ...
Validation loss decreased (1.262520 --> 1.262154).  Saving model ...
Validation loss decreased (1.262154 --> 1.261949).  Saving model ...
Validation loss decreased (1.261949 --> 1.261668).  Saving model ...
Validation loss decreased (1.261668 --> 1.261316).  Saving model ...
Validation loss decreased (1.261316 --> 1.260935).  Saving model ...
Validation loss decreased (1.260935 --> 1.260657).  Saving model ...
Validation loss decreased (1.260657 --> 1.260358).  Saving model ...
Validation loss decreased (1.260358 --> 1.260259).  Saving model ...
Validation loss decreased (1.260259 --> 1.259766).  Saving model ...
Validation loss decreased (1.259766 --> 1.259609).  Saving model ...
Validation loss decreased (1.259609 --> 1.259216).  Saving model ...
Validation loss decreased (1.259216 --> 1.258972).  Saving model ...
Validation loss decreased (1.258972 --> 1.258604).  Saving model ...
Validation loss decreased (1.258604 --> 1.258564).  Saving model ...
Validation loss decreased (1.258564 --> 1.258121).  Saving model ...
Validation loss decreased (1.258121 --> 1.257832).  Saving model ...
Validation loss decreased (1.257832 --> 1.257655).  Saving model ...
Validation loss decreased (1.257655 --> 1.257243).  Saving model ...
Validation loss decreased (1.257243 --> 1.257000).  Saving model ...
Validation loss decreased (1.257000 --> 1.256859).  Saving model ...
Validation loss decreased (1.256859 --> 1.256740).  Saving model ...
Validation loss decreased (1.256740 --> 1.256625).  Saving model ...
Validation loss decreased (1.256625 --> 1.256208).  Saving model ...
Validation loss decreased (1.256208 --> 1.255864).  Saving model ...
Validation loss decreased (1.255864 --> 1.255586).  Saving model ...
Validation loss decreased (1.255586 --> 1.255399).  Saving model ...
Validation loss decreased (1.255399 --> 1.255092).  Saving model ...
Validation loss decreased (1.255092 --> 1.254396).  Saving model ...
Validation loss decreased (1.254396 --> 1.254160).  Saving model ...
Validation loss decreased (1.254160 --> 1.253989).  Saving model ...
Validation loss decreased (1.253989 --> 1.253551).  Saving model ...
Validation loss decreased (1.253551 --> 1.253437).  Saving model ...
Validation loss decreased (1.253437 --> 1.252991).  Saving model ...
Validation loss decreased (1.252991 --> 1.252735).  Saving model ...
Validation loss decreased (1.252735 --> 1.252246).  Saving model ...
Validation loss decreased (1.252246 --> 1.252131).  Saving model ...
EarlyStopping counter: 1 out of 5.0
Validation loss decreased (1.252131 --> 1.251915).  Saving model ...
Validation loss decreased (1.251915 --> 1.251581).  Saving model ...
Validation loss decreased (1.251581 --> 1.251341).  Saving model ...
Validation loss decreased (1.251341 --> 1.251289).  Saving model ...
Validation loss decreased (1.251289 --> 1.250859).  Saving model ...
Validation loss decreased (1.250859 --> 1.250484).  Saving model ...
Validation loss decreased (1.250484 --> 1.250051).  Saving model ...
Validation loss decreased (1.250051 --> 1.249926).  Saving model ...
Validation loss decreased (1.249926 --> 1.249702).  Saving model ...
Validation loss decreased (1.249702 --> 1.249298).  Saving model ...
Validation loss decreased (1.249298 --> 1.249274).  Saving model ...
Validation loss decreased (1.249274 --> 1.248810).  Saving model ...
Validation loss decreased (1.248810 --> 1.248460).  Saving model ...
Validation loss decreased (1.248460 --> 1.248261).  Saving model ...
Validation loss decreased (1.248261 --> 1.247831).  Saving model ...
Validation loss decreased (1.247831 --> 1.247705).  Saving model ...
Validation loss decreased (1.247705 --> 1.247482).  Saving model ...
Validation loss decreased (1.247482 --> 1.247025).  Saving model ...
Validation loss decreased (1.247025 --> 1.246680).  Saving model ...
Validation loss decreased (1.246680 --> 1.246420).  Saving model ...
Validation loss decreased (1.246420 --> 1.246095).  Saving model ...
Validation loss decreased (1.246095 --> 1.246000).  Saving model ...
Validation loss decreased (1.246000 --> 1.245867).  Saving model ...
Validation loss decreased (1.245867 --> 1.245516).  Saving model ...
Validation loss decreased (1.245516 --> 1.245236).  Saving model ...
Validation loss decreased (1.245236 --> 1.245032).  Saving model ...
Validation loss decreased (1.245032 --> 1.244604).  Saving model ...
Validation loss decreased (1.244604 --> 1.244484).  Saving model ...
Validation loss decreased (1.244484 --> 1.244194).  Saving model ...
Validation loss decreased (1.244194 --> 1.243761).  Saving model ...
Validation loss decreased (1.243761 --> 1.243422).  Saving model ...
Validation loss decreased (1.243422 --> 1.243291).  Saving model ...
EarlyStopping counter: 1 out of 5.0
Validation loss decreased (1.243291 --> 1.242961).  Saving model ...
Validation loss decreased (1.242961 --> 1.242828).  Saving model ...
Validation loss decreased (1.242828 --> 1.242657).  Saving model ...
Validation loss decreased (1.242657 --> 1.242103).  Saving model ...
Validation loss decreased (1.242103 --> 1.241631).  Saving model ...
Validation loss decreased (1.241631 --> 1.241196).  Saving model ...
Validation loss decreased (1.241196 --> 1.240876).  Saving model ...
EarlyStopping counter: 1 out of 5.0
Validation loss decreased (1.240876 --> 1.240699).  Saving model ...
Validation loss decreased (1.240699 --> 1.240302).  Saving model ...
Validation loss decreased (1.240302 --> 1.240163).  Saving model ...
Validation loss decreased (1.240163 --> 1.239954).  Saving model ...
Validation loss decreased (1.239954 --> 1.239728).  Saving model ...
Validation loss decreased (1.239728 --> 1.239608).  Saving model ...
Validation loss decreased (1.239608 --> 1.239214).  Saving model ...
Validation loss decreased (1.239214 --> 1.238703).  Saving model ...
Validation loss decreased (1.238703 --> 1.238296).  Saving model ...
Validation loss decreased (1.238296 --> 1.237840).  Saving model ...
Validation loss decreased (1.237840 --> 1.237360).  Saving model ...
Validation loss decreased (1.237360 --> 1.236937).  Saving model ...
EarlyStopping counter: 1 out of 5.0
EarlyStopping counter: 2 out of 5.0
Validation loss decreased (1.236937 --> 1.236660).  Saving model ...
Validation loss decreased (1.236660 --> 1.236086).  Saving model ...
Validation loss decreased (1.236086 --> 1.235379).  Saving model ...
Validation loss decreased (1.235379 --> 1.235192).  Saving model ...
Validation loss decreased (1.235192 --> 1.234835).  Saving model ...
Validation loss decreased (1.234835 --> 1.234649).  Saving model ...
Validation loss decreased (1.234649 --> 1.234399).  Saving model ...
Validation loss decreased (1.234399 --> 1.234360).  Saving model ...
Validation loss decreased (1.234360 --> 1.233963).  Saving model ...
EarlyStopping counter: 1 out of 5.0
Validation loss decreased (1.233963 --> 1.233846).  Saving model ...
Validation loss decreased (1.233846 --> 1.233786).  Saving model ...
Validation loss decreased (1.233786 --> 1.233535).  Saving model ...
Validation loss decreased (1.233535 --> 1.233333).  Saving model ...
Validation loss decreased (1.233333 --> 1.232958).  Saving model ...
Validation loss decreased (1.232958 --> 1.232566).  Saving model ...
Validation loss decreased (1.232566 --> 1.232237).  Saving model ...
Validation loss decreased (1.232237 --> 1.232035).  Saving model ...
Validation loss decreased (1.232035 --> 1.231743).  Saving model ...
Validation loss decreased (1.231743 --> 1.231330).  Saving model ...
Validation loss decreased (1.231330 --> 1.231031).  Saving model ...
Validation loss decreased (1.231031 --> 1.230769).  Saving model ...
EarlyStopping counter: 1 out of 5.0
Validation loss decreased (1.230769 --> 1.230457).  Saving model ...
Validation loss decreased (1.230457 --> 1.230026).  Saving model ...
Validation loss decreased (1.230026 --> 1.229730).  Saving model ...
Validation loss decreased (1.229730 --> 1.229391).  Saving model ...
Validation loss decreased (1.229391 --> 1.229085).  Saving model ...
Validation loss decreased (1.229085 --> 1.228666).  Saving model ...
Validation loss decreased (1.228666 --> 1.228061).  Saving model ...
Validation loss decreased (1.228061 --> 1.227604).  Saving model ...
Validation loss decreased (1.227604 --> 1.227179).  Saving model ...
Validation loss decreased (1.227179 --> 1.226910).  Saving model ...
Validation loss decreased (1.226910 --> 1.226906).  Saving model ...
Validation loss decreased (1.226906 --> 1.226729).  Saving model ...
Validation loss decreased (1.226729 --> 1.226643).  Saving model ...
Validation loss decreased (1.226643 --> 1.226160).  Saving model ...
Validation loss decreased (1.226160 --> 1.225980).  Saving model ...
Validation loss decreased (1.225980 --> 1.225906).  Saving model ...
EarlyStopping counter: 1 out of 5.0
Validation loss decreased (1.225906 --> 1.225693).  Saving model ...
Validation loss decreased (1.225693 --> 1.225560).  Saving model ...
Validation loss decreased (1.225560 --> 1.225350).  Saving model ...
Validation loss decreased (1.225350 --> 1.225060).  Saving model ...
Validation loss decreased (1.225060 --> 1.224745).  Saving model ...
Validation loss decreased (1.224745 --> 1.224228).  Saving model ...
Validation loss decreased (1.224228 --> 1.224211).  Saving model ...
Validation loss decreased (1.224211 --> 1.223532).  Saving model ...
Validation loss decreased (1.223532 --> 1.223043).  Saving model ...
Validation loss decreased (1.223043 --> 1.222621).  Saving model ...
Validation loss decreased (1.222621 --> 1.222233).  Saving model ...
Validation loss decreased (1.222233 --> 1.221993).  Saving model ...
Validation loss decreased (1.221993 --> 1.221809).  Saving model ...
Validation loss decreased (1.221809 --> 1.221207).  Saving model ...
Validation loss decreased (1.221207 --> 1.220944).  Saving model ...
EarlyStopping counter: 1 out of 5.0
Validation loss decreased (1.220944 --> 1.220846).  Saving model ...
Validation loss decreased (1.220846 --> 1.220659).  Saving model ...
Validation loss decreased (1.220659 --> 1.220561).  Saving model ...
Validation loss decreased (1.220561 --> 1.220376).  Saving model ...
EarlyStopping counter: 1 out of 5.0
EarlyStopping counter: 2 out of 5.0
Validation loss decreased (1.220376 --> 1.220144).  Saving model ...
Validation loss decreased (1.220144 --> 1.219919).  Saving model ...
Validation loss decreased (1.219919 --> 1.219677).  Saving model ...
Validation loss decreased (1.219677 --> 1.219412).  Saving model ...
Validation loss decreased (1.219412 --> 1.219023).  Saving model ...
Validation loss decreased (1.219023 --> 1.218914).  Saving model ...
Validation loss decreased (1.218914 --> 1.218593).  Saving model ...
Validation loss decreased (1.218593 --> 1.217946).  Saving model ...
Validation loss decreased (1.217946 --> 1.217395).  Saving model ...
Validation loss decreased (1.217395 --> 1.217286).  Saving model ...
Validation loss decreased (1.217286 --> 1.217099).  Saving model ...
Validation loss decreased (1.217099 --> 1.216861).  Saving model ...
Validation loss decreased (1.216861 --> 1.216466).  Saving model ...
Validation loss decreased (1.216466 --> 1.216355).  Saving model ...
EarlyStopping counter: 1 out of 5.0
Validation loss decreased (1.216355 --> 1.215818).  Saving model ...
Validation loss decreased (1.215818 --> 1.215407).  Saving model ...
EarlyStopping counter: 1 out of 5.0
EarlyStopping counter: 2 out of 5.0
EarlyStopping counter: 3 out of 5.0
Validation loss decreased (1.215407 --> 1.215348).  Saving model ...
Validation loss decreased (1.215348 --> 1.214990).  Saving model ...
/localscratch/yinan.28706188.0/env/lib/python3.7/site-packages/torch/nn/functional.py:1794: UserWarning: nn.functional.tanh is deprecated. Use torch.tanh instead.
  warnings.warn("nn.functional.tanh is deprecated. Use torch.tanh instead.")
/localscratch/yinan.28706188.0/env/lib/python3.7/site-packages/transformers/optimization.py:155: UserWarning: This overload of add_ is deprecated:
	add_(Number alpha, Tensor other)
Consider using one of the following signatures instead:
	add_(Tensor other, *, Number alpha) (Triggered internally at  ../torch/csrc/utils/python_arg_parser.cpp:1025.)
  exp_avg.mul_(beta1).add_(1.0 - beta1, grad)
wandb: Waiting for W&B process to finish, PID 253125... (success).
wandb: - 0.00MB of 0.00MB uploaded (0.00MB deduped)wandb: \ 0.00MB of 0.00MB uploaded (0.00MB deduped)wandb: | 0.00MB of 0.00MB uploaded (0.00MB deduped)wandb: / 0.00MB of 0.00MB uploaded (0.00MB deduped)wandb: - 0.00MB of 0.00MB uploaded (0.00MB deduped)wandb: \ 0.00MB of 0.00MB uploaded (0.00MB deduped)wandb: | 0.00MB of 0.00MB uploaded (0.00MB deduped)wandb: / 0.00MB of 0.00MB uploaded (0.00MB deduped)wandb: - 0.00MB of 0.00MB uploaded (0.00MB deduped)wandb: \ 0.00MB of 0.00MB uploaded (0.00MB deduped)wandb: | 0.00MB of 0.00MB uploaded (0.00MB deduped)wandb: / 0.00MB of 0.00MB uploaded (0.00MB deduped)wandb: - 0.00MB of 0.00MB uploaded (0.00MB deduped)wandb:                                                                                
wandb: Run history:
wandb:     e_F1 ▁▂▂▂▃▄▅▅▅▅▅▅▅▅▅▆▆▆▆▆▆▇▇▇▇▇▇▇▇▇▇▇████████
wandb:   e_loss █▇▇▆▆▆▅▅▅▅▅▅▄▄▄▄▄▄▃▃▃▃▃▃▂▂▂▂▂▂▂▂▂▂▁▁▁▁▁▁
wandb:     t_F1 ▁▁▂▂▃▂▃▃▃▃▄▅▅▅▅▅▆▅▆▆▆▆▆▆▆▇▇▇▇▆▇▇███▇▇███
wandb:   t_loss ██▇▇▇▇▆▆▆▆▆▅▆▆▅▅▅▄▄▄▄▄▄▄▃▃▃▃▃▃▂▂▂▂▂▂▂▁▁▁
wandb: 
wandb: Run summary:
wandb:     e_F1 43.35352
wandb:   e_loss 1.21499
wandb:     t_F1 54.92914
wandb:   t_loss 1.10295
wandb: 
wandb: Synced 4 W&B file(s), 0 media file(s), 0 artifact file(s) and 0 other file(s)
wandb: Synced worldly-salad-1: https://wandb.ai/yinanazhou/xl_512_bs_8_lr_1e07_es_5_lc_True_nr_True_sr_True_stem_False_lemma_True_repeat_1_fold_1/runs/2df6jw7a
wandb: Find logs at: ./wandb/run-20220311_003036-2df6jw7a/logs/debug.log
wandb: 

wandb: wandb version 0.12.11 is available!  To upgrade, please run:
wandb:  $ pip install wandb --upgrade
2022-03-11 06:01:38.642079: I tensorflow/stream_executor/platform/default/dso_loader.cc:48] Successfully opened dynamic library libcudart.so.10.1
wandb: Tracking run with wandb version 0.12.5
wandb: Syncing run rose-lake-1
wandb: ⭐️ View project at https://wandb.ai/yinanazhou/xl_512_bs_8_lr_1e07_es_5_lc_True_nr_True_sr_True_stem_False_lemma_True_repeat_1_fold_2
wandb: 🚀 View run at https://wandb.ai/yinanazhou/xl_512_bs_8_lr_1e07_es_5_lc_True_nr_True_sr_True_stem_False_lemma_True_repeat_1_fold_2/runs/1jhrue4p
wandb: Run data is saved locally in /project/6002780/yinan/Thesis_MER_Lyrics/lyric-emotion/wandb/run-20220311_060135-1jhrue4p
wandb: Run `wandb offline` to turn off syncing.
slurmstepd: error: *** JOB 28706188 ON cdr2617 CANCELLED AT 2022-03-11T10:26:37 DUE TO TIME LIMIT ***
