Unloading StdEnv/2020

Due to MODULEPATH changes, the following have been reloaded:
  1) mii/1.1.1


The following have been reloaded with a version change:
  1) python/3.8.2 => python/3.7.4

Using base prefix '/cvmfs/soft.computecanada.ca/easybuild/software/2017/Core/python/3.7.4'
New python executable in /localscratch/yinan.29008288.0/env/bin/python
Installing setuptools, pip, wheel...
done.
Ignoring pip: markers 'python_version < "3"' don't match your environment
Looking in links: /cvmfs/soft.computecanada.ca/custom/python/wheelhouse/nix/avx2, /cvmfs/soft.computecanada.ca/custom/python/wheelhouse/nix/generic, /cvmfs/soft.computecanada.ca/custom/python/wheelhouse/generic
Collecting pip
Installing collected packages: pip
  Found existing installation: pip 19.1.1
    Uninstalling pip-19.1.1:
      Successfully uninstalled pip-19.1.1
Successfully installed pip-21.2.3+computecanada
Looking in links: /cvmfs/soft.computecanada.ca/custom/python/wheelhouse/nix/avx2, /cvmfs/soft.computecanada.ca/custom/python/wheelhouse/nix/generic, /cvmfs/soft.computecanada.ca/custom/python/wheelhouse/generic
Processing /cvmfs/soft.computecanada.ca/custom/python/wheelhouse/generic/keras-2.8.0+computecanada-py2.py3-none-any.whl
Processing /cvmfs/soft.computecanada.ca/custom/python/wheelhouse/generic/Keras_Preprocessing-1.1.2+computecanada-py3-none-any.whl
Requirement already satisfied: matplotlib in /cvmfs/soft.computecanada.ca/easybuild/software/2017/Core/scipy-stack/2019a/lib/python3.7/site-packages (from -r requirements.txt (line 3)) (3.0.2)
Processing /cvmfs/soft.computecanada.ca/custom/python/wheelhouse/generic/nltk-3.6.5+computecanada-py3-none-any.whl
Processing /cvmfs/soft.computecanada.ca/custom/python/wheelhouse/generic/scikit_learn-0.22.1+computecanada-cp37-cp37m-linux_x86_64.whl
Processing /cvmfs/soft.computecanada.ca/custom/python/wheelhouse/generic/tensorboard-2.3.0+computecanada-py3-none-any.whl
Processing /cvmfs/soft.computecanada.ca/custom/python/wheelhouse/generic/tensorboard_plugin_wit-1.7.0+computecanada-py3-none-any.whl
Processing /cvmfs/soft.computecanada.ca/custom/python/wheelhouse/generic/tensorflow_gpu-2.3.0+computecanada-cp37-cp37m-linux_x86_64.whl
Processing /cvmfs/soft.computecanada.ca/custom/python/wheelhouse/generic/tensorflow_estimator-2.3.0+computecanada-py2.py3-none-any.whl
Processing /cvmfs/soft.computecanada.ca/custom/python/wheelhouse/generic/tokenizers-0.5.2+computecanada-cp37-cp37m-linux_x86_64.whl
Processing /cvmfs/soft.computecanada.ca/custom/python/wheelhouse/nix/avx2/torch-1.4.0+computecanada-cp37-cp37m-linux_x86_64.whl
Processing /cvmfs/soft.computecanada.ca/custom/python/wheelhouse/generic/torchtext-0.6.0+computecanada-py3-none-any.whl
Processing /cvmfs/soft.computecanada.ca/custom/python/wheelhouse/generic/torchvision-0.8.2+computecanada-cp37-cp37m-linux_x86_64.whl
Processing /cvmfs/soft.computecanada.ca/custom/python/wheelhouse/generic/transformers-2.5.1+computecanada-py3-none-any.whl
Processing /cvmfs/soft.computecanada.ca/custom/python/wheelhouse/generic/urllib3-1.26.7+computecanada-py2.py3-none-any.whl
Processing /cvmfs/soft.computecanada.ca/custom/python/wheelhouse/generic/joblib-1.1.0+computecanada-py2.py3-none-any.whl
Processing /cvmfs/soft.computecanada.ca/custom/python/wheelhouse/generic/tqdm-4.63.0+computecanada-py2.py3-none-any.whl
Processing /cvmfs/soft.computecanada.ca/custom/python/wheelhouse/generic/click-8.0.3+computecanada-py3-none-any.whl
ERROR: Could not find a version that satisfies the requirement regex>=2021.8.3 (from nltk) (from versions: 2018.1.10+computecanada, 2019.11.1+computecanada, 2020.11.13+computecanada)
ERROR: No matching distribution found for regex>=2021.8.3
Looking in links: /cvmfs/soft.computecanada.ca/custom/python/wheelhouse/nix/avx2, /cvmfs/soft.computecanada.ca/custom/python/wheelhouse/nix/generic, /cvmfs/soft.computecanada.ca/custom/python/wheelhouse/generic
ERROR: Could not find a version that satisfies the requirement numpy==1.20.0+computacanada (from versions: 1.15.0+computecanada, 1.15.2+computecanada, 1.15.4+computecanada, 1.16.0+computecanada, 1.16.2+computecanada, 1.16.3+computecanada, 1.17.4+computecanada, 1.18.1+computecanada, 1.18.4+computecanada, 1.19.1+computecanada, 1.19.2+computecanada, 1.20.2+computecanada)
ERROR: No matching distribution found for numpy==1.20.0+computacanada
Looking in links: /cvmfs/soft.computecanada.ca/custom/python/wheelhouse/nix/avx2, /cvmfs/soft.computecanada.ca/custom/python/wheelhouse/nix/generic, /cvmfs/soft.computecanada.ca/custom/python/wheelhouse/generic
Processing /cvmfs/soft.computecanada.ca/custom/python/wheelhouse/generic/wandb-0.12.5+computecanada-py2.py3-none-any.whl
Processing /cvmfs/soft.computecanada.ca/custom/python/wheelhouse/generic/click-8.0.3+computecanada-py3-none-any.whl
Processing /cvmfs/soft.computecanada.ca/custom/python/wheelhouse/generic/protobuf-3.19.4+computecanada-py2.py3-none-any.whl
Processing /cvmfs/soft.computecanada.ca/custom/python/wheelhouse/generic/six-1.16.0+computecanada-py2.py3-none-any.whl
Processing /cvmfs/soft.computecanada.ca/custom/python/wheelhouse/generic/configparser-5.0.2+computecanada-py3-none-any.whl
Processing /cvmfs/soft.computecanada.ca/custom/python/wheelhouse/generic/GitPython-3.1.24+computecanada-py3-none-any.whl
Processing /cvmfs/soft.computecanada.ca/custom/python/wheelhouse/generic/pathtools-0.1.2+computecanada-py3-none-any.whl
Processing /cvmfs/soft.computecanada.ca/custom/python/wheelhouse/generic/PyYAML-5.3.1+computecanada-cp37-cp37m-linux_x86_64.whl
Processing /cvmfs/soft.computecanada.ca/custom/python/wheelhouse/generic/sentry_sdk-1.5.0+computecanada-py2.py3-none-any.whl
Processing /cvmfs/soft.computecanada.ca/custom/python/wheelhouse/generic/subprocess32-3.5.4+computecanada-py3-none-any.whl
Processing /cvmfs/soft.computecanada.ca/custom/python/wheelhouse/generic/promise-2.3+computecanada-py3-none-any.whl
Requirement already satisfied: python-dateutil>=2.6.1 in /cvmfs/soft.computecanada.ca/easybuild/software/2017/Core/scipy-stack/2019a/lib/python3.7/site-packages (from wandb) (2.7.5)
Processing /cvmfs/soft.computecanada.ca/custom/python/wheelhouse/generic/shortuuid-1.0.1+computecanada-py3-none-any.whl
Processing /cvmfs/soft.computecanada.ca/custom/python/wheelhouse/generic/psutil-5.7.3+computecanada-cp37-cp37m-linux_x86_64.whl
Requirement already satisfied: requests<3,>=2.0.0 in /cvmfs/soft.computecanada.ca/easybuild/software/2017/Core/scipy-stack/2019a/lib/python3.7/site-packages (from wandb) (2.21.0)
Processing /cvmfs/soft.computecanada.ca/custom/python/wheelhouse/generic/yaspin-2.1.0+computecanada-py3-none-any.whl
Processing /cvmfs/soft.computecanada.ca/custom/python/wheelhouse/generic/docker_pycreds-0.4.0+computecanada-py2.py3-none-any.whl
Requirement already satisfied: importlib-metadata in /cvmfs/soft.computecanada.ca/easybuild/software/2017/Core/scipy-stack/2019a/lib/python3.7/site-packages (from Click!=8.0.0,>=7.0->wandb) (0.8)
Processing /cvmfs/soft.computecanada.ca/custom/python/wheelhouse/generic/gitdb-4.0.9+computecanada-py3-none-any.whl
Processing /cvmfs/soft.computecanada.ca/custom/python/wheelhouse/generic/typing_extensions-4.0.1+computecanada-py3-none-any.whl
Processing /cvmfs/soft.computecanada.ca/custom/python/wheelhouse/generic/smmap-5.0.0+computecanada-py3-none-any.whl
Requirement already satisfied: urllib3<1.25,>=1.21.1 in /cvmfs/soft.computecanada.ca/easybuild/software/2017/Core/scipy-stack/2019a/lib/python3.7/site-packages (from requests<3,>=2.0.0->wandb) (1.24.1)
Requirement already satisfied: chardet<3.1.0,>=3.0.2 in /cvmfs/soft.computecanada.ca/easybuild/software/2017/Core/scipy-stack/2019a/lib/python3.7/site-packages (from requests<3,>=2.0.0->wandb) (3.0.4)
Requirement already satisfied: idna<2.9,>=2.5 in /cvmfs/soft.computecanada.ca/easybuild/software/2017/Core/scipy-stack/2019a/lib/python3.7/site-packages (from requests<3,>=2.0.0->wandb) (2.8)
Requirement already satisfied: certifi>=2017.4.17 in /cvmfs/soft.computecanada.ca/easybuild/software/2017/Core/scipy-stack/2019a/lib/python3.7/site-packages (from requests<3,>=2.0.0->wandb) (2018.11.29)
Processing /cvmfs/soft.computecanada.ca/custom/python/wheelhouse/generic/termcolor-1.1.0+computecanada-py3-none-any.whl
Requirement already satisfied: zipp>=0.3.2 in /cvmfs/soft.computecanada.ca/easybuild/software/2017/Core/scipy-stack/2019a/lib/python3.7/site-packages (from importlib-metadata->Click!=8.0.0,>=7.0->wandb) (0.3.3)
Installing collected packages: smmap, typing-extensions, termcolor, six, gitdb, yaspin, subprocess32, shortuuid, sentry-sdk, PyYAML, psutil, protobuf, promise, pathtools, GitPython, docker-pycreds, configparser, Click, wandb
  Attempting uninstall: six
    Found existing installation: six 1.12.0
    Not uninstalling six at /cvmfs/soft.computecanada.ca/easybuild/software/2017/Core/scipy-stack/2019a/lib/python3.7/site-packages, outside environment /localscratch/yinan.29008288.0/env
    Can't uninstall 'six'. No files were found to uninstall.
Successfully installed Click-8.0.3+computecanada GitPython-3.1.24+computecanada PyYAML-5.3.1+computecanada configparser-5.0.2+computecanada docker-pycreds-0.4.0+computecanada gitdb-4.0.9+computecanada pathtools-0.1.2+computecanada promise-2.3+computecanada protobuf-3.19.4+computecanada psutil-5.7.3+computecanada sentry-sdk-1.5.0+computecanada shortuuid-1.0.1+computecanada six-1.16.0+computecanada smmap-5.0.0+computecanada subprocess32-3.5.4+computecanada termcolor-1.1.0+computecanada typing-extensions-4.0.1+computecanada wandb-0.12.5+computecanada yaspin-2.1.0+computecanada
Looking in links: /cvmfs/soft.computecanada.ca/custom/python/wheelhouse/nix/avx2, /cvmfs/soft.computecanada.ca/custom/python/wheelhouse/nix/generic, /cvmfs/soft.computecanada.ca/custom/python/wheelhouse/generic
ERROR: Could not find a version that satisfies the requirement sagemaker (from versions: none)
ERROR: No matching distribution found for sagemaker
Looking in links: /cvmfs/soft.computecanada.ca/custom/python/wheelhouse/nix/avx2, /cvmfs/soft.computecanada.ca/custom/python/wheelhouse/nix/generic, /cvmfs/soft.computecanada.ca/custom/python/wheelhouse/generic
Processing /cvmfs/soft.computecanada.ca/custom/python/wheelhouse/generic/torch-1.9.1+computecanada-cp37-cp37m-linux_x86_64.whl
Requirement already satisfied: typing-extensions in /localscratch/yinan.29008288.0/env/lib/python3.7/site-packages (from torch) (4.0.1+computecanada)
Installing collected packages: torch
Successfully installed torch-1.9.1+computecanada
Looking in links: /cvmfs/soft.computecanada.ca/custom/python/wheelhouse/nix/avx2, /cvmfs/soft.computecanada.ca/custom/python/wheelhouse/nix/generic, /cvmfs/soft.computecanada.ca/custom/python/wheelhouse/generic
Processing /cvmfs/soft.computecanada.ca/custom/python/wheelhouse/generic/transformers-2.5.1+computecanada-py3-none-any.whl
Processing /cvmfs/soft.computecanada.ca/custom/python/wheelhouse/generic/filelock-3.4.2+computecanada-py3-none-any.whl
Processing /cvmfs/soft.computecanada.ca/custom/python/wheelhouse/generic/boto3-1.20.52+computecanada-py3-none-any.whl
Processing /cvmfs/soft.computecanada.ca/custom/python/wheelhouse/generic/tokenizers-0.5.2+computecanada-cp37-cp37m-linux_x86_64.whl
Requirement already satisfied: numpy in /cvmfs/soft.computecanada.ca/easybuild/software/2017/Core/scipy-stack/2019a/lib/python3.7/site-packages (from transformers==2.5.1+computecanada) (1.16.0)
Processing /cvmfs/soft.computecanada.ca/custom/python/wheelhouse/generic/sentencepiece-0.1.91+computecanada-cp37-cp37m-linux_x86_64.whl
Processing /cvmfs/soft.computecanada.ca/custom/python/wheelhouse/generic/sacremoses-0.0.46+computecanada-py3-none-any.whl
Requirement already satisfied: requests in /cvmfs/soft.computecanada.ca/easybuild/software/2017/Core/scipy-stack/2019a/lib/python3.7/site-packages (from transformers==2.5.1+computecanada) (2.21.0)
Processing /cvmfs/soft.computecanada.ca/custom/python/wheelhouse/generic/tqdm-4.63.0+computecanada-py2.py3-none-any.whl
Processing /cvmfs/soft.computecanada.ca/custom/python/wheelhouse/generic/regex-2020.11.13+computecanada-cp37-cp37m-linux_x86_64.whl
Processing /cvmfs/soft.computecanada.ca/custom/python/wheelhouse/generic/jmespath-0.10.0+computecanada-py2.py3-none-any.whl
Processing /cvmfs/soft.computecanada.ca/custom/python/wheelhouse/generic/s3transfer-0.5.1+computecanada-py3-none-any.whl
Processing /cvmfs/soft.computecanada.ca/custom/python/wheelhouse/generic/botocore-1.23.52+computecanada-py3-none-any.whl
Requirement already satisfied: python-dateutil<3.0.0,>=2.1 in /cvmfs/soft.computecanada.ca/easybuild/software/2017/Core/scipy-stack/2019a/lib/python3.7/site-packages (from botocore<1.24.0,>=1.23.52->boto3->transformers==2.5.1+computecanada) (2.7.5)
Processing /cvmfs/soft.computecanada.ca/custom/python/wheelhouse/generic/urllib3-1.26.8+computecanada-py2.py3-none-any.whl
Requirement already satisfied: six>=1.5 in /localscratch/yinan.29008288.0/env/lib/python3.7/site-packages (from python-dateutil<3.0.0,>=2.1->botocore<1.24.0,>=1.23.52->boto3->transformers==2.5.1+computecanada) (1.16.0+computecanada)
Processing /cvmfs/soft.computecanada.ca/custom/python/wheelhouse/generic/requests-2.27.1+computecanada-py2.py3-none-any.whl
Requirement already satisfied: idna<4,>=2.5 in /cvmfs/soft.computecanada.ca/easybuild/software/2017/Core/scipy-stack/2019a/lib/python3.7/site-packages (from requests->transformers==2.5.1+computecanada) (2.8)
Processing /cvmfs/soft.computecanada.ca/custom/python/wheelhouse/generic/charset_normalizer-2.0.11+computecanada-py3-none-any.whl
Requirement already satisfied: certifi>=2017.4.17 in /cvmfs/soft.computecanada.ca/easybuild/software/2017/Core/scipy-stack/2019a/lib/python3.7/site-packages (from requests->transformers==2.5.1+computecanada) (2018.11.29)
Requirement already satisfied: click in /localscratch/yinan.29008288.0/env/lib/python3.7/site-packages (from sacremoses->transformers==2.5.1+computecanada) (8.0.3+computecanada)
Processing /cvmfs/soft.computecanada.ca/custom/python/wheelhouse/generic/joblib-1.1.0+computecanada-py2.py3-none-any.whl
Requirement already satisfied: importlib-metadata in /cvmfs/soft.computecanada.ca/easybuild/software/2017/Core/scipy-stack/2019a/lib/python3.7/site-packages (from click->sacremoses->transformers==2.5.1+computecanada) (0.8)
Requirement already satisfied: zipp>=0.3.2 in /cvmfs/soft.computecanada.ca/easybuild/software/2017/Core/scipy-stack/2019a/lib/python3.7/site-packages (from importlib-metadata->click->sacremoses->transformers==2.5.1+computecanada) (0.3.3)
Installing collected packages: urllib3, jmespath, botocore, tqdm, s3transfer, regex, joblib, charset-normalizer, tokenizers, sentencepiece, sacremoses, requests, filelock, boto3, transformers
  Attempting uninstall: urllib3
    Found existing installation: urllib3 1.24.1
    Not uninstalling urllib3 at /cvmfs/soft.computecanada.ca/easybuild/software/2017/Core/scipy-stack/2019a/lib/python3.7/site-packages, outside environment /localscratch/yinan.29008288.0/env
    Can't uninstall 'urllib3'. No files were found to uninstall.
  Attempting uninstall: requests
    Found existing installation: requests 2.21.0
    Not uninstalling requests at /cvmfs/soft.computecanada.ca/easybuild/software/2017/Core/scipy-stack/2019a/lib/python3.7/site-packages, outside environment /localscratch/yinan.29008288.0/env
    Can't uninstall 'requests'. No files were found to uninstall.
Successfully installed boto3-1.20.52+computecanada botocore-1.23.52+computecanada charset-normalizer-2.0.11+computecanada filelock-3.4.2+computecanada jmespath-0.10.0+computecanada joblib-1.1.0+computecanada regex-2020.11.13+computecanada requests-2.27.1+computecanada s3transfer-0.5.1+computecanada sacremoses-0.0.46+computecanada sentencepiece-0.1.91+computecanada tokenizers-0.5.2+computecanada tqdm-4.63.0+computecanada transformers-2.5.1+computecanada urllib3-1.26.8+computecanada
Looking in links: /cvmfs/soft.computecanada.ca/custom/python/wheelhouse/nix/avx2, /cvmfs/soft.computecanada.ca/custom/python/wheelhouse/nix/generic, /cvmfs/soft.computecanada.ca/custom/python/wheelhouse/generic
Processing /cvmfs/soft.computecanada.ca/custom/python/wheelhouse/generic/tensorflow_gpu-2.3.0+computecanada-cp37-cp37m-linux_x86_64.whl
Processing /cvmfs/soft.computecanada.ca/custom/python/wheelhouse/generic/google_pasta-0.2.0+computecanada-py3-none-any.whl
Processing /cvmfs/soft.computecanada.ca/custom/python/wheelhouse/generic/astunparse-1.6.3+computecanada-py2.py3-none-any.whl
Requirement already satisfied: wheel>=0.26 in /localscratch/yinan.29008288.0/env/lib/python3.7/site-packages (from tensorflow_gpu==2.3.0+computecanada) (0.33.4)
Requirement already satisfied: six>=1.12.0 in /localscratch/yinan.29008288.0/env/lib/python3.7/site-packages (from tensorflow_gpu==2.3.0+computecanada) (1.16.0+computecanada)
Processing /cvmfs/soft.computecanada.ca/custom/python/wheelhouse/generic/gast-0.3.3+computecanada-py3-none-any.whl
Requirement already satisfied: termcolor>=1.1.0 in /localscratch/yinan.29008288.0/env/lib/python3.7/site-packages (from tensorflow_gpu==2.3.0+computecanada) (1.1.0+computecanada)
Processing /cvmfs/soft.computecanada.ca/custom/python/wheelhouse/generic/tensorboard-2.8.0+computecanada-py3-none-any.whl
Processing /cvmfs/soft.computecanada.ca/custom/python/wheelhouse/generic/Keras_Preprocessing-1.1.2+computecanada-py3-none-any.whl
Processing /cvmfs/soft.computecanada.ca/custom/python/wheelhouse/generic/tensorflow_estimator-2.3.0+computecanada-py2.py3-none-any.whl
Processing /cvmfs/soft.computecanada.ca/custom/python/wheelhouse/generic/wrapt-1.11.2+computecanada-cp37-cp37m-linux_x86_64.whl
Processing /cvmfs/soft.computecanada.ca/custom/python/wheelhouse/generic/grpcio-1.38.0+computecanada-cp37-cp37m-linux_x86_64.whl
Requirement already satisfied: protobuf>=3.9.2 in /localscratch/yinan.29008288.0/env/lib/python3.7/site-packages (from tensorflow_gpu==2.3.0+computecanada) (3.19.4+computecanada)
Processing /cvmfs/soft.computecanada.ca/custom/python/wheelhouse/nix/avx2/h5py-2.10.0+computecanada-cp37-cp37m-linux_x86_64.whl
Processing /cvmfs/soft.computecanada.ca/custom/python/wheelhouse/generic/opt_einsum-3.3.0+computecanada-py3-none-any.whl
Processing /cvmfs/soft.computecanada.ca/custom/python/wheelhouse/nix/generic/scipy-1.4.1+computecanada-cp37-cp37m-linux_x86_64.whl
Processing /cvmfs/soft.computecanada.ca/custom/python/wheelhouse/generic/absl_py-1.0.0+computecanada-py3-none-any.whl
Requirement already satisfied: numpy<1.19.0,>=1.16.0 in /cvmfs/soft.computecanada.ca/easybuild/software/2017/Core/scipy-stack/2019a/lib/python3.7/site-packages (from tensorflow_gpu==2.3.0+computecanada) (1.16.0)
Processing /cvmfs/soft.computecanada.ca/custom/python/wheelhouse/generic/google_auth_oauthlib-0.4.6+computecanada-py2.py3-none-any.whl
Requirement already satisfied: requests<3,>=2.21.0 in /localscratch/yinan.29008288.0/env/lib/python3.7/site-packages (from tensorboard<3,>=2.3.0->tensorflow_gpu==2.3.0+computecanada) (2.27.1+computecanada)
Processing /cvmfs/soft.computecanada.ca/custom/python/wheelhouse/generic/tensorboard_data_server-0.6.1+computecanada-py3-none-linux_x86_64.whl
Processing /cvmfs/soft.computecanada.ca/custom/python/wheelhouse/generic/tensorboard_plugin_wit-1.8.0+computecanada-py3-none-any.whl
Processing /cvmfs/soft.computecanada.ca/custom/python/wheelhouse/generic/Markdown-3.3.6+computecanada-py3-none-any.whl
Processing /cvmfs/soft.computecanada.ca/custom/python/wheelhouse/generic/Werkzeug-2.0.3+computecanada-py3-none-any.whl
Requirement already satisfied: setuptools>=41.0.0 in /localscratch/yinan.29008288.0/env/lib/python3.7/site-packages (from tensorboard<3,>=2.3.0->tensorflow_gpu==2.3.0+computecanada) (41.0.1)
Processing /cvmfs/soft.computecanada.ca/custom/python/wheelhouse/generic/google_auth-2.3.3+computecanada-py2.py3-none-any.whl
Processing /cvmfs/soft.computecanada.ca/custom/python/wheelhouse/generic/cachetools-4.2.4+computecanada-py3-none-any.whl
Processing /cvmfs/soft.computecanada.ca/custom/python/wheelhouse/generic/rsa-4.8+computecanada-py3-none-any.whl
Processing /cvmfs/soft.computecanada.ca/custom/python/wheelhouse/generic/pyasn1_modules-0.2.8+computecanada-py2.py3-none-any.whl
Processing /cvmfs/soft.computecanada.ca/custom/python/wheelhouse/generic/requests_oauthlib-1.3.0+computecanada-py2.py3-none-any.whl
Processing /cvmfs/soft.computecanada.ca/custom/python/wheelhouse/generic/importlib_metadata-4.10.1+computecanada-py3-none-any.whl
Requirement already satisfied: typing-extensions>=3.6.4 in /localscratch/yinan.29008288.0/env/lib/python3.7/site-packages (from importlib-metadata>=4.4->markdown>=2.6.8->tensorboard<3,>=2.3.0->tensorflow_gpu==2.3.0+computecanada) (4.0.1+computecanada)
Processing /cvmfs/soft.computecanada.ca/custom/python/wheelhouse/generic/zipp-3.7.0+computecanada-py3-none-any.whl
Processing /cvmfs/soft.computecanada.ca/custom/python/wheelhouse/generic/pyasn1-0.4.8+computecanada-py2.py3-none-any.whl
Requirement already satisfied: charset-normalizer~=2.0.0 in /localscratch/yinan.29008288.0/env/lib/python3.7/site-packages (from requests<3,>=2.21.0->tensorboard<3,>=2.3.0->tensorflow_gpu==2.3.0+computecanada) (2.0.11+computecanada)
Requirement already satisfied: idna<4,>=2.5 in /cvmfs/soft.computecanada.ca/easybuild/software/2017/Core/scipy-stack/2019a/lib/python3.7/site-packages (from requests<3,>=2.21.0->tensorboard<3,>=2.3.0->tensorflow_gpu==2.3.0+computecanada) (2.8)
Requirement already satisfied: certifi>=2017.4.17 in /cvmfs/soft.computecanada.ca/easybuild/software/2017/Core/scipy-stack/2019a/lib/python3.7/site-packages (from requests<3,>=2.21.0->tensorboard<3,>=2.3.0->tensorflow_gpu==2.3.0+computecanada) (2018.11.29)
Requirement already satisfied: urllib3<1.27,>=1.21.1 in /localscratch/yinan.29008288.0/env/lib/python3.7/site-packages (from requests<3,>=2.21.0->tensorboard<3,>=2.3.0->tensorflow_gpu==2.3.0+computecanada) (1.26.8+computecanada)
Processing /cvmfs/soft.computecanada.ca/custom/python/wheelhouse/generic/oauthlib-3.1.1+computecanada-py2.py3-none-any.whl
Installing collected packages: pyasn1, zipp, rsa, pyasn1-modules, oauthlib, cachetools, requests-oauthlib, importlib-metadata, google-auth, werkzeug, tensorboard-plugin-wit, tensorboard-data-server, markdown, grpcio, google-auth-oauthlib, absl-py, wrapt, tensorflow-estimator, tensorboard, scipy, opt-einsum, keras-preprocessing, h5py, google-pasta, gast, astunparse, tensorflow-gpu
  Attempting uninstall: pyasn1
    Found existing installation: pyasn1 0.4.3
    Not uninstalling pyasn1 at /cvmfs/soft.computecanada.ca/easybuild/software/2017/Core/scipy-stack/2019a/lib/python3.7/site-packages, outside environment /localscratch/yinan.29008288.0/env
    Can't uninstall 'pyasn1'. No files were found to uninstall.
  Attempting uninstall: zipp
    Found existing installation: zipp 0.3.3
    Not uninstalling zipp at /cvmfs/soft.computecanada.ca/easybuild/software/2017/Core/scipy-stack/2019a/lib/python3.7/site-packages, outside environment /localscratch/yinan.29008288.0/env
    Can't uninstall 'zipp'. No files were found to uninstall.
  Attempting uninstall: importlib-metadata
    Found existing installation: importlib-metadata 0.8
    Not uninstalling importlib-metadata at /cvmfs/soft.computecanada.ca/easybuild/software/2017/Core/scipy-stack/2019a/lib/python3.7/site-packages, outside environment /localscratch/yinan.29008288.0/env
    Can't uninstall 'importlib-metadata'. No files were found to uninstall.
  Attempting uninstall: scipy
    Found existing installation: scipy 1.2.0
    Not uninstalling scipy at /cvmfs/soft.computecanada.ca/easybuild/software/2017/Core/scipy-stack/2019a/lib/python3.7/site-packages, outside environment /localscratch/yinan.29008288.0/env
    Can't uninstall 'scipy'. No files were found to uninstall.
Successfully installed absl-py-1.0.0+computecanada astunparse-1.6.3+computecanada cachetools-4.2.4+computecanada gast-0.3.3+computecanada google-auth-2.3.3+computecanada google-auth-oauthlib-0.4.6+computecanada google-pasta-0.2.0+computecanada grpcio-1.38.0+computecanada h5py-2.10.0+computecanada importlib-metadata-4.10.1+computecanada keras-preprocessing-1.1.2+computecanada markdown-3.3.6+computecanada oauthlib-3.1.1+computecanada opt-einsum-3.3.0+computecanada pyasn1-0.4.8+computecanada pyasn1-modules-0.2.8+computecanada requests-oauthlib-1.3.0+computecanada rsa-4.8+computecanada scipy-1.4.1+computecanada tensorboard-2.8.0+computecanada tensorboard-data-server-0.6.1+computecanada tensorboard-plugin-wit-1.8.0+computecanada tensorflow-estimator-2.3.0+computecanada tensorflow-gpu-2.3.0+computecanada werkzeug-2.0.3+computecanada wrapt-1.11.2+computecanada zipp-3.7.0+computecanada
Looking in links: /cvmfs/soft.computecanada.ca/custom/python/wheelhouse/nix/avx2, /cvmfs/soft.computecanada.ca/custom/python/wheelhouse/nix/generic, /cvmfs/soft.computecanada.ca/custom/python/wheelhouse/generic
Processing /cvmfs/soft.computecanada.ca/custom/python/wheelhouse/generic/keras-2.8.0+computecanada-py2.py3-none-any.whl
Installing collected packages: Keras
Successfully installed Keras-2.8.0+computecanada
Looking in links: /cvmfs/soft.computecanada.ca/custom/python/wheelhouse/nix/avx2, /cvmfs/soft.computecanada.ca/custom/python/wheelhouse/nix/generic, /cvmfs/soft.computecanada.ca/custom/python/wheelhouse/generic
Processing /cvmfs/soft.computecanada.ca/custom/python/wheelhouse/generic/urllib3-1.26.7+computecanada-py2.py3-none-any.whl
Installing collected packages: urllib3
  Attempting uninstall: urllib3
    Found existing installation: urllib3 1.26.8+computecanada
    Uninstalling urllib3-1.26.8+computecanada:
      Successfully uninstalled urllib3-1.26.8+computecanada
Successfully installed urllib3-1.26.7+computecanada
Looking in links: /cvmfs/soft.computecanada.ca/custom/python/wheelhouse/nix/avx2, /cvmfs/soft.computecanada.ca/custom/python/wheelhouse/nix/generic, /cvmfs/soft.computecanada.ca/custom/python/wheelhouse/generic
Processing /cvmfs/soft.computecanada.ca/custom/python/wheelhouse/generic/nltk-3.7+computecanada-py3-none-any.whl
Requirement already satisfied: joblib in /localscratch/yinan.29008288.0/env/lib/python3.7/site-packages (from nltk) (1.1.0+computecanada)
Requirement already satisfied: click in /localscratch/yinan.29008288.0/env/lib/python3.7/site-packages (from nltk) (8.0.3+computecanada)
Requirement already satisfied: tqdm in /localscratch/yinan.29008288.0/env/lib/python3.7/site-packages (from nltk) (4.63.0+computecanada)
Processing /cvmfs/soft.computecanada.ca/custom/python/wheelhouse/generic/nltk-3.6.5+computecanada-py3-none-any.whl
Processing /cvmfs/soft.computecanada.ca/custom/python/wheelhouse/generic/nltk-3.6.3+computecanada-py3-none-any.whl
Requirement already satisfied: regex in /localscratch/yinan.29008288.0/env/lib/python3.7/site-packages (from nltk) (2020.11.13+computecanada)
Requirement already satisfied: importlib-metadata in /localscratch/yinan.29008288.0/env/lib/python3.7/site-packages (from click->nltk) (4.10.1+computecanada)
Requirement already satisfied: typing-extensions>=3.6.4 in /localscratch/yinan.29008288.0/env/lib/python3.7/site-packages (from importlib-metadata->click->nltk) (4.0.1+computecanada)
Requirement already satisfied: zipp>=0.5 in /localscratch/yinan.29008288.0/env/lib/python3.7/site-packages (from importlib-metadata->click->nltk) (3.7.0+computecanada)
Installing collected packages: nltk
Successfully installed nltk-3.6.3+computecanada
Looking in links: /cvmfs/soft.computecanada.ca/custom/python/wheelhouse/nix/avx2, /cvmfs/soft.computecanada.ca/custom/python/wheelhouse/nix/generic, /cvmfs/soft.computecanada.ca/custom/python/wheelhouse/generic
Processing /cvmfs/soft.computecanada.ca/custom/python/wheelhouse/generic/scikit_learn-0.22.1+computecanada-cp37-cp37m-linux_x86_64.whl
Requirement already satisfied: joblib>=0.11 in /localscratch/yinan.29008288.0/env/lib/python3.7/site-packages (from scikit-learn==0.22.1) (1.1.0+computecanada)
Requirement already satisfied: numpy>=1.11.0 in /cvmfs/soft.computecanada.ca/easybuild/software/2017/Core/scipy-stack/2019a/lib/python3.7/site-packages (from scikit-learn==0.22.1) (1.16.0)
Requirement already satisfied: scipy>=0.17.0 in /localscratch/yinan.29008288.0/env/lib/python3.7/site-packages (from scikit-learn==0.22.1) (1.4.1+computecanada)
Installing collected packages: scikit-learn
Successfully installed scikit-learn-0.22.1+computecanada
Looking in links: /cvmfs/soft.computecanada.ca/custom/python/wheelhouse/nix/avx2, /cvmfs/soft.computecanada.ca/custom/python/wheelhouse/nix/generic, /cvmfs/soft.computecanada.ca/custom/python/wheelhouse/generic
Requirement already satisfied: tokenizers==0.5.2 in /localscratch/yinan.29008288.0/env/lib/python3.7/site-packages (0.5.2+computecanada)
wandb: Appending key for api.wandb.ai to your netrc file: /home/yinan/.netrc
Starting Task
2022-03-15 16:39:26.178757: I tensorflow/stream_executor/platform/default/dso_loader.cc:48] Successfully opened dynamic library libcudart.so.10.1
[nltk_data] Downloading package stopwords to /home/yinan/nltk_data...
[nltk_data]   Package stopwords is already up-to-date!
[nltk_data] Downloading package wordnet to /home/yinan/nltk_data...
[nltk_data]   Package wordnet is already up-to-date!
wandb: Currently logged in as: yinanazhou (use `wandb login --relogin` to force relogin)
wandb: wandb version 0.12.11 is available!  To upgrade, please run:
wandb:  $ pip install wandb --upgrade
2022-03-15 16:39:45.745411: I tensorflow/stream_executor/platform/default/dso_loader.cc:48] Successfully opened dynamic library libcudart.so.10.1
wandb: Tracking run with wandb version 0.12.5
wandb: Syncing run volcanic-shadow-1
wandb: ⭐️ View project at https://wandb.ai/yinanazhou/xl_512_bs_8_lr_1e06_es_5_lc_True_nr_True_sr_True_stem_True_lemma_False_repeat_1_fold_1
wandb: 🚀 View run at https://wandb.ai/yinanazhou/xl_512_bs_8_lr_1e06_es_5_lc_True_nr_True_sr_True_stem_True_lemma_False_repeat_1_fold_1/runs/1730527m
wandb: Run data is saved locally in /project/6002780/yinan/Thesis_MER_Lyrics/lyric-emotion/wandb/run-20220315_163943-1730527m
wandb: Run `wandb offline` to turn off syncing.

Validation loss decreased (inf --> 1.430802).  Saving model ...
Validation loss decreased (1.430802 --> 1.412844).  Saving model ...
Validation loss decreased (1.412844 --> 1.397584).  Saving model ...
Validation loss decreased (1.397584 --> 1.386169).  Saving model ...
Validation loss decreased (1.386169 --> 1.377412).  Saving model ...
Validation loss decreased (1.377412 --> 1.369765).  Saving model ...
Validation loss decreased (1.369765 --> 1.364451).  Saving model ...
Validation loss decreased (1.364451 --> 1.359499).  Saving model ...
Validation loss decreased (1.359499 --> 1.355043).  Saving model ...
Validation loss decreased (1.355043 --> 1.350380).  Saving model ...
Validation loss decreased (1.350380 --> 1.346062).  Saving model ...
Validation loss decreased (1.346062 --> 1.342096).  Saving model ...
Validation loss decreased (1.342096 --> 1.338372).  Saving model ...
Validation loss decreased (1.338372 --> 1.334480).  Saving model ...
Validation loss decreased (1.334480 --> 1.330222).  Saving model ...
Validation loss decreased (1.330222 --> 1.326268).  Saving model ...
Validation loss decreased (1.326268 --> 1.322305).  Saving model ...
Validation loss decreased (1.322305 --> 1.318177).  Saving model ...
Validation loss decreased (1.318177 --> 1.313915).  Saving model ...
Validation loss decreased (1.313915 --> 1.308910).  Saving model ...
Validation loss decreased (1.308910 --> 1.304758).  Saving model ...
Validation loss decreased (1.304758 --> 1.300695).  Saving model ...
Validation loss decreased (1.300695 --> 1.296857).  Saving model ...
Validation loss decreased (1.296857 --> 1.292195).  Saving model ...
Validation loss decreased (1.292195 --> 1.287799).  Saving model ...
Validation loss decreased (1.287799 --> 1.283709).  Saving model ...
Validation loss decreased (1.283709 --> 1.279681).  Saving model ...
Validation loss decreased (1.279681 --> 1.276568).  Saving model ...
Validation loss decreased (1.276568 --> 1.274172).  Saving model ...
Validation loss decreased (1.274172 --> 1.271892).  Saving model ...
Validation loss decreased (1.271892 --> 1.269055).  Saving model ...
Validation loss decreased (1.269055 --> 1.264359).  Saving model ...
Validation loss decreased (1.264359 --> 1.263599).  Saving model ...
Validation loss decreased (1.263599 --> 1.258447).  Saving model ...
Validation loss decreased (1.258447 --> 1.258193).  Saving model ...
Validation loss decreased (1.258193 --> 1.254563).  Saving model ...
Validation loss decreased (1.254563 --> 1.252902).  Saving model ...
Validation loss decreased (1.252902 --> 1.249198).  Saving model ...
Validation loss decreased (1.249198 --> 1.247007).  Saving model ...
Validation loss decreased (1.247007 --> 1.244498).  Saving model ...
Validation loss decreased (1.244498 --> 1.240359).  Saving model ...
Validation loss decreased (1.240359 --> 1.235253).  Saving model ...
Validation loss decreased (1.235253 --> 1.232360).  Saving model ...
EarlyStopping counter: 1 out of 5.0
Validation loss decreased (1.232360 --> 1.229351).  Saving model ...
Validation loss decreased (1.229351 --> 1.226187).  Saving model ...
Validation loss decreased (1.226187 --> 1.225632).  Saving model ...
Validation loss decreased (1.225632 --> 1.222413).  Saving model ...
Validation loss decreased (1.222413 --> 1.221576).  Saving model ...
Validation loss decreased (1.221576 --> 1.217515).  Saving model ...
Validation loss decreased (1.217515 --> 1.217336).  Saving model ...
Validation loss decreased (1.217336 --> 1.213143).  Saving model ...
Validation loss decreased (1.213143 --> 1.211339).  Saving model ...
Validation loss decreased (1.211339 --> 1.209193).  Saving model ...
Validation loss decreased (1.209193 --> 1.207602).  Saving model ...
Validation loss decreased (1.207602 --> 1.202671).  Saving model ...
Validation loss decreased (1.202671 --> 1.198777).  Saving model ...
Validation loss decreased (1.198777 --> 1.195545).  Saving model ...
EarlyStopping counter: 1 out of 5.0
EarlyStopping counter: 2 out of 5.0
Validation loss decreased (1.195545 --> 1.188393).  Saving model ...
EarlyStopping counter: 1 out of 5.0
Validation loss decreased (1.188393 --> 1.181933).  Saving model ...
Validation loss decreased (1.181933 --> 1.181053).  Saving model ...
Validation loss decreased (1.181053 --> 1.180043).  Saving model ...
Validation loss decreased (1.180043 --> 1.174617).  Saving model ...
Validation loss decreased (1.174617 --> 1.173421).  Saving model ...
Validation loss decreased (1.173421 --> 1.170380).  Saving model ...
Validation loss decreased (1.170380 --> 1.168580).  Saving model ...
EarlyStopping counter: 1 out of 5.0
Validation loss decreased (1.168580 --> 1.166111).  Saving model ...
Validation loss decreased (1.166111 --> 1.165434).  Saving model ...
Validation loss decreased (1.165434 --> 1.162438).  Saving model ...
Validation loss decreased (1.162438 --> 1.155211).  Saving model ...
Validation loss decreased (1.155211 --> 1.152384).  Saving model ...
EarlyStopping counter: 1 out of 5.0
EarlyStopping counter: 2 out of 5.0
Validation loss decreased (1.152384 --> 1.148845).  Saving model ...
Validation loss decreased (1.148845 --> 1.145520).  Saving model ...
Validation loss decreased (1.145520 --> 1.142184).  Saving model ...
Validation loss decreased (1.142184 --> 1.141996).  Saving model ...
Validation loss decreased (1.141996 --> 1.141032).  Saving model ...
Validation loss decreased (1.141032 --> 1.139475).  Saving model ...
Validation loss decreased (1.139475 --> 1.138199).  Saving model ...
Validation loss decreased (1.138199 --> 1.132230).  Saving model ...
Validation loss decreased (1.132230 --> 1.126876).  Saving model ...
Validation loss decreased (1.126876 --> 1.126766).  Saving model ...
EarlyStopping counter: 1 out of 5.0
Validation loss decreased (1.126766 --> 1.125239).  Saving model ...
Validation loss decreased (1.125239 --> 1.123873).  Saving model ...
Validation loss decreased (1.123873 --> 1.120806).  Saving model ...
EarlyStopping counter: 1 out of 5.0
Validation loss decreased (1.120806 --> 1.120740).  Saving model ...
Validation loss decreased (1.120740 --> 1.119868).  Saving model ...
EarlyStopping counter: 1 out of 5.0
Validation loss decreased (1.119868 --> 1.116751).  Saving model ...
EarlyStopping counter: 1 out of 5.0
Validation loss decreased (1.116751 --> 1.114840).  Saving model ...
Validation loss decreased (1.114840 --> 1.111464).  Saving model ...
Validation loss decreased (1.111464 --> 1.111410).  Saving model ...
Validation loss decreased (1.111410 --> 1.111180).  Saving model ...
Validation loss decreased (1.111180 --> 1.109421).  Saving model ...
Validation loss decreased (1.109421 --> 1.103078).  Saving model ...
EarlyStopping counter: 1 out of 5.0
Validation loss decreased (1.103078 --> 1.102789).  Saving model ...
Validation loss decreased (1.102789 --> 1.098237).  Saving model ...
Validation loss decreased (1.098237 --> 1.095197).  Saving model ...
EarlyStopping counter: 1 out of 5.0
Validation loss decreased (1.095197 --> 1.094284).  Saving model ...
Validation loss decreased (1.094284 --> 1.087418).  Saving model ...
EarlyStopping counter: 1 out of 5.0
EarlyStopping counter: 2 out of 5.0
EarlyStopping counter: 3 out of 5.0
EarlyStopping counter: 4 out of 5.0
EarlyStopping counter: 5 out of 5.0
/localscratch/yinan.29008288.0/env/lib/python3.7/site-packages/torch/nn/functional.py:1794: UserWarning: nn.functional.tanh is deprecated. Use torch.tanh instead.
  warnings.warn("nn.functional.tanh is deprecated. Use torch.tanh instead.")
/localscratch/yinan.29008288.0/env/lib/python3.7/site-packages/transformers/optimization.py:155: UserWarning: This overload of add_ is deprecated:
	add_(Number alpha, Tensor other)
Consider using one of the following signatures instead:
	add_(Tensor other, *, Number alpha) (Triggered internally at  ../torch/csrc/utils/python_arg_parser.cpp:1025.)
  exp_avg.mul_(beta1).add_(1.0 - beta1, grad)
wandb: Waiting for W&B process to finish, PID 93949... (success).
wandb: - 0.00MB of 0.00MB uploaded (0.00MB deduped)wandb: \ 0.00MB of 0.00MB uploaded (0.00MB deduped)wandb: | 0.00MB of 0.00MB uploaded (0.00MB deduped)wandb: / 0.00MB of 0.00MB uploaded (0.00MB deduped)wandb: - 0.00MB of 0.00MB uploaded (0.00MB deduped)wandb: \ 0.00MB of 0.00MB uploaded (0.00MB deduped)wandb: | 0.00MB of 0.00MB uploaded (0.00MB deduped)wandb: / 0.00MB of 0.00MB uploaded (0.00MB deduped)wandb: - 0.00MB of 0.00MB uploaded (0.00MB deduped)wandb: \ 0.00MB of 0.00MB uploaded (0.00MB deduped)wandb: | 0.00MB of 0.00MB uploaded (0.00MB deduped)wandb: / 0.00MB of 0.00MB uploaded (0.00MB deduped)wandb: - 0.00MB of 0.00MB uploaded (0.00MB deduped)wandb:                                                                                
wandb: Run history:
wandb:     e_F1 ▁▂▃▄▅▅▅▅▅▅▆▆▆▆▆▆▆▇▇▇▇▇▇▇▇▇▇▇▇▇▇▇▇███████
wandb:   e_loss █▇▇▆▆▆▆▅▅▅▅▅▄▄▄▄▄▄▄▃▃▃▃▃▃▂▂▂▂▂▂▂▂▂▁▁▁▁▁▁
wandb:     t_F1 ▁▂▃▃▃▃▄▄▄▅▄▅▅▆▆▅▆▆▆▆▇▇▆▆▇▇▇▇▇▇▇▇▇█▇██▇██
wandb:   t_loss ██▇▇▇▇▇▆▆▆▅▅▅▅▅▄▄▄▄▄▃▃▃▃▃▃▃▃▂▂▂▂▂▂▂▂▁▂▁▁
wandb: 
wandb: Run summary:
wandb:     e_F1 50.70225
wandb:   e_loss 1.08939
wandb:     t_F1 66.44114
wandb:   t_loss 0.85638
wandb: 
wandb: Synced 4 W&B file(s), 0 media file(s), 0 artifact file(s) and 0 other file(s)
wandb: Synced volcanic-shadow-1: https://wandb.ai/yinanazhou/xl_512_bs_8_lr_1e06_es_5_lc_True_nr_True_sr_True_stem_True_lemma_False_repeat_1_fold_1/runs/1730527m
wandb: Find logs at: ./wandb/run-20220315_163943-1730527m/logs/debug.log
wandb: 

wandb: wandb version 0.12.11 is available!  To upgrade, please run:
wandb:  $ pip install wandb --upgrade
2022-03-15 17:55:17.857453: I tensorflow/stream_executor/platform/default/dso_loader.cc:48] Successfully opened dynamic library libcudart.so.10.1
wandb: Tracking run with wandb version 0.12.5
wandb: Syncing run rare-elevator-1
wandb: ⭐️ View project at https://wandb.ai/yinanazhou/xl_512_bs_8_lr_1e06_es_5_lc_True_nr_True_sr_True_stem_True_lemma_False_repeat_1_fold_2
wandb: 🚀 View run at https://wandb.ai/yinanazhou/xl_512_bs_8_lr_1e06_es_5_lc_True_nr_True_sr_True_stem_True_lemma_False_repeat_1_fold_2/runs/r38sdvhk
wandb: Run data is saved locally in /project/6002780/yinan/Thesis_MER_Lyrics/lyric-emotion/wandb/run-20220315_175434-r38sdvhk
wandb: Run `wandb offline` to turn off syncing.

Validation loss decreased (inf --> 1.429004).  Saving model ...
Validation loss decreased (1.429004 --> 1.415296).  Saving model ...
Validation loss decreased (1.415296 --> 1.406395).  Saving model ...
Validation loss decreased (1.406395 --> 1.399192).  Saving model ...
Validation loss decreased (1.399192 --> 1.393254).  Saving model ...
Validation loss decreased (1.393254 --> 1.388325).  Saving model ...
Validation loss decreased (1.388325 --> 1.384678).  Saving model ...
Validation loss decreased (1.384678 --> 1.381327).  Saving model ...
Validation loss decreased (1.381327 --> 1.377974).  Saving model ...
Validation loss decreased (1.377974 --> 1.374655).  Saving model ...
Validation loss decreased (1.374655 --> 1.371583).  Saving model ...
Validation loss decreased (1.371583 --> 1.368376).  Saving model ...
Validation loss decreased (1.368376 --> 1.365546).  Saving model ...
Validation loss decreased (1.365546 --> 1.362571).  Saving model ...
Validation loss decreased (1.362571 --> 1.359507).  Saving model ...
Validation loss decreased (1.359507 --> 1.356481).  Saving model ...
Validation loss decreased (1.356481 --> 1.353746).  Saving model ...
Validation loss decreased (1.353746 --> 1.350866).  Saving model ...
Validation loss decreased (1.350866 --> 1.347892).  Saving model ...
Validation loss decreased (1.347892 --> 1.344798).  Saving model ...
Validation loss decreased (1.344798 --> 1.342013).  Saving model ...
Validation loss decreased (1.342013 --> 1.339012).  Saving model ...
Validation loss decreased (1.339012 --> 1.335664).  Saving model ...
Validation loss decreased (1.335664 --> 1.332528).  Saving model ...
Validation loss decreased (1.332528 --> 1.329046).  Saving model ...
Validation loss decreased (1.329046 --> 1.324884).  Saving model ...
Validation loss decreased (1.324884 --> 1.321414).  Saving model ...
Validation loss decreased (1.321414 --> 1.318026).  Saving model ...
Validation loss decreased (1.318026 --> 1.314330).  Saving model ...
Validation loss decreased (1.314330 --> 1.310519).  Saving model ...
Validation loss decreased (1.310519 --> 1.306465).  Saving model ...
Validation loss decreased (1.306465 --> 1.301827).  Saving model ...
Validation loss decreased (1.301827 --> 1.297660).  Saving model ...
Validation loss decreased (1.297660 --> 1.293411).  Saving model ...
Validation loss decreased (1.293411 --> 1.288000).  Saving model ...
Validation loss decreased (1.288000 --> 1.282367).  Saving model ...
Validation loss decreased (1.282367 --> 1.275923).  Saving model ...
Validation loss decreased (1.275923 --> 1.269628).  Saving model ...
Validation loss decreased (1.269628 --> 1.263763).  Saving model ...
Validation loss decreased (1.263763 --> 1.258115).  Saving model ...
Validation loss decreased (1.258115 --> 1.251745).  Saving model ...
Validation loss decreased (1.251745 --> 1.245387).  Saving model ...
Validation loss decreased (1.245387 --> 1.238761).  Saving model ...
Validation loss decreased (1.238761 --> 1.232266).  Saving model ...
Validation loss decreased (1.232266 --> 1.226515).  Saving model ...
Validation loss decreased (1.226515 --> 1.220234).  Saving model ...
Validation loss decreased (1.220234 --> 1.213293).  Saving model ...
Validation loss decreased (1.213293 --> 1.207292).  Saving model ...
Validation loss decreased (1.207292 --> 1.201706).  Saving model ...
Validation loss decreased (1.201706 --> 1.196136).  Saving model ...
Validation loss decreased (1.196136 --> 1.190042).  Saving model ...
Validation loss decreased (1.190042 --> 1.184805).  Saving model ...
Validation loss decreased (1.184805 --> 1.180651).  Saving model ...
Validation loss decreased (1.180651 --> 1.175726).  Saving model ...
Validation loss decreased (1.175726 --> 1.170496).  Saving model ...
Validation loss decreased (1.170496 --> 1.165380).  Saving model ...
Validation loss decreased (1.165380 --> 1.160597).  Saving model ...
Validation loss decreased (1.160597 --> 1.154874).  Saving model ...
Validation loss decreased (1.154874 --> 1.149553).  Saving model ...
Validation loss decreased (1.149553 --> 1.144204).  Saving model ...
Validation loss decreased (1.144204 --> 1.138827).  Saving model ...
Validation loss decreased (1.138827 --> 1.134348).  Saving model ...
Validation loss decreased (1.134348 --> 1.129323).  Saving model ...
Validation loss decreased (1.129323 --> 1.124179).  Saving model ...
Validation loss decreased (1.124179 --> 1.120449).  Saving model ...
Validation loss decreased (1.120449 --> 1.116892).  Saving model ...
Validation loss decreased (1.116892 --> 1.112831).  Saving model ...
Validation loss decreased (1.112831 --> 1.108191).  Saving model ...
Validation loss decreased (1.108191 --> 1.104451).  Saving model ...
Validation loss decreased (1.104451 --> 1.100931).  Saving model ...
Validation loss decreased (1.100931 --> 1.097074).  Saving model ...
Validation loss decreased (1.097074 --> 1.094288).  Saving model ...
Validation loss decreased (1.094288 --> 1.091089).  Saving model ...
Validation loss decreased (1.091089 --> 1.087174).  Saving model ...
Validation loss decreased (1.087174 --> 1.083130).  Saving model ...
Validation loss decreased (1.083130 --> 1.079267).  Saving model ...
Validation loss decreased (1.079267 --> 1.075948).  Saving model ...
Validation loss decreased (1.075948 --> 1.073067).  Saving model ...
Validation loss decreased (1.073067 --> 1.070348).  Saving model ...
Validation loss decreased (1.070348 --> 1.067822).  Saving model ...
Validation loss decreased (1.067822 --> 1.064842).  Saving model ...
Validation loss decreased (1.064842 --> 1.061684).  Saving model ...
Validation loss decreased (1.061684 --> 1.057582).  Saving model ...
Validation loss decreased (1.057582 --> 1.054783).  Saving model ...
Validation loss decreased (1.054783 --> 1.052268).  Saving model ...
Validation loss decreased (1.052268 --> 1.050413).  Saving model ...
Validation loss decreased (1.050413 --> 1.047915).  Saving model ...
Validation loss decreased (1.047915 --> 1.045343).  Saving model ...
Validation loss decreased (1.045343 --> 1.042692).  Saving model ...
Validation loss decreased (1.042692 --> 1.041075).  Saving model ...
Validation loss decreased (1.041075 --> 1.038060).  Saving model ...
Validation loss decreased (1.038060 --> 1.036938).  Saving model ...
Validation loss decreased (1.036938 --> 1.034380).  Saving model ...
Validation loss decreased (1.034380 --> 1.030912).  Saving model ...
Validation loss decreased (1.030912 --> 1.028637).  Saving model ...
Validation loss decreased (1.028637 --> 1.026263).  Saving model ...
Validation loss decreased (1.026263 --> 1.023660).  Saving model ...
Validation loss decreased (1.023660 --> 1.021691).  Saving model ...
Validation loss decreased (1.021691 --> 1.020419).  Saving model ...
Validation loss decreased (1.020419 --> 1.017888).  Saving model ...
Validation loss decreased (1.017888 --> 1.016590).  Saving model ...
Validation loss decreased (1.016590 --> 1.015410).  Saving model ...
Validation loss decreased (1.015410 --> 1.013809).  Saving model ...
Validation loss decreased (1.013809 --> 1.010937).  Saving model ...
Validation loss decreased (1.010937 --> 1.008874).  Saving model ...
Validation loss decreased (1.008874 --> 1.007830).  Saving model ...
Validation loss decreased (1.007830 --> 1.007293).  Saving model ...
Validation loss decreased (1.007293 --> 1.004893).  Saving model ...
Validation loss decreased (1.004893 --> 1.003806).  Saving model ...
Validation loss decreased (1.003806 --> 1.002450).  Saving model ...
Validation loss decreased (1.002450 --> 1.000147).  Saving model ...
Validation loss decreased (1.000147 --> 0.998011).  Saving model ...
Validation loss decreased (0.998011 --> 0.995998).  Saving model ...
Validation loss decreased (0.995998 --> 0.994675).  Saving model ...
Validation loss decreased (0.994675 --> 0.993985).  Saving model ...
Validation loss decreased (0.993985 --> 0.992735).  Saving model ...
Validation loss decreased (0.992735 --> 0.991096).  Saving model ...
Validation loss decreased (0.991096 --> 0.990210).  Saving model ...
Validation loss decreased (0.990210 --> 0.988618).  Saving model ...
Validation loss decreased (0.988618 --> 0.988186).  Saving model ...
Validation loss decreased (0.988186 --> 0.988149).  Saving model ...
Validation loss decreased (0.988149 --> 0.986830).  Saving model ...
Validation loss decreased (0.986830 --> 0.986606).  Saving model ...
Validation loss decreased (0.986606 --> 0.986156).  Saving model ...
Validation loss decreased (0.986156 --> 0.985204).  Saving model ...
Validation loss decreased (0.985204 --> 0.984650).  Saving model ...
Validation loss decreased (0.984650 --> 0.983429).  Saving model ...
Validation loss decreased (0.983429 --> 0.982161).  Saving model ...
Validation loss decreased (0.982161 --> 0.982084).  Saving model ...
Validation loss decreased (0.982084 --> 0.982064).  Saving model ...
EarlyStopping counter: 1 out of 5.0
Validation loss decreased (0.982064 --> 0.980030).  Saving model ...
EarlyStopping counter: 1 out of 5.0
EarlyStopping counter: 2 out of 5.0
Validation loss decreased (0.980030 --> 0.979170).  Saving model ...
Validation loss decreased (0.979170 --> 0.978690).  Saving model ...
EarlyStopping counter: 1 out of 5.0
Validation loss decreased (0.978690 --> 0.978447).  Saving model ...
Validation loss decreased (0.978447 --> 0.977163).  Saving model ...
Validation loss decreased (0.977163 --> 0.975998).  Saving model ...
EarlyStopping counter: 1 out of 5.0
EarlyStopping counter: 2 out of 5.0
Validation loss decreased (0.975998 --> 0.975610).  Saving model ...
Validation loss decreased (0.975610 --> 0.975089).  Saving model ...
EarlyStopping counter: 1 out of 5.0
Validation loss decreased (0.975089 --> 0.973981).  Saving model ...
EarlyStopping counter: 1 out of 5.0
EarlyStopping counter: 2 out of 5.0
EarlyStopping counter: 3 out of 5.0
Validation loss decreased (0.973981 --> 0.972828).  Saving model ...
EarlyStopping counter: 1 out of 5.0
EarlyStopping counter: 2 out of 5.0
EarlyStopping counter: 3 out of 5.0
EarlyStopping counter: 4 out of 5.0
EarlyStopping counter: 5 out of 5.0
/localscratch/yinan.29008288.0/env/lib/python3.7/site-packages/torch/nn/functional.py:1794: UserWarning: nn.functional.tanh is deprecated. Use torch.tanh instead.
  warnings.warn("nn.functional.tanh is deprecated. Use torch.tanh instead.")
wandb: Waiting for W&B process to finish, PID 98018... (success).
wandb: - 0.00MB of 0.00MB uploaded (0.00MB deduped)wandb: \ 0.00MB of 0.00MB uploaded (0.00MB deduped)wandb: | 0.00MB of 0.00MB uploaded (0.00MB deduped)wandb: / 0.00MB of 0.00MB uploaded (0.00MB deduped)wandb: - 0.00MB of 0.00MB uploaded (0.00MB deduped)wandb: \ 0.00MB of 0.00MB uploaded (0.00MB deduped)wandb: | 0.00MB of 0.00MB uploaded (0.00MB deduped)wandb: / 0.00MB of 0.00MB uploaded (0.00MB deduped)wandb: - 0.00MB of 0.00MB uploaded (0.00MB deduped)wandb: \ 0.00MB of 0.00MB uploaded (0.00MB deduped)wandb: | 0.00MB of 0.00MB uploaded (0.00MB deduped)wandb: / 0.00MB of 0.00MB uploaded (0.00MB deduped)wandb: - 0.00MB of 0.00MB uploaded (0.00MB deduped)wandb:                                                                                
wandb: Run history:
wandb:     e_F1 ▁▁▂▄▄▄▄▄▄▅▅▆▆▆▆▇▇▇▇▇▇▇█▇████████████████
wandb:   e_loss ██▇▇▇▇▇▆▆▆▆▅▅▄▄▄▃▃▃▃▃▂▂▂▂▂▂▂▁▁▁▁▁▁▁▁▁▁▁▁
wandb:     t_F1 ▁▂▃▂▃▃▃▄▄▄▄▅▅▅▅▅▆▆▆▆▇▆▆▆▇▇▇▇▇▇▇█▇█▇█████
wandb:   t_loss ███▇▇▇▇▇▇▆▆▆▆▅▅▅▅▄▅▄▄▄▄▄▃▃▃▃▂▂▂▂▂▂▂▁▁▁▁▁
wandb: 
wandb: Run summary:
wandb:     e_F1 57.71674
wandb:   e_loss 0.97464
wandb:     t_F1 70.37135
wandb:   t_loss 0.81132
wandb: 
wandb: Synced 4 W&B file(s), 0 media file(s), 0 artifact file(s) and 0 other file(s)
wandb: Synced rare-elevator-1: https://wandb.ai/yinanazhou/xl_512_bs_8_lr_1e06_es_5_lc_True_nr_True_sr_True_stem_True_lemma_False_repeat_1_fold_2/runs/r38sdvhk
wandb: Find logs at: ./wandb/run-20220315_175434-r38sdvhk/logs/debug.log
wandb: 

wandb: wandb version 0.12.11 is available!  To upgrade, please run:
wandb:  $ pip install wandb --upgrade
2022-03-15 19:45:18.502398: I tensorflow/stream_executor/platform/default/dso_loader.cc:48] Successfully opened dynamic library libcudart.so.10.1
wandb: Tracking run with wandb version 0.12.5
wandb: Syncing run iconic-cosmos-1
wandb: ⭐️ View project at https://wandb.ai/yinanazhou/xl_512_bs_8_lr_1e06_es_5_lc_True_nr_True_sr_True_stem_True_lemma_False_repeat_2_fold_1
wandb: 🚀 View run at https://wandb.ai/yinanazhou/xl_512_bs_8_lr_1e06_es_5_lc_True_nr_True_sr_True_stem_True_lemma_False_repeat_2_fold_1/runs/2lw32use
wandb: Run data is saved locally in /project/6002780/yinan/Thesis_MER_Lyrics/lyric-emotion/wandb/run-20220315_194515-2lw32use
wandb: Run `wandb offline` to turn off syncing.
slurmstepd: error: *** JOB 29008288 ON cdr2583 CANCELLED AT 2022-03-15T20:07:01 ***
