Unloading StdEnv/2020

Due to MODULEPATH changes, the following have been reloaded:
  1) mii/1.1.1


The following have been reloaded with a version change:
  1) python/3.8.2 => python/3.7.4

Using base prefix '/cvmfs/soft.computecanada.ca/easybuild/software/2017/Core/python/3.7.4'
New python executable in /localscratch/yinan.29338303.0/env/bin/python
Installing setuptools, pip, wheel...
done.
Ignoring pip: markers 'python_version < "3"' don't match your environment
Looking in links: /cvmfs/soft.computecanada.ca/custom/python/wheelhouse/nix/avx2, /cvmfs/soft.computecanada.ca/custom/python/wheelhouse/nix/generic, /cvmfs/soft.computecanada.ca/custom/python/wheelhouse/generic
Collecting pip
Installing collected packages: pip
  Found existing installation: pip 19.1.1
    Uninstalling pip-19.1.1:
      Successfully uninstalled pip-19.1.1
Successfully installed pip-21.2.3+computecanada
Looking in links: /cvmfs/soft.computecanada.ca/custom/python/wheelhouse/nix/avx2, /cvmfs/soft.computecanada.ca/custom/python/wheelhouse/nix/generic, /cvmfs/soft.computecanada.ca/custom/python/wheelhouse/generic
Processing /cvmfs/soft.computecanada.ca/custom/python/wheelhouse/generic/keras-2.8.0+computecanada-py2.py3-none-any.whl
Processing /cvmfs/soft.computecanada.ca/custom/python/wheelhouse/generic/Keras_Preprocessing-1.1.2+computecanada-py3-none-any.whl
Requirement already satisfied: matplotlib in /cvmfs/soft.computecanada.ca/easybuild/software/2017/Core/scipy-stack/2019a/lib/python3.7/site-packages (from -r requirements.txt (line 3)) (3.0.2)
Processing /cvmfs/soft.computecanada.ca/custom/python/wheelhouse/generic/nltk-3.6.5+computecanada-py3-none-any.whl
Processing /cvmfs/soft.computecanada.ca/custom/python/wheelhouse/generic/scikit_learn-0.22.1+computecanada-cp37-cp37m-linux_x86_64.whl
Processing /cvmfs/soft.computecanada.ca/custom/python/wheelhouse/generic/tensorboard-2.3.0+computecanada-py3-none-any.whl
Processing /cvmfs/soft.computecanada.ca/custom/python/wheelhouse/generic/tensorboard_plugin_wit-1.7.0+computecanada-py3-none-any.whl
Processing /cvmfs/soft.computecanada.ca/custom/python/wheelhouse/generic/tensorflow_gpu-2.3.0+computecanada-cp37-cp37m-linux_x86_64.whl
Processing /cvmfs/soft.computecanada.ca/custom/python/wheelhouse/generic/tensorflow_estimator-2.3.0+computecanada-py2.py3-none-any.whl
Processing /cvmfs/soft.computecanada.ca/custom/python/wheelhouse/generic/tokenizers-0.5.2+computecanada-cp37-cp37m-linux_x86_64.whl
Processing /cvmfs/soft.computecanada.ca/custom/python/wheelhouse/nix/avx2/torch-1.4.0+computecanada-cp37-cp37m-linux_x86_64.whl
Processing /cvmfs/soft.computecanada.ca/custom/python/wheelhouse/generic/torchtext-0.6.0+computecanada-py3-none-any.whl
Processing /cvmfs/soft.computecanada.ca/custom/python/wheelhouse/generic/torchvision-0.8.2+computecanada-cp37-cp37m-linux_x86_64.whl
Processing /cvmfs/soft.computecanada.ca/custom/python/wheelhouse/generic/transformers-2.5.1+computecanada-py3-none-any.whl
Processing /cvmfs/soft.computecanada.ca/custom/python/wheelhouse/generic/urllib3-1.26.7+computecanada-py2.py3-none-any.whl
ERROR: Could not find a version that satisfies the requirement regex>=2021.8.3 (from nltk) (from versions: 2018.1.10+computecanada, 2019.11.1+computecanada, 2020.11.13+computecanada)
ERROR: No matching distribution found for regex>=2021.8.3
Looking in links: /cvmfs/soft.computecanada.ca/custom/python/wheelhouse/nix/avx2, /cvmfs/soft.computecanada.ca/custom/python/wheelhouse/nix/generic, /cvmfs/soft.computecanada.ca/custom/python/wheelhouse/generic
ERROR: Could not find a version that satisfies the requirement numpy==1.20.0+computacanada (from versions: 1.15.0+computecanada, 1.15.2+computecanada, 1.15.4+computecanada, 1.16.0+computecanada, 1.16.2+computecanada, 1.16.3+computecanada, 1.17.4+computecanada, 1.18.1+computecanada, 1.18.4+computecanada, 1.19.1+computecanada, 1.19.2+computecanada, 1.20.2+computecanada)
ERROR: No matching distribution found for numpy==1.20.0+computacanada
Looking in links: /cvmfs/soft.computecanada.ca/custom/python/wheelhouse/nix/avx2, /cvmfs/soft.computecanada.ca/custom/python/wheelhouse/nix/generic, /cvmfs/soft.computecanada.ca/custom/python/wheelhouse/generic
Processing /cvmfs/soft.computecanada.ca/custom/python/wheelhouse/generic/wandb-0.12.5+computecanada-py2.py3-none-any.whl
Processing /cvmfs/soft.computecanada.ca/custom/python/wheelhouse/generic/psutil-5.7.3+computecanada-cp37-cp37m-linux_x86_64.whl
Processing /cvmfs/soft.computecanada.ca/custom/python/wheelhouse/generic/yaspin-2.1.0+computecanada-py3-none-any.whl
Processing /cvmfs/soft.computecanada.ca/custom/python/wheelhouse/generic/six-1.16.0+computecanada-py2.py3-none-any.whl
Processing /cvmfs/soft.computecanada.ca/custom/python/wheelhouse/generic/subprocess32-3.5.4+computecanada-py3-none-any.whl
Processing /cvmfs/soft.computecanada.ca/custom/python/wheelhouse/generic/protobuf-3.19.4+computecanada-py2.py3-none-any.whl
Requirement already satisfied: requests<3,>=2.0.0 in /cvmfs/soft.computecanada.ca/easybuild/software/2017/Core/scipy-stack/2019a/lib/python3.7/site-packages (from wandb) (2.21.0)
Processing /cvmfs/soft.computecanada.ca/custom/python/wheelhouse/generic/sentry_sdk-1.5.0+computecanada-py2.py3-none-any.whl
Requirement already satisfied: python-dateutil>=2.6.1 in /cvmfs/soft.computecanada.ca/easybuild/software/2017/Core/scipy-stack/2019a/lib/python3.7/site-packages (from wandb) (2.7.5)
Processing /cvmfs/soft.computecanada.ca/custom/python/wheelhouse/generic/GitPython-3.1.24+computecanada-py3-none-any.whl
Processing /cvmfs/soft.computecanada.ca/custom/python/wheelhouse/generic/docker_pycreds-0.4.0+computecanada-py2.py3-none-any.whl
Processing /cvmfs/soft.computecanada.ca/custom/python/wheelhouse/generic/configparser-5.0.2+computecanada-py3-none-any.whl
Processing /cvmfs/soft.computecanada.ca/custom/python/wheelhouse/generic/PyYAML-5.3.1+computecanada-cp37-cp37m-linux_x86_64.whl
Processing /cvmfs/soft.computecanada.ca/custom/python/wheelhouse/generic/shortuuid-1.0.1+computecanada-py3-none-any.whl
Processing /cvmfs/soft.computecanada.ca/custom/python/wheelhouse/generic/click-8.0.4+computecanada-py3-none-any.whl
Processing /cvmfs/soft.computecanada.ca/custom/python/wheelhouse/generic/pathtools-0.1.2+computecanada-py3-none-any.whl
Processing /cvmfs/soft.computecanada.ca/custom/python/wheelhouse/generic/promise-2.3+computecanada-py3-none-any.whl
Requirement already satisfied: importlib-metadata in /cvmfs/soft.computecanada.ca/easybuild/software/2017/Core/scipy-stack/2019a/lib/python3.7/site-packages (from Click!=8.0.0,>=7.0->wandb) (0.8)
Processing /cvmfs/soft.computecanada.ca/custom/python/wheelhouse/generic/typing_extensions-4.0.1+computecanada-py3-none-any.whl
Processing /cvmfs/soft.computecanada.ca/custom/python/wheelhouse/generic/gitdb-4.0.9+computecanada-py3-none-any.whl
Processing /cvmfs/soft.computecanada.ca/custom/python/wheelhouse/generic/smmap-5.0.0+computecanada-py3-none-any.whl
Requirement already satisfied: urllib3<1.25,>=1.21.1 in /cvmfs/soft.computecanada.ca/easybuild/software/2017/Core/scipy-stack/2019a/lib/python3.7/site-packages (from requests<3,>=2.0.0->wandb) (1.24.1)
Requirement already satisfied: idna<2.9,>=2.5 in /cvmfs/soft.computecanada.ca/easybuild/software/2017/Core/scipy-stack/2019a/lib/python3.7/site-packages (from requests<3,>=2.0.0->wandb) (2.8)
Requirement already satisfied: certifi>=2017.4.17 in /cvmfs/soft.computecanada.ca/easybuild/software/2017/Core/scipy-stack/2019a/lib/python3.7/site-packages (from requests<3,>=2.0.0->wandb) (2018.11.29)
Requirement already satisfied: chardet<3.1.0,>=3.0.2 in /cvmfs/soft.computecanada.ca/easybuild/software/2017/Core/scipy-stack/2019a/lib/python3.7/site-packages (from requests<3,>=2.0.0->wandb) (3.0.4)
Processing /cvmfs/soft.computecanada.ca/custom/python/wheelhouse/generic/termcolor-1.1.0+computecanada-py3-none-any.whl
Requirement already satisfied: zipp>=0.3.2 in /cvmfs/soft.computecanada.ca/easybuild/software/2017/Core/scipy-stack/2019a/lib/python3.7/site-packages (from importlib-metadata->Click!=8.0.0,>=7.0->wandb) (0.3.3)
Installing collected packages: smmap, typing-extensions, termcolor, six, gitdb, yaspin, subprocess32, shortuuid, sentry-sdk, PyYAML, psutil, protobuf, promise, pathtools, GitPython, docker-pycreds, configparser, Click, wandb
  Attempting uninstall: six
    Found existing installation: six 1.12.0
    Not uninstalling six at /cvmfs/soft.computecanada.ca/easybuild/software/2017/Core/scipy-stack/2019a/lib/python3.7/site-packages, outside environment /localscratch/yinan.29338303.0/env
    Can't uninstall 'six'. No files were found to uninstall.
Successfully installed Click-8.0.4+computecanada GitPython-3.1.24+computecanada PyYAML-5.3.1+computecanada configparser-5.0.2+computecanada docker-pycreds-0.4.0+computecanada gitdb-4.0.9+computecanada pathtools-0.1.2+computecanada promise-2.3+computecanada protobuf-3.19.4+computecanada psutil-5.7.3+computecanada sentry-sdk-1.5.0+computecanada shortuuid-1.0.1+computecanada six-1.16.0+computecanada smmap-5.0.0+computecanada subprocess32-3.5.4+computecanada termcolor-1.1.0+computecanada typing-extensions-4.0.1+computecanada wandb-0.12.5+computecanada yaspin-2.1.0+computecanada
Looking in links: /cvmfs/soft.computecanada.ca/custom/python/wheelhouse/nix/avx2, /cvmfs/soft.computecanada.ca/custom/python/wheelhouse/nix/generic, /cvmfs/soft.computecanada.ca/custom/python/wheelhouse/generic
ERROR: Could not find a version that satisfies the requirement sagemaker (from versions: none)
ERROR: No matching distribution found for sagemaker
Looking in links: /cvmfs/soft.computecanada.ca/custom/python/wheelhouse/nix/avx2, /cvmfs/soft.computecanada.ca/custom/python/wheelhouse/nix/generic, /cvmfs/soft.computecanada.ca/custom/python/wheelhouse/generic
Processing /cvmfs/soft.computecanada.ca/custom/python/wheelhouse/generic/torch-1.9.1+computecanada-cp37-cp37m-linux_x86_64.whl
Requirement already satisfied: typing-extensions in /localscratch/yinan.29338303.0/env/lib/python3.7/site-packages (from torch) (4.0.1+computecanada)
Installing collected packages: torch
Successfully installed torch-1.9.1+computecanada
Looking in links: /cvmfs/soft.computecanada.ca/custom/python/wheelhouse/nix/avx2, /cvmfs/soft.computecanada.ca/custom/python/wheelhouse/nix/generic, /cvmfs/soft.computecanada.ca/custom/python/wheelhouse/generic
Processing /cvmfs/soft.computecanada.ca/custom/python/wheelhouse/generic/transformers-2.5.1+computecanada-py3-none-any.whl
Processing /cvmfs/soft.computecanada.ca/custom/python/wheelhouse/generic/filelock-3.4.2+computecanada-py3-none-any.whl
Processing /cvmfs/soft.computecanada.ca/custom/python/wheelhouse/generic/tqdm-4.63.0+computecanada-py2.py3-none-any.whl
Processing /cvmfs/soft.computecanada.ca/custom/python/wheelhouse/generic/sentencepiece-0.1.91+computecanada-cp37-cp37m-linux_x86_64.whl
Processing /cvmfs/soft.computecanada.ca/custom/python/wheelhouse/generic/tokenizers-0.5.2+computecanada-cp37-cp37m-linux_x86_64.whl
Processing /cvmfs/soft.computecanada.ca/custom/python/wheelhouse/generic/regex-2020.11.13+computecanada-cp37-cp37m-linux_x86_64.whl
Requirement already satisfied: numpy in /cvmfs/soft.computecanada.ca/easybuild/software/2017/Core/scipy-stack/2019a/lib/python3.7/site-packages (from transformers==2.5.1+computecanada) (1.16.0)
Requirement already satisfied: requests in /cvmfs/soft.computecanada.ca/easybuild/software/2017/Core/scipy-stack/2019a/lib/python3.7/site-packages (from transformers==2.5.1+computecanada) (2.21.0)
Processing /cvmfs/soft.computecanada.ca/custom/python/wheelhouse/generic/boto3-1.21.14+computecanada-py3-none-any.whl
Processing /cvmfs/soft.computecanada.ca/custom/python/wheelhouse/generic/sacremoses-0.0.46+computecanada-py3-none-any.whl
Processing /cvmfs/soft.computecanada.ca/custom/python/wheelhouse/generic/botocore-1.24.14+computecanada-py3-none-any.whl
Processing /cvmfs/soft.computecanada.ca/custom/python/wheelhouse/generic/s3transfer-0.5.1+computecanada-py3-none-any.whl
Processing /cvmfs/soft.computecanada.ca/custom/python/wheelhouse/generic/jmespath-0.10.0+computecanada-py2.py3-none-any.whl
Processing /cvmfs/soft.computecanada.ca/custom/python/wheelhouse/generic/urllib3-1.26.8+computecanada-py2.py3-none-any.whl
Requirement already satisfied: python-dateutil<3.0.0,>=2.1 in /cvmfs/soft.computecanada.ca/easybuild/software/2017/Core/scipy-stack/2019a/lib/python3.7/site-packages (from botocore<1.25.0,>=1.24.14->boto3->transformers==2.5.1+computecanada) (2.7.5)
Requirement already satisfied: six>=1.5 in /localscratch/yinan.29338303.0/env/lib/python3.7/site-packages (from python-dateutil<3.0.0,>=2.1->botocore<1.25.0,>=1.24.14->boto3->transformers==2.5.1+computecanada) (1.16.0+computecanada)
Requirement already satisfied: chardet<3.1.0,>=3.0.2 in /cvmfs/soft.computecanada.ca/easybuild/software/2017/Core/scipy-stack/2019a/lib/python3.7/site-packages (from requests->transformers==2.5.1+computecanada) (3.0.4)
Requirement already satisfied: certifi>=2017.4.17 in /cvmfs/soft.computecanada.ca/easybuild/software/2017/Core/scipy-stack/2019a/lib/python3.7/site-packages (from requests->transformers==2.5.1+computecanada) (2018.11.29)
Processing /cvmfs/soft.computecanada.ca/custom/python/wheelhouse/generic/requests-2.27.1+computecanada-py2.py3-none-any.whl
Processing /cvmfs/soft.computecanada.ca/custom/python/wheelhouse/generic/charset_normalizer-2.0.12+computecanada-py3-none-any.whl
Requirement already satisfied: idna<4,>=2.5 in /cvmfs/soft.computecanada.ca/easybuild/software/2017/Core/scipy-stack/2019a/lib/python3.7/site-packages (from requests->transformers==2.5.1+computecanada) (2.8)
Processing /cvmfs/soft.computecanada.ca/custom/python/wheelhouse/generic/joblib-1.1.0+computecanada-py2.py3-none-any.whl
Requirement already satisfied: click in /localscratch/yinan.29338303.0/env/lib/python3.7/site-packages (from sacremoses->transformers==2.5.1+computecanada) (8.0.4+computecanada)
Requirement already satisfied: importlib-metadata in /cvmfs/soft.computecanada.ca/easybuild/software/2017/Core/scipy-stack/2019a/lib/python3.7/site-packages (from click->sacremoses->transformers==2.5.1+computecanada) (0.8)
Requirement already satisfied: zipp>=0.3.2 in /cvmfs/soft.computecanada.ca/easybuild/software/2017/Core/scipy-stack/2019a/lib/python3.7/site-packages (from importlib-metadata->click->sacremoses->transformers==2.5.1+computecanada) (0.3.3)
Installing collected packages: urllib3, jmespath, botocore, tqdm, s3transfer, regex, joblib, charset-normalizer, tokenizers, sentencepiece, sacremoses, requests, filelock, boto3, transformers
  Attempting uninstall: urllib3
    Found existing installation: urllib3 1.24.1
    Not uninstalling urllib3 at /cvmfs/soft.computecanada.ca/easybuild/software/2017/Core/scipy-stack/2019a/lib/python3.7/site-packages, outside environment /localscratch/yinan.29338303.0/env
    Can't uninstall 'urllib3'. No files were found to uninstall.
  Attempting uninstall: requests
    Found existing installation: requests 2.21.0
    Not uninstalling requests at /cvmfs/soft.computecanada.ca/easybuild/software/2017/Core/scipy-stack/2019a/lib/python3.7/site-packages, outside environment /localscratch/yinan.29338303.0/env
    Can't uninstall 'requests'. No files were found to uninstall.
Successfully installed boto3-1.21.14+computecanada botocore-1.24.14+computecanada charset-normalizer-2.0.12+computecanada filelock-3.4.2+computecanada jmespath-0.10.0+computecanada joblib-1.1.0+computecanada regex-2020.11.13+computecanada requests-2.27.1+computecanada s3transfer-0.5.1+computecanada sacremoses-0.0.46+computecanada sentencepiece-0.1.91+computecanada tokenizers-0.5.2+computecanada tqdm-4.63.0+computecanada transformers-2.5.1+computecanada urllib3-1.26.8+computecanada
Looking in links: /cvmfs/soft.computecanada.ca/custom/python/wheelhouse/nix/avx2, /cvmfs/soft.computecanada.ca/custom/python/wheelhouse/nix/generic, /cvmfs/soft.computecanada.ca/custom/python/wheelhouse/generic
Processing /cvmfs/soft.computecanada.ca/custom/python/wheelhouse/generic/tensorflow_gpu-2.3.0+computecanada-cp37-cp37m-linux_x86_64.whl
Processing /cvmfs/soft.computecanada.ca/custom/python/wheelhouse/generic/tensorboard-2.8.0+computecanada-py3-none-any.whl
Processing /cvmfs/soft.computecanada.ca/custom/python/wheelhouse/generic/tensorflow_estimator-2.3.0+computecanada-py2.py3-none-any.whl
Processing /cvmfs/soft.computecanada.ca/custom/python/wheelhouse/generic/Keras_Preprocessing-1.1.2+computecanada-py3-none-any.whl
Processing /cvmfs/soft.computecanada.ca/custom/python/wheelhouse/generic/grpcio-1.38.0+computecanada-cp37-cp37m-linux_x86_64.whl
Requirement already satisfied: protobuf>=3.9.2 in /localscratch/yinan.29338303.0/env/lib/python3.7/site-packages (from tensorflow_gpu==2.3.0+computecanada) (3.19.4+computecanada)
Processing /cvmfs/soft.computecanada.ca/custom/python/wheelhouse/generic/gast-0.3.3+computecanada-py3-none-any.whl
Processing /cvmfs/soft.computecanada.ca/custom/python/wheelhouse/generic/opt_einsum-3.3.0+computecanada-py3-none-any.whl
Processing /cvmfs/soft.computecanada.ca/custom/python/wheelhouse/nix/generic/scipy-1.4.1+computecanada-cp37-cp37m-linux_x86_64.whl
Processing /cvmfs/soft.computecanada.ca/custom/python/wheelhouse/nix/avx2/h5py-2.10.0+computecanada-cp37-cp37m-linux_x86_64.whl
Processing /cvmfs/soft.computecanada.ca/custom/python/wheelhouse/generic/wrapt-1.11.2+computecanada-cp37-cp37m-linux_x86_64.whl
Requirement already satisfied: wheel>=0.26 in /localscratch/yinan.29338303.0/env/lib/python3.7/site-packages (from tensorflow_gpu==2.3.0+computecanada) (0.33.4)
Requirement already satisfied: six>=1.12.0 in /localscratch/yinan.29338303.0/env/lib/python3.7/site-packages (from tensorflow_gpu==2.3.0+computecanada) (1.16.0+computecanada)
Processing /cvmfs/soft.computecanada.ca/custom/python/wheelhouse/generic/absl_py-1.0.0+computecanada-py3-none-any.whl
Requirement already satisfied: termcolor>=1.1.0 in /localscratch/yinan.29338303.0/env/lib/python3.7/site-packages (from tensorflow_gpu==2.3.0+computecanada) (1.1.0+computecanada)
Requirement already satisfied: numpy<1.19.0,>=1.16.0 in /cvmfs/soft.computecanada.ca/easybuild/software/2017/Core/scipy-stack/2019a/lib/python3.7/site-packages (from tensorflow_gpu==2.3.0+computecanada) (1.16.0)
Processing /cvmfs/soft.computecanada.ca/custom/python/wheelhouse/generic/astunparse-1.6.3+computecanada-py2.py3-none-any.whl
Processing /cvmfs/soft.computecanada.ca/custom/python/wheelhouse/generic/google_pasta-0.2.0+computecanada-py3-none-any.whl
Processing /cvmfs/soft.computecanada.ca/custom/python/wheelhouse/generic/google_auth-2.3.3+computecanada-py2.py3-none-any.whl
Processing /cvmfs/soft.computecanada.ca/custom/python/wheelhouse/generic/Markdown-3.3.6+computecanada-py3-none-any.whl
Processing /cvmfs/soft.computecanada.ca/custom/python/wheelhouse/generic/Werkzeug-2.0.3+computecanada-py3-none-any.whl
Processing /cvmfs/soft.computecanada.ca/custom/python/wheelhouse/generic/tensorboard_plugin_wit-1.8.0+computecanada-py3-none-any.whl
Requirement already satisfied: requests<3,>=2.21.0 in /localscratch/yinan.29338303.0/env/lib/python3.7/site-packages (from tensorboard<3,>=2.3.0->tensorflow_gpu==2.3.0+computecanada) (2.27.1+computecanada)
Requirement already satisfied: setuptools>=41.0.0 in /localscratch/yinan.29338303.0/env/lib/python3.7/site-packages (from tensorboard<3,>=2.3.0->tensorflow_gpu==2.3.0+computecanada) (41.0.1)
Processing /cvmfs/soft.computecanada.ca/custom/python/wheelhouse/generic/google_auth_oauthlib-0.4.6+computecanada-py2.py3-none-any.whl
Processing /cvmfs/soft.computecanada.ca/custom/python/wheelhouse/generic/tensorboard_data_server-0.6.1+computecanada-py3-none-linux_x86_64.whl
Processing /cvmfs/soft.computecanada.ca/custom/python/wheelhouse/generic/rsa-4.8+computecanada-py3-none-any.whl
Processing /cvmfs/soft.computecanada.ca/custom/python/wheelhouse/generic/cachetools-4.2.4+computecanada-py3-none-any.whl
Processing /cvmfs/soft.computecanada.ca/custom/python/wheelhouse/generic/pyasn1_modules-0.2.8+computecanada-py2.py3-none-any.whl
Processing /cvmfs/soft.computecanada.ca/custom/python/wheelhouse/generic/requests_oauthlib-1.3.0+computecanada-py2.py3-none-any.whl
Processing /cvmfs/soft.computecanada.ca/custom/python/wheelhouse/generic/importlib_metadata-4.10.1+computecanada-py3-none-any.whl
Processing /cvmfs/soft.computecanada.ca/custom/python/wheelhouse/generic/zipp-3.7.0+computecanada-py3-none-any.whl
Requirement already satisfied: typing-extensions>=3.6.4 in /localscratch/yinan.29338303.0/env/lib/python3.7/site-packages (from importlib-metadata>=4.4->markdown>=2.6.8->tensorboard<3,>=2.3.0->tensorflow_gpu==2.3.0+computecanada) (4.0.1+computecanada)
Processing /cvmfs/soft.computecanada.ca/custom/python/wheelhouse/generic/pyasn1-0.4.8+computecanada-py2.py3-none-any.whl
Requirement already satisfied: certifi>=2017.4.17 in /cvmfs/soft.computecanada.ca/easybuild/software/2017/Core/scipy-stack/2019a/lib/python3.7/site-packages (from requests<3,>=2.21.0->tensorboard<3,>=2.3.0->tensorflow_gpu==2.3.0+computecanada) (2018.11.29)
Requirement already satisfied: idna<4,>=2.5 in /cvmfs/soft.computecanada.ca/easybuild/software/2017/Core/scipy-stack/2019a/lib/python3.7/site-packages (from requests<3,>=2.21.0->tensorboard<3,>=2.3.0->tensorflow_gpu==2.3.0+computecanada) (2.8)
Requirement already satisfied: urllib3<1.27,>=1.21.1 in /localscratch/yinan.29338303.0/env/lib/python3.7/site-packages (from requests<3,>=2.21.0->tensorboard<3,>=2.3.0->tensorflow_gpu==2.3.0+computecanada) (1.26.8+computecanada)
Requirement already satisfied: charset-normalizer~=2.0.0 in /localscratch/yinan.29338303.0/env/lib/python3.7/site-packages (from requests<3,>=2.21.0->tensorboard<3,>=2.3.0->tensorflow_gpu==2.3.0+computecanada) (2.0.12+computecanada)
Processing /cvmfs/soft.computecanada.ca/custom/python/wheelhouse/generic/oauthlib-3.1.1+computecanada-py2.py3-none-any.whl
Installing collected packages: pyasn1, zipp, rsa, pyasn1-modules, oauthlib, cachetools, requests-oauthlib, importlib-metadata, google-auth, werkzeug, tensorboard-plugin-wit, tensorboard-data-server, markdown, grpcio, google-auth-oauthlib, absl-py, wrapt, tensorflow-estimator, tensorboard, scipy, opt-einsum, keras-preprocessing, h5py, google-pasta, gast, astunparse, tensorflow-gpu
  Attempting uninstall: pyasn1
    Found existing installation: pyasn1 0.4.3
    Not uninstalling pyasn1 at /cvmfs/soft.computecanada.ca/easybuild/software/2017/Core/scipy-stack/2019a/lib/python3.7/site-packages, outside environment /localscratch/yinan.29338303.0/env
    Can't uninstall 'pyasn1'. No files were found to uninstall.
  Attempting uninstall: zipp
    Found existing installation: zipp 0.3.3
    Not uninstalling zipp at /cvmfs/soft.computecanada.ca/easybuild/software/2017/Core/scipy-stack/2019a/lib/python3.7/site-packages, outside environment /localscratch/yinan.29338303.0/env
    Can't uninstall 'zipp'. No files were found to uninstall.
  Attempting uninstall: importlib-metadata
    Found existing installation: importlib-metadata 0.8
    Not uninstalling importlib-metadata at /cvmfs/soft.computecanada.ca/easybuild/software/2017/Core/scipy-stack/2019a/lib/python3.7/site-packages, outside environment /localscratch/yinan.29338303.0/env
    Can't uninstall 'importlib-metadata'. No files were found to uninstall.
  Attempting uninstall: scipy
    Found existing installation: scipy 1.2.0
    Not uninstalling scipy at /cvmfs/soft.computecanada.ca/easybuild/software/2017/Core/scipy-stack/2019a/lib/python3.7/site-packages, outside environment /localscratch/yinan.29338303.0/env
    Can't uninstall 'scipy'. No files were found to uninstall.
Successfully installed absl-py-1.0.0+computecanada astunparse-1.6.3+computecanada cachetools-4.2.4+computecanada gast-0.3.3+computecanada google-auth-2.3.3+computecanada google-auth-oauthlib-0.4.6+computecanada google-pasta-0.2.0+computecanada grpcio-1.38.0+computecanada h5py-2.10.0+computecanada importlib-metadata-4.10.1+computecanada keras-preprocessing-1.1.2+computecanada markdown-3.3.6+computecanada oauthlib-3.1.1+computecanada opt-einsum-3.3.0+computecanada pyasn1-0.4.8+computecanada pyasn1-modules-0.2.8+computecanada requests-oauthlib-1.3.0+computecanada rsa-4.8+computecanada scipy-1.4.1+computecanada tensorboard-2.8.0+computecanada tensorboard-data-server-0.6.1+computecanada tensorboard-plugin-wit-1.8.0+computecanada tensorflow-estimator-2.3.0+computecanada tensorflow-gpu-2.3.0+computecanada werkzeug-2.0.3+computecanada wrapt-1.11.2+computecanada zipp-3.7.0+computecanada
Looking in links: /cvmfs/soft.computecanada.ca/custom/python/wheelhouse/nix/avx2, /cvmfs/soft.computecanada.ca/custom/python/wheelhouse/nix/generic, /cvmfs/soft.computecanada.ca/custom/python/wheelhouse/generic
Processing /cvmfs/soft.computecanada.ca/custom/python/wheelhouse/generic/keras-2.8.0+computecanada-py2.py3-none-any.whl
Installing collected packages: Keras
Successfully installed Keras-2.8.0+computecanada
Looking in links: /cvmfs/soft.computecanada.ca/custom/python/wheelhouse/nix/avx2, /cvmfs/soft.computecanada.ca/custom/python/wheelhouse/nix/generic, /cvmfs/soft.computecanada.ca/custom/python/wheelhouse/generic
Processing /cvmfs/soft.computecanada.ca/custom/python/wheelhouse/generic/urllib3-1.26.7+computecanada-py2.py3-none-any.whl
Installing collected packages: urllib3
  Attempting uninstall: urllib3
    Found existing installation: urllib3 1.26.8+computecanada
    Uninstalling urllib3-1.26.8+computecanada:
      Successfully uninstalled urllib3-1.26.8+computecanada
Successfully installed urllib3-1.26.7+computecanada
Looking in links: /cvmfs/soft.computecanada.ca/custom/python/wheelhouse/nix/avx2, /cvmfs/soft.computecanada.ca/custom/python/wheelhouse/nix/generic, /cvmfs/soft.computecanada.ca/custom/python/wheelhouse/generic
Processing /cvmfs/soft.computecanada.ca/custom/python/wheelhouse/generic/nltk-3.7+computecanada-py3-none-any.whl
Processing /cvmfs/soft.computecanada.ca/custom/python/wheelhouse/generic/nltk-3.6.5+computecanada-py3-none-any.whl
Processing /cvmfs/soft.computecanada.ca/custom/python/wheelhouse/generic/nltk-3.6.3+computecanada-py3-none-any.whl
Requirement already satisfied: tqdm in /localscratch/yinan.29338303.0/env/lib/python3.7/site-packages (from nltk) (4.63.0+computecanada)
Requirement already satisfied: joblib in /localscratch/yinan.29338303.0/env/lib/python3.7/site-packages (from nltk) (1.1.0+computecanada)
Requirement already satisfied: click in /localscratch/yinan.29338303.0/env/lib/python3.7/site-packages (from nltk) (8.0.4+computecanada)
Requirement already satisfied: regex in /localscratch/yinan.29338303.0/env/lib/python3.7/site-packages (from nltk) (2020.11.13+computecanada)
Requirement already satisfied: importlib-metadata in /localscratch/yinan.29338303.0/env/lib/python3.7/site-packages (from click->nltk) (4.10.1+computecanada)
Requirement already satisfied: zipp>=0.5 in /localscratch/yinan.29338303.0/env/lib/python3.7/site-packages (from importlib-metadata->click->nltk) (3.7.0+computecanada)
Requirement already satisfied: typing-extensions>=3.6.4 in /localscratch/yinan.29338303.0/env/lib/python3.7/site-packages (from importlib-metadata->click->nltk) (4.0.1+computecanada)
Installing collected packages: nltk
Successfully installed nltk-3.6.3+computecanada
Looking in links: /cvmfs/soft.computecanada.ca/custom/python/wheelhouse/nix/avx2, /cvmfs/soft.computecanada.ca/custom/python/wheelhouse/nix/generic, /cvmfs/soft.computecanada.ca/custom/python/wheelhouse/generic
Processing /cvmfs/soft.computecanada.ca/custom/python/wheelhouse/generic/scikit_learn-0.22.1+computecanada-cp37-cp37m-linux_x86_64.whl
Requirement already satisfied: numpy>=1.11.0 in /cvmfs/soft.computecanada.ca/easybuild/software/2017/Core/scipy-stack/2019a/lib/python3.7/site-packages (from scikit-learn==0.22.1) (1.16.0)
Requirement already satisfied: scipy>=0.17.0 in /localscratch/yinan.29338303.0/env/lib/python3.7/site-packages (from scikit-learn==0.22.1) (1.4.1+computecanada)
Requirement already satisfied: joblib>=0.11 in /localscratch/yinan.29338303.0/env/lib/python3.7/site-packages (from scikit-learn==0.22.1) (1.1.0+computecanada)
Installing collected packages: scikit-learn
Successfully installed scikit-learn-0.22.1+computecanada
Looking in links: /cvmfs/soft.computecanada.ca/custom/python/wheelhouse/nix/avx2, /cvmfs/soft.computecanada.ca/custom/python/wheelhouse/nix/generic, /cvmfs/soft.computecanada.ca/custom/python/wheelhouse/generic
Requirement already satisfied: tokenizers==0.5.2 in /localscratch/yinan.29338303.0/env/lib/python3.7/site-packages (0.5.2+computecanada)
wandb: Appending key for api.wandb.ai to your netrc file: /home/yinan/.netrc
Starting Task
2022-03-24 01:07:40.978405: I tensorflow/stream_executor/platform/default/dso_loader.cc:48] Successfully opened dynamic library libcudart.so.10.1
[nltk_data] Downloading package stopwords to /home/yinan/nltk_data...
[nltk_data]   Package stopwords is already up-to-date!
[nltk_data] Downloading package wordnet to /home/yinan/nltk_data...
[nltk_data]   Package wordnet is already up-to-date!
wandb: Currently logged in as: yinanazhou (use `wandb login --relogin` to force relogin)
wandb: wandb version 0.12.11 is available!  To upgrade, please run:
wandb:  $ pip install wandb --upgrade
2022-03-24 01:07:53.765268: I tensorflow/stream_executor/platform/default/dso_loader.cc:48] Successfully opened dynamic library libcudart.so.10.1
wandb: Tracking run with wandb version 0.12.5
wandb: Syncing run pretty-pine-1
wandb: ⭐️ View project at https://wandb.ai/yinanazhou/xl_512_bs_8_lr_1e06_es_5_lc_True_nr_True_sr_False_stem_False_lemma_False_repeat_1_fold_1
wandb: 🚀 View run at https://wandb.ai/yinanazhou/xl_512_bs_8_lr_1e06_es_5_lc_True_nr_True_sr_False_stem_False_lemma_False_repeat_1_fold_1/runs/17p1x6qv
wandb: Run data is saved locally in /project/6002780/yinan/Thesis_MER_Lyrics/lyric-emotion/wandb/run-20220324_010751-17p1x6qv
wandb: Run `wandb offline` to turn off syncing.

Validation loss decreased (inf --> 1.439705).  Saving model ...
Validation loss decreased (1.439705 --> 1.419512).  Saving model ...
Validation loss decreased (1.419512 --> 1.402896).  Saving model ...
Validation loss decreased (1.402896 --> 1.389535).  Saving model ...
Validation loss decreased (1.389535 --> 1.379558).  Saving model ...
Validation loss decreased (1.379558 --> 1.370725).  Saving model ...
Validation loss decreased (1.370725 --> 1.364060).  Saving model ...
Validation loss decreased (1.364060 --> 1.358288).  Saving model ...
Validation loss decreased (1.358288 --> 1.352618).  Saving model ...
Validation loss decreased (1.352618 --> 1.347247).  Saving model ...
Validation loss decreased (1.347247 --> 1.341469).  Saving model ...
Validation loss decreased (1.341469 --> 1.336687).  Saving model ...
Validation loss decreased (1.336687 --> 1.331722).  Saving model ...
Validation loss decreased (1.331722 --> 1.326793).  Saving model ...
Validation loss decreased (1.326793 --> 1.321442).  Saving model ...
Validation loss decreased (1.321442 --> 1.317452).  Saving model ...
Validation loss decreased (1.317452 --> 1.311851).  Saving model ...
Validation loss decreased (1.311851 --> 1.305910).  Saving model ...
Validation loss decreased (1.305910 --> 1.300498).  Saving model ...
Validation loss decreased (1.300498 --> 1.294612).  Saving model ...
Validation loss decreased (1.294612 --> 1.289088).  Saving model ...
Validation loss decreased (1.289088 --> 1.282033).  Saving model ...
Validation loss decreased (1.282033 --> 1.278490).  Saving model ...
Validation loss decreased (1.278490 --> 1.271101).  Saving model ...
Validation loss decreased (1.271101 --> 1.265703).  Saving model ...
Validation loss decreased (1.265703 --> 1.261029).  Saving model ...
Validation loss decreased (1.261029 --> 1.254424).  Saving model ...
Validation loss decreased (1.254424 --> 1.250263).  Saving model ...
Validation loss decreased (1.250263 --> 1.247004).  Saving model ...
Validation loss decreased (1.247004 --> 1.245395).  Saving model ...
Validation loss decreased (1.245395 --> 1.242729).  Saving model ...
Validation loss decreased (1.242729 --> 1.237397).  Saving model ...
Validation loss decreased (1.237397 --> 1.235904).  Saving model ...
Validation loss decreased (1.235904 --> 1.230276).  Saving model ...
Validation loss decreased (1.230276 --> 1.227219).  Saving model ...
Validation loss decreased (1.227219 --> 1.220999).  Saving model ...
Validation loss decreased (1.220999 --> 1.215459).  Saving model ...
Validation loss decreased (1.215459 --> 1.214406).  Saving model ...
Validation loss decreased (1.214406 --> 1.209761).  Saving model ...
Validation loss decreased (1.209761 --> 1.208001).  Saving model ...
Validation loss decreased (1.208001 --> 1.201319).  Saving model ...
Validation loss decreased (1.201319 --> 1.197031).  Saving model ...
Validation loss decreased (1.197031 --> 1.194019).  Saving model ...
Validation loss decreased (1.194019 --> 1.193997).  Saving model ...
Validation loss decreased (1.193997 --> 1.189291).  Saving model ...
Validation loss decreased (1.189291 --> 1.186797).  Saving model ...
Validation loss decreased (1.186797 --> 1.185167).  Saving model ...
EarlyStopping counter: 1 out of 5.0
Validation loss decreased (1.185167 --> 1.179282).  Saving model ...
Validation loss decreased (1.179282 --> 1.179126).  Saving model ...
Validation loss decreased (1.179126 --> 1.172249).  Saving model ...
Validation loss decreased (1.172249 --> 1.169561).  Saving model ...
Validation loss decreased (1.169561 --> 1.168631).  Saving model ...
Validation loss decreased (1.168631 --> 1.165754).  Saving model ...
Validation loss decreased (1.165754 --> 1.165563).  Saving model ...
Validation loss decreased (1.165563 --> 1.159924).  Saving model ...
Validation loss decreased (1.159924 --> 1.154075).  Saving model ...
Validation loss decreased (1.154075 --> 1.149934).  Saving model ...
Validation loss decreased (1.149934 --> 1.144026).  Saving model ...
EarlyStopping counter: 1 out of 5.0
Validation loss decreased (1.144026 --> 1.141895).  Saving model ...
Validation loss decreased (1.141895 --> 1.139391).  Saving model ...
Validation loss decreased (1.139391 --> 1.134637).  Saving model ...
EarlyStopping counter: 1 out of 5.0
EarlyStopping counter: 2 out of 5.0
Validation loss decreased (1.134637 --> 1.130837).  Saving model ...
Validation loss decreased (1.130837 --> 1.128263).  Saving model ...
Validation loss decreased (1.128263 --> 1.122229).  Saving model ...
Validation loss decreased (1.122229 --> 1.121355).  Saving model ...
Validation loss decreased (1.121355 --> 1.119745).  Saving model ...
Validation loss decreased (1.119745 --> 1.113369).  Saving model ...
Validation loss decreased (1.113369 --> 1.111985).  Saving model ...
Validation loss decreased (1.111985 --> 1.111388).  Saving model ...
Validation loss decreased (1.111388 --> 1.108078).  Saving model ...
Validation loss decreased (1.108078 --> 1.104047).  Saving model ...
Validation loss decreased (1.104047 --> 1.103267).  Saving model ...
Validation loss decreased (1.103267 --> 1.102833).  Saving model ...
Validation loss decreased (1.102833 --> 1.098015).  Saving model ...
Validation loss decreased (1.098015 --> 1.092954).  Saving model ...
Validation loss decreased (1.092954 --> 1.091071).  Saving model ...
EarlyStopping counter: 1 out of 5.0
EarlyStopping counter: 2 out of 5.0
EarlyStopping counter: 3 out of 5.0
Validation loss decreased (1.091071 --> 1.088426).  Saving model ...
Validation loss decreased (1.088426 --> 1.086415).  Saving model ...
Validation loss decreased (1.086415 --> 1.081795).  Saving model ...
Validation loss decreased (1.081795 --> 1.076227).  Saving model ...
EarlyStopping counter: 1 out of 5.0
EarlyStopping counter: 2 out of 5.0
EarlyStopping counter: 3 out of 5.0
Validation loss decreased (1.076227 --> 1.076158).  Saving model ...
Validation loss decreased (1.076158 --> 1.075998).  Saving model ...
Validation loss decreased (1.075998 --> 1.073468).  Saving model ...
EarlyStopping counter: 1 out of 5.0
EarlyStopping counter: 2 out of 5.0
Validation loss decreased (1.073468 --> 1.071521).  Saving model ...
Validation loss decreased (1.071521 --> 1.070522).  Saving model ...
Validation loss decreased (1.070522 --> 1.063458).  Saving model ...
Validation loss decreased (1.063458 --> 1.062997).  Saving model ...
EarlyStopping counter: 1 out of 5.0
EarlyStopping counter: 2 out of 5.0
Validation loss decreased (1.062997 --> 1.058527).  Saving model ...
Validation loss decreased (1.058527 --> 1.057909).  Saving model ...
Validation loss decreased (1.057909 --> 1.056703).  Saving model ...
Validation loss decreased (1.056703 --> 1.055632).  Saving model ...
Validation loss decreased (1.055632 --> 1.052692).  Saving model ...
Validation loss decreased (1.052692 --> 1.052595).  Saving model ...
Validation loss decreased (1.052595 --> 1.049691).  Saving model ...
Validation loss decreased (1.049691 --> 1.047494).  Saving model ...
Validation loss decreased (1.047494 --> 1.044458).  Saving model ...
EarlyStopping counter: 1 out of 5.0
EarlyStopping counter: 2 out of 5.0
EarlyStopping counter: 3 out of 5.0
EarlyStopping counter: 4 out of 5.0
EarlyStopping counter: 5 out of 5.0
/localscratch/yinan.29338303.0/env/lib/python3.7/site-packages/torch/nn/functional.py:1794: UserWarning: nn.functional.tanh is deprecated. Use torch.tanh instead.
  warnings.warn("nn.functional.tanh is deprecated. Use torch.tanh instead.")
/localscratch/yinan.29338303.0/env/lib/python3.7/site-packages/transformers/optimization.py:155: UserWarning: This overload of add_ is deprecated:
	add_(Number alpha, Tensor other)
Consider using one of the following signatures instead:
	add_(Tensor other, *, Number alpha) (Triggered internally at  ../torch/csrc/utils/python_arg_parser.cpp:1025.)
  exp_avg.mul_(beta1).add_(1.0 - beta1, grad)
wandb: Waiting for W&B process to finish, PID 25066... (success).
wandb: - 0.00MB of 0.00MB uploaded (0.00MB deduped)wandb: \ 0.00MB of 0.00MB uploaded (0.00MB deduped)wandb: | 0.00MB of 0.00MB uploaded (0.00MB deduped)wandb: / 0.00MB of 0.00MB uploaded (0.00MB deduped)wandb: - 0.00MB of 0.00MB uploaded (0.00MB deduped)wandb: \ 0.00MB of 0.00MB uploaded (0.00MB deduped)wandb: | 0.00MB of 0.00MB uploaded (0.00MB deduped)wandb: / 0.00MB of 0.00MB uploaded (0.00MB deduped)wandb: - 0.00MB of 0.00MB uploaded (0.00MB deduped)wandb: \ 0.00MB of 0.00MB uploaded (0.00MB deduped)wandb: | 0.00MB of 0.00MB uploaded (0.00MB deduped)wandb: / 0.00MB of 0.00MB uploaded (0.00MB deduped)wandb: - 0.00MB of 0.00MB uploaded (0.00MB deduped)wandb:                                                                                
wandb: Run history:
wandb:     e_F1 ▁▂▃▄▅▅▅▅▅▆▆▆▆▆▆▆▆▆▆▆▇▇▇▇▇▇▇▇▇▇▇▇▇▇██████
wandb:   e_loss █▇▇▆▆▆▆▅▅▅▅▄▄▄▄▄▃▃▃▃▃▃▃▂▂▂▂▂▂▂▂▂▂▁▁▁▁▁▁▁
wandb:     t_F1 ▁▁▂▃▃▃▃▄▄▅▅▅▆▅▆▆▇▆▆▆▇▇▆▆▇▇▇▇▇▇▇▇█▇▇█████
wandb:   t_loss ██▇▇▇▇▇▆▆▆▅▅▅▅▄▄▄▄▄▄▃▃▃▃▃▃▃▃▂▂▂▂▂▂▂▁▁▁▁▁
wandb: 
wandb: Run summary:
wandb:     e_F1 55.35941
wandb:   e_loss 1.04531
wandb:     t_F1 68.50396
wandb:   t_loss 0.8105
wandb: 
wandb: Synced 4 W&B file(s), 0 media file(s), 0 artifact file(s) and 0 other file(s)
wandb: Synced pretty-pine-1: https://wandb.ai/yinanazhou/xl_512_bs_8_lr_1e06_es_5_lc_True_nr_True_sr_False_stem_False_lemma_False_repeat_1_fold_1/runs/17p1x6qv
wandb: Find logs at: ./wandb/run-20220324_010751-17p1x6qv/logs/debug.log
wandb: 

wandb: wandb version 0.12.11 is available!  To upgrade, please run:
wandb:  $ pip install wandb --upgrade
2022-03-24 02:21:10.734868: I tensorflow/stream_executor/platform/default/dso_loader.cc:48] Successfully opened dynamic library libcudart.so.10.1
wandb: Tracking run with wandb version 0.12.5
wandb: Syncing run iconic-plant-1
wandb: ⭐️ View project at https://wandb.ai/yinanazhou/xl_512_bs_8_lr_1e06_es_5_lc_True_nr_True_sr_False_stem_False_lemma_False_repeat_1_fold_2
wandb: 🚀 View run at https://wandb.ai/yinanazhou/xl_512_bs_8_lr_1e06_es_5_lc_True_nr_True_sr_False_stem_False_lemma_False_repeat_1_fold_2/runs/1wrntfgb
wandb: Run data is saved locally in /project/6002780/yinan/Thesis_MER_Lyrics/lyric-emotion/wandb/run-20220324_022108-1wrntfgb
wandb: Run `wandb offline` to turn off syncing.

Validation loss decreased (inf --> 1.435001).  Saving model ...
Validation loss decreased (1.435001 --> 1.418763).  Saving model ...
Validation loss decreased (1.418763 --> 1.408335).  Saving model ...
Validation loss decreased (1.408335 --> 1.400220).  Saving model ...
Validation loss decreased (1.400220 --> 1.393591).  Saving model ...
Validation loss decreased (1.393591 --> 1.387882).  Saving model ...
Validation loss decreased (1.387882 --> 1.383205).  Saving model ...
Validation loss decreased (1.383205 --> 1.378950).  Saving model ...
Validation loss decreased (1.378950 --> 1.374832).  Saving model ...
Validation loss decreased (1.374832 --> 1.370932).  Saving model ...
Validation loss decreased (1.370932 --> 1.367122).  Saving model ...
Validation loss decreased (1.367122 --> 1.363422).  Saving model ...
Validation loss decreased (1.363422 --> 1.359813).  Saving model ...
Validation loss decreased (1.359813 --> 1.355920).  Saving model ...
Validation loss decreased (1.355920 --> 1.352425).  Saving model ...
Validation loss decreased (1.352425 --> 1.348827).  Saving model ...
Validation loss decreased (1.348827 --> 1.345163).  Saving model ...
Validation loss decreased (1.345163 --> 1.341188).  Saving model ...
Validation loss decreased (1.341188 --> 1.336919).  Saving model ...
Validation loss decreased (1.336919 --> 1.332396).  Saving model ...
Validation loss decreased (1.332396 --> 1.327821).  Saving model ...
Validation loss decreased (1.327821 --> 1.323125).  Saving model ...
Validation loss decreased (1.323125 --> 1.317889).  Saving model ...
Validation loss decreased (1.317889 --> 1.312892).  Saving model ...
Validation loss decreased (1.312892 --> 1.307540).  Saving model ...
Validation loss decreased (1.307540 --> 1.301050).  Saving model ...
Validation loss decreased (1.301050 --> 1.294891).  Saving model ...
Validation loss decreased (1.294891 --> 1.288332).  Saving model ...
Validation loss decreased (1.288332 --> 1.281812).  Saving model ...
Validation loss decreased (1.281812 --> 1.275418).  Saving model ...
Validation loss decreased (1.275418 --> 1.268253).  Saving model ...
Validation loss decreased (1.268253 --> 1.260781).  Saving model ...
Validation loss decreased (1.260781 --> 1.253849).  Saving model ...
Validation loss decreased (1.253849 --> 1.247136).  Saving model ...
Validation loss decreased (1.247136 --> 1.238668).  Saving model ...
Validation loss decreased (1.238668 --> 1.230571).  Saving model ...
Validation loss decreased (1.230571 --> 1.223175).  Saving model ...
Validation loss decreased (1.223175 --> 1.215619).  Saving model ...
Validation loss decreased (1.215619 --> 1.207706).  Saving model ...
Validation loss decreased (1.207706 --> 1.200363).  Saving model ...
Validation loss decreased (1.200363 --> 1.192562).  Saving model ...
Validation loss decreased (1.192562 --> 1.185530).  Saving model ...
Validation loss decreased (1.185530 --> 1.178891).  Saving model ...
Validation loss decreased (1.178891 --> 1.171389).  Saving model ...
Validation loss decreased (1.171389 --> 1.165513).  Saving model ...
Validation loss decreased (1.165513 --> 1.159452).  Saving model ...
Validation loss decreased (1.159452 --> 1.152918).  Saving model ...
Validation loss decreased (1.152918 --> 1.146308).  Saving model ...
Validation loss decreased (1.146308 --> 1.139954).  Saving model ...
Validation loss decreased (1.139954 --> 1.133992).  Saving model ...
Validation loss decreased (1.133992 --> 1.127479).  Saving model ...
Validation loss decreased (1.127479 --> 1.121267).  Saving model ...
Validation loss decreased (1.121267 --> 1.115498).  Saving model ...
Validation loss decreased (1.115498 --> 1.110310).  Saving model ...
Validation loss decreased (1.110310 --> 1.103991).  Saving model ...
Validation loss decreased (1.103991 --> 1.098997).  Saving model ...
Validation loss decreased (1.098997 --> 1.093121).  Saving model ...
Validation loss decreased (1.093121 --> 1.088137).  Saving model ...
Validation loss decreased (1.088137 --> 1.083331).  Saving model ...
Validation loss decreased (1.083331 --> 1.078039).  Saving model ...
Validation loss decreased (1.078039 --> 1.072474).  Saving model ...
Validation loss decreased (1.072474 --> 1.068984).  Saving model ...
Validation loss decreased (1.068984 --> 1.065263).  Saving model ...
Validation loss decreased (1.065263 --> 1.060492).  Saving model ...
Validation loss decreased (1.060492 --> 1.054920).  Saving model ...
Validation loss decreased (1.054920 --> 1.052353).  Saving model ...
Validation loss decreased (1.052353 --> 1.046293).  Saving model ...
Validation loss decreased (1.046293 --> 1.041604).  Saving model ...
Validation loss decreased (1.041604 --> 1.038351).  Saving model ...
Validation loss decreased (1.038351 --> 1.034586).  Saving model ...
Validation loss decreased (1.034586 --> 1.029735).  Saving model ...
Validation loss decreased (1.029735 --> 1.026122).  Saving model ...
Validation loss decreased (1.026122 --> 1.022654).  Saving model ...
Validation loss decreased (1.022654 --> 1.018326).  Saving model ...
Validation loss decreased (1.018326 --> 1.016013).  Saving model ...
Validation loss decreased (1.016013 --> 1.014422).  Saving model ...
Validation loss decreased (1.014422 --> 1.009932).  Saving model ...
Validation loss decreased (1.009932 --> 1.007549).  Saving model ...
Validation loss decreased (1.007549 --> 1.004533).  Saving model ...
Validation loss decreased (1.004533 --> 1.000941).  Saving model ...
Validation loss decreased (1.000941 --> 0.998339).  Saving model ...
Validation loss decreased (0.998339 --> 0.994133).  Saving model ...
Validation loss decreased (0.994133 --> 0.990858).  Saving model ...
Validation loss decreased (0.990858 --> 0.988968).  Saving model ...
Validation loss decreased (0.988968 --> 0.985696).  Saving model ...
Validation loss decreased (0.985696 --> 0.983559).  Saving model ...
Validation loss decreased (0.983559 --> 0.982592).  Saving model ...
Validation loss decreased (0.982592 --> 0.979237).  Saving model ...
Validation loss decreased (0.979237 --> 0.976732).  Saving model ...
Validation loss decreased (0.976732 --> 0.974419).  Saving model ...
Validation loss decreased (0.974419 --> 0.973042).  Saving model ...
Validation loss decreased (0.973042 --> 0.972902).  Saving model ...
Validation loss decreased (0.972902 --> 0.969500).  Saving model ...
Validation loss decreased (0.969500 --> 0.967386).  Saving model ...
Validation loss decreased (0.967386 --> 0.964876).  Saving model ...
Validation loss decreased (0.964876 --> 0.964149).  Saving model ...
Validation loss decreased (0.964149 --> 0.961388).  Saving model ...
Validation loss decreased (0.961388 --> 0.959534).  Saving model ...
Validation loss decreased (0.959534 --> 0.957714).  Saving model ...
Validation loss decreased (0.957714 --> 0.956379).  Saving model ...
Validation loss decreased (0.956379 --> 0.955508).  Saving model ...
Validation loss decreased (0.955508 --> 0.953449).  Saving model ...
Validation loss decreased (0.953449 --> 0.951154).  Saving model ...
Validation loss decreased (0.951154 --> 0.949147).  Saving model ...
Validation loss decreased (0.949147 --> 0.947953).  Saving model ...
Validation loss decreased (0.947953 --> 0.947190).  Saving model ...
Validation loss decreased (0.947190 --> 0.945339).  Saving model ...
Validation loss decreased (0.945339 --> 0.944032).  Saving model ...
Validation loss decreased (0.944032 --> 0.942753).  Saving model ...
Validation loss decreased (0.942753 --> 0.940639).  Saving model ...
Validation loss decreased (0.940639 --> 0.939471).  Saving model ...
Validation loss decreased (0.939471 --> 0.938355).  Saving model ...
Validation loss decreased (0.938355 --> 0.936318).  Saving model ...
Validation loss decreased (0.936318 --> 0.934813).  Saving model ...
Validation loss decreased (0.934813 --> 0.933663).  Saving model ...
Validation loss decreased (0.933663 --> 0.933278).  Saving model ...
Validation loss decreased (0.933278 --> 0.931980).  Saving model ...
EarlyStopping counter: 1 out of 5.0
Validation loss decreased (0.931980 --> 0.930921).  Saving model ...
EarlyStopping counter: 1 out of 5.0
Validation loss decreased (0.930921 --> 0.930909).  Saving model ...
Validation loss decreased (0.930909 --> 0.930675).  Saving model ...
Validation loss decreased (0.930675 --> 0.930435).  Saving model ...
Validation loss decreased (0.930435 --> 0.929080).  Saving model ...
Validation loss decreased (0.929080 --> 0.928394).  Saving model ...
EarlyStopping counter: 1 out of 5.0
Validation loss decreased (0.928394 --> 0.927803).  Saving model ...
Validation loss decreased (0.927803 --> 0.927076).  Saving model ...
Validation loss decreased (0.927076 --> 0.926402).  Saving model ...
EarlyStopping counter: 1 out of 5.0
Validation loss decreased (0.926402 --> 0.925928).  Saving model ...
Validation loss decreased (0.925928 --> 0.924720).  Saving model ...
EarlyStopping counter: 1 out of 5.0
EarlyStopping counter: 2 out of 5.0
EarlyStopping counter: 3 out of 5.0
EarlyStopping counter: 4 out of 5.0
EarlyStopping counter: 5 out of 5.0
/localscratch/yinan.29338303.0/env/lib/python3.7/site-packages/torch/nn/functional.py:1794: UserWarning: nn.functional.tanh is deprecated. Use torch.tanh instead.
  warnings.warn("nn.functional.tanh is deprecated. Use torch.tanh instead.")
wandb: Waiting for W&B process to finish, PID 29021... (success).
wandb: - 0.00MB of 0.00MB uploaded (0.00MB deduped)wandb: \ 0.00MB of 0.00MB uploaded (0.00MB deduped)wandb: | 0.00MB of 0.00MB uploaded (0.00MB deduped)wandb: / 0.00MB of 0.00MB uploaded (0.00MB deduped)wandb: - 0.00MB of 0.00MB uploaded (0.00MB deduped)wandb: \ 0.00MB of 0.00MB uploaded (0.00MB deduped)wandb: | 0.00MB of 0.00MB uploaded (0.00MB deduped)wandb: / 0.00MB of 0.00MB uploaded (0.00MB deduped)wandb: - 0.00MB of 0.00MB uploaded (0.00MB deduped)wandb: \ 0.00MB of 0.00MB uploaded (0.00MB deduped)wandb: | 0.00MB of 0.00MB uploaded (0.00MB deduped)wandb: / 0.00MB of 0.00MB uploaded (0.00MB deduped)wandb: - 0.00MB of 0.00MB uploaded (0.00MB deduped)wandb: \ 0.00MB of 0.00MB uploaded (0.00MB deduped)wandb: | 0.00MB of 0.00MB uploaded (0.00MB deduped)wandb: / 0.00MB of 0.00MB uploaded (0.00MB deduped)wandb: - 0.00MB of 0.00MB uploaded (0.00MB deduped)wandb: \ 0.00MB of 0.00MB uploaded (0.00MB deduped)wandb: | 0.00MB of 0.00MB uploaded (0.00MB deduped)wandb: / 0.00MB of 0.00MB uploaded (0.00MB deduped)wandb: - 0.00MB of 0.00MB uploaded (0.00MB deduped)wandb: \ 0.00MB of 0.00MB uploaded (0.00MB deduped)wandb: | 0.00MB of 0.00MB uploaded (0.00MB deduped)wandb: / 0.00MB of 0.00MB uploaded (0.00MB deduped)wandb: - 0.00MB of 0.00MB uploaded (0.00MB deduped)wandb: \ 0.00MB of 0.00MB uploaded (0.00MB deduped)wandb: | 0.00MB of 0.00MB uploaded (0.00MB deduped)wandb: / 0.00MB of 0.00MB uploaded (0.00MB deduped)wandb: - 0.00MB of 0.00MB uploaded (0.00MB deduped)wandb: \ 0.00MB of 0.00MB uploaded (0.00MB deduped)wandb: | 0.00MB of 0.00MB uploaded (0.00MB deduped)wandb: / 0.00MB of 0.00MB uploaded (0.00MB deduped)wandb: - 0.00MB of 0.00MB uploaded (0.00MB deduped)wandb: \ 0.00MB of 0.00MB uploaded (0.00MB deduped)wandb: | 0.00MB of 0.00MB uploaded (0.00MB deduped)wandb: / 0.00MB of 0.00MB uploaded (0.00MB deduped)wandb: - 0.00MB of 0.00MB uploaded (0.00MB deduped)wandb: \ 0.00MB of 0.00MB uploaded (0.00MB deduped)wandb: | 0.00MB of 0.00MB uploaded (0.00MB deduped)wandb: / 0.00MB of 0.00MB uploaded (0.00MB deduped)wandb: - 0.00MB of 0.00MB uploaded (0.00MB deduped)wandb: \ 0.00MB of 0.00MB uploaded (0.00MB deduped)wandb: | 0.00MB of 0.00MB uploaded (0.00MB deduped)wandb: / 0.00MB of 0.00MB uploaded (0.00MB deduped)wandb: - 0.00MB of 0.00MB uploaded (0.00MB deduped)wandb:                                                                                
wandb: Run history:
wandb:     e_F1 ▁▁▃▄▄▅▅▅▅▅▆▆▆▆▇▇▇▇▇▇▇▇▇▇▇▇▇█████████████
wandb:   e_loss ██▇▇▇▇▇▆▆▆▅▅▅▄▄▄▃▃▃▃▃▂▂▂▂▂▂▂▁▁▁▁▁▁▁▁▁▁▁▁
wandb:     t_F1 ▁▂▂▂▂▃▃▄▄▄▄▅▅▅▅▅▆▆▅▆▆▆▆▇▇▆▇▆▇▇▇▇▇▇███▇██
wandb:   t_loss ██▇▇▇▇▇▇▆▆▆▆▆▅▅▅▅▅▅▄▄▄▃▃▃▃▃▃▂▃▂▂▂▂▂▁▂▂▁▁
wandb: 
wandb: Run summary:
wandb:     e_F1 61.2515
wandb:   e_loss 0.92578
wandb:     t_F1 72.47963
wandb:   t_loss 0.76391
wandb: 
wandb: Synced 4 W&B file(s), 0 media file(s), 0 artifact file(s) and 0 other file(s)
wandb: Synced iconic-plant-1: https://wandb.ai/yinanazhou/xl_512_bs_8_lr_1e06_es_5_lc_True_nr_True_sr_False_stem_False_lemma_False_repeat_1_fold_2/runs/1wrntfgb
wandb: Find logs at: ./wandb/run-20220324_022108-1wrntfgb/logs/debug.log
wandb: 

wandb: wandb version 0.12.11 is available!  To upgrade, please run:
wandb:  $ pip install wandb --upgrade
2022-03-24 03:51:55.008661: I tensorflow/stream_executor/platform/default/dso_loader.cc:48] Successfully opened dynamic library libcudart.so.10.1
wandb: Tracking run with wandb version 0.12.5
wandb: Syncing run major-aardvark-1
wandb: ⭐️ View project at https://wandb.ai/yinanazhou/xl_512_bs_8_lr_1e06_es_5_lc_True_nr_True_sr_False_stem_False_lemma_False_repeat_2_fold_1
wandb: 🚀 View run at https://wandb.ai/yinanazhou/xl_512_bs_8_lr_1e06_es_5_lc_True_nr_True_sr_False_stem_False_lemma_False_repeat_2_fold_1/runs/23jo1cym
wandb: Run data is saved locally in /project/6002780/yinan/Thesis_MER_Lyrics/lyric-emotion/wandb/run-20220324_035152-23jo1cym
wandb: Run `wandb offline` to turn off syncing.

Validation loss decreased (inf --> 1.412877).  Saving model ...
Validation loss decreased (1.412877 --> 1.400013).  Saving model ...
Validation loss decreased (1.400013 --> 1.390166).  Saving model ...
Validation loss decreased (1.390166 --> 1.382783).  Saving model ...
Validation loss decreased (1.382783 --> 1.376945).  Saving model ...
Validation loss decreased (1.376945 --> 1.371683).  Saving model ...
Validation loss decreased (1.371683 --> 1.367451).  Saving model ...
Validation loss decreased (1.367451 --> 1.363655).  Saving model ...
Validation loss decreased (1.363655 --> 1.359831).  Saving model ...
Validation loss decreased (1.359831 --> 1.356018).  Saving model ...
Validation loss decreased (1.356018 --> 1.351955).  Saving model ...
Validation loss decreased (1.351955 --> 1.348474).  Saving model ...
Validation loss decreased (1.348474 --> 1.344508).  Saving model ...
Validation loss decreased (1.344508 --> 1.340514).  Saving model ...
Validation loss decreased (1.340514 --> 1.336176).  Saving model ...
Validation loss decreased (1.336176 --> 1.331854).  Saving model ...
Validation loss decreased (1.331854 --> 1.327405).  Saving model ...
Validation loss decreased (1.327405 --> 1.323228).  Saving model ...
Validation loss decreased (1.323228 --> 1.318394).  Saving model ...
Validation loss decreased (1.318394 --> 1.312604).  Saving model ...
Validation loss decreased (1.312604 --> 1.306844).  Saving model ...
Validation loss decreased (1.306844 --> 1.299513).  Saving model ...
Validation loss decreased (1.299513 --> 1.292060).  Saving model ...
Validation loss decreased (1.292060 --> 1.285228).  Saving model ...
Validation loss decreased (1.285228 --> 1.277172).  Saving model ...
Validation loss decreased (1.277172 --> 1.267661).  Saving model ...
Validation loss decreased (1.267661 --> 1.260593).  Saving model ...
Validation loss decreased (1.260593 --> 1.252283).  Saving model ...
Validation loss decreased (1.252283 --> 1.243345).  Saving model ...
Validation loss decreased (1.243345 --> 1.234840).  Saving model ...
Validation loss decreased (1.234840 --> 1.226778).  Saving model ...
Validation loss decreased (1.226778 --> 1.218171).  Saving model ...
Validation loss decreased (1.218171 --> 1.211000).  Saving model ...
Validation loss decreased (1.211000 --> 1.204563).  Saving model ...
Validation loss decreased (1.204563 --> 1.198035).  Saving model ...
Validation loss decreased (1.198035 --> 1.190574).  Saving model ...
Validation loss decreased (1.190574 --> 1.183306).  Saving model ...
Validation loss decreased (1.183306 --> 1.177914).  Saving model ...
Validation loss decreased (1.177914 --> 1.172179).  Saving model ...
Validation loss decreased (1.172179 --> 1.165797).  Saving model ...
Validation loss decreased (1.165797 --> 1.159331).  Saving model ...
Validation loss decreased (1.159331 --> 1.156069).  Saving model ...
Validation loss decreased (1.156069 --> 1.150928).  Saving model ...
Validation loss decreased (1.150928 --> 1.146484).  Saving model ...
Validation loss decreased (1.146484 --> 1.141912).  Saving model ...
Validation loss decreased (1.141912 --> 1.135235).  Saving model ...
Validation loss decreased (1.135235 --> 1.131355).  Saving model ...
Validation loss decreased (1.131355 --> 1.128911).  Saving model ...
Validation loss decreased (1.128911 --> 1.122244).  Saving model ...
Validation loss decreased (1.122244 --> 1.118294).  Saving model ...
Validation loss decreased (1.118294 --> 1.114013).  Saving model ...
Validation loss decreased (1.114013 --> 1.111073).  Saving model ...
Validation loss decreased (1.111073 --> 1.105022).  Saving model ...
Validation loss decreased (1.105022 --> 1.099951).  Saving model ...
Validation loss decreased (1.099951 --> 1.095759).  Saving model ...
Validation loss decreased (1.095759 --> 1.091301).  Saving model ...
Validation loss decreased (1.091301 --> 1.086920).  Saving model ...
Validation loss decreased (1.086920 --> 1.083041).  Saving model ...
Validation loss decreased (1.083041 --> 1.082966).  Saving model ...
Validation loss decreased (1.082966 --> 1.077367).  Saving model ...
Validation loss decreased (1.077367 --> 1.071924).  Saving model ...
Validation loss decreased (1.071924 --> 1.068577).  Saving model ...
Validation loss decreased (1.068577 --> 1.066085).  Saving model ...
Validation loss decreased (1.066085 --> 1.064899).  Saving model ...
Validation loss decreased (1.064899 --> 1.061647).  Saving model ...
Validation loss decreased (1.061647 --> 1.059885).  Saving model ...
Validation loss decreased (1.059885 --> 1.056160).  Saving model ...
Validation loss decreased (1.056160 --> 1.049354).  Saving model ...
Validation loss decreased (1.049354 --> 1.046229).  Saving model ...
Validation loss decreased (1.046229 --> 1.044137).  Saving model ...
Validation loss decreased (1.044137 --> 1.042099).  Saving model ...
Validation loss decreased (1.042099 --> 1.040135).  Saving model ...
Validation loss decreased (1.040135 --> 1.037899).  Saving model ...
Validation loss decreased (1.037899 --> 1.035547).  Saving model ...
Validation loss decreased (1.035547 --> 1.031529).  Saving model ...
EarlyStopping counter: 1 out of 5.0
Validation loss decreased (1.031529 --> 1.029523).  Saving model ...
Validation loss decreased (1.029523 --> 1.025516).  Saving model ...
Validation loss decreased (1.025516 --> 1.022100).  Saving model ...
EarlyStopping counter: 1 out of 5.0
Validation loss decreased (1.022100 --> 1.020296).  Saving model ...
Validation loss decreased (1.020296 --> 1.015967).  Saving model ...
Validation loss decreased (1.015967 --> 1.013026).  Saving model ...
Validation loss decreased (1.013026 --> 1.012778).  Saving model ...
Validation loss decreased (1.012778 --> 1.009978).  Saving model ...
Validation loss decreased (1.009978 --> 1.007810).  Saving model ...
Validation loss decreased (1.007810 --> 1.006413).  Saving model ...
EarlyStopping counter: 1 out of 5.0
Validation loss decreased (1.006413 --> 1.002592).  Saving model ...
Validation loss decreased (1.002592 --> 1.000581).  Saving model ...
Validation loss decreased (1.000581 --> 1.000118).  Saving model ...
Validation loss decreased (1.000118 --> 0.999447).  Saving model ...
Validation loss decreased (0.999447 --> 0.996057).  Saving model ...
Validation loss decreased (0.996057 --> 0.994536).  Saving model ...
Validation loss decreased (0.994536 --> 0.991762).  Saving model ...
EarlyStopping counter: 1 out of 5.0
Validation loss decreased (0.991762 --> 0.990005).  Saving model ...
Validation loss decreased (0.990005 --> 0.986993).  Saving model ...
Validation loss decreased (0.986993 --> 0.985028).  Saving model ...
Validation loss decreased (0.985028 --> 0.981478).  Saving model ...
Validation loss decreased (0.981478 --> 0.979914).  Saving model ...
Validation loss decreased (0.979914 --> 0.977594).  Saving model ...
EarlyStopping counter: 1 out of 5.0
EarlyStopping counter: 2 out of 5.0
Validation loss decreased (0.977594 --> 0.976956).  Saving model ...
Validation loss decreased (0.976956 --> 0.974953).  Saving model ...
Validation loss decreased (0.974953 --> 0.974247).  Saving model ...
EarlyStopping counter: 1 out of 5.0
EarlyStopping counter: 2 out of 5.0
Validation loss decreased (0.974247 --> 0.974108).  Saving model ...
Validation loss decreased (0.974108 --> 0.969532).  Saving model ...
EarlyStopping counter: 1 out of 5.0
EarlyStopping counter: 2 out of 5.0
Validation loss decreased (0.969532 --> 0.969154).  Saving model ...
EarlyStopping counter: 1 out of 5.0
EarlyStopping counter: 2 out of 5.0
EarlyStopping counter: 3 out of 5.0
Validation loss decreased (0.969154 --> 0.967390).  Saving model ...
Validation loss decreased (0.967390 --> 0.965689).  Saving model ...
EarlyStopping counter: 1 out of 5.0
Validation loss decreased (0.965689 --> 0.963680).  Saving model ...
Validation loss decreased (0.963680 --> 0.962468).  Saving model ...
Validation loss decreased (0.962468 --> 0.961535).  Saving model ...
EarlyStopping counter: 1 out of 5.0
EarlyStopping counter: 2 out of 5.0
Validation loss decreased (0.961535 --> 0.961201).  Saving model ...
EarlyStopping counter: 1 out of 5.0
Validation loss decreased (0.961201 --> 0.959644).  Saving model ...
Validation loss decreased (0.959644 --> 0.958501).  Saving model ...
EarlyStopping counter: 1 out of 5.0
EarlyStopping counter: 2 out of 5.0
EarlyStopping counter: 3 out of 5.0
EarlyStopping counter: 4 out of 5.0
EarlyStopping counter: 5 out of 5.0
/localscratch/yinan.29338303.0/env/lib/python3.7/site-packages/torch/nn/functional.py:1794: UserWarning: nn.functional.tanh is deprecated. Use torch.tanh instead.
  warnings.warn("nn.functional.tanh is deprecated. Use torch.tanh instead.")
wandb: Waiting for W&B process to finish, PID 33891... (success).
wandb: - 0.00MB of 0.00MB uploaded (0.00MB deduped)wandb: \ 0.00MB of 0.00MB uploaded (0.00MB deduped)wandb: | 0.00MB of 0.00MB uploaded (0.00MB deduped)wandb: / 0.00MB of 0.00MB uploaded (0.00MB deduped)wandb: - 0.00MB of 0.00MB uploaded (0.00MB deduped)wandb: \ 0.00MB of 0.00MB uploaded (0.00MB deduped)wandb: | 0.00MB of 0.00MB uploaded (0.00MB deduped)wandb: / 0.00MB of 0.00MB uploaded (0.00MB deduped)wandb: - 0.00MB of 0.00MB uploaded (0.00MB deduped)wandb: \ 0.00MB of 0.00MB uploaded (0.00MB deduped)wandb: | 0.00MB of 0.00MB uploaded (0.00MB deduped)wandb: / 0.00MB of 0.00MB uploaded (0.00MB deduped)wandb: - 0.00MB of 0.00MB uploaded (0.00MB deduped)wandb: \ 0.00MB of 0.00MB uploaded (0.00MB deduped)wandb:                                                                                
wandb: Run history:
wandb:     e_F1 ▁▂▅▅▆▆▆▆▇▆▇▇▇▇▇▇▇▇▇▇▇▇▇▇▇▇█▇▇███████████
wandb:   e_loss ██▇▇▇▇▆▆▆▅▅▄▄▄▄▃▃▃▃▃▂▂▂▂▂▂▂▂▂▁▁▁▁▁▁▁▁▁▁▁
wandb:     t_F1 ▁▁▂▃▃▃▄▄▄▄▅▅▅▅▅▆▆▆▆▆▇▆▇▇▆▇▇▇▇▇█▇▇███████
wandb:   t_loss ███▇▇▇▇▇▇▆▆▆▅▅▅▅▄▄▄▄▄▄▃▃▃▃▃▂▂▂▂▂▂▂▁▁▁▁▁▁
wandb: 
wandb: Run summary:
wandb:     e_F1 59.79758
wandb:   e_loss 0.95911
wandb:     t_F1 70.67201
wandb:   t_loss 0.76442
wandb: 
wandb: Synced 4 W&B file(s), 0 media file(s), 0 artifact file(s) and 0 other file(s)
wandb: Synced major-aardvark-1: https://wandb.ai/yinanazhou/xl_512_bs_8_lr_1e06_es_5_lc_True_nr_True_sr_False_stem_False_lemma_False_repeat_2_fold_1/runs/23jo1cym
wandb: Find logs at: ./wandb/run-20220324_035152-23jo1cym/logs/debug.log
wandb: 

wandb: wandb version 0.12.11 is available!  To upgrade, please run:
wandb:  $ pip install wandb --upgrade
2022-03-24 05:20:19.314445: I tensorflow/stream_executor/platform/default/dso_loader.cc:48] Successfully opened dynamic library libcudart.so.10.1
wandb: Tracking run with wandb version 0.12.5
wandb: Syncing run wild-dew-1
wandb: ⭐️ View project at https://wandb.ai/yinanazhou/xl_512_bs_8_lr_1e06_es_5_lc_True_nr_True_sr_False_stem_False_lemma_False_repeat_2_fold_2
wandb: 🚀 View run at https://wandb.ai/yinanazhou/xl_512_bs_8_lr_1e06_es_5_lc_True_nr_True_sr_False_stem_False_lemma_False_repeat_2_fold_2/runs/2wcw4f0w
wandb: Run data is saved locally in /project/6002780/yinan/Thesis_MER_Lyrics/lyric-emotion/wandb/run-20220324_052016-2wcw4f0w
wandb: Run `wandb offline` to turn off syncing.
slurmstepd: error: *** JOB 29338303 ON cdr2638 CANCELLED AT 2022-03-24T06:34:56 ***
