Unloading StdEnv/2020

Due to MODULEPATH changes, the following have been reloaded:
  1) mii/1.1.1


The following have been reloaded with a version change:
  1) python/3.8.2 => python/3.7.4

Using base prefix '/cvmfs/soft.computecanada.ca/easybuild/software/2017/Core/python/3.7.4'
New python executable in /localscratch/yinan.29323954.0/env/bin/python
Installing setuptools, pip, wheel...
done.
Ignoring pip: markers 'python_version < "3"' don't match your environment
Looking in links: /cvmfs/soft.computecanada.ca/custom/python/wheelhouse/nix/avx2, /cvmfs/soft.computecanada.ca/custom/python/wheelhouse/nix/generic, /cvmfs/soft.computecanada.ca/custom/python/wheelhouse/generic
Collecting pip
Installing collected packages: pip
  Found existing installation: pip 19.1.1
    Uninstalling pip-19.1.1:
      Successfully uninstalled pip-19.1.1
Successfully installed pip-21.2.3+computecanada
Looking in links: /cvmfs/soft.computecanada.ca/custom/python/wheelhouse/nix/avx2, /cvmfs/soft.computecanada.ca/custom/python/wheelhouse/nix/generic, /cvmfs/soft.computecanada.ca/custom/python/wheelhouse/generic
Processing /cvmfs/soft.computecanada.ca/custom/python/wheelhouse/generic/keras-2.8.0+computecanada-py2.py3-none-any.whl
Processing /cvmfs/soft.computecanada.ca/custom/python/wheelhouse/generic/Keras_Preprocessing-1.1.2+computecanada-py3-none-any.whl
Requirement already satisfied: matplotlib in /cvmfs/soft.computecanada.ca/easybuild/software/2017/Core/scipy-stack/2019a/lib/python3.7/site-packages (from -r requirements.txt (line 3)) (3.0.2)
Processing /cvmfs/soft.computecanada.ca/custom/python/wheelhouse/generic/nltk-3.6.5+computecanada-py3-none-any.whl
Processing /cvmfs/soft.computecanada.ca/custom/python/wheelhouse/generic/scikit_learn-0.22.1+computecanada-cp37-cp37m-linux_x86_64.whl
Processing /cvmfs/soft.computecanada.ca/custom/python/wheelhouse/generic/tensorboard-2.3.0+computecanada-py3-none-any.whl
Processing /cvmfs/soft.computecanada.ca/custom/python/wheelhouse/generic/tensorboard_plugin_wit-1.7.0+computecanada-py3-none-any.whl
Processing /cvmfs/soft.computecanada.ca/custom/python/wheelhouse/generic/tensorflow_gpu-2.3.0+computecanada-cp37-cp37m-linux_x86_64.whl
Processing /cvmfs/soft.computecanada.ca/custom/python/wheelhouse/generic/tensorflow_estimator-2.3.0+computecanada-py2.py3-none-any.whl
Processing /cvmfs/soft.computecanada.ca/custom/python/wheelhouse/generic/tokenizers-0.5.2+computecanada-cp37-cp37m-linux_x86_64.whl
Processing /cvmfs/soft.computecanada.ca/custom/python/wheelhouse/nix/avx2/torch-1.4.0+computecanada-cp37-cp37m-linux_x86_64.whl
Processing /cvmfs/soft.computecanada.ca/custom/python/wheelhouse/generic/torchtext-0.6.0+computecanada-py3-none-any.whl
Processing /cvmfs/soft.computecanada.ca/custom/python/wheelhouse/generic/torchvision-0.8.2+computecanada-cp37-cp37m-linux_x86_64.whl
Processing /cvmfs/soft.computecanada.ca/custom/python/wheelhouse/generic/transformers-2.5.1+computecanada-py3-none-any.whl
Processing /cvmfs/soft.computecanada.ca/custom/python/wheelhouse/generic/urllib3-1.26.7+computecanada-py2.py3-none-any.whl
Processing /cvmfs/soft.computecanada.ca/custom/python/wheelhouse/generic/joblib-1.1.0+computecanada-py2.py3-none-any.whl
Processing /cvmfs/soft.computecanada.ca/custom/python/wheelhouse/generic/tqdm-4.63.0+computecanada-py2.py3-none-any.whl
ERROR: Could not find a version that satisfies the requirement regex>=2021.8.3 (from nltk) (from versions: 2018.1.10+computecanada, 2019.11.1+computecanada, 2020.11.13+computecanada)
ERROR: No matching distribution found for regex>=2021.8.3
Looking in links: /cvmfs/soft.computecanada.ca/custom/python/wheelhouse/nix/avx2, /cvmfs/soft.computecanada.ca/custom/python/wheelhouse/nix/generic, /cvmfs/soft.computecanada.ca/custom/python/wheelhouse/generic
ERROR: Could not find a version that satisfies the requirement numpy==1.20.0+computacanada (from versions: 1.15.0+computecanada, 1.15.2+computecanada, 1.15.4+computecanada, 1.16.0+computecanada, 1.16.2+computecanada, 1.16.3+computecanada, 1.17.4+computecanada, 1.18.1+computecanada, 1.18.4+computecanada, 1.19.1+computecanada, 1.19.2+computecanada, 1.20.2+computecanada)
ERROR: No matching distribution found for numpy==1.20.0+computacanada
Looking in links: /cvmfs/soft.computecanada.ca/custom/python/wheelhouse/nix/avx2, /cvmfs/soft.computecanada.ca/custom/python/wheelhouse/nix/generic, /cvmfs/soft.computecanada.ca/custom/python/wheelhouse/generic
Processing /cvmfs/soft.computecanada.ca/custom/python/wheelhouse/generic/wandb-0.12.5+computecanada-py2.py3-none-any.whl
Processing /cvmfs/soft.computecanada.ca/custom/python/wheelhouse/generic/configparser-5.0.2+computecanada-py3-none-any.whl
Processing /cvmfs/soft.computecanada.ca/custom/python/wheelhouse/generic/yaspin-2.1.0+computecanada-py3-none-any.whl
Requirement already satisfied: python-dateutil>=2.6.1 in /cvmfs/soft.computecanada.ca/easybuild/software/2017/Core/scipy-stack/2019a/lib/python3.7/site-packages (from wandb) (2.7.5)
Processing /cvmfs/soft.computecanada.ca/custom/python/wheelhouse/generic/docker_pycreds-0.4.0+computecanada-py2.py3-none-any.whl
Processing /cvmfs/soft.computecanada.ca/custom/python/wheelhouse/generic/subprocess32-3.5.4+computecanada-py3-none-any.whl
Processing /cvmfs/soft.computecanada.ca/custom/python/wheelhouse/generic/six-1.16.0+computecanada-py2.py3-none-any.whl
Processing /cvmfs/soft.computecanada.ca/custom/python/wheelhouse/generic/psutil-5.7.3+computecanada-cp37-cp37m-linux_x86_64.whl
Processing /cvmfs/soft.computecanada.ca/custom/python/wheelhouse/generic/sentry_sdk-1.5.0+computecanada-py2.py3-none-any.whl
Processing /cvmfs/soft.computecanada.ca/custom/python/wheelhouse/generic/protobuf-3.19.4+computecanada-py2.py3-none-any.whl
Processing /cvmfs/soft.computecanada.ca/custom/python/wheelhouse/generic/pathtools-0.1.2+computecanada-py3-none-any.whl
Processing /cvmfs/soft.computecanada.ca/custom/python/wheelhouse/generic/shortuuid-1.0.1+computecanada-py3-none-any.whl
Processing /cvmfs/soft.computecanada.ca/custom/python/wheelhouse/generic/promise-2.3+computecanada-py3-none-any.whl
Processing /cvmfs/soft.computecanada.ca/custom/python/wheelhouse/generic/PyYAML-5.3.1+computecanada-cp37-cp37m-linux_x86_64.whl
Processing /cvmfs/soft.computecanada.ca/custom/python/wheelhouse/generic/GitPython-3.1.24+computecanada-py3-none-any.whl
Processing /cvmfs/soft.computecanada.ca/custom/python/wheelhouse/generic/click-8.0.4+computecanada-py3-none-any.whl
Requirement already satisfied: requests<3,>=2.0.0 in /cvmfs/soft.computecanada.ca/easybuild/software/2017/Core/scipy-stack/2019a/lib/python3.7/site-packages (from wandb) (2.21.0)
Requirement already satisfied: importlib-metadata in /cvmfs/soft.computecanada.ca/easybuild/software/2017/Core/scipy-stack/2019a/lib/python3.7/site-packages (from Click!=8.0.0,>=7.0->wandb) (0.8)
Processing /cvmfs/soft.computecanada.ca/custom/python/wheelhouse/generic/gitdb-4.0.9+computecanada-py3-none-any.whl
Processing /cvmfs/soft.computecanada.ca/custom/python/wheelhouse/generic/typing_extensions-4.0.1+computecanada-py3-none-any.whl
Processing /cvmfs/soft.computecanada.ca/custom/python/wheelhouse/generic/smmap-5.0.0+computecanada-py3-none-any.whl
Requirement already satisfied: certifi>=2017.4.17 in /cvmfs/soft.computecanada.ca/easybuild/software/2017/Core/scipy-stack/2019a/lib/python3.7/site-packages (from requests<3,>=2.0.0->wandb) (2018.11.29)
Requirement already satisfied: idna<2.9,>=2.5 in /cvmfs/soft.computecanada.ca/easybuild/software/2017/Core/scipy-stack/2019a/lib/python3.7/site-packages (from requests<3,>=2.0.0->wandb) (2.8)
Requirement already satisfied: urllib3<1.25,>=1.21.1 in /cvmfs/soft.computecanada.ca/easybuild/software/2017/Core/scipy-stack/2019a/lib/python3.7/site-packages (from requests<3,>=2.0.0->wandb) (1.24.1)
Requirement already satisfied: chardet<3.1.0,>=3.0.2 in /cvmfs/soft.computecanada.ca/easybuild/software/2017/Core/scipy-stack/2019a/lib/python3.7/site-packages (from requests<3,>=2.0.0->wandb) (3.0.4)
Processing /cvmfs/soft.computecanada.ca/custom/python/wheelhouse/generic/termcolor-1.1.0+computecanada-py3-none-any.whl
Requirement already satisfied: zipp>=0.3.2 in /cvmfs/soft.computecanada.ca/easybuild/software/2017/Core/scipy-stack/2019a/lib/python3.7/site-packages (from importlib-metadata->Click!=8.0.0,>=7.0->wandb) (0.3.3)
Installing collected packages: smmap, typing-extensions, termcolor, six, gitdb, yaspin, subprocess32, shortuuid, sentry-sdk, PyYAML, psutil, protobuf, promise, pathtools, GitPython, docker-pycreds, configparser, Click, wandb
  Attempting uninstall: six
    Found existing installation: six 1.12.0
    Not uninstalling six at /cvmfs/soft.computecanada.ca/easybuild/software/2017/Core/scipy-stack/2019a/lib/python3.7/site-packages, outside environment /localscratch/yinan.29323954.0/env
    Can't uninstall 'six'. No files were found to uninstall.
Successfully installed Click-8.0.4+computecanada GitPython-3.1.24+computecanada PyYAML-5.3.1+computecanada configparser-5.0.2+computecanada docker-pycreds-0.4.0+computecanada gitdb-4.0.9+computecanada pathtools-0.1.2+computecanada promise-2.3+computecanada protobuf-3.19.4+computecanada psutil-5.7.3+computecanada sentry-sdk-1.5.0+computecanada shortuuid-1.0.1+computecanada six-1.16.0+computecanada smmap-5.0.0+computecanada subprocess32-3.5.4+computecanada termcolor-1.1.0+computecanada typing-extensions-4.0.1+computecanada wandb-0.12.5+computecanada yaspin-2.1.0+computecanada
Looking in links: /cvmfs/soft.computecanada.ca/custom/python/wheelhouse/nix/avx2, /cvmfs/soft.computecanada.ca/custom/python/wheelhouse/nix/generic, /cvmfs/soft.computecanada.ca/custom/python/wheelhouse/generic
ERROR: Could not find a version that satisfies the requirement sagemaker (from versions: none)
ERROR: No matching distribution found for sagemaker
Looking in links: /cvmfs/soft.computecanada.ca/custom/python/wheelhouse/nix/avx2, /cvmfs/soft.computecanada.ca/custom/python/wheelhouse/nix/generic, /cvmfs/soft.computecanada.ca/custom/python/wheelhouse/generic
Processing /cvmfs/soft.computecanada.ca/custom/python/wheelhouse/generic/torch-1.9.1+computecanada-cp37-cp37m-linux_x86_64.whl
Requirement already satisfied: typing-extensions in /localscratch/yinan.29323954.0/env/lib/python3.7/site-packages (from torch) (4.0.1+computecanada)
Installing collected packages: torch
Successfully installed torch-1.9.1+computecanada
Looking in links: /cvmfs/soft.computecanada.ca/custom/python/wheelhouse/nix/avx2, /cvmfs/soft.computecanada.ca/custom/python/wheelhouse/nix/generic, /cvmfs/soft.computecanada.ca/custom/python/wheelhouse/generic
Processing /cvmfs/soft.computecanada.ca/custom/python/wheelhouse/generic/transformers-2.5.1+computecanada-py3-none-any.whl
Processing /cvmfs/soft.computecanada.ca/custom/python/wheelhouse/generic/sentencepiece-0.1.91+computecanada-cp37-cp37m-linux_x86_64.whl
Processing /cvmfs/soft.computecanada.ca/custom/python/wheelhouse/generic/boto3-1.21.14+computecanada-py3-none-any.whl
Processing /cvmfs/soft.computecanada.ca/custom/python/wheelhouse/generic/regex-2020.11.13+computecanada-cp37-cp37m-linux_x86_64.whl
Processing /cvmfs/soft.computecanada.ca/custom/python/wheelhouse/generic/sacremoses-0.0.46+computecanada-py3-none-any.whl
Requirement already satisfied: numpy in /cvmfs/soft.computecanada.ca/easybuild/software/2017/Core/scipy-stack/2019a/lib/python3.7/site-packages (from transformers==2.5.1+computecanada) (1.16.0)
Processing /cvmfs/soft.computecanada.ca/custom/python/wheelhouse/generic/tokenizers-0.5.2+computecanada-cp37-cp37m-linux_x86_64.whl
Processing /cvmfs/soft.computecanada.ca/custom/python/wheelhouse/generic/tqdm-4.63.0+computecanada-py2.py3-none-any.whl
Processing /cvmfs/soft.computecanada.ca/custom/python/wheelhouse/generic/filelock-3.4.2+computecanada-py3-none-any.whl
Requirement already satisfied: requests in /cvmfs/soft.computecanada.ca/easybuild/software/2017/Core/scipy-stack/2019a/lib/python3.7/site-packages (from transformers==2.5.1+computecanada) (2.21.0)
Processing /cvmfs/soft.computecanada.ca/custom/python/wheelhouse/generic/jmespath-0.10.0+computecanada-py2.py3-none-any.whl
Processing /cvmfs/soft.computecanada.ca/custom/python/wheelhouse/generic/s3transfer-0.5.1+computecanada-py3-none-any.whl
Processing /cvmfs/soft.computecanada.ca/custom/python/wheelhouse/generic/botocore-1.24.14+computecanada-py3-none-any.whl
Processing /cvmfs/soft.computecanada.ca/custom/python/wheelhouse/generic/urllib3-1.26.8+computecanada-py2.py3-none-any.whl
Requirement already satisfied: python-dateutil<3.0.0,>=2.1 in /cvmfs/soft.computecanada.ca/easybuild/software/2017/Core/scipy-stack/2019a/lib/python3.7/site-packages (from botocore<1.25.0,>=1.24.14->boto3->transformers==2.5.1+computecanada) (2.7.5)
Requirement already satisfied: six>=1.5 in /localscratch/yinan.29323954.0/env/lib/python3.7/site-packages (from python-dateutil<3.0.0,>=2.1->botocore<1.25.0,>=1.24.14->boto3->transformers==2.5.1+computecanada) (1.16.0+computecanada)
Requirement already satisfied: chardet<3.1.0,>=3.0.2 in /cvmfs/soft.computecanada.ca/easybuild/software/2017/Core/scipy-stack/2019a/lib/python3.7/site-packages (from requests->transformers==2.5.1+computecanada) (3.0.4)
Requirement already satisfied: idna<2.9,>=2.5 in /cvmfs/soft.computecanada.ca/easybuild/software/2017/Core/scipy-stack/2019a/lib/python3.7/site-packages (from requests->transformers==2.5.1+computecanada) (2.8)
Requirement already satisfied: certifi>=2017.4.17 in /cvmfs/soft.computecanada.ca/easybuild/software/2017/Core/scipy-stack/2019a/lib/python3.7/site-packages (from requests->transformers==2.5.1+computecanada) (2018.11.29)
Processing /cvmfs/soft.computecanada.ca/custom/python/wheelhouse/generic/requests-2.27.1+computecanada-py2.py3-none-any.whl
Processing /cvmfs/soft.computecanada.ca/custom/python/wheelhouse/generic/charset_normalizer-2.0.12+computecanada-py3-none-any.whl
Requirement already satisfied: click in /localscratch/yinan.29323954.0/env/lib/python3.7/site-packages (from sacremoses->transformers==2.5.1+computecanada) (8.0.4+computecanada)
Processing /cvmfs/soft.computecanada.ca/custom/python/wheelhouse/generic/joblib-1.1.0+computecanada-py2.py3-none-any.whl
Requirement already satisfied: importlib-metadata in /cvmfs/soft.computecanada.ca/easybuild/software/2017/Core/scipy-stack/2019a/lib/python3.7/site-packages (from click->sacremoses->transformers==2.5.1+computecanada) (0.8)
Requirement already satisfied: zipp>=0.3.2 in /cvmfs/soft.computecanada.ca/easybuild/software/2017/Core/scipy-stack/2019a/lib/python3.7/site-packages (from importlib-metadata->click->sacremoses->transformers==2.5.1+computecanada) (0.3.3)
Installing collected packages: urllib3, jmespath, botocore, tqdm, s3transfer, regex, joblib, charset-normalizer, tokenizers, sentencepiece, sacremoses, requests, filelock, boto3, transformers
  Attempting uninstall: urllib3
    Found existing installation: urllib3 1.24.1
    Not uninstalling urllib3 at /cvmfs/soft.computecanada.ca/easybuild/software/2017/Core/scipy-stack/2019a/lib/python3.7/site-packages, outside environment /localscratch/yinan.29323954.0/env
    Can't uninstall 'urllib3'. No files were found to uninstall.
  Attempting uninstall: requests
    Found existing installation: requests 2.21.0
    Not uninstalling requests at /cvmfs/soft.computecanada.ca/easybuild/software/2017/Core/scipy-stack/2019a/lib/python3.7/site-packages, outside environment /localscratch/yinan.29323954.0/env
    Can't uninstall 'requests'. No files were found to uninstall.
Successfully installed boto3-1.21.14+computecanada botocore-1.24.14+computecanada charset-normalizer-2.0.12+computecanada filelock-3.4.2+computecanada jmespath-0.10.0+computecanada joblib-1.1.0+computecanada regex-2020.11.13+computecanada requests-2.27.1+computecanada s3transfer-0.5.1+computecanada sacremoses-0.0.46+computecanada sentencepiece-0.1.91+computecanada tokenizers-0.5.2+computecanada tqdm-4.63.0+computecanada transformers-2.5.1+computecanada urllib3-1.26.8+computecanada
Looking in links: /cvmfs/soft.computecanada.ca/custom/python/wheelhouse/nix/avx2, /cvmfs/soft.computecanada.ca/custom/python/wheelhouse/nix/generic, /cvmfs/soft.computecanada.ca/custom/python/wheelhouse/generic
Processing /cvmfs/soft.computecanada.ca/custom/python/wheelhouse/generic/tensorflow_gpu-2.3.0+computecanada-cp37-cp37m-linux_x86_64.whl
Processing /cvmfs/soft.computecanada.ca/custom/python/wheelhouse/generic/google_pasta-0.2.0+computecanada-py3-none-any.whl
Processing /cvmfs/soft.computecanada.ca/custom/python/wheelhouse/generic/wrapt-1.11.2+computecanada-cp37-cp37m-linux_x86_64.whl
Requirement already satisfied: numpy<1.19.0,>=1.16.0 in /cvmfs/soft.computecanada.ca/easybuild/software/2017/Core/scipy-stack/2019a/lib/python3.7/site-packages (from tensorflow_gpu==2.3.0+computecanada) (1.16.0)
Requirement already satisfied: six>=1.12.0 in /localscratch/yinan.29323954.0/env/lib/python3.7/site-packages (from tensorflow_gpu==2.3.0+computecanada) (1.16.0+computecanada)
Processing /cvmfs/soft.computecanada.ca/custom/python/wheelhouse/generic/tensorflow_estimator-2.3.0+computecanada-py2.py3-none-any.whl
Processing /cvmfs/soft.computecanada.ca/custom/python/wheelhouse/generic/astunparse-1.6.3+computecanada-py2.py3-none-any.whl
Processing /cvmfs/soft.computecanada.ca/custom/python/wheelhouse/generic/Keras_Preprocessing-1.1.2+computecanada-py3-none-any.whl
Processing /cvmfs/soft.computecanada.ca/custom/python/wheelhouse/nix/generic/scipy-1.4.1+computecanada-cp37-cp37m-linux_x86_64.whl
Processing /cvmfs/soft.computecanada.ca/custom/python/wheelhouse/generic/tensorboard-2.8.0+computecanada-py3-none-any.whl
Processing /cvmfs/soft.computecanada.ca/custom/python/wheelhouse/generic/opt_einsum-3.3.0+computecanada-py3-none-any.whl
Requirement already satisfied: protobuf>=3.9.2 in /localscratch/yinan.29323954.0/env/lib/python3.7/site-packages (from tensorflow_gpu==2.3.0+computecanada) (3.19.4+computecanada)
Processing /cvmfs/soft.computecanada.ca/custom/python/wheelhouse/generic/grpcio-1.38.0+computecanada-cp37-cp37m-linux_x86_64.whl
Processing /cvmfs/soft.computecanada.ca/custom/python/wheelhouse/generic/gast-0.3.3+computecanada-py3-none-any.whl
Processing /cvmfs/soft.computecanada.ca/custom/python/wheelhouse/generic/absl_py-1.0.0+computecanada-py3-none-any.whl
Requirement already satisfied: termcolor>=1.1.0 in /localscratch/yinan.29323954.0/env/lib/python3.7/site-packages (from tensorflow_gpu==2.3.0+computecanada) (1.1.0+computecanada)
Processing /cvmfs/soft.computecanada.ca/custom/python/wheelhouse/nix/avx2/h5py-2.10.0+computecanada-cp37-cp37m-linux_x86_64.whl
Requirement already satisfied: wheel>=0.26 in /localscratch/yinan.29323954.0/env/lib/python3.7/site-packages (from tensorflow_gpu==2.3.0+computecanada) (0.33.4)
Requirement already satisfied: setuptools>=41.0.0 in /localscratch/yinan.29323954.0/env/lib/python3.7/site-packages (from tensorboard<3,>=2.3.0->tensorflow_gpu==2.3.0+computecanada) (41.0.1)
Processing /cvmfs/soft.computecanada.ca/custom/python/wheelhouse/generic/tensorboard_plugin_wit-1.8.0+computecanada-py3-none-any.whl
Processing /cvmfs/soft.computecanada.ca/custom/python/wheelhouse/generic/google_auth-2.3.3+computecanada-py2.py3-none-any.whl
Requirement already satisfied: requests<3,>=2.21.0 in /localscratch/yinan.29323954.0/env/lib/python3.7/site-packages (from tensorboard<3,>=2.3.0->tensorflow_gpu==2.3.0+computecanada) (2.27.1+computecanada)
Processing /cvmfs/soft.computecanada.ca/custom/python/wheelhouse/generic/tensorboard_data_server-0.6.1+computecanada-py3-none-linux_x86_64.whl
Processing /cvmfs/soft.computecanada.ca/custom/python/wheelhouse/generic/Werkzeug-2.0.3+computecanada-py3-none-any.whl
Processing /cvmfs/soft.computecanada.ca/custom/python/wheelhouse/generic/Markdown-3.3.6+computecanada-py3-none-any.whl
Processing /cvmfs/soft.computecanada.ca/custom/python/wheelhouse/generic/google_auth_oauthlib-0.4.6+computecanada-py2.py3-none-any.whl
Processing /cvmfs/soft.computecanada.ca/custom/python/wheelhouse/generic/cachetools-4.2.4+computecanada-py3-none-any.whl
Processing /cvmfs/soft.computecanada.ca/custom/python/wheelhouse/generic/rsa-4.8+computecanada-py3-none-any.whl
Processing /cvmfs/soft.computecanada.ca/custom/python/wheelhouse/generic/pyasn1_modules-0.2.8+computecanada-py2.py3-none-any.whl
Processing /cvmfs/soft.computecanada.ca/custom/python/wheelhouse/generic/requests_oauthlib-1.3.0+computecanada-py2.py3-none-any.whl
Processing /cvmfs/soft.computecanada.ca/custom/python/wheelhouse/generic/importlib_metadata-4.10.1+computecanada-py3-none-any.whl
Requirement already satisfied: typing-extensions>=3.6.4 in /localscratch/yinan.29323954.0/env/lib/python3.7/site-packages (from importlib-metadata>=4.4->markdown>=2.6.8->tensorboard<3,>=2.3.0->tensorflow_gpu==2.3.0+computecanada) (4.0.1+computecanada)
Processing /cvmfs/soft.computecanada.ca/custom/python/wheelhouse/generic/zipp-3.7.0+computecanada-py3-none-any.whl
Processing /cvmfs/soft.computecanada.ca/custom/python/wheelhouse/generic/pyasn1-0.4.8+computecanada-py2.py3-none-any.whl
Requirement already satisfied: certifi>=2017.4.17 in /cvmfs/soft.computecanada.ca/easybuild/software/2017/Core/scipy-stack/2019a/lib/python3.7/site-packages (from requests<3,>=2.21.0->tensorboard<3,>=2.3.0->tensorflow_gpu==2.3.0+computecanada) (2018.11.29)
Requirement already satisfied: urllib3<1.27,>=1.21.1 in /localscratch/yinan.29323954.0/env/lib/python3.7/site-packages (from requests<3,>=2.21.0->tensorboard<3,>=2.3.0->tensorflow_gpu==2.3.0+computecanada) (1.26.8+computecanada)
Requirement already satisfied: charset-normalizer~=2.0.0 in /localscratch/yinan.29323954.0/env/lib/python3.7/site-packages (from requests<3,>=2.21.0->tensorboard<3,>=2.3.0->tensorflow_gpu==2.3.0+computecanada) (2.0.12+computecanada)
Requirement already satisfied: idna<4,>=2.5 in /cvmfs/soft.computecanada.ca/easybuild/software/2017/Core/scipy-stack/2019a/lib/python3.7/site-packages (from requests<3,>=2.21.0->tensorboard<3,>=2.3.0->tensorflow_gpu==2.3.0+computecanada) (2.8)
Processing /cvmfs/soft.computecanada.ca/custom/python/wheelhouse/generic/oauthlib-3.1.1+computecanada-py2.py3-none-any.whl
Installing collected packages: pyasn1, zipp, rsa, pyasn1-modules, oauthlib, cachetools, requests-oauthlib, importlib-metadata, google-auth, werkzeug, tensorboard-plugin-wit, tensorboard-data-server, markdown, grpcio, google-auth-oauthlib, absl-py, wrapt, tensorflow-estimator, tensorboard, scipy, opt-einsum, keras-preprocessing, h5py, google-pasta, gast, astunparse, tensorflow-gpu
  Attempting uninstall: pyasn1
    Found existing installation: pyasn1 0.4.3
    Not uninstalling pyasn1 at /cvmfs/soft.computecanada.ca/easybuild/software/2017/Core/scipy-stack/2019a/lib/python3.7/site-packages, outside environment /localscratch/yinan.29323954.0/env
    Can't uninstall 'pyasn1'. No files were found to uninstall.
  Attempting uninstall: zipp
    Found existing installation: zipp 0.3.3
    Not uninstalling zipp at /cvmfs/soft.computecanada.ca/easybuild/software/2017/Core/scipy-stack/2019a/lib/python3.7/site-packages, outside environment /localscratch/yinan.29323954.0/env
    Can't uninstall 'zipp'. No files were found to uninstall.
  Attempting uninstall: importlib-metadata
    Found existing installation: importlib-metadata 0.8
    Not uninstalling importlib-metadata at /cvmfs/soft.computecanada.ca/easybuild/software/2017/Core/scipy-stack/2019a/lib/python3.7/site-packages, outside environment /localscratch/yinan.29323954.0/env
    Can't uninstall 'importlib-metadata'. No files were found to uninstall.
  Attempting uninstall: scipy
    Found existing installation: scipy 1.2.0
    Not uninstalling scipy at /cvmfs/soft.computecanada.ca/easybuild/software/2017/Core/scipy-stack/2019a/lib/python3.7/site-packages, outside environment /localscratch/yinan.29323954.0/env
    Can't uninstall 'scipy'. No files were found to uninstall.
Successfully installed absl-py-1.0.0+computecanada astunparse-1.6.3+computecanada cachetools-4.2.4+computecanada gast-0.3.3+computecanada google-auth-2.3.3+computecanada google-auth-oauthlib-0.4.6+computecanada google-pasta-0.2.0+computecanada grpcio-1.38.0+computecanada h5py-2.10.0+computecanada importlib-metadata-4.10.1+computecanada keras-preprocessing-1.1.2+computecanada markdown-3.3.6+computecanada oauthlib-3.1.1+computecanada opt-einsum-3.3.0+computecanada pyasn1-0.4.8+computecanada pyasn1-modules-0.2.8+computecanada requests-oauthlib-1.3.0+computecanada rsa-4.8+computecanada scipy-1.4.1+computecanada tensorboard-2.8.0+computecanada tensorboard-data-server-0.6.1+computecanada tensorboard-plugin-wit-1.8.0+computecanada tensorflow-estimator-2.3.0+computecanada tensorflow-gpu-2.3.0+computecanada werkzeug-2.0.3+computecanada wrapt-1.11.2+computecanada zipp-3.7.0+computecanada
Looking in links: /cvmfs/soft.computecanada.ca/custom/python/wheelhouse/nix/avx2, /cvmfs/soft.computecanada.ca/custom/python/wheelhouse/nix/generic, /cvmfs/soft.computecanada.ca/custom/python/wheelhouse/generic
Processing /cvmfs/soft.computecanada.ca/custom/python/wheelhouse/generic/keras-2.8.0+computecanada-py2.py3-none-any.whl
Installing collected packages: Keras
Successfully installed Keras-2.8.0+computecanada
Looking in links: /cvmfs/soft.computecanada.ca/custom/python/wheelhouse/nix/avx2, /cvmfs/soft.computecanada.ca/custom/python/wheelhouse/nix/generic, /cvmfs/soft.computecanada.ca/custom/python/wheelhouse/generic
Processing /cvmfs/soft.computecanada.ca/custom/python/wheelhouse/generic/urllib3-1.26.7+computecanada-py2.py3-none-any.whl
Installing collected packages: urllib3
  Attempting uninstall: urllib3
    Found existing installation: urllib3 1.26.8+computecanada
    Uninstalling urllib3-1.26.8+computecanada:
      Successfully uninstalled urllib3-1.26.8+computecanada
Successfully installed urllib3-1.26.7+computecanada
Looking in links: /cvmfs/soft.computecanada.ca/custom/python/wheelhouse/nix/avx2, /cvmfs/soft.computecanada.ca/custom/python/wheelhouse/nix/generic, /cvmfs/soft.computecanada.ca/custom/python/wheelhouse/generic
Processing /cvmfs/soft.computecanada.ca/custom/python/wheelhouse/generic/nltk-3.7+computecanada-py3-none-any.whl
Requirement already satisfied: joblib in /localscratch/yinan.29323954.0/env/lib/python3.7/site-packages (from nltk) (1.1.0+computecanada)
Requirement already satisfied: tqdm in /localscratch/yinan.29323954.0/env/lib/python3.7/site-packages (from nltk) (4.63.0+computecanada)
Requirement already satisfied: click in /localscratch/yinan.29323954.0/env/lib/python3.7/site-packages (from nltk) (8.0.4+computecanada)
Processing /cvmfs/soft.computecanada.ca/custom/python/wheelhouse/generic/nltk-3.6.5+computecanada-py3-none-any.whl
Processing /cvmfs/soft.computecanada.ca/custom/python/wheelhouse/generic/nltk-3.6.3+computecanada-py3-none-any.whl
Requirement already satisfied: regex in /localscratch/yinan.29323954.0/env/lib/python3.7/site-packages (from nltk) (2020.11.13+computecanada)
Requirement already satisfied: importlib-metadata in /localscratch/yinan.29323954.0/env/lib/python3.7/site-packages (from click->nltk) (4.10.1+computecanada)
Requirement already satisfied: zipp>=0.5 in /localscratch/yinan.29323954.0/env/lib/python3.7/site-packages (from importlib-metadata->click->nltk) (3.7.0+computecanada)
Requirement already satisfied: typing-extensions>=3.6.4 in /localscratch/yinan.29323954.0/env/lib/python3.7/site-packages (from importlib-metadata->click->nltk) (4.0.1+computecanada)
Installing collected packages: nltk
Successfully installed nltk-3.6.3+computecanada
Looking in links: /cvmfs/soft.computecanada.ca/custom/python/wheelhouse/nix/avx2, /cvmfs/soft.computecanada.ca/custom/python/wheelhouse/nix/generic, /cvmfs/soft.computecanada.ca/custom/python/wheelhouse/generic
Processing /cvmfs/soft.computecanada.ca/custom/python/wheelhouse/generic/scikit_learn-0.22.1+computecanada-cp37-cp37m-linux_x86_64.whl
Requirement already satisfied: joblib>=0.11 in /localscratch/yinan.29323954.0/env/lib/python3.7/site-packages (from scikit-learn==0.22.1) (1.1.0+computecanada)
Requirement already satisfied: numpy>=1.11.0 in /cvmfs/soft.computecanada.ca/easybuild/software/2017/Core/scipy-stack/2019a/lib/python3.7/site-packages (from scikit-learn==0.22.1) (1.16.0)
Requirement already satisfied: scipy>=0.17.0 in /localscratch/yinan.29323954.0/env/lib/python3.7/site-packages (from scikit-learn==0.22.1) (1.4.1+computecanada)
Installing collected packages: scikit-learn
Successfully installed scikit-learn-0.22.1+computecanada
Looking in links: /cvmfs/soft.computecanada.ca/custom/python/wheelhouse/nix/avx2, /cvmfs/soft.computecanada.ca/custom/python/wheelhouse/nix/generic, /cvmfs/soft.computecanada.ca/custom/python/wheelhouse/generic
Requirement already satisfied: tokenizers==0.5.2 in /localscratch/yinan.29323954.0/env/lib/python3.7/site-packages (0.5.2+computecanada)
wandb: Appending key for api.wandb.ai to your netrc file: /home/yinan/.netrc
Starting Task
2022-03-24 01:07:52.503791: I tensorflow/stream_executor/platform/default/dso_loader.cc:48] Successfully opened dynamic library libcudart.so.10.1
[nltk_data] Downloading package stopwords to /home/yinan/nltk_data...
[nltk_data]   Package stopwords is already up-to-date!
[nltk_data] Downloading package wordnet to /home/yinan/nltk_data...
[nltk_data]   Package wordnet is already up-to-date!
wandb: Currently logged in as: yinanazhou (use `wandb login --relogin` to force relogin)
wandb: wandb version 0.12.11 is available!  To upgrade, please run:
wandb:  $ pip install wandb --upgrade
2022-03-24 01:08:04.713531: I tensorflow/stream_executor/platform/default/dso_loader.cc:48] Successfully opened dynamic library libcudart.so.10.1
wandb: Tracking run with wandb version 0.12.5
wandb: Syncing run quiet-puddle-1
wandb: ⭐️ View project at https://wandb.ai/yinanazhou/xl_512_bs_8_lr_1e06_es_10_lc_True_nr_True_sr_False_stem_False_lemma_False_repeat_1_fold_1
wandb: 🚀 View run at https://wandb.ai/yinanazhou/xl_512_bs_8_lr_1e06_es_10_lc_True_nr_True_sr_False_stem_False_lemma_False_repeat_1_fold_1/runs/304w547c
wandb: Run data is saved locally in /project/6002780/yinan/Thesis_MER_Lyrics/lyric-emotion/wandb/run-20220324_010802-304w547c
wandb: Run `wandb offline` to turn off syncing.

Validation loss decreased (inf --> 1.439705).  Saving model ...
Validation loss decreased (1.439705 --> 1.419512).  Saving model ...
Validation loss decreased (1.419512 --> 1.402896).  Saving model ...
Validation loss decreased (1.402896 --> 1.389535).  Saving model ...
Validation loss decreased (1.389535 --> 1.379558).  Saving model ...
Validation loss decreased (1.379558 --> 1.370725).  Saving model ...
Validation loss decreased (1.370725 --> 1.364060).  Saving model ...
Validation loss decreased (1.364060 --> 1.358288).  Saving model ...
Validation loss decreased (1.358288 --> 1.352618).  Saving model ...
Validation loss decreased (1.352618 --> 1.347247).  Saving model ...
Validation loss decreased (1.347247 --> 1.341469).  Saving model ...
Validation loss decreased (1.341469 --> 1.336687).  Saving model ...
Validation loss decreased (1.336687 --> 1.331722).  Saving model ...
Validation loss decreased (1.331722 --> 1.326793).  Saving model ...
Validation loss decreased (1.326793 --> 1.321442).  Saving model ...
Validation loss decreased (1.321442 --> 1.317452).  Saving model ...
Validation loss decreased (1.317452 --> 1.311851).  Saving model ...
Validation loss decreased (1.311851 --> 1.305910).  Saving model ...
Validation loss decreased (1.305910 --> 1.300498).  Saving model ...
Validation loss decreased (1.300498 --> 1.294612).  Saving model ...
Validation loss decreased (1.294612 --> 1.289088).  Saving model ...
Validation loss decreased (1.289088 --> 1.282033).  Saving model ...
Validation loss decreased (1.282033 --> 1.278490).  Saving model ...
Validation loss decreased (1.278490 --> 1.271101).  Saving model ...
Validation loss decreased (1.271101 --> 1.265703).  Saving model ...
Validation loss decreased (1.265703 --> 1.261029).  Saving model ...
Validation loss decreased (1.261029 --> 1.254424).  Saving model ...
Validation loss decreased (1.254424 --> 1.250263).  Saving model ...
Validation loss decreased (1.250263 --> 1.247004).  Saving model ...
Validation loss decreased (1.247004 --> 1.245395).  Saving model ...
Validation loss decreased (1.245395 --> 1.242729).  Saving model ...
Validation loss decreased (1.242729 --> 1.237397).  Saving model ...
Validation loss decreased (1.237397 --> 1.235904).  Saving model ...
Validation loss decreased (1.235904 --> 1.230276).  Saving model ...
Validation loss decreased (1.230276 --> 1.227219).  Saving model ...
Validation loss decreased (1.227219 --> 1.220999).  Saving model ...
Validation loss decreased (1.220999 --> 1.215459).  Saving model ...
Validation loss decreased (1.215459 --> 1.214406).  Saving model ...
Validation loss decreased (1.214406 --> 1.209761).  Saving model ...
Validation loss decreased (1.209761 --> 1.208001).  Saving model ...
Validation loss decreased (1.208001 --> 1.201319).  Saving model ...
Validation loss decreased (1.201319 --> 1.197031).  Saving model ...
Validation loss decreased (1.197031 --> 1.194019).  Saving model ...
Validation loss decreased (1.194019 --> 1.193997).  Saving model ...
Validation loss decreased (1.193997 --> 1.189291).  Saving model ...
Validation loss decreased (1.189291 --> 1.186797).  Saving model ...
Validation loss decreased (1.186797 --> 1.185167).  Saving model ...
EarlyStopping counter: 1 out of 10.0
Validation loss decreased (1.185167 --> 1.179282).  Saving model ...
Validation loss decreased (1.179282 --> 1.179126).  Saving model ...
Validation loss decreased (1.179126 --> 1.172249).  Saving model ...
Validation loss decreased (1.172249 --> 1.169561).  Saving model ...
Validation loss decreased (1.169561 --> 1.168631).  Saving model ...
Validation loss decreased (1.168631 --> 1.165754).  Saving model ...
Validation loss decreased (1.165754 --> 1.165563).  Saving model ...
Validation loss decreased (1.165563 --> 1.159924).  Saving model ...
Validation loss decreased (1.159924 --> 1.154075).  Saving model ...
Validation loss decreased (1.154075 --> 1.149934).  Saving model ...
Validation loss decreased (1.149934 --> 1.144026).  Saving model ...
EarlyStopping counter: 1 out of 10.0
Validation loss decreased (1.144026 --> 1.141895).  Saving model ...
Validation loss decreased (1.141895 --> 1.139391).  Saving model ...
Validation loss decreased (1.139391 --> 1.134637).  Saving model ...
EarlyStopping counter: 1 out of 10.0
EarlyStopping counter: 2 out of 10.0
Validation loss decreased (1.134637 --> 1.130837).  Saving model ...
Validation loss decreased (1.130837 --> 1.128263).  Saving model ...
Validation loss decreased (1.128263 --> 1.122229).  Saving model ...
Validation loss decreased (1.122229 --> 1.121355).  Saving model ...
Validation loss decreased (1.121355 --> 1.119745).  Saving model ...
Validation loss decreased (1.119745 --> 1.113369).  Saving model ...
Validation loss decreased (1.113369 --> 1.111985).  Saving model ...
Validation loss decreased (1.111985 --> 1.111388).  Saving model ...
Validation loss decreased (1.111388 --> 1.108078).  Saving model ...
Validation loss decreased (1.108078 --> 1.104047).  Saving model ...
Validation loss decreased (1.104047 --> 1.103267).  Saving model ...
Validation loss decreased (1.103267 --> 1.102833).  Saving model ...
Validation loss decreased (1.102833 --> 1.098015).  Saving model ...
Validation loss decreased (1.098015 --> 1.092954).  Saving model ...
Validation loss decreased (1.092954 --> 1.091071).  Saving model ...
EarlyStopping counter: 1 out of 10.0
EarlyStopping counter: 2 out of 10.0
EarlyStopping counter: 3 out of 10.0
Validation loss decreased (1.091071 --> 1.088426).  Saving model ...
Validation loss decreased (1.088426 --> 1.086415).  Saving model ...
Validation loss decreased (1.086415 --> 1.081795).  Saving model ...
Validation loss decreased (1.081795 --> 1.076227).  Saving model ...
EarlyStopping counter: 1 out of 10.0
EarlyStopping counter: 2 out of 10.0
EarlyStopping counter: 3 out of 10.0
Validation loss decreased (1.076227 --> 1.076158).  Saving model ...
Validation loss decreased (1.076158 --> 1.075998).  Saving model ...
Validation loss decreased (1.075998 --> 1.073468).  Saving model ...
EarlyStopping counter: 1 out of 10.0
EarlyStopping counter: 2 out of 10.0
Validation loss decreased (1.073468 --> 1.071521).  Saving model ...
Validation loss decreased (1.071521 --> 1.070522).  Saving model ...
Validation loss decreased (1.070522 --> 1.063458).  Saving model ...
Validation loss decreased (1.063458 --> 1.062997).  Saving model ...
EarlyStopping counter: 1 out of 10.0
EarlyStopping counter: 2 out of 10.0
Validation loss decreased (1.062997 --> 1.058527).  Saving model ...
Validation loss decreased (1.058527 --> 1.057909).  Saving model ...
Validation loss decreased (1.057909 --> 1.056703).  Saving model ...
Validation loss decreased (1.056703 --> 1.055632).  Saving model ...
Validation loss decreased (1.055632 --> 1.052692).  Saving model ...
Validation loss decreased (1.052692 --> 1.052595).  Saving model ...
Validation loss decreased (1.052595 --> 1.049691).  Saving model ...
Validation loss decreased (1.049691 --> 1.047494).  Saving model ...
Validation loss decreased (1.047494 --> 1.044458).  Saving model ...
EarlyStopping counter: 1 out of 10.0
EarlyStopping counter: 2 out of 10.0
EarlyStopping counter: 3 out of 10.0
EarlyStopping counter: 4 out of 10.0
EarlyStopping counter: 5 out of 10.0
Validation loss decreased (1.044458 --> 1.043136).  Saving model ...
Validation loss decreased (1.043136 --> 1.038603).  Saving model ...
Validation loss decreased (1.038603 --> 1.036479).  Saving model ...
Validation loss decreased (1.036479 --> 1.034389).  Saving model ...
Validation loss decreased (1.034389 --> 1.031973).  Saving model ...
EarlyStopping counter: 1 out of 10.0
Validation loss decreased (1.031973 --> 1.031230).  Saving model ...
Validation loss decreased (1.031230 --> 1.027849).  Saving model ...
EarlyStopping counter: 1 out of 10.0
Validation loss decreased (1.027849 --> 1.026845).  Saving model ...
Validation loss decreased (1.026845 --> 1.026224).  Saving model ...
EarlyStopping counter: 1 out of 10.0
EarlyStopping counter: 2 out of 10.0
EarlyStopping counter: 3 out of 10.0
Validation loss decreased (1.026224 --> 1.024811).  Saving model ...
Validation loss decreased (1.024811 --> 1.024381).  Saving model ...
EarlyStopping counter: 1 out of 10.0
Validation loss decreased (1.024381 --> 1.021788).  Saving model ...
Validation loss decreased (1.021788 --> 1.020333).  Saving model ...
EarlyStopping counter: 1 out of 10.0
EarlyStopping counter: 2 out of 10.0
EarlyStopping counter: 3 out of 10.0
Validation loss decreased (1.020333 --> 1.018223).  Saving model ...
Validation loss decreased (1.018223 --> 1.018061).  Saving model ...
EarlyStopping counter: 1 out of 10.0
EarlyStopping counter: 2 out of 10.0
EarlyStopping counter: 3 out of 10.0
EarlyStopping counter: 4 out of 10.0
EarlyStopping counter: 5 out of 10.0
Validation loss decreased (1.018061 --> 1.014636).  Saving model ...
Validation loss decreased (1.014636 --> 1.013544).  Saving model ...
EarlyStopping counter: 1 out of 10.0
EarlyStopping counter: 2 out of 10.0
EarlyStopping counter: 3 out of 10.0
Validation loss decreased (1.013544 --> 1.012678).  Saving model ...
Validation loss decreased (1.012678 --> 1.010186).  Saving model ...
EarlyStopping counter: 1 out of 10.0
Validation loss decreased (1.010186 --> 1.010108).  Saving model ...
EarlyStopping counter: 1 out of 10.0
Validation loss decreased (1.010108 --> 1.009077).  Saving model ...
Validation loss decreased (1.009077 --> 1.005800).  Saving model ...
EarlyStopping counter: 1 out of 10.0
EarlyStopping counter: 2 out of 10.0
EarlyStopping counter: 3 out of 10.0
EarlyStopping counter: 4 out of 10.0
EarlyStopping counter: 5 out of 10.0
EarlyStopping counter: 6 out of 10.0
EarlyStopping counter: 7 out of 10.0
EarlyStopping counter: 8 out of 10.0
EarlyStopping counter: 9 out of 10.0
EarlyStopping counter: 10 out of 10.0
/localscratch/yinan.29323954.0/env/lib/python3.7/site-packages/torch/nn/functional.py:1794: UserWarning: nn.functional.tanh is deprecated. Use torch.tanh instead.
  warnings.warn("nn.functional.tanh is deprecated. Use torch.tanh instead.")
/localscratch/yinan.29323954.0/env/lib/python3.7/site-packages/transformers/optimization.py:155: UserWarning: This overload of add_ is deprecated:
	add_(Number alpha, Tensor other)
Consider using one of the following signatures instead:
	add_(Tensor other, *, Number alpha) (Triggered internally at  ../torch/csrc/utils/python_arg_parser.cpp:1025.)
  exp_avg.mul_(beta1).add_(1.0 - beta1, grad)
wandb: Waiting for W&B process to finish, PID 26819... (success).
wandb: - 0.00MB of 0.00MB uploaded (0.00MB deduped)wandb: \ 0.00MB of 0.00MB uploaded (0.00MB deduped)wandb: | 0.00MB of 0.00MB uploaded (0.00MB deduped)wandb: / 0.00MB of 0.00MB uploaded (0.00MB deduped)wandb: - 0.00MB of 0.00MB uploaded (0.00MB deduped)wandb: \ 0.00MB of 0.00MB uploaded (0.00MB deduped)wandb: | 0.00MB of 0.00MB uploaded (0.00MB deduped)wandb: / 0.00MB of 0.00MB uploaded (0.00MB deduped)wandb: - 0.00MB of 0.00MB uploaded (0.00MB deduped)wandb: \ 0.00MB of 0.00MB uploaded (0.00MB deduped)wandb: | 0.00MB of 0.00MB uploaded (0.00MB deduped)wandb: / 0.00MB of 0.00MB uploaded (0.00MB deduped)wandb: - 0.00MB of 0.00MB uploaded (0.00MB deduped)wandb: \ 0.00MB of 0.00MB uploaded (0.00MB deduped)wandb: | 0.00MB of 0.00MB uploaded (0.00MB deduped)wandb: / 0.00MB of 0.00MB uploaded (0.00MB deduped)wandb: - 0.00MB of 0.00MB uploaded (0.00MB deduped)wandb:                                                                                
wandb: Run history:
wandb:     e_F1 ▁▂▄▄▅▅▅▅▅▆▆▆▆▆▆▆▆▆▇▇▇▇▇▇▇▇████▇█████████
wandb:   e_loss █▇▇▆▆▆▅▅▅▅▄▄▄▄▃▃▃▃▃▂▂▂▂▂▂▂▂▂▂▁▁▁▁▁▁▁▁▁▁▁
wandb:     t_F1 ▁▂▂▃▃▄▄▄▅▅▅▅▅▅▆▆▅▆▅▆▇▆▇▇▇▇▇▇▇▇▇▇▇▇▇█████
wandb:   t_loss █▇█▇▇▆▆▆▆▅▅▅▄▅▄▄▄▄▄▃▃▃▃▃▂▂▂▂▂▂▂▂▂▂▁▁▁▁▁▁
wandb: 
wandb: Run summary:
wandb:     e_F1 57.25595
wandb:   e_loss 1.01565
wandb:     t_F1 74.0466
wandb:   t_loss 0.69737
wandb: 
wandb: Synced 4 W&B file(s), 0 media file(s), 0 artifact file(s) and 0 other file(s)
wandb: Synced quiet-puddle-1: https://wandb.ai/yinanazhou/xl_512_bs_8_lr_1e06_es_10_lc_True_nr_True_sr_False_stem_False_lemma_False_repeat_1_fold_1/runs/304w547c
wandb: Find logs at: ./wandb/run-20220324_010802-304w547c/logs/debug.log
wandb: 

wandb: wandb version 0.12.11 is available!  To upgrade, please run:
wandb:  $ pip install wandb --upgrade
2022-03-24 02:54:33.813783: I tensorflow/stream_executor/platform/default/dso_loader.cc:48] Successfully opened dynamic library libcudart.so.10.1
wandb: Tracking run with wandb version 0.12.5
wandb: Syncing run celestial-monkey-1
wandb: ⭐️ View project at https://wandb.ai/yinanazhou/xl_512_bs_8_lr_1e06_es_10_lc_True_nr_True_sr_False_stem_False_lemma_False_repeat_1_fold_2
wandb: 🚀 View run at https://wandb.ai/yinanazhou/xl_512_bs_8_lr_1e06_es_10_lc_True_nr_True_sr_False_stem_False_lemma_False_repeat_1_fold_2/runs/2dlqzs36
wandb: Run data is saved locally in /project/6002780/yinan/Thesis_MER_Lyrics/lyric-emotion/wandb/run-20220324_025431-2dlqzs36
wandb: Run `wandb offline` to turn off syncing.

Validation loss decreased (inf --> 1.514618).  Saving model ...
Validation loss decreased (1.514618 --> 1.466998).  Saving model ...
Validation loss decreased (1.466998 --> 1.437521).  Saving model ...
Validation loss decreased (1.437521 --> 1.420343).  Saving model ...
Validation loss decreased (1.420343 --> 1.409124).  Saving model ...
Validation loss decreased (1.409124 --> 1.401703).  Saving model ...
Validation loss decreased (1.401703 --> 1.396382).  Saving model ...
Validation loss decreased (1.396382 --> 1.391626).  Saving model ...
Validation loss decreased (1.391626 --> 1.387137).  Saving model ...
Validation loss decreased (1.387137 --> 1.382839).  Saving model ...
Validation loss decreased (1.382839 --> 1.378801).  Saving model ...
Validation loss decreased (1.378801 --> 1.372687).  Saving model ...
Validation loss decreased (1.372687 --> 1.367986).  Saving model ...
Validation loss decreased (1.367986 --> 1.363603).  Saving model ...
Validation loss decreased (1.363603 --> 1.358547).  Saving model ...
Validation loss decreased (1.358547 --> 1.353940).  Saving model ...
Validation loss decreased (1.353940 --> 1.348383).  Saving model ...
Validation loss decreased (1.348383 --> 1.343722).  Saving model ...
Validation loss decreased (1.343722 --> 1.338779).  Saving model ...
Validation loss decreased (1.338779 --> 1.333652).  Saving model ...
Validation loss decreased (1.333652 --> 1.328639).  Saving model ...
Validation loss decreased (1.328639 --> 1.323374).  Saving model ...
Validation loss decreased (1.323374 --> 1.317826).  Saving model ...
Validation loss decreased (1.317826 --> 1.312511).  Saving model ...
Validation loss decreased (1.312511 --> 1.306750).  Saving model ...
Validation loss decreased (1.306750 --> 1.300561).  Saving model ...
Validation loss decreased (1.300561 --> 1.294904).  Saving model ...
Validation loss decreased (1.294904 --> 1.288768).  Saving model ...
Validation loss decreased (1.288768 --> 1.282928).  Saving model ...
Validation loss decreased (1.282928 --> 1.277279).  Saving model ...
Validation loss decreased (1.277279 --> 1.271486).  Saving model ...
Validation loss decreased (1.271486 --> 1.265372).  Saving model ...
Validation loss decreased (1.265372 --> 1.259242).  Saving model ...
Validation loss decreased (1.259242 --> 1.251859).  Saving model ...
Validation loss decreased (1.251859 --> 1.245584).  Saving model ...
Validation loss decreased (1.245584 --> 1.239496).  Saving model ...
Validation loss decreased (1.239496 --> 1.233419).  Saving model ...
Validation loss decreased (1.233419 --> 1.227286).  Saving model ...
Validation loss decreased (1.227286 --> 1.221122).  Saving model ...
Validation loss decreased (1.221122 --> 1.214986).  Saving model ...
Validation loss decreased (1.214986 --> 1.208963).  Saving model ...
Validation loss decreased (1.208963 --> 1.201599).  Saving model ...
Validation loss decreased (1.201599 --> 1.195010).  Saving model ...
Validation loss decreased (1.195010 --> 1.187766).  Saving model ...
Validation loss decreased (1.187766 --> 1.180848).  Saving model ...
Validation loss decreased (1.180848 --> 1.173891).  Saving model ...
Validation loss decreased (1.173891 --> 1.167473).  Saving model ...
Validation loss decreased (1.167473 --> 1.160826).  Saving model ...
Validation loss decreased (1.160826 --> 1.154631).  Saving model ...
Validation loss decreased (1.154631 --> 1.148348).  Saving model ...
Validation loss decreased (1.148348 --> 1.142012).  Saving model ...
Validation loss decreased (1.142012 --> 1.135753).  Saving model ...
Validation loss decreased (1.135753 --> 1.129300).  Saving model ...
Validation loss decreased (1.129300 --> 1.123560).  Saving model ...
Validation loss decreased (1.123560 --> 1.117719).  Saving model ...
Validation loss decreased (1.117719 --> 1.111657).  Saving model ...
Validation loss decreased (1.111657 --> 1.106734).  Saving model ...
Validation loss decreased (1.106734 --> 1.100771).  Saving model ...
Validation loss decreased (1.100771 --> 1.095014).  Saving model ...
Validation loss decreased (1.095014 --> 1.089366).  Saving model ...
Validation loss decreased (1.089366 --> 1.084392).  Saving model ...
Validation loss decreased (1.084392 --> 1.079370).  Saving model ...
Validation loss decreased (1.079370 --> 1.073657).  Saving model ...
Validation loss decreased (1.073657 --> 1.068614).  Saving model ...
Validation loss decreased (1.068614 --> 1.064185).  Saving model ...
Validation loss decreased (1.064185 --> 1.060298).  Saving model ...
Validation loss decreased (1.060298 --> 1.056838).  Saving model ...
Validation loss decreased (1.056838 --> 1.051922).  Saving model ...
Validation loss decreased (1.051922 --> 1.047396).  Saving model ...
Validation loss decreased (1.047396 --> 1.043511).  Saving model ...
Validation loss decreased (1.043511 --> 1.039340).  Saving model ...
Validation loss decreased (1.039340 --> 1.035369).  Saving model ...
Validation loss decreased (1.035369 --> 1.030980).  Saving model ...
Validation loss decreased (1.030980 --> 1.027092).  Saving model ...
Validation loss decreased (1.027092 --> 1.023860).  Saving model ...
Validation loss decreased (1.023860 --> 1.020216).  Saving model ...
Validation loss decreased (1.020216 --> 1.016997).  Saving model ...
Validation loss decreased (1.016997 --> 1.013192).  Saving model ...
Validation loss decreased (1.013192 --> 1.009220).  Saving model ...
Validation loss decreased (1.009220 --> 1.006354).  Saving model ...
Validation loss decreased (1.006354 --> 1.002380).  Saving model ...
Validation loss decreased (1.002380 --> 0.999636).  Saving model ...
Validation loss decreased (0.999636 --> 0.996106).  Saving model ...
Validation loss decreased (0.996106 --> 0.993826).  Saving model ...
Validation loss decreased (0.993826 --> 0.990690).  Saving model ...
Validation loss decreased (0.990690 --> 0.987998).  Saving model ...
Validation loss decreased (0.987998 --> 0.985171).  Saving model ...
Validation loss decreased (0.985171 --> 0.982713).  Saving model ...
Validation loss decreased (0.982713 --> 0.979643).  Saving model ...
Validation loss decreased (0.979643 --> 0.977568).  Saving model ...
Validation loss decreased (0.977568 --> 0.975008).  Saving model ...
Validation loss decreased (0.975008 --> 0.972364).  Saving model ...
Validation loss decreased (0.972364 --> 0.970005).  Saving model ...
Validation loss decreased (0.970005 --> 0.967830).  Saving model ...
Validation loss decreased (0.967830 --> 0.966047).  Saving model ...
Validation loss decreased (0.966047 --> 0.964214).  Saving model ...
Validation loss decreased (0.964214 --> 0.962546).  Saving model ...
Validation loss decreased (0.962546 --> 0.960855).  Saving model ...
Validation loss decreased (0.960855 --> 0.959122).  Saving model ...
Validation loss decreased (0.959122 --> 0.956910).  Saving model ...
Validation loss decreased (0.956910 --> 0.954617).  Saving model ...
Validation loss decreased (0.954617 --> 0.951901).  Saving model ...
Validation loss decreased (0.951901 --> 0.951240).  Saving model ...
Validation loss decreased (0.951240 --> 0.949446).  Saving model ...
Validation loss decreased (0.949446 --> 0.947682).  Saving model ...
Validation loss decreased (0.947682 --> 0.946200).  Saving model ...
Validation loss decreased (0.946200 --> 0.944776).  Saving model ...
Validation loss decreased (0.944776 --> 0.942822).  Saving model ...
Validation loss decreased (0.942822 --> 0.942686).  Saving model ...
Validation loss decreased (0.942686 --> 0.940969).  Saving model ...
Validation loss decreased (0.940969 --> 0.939342).  Saving model ...
Validation loss decreased (0.939342 --> 0.939107).  Saving model ...
Validation loss decreased (0.939107 --> 0.938453).  Saving model ...
Validation loss decreased (0.938453 --> 0.937008).  Saving model ...
Validation loss decreased (0.937008 --> 0.936868).  Saving model ...
Validation loss decreased (0.936868 --> 0.936277).  Saving model ...
Validation loss decreased (0.936277 --> 0.935002).  Saving model ...
Validation loss decreased (0.935002 --> 0.934052).  Saving model ...
Validation loss decreased (0.934052 --> 0.933034).  Saving model ...
EarlyStopping counter: 1 out of 10.0
Validation loss decreased (0.933034 --> 0.932830).  Saving model ...
Validation loss decreased (0.932830 --> 0.930085).  Saving model ...
Validation loss decreased (0.930085 --> 0.929448).  Saving model ...
Validation loss decreased (0.929448 --> 0.927396).  Saving model ...
Validation loss decreased (0.927396 --> 0.927131).  Saving model ...
EarlyStopping counter: 1 out of 10.0
EarlyStopping counter: 2 out of 10.0
EarlyStopping counter: 3 out of 10.0
EarlyStopping counter: 4 out of 10.0
EarlyStopping counter: 5 out of 10.0
Validation loss decreased (0.927131 --> 0.926099).  Saving model ...
Validation loss decreased (0.926099 --> 0.925973).  Saving model ...
Validation loss decreased (0.925973 --> 0.925555).  Saving model ...
Validation loss decreased (0.925555 --> 0.925442).  Saving model ...
EarlyStopping counter: 1 out of 10.0
Validation loss decreased (0.925442 --> 0.924583).  Saving model ...
EarlyStopping counter: 1 out of 10.0
Validation loss decreased (0.924583 --> 0.923435).  Saving model ...
EarlyStopping counter: 1 out of 10.0
Validation loss decreased (0.923435 --> 0.922611).  Saving model ...
Validation loss decreased (0.922611 --> 0.922257).  Saving model ...
EarlyStopping counter: 1 out of 10.0
EarlyStopping counter: 2 out of 10.0
EarlyStopping counter: 3 out of 10.0
Validation loss decreased (0.922257 --> 0.922254).  Saving model ...
EarlyStopping counter: 1 out of 10.0
Validation loss decreased (0.922254 --> 0.921903).  Saving model ...
EarlyStopping counter: 1 out of 10.0
EarlyStopping counter: 2 out of 10.0
EarlyStopping counter: 3 out of 10.0
EarlyStopping counter: 4 out of 10.0
EarlyStopping counter: 5 out of 10.0
EarlyStopping counter: 6 out of 10.0
EarlyStopping counter: 7 out of 10.0
EarlyStopping counter: 8 out of 10.0
EarlyStopping counter: 9 out of 10.0
EarlyStopping counter: 10 out of 10.0
/localscratch/yinan.29323954.0/env/lib/python3.7/site-packages/torch/nn/functional.py:1794: UserWarning: nn.functional.tanh is deprecated. Use torch.tanh instead.
  warnings.warn("nn.functional.tanh is deprecated. Use torch.tanh instead.")
wandb: Waiting for W&B process to finish, PID 32514... (success).
wandb: - 0.00MB of 0.00MB uploaded (0.00MB deduped)wandb: \ 0.00MB of 0.00MB uploaded (0.00MB deduped)wandb: | 0.00MB of 0.00MB uploaded (0.00MB deduped)wandb: / 0.00MB of 0.00MB uploaded (0.00MB deduped)wandb: - 0.00MB of 0.00MB uploaded (0.00MB deduped)wandb: \ 0.00MB of 0.00MB uploaded (0.00MB deduped)wandb: | 0.00MB of 0.00MB uploaded (0.00MB deduped)wandb: / 0.00MB of 0.00MB uploaded (0.00MB deduped)wandb: - 0.00MB of 0.00MB uploaded (0.00MB deduped)wandb: \ 0.00MB of 0.00MB uploaded (0.00MB deduped)wandb: | 0.00MB of 0.00MB uploaded (0.00MB deduped)wandb: / 0.00MB of 0.00MB uploaded (0.00MB deduped)wandb: - 0.00MB of 0.00MB uploaded (0.00MB deduped)wandb:                                                                                
wandb: Run history:
wandb:     e_F1 ▁▂▃▄▄▄▄▅▅▅▅▆▆▆▇▇▇▇▇▇▇▇██████████████████
wandb:   e_loss █▇▇▇▇▆▆▆▅▅▅▄▄▄▃▃▃▃▂▂▂▂▂▂▂▁▁▁▁▁▁▁▁▁▁▁▁▁▁▁
wandb:     t_F1 ▁▂▂▃▃▃▃▄▄▄▅▅▅▅▅▆▆▆▆▆▆▆▆▇▇▇▇▇▇▇▇▇▇▇██████
wandb:   t_loss █▇▇▇▇▇▆▆▆▆▆▅▅▅▅▄▄▄▄▄▃▄▃▃▃▃▂▂▂▂▂▂▁▂▁▁▁▁▁▁
wandb: 
wandb: Run summary:
wandb:     e_F1 62.15688
wandb:   e_loss 0.92659
wandb:     t_F1 74.19845
wandb:   t_loss 0.71646
wandb: 
wandb: Synced 4 W&B file(s), 0 media file(s), 0 artifact file(s) and 0 other file(s)
wandb: Synced celestial-monkey-1: https://wandb.ai/yinanazhou/xl_512_bs_8_lr_1e06_es_10_lc_True_nr_True_sr_False_stem_False_lemma_False_repeat_1_fold_2/runs/2dlqzs36
wandb: Find logs at: ./wandb/run-20220324_025431-2dlqzs36/logs/debug.log
wandb: 

wandb: wandb version 0.12.11 is available!  To upgrade, please run:
wandb:  $ pip install wandb --upgrade
2022-03-24 04:37:58.527717: I tensorflow/stream_executor/platform/default/dso_loader.cc:48] Successfully opened dynamic library libcudart.so.10.1
wandb: Tracking run with wandb version 0.12.5
wandb: Syncing run clean-dragon-1
wandb: ⭐️ View project at https://wandb.ai/yinanazhou/xl_512_bs_8_lr_1e06_es_10_lc_True_nr_True_sr_False_stem_False_lemma_False_repeat_2_fold_1
wandb: 🚀 View run at https://wandb.ai/yinanazhou/xl_512_bs_8_lr_1e06_es_10_lc_True_nr_True_sr_False_stem_False_lemma_False_repeat_2_fold_1/runs/2dornuji
wandb: Run data is saved locally in /project/6002780/yinan/Thesis_MER_Lyrics/lyric-emotion/wandb/run-20220324_043755-2dornuji
wandb: Run `wandb offline` to turn off syncing.

Validation loss decreased (inf --> 1.405493).  Saving model ...
Validation loss decreased (1.405493 --> 1.394754).  Saving model ...
Validation loss decreased (1.394754 --> 1.386056).  Saving model ...
Validation loss decreased (1.386056 --> 1.379246).  Saving model ...
Validation loss decreased (1.379246 --> 1.373622).  Saving model ...
Validation loss decreased (1.373622 --> 1.368374).  Saving model ...
Validation loss decreased (1.368374 --> 1.363667).  Saving model ...
Validation loss decreased (1.363667 --> 1.359080).  Saving model ...
Validation loss decreased (1.359080 --> 1.355402).  Saving model ...
Validation loss decreased (1.355402 --> 1.350940).  Saving model ...
Validation loss decreased (1.350940 --> 1.346895).  Saving model ...
Validation loss decreased (1.346895 --> 1.342683).  Saving model ...
Validation loss decreased (1.342683 --> 1.338893).  Saving model ...
Validation loss decreased (1.338893 --> 1.334081).  Saving model ...
Validation loss decreased (1.334081 --> 1.329784).  Saving model ...
Validation loss decreased (1.329784 --> 1.325160).  Saving model ...
Validation loss decreased (1.325160 --> 1.319870).  Saving model ...
Validation loss decreased (1.319870 --> 1.313563).  Saving model ...
Validation loss decreased (1.313563 --> 1.308162).  Saving model ...
Validation loss decreased (1.308162 --> 1.302572).  Saving model ...
Validation loss decreased (1.302572 --> 1.296167).  Saving model ...
Validation loss decreased (1.296167 --> 1.289510).  Saving model ...
Validation loss decreased (1.289510 --> 1.283368).  Saving model ...
Validation loss decreased (1.283368 --> 1.276933).  Saving model ...
Validation loss decreased (1.276933 --> 1.270071).  Saving model ...
Validation loss decreased (1.270071 --> 1.263132).  Saving model ...
Validation loss decreased (1.263132 --> 1.256483).  Saving model ...
Validation loss decreased (1.256483 --> 1.248533).  Saving model ...
Validation loss decreased (1.248533 --> 1.241820).  Saving model ...
Validation loss decreased (1.241820 --> 1.234402).  Saving model ...
Validation loss decreased (1.234402 --> 1.224975).  Saving model ...
Validation loss decreased (1.224975 --> 1.217616).  Saving model ...
Validation loss decreased (1.217616 --> 1.210360).  Saving model ...
Validation loss decreased (1.210360 --> 1.203512).  Saving model ...
Validation loss decreased (1.203512 --> 1.195984).  Saving model ...
Validation loss decreased (1.195984 --> 1.187257).  Saving model ...
Validation loss decreased (1.187257 --> 1.180909).  Saving model ...
Validation loss decreased (1.180909 --> 1.174252).  Saving model ...
Validation loss decreased (1.174252 --> 1.168812).  Saving model ...
Validation loss decreased (1.168812 --> 1.162242).  Saving model ...
Validation loss decreased (1.162242 --> 1.156263).  Saving model ...
Validation loss decreased (1.156263 --> 1.151120).  Saving model ...
Validation loss decreased (1.151120 --> 1.146706).  Saving model ...
Validation loss decreased (1.146706 --> 1.141058).  Saving model ...
Validation loss decreased (1.141058 --> 1.135717).  Saving model ...
Validation loss decreased (1.135717 --> 1.131608).  Saving model ...
Validation loss decreased (1.131608 --> 1.128571).  Saving model ...
Validation loss decreased (1.128571 --> 1.125146).  Saving model ...
Validation loss decreased (1.125146 --> 1.120944).  Saving model ...
Validation loss decreased (1.120944 --> 1.115911).  Saving model ...
Validation loss decreased (1.115911 --> 1.110289).  Saving model ...
Validation loss decreased (1.110289 --> 1.106471).  Saving model ...
Validation loss decreased (1.106471 --> 1.102010).  Saving model ...
Validation loss decreased (1.102010 --> 1.097297).  Saving model ...
Validation loss decreased (1.097297 --> 1.093568).  Saving model ...
Validation loss decreased (1.093568 --> 1.092550).  Saving model ...
Validation loss decreased (1.092550 --> 1.086165).  Saving model ...
Validation loss decreased (1.086165 --> 1.082987).  Saving model ...
Validation loss decreased (1.082987 --> 1.080703).  Saving model ...
Validation loss decreased (1.080703 --> 1.078005).  Saving model ...
Validation loss decreased (1.078005 --> 1.074061).  Saving model ...
Validation loss decreased (1.074061 --> 1.070361).  Saving model ...
Validation loss decreased (1.070361 --> 1.065705).  Saving model ...
Validation loss decreased (1.065705 --> 1.064090).  Saving model ...
Validation loss decreased (1.064090 --> 1.060451).  Saving model ...
Validation loss decreased (1.060451 --> 1.057287).  Saving model ...
Validation loss decreased (1.057287 --> 1.053913).  Saving model ...
Validation loss decreased (1.053913 --> 1.049452).  Saving model ...
Validation loss decreased (1.049452 --> 1.047909).  Saving model ...
Validation loss decreased (1.047909 --> 1.047338).  Saving model ...
Validation loss decreased (1.047338 --> 1.043518).  Saving model ...
Validation loss decreased (1.043518 --> 1.039298).  Saving model ...
Validation loss decreased (1.039298 --> 1.036961).  Saving model ...
Validation loss decreased (1.036961 --> 1.036009).  Saving model ...
Validation loss decreased (1.036009 --> 1.033950).  Saving model ...
Validation loss decreased (1.033950 --> 1.032168).  Saving model ...
Validation loss decreased (1.032168 --> 1.029029).  Saving model ...
Validation loss decreased (1.029029 --> 1.026776).  Saving model ...
Validation loss decreased (1.026776 --> 1.026063).  Saving model ...
Validation loss decreased (1.026063 --> 1.022868).  Saving model ...
Validation loss decreased (1.022868 --> 1.019825).  Saving model ...
Validation loss decreased (1.019825 --> 1.019493).  Saving model ...
Validation loss decreased (1.019493 --> 1.018176).  Saving model ...
Validation loss decreased (1.018176 --> 1.015478).  Saving model ...
Validation loss decreased (1.015478 --> 1.015348).  Saving model ...
Validation loss decreased (1.015348 --> 1.014111).  Saving model ...
Validation loss decreased (1.014111 --> 1.011436).  Saving model ...
Validation loss decreased (1.011436 --> 1.010767).  Saving model ...
Validation loss decreased (1.010767 --> 1.008567).  Saving model ...
Validation loss decreased (1.008567 --> 1.006184).  Saving model ...
EarlyStopping counter: 1 out of 10.0
Validation loss decreased (1.006184 --> 1.005461).  Saving model ...
Validation loss decreased (1.005461 --> 1.004255).  Saving model ...
Validation loss decreased (1.004255 --> 1.002631).  Saving model ...
Validation loss decreased (1.002631 --> 1.001079).  Saving model ...
Validation loss decreased (1.001079 --> 0.999242).  Saving model ...
Validation loss decreased (0.999242 --> 0.996901).  Saving model ...
Validation loss decreased (0.996901 --> 0.995706).  Saving model ...
Validation loss decreased (0.995706 --> 0.993391).  Saving model ...
Validation loss decreased (0.993391 --> 0.992792).  Saving model ...
Validation loss decreased (0.992792 --> 0.990996).  Saving model ...
Validation loss decreased (0.990996 --> 0.987956).  Saving model ...
EarlyStopping counter: 1 out of 10.0
Validation loss decreased (0.987956 --> 0.986833).  Saving model ...
Validation loss decreased (0.986833 --> 0.985945).  Saving model ...
Validation loss decreased (0.985945 --> 0.983917).  Saving model ...
Validation loss decreased (0.983917 --> 0.982282).  Saving model ...
EarlyStopping counter: 1 out of 10.0
Validation loss decreased (0.982282 --> 0.981332).  Saving model ...
Validation loss decreased (0.981332 --> 0.979936).  Saving model ...
Validation loss decreased (0.979936 --> 0.977466).  Saving model ...
EarlyStopping counter: 1 out of 10.0
EarlyStopping counter: 2 out of 10.0
Validation loss decreased (0.977466 --> 0.976600).  Saving model ...
Validation loss decreased (0.976600 --> 0.975274).  Saving model ...
Validation loss decreased (0.975274 --> 0.974616).  Saving model ...
Validation loss decreased (0.974616 --> 0.973477).  Saving model ...
Validation loss decreased (0.973477 --> 0.971114).  Saving model ...
Validation loss decreased (0.971114 --> 0.970433).  Saving model ...
EarlyStopping counter: 1 out of 10.0
EarlyStopping counter: 2 out of 10.0
EarlyStopping counter: 3 out of 10.0
Validation loss decreased (0.970433 --> 0.969314).  Saving model ...
EarlyStopping counter: 1 out of 10.0
EarlyStopping counter: 2 out of 10.0
EarlyStopping counter: 3 out of 10.0
EarlyStopping counter: 4 out of 10.0
Validation loss decreased (0.969314 --> 0.968884).  Saving model ...
Validation loss decreased (0.968884 --> 0.966779).  Saving model ...
Validation loss decreased (0.966779 --> 0.966171).  Saving model ...
EarlyStopping counter: 1 out of 10.0
EarlyStopping counter: 2 out of 10.0
EarlyStopping counter: 3 out of 10.0
Validation loss decreased (0.966171 --> 0.965542).  Saving model ...
EarlyStopping counter: 1 out of 10.0
EarlyStopping counter: 2 out of 10.0
EarlyStopping counter: 3 out of 10.0
Validation loss decreased (0.965542 --> 0.964886).  Saving model ...
EarlyStopping counter: 1 out of 10.0
EarlyStopping counter: 2 out of 10.0
EarlyStopping counter: 3 out of 10.0
EarlyStopping counter: 4 out of 10.0
EarlyStopping counter: 5 out of 10.0
EarlyStopping counter: 6 out of 10.0
EarlyStopping counter: 7 out of 10.0
EarlyStopping counter: 8 out of 10.0
EarlyStopping counter: 9 out of 10.0
EarlyStopping counter: 10 out of 10.0
/localscratch/yinan.29323954.0/env/lib/python3.7/site-packages/torch/nn/functional.py:1794: UserWarning: nn.functional.tanh is deprecated. Use torch.tanh instead.
  warnings.warn("nn.functional.tanh is deprecated. Use torch.tanh instead.")
wandb: Waiting for W&B process to finish, PID 38085... (success).
wandb: - 0.00MB of 0.00MB uploaded (0.00MB deduped)wandb: \ 0.00MB of 0.00MB uploaded (0.00MB deduped)wandb: | 0.00MB of 0.00MB uploaded (0.00MB deduped)wandb: / 0.00MB of 0.00MB uploaded (0.00MB deduped)wandb: - 0.00MB of 0.00MB uploaded (0.00MB deduped)wandb: \ 0.00MB of 0.00MB uploaded (0.00MB deduped)wandb: | 0.00MB of 0.00MB uploaded (0.00MB deduped)wandb: / 0.00MB of 0.00MB uploaded (0.00MB deduped)wandb: - 0.00MB of 0.00MB uploaded (0.00MB deduped)wandb: \ 0.00MB of 0.00MB uploaded (0.00MB deduped)wandb: | 0.00MB of 0.00MB uploaded (0.00MB deduped)wandb: / 0.00MB of 0.00MB uploaded (0.00MB deduped)wandb:                                                                                
wandb: Run history:
wandb:     e_F1 ▁▂▃▄▅▅▅▆▆▆▆▆▇▇▇▇▇▇▇▇▇██▇████████████████
wandb:   e_loss ██▇▇▇▆▆▆▅▅▄▄▄▃▃▃▃▃▂▂▂▂▂▂▂▂▁▁▁▁▁▁▁▁▁▁▁▁▁▁
wandb:     t_F1 ▁▁▂▃▃▃▃▄▄▅▅▅▅▅▆▆▆▆▆▆▆▇▇▇▇▇▇▇▇▇▇▇▇███████
wandb:   t_loss ███▇▇▇▇▆▆▆▆▆▅▅▅▄▄▄▄▄▃▃▃▃▃▃▃▂▂▂▂▂▂▂▂▂▁▁▁▁
wandb: 
wandb: Run summary:
wandb:     e_F1 59.41888
wandb:   e_loss 0.96747
wandb:     t_F1 74.85339
wandb:   t_loss 0.69063
wandb: 
wandb: Synced 4 W&B file(s), 0 media file(s), 0 artifact file(s) and 0 other file(s)
wandb: Synced clean-dragon-1: https://wandb.ai/yinanazhou/xl_512_bs_8_lr_1e06_es_10_lc_True_nr_True_sr_False_stem_False_lemma_False_repeat_2_fold_1/runs/2dornuji
wandb: Find logs at: ./wandb/run-20220324_043755-2dornuji/logs/debug.log
wandb: 

wandb: wandb version 0.12.11 is available!  To upgrade, please run:
wandb:  $ pip install wandb --upgrade
2022-03-24 06:15:15.358554: I tensorflow/stream_executor/platform/default/dso_loader.cc:48] Successfully opened dynamic library libcudart.so.10.1
wandb: Tracking run with wandb version 0.12.5
wandb: Syncing run amber-waterfall-1
wandb: ⭐️ View project at https://wandb.ai/yinanazhou/xl_512_bs_8_lr_1e06_es_10_lc_True_nr_True_sr_False_stem_False_lemma_False_repeat_2_fold_2
wandb: 🚀 View run at https://wandb.ai/yinanazhou/xl_512_bs_8_lr_1e06_es_10_lc_True_nr_True_sr_False_stem_False_lemma_False_repeat_2_fold_2/runs/2vv2ku8m
wandb: Run data is saved locally in /project/6002780/yinan/Thesis_MER_Lyrics/lyric-emotion/wandb/run-20220324_061512-2vv2ku8m
wandb: Run `wandb offline` to turn off syncing.
slurmstepd: error: *** JOB 29323954 ON cdr2642 CANCELLED AT 2022-03-24T06:34:56 ***
