Unloading StdEnv/2020

Due to MODULEPATH changes, the following have been reloaded:
  1) mii/1.1.1


The following have been reloaded with a version change:
  1) python/3.8.2 => python/3.7.4

Using base prefix '/cvmfs/soft.computecanada.ca/easybuild/software/2017/Core/python/3.7.4'
New python executable in /localscratch/yinan.27787820.0/env/bin/python
Installing setuptools, pip, wheel...
done.
Ignoring pip: markers 'python_version < "3"' don't match your environment
Looking in links: /cvmfs/soft.computecanada.ca/custom/python/wheelhouse/nix/avx2, /cvmfs/soft.computecanada.ca/custom/python/wheelhouse/nix/generic, /cvmfs/soft.computecanada.ca/custom/python/wheelhouse/generic
Collecting pip
Installing collected packages: pip
  Found existing installation: pip 19.1.1
    Uninstalling pip-19.1.1:
      Successfully uninstalled pip-19.1.1
Successfully installed pip-21.2.3+computecanada
Looking in links: /cvmfs/soft.computecanada.ca/custom/python/wheelhouse/nix/avx2, /cvmfs/soft.computecanada.ca/custom/python/wheelhouse/nix/generic, /cvmfs/soft.computecanada.ca/custom/python/wheelhouse/generic
Processing /cvmfs/soft.computecanada.ca/custom/python/wheelhouse/generic/keras-2.7.0+computecanada-py2.py3-none-any.whl
Processing /cvmfs/soft.computecanada.ca/custom/python/wheelhouse/generic/Keras_Preprocessing-1.1.2+computecanada-py3-none-any.whl
Requirement already satisfied: matplotlib in /cvmfs/soft.computecanada.ca/easybuild/software/2017/Core/scipy-stack/2019a/lib/python3.7/site-packages (from -r requirements.txt (line 3)) (3.0.2)
Processing /cvmfs/soft.computecanada.ca/custom/python/wheelhouse/generic/nltk-3.6.5+computecanada-py3-none-any.whl
Processing /cvmfs/soft.computecanada.ca/custom/python/wheelhouse/generic/scikit_learn-0.22.1+computecanada-cp37-cp37m-linux_x86_64.whl
Processing /cvmfs/soft.computecanada.ca/custom/python/wheelhouse/generic/tensorboard-2.3.0+computecanada-py3-none-any.whl
Processing /cvmfs/soft.computecanada.ca/custom/python/wheelhouse/generic/tensorboard_plugin_wit-1.7.0+computecanada-py3-none-any.whl
Processing /cvmfs/soft.computecanada.ca/custom/python/wheelhouse/generic/tensorflow_gpu-2.3.0+computecanada-cp37-cp37m-linux_x86_64.whl
Processing /cvmfs/soft.computecanada.ca/custom/python/wheelhouse/generic/tensorflow_estimator-2.3.0+computecanada-py2.py3-none-any.whl
Processing /cvmfs/soft.computecanada.ca/custom/python/wheelhouse/generic/tokenizers-0.5.2+computecanada-cp37-cp37m-linux_x86_64.whl
Processing /cvmfs/soft.computecanada.ca/custom/python/wheelhouse/nix/avx2/torch-1.4.0+computecanada-cp37-cp37m-linux_x86_64.whl
Processing /cvmfs/soft.computecanada.ca/custom/python/wheelhouse/generic/torchtext-0.6.0+computecanada-py3-none-any.whl
Processing /cvmfs/soft.computecanada.ca/custom/python/wheelhouse/generic/torchvision-0.8.2+computecanada-cp37-cp37m-linux_x86_64.whl
Processing /cvmfs/soft.computecanada.ca/custom/python/wheelhouse/generic/transformers-2.5.1+computecanada-py3-none-any.whl
Processing /cvmfs/soft.computecanada.ca/custom/python/wheelhouse/generic/urllib3-1.26.7+computecanada-py2.py3-none-any.whl
ERROR: Could not find a version that satisfies the requirement regex>=2021.8.3 (from nltk) (from versions: 2018.1.10+computecanada, 2019.11.1+computecanada, 2020.11.13+computecanada)
ERROR: No matching distribution found for regex>=2021.8.3
Looking in links: /cvmfs/soft.computecanada.ca/custom/python/wheelhouse/nix/avx2, /cvmfs/soft.computecanada.ca/custom/python/wheelhouse/nix/generic, /cvmfs/soft.computecanada.ca/custom/python/wheelhouse/generic
ERROR: Could not find a version that satisfies the requirement numpy==1.20.0+computacanada (from versions: 1.15.0+computecanada, 1.15.2+computecanada, 1.15.4+computecanada, 1.16.0+computecanada, 1.16.2+computecanada, 1.16.3+computecanada, 1.17.4+computecanada, 1.18.1+computecanada, 1.18.4+computecanada, 1.19.1+computecanada, 1.19.2+computecanada, 1.20.2+computecanada)
ERROR: No matching distribution found for numpy==1.20.0+computacanada
Looking in links: /cvmfs/soft.computecanada.ca/custom/python/wheelhouse/nix/avx2, /cvmfs/soft.computecanada.ca/custom/python/wheelhouse/nix/generic, /cvmfs/soft.computecanada.ca/custom/python/wheelhouse/generic
Processing /cvmfs/soft.computecanada.ca/custom/python/wheelhouse/generic/wandb-0.12.5+computecanada-py2.py3-none-any.whl
Requirement already satisfied: requests<3,>=2.0.0 in /cvmfs/soft.computecanada.ca/easybuild/software/2017/Core/scipy-stack/2019a/lib/python3.7/site-packages (from wandb) (2.21.0)
Processing /cvmfs/soft.computecanada.ca/custom/python/wheelhouse/generic/subprocess32-3.5.4+computecanada-py3-none-any.whl
Processing /cvmfs/soft.computecanada.ca/custom/python/wheelhouse/generic/yaspin-2.1.0+computecanada-py3-none-any.whl
Processing /cvmfs/soft.computecanada.ca/custom/python/wheelhouse/generic/configparser-5.0.2+computecanada-py3-none-any.whl
Processing /cvmfs/soft.computecanada.ca/custom/python/wheelhouse/generic/protobuf-3.19.3+computecanada-py2.py3-none-any.whl
Processing /cvmfs/soft.computecanada.ca/custom/python/wheelhouse/generic/six-1.16.0+computecanada-py2.py3-none-any.whl
Requirement already satisfied: python-dateutil>=2.6.1 in /cvmfs/soft.computecanada.ca/easybuild/software/2017/Core/scipy-stack/2019a/lib/python3.7/site-packages (from wandb) (2.7.5)
Processing /cvmfs/soft.computecanada.ca/custom/python/wheelhouse/generic/PyYAML-5.3.1+computecanada-cp37-cp37m-linux_x86_64.whl
Processing /cvmfs/soft.computecanada.ca/custom/python/wheelhouse/generic/sentry_sdk-1.5.0+computecanada-py2.py3-none-any.whl
Processing /cvmfs/soft.computecanada.ca/custom/python/wheelhouse/generic/GitPython-3.1.24+computecanada-py3-none-any.whl
Processing /cvmfs/soft.computecanada.ca/custom/python/wheelhouse/generic/promise-2.3+computecanada-py3-none-any.whl
Processing /cvmfs/soft.computecanada.ca/custom/python/wheelhouse/generic/click-8.0.3+computecanada-py3-none-any.whl
Processing /cvmfs/soft.computecanada.ca/custom/python/wheelhouse/generic/shortuuid-1.0.1+computecanada-py3-none-any.whl
Processing /cvmfs/soft.computecanada.ca/custom/python/wheelhouse/generic/docker_pycreds-0.4.0+computecanada-py2.py3-none-any.whl
Processing /cvmfs/soft.computecanada.ca/custom/python/wheelhouse/generic/pathtools-0.1.2+computecanada-py3-none-any.whl
Processing /cvmfs/soft.computecanada.ca/custom/python/wheelhouse/generic/psutil-5.7.3+computecanada-cp37-cp37m-linux_x86_64.whl
Requirement already satisfied: importlib-metadata in /cvmfs/soft.computecanada.ca/easybuild/software/2017/Core/scipy-stack/2019a/lib/python3.7/site-packages (from Click!=8.0.0,>=7.0->wandb) (0.8)
Processing /cvmfs/soft.computecanada.ca/custom/python/wheelhouse/generic/typing_extensions-4.0.1+computecanada-py3-none-any.whl
Processing /cvmfs/soft.computecanada.ca/custom/python/wheelhouse/generic/gitdb-4.0.9+computecanada-py3-none-any.whl
Processing /cvmfs/soft.computecanada.ca/custom/python/wheelhouse/generic/smmap-5.0.0+computecanada-py3-none-any.whl
Requirement already satisfied: certifi>=2017.4.17 in /cvmfs/soft.computecanada.ca/easybuild/software/2017/Core/scipy-stack/2019a/lib/python3.7/site-packages (from requests<3,>=2.0.0->wandb) (2018.11.29)
Requirement already satisfied: chardet<3.1.0,>=3.0.2 in /cvmfs/soft.computecanada.ca/easybuild/software/2017/Core/scipy-stack/2019a/lib/python3.7/site-packages (from requests<3,>=2.0.0->wandb) (3.0.4)
Requirement already satisfied: idna<2.9,>=2.5 in /cvmfs/soft.computecanada.ca/easybuild/software/2017/Core/scipy-stack/2019a/lib/python3.7/site-packages (from requests<3,>=2.0.0->wandb) (2.8)
Requirement already satisfied: urllib3<1.25,>=1.21.1 in /cvmfs/soft.computecanada.ca/easybuild/software/2017/Core/scipy-stack/2019a/lib/python3.7/site-packages (from requests<3,>=2.0.0->wandb) (1.24.1)
Processing /cvmfs/soft.computecanada.ca/custom/python/wheelhouse/generic/termcolor-1.1.0+computecanada-py3-none-any.whl
Requirement already satisfied: zipp>=0.3.2 in /cvmfs/soft.computecanada.ca/easybuild/software/2017/Core/scipy-stack/2019a/lib/python3.7/site-packages (from importlib-metadata->Click!=8.0.0,>=7.0->wandb) (0.3.3)
Installing collected packages: smmap, typing-extensions, termcolor, six, gitdb, yaspin, subprocess32, shortuuid, sentry-sdk, PyYAML, psutil, protobuf, promise, pathtools, GitPython, docker-pycreds, configparser, Click, wandb
  Attempting uninstall: six
    Found existing installation: six 1.12.0
    Not uninstalling six at /cvmfs/soft.computecanada.ca/easybuild/software/2017/Core/scipy-stack/2019a/lib/python3.7/site-packages, outside environment /localscratch/yinan.27787820.0/env
    Can't uninstall 'six'. No files were found to uninstall.
Successfully installed Click-8.0.3+computecanada GitPython-3.1.24+computecanada PyYAML-5.3.1+computecanada configparser-5.0.2+computecanada docker-pycreds-0.4.0+computecanada gitdb-4.0.9+computecanada pathtools-0.1.2+computecanada promise-2.3+computecanada protobuf-3.19.3+computecanada psutil-5.7.3+computecanada sentry-sdk-1.5.0+computecanada shortuuid-1.0.1+computecanada six-1.16.0+computecanada smmap-5.0.0+computecanada subprocess32-3.5.4+computecanada termcolor-1.1.0+computecanada typing-extensions-4.0.1+computecanada wandb-0.12.5+computecanada yaspin-2.1.0+computecanada
Looking in links: /cvmfs/soft.computecanada.ca/custom/python/wheelhouse/nix/avx2, /cvmfs/soft.computecanada.ca/custom/python/wheelhouse/nix/generic, /cvmfs/soft.computecanada.ca/custom/python/wheelhouse/generic
ERROR: Could not find a version that satisfies the requirement sagemaker (from versions: none)
ERROR: No matching distribution found for sagemaker
Looking in links: /cvmfs/soft.computecanada.ca/custom/python/wheelhouse/nix/avx2, /cvmfs/soft.computecanada.ca/custom/python/wheelhouse/nix/generic, /cvmfs/soft.computecanada.ca/custom/python/wheelhouse/generic
Processing /cvmfs/soft.computecanada.ca/custom/python/wheelhouse/generic/torch-1.9.1+computecanada-cp37-cp37m-linux_x86_64.whl
Requirement already satisfied: typing-extensions in /localscratch/yinan.27787820.0/env/lib/python3.7/site-packages (from torch) (4.0.1+computecanada)
Installing collected packages: torch
Successfully installed torch-1.9.1+computecanada
Looking in links: /cvmfs/soft.computecanada.ca/custom/python/wheelhouse/nix/avx2, /cvmfs/soft.computecanada.ca/custom/python/wheelhouse/nix/generic, /cvmfs/soft.computecanada.ca/custom/python/wheelhouse/generic
Processing /cvmfs/soft.computecanada.ca/custom/python/wheelhouse/generic/transformers-2.5.1+computecanada-py3-none-any.whl
Requirement already satisfied: numpy in /cvmfs/soft.computecanada.ca/easybuild/software/2017/Core/scipy-stack/2019a/lib/python3.7/site-packages (from transformers==2.5.1+computecanada) (1.16.0)
Processing /cvmfs/soft.computecanada.ca/custom/python/wheelhouse/generic/filelock-3.4.2+computecanada-py3-none-any.whl
Processing /cvmfs/soft.computecanada.ca/custom/python/wheelhouse/generic/tqdm-4.62.3+computecanada-py2.py3-none-any.whl
Processing /cvmfs/soft.computecanada.ca/custom/python/wheelhouse/generic/boto3-1.20.52+computecanada-py3-none-any.whl
Processing /cvmfs/soft.computecanada.ca/custom/python/wheelhouse/generic/sentencepiece-0.1.91+computecanada-cp37-cp37m-linux_x86_64.whl
Processing /cvmfs/soft.computecanada.ca/custom/python/wheelhouse/generic/sacremoses-0.0.46+computecanada-py3-none-any.whl
Processing /cvmfs/soft.computecanada.ca/custom/python/wheelhouse/generic/regex-2020.11.13+computecanada-cp37-cp37m-linux_x86_64.whl
Processing /cvmfs/soft.computecanada.ca/custom/python/wheelhouse/generic/tokenizers-0.5.2+computecanada-cp37-cp37m-linux_x86_64.whl
Requirement already satisfied: requests in /cvmfs/soft.computecanada.ca/easybuild/software/2017/Core/scipy-stack/2019a/lib/python3.7/site-packages (from transformers==2.5.1+computecanada) (2.21.0)
Processing /cvmfs/soft.computecanada.ca/custom/python/wheelhouse/generic/jmespath-0.10.0+computecanada-py2.py3-none-any.whl
Processing /cvmfs/soft.computecanada.ca/custom/python/wheelhouse/generic/botocore-1.23.52+computecanada-py3-none-any.whl
Processing /cvmfs/soft.computecanada.ca/custom/python/wheelhouse/generic/s3transfer-0.5.1+computecanada-py3-none-any.whl
Processing /cvmfs/soft.computecanada.ca/custom/python/wheelhouse/generic/urllib3-1.26.8+computecanada-py2.py3-none-any.whl
Requirement already satisfied: python-dateutil<3.0.0,>=2.1 in /cvmfs/soft.computecanada.ca/easybuild/software/2017/Core/scipy-stack/2019a/lib/python3.7/site-packages (from botocore<1.24.0,>=1.23.52->boto3->transformers==2.5.1+computecanada) (2.7.5)
Requirement already satisfied: six>=1.5 in /localscratch/yinan.27787820.0/env/lib/python3.7/site-packages (from python-dateutil<3.0.0,>=2.1->botocore<1.24.0,>=1.23.52->boto3->transformers==2.5.1+computecanada) (1.16.0+computecanada)
Requirement already satisfied: chardet<3.1.0,>=3.0.2 in /cvmfs/soft.computecanada.ca/easybuild/software/2017/Core/scipy-stack/2019a/lib/python3.7/site-packages (from requests->transformers==2.5.1+computecanada) (3.0.4)
Requirement already satisfied: certifi>=2017.4.17 in /cvmfs/soft.computecanada.ca/easybuild/software/2017/Core/scipy-stack/2019a/lib/python3.7/site-packages (from requests->transformers==2.5.1+computecanada) (2018.11.29)
Processing /cvmfs/soft.computecanada.ca/custom/python/wheelhouse/generic/requests-2.27.1+computecanada-py2.py3-none-any.whl
Processing /cvmfs/soft.computecanada.ca/custom/python/wheelhouse/generic/charset_normalizer-2.0.11+computecanada-py3-none-any.whl
Requirement already satisfied: idna<4,>=2.5 in /cvmfs/soft.computecanada.ca/easybuild/software/2017/Core/scipy-stack/2019a/lib/python3.7/site-packages (from requests->transformers==2.5.1+computecanada) (2.8)
Processing /cvmfs/soft.computecanada.ca/custom/python/wheelhouse/generic/joblib-1.1.0+computecanada-py2.py3-none-any.whl
Requirement already satisfied: click in /localscratch/yinan.27787820.0/env/lib/python3.7/site-packages (from sacremoses->transformers==2.5.1+computecanada) (8.0.3+computecanada)
Requirement already satisfied: importlib-metadata in /cvmfs/soft.computecanada.ca/easybuild/software/2017/Core/scipy-stack/2019a/lib/python3.7/site-packages (from click->sacremoses->transformers==2.5.1+computecanada) (0.8)
Requirement already satisfied: zipp>=0.3.2 in /cvmfs/soft.computecanada.ca/easybuild/software/2017/Core/scipy-stack/2019a/lib/python3.7/site-packages (from importlib-metadata->click->sacremoses->transformers==2.5.1+computecanada) (0.3.3)
Installing collected packages: urllib3, jmespath, botocore, tqdm, s3transfer, regex, joblib, charset-normalizer, tokenizers, sentencepiece, sacremoses, requests, filelock, boto3, transformers
  Attempting uninstall: urllib3
    Found existing installation: urllib3 1.24.1
    Not uninstalling urllib3 at /cvmfs/soft.computecanada.ca/easybuild/software/2017/Core/scipy-stack/2019a/lib/python3.7/site-packages, outside environment /localscratch/yinan.27787820.0/env
    Can't uninstall 'urllib3'. No files were found to uninstall.
  Attempting uninstall: requests
    Found existing installation: requests 2.21.0
    Not uninstalling requests at /cvmfs/soft.computecanada.ca/easybuild/software/2017/Core/scipy-stack/2019a/lib/python3.7/site-packages, outside environment /localscratch/yinan.27787820.0/env
    Can't uninstall 'requests'. No files were found to uninstall.
Successfully installed boto3-1.20.52+computecanada botocore-1.23.52+computecanada charset-normalizer-2.0.11+computecanada filelock-3.4.2+computecanada jmespath-0.10.0+computecanada joblib-1.1.0+computecanada regex-2020.11.13+computecanada requests-2.27.1+computecanada s3transfer-0.5.1+computecanada sacremoses-0.0.46+computecanada sentencepiece-0.1.91+computecanada tokenizers-0.5.2+computecanada tqdm-4.62.3+computecanada transformers-2.5.1+computecanada urllib3-1.26.8+computecanada
Looking in links: /cvmfs/soft.computecanada.ca/custom/python/wheelhouse/nix/avx2, /cvmfs/soft.computecanada.ca/custom/python/wheelhouse/nix/generic, /cvmfs/soft.computecanada.ca/custom/python/wheelhouse/generic
Processing /cvmfs/soft.computecanada.ca/custom/python/wheelhouse/generic/tensorflow_gpu-2.3.0+computecanada-cp37-cp37m-linux_x86_64.whl
Processing /cvmfs/soft.computecanada.ca/custom/python/wheelhouse/generic/wrapt-1.11.2+computecanada-cp37-cp37m-linux_x86_64.whl
Processing /cvmfs/soft.computecanada.ca/custom/python/wheelhouse/nix/avx2/h5py-2.10.0+computecanada-cp37-cp37m-linux_x86_64.whl
Processing /cvmfs/soft.computecanada.ca/custom/python/wheelhouse/generic/absl_py-1.0.0+computecanada-py3-none-any.whl
Requirement already satisfied: wheel>=0.26 in /localscratch/yinan.27787820.0/env/lib/python3.7/site-packages (from tensorflow_gpu==2.3.0+computecanada) (0.33.4)
Processing /cvmfs/soft.computecanada.ca/custom/python/wheelhouse/generic/tensorboard-2.6.0+computecanada-py3-none-any.whl
Requirement already satisfied: six>=1.12.0 in /localscratch/yinan.27787820.0/env/lib/python3.7/site-packages (from tensorflow_gpu==2.3.0+computecanada) (1.16.0+computecanada)
Processing /cvmfs/soft.computecanada.ca/custom/python/wheelhouse/generic/tensorflow_estimator-2.3.0+computecanada-py2.py3-none-any.whl
Requirement already satisfied: numpy<1.19.0,>=1.16.0 in /cvmfs/soft.computecanada.ca/easybuild/software/2017/Core/scipy-stack/2019a/lib/python3.7/site-packages (from tensorflow_gpu==2.3.0+computecanada) (1.16.0)
Processing /cvmfs/soft.computecanada.ca/custom/python/wheelhouse/nix/generic/scipy-1.4.1+computecanada-cp37-cp37m-linux_x86_64.whl
Processing /cvmfs/soft.computecanada.ca/custom/python/wheelhouse/generic/astunparse-1.6.3+computecanada-py2.py3-none-any.whl
Processing /cvmfs/soft.computecanada.ca/custom/python/wheelhouse/generic/grpcio-1.38.0+computecanada-cp37-cp37m-linux_x86_64.whl
Processing /cvmfs/soft.computecanada.ca/custom/python/wheelhouse/generic/Keras_Preprocessing-1.1.2+computecanada-py3-none-any.whl
Requirement already satisfied: protobuf>=3.9.2 in /localscratch/yinan.27787820.0/env/lib/python3.7/site-packages (from tensorflow_gpu==2.3.0+computecanada) (3.19.3+computecanada)
Requirement already satisfied: termcolor>=1.1.0 in /localscratch/yinan.27787820.0/env/lib/python3.7/site-packages (from tensorflow_gpu==2.3.0+computecanada) (1.1.0+computecanada)
Processing /cvmfs/soft.computecanada.ca/custom/python/wheelhouse/generic/gast-0.3.3+computecanada-py3-none-any.whl
Processing /cvmfs/soft.computecanada.ca/custom/python/wheelhouse/generic/opt_einsum-3.3.0+computecanada-py3-none-any.whl
Processing /cvmfs/soft.computecanada.ca/custom/python/wheelhouse/generic/google_pasta-0.2.0+computecanada-py3-none-any.whl
Processing /cvmfs/soft.computecanada.ca/custom/python/wheelhouse/generic/tensorboard_plugin_wit-1.8.0+computecanada-py3-none-any.whl
Processing /cvmfs/soft.computecanada.ca/custom/python/wheelhouse/generic/google_auth_oauthlib-0.4.6+computecanada-py2.py3-none-any.whl
Processing /cvmfs/soft.computecanada.ca/custom/python/wheelhouse/generic/Markdown-3.3.6+computecanada-py3-none-any.whl
Processing /cvmfs/soft.computecanada.ca/custom/python/wheelhouse/generic/Werkzeug-2.0.3+computecanada-py3-none-any.whl
Requirement already satisfied: setuptools>=41.0.0 in /localscratch/yinan.27787820.0/env/lib/python3.7/site-packages (from tensorboard<3,>=2.3.0->tensorflow_gpu==2.3.0+computecanada) (41.0.1)
Processing /cvmfs/soft.computecanada.ca/custom/python/wheelhouse/generic/tensorboard_data_server-0.6.1+computecanada-py3-none-linux_x86_64.whl
Processing /cvmfs/soft.computecanada.ca/custom/python/wheelhouse/generic/google_auth-1.35.0+computecanada-py2.py3-none-any.whl
Requirement already satisfied: requests<3,>=2.21.0 in /localscratch/yinan.27787820.0/env/lib/python3.7/site-packages (from tensorboard<3,>=2.3.0->tensorflow_gpu==2.3.0+computecanada) (2.27.1+computecanada)
Processing /cvmfs/soft.computecanada.ca/custom/python/wheelhouse/generic/cachetools-4.2.4+computecanada-py3-none-any.whl
Processing /cvmfs/soft.computecanada.ca/custom/python/wheelhouse/generic/rsa-4.8+computecanada-py3-none-any.whl
Processing /cvmfs/soft.computecanada.ca/custom/python/wheelhouse/generic/pyasn1_modules-0.2.8+computecanada-py2.py3-none-any.whl
Processing /cvmfs/soft.computecanada.ca/custom/python/wheelhouse/generic/requests_oauthlib-1.3.0+computecanada-py2.py3-none-any.whl
Processing /cvmfs/soft.computecanada.ca/custom/python/wheelhouse/generic/importlib_metadata-4.10.1+computecanada-py3-none-any.whl
Processing /cvmfs/soft.computecanada.ca/custom/python/wheelhouse/generic/zipp-3.7.0+computecanada-py3-none-any.whl
Requirement already satisfied: typing-extensions>=3.6.4 in /localscratch/yinan.27787820.0/env/lib/python3.7/site-packages (from importlib-metadata>=4.4->markdown>=2.6.8->tensorboard<3,>=2.3.0->tensorflow_gpu==2.3.0+computecanada) (4.0.1+computecanada)
Processing /cvmfs/soft.computecanada.ca/custom/python/wheelhouse/generic/pyasn1-0.4.8+computecanada-py2.py3-none-any.whl
Requirement already satisfied: charset-normalizer~=2.0.0 in /localscratch/yinan.27787820.0/env/lib/python3.7/site-packages (from requests<3,>=2.21.0->tensorboard<3,>=2.3.0->tensorflow_gpu==2.3.0+computecanada) (2.0.11+computecanada)
Requirement already satisfied: idna<4,>=2.5 in /cvmfs/soft.computecanada.ca/easybuild/software/2017/Core/scipy-stack/2019a/lib/python3.7/site-packages (from requests<3,>=2.21.0->tensorboard<3,>=2.3.0->tensorflow_gpu==2.3.0+computecanada) (2.8)
Requirement already satisfied: urllib3<1.27,>=1.21.1 in /localscratch/yinan.27787820.0/env/lib/python3.7/site-packages (from requests<3,>=2.21.0->tensorboard<3,>=2.3.0->tensorflow_gpu==2.3.0+computecanada) (1.26.8+computecanada)
Requirement already satisfied: certifi>=2017.4.17 in /cvmfs/soft.computecanada.ca/easybuild/software/2017/Core/scipy-stack/2019a/lib/python3.7/site-packages (from requests<3,>=2.21.0->tensorboard<3,>=2.3.0->tensorflow_gpu==2.3.0+computecanada) (2018.11.29)
Processing /cvmfs/soft.computecanada.ca/custom/python/wheelhouse/generic/oauthlib-3.1.1+computecanada-py2.py3-none-any.whl
Installing collected packages: pyasn1, zipp, rsa, pyasn1-modules, oauthlib, cachetools, requests-oauthlib, importlib-metadata, google-auth, werkzeug, tensorboard-plugin-wit, tensorboard-data-server, markdown, grpcio, google-auth-oauthlib, absl-py, wrapt, tensorflow-estimator, tensorboard, scipy, opt-einsum, keras-preprocessing, h5py, google-pasta, gast, astunparse, tensorflow-gpu
  Attempting uninstall: pyasn1
    Found existing installation: pyasn1 0.4.3
    Not uninstalling pyasn1 at /cvmfs/soft.computecanada.ca/easybuild/software/2017/Core/scipy-stack/2019a/lib/python3.7/site-packages, outside environment /localscratch/yinan.27787820.0/env
    Can't uninstall 'pyasn1'. No files were found to uninstall.
  Attempting uninstall: zipp
    Found existing installation: zipp 0.3.3
    Not uninstalling zipp at /cvmfs/soft.computecanada.ca/easybuild/software/2017/Core/scipy-stack/2019a/lib/python3.7/site-packages, outside environment /localscratch/yinan.27787820.0/env
    Can't uninstall 'zipp'. No files were found to uninstall.
  Attempting uninstall: importlib-metadata
    Found existing installation: importlib-metadata 0.8
    Not uninstalling importlib-metadata at /cvmfs/soft.computecanada.ca/easybuild/software/2017/Core/scipy-stack/2019a/lib/python3.7/site-packages, outside environment /localscratch/yinan.27787820.0/env
    Can't uninstall 'importlib-metadata'. No files were found to uninstall.
  Attempting uninstall: scipy
    Found existing installation: scipy 1.2.0
    Not uninstalling scipy at /cvmfs/soft.computecanada.ca/easybuild/software/2017/Core/scipy-stack/2019a/lib/python3.7/site-packages, outside environment /localscratch/yinan.27787820.0/env
    Can't uninstall 'scipy'. No files were found to uninstall.
Successfully installed absl-py-1.0.0+computecanada astunparse-1.6.3+computecanada cachetools-4.2.4+computecanada gast-0.3.3+computecanada google-auth-1.35.0+computecanada google-auth-oauthlib-0.4.6+computecanada google-pasta-0.2.0+computecanada grpcio-1.38.0+computecanada h5py-2.10.0+computecanada importlib-metadata-4.10.1+computecanada keras-preprocessing-1.1.2+computecanada markdown-3.3.6+computecanada oauthlib-3.1.1+computecanada opt-einsum-3.3.0+computecanada pyasn1-0.4.8+computecanada pyasn1-modules-0.2.8+computecanada requests-oauthlib-1.3.0+computecanada rsa-4.8+computecanada scipy-1.4.1+computecanada tensorboard-2.6.0+computecanada tensorboard-data-server-0.6.1+computecanada tensorboard-plugin-wit-1.8.0+computecanada tensorflow-estimator-2.3.0+computecanada tensorflow-gpu-2.3.0+computecanada werkzeug-2.0.3+computecanada wrapt-1.11.2+computecanada zipp-3.7.0+computecanada
Looking in links: /cvmfs/soft.computecanada.ca/custom/python/wheelhouse/nix/avx2, /cvmfs/soft.computecanada.ca/custom/python/wheelhouse/nix/generic, /cvmfs/soft.computecanada.ca/custom/python/wheelhouse/generic
Processing /cvmfs/soft.computecanada.ca/custom/python/wheelhouse/generic/keras-2.7.0+computecanada-py2.py3-none-any.whl
Installing collected packages: Keras
Successfully installed Keras-2.7.0+computecanada
Looking in links: /cvmfs/soft.computecanada.ca/custom/python/wheelhouse/nix/avx2, /cvmfs/soft.computecanada.ca/custom/python/wheelhouse/nix/generic, /cvmfs/soft.computecanada.ca/custom/python/wheelhouse/generic
Processing /cvmfs/soft.computecanada.ca/custom/python/wheelhouse/generic/urllib3-1.26.7+computecanada-py2.py3-none-any.whl
Installing collected packages: urllib3
  Attempting uninstall: urllib3
    Found existing installation: urllib3 1.26.8+computecanada
    Uninstalling urllib3-1.26.8+computecanada:
      Successfully uninstalled urllib3-1.26.8+computecanada
Successfully installed urllib3-1.26.7+computecanada
Looking in links: /cvmfs/soft.computecanada.ca/custom/python/wheelhouse/nix/avx2, /cvmfs/soft.computecanada.ca/custom/python/wheelhouse/nix/generic, /cvmfs/soft.computecanada.ca/custom/python/wheelhouse/generic
Processing /cvmfs/soft.computecanada.ca/custom/python/wheelhouse/generic/nltk-3.7+computecanada-py3-none-any.whl
Requirement already satisfied: joblib in /localscratch/yinan.27787820.0/env/lib/python3.7/site-packages (from nltk) (1.1.0+computecanada)
Requirement already satisfied: tqdm in /localscratch/yinan.27787820.0/env/lib/python3.7/site-packages (from nltk) (4.62.3+computecanada)
Processing /cvmfs/soft.computecanada.ca/custom/python/wheelhouse/generic/nltk-3.6.5+computecanada-py3-none-any.whl
Processing /cvmfs/soft.computecanada.ca/custom/python/wheelhouse/generic/nltk-3.6.3+computecanada-py3-none-any.whl
Requirement already satisfied: regex in /localscratch/yinan.27787820.0/env/lib/python3.7/site-packages (from nltk) (2020.11.13+computecanada)
Requirement already satisfied: click in /localscratch/yinan.27787820.0/env/lib/python3.7/site-packages (from nltk) (8.0.3+computecanada)
Requirement already satisfied: importlib-metadata in /localscratch/yinan.27787820.0/env/lib/python3.7/site-packages (from click->nltk) (4.10.1+computecanada)
Requirement already satisfied: zipp>=0.5 in /localscratch/yinan.27787820.0/env/lib/python3.7/site-packages (from importlib-metadata->click->nltk) (3.7.0+computecanada)
Requirement already satisfied: typing-extensions>=3.6.4 in /localscratch/yinan.27787820.0/env/lib/python3.7/site-packages (from importlib-metadata->click->nltk) (4.0.1+computecanada)
Installing collected packages: nltk
Successfully installed nltk-3.6.3+computecanada
Looking in links: /cvmfs/soft.computecanada.ca/custom/python/wheelhouse/nix/avx2, /cvmfs/soft.computecanada.ca/custom/python/wheelhouse/nix/generic, /cvmfs/soft.computecanada.ca/custom/python/wheelhouse/generic
Processing /cvmfs/soft.computecanada.ca/custom/python/wheelhouse/generic/scikit_learn-0.22.1+computecanada-cp37-cp37m-linux_x86_64.whl
Requirement already satisfied: joblib>=0.11 in /localscratch/yinan.27787820.0/env/lib/python3.7/site-packages (from scikit-learn==0.22.1) (1.1.0+computecanada)
Requirement already satisfied: numpy>=1.11.0 in /cvmfs/soft.computecanada.ca/easybuild/software/2017/Core/scipy-stack/2019a/lib/python3.7/site-packages (from scikit-learn==0.22.1) (1.16.0)
Requirement already satisfied: scipy>=0.17.0 in /localscratch/yinan.27787820.0/env/lib/python3.7/site-packages (from scikit-learn==0.22.1) (1.4.1+computecanada)
Installing collected packages: scikit-learn
Successfully installed scikit-learn-0.22.1+computecanada
Looking in links: /cvmfs/soft.computecanada.ca/custom/python/wheelhouse/nix/avx2, /cvmfs/soft.computecanada.ca/custom/python/wheelhouse/nix/generic, /cvmfs/soft.computecanada.ca/custom/python/wheelhouse/generic
Requirement already satisfied: tokenizers==0.5.2 in /localscratch/yinan.27787820.0/env/lib/python3.7/site-packages (0.5.2+computecanada)
wandb: Appending key for api.wandb.ai to your netrc file: /home/yinan/.netrc
Starting Task
2022-02-25 10:43:51.032579: I tensorflow/stream_executor/platform/default/dso_loader.cc:48] Successfully opened dynamic library libcudart.so.10.1
[nltk_data] Downloading package stopwords to /home/yinan/nltk_data...
[nltk_data]   Package stopwords is already up-to-date!
[nltk_data] Downloading package wordnet to /home/yinan/nltk_data...
[nltk_data]   Package wordnet is already up-to-date!
wandb: Currently logged in as: yinanazhou (use `wandb login --relogin` to force relogin)
wandb: wandb version 0.12.10 is available!  To upgrade, please run:
wandb:  $ pip install wandb --upgrade
2022-02-25 10:43:59.955772: I tensorflow/stream_executor/platform/default/dso_loader.cc:48] Successfully opened dynamic library libcudart.so.10.1
wandb: Tracking run with wandb version 0.12.5
wandb: Syncing run treasured-sea-1
wandb: ⭐️ View project at https://wandb.ai/yinanazhou/xl_512_bs_8_lr_1e07_es_50_lc_False_nr_False_stem_False_lemma_False_repeat_1_fold_1
wandb: 🚀 View run at https://wandb.ai/yinanazhou/xl_512_bs_8_lr_1e07_es_50_lc_False_nr_False_stem_False_lemma_False_repeat_1_fold_1/runs/2rllgid8
wandb: Run data is saved locally in /project/6002780/yinan/Thesis_MER_Lyrics/lyric-emotion/wandb/run-20220225_104357-2rllgid8
wandb: Run `wandb offline` to turn off syncing.

Validation loss decreased (inf --> 1.447266).  Saving model ...
Validation loss decreased (1.447266 --> 1.437970).  Saving model ...
Validation loss decreased (1.437970 --> 1.428082).  Saving model ...
Validation loss decreased (1.428082 --> 1.419422).  Saving model ...
Validation loss decreased (1.419422 --> 1.410801).  Saving model ...
Validation loss decreased (1.410801 --> 1.403790).  Saving model ...
Validation loss decreased (1.403790 --> 1.396325).  Saving model ...
Validation loss decreased (1.396325 --> 1.389933).  Saving model ...
Validation loss decreased (1.389933 --> 1.384976).  Saving model ...
Validation loss decreased (1.384976 --> 1.378998).  Saving model ...
Validation loss decreased (1.378998 --> 1.372438).  Saving model ...
Validation loss decreased (1.372438 --> 1.367018).  Saving model ...
Validation loss decreased (1.367018 --> 1.361318).  Saving model ...
Validation loss decreased (1.361318 --> 1.357056).  Saving model ...
Validation loss decreased (1.357056 --> 1.352462).  Saving model ...
Validation loss decreased (1.352462 --> 1.347467).  Saving model ...
Validation loss decreased (1.347467 --> 1.343710).  Saving model ...
Validation loss decreased (1.343710 --> 1.339687).  Saving model ...
Validation loss decreased (1.339687 --> 1.335850).  Saving model ...
Validation loss decreased (1.335850 --> 1.331873).  Saving model ...
Validation loss decreased (1.331873 --> 1.327640).  Saving model ...
Validation loss decreased (1.327640 --> 1.324385).  Saving model ...
Validation loss decreased (1.324385 --> 1.320620).  Saving model ...
Validation loss decreased (1.320620 --> 1.316456).  Saving model ...
Validation loss decreased (1.316456 --> 1.312808).  Saving model ...
Validation loss decreased (1.312808 --> 1.309726).  Saving model ...
Validation loss decreased (1.309726 --> 1.306804).  Saving model ...
Validation loss decreased (1.306804 --> 1.303609).  Saving model ...
Validation loss decreased (1.303609 --> 1.300115).  Saving model ...
Validation loss decreased (1.300115 --> 1.296964).  Saving model ...
Validation loss decreased (1.296964 --> 1.294100).  Saving model ...
Validation loss decreased (1.294100 --> 1.291073).  Saving model ...
Validation loss decreased (1.291073 --> 1.288614).  Saving model ...
Validation loss decreased (1.288614 --> 1.285543).  Saving model ...
Validation loss decreased (1.285543 --> 1.282380).  Saving model ...
Validation loss decreased (1.282380 --> 1.279665).  Saving model ...
Validation loss decreased (1.279665 --> 1.277156).  Saving model ...
Validation loss decreased (1.277156 --> 1.274100).  Saving model ...
Validation loss decreased (1.274100 --> 1.271296).  Saving model ...
Validation loss decreased (1.271296 --> 1.268631).  Saving model ...
Validation loss decreased (1.268631 --> 1.265496).  Saving model ...
Validation loss decreased (1.265496 --> 1.262232).  Saving model ...
Validation loss decreased (1.262232 --> 1.259580).  Saving model ...
Validation loss decreased (1.259580 --> 1.257002).  Saving model ...
Validation loss decreased (1.257002 --> 1.254105).  Saving model ...
Validation loss decreased (1.254105 --> 1.250817).  Saving model ...
Validation loss decreased (1.250817 --> 1.248023).  Saving model ...
Validation loss decreased (1.248023 --> 1.245421).  Saving model ...
Validation loss decreased (1.245421 --> 1.242726).  Saving model ...
Validation loss decreased (1.242726 --> 1.240046).  Saving model ...
Validation loss decreased (1.240046 --> 1.236974).  Saving model ...
Validation loss decreased (1.236974 --> 1.234185).  Saving model ...
Validation loss decreased (1.234185 --> 1.232467).  Saving model ...
Validation loss decreased (1.232467 --> 1.230033).  Saving model ...
Validation loss decreased (1.230033 --> 1.227734).  Saving model ...
Validation loss decreased (1.227734 --> 1.225117).  Saving model ...
Validation loss decreased (1.225117 --> 1.222807).  Saving model ...
Validation loss decreased (1.222807 --> 1.220420).  Saving model ...
Validation loss decreased (1.220420 --> 1.217257).  Saving model ...
Validation loss decreased (1.217257 --> 1.214080).  Saving model ...
Validation loss decreased (1.214080 --> 1.211504).  Saving model ...
Validation loss decreased (1.211504 --> 1.209025).  Saving model ...
Validation loss decreased (1.209025 --> 1.206252).  Saving model ...
Validation loss decreased (1.206252 --> 1.203766).  Saving model ...
Validation loss decreased (1.203766 --> 1.201381).  Saving model ...
Validation loss decreased (1.201381 --> 1.199346).  Saving model ...
Validation loss decreased (1.199346 --> 1.195874).  Saving model ...
Validation loss decreased (1.195874 --> 1.193373).  Saving model ...
Validation loss decreased (1.193373 --> 1.190509).  Saving model ...
Validation loss decreased (1.190509 --> 1.188051).  Saving model ...
Validation loss decreased (1.188051 --> 1.185908).  Saving model ...
Validation loss decreased (1.185908 --> 1.182441).  Saving model ...
Validation loss decreased (1.182441 --> 1.180518).  Saving model ...
Validation loss decreased (1.180518 --> 1.177906).  Saving model ...
Validation loss decreased (1.177906 --> 1.175591).  Saving model ...
Validation loss decreased (1.175591 --> 1.172585).  Saving model ...
Validation loss decreased (1.172585 --> 1.170681).  Saving model ...
Validation loss decreased (1.170681 --> 1.168675).  Saving model ...
Validation loss decreased (1.168675 --> 1.165697).  Saving model ...
Validation loss decreased (1.165697 --> 1.162733).  Saving model ...
Validation loss decreased (1.162733 --> 1.160420).  Saving model ...
Validation loss decreased (1.160420 --> 1.157852).  Saving model ...
Validation loss decreased (1.157852 --> 1.154953).  Saving model ...
Validation loss decreased (1.154953 --> 1.152608).  Saving model ...
Validation loss decreased (1.152608 --> 1.150433).  Saving model ...
Validation loss decreased (1.150433 --> 1.146321).  Saving model ...
Validation loss decreased (1.146321 --> 1.144510).  Saving model ...
Validation loss decreased (1.144510 --> 1.142464).  Saving model ...
Validation loss decreased (1.142464 --> 1.140439).  Saving model ...
Validation loss decreased (1.140439 --> 1.137561).  Saving model ...
Validation loss decreased (1.137561 --> 1.134989).  Saving model ...
Validation loss decreased (1.134989 --> 1.132545).  Saving model ...
Validation loss decreased (1.132545 --> 1.129488).  Saving model ...
Validation loss decreased (1.129488 --> 1.125604).  Saving model ...
Validation loss decreased (1.125604 --> 1.123842).  Saving model ...
Validation loss decreased (1.123842 --> 1.120446).  Saving model ...
Validation loss decreased (1.120446 --> 1.119579).  Saving model ...
Validation loss decreased (1.119579 --> 1.116534).  Saving model ...
Validation loss decreased (1.116534 --> 1.113922).  Saving model ...
Validation loss decreased (1.113922 --> 1.111873).  Saving model ...
Validation loss decreased (1.111873 --> 1.109070).  Saving model ...
Validation loss decreased (1.109070 --> 1.105903).  Saving model ...
Validation loss decreased (1.105903 --> 1.102078).  Saving model ...
Validation loss decreased (1.102078 --> 1.100934).  Saving model ...
EarlyStopping counter: 1 out of 50.0
EarlyStopping counter: 2 out of 50.0
Validation loss decreased (1.100934 --> 1.097475).  Saving model ...
Validation loss decreased (1.097475 --> 1.090840).  Saving model ...
Validation loss decreased (1.090840 --> 1.088853).  Saving model ...
Validation loss decreased (1.088853 --> 1.087111).  Saving model ...
Validation loss decreased (1.087111 --> 1.086100).  Saving model ...
Validation loss decreased (1.086100 --> 1.085459).  Saving model ...
EarlyStopping counter: 1 out of 50.0
Validation loss decreased (1.085459 --> 1.082830).  Saving model ...
Validation loss decreased (1.082830 --> 1.076488).  Saving model ...
Validation loss decreased (1.076488 --> 1.075228).  Saving model ...
Validation loss decreased (1.075228 --> 1.072619).  Saving model ...
Validation loss decreased (1.072619 --> 1.068811).  Saving model ...
EarlyStopping counter: 1 out of 50.0
Validation loss decreased (1.068811 --> 1.067721).  Saving model ...
Validation loss decreased (1.067721 --> 1.066020).  Saving model ...
Validation loss decreased (1.066020 --> 1.063806).  Saving model ...
Validation loss decreased (1.063806 --> 1.061452).  Saving model ...
Validation loss decreased (1.061452 --> 1.060221).  Saving model ...
Validation loss decreased (1.060221 --> 1.057816).  Saving model ...
Validation loss decreased (1.057816 --> 1.056333).  Saving model ...
Validation loss decreased (1.056333 --> 1.054592).  Saving model ...
EarlyStopping counter: 1 out of 50.0
Validation loss decreased (1.054592 --> 1.052147).  Saving model ...
Validation loss decreased (1.052147 --> 1.049725).  Saving model ...
Validation loss decreased (1.049725 --> 1.046112).  Saving model ...
EarlyStopping counter: 1 out of 50.0
EarlyStopping counter: 2 out of 50.0
EarlyStopping counter: 3 out of 50.0
EarlyStopping counter: 4 out of 50.0
Validation loss decreased (1.046112 --> 1.043559).  Saving model ...
Validation loss decreased (1.043559 --> 1.040102).  Saving model ...
EarlyStopping counter: 1 out of 50.0
EarlyStopping counter: 2 out of 50.0
Validation loss decreased (1.040102 --> 1.036209).  Saving model ...
Validation loss decreased (1.036209 --> 1.033615).  Saving model ...
EarlyStopping counter: 1 out of 50.0
Validation loss decreased (1.033615 --> 1.032157).  Saving model ...
Validation loss decreased (1.032157 --> 1.032104).  Saving model ...
Validation loss decreased (1.032104 --> 1.028753).  Saving model ...
Validation loss decreased (1.028753 --> 1.027747).  Saving model ...
Validation loss decreased (1.027747 --> 1.024468).  Saving model ...
Validation loss decreased (1.024468 --> 1.024419).  Saving model ...
Validation loss decreased (1.024419 --> 1.020536).  Saving model ...
EarlyStopping counter: 1 out of 50.0
EarlyStopping counter: 2 out of 50.0
Validation loss decreased (1.020536 --> 1.019872).  Saving model ...
Validation loss decreased (1.019872 --> 1.015223).  Saving model ...
Validation loss decreased (1.015223 --> 1.015153).  Saving model ...
EarlyStopping counter: 1 out of 50.0
EarlyStopping counter: 2 out of 50.0
Validation loss decreased (1.015153 --> 1.014514).  Saving model ...
Validation loss decreased (1.014514 --> 1.012840).  Saving model ...
Validation loss decreased (1.012840 --> 1.007441).  Saving model ...
EarlyStopping counter: 1 out of 50.0
EarlyStopping counter: 2 out of 50.0
EarlyStopping counter: 3 out of 50.0
EarlyStopping counter: 4 out of 50.0
EarlyStopping counter: 5 out of 50.0
EarlyStopping counter: 6 out of 50.0
Validation loss decreased (1.007441 --> 1.006093).  Saving model ...
EarlyStopping counter: 1 out of 50.0
EarlyStopping counter: 2 out of 50.0
EarlyStopping counter: 3 out of 50.0
Validation loss decreased (1.006093 --> 1.003951).  Saving model ...
EarlyStopping counter: 1 out of 50.0
Validation loss decreased (1.003951 --> 0.999011).  Saving model ...
EarlyStopping counter: 1 out of 50.0
EarlyStopping counter: 2 out of 50.0
Validation loss decreased (0.999011 --> 0.998733).  Saving model ...
Validation loss decreased (0.998733 --> 0.997306).  Saving model ...
Validation loss decreased (0.997306 --> 0.995317).  Saving model ...
Validation loss decreased (0.995317 --> 0.993892).  Saving model ...
EarlyStopping counter: 1 out of 50.0
EarlyStopping counter: 2 out of 50.0
Validation loss decreased (0.993892 --> 0.992318).  Saving model ...
EarlyStopping counter: 1 out of 50.0
EarlyStopping counter: 2 out of 50.0
Validation loss decreased (0.992318 --> 0.990441).  Saving model ...
Validation loss decreased (0.990441 --> 0.990026).  Saving model ...
Validation loss decreased (0.990026 --> 0.988669).  Saving model ...
EarlyStopping counter: 1 out of 50.0
Validation loss decreased (0.988669 --> 0.988235).  Saving model ...
Validation loss decreased (0.988235 --> 0.987834).  Saving model ...
EarlyStopping counter: 1 out of 50.0
Validation loss decreased (0.987834 --> 0.987612).  Saving model ...
Validation loss decreased (0.987612 --> 0.987303).  Saving model ...
Validation loss decreased (0.987303 --> 0.983879).  Saving model ...
Validation loss decreased (0.983879 --> 0.982175).  Saving model ...
Validation loss decreased (0.982175 --> 0.981865).  Saving model ...
Validation loss decreased (0.981865 --> 0.981380).  Saving model ...
EarlyStopping counter: 1 out of 50.0
Validation loss decreased (0.981380 --> 0.980810).  Saving model ...
Validation loss decreased (0.980810 --> 0.980567).  Saving model ...
EarlyStopping counter: 1 out of 50.0
Validation loss decreased (0.980567 --> 0.980537).  Saving model ...
Validation loss decreased (0.980537 --> 0.977889).  Saving model ...
EarlyStopping counter: 1 out of 50.0
EarlyStopping counter: 2 out of 50.0
Validation loss decreased (0.977889 --> 0.977818).  Saving model ...
EarlyStopping counter: 1 out of 50.0
EarlyStopping counter: 2 out of 50.0
Validation loss decreased (0.977818 --> 0.976537).  Saving model ...
EarlyStopping counter: 1 out of 50.0
EarlyStopping counter: 2 out of 50.0
EarlyStopping counter: 3 out of 50.0
EarlyStopping counter: 4 out of 50.0
EarlyStopping counter: 5 out of 50.0
EarlyStopping counter: 6 out of 50.0
EarlyStopping counter: 7 out of 50.0
Validation loss decreased (0.976537 --> 0.974283).  Saving model ...
Validation loss decreased (0.974283 --> 0.972175).  Saving model ...
Validation loss decreased (0.972175 --> 0.971662).  Saving model ...
Validation loss decreased (0.971662 --> 0.970684).  Saving model ...
EarlyStopping counter: 1 out of 50.0
Validation loss decreased (0.970684 --> 0.969559).  Saving model ...
EarlyStopping counter: 1 out of 50.0
Validation loss decreased (0.969559 --> 0.968793).  Saving model ...
Validation loss decreased (0.968793 --> 0.967654).  Saving model ...
EarlyStopping counter: 1 out of 50.0
Validation loss decreased (0.967654 --> 0.966751).  Saving model ...
EarlyStopping counter: 1 out of 50.0
EarlyStopping counter: 2 out of 50.0
EarlyStopping counter: 3 out of 50.0
EarlyStopping counter: 4 out of 50.0
Validation loss decreased (0.966751 --> 0.965659).  Saving model ...
Validation loss decreased (0.965659 --> 0.965253).  Saving model ...
Validation loss decreased (0.965253 --> 0.964719).  Saving model ...
EarlyStopping counter: 1 out of 50.0
Validation loss decreased (0.964719 --> 0.963148).  Saving model ...
EarlyStopping counter: 1 out of 50.0
EarlyStopping counter: 2 out of 50.0
Validation loss decreased (0.963148 --> 0.961735).  Saving model ...
EarlyStopping counter: 1 out of 50.0
EarlyStopping counter: 2 out of 50.0
EarlyStopping counter: 3 out of 50.0
Validation loss decreased (0.961735 --> 0.961624).  Saving model ...
EarlyStopping counter: 1 out of 50.0
EarlyStopping counter: 2 out of 50.0
EarlyStopping counter: 3 out of 50.0
Validation loss decreased (0.961624 --> 0.960949).  Saving model ...
EarlyStopping counter: 1 out of 50.0
EarlyStopping counter: 2 out of 50.0
EarlyStopping counter: 3 out of 50.0
EarlyStopping counter: 4 out of 50.0
EarlyStopping counter: 5 out of 50.0
Validation loss decreased (0.960949 --> 0.960329).  Saving model ...
EarlyStopping counter: 1 out of 50.0
EarlyStopping counter: 2 out of 50.0
EarlyStopping counter: 3 out of 50.0
EarlyStopping counter: 4 out of 50.0
EarlyStopping counter: 5 out of 50.0
EarlyStopping counter: 6 out of 50.0
EarlyStopping counter: 7 out of 50.0
EarlyStopping counter: 8 out of 50.0
EarlyStopping counter: 9 out of 50.0
EarlyStopping counter: 10 out of 50.0
EarlyStopping counter: 11 out of 50.0
EarlyStopping counter: 12 out of 50.0
EarlyStopping counter: 13 out of 50.0
EarlyStopping counter: 14 out of 50.0
EarlyStopping counter: 15 out of 50.0
EarlyStopping counter: 16 out of 50.0
EarlyStopping counter: 17 out of 50.0
EarlyStopping counter: 18 out of 50.0
EarlyStopping counter: 19 out of 50.0
EarlyStopping counter: 20 out of 50.0
EarlyStopping counter: 21 out of 50.0
EarlyStopping counter: 22 out of 50.0
EarlyStopping counter: 23 out of 50.0
EarlyStopping counter: 24 out of 50.0
EarlyStopping counter: 25 out of 50.0
EarlyStopping counter: 26 out of 50.0
EarlyStopping counter: 27 out of 50.0
EarlyStopping counter: 28 out of 50.0
EarlyStopping counter: 29 out of 50.0
EarlyStopping counter: 30 out of 50.0
EarlyStopping counter: 31 out of 50.0
EarlyStopping counter: 32 out of 50.0
EarlyStopping counter: 33 out of 50.0
EarlyStopping counter: 34 out of 50.0
EarlyStopping counter: 35 out of 50.0
EarlyStopping counter: 36 out of 50.0
EarlyStopping counter: 37 out of 50.0
EarlyStopping counter: 38 out of 50.0
EarlyStopping counter: 39 out of 50.0
EarlyStopping counter: 40 out of 50.0
EarlyStopping counter: 41 out of 50.0
EarlyStopping counter: 42 out of 50.0
EarlyStopping counter: 43 out of 50.0
EarlyStopping counter: 44 out of 50.0
EarlyStopping counter: 45 out of 50.0
EarlyStopping counter: 46 out of 50.0
EarlyStopping counter: 47 out of 50.0
EarlyStopping counter: 48 out of 50.0
EarlyStopping counter: 49 out of 50.0
EarlyStopping counter: 50 out of 50.0
/localscratch/yinan.27787820.0/env/lib/python3.7/site-packages/torch/nn/functional.py:1794: UserWarning: nn.functional.tanh is deprecated. Use torch.tanh instead.
  warnings.warn("nn.functional.tanh is deprecated. Use torch.tanh instead.")
/localscratch/yinan.27787820.0/env/lib/python3.7/site-packages/transformers/optimization.py:155: UserWarning: This overload of add_ is deprecated:
	add_(Number alpha, Tensor other)
Consider using one of the following signatures instead:
	add_(Tensor other, *, Number alpha) (Triggered internally at  ../torch/csrc/utils/python_arg_parser.cpp:1025.)
  exp_avg.mul_(beta1).add_(1.0 - beta1, grad)
wandb: Waiting for W&B process to finish, PID 6510... (success).
wandb: - 0.00MB of 0.00MB uploaded (0.00MB deduped)wandb: \ 0.00MB of 0.00MB uploaded (0.00MB deduped)wandb: | 0.00MB of 0.00MB uploaded (0.00MB deduped)wandb: / 0.00MB of 0.00MB uploaded (0.00MB deduped)wandb: - 0.00MB of 0.00MB uploaded (0.00MB deduped)wandb: \ 0.00MB of 0.00MB uploaded (0.00MB deduped)wandb: | 0.00MB of 0.00MB uploaded (0.00MB deduped)wandb: / 0.00MB of 0.00MB uploaded (0.00MB deduped)wandb: - 0.00MB of 0.00MB uploaded (0.00MB deduped)wandb: \ 0.00MB of 0.00MB uploaded (0.00MB deduped)wandb: | 0.00MB of 0.00MB uploaded (0.00MB deduped)wandb: / 0.00MB of 0.00MB uploaded (0.00MB deduped)wandb:                                                                                
wandb: Run history:
wandb:     e_F1 ▁▂▃▄▅▅▆▆▆▆▆▆▇▇▇▇▇███████████████████████
wandb:   e_loss ██▇▆▆▆▅▅▅▄▄▄▄▃▃▃▃▂▂▂▂▂▂▂▁▁▁▁▁▁▁▁▁▁▁▁▁▁▁▁
wandb:     t_F1 ▁▁▂▂▃▃▃▄▄▅▄▅▅▅▆▅▆▆▆▆▆▆▆▆▇▇▇▇▇▇▇▇▇▇█▇████
wandb:   t_loss ███▇▇▇▇▆▆▆▆▆▅▅▅▅▄▄▄▄▄▃▃▃▃▃▃▃▃▂▂▂▂▂▂▂▁▁▁▁
wandb: 
wandb: Run summary:
wandb:     e_F1 58.96646
wandb:   e_loss 0.96935
wandb:     t_F1 81.28505
wandb:   t_loss 0.56597
wandb: 
wandb: Synced 4 W&B file(s), 0 media file(s), 0 artifact file(s) and 0 other file(s)
wandb: Synced treasured-sea-1: https://wandb.ai/yinanazhou/xl_512_bs_8_lr_1e07_es_50_lc_False_nr_False_stem_False_lemma_False_repeat_1_fold_1/runs/2rllgid8
wandb: Find logs at: ./wandb/run-20220225_104357-2rllgid8/logs/debug.log
wandb: 

wandb: wandb version 0.12.10 is available!  To upgrade, please run:
wandb:  $ pip install wandb --upgrade
2022-02-25 15:29:24.364364: I tensorflow/stream_executor/platform/default/dso_loader.cc:48] Successfully opened dynamic library libcudart.so.10.1
wandb: Tracking run with wandb version 0.12.5
wandb: Syncing run fresh-feather-1
wandb: ⭐️ View project at https://wandb.ai/yinanazhou/xl_512_bs_8_lr_1e07_es_50_lc_False_nr_False_stem_False_lemma_False_repeat_1_fold_2
wandb: 🚀 View run at https://wandb.ai/yinanazhou/xl_512_bs_8_lr_1e07_es_50_lc_False_nr_False_stem_False_lemma_False_repeat_1_fold_2/runs/3vch882e
wandb: Run data is saved locally in /project/6002780/yinan/Thesis_MER_Lyrics/lyric-emotion/wandb/run-20220225_152921-3vch882e
wandb: Run `wandb offline` to turn off syncing.

Validation loss decreased (inf --> 1.447695).  Saving model ...
Validation loss decreased (1.447695 --> 1.440998).  Saving model ...
Validation loss decreased (1.440998 --> 1.434973).  Saving model ...
Validation loss decreased (1.434973 --> 1.429762).  Saving model ...
Validation loss decreased (1.429762 --> 1.425083).  Saving model ...
Validation loss decreased (1.425083 --> 1.420804).  Saving model ...
Validation loss decreased (1.420804 --> 1.416609).  Saving model ...
Validation loss decreased (1.416609 --> 1.412957).  Saving model ...
Validation loss decreased (1.412957 --> 1.409720).  Saving model ...
Validation loss decreased (1.409720 --> 1.406203).  Saving model ...
Validation loss decreased (1.406203 --> 1.403326).  Saving model ...
Validation loss decreased (1.403326 --> 1.400893).  Saving model ...
Validation loss decreased (1.400893 --> 1.398186).  Saving model ...
Validation loss decreased (1.398186 --> 1.395662).  Saving model ...
Validation loss decreased (1.395662 --> 1.393108).  Saving model ...
Validation loss decreased (1.393108 --> 1.390825).  Saving model ...
Validation loss decreased (1.390825 --> 1.388757).  Saving model ...
Validation loss decreased (1.388757 --> 1.387042).  Saving model ...
Validation loss decreased (1.387042 --> 1.385121).  Saving model ...
Validation loss decreased (1.385121 --> 1.383241).  Saving model ...
Validation loss decreased (1.383241 --> 1.381424).  Saving model ...
Validation loss decreased (1.381424 --> 1.379665).  Saving model ...
Validation loss decreased (1.379665 --> 1.378026).  Saving model ...
Validation loss decreased (1.378026 --> 1.376500).  Saving model ...
Validation loss decreased (1.376500 --> 1.375004).  Saving model ...
Validation loss decreased (1.375004 --> 1.373427).  Saving model ...
Validation loss decreased (1.373427 --> 1.371932).  Saving model ...
Validation loss decreased (1.371932 --> 1.370339).  Saving model ...
Validation loss decreased (1.370339 --> 1.368951).  Saving model ...
Validation loss decreased (1.368951 --> 1.367330).  Saving model ...
Validation loss decreased (1.367330 --> 1.365729).  Saving model ...
Validation loss decreased (1.365729 --> 1.364261).  Saving model ...
Validation loss decreased (1.364261 --> 1.362885).  Saving model ...
Validation loss decreased (1.362885 --> 1.361398).  Saving model ...
Validation loss decreased (1.361398 --> 1.359888).  Saving model ...
Validation loss decreased (1.359888 --> 1.358394).  Saving model ...
Validation loss decreased (1.358394 --> 1.356864).  Saving model ...
Validation loss decreased (1.356864 --> 1.355397).  Saving model ...
Validation loss decreased (1.355397 --> 1.353919).  Saving model ...
Validation loss decreased (1.353919 --> 1.352498).  Saving model ...
Validation loss decreased (1.352498 --> 1.350909).  Saving model ...
Validation loss decreased (1.350909 --> 1.348920).  Saving model ...
Validation loss decreased (1.348920 --> 1.347713).  Saving model ...
Validation loss decreased (1.347713 --> 1.346159).  Saving model ...
Validation loss decreased (1.346159 --> 1.344550).  Saving model ...
Validation loss decreased (1.344550 --> 1.342329).  Saving model ...
Validation loss decreased (1.342329 --> 1.340548).  Saving model ...
Validation loss decreased (1.340548 --> 1.338585).  Saving model ...
Validation loss decreased (1.338585 --> 1.336881).  Saving model ...
Validation loss decreased (1.336881 --> 1.335090).  Saving model ...
Validation loss decreased (1.335090 --> 1.333776).  Saving model ...
Validation loss decreased (1.333776 --> 1.330746).  Saving model ...
Validation loss decreased (1.330746 --> 1.328804).  Saving model ...
Validation loss decreased (1.328804 --> 1.326566).  Saving model ...
Validation loss decreased (1.326566 --> 1.324730).  Saving model ...
Validation loss decreased (1.324730 --> 1.322331).  Saving model ...
Validation loss decreased (1.322331 --> 1.320307).  Saving model ...
Validation loss decreased (1.320307 --> 1.317891).  Saving model ...
Validation loss decreased (1.317891 --> 1.315844).  Saving model ...
Validation loss decreased (1.315844 --> 1.313754).  Saving model ...
Validation loss decreased (1.313754 --> 1.311829).  Saving model ...
Validation loss decreased (1.311829 --> 1.309632).  Saving model ...
Validation loss decreased (1.309632 --> 1.307112).  Saving model ...
Validation loss decreased (1.307112 --> 1.304487).  Saving model ...
Validation loss decreased (1.304487 --> 1.302222).  Saving model ...
Validation loss decreased (1.302222 --> 1.299650).  Saving model ...
Validation loss decreased (1.299650 --> 1.296977).  Saving model ...
Validation loss decreased (1.296977 --> 1.294827).  Saving model ...
Validation loss decreased (1.294827 --> 1.292825).  Saving model ...
Validation loss decreased (1.292825 --> 1.289704).  Saving model ...
Validation loss decreased (1.289704 --> 1.287185).  Saving model ...
Validation loss decreased (1.287185 --> 1.284675).  Saving model ...
Validation loss decreased (1.284675 --> 1.282078).  Saving model ...
Validation loss decreased (1.282078 --> 1.279877).  Saving model ...
Validation loss decreased (1.279877 --> 1.277099).  Saving model ...
Validation loss decreased (1.277099 --> 1.275258).  Saving model ...
Validation loss decreased (1.275258 --> 1.272758).  Saving model ...
Validation loss decreased (1.272758 --> 1.269993).  Saving model ...
Validation loss decreased (1.269993 --> 1.267436).  Saving model ...
Validation loss decreased (1.267436 --> 1.264666).  Saving model ...
Validation loss decreased (1.264666 --> 1.261933).  Saving model ...
Validation loss decreased (1.261933 --> 1.259790).  Saving model ...
Validation loss decreased (1.259790 --> 1.256755).  Saving model ...
Validation loss decreased (1.256755 --> 1.254615).  Saving model ...
Validation loss decreased (1.254615 --> 1.253403).  Saving model ...
Validation loss decreased (1.253403 --> 1.251279).  Saving model ...
Validation loss decreased (1.251279 --> 1.247879).  Saving model ...
Validation loss decreased (1.247879 --> 1.245450).  Saving model ...
Validation loss decreased (1.245450 --> 1.243172).  Saving model ...
Validation loss decreased (1.243172 --> 1.240763).  Saving model ...
Validation loss decreased (1.240763 --> 1.237895).  Saving model ...
Validation loss decreased (1.237895 --> 1.235121).  Saving model ...
Validation loss decreased (1.235121 --> 1.232893).  Saving model ...
Validation loss decreased (1.232893 --> 1.230764).  Saving model ...
Validation loss decreased (1.230764 --> 1.228170).  Saving model ...
Validation loss decreased (1.228170 --> 1.224859).  Saving model ...
Validation loss decreased (1.224859 --> 1.222145).  Saving model ...
Validation loss decreased (1.222145 --> 1.219916).  Saving model ...
Validation loss decreased (1.219916 --> 1.217220).  Saving model ...
Validation loss decreased (1.217220 --> 1.214480).  Saving model ...
Validation loss decreased (1.214480 --> 1.212161).  Saving model ...
Validation loss decreased (1.212161 --> 1.210256).  Saving model ...
Validation loss decreased (1.210256 --> 1.207898).  Saving model ...
Validation loss decreased (1.207898 --> 1.205256).  Saving model ...
Validation loss decreased (1.205256 --> 1.201798).  Saving model ...
Validation loss decreased (1.201798 --> 1.199164).  Saving model ...
Validation loss decreased (1.199164 --> 1.196319).  Saving model ...
Validation loss decreased (1.196319 --> 1.193147).  Saving model ...
Validation loss decreased (1.193147 --> 1.189909).  Saving model ...
Validation loss decreased (1.189909 --> 1.187114).  Saving model ...
Validation loss decreased (1.187114 --> 1.184768).  Saving model ...
Validation loss decreased (1.184768 --> 1.181857).  Saving model ...
Validation loss decreased (1.181857 --> 1.178740).  Saving model ...
Validation loss decreased (1.178740 --> 1.175529).  Saving model ...
Validation loss decreased (1.175529 --> 1.172466).  Saving model ...
Validation loss decreased (1.172466 --> 1.169497).  Saving model ...
Validation loss decreased (1.169497 --> 1.167400).  Saving model ...
Validation loss decreased (1.167400 --> 1.164839).  Saving model ...
Validation loss decreased (1.164839 --> 1.161119).  Saving model ...
Validation loss decreased (1.161119 --> 1.158687).  Saving model ...
Validation loss decreased (1.158687 --> 1.156160).  Saving model ...
Validation loss decreased (1.156160 --> 1.153148).  Saving model ...
Validation loss decreased (1.153148 --> 1.149953).  Saving model ...
Validation loss decreased (1.149953 --> 1.147811).  Saving model ...
Validation loss decreased (1.147811 --> 1.145221).  Saving model ...
Validation loss decreased (1.145221 --> 1.143245).  Saving model ...
Validation loss decreased (1.143245 --> 1.139822).  Saving model ...
Validation loss decreased (1.139822 --> 1.136891).  Saving model ...
Validation loss decreased (1.136891 --> 1.134553).  Saving model ...
Validation loss decreased (1.134553 --> 1.130897).  Saving model ...
Validation loss decreased (1.130897 --> 1.128638).  Saving model ...
Validation loss decreased (1.128638 --> 1.125994).  Saving model ...
Validation loss decreased (1.125994 --> 1.123383).  Saving model ...
Validation loss decreased (1.123383 --> 1.121000).  Saving model ...
Validation loss decreased (1.121000 --> 1.119280).  Saving model ...
Validation loss decreased (1.119280 --> 1.115686).  Saving model ...
Validation loss decreased (1.115686 --> 1.112369).  Saving model ...
Validation loss decreased (1.112369 --> 1.109959).  Saving model ...
Validation loss decreased (1.109959 --> 1.108001).  Saving model ...
Validation loss decreased (1.108001 --> 1.105354).  Saving model ...
Validation loss decreased (1.105354 --> 1.102770).  Saving model ...
Validation loss decreased (1.102770 --> 1.100145).  Saving model ...
Validation loss decreased (1.100145 --> 1.097913).  Saving model ...
Validation loss decreased (1.097913 --> 1.095450).  Saving model ...
Validation loss decreased (1.095450 --> 1.092729).  Saving model ...
Validation loss decreased (1.092729 --> 1.090239).  Saving model ...
Validation loss decreased (1.090239 --> 1.088461).  Saving model ...
Validation loss decreased (1.088461 --> 1.085999).  Saving model ...
Validation loss decreased (1.085999 --> 1.083312).  Saving model ...
Validation loss decreased (1.083312 --> 1.080815).  Saving model ...
Validation loss decreased (1.080815 --> 1.078642).  Saving model ...
Validation loss decreased (1.078642 --> 1.075527).  Saving model ...
Validation loss decreased (1.075527 --> 1.073099).  Saving model ...
Validation loss decreased (1.073099 --> 1.070332).  Saving model ...
Validation loss decreased (1.070332 --> 1.068320).  Saving model ...
Validation loss decreased (1.068320 --> 1.065904).  Saving model ...
Validation loss decreased (1.065904 --> 1.064105).  Saving model ...
Validation loss decreased (1.064105 --> 1.061555).  Saving model ...
Validation loss decreased (1.061555 --> 1.059478).  Saving model ...
Validation loss decreased (1.059478 --> 1.056119).  Saving model ...
Validation loss decreased (1.056119 --> 1.054204).  Saving model ...
Validation loss decreased (1.054204 --> 1.052144).  Saving model ...
Validation loss decreased (1.052144 --> 1.050426).  Saving model ...
Validation loss decreased (1.050426 --> 1.048300).  Saving model ...
Validation loss decreased (1.048300 --> 1.046007).  Saving model ...
Validation loss decreased (1.046007 --> 1.044207).  Saving model ...
Validation loss decreased (1.044207 --> 1.042280).  Saving model ...
Validation loss decreased (1.042280 --> 1.040481).  Saving model ...
Validation loss decreased (1.040481 --> 1.038375).  Saving model ...
Validation loss decreased (1.038375 --> 1.035793).  Saving model ...
Validation loss decreased (1.035793 --> 1.033161).  Saving model ...
Validation loss decreased (1.033161 --> 1.030164).  Saving model ...
Validation loss decreased (1.030164 --> 1.028336).  Saving model ...
Validation loss decreased (1.028336 --> 1.026484).  Saving model ...
Validation loss decreased (1.026484 --> 1.024934).  Saving model ...
Validation loss decreased (1.024934 --> 1.022533).  Saving model ...
Validation loss decreased (1.022533 --> 1.020569).  Saving model ...
Validation loss decreased (1.020569 --> 1.018152).  Saving model ...
Validation loss decreased (1.018152 --> 1.016418).  Saving model ...
Validation loss decreased (1.016418 --> 1.014882).  Saving model ...
Validation loss decreased (1.014882 --> 1.013397).  Saving model ...
Validation loss decreased (1.013397 --> 1.012035).  Saving model ...
Validation loss decreased (1.012035 --> 1.010911).  Saving model ...
Validation loss decreased (1.010911 --> 1.009068).  Saving model ...
Validation loss decreased (1.009068 --> 1.006891).  Saving model ...
Validation loss decreased (1.006891 --> 1.005072).  Saving model ...
Validation loss decreased (1.005072 --> 1.003511).  Saving model ...
Validation loss decreased (1.003511 --> 1.001544).  Saving model ...
Validation loss decreased (1.001544 --> 0.999240).  Saving model ...
Validation loss decreased (0.999240 --> 0.997514).  Saving model ...
Validation loss decreased (0.997514 --> 0.995875).  Saving model ...
Validation loss decreased (0.995875 --> 0.994507).  Saving model ...
Validation loss decreased (0.994507 --> 0.992915).  Saving model ...
Validation loss decreased (0.992915 --> 0.990909).  Saving model ...
Validation loss decreased (0.990909 --> 0.989485).  Saving model ...
Validation loss decreased (0.989485 --> 0.987236).  Saving model ...
Validation loss decreased (0.987236 --> 0.986377).  Saving model ...
Validation loss decreased (0.986377 --> 0.984601).  Saving model ...
Validation loss decreased (0.984601 --> 0.983577).  Saving model ...
Validation loss decreased (0.983577 --> 0.983052).  Saving model ...
Validation loss decreased (0.983052 --> 0.981426).  Saving model ...
Validation loss decreased (0.981426 --> 0.980377).  Saving model ...
Validation loss decreased (0.980377 --> 0.979582).  Saving model ...
Validation loss decreased (0.979582 --> 0.978673).  Saving model ...
Validation loss decreased (0.978673 --> 0.977086).  Saving model ...
Validation loss decreased (0.977086 --> 0.975562).  Saving model ...
Validation loss decreased (0.975562 --> 0.974355).  Saving model ...
Validation loss decreased (0.974355 --> 0.972955).  Saving model ...
Validation loss decreased (0.972955 --> 0.972407).  Saving model ...
Validation loss decreased (0.972407 --> 0.971319).  Saving model ...
Validation loss decreased (0.971319 --> 0.970035).  Saving model ...
Validation loss decreased (0.970035 --> 0.968675).  Saving model ...
Validation loss decreased (0.968675 --> 0.967750).  Saving model ...
Validation loss decreased (0.967750 --> 0.966964).  Saving model ...
Validation loss decreased (0.966964 --> 0.965529).  Saving model ...
Validation loss decreased (0.965529 --> 0.964499).  Saving model ...
Validation loss decreased (0.964499 --> 0.964289).  Saving model ...
Validation loss decreased (0.964289 --> 0.962855).  Saving model ...
Validation loss decreased (0.962855 --> 0.962831).  Saving model ...
Validation loss decreased (0.962831 --> 0.962346).  Saving model ...
Validation loss decreased (0.962346 --> 0.960223).  Saving model ...
Validation loss decreased (0.960223 --> 0.959248).  Saving model ...
Validation loss decreased (0.959248 --> 0.958596).  Saving model ...
Validation loss decreased (0.958596 --> 0.957368).  Saving model ...
Validation loss decreased (0.957368 --> 0.956219).  Saving model ...
Validation loss decreased (0.956219 --> 0.955732).  Saving model ...
Validation loss decreased (0.955732 --> 0.954264).  Saving model ...
Validation loss decreased (0.954264 --> 0.953433).  Saving model ...
Validation loss decreased (0.953433 --> 0.952331).  Saving model ...
Validation loss decreased (0.952331 --> 0.951868).  Saving model ...
Validation loss decreased (0.951868 --> 0.951214).  Saving model ...
Validation loss decreased (0.951214 --> 0.950661).  Saving model ...
Validation loss decreased (0.950661 --> 0.949705).  Saving model ...
Validation loss decreased (0.949705 --> 0.948719).  Saving model ...
Validation loss decreased (0.948719 --> 0.948327).  Saving model ...
Validation loss decreased (0.948327 --> 0.947816).  Saving model ...
Validation loss decreased (0.947816 --> 0.947446).  Saving model ...
Validation loss decreased (0.947446 --> 0.946563).  Saving model ...
EarlyStopping counter: 1 out of 50.0
Validation loss decreased (0.946563 --> 0.945906).  Saving model ...
Validation loss decreased (0.945906 --> 0.945064).  Saving model ...
Validation loss decreased (0.945064 --> 0.943962).  Saving model ...
EarlyStopping counter: 1 out of 50.0
Validation loss decreased (0.943962 --> 0.942945).  Saving model ...
EarlyStopping counter: 1 out of 50.0
Validation loss decreased (0.942945 --> 0.941291).  Saving model ...
EarlyStopping counter: 1 out of 50.0
Validation loss decreased (0.941291 --> 0.940877).  Saving model ...
Validation loss decreased (0.940877 --> 0.940253).  Saving model ...
Validation loss decreased (0.940253 --> 0.939937).  Saving model ...
Validation loss decreased (0.939937 --> 0.939499).  Saving model ...
Validation loss decreased (0.939499 --> 0.939284).  Saving model ...
Validation loss decreased (0.939284 --> 0.938550).  Saving model ...
Validation loss decreased (0.938550 --> 0.938524).  Saving model ...
EarlyStopping counter: 1 out of 50.0
EarlyStopping counter: 2 out of 50.0
EarlyStopping counter: 3 out of 50.0
Validation loss decreased (0.938524 --> 0.937703).  Saving model ...
EarlyStopping counter: 1 out of 50.0
Validation loss decreased (0.937703 --> 0.936869).  Saving model ...
Validation loss decreased (0.936869 --> 0.936177).  Saving model ...
EarlyStopping counter: 1 out of 50.0
EarlyStopping counter: 2 out of 50.0
EarlyStopping counter: 3 out of 50.0
EarlyStopping counter: 4 out of 50.0
EarlyStopping counter: 5 out of 50.0
EarlyStopping counter: 6 out of 50.0
EarlyStopping counter: 7 out of 50.0
Validation loss decreased (0.936177 --> 0.934665).  Saving model ...
EarlyStopping counter: 1 out of 50.0
EarlyStopping counter: 2 out of 50.0
EarlyStopping counter: 3 out of 50.0
EarlyStopping counter: 4 out of 50.0
EarlyStopping counter: 5 out of 50.0
EarlyStopping counter: 6 out of 50.0
EarlyStopping counter: 7 out of 50.0
EarlyStopping counter: 8 out of 50.0
EarlyStopping counter: 9 out of 50.0
EarlyStopping counter: 10 out of 50.0
EarlyStopping counter: 11 out of 50.0
EarlyStopping counter: 12 out of 50.0
EarlyStopping counter: 13 out of 50.0
EarlyStopping counter: 14 out of 50.0
EarlyStopping counter: 15 out of 50.0
EarlyStopping counter: 16 out of 50.0
EarlyStopping counter: 17 out of 50.0
EarlyStopping counter: 18 out of 50.0
EarlyStopping counter: 19 out of 50.0
EarlyStopping counter: 20 out of 50.0
EarlyStopping counter: 21 out of 50.0
EarlyStopping counter: 22 out of 50.0
EarlyStopping counter: 23 out of 50.0
EarlyStopping counter: 24 out of 50.0
EarlyStopping counter: 25 out of 50.0
EarlyStopping counter: 26 out of 50.0
EarlyStopping counter: 27 out of 50.0
EarlyStopping counter: 28 out of 50.0
EarlyStopping counter: 29 out of 50.0
EarlyStopping counter: 30 out of 50.0
EarlyStopping counter: 31 out of 50.0
EarlyStopping counter: 32 out of 50.0
EarlyStopping counter: 33 out of 50.0
EarlyStopping counter: 34 out of 50.0
EarlyStopping counter: 35 out of 50.0
EarlyStopping counter: 36 out of 50.0
EarlyStopping counter: 37 out of 50.0
EarlyStopping counter: 38 out of 50.0
EarlyStopping counter: 39 out of 50.0
EarlyStopping counter: 40 out of 50.0
EarlyStopping counter: 41 out of 50.0
EarlyStopping counter: 42 out of 50.0
EarlyStopping counter: 43 out of 50.0
EarlyStopping counter: 44 out of 50.0
EarlyStopping counter: 45 out of 50.0
EarlyStopping counter: 46 out of 50.0
EarlyStopping counter: 47 out of 50.0
EarlyStopping counter: 48 out of 50.0
EarlyStopping counter: 49 out of 50.0
EarlyStopping counter: 50 out of 50.0
/localscratch/yinan.27787820.0/env/lib/python3.7/site-packages/torch/nn/functional.py:1794: UserWarning: nn.functional.tanh is deprecated. Use torch.tanh instead.
  warnings.warn("nn.functional.tanh is deprecated. Use torch.tanh instead.")
wandb: Waiting for W&B process to finish, PID 21861... (success).
wandb: - 0.00MB of 0.00MB uploaded (0.00MB deduped)wandb: \ 0.00MB of 0.00MB uploaded (0.00MB deduped)wandb: | 0.00MB of 0.00MB uploaded (0.00MB deduped)wandb: / 0.00MB of 0.00MB uploaded (0.00MB deduped)wandb: - 0.00MB of 0.00MB uploaded (0.00MB deduped)wandb: \ 0.00MB of 0.00MB uploaded (0.00MB deduped)wandb: | 0.00MB of 0.00MB uploaded (0.00MB deduped)wandb: / 0.00MB of 0.00MB uploaded (0.00MB deduped)wandb: - 0.00MB of 0.00MB uploaded (0.00MB deduped)wandb: \ 0.00MB of 0.00MB uploaded (0.00MB deduped)wandb: | 0.00MB of 0.00MB uploaded (0.00MB deduped)wandb: / 0.00MB of 0.00MB uploaded (0.00MB deduped)wandb:                                                                                
wandb: Run history:
wandb:     e_F1 ▁▁▂▃▄▄▄▅▅▆▆▆▆▆▆▇▇▇▇▇▇▇▇▇▇▇▇█████████████
wandb:   e_loss ██▇▇▇▇▇▆▆▆▆▅▅▅▄▄▄▃▃▃▃▂▂▂▂▂▁▁▁▁▁▁▁▁▁▁▁▁▁▁
wandb:     t_F1 ▁▁▂▂▂▃▃▃▃▄▄▄▄▅▅▅▆▅▆▆▆▆▇▇▇▇▇▇▇▇▇▇▇▇▇█████
wandb:   t_loss ████▇▇▇▇▇▇▇▆▆▆▆▆▅▅▅▅▄▄▄▄▄▃▃▃▃▃▂▂▂▂▂▂▁▁▁▁
wandb: 
wandb: Run summary:
wandb:     e_F1 59.41272
wandb:   e_loss 0.94838
wandb:     t_F1 80.33091
wandb:   t_loss 0.59174
wandb: 
wandb: Synced 4 W&B file(s), 0 media file(s), 0 artifact file(s) and 0 other file(s)
wandb: Synced fresh-feather-1: https://wandb.ai/yinanazhou/xl_512_bs_8_lr_1e07_es_50_lc_False_nr_False_stem_False_lemma_False_repeat_1_fold_2/runs/3vch882e
wandb: Find logs at: ./wandb/run-20220225_152921-3vch882e/logs/debug.log
wandb: 

wandb: wandb version 0.12.10 is available!  To upgrade, please run:
wandb:  $ pip install wandb --upgrade
2022-02-25 20:32:08.102935: I tensorflow/stream_executor/platform/default/dso_loader.cc:48] Successfully opened dynamic library libcudart.so.10.1
wandb: Tracking run with wandb version 0.12.5
wandb: Syncing run worthy-plant-1
wandb: ⭐️ View project at https://wandb.ai/yinanazhou/xl_512_bs_8_lr_1e07_es_50_lc_False_nr_False_stem_False_lemma_False_repeat_2_fold_1
wandb: 🚀 View run at https://wandb.ai/yinanazhou/xl_512_bs_8_lr_1e07_es_50_lc_False_nr_False_stem_False_lemma_False_repeat_2_fold_1/runs/lqpqfpxu
wandb: Run data is saved locally in /project/6002780/yinan/Thesis_MER_Lyrics/lyric-emotion/wandb/run-20220225_203205-lqpqfpxu
wandb: Run `wandb offline` to turn off syncing.
slurmstepd: error: *** JOB 27787820 ON cdr2576 CANCELLED AT 2022-02-25T20:40:33 DUE TO TIME LIMIT ***
