Unloading StdEnv/2020

Due to MODULEPATH changes, the following have been reloaded:
  1) mii/1.1.1


The following have been reloaded with a version change:
  1) python/3.8.2 => python/3.7.4

Using base prefix '/cvmfs/soft.computecanada.ca/easybuild/software/2017/Core/python/3.7.4'
New python executable in /localscratch/yinan.28698709.0/env/bin/python
Installing setuptools, pip, wheel...
done.
Ignoring pip: markers 'python_version < "3"' don't match your environment
Looking in links: /cvmfs/soft.computecanada.ca/custom/python/wheelhouse/nix/avx2, /cvmfs/soft.computecanada.ca/custom/python/wheelhouse/nix/generic, /cvmfs/soft.computecanada.ca/custom/python/wheelhouse/generic
Collecting pip
Installing collected packages: pip
  Found existing installation: pip 19.1.1
    Uninstalling pip-19.1.1:
      Successfully uninstalled pip-19.1.1
Successfully installed pip-21.2.3+computecanada
Looking in links: /cvmfs/soft.computecanada.ca/custom/python/wheelhouse/nix/avx2, /cvmfs/soft.computecanada.ca/custom/python/wheelhouse/nix/generic, /cvmfs/soft.computecanada.ca/custom/python/wheelhouse/generic
Processing /cvmfs/soft.computecanada.ca/custom/python/wheelhouse/generic/keras-2.8.0+computecanada-py2.py3-none-any.whl
Processing /cvmfs/soft.computecanada.ca/custom/python/wheelhouse/generic/Keras_Preprocessing-1.1.2+computecanada-py3-none-any.whl
Requirement already satisfied: matplotlib in /cvmfs/soft.computecanada.ca/easybuild/software/2017/Core/scipy-stack/2019a/lib/python3.7/site-packages (from -r requirements.txt (line 3)) (3.0.2)
Processing /cvmfs/soft.computecanada.ca/custom/python/wheelhouse/generic/nltk-3.6.5+computecanada-py3-none-any.whl
Processing /cvmfs/soft.computecanada.ca/custom/python/wheelhouse/generic/scikit_learn-0.22.1+computecanada-cp37-cp37m-linux_x86_64.whl
Processing /cvmfs/soft.computecanada.ca/custom/python/wheelhouse/generic/tensorboard-2.3.0+computecanada-py3-none-any.whl
Processing /cvmfs/soft.computecanada.ca/custom/python/wheelhouse/generic/tensorboard_plugin_wit-1.7.0+computecanada-py3-none-any.whl
Processing /cvmfs/soft.computecanada.ca/custom/python/wheelhouse/generic/tensorflow_gpu-2.3.0+computecanada-cp37-cp37m-linux_x86_64.whl
Processing /cvmfs/soft.computecanada.ca/custom/python/wheelhouse/generic/tensorflow_estimator-2.3.0+computecanada-py2.py3-none-any.whl
Processing /cvmfs/soft.computecanada.ca/custom/python/wheelhouse/generic/tokenizers-0.5.2+computecanada-cp37-cp37m-linux_x86_64.whl
Processing /cvmfs/soft.computecanada.ca/custom/python/wheelhouse/nix/avx2/torch-1.4.0+computecanada-cp37-cp37m-linux_x86_64.whl
Processing /cvmfs/soft.computecanada.ca/custom/python/wheelhouse/generic/torchtext-0.6.0+computecanada-py3-none-any.whl
Processing /cvmfs/soft.computecanada.ca/custom/python/wheelhouse/generic/torchvision-0.8.2+computecanada-cp37-cp37m-linux_x86_64.whl
Processing /cvmfs/soft.computecanada.ca/custom/python/wheelhouse/generic/transformers-2.5.1+computecanada-py3-none-any.whl
Processing /cvmfs/soft.computecanada.ca/custom/python/wheelhouse/generic/urllib3-1.26.7+computecanada-py2.py3-none-any.whl
Processing /cvmfs/soft.computecanada.ca/custom/python/wheelhouse/generic/joblib-1.1.0+computecanada-py2.py3-none-any.whl
Processing /cvmfs/soft.computecanada.ca/custom/python/wheelhouse/generic/tqdm-4.63.0+computecanada-py2.py3-none-any.whl
Processing /cvmfs/soft.computecanada.ca/custom/python/wheelhouse/generic/click-8.0.3+computecanada-py3-none-any.whl
ERROR: Could not find a version that satisfies the requirement regex>=2021.8.3 (from nltk) (from versions: 2018.1.10+computecanada, 2019.11.1+computecanada, 2020.11.13+computecanada)
ERROR: No matching distribution found for regex>=2021.8.3
Looking in links: /cvmfs/soft.computecanada.ca/custom/python/wheelhouse/nix/avx2, /cvmfs/soft.computecanada.ca/custom/python/wheelhouse/nix/generic, /cvmfs/soft.computecanada.ca/custom/python/wheelhouse/generic
ERROR: Could not find a version that satisfies the requirement numpy==1.20.0+computacanada (from versions: 1.15.0+computecanada, 1.15.2+computecanada, 1.15.4+computecanada, 1.16.0+computecanada, 1.16.2+computecanada, 1.16.3+computecanada, 1.17.4+computecanada, 1.18.1+computecanada, 1.18.4+computecanada, 1.19.1+computecanada, 1.19.2+computecanada, 1.20.2+computecanada)
ERROR: No matching distribution found for numpy==1.20.0+computacanada
Looking in links: /cvmfs/soft.computecanada.ca/custom/python/wheelhouse/nix/avx2, /cvmfs/soft.computecanada.ca/custom/python/wheelhouse/nix/generic, /cvmfs/soft.computecanada.ca/custom/python/wheelhouse/generic
Processing /cvmfs/soft.computecanada.ca/custom/python/wheelhouse/generic/wandb-0.12.5+computecanada-py2.py3-none-any.whl
Processing /cvmfs/soft.computecanada.ca/custom/python/wheelhouse/generic/docker_pycreds-0.4.0+computecanada-py2.py3-none-any.whl
Requirement already satisfied: requests<3,>=2.0.0 in /cvmfs/soft.computecanada.ca/easybuild/software/2017/Core/scipy-stack/2019a/lib/python3.7/site-packages (from wandb) (2.21.0)
Processing /cvmfs/soft.computecanada.ca/custom/python/wheelhouse/generic/subprocess32-3.5.4+computecanada-py3-none-any.whl
Processing /cvmfs/soft.computecanada.ca/custom/python/wheelhouse/generic/GitPython-3.1.24+computecanada-py3-none-any.whl
Processing /cvmfs/soft.computecanada.ca/custom/python/wheelhouse/generic/promise-2.3+computecanada-py3-none-any.whl
Processing /cvmfs/soft.computecanada.ca/custom/python/wheelhouse/generic/pathtools-0.1.2+computecanada-py3-none-any.whl
Processing /cvmfs/soft.computecanada.ca/custom/python/wheelhouse/generic/click-8.0.3+computecanada-py3-none-any.whl
Processing /cvmfs/soft.computecanada.ca/custom/python/wheelhouse/generic/configparser-5.0.2+computecanada-py3-none-any.whl
Processing /cvmfs/soft.computecanada.ca/custom/python/wheelhouse/generic/shortuuid-1.0.1+computecanada-py3-none-any.whl
Processing /cvmfs/soft.computecanada.ca/custom/python/wheelhouse/generic/yaspin-2.1.0+computecanada-py3-none-any.whl
Processing /cvmfs/soft.computecanada.ca/custom/python/wheelhouse/generic/psutil-5.7.3+computecanada-cp37-cp37m-linux_x86_64.whl
Processing /cvmfs/soft.computecanada.ca/custom/python/wheelhouse/generic/sentry_sdk-1.5.0+computecanada-py2.py3-none-any.whl
Processing /cvmfs/soft.computecanada.ca/custom/python/wheelhouse/generic/PyYAML-5.3.1+computecanada-cp37-cp37m-linux_x86_64.whl
Processing /cvmfs/soft.computecanada.ca/custom/python/wheelhouse/generic/six-1.16.0+computecanada-py2.py3-none-any.whl
Processing /cvmfs/soft.computecanada.ca/custom/python/wheelhouse/generic/protobuf-3.19.4+computecanada-py2.py3-none-any.whl
Requirement already satisfied: python-dateutil>=2.6.1 in /cvmfs/soft.computecanada.ca/easybuild/software/2017/Core/scipy-stack/2019a/lib/python3.7/site-packages (from wandb) (2.7.5)
Requirement already satisfied: importlib-metadata in /cvmfs/soft.computecanada.ca/easybuild/software/2017/Core/scipy-stack/2019a/lib/python3.7/site-packages (from Click!=8.0.0,>=7.0->wandb) (0.8)
Processing /cvmfs/soft.computecanada.ca/custom/python/wheelhouse/generic/typing_extensions-4.0.1+computecanada-py3-none-any.whl
Processing /cvmfs/soft.computecanada.ca/custom/python/wheelhouse/generic/gitdb-4.0.9+computecanada-py3-none-any.whl
Processing /cvmfs/soft.computecanada.ca/custom/python/wheelhouse/generic/smmap-5.0.0+computecanada-py3-none-any.whl
Requirement already satisfied: urllib3<1.25,>=1.21.1 in /cvmfs/soft.computecanada.ca/easybuild/software/2017/Core/scipy-stack/2019a/lib/python3.7/site-packages (from requests<3,>=2.0.0->wandb) (1.24.1)
Requirement already satisfied: idna<2.9,>=2.5 in /cvmfs/soft.computecanada.ca/easybuild/software/2017/Core/scipy-stack/2019a/lib/python3.7/site-packages (from requests<3,>=2.0.0->wandb) (2.8)
Requirement already satisfied: chardet<3.1.0,>=3.0.2 in /cvmfs/soft.computecanada.ca/easybuild/software/2017/Core/scipy-stack/2019a/lib/python3.7/site-packages (from requests<3,>=2.0.0->wandb) (3.0.4)
Requirement already satisfied: certifi>=2017.4.17 in /cvmfs/soft.computecanada.ca/easybuild/software/2017/Core/scipy-stack/2019a/lib/python3.7/site-packages (from requests<3,>=2.0.0->wandb) (2018.11.29)
Processing /cvmfs/soft.computecanada.ca/custom/python/wheelhouse/generic/termcolor-1.1.0+computecanada-py3-none-any.whl
Requirement already satisfied: zipp>=0.3.2 in /cvmfs/soft.computecanada.ca/easybuild/software/2017/Core/scipy-stack/2019a/lib/python3.7/site-packages (from importlib-metadata->Click!=8.0.0,>=7.0->wandb) (0.3.3)
Installing collected packages: smmap, typing-extensions, termcolor, six, gitdb, yaspin, subprocess32, shortuuid, sentry-sdk, PyYAML, psutil, protobuf, promise, pathtools, GitPython, docker-pycreds, configparser, Click, wandb
  Attempting uninstall: six
    Found existing installation: six 1.12.0
    Not uninstalling six at /cvmfs/soft.computecanada.ca/easybuild/software/2017/Core/scipy-stack/2019a/lib/python3.7/site-packages, outside environment /localscratch/yinan.28698709.0/env
    Can't uninstall 'six'. No files were found to uninstall.
Successfully installed Click-8.0.3+computecanada GitPython-3.1.24+computecanada PyYAML-5.3.1+computecanada configparser-5.0.2+computecanada docker-pycreds-0.4.0+computecanada gitdb-4.0.9+computecanada pathtools-0.1.2+computecanada promise-2.3+computecanada protobuf-3.19.4+computecanada psutil-5.7.3+computecanada sentry-sdk-1.5.0+computecanada shortuuid-1.0.1+computecanada six-1.16.0+computecanada smmap-5.0.0+computecanada subprocess32-3.5.4+computecanada termcolor-1.1.0+computecanada typing-extensions-4.0.1+computecanada wandb-0.12.5+computecanada yaspin-2.1.0+computecanada
Looking in links: /cvmfs/soft.computecanada.ca/custom/python/wheelhouse/nix/avx2, /cvmfs/soft.computecanada.ca/custom/python/wheelhouse/nix/generic, /cvmfs/soft.computecanada.ca/custom/python/wheelhouse/generic
ERROR: Could not find a version that satisfies the requirement sagemaker (from versions: none)
ERROR: No matching distribution found for sagemaker
Looking in links: /cvmfs/soft.computecanada.ca/custom/python/wheelhouse/nix/avx2, /cvmfs/soft.computecanada.ca/custom/python/wheelhouse/nix/generic, /cvmfs/soft.computecanada.ca/custom/python/wheelhouse/generic
Processing /cvmfs/soft.computecanada.ca/custom/python/wheelhouse/generic/torch-1.9.1+computecanada-cp37-cp37m-linux_x86_64.whl
Requirement already satisfied: typing-extensions in /localscratch/yinan.28698709.0/env/lib/python3.7/site-packages (from torch) (4.0.1+computecanada)
Installing collected packages: torch
Successfully installed torch-1.9.1+computecanada
Looking in links: /cvmfs/soft.computecanada.ca/custom/python/wheelhouse/nix/avx2, /cvmfs/soft.computecanada.ca/custom/python/wheelhouse/nix/generic, /cvmfs/soft.computecanada.ca/custom/python/wheelhouse/generic
Processing /cvmfs/soft.computecanada.ca/custom/python/wheelhouse/generic/transformers-2.5.1+computecanada-py3-none-any.whl
Processing /cvmfs/soft.computecanada.ca/custom/python/wheelhouse/generic/regex-2020.11.13+computecanada-cp37-cp37m-linux_x86_64.whl
Processing /cvmfs/soft.computecanada.ca/custom/python/wheelhouse/generic/filelock-3.4.2+computecanada-py3-none-any.whl
Requirement already satisfied: requests in /cvmfs/soft.computecanada.ca/easybuild/software/2017/Core/scipy-stack/2019a/lib/python3.7/site-packages (from transformers==2.5.1+computecanada) (2.21.0)
Processing /cvmfs/soft.computecanada.ca/custom/python/wheelhouse/generic/boto3-1.20.52+computecanada-py3-none-any.whl
Processing /cvmfs/soft.computecanada.ca/custom/python/wheelhouse/generic/sacremoses-0.0.46+computecanada-py3-none-any.whl
Processing /cvmfs/soft.computecanada.ca/custom/python/wheelhouse/generic/tqdm-4.63.0+computecanada-py2.py3-none-any.whl
Processing /cvmfs/soft.computecanada.ca/custom/python/wheelhouse/generic/sentencepiece-0.1.91+computecanada-cp37-cp37m-linux_x86_64.whl
Processing /cvmfs/soft.computecanada.ca/custom/python/wheelhouse/generic/tokenizers-0.5.2+computecanada-cp37-cp37m-linux_x86_64.whl
Requirement already satisfied: numpy in /cvmfs/soft.computecanada.ca/easybuild/software/2017/Core/scipy-stack/2019a/lib/python3.7/site-packages (from transformers==2.5.1+computecanada) (1.16.0)
Processing /cvmfs/soft.computecanada.ca/custom/python/wheelhouse/generic/jmespath-0.10.0+computecanada-py2.py3-none-any.whl
Processing /cvmfs/soft.computecanada.ca/custom/python/wheelhouse/generic/botocore-1.23.52+computecanada-py3-none-any.whl
Processing /cvmfs/soft.computecanada.ca/custom/python/wheelhouse/generic/s3transfer-0.5.1+computecanada-py3-none-any.whl
Requirement already satisfied: python-dateutil<3.0.0,>=2.1 in /cvmfs/soft.computecanada.ca/easybuild/software/2017/Core/scipy-stack/2019a/lib/python3.7/site-packages (from botocore<1.24.0,>=1.23.52->boto3->transformers==2.5.1+computecanada) (2.7.5)
Processing /cvmfs/soft.computecanada.ca/custom/python/wheelhouse/generic/urllib3-1.26.8+computecanada-py2.py3-none-any.whl
Requirement already satisfied: six>=1.5 in /localscratch/yinan.28698709.0/env/lib/python3.7/site-packages (from python-dateutil<3.0.0,>=2.1->botocore<1.24.0,>=1.23.52->boto3->transformers==2.5.1+computecanada) (1.16.0+computecanada)
Requirement already satisfied: chardet<3.1.0,>=3.0.2 in /cvmfs/soft.computecanada.ca/easybuild/software/2017/Core/scipy-stack/2019a/lib/python3.7/site-packages (from requests->transformers==2.5.1+computecanada) (3.0.4)
Requirement already satisfied: idna<2.9,>=2.5 in /cvmfs/soft.computecanada.ca/easybuild/software/2017/Core/scipy-stack/2019a/lib/python3.7/site-packages (from requests->transformers==2.5.1+computecanada) (2.8)
Processing /cvmfs/soft.computecanada.ca/custom/python/wheelhouse/generic/requests-2.27.1+computecanada-py2.py3-none-any.whl
Processing /cvmfs/soft.computecanada.ca/custom/python/wheelhouse/generic/charset_normalizer-2.0.11+computecanada-py3-none-any.whl
Requirement already satisfied: certifi>=2017.4.17 in /cvmfs/soft.computecanada.ca/easybuild/software/2017/Core/scipy-stack/2019a/lib/python3.7/site-packages (from requests->transformers==2.5.1+computecanada) (2018.11.29)
Processing /cvmfs/soft.computecanada.ca/custom/python/wheelhouse/generic/joblib-1.1.0+computecanada-py2.py3-none-any.whl
Requirement already satisfied: click in /localscratch/yinan.28698709.0/env/lib/python3.7/site-packages (from sacremoses->transformers==2.5.1+computecanada) (8.0.3+computecanada)
Requirement already satisfied: importlib-metadata in /cvmfs/soft.computecanada.ca/easybuild/software/2017/Core/scipy-stack/2019a/lib/python3.7/site-packages (from click->sacremoses->transformers==2.5.1+computecanada) (0.8)
Requirement already satisfied: zipp>=0.3.2 in /cvmfs/soft.computecanada.ca/easybuild/software/2017/Core/scipy-stack/2019a/lib/python3.7/site-packages (from importlib-metadata->click->sacremoses->transformers==2.5.1+computecanada) (0.3.3)
Installing collected packages: urllib3, jmespath, botocore, tqdm, s3transfer, regex, joblib, charset-normalizer, tokenizers, sentencepiece, sacremoses, requests, filelock, boto3, transformers
  Attempting uninstall: urllib3
    Found existing installation: urllib3 1.24.1
    Not uninstalling urllib3 at /cvmfs/soft.computecanada.ca/easybuild/software/2017/Core/scipy-stack/2019a/lib/python3.7/site-packages, outside environment /localscratch/yinan.28698709.0/env
    Can't uninstall 'urllib3'. No files were found to uninstall.
  Attempting uninstall: requests
    Found existing installation: requests 2.21.0
    Not uninstalling requests at /cvmfs/soft.computecanada.ca/easybuild/software/2017/Core/scipy-stack/2019a/lib/python3.7/site-packages, outside environment /localscratch/yinan.28698709.0/env
    Can't uninstall 'requests'. No files were found to uninstall.
Successfully installed boto3-1.20.52+computecanada botocore-1.23.52+computecanada charset-normalizer-2.0.11+computecanada filelock-3.4.2+computecanada jmespath-0.10.0+computecanada joblib-1.1.0+computecanada regex-2020.11.13+computecanada requests-2.27.1+computecanada s3transfer-0.5.1+computecanada sacremoses-0.0.46+computecanada sentencepiece-0.1.91+computecanada tokenizers-0.5.2+computecanada tqdm-4.63.0+computecanada transformers-2.5.1+computecanada urllib3-1.26.8+computecanada
Looking in links: /cvmfs/soft.computecanada.ca/custom/python/wheelhouse/nix/avx2, /cvmfs/soft.computecanada.ca/custom/python/wheelhouse/nix/generic, /cvmfs/soft.computecanada.ca/custom/python/wheelhouse/generic
Processing /cvmfs/soft.computecanada.ca/custom/python/wheelhouse/generic/tensorflow_gpu-2.3.0+computecanada-cp37-cp37m-linux_x86_64.whl
Requirement already satisfied: protobuf>=3.9.2 in /localscratch/yinan.28698709.0/env/lib/python3.7/site-packages (from tensorflow_gpu==2.3.0+computecanada) (3.19.4+computecanada)
Processing /cvmfs/soft.computecanada.ca/custom/python/wheelhouse/generic/grpcio-1.38.0+computecanada-cp37-cp37m-linux_x86_64.whl
Processing /cvmfs/soft.computecanada.ca/custom/python/wheelhouse/nix/avx2/h5py-2.10.0+computecanada-cp37-cp37m-linux_x86_64.whl
Processing /cvmfs/soft.computecanada.ca/custom/python/wheelhouse/generic/google_pasta-0.2.0+computecanada-py3-none-any.whl
Processing /cvmfs/soft.computecanada.ca/custom/python/wheelhouse/generic/astunparse-1.6.3+computecanada-py2.py3-none-any.whl
Requirement already satisfied: termcolor>=1.1.0 in /localscratch/yinan.28698709.0/env/lib/python3.7/site-packages (from tensorflow_gpu==2.3.0+computecanada) (1.1.0+computecanada)
Processing /cvmfs/soft.computecanada.ca/custom/python/wheelhouse/generic/tensorflow_estimator-2.3.0+computecanada-py2.py3-none-any.whl
Requirement already satisfied: numpy<1.19.0,>=1.16.0 in /cvmfs/soft.computecanada.ca/easybuild/software/2017/Core/scipy-stack/2019a/lib/python3.7/site-packages (from tensorflow_gpu==2.3.0+computecanada) (1.16.0)
Processing /cvmfs/soft.computecanada.ca/custom/python/wheelhouse/generic/gast-0.3.3+computecanada-py3-none-any.whl
Requirement already satisfied: wheel>=0.26 in /localscratch/yinan.28698709.0/env/lib/python3.7/site-packages (from tensorflow_gpu==2.3.0+computecanada) (0.33.4)
Processing /cvmfs/soft.computecanada.ca/custom/python/wheelhouse/generic/Keras_Preprocessing-1.1.2+computecanada-py3-none-any.whl
Requirement already satisfied: six>=1.12.0 in /localscratch/yinan.28698709.0/env/lib/python3.7/site-packages (from tensorflow_gpu==2.3.0+computecanada) (1.16.0+computecanada)
Processing /cvmfs/soft.computecanada.ca/custom/python/wheelhouse/generic/absl_py-1.0.0+computecanada-py3-none-any.whl
Processing /cvmfs/soft.computecanada.ca/custom/python/wheelhouse/generic/wrapt-1.11.2+computecanada-cp37-cp37m-linux_x86_64.whl
Processing /cvmfs/soft.computecanada.ca/custom/python/wheelhouse/generic/tensorboard-2.8.0+computecanada-py3-none-any.whl
Processing /cvmfs/soft.computecanada.ca/custom/python/wheelhouse/generic/opt_einsum-3.3.0+computecanada-py3-none-any.whl
Processing /cvmfs/soft.computecanada.ca/custom/python/wheelhouse/nix/generic/scipy-1.4.1+computecanada-cp37-cp37m-linux_x86_64.whl
Processing /cvmfs/soft.computecanada.ca/custom/python/wheelhouse/generic/Werkzeug-2.0.3+computecanada-py3-none-any.whl
Processing /cvmfs/soft.computecanada.ca/custom/python/wheelhouse/generic/google_auth-2.3.3+computecanada-py2.py3-none-any.whl
Processing /cvmfs/soft.computecanada.ca/custom/python/wheelhouse/generic/Markdown-3.3.6+computecanada-py3-none-any.whl
Processing /cvmfs/soft.computecanada.ca/custom/python/wheelhouse/generic/tensorboard_plugin_wit-1.8.0+computecanada-py3-none-any.whl
Processing /cvmfs/soft.computecanada.ca/custom/python/wheelhouse/generic/google_auth_oauthlib-0.4.6+computecanada-py2.py3-none-any.whl
Requirement already satisfied: setuptools>=41.0.0 in /localscratch/yinan.28698709.0/env/lib/python3.7/site-packages (from tensorboard<3,>=2.3.0->tensorflow_gpu==2.3.0+computecanada) (41.0.1)
Requirement already satisfied: requests<3,>=2.21.0 in /localscratch/yinan.28698709.0/env/lib/python3.7/site-packages (from tensorboard<3,>=2.3.0->tensorflow_gpu==2.3.0+computecanada) (2.27.1+computecanada)
Processing /cvmfs/soft.computecanada.ca/custom/python/wheelhouse/generic/tensorboard_data_server-0.6.1+computecanada-py3-none-linux_x86_64.whl
Processing /cvmfs/soft.computecanada.ca/custom/python/wheelhouse/generic/pyasn1_modules-0.2.8+computecanada-py2.py3-none-any.whl
Processing /cvmfs/soft.computecanada.ca/custom/python/wheelhouse/generic/rsa-4.8+computecanada-py3-none-any.whl
Processing /cvmfs/soft.computecanada.ca/custom/python/wheelhouse/generic/cachetools-4.2.4+computecanada-py3-none-any.whl
Processing /cvmfs/soft.computecanada.ca/custom/python/wheelhouse/generic/requests_oauthlib-1.3.0+computecanada-py2.py3-none-any.whl
Processing /cvmfs/soft.computecanada.ca/custom/python/wheelhouse/generic/importlib_metadata-4.10.1+computecanada-py3-none-any.whl
Requirement already satisfied: typing-extensions>=3.6.4 in /localscratch/yinan.28698709.0/env/lib/python3.7/site-packages (from importlib-metadata>=4.4->markdown>=2.6.8->tensorboard<3,>=2.3.0->tensorflow_gpu==2.3.0+computecanada) (4.0.1+computecanada)
Processing /cvmfs/soft.computecanada.ca/custom/python/wheelhouse/generic/zipp-3.7.0+computecanada-py3-none-any.whl
Processing /cvmfs/soft.computecanada.ca/custom/python/wheelhouse/generic/pyasn1-0.4.8+computecanada-py2.py3-none-any.whl
Requirement already satisfied: certifi>=2017.4.17 in /cvmfs/soft.computecanada.ca/easybuild/software/2017/Core/scipy-stack/2019a/lib/python3.7/site-packages (from requests<3,>=2.21.0->tensorboard<3,>=2.3.0->tensorflow_gpu==2.3.0+computecanada) (2018.11.29)
Requirement already satisfied: idna<4,>=2.5 in /cvmfs/soft.computecanada.ca/easybuild/software/2017/Core/scipy-stack/2019a/lib/python3.7/site-packages (from requests<3,>=2.21.0->tensorboard<3,>=2.3.0->tensorflow_gpu==2.3.0+computecanada) (2.8)
Requirement already satisfied: urllib3<1.27,>=1.21.1 in /localscratch/yinan.28698709.0/env/lib/python3.7/site-packages (from requests<3,>=2.21.0->tensorboard<3,>=2.3.0->tensorflow_gpu==2.3.0+computecanada) (1.26.8+computecanada)
Requirement already satisfied: charset-normalizer~=2.0.0 in /localscratch/yinan.28698709.0/env/lib/python3.7/site-packages (from requests<3,>=2.21.0->tensorboard<3,>=2.3.0->tensorflow_gpu==2.3.0+computecanada) (2.0.11+computecanada)
Processing /cvmfs/soft.computecanada.ca/custom/python/wheelhouse/generic/oauthlib-3.1.1+computecanada-py2.py3-none-any.whl
Installing collected packages: pyasn1, zipp, rsa, pyasn1-modules, oauthlib, cachetools, requests-oauthlib, importlib-metadata, google-auth, werkzeug, tensorboard-plugin-wit, tensorboard-data-server, markdown, grpcio, google-auth-oauthlib, absl-py, wrapt, tensorflow-estimator, tensorboard, scipy, opt-einsum, keras-preprocessing, h5py, google-pasta, gast, astunparse, tensorflow-gpu
  Attempting uninstall: pyasn1
    Found existing installation: pyasn1 0.4.3
    Not uninstalling pyasn1 at /cvmfs/soft.computecanada.ca/easybuild/software/2017/Core/scipy-stack/2019a/lib/python3.7/site-packages, outside environment /localscratch/yinan.28698709.0/env
    Can't uninstall 'pyasn1'. No files were found to uninstall.
  Attempting uninstall: zipp
    Found existing installation: zipp 0.3.3
    Not uninstalling zipp at /cvmfs/soft.computecanada.ca/easybuild/software/2017/Core/scipy-stack/2019a/lib/python3.7/site-packages, outside environment /localscratch/yinan.28698709.0/env
    Can't uninstall 'zipp'. No files were found to uninstall.
  Attempting uninstall: importlib-metadata
    Found existing installation: importlib-metadata 0.8
    Not uninstalling importlib-metadata at /cvmfs/soft.computecanada.ca/easybuild/software/2017/Core/scipy-stack/2019a/lib/python3.7/site-packages, outside environment /localscratch/yinan.28698709.0/env
    Can't uninstall 'importlib-metadata'. No files were found to uninstall.
  Attempting uninstall: scipy
    Found existing installation: scipy 1.2.0
    Not uninstalling scipy at /cvmfs/soft.computecanada.ca/easybuild/software/2017/Core/scipy-stack/2019a/lib/python3.7/site-packages, outside environment /localscratch/yinan.28698709.0/env
    Can't uninstall 'scipy'. No files were found to uninstall.
Successfully installed absl-py-1.0.0+computecanada astunparse-1.6.3+computecanada cachetools-4.2.4+computecanada gast-0.3.3+computecanada google-auth-2.3.3+computecanada google-auth-oauthlib-0.4.6+computecanada google-pasta-0.2.0+computecanada grpcio-1.38.0+computecanada h5py-2.10.0+computecanada importlib-metadata-4.10.1+computecanada keras-preprocessing-1.1.2+computecanada markdown-3.3.6+computecanada oauthlib-3.1.1+computecanada opt-einsum-3.3.0+computecanada pyasn1-0.4.8+computecanada pyasn1-modules-0.2.8+computecanada requests-oauthlib-1.3.0+computecanada rsa-4.8+computecanada scipy-1.4.1+computecanada tensorboard-2.8.0+computecanada tensorboard-data-server-0.6.1+computecanada tensorboard-plugin-wit-1.8.0+computecanada tensorflow-estimator-2.3.0+computecanada tensorflow-gpu-2.3.0+computecanada werkzeug-2.0.3+computecanada wrapt-1.11.2+computecanada zipp-3.7.0+computecanada
Looking in links: /cvmfs/soft.computecanada.ca/custom/python/wheelhouse/nix/avx2, /cvmfs/soft.computecanada.ca/custom/python/wheelhouse/nix/generic, /cvmfs/soft.computecanada.ca/custom/python/wheelhouse/generic
Processing /cvmfs/soft.computecanada.ca/custom/python/wheelhouse/generic/keras-2.8.0+computecanada-py2.py3-none-any.whl
Installing collected packages: Keras
Successfully installed Keras-2.8.0+computecanada
Looking in links: /cvmfs/soft.computecanada.ca/custom/python/wheelhouse/nix/avx2, /cvmfs/soft.computecanada.ca/custom/python/wheelhouse/nix/generic, /cvmfs/soft.computecanada.ca/custom/python/wheelhouse/generic
Processing /cvmfs/soft.computecanada.ca/custom/python/wheelhouse/generic/urllib3-1.26.7+computecanada-py2.py3-none-any.whl
Installing collected packages: urllib3
  Attempting uninstall: urllib3
    Found existing installation: urllib3 1.26.8+computecanada
    Uninstalling urllib3-1.26.8+computecanada:
      Successfully uninstalled urllib3-1.26.8+computecanada
Successfully installed urllib3-1.26.7+computecanada
Looking in links: /cvmfs/soft.computecanada.ca/custom/python/wheelhouse/nix/avx2, /cvmfs/soft.computecanada.ca/custom/python/wheelhouse/nix/generic, /cvmfs/soft.computecanada.ca/custom/python/wheelhouse/generic
Processing /cvmfs/soft.computecanada.ca/custom/python/wheelhouse/generic/nltk-3.7+computecanada-py3-none-any.whl
Requirement already satisfied: tqdm in /localscratch/yinan.28698709.0/env/lib/python3.7/site-packages (from nltk) (4.63.0+computecanada)
Processing /cvmfs/soft.computecanada.ca/custom/python/wheelhouse/generic/nltk-3.6.5+computecanada-py3-none-any.whl
Processing /cvmfs/soft.computecanada.ca/custom/python/wheelhouse/generic/nltk-3.6.3+computecanada-py3-none-any.whl
Requirement already satisfied: regex in /localscratch/yinan.28698709.0/env/lib/python3.7/site-packages (from nltk) (2020.11.13+computecanada)
Requirement already satisfied: click in /localscratch/yinan.28698709.0/env/lib/python3.7/site-packages (from nltk) (8.0.3+computecanada)
Requirement already satisfied: joblib in /localscratch/yinan.28698709.0/env/lib/python3.7/site-packages (from nltk) (1.1.0+computecanada)
Requirement already satisfied: importlib-metadata in /localscratch/yinan.28698709.0/env/lib/python3.7/site-packages (from click->nltk) (4.10.1+computecanada)
Requirement already satisfied: typing-extensions>=3.6.4 in /localscratch/yinan.28698709.0/env/lib/python3.7/site-packages (from importlib-metadata->click->nltk) (4.0.1+computecanada)
Requirement already satisfied: zipp>=0.5 in /localscratch/yinan.28698709.0/env/lib/python3.7/site-packages (from importlib-metadata->click->nltk) (3.7.0+computecanada)
Installing collected packages: nltk
Successfully installed nltk-3.6.3+computecanada
Looking in links: /cvmfs/soft.computecanada.ca/custom/python/wheelhouse/nix/avx2, /cvmfs/soft.computecanada.ca/custom/python/wheelhouse/nix/generic, /cvmfs/soft.computecanada.ca/custom/python/wheelhouse/generic
Processing /cvmfs/soft.computecanada.ca/custom/python/wheelhouse/generic/scikit_learn-0.22.1+computecanada-cp37-cp37m-linux_x86_64.whl
Requirement already satisfied: joblib>=0.11 in /localscratch/yinan.28698709.0/env/lib/python3.7/site-packages (from scikit-learn==0.22.1) (1.1.0+computecanada)
Requirement already satisfied: scipy>=0.17.0 in /localscratch/yinan.28698709.0/env/lib/python3.7/site-packages (from scikit-learn==0.22.1) (1.4.1+computecanada)
Requirement already satisfied: numpy>=1.11.0 in /cvmfs/soft.computecanada.ca/easybuild/software/2017/Core/scipy-stack/2019a/lib/python3.7/site-packages (from scikit-learn==0.22.1) (1.16.0)
Installing collected packages: scikit-learn
Successfully installed scikit-learn-0.22.1+computecanada
Looking in links: /cvmfs/soft.computecanada.ca/custom/python/wheelhouse/nix/avx2, /cvmfs/soft.computecanada.ca/custom/python/wheelhouse/nix/generic, /cvmfs/soft.computecanada.ca/custom/python/wheelhouse/generic
Requirement already satisfied: tokenizers==0.5.2 in /localscratch/yinan.28698709.0/env/lib/python3.7/site-packages (0.5.2+computecanada)
wandb: Appending key for api.wandb.ai to your netrc file: /home/yinan/.netrc
Starting Task
2022-03-11 09:09:14.856357: I tensorflow/stream_executor/platform/default/dso_loader.cc:48] Successfully opened dynamic library libcudart.so.10.1
[nltk_data] Downloading package stopwords to /home/yinan/nltk_data...
[nltk_data]   Package stopwords is already up-to-date!
[nltk_data] Downloading package wordnet to /home/yinan/nltk_data...
[nltk_data]   Package wordnet is already up-to-date!
wandb: Currently logged in as: yinanazhou (use `wandb login --relogin` to force relogin)
wandb: wandb version 0.12.11 is available!  To upgrade, please run:
wandb:  $ pip install wandb --upgrade
2022-03-11 09:09:28.133402: I tensorflow/stream_executor/platform/default/dso_loader.cc:48] Successfully opened dynamic library libcudart.so.10.1
wandb: Tracking run with wandb version 0.12.5
wandb: Syncing run jumping-capybara-1
wandb: ⭐️ View project at https://wandb.ai/yinanazhou/xl_512_bs_8_lr_1e07_es_15_lc_False_nr_True_sr_False_stem_False_lemma_True_repeat_1_fold_1
wandb: 🚀 View run at https://wandb.ai/yinanazhou/xl_512_bs_8_lr_1e07_es_15_lc_False_nr_True_sr_False_stem_False_lemma_True_repeat_1_fold_1/runs/1qhkalok
wandb: Run data is saved locally in /project/6002780/yinan/Thesis_MER_Lyrics/lyric-emotion/wandb/run-20220311_090925-1qhkalok
wandb: Run `wandb offline` to turn off syncing.

Validation loss decreased (inf --> 1.456941).  Saving model ...
Validation loss decreased (1.456941 --> 1.454135).  Saving model ...
Validation loss decreased (1.454135 --> 1.451262).  Saving model ...
Validation loss decreased (1.451262 --> 1.448400).  Saving model ...
Validation loss decreased (1.448400 --> 1.445673).  Saving model ...
Validation loss decreased (1.445673 --> 1.443016).  Saving model ...
Validation loss decreased (1.443016 --> 1.440477).  Saving model ...
Validation loss decreased (1.440477 --> 1.438027).  Saving model ...
Validation loss decreased (1.438027 --> 1.435664).  Saving model ...
Validation loss decreased (1.435664 --> 1.433245).  Saving model ...
Validation loss decreased (1.433245 --> 1.430847).  Saving model ...
Validation loss decreased (1.430847 --> 1.428717).  Saving model ...
Validation loss decreased (1.428717 --> 1.426572).  Saving model ...
Validation loss decreased (1.426572 --> 1.424444).  Saving model ...
Validation loss decreased (1.424444 --> 1.422402).  Saving model ...
Validation loss decreased (1.422402 --> 1.420350).  Saving model ...
Validation loss decreased (1.420350 --> 1.418426).  Saving model ...
Validation loss decreased (1.418426 --> 1.416435).  Saving model ...
Validation loss decreased (1.416435 --> 1.414444).  Saving model ...
Validation loss decreased (1.414444 --> 1.412511).  Saving model ...
Validation loss decreased (1.412511 --> 1.410570).  Saving model ...
Validation loss decreased (1.410570 --> 1.408843).  Saving model ...
Validation loss decreased (1.408843 --> 1.407172).  Saving model ...
Validation loss decreased (1.407172 --> 1.405593).  Saving model ...
Validation loss decreased (1.405593 --> 1.404004).  Saving model ...
Validation loss decreased (1.404004 --> 1.402369).  Saving model ...
Validation loss decreased (1.402369 --> 1.400859).  Saving model ...
Validation loss decreased (1.400859 --> 1.399301).  Saving model ...
Validation loss decreased (1.399301 --> 1.397858).  Saving model ...
Validation loss decreased (1.397858 --> 1.396441).  Saving model ...
Validation loss decreased (1.396441 --> 1.395033).  Saving model ...
Validation loss decreased (1.395033 --> 1.393594).  Saving model ...
Validation loss decreased (1.393594 --> 1.392266).  Saving model ...
Validation loss decreased (1.392266 --> 1.390926).  Saving model ...
Validation loss decreased (1.390926 --> 1.389681).  Saving model ...
Validation loss decreased (1.389681 --> 1.388404).  Saving model ...
Validation loss decreased (1.388404 --> 1.387169).  Saving model ...
Validation loss decreased (1.387169 --> 1.386038).  Saving model ...
Validation loss decreased (1.386038 --> 1.384813).  Saving model ...
Validation loss decreased (1.384813 --> 1.383621).  Saving model ...
Validation loss decreased (1.383621 --> 1.382499).  Saving model ...
Validation loss decreased (1.382499 --> 1.381356).  Saving model ...
Validation loss decreased (1.381356 --> 1.380231).  Saving model ...
Validation loss decreased (1.380231 --> 1.379207).  Saving model ...
Validation loss decreased (1.379207 --> 1.377999).  Saving model ...
Validation loss decreased (1.377999 --> 1.376977).  Saving model ...
Validation loss decreased (1.376977 --> 1.375932).  Saving model ...
Validation loss decreased (1.375932 --> 1.374894).  Saving model ...
Validation loss decreased (1.374894 --> 1.373904).  Saving model ...
Validation loss decreased (1.373904 --> 1.372943).  Saving model ...
Validation loss decreased (1.372943 --> 1.372009).  Saving model ...
Validation loss decreased (1.372009 --> 1.371170).  Saving model ...
Validation loss decreased (1.371170 --> 1.370181).  Saving model ...
Validation loss decreased (1.370181 --> 1.369220).  Saving model ...
Validation loss decreased (1.369220 --> 1.368373).  Saving model ...
Validation loss decreased (1.368373 --> 1.367511).  Saving model ...
Validation loss decreased (1.367511 --> 1.366576).  Saving model ...
Validation loss decreased (1.366576 --> 1.365684).  Saving model ...
Validation loss decreased (1.365684 --> 1.364774).  Saving model ...
Validation loss decreased (1.364774 --> 1.363988).  Saving model ...
Validation loss decreased (1.363988 --> 1.363129).  Saving model ...
Validation loss decreased (1.363129 --> 1.362332).  Saving model ...
Validation loss decreased (1.362332 --> 1.361493).  Saving model ...
Validation loss decreased (1.361493 --> 1.360583).  Saving model ...
Validation loss decreased (1.360583 --> 1.359849).  Saving model ...
Validation loss decreased (1.359849 --> 1.359003).  Saving model ...
Validation loss decreased (1.359003 --> 1.358295).  Saving model ...
Validation loss decreased (1.358295 --> 1.357534).  Saving model ...
Validation loss decreased (1.357534 --> 1.356801).  Saving model ...
Validation loss decreased (1.356801 --> 1.356133).  Saving model ...
Validation loss decreased (1.356133 --> 1.355483).  Saving model ...
Validation loss decreased (1.355483 --> 1.354736).  Saving model ...
Validation loss decreased (1.354736 --> 1.353995).  Saving model ...
Validation loss decreased (1.353995 --> 1.353305).  Saving model ...
Validation loss decreased (1.353305 --> 1.352625).  Saving model ...
Validation loss decreased (1.352625 --> 1.351973).  Saving model ...
Validation loss decreased (1.351973 --> 1.351308).  Saving model ...
Validation loss decreased (1.351308 --> 1.350628).  Saving model ...
Validation loss decreased (1.350628 --> 1.349920).  Saving model ...
Validation loss decreased (1.349920 --> 1.349248).  Saving model ...
Validation loss decreased (1.349248 --> 1.348650).  Saving model ...
Validation loss decreased (1.348650 --> 1.347995).  Saving model ...
Validation loss decreased (1.347995 --> 1.347292).  Saving model ...
Validation loss decreased (1.347292 --> 1.346618).  Saving model ...
Validation loss decreased (1.346618 --> 1.346032).  Saving model ...
Validation loss decreased (1.346032 --> 1.345349).  Saving model ...
Validation loss decreased (1.345349 --> 1.344741).  Saving model ...
Validation loss decreased (1.344741 --> 1.344064).  Saving model ...
Validation loss decreased (1.344064 --> 1.343460).  Saving model ...
Validation loss decreased (1.343460 --> 1.342909).  Saving model ...
Validation loss decreased (1.342909 --> 1.342307).  Saving model ...
Validation loss decreased (1.342307 --> 1.341675).  Saving model ...
Validation loss decreased (1.341675 --> 1.340983).  Saving model ...
Validation loss decreased (1.340983 --> 1.340308).  Saving model ...
Validation loss decreased (1.340308 --> 1.339601).  Saving model ...
Validation loss decreased (1.339601 --> 1.338994).  Saving model ...
Validation loss decreased (1.338994 --> 1.338399).  Saving model ...
Validation loss decreased (1.338399 --> 1.337721).  Saving model ...
Validation loss decreased (1.337721 --> 1.337127).  Saving model ...
Validation loss decreased (1.337127 --> 1.336604).  Saving model ...
Validation loss decreased (1.336604 --> 1.335953).  Saving model ...
Validation loss decreased (1.335953 --> 1.335294).  Saving model ...
Validation loss decreased (1.335294 --> 1.334688).  Saving model ...
Validation loss decreased (1.334688 --> 1.334126).  Saving model ...
Validation loss decreased (1.334126 --> 1.333438).  Saving model ...
Validation loss decreased (1.333438 --> 1.332814).  Saving model ...
Validation loss decreased (1.332814 --> 1.332185).  Saving model ...
Validation loss decreased (1.332185 --> 1.331605).  Saving model ...
Validation loss decreased (1.331605 --> 1.330957).  Saving model ...
Validation loss decreased (1.330957 --> 1.330338).  Saving model ...
Validation loss decreased (1.330338 --> 1.329738).  Saving model ...
Validation loss decreased (1.329738 --> 1.329207).  Saving model ...
Validation loss decreased (1.329207 --> 1.328626).  Saving model ...
Validation loss decreased (1.328626 --> 1.328024).  Saving model ...
Validation loss decreased (1.328024 --> 1.327341).  Saving model ...
Validation loss decreased (1.327341 --> 1.326730).  Saving model ...
Validation loss decreased (1.326730 --> 1.326089).  Saving model ...
Validation loss decreased (1.326089 --> 1.325499).  Saving model ...
Validation loss decreased (1.325499 --> 1.324856).  Saving model ...
Validation loss decreased (1.324856 --> 1.324185).  Saving model ...
Validation loss decreased (1.324185 --> 1.323607).  Saving model ...
Validation loss decreased (1.323607 --> 1.322976).  Saving model ...
Validation loss decreased (1.322976 --> 1.322430).  Saving model ...
Validation loss decreased (1.322430 --> 1.321725).  Saving model ...
Validation loss decreased (1.321725 --> 1.321100).  Saving model ...
Validation loss decreased (1.321100 --> 1.320437).  Saving model ...
Validation loss decreased (1.320437 --> 1.319850).  Saving model ...
Validation loss decreased (1.319850 --> 1.319204).  Saving model ...
Validation loss decreased (1.319204 --> 1.318554).  Saving model ...
Validation loss decreased (1.318554 --> 1.317904).  Saving model ...
Validation loss decreased (1.317904 --> 1.317283).  Saving model ...
Validation loss decreased (1.317283 --> 1.316649).  Saving model ...
Validation loss decreased (1.316649 --> 1.316035).  Saving model ...
Validation loss decreased (1.316035 --> 1.315445).  Saving model ...
Validation loss decreased (1.315445 --> 1.314799).  Saving model ...
Validation loss decreased (1.314799 --> 1.314100).  Saving model ...
Validation loss decreased (1.314100 --> 1.313494).  Saving model ...
Validation loss decreased (1.313494 --> 1.312802).  Saving model ...
Validation loss decreased (1.312802 --> 1.312170).  Saving model ...
Validation loss decreased (1.312170 --> 1.311600).  Saving model ...
Validation loss decreased (1.311600 --> 1.310944).  Saving model ...
Validation loss decreased (1.310944 --> 1.310317).  Saving model ...
Validation loss decreased (1.310317 --> 1.309725).  Saving model ...
Validation loss decreased (1.309725 --> 1.309073).  Saving model ...
Validation loss decreased (1.309073 --> 1.308387).  Saving model ...
Validation loss decreased (1.308387 --> 1.307736).  Saving model ...
Validation loss decreased (1.307736 --> 1.307056).  Saving model ...
Validation loss decreased (1.307056 --> 1.306221).  Saving model ...
Validation loss decreased (1.306221 --> 1.305590).  Saving model ...
Validation loss decreased (1.305590 --> 1.304880).  Saving model ...
Validation loss decreased (1.304880 --> 1.304229).  Saving model ...
Validation loss decreased (1.304229 --> 1.303614).  Saving model ...
Validation loss decreased (1.303614 --> 1.302998).  Saving model ...
Validation loss decreased (1.302998 --> 1.302448).  Saving model ...
Validation loss decreased (1.302448 --> 1.301879).  Saving model ...
Validation loss decreased (1.301879 --> 1.301306).  Saving model ...
Validation loss decreased (1.301306 --> 1.300671).  Saving model ...
Validation loss decreased (1.300671 --> 1.300015).  Saving model ...
Validation loss decreased (1.300015 --> 1.299402).  Saving model ...
Validation loss decreased (1.299402 --> 1.298700).  Saving model ...
Validation loss decreased (1.298700 --> 1.297992).  Saving model ...
Validation loss decreased (1.297992 --> 1.297305).  Saving model ...
Validation loss decreased (1.297305 --> 1.296605).  Saving model ...
Validation loss decreased (1.296605 --> 1.295746).  Saving model ...
Validation loss decreased (1.295746 --> 1.294975).  Saving model ...
Validation loss decreased (1.294975 --> 1.294224).  Saving model ...
Validation loss decreased (1.294224 --> 1.293671).  Saving model ...
Validation loss decreased (1.293671 --> 1.293055).  Saving model ...
Validation loss decreased (1.293055 --> 1.292450).  Saving model ...
Validation loss decreased (1.292450 --> 1.291794).  Saving model ...
Validation loss decreased (1.291794 --> 1.291076).  Saving model ...
Validation loss decreased (1.291076 --> 1.290501).  Saving model ...
Validation loss decreased (1.290501 --> 1.289834).  Saving model ...
Validation loss decreased (1.289834 --> 1.289179).  Saving model ...
Validation loss decreased (1.289179 --> 1.288458).  Saving model ...
Validation loss decreased (1.288458 --> 1.287909).  Saving model ...
Validation loss decreased (1.287909 --> 1.287215).  Saving model ...
Validation loss decreased (1.287215 --> 1.286498).  Saving model ...
Validation loss decreased (1.286498 --> 1.285854).  Saving model ...
Validation loss decreased (1.285854 --> 1.285088).  Saving model ...
Validation loss decreased (1.285088 --> 1.284238).  Saving model ...
Validation loss decreased (1.284238 --> 1.283466).  Saving model ...
Validation loss decreased (1.283466 --> 1.282790).  Saving model ...
Validation loss decreased (1.282790 --> 1.282101).  Saving model ...
Validation loss decreased (1.282101 --> 1.281499).  Saving model ...
Validation loss decreased (1.281499 --> 1.280770).  Saving model ...
Validation loss decreased (1.280770 --> 1.280251).  Saving model ...
Validation loss decreased (1.280251 --> 1.279680).  Saving model ...
Validation loss decreased (1.279680 --> 1.279007).  Saving model ...
Validation loss decreased (1.279007 --> 1.278342).  Saving model ...
Validation loss decreased (1.278342 --> 1.277746).  Saving model ...
Validation loss decreased (1.277746 --> 1.277128).  Saving model ...
Validation loss decreased (1.277128 --> 1.276563).  Saving model ...
Validation loss decreased (1.276563 --> 1.275813).  Saving model ...
Validation loss decreased (1.275813 --> 1.275061).  Saving model ...
Validation loss decreased (1.275061 --> 1.274522).  Saving model ...
Validation loss decreased (1.274522 --> 1.273878).  Saving model ...
Validation loss decreased (1.273878 --> 1.273326).  Saving model ...
Validation loss decreased (1.273326 --> 1.272492).  Saving model ...
Validation loss decreased (1.272492 --> 1.271746).  Saving model ...
Validation loss decreased (1.271746 --> 1.271208).  Saving model ...
Validation loss decreased (1.271208 --> 1.270753).  Saving model ...
Validation loss decreased (1.270753 --> 1.270088).  Saving model ...
Validation loss decreased (1.270088 --> 1.269464).  Saving model ...
Validation loss decreased (1.269464 --> 1.269102).  Saving model ...
Validation loss decreased (1.269102 --> 1.268589).  Saving model ...
Validation loss decreased (1.268589 --> 1.267918).  Saving model ...
Validation loss decreased (1.267918 --> 1.267297).  Saving model ...
Validation loss decreased (1.267297 --> 1.266848).  Saving model ...
Validation loss decreased (1.266848 --> 1.266089).  Saving model ...
Validation loss decreased (1.266089 --> 1.265545).  Saving model ...
Validation loss decreased (1.265545 --> 1.264867).  Saving model ...
Validation loss decreased (1.264867 --> 1.264418).  Saving model ...
Validation loss decreased (1.264418 --> 1.263795).  Saving model ...
Validation loss decreased (1.263795 --> 1.263177).  Saving model ...
Validation loss decreased (1.263177 --> 1.262558).  Saving model ...
Validation loss decreased (1.262558 --> 1.261976).  Saving model ...
Validation loss decreased (1.261976 --> 1.261435).  Saving model ...
Validation loss decreased (1.261435 --> 1.260846).  Saving model ...
Validation loss decreased (1.260846 --> 1.260380).  Saving model ...
Validation loss decreased (1.260380 --> 1.259857).  Saving model ...
Validation loss decreased (1.259857 --> 1.259178).  Saving model ...
Validation loss decreased (1.259178 --> 1.258521).  Saving model ...
Validation loss decreased (1.258521 --> 1.257929).  Saving model ...
Validation loss decreased (1.257929 --> 1.257356).  Saving model ...
Validation loss decreased (1.257356 --> 1.256893).  Saving model ...
Validation loss decreased (1.256893 --> 1.256336).  Saving model ...
Validation loss decreased (1.256336 --> 1.255853).  Saving model ...
Validation loss decreased (1.255853 --> 1.255277).  Saving model ...
Validation loss decreased (1.255277 --> 1.254702).  Saving model ...
Validation loss decreased (1.254702 --> 1.254137).  Saving model ...
Validation loss decreased (1.254137 --> 1.253437).  Saving model ...
Validation loss decreased (1.253437 --> 1.253082).  Saving model ...
Validation loss decreased (1.253082 --> 1.252522).  Saving model ...
Validation loss decreased (1.252522 --> 1.251969).  Saving model ...
Validation loss decreased (1.251969 --> 1.251548).  Saving model ...
Validation loss decreased (1.251548 --> 1.250983).  Saving model ...
Validation loss decreased (1.250983 --> 1.250557).  Saving model ...
Validation loss decreased (1.250557 --> 1.249994).  Saving model ...
Validation loss decreased (1.249994 --> 1.249461).  Saving model ...
Validation loss decreased (1.249461 --> 1.249112).  Saving model ...
Validation loss decreased (1.249112 --> 1.248586).  Saving model ...
Validation loss decreased (1.248586 --> 1.248134).  Saving model ...
Validation loss decreased (1.248134 --> 1.247513).  Saving model ...
Validation loss decreased (1.247513 --> 1.246982).  Saving model ...
Validation loss decreased (1.246982 --> 1.246421).  Saving model ...
Validation loss decreased (1.246421 --> 1.245959).  Saving model ...
Validation loss decreased (1.245959 --> 1.245588).  Saving model ...
Validation loss decreased (1.245588 --> 1.245157).  Saving model ...
Validation loss decreased (1.245157 --> 1.244741).  Saving model ...
Validation loss decreased (1.244741 --> 1.244167).  Saving model ...
Validation loss decreased (1.244167 --> 1.243677).  Saving model ...
Validation loss decreased (1.243677 --> 1.243162).  Saving model ...
Validation loss decreased (1.243162 --> 1.242697).  Saving model ...
Validation loss decreased (1.242697 --> 1.242311).  Saving model ...
Validation loss decreased (1.242311 --> 1.241764).  Saving model ...
Validation loss decreased (1.241764 --> 1.241368).  Saving model ...
Validation loss decreased (1.241368 --> 1.241108).  Saving model ...
Validation loss decreased (1.241108 --> 1.240402).  Saving model ...
Validation loss decreased (1.240402 --> 1.239961).  Saving model ...
Validation loss decreased (1.239961 --> 1.239485).  Saving model ...
Validation loss decreased (1.239485 --> 1.239084).  Saving model ...
Validation loss decreased (1.239084 --> 1.238698).  Saving model ...
Validation loss decreased (1.238698 --> 1.238084).  Saving model ...
Validation loss decreased (1.238084 --> 1.237511).  Saving model ...
Validation loss decreased (1.237511 --> 1.236997).  Saving model ...
Validation loss decreased (1.236997 --> 1.236638).  Saving model ...
Validation loss decreased (1.236638 --> 1.236286).  Saving model ...
Validation loss decreased (1.236286 --> 1.235867).  Saving model ...
Validation loss decreased (1.235867 --> 1.235270).  Saving model ...
Validation loss decreased (1.235270 --> 1.234880).  Saving model ...
Validation loss decreased (1.234880 --> 1.234334).  Saving model ...
Validation loss decreased (1.234334 --> 1.233848).  Saving model ...
Validation loss decreased (1.233848 --> 1.233228).  Saving model ...
Validation loss decreased (1.233228 --> 1.232758).  Saving model ...
Validation loss decreased (1.232758 --> 1.232271).  Saving model ...
Validation loss decreased (1.232271 --> 1.231922).  Saving model ...
Validation loss decreased (1.231922 --> 1.231368).  Saving model ...
Validation loss decreased (1.231368 --> 1.230812).  Saving model ...
Validation loss decreased (1.230812 --> 1.230300).  Saving model ...
Validation loss decreased (1.230300 --> 1.229877).  Saving model ...
Validation loss decreased (1.229877 --> 1.229461).  Saving model ...
Validation loss decreased (1.229461 --> 1.229181).  Saving model ...
Validation loss decreased (1.229181 --> 1.228876).  Saving model ...
Validation loss decreased (1.228876 --> 1.228639).  Saving model ...
Validation loss decreased (1.228639 --> 1.228457).  Saving model ...
Validation loss decreased (1.228457 --> 1.227824).  Saving model ...
Validation loss decreased (1.227824 --> 1.227549).  Saving model ...
Validation loss decreased (1.227549 --> 1.227249).  Saving model ...
Validation loss decreased (1.227249 --> 1.226812).  Saving model ...
Validation loss decreased (1.226812 --> 1.226457).  Saving model ...
Validation loss decreased (1.226457 --> 1.225908).  Saving model ...
Validation loss decreased (1.225908 --> 1.225468).  Saving model ...
Validation loss decreased (1.225468 --> 1.225051).  Saving model ...
Validation loss decreased (1.225051 --> 1.224472).  Saving model ...
Validation loss decreased (1.224472 --> 1.224063).  Saving model ...
Validation loss decreased (1.224063 --> 1.223789).  Saving model ...
Validation loss decreased (1.223789 --> 1.223378).  Saving model ...
Validation loss decreased (1.223378 --> 1.223085).  Saving model ...
Validation loss decreased (1.223085 --> 1.222827).  Saving model ...
Validation loss decreased (1.222827 --> 1.222516).  Saving model ...
Validation loss decreased (1.222516 --> 1.221879).  Saving model ...
Validation loss decreased (1.221879 --> 1.221450).  Saving model ...
Validation loss decreased (1.221450 --> 1.220992).  Saving model ...
Validation loss decreased (1.220992 --> 1.220574).  Saving model ...
Validation loss decreased (1.220574 --> 1.220323).  Saving model ...
Validation loss decreased (1.220323 --> 1.219938).  Saving model ...
Validation loss decreased (1.219938 --> 1.219506).  Saving model ...
Validation loss decreased (1.219506 --> 1.219247).  Saving model ...
Validation loss decreased (1.219247 --> 1.218728).  Saving model ...
Validation loss decreased (1.218728 --> 1.218526).  Saving model ...
Validation loss decreased (1.218526 --> 1.218174).  Saving model ...
Validation loss decreased (1.218174 --> 1.217798).  Saving model ...
Validation loss decreased (1.217798 --> 1.217490).  Saving model ...
Validation loss decreased (1.217490 --> 1.217242).  Saving model ...
Validation loss decreased (1.217242 --> 1.216738).  Saving model ...
Validation loss decreased (1.216738 --> 1.216282).  Saving model ...
Validation loss decreased (1.216282 --> 1.215893).  Saving model ...
Validation loss decreased (1.215893 --> 1.215540).  Saving model ...
Validation loss decreased (1.215540 --> 1.215239).  Saving model ...
Validation loss decreased (1.215239 --> 1.215019).  Saving model ...
Validation loss decreased (1.215019 --> 1.214308).  Saving model ...
Validation loss decreased (1.214308 --> 1.213749).  Saving model ...
Validation loss decreased (1.213749 --> 1.213203).  Saving model ...
Validation loss decreased (1.213203 --> 1.212650).  Saving model ...
Validation loss decreased (1.212650 --> 1.212249).  Saving model ...
Validation loss decreased (1.212249 --> 1.211961).  Saving model ...
Validation loss decreased (1.211961 --> 1.211764).  Saving model ...
Validation loss decreased (1.211764 --> 1.211449).  Saving model ...
Validation loss decreased (1.211449 --> 1.211076).  Saving model ...
Validation loss decreased (1.211076 --> 1.210817).  Saving model ...
Validation loss decreased (1.210817 --> 1.210620).  Saving model ...
Validation loss decreased (1.210620 --> 1.210233).  Saving model ...
Validation loss decreased (1.210233 --> 1.210026).  Saving model ...
Validation loss decreased (1.210026 --> 1.209866).  Saving model ...
Validation loss decreased (1.209866 --> 1.209479).  Saving model ...
Validation loss decreased (1.209479 --> 1.209197).  Saving model ...
Validation loss decreased (1.209197 --> 1.209065).  Saving model ...
Validation loss decreased (1.209065 --> 1.208410).  Saving model ...
Validation loss decreased (1.208410 --> 1.207940).  Saving model ...
Validation loss decreased (1.207940 --> 1.207774).  Saving model ...
Validation loss decreased (1.207774 --> 1.207387).  Saving model ...
Validation loss decreased (1.207387 --> 1.207184).  Saving model ...
Validation loss decreased (1.207184 --> 1.206850).  Saving model ...
Validation loss decreased (1.206850 --> 1.206605).  Saving model ...
Validation loss decreased (1.206605 --> 1.206279).  Saving model ...
Validation loss decreased (1.206279 --> 1.205886).  Saving model ...
Validation loss decreased (1.205886 --> 1.205409).  Saving model ...
Validation loss decreased (1.205409 --> 1.204897).  Saving model ...
Validation loss decreased (1.204897 --> 1.204458).  Saving model ...
Validation loss decreased (1.204458 --> 1.204056).  Saving model ...
Validation loss decreased (1.204056 --> 1.203347).  Saving model ...
Validation loss decreased (1.203347 --> 1.203031).  Saving model ...
Validation loss decreased (1.203031 --> 1.202763).  Saving model ...
Validation loss decreased (1.202763 --> 1.202249).  Saving model ...
Validation loss decreased (1.202249 --> 1.201783).  Saving model ...
Validation loss decreased (1.201783 --> 1.201298).  Saving model ...
Validation loss decreased (1.201298 --> 1.200874).  Saving model ...
Validation loss decreased (1.200874 --> 1.200544).  Saving model ...
Validation loss decreased (1.200544 --> 1.200245).  Saving model ...
Validation loss decreased (1.200245 --> 1.199913).  Saving model ...
Validation loss decreased (1.199913 --> 1.199548).  Saving model ...
Validation loss decreased (1.199548 --> 1.199294).  Saving model ...
Validation loss decreased (1.199294 --> 1.198697).  Saving model ...
Validation loss decreased (1.198697 --> 1.198428).  Saving model ...
Validation loss decreased (1.198428 --> 1.198087).  Saving model ...
Validation loss decreased (1.198087 --> 1.197593).  Saving model ...
Validation loss decreased (1.197593 --> 1.197047).  Saving model ...
Validation loss decreased (1.197047 --> 1.196794).  Saving model ...
Validation loss decreased (1.196794 --> 1.196377).  Saving model ...
Validation loss decreased (1.196377 --> 1.195989).  Saving model ...
Validation loss decreased (1.195989 --> 1.195907).  Saving model ...
Validation loss decreased (1.195907 --> 1.195659).  Saving model ...
Validation loss decreased (1.195659 --> 1.195499).  Saving model ...
Validation loss decreased (1.195499 --> 1.195342).  Saving model ...
Validation loss decreased (1.195342 --> 1.195074).  Saving model ...
Validation loss decreased (1.195074 --> 1.194514).  Saving model ...
Validation loss decreased (1.194514 --> 1.193853).  Saving model ...
Validation loss decreased (1.193853 --> 1.193450).  Saving model ...
Validation loss decreased (1.193450 --> 1.193006).  Saving model ...
Validation loss decreased (1.193006 --> 1.192496).  Saving model ...
Validation loss decreased (1.192496 --> 1.192331).  Saving model ...
Validation loss decreased (1.192331 --> 1.192196).  Saving model ...
Validation loss decreased (1.192196 --> 1.191906).  Saving model ...
Validation loss decreased (1.191906 --> 1.191495).  Saving model ...
Validation loss decreased (1.191495 --> 1.191230).  Saving model ...
Validation loss decreased (1.191230 --> 1.191089).  Saving model ...
Validation loss decreased (1.191089 --> 1.190639).  Saving model ...
Validation loss decreased (1.190639 --> 1.190411).  Saving model ...
Validation loss decreased (1.190411 --> 1.190023).  Saving model ...
Validation loss decreased (1.190023 --> 1.189580).  Saving model ...
Validation loss decreased (1.189580 --> 1.189161).  Saving model ...
Validation loss decreased (1.189161 --> 1.188912).  Saving model ...
Validation loss decreased (1.188912 --> 1.188890).  Saving model ...
Validation loss decreased (1.188890 --> 1.188551).  Saving model ...
Validation loss decreased (1.188551 --> 1.188159).  Saving model ...
Validation loss decreased (1.188159 --> 1.188118).  Saving model ...
Validation loss decreased (1.188118 --> 1.187854).  Saving model ...
Validation loss decreased (1.187854 --> 1.187309).  Saving model ...
Validation loss decreased (1.187309 --> 1.186736).  Saving model ...
Validation loss decreased (1.186736 --> 1.186409).  Saving model ...
Validation loss decreased (1.186409 --> 1.186373).  Saving model ...
Validation loss decreased (1.186373 --> 1.186029).  Saving model ...
Validation loss decreased (1.186029 --> 1.185545).  Saving model ...
Validation loss decreased (1.185545 --> 1.185067).  Saving model ...
Validation loss decreased (1.185067 --> 1.184701).  Saving model ...
Validation loss decreased (1.184701 --> 1.184283).  Saving model ...
Validation loss decreased (1.184283 --> 1.183912).  Saving model ...
Validation loss decreased (1.183912 --> 1.183803).  Saving model ...
Validation loss decreased (1.183803 --> 1.182987).  Saving model ...
Validation loss decreased (1.182987 --> 1.182592).  Saving model ...
Validation loss decreased (1.182592 --> 1.182183).  Saving model ...
Validation loss decreased (1.182183 --> 1.181684).  Saving model ...
Validation loss decreased (1.181684 --> 1.181490).  Saving model ...
Validation loss decreased (1.181490 --> 1.181201).  Saving model ...
Validation loss decreased (1.181201 --> 1.180821).  Saving model ...
Validation loss decreased (1.180821 --> 1.180648).  Saving model ...
Validation loss decreased (1.180648 --> 1.180366).  Saving model ...
Validation loss decreased (1.180366 --> 1.179780).  Saving model ...
Validation loss decreased (1.179780 --> 1.179357).  Saving model ...
Validation loss decreased (1.179357 --> 1.179160).  Saving model ...
Validation loss decreased (1.179160 --> 1.178861).  Saving model ...
Validation loss decreased (1.178861 --> 1.178365).  Saving model ...
Validation loss decreased (1.178365 --> 1.177985).  Saving model ...
Validation loss decreased (1.177985 --> 1.177478).  Saving model ...
Validation loss decreased (1.177478 --> 1.177463).  Saving model ...
Validation loss decreased (1.177463 --> 1.177262).  Saving model ...
Validation loss decreased (1.177262 --> 1.177019).  Saving model ...
Validation loss decreased (1.177019 --> 1.176733).  Saving model ...
Validation loss decreased (1.176733 --> 1.176682).  Saving model ...
Validation loss decreased (1.176682 --> 1.176216).  Saving model ...
Validation loss decreased (1.176216 --> 1.175962).  Saving model ...
Validation loss decreased (1.175962 --> 1.175495).  Saving model ...
Validation loss decreased (1.175495 --> 1.175206).  Saving model ...
Validation loss decreased (1.175206 --> 1.174779).  Saving model ...
Validation loss decreased (1.174779 --> 1.174304).  Saving model ...
Validation loss decreased (1.174304 --> 1.173879).  Saving model ...
Validation loss decreased (1.173879 --> 1.173603).  Saving model ...
EarlyStopping counter: 1 out of 15.0
Validation loss decreased (1.173603 --> 1.173029).  Saving model ...
Validation loss decreased (1.173029 --> 1.172420).  Saving model ...
Validation loss decreased (1.172420 --> 1.172056).  Saving model ...
Validation loss decreased (1.172056 --> 1.171798).  Saving model ...
Validation loss decreased (1.171798 --> 1.171431).  Saving model ...
Validation loss decreased (1.171431 --> 1.170949).  Saving model ...
Validation loss decreased (1.170949 --> 1.170476).  Saving model ...
Validation loss decreased (1.170476 --> 1.169997).  Saving model ...
Validation loss decreased (1.169997 --> 1.169481).  Saving model ...
Validation loss decreased (1.169481 --> 1.169076).  Saving model ...
Validation loss decreased (1.169076 --> 1.169002).  Saving model ...
Validation loss decreased (1.169002 --> 1.168749).  Saving model ...
Validation loss decreased (1.168749 --> 1.168402).  Saving model ...
Validation loss decreased (1.168402 --> 1.167963).  Saving model ...
Validation loss decreased (1.167963 --> 1.167842).  Saving model ...
Validation loss decreased (1.167842 --> 1.167628).  Saving model ...
Validation loss decreased (1.167628 --> 1.167456).  Saving model ...
Validation loss decreased (1.167456 --> 1.167418).  Saving model ...
Validation loss decreased (1.167418 --> 1.167232).  Saving model ...
Validation loss decreased (1.167232 --> 1.166993).  Saving model ...
Validation loss decreased (1.166993 --> 1.166734).  Saving model ...
Validation loss decreased (1.166734 --> 1.166202).  Saving model ...
Validation loss decreased (1.166202 --> 1.165666).  Saving model ...
Validation loss decreased (1.165666 --> 1.165438).  Saving model ...
Validation loss decreased (1.165438 --> 1.164991).  Saving model ...
Validation loss decreased (1.164991 --> 1.164332).  Saving model ...
Validation loss decreased (1.164332 --> 1.163888).  Saving model ...
Validation loss decreased (1.163888 --> 1.163061).  Saving model ...
Validation loss decreased (1.163061 --> 1.162677).  Saving model ...
Validation loss decreased (1.162677 --> 1.162374).  Saving model ...
Validation loss decreased (1.162374 --> 1.161999).  Saving model ...
Validation loss decreased (1.161999 --> 1.161727).  Saving model ...
Validation loss decreased (1.161727 --> 1.161548).  Saving model ...
Validation loss decreased (1.161548 --> 1.161339).  Saving model ...
Validation loss decreased (1.161339 --> 1.161049).  Saving model ...
Validation loss decreased (1.161049 --> 1.160769).  Saving model ...
Validation loss decreased (1.160769 --> 1.160342).  Saving model ...
Validation loss decreased (1.160342 --> 1.160094).  Saving model ...
Validation loss decreased (1.160094 --> 1.159824).  Saving model ...
Validation loss decreased (1.159824 --> 1.159747).  Saving model ...
Validation loss decreased (1.159747 --> 1.159455).  Saving model ...
Validation loss decreased (1.159455 --> 1.158964).  Saving model ...
Validation loss decreased (1.158964 --> 1.158589).  Saving model ...
Validation loss decreased (1.158589 --> 1.158248).  Saving model ...
Validation loss decreased (1.158248 --> 1.157964).  Saving model ...
Validation loss decreased (1.157964 --> 1.157584).  Saving model ...
Validation loss decreased (1.157584 --> 1.157371).  Saving model ...
Validation loss decreased (1.157371 --> 1.156761).  Saving model ...
Validation loss decreased (1.156761 --> 1.156509).  Saving model ...
Validation loss decreased (1.156509 --> 1.156277).  Saving model ...
Validation loss decreased (1.156277 --> 1.156015).  Saving model ...
Validation loss decreased (1.156015 --> 1.155796).  Saving model ...
Validation loss decreased (1.155796 --> 1.155685).  Saving model ...
Validation loss decreased (1.155685 --> 1.155480).  Saving model ...
Validation loss decreased (1.155480 --> 1.155072).  Saving model ...
Validation loss decreased (1.155072 --> 1.154777).  Saving model ...
EarlyStopping counter: 1 out of 15.0
Validation loss decreased (1.154777 --> 1.154367).  Saving model ...
Validation loss decreased (1.154367 --> 1.153850).  Saving model ...
Validation loss decreased (1.153850 --> 1.153748).  Saving model ...
Validation loss decreased (1.153748 --> 1.153264).  Saving model ...
/localscratch/yinan.28698709.0/env/lib/python3.7/site-packages/torch/nn/functional.py:1794: UserWarning: nn.functional.tanh is deprecated. Use torch.tanh instead.
  warnings.warn("nn.functional.tanh is deprecated. Use torch.tanh instead.")
/localscratch/yinan.28698709.0/env/lib/python3.7/site-packages/transformers/optimization.py:155: UserWarning: This overload of add_ is deprecated:
	add_(Number alpha, Tensor other)
Consider using one of the following signatures instead:
	add_(Tensor other, *, Number alpha) (Triggered internally at  ../torch/csrc/utils/python_arg_parser.cpp:1025.)
  exp_avg.mul_(beta1).add_(1.0 - beta1, grad)
wandb: Waiting for W&B process to finish, PID 214254... (success).
wandb: - 0.00MB of 0.00MB uploaded (0.00MB deduped)wandb: \ 0.00MB of 0.00MB uploaded (0.00MB deduped)wandb: | 0.00MB of 0.00MB uploaded (0.00MB deduped)wandb: / 0.00MB of 0.00MB uploaded (0.00MB deduped)wandb: - 0.00MB of 0.00MB uploaded (0.00MB deduped)wandb: \ 0.00MB of 0.00MB uploaded (0.00MB deduped)wandb: | 0.00MB of 0.00MB uploaded (0.00MB deduped)wandb: / 0.00MB of 0.00MB uploaded (0.00MB deduped)wandb: - 0.00MB of 0.00MB uploaded (0.00MB deduped)wandb: \ 0.00MB of 0.00MB uploaded (0.00MB deduped)wandb: | 0.00MB of 0.00MB uploaded (0.00MB deduped)wandb: / 0.00MB of 0.00MB uploaded (0.00MB deduped)wandb: - 0.00MB of 0.00MB uploaded (0.00MB deduped)wandb:                                                                                
wandb: Run history:
wandb:     e_F1 ▁▁▂▃▃▄▅▅▅▅▅▅▆▆▆▆▆▇▇▇▆▇▇▇▇▇▇▇▇▇▇█████████
wandb:   e_loss █▇▇▆▆▆▆▅▅▅▅▅▄▄▄▄▄▄▃▃▃▃▃▃▃▂▂▂▂▂▂▂▂▂▁▁▁▁▁▁
wandb:     t_F1 ▁▂▂▂▃▃▃▃▃▄▄▅▅▄▅▆▆▆▇▆▆▆▆▆▆▇▇▇▇▆▇▇▇▇▇██▇▇█
wandb:   t_loss ██▇▇▇▆▆▆▆▆▆▅▅▆▅▅▄▄▄▄▄▄▄▄▃▃▃▃▃▃▂▂▂▂▂▁▂▁▁▁
wandb: 
wandb: Run summary:
wandb:     e_F1 49.06041
wandb:   e_loss 1.15326
wandb:     t_F1 53.618
wandb:   t_loss 1.08412
wandb: 
wandb: Synced 4 W&B file(s), 0 media file(s), 0 artifact file(s) and 0 other file(s)
wandb: Synced jumping-capybara-1: https://wandb.ai/yinanazhou/xl_512_bs_8_lr_1e07_es_15_lc_False_nr_True_sr_False_stem_False_lemma_True_repeat_1_fold_1/runs/1qhkalok
wandb: Find logs at: ./wandb/run-20220311_090925-1qhkalok/logs/debug.log
wandb: 

wandb: wandb version 0.12.11 is available!  To upgrade, please run:
wandb:  $ pip install wandb --upgrade
2022-03-11 14:33:17.707099: I tensorflow/stream_executor/platform/default/dso_loader.cc:48] Successfully opened dynamic library libcudart.so.10.1
wandb: Tracking run with wandb version 0.12.5
wandb: Syncing run azure-bee-1
wandb: ⭐️ View project at https://wandb.ai/yinanazhou/xl_512_bs_8_lr_1e07_es_15_lc_False_nr_True_sr_False_stem_False_lemma_True_repeat_1_fold_2
wandb: 🚀 View run at https://wandb.ai/yinanazhou/xl_512_bs_8_lr_1e07_es_15_lc_False_nr_True_sr_False_stem_False_lemma_True_repeat_1_fold_2/runs/2ox2uchp
wandb: Run data is saved locally in /project/6002780/yinan/Thesis_MER_Lyrics/lyric-emotion/wandb/run-20220311_143313-2ox2uchp
wandb: Run `wandb offline` to turn off syncing.
slurmstepd: error: *** JOB 28698709 ON cdr2591 CANCELLED AT 2022-03-11T19:05:24 DUE TO TIME LIMIT ***
