Unloading StdEnv/2020

Due to MODULEPATH changes, the following have been reloaded:
  1) mii/1.1.1


The following have been reloaded with a version change:
  1) python/3.8.2 => python/3.7.4

Using base prefix '/cvmfs/soft.computecanada.ca/easybuild/software/2017/Core/python/3.7.4'
New python executable in /localscratch/yinan.27794531.0/env/bin/python
Installing setuptools, pip, wheel...
done.
Ignoring pip: markers 'python_version < "3"' don't match your environment
Looking in links: /cvmfs/soft.computecanada.ca/custom/python/wheelhouse/nix/avx2, /cvmfs/soft.computecanada.ca/custom/python/wheelhouse/nix/generic, /cvmfs/soft.computecanada.ca/custom/python/wheelhouse/generic
Collecting pip
Installing collected packages: pip
  Found existing installation: pip 19.1.1
    Uninstalling pip-19.1.1:
      Successfully uninstalled pip-19.1.1
Successfully installed pip-21.2.3+computecanada
Looking in links: /cvmfs/soft.computecanada.ca/custom/python/wheelhouse/nix/avx2, /cvmfs/soft.computecanada.ca/custom/python/wheelhouse/nix/generic, /cvmfs/soft.computecanada.ca/custom/python/wheelhouse/generic
Processing /cvmfs/soft.computecanada.ca/custom/python/wheelhouse/generic/keras-2.7.0+computecanada-py2.py3-none-any.whl
Processing /cvmfs/soft.computecanada.ca/custom/python/wheelhouse/generic/Keras_Preprocessing-1.1.2+computecanada-py3-none-any.whl
Requirement already satisfied: matplotlib in /cvmfs/soft.computecanada.ca/easybuild/software/2017/Core/scipy-stack/2019a/lib/python3.7/site-packages (from -r requirements.txt (line 3)) (3.0.2)
Processing /cvmfs/soft.computecanada.ca/custom/python/wheelhouse/generic/nltk-3.6.5+computecanada-py3-none-any.whl
Processing /cvmfs/soft.computecanada.ca/custom/python/wheelhouse/generic/scikit_learn-0.22.1+computecanada-cp37-cp37m-linux_x86_64.whl
Processing /cvmfs/soft.computecanada.ca/custom/python/wheelhouse/generic/tensorboard-2.3.0+computecanada-py3-none-any.whl
Processing /cvmfs/soft.computecanada.ca/custom/python/wheelhouse/generic/tensorboard_plugin_wit-1.7.0+computecanada-py3-none-any.whl
Processing /cvmfs/soft.computecanada.ca/custom/python/wheelhouse/generic/tensorflow_gpu-2.3.0+computecanada-cp37-cp37m-linux_x86_64.whl
Processing /cvmfs/soft.computecanada.ca/custom/python/wheelhouse/generic/tensorflow_estimator-2.3.0+computecanada-py2.py3-none-any.whl
Processing /cvmfs/soft.computecanada.ca/custom/python/wheelhouse/generic/tokenizers-0.5.2+computecanada-cp37-cp37m-linux_x86_64.whl
Processing /cvmfs/soft.computecanada.ca/custom/python/wheelhouse/nix/avx2/torch-1.4.0+computecanada-cp37-cp37m-linux_x86_64.whl
Processing /cvmfs/soft.computecanada.ca/custom/python/wheelhouse/generic/torchtext-0.6.0+computecanada-py3-none-any.whl
Processing /cvmfs/soft.computecanada.ca/custom/python/wheelhouse/generic/torchvision-0.8.2+computecanada-cp37-cp37m-linux_x86_64.whl
Processing /cvmfs/soft.computecanada.ca/custom/python/wheelhouse/generic/transformers-2.5.1+computecanada-py3-none-any.whl
Processing /cvmfs/soft.computecanada.ca/custom/python/wheelhouse/generic/urllib3-1.26.7+computecanada-py2.py3-none-any.whl
Processing /cvmfs/soft.computecanada.ca/custom/python/wheelhouse/generic/click-8.0.3+computecanada-py3-none-any.whl
Processing /cvmfs/soft.computecanada.ca/custom/python/wheelhouse/generic/tqdm-4.62.3+computecanada-py2.py3-none-any.whl
ERROR: Could not find a version that satisfies the requirement regex>=2021.8.3 (from nltk) (from versions: 2018.1.10+computecanada, 2019.11.1+computecanada, 2020.11.13+computecanada)
ERROR: No matching distribution found for regex>=2021.8.3
Looking in links: /cvmfs/soft.computecanada.ca/custom/python/wheelhouse/nix/avx2, /cvmfs/soft.computecanada.ca/custom/python/wheelhouse/nix/generic, /cvmfs/soft.computecanada.ca/custom/python/wheelhouse/generic
ERROR: Could not find a version that satisfies the requirement numpy==1.20.0+computacanada (from versions: 1.15.0+computecanada, 1.15.2+computecanada, 1.15.4+computecanada, 1.16.0+computecanada, 1.16.2+computecanada, 1.16.3+computecanada, 1.17.4+computecanada, 1.18.1+computecanada, 1.18.4+computecanada, 1.19.1+computecanada, 1.19.2+computecanada, 1.20.2+computecanada)
ERROR: No matching distribution found for numpy==1.20.0+computacanada
Looking in links: /cvmfs/soft.computecanada.ca/custom/python/wheelhouse/nix/avx2, /cvmfs/soft.computecanada.ca/custom/python/wheelhouse/nix/generic, /cvmfs/soft.computecanada.ca/custom/python/wheelhouse/generic
Processing /cvmfs/soft.computecanada.ca/custom/python/wheelhouse/generic/wandb-0.12.5+computecanada-py2.py3-none-any.whl
Processing /cvmfs/soft.computecanada.ca/custom/python/wheelhouse/generic/psutil-5.7.3+computecanada-cp37-cp37m-linux_x86_64.whl
Processing /cvmfs/soft.computecanada.ca/custom/python/wheelhouse/generic/yaspin-2.1.0+computecanada-py3-none-any.whl
Processing /cvmfs/soft.computecanada.ca/custom/python/wheelhouse/generic/shortuuid-1.0.1+computecanada-py3-none-any.whl
Processing /cvmfs/soft.computecanada.ca/custom/python/wheelhouse/generic/sentry_sdk-1.5.0+computecanada-py2.py3-none-any.whl
Processing /cvmfs/soft.computecanada.ca/custom/python/wheelhouse/generic/protobuf-3.19.3+computecanada-py2.py3-none-any.whl
Requirement already satisfied: python-dateutil>=2.6.1 in /cvmfs/soft.computecanada.ca/easybuild/software/2017/Core/scipy-stack/2019a/lib/python3.7/site-packages (from wandb) (2.7.5)
Processing /cvmfs/soft.computecanada.ca/custom/python/wheelhouse/generic/pathtools-0.1.2+computecanada-py3-none-any.whl
Processing /cvmfs/soft.computecanada.ca/custom/python/wheelhouse/generic/docker_pycreds-0.4.0+computecanada-py2.py3-none-any.whl
Processing /cvmfs/soft.computecanada.ca/custom/python/wheelhouse/generic/configparser-5.0.2+computecanada-py3-none-any.whl
Processing /cvmfs/soft.computecanada.ca/custom/python/wheelhouse/generic/GitPython-3.1.24+computecanada-py3-none-any.whl
Processing /cvmfs/soft.computecanada.ca/custom/python/wheelhouse/generic/six-1.16.0+computecanada-py2.py3-none-any.whl
Processing /cvmfs/soft.computecanada.ca/custom/python/wheelhouse/generic/PyYAML-5.3.1+computecanada-cp37-cp37m-linux_x86_64.whl
Processing /cvmfs/soft.computecanada.ca/custom/python/wheelhouse/generic/subprocess32-3.5.4+computecanada-py3-none-any.whl
Processing /cvmfs/soft.computecanada.ca/custom/python/wheelhouse/generic/promise-2.3+computecanada-py3-none-any.whl
Requirement already satisfied: requests<3,>=2.0.0 in /cvmfs/soft.computecanada.ca/easybuild/software/2017/Core/scipy-stack/2019a/lib/python3.7/site-packages (from wandb) (2.21.0)
Processing /cvmfs/soft.computecanada.ca/custom/python/wheelhouse/generic/click-8.0.3+computecanada-py3-none-any.whl
Requirement already satisfied: importlib-metadata in /cvmfs/soft.computecanada.ca/easybuild/software/2017/Core/scipy-stack/2019a/lib/python3.7/site-packages (from Click!=8.0.0,>=7.0->wandb) (0.8)
Processing /cvmfs/soft.computecanada.ca/custom/python/wheelhouse/generic/typing_extensions-4.0.1+computecanada-py3-none-any.whl
Processing /cvmfs/soft.computecanada.ca/custom/python/wheelhouse/generic/gitdb-4.0.9+computecanada-py3-none-any.whl
Processing /cvmfs/soft.computecanada.ca/custom/python/wheelhouse/generic/smmap-5.0.0+computecanada-py3-none-any.whl
Requirement already satisfied: idna<2.9,>=2.5 in /cvmfs/soft.computecanada.ca/easybuild/software/2017/Core/scipy-stack/2019a/lib/python3.7/site-packages (from requests<3,>=2.0.0->wandb) (2.8)
Requirement already satisfied: certifi>=2017.4.17 in /cvmfs/soft.computecanada.ca/easybuild/software/2017/Core/scipy-stack/2019a/lib/python3.7/site-packages (from requests<3,>=2.0.0->wandb) (2018.11.29)
Requirement already satisfied: chardet<3.1.0,>=3.0.2 in /cvmfs/soft.computecanada.ca/easybuild/software/2017/Core/scipy-stack/2019a/lib/python3.7/site-packages (from requests<3,>=2.0.0->wandb) (3.0.4)
Requirement already satisfied: urllib3<1.25,>=1.21.1 in /cvmfs/soft.computecanada.ca/easybuild/software/2017/Core/scipy-stack/2019a/lib/python3.7/site-packages (from requests<3,>=2.0.0->wandb) (1.24.1)
Processing /cvmfs/soft.computecanada.ca/custom/python/wheelhouse/generic/termcolor-1.1.0+computecanada-py3-none-any.whl
Requirement already satisfied: zipp>=0.3.2 in /cvmfs/soft.computecanada.ca/easybuild/software/2017/Core/scipy-stack/2019a/lib/python3.7/site-packages (from importlib-metadata->Click!=8.0.0,>=7.0->wandb) (0.3.3)
Installing collected packages: smmap, typing-extensions, termcolor, six, gitdb, yaspin, subprocess32, shortuuid, sentry-sdk, PyYAML, psutil, protobuf, promise, pathtools, GitPython, docker-pycreds, configparser, Click, wandb
  Attempting uninstall: six
    Found existing installation: six 1.12.0
    Not uninstalling six at /cvmfs/soft.computecanada.ca/easybuild/software/2017/Core/scipy-stack/2019a/lib/python3.7/site-packages, outside environment /localscratch/yinan.27794531.0/env
    Can't uninstall 'six'. No files were found to uninstall.
Successfully installed Click-8.0.3+computecanada GitPython-3.1.24+computecanada PyYAML-5.3.1+computecanada configparser-5.0.2+computecanada docker-pycreds-0.4.0+computecanada gitdb-4.0.9+computecanada pathtools-0.1.2+computecanada promise-2.3+computecanada protobuf-3.19.3+computecanada psutil-5.7.3+computecanada sentry-sdk-1.5.0+computecanada shortuuid-1.0.1+computecanada six-1.16.0+computecanada smmap-5.0.0+computecanada subprocess32-3.5.4+computecanada termcolor-1.1.0+computecanada typing-extensions-4.0.1+computecanada wandb-0.12.5+computecanada yaspin-2.1.0+computecanada
Looking in links: /cvmfs/soft.computecanada.ca/custom/python/wheelhouse/nix/avx2, /cvmfs/soft.computecanada.ca/custom/python/wheelhouse/nix/generic, /cvmfs/soft.computecanada.ca/custom/python/wheelhouse/generic
ERROR: Could not find a version that satisfies the requirement sagemaker (from versions: none)
ERROR: No matching distribution found for sagemaker
Looking in links: /cvmfs/soft.computecanada.ca/custom/python/wheelhouse/nix/avx2, /cvmfs/soft.computecanada.ca/custom/python/wheelhouse/nix/generic, /cvmfs/soft.computecanada.ca/custom/python/wheelhouse/generic
Processing /cvmfs/soft.computecanada.ca/custom/python/wheelhouse/generic/torch-1.9.1+computecanada-cp37-cp37m-linux_x86_64.whl
Requirement already satisfied: typing-extensions in /localscratch/yinan.27794531.0/env/lib/python3.7/site-packages (from torch) (4.0.1+computecanada)
Installing collected packages: torch
Successfully installed torch-1.9.1+computecanada
Looking in links: /cvmfs/soft.computecanada.ca/custom/python/wheelhouse/nix/avx2, /cvmfs/soft.computecanada.ca/custom/python/wheelhouse/nix/generic, /cvmfs/soft.computecanada.ca/custom/python/wheelhouse/generic
Processing /cvmfs/soft.computecanada.ca/custom/python/wheelhouse/generic/transformers-2.5.1+computecanada-py3-none-any.whl
Processing /cvmfs/soft.computecanada.ca/custom/python/wheelhouse/generic/tokenizers-0.5.2+computecanada-cp37-cp37m-linux_x86_64.whl
Processing /cvmfs/soft.computecanada.ca/custom/python/wheelhouse/generic/boto3-1.20.52+computecanada-py3-none-any.whl
Processing /cvmfs/soft.computecanada.ca/custom/python/wheelhouse/generic/sacremoses-0.0.46+computecanada-py3-none-any.whl
Requirement already satisfied: requests in /cvmfs/soft.computecanada.ca/easybuild/software/2017/Core/scipy-stack/2019a/lib/python3.7/site-packages (from transformers==2.5.1+computecanada) (2.21.0)
Processing /cvmfs/soft.computecanada.ca/custom/python/wheelhouse/generic/sentencepiece-0.1.91+computecanada-cp37-cp37m-linux_x86_64.whl
Processing /cvmfs/soft.computecanada.ca/custom/python/wheelhouse/generic/regex-2020.11.13+computecanada-cp37-cp37m-linux_x86_64.whl
Requirement already satisfied: numpy in /cvmfs/soft.computecanada.ca/easybuild/software/2017/Core/scipy-stack/2019a/lib/python3.7/site-packages (from transformers==2.5.1+computecanada) (1.16.0)
Processing /cvmfs/soft.computecanada.ca/custom/python/wheelhouse/generic/filelock-3.4.2+computecanada-py3-none-any.whl
Processing /cvmfs/soft.computecanada.ca/custom/python/wheelhouse/generic/tqdm-4.62.3+computecanada-py2.py3-none-any.whl
Processing /cvmfs/soft.computecanada.ca/custom/python/wheelhouse/generic/botocore-1.23.52+computecanada-py3-none-any.whl
Processing /cvmfs/soft.computecanada.ca/custom/python/wheelhouse/generic/jmespath-0.10.0+computecanada-py2.py3-none-any.whl
Processing /cvmfs/soft.computecanada.ca/custom/python/wheelhouse/generic/s3transfer-0.5.1+computecanada-py3-none-any.whl
Processing /cvmfs/soft.computecanada.ca/custom/python/wheelhouse/generic/urllib3-1.26.8+computecanada-py2.py3-none-any.whl
Requirement already satisfied: python-dateutil<3.0.0,>=2.1 in /cvmfs/soft.computecanada.ca/easybuild/software/2017/Core/scipy-stack/2019a/lib/python3.7/site-packages (from botocore<1.24.0,>=1.23.52->boto3->transformers==2.5.1+computecanada) (2.7.5)
Requirement already satisfied: six>=1.5 in /localscratch/yinan.27794531.0/env/lib/python3.7/site-packages (from python-dateutil<3.0.0,>=2.1->botocore<1.24.0,>=1.23.52->boto3->transformers==2.5.1+computecanada) (1.16.0+computecanada)
Requirement already satisfied: certifi>=2017.4.17 in /cvmfs/soft.computecanada.ca/easybuild/software/2017/Core/scipy-stack/2019a/lib/python3.7/site-packages (from requests->transformers==2.5.1+computecanada) (2018.11.29)
Requirement already satisfied: chardet<3.1.0,>=3.0.2 in /cvmfs/soft.computecanada.ca/easybuild/software/2017/Core/scipy-stack/2019a/lib/python3.7/site-packages (from requests->transformers==2.5.1+computecanada) (3.0.4)
Requirement already satisfied: idna<2.9,>=2.5 in /cvmfs/soft.computecanada.ca/easybuild/software/2017/Core/scipy-stack/2019a/lib/python3.7/site-packages (from requests->transformers==2.5.1+computecanada) (2.8)
Processing /cvmfs/soft.computecanada.ca/custom/python/wheelhouse/generic/requests-2.27.1+computecanada-py2.py3-none-any.whl
Processing /cvmfs/soft.computecanada.ca/custom/python/wheelhouse/generic/charset_normalizer-2.0.11+computecanada-py3-none-any.whl
Processing /cvmfs/soft.computecanada.ca/custom/python/wheelhouse/generic/joblib-1.1.0+computecanada-py2.py3-none-any.whl
Requirement already satisfied: click in /localscratch/yinan.27794531.0/env/lib/python3.7/site-packages (from sacremoses->transformers==2.5.1+computecanada) (8.0.3+computecanada)
Requirement already satisfied: importlib-metadata in /cvmfs/soft.computecanada.ca/easybuild/software/2017/Core/scipy-stack/2019a/lib/python3.7/site-packages (from click->sacremoses->transformers==2.5.1+computecanada) (0.8)
Requirement already satisfied: zipp>=0.3.2 in /cvmfs/soft.computecanada.ca/easybuild/software/2017/Core/scipy-stack/2019a/lib/python3.7/site-packages (from importlib-metadata->click->sacremoses->transformers==2.5.1+computecanada) (0.3.3)
Installing collected packages: urllib3, jmespath, botocore, tqdm, s3transfer, regex, joblib, charset-normalizer, tokenizers, sentencepiece, sacremoses, requests, filelock, boto3, transformers
  Attempting uninstall: urllib3
    Found existing installation: urllib3 1.24.1
    Not uninstalling urllib3 at /cvmfs/soft.computecanada.ca/easybuild/software/2017/Core/scipy-stack/2019a/lib/python3.7/site-packages, outside environment /localscratch/yinan.27794531.0/env
    Can't uninstall 'urllib3'. No files were found to uninstall.
  Attempting uninstall: requests
    Found existing installation: requests 2.21.0
    Not uninstalling requests at /cvmfs/soft.computecanada.ca/easybuild/software/2017/Core/scipy-stack/2019a/lib/python3.7/site-packages, outside environment /localscratch/yinan.27794531.0/env
    Can't uninstall 'requests'. No files were found to uninstall.
Successfully installed boto3-1.20.52+computecanada botocore-1.23.52+computecanada charset-normalizer-2.0.11+computecanada filelock-3.4.2+computecanada jmespath-0.10.0+computecanada joblib-1.1.0+computecanada regex-2020.11.13+computecanada requests-2.27.1+computecanada s3transfer-0.5.1+computecanada sacremoses-0.0.46+computecanada sentencepiece-0.1.91+computecanada tokenizers-0.5.2+computecanada tqdm-4.62.3+computecanada transformers-2.5.1+computecanada urllib3-1.26.8+computecanada
Looking in links: /cvmfs/soft.computecanada.ca/custom/python/wheelhouse/nix/avx2, /cvmfs/soft.computecanada.ca/custom/python/wheelhouse/nix/generic, /cvmfs/soft.computecanada.ca/custom/python/wheelhouse/generic
Processing /cvmfs/soft.computecanada.ca/custom/python/wheelhouse/generic/tensorflow_gpu-2.3.0+computecanada-cp37-cp37m-linux_x86_64.whl
Processing /cvmfs/soft.computecanada.ca/custom/python/wheelhouse/generic/tensorflow_estimator-2.3.0+computecanada-py2.py3-none-any.whl
Processing /cvmfs/soft.computecanada.ca/custom/python/wheelhouse/generic/absl_py-1.0.0+computecanada-py3-none-any.whl
Processing /cvmfs/soft.computecanada.ca/custom/python/wheelhouse/generic/gast-0.3.3+computecanada-py3-none-any.whl
Processing /cvmfs/soft.computecanada.ca/custom/python/wheelhouse/generic/tensorboard-2.6.0+computecanada-py3-none-any.whl
Processing /cvmfs/soft.computecanada.ca/custom/python/wheelhouse/generic/google_pasta-0.2.0+computecanada-py3-none-any.whl
Requirement already satisfied: protobuf>=3.9.2 in /localscratch/yinan.27794531.0/env/lib/python3.7/site-packages (from tensorflow_gpu==2.3.0+computecanada) (3.19.3+computecanada)
Processing /cvmfs/soft.computecanada.ca/custom/python/wheelhouse/generic/wrapt-1.11.2+computecanada-cp37-cp37m-linux_x86_64.whl
Processing /cvmfs/soft.computecanada.ca/custom/python/wheelhouse/nix/avx2/h5py-2.10.0+computecanada-cp37-cp37m-linux_x86_64.whl
Requirement already satisfied: wheel>=0.26 in /localscratch/yinan.27794531.0/env/lib/python3.7/site-packages (from tensorflow_gpu==2.3.0+computecanada) (0.33.4)
Processing /cvmfs/soft.computecanada.ca/custom/python/wheelhouse/nix/generic/scipy-1.4.1+computecanada-cp37-cp37m-linux_x86_64.whl
Requirement already satisfied: numpy<1.19.0,>=1.16.0 in /cvmfs/soft.computecanada.ca/easybuild/software/2017/Core/scipy-stack/2019a/lib/python3.7/site-packages (from tensorflow_gpu==2.3.0+computecanada) (1.16.0)
Processing /cvmfs/soft.computecanada.ca/custom/python/wheelhouse/generic/astunparse-1.6.3+computecanada-py2.py3-none-any.whl
Processing /cvmfs/soft.computecanada.ca/custom/python/wheelhouse/generic/opt_einsum-3.3.0+computecanada-py3-none-any.whl
Processing /cvmfs/soft.computecanada.ca/custom/python/wheelhouse/generic/Keras_Preprocessing-1.1.2+computecanada-py3-none-any.whl
Requirement already satisfied: six>=1.12.0 in /localscratch/yinan.27794531.0/env/lib/python3.7/site-packages (from tensorflow_gpu==2.3.0+computecanada) (1.16.0+computecanada)
Processing /cvmfs/soft.computecanada.ca/custom/python/wheelhouse/generic/grpcio-1.38.0+computecanada-cp37-cp37m-linux_x86_64.whl
Requirement already satisfied: termcolor>=1.1.0 in /localscratch/yinan.27794531.0/env/lib/python3.7/site-packages (from tensorflow_gpu==2.3.0+computecanada) (1.1.0+computecanada)
Processing /cvmfs/soft.computecanada.ca/custom/python/wheelhouse/generic/Werkzeug-2.0.3+computecanada-py3-none-any.whl
Processing /cvmfs/soft.computecanada.ca/custom/python/wheelhouse/generic/google_auth-1.35.0+computecanada-py2.py3-none-any.whl
Processing /cvmfs/soft.computecanada.ca/custom/python/wheelhouse/generic/tensorboard_data_server-0.6.1+computecanada-py3-none-linux_x86_64.whl
Processing /cvmfs/soft.computecanada.ca/custom/python/wheelhouse/generic/google_auth_oauthlib-0.4.6+computecanada-py2.py3-none-any.whl
Processing /cvmfs/soft.computecanada.ca/custom/python/wheelhouse/generic/tensorboard_plugin_wit-1.8.0+computecanada-py3-none-any.whl
Requirement already satisfied: setuptools>=41.0.0 in /localscratch/yinan.27794531.0/env/lib/python3.7/site-packages (from tensorboard<3,>=2.3.0->tensorflow_gpu==2.3.0+computecanada) (41.0.1)
Processing /cvmfs/soft.computecanada.ca/custom/python/wheelhouse/generic/Markdown-3.3.6+computecanada-py3-none-any.whl
Requirement already satisfied: requests<3,>=2.21.0 in /localscratch/yinan.27794531.0/env/lib/python3.7/site-packages (from tensorboard<3,>=2.3.0->tensorflow_gpu==2.3.0+computecanada) (2.27.1+computecanada)
Processing /cvmfs/soft.computecanada.ca/custom/python/wheelhouse/generic/rsa-4.8+computecanada-py3-none-any.whl
Processing /cvmfs/soft.computecanada.ca/custom/python/wheelhouse/generic/cachetools-4.2.4+computecanada-py3-none-any.whl
Processing /cvmfs/soft.computecanada.ca/custom/python/wheelhouse/generic/pyasn1_modules-0.2.8+computecanada-py2.py3-none-any.whl
Processing /cvmfs/soft.computecanada.ca/custom/python/wheelhouse/generic/requests_oauthlib-1.3.0+computecanada-py2.py3-none-any.whl
Processing /cvmfs/soft.computecanada.ca/custom/python/wheelhouse/generic/importlib_metadata-4.10.1+computecanada-py3-none-any.whl
Processing /cvmfs/soft.computecanada.ca/custom/python/wheelhouse/generic/zipp-3.7.0+computecanada-py3-none-any.whl
Requirement already satisfied: typing-extensions>=3.6.4 in /localscratch/yinan.27794531.0/env/lib/python3.7/site-packages (from importlib-metadata>=4.4->markdown>=2.6.8->tensorboard<3,>=2.3.0->tensorflow_gpu==2.3.0+computecanada) (4.0.1+computecanada)
Processing /cvmfs/soft.computecanada.ca/custom/python/wheelhouse/generic/pyasn1-0.4.8+computecanada-py2.py3-none-any.whl
Requirement already satisfied: urllib3<1.27,>=1.21.1 in /localscratch/yinan.27794531.0/env/lib/python3.7/site-packages (from requests<3,>=2.21.0->tensorboard<3,>=2.3.0->tensorflow_gpu==2.3.0+computecanada) (1.26.8+computecanada)
Requirement already satisfied: idna<4,>=2.5 in /cvmfs/soft.computecanada.ca/easybuild/software/2017/Core/scipy-stack/2019a/lib/python3.7/site-packages (from requests<3,>=2.21.0->tensorboard<3,>=2.3.0->tensorflow_gpu==2.3.0+computecanada) (2.8)
Requirement already satisfied: certifi>=2017.4.17 in /cvmfs/soft.computecanada.ca/easybuild/software/2017/Core/scipy-stack/2019a/lib/python3.7/site-packages (from requests<3,>=2.21.0->tensorboard<3,>=2.3.0->tensorflow_gpu==2.3.0+computecanada) (2018.11.29)
Requirement already satisfied: charset-normalizer~=2.0.0 in /localscratch/yinan.27794531.0/env/lib/python3.7/site-packages (from requests<3,>=2.21.0->tensorboard<3,>=2.3.0->tensorflow_gpu==2.3.0+computecanada) (2.0.11+computecanada)
Processing /cvmfs/soft.computecanada.ca/custom/python/wheelhouse/generic/oauthlib-3.1.1+computecanada-py2.py3-none-any.whl
Installing collected packages: pyasn1, zipp, rsa, pyasn1-modules, oauthlib, cachetools, requests-oauthlib, importlib-metadata, google-auth, werkzeug, tensorboard-plugin-wit, tensorboard-data-server, markdown, grpcio, google-auth-oauthlib, absl-py, wrapt, tensorflow-estimator, tensorboard, scipy, opt-einsum, keras-preprocessing, h5py, google-pasta, gast, astunparse, tensorflow-gpu
  Attempting uninstall: pyasn1
    Found existing installation: pyasn1 0.4.3
    Not uninstalling pyasn1 at /cvmfs/soft.computecanada.ca/easybuild/software/2017/Core/scipy-stack/2019a/lib/python3.7/site-packages, outside environment /localscratch/yinan.27794531.0/env
    Can't uninstall 'pyasn1'. No files were found to uninstall.
  Attempting uninstall: zipp
    Found existing installation: zipp 0.3.3
    Not uninstalling zipp at /cvmfs/soft.computecanada.ca/easybuild/software/2017/Core/scipy-stack/2019a/lib/python3.7/site-packages, outside environment /localscratch/yinan.27794531.0/env
    Can't uninstall 'zipp'. No files were found to uninstall.
  Attempting uninstall: importlib-metadata
    Found existing installation: importlib-metadata 0.8
    Not uninstalling importlib-metadata at /cvmfs/soft.computecanada.ca/easybuild/software/2017/Core/scipy-stack/2019a/lib/python3.7/site-packages, outside environment /localscratch/yinan.27794531.0/env
    Can't uninstall 'importlib-metadata'. No files were found to uninstall.
  Attempting uninstall: scipy
    Found existing installation: scipy 1.2.0
    Not uninstalling scipy at /cvmfs/soft.computecanada.ca/easybuild/software/2017/Core/scipy-stack/2019a/lib/python3.7/site-packages, outside environment /localscratch/yinan.27794531.0/env
    Can't uninstall 'scipy'. No files were found to uninstall.
Successfully installed absl-py-1.0.0+computecanada astunparse-1.6.3+computecanada cachetools-4.2.4+computecanada gast-0.3.3+computecanada google-auth-1.35.0+computecanada google-auth-oauthlib-0.4.6+computecanada google-pasta-0.2.0+computecanada grpcio-1.38.0+computecanada h5py-2.10.0+computecanada importlib-metadata-4.10.1+computecanada keras-preprocessing-1.1.2+computecanada markdown-3.3.6+computecanada oauthlib-3.1.1+computecanada opt-einsum-3.3.0+computecanada pyasn1-0.4.8+computecanada pyasn1-modules-0.2.8+computecanada requests-oauthlib-1.3.0+computecanada rsa-4.8+computecanada scipy-1.4.1+computecanada tensorboard-2.6.0+computecanada tensorboard-data-server-0.6.1+computecanada tensorboard-plugin-wit-1.8.0+computecanada tensorflow-estimator-2.3.0+computecanada tensorflow-gpu-2.3.0+computecanada werkzeug-2.0.3+computecanada wrapt-1.11.2+computecanada zipp-3.7.0+computecanada
Looking in links: /cvmfs/soft.computecanada.ca/custom/python/wheelhouse/nix/avx2, /cvmfs/soft.computecanada.ca/custom/python/wheelhouse/nix/generic, /cvmfs/soft.computecanada.ca/custom/python/wheelhouse/generic
Processing /cvmfs/soft.computecanada.ca/custom/python/wheelhouse/generic/keras-2.7.0+computecanada-py2.py3-none-any.whl
Installing collected packages: Keras
Successfully installed Keras-2.7.0+computecanada
Looking in links: /cvmfs/soft.computecanada.ca/custom/python/wheelhouse/nix/avx2, /cvmfs/soft.computecanada.ca/custom/python/wheelhouse/nix/generic, /cvmfs/soft.computecanada.ca/custom/python/wheelhouse/generic
Processing /cvmfs/soft.computecanada.ca/custom/python/wheelhouse/generic/urllib3-1.26.7+computecanada-py2.py3-none-any.whl
Installing collected packages: urllib3
  Attempting uninstall: urllib3
    Found existing installation: urllib3 1.26.8+computecanada
    Uninstalling urllib3-1.26.8+computecanada:
      Successfully uninstalled urllib3-1.26.8+computecanada
Successfully installed urllib3-1.26.7+computecanada
Looking in links: /cvmfs/soft.computecanada.ca/custom/python/wheelhouse/nix/avx2, /cvmfs/soft.computecanada.ca/custom/python/wheelhouse/nix/generic, /cvmfs/soft.computecanada.ca/custom/python/wheelhouse/generic
Processing /cvmfs/soft.computecanada.ca/custom/python/wheelhouse/generic/nltk-3.7+computecanada-py3-none-any.whl
Requirement already satisfied: tqdm in /localscratch/yinan.27794531.0/env/lib/python3.7/site-packages (from nltk) (4.62.3+computecanada)
Requirement already satisfied: click in /localscratch/yinan.27794531.0/env/lib/python3.7/site-packages (from nltk) (8.0.3+computecanada)
Requirement already satisfied: joblib in /localscratch/yinan.27794531.0/env/lib/python3.7/site-packages (from nltk) (1.1.0+computecanada)
Processing /cvmfs/soft.computecanada.ca/custom/python/wheelhouse/generic/nltk-3.6.5+computecanada-py3-none-any.whl
Processing /cvmfs/soft.computecanada.ca/custom/python/wheelhouse/generic/nltk-3.6.3+computecanada-py3-none-any.whl
Requirement already satisfied: regex in /localscratch/yinan.27794531.0/env/lib/python3.7/site-packages (from nltk) (2020.11.13+computecanada)
Requirement already satisfied: importlib-metadata in /localscratch/yinan.27794531.0/env/lib/python3.7/site-packages (from click->nltk) (4.10.1+computecanada)
Requirement already satisfied: typing-extensions>=3.6.4 in /localscratch/yinan.27794531.0/env/lib/python3.7/site-packages (from importlib-metadata->click->nltk) (4.0.1+computecanada)
Requirement already satisfied: zipp>=0.5 in /localscratch/yinan.27794531.0/env/lib/python3.7/site-packages (from importlib-metadata->click->nltk) (3.7.0+computecanada)
Installing collected packages: nltk
Successfully installed nltk-3.6.3+computecanada
Looking in links: /cvmfs/soft.computecanada.ca/custom/python/wheelhouse/nix/avx2, /cvmfs/soft.computecanada.ca/custom/python/wheelhouse/nix/generic, /cvmfs/soft.computecanada.ca/custom/python/wheelhouse/generic
Processing /cvmfs/soft.computecanada.ca/custom/python/wheelhouse/generic/scikit_learn-0.22.1+computecanada-cp37-cp37m-linux_x86_64.whl
Requirement already satisfied: scipy>=0.17.0 in /localscratch/yinan.27794531.0/env/lib/python3.7/site-packages (from scikit-learn==0.22.1) (1.4.1+computecanada)
Requirement already satisfied: joblib>=0.11 in /localscratch/yinan.27794531.0/env/lib/python3.7/site-packages (from scikit-learn==0.22.1) (1.1.0+computecanada)
Requirement already satisfied: numpy>=1.11.0 in /cvmfs/soft.computecanada.ca/easybuild/software/2017/Core/scipy-stack/2019a/lib/python3.7/site-packages (from scikit-learn==0.22.1) (1.16.0)
Installing collected packages: scikit-learn
Successfully installed scikit-learn-0.22.1+computecanada
Looking in links: /cvmfs/soft.computecanada.ca/custom/python/wheelhouse/nix/avx2, /cvmfs/soft.computecanada.ca/custom/python/wheelhouse/nix/generic, /cvmfs/soft.computecanada.ca/custom/python/wheelhouse/generic
Requirement already satisfied: tokenizers==0.5.2 in /localscratch/yinan.27794531.0/env/lib/python3.7/site-packages (0.5.2+computecanada)
wandb: Appending key for api.wandb.ai to your netrc file: /home/yinan/.netrc
Starting Task
2022-02-25 10:39:43.850473: I tensorflow/stream_executor/platform/default/dso_loader.cc:48] Successfully opened dynamic library libcudart.so.10.1
[nltk_data] Downloading package stopwords to /home/yinan/nltk_data...
[nltk_data]   Package stopwords is already up-to-date!
[nltk_data] Downloading package wordnet to /home/yinan/nltk_data...
[nltk_data]   Package wordnet is already up-to-date!
wandb: Currently logged in as: yinanazhou (use `wandb login --relogin` to force relogin)
wandb: wandb version 0.12.10 is available!  To upgrade, please run:
wandb:  $ pip install wandb --upgrade
2022-02-25 10:39:53.931168: I tensorflow/stream_executor/platform/default/dso_loader.cc:48] Successfully opened dynamic library libcudart.so.10.1
wandb: Tracking run with wandb version 0.12.5
wandb: Syncing run zesty-plasma-1
wandb: ⭐️ View project at https://wandb.ai/yinanazhou/xl_512_bs_8_lr_1e07_es_5_lc_False_nr_False_stem_False_lemma_False_repeat_1_fold_1
wandb: 🚀 View run at https://wandb.ai/yinanazhou/xl_512_bs_8_lr_1e07_es_5_lc_False_nr_False_stem_False_lemma_False_repeat_1_fold_1/runs/21f438jj
wandb: Run data is saved locally in /project/6002780/yinan/Thesis_MER_Lyrics/lyric-emotion/wandb/run-20220225_103951-21f438jj
wandb: Run `wandb offline` to turn off syncing.

Validation loss decreased (inf --> 1.447266).  Saving model ...
Validation loss decreased (1.447266 --> 1.437970).  Saving model ...
Validation loss decreased (1.437970 --> 1.428082).  Saving model ...
Validation loss decreased (1.428082 --> 1.419422).  Saving model ...
Validation loss decreased (1.419422 --> 1.410801).  Saving model ...
Validation loss decreased (1.410801 --> 1.403790).  Saving model ...
Validation loss decreased (1.403790 --> 1.396325).  Saving model ...
Validation loss decreased (1.396325 --> 1.389933).  Saving model ...
Validation loss decreased (1.389933 --> 1.384976).  Saving model ...
Validation loss decreased (1.384976 --> 1.378998).  Saving model ...
Validation loss decreased (1.378998 --> 1.372438).  Saving model ...
Validation loss decreased (1.372438 --> 1.367018).  Saving model ...
Validation loss decreased (1.367018 --> 1.361318).  Saving model ...
Validation loss decreased (1.361318 --> 1.357056).  Saving model ...
Validation loss decreased (1.357056 --> 1.352462).  Saving model ...
Validation loss decreased (1.352462 --> 1.347467).  Saving model ...
Validation loss decreased (1.347467 --> 1.343710).  Saving model ...
Validation loss decreased (1.343710 --> 1.339687).  Saving model ...
Validation loss decreased (1.339687 --> 1.335850).  Saving model ...
Validation loss decreased (1.335850 --> 1.331873).  Saving model ...
Validation loss decreased (1.331873 --> 1.327640).  Saving model ...
Validation loss decreased (1.327640 --> 1.324385).  Saving model ...
Validation loss decreased (1.324385 --> 1.320620).  Saving model ...
Validation loss decreased (1.320620 --> 1.316456).  Saving model ...
Validation loss decreased (1.316456 --> 1.312808).  Saving model ...
Validation loss decreased (1.312808 --> 1.309726).  Saving model ...
Validation loss decreased (1.309726 --> 1.306804).  Saving model ...
Validation loss decreased (1.306804 --> 1.303609).  Saving model ...
Validation loss decreased (1.303609 --> 1.300115).  Saving model ...
Validation loss decreased (1.300115 --> 1.296964).  Saving model ...
Validation loss decreased (1.296964 --> 1.294100).  Saving model ...
Validation loss decreased (1.294100 --> 1.291073).  Saving model ...
Validation loss decreased (1.291073 --> 1.288614).  Saving model ...
Validation loss decreased (1.288614 --> 1.285543).  Saving model ...
Validation loss decreased (1.285543 --> 1.282380).  Saving model ...
Validation loss decreased (1.282380 --> 1.279665).  Saving model ...
Validation loss decreased (1.279665 --> 1.277156).  Saving model ...
Validation loss decreased (1.277156 --> 1.274100).  Saving model ...
Validation loss decreased (1.274100 --> 1.271296).  Saving model ...
Validation loss decreased (1.271296 --> 1.268631).  Saving model ...
Validation loss decreased (1.268631 --> 1.265496).  Saving model ...
Validation loss decreased (1.265496 --> 1.262232).  Saving model ...
Validation loss decreased (1.262232 --> 1.259580).  Saving model ...
Validation loss decreased (1.259580 --> 1.257002).  Saving model ...
Validation loss decreased (1.257002 --> 1.254105).  Saving model ...
Validation loss decreased (1.254105 --> 1.250817).  Saving model ...
Validation loss decreased (1.250817 --> 1.248023).  Saving model ...
Validation loss decreased (1.248023 --> 1.245421).  Saving model ...
Validation loss decreased (1.245421 --> 1.242726).  Saving model ...
Validation loss decreased (1.242726 --> 1.240046).  Saving model ...
Validation loss decreased (1.240046 --> 1.236974).  Saving model ...
Validation loss decreased (1.236974 --> 1.234185).  Saving model ...
Validation loss decreased (1.234185 --> 1.232467).  Saving model ...
Validation loss decreased (1.232467 --> 1.230033).  Saving model ...
Validation loss decreased (1.230033 --> 1.227734).  Saving model ...
Validation loss decreased (1.227734 --> 1.225117).  Saving model ...
Validation loss decreased (1.225117 --> 1.222807).  Saving model ...
Validation loss decreased (1.222807 --> 1.220420).  Saving model ...
Validation loss decreased (1.220420 --> 1.217257).  Saving model ...
Validation loss decreased (1.217257 --> 1.214080).  Saving model ...
Validation loss decreased (1.214080 --> 1.211504).  Saving model ...
Validation loss decreased (1.211504 --> 1.209025).  Saving model ...
Validation loss decreased (1.209025 --> 1.206252).  Saving model ...
Validation loss decreased (1.206252 --> 1.203766).  Saving model ...
Validation loss decreased (1.203766 --> 1.201381).  Saving model ...
Validation loss decreased (1.201381 --> 1.199346).  Saving model ...
Validation loss decreased (1.199346 --> 1.195874).  Saving model ...
Validation loss decreased (1.195874 --> 1.193373).  Saving model ...
Validation loss decreased (1.193373 --> 1.190509).  Saving model ...
Validation loss decreased (1.190509 --> 1.188051).  Saving model ...
Validation loss decreased (1.188051 --> 1.185908).  Saving model ...
Validation loss decreased (1.185908 --> 1.182441).  Saving model ...
Validation loss decreased (1.182441 --> 1.180518).  Saving model ...
Validation loss decreased (1.180518 --> 1.177906).  Saving model ...
Validation loss decreased (1.177906 --> 1.175591).  Saving model ...
Validation loss decreased (1.175591 --> 1.172585).  Saving model ...
Validation loss decreased (1.172585 --> 1.170681).  Saving model ...
Validation loss decreased (1.170681 --> 1.168675).  Saving model ...
Validation loss decreased (1.168675 --> 1.165697).  Saving model ...
Validation loss decreased (1.165697 --> 1.162733).  Saving model ...
Validation loss decreased (1.162733 --> 1.160420).  Saving model ...
Validation loss decreased (1.160420 --> 1.157852).  Saving model ...
Validation loss decreased (1.157852 --> 1.154953).  Saving model ...
Validation loss decreased (1.154953 --> 1.152608).  Saving model ...
Validation loss decreased (1.152608 --> 1.150433).  Saving model ...
Validation loss decreased (1.150433 --> 1.146321).  Saving model ...
Validation loss decreased (1.146321 --> 1.144510).  Saving model ...
Validation loss decreased (1.144510 --> 1.142464).  Saving model ...
Validation loss decreased (1.142464 --> 1.140439).  Saving model ...
Validation loss decreased (1.140439 --> 1.137561).  Saving model ...
Validation loss decreased (1.137561 --> 1.134989).  Saving model ...
Validation loss decreased (1.134989 --> 1.132545).  Saving model ...
Validation loss decreased (1.132545 --> 1.129488).  Saving model ...
Validation loss decreased (1.129488 --> 1.125604).  Saving model ...
Validation loss decreased (1.125604 --> 1.123842).  Saving model ...
Validation loss decreased (1.123842 --> 1.120446).  Saving model ...
Validation loss decreased (1.120446 --> 1.119579).  Saving model ...
Validation loss decreased (1.119579 --> 1.116534).  Saving model ...
Validation loss decreased (1.116534 --> 1.113922).  Saving model ...
Validation loss decreased (1.113922 --> 1.111873).  Saving model ...
Validation loss decreased (1.111873 --> 1.109070).  Saving model ...
Validation loss decreased (1.109070 --> 1.105903).  Saving model ...
Validation loss decreased (1.105903 --> 1.102078).  Saving model ...
Validation loss decreased (1.102078 --> 1.100934).  Saving model ...
EarlyStopping counter: 1 out of 5.0
EarlyStopping counter: 2 out of 5.0
Validation loss decreased (1.100934 --> 1.097475).  Saving model ...
Validation loss decreased (1.097475 --> 1.090840).  Saving model ...
Validation loss decreased (1.090840 --> 1.088853).  Saving model ...
Validation loss decreased (1.088853 --> 1.087111).  Saving model ...
Validation loss decreased (1.087111 --> 1.086100).  Saving model ...
Validation loss decreased (1.086100 --> 1.085459).  Saving model ...
EarlyStopping counter: 1 out of 5.0
Validation loss decreased (1.085459 --> 1.082830).  Saving model ...
Validation loss decreased (1.082830 --> 1.076488).  Saving model ...
Validation loss decreased (1.076488 --> 1.075228).  Saving model ...
Validation loss decreased (1.075228 --> 1.072619).  Saving model ...
Validation loss decreased (1.072619 --> 1.068811).  Saving model ...
EarlyStopping counter: 1 out of 5.0
Validation loss decreased (1.068811 --> 1.067721).  Saving model ...
Validation loss decreased (1.067721 --> 1.066020).  Saving model ...
Validation loss decreased (1.066020 --> 1.063806).  Saving model ...
Validation loss decreased (1.063806 --> 1.061452).  Saving model ...
Validation loss decreased (1.061452 --> 1.060221).  Saving model ...
Validation loss decreased (1.060221 --> 1.057816).  Saving model ...
Validation loss decreased (1.057816 --> 1.056333).  Saving model ...
Validation loss decreased (1.056333 --> 1.054592).  Saving model ...
EarlyStopping counter: 1 out of 5.0
Validation loss decreased (1.054592 --> 1.052147).  Saving model ...
Validation loss decreased (1.052147 --> 1.049725).  Saving model ...
Validation loss decreased (1.049725 --> 1.046112).  Saving model ...
EarlyStopping counter: 1 out of 5.0
EarlyStopping counter: 2 out of 5.0
EarlyStopping counter: 3 out of 5.0
EarlyStopping counter: 4 out of 5.0
Validation loss decreased (1.046112 --> 1.043559).  Saving model ...
Validation loss decreased (1.043559 --> 1.040102).  Saving model ...
EarlyStopping counter: 1 out of 5.0
EarlyStopping counter: 2 out of 5.0
Validation loss decreased (1.040102 --> 1.036209).  Saving model ...
Validation loss decreased (1.036209 --> 1.033615).  Saving model ...
EarlyStopping counter: 1 out of 5.0
Validation loss decreased (1.033615 --> 1.032157).  Saving model ...
Validation loss decreased (1.032157 --> 1.032104).  Saving model ...
Validation loss decreased (1.032104 --> 1.028753).  Saving model ...
Validation loss decreased (1.028753 --> 1.027747).  Saving model ...
Validation loss decreased (1.027747 --> 1.024468).  Saving model ...
Validation loss decreased (1.024468 --> 1.024419).  Saving model ...
Validation loss decreased (1.024419 --> 1.020536).  Saving model ...
EarlyStopping counter: 1 out of 5.0
EarlyStopping counter: 2 out of 5.0
Validation loss decreased (1.020536 --> 1.019872).  Saving model ...
Validation loss decreased (1.019872 --> 1.015223).  Saving model ...
Validation loss decreased (1.015223 --> 1.015153).  Saving model ...
EarlyStopping counter: 1 out of 5.0
EarlyStopping counter: 2 out of 5.0
Validation loss decreased (1.015153 --> 1.014514).  Saving model ...
Validation loss decreased (1.014514 --> 1.012840).  Saving model ...
Validation loss decreased (1.012840 --> 1.007441).  Saving model ...
EarlyStopping counter: 1 out of 5.0
EarlyStopping counter: 2 out of 5.0
EarlyStopping counter: 3 out of 5.0
EarlyStopping counter: 4 out of 5.0
EarlyStopping counter: 5 out of 5.0
/localscratch/yinan.27794531.0/env/lib/python3.7/site-packages/torch/nn/functional.py:1794: UserWarning: nn.functional.tanh is deprecated. Use torch.tanh instead.
  warnings.warn("nn.functional.tanh is deprecated. Use torch.tanh instead.")
/localscratch/yinan.27794531.0/env/lib/python3.7/site-packages/transformers/optimization.py:155: UserWarning: This overload of add_ is deprecated:
	add_(Number alpha, Tensor other)
Consider using one of the following signatures instead:
	add_(Tensor other, *, Number alpha) (Triggered internally at  ../torch/csrc/utils/python_arg_parser.cpp:1025.)
  exp_avg.mul_(beta1).add_(1.0 - beta1, grad)
wandb: Waiting for W&B process to finish, PID 147535... (success).
wandb: - 0.00MB of 0.00MB uploaded (0.00MB deduped)wandb: \ 0.00MB of 0.00MB uploaded (0.00MB deduped)wandb: | 0.00MB of 0.00MB uploaded (0.00MB deduped)wandb: / 0.00MB of 0.00MB uploaded (0.00MB deduped)wandb: - 0.00MB of 0.00MB uploaded (0.00MB deduped)wandb: \ 0.00MB of 0.00MB uploaded (0.00MB deduped)wandb: | 0.00MB of 0.00MB uploaded (0.00MB deduped)wandb: / 0.00MB of 0.00MB uploaded (0.00MB deduped)wandb: - 0.00MB of 0.00MB uploaded (0.00MB deduped)wandb: \ 0.00MB of 0.00MB uploaded (0.00MB deduped)wandb: | 0.00MB of 0.00MB uploaded (0.00MB deduped)wandb: / 0.00MB of 0.00MB uploaded (0.00MB deduped)wandb: - 0.00MB of 0.00MB uploaded (0.00MB deduped)wandb:                                                                                
wandb: Run history:
wandb:     e_F1 ▁▁▂▃▄▄▅▅▅▆▆▆▆▆▆▆▆▆▆▆▇▇▇▇▇▇▇▇▇▇██████████
wandb:   e_loss █▇▇▇▆▆▆▆▆▅▅▅▅▅▄▄▄▄▄▃▃▃▃▃▃▂▂▂▂▂▂▂▂▂▁▁▁▁▁▁
wandb:     t_F1 ▁▂▁▃▃▃▄▃▄▄▄▄▅▅▅▅▅▆▆▆▆▆▆▆▆▆▇▇▇▇▇▇▇█▇█▇█▇█
wandb:   t_loss ███▇▇▇▆▆▆▆▆▆▆▅▅▅▅▅▅▄▄▄▄▄▄▃▃▃▃▃▃▂▃▂▂▂▂▂▂▁
wandb: 
wandb: Run summary:
wandb:     e_F1 58.21695
wandb:   e_loss 1.01042
wandb:     t_F1 69.86326
wandb:   t_loss 0.83059
wandb: 
wandb: Synced 4 W&B file(s), 0 media file(s), 0 artifact file(s) and 0 other file(s)
wandb: Synced zesty-plasma-1: https://wandb.ai/yinanazhou/xl_512_bs_8_lr_1e07_es_5_lc_False_nr_False_stem_False_lemma_False_repeat_1_fold_1/runs/21f438jj
wandb: Find logs at: ./wandb/run-20220225_103951-21f438jj/logs/debug.log
wandb: 

wandb: wandb version 0.12.10 is available!  To upgrade, please run:
wandb:  $ pip install wandb --upgrade
2022-02-25 13:16:46.497638: I tensorflow/stream_executor/platform/default/dso_loader.cc:48] Successfully opened dynamic library libcudart.so.10.1
wandb: Tracking run with wandb version 0.12.5
wandb: Syncing run lively-mountain-1
wandb: ⭐️ View project at https://wandb.ai/yinanazhou/xl_512_bs_8_lr_1e07_es_5_lc_False_nr_False_stem_False_lemma_False_repeat_1_fold_2
wandb: 🚀 View run at https://wandb.ai/yinanazhou/xl_512_bs_8_lr_1e07_es_5_lc_False_nr_False_stem_False_lemma_False_repeat_1_fold_2/runs/211n3hvj
wandb: Run data is saved locally in /project/6002780/yinan/Thesis_MER_Lyrics/lyric-emotion/wandb/run-20220225_131643-211n3hvj
wandb: Run `wandb offline` to turn off syncing.

Validation loss decreased (inf --> 1.435771).  Saving model ...
Validation loss decreased (1.435771 --> 1.430179).  Saving model ...
Validation loss decreased (1.430179 --> 1.424635).  Saving model ...
Validation loss decreased (1.424635 --> 1.419947).  Saving model ...
Validation loss decreased (1.419947 --> 1.415760).  Saving model ...
Validation loss decreased (1.415760 --> 1.412037).  Saving model ...
Validation loss decreased (1.412037 --> 1.408062).  Saving model ...
Validation loss decreased (1.408062 --> 1.404501).  Saving model ...
Validation loss decreased (1.404501 --> 1.401546).  Saving model ...
Validation loss decreased (1.401546 --> 1.398585).  Saving model ...
Validation loss decreased (1.398585 --> 1.395762).  Saving model ...
Validation loss decreased (1.395762 --> 1.393352).  Saving model ...
Validation loss decreased (1.393352 --> 1.391142).  Saving model ...
Validation loss decreased (1.391142 --> 1.388781).  Saving model ...
Validation loss decreased (1.388781 --> 1.386541).  Saving model ...
Validation loss decreased (1.386541 --> 1.384350).  Saving model ...
Validation loss decreased (1.384350 --> 1.382486).  Saving model ...
Validation loss decreased (1.382486 --> 1.380495).  Saving model ...
Validation loss decreased (1.380495 --> 1.378712).  Saving model ...
Validation loss decreased (1.378712 --> 1.376947).  Saving model ...
Validation loss decreased (1.376947 --> 1.375663).  Saving model ...
Validation loss decreased (1.375663 --> 1.374108).  Saving model ...
Validation loss decreased (1.374108 --> 1.372590).  Saving model ...
Validation loss decreased (1.372590 --> 1.371131).  Saving model ...
Validation loss decreased (1.371131 --> 1.369544).  Saving model ...
Validation loss decreased (1.369544 --> 1.367946).  Saving model ...
Validation loss decreased (1.367946 --> 1.366375).  Saving model ...
Validation loss decreased (1.366375 --> 1.364737).  Saving model ...
Validation loss decreased (1.364737 --> 1.363093).  Saving model ...
Validation loss decreased (1.363093 --> 1.361657).  Saving model ...
Validation loss decreased (1.361657 --> 1.360022).  Saving model ...
Validation loss decreased (1.360022 --> 1.358769).  Saving model ...
Validation loss decreased (1.358769 --> 1.357044).  Saving model ...
Validation loss decreased (1.357044 --> 1.355388).  Saving model ...
Validation loss decreased (1.355388 --> 1.354198).  Saving model ...
Validation loss decreased (1.354198 --> 1.352676).  Saving model ...
Validation loss decreased (1.352676 --> 1.351215).  Saving model ...
Validation loss decreased (1.351215 --> 1.349680).  Saving model ...
Validation loss decreased (1.349680 --> 1.348444).  Saving model ...
Validation loss decreased (1.348444 --> 1.347044).  Saving model ...
Validation loss decreased (1.347044 --> 1.345701).  Saving model ...
Validation loss decreased (1.345701 --> 1.344474).  Saving model ...
Validation loss decreased (1.344474 --> 1.342669).  Saving model ...
Validation loss decreased (1.342669 --> 1.341287).  Saving model ...
Validation loss decreased (1.341287 --> 1.339736).  Saving model ...
Validation loss decreased (1.339736 --> 1.338133).  Saving model ...
Validation loss decreased (1.338133 --> 1.336448).  Saving model ...
Validation loss decreased (1.336448 --> 1.334715).  Saving model ...
Validation loss decreased (1.334715 --> 1.333326).  Saving model ...
Validation loss decreased (1.333326 --> 1.331758).  Saving model ...
Validation loss decreased (1.331758 --> 1.329801).  Saving model ...
Validation loss decreased (1.329801 --> 1.328138).  Saving model ...
Validation loss decreased (1.328138 --> 1.326497).  Saving model ...
Validation loss decreased (1.326497 --> 1.324466).  Saving model ...
Validation loss decreased (1.324466 --> 1.322660).  Saving model ...
Validation loss decreased (1.322660 --> 1.320412).  Saving model ...
Validation loss decreased (1.320412 --> 1.318268).  Saving model ...
Validation loss decreased (1.318268 --> 1.316353).  Saving model ...
Validation loss decreased (1.316353 --> 1.314107).  Saving model ...
Validation loss decreased (1.314107 --> 1.311812).  Saving model ...
Validation loss decreased (1.311812 --> 1.309532).  Saving model ...
Validation loss decreased (1.309532 --> 1.307462).  Saving model ...
Validation loss decreased (1.307462 --> 1.305047).  Saving model ...
Validation loss decreased (1.305047 --> 1.302807).  Saving model ...
Validation loss decreased (1.302807 --> 1.299759).  Saving model ...
Validation loss decreased (1.299759 --> 1.295775).  Saving model ...
Validation loss decreased (1.295775 --> 1.292767).  Saving model ...
Validation loss decreased (1.292767 --> 1.289548).  Saving model ...
Validation loss decreased (1.289548 --> 1.286741).  Saving model ...
Validation loss decreased (1.286741 --> 1.284938).  Saving model ...
Validation loss decreased (1.284938 --> 1.282436).  Saving model ...
Validation loss decreased (1.282436 --> 1.280023).  Saving model ...
Validation loss decreased (1.280023 --> 1.277117).  Saving model ...
Validation loss decreased (1.277117 --> 1.274192).  Saving model ...
Validation loss decreased (1.274192 --> 1.270398).  Saving model ...
Validation loss decreased (1.270398 --> 1.267133).  Saving model ...
Validation loss decreased (1.267133 --> 1.263687).  Saving model ...
Validation loss decreased (1.263687 --> 1.260642).  Saving model ...
Validation loss decreased (1.260642 --> 1.257124).  Saving model ...
Validation loss decreased (1.257124 --> 1.253693).  Saving model ...
Validation loss decreased (1.253693 --> 1.249961).  Saving model ...
Validation loss decreased (1.249961 --> 1.246402).  Saving model ...
Validation loss decreased (1.246402 --> 1.243010).  Saving model ...
Validation loss decreased (1.243010 --> 1.238794).  Saving model ...
Validation loss decreased (1.238794 --> 1.235019).  Saving model ...
Validation loss decreased (1.235019 --> 1.231789).  Saving model ...
Validation loss decreased (1.231789 --> 1.228075).  Saving model ...
Validation loss decreased (1.228075 --> 1.224650).  Saving model ...
Validation loss decreased (1.224650 --> 1.222262).  Saving model ...
Validation loss decreased (1.222262 --> 1.219517).  Saving model ...
Validation loss decreased (1.219517 --> 1.216493).  Saving model ...
Validation loss decreased (1.216493 --> 1.212583).  Saving model ...
Validation loss decreased (1.212583 --> 1.209033).  Saving model ...
Validation loss decreased (1.209033 --> 1.204273).  Saving model ...
Validation loss decreased (1.204273 --> 1.200210).  Saving model ...
Validation loss decreased (1.200210 --> 1.197035).  Saving model ...
Validation loss decreased (1.197035 --> 1.193569).  Saving model ...
Validation loss decreased (1.193569 --> 1.189728).  Saving model ...
Validation loss decreased (1.189728 --> 1.186065).  Saving model ...
Validation loss decreased (1.186065 --> 1.183466).  Saving model ...
Validation loss decreased (1.183466 --> 1.180261).  Saving model ...
Validation loss decreased (1.180261 --> 1.178673).  Saving model ...
Validation loss decreased (1.178673 --> 1.176081).  Saving model ...
Validation loss decreased (1.176081 --> 1.172439).  Saving model ...
Validation loss decreased (1.172439 --> 1.169139).  Saving model ...
Validation loss decreased (1.169139 --> 1.166004).  Saving model ...
Validation loss decreased (1.166004 --> 1.162896).  Saving model ...
Validation loss decreased (1.162896 --> 1.160627).  Saving model ...
Validation loss decreased (1.160627 --> 1.157436).  Saving model ...
Validation loss decreased (1.157436 --> 1.153810).  Saving model ...
Validation loss decreased (1.153810 --> 1.150828).  Saving model ...
Validation loss decreased (1.150828 --> 1.148415).  Saving model ...
Validation loss decreased (1.148415 --> 1.145198).  Saving model ...
Validation loss decreased (1.145198 --> 1.141866).  Saving model ...
Validation loss decreased (1.141866 --> 1.138724).  Saving model ...
Validation loss decreased (1.138724 --> 1.134923).  Saving model ...
Validation loss decreased (1.134923 --> 1.132299).  Saving model ...
Validation loss decreased (1.132299 --> 1.129189).  Saving model ...
Validation loss decreased (1.129189 --> 1.126051).  Saving model ...
Validation loss decreased (1.126051 --> 1.122854).  Saving model ...
Validation loss decreased (1.122854 --> 1.119680).  Saving model ...
Validation loss decreased (1.119680 --> 1.116216).  Saving model ...
Validation loss decreased (1.116216 --> 1.113629).  Saving model ...
Validation loss decreased (1.113629 --> 1.110928).  Saving model ...
Validation loss decreased (1.110928 --> 1.108486).  Saving model ...
Validation loss decreased (1.108486 --> 1.105409).  Saving model ...
Validation loss decreased (1.105409 --> 1.102940).  Saving model ...
Validation loss decreased (1.102940 --> 1.099979).  Saving model ...
Validation loss decreased (1.099979 --> 1.097481).  Saving model ...
Validation loss decreased (1.097481 --> 1.095842).  Saving model ...
Validation loss decreased (1.095842 --> 1.092638).  Saving model ...
Validation loss decreased (1.092638 --> 1.090910).  Saving model ...
Validation loss decreased (1.090910 --> 1.088417).  Saving model ...
Validation loss decreased (1.088417 --> 1.085830).  Saving model ...
Validation loss decreased (1.085830 --> 1.083177).  Saving model ...
Validation loss decreased (1.083177 --> 1.080592).  Saving model ...
Validation loss decreased (1.080592 --> 1.078534).  Saving model ...
Validation loss decreased (1.078534 --> 1.074787).  Saving model ...
Validation loss decreased (1.074787 --> 1.072181).  Saving model ...
Validation loss decreased (1.072181 --> 1.070676).  Saving model ...
Validation loss decreased (1.070676 --> 1.068006).  Saving model ...
Validation loss decreased (1.068006 --> 1.064328).  Saving model ...
Validation loss decreased (1.064328 --> 1.062362).  Saving model ...
Validation loss decreased (1.062362 --> 1.060532).  Saving model ...
Validation loss decreased (1.060532 --> 1.058324).  Saving model ...
Validation loss decreased (1.058324 --> 1.056647).  Saving model ...
Validation loss decreased (1.056647 --> 1.054161).  Saving model ...
Validation loss decreased (1.054161 --> 1.051530).  Saving model ...
Validation loss decreased (1.051530 --> 1.050089).  Saving model ...
Validation loss decreased (1.050089 --> 1.046843).  Saving model ...
Validation loss decreased (1.046843 --> 1.044793).  Saving model ...
Validation loss decreased (1.044793 --> 1.044721).  Saving model ...
Validation loss decreased (1.044721 --> 1.042721).  Saving model ...
Validation loss decreased (1.042721 --> 1.040155).  Saving model ...
Validation loss decreased (1.040155 --> 1.037794).  Saving model ...
Validation loss decreased (1.037794 --> 1.035552).  Saving model ...
Validation loss decreased (1.035552 --> 1.032193).  Saving model ...
Validation loss decreased (1.032193 --> 1.029971).  Saving model ...
Validation loss decreased (1.029971 --> 1.025580).  Saving model ...
Validation loss decreased (1.025580 --> 1.023744).  Saving model ...
Validation loss decreased (1.023744 --> 1.021561).  Saving model ...
Validation loss decreased (1.021561 --> 1.020291).  Saving model ...
Validation loss decreased (1.020291 --> 1.018208).  Saving model ...
Validation loss decreased (1.018208 --> 1.015932).  Saving model ...
Validation loss decreased (1.015932 --> 1.013950).  Saving model ...
Validation loss decreased (1.013950 --> 1.011786).  Saving model ...
Validation loss decreased (1.011786 --> 1.010250).  Saving model ...
Validation loss decreased (1.010250 --> 1.008211).  Saving model ...
Validation loss decreased (1.008211 --> 1.006067).  Saving model ...
Validation loss decreased (1.006067 --> 1.003740).  Saving model ...
Validation loss decreased (1.003740 --> 1.001838).  Saving model ...
Validation loss decreased (1.001838 --> 1.001704).  Saving model ...
Validation loss decreased (1.001704 --> 0.998947).  Saving model ...
Validation loss decreased (0.998947 --> 0.997380).  Saving model ...
Validation loss decreased (0.997380 --> 0.995626).  Saving model ...
Validation loss decreased (0.995626 --> 0.994449).  Saving model ...
Validation loss decreased (0.994449 --> 0.993044).  Saving model ...
Validation loss decreased (0.993044 --> 0.992897).  Saving model ...
Validation loss decreased (0.992897 --> 0.991308).  Saving model ...
Validation loss decreased (0.991308 --> 0.989405).  Saving model ...
Validation loss decreased (0.989405 --> 0.987931).  Saving model ...
Validation loss decreased (0.987931 --> 0.985689).  Saving model ...
Validation loss decreased (0.985689 --> 0.984065).  Saving model ...
Validation loss decreased (0.984065 --> 0.983374).  Saving model ...
Validation loss decreased (0.983374 --> 0.979971).  Saving model ...
Validation loss decreased (0.979971 --> 0.977773).  Saving model ...
EarlyStopping counter: 1 out of 5.0
Validation loss decreased (0.977773 --> 0.974792).  Saving model ...
Validation loss decreased (0.974792 --> 0.972074).  Saving model ...
Validation loss decreased (0.972074 --> 0.969381).  Saving model ...
Validation loss decreased (0.969381 --> 0.968097).  Saving model ...
EarlyStopping counter: 1 out of 5.0
EarlyStopping counter: 2 out of 5.0
Validation loss decreased (0.968097 --> 0.967146).  Saving model ...
Validation loss decreased (0.967146 --> 0.966044).  Saving model ...
Validation loss decreased (0.966044 --> 0.963377).  Saving model ...
Validation loss decreased (0.963377 --> 0.960667).  Saving model ...
Validation loss decreased (0.960667 --> 0.957809).  Saving model ...
Validation loss decreased (0.957809 --> 0.956972).  Saving model ...
Validation loss decreased (0.956972 --> 0.954610).  Saving model ...
Validation loss decreased (0.954610 --> 0.953080).  Saving model ...
Validation loss decreased (0.953080 --> 0.952413).  Saving model ...
EarlyStopping counter: 1 out of 5.0
EarlyStopping counter: 2 out of 5.0
Validation loss decreased (0.952413 --> 0.951279).  Saving model ...
Validation loss decreased (0.951279 --> 0.948040).  Saving model ...
Validation loss decreased (0.948040 --> 0.945858).  Saving model ...
Validation loss decreased (0.945858 --> 0.943516).  Saving model ...
Validation loss decreased (0.943516 --> 0.943138).  Saving model ...
Validation loss decreased (0.943138 --> 0.941249).  Saving model ...
Validation loss decreased (0.941249 --> 0.940902).  Saving model ...
EarlyStopping counter: 1 out of 5.0
Validation loss decreased (0.940902 --> 0.937296).  Saving model ...
Validation loss decreased (0.937296 --> 0.936463).  Saving model ...
Validation loss decreased (0.936463 --> 0.935938).  Saving model ...
Validation loss decreased (0.935938 --> 0.934539).  Saving model ...
EarlyStopping counter: 1 out of 5.0
Validation loss decreased (0.934539 --> 0.933709).  Saving model ...
Validation loss decreased (0.933709 --> 0.932749).  Saving model ...
Validation loss decreased (0.932749 --> 0.931560).  Saving model ...
Validation loss decreased (0.931560 --> 0.930235).  Saving model ...
Validation loss decreased (0.930235 --> 0.929074).  Saving model ...
Validation loss decreased (0.929074 --> 0.927714).  Saving model ...
Validation loss decreased (0.927714 --> 0.926186).  Saving model ...
EarlyStopping counter: 1 out of 5.0
Validation loss decreased (0.926186 --> 0.926176).  Saving model ...
Validation loss decreased (0.926176 --> 0.925434).  Saving model ...
Validation loss decreased (0.925434 --> 0.923575).  Saving model ...
Validation loss decreased (0.923575 --> 0.921996).  Saving model ...
Validation loss decreased (0.921996 --> 0.921205).  Saving model ...
Validation loss decreased (0.921205 --> 0.920313).  Saving model ...
Validation loss decreased (0.920313 --> 0.918799).  Saving model ...
EarlyStopping counter: 1 out of 5.0
EarlyStopping counter: 2 out of 5.0
Validation loss decreased (0.918799 --> 0.918045).  Saving model ...
Validation loss decreased (0.918045 --> 0.916689).  Saving model ...
Validation loss decreased (0.916689 --> 0.916536).  Saving model ...
EarlyStopping counter: 1 out of 5.0
Validation loss decreased (0.916536 --> 0.916412).  Saving model ...
EarlyStopping counter: 1 out of 5.0
Validation loss decreased (0.916412 --> 0.915726).  Saving model ...
Validation loss decreased (0.915726 --> 0.913183).  Saving model ...
EarlyStopping counter: 1 out of 5.0
Validation loss decreased (0.913183 --> 0.912172).  Saving model ...
Validation loss decreased (0.912172 --> 0.911386).  Saving model ...
Validation loss decreased (0.911386 --> 0.909998).  Saving model ...
Validation loss decreased (0.909998 --> 0.909711).  Saving model ...
Validation loss decreased (0.909711 --> 0.909260).  Saving model ...
Validation loss decreased (0.909260 --> 0.908212).  Saving model ...
Validation loss decreased (0.908212 --> 0.907430).  Saving model ...
Validation loss decreased (0.907430 --> 0.906770).  Saving model ...
EarlyStopping counter: 1 out of 5.0
Validation loss decreased (0.906770 --> 0.906337).  Saving model ...
Validation loss decreased (0.906337 --> 0.905857).  Saving model ...
Validation loss decreased (0.905857 --> 0.905773).  Saving model ...
Validation loss decreased (0.905773 --> 0.905364).  Saving model ...
Validation loss decreased (0.905364 --> 0.904779).  Saving model ...
EarlyStopping counter: 1 out of 5.0
Validation loss decreased (0.904779 --> 0.904266).  Saving model ...
Validation loss decreased (0.904266 --> 0.903501).  Saving model ...
Validation loss decreased (0.903501 --> 0.902979).  Saving model ...
Validation loss decreased (0.902979 --> 0.901774).  Saving model ...
Validation loss decreased (0.901774 --> 0.900982).  Saving model ...
Validation loss decreased (0.900982 --> 0.900920).  Saving model ...
EarlyStopping counter: 1 out of 5.0
EarlyStopping counter: 2 out of 5.0
EarlyStopping counter: 3 out of 5.0
Validation loss decreased (0.900920 --> 0.900118).  Saving model ...
EarlyStopping counter: 1 out of 5.0
Validation loss decreased (0.900118 --> 0.900016).  Saving model ...
Validation loss decreased (0.900016 --> 0.899554).  Saving model ...
Validation loss decreased (0.899554 --> 0.898588).  Saving model ...
EarlyStopping counter: 1 out of 5.0
EarlyStopping counter: 2 out of 5.0
Validation loss decreased (0.898588 --> 0.897539).  Saving model ...
EarlyStopping counter: 1 out of 5.0
EarlyStopping counter: 2 out of 5.0
EarlyStopping counter: 3 out of 5.0
EarlyStopping counter: 4 out of 5.0
EarlyStopping counter: 5 out of 5.0
/localscratch/yinan.27794531.0/env/lib/python3.7/site-packages/torch/nn/functional.py:1794: UserWarning: nn.functional.tanh is deprecated. Use torch.tanh instead.
  warnings.warn("nn.functional.tanh is deprecated. Use torch.tanh instead.")
wandb: Waiting for W&B process to finish, PID 155930... (success).
wandb: - 0.00MB of 0.00MB uploaded (0.00MB deduped)wandb: \ 0.00MB of 0.00MB uploaded (0.00MB deduped)wandb: | 0.00MB of 0.00MB uploaded (0.00MB deduped)wandb: / 0.00MB of 0.00MB uploaded (0.00MB deduped)wandb: - 0.00MB of 0.00MB uploaded (0.00MB deduped)wandb: \ 0.00MB of 0.00MB uploaded (0.00MB deduped)wandb: | 0.00MB of 0.00MB uploaded (0.00MB deduped)wandb: / 0.00MB of 0.00MB uploaded (0.00MB deduped)wandb: - 0.00MB of 0.00MB uploaded (0.00MB deduped)wandb: \ 0.00MB of 0.00MB uploaded (0.00MB deduped)wandb: | 0.00MB of 0.00MB uploaded (0.00MB deduped)wandb: / 0.00MB of 0.00MB uploaded (0.00MB deduped)wandb: - 0.00MB of 0.00MB uploaded (0.00MB deduped)wandb: \ 0.00MB of 0.00MB uploaded (0.00MB deduped)wandb:                                                                                
wandb: Run history:
wandb:     e_F1 ▁▁▂▃▃▃▄▄▄▄▅▅▆▇▆▇▇▇▇▇▇██▇████████████████
wandb:   e_loss ███▇▇▇▇▇▇▆▆▆▅▅▅▅▄▄▄▃▃▃▃▃▂▂▂▂▂▂▁▁▁▁▁▁▁▁▁▁
wandb:     t_F1 ▁▁▁▁▂▂▂▃▃▃▃▄▄▄▄▄▅▅▅▅▆▆▆▆▆▆▆▆▇▇▇▇▇▇▇█████
wandb:   t_loss ████▇▇▇▇▇▇▇▆▆▆▆▆▆▅▅▅▅▄▄▄▄▄▄▃▃▃▂▃▂▂▂▂▂▂▁▁
wandb: 
wandb: Run summary:
wandb:     e_F1 58.31629
wandb:   e_loss 0.8983
wandb:     t_F1 76.9099
wandb:   t_loss 0.68497
wandb: 
wandb: Synced 4 W&B file(s), 0 media file(s), 0 artifact file(s) and 0 other file(s)
wandb: Synced lively-mountain-1: https://wandb.ai/yinanazhou/xl_512_bs_8_lr_1e07_es_5_lc_False_nr_False_stem_False_lemma_False_repeat_1_fold_2/runs/211n3hvj
wandb: Find logs at: ./wandb/run-20220225_131643-211n3hvj/logs/debug.log
wandb: 

wandb: wandb version 0.12.10 is available!  To upgrade, please run:
wandb:  $ pip install wandb --upgrade
2022-02-25 17:41:58.764334: I tensorflow/stream_executor/platform/default/dso_loader.cc:48] Successfully opened dynamic library libcudart.so.10.1
wandb: Tracking run with wandb version 0.12.5
wandb: Syncing run effortless-bird-1
wandb: ⭐️ View project at https://wandb.ai/yinanazhou/xl_512_bs_8_lr_1e07_es_5_lc_False_nr_False_stem_False_lemma_False_repeat_2_fold_1
wandb: 🚀 View run at https://wandb.ai/yinanazhou/xl_512_bs_8_lr_1e07_es_5_lc_False_nr_False_stem_False_lemma_False_repeat_2_fold_1/runs/ou467rzb
wandb: Run data is saved locally in /project/6002780/yinan/Thesis_MER_Lyrics/lyric-emotion/wandb/run-20220225_174155-ou467rzb
wandb: Run `wandb offline` to turn off syncing.
slurmstepd: error: *** JOB 27794531 ON cdr2638 CANCELLED AT 2022-02-25T20:35:25 DUE TO TIME LIMIT ***
