Unloading StdEnv/2020

Due to MODULEPATH changes, the following have been reloaded:
  1) mii/1.1.1


The following have been reloaded with a version change:
  1) python/3.8.2 => python/3.7.4

Using base prefix '/cvmfs/soft.computecanada.ca/easybuild/software/2017/Core/python/3.7.4'
New python executable in /localscratch/yinan.28698556.0/env/bin/python
Installing setuptools, pip, wheel...
done.
Ignoring pip: markers 'python_version < "3"' don't match your environment
Looking in links: /cvmfs/soft.computecanada.ca/custom/python/wheelhouse/nix/avx2, /cvmfs/soft.computecanada.ca/custom/python/wheelhouse/nix/generic, /cvmfs/soft.computecanada.ca/custom/python/wheelhouse/generic
Collecting pip
Installing collected packages: pip
  Found existing installation: pip 19.1.1
    Uninstalling pip-19.1.1:
      Successfully uninstalled pip-19.1.1
Successfully installed pip-21.2.3+computecanada
Looking in links: /cvmfs/soft.computecanada.ca/custom/python/wheelhouse/nix/avx2, /cvmfs/soft.computecanada.ca/custom/python/wheelhouse/nix/generic, /cvmfs/soft.computecanada.ca/custom/python/wheelhouse/generic
Processing /cvmfs/soft.computecanada.ca/custom/python/wheelhouse/generic/keras-2.8.0+computecanada-py2.py3-none-any.whl
Processing /cvmfs/soft.computecanada.ca/custom/python/wheelhouse/generic/Keras_Preprocessing-1.1.2+computecanada-py3-none-any.whl
Requirement already satisfied: matplotlib in /cvmfs/soft.computecanada.ca/easybuild/software/2017/Core/scipy-stack/2019a/lib/python3.7/site-packages (from -r requirements.txt (line 3)) (3.0.2)
Processing /cvmfs/soft.computecanada.ca/custom/python/wheelhouse/generic/nltk-3.6.5+computecanada-py3-none-any.whl
Processing /cvmfs/soft.computecanada.ca/custom/python/wheelhouse/generic/scikit_learn-0.22.1+computecanada-cp37-cp37m-linux_x86_64.whl
Processing /cvmfs/soft.computecanada.ca/custom/python/wheelhouse/generic/tensorboard-2.3.0+computecanada-py3-none-any.whl
Processing /cvmfs/soft.computecanada.ca/custom/python/wheelhouse/generic/tensorboard_plugin_wit-1.7.0+computecanada-py3-none-any.whl
Processing /cvmfs/soft.computecanada.ca/custom/python/wheelhouse/generic/tensorflow_gpu-2.3.0+computecanada-cp37-cp37m-linux_x86_64.whl
Processing /cvmfs/soft.computecanada.ca/custom/python/wheelhouse/generic/tensorflow_estimator-2.3.0+computecanada-py2.py3-none-any.whl
Processing /cvmfs/soft.computecanada.ca/custom/python/wheelhouse/generic/tokenizers-0.5.2+computecanada-cp37-cp37m-linux_x86_64.whl
Processing /cvmfs/soft.computecanada.ca/custom/python/wheelhouse/nix/avx2/torch-1.4.0+computecanada-cp37-cp37m-linux_x86_64.whl
Processing /cvmfs/soft.computecanada.ca/custom/python/wheelhouse/generic/torchtext-0.6.0+computecanada-py3-none-any.whl
Processing /cvmfs/soft.computecanada.ca/custom/python/wheelhouse/generic/torchvision-0.8.2+computecanada-cp37-cp37m-linux_x86_64.whl
Processing /cvmfs/soft.computecanada.ca/custom/python/wheelhouse/generic/transformers-2.5.1+computecanada-py3-none-any.whl
Processing /cvmfs/soft.computecanada.ca/custom/python/wheelhouse/generic/urllib3-1.26.7+computecanada-py2.py3-none-any.whl
Processing /cvmfs/soft.computecanada.ca/custom/python/wheelhouse/generic/tqdm-4.63.0+computecanada-py2.py3-none-any.whl
Processing /cvmfs/soft.computecanada.ca/custom/python/wheelhouse/generic/click-8.0.3+computecanada-py3-none-any.whl
Processing /cvmfs/soft.computecanada.ca/custom/python/wheelhouse/generic/joblib-1.1.0+computecanada-py2.py3-none-any.whl
ERROR: Could not find a version that satisfies the requirement regex>=2021.8.3 (from nltk) (from versions: 2018.1.10+computecanada, 2019.11.1+computecanada, 2020.11.13+computecanada)
ERROR: No matching distribution found for regex>=2021.8.3
Looking in links: /cvmfs/soft.computecanada.ca/custom/python/wheelhouse/nix/avx2, /cvmfs/soft.computecanada.ca/custom/python/wheelhouse/nix/generic, /cvmfs/soft.computecanada.ca/custom/python/wheelhouse/generic
ERROR: Could not find a version that satisfies the requirement numpy==1.20.0+computacanada (from versions: 1.15.0+computecanada, 1.15.2+computecanada, 1.15.4+computecanada, 1.16.0+computecanada, 1.16.2+computecanada, 1.16.3+computecanada, 1.17.4+computecanada, 1.18.1+computecanada, 1.18.4+computecanada, 1.19.1+computecanada, 1.19.2+computecanada, 1.20.2+computecanada)
ERROR: No matching distribution found for numpy==1.20.0+computacanada
Looking in links: /cvmfs/soft.computecanada.ca/custom/python/wheelhouse/nix/avx2, /cvmfs/soft.computecanada.ca/custom/python/wheelhouse/nix/generic, /cvmfs/soft.computecanada.ca/custom/python/wheelhouse/generic
Processing /cvmfs/soft.computecanada.ca/custom/python/wheelhouse/generic/wandb-0.12.5+computecanada-py2.py3-none-any.whl
Requirement already satisfied: requests<3,>=2.0.0 in /cvmfs/soft.computecanada.ca/easybuild/software/2017/Core/scipy-stack/2019a/lib/python3.7/site-packages (from wandb) (2.21.0)
Processing /cvmfs/soft.computecanada.ca/custom/python/wheelhouse/generic/click-8.0.3+computecanada-py3-none-any.whl
Processing /cvmfs/soft.computecanada.ca/custom/python/wheelhouse/generic/six-1.16.0+computecanada-py2.py3-none-any.whl
Processing /cvmfs/soft.computecanada.ca/custom/python/wheelhouse/generic/subprocess32-3.5.4+computecanada-py3-none-any.whl
Processing /cvmfs/soft.computecanada.ca/custom/python/wheelhouse/generic/docker_pycreds-0.4.0+computecanada-py2.py3-none-any.whl
Processing /cvmfs/soft.computecanada.ca/custom/python/wheelhouse/generic/shortuuid-1.0.1+computecanada-py3-none-any.whl
Processing /cvmfs/soft.computecanada.ca/custom/python/wheelhouse/generic/yaspin-2.1.0+computecanada-py3-none-any.whl
Processing /cvmfs/soft.computecanada.ca/custom/python/wheelhouse/generic/configparser-5.0.2+computecanada-py3-none-any.whl
Processing /cvmfs/soft.computecanada.ca/custom/python/wheelhouse/generic/pathtools-0.1.2+computecanada-py3-none-any.whl
Processing /cvmfs/soft.computecanada.ca/custom/python/wheelhouse/generic/protobuf-3.19.4+computecanada-py2.py3-none-any.whl
Processing /cvmfs/soft.computecanada.ca/custom/python/wheelhouse/generic/psutil-5.7.3+computecanada-cp37-cp37m-linux_x86_64.whl
Processing /cvmfs/soft.computecanada.ca/custom/python/wheelhouse/generic/promise-2.3+computecanada-py3-none-any.whl
Processing /cvmfs/soft.computecanada.ca/custom/python/wheelhouse/generic/PyYAML-5.3.1+computecanada-cp37-cp37m-linux_x86_64.whl
Processing /cvmfs/soft.computecanada.ca/custom/python/wheelhouse/generic/GitPython-3.1.24+computecanada-py3-none-any.whl
Requirement already satisfied: python-dateutil>=2.6.1 in /cvmfs/soft.computecanada.ca/easybuild/software/2017/Core/scipy-stack/2019a/lib/python3.7/site-packages (from wandb) (2.7.5)
Processing /cvmfs/soft.computecanada.ca/custom/python/wheelhouse/generic/sentry_sdk-1.5.0+computecanada-py2.py3-none-any.whl
Requirement already satisfied: importlib-metadata in /cvmfs/soft.computecanada.ca/easybuild/software/2017/Core/scipy-stack/2019a/lib/python3.7/site-packages (from Click!=8.0.0,>=7.0->wandb) (0.8)
Processing /cvmfs/soft.computecanada.ca/custom/python/wheelhouse/generic/gitdb-4.0.9+computecanada-py3-none-any.whl
Processing /cvmfs/soft.computecanada.ca/custom/python/wheelhouse/generic/typing_extensions-4.0.1+computecanada-py3-none-any.whl
Processing /cvmfs/soft.computecanada.ca/custom/python/wheelhouse/generic/smmap-5.0.0+computecanada-py3-none-any.whl
Requirement already satisfied: urllib3<1.25,>=1.21.1 in /cvmfs/soft.computecanada.ca/easybuild/software/2017/Core/scipy-stack/2019a/lib/python3.7/site-packages (from requests<3,>=2.0.0->wandb) (1.24.1)
Requirement already satisfied: certifi>=2017.4.17 in /cvmfs/soft.computecanada.ca/easybuild/software/2017/Core/scipy-stack/2019a/lib/python3.7/site-packages (from requests<3,>=2.0.0->wandb) (2018.11.29)
Requirement already satisfied: idna<2.9,>=2.5 in /cvmfs/soft.computecanada.ca/easybuild/software/2017/Core/scipy-stack/2019a/lib/python3.7/site-packages (from requests<3,>=2.0.0->wandb) (2.8)
Requirement already satisfied: chardet<3.1.0,>=3.0.2 in /cvmfs/soft.computecanada.ca/easybuild/software/2017/Core/scipy-stack/2019a/lib/python3.7/site-packages (from requests<3,>=2.0.0->wandb) (3.0.4)
Processing /cvmfs/soft.computecanada.ca/custom/python/wheelhouse/generic/termcolor-1.1.0+computecanada-py3-none-any.whl
Requirement already satisfied: zipp>=0.3.2 in /cvmfs/soft.computecanada.ca/easybuild/software/2017/Core/scipy-stack/2019a/lib/python3.7/site-packages (from importlib-metadata->Click!=8.0.0,>=7.0->wandb) (0.3.3)
Installing collected packages: smmap, typing-extensions, termcolor, six, gitdb, yaspin, subprocess32, shortuuid, sentry-sdk, PyYAML, psutil, protobuf, promise, pathtools, GitPython, docker-pycreds, configparser, Click, wandb
  Attempting uninstall: six
    Found existing installation: six 1.12.0
    Not uninstalling six at /cvmfs/soft.computecanada.ca/easybuild/software/2017/Core/scipy-stack/2019a/lib/python3.7/site-packages, outside environment /localscratch/yinan.28698556.0/env
    Can't uninstall 'six'. No files were found to uninstall.
Successfully installed Click-8.0.3+computecanada GitPython-3.1.24+computecanada PyYAML-5.3.1+computecanada configparser-5.0.2+computecanada docker-pycreds-0.4.0+computecanada gitdb-4.0.9+computecanada pathtools-0.1.2+computecanada promise-2.3+computecanada protobuf-3.19.4+computecanada psutil-5.7.3+computecanada sentry-sdk-1.5.0+computecanada shortuuid-1.0.1+computecanada six-1.16.0+computecanada smmap-5.0.0+computecanada subprocess32-3.5.4+computecanada termcolor-1.1.0+computecanada typing-extensions-4.0.1+computecanada wandb-0.12.5+computecanada yaspin-2.1.0+computecanada
Looking in links: /cvmfs/soft.computecanada.ca/custom/python/wheelhouse/nix/avx2, /cvmfs/soft.computecanada.ca/custom/python/wheelhouse/nix/generic, /cvmfs/soft.computecanada.ca/custom/python/wheelhouse/generic
ERROR: Could not find a version that satisfies the requirement sagemaker (from versions: none)
ERROR: No matching distribution found for sagemaker
Looking in links: /cvmfs/soft.computecanada.ca/custom/python/wheelhouse/nix/avx2, /cvmfs/soft.computecanada.ca/custom/python/wheelhouse/nix/generic, /cvmfs/soft.computecanada.ca/custom/python/wheelhouse/generic
Processing /cvmfs/soft.computecanada.ca/custom/python/wheelhouse/generic/torch-1.9.1+computecanada-cp37-cp37m-linux_x86_64.whl
Requirement already satisfied: typing-extensions in /localscratch/yinan.28698556.0/env/lib/python3.7/site-packages (from torch) (4.0.1+computecanada)
Installing collected packages: torch
Successfully installed torch-1.9.1+computecanada
Looking in links: /cvmfs/soft.computecanada.ca/custom/python/wheelhouse/nix/avx2, /cvmfs/soft.computecanada.ca/custom/python/wheelhouse/nix/generic, /cvmfs/soft.computecanada.ca/custom/python/wheelhouse/generic
Processing /cvmfs/soft.computecanada.ca/custom/python/wheelhouse/generic/transformers-2.5.1+computecanada-py3-none-any.whl
Processing /cvmfs/soft.computecanada.ca/custom/python/wheelhouse/generic/tqdm-4.63.0+computecanada-py2.py3-none-any.whl
Processing /cvmfs/soft.computecanada.ca/custom/python/wheelhouse/generic/tokenizers-0.5.2+computecanada-cp37-cp37m-linux_x86_64.whl
Processing /cvmfs/soft.computecanada.ca/custom/python/wheelhouse/generic/boto3-1.20.52+computecanada-py3-none-any.whl
Processing /cvmfs/soft.computecanada.ca/custom/python/wheelhouse/generic/filelock-3.4.2+computecanada-py3-none-any.whl
Processing /cvmfs/soft.computecanada.ca/custom/python/wheelhouse/generic/sentencepiece-0.1.91+computecanada-cp37-cp37m-linux_x86_64.whl
Requirement already satisfied: numpy in /cvmfs/soft.computecanada.ca/easybuild/software/2017/Core/scipy-stack/2019a/lib/python3.7/site-packages (from transformers==2.5.1+computecanada) (1.16.0)
Requirement already satisfied: requests in /cvmfs/soft.computecanada.ca/easybuild/software/2017/Core/scipy-stack/2019a/lib/python3.7/site-packages (from transformers==2.5.1+computecanada) (2.21.0)
Processing /cvmfs/soft.computecanada.ca/custom/python/wheelhouse/generic/regex-2020.11.13+computecanada-cp37-cp37m-linux_x86_64.whl
Processing /cvmfs/soft.computecanada.ca/custom/python/wheelhouse/generic/sacremoses-0.0.46+computecanada-py3-none-any.whl
Processing /cvmfs/soft.computecanada.ca/custom/python/wheelhouse/generic/s3transfer-0.5.1+computecanada-py3-none-any.whl
Processing /cvmfs/soft.computecanada.ca/custom/python/wheelhouse/generic/jmespath-0.10.0+computecanada-py2.py3-none-any.whl
Processing /cvmfs/soft.computecanada.ca/custom/python/wheelhouse/generic/botocore-1.23.52+computecanada-py3-none-any.whl
Processing /cvmfs/soft.computecanada.ca/custom/python/wheelhouse/generic/urllib3-1.26.8+computecanada-py2.py3-none-any.whl
Requirement already satisfied: python-dateutil<3.0.0,>=2.1 in /cvmfs/soft.computecanada.ca/easybuild/software/2017/Core/scipy-stack/2019a/lib/python3.7/site-packages (from botocore<1.24.0,>=1.23.52->boto3->transformers==2.5.1+computecanada) (2.7.5)
Requirement already satisfied: six>=1.5 in /localscratch/yinan.28698556.0/env/lib/python3.7/site-packages (from python-dateutil<3.0.0,>=2.1->botocore<1.24.0,>=1.23.52->boto3->transformers==2.5.1+computecanada) (1.16.0+computecanada)
Processing /cvmfs/soft.computecanada.ca/custom/python/wheelhouse/generic/requests-2.27.1+computecanada-py2.py3-none-any.whl
Requirement already satisfied: certifi>=2017.4.17 in /cvmfs/soft.computecanada.ca/easybuild/software/2017/Core/scipy-stack/2019a/lib/python3.7/site-packages (from requests->transformers==2.5.1+computecanada) (2018.11.29)
Requirement already satisfied: idna<4,>=2.5 in /cvmfs/soft.computecanada.ca/easybuild/software/2017/Core/scipy-stack/2019a/lib/python3.7/site-packages (from requests->transformers==2.5.1+computecanada) (2.8)
Processing /cvmfs/soft.computecanada.ca/custom/python/wheelhouse/generic/charset_normalizer-2.0.11+computecanada-py3-none-any.whl
Processing /cvmfs/soft.computecanada.ca/custom/python/wheelhouse/generic/joblib-1.1.0+computecanada-py2.py3-none-any.whl
Requirement already satisfied: click in /localscratch/yinan.28698556.0/env/lib/python3.7/site-packages (from sacremoses->transformers==2.5.1+computecanada) (8.0.3+computecanada)
Requirement already satisfied: importlib-metadata in /cvmfs/soft.computecanada.ca/easybuild/software/2017/Core/scipy-stack/2019a/lib/python3.7/site-packages (from click->sacremoses->transformers==2.5.1+computecanada) (0.8)
Requirement already satisfied: zipp>=0.3.2 in /cvmfs/soft.computecanada.ca/easybuild/software/2017/Core/scipy-stack/2019a/lib/python3.7/site-packages (from importlib-metadata->click->sacremoses->transformers==2.5.1+computecanada) (0.3.3)
Installing collected packages: urllib3, jmespath, botocore, tqdm, s3transfer, regex, joblib, charset-normalizer, tokenizers, sentencepiece, sacremoses, requests, filelock, boto3, transformers
  Attempting uninstall: urllib3
    Found existing installation: urllib3 1.24.1
    Not uninstalling urllib3 at /cvmfs/soft.computecanada.ca/easybuild/software/2017/Core/scipy-stack/2019a/lib/python3.7/site-packages, outside environment /localscratch/yinan.28698556.0/env
    Can't uninstall 'urllib3'. No files were found to uninstall.
  Attempting uninstall: requests
    Found existing installation: requests 2.21.0
    Not uninstalling requests at /cvmfs/soft.computecanada.ca/easybuild/software/2017/Core/scipy-stack/2019a/lib/python3.7/site-packages, outside environment /localscratch/yinan.28698556.0/env
    Can't uninstall 'requests'. No files were found to uninstall.
Successfully installed boto3-1.20.52+computecanada botocore-1.23.52+computecanada charset-normalizer-2.0.11+computecanada filelock-3.4.2+computecanada jmespath-0.10.0+computecanada joblib-1.1.0+computecanada regex-2020.11.13+computecanada requests-2.27.1+computecanada s3transfer-0.5.1+computecanada sacremoses-0.0.46+computecanada sentencepiece-0.1.91+computecanada tokenizers-0.5.2+computecanada tqdm-4.63.0+computecanada transformers-2.5.1+computecanada urllib3-1.26.8+computecanada
Looking in links: /cvmfs/soft.computecanada.ca/custom/python/wheelhouse/nix/avx2, /cvmfs/soft.computecanada.ca/custom/python/wheelhouse/nix/generic, /cvmfs/soft.computecanada.ca/custom/python/wheelhouse/generic
Processing /cvmfs/soft.computecanada.ca/custom/python/wheelhouse/generic/tensorflow_gpu-2.3.0+computecanada-cp37-cp37m-linux_x86_64.whl
Requirement already satisfied: termcolor>=1.1.0 in /localscratch/yinan.28698556.0/env/lib/python3.7/site-packages (from tensorflow_gpu==2.3.0+computecanada) (1.1.0+computecanada)
Processing /cvmfs/soft.computecanada.ca/custom/python/wheelhouse/generic/absl_py-1.0.0+computecanada-py3-none-any.whl
Processing /cvmfs/soft.computecanada.ca/custom/python/wheelhouse/generic/grpcio-1.38.0+computecanada-cp37-cp37m-linux_x86_64.whl
Processing /cvmfs/soft.computecanada.ca/custom/python/wheelhouse/generic/wrapt-1.11.2+computecanada-cp37-cp37m-linux_x86_64.whl
Processing /cvmfs/soft.computecanada.ca/custom/python/wheelhouse/generic/google_pasta-0.2.0+computecanada-py3-none-any.whl
Requirement already satisfied: protobuf>=3.9.2 in /localscratch/yinan.28698556.0/env/lib/python3.7/site-packages (from tensorflow_gpu==2.3.0+computecanada) (3.19.4+computecanada)
Processing /cvmfs/soft.computecanada.ca/custom/python/wheelhouse/generic/tensorboard-2.8.0+computecanada-py3-none-any.whl
Requirement already satisfied: wheel>=0.26 in /localscratch/yinan.28698556.0/env/lib/python3.7/site-packages (from tensorflow_gpu==2.3.0+computecanada) (0.33.4)
Processing /cvmfs/soft.computecanada.ca/custom/python/wheelhouse/generic/Keras_Preprocessing-1.1.2+computecanada-py3-none-any.whl
Processing /cvmfs/soft.computecanada.ca/custom/python/wheelhouse/generic/opt_einsum-3.3.0+computecanada-py3-none-any.whl
Processing /cvmfs/soft.computecanada.ca/custom/python/wheelhouse/generic/tensorflow_estimator-2.3.0+computecanada-py2.py3-none-any.whl
Processing /cvmfs/soft.computecanada.ca/custom/python/wheelhouse/nix/generic/scipy-1.4.1+computecanada-cp37-cp37m-linux_x86_64.whl
Requirement already satisfied: six>=1.12.0 in /localscratch/yinan.28698556.0/env/lib/python3.7/site-packages (from tensorflow_gpu==2.3.0+computecanada) (1.16.0+computecanada)
Processing /cvmfs/soft.computecanada.ca/custom/python/wheelhouse/nix/avx2/h5py-2.10.0+computecanada-cp37-cp37m-linux_x86_64.whl
Requirement already satisfied: numpy<1.19.0,>=1.16.0 in /cvmfs/soft.computecanada.ca/easybuild/software/2017/Core/scipy-stack/2019a/lib/python3.7/site-packages (from tensorflow_gpu==2.3.0+computecanada) (1.16.0)
Processing /cvmfs/soft.computecanada.ca/custom/python/wheelhouse/generic/gast-0.3.3+computecanada-py3-none-any.whl
Processing /cvmfs/soft.computecanada.ca/custom/python/wheelhouse/generic/astunparse-1.6.3+computecanada-py2.py3-none-any.whl
Processing /cvmfs/soft.computecanada.ca/custom/python/wheelhouse/generic/google_auth-2.3.3+computecanada-py2.py3-none-any.whl
Processing /cvmfs/soft.computecanada.ca/custom/python/wheelhouse/generic/google_auth_oauthlib-0.4.6+computecanada-py2.py3-none-any.whl
Requirement already satisfied: requests<3,>=2.21.0 in /localscratch/yinan.28698556.0/env/lib/python3.7/site-packages (from tensorboard<3,>=2.3.0->tensorflow_gpu==2.3.0+computecanada) (2.27.1+computecanada)
Processing /cvmfs/soft.computecanada.ca/custom/python/wheelhouse/generic/tensorboard_plugin_wit-1.8.0+computecanada-py3-none-any.whl
Processing /cvmfs/soft.computecanada.ca/custom/python/wheelhouse/generic/Markdown-3.3.6+computecanada-py3-none-any.whl
Processing /cvmfs/soft.computecanada.ca/custom/python/wheelhouse/generic/Werkzeug-2.0.3+computecanada-py3-none-any.whl
Processing /cvmfs/soft.computecanada.ca/custom/python/wheelhouse/generic/tensorboard_data_server-0.6.1+computecanada-py3-none-linux_x86_64.whl
Requirement already satisfied: setuptools>=41.0.0 in /localscratch/yinan.28698556.0/env/lib/python3.7/site-packages (from tensorboard<3,>=2.3.0->tensorflow_gpu==2.3.0+computecanada) (41.0.1)
Processing /cvmfs/soft.computecanada.ca/custom/python/wheelhouse/generic/rsa-4.8+computecanada-py3-none-any.whl
Processing /cvmfs/soft.computecanada.ca/custom/python/wheelhouse/generic/cachetools-4.2.4+computecanada-py3-none-any.whl
Processing /cvmfs/soft.computecanada.ca/custom/python/wheelhouse/generic/pyasn1_modules-0.2.8+computecanada-py2.py3-none-any.whl
Processing /cvmfs/soft.computecanada.ca/custom/python/wheelhouse/generic/requests_oauthlib-1.3.0+computecanada-py2.py3-none-any.whl
Processing /cvmfs/soft.computecanada.ca/custom/python/wheelhouse/generic/importlib_metadata-4.10.1+computecanada-py3-none-any.whl
Processing /cvmfs/soft.computecanada.ca/custom/python/wheelhouse/generic/zipp-3.7.0+computecanada-py3-none-any.whl
Requirement already satisfied: typing-extensions>=3.6.4 in /localscratch/yinan.28698556.0/env/lib/python3.7/site-packages (from importlib-metadata>=4.4->markdown>=2.6.8->tensorboard<3,>=2.3.0->tensorflow_gpu==2.3.0+computecanada) (4.0.1+computecanada)
Processing /cvmfs/soft.computecanada.ca/custom/python/wheelhouse/generic/pyasn1-0.4.8+computecanada-py2.py3-none-any.whl
Requirement already satisfied: urllib3<1.27,>=1.21.1 in /localscratch/yinan.28698556.0/env/lib/python3.7/site-packages (from requests<3,>=2.21.0->tensorboard<3,>=2.3.0->tensorflow_gpu==2.3.0+computecanada) (1.26.8+computecanada)
Requirement already satisfied: certifi>=2017.4.17 in /cvmfs/soft.computecanada.ca/easybuild/software/2017/Core/scipy-stack/2019a/lib/python3.7/site-packages (from requests<3,>=2.21.0->tensorboard<3,>=2.3.0->tensorflow_gpu==2.3.0+computecanada) (2018.11.29)
Requirement already satisfied: charset-normalizer~=2.0.0 in /localscratch/yinan.28698556.0/env/lib/python3.7/site-packages (from requests<3,>=2.21.0->tensorboard<3,>=2.3.0->tensorflow_gpu==2.3.0+computecanada) (2.0.11+computecanada)
Requirement already satisfied: idna<4,>=2.5 in /cvmfs/soft.computecanada.ca/easybuild/software/2017/Core/scipy-stack/2019a/lib/python3.7/site-packages (from requests<3,>=2.21.0->tensorboard<3,>=2.3.0->tensorflow_gpu==2.3.0+computecanada) (2.8)
Processing /cvmfs/soft.computecanada.ca/custom/python/wheelhouse/generic/oauthlib-3.1.1+computecanada-py2.py3-none-any.whl
Installing collected packages: pyasn1, zipp, rsa, pyasn1-modules, oauthlib, cachetools, requests-oauthlib, importlib-metadata, google-auth, werkzeug, tensorboard-plugin-wit, tensorboard-data-server, markdown, grpcio, google-auth-oauthlib, absl-py, wrapt, tensorflow-estimator, tensorboard, scipy, opt-einsum, keras-preprocessing, h5py, google-pasta, gast, astunparse, tensorflow-gpu
  Attempting uninstall: pyasn1
    Found existing installation: pyasn1 0.4.3
    Not uninstalling pyasn1 at /cvmfs/soft.computecanada.ca/easybuild/software/2017/Core/scipy-stack/2019a/lib/python3.7/site-packages, outside environment /localscratch/yinan.28698556.0/env
    Can't uninstall 'pyasn1'. No files were found to uninstall.
  Attempting uninstall: zipp
    Found existing installation: zipp 0.3.3
    Not uninstalling zipp at /cvmfs/soft.computecanada.ca/easybuild/software/2017/Core/scipy-stack/2019a/lib/python3.7/site-packages, outside environment /localscratch/yinan.28698556.0/env
    Can't uninstall 'zipp'. No files were found to uninstall.
  Attempting uninstall: importlib-metadata
    Found existing installation: importlib-metadata 0.8
    Not uninstalling importlib-metadata at /cvmfs/soft.computecanada.ca/easybuild/software/2017/Core/scipy-stack/2019a/lib/python3.7/site-packages, outside environment /localscratch/yinan.28698556.0/env
    Can't uninstall 'importlib-metadata'. No files were found to uninstall.
  Attempting uninstall: scipy
    Found existing installation: scipy 1.2.0
    Not uninstalling scipy at /cvmfs/soft.computecanada.ca/easybuild/software/2017/Core/scipy-stack/2019a/lib/python3.7/site-packages, outside environment /localscratch/yinan.28698556.0/env
    Can't uninstall 'scipy'. No files were found to uninstall.
Successfully installed absl-py-1.0.0+computecanada astunparse-1.6.3+computecanada cachetools-4.2.4+computecanada gast-0.3.3+computecanada google-auth-2.3.3+computecanada google-auth-oauthlib-0.4.6+computecanada google-pasta-0.2.0+computecanada grpcio-1.38.0+computecanada h5py-2.10.0+computecanada importlib-metadata-4.10.1+computecanada keras-preprocessing-1.1.2+computecanada markdown-3.3.6+computecanada oauthlib-3.1.1+computecanada opt-einsum-3.3.0+computecanada pyasn1-0.4.8+computecanada pyasn1-modules-0.2.8+computecanada requests-oauthlib-1.3.0+computecanada rsa-4.8+computecanada scipy-1.4.1+computecanada tensorboard-2.8.0+computecanada tensorboard-data-server-0.6.1+computecanada tensorboard-plugin-wit-1.8.0+computecanada tensorflow-estimator-2.3.0+computecanada tensorflow-gpu-2.3.0+computecanada werkzeug-2.0.3+computecanada wrapt-1.11.2+computecanada zipp-3.7.0+computecanada
Looking in links: /cvmfs/soft.computecanada.ca/custom/python/wheelhouse/nix/avx2, /cvmfs/soft.computecanada.ca/custom/python/wheelhouse/nix/generic, /cvmfs/soft.computecanada.ca/custom/python/wheelhouse/generic
Processing /cvmfs/soft.computecanada.ca/custom/python/wheelhouse/generic/keras-2.8.0+computecanada-py2.py3-none-any.whl
Installing collected packages: Keras
Successfully installed Keras-2.8.0+computecanada
Looking in links: /cvmfs/soft.computecanada.ca/custom/python/wheelhouse/nix/avx2, /cvmfs/soft.computecanada.ca/custom/python/wheelhouse/nix/generic, /cvmfs/soft.computecanada.ca/custom/python/wheelhouse/generic
Processing /cvmfs/soft.computecanada.ca/custom/python/wheelhouse/generic/urllib3-1.26.7+computecanada-py2.py3-none-any.whl
Installing collected packages: urllib3
  Attempting uninstall: urllib3
    Found existing installation: urllib3 1.26.8+computecanada
    Uninstalling urllib3-1.26.8+computecanada:
      Successfully uninstalled urllib3-1.26.8+computecanada
Successfully installed urllib3-1.26.7+computecanada
Looking in links: /cvmfs/soft.computecanada.ca/custom/python/wheelhouse/nix/avx2, /cvmfs/soft.computecanada.ca/custom/python/wheelhouse/nix/generic, /cvmfs/soft.computecanada.ca/custom/python/wheelhouse/generic
Processing /cvmfs/soft.computecanada.ca/custom/python/wheelhouse/generic/nltk-3.7+computecanada-py3-none-any.whl
Requirement already satisfied: tqdm in /localscratch/yinan.28698556.0/env/lib/python3.7/site-packages (from nltk) (4.63.0+computecanada)
Requirement already satisfied: click in /localscratch/yinan.28698556.0/env/lib/python3.7/site-packages (from nltk) (8.0.3+computecanada)
Processing /cvmfs/soft.computecanada.ca/custom/python/wheelhouse/generic/nltk-3.6.5+computecanada-py3-none-any.whl
Processing /cvmfs/soft.computecanada.ca/custom/python/wheelhouse/generic/nltk-3.6.3+computecanada-py3-none-any.whl
Requirement already satisfied: regex in /localscratch/yinan.28698556.0/env/lib/python3.7/site-packages (from nltk) (2020.11.13+computecanada)
Requirement already satisfied: joblib in /localscratch/yinan.28698556.0/env/lib/python3.7/site-packages (from nltk) (1.1.0+computecanada)
Requirement already satisfied: importlib-metadata in /localscratch/yinan.28698556.0/env/lib/python3.7/site-packages (from click->nltk) (4.10.1+computecanada)
Requirement already satisfied: typing-extensions>=3.6.4 in /localscratch/yinan.28698556.0/env/lib/python3.7/site-packages (from importlib-metadata->click->nltk) (4.0.1+computecanada)
Requirement already satisfied: zipp>=0.5 in /localscratch/yinan.28698556.0/env/lib/python3.7/site-packages (from importlib-metadata->click->nltk) (3.7.0+computecanada)
Installing collected packages: nltk
Successfully installed nltk-3.6.3+computecanada
Looking in links: /cvmfs/soft.computecanada.ca/custom/python/wheelhouse/nix/avx2, /cvmfs/soft.computecanada.ca/custom/python/wheelhouse/nix/generic, /cvmfs/soft.computecanada.ca/custom/python/wheelhouse/generic
Processing /cvmfs/soft.computecanada.ca/custom/python/wheelhouse/generic/scikit_learn-0.22.1+computecanada-cp37-cp37m-linux_x86_64.whl
Requirement already satisfied: numpy>=1.11.0 in /cvmfs/soft.computecanada.ca/easybuild/software/2017/Core/scipy-stack/2019a/lib/python3.7/site-packages (from scikit-learn==0.22.1) (1.16.0)
Requirement already satisfied: scipy>=0.17.0 in /localscratch/yinan.28698556.0/env/lib/python3.7/site-packages (from scikit-learn==0.22.1) (1.4.1+computecanada)
Requirement already satisfied: joblib>=0.11 in /localscratch/yinan.28698556.0/env/lib/python3.7/site-packages (from scikit-learn==0.22.1) (1.1.0+computecanada)
Installing collected packages: scikit-learn
Successfully installed scikit-learn-0.22.1+computecanada
Looking in links: /cvmfs/soft.computecanada.ca/custom/python/wheelhouse/nix/avx2, /cvmfs/soft.computecanada.ca/custom/python/wheelhouse/nix/generic, /cvmfs/soft.computecanada.ca/custom/python/wheelhouse/generic
Requirement already satisfied: tokenizers==0.5.2 in /localscratch/yinan.28698556.0/env/lib/python3.7/site-packages (0.5.2+computecanada)
wandb: Appending key for api.wandb.ai to your netrc file: /home/yinan/.netrc
Starting Task
2022-03-11 00:29:23.910800: I tensorflow/stream_executor/platform/default/dso_loader.cc:48] Successfully opened dynamic library libcudart.so.10.1
[nltk_data] Downloading package stopwords to /home/yinan/nltk_data...
[nltk_data]   Package stopwords is already up-to-date!
[nltk_data] Downloading package wordnet to /home/yinan/nltk_data...
[nltk_data]   Package wordnet is already up-to-date!
wandb: Currently logged in as: yinanazhou (use `wandb login --relogin` to force relogin)
wandb: wandb version 0.12.11 is available!  To upgrade, please run:
wandb:  $ pip install wandb --upgrade
2022-03-11 00:29:32.463965: I tensorflow/stream_executor/platform/default/dso_loader.cc:48] Successfully opened dynamic library libcudart.so.10.1
wandb: Tracking run with wandb version 0.12.5
wandb: Syncing run iconic-oath-1
wandb: ⭐️ View project at https://wandb.ai/yinanazhou/xl_512_bs_8_lr_1e07_es_15_lc_True_nr_True_sr_True_stem_False_lemma_False_repeat_1_fold_1
wandb: 🚀 View run at https://wandb.ai/yinanazhou/xl_512_bs_8_lr_1e07_es_15_lc_True_nr_True_sr_True_stem_False_lemma_False_repeat_1_fold_1/runs/3m52sp2m
wandb: Run data is saved locally in /project/6002780/yinan/Thesis_MER_Lyrics/lyric-emotion/wandb/run-20220311_002930-3m52sp2m
wandb: Run `wandb offline` to turn off syncing.

Validation loss decreased (inf --> 1.464077).  Saving model ...
Validation loss decreased (1.464077 --> 1.461484).  Saving model ...
Validation loss decreased (1.461484 --> 1.458779).  Saving model ...
Validation loss decreased (1.458779 --> 1.456094).  Saving model ...
Validation loss decreased (1.456094 --> 1.453516).  Saving model ...
Validation loss decreased (1.453516 --> 1.450996).  Saving model ...
Validation loss decreased (1.450996 --> 1.448730).  Saving model ...
Validation loss decreased (1.448730 --> 1.446542).  Saving model ...
Validation loss decreased (1.446542 --> 1.444330).  Saving model ...
Validation loss decreased (1.444330 --> 1.442032).  Saving model ...
Validation loss decreased (1.442032 --> 1.439813).  Saving model ...
Validation loss decreased (1.439813 --> 1.437805).  Saving model ...
Validation loss decreased (1.437805 --> 1.435808).  Saving model ...
Validation loss decreased (1.435808 --> 1.433770).  Saving model ...
Validation loss decreased (1.433770 --> 1.431863).  Saving model ...
Validation loss decreased (1.431863 --> 1.430038).  Saving model ...
Validation loss decreased (1.430038 --> 1.428231).  Saving model ...
Validation loss decreased (1.428231 --> 1.426440).  Saving model ...
Validation loss decreased (1.426440 --> 1.424745).  Saving model ...
Validation loss decreased (1.424745 --> 1.423034).  Saving model ...
Validation loss decreased (1.423034 --> 1.421366).  Saving model ...
Validation loss decreased (1.421366 --> 1.419731).  Saving model ...
Validation loss decreased (1.419731 --> 1.418157).  Saving model ...
Validation loss decreased (1.418157 --> 1.416651).  Saving model ...
Validation loss decreased (1.416651 --> 1.415108).  Saving model ...
Validation loss decreased (1.415108 --> 1.413652).  Saving model ...
Validation loss decreased (1.413652 --> 1.412235).  Saving model ...
Validation loss decreased (1.412235 --> 1.410816).  Saving model ...
Validation loss decreased (1.410816 --> 1.409560).  Saving model ...
Validation loss decreased (1.409560 --> 1.408321).  Saving model ...
Validation loss decreased (1.408321 --> 1.407015).  Saving model ...
Validation loss decreased (1.407015 --> 1.405730).  Saving model ...
Validation loss decreased (1.405730 --> 1.404581).  Saving model ...
Validation loss decreased (1.404581 --> 1.403367).  Saving model ...
Validation loss decreased (1.403367 --> 1.402249).  Saving model ...
Validation loss decreased (1.402249 --> 1.401001).  Saving model ...
Validation loss decreased (1.401001 --> 1.399817).  Saving model ...
Validation loss decreased (1.399817 --> 1.398801).  Saving model ...
Validation loss decreased (1.398801 --> 1.397707).  Saving model ...
Validation loss decreased (1.397707 --> 1.396757).  Saving model ...
Validation loss decreased (1.396757 --> 1.395770).  Saving model ...
Validation loss decreased (1.395770 --> 1.394690).  Saving model ...
Validation loss decreased (1.394690 --> 1.393706).  Saving model ...
Validation loss decreased (1.393706 --> 1.392721).  Saving model ...
Validation loss decreased (1.392721 --> 1.391721).  Saving model ...
Validation loss decreased (1.391721 --> 1.390836).  Saving model ...
Validation loss decreased (1.390836 --> 1.389952).  Saving model ...
Validation loss decreased (1.389952 --> 1.389052).  Saving model ...
Validation loss decreased (1.389052 --> 1.388181).  Saving model ...
Validation loss decreased (1.388181 --> 1.387315).  Saving model ...
Validation loss decreased (1.387315 --> 1.386535).  Saving model ...
Validation loss decreased (1.386535 --> 1.385805).  Saving model ...
Validation loss decreased (1.385805 --> 1.385014).  Saving model ...
Validation loss decreased (1.385014 --> 1.384197).  Saving model ...
Validation loss decreased (1.384197 --> 1.383471).  Saving model ...
Validation loss decreased (1.383471 --> 1.382715).  Saving model ...
Validation loss decreased (1.382715 --> 1.381944).  Saving model ...
Validation loss decreased (1.381944 --> 1.381238).  Saving model ...
Validation loss decreased (1.381238 --> 1.380495).  Saving model ...
Validation loss decreased (1.380495 --> 1.379857).  Saving model ...
Validation loss decreased (1.379857 --> 1.379156).  Saving model ...
Validation loss decreased (1.379156 --> 1.378428).  Saving model ...
Validation loss decreased (1.378428 --> 1.377723).  Saving model ...
Validation loss decreased (1.377723 --> 1.377044).  Saving model ...
Validation loss decreased (1.377044 --> 1.376471).  Saving model ...
Validation loss decreased (1.376471 --> 1.375780).  Saving model ...
Validation loss decreased (1.375780 --> 1.375204).  Saving model ...
Validation loss decreased (1.375204 --> 1.374558).  Saving model ...
Validation loss decreased (1.374558 --> 1.374017).  Saving model ...
Validation loss decreased (1.374017 --> 1.373474).  Saving model ...
Validation loss decreased (1.373474 --> 1.372920).  Saving model ...
Validation loss decreased (1.372920 --> 1.372303).  Saving model ...
Validation loss decreased (1.372303 --> 1.371688).  Saving model ...
Validation loss decreased (1.371688 --> 1.371058).  Saving model ...
Validation loss decreased (1.371058 --> 1.370502).  Saving model ...
Validation loss decreased (1.370502 --> 1.369958).  Saving model ...
Validation loss decreased (1.369958 --> 1.369423).  Saving model ...
Validation loss decreased (1.369423 --> 1.368879).  Saving model ...
Validation loss decreased (1.368879 --> 1.368325).  Saving model ...
Validation loss decreased (1.368325 --> 1.367766).  Saving model ...
Validation loss decreased (1.367766 --> 1.367231).  Saving model ...
Validation loss decreased (1.367231 --> 1.366721).  Saving model ...
Validation loss decreased (1.366721 --> 1.366188).  Saving model ...
Validation loss decreased (1.366188 --> 1.365713).  Saving model ...
Validation loss decreased (1.365713 --> 1.365213).  Saving model ...
Validation loss decreased (1.365213 --> 1.364687).  Saving model ...
Validation loss decreased (1.364687 --> 1.364183).  Saving model ...
Validation loss decreased (1.364183 --> 1.363599).  Saving model ...
Validation loss decreased (1.363599 --> 1.363157).  Saving model ...
Validation loss decreased (1.363157 --> 1.362697).  Saving model ...
Validation loss decreased (1.362697 --> 1.362232).  Saving model ...
Validation loss decreased (1.362232 --> 1.361797).  Saving model ...
Validation loss decreased (1.361797 --> 1.361337).  Saving model ...
Validation loss decreased (1.361337 --> 1.360846).  Saving model ...
Validation loss decreased (1.360846 --> 1.360382).  Saving model ...
Validation loss decreased (1.360382 --> 1.359955).  Saving model ...
Validation loss decreased (1.359955 --> 1.359495).  Saving model ...
Validation loss decreased (1.359495 --> 1.359014).  Saving model ...
Validation loss decreased (1.359014 --> 1.358559).  Saving model ...
Validation loss decreased (1.358559 --> 1.358134).  Saving model ...
Validation loss decreased (1.358134 --> 1.357664).  Saving model ...
Validation loss decreased (1.357664 --> 1.357187).  Saving model ...
Validation loss decreased (1.357187 --> 1.356734).  Saving model ...
Validation loss decreased (1.356734 --> 1.356262).  Saving model ...
Validation loss decreased (1.356262 --> 1.355761).  Saving model ...
Validation loss decreased (1.355761 --> 1.355331).  Saving model ...
Validation loss decreased (1.355331 --> 1.354868).  Saving model ...
Validation loss decreased (1.354868 --> 1.354416).  Saving model ...
Validation loss decreased (1.354416 --> 1.353922).  Saving model ...
Validation loss decreased (1.353922 --> 1.353486).  Saving model ...
Validation loss decreased (1.353486 --> 1.353056).  Saving model ...
Validation loss decreased (1.353056 --> 1.352605).  Saving model ...
Validation loss decreased (1.352605 --> 1.352184).  Saving model ...
Validation loss decreased (1.352184 --> 1.351788).  Saving model ...
Validation loss decreased (1.351788 --> 1.351357).  Saving model ...
Validation loss decreased (1.351357 --> 1.350916).  Saving model ...
Validation loss decreased (1.350916 --> 1.350457).  Saving model ...
Validation loss decreased (1.350457 --> 1.350023).  Saving model ...
Validation loss decreased (1.350023 --> 1.349598).  Saving model ...
Validation loss decreased (1.349598 --> 1.349128).  Saving model ...
Validation loss decreased (1.349128 --> 1.348738).  Saving model ...
Validation loss decreased (1.348738 --> 1.348275).  Saving model ...
Validation loss decreased (1.348275 --> 1.347901).  Saving model ...
Validation loss decreased (1.347901 --> 1.347469).  Saving model ...
Validation loss decreased (1.347469 --> 1.347042).  Saving model ...
Validation loss decreased (1.347042 --> 1.346582).  Saving model ...
Validation loss decreased (1.346582 --> 1.346155).  Saving model ...
Validation loss decreased (1.346155 --> 1.345678).  Saving model ...
Validation loss decreased (1.345678 --> 1.345261).  Saving model ...
Validation loss decreased (1.345261 --> 1.344873).  Saving model ...
Validation loss decreased (1.344873 --> 1.344426).  Saving model ...
Validation loss decreased (1.344426 --> 1.343971).  Saving model ...
Validation loss decreased (1.343971 --> 1.343480).  Saving model ...
Validation loss decreased (1.343480 --> 1.343051).  Saving model ...
Validation loss decreased (1.343051 --> 1.342594).  Saving model ...
Validation loss decreased (1.342594 --> 1.342130).  Saving model ...
Validation loss decreased (1.342130 --> 1.341725).  Saving model ...
Validation loss decreased (1.341725 --> 1.341295).  Saving model ...
Validation loss decreased (1.341295 --> 1.340800).  Saving model ...
Validation loss decreased (1.340800 --> 1.340357).  Saving model ...
Validation loss decreased (1.340357 --> 1.339923).  Saving model ...
Validation loss decreased (1.339923 --> 1.339484).  Saving model ...
Validation loss decreased (1.339484 --> 1.339004).  Saving model ...
Validation loss decreased (1.339004 --> 1.338578).  Saving model ...
Validation loss decreased (1.338578 --> 1.338075).  Saving model ...
Validation loss decreased (1.338075 --> 1.337640).  Saving model ...
Validation loss decreased (1.337640 --> 1.337196).  Saving model ...
Validation loss decreased (1.337196 --> 1.336708).  Saving model ...
Validation loss decreased (1.336708 --> 1.336259).  Saving model ...
Validation loss decreased (1.336259 --> 1.335803).  Saving model ...
Validation loss decreased (1.335803 --> 1.335370).  Saving model ...
Validation loss decreased (1.335370 --> 1.334981).  Saving model ...
Validation loss decreased (1.334981 --> 1.334536).  Saving model ...
Validation loss decreased (1.334536 --> 1.334116).  Saving model ...
Validation loss decreased (1.334116 --> 1.333626).  Saving model ...
Validation loss decreased (1.333626 --> 1.333233).  Saving model ...
Validation loss decreased (1.333233 --> 1.332815).  Saving model ...
Validation loss decreased (1.332815 --> 1.332327).  Saving model ...
Validation loss decreased (1.332327 --> 1.331829).  Saving model ...
Validation loss decreased (1.331829 --> 1.331378).  Saving model ...
Validation loss decreased (1.331378 --> 1.330906).  Saving model ...
Validation loss decreased (1.330906 --> 1.330461).  Saving model ...
Validation loss decreased (1.330461 --> 1.329996).  Saving model ...
Validation loss decreased (1.329996 --> 1.329509).  Saving model ...
Validation loss decreased (1.329509 --> 1.329065).  Saving model ...
Validation loss decreased (1.329065 --> 1.328627).  Saving model ...
Validation loss decreased (1.328627 --> 1.328148).  Saving model ...
Validation loss decreased (1.328148 --> 1.327684).  Saving model ...
Validation loss decreased (1.327684 --> 1.327267).  Saving model ...
Validation loss decreased (1.327267 --> 1.326772).  Saving model ...
Validation loss decreased (1.326772 --> 1.326260).  Saving model ...
Validation loss decreased (1.326260 --> 1.325840).  Saving model ...
Validation loss decreased (1.325840 --> 1.325420).  Saving model ...
Validation loss decreased (1.325420 --> 1.324983).  Saving model ...
Validation loss decreased (1.324983 --> 1.324537).  Saving model ...
Validation loss decreased (1.324537 --> 1.324074).  Saving model ...
Validation loss decreased (1.324074 --> 1.323521).  Saving model ...
Validation loss decreased (1.323521 --> 1.323038).  Saving model ...
Validation loss decreased (1.323038 --> 1.322657).  Saving model ...
Validation loss decreased (1.322657 --> 1.322253).  Saving model ...
Validation loss decreased (1.322253 --> 1.321797).  Saving model ...
Validation loss decreased (1.321797 --> 1.321257).  Saving model ...
Validation loss decreased (1.321257 --> 1.320775).  Saving model ...
Validation loss decreased (1.320775 --> 1.320319).  Saving model ...
Validation loss decreased (1.320319 --> 1.319832).  Saving model ...
Validation loss decreased (1.319832 --> 1.319227).  Saving model ...
Validation loss decreased (1.319227 --> 1.318849).  Saving model ...
Validation loss decreased (1.318849 --> 1.318465).  Saving model ...
Validation loss decreased (1.318465 --> 1.317953).  Saving model ...
Validation loss decreased (1.317953 --> 1.317490).  Saving model ...
Validation loss decreased (1.317490 --> 1.317082).  Saving model ...
Validation loss decreased (1.317082 --> 1.316689).  Saving model ...
Validation loss decreased (1.316689 --> 1.316316).  Saving model ...
Validation loss decreased (1.316316 --> 1.315833).  Saving model ...
Validation loss decreased (1.315833 --> 1.315387).  Saving model ...
Validation loss decreased (1.315387 --> 1.314977).  Saving model ...
Validation loss decreased (1.314977 --> 1.314507).  Saving model ...
Validation loss decreased (1.314507 --> 1.314003).  Saving model ...
Validation loss decreased (1.314003 --> 1.313398).  Saving model ...
Validation loss decreased (1.313398 --> 1.312789).  Saving model ...
Validation loss decreased (1.312789 --> 1.312339).  Saving model ...
Validation loss decreased (1.312339 --> 1.311851).  Saving model ...
Validation loss decreased (1.311851 --> 1.311449).  Saving model ...
Validation loss decreased (1.311449 --> 1.310963).  Saving model ...
Validation loss decreased (1.310963 --> 1.310598).  Saving model ...
Validation loss decreased (1.310598 --> 1.310175).  Saving model ...
Validation loss decreased (1.310175 --> 1.309707).  Saving model ...
Validation loss decreased (1.309707 --> 1.309305).  Saving model ...
Validation loss decreased (1.309305 --> 1.308940).  Saving model ...
Validation loss decreased (1.308940 --> 1.308546).  Saving model ...
Validation loss decreased (1.308546 --> 1.308036).  Saving model ...
Validation loss decreased (1.308036 --> 1.307503).  Saving model ...
Validation loss decreased (1.307503 --> 1.307085).  Saving model ...
Validation loss decreased (1.307085 --> 1.306566).  Saving model ...
Validation loss decreased (1.306566 --> 1.306140).  Saving model ...
Validation loss decreased (1.306140 --> 1.305676).  Saving model ...
Validation loss decreased (1.305676 --> 1.305290).  Saving model ...
Validation loss decreased (1.305290 --> 1.304794).  Saving model ...
Validation loss decreased (1.304794 --> 1.304369).  Saving model ...
Validation loss decreased (1.304369 --> 1.303925).  Saving model ...
Validation loss decreased (1.303925 --> 1.303404).  Saving model ...
Validation loss decreased (1.303404 --> 1.302923).  Saving model ...
Validation loss decreased (1.302923 --> 1.302379).  Saving model ...
Validation loss decreased (1.302379 --> 1.301863).  Saving model ...
Validation loss decreased (1.301863 --> 1.301379).  Saving model ...
Validation loss decreased (1.301379 --> 1.300910).  Saving model ...
Validation loss decreased (1.300910 --> 1.300520).  Saving model ...
Validation loss decreased (1.300520 --> 1.300085).  Saving model ...
Validation loss decreased (1.300085 --> 1.299601).  Saving model ...
Validation loss decreased (1.299601 --> 1.299139).  Saving model ...
Validation loss decreased (1.299139 --> 1.298586).  Saving model ...
Validation loss decreased (1.298586 --> 1.298087).  Saving model ...
Validation loss decreased (1.298087 --> 1.297646).  Saving model ...
Validation loss decreased (1.297646 --> 1.297166).  Saving model ...
Validation loss decreased (1.297166 --> 1.296722).  Saving model ...
Validation loss decreased (1.296722 --> 1.296291).  Saving model ...
Validation loss decreased (1.296291 --> 1.295847).  Saving model ...
Validation loss decreased (1.295847 --> 1.295473).  Saving model ...
Validation loss decreased (1.295473 --> 1.295042).  Saving model ...
Validation loss decreased (1.295042 --> 1.294675).  Saving model ...
Validation loss decreased (1.294675 --> 1.294294).  Saving model ...
Validation loss decreased (1.294294 --> 1.293939).  Saving model ...
Validation loss decreased (1.293939 --> 1.293591).  Saving model ...
Validation loss decreased (1.293591 --> 1.293152).  Saving model ...
Validation loss decreased (1.293152 --> 1.292862).  Saving model ...
Validation loss decreased (1.292862 --> 1.292417).  Saving model ...
Validation loss decreased (1.292417 --> 1.292194).  Saving model ...
Validation loss decreased (1.292194 --> 1.291857).  Saving model ...
Validation loss decreased (1.291857 --> 1.291493).  Saving model ...
Validation loss decreased (1.291493 --> 1.291090).  Saving model ...
Validation loss decreased (1.291090 --> 1.290597).  Saving model ...
Validation loss decreased (1.290597 --> 1.290226).  Saving model ...
Validation loss decreased (1.290226 --> 1.289923).  Saving model ...
Validation loss decreased (1.289923 --> 1.289527).  Saving model ...
Validation loss decreased (1.289527 --> 1.289178).  Saving model ...
Validation loss decreased (1.289178 --> 1.288810).  Saving model ...
Validation loss decreased (1.288810 --> 1.288450).  Saving model ...
Validation loss decreased (1.288450 --> 1.288040).  Saving model ...
Validation loss decreased (1.288040 --> 1.287479).  Saving model ...
Validation loss decreased (1.287479 --> 1.287064).  Saving model ...
Validation loss decreased (1.287064 --> 1.286663).  Saving model ...
Validation loss decreased (1.286663 --> 1.286217).  Saving model ...
Validation loss decreased (1.286217 --> 1.285672).  Saving model ...
Validation loss decreased (1.285672 --> 1.285265).  Saving model ...
Validation loss decreased (1.285265 --> 1.284726).  Saving model ...
Validation loss decreased (1.284726 --> 1.284284).  Saving model ...
Validation loss decreased (1.284284 --> 1.284008).  Saving model ...
Validation loss decreased (1.284008 --> 1.283747).  Saving model ...
Validation loss decreased (1.283747 --> 1.283342).  Saving model ...
Validation loss decreased (1.283342 --> 1.282926).  Saving model ...
Validation loss decreased (1.282926 --> 1.282511).  Saving model ...
Validation loss decreased (1.282511 --> 1.281963).  Saving model ...
Validation loss decreased (1.281963 --> 1.281636).  Saving model ...
Validation loss decreased (1.281636 --> 1.281072).  Saving model ...
Validation loss decreased (1.281072 --> 1.280644).  Saving model ...
Validation loss decreased (1.280644 --> 1.280347).  Saving model ...
Validation loss decreased (1.280347 --> 1.280110).  Saving model ...
Validation loss decreased (1.280110 --> 1.279653).  Saving model ...
Validation loss decreased (1.279653 --> 1.279182).  Saving model ...
Validation loss decreased (1.279182 --> 1.278768).  Saving model ...
Validation loss decreased (1.278768 --> 1.278261).  Saving model ...
Validation loss decreased (1.278261 --> 1.277922).  Saving model ...
Validation loss decreased (1.277922 --> 1.277674).  Saving model ...
Validation loss decreased (1.277674 --> 1.277250).  Saving model ...
Validation loss decreased (1.277250 --> 1.276895).  Saving model ...
Validation loss decreased (1.276895 --> 1.276663).  Saving model ...
Validation loss decreased (1.276663 --> 1.276189).  Saving model ...
Validation loss decreased (1.276189 --> 1.275744).  Saving model ...
Validation loss decreased (1.275744 --> 1.275359).  Saving model ...
Validation loss decreased (1.275359 --> 1.275094).  Saving model ...
Validation loss decreased (1.275094 --> 1.274634).  Saving model ...
Validation loss decreased (1.274634 --> 1.274236).  Saving model ...
Validation loss decreased (1.274236 --> 1.273885).  Saving model ...
Validation loss decreased (1.273885 --> 1.273645).  Saving model ...
Validation loss decreased (1.273645 --> 1.273202).  Saving model ...
Validation loss decreased (1.273202 --> 1.272852).  Saving model ...
Validation loss decreased (1.272852 --> 1.272498).  Saving model ...
Validation loss decreased (1.272498 --> 1.271941).  Saving model ...
Validation loss decreased (1.271941 --> 1.271736).  Saving model ...
Validation loss decreased (1.271736 --> 1.271374).  Saving model ...
Validation loss decreased (1.271374 --> 1.270947).  Saving model ...
Validation loss decreased (1.270947 --> 1.270548).  Saving model ...
Validation loss decreased (1.270548 --> 1.270420).  Saving model ...
Validation loss decreased (1.270420 --> 1.270006).  Saving model ...
Validation loss decreased (1.270006 --> 1.269427).  Saving model ...
Validation loss decreased (1.269427 --> 1.269108).  Saving model ...
Validation loss decreased (1.269108 --> 1.268926).  Saving model ...
Validation loss decreased (1.268926 --> 1.268700).  Saving model ...
Validation loss decreased (1.268700 --> 1.268436).  Saving model ...
Validation loss decreased (1.268436 --> 1.267774).  Saving model ...
Validation loss decreased (1.267774 --> 1.267656).  Saving model ...
Validation loss decreased (1.267656 --> 1.267388).  Saving model ...
Validation loss decreased (1.267388 --> 1.267094).  Saving model ...
Validation loss decreased (1.267094 --> 1.266927).  Saving model ...
Validation loss decreased (1.266927 --> 1.266657).  Saving model ...
Validation loss decreased (1.266657 --> 1.266275).  Saving model ...
Validation loss decreased (1.266275 --> 1.265965).  Saving model ...
Validation loss decreased (1.265965 --> 1.265591).  Saving model ...
Validation loss decreased (1.265591 --> 1.265228).  Saving model ...
Validation loss decreased (1.265228 --> 1.265014).  Saving model ...
Validation loss decreased (1.265014 --> 1.264924).  Saving model ...
Validation loss decreased (1.264924 --> 1.264531).  Saving model ...
Validation loss decreased (1.264531 --> 1.264226).  Saving model ...
Validation loss decreased (1.264226 --> 1.264063).  Saving model ...
Validation loss decreased (1.264063 --> 1.263695).  Saving model ...
Validation loss decreased (1.263695 --> 1.263503).  Saving model ...
Validation loss decreased (1.263503 --> 1.263202).  Saving model ...
Validation loss decreased (1.263202 --> 1.262844).  Saving model ...
Validation loss decreased (1.262844 --> 1.262445).  Saving model ...
Validation loss decreased (1.262445 --> 1.262166).  Saving model ...
Validation loss decreased (1.262166 --> 1.261871).  Saving model ...
Validation loss decreased (1.261871 --> 1.261763).  Saving model ...
Validation loss decreased (1.261763 --> 1.261280).  Saving model ...
Validation loss decreased (1.261280 --> 1.261129).  Saving model ...
Validation loss decreased (1.261129 --> 1.260702).  Saving model ...
Validation loss decreased (1.260702 --> 1.260479).  Saving model ...
Validation loss decreased (1.260479 --> 1.260118).  Saving model ...
Validation loss decreased (1.260118 --> 1.260087).  Saving model ...
Validation loss decreased (1.260087 --> 1.259644).  Saving model ...
Validation loss decreased (1.259644 --> 1.259339).  Saving model ...
Validation loss decreased (1.259339 --> 1.259160).  Saving model ...
Validation loss decreased (1.259160 --> 1.258765).  Saving model ...
Validation loss decreased (1.258765 --> 1.258501).  Saving model ...
Validation loss decreased (1.258501 --> 1.258375).  Saving model ...
Validation loss decreased (1.258375 --> 1.258275).  Saving model ...
Validation loss decreased (1.258275 --> 1.258137).  Saving model ...
Validation loss decreased (1.258137 --> 1.257721).  Saving model ...
Validation loss decreased (1.257721 --> 1.257364).  Saving model ...
Validation loss decreased (1.257364 --> 1.257059).  Saving model ...
Validation loss decreased (1.257059 --> 1.256892).  Saving model ...
Validation loss decreased (1.256892 --> 1.256570).  Saving model ...
Validation loss decreased (1.256570 --> 1.255890).  Saving model ...
Validation loss decreased (1.255890 --> 1.255643).  Saving model ...
Validation loss decreased (1.255643 --> 1.255477).  Saving model ...
Validation loss decreased (1.255477 --> 1.255016).  Saving model ...
Validation loss decreased (1.255016 --> 1.254892).  Saving model ...
Validation loss decreased (1.254892 --> 1.254446).  Saving model ...
Validation loss decreased (1.254446 --> 1.254193).  Saving model ...
Validation loss decreased (1.254193 --> 1.253691).  Saving model ...
Validation loss decreased (1.253691 --> 1.253583).  Saving model ...
EarlyStopping counter: 1 out of 15.0
Validation loss decreased (1.253583 --> 1.253338).  Saving model ...
Validation loss decreased (1.253338 --> 1.253001).  Saving model ...
Validation loss decreased (1.253001 --> 1.252763).  Saving model ...
Validation loss decreased (1.252763 --> 1.252754).  Saving model ...
Validation loss decreased (1.252754 --> 1.252333).  Saving model ...
Validation loss decreased (1.252333 --> 1.251946).  Saving model ...
Validation loss decreased (1.251946 --> 1.251507).  Saving model ...
Validation loss decreased (1.251507 --> 1.251350).  Saving model ...
Validation loss decreased (1.251350 --> 1.251137).  Saving model ...
Validation loss decreased (1.251137 --> 1.250736).  Saving model ...
Validation loss decreased (1.250736 --> 1.250726).  Saving model ...
Validation loss decreased (1.250726 --> 1.250242).  Saving model ...
Validation loss decreased (1.250242 --> 1.249886).  Saving model ...
Validation loss decreased (1.249886 --> 1.249695).  Saving model ...
Validation loss decreased (1.249695 --> 1.249274).  Saving model ...
Validation loss decreased (1.249274 --> 1.249137).  Saving model ...
Validation loss decreased (1.249137 --> 1.248922).  Saving model ...
Validation loss decreased (1.248922 --> 1.248455).  Saving model ...
Validation loss decreased (1.248455 --> 1.248103).  Saving model ...
Validation loss decreased (1.248103 --> 1.247831).  Saving model ...
Validation loss decreased (1.247831 --> 1.247528).  Saving model ...
Validation loss decreased (1.247528 --> 1.247424).  Saving model ...
Validation loss decreased (1.247424 --> 1.247315).  Saving model ...
Validation loss decreased (1.247315 --> 1.246947).  Saving model ...
Validation loss decreased (1.246947 --> 1.246664).  Saving model ...
Validation loss decreased (1.246664 --> 1.246470).  Saving model ...
Validation loss decreased (1.246470 --> 1.246086).  Saving model ...
Validation loss decreased (1.246086 --> 1.245961).  Saving model ...
Validation loss decreased (1.245961 --> 1.245673).  Saving model ...
Validation loss decreased (1.245673 --> 1.245235).  Saving model ...
Validation loss decreased (1.245235 --> 1.244949).  Saving model ...
Validation loss decreased (1.244949 --> 1.244842).  Saving model ...
EarlyStopping counter: 1 out of 15.0
Validation loss decreased (1.244842 --> 1.244554).  Saving model ...
Validation loss decreased (1.244554 --> 1.244407).  Saving model ...
Validation loss decreased (1.244407 --> 1.244272).  Saving model ...
Validation loss decreased (1.244272 --> 1.243749).  Saving model ...
Validation loss decreased (1.243749 --> 1.243235).  Saving model ...
Validation loss decreased (1.243235 --> 1.242801).  Saving model ...
Validation loss decreased (1.242801 --> 1.242510).  Saving model ...
EarlyStopping counter: 1 out of 15.0
Validation loss decreased (1.242510 --> 1.242305).  Saving model ...
Validation loss decreased (1.242305 --> 1.241893).  Saving model ...
Validation loss decreased (1.241893 --> 1.241767).  Saving model ...
Validation loss decreased (1.241767 --> 1.241562).  Saving model ...
Validation loss decreased (1.241562 --> 1.241346).  Saving model ...
Validation loss decreased (1.241346 --> 1.241194).  Saving model ...
Validation loss decreased (1.241194 --> 1.240789).  Saving model ...
Validation loss decreased (1.240789 --> 1.240253).  Saving model ...
Validation loss decreased (1.240253 --> 1.239844).  Saving model ...
Validation loss decreased (1.239844 --> 1.239377).  Saving model ...
Validation loss decreased (1.239377 --> 1.238925).  Saving model ...
Validation loss decreased (1.238925 --> 1.238503).  Saving model ...
EarlyStopping counter: 1 out of 15.0
Validation loss decreased (1.238503 --> 1.238500).  Saving model ...
Validation loss decreased (1.238500 --> 1.238221).  Saving model ...
Validation loss decreased (1.238221 --> 1.237639).  Saving model ...
Validation loss decreased (1.237639 --> 1.236897).  Saving model ...
Validation loss decreased (1.236897 --> 1.236720).  Saving model ...
Validation loss decreased (1.236720 --> 1.236397).  Saving model ...
Validation loss decreased (1.236397 --> 1.236195).  Saving model ...
Validation loss decreased (1.236195 --> 1.235936).  Saving model ...
Validation loss decreased (1.235936 --> 1.235902).  Saving model ...
Validation loss decreased (1.235902 --> 1.235549).  Saving model ...
EarlyStopping counter: 1 out of 15.0
Validation loss decreased (1.235549 --> 1.235470).  Saving model ...
Validation loss decreased (1.235470 --> 1.235415).  Saving model ...
Validation loss decreased (1.235415 --> 1.235179).  Saving model ...
Validation loss decreased (1.235179 --> 1.234990).  Saving model ...
Validation loss decreased (1.234990 --> 1.234593).  Saving model ...
Validation loss decreased (1.234593 --> 1.234201).  Saving model ...
Validation loss decreased (1.234201 --> 1.233865).  Saving model ...
Validation loss decreased (1.233865 --> 1.233654).  Saving model ...
Validation loss decreased (1.233654 --> 1.233348).  Saving model ...
Validation loss decreased (1.233348 --> 1.232913).  Saving model ...
Validation loss decreased (1.232913 --> 1.232614).  Saving model ...
Validation loss decreased (1.232614 --> 1.232361).  Saving model ...
EarlyStopping counter: 1 out of 15.0
Validation loss decreased (1.232361 --> 1.232093).  Saving model ...
Validation loss decreased (1.232093 --> 1.231664).  Saving model ...
Validation loss decreased (1.231664 --> 1.231348).  Saving model ...
Validation loss decreased (1.231348 --> 1.231031).  Saving model ...
Validation loss decreased (1.231031 --> 1.230694).  Saving model ...
Validation loss decreased (1.230694 --> 1.230271).  Saving model ...
Validation loss decreased (1.230271 --> 1.229672).  Saving model ...
Validation loss decreased (1.229672 --> 1.229171).  Saving model ...
Validation loss decreased (1.229171 --> 1.228739).  Saving model ...
Validation loss decreased (1.228739 --> 1.228493).  Saving model ...
Validation loss decreased (1.228493 --> 1.228454).  Saving model ...
Validation loss decreased (1.228454 --> 1.228256).  Saving model ...
Validation loss decreased (1.228256 --> 1.228149).  Saving model ...
Validation loss decreased (1.228149 --> 1.227672).  Saving model ...
Validation loss decreased (1.227672 --> 1.227482).  Saving model ...
Validation loss decreased (1.227482 --> 1.227422).  Saving model ...
EarlyStopping counter: 1 out of 15.0
Validation loss decreased (1.227422 --> 1.227180).  Saving model ...
Validation loss decreased (1.227180 --> 1.227033).  Saving model ...
Validation loss decreased (1.227033 --> 1.226816).  Saving model ...
Validation loss decreased (1.226816 --> 1.226555).  Saving model ...
Validation loss decreased (1.226555 --> 1.226221).  Saving model ...
Validation loss decreased (1.226221 --> 1.225698).  Saving model ...
Validation loss decreased (1.225698 --> 1.225689).  Saving model ...
Validation loss decreased (1.225689 --> 1.224986).  Saving model ...
Validation loss decreased (1.224986 --> 1.224526).  Saving model ...
Validation loss decreased (1.224526 --> 1.224100).  Saving model ...
Validation loss decreased (1.224100 --> 1.223699).  Saving model ...
Validation loss decreased (1.223699 --> 1.223448).  Saving model ...
Validation loss decreased (1.223448 --> 1.223290).  Saving model ...
Validation loss decreased (1.223290 --> 1.222650).  Saving model ...
Validation loss decreased (1.222650 --> 1.222335).  Saving model ...
EarlyStopping counter: 1 out of 15.0
Validation loss decreased (1.222335 --> 1.222262).  Saving model ...
Validation loss decreased (1.222262 --> 1.222044).  Saving model ...
Validation loss decreased (1.222044 --> 1.221948).  Saving model ...
Validation loss decreased (1.221948 --> 1.221757).  Saving model ...
EarlyStopping counter: 1 out of 15.0
EarlyStopping counter: 2 out of 15.0
Validation loss decreased (1.221757 --> 1.221531).  Saving model ...
Validation loss decreased (1.221531 --> 1.221297).  Saving model ...
Validation loss decreased (1.221297 --> 1.221046).  Saving model ...
Validation loss decreased (1.221046 --> 1.220790).  Saving model ...
Validation loss decreased (1.220790 --> 1.220403).  Saving model ...
Validation loss decreased (1.220403 --> 1.220303).  Saving model ...
Validation loss decreased (1.220303 --> 1.219969).  Saving model ...
Validation loss decreased (1.219969 --> 1.219301).  Saving model ...
Validation loss decreased (1.219301 --> 1.218723).  Saving model ...
Validation loss decreased (1.218723 --> 1.218674).  Saving model ...
Validation loss decreased (1.218674 --> 1.218500).  Saving model ...
Validation loss decreased (1.218500 --> 1.218291).  Saving model ...
Validation loss decreased (1.218291 --> 1.217913).  Saving model ...
Validation loss decreased (1.217913 --> 1.217800).  Saving model ...
EarlyStopping counter: 1 out of 15.0
Validation loss decreased (1.217800 --> 1.217227).  Saving model ...
Validation loss decreased (1.217227 --> 1.216809).  Saving model ...
EarlyStopping counter: 1 out of 15.0
EarlyStopping counter: 2 out of 15.0
EarlyStopping counter: 3 out of 15.0
Validation loss decreased (1.216809 --> 1.216806).  Saving model ...
Validation loss decreased (1.216806 --> 1.216485).  Saving model ...
/localscratch/yinan.28698556.0/env/lib/python3.7/site-packages/torch/nn/functional.py:1794: UserWarning: nn.functional.tanh is deprecated. Use torch.tanh instead.
  warnings.warn("nn.functional.tanh is deprecated. Use torch.tanh instead.")
/localscratch/yinan.28698556.0/env/lib/python3.7/site-packages/transformers/optimization.py:155: UserWarning: This overload of add_ is deprecated:
	add_(Number alpha, Tensor other)
Consider using one of the following signatures instead:
	add_(Tensor other, *, Number alpha) (Triggered internally at  ../torch/csrc/utils/python_arg_parser.cpp:1025.)
  exp_avg.mul_(beta1).add_(1.0 - beta1, grad)
wandb: Waiting for W&B process to finish, PID 36276... (success).
wandb: - 0.00MB of 0.00MB uploaded (0.00MB deduped)wandb: \ 0.00MB of 0.00MB uploaded (0.00MB deduped)wandb: | 0.00MB of 0.00MB uploaded (0.00MB deduped)wandb: / 0.00MB of 0.00MB uploaded (0.00MB deduped)wandb: - 0.00MB of 0.00MB uploaded (0.00MB deduped)wandb: \ 0.00MB of 0.00MB uploaded (0.00MB deduped)wandb: | 0.00MB of 0.00MB uploaded (0.00MB deduped)wandb: / 0.00MB of 0.00MB uploaded (0.00MB deduped)wandb: - 0.00MB of 0.00MB uploaded (0.00MB deduped)wandb: \ 0.00MB of 0.00MB uploaded (0.00MB deduped)wandb: | 0.00MB of 0.00MB uploaded (0.00MB deduped)wandb: / 0.00MB of 0.00MB uploaded (0.00MB deduped)wandb: - 0.00MB of 0.00MB uploaded (0.00MB deduped)wandb: \ 0.00MB of 0.00MB uploaded (0.00MB deduped)wandb: | 0.00MB of 0.00MB uploaded (0.00MB deduped)wandb:                                                                                
wandb: Run history:
wandb:     e_F1 ▁▁▂▂▃▄▅▅▅▅▅▆▆▆▆▆▆▆▆▆▆▇▇▇▇▇▇▇▇▇▇▇████████
wandb:   e_loss █▇▇▆▆▆▅▅▅▅▅▅▄▄▄▄▄▄▃▃▃▃▃▃▃▂▂▂▂▂▂▂▂▂▁▁▁▁▁▁
wandb:     t_F1 ▁▁▂▂▃▂▃▃▃▃▄▅▅▅▅▅▆▆▆▆▆▆▆▆▆▇▇▇▆▆▇▇▇██▇▇█▇█
wandb:   t_loss ██▇▇▇▇▆▆▆▆▆▅▆▆▅▅▅▄▄▄▄▄▄▄▃▃▃▃▃▃▂▂▂▂▂▂▂▁▁▁
wandb: 
wandb: Run summary:
wandb:     e_F1 43.30702
wandb:   e_loss 1.21648
wandb:     t_F1 55.36287
wandb:   t_loss 1.10171
wandb: 
wandb: Synced 4 W&B file(s), 0 media file(s), 0 artifact file(s) and 0 other file(s)
wandb: Synced iconic-oath-1: https://wandb.ai/yinanazhou/xl_512_bs_8_lr_1e07_es_15_lc_True_nr_True_sr_True_stem_False_lemma_False_repeat_1_fold_1/runs/3m52sp2m
wandb: Find logs at: ./wandb/run-20220311_002930-3m52sp2m/logs/debug.log
wandb: 

wandb: wandb version 0.12.11 is available!  To upgrade, please run:
wandb:  $ pip install wandb --upgrade
2022-03-11 05:58:47.649528: I tensorflow/stream_executor/platform/default/dso_loader.cc:48] Successfully opened dynamic library libcudart.so.10.1
wandb: Tracking run with wandb version 0.12.5
wandb: Syncing run young-firefly-1
wandb: ⭐️ View project at https://wandb.ai/yinanazhou/xl_512_bs_8_lr_1e07_es_15_lc_True_nr_True_sr_True_stem_False_lemma_False_repeat_1_fold_2
wandb: 🚀 View run at https://wandb.ai/yinanazhou/xl_512_bs_8_lr_1e07_es_15_lc_True_nr_True_sr_True_stem_False_lemma_False_repeat_1_fold_2/runs/3qsd7kzk
wandb: Run data is saved locally in /project/6002780/yinan/Thesis_MER_Lyrics/lyric-emotion/wandb/run-20220311_055845-3qsd7kzk
wandb: Run `wandb offline` to turn off syncing.
slurmstepd: error: *** JOB 28698556 ON cdr2610 CANCELLED AT 2022-03-11T10:26:37 DUE TO TIME LIMIT ***
