Unloading StdEnv/2020

Due to MODULEPATH changes, the following have been reloaded:
  1) mii/1.1.1


The following have been reloaded with a version change:
  1) python/3.8.2 => python/3.7.4

Using base prefix '/cvmfs/soft.computecanada.ca/easybuild/software/2017/Core/python/3.7.4'
New python executable in /localscratch/yinan.28735477.0/env/bin/python
Installing setuptools, pip, wheel...
done.
Ignoring pip: markers 'python_version < "3"' don't match your environment
Looking in links: /cvmfs/soft.computecanada.ca/custom/python/wheelhouse/nix/avx2, /cvmfs/soft.computecanada.ca/custom/python/wheelhouse/nix/generic, /cvmfs/soft.computecanada.ca/custom/python/wheelhouse/generic
Collecting pip
Installing collected packages: pip
  Found existing installation: pip 19.1.1
    Uninstalling pip-19.1.1:
      Successfully uninstalled pip-19.1.1
Successfully installed pip-21.2.3+computecanada
Looking in links: /cvmfs/soft.computecanada.ca/custom/python/wheelhouse/nix/avx2, /cvmfs/soft.computecanada.ca/custom/python/wheelhouse/nix/generic, /cvmfs/soft.computecanada.ca/custom/python/wheelhouse/generic
Processing /cvmfs/soft.computecanada.ca/custom/python/wheelhouse/generic/keras-2.8.0+computecanada-py2.py3-none-any.whl
Processing /cvmfs/soft.computecanada.ca/custom/python/wheelhouse/generic/Keras_Preprocessing-1.1.2+computecanada-py3-none-any.whl
Requirement already satisfied: matplotlib in /cvmfs/soft.computecanada.ca/easybuild/software/2017/Core/scipy-stack/2019a/lib/python3.7/site-packages (from -r requirements.txt (line 3)) (3.0.2)
Processing /cvmfs/soft.computecanada.ca/custom/python/wheelhouse/generic/nltk-3.6.5+computecanada-py3-none-any.whl
Processing /cvmfs/soft.computecanada.ca/custom/python/wheelhouse/generic/scikit_learn-0.22.1+computecanada-cp37-cp37m-linux_x86_64.whl
Processing /cvmfs/soft.computecanada.ca/custom/python/wheelhouse/generic/tensorboard-2.3.0+computecanada-py3-none-any.whl
Processing /cvmfs/soft.computecanada.ca/custom/python/wheelhouse/generic/tensorboard_plugin_wit-1.7.0+computecanada-py3-none-any.whl
Processing /cvmfs/soft.computecanada.ca/custom/python/wheelhouse/generic/tensorflow_gpu-2.3.0+computecanada-cp37-cp37m-linux_x86_64.whl
Processing /cvmfs/soft.computecanada.ca/custom/python/wheelhouse/generic/tensorflow_estimator-2.3.0+computecanada-py2.py3-none-any.whl
Processing /cvmfs/soft.computecanada.ca/custom/python/wheelhouse/generic/tokenizers-0.5.2+computecanada-cp37-cp37m-linux_x86_64.whl
Processing /cvmfs/soft.computecanada.ca/custom/python/wheelhouse/nix/avx2/torch-1.4.0+computecanada-cp37-cp37m-linux_x86_64.whl
Processing /cvmfs/soft.computecanada.ca/custom/python/wheelhouse/generic/torchtext-0.6.0+computecanada-py3-none-any.whl
Processing /cvmfs/soft.computecanada.ca/custom/python/wheelhouse/generic/torchvision-0.8.2+computecanada-cp37-cp37m-linux_x86_64.whl
Processing /cvmfs/soft.computecanada.ca/custom/python/wheelhouse/generic/transformers-2.5.1+computecanada-py3-none-any.whl
Processing /cvmfs/soft.computecanada.ca/custom/python/wheelhouse/generic/urllib3-1.26.7+computecanada-py2.py3-none-any.whl
Processing /cvmfs/soft.computecanada.ca/custom/python/wheelhouse/generic/click-8.0.3+computecanada-py3-none-any.whl
ERROR: Could not find a version that satisfies the requirement regex>=2021.8.3 (from nltk) (from versions: 2018.1.10+computecanada, 2019.11.1+computecanada, 2020.11.13+computecanada)
ERROR: No matching distribution found for regex>=2021.8.3
Looking in links: /cvmfs/soft.computecanada.ca/custom/python/wheelhouse/nix/avx2, /cvmfs/soft.computecanada.ca/custom/python/wheelhouse/nix/generic, /cvmfs/soft.computecanada.ca/custom/python/wheelhouse/generic
ERROR: Could not find a version that satisfies the requirement numpy==1.20.0+computacanada (from versions: 1.15.0+computecanada, 1.15.2+computecanada, 1.15.4+computecanada, 1.16.0+computecanada, 1.16.2+computecanada, 1.16.3+computecanada, 1.17.4+computecanada, 1.18.1+computecanada, 1.18.4+computecanada, 1.19.1+computecanada, 1.19.2+computecanada, 1.20.2+computecanada)
ERROR: No matching distribution found for numpy==1.20.0+computacanada
Looking in links: /cvmfs/soft.computecanada.ca/custom/python/wheelhouse/nix/avx2, /cvmfs/soft.computecanada.ca/custom/python/wheelhouse/nix/generic, /cvmfs/soft.computecanada.ca/custom/python/wheelhouse/generic
Processing /cvmfs/soft.computecanada.ca/custom/python/wheelhouse/generic/wandb-0.12.5+computecanada-py2.py3-none-any.whl
Processing /cvmfs/soft.computecanada.ca/custom/python/wheelhouse/generic/protobuf-3.19.4+computecanada-py2.py3-none-any.whl
Requirement already satisfied: python-dateutil>=2.6.1 in /cvmfs/soft.computecanada.ca/easybuild/software/2017/Core/scipy-stack/2019a/lib/python3.7/site-packages (from wandb) (2.7.5)
Processing /cvmfs/soft.computecanada.ca/custom/python/wheelhouse/generic/promise-2.3+computecanada-py3-none-any.whl
Processing /cvmfs/soft.computecanada.ca/custom/python/wheelhouse/generic/pathtools-0.1.2+computecanada-py3-none-any.whl
Processing /cvmfs/soft.computecanada.ca/custom/python/wheelhouse/generic/psutil-5.7.3+computecanada-cp37-cp37m-linux_x86_64.whl
Processing /cvmfs/soft.computecanada.ca/custom/python/wheelhouse/generic/sentry_sdk-1.5.0+computecanada-py2.py3-none-any.whl
Processing /cvmfs/soft.computecanada.ca/custom/python/wheelhouse/generic/PyYAML-5.3.1+computecanada-cp37-cp37m-linux_x86_64.whl
Requirement already satisfied: requests<3,>=2.0.0 in /cvmfs/soft.computecanada.ca/easybuild/software/2017/Core/scipy-stack/2019a/lib/python3.7/site-packages (from wandb) (2.21.0)
Processing /cvmfs/soft.computecanada.ca/custom/python/wheelhouse/generic/shortuuid-1.0.1+computecanada-py3-none-any.whl
Processing /cvmfs/soft.computecanada.ca/custom/python/wheelhouse/generic/six-1.16.0+computecanada-py2.py3-none-any.whl
Processing /cvmfs/soft.computecanada.ca/custom/python/wheelhouse/generic/configparser-5.0.2+computecanada-py3-none-any.whl
Processing /cvmfs/soft.computecanada.ca/custom/python/wheelhouse/generic/docker_pycreds-0.4.0+computecanada-py2.py3-none-any.whl
Processing /cvmfs/soft.computecanada.ca/custom/python/wheelhouse/generic/subprocess32-3.5.4+computecanada-py3-none-any.whl
Processing /cvmfs/soft.computecanada.ca/custom/python/wheelhouse/generic/click-8.0.3+computecanada-py3-none-any.whl
Processing /cvmfs/soft.computecanada.ca/custom/python/wheelhouse/generic/yaspin-2.1.0+computecanada-py3-none-any.whl
Processing /cvmfs/soft.computecanada.ca/custom/python/wheelhouse/generic/GitPython-3.1.24+computecanada-py3-none-any.whl
Requirement already satisfied: importlib-metadata in /cvmfs/soft.computecanada.ca/easybuild/software/2017/Core/scipy-stack/2019a/lib/python3.7/site-packages (from Click!=8.0.0,>=7.0->wandb) (0.8)
Processing /cvmfs/soft.computecanada.ca/custom/python/wheelhouse/generic/typing_extensions-4.0.1+computecanada-py3-none-any.whl
Processing /cvmfs/soft.computecanada.ca/custom/python/wheelhouse/generic/gitdb-4.0.9+computecanada-py3-none-any.whl
Processing /cvmfs/soft.computecanada.ca/custom/python/wheelhouse/generic/smmap-5.0.0+computecanada-py3-none-any.whl
Requirement already satisfied: urllib3<1.25,>=1.21.1 in /cvmfs/soft.computecanada.ca/easybuild/software/2017/Core/scipy-stack/2019a/lib/python3.7/site-packages (from requests<3,>=2.0.0->wandb) (1.24.1)
Requirement already satisfied: certifi>=2017.4.17 in /cvmfs/soft.computecanada.ca/easybuild/software/2017/Core/scipy-stack/2019a/lib/python3.7/site-packages (from requests<3,>=2.0.0->wandb) (2018.11.29)
Requirement already satisfied: chardet<3.1.0,>=3.0.2 in /cvmfs/soft.computecanada.ca/easybuild/software/2017/Core/scipy-stack/2019a/lib/python3.7/site-packages (from requests<3,>=2.0.0->wandb) (3.0.4)
Requirement already satisfied: idna<2.9,>=2.5 in /cvmfs/soft.computecanada.ca/easybuild/software/2017/Core/scipy-stack/2019a/lib/python3.7/site-packages (from requests<3,>=2.0.0->wandb) (2.8)
Processing /cvmfs/soft.computecanada.ca/custom/python/wheelhouse/generic/termcolor-1.1.0+computecanada-py3-none-any.whl
Requirement already satisfied: zipp>=0.3.2 in /cvmfs/soft.computecanada.ca/easybuild/software/2017/Core/scipy-stack/2019a/lib/python3.7/site-packages (from importlib-metadata->Click!=8.0.0,>=7.0->wandb) (0.3.3)
Installing collected packages: smmap, typing-extensions, termcolor, six, gitdb, yaspin, subprocess32, shortuuid, sentry-sdk, PyYAML, psutil, protobuf, promise, pathtools, GitPython, docker-pycreds, configparser, Click, wandb
  Attempting uninstall: six
    Found existing installation: six 1.12.0
    Not uninstalling six at /cvmfs/soft.computecanada.ca/easybuild/software/2017/Core/scipy-stack/2019a/lib/python3.7/site-packages, outside environment /localscratch/yinan.28735477.0/env
    Can't uninstall 'six'. No files were found to uninstall.
Successfully installed Click-8.0.3+computecanada GitPython-3.1.24+computecanada PyYAML-5.3.1+computecanada configparser-5.0.2+computecanada docker-pycreds-0.4.0+computecanada gitdb-4.0.9+computecanada pathtools-0.1.2+computecanada promise-2.3+computecanada protobuf-3.19.4+computecanada psutil-5.7.3+computecanada sentry-sdk-1.5.0+computecanada shortuuid-1.0.1+computecanada six-1.16.0+computecanada smmap-5.0.0+computecanada subprocess32-3.5.4+computecanada termcolor-1.1.0+computecanada typing-extensions-4.0.1+computecanada wandb-0.12.5+computecanada yaspin-2.1.0+computecanada
Looking in links: /cvmfs/soft.computecanada.ca/custom/python/wheelhouse/nix/avx2, /cvmfs/soft.computecanada.ca/custom/python/wheelhouse/nix/generic, /cvmfs/soft.computecanada.ca/custom/python/wheelhouse/generic
ERROR: Could not find a version that satisfies the requirement sagemaker (from versions: none)
ERROR: No matching distribution found for sagemaker
Looking in links: /cvmfs/soft.computecanada.ca/custom/python/wheelhouse/nix/avx2, /cvmfs/soft.computecanada.ca/custom/python/wheelhouse/nix/generic, /cvmfs/soft.computecanada.ca/custom/python/wheelhouse/generic
Processing /cvmfs/soft.computecanada.ca/custom/python/wheelhouse/generic/torch-1.9.1+computecanada-cp37-cp37m-linux_x86_64.whl
Requirement already satisfied: typing-extensions in /localscratch/yinan.28735477.0/env/lib/python3.7/site-packages (from torch) (4.0.1+computecanada)
Installing collected packages: torch
Successfully installed torch-1.9.1+computecanada
Looking in links: /cvmfs/soft.computecanada.ca/custom/python/wheelhouse/nix/avx2, /cvmfs/soft.computecanada.ca/custom/python/wheelhouse/nix/generic, /cvmfs/soft.computecanada.ca/custom/python/wheelhouse/generic
Processing /cvmfs/soft.computecanada.ca/custom/python/wheelhouse/generic/transformers-2.5.1+computecanada-py3-none-any.whl
Requirement already satisfied: numpy in /cvmfs/soft.computecanada.ca/easybuild/software/2017/Core/scipy-stack/2019a/lib/python3.7/site-packages (from transformers==2.5.1+computecanada) (1.16.0)
Processing /cvmfs/soft.computecanada.ca/custom/python/wheelhouse/generic/filelock-3.4.2+computecanada-py3-none-any.whl
Processing /cvmfs/soft.computecanada.ca/custom/python/wheelhouse/generic/regex-2020.11.13+computecanada-cp37-cp37m-linux_x86_64.whl
Processing /cvmfs/soft.computecanada.ca/custom/python/wheelhouse/generic/boto3-1.20.52+computecanada-py3-none-any.whl
Processing /cvmfs/soft.computecanada.ca/custom/python/wheelhouse/generic/tokenizers-0.5.2+computecanada-cp37-cp37m-linux_x86_64.whl
Processing /cvmfs/soft.computecanada.ca/custom/python/wheelhouse/generic/tqdm-4.63.0+computecanada-py2.py3-none-any.whl
Requirement already satisfied: requests in /cvmfs/soft.computecanada.ca/easybuild/software/2017/Core/scipy-stack/2019a/lib/python3.7/site-packages (from transformers==2.5.1+computecanada) (2.21.0)
Processing /cvmfs/soft.computecanada.ca/custom/python/wheelhouse/generic/sacremoses-0.0.46+computecanada-py3-none-any.whl
Processing /cvmfs/soft.computecanada.ca/custom/python/wheelhouse/generic/sentencepiece-0.1.91+computecanada-cp37-cp37m-linux_x86_64.whl
Processing /cvmfs/soft.computecanada.ca/custom/python/wheelhouse/generic/botocore-1.23.52+computecanada-py3-none-any.whl
Processing /cvmfs/soft.computecanada.ca/custom/python/wheelhouse/generic/jmespath-0.10.0+computecanada-py2.py3-none-any.whl
Processing /cvmfs/soft.computecanada.ca/custom/python/wheelhouse/generic/s3transfer-0.5.1+computecanada-py3-none-any.whl
Processing /cvmfs/soft.computecanada.ca/custom/python/wheelhouse/generic/urllib3-1.26.8+computecanada-py2.py3-none-any.whl
Requirement already satisfied: python-dateutil<3.0.0,>=2.1 in /cvmfs/soft.computecanada.ca/easybuild/software/2017/Core/scipy-stack/2019a/lib/python3.7/site-packages (from botocore<1.24.0,>=1.23.52->boto3->transformers==2.5.1+computecanada) (2.7.5)
Requirement already satisfied: six>=1.5 in /localscratch/yinan.28735477.0/env/lib/python3.7/site-packages (from python-dateutil<3.0.0,>=2.1->botocore<1.24.0,>=1.23.52->boto3->transformers==2.5.1+computecanada) (1.16.0+computecanada)
Processing /cvmfs/soft.computecanada.ca/custom/python/wheelhouse/generic/requests-2.27.1+computecanada-py2.py3-none-any.whl
Requirement already satisfied: idna<4,>=2.5 in /cvmfs/soft.computecanada.ca/easybuild/software/2017/Core/scipy-stack/2019a/lib/python3.7/site-packages (from requests->transformers==2.5.1+computecanada) (2.8)
Requirement already satisfied: certifi>=2017.4.17 in /cvmfs/soft.computecanada.ca/easybuild/software/2017/Core/scipy-stack/2019a/lib/python3.7/site-packages (from requests->transformers==2.5.1+computecanada) (2018.11.29)
Processing /cvmfs/soft.computecanada.ca/custom/python/wheelhouse/generic/charset_normalizer-2.0.11+computecanada-py3-none-any.whl
Requirement already satisfied: click in /localscratch/yinan.28735477.0/env/lib/python3.7/site-packages (from sacremoses->transformers==2.5.1+computecanada) (8.0.3+computecanada)
Processing /cvmfs/soft.computecanada.ca/custom/python/wheelhouse/generic/joblib-1.1.0+computecanada-py2.py3-none-any.whl
Requirement already satisfied: importlib-metadata in /cvmfs/soft.computecanada.ca/easybuild/software/2017/Core/scipy-stack/2019a/lib/python3.7/site-packages (from click->sacremoses->transformers==2.5.1+computecanada) (0.8)
Requirement already satisfied: zipp>=0.3.2 in /cvmfs/soft.computecanada.ca/easybuild/software/2017/Core/scipy-stack/2019a/lib/python3.7/site-packages (from importlib-metadata->click->sacremoses->transformers==2.5.1+computecanada) (0.3.3)
Installing collected packages: urllib3, jmespath, botocore, tqdm, s3transfer, regex, joblib, charset-normalizer, tokenizers, sentencepiece, sacremoses, requests, filelock, boto3, transformers
  Attempting uninstall: urllib3
    Found existing installation: urllib3 1.24.1
    Not uninstalling urllib3 at /cvmfs/soft.computecanada.ca/easybuild/software/2017/Core/scipy-stack/2019a/lib/python3.7/site-packages, outside environment /localscratch/yinan.28735477.0/env
    Can't uninstall 'urllib3'. No files were found to uninstall.
  Attempting uninstall: requests
    Found existing installation: requests 2.21.0
    Not uninstalling requests at /cvmfs/soft.computecanada.ca/easybuild/software/2017/Core/scipy-stack/2019a/lib/python3.7/site-packages, outside environment /localscratch/yinan.28735477.0/env
    Can't uninstall 'requests'. No files were found to uninstall.
Successfully installed boto3-1.20.52+computecanada botocore-1.23.52+computecanada charset-normalizer-2.0.11+computecanada filelock-3.4.2+computecanada jmespath-0.10.0+computecanada joblib-1.1.0+computecanada regex-2020.11.13+computecanada requests-2.27.1+computecanada s3transfer-0.5.1+computecanada sacremoses-0.0.46+computecanada sentencepiece-0.1.91+computecanada tokenizers-0.5.2+computecanada tqdm-4.63.0+computecanada transformers-2.5.1+computecanada urllib3-1.26.8+computecanada
Looking in links: /cvmfs/soft.computecanada.ca/custom/python/wheelhouse/nix/avx2, /cvmfs/soft.computecanada.ca/custom/python/wheelhouse/nix/generic, /cvmfs/soft.computecanada.ca/custom/python/wheelhouse/generic
Processing /cvmfs/soft.computecanada.ca/custom/python/wheelhouse/generic/tensorflow_gpu-2.3.0+computecanada-cp37-cp37m-linux_x86_64.whl
Processing /cvmfs/soft.computecanada.ca/custom/python/wheelhouse/generic/absl_py-1.0.0+computecanada-py3-none-any.whl
Processing /cvmfs/soft.computecanada.ca/custom/python/wheelhouse/nix/generic/scipy-1.4.1+computecanada-cp37-cp37m-linux_x86_64.whl
Requirement already satisfied: protobuf>=3.9.2 in /localscratch/yinan.28735477.0/env/lib/python3.7/site-packages (from tensorflow_gpu==2.3.0+computecanada) (3.19.4+computecanada)
Processing /cvmfs/soft.computecanada.ca/custom/python/wheelhouse/generic/gast-0.3.3+computecanada-py3-none-any.whl
Processing /cvmfs/soft.computecanada.ca/custom/python/wheelhouse/generic/tensorflow_estimator-2.3.0+computecanada-py2.py3-none-any.whl
Requirement already satisfied: six>=1.12.0 in /localscratch/yinan.28735477.0/env/lib/python3.7/site-packages (from tensorflow_gpu==2.3.0+computecanada) (1.16.0+computecanada)
Processing /cvmfs/soft.computecanada.ca/custom/python/wheelhouse/generic/grpcio-1.38.0+computecanada-cp37-cp37m-linux_x86_64.whl
Processing /cvmfs/soft.computecanada.ca/custom/python/wheelhouse/nix/avx2/h5py-2.10.0+computecanada-cp37-cp37m-linux_x86_64.whl
Processing /cvmfs/soft.computecanada.ca/custom/python/wheelhouse/generic/opt_einsum-3.3.0+computecanada-py3-none-any.whl
Processing /cvmfs/soft.computecanada.ca/custom/python/wheelhouse/generic/wrapt-1.11.2+computecanada-cp37-cp37m-linux_x86_64.whl
Requirement already satisfied: termcolor>=1.1.0 in /localscratch/yinan.28735477.0/env/lib/python3.7/site-packages (from tensorflow_gpu==2.3.0+computecanada) (1.1.0+computecanada)
Requirement already satisfied: numpy<1.19.0,>=1.16.0 in /cvmfs/soft.computecanada.ca/easybuild/software/2017/Core/scipy-stack/2019a/lib/python3.7/site-packages (from tensorflow_gpu==2.3.0+computecanada) (1.16.0)
Requirement already satisfied: wheel>=0.26 in /localscratch/yinan.28735477.0/env/lib/python3.7/site-packages (from tensorflow_gpu==2.3.0+computecanada) (0.33.4)
Processing /cvmfs/soft.computecanada.ca/custom/python/wheelhouse/generic/google_pasta-0.2.0+computecanada-py3-none-any.whl
Processing /cvmfs/soft.computecanada.ca/custom/python/wheelhouse/generic/astunparse-1.6.3+computecanada-py2.py3-none-any.whl
Processing /cvmfs/soft.computecanada.ca/custom/python/wheelhouse/generic/Keras_Preprocessing-1.1.2+computecanada-py3-none-any.whl
Processing /cvmfs/soft.computecanada.ca/custom/python/wheelhouse/generic/tensorboard-2.8.0+computecanada-py3-none-any.whl
Processing /cvmfs/soft.computecanada.ca/custom/python/wheelhouse/generic/Markdown-3.3.6+computecanada-py3-none-any.whl
Processing /cvmfs/soft.computecanada.ca/custom/python/wheelhouse/generic/tensorboard_plugin_wit-1.8.0+computecanada-py3-none-any.whl
Processing /cvmfs/soft.computecanada.ca/custom/python/wheelhouse/generic/Werkzeug-2.0.3+computecanada-py3-none-any.whl
Requirement already satisfied: requests<3,>=2.21.0 in /localscratch/yinan.28735477.0/env/lib/python3.7/site-packages (from tensorboard<3,>=2.3.0->tensorflow_gpu==2.3.0+computecanada) (2.27.1+computecanada)
Processing /cvmfs/soft.computecanada.ca/custom/python/wheelhouse/generic/google_auth_oauthlib-0.4.6+computecanada-py2.py3-none-any.whl
Processing /cvmfs/soft.computecanada.ca/custom/python/wheelhouse/generic/google_auth-2.3.3+computecanada-py2.py3-none-any.whl
Requirement already satisfied: setuptools>=41.0.0 in /localscratch/yinan.28735477.0/env/lib/python3.7/site-packages (from tensorboard<3,>=2.3.0->tensorflow_gpu==2.3.0+computecanada) (41.0.1)
Processing /cvmfs/soft.computecanada.ca/custom/python/wheelhouse/generic/tensorboard_data_server-0.6.1+computecanada-py3-none-linux_x86_64.whl
Processing /cvmfs/soft.computecanada.ca/custom/python/wheelhouse/generic/pyasn1_modules-0.2.8+computecanada-py2.py3-none-any.whl
Processing /cvmfs/soft.computecanada.ca/custom/python/wheelhouse/generic/cachetools-4.2.4+computecanada-py3-none-any.whl
Processing /cvmfs/soft.computecanada.ca/custom/python/wheelhouse/generic/rsa-4.8+computecanada-py3-none-any.whl
Processing /cvmfs/soft.computecanada.ca/custom/python/wheelhouse/generic/requests_oauthlib-1.3.0+computecanada-py2.py3-none-any.whl
Processing /cvmfs/soft.computecanada.ca/custom/python/wheelhouse/generic/importlib_metadata-4.10.1+computecanada-py3-none-any.whl
Requirement already satisfied: typing-extensions>=3.6.4 in /localscratch/yinan.28735477.0/env/lib/python3.7/site-packages (from importlib-metadata>=4.4->markdown>=2.6.8->tensorboard<3,>=2.3.0->tensorflow_gpu==2.3.0+computecanada) (4.0.1+computecanada)
Processing /cvmfs/soft.computecanada.ca/custom/python/wheelhouse/generic/zipp-3.7.0+computecanada-py3-none-any.whl
Processing /cvmfs/soft.computecanada.ca/custom/python/wheelhouse/generic/pyasn1-0.4.8+computecanada-py2.py3-none-any.whl
Requirement already satisfied: idna<4,>=2.5 in /cvmfs/soft.computecanada.ca/easybuild/software/2017/Core/scipy-stack/2019a/lib/python3.7/site-packages (from requests<3,>=2.21.0->tensorboard<3,>=2.3.0->tensorflow_gpu==2.3.0+computecanada) (2.8)
Requirement already satisfied: urllib3<1.27,>=1.21.1 in /localscratch/yinan.28735477.0/env/lib/python3.7/site-packages (from requests<3,>=2.21.0->tensorboard<3,>=2.3.0->tensorflow_gpu==2.3.0+computecanada) (1.26.8+computecanada)
Requirement already satisfied: charset-normalizer~=2.0.0 in /localscratch/yinan.28735477.0/env/lib/python3.7/site-packages (from requests<3,>=2.21.0->tensorboard<3,>=2.3.0->tensorflow_gpu==2.3.0+computecanada) (2.0.11+computecanada)
Requirement already satisfied: certifi>=2017.4.17 in /cvmfs/soft.computecanada.ca/easybuild/software/2017/Core/scipy-stack/2019a/lib/python3.7/site-packages (from requests<3,>=2.21.0->tensorboard<3,>=2.3.0->tensorflow_gpu==2.3.0+computecanada) (2018.11.29)
Processing /cvmfs/soft.computecanada.ca/custom/python/wheelhouse/generic/oauthlib-3.1.1+computecanada-py2.py3-none-any.whl
Installing collected packages: pyasn1, zipp, rsa, pyasn1-modules, oauthlib, cachetools, requests-oauthlib, importlib-metadata, google-auth, werkzeug, tensorboard-plugin-wit, tensorboard-data-server, markdown, grpcio, google-auth-oauthlib, absl-py, wrapt, tensorflow-estimator, tensorboard, scipy, opt-einsum, keras-preprocessing, h5py, google-pasta, gast, astunparse, tensorflow-gpu
  Attempting uninstall: pyasn1
    Found existing installation: pyasn1 0.4.3
    Not uninstalling pyasn1 at /cvmfs/soft.computecanada.ca/easybuild/software/2017/Core/scipy-stack/2019a/lib/python3.7/site-packages, outside environment /localscratch/yinan.28735477.0/env
    Can't uninstall 'pyasn1'. No files were found to uninstall.
  Attempting uninstall: zipp
    Found existing installation: zipp 0.3.3
    Not uninstalling zipp at /cvmfs/soft.computecanada.ca/easybuild/software/2017/Core/scipy-stack/2019a/lib/python3.7/site-packages, outside environment /localscratch/yinan.28735477.0/env
    Can't uninstall 'zipp'. No files were found to uninstall.
  Attempting uninstall: importlib-metadata
    Found existing installation: importlib-metadata 0.8
    Not uninstalling importlib-metadata at /cvmfs/soft.computecanada.ca/easybuild/software/2017/Core/scipy-stack/2019a/lib/python3.7/site-packages, outside environment /localscratch/yinan.28735477.0/env
    Can't uninstall 'importlib-metadata'. No files were found to uninstall.
  Attempting uninstall: scipy
    Found existing installation: scipy 1.2.0
    Not uninstalling scipy at /cvmfs/soft.computecanada.ca/easybuild/software/2017/Core/scipy-stack/2019a/lib/python3.7/site-packages, outside environment /localscratch/yinan.28735477.0/env
    Can't uninstall 'scipy'. No files were found to uninstall.
Successfully installed absl-py-1.0.0+computecanada astunparse-1.6.3+computecanada cachetools-4.2.4+computecanada gast-0.3.3+computecanada google-auth-2.3.3+computecanada google-auth-oauthlib-0.4.6+computecanada google-pasta-0.2.0+computecanada grpcio-1.38.0+computecanada h5py-2.10.0+computecanada importlib-metadata-4.10.1+computecanada keras-preprocessing-1.1.2+computecanada markdown-3.3.6+computecanada oauthlib-3.1.1+computecanada opt-einsum-3.3.0+computecanada pyasn1-0.4.8+computecanada pyasn1-modules-0.2.8+computecanada requests-oauthlib-1.3.0+computecanada rsa-4.8+computecanada scipy-1.4.1+computecanada tensorboard-2.8.0+computecanada tensorboard-data-server-0.6.1+computecanada tensorboard-plugin-wit-1.8.0+computecanada tensorflow-estimator-2.3.0+computecanada tensorflow-gpu-2.3.0+computecanada werkzeug-2.0.3+computecanada wrapt-1.11.2+computecanada zipp-3.7.0+computecanada
Looking in links: /cvmfs/soft.computecanada.ca/custom/python/wheelhouse/nix/avx2, /cvmfs/soft.computecanada.ca/custom/python/wheelhouse/nix/generic, /cvmfs/soft.computecanada.ca/custom/python/wheelhouse/generic
Processing /cvmfs/soft.computecanada.ca/custom/python/wheelhouse/generic/keras-2.8.0+computecanada-py2.py3-none-any.whl
Installing collected packages: Keras
Successfully installed Keras-2.8.0+computecanada
Looking in links: /cvmfs/soft.computecanada.ca/custom/python/wheelhouse/nix/avx2, /cvmfs/soft.computecanada.ca/custom/python/wheelhouse/nix/generic, /cvmfs/soft.computecanada.ca/custom/python/wheelhouse/generic
Processing /cvmfs/soft.computecanada.ca/custom/python/wheelhouse/generic/urllib3-1.26.7+computecanada-py2.py3-none-any.whl
Installing collected packages: urllib3
  Attempting uninstall: urllib3
    Found existing installation: urllib3 1.26.8+computecanada
    Uninstalling urllib3-1.26.8+computecanada:
      Successfully uninstalled urllib3-1.26.8+computecanada
Successfully installed urllib3-1.26.7+computecanada
Looking in links: /cvmfs/soft.computecanada.ca/custom/python/wheelhouse/nix/avx2, /cvmfs/soft.computecanada.ca/custom/python/wheelhouse/nix/generic, /cvmfs/soft.computecanada.ca/custom/python/wheelhouse/generic
Processing /cvmfs/soft.computecanada.ca/custom/python/wheelhouse/generic/nltk-3.7+computecanada-py3-none-any.whl
Processing /cvmfs/soft.computecanada.ca/custom/python/wheelhouse/generic/nltk-3.6.5+computecanada-py3-none-any.whl
Processing /cvmfs/soft.computecanada.ca/custom/python/wheelhouse/generic/nltk-3.6.3+computecanada-py3-none-any.whl
Requirement already satisfied: regex in /localscratch/yinan.28735477.0/env/lib/python3.7/site-packages (from nltk) (2020.11.13+computecanada)
Requirement already satisfied: tqdm in /localscratch/yinan.28735477.0/env/lib/python3.7/site-packages (from nltk) (4.63.0+computecanada)
Requirement already satisfied: click in /localscratch/yinan.28735477.0/env/lib/python3.7/site-packages (from nltk) (8.0.3+computecanada)
Requirement already satisfied: joblib in /localscratch/yinan.28735477.0/env/lib/python3.7/site-packages (from nltk) (1.1.0+computecanada)
Requirement already satisfied: importlib-metadata in /localscratch/yinan.28735477.0/env/lib/python3.7/site-packages (from click->nltk) (4.10.1+computecanada)
Requirement already satisfied: typing-extensions>=3.6.4 in /localscratch/yinan.28735477.0/env/lib/python3.7/site-packages (from importlib-metadata->click->nltk) (4.0.1+computecanada)
Requirement already satisfied: zipp>=0.5 in /localscratch/yinan.28735477.0/env/lib/python3.7/site-packages (from importlib-metadata->click->nltk) (3.7.0+computecanada)
Installing collected packages: nltk
Successfully installed nltk-3.6.3+computecanada
Looking in links: /cvmfs/soft.computecanada.ca/custom/python/wheelhouse/nix/avx2, /cvmfs/soft.computecanada.ca/custom/python/wheelhouse/nix/generic, /cvmfs/soft.computecanada.ca/custom/python/wheelhouse/generic
Processing /cvmfs/soft.computecanada.ca/custom/python/wheelhouse/generic/scikit_learn-0.22.1+computecanada-cp37-cp37m-linux_x86_64.whl
Requirement already satisfied: scipy>=0.17.0 in /localscratch/yinan.28735477.0/env/lib/python3.7/site-packages (from scikit-learn==0.22.1) (1.4.1+computecanada)
Requirement already satisfied: joblib>=0.11 in /localscratch/yinan.28735477.0/env/lib/python3.7/site-packages (from scikit-learn==0.22.1) (1.1.0+computecanada)
Requirement already satisfied: numpy>=1.11.0 in /cvmfs/soft.computecanada.ca/easybuild/software/2017/Core/scipy-stack/2019a/lib/python3.7/site-packages (from scikit-learn==0.22.1) (1.16.0)
Installing collected packages: scikit-learn
Successfully installed scikit-learn-0.22.1+computecanada
Looking in links: /cvmfs/soft.computecanada.ca/custom/python/wheelhouse/nix/avx2, /cvmfs/soft.computecanada.ca/custom/python/wheelhouse/nix/generic, /cvmfs/soft.computecanada.ca/custom/python/wheelhouse/generic
Requirement already satisfied: tokenizers==0.5.2 in /localscratch/yinan.28735477.0/env/lib/python3.7/site-packages (0.5.2+computecanada)
wandb: Appending key for api.wandb.ai to your netrc file: /home/yinan/.netrc
Starting Task
2022-03-11 09:24:49.809979: I tensorflow/stream_executor/platform/default/dso_loader.cc:48] Successfully opened dynamic library libcudart.so.10.1
[nltk_data] Downloading package stopwords to /home/yinan/nltk_data...
[nltk_data]   Package stopwords is already up-to-date!
[nltk_data] Downloading package wordnet to /home/yinan/nltk_data...
[nltk_data]   Package wordnet is already up-to-date!
wandb: Currently logged in as: yinanazhou (use `wandb login --relogin` to force relogin)
wandb: wandb version 0.12.11 is available!  To upgrade, please run:
wandb:  $ pip install wandb --upgrade
2022-03-11 09:25:03.585971: I tensorflow/stream_executor/platform/default/dso_loader.cc:48] Successfully opened dynamic library libcudart.so.10.1
wandb: Tracking run with wandb version 0.12.5
wandb: Syncing run breezy-fire-1
wandb: ⭐️ View project at https://wandb.ai/yinanazhou/xl_512_bs_8_lr_1e07_es_10_lc_False_nr_True_sr_True_stem_False_lemma_True_repeat_1_fold_1
wandb: 🚀 View run at https://wandb.ai/yinanazhou/xl_512_bs_8_lr_1e07_es_10_lc_False_nr_True_sr_True_stem_False_lemma_True_repeat_1_fold_1/runs/k7nm2sp0
wandb: Run data is saved locally in /project/6002780/yinan/Thesis_MER_Lyrics/lyric-emotion/wandb/run-20220311_092500-k7nm2sp0
wandb: Run `wandb offline` to turn off syncing.

Validation loss decreased (inf --> 1.452458).  Saving model ...
Validation loss decreased (1.452458 --> 1.449778).  Saving model ...
Validation loss decreased (1.449778 --> 1.446994).  Saving model ...
Validation loss decreased (1.446994 --> 1.444182).  Saving model ...
Validation loss decreased (1.444182 --> 1.441579).  Saving model ...
Validation loss decreased (1.441579 --> 1.438991).  Saving model ...
Validation loss decreased (1.438991 --> 1.436544).  Saving model ...
Validation loss decreased (1.436544 --> 1.434257).  Saving model ...
Validation loss decreased (1.434257 --> 1.432038).  Saving model ...
Validation loss decreased (1.432038 --> 1.429741).  Saving model ...
Validation loss decreased (1.429741 --> 1.427444).  Saving model ...
Validation loss decreased (1.427444 --> 1.425333).  Saving model ...
Validation loss decreased (1.425333 --> 1.423187).  Saving model ...
Validation loss decreased (1.423187 --> 1.421105).  Saving model ...
Validation loss decreased (1.421105 --> 1.419153).  Saving model ...
Validation loss decreased (1.419153 --> 1.417194).  Saving model ...
Validation loss decreased (1.417194 --> 1.415246).  Saving model ...
Validation loss decreased (1.415246 --> 1.413291).  Saving model ...
Validation loss decreased (1.413291 --> 1.411521).  Saving model ...
Validation loss decreased (1.411521 --> 1.409796).  Saving model ...
Validation loss decreased (1.409796 --> 1.408059).  Saving model ...
Validation loss decreased (1.408059 --> 1.406400).  Saving model ...
Validation loss decreased (1.406400 --> 1.404771).  Saving model ...
Validation loss decreased (1.404771 --> 1.403298).  Saving model ...
Validation loss decreased (1.403298 --> 1.401741).  Saving model ...
Validation loss decreased (1.401741 --> 1.400267).  Saving model ...
Validation loss decreased (1.400267 --> 1.398775).  Saving model ...
Validation loss decreased (1.398775 --> 1.397274).  Saving model ...
Validation loss decreased (1.397274 --> 1.395898).  Saving model ...
Validation loss decreased (1.395898 --> 1.394533).  Saving model ...
Validation loss decreased (1.394533 --> 1.393209).  Saving model ...
Validation loss decreased (1.393209 --> 1.391840).  Saving model ...
Validation loss decreased (1.391840 --> 1.390629).  Saving model ...
Validation loss decreased (1.390629 --> 1.389390).  Saving model ...
Validation loss decreased (1.389390 --> 1.388220).  Saving model ...
Validation loss decreased (1.388220 --> 1.386926).  Saving model ...
Validation loss decreased (1.386926 --> 1.385776).  Saving model ...
Validation loss decreased (1.385776 --> 1.384763).  Saving model ...
Validation loss decreased (1.384763 --> 1.383622).  Saving model ...
Validation loss decreased (1.383622 --> 1.382508).  Saving model ...
Validation loss decreased (1.382508 --> 1.381450).  Saving model ...
Validation loss decreased (1.381450 --> 1.380362).  Saving model ...
Validation loss decreased (1.380362 --> 1.379334).  Saving model ...
Validation loss decreased (1.379334 --> 1.378320).  Saving model ...
Validation loss decreased (1.378320 --> 1.377157).  Saving model ...
Validation loss decreased (1.377157 --> 1.376204).  Saving model ...
Validation loss decreased (1.376204 --> 1.375247).  Saving model ...
Validation loss decreased (1.375247 --> 1.374274).  Saving model ...
Validation loss decreased (1.374274 --> 1.373421).  Saving model ...
Validation loss decreased (1.373421 --> 1.372543).  Saving model ...
Validation loss decreased (1.372543 --> 1.371746).  Saving model ...
Validation loss decreased (1.371746 --> 1.370896).  Saving model ...
Validation loss decreased (1.370896 --> 1.369991).  Saving model ...
Validation loss decreased (1.369991 --> 1.369081).  Saving model ...
Validation loss decreased (1.369081 --> 1.368306).  Saving model ...
Validation loss decreased (1.368306 --> 1.367516).  Saving model ...
Validation loss decreased (1.367516 --> 1.366648).  Saving model ...
Validation loss decreased (1.366648 --> 1.365848).  Saving model ...
Validation loss decreased (1.365848 --> 1.364993).  Saving model ...
Validation loss decreased (1.364993 --> 1.364274).  Saving model ...
Validation loss decreased (1.364274 --> 1.363500).  Saving model ...
Validation loss decreased (1.363500 --> 1.362720).  Saving model ...
Validation loss decreased (1.362720 --> 1.361937).  Saving model ...
Validation loss decreased (1.361937 --> 1.361143).  Saving model ...
Validation loss decreased (1.361143 --> 1.360459).  Saving model ...
Validation loss decreased (1.360459 --> 1.359639).  Saving model ...
Validation loss decreased (1.359639 --> 1.358973).  Saving model ...
Validation loss decreased (1.358973 --> 1.358313).  Saving model ...
Validation loss decreased (1.358313 --> 1.357629).  Saving model ...
Validation loss decreased (1.357629 --> 1.356984).  Saving model ...
Validation loss decreased (1.356984 --> 1.356329).  Saving model ...
Validation loss decreased (1.356329 --> 1.355612).  Saving model ...
Validation loss decreased (1.355612 --> 1.354943).  Saving model ...
Validation loss decreased (1.354943 --> 1.354315).  Saving model ...
Validation loss decreased (1.354315 --> 1.353651).  Saving model ...
Validation loss decreased (1.353651 --> 1.353056).  Saving model ...
Validation loss decreased (1.353056 --> 1.352431).  Saving model ...
Validation loss decreased (1.352431 --> 1.351783).  Saving model ...
Validation loss decreased (1.351783 --> 1.351145).  Saving model ...
Validation loss decreased (1.351145 --> 1.350556).  Saving model ...
Validation loss decreased (1.350556 --> 1.349991).  Saving model ...
Validation loss decreased (1.349991 --> 1.349365).  Saving model ...
Validation loss decreased (1.349365 --> 1.348744).  Saving model ...
Validation loss decreased (1.348744 --> 1.348187).  Saving model ...
Validation loss decreased (1.348187 --> 1.347610).  Saving model ...
Validation loss decreased (1.347610 --> 1.346971).  Saving model ...
Validation loss decreased (1.346971 --> 1.346365).  Saving model ...
Validation loss decreased (1.346365 --> 1.345692).  Saving model ...
Validation loss decreased (1.345692 --> 1.345088).  Saving model ...
Validation loss decreased (1.345088 --> 1.344539).  Saving model ...
Validation loss decreased (1.344539 --> 1.343933).  Saving model ...
Validation loss decreased (1.343933 --> 1.343309).  Saving model ...
Validation loss decreased (1.343309 --> 1.342701).  Saving model ...
Validation loss decreased (1.342701 --> 1.342105).  Saving model ...
Validation loss decreased (1.342105 --> 1.341433).  Saving model ...
Validation loss decreased (1.341433 --> 1.340878).  Saving model ...
Validation loss decreased (1.340878 --> 1.340297).  Saving model ...
Validation loss decreased (1.340297 --> 1.339659).  Saving model ...
Validation loss decreased (1.339659 --> 1.339048).  Saving model ...
Validation loss decreased (1.339048 --> 1.338500).  Saving model ...
Validation loss decreased (1.338500 --> 1.337910).  Saving model ...
Validation loss decreased (1.337910 --> 1.337288).  Saving model ...
Validation loss decreased (1.337288 --> 1.336708).  Saving model ...
Validation loss decreased (1.336708 --> 1.336165).  Saving model ...
Validation loss decreased (1.336165 --> 1.335506).  Saving model ...
Validation loss decreased (1.335506 --> 1.334946).  Saving model ...
Validation loss decreased (1.334946 --> 1.334341).  Saving model ...
Validation loss decreased (1.334341 --> 1.333755).  Saving model ...
Validation loss decreased (1.333755 --> 1.333090).  Saving model ...
Validation loss decreased (1.333090 --> 1.332498).  Saving model ...
Validation loss decreased (1.332498 --> 1.331902).  Saving model ...
Validation loss decreased (1.331902 --> 1.331276).  Saving model ...
Validation loss decreased (1.331276 --> 1.330705).  Saving model ...
Validation loss decreased (1.330705 --> 1.330143).  Saving model ...
Validation loss decreased (1.330143 --> 1.329507).  Saving model ...
Validation loss decreased (1.329507 --> 1.328926).  Saving model ...
Validation loss decreased (1.328926 --> 1.328326).  Saving model ...
Validation loss decreased (1.328326 --> 1.327723).  Saving model ...
Validation loss decreased (1.327723 --> 1.327068).  Saving model ...
Validation loss decreased (1.327068 --> 1.326441).  Saving model ...
Validation loss decreased (1.326441 --> 1.325822).  Saving model ...
Validation loss decreased (1.325822 --> 1.325219).  Saving model ...
Validation loss decreased (1.325219 --> 1.324647).  Saving model ...
Validation loss decreased (1.324647 --> 1.323965).  Saving model ...
Validation loss decreased (1.323965 --> 1.323414).  Saving model ...
Validation loss decreased (1.323414 --> 1.322755).  Saving model ...
Validation loss decreased (1.322755 --> 1.322101).  Saving model ...
Validation loss decreased (1.322101 --> 1.321462).  Saving model ...
Validation loss decreased (1.321462 --> 1.320876).  Saving model ...
Validation loss decreased (1.320876 --> 1.320278).  Saving model ...
Validation loss decreased (1.320278 --> 1.319632).  Saving model ...
Validation loss decreased (1.319632 --> 1.319008).  Saving model ...
Validation loss decreased (1.319008 --> 1.318387).  Saving model ...
Validation loss decreased (1.318387 --> 1.317763).  Saving model ...
Validation loss decreased (1.317763 --> 1.317133).  Saving model ...
Validation loss decreased (1.317133 --> 1.316526).  Saving model ...
Validation loss decreased (1.316526 --> 1.315917).  Saving model ...
Validation loss decreased (1.315917 --> 1.315252).  Saving model ...
Validation loss decreased (1.315252 --> 1.314612).  Saving model ...
Validation loss decreased (1.314612 --> 1.314057).  Saving model ...
Validation loss decreased (1.314057 --> 1.313434).  Saving model ...
Validation loss decreased (1.313434 --> 1.312796).  Saving model ...
Validation loss decreased (1.312796 --> 1.312240).  Saving model ...
Validation loss decreased (1.312240 --> 1.311589).  Saving model ...
Validation loss decreased (1.311589 --> 1.310904).  Saving model ...
Validation loss decreased (1.310904 --> 1.310233).  Saving model ...
Validation loss decreased (1.310233 --> 1.309532).  Saving model ...
Validation loss decreased (1.309532 --> 1.308802).  Saving model ...
Validation loss decreased (1.308802 --> 1.308116).  Saving model ...
Validation loss decreased (1.308116 --> 1.307397).  Saving model ...
Validation loss decreased (1.307397 --> 1.306809).  Saving model ...
Validation loss decreased (1.306809 --> 1.306223).  Saving model ...
Validation loss decreased (1.306223 --> 1.305535).  Saving model ...
Validation loss decreased (1.305535 --> 1.304974).  Saving model ...
Validation loss decreased (1.304974 --> 1.304393).  Saving model ...
Validation loss decreased (1.304393 --> 1.303842).  Saving model ...
Validation loss decreased (1.303842 --> 1.303201).  Saving model ...
Validation loss decreased (1.303201 --> 1.302612).  Saving model ...
Validation loss decreased (1.302612 --> 1.301925).  Saving model ...
Validation loss decreased (1.301925 --> 1.301237).  Saving model ...
Validation loss decreased (1.301237 --> 1.300538).  Saving model ...
Validation loss decreased (1.300538 --> 1.299886).  Saving model ...
Validation loss decreased (1.299886 --> 1.299301).  Saving model ...
Validation loss decreased (1.299301 --> 1.298589).  Saving model ...
Validation loss decreased (1.298589 --> 1.297793).  Saving model ...
Validation loss decreased (1.297793 --> 1.297156).  Saving model ...
Validation loss decreased (1.297156 --> 1.296492).  Saving model ...
Validation loss decreased (1.296492 --> 1.295811).  Saving model ...
Validation loss decreased (1.295811 --> 1.295264).  Saving model ...
Validation loss decreased (1.295264 --> 1.294535).  Saving model ...
Validation loss decreased (1.294535 --> 1.293840).  Saving model ...
Validation loss decreased (1.293840 --> 1.293240).  Saving model ...
Validation loss decreased (1.293240 --> 1.292623).  Saving model ...
Validation loss decreased (1.292623 --> 1.292053).  Saving model ...
Validation loss decreased (1.292053 --> 1.291435).  Saving model ...
Validation loss decreased (1.291435 --> 1.290802).  Saving model ...
Validation loss decreased (1.290802 --> 1.290199).  Saving model ...
Validation loss decreased (1.290199 --> 1.289524).  Saving model ...
Validation loss decreased (1.289524 --> 1.288866).  Saving model ...
Validation loss decreased (1.288866 --> 1.288250).  Saving model ...
Validation loss decreased (1.288250 --> 1.287612).  Saving model ...
Validation loss decreased (1.287612 --> 1.286917).  Saving model ...
Validation loss decreased (1.286917 --> 1.286247).  Saving model ...
Validation loss decreased (1.286247 --> 1.285607).  Saving model ...
Validation loss decreased (1.285607 --> 1.284962).  Saving model ...
Validation loss decreased (1.284962 --> 1.284336).  Saving model ...
Validation loss decreased (1.284336 --> 1.283860).  Saving model ...
Validation loss decreased (1.283860 --> 1.283240).  Saving model ...
Validation loss decreased (1.283240 --> 1.282532).  Saving model ...
Validation loss decreased (1.282532 --> 1.281858).  Saving model ...
Validation loss decreased (1.281858 --> 1.281267).  Saving model ...
Validation loss decreased (1.281267 --> 1.280618).  Saving model ...
Validation loss decreased (1.280618 --> 1.280121).  Saving model ...
Validation loss decreased (1.280121 --> 1.279560).  Saving model ...
Validation loss decreased (1.279560 --> 1.278965).  Saving model ...
Validation loss decreased (1.278965 --> 1.278409).  Saving model ...
Validation loss decreased (1.278409 --> 1.277856).  Saving model ...
Validation loss decreased (1.277856 --> 1.277366).  Saving model ...
Validation loss decreased (1.277366 --> 1.276700).  Saving model ...
Validation loss decreased (1.276700 --> 1.276069).  Saving model ...
Validation loss decreased (1.276069 --> 1.275454).  Saving model ...
Validation loss decreased (1.275454 --> 1.274880).  Saving model ...
Validation loss decreased (1.274880 --> 1.274302).  Saving model ...
Validation loss decreased (1.274302 --> 1.273675).  Saving model ...
Validation loss decreased (1.273675 --> 1.273149).  Saving model ...
Validation loss decreased (1.273149 --> 1.272629).  Saving model ...
Validation loss decreased (1.272629 --> 1.272102).  Saving model ...
Validation loss decreased (1.272102 --> 1.271636).  Saving model ...
Validation loss decreased (1.271636 --> 1.271193).  Saving model ...
Validation loss decreased (1.271193 --> 1.270638).  Saving model ...
Validation loss decreased (1.270638 --> 1.269990).  Saving model ...
Validation loss decreased (1.269990 --> 1.269347).  Saving model ...
Validation loss decreased (1.269347 --> 1.268860).  Saving model ...
Validation loss decreased (1.268860 --> 1.268311).  Saving model ...
Validation loss decreased (1.268311 --> 1.267721).  Saving model ...
Validation loss decreased (1.267721 --> 1.267113).  Saving model ...
Validation loss decreased (1.267113 --> 1.266644).  Saving model ...
Validation loss decreased (1.266644 --> 1.266009).  Saving model ...
Validation loss decreased (1.266009 --> 1.265451).  Saving model ...
Validation loss decreased (1.265451 --> 1.264947).  Saving model ...
Validation loss decreased (1.264947 --> 1.264309).  Saving model ...
Validation loss decreased (1.264309 --> 1.263729).  Saving model ...
Validation loss decreased (1.263729 --> 1.263138).  Saving model ...
Validation loss decreased (1.263138 --> 1.262632).  Saving model ...
Validation loss decreased (1.262632 --> 1.261981).  Saving model ...
Validation loss decreased (1.261981 --> 1.261539).  Saving model ...
Validation loss decreased (1.261539 --> 1.261030).  Saving model ...
Validation loss decreased (1.261030 --> 1.260575).  Saving model ...
Validation loss decreased (1.260575 --> 1.260073).  Saving model ...
Validation loss decreased (1.260073 --> 1.259544).  Saving model ...
Validation loss decreased (1.259544 --> 1.259036).  Saving model ...
Validation loss decreased (1.259036 --> 1.258504).  Saving model ...
Validation loss decreased (1.258504 --> 1.258175).  Saving model ...
Validation loss decreased (1.258175 --> 1.257603).  Saving model ...
Validation loss decreased (1.257603 --> 1.257183).  Saving model ...
Validation loss decreased (1.257183 --> 1.256797).  Saving model ...
Validation loss decreased (1.256797 --> 1.256295).  Saving model ...
Validation loss decreased (1.256295 --> 1.255847).  Saving model ...
Validation loss decreased (1.255847 --> 1.255334).  Saving model ...
Validation loss decreased (1.255334 --> 1.254787).  Saving model ...
Validation loss decreased (1.254787 --> 1.254383).  Saving model ...
Validation loss decreased (1.254383 --> 1.253958).  Saving model ...
Validation loss decreased (1.253958 --> 1.253481).  Saving model ...
Validation loss decreased (1.253481 --> 1.252839).  Saving model ...
Validation loss decreased (1.252839 --> 1.252402).  Saving model ...
Validation loss decreased (1.252402 --> 1.251830).  Saving model ...
Validation loss decreased (1.251830 --> 1.251338).  Saving model ...
Validation loss decreased (1.251338 --> 1.250987).  Saving model ...
Validation loss decreased (1.250987 --> 1.250460).  Saving model ...
Validation loss decreased (1.250460 --> 1.250079).  Saving model ...
Validation loss decreased (1.250079 --> 1.249604).  Saving model ...
Validation loss decreased (1.249604 --> 1.249183).  Saving model ...
Validation loss decreased (1.249183 --> 1.248698).  Saving model ...
Validation loss decreased (1.248698 --> 1.248295).  Saving model ...
Validation loss decreased (1.248295 --> 1.247831).  Saving model ...
Validation loss decreased (1.247831 --> 1.247337).  Saving model ...
Validation loss decreased (1.247337 --> 1.247080).  Saving model ...
Validation loss decreased (1.247080 --> 1.246675).  Saving model ...
Validation loss decreased (1.246675 --> 1.245993).  Saving model ...
Validation loss decreased (1.245993 --> 1.245548).  Saving model ...
Validation loss decreased (1.245548 --> 1.245145).  Saving model ...
Validation loss decreased (1.245145 --> 1.244826).  Saving model ...
Validation loss decreased (1.244826 --> 1.244372).  Saving model ...
Validation loss decreased (1.244372 --> 1.243791).  Saving model ...
Validation loss decreased (1.243791 --> 1.243203).  Saving model ...
Validation loss decreased (1.243203 --> 1.242730).  Saving model ...
Validation loss decreased (1.242730 --> 1.242461).  Saving model ...
Validation loss decreased (1.242461 --> 1.242008).  Saving model ...
Validation loss decreased (1.242008 --> 1.241523).  Saving model ...
Validation loss decreased (1.241523 --> 1.241034).  Saving model ...
Validation loss decreased (1.241034 --> 1.240644).  Saving model ...
Validation loss decreased (1.240644 --> 1.240147).  Saving model ...
Validation loss decreased (1.240147 --> 1.239599).  Saving model ...
Validation loss decreased (1.239599 --> 1.239063).  Saving model ...
Validation loss decreased (1.239063 --> 1.238563).  Saving model ...
Validation loss decreased (1.238563 --> 1.238100).  Saving model ...
Validation loss decreased (1.238100 --> 1.237768).  Saving model ...
Validation loss decreased (1.237768 --> 1.237203).  Saving model ...
Validation loss decreased (1.237203 --> 1.236708).  Saving model ...
Validation loss decreased (1.236708 --> 1.236356).  Saving model ...
Validation loss decreased (1.236356 --> 1.235848).  Saving model ...
Validation loss decreased (1.235848 --> 1.235403).  Saving model ...
Validation loss decreased (1.235403 --> 1.235080).  Saving model ...
Validation loss decreased (1.235080 --> 1.234688).  Saving model ...
Validation loss decreased (1.234688 --> 1.234389).  Saving model ...
Validation loss decreased (1.234389 --> 1.234039).  Saving model ...
Validation loss decreased (1.234039 --> 1.233392).  Saving model ...
Validation loss decreased (1.233392 --> 1.233060).  Saving model ...
Validation loss decreased (1.233060 --> 1.232800).  Saving model ...
Validation loss decreased (1.232800 --> 1.232412).  Saving model ...
Validation loss decreased (1.232412 --> 1.232016).  Saving model ...
Validation loss decreased (1.232016 --> 1.231505).  Saving model ...
Validation loss decreased (1.231505 --> 1.231119).  Saving model ...
Validation loss decreased (1.231119 --> 1.230879).  Saving model ...
Validation loss decreased (1.230879 --> 1.230355).  Saving model ...
Validation loss decreased (1.230355 --> 1.229947).  Saving model ...
Validation loss decreased (1.229947 --> 1.229574).  Saving model ...
Validation loss decreased (1.229574 --> 1.229084).  Saving model ...
Validation loss decreased (1.229084 --> 1.228742).  Saving model ...
Validation loss decreased (1.228742 --> 1.228344).  Saving model ...
Validation loss decreased (1.228344 --> 1.227910).  Saving model ...
Validation loss decreased (1.227910 --> 1.227255).  Saving model ...
Validation loss decreased (1.227255 --> 1.226865).  Saving model ...
Validation loss decreased (1.226865 --> 1.226399).  Saving model ...
Validation loss decreased (1.226399 --> 1.225991).  Saving model ...
Validation loss decreased (1.225991 --> 1.225689).  Saving model ...
Validation loss decreased (1.225689 --> 1.225360).  Saving model ...
Validation loss decreased (1.225360 --> 1.224990).  Saving model ...
Validation loss decreased (1.224990 --> 1.224630).  Saving model ...
Validation loss decreased (1.224630 --> 1.224115).  Saving model ...
Validation loss decreased (1.224115 --> 1.223773).  Saving model ...
Validation loss decreased (1.223773 --> 1.223426).  Saving model ...
Validation loss decreased (1.223426 --> 1.223013).  Saving model ...
Validation loss decreased (1.223013 --> 1.222769).  Saving model ...
Validation loss decreased (1.222769 --> 1.222529).  Saving model ...
Validation loss decreased (1.222529 --> 1.222044).  Saving model ...
Validation loss decreased (1.222044 --> 1.221661).  Saving model ...
Validation loss decreased (1.221661 --> 1.221369).  Saving model ...
Validation loss decreased (1.221369 --> 1.220944).  Saving model ...
Validation loss decreased (1.220944 --> 1.220546).  Saving model ...
Validation loss decreased (1.220546 --> 1.220276).  Saving model ...
Validation loss decreased (1.220276 --> 1.219734).  Saving model ...
Validation loss decreased (1.219734 --> 1.219199).  Saving model ...
Validation loss decreased (1.219199 --> 1.218873).  Saving model ...
Validation loss decreased (1.218873 --> 1.218466).  Saving model ...
Validation loss decreased (1.218466 --> 1.218019).  Saving model ...
Validation loss decreased (1.218019 --> 1.217566).  Saving model ...
Validation loss decreased (1.217566 --> 1.217442).  Saving model ...
Validation loss decreased (1.217442 --> 1.217039).  Saving model ...
Validation loss decreased (1.217039 --> 1.216697).  Saving model ...
Validation loss decreased (1.216697 --> 1.216387).  Saving model ...
Validation loss decreased (1.216387 --> 1.216021).  Saving model ...
Validation loss decreased (1.216021 --> 1.215740).  Saving model ...
Validation loss decreased (1.215740 --> 1.215390).  Saving model ...
Validation loss decreased (1.215390 --> 1.215002).  Saving model ...
Validation loss decreased (1.215002 --> 1.214477).  Saving model ...
Validation loss decreased (1.214477 --> 1.214128).  Saving model ...
Validation loss decreased (1.214128 --> 1.213950).  Saving model ...
Validation loss decreased (1.213950 --> 1.213302).  Saving model ...
Validation loss decreased (1.213302 --> 1.213017).  Saving model ...
Validation loss decreased (1.213017 --> 1.212687).  Saving model ...
Validation loss decreased (1.212687 --> 1.212195).  Saving model ...
Validation loss decreased (1.212195 --> 1.212074).  Saving model ...
Validation loss decreased (1.212074 --> 1.211720).  Saving model ...
Validation loss decreased (1.211720 --> 1.211538).  Saving model ...
Validation loss decreased (1.211538 --> 1.211215).  Saving model ...
Validation loss decreased (1.211215 --> 1.210612).  Saving model ...
Validation loss decreased (1.210612 --> 1.210246).  Saving model ...
Validation loss decreased (1.210246 --> 1.210042).  Saving model ...
Validation loss decreased (1.210042 --> 1.209682).  Saving model ...
Validation loss decreased (1.209682 --> 1.209233).  Saving model ...
Validation loss decreased (1.209233 --> 1.208511).  Saving model ...
Validation loss decreased (1.208511 --> 1.208172).  Saving model ...
Validation loss decreased (1.208172 --> 1.208089).  Saving model ...
Validation loss decreased (1.208089 --> 1.207563).  Saving model ...
Validation loss decreased (1.207563 --> 1.207164).  Saving model ...
Validation loss decreased (1.207164 --> 1.206628).  Saving model ...
Validation loss decreased (1.206628 --> 1.206255).  Saving model ...
Validation loss decreased (1.206255 --> 1.205627).  Saving model ...
Validation loss decreased (1.205627 --> 1.205331).  Saving model ...
Validation loss decreased (1.205331 --> 1.204984).  Saving model ...
Validation loss decreased (1.204984 --> 1.204661).  Saving model ...
Validation loss decreased (1.204661 --> 1.204196).  Saving model ...
Validation loss decreased (1.204196 --> 1.203657).  Saving model ...
Validation loss decreased (1.203657 --> 1.203229).  Saving model ...
Validation loss decreased (1.203229 --> 1.202723).  Saving model ...
Validation loss decreased (1.202723 --> 1.202238).  Saving model ...
Validation loss decreased (1.202238 --> 1.201906).  Saving model ...
Validation loss decreased (1.201906 --> 1.201708).  Saving model ...
Validation loss decreased (1.201708 --> 1.201236).  Saving model ...
Validation loss decreased (1.201236 --> 1.200801).  Saving model ...
Validation loss decreased (1.200801 --> 1.200435).  Saving model ...
Validation loss decreased (1.200435 --> 1.199931).  Saving model ...
Validation loss decreased (1.199931 --> 1.199653).  Saving model ...
Validation loss decreased (1.199653 --> 1.199421).  Saving model ...
Validation loss decreased (1.199421 --> 1.199238).  Saving model ...
Validation loss decreased (1.199238 --> 1.198838).  Saving model ...
Validation loss decreased (1.198838 --> 1.198305).  Saving model ...
Validation loss decreased (1.198305 --> 1.197827).  Saving model ...
Validation loss decreased (1.197827 --> 1.197568).  Saving model ...
Validation loss decreased (1.197568 --> 1.197182).  Saving model ...
Validation loss decreased (1.197182 --> 1.196731).  Saving model ...
Validation loss decreased (1.196731 --> 1.196525).  Saving model ...
Validation loss decreased (1.196525 --> 1.196037).  Saving model ...
Validation loss decreased (1.196037 --> 1.195597).  Saving model ...
Validation loss decreased (1.195597 --> 1.195361).  Saving model ...
Validation loss decreased (1.195361 --> 1.195014).  Saving model ...
Validation loss decreased (1.195014 --> 1.194399).  Saving model ...
Validation loss decreased (1.194399 --> 1.194273).  Saving model ...
Validation loss decreased (1.194273 --> 1.194105).  Saving model ...
Validation loss decreased (1.194105 --> 1.193857).  Saving model ...
Validation loss decreased (1.193857 --> 1.193598).  Saving model ...
Validation loss decreased (1.193598 --> 1.193320).  Saving model ...
Validation loss decreased (1.193320 --> 1.193006).  Saving model ...
Validation loss decreased (1.193006 --> 1.192730).  Saving model ...
Validation loss decreased (1.192730 --> 1.192350).  Saving model ...
Validation loss decreased (1.192350 --> 1.192152).  Saving model ...
Validation loss decreased (1.192152 --> 1.191761).  Saving model ...
Validation loss decreased (1.191761 --> 1.191423).  Saving model ...
Validation loss decreased (1.191423 --> 1.190796).  Saving model ...
Validation loss decreased (1.190796 --> 1.190476).  Saving model ...
Validation loss decreased (1.190476 --> 1.190373).  Saving model ...
Validation loss decreased (1.190373 --> 1.190110).  Saving model ...
Validation loss decreased (1.190110 --> 1.189680).  Saving model ...
Validation loss decreased (1.189680 --> 1.189277).  Saving model ...
Validation loss decreased (1.189277 --> 1.188957).  Saving model ...
Validation loss decreased (1.188957 --> 1.188481).  Saving model ...
Validation loss decreased (1.188481 --> 1.188109).  Saving model ...
Validation loss decreased (1.188109 --> 1.187803).  Saving model ...
Validation loss decreased (1.187803 --> 1.187241).  Saving model ...
Validation loss decreased (1.187241 --> 1.186711).  Saving model ...
Validation loss decreased (1.186711 --> 1.186334).  Saving model ...
Validation loss decreased (1.186334 --> 1.185983).  Saving model ...
Validation loss decreased (1.185983 --> 1.185655).  Saving model ...
Validation loss decreased (1.185655 --> 1.185514).  Saving model ...
Validation loss decreased (1.185514 --> 1.185171).  Saving model ...
Validation loss decreased (1.185171 --> 1.184900).  Saving model ...
Validation loss decreased (1.184900 --> 1.184393).  Saving model ...
Validation loss decreased (1.184393 --> 1.183787).  Saving model ...
Validation loss decreased (1.183787 --> 1.183500).  Saving model ...
Validation loss decreased (1.183500 --> 1.183144).  Saving model ...
Validation loss decreased (1.183144 --> 1.182651).  Saving model ...
Validation loss decreased (1.182651 --> 1.182233).  Saving model ...
Validation loss decreased (1.182233 --> 1.181964).  Saving model ...
Validation loss decreased (1.181964 --> 1.181432).  Saving model ...
Validation loss decreased (1.181432 --> 1.181301).  Saving model ...
Validation loss decreased (1.181301 --> 1.181190).  Saving model ...
Validation loss decreased (1.181190 --> 1.180827).  Saving model ...
Validation loss decreased (1.180827 --> 1.180573).  Saving model ...
Validation loss decreased (1.180573 --> 1.180497).  Saving model ...
Validation loss decreased (1.180497 --> 1.180002).  Saving model ...
Validation loss decreased (1.180002 --> 1.179695).  Saving model ...
Validation loss decreased (1.179695 --> 1.179256).  Saving model ...
Validation loss decreased (1.179256 --> 1.178947).  Saving model ...
Validation loss decreased (1.178947 --> 1.178584).  Saving model ...
Validation loss decreased (1.178584 --> 1.178044).  Saving model ...
Validation loss decreased (1.178044 --> 1.177667).  Saving model ...
Validation loss decreased (1.177667 --> 1.177391).  Saving model ...
Validation loss decreased (1.177391 --> 1.177229).  Saving model ...
Validation loss decreased (1.177229 --> 1.176691).  Saving model ...
Validation loss decreased (1.176691 --> 1.176170).  Saving model ...
Validation loss decreased (1.176170 --> 1.175972).  Saving model ...
Validation loss decreased (1.175972 --> 1.175582).  Saving model ...
Validation loss decreased (1.175582 --> 1.175149).  Saving model ...
Validation loss decreased (1.175149 --> 1.174688).  Saving model ...
Validation loss decreased (1.174688 --> 1.174137).  Saving model ...
Validation loss decreased (1.174137 --> 1.173714).  Saving model ...
Validation loss decreased (1.173714 --> 1.173284).  Saving model ...
Validation loss decreased (1.173284 --> 1.172960).  Saving model ...
Validation loss decreased (1.172960 --> 1.172727).  Saving model ...
Validation loss decreased (1.172727 --> 1.172449).  Saving model ...
Validation loss decreased (1.172449 --> 1.172004).  Saving model ...
Validation loss decreased (1.172004 --> 1.171707).  Saving model ...
Validation loss decreased (1.171707 --> 1.171493).  Saving model ...
Validation loss decreased (1.171493 --> 1.171064).  Saving model ...
Validation loss decreased (1.171064 --> 1.170693).  Saving model ...
Validation loss decreased (1.170693 --> 1.170461).  Saving model ...
Validation loss decreased (1.170461 --> 1.170248).  Saving model ...
Validation loss decreased (1.170248 --> 1.170020).  Saving model ...
Validation loss decreased (1.170020 --> 1.169827).  Saving model ...
Validation loss decreased (1.169827 --> 1.169668).  Saving model ...
Validation loss decreased (1.169668 --> 1.169113).  Saving model ...
Validation loss decreased (1.169113 --> 1.168792).  Saving model ...
Validation loss decreased (1.168792 --> 1.168423).  Saving model ...
Validation loss decreased (1.168423 --> 1.168060).  Saving model ...
Validation loss decreased (1.168060 --> 1.167683).  Saving model ...
Validation loss decreased (1.167683 --> 1.167015).  Saving model ...
Validation loss decreased (1.167015 --> 1.166638).  Saving model ...
Validation loss decreased (1.166638 --> 1.166272).  Saving model ...
Validation loss decreased (1.166272 --> 1.165661).  Saving model ...
Validation loss decreased (1.165661 --> 1.165359).  Saving model ...
Validation loss decreased (1.165359 --> 1.165349).  Saving model ...
Validation loss decreased (1.165349 --> 1.165018).  Saving model ...
Validation loss decreased (1.165018 --> 1.164720).  Saving model ...
Validation loss decreased (1.164720 --> 1.164303).  Saving model ...
Validation loss decreased (1.164303 --> 1.163923).  Saving model ...
EarlyStopping counter: 1 out of 10.0
Validation loss decreased (1.163923 --> 1.163706).  Saving model ...
Validation loss decreased (1.163706 --> 1.163480).  Saving model ...
Validation loss decreased (1.163480 --> 1.163174).  Saving model ...
Validation loss decreased (1.163174 --> 1.162699).  Saving model ...
Validation loss decreased (1.162699 --> 1.162372).  Saving model ...
Validation loss decreased (1.162372 --> 1.161974).  Saving model ...
Validation loss decreased (1.161974 --> 1.161543).  Saving model ...
Validation loss decreased (1.161543 --> 1.161232).  Saving model ...
Validation loss decreased (1.161232 --> 1.160785).  Saving model ...
Validation loss decreased (1.160785 --> 1.160106).  Saving model ...
Validation loss decreased (1.160106 --> 1.159933).  Saving model ...
EarlyStopping counter: 1 out of 10.0
Validation loss decreased (1.159933 --> 1.159611).  Saving model ...
Validation loss decreased (1.159611 --> 1.159468).  Saving model ...
Validation loss decreased (1.159468 --> 1.159324).  Saving model ...
Validation loss decreased (1.159324 --> 1.159027).  Saving model ...
Validation loss decreased (1.159027 --> 1.158661).  Saving model ...
Validation loss decreased (1.158661 --> 1.158088).  Saving model ...
EarlyStopping counter: 1 out of 10.0
Validation loss decreased (1.158088 --> 1.157895).  Saving model ...
Validation loss decreased (1.157895 --> 1.157432).  Saving model ...
Validation loss decreased (1.157432 --> 1.157067).  Saving model ...
Validation loss decreased (1.157067 --> 1.156548).  Saving model ...
/localscratch/yinan.28735477.0/env/lib/python3.7/site-packages/torch/nn/functional.py:1794: UserWarning: nn.functional.tanh is deprecated. Use torch.tanh instead.
  warnings.warn("nn.functional.tanh is deprecated. Use torch.tanh instead.")
/localscratch/yinan.28735477.0/env/lib/python3.7/site-packages/transformers/optimization.py:155: UserWarning: This overload of add_ is deprecated:
	add_(Number alpha, Tensor other)
Consider using one of the following signatures instead:
	add_(Tensor other, *, Number alpha) (Triggered internally at  ../torch/csrc/utils/python_arg_parser.cpp:1025.)
  exp_avg.mul_(beta1).add_(1.0 - beta1, grad)
wandb: Waiting for W&B process to finish, PID 165433... (success).
wandb: - 0.00MB of 0.00MB uploaded (0.00MB deduped)wandb: \ 0.00MB of 0.00MB uploaded (0.00MB deduped)wandb: | 0.00MB of 0.00MB uploaded (0.00MB deduped)wandb: / 0.00MB of 0.00MB uploaded (0.00MB deduped)wandb: - 0.00MB of 0.00MB uploaded (0.00MB deduped)wandb: \ 0.00MB of 0.00MB uploaded (0.00MB deduped)wandb: | 0.00MB of 0.00MB uploaded (0.00MB deduped)wandb: / 0.00MB of 0.00MB uploaded (0.00MB deduped)wandb: - 0.00MB of 0.00MB uploaded (0.00MB deduped)wandb: \ 0.00MB of 0.00MB uploaded (0.00MB deduped)wandb: | 0.00MB of 0.00MB uploaded (0.00MB deduped)wandb: / 0.00MB of 0.00MB uploaded (0.00MB deduped)wandb: - 0.00MB of 0.00MB uploaded (0.00MB deduped)wandb: \ 0.00MB of 0.00MB uploaded (0.00MB deduped)wandb:                                                                                
wandb: Run history:
wandb:     e_F1 ▁▁▂▂▃▄▄▄▅▅▅▅▅▅▆▆▆▆▇▇▇▇▇▇▇▇▇▇▇▇▇▇▇▇██████
wandb:   e_loss █▇▇▆▆▆▆▆▅▅▅▅▅▄▄▄▄▄▃▃▃▃▃▃▃▃▂▂▂▂▂▂▂▂▁▁▁▁▁▁
wandb:     t_F1 ▁▁▂▂▃▃▃▃▃▄▄▅▅▅▅▅▆▆▆▇▆▆▅▆▇▇▇▆▇▆▇▇▇█▇█████
wandb:   t_loss ██▇▇▇▇▆▆▆▆▆▅▅▅▅▅▄▄▄▄▄▄▄▄▃▃▃▃▃▃▂▃▂▂▂▂▂▁▁▁
wandb: 
wandb: Run summary:
wandb:     e_F1 47.89658
wandb:   e_loss 1.15655
wandb:     t_F1 56.3748
wandb:   t_loss 1.07752
wandb: 
wandb: Synced 4 W&B file(s), 0 media file(s), 0 artifact file(s) and 0 other file(s)
wandb: Synced breezy-fire-1: https://wandb.ai/yinanazhou/xl_512_bs_8_lr_1e07_es_10_lc_False_nr_True_sr_True_stem_False_lemma_True_repeat_1_fold_1/runs/k7nm2sp0
wandb: Find logs at: ./wandb/run-20220311_092500-k7nm2sp0/logs/debug.log
wandb: 

wandb: wandb version 0.12.11 is available!  To upgrade, please run:
wandb:  $ pip install wandb --upgrade
2022-03-11 14:57:38.226144: I tensorflow/stream_executor/platform/default/dso_loader.cc:48] Successfully opened dynamic library libcudart.so.10.1
wandb: Tracking run with wandb version 0.12.5
wandb: Syncing run iconic-leaf-1
wandb: ⭐️ View project at https://wandb.ai/yinanazhou/xl_512_bs_8_lr_1e07_es_10_lc_False_nr_True_sr_True_stem_False_lemma_True_repeat_1_fold_2
wandb: 🚀 View run at https://wandb.ai/yinanazhou/xl_512_bs_8_lr_1e07_es_10_lc_False_nr_True_sr_True_stem_False_lemma_True_repeat_1_fold_2/runs/3cen7fkh
wandb: Run data is saved locally in /project/6002780/yinan/Thesis_MER_Lyrics/lyric-emotion/wandb/run-20220311_145734-3cen7fkh
wandb: Run `wandb offline` to turn off syncing.
slurmstepd: error: *** JOB 28735477 ON cdr2577 CANCELLED AT 2022-03-11T19:22:48 DUE TO TIME LIMIT ***
