Unloading StdEnv/2020

Due to MODULEPATH changes, the following have been reloaded:
  1) mii/1.1.1


The following have been reloaded with a version change:
  1) python/3.8.2 => python/3.7.4

Using base prefix '/cvmfs/soft.computecanada.ca/easybuild/software/2017/Core/python/3.7.4'
New python executable in /localscratch/yinan.28721947.0/env/bin/python
Installing setuptools, pip, wheel...
done.
Ignoring pip: markers 'python_version < "3"' don't match your environment
Looking in links: /cvmfs/soft.computecanada.ca/custom/python/wheelhouse/nix/avx2, /cvmfs/soft.computecanada.ca/custom/python/wheelhouse/nix/generic, /cvmfs/soft.computecanada.ca/custom/python/wheelhouse/generic
Collecting pip
Installing collected packages: pip
  Found existing installation: pip 19.1.1
    Uninstalling pip-19.1.1:
      Successfully uninstalled pip-19.1.1
Successfully installed pip-21.2.3+computecanada
Looking in links: /cvmfs/soft.computecanada.ca/custom/python/wheelhouse/nix/avx2, /cvmfs/soft.computecanada.ca/custom/python/wheelhouse/nix/generic, /cvmfs/soft.computecanada.ca/custom/python/wheelhouse/generic
Processing /cvmfs/soft.computecanada.ca/custom/python/wheelhouse/generic/keras-2.8.0+computecanada-py2.py3-none-any.whl
Processing /cvmfs/soft.computecanada.ca/custom/python/wheelhouse/generic/Keras_Preprocessing-1.1.2+computecanada-py3-none-any.whl
Requirement already satisfied: matplotlib in /cvmfs/soft.computecanada.ca/easybuild/software/2017/Core/scipy-stack/2019a/lib/python3.7/site-packages (from -r requirements.txt (line 3)) (3.0.2)
Processing /cvmfs/soft.computecanada.ca/custom/python/wheelhouse/generic/nltk-3.6.5+computecanada-py3-none-any.whl
Processing /cvmfs/soft.computecanada.ca/custom/python/wheelhouse/generic/scikit_learn-0.22.1+computecanada-cp37-cp37m-linux_x86_64.whl
Processing /cvmfs/soft.computecanada.ca/custom/python/wheelhouse/generic/tensorboard-2.3.0+computecanada-py3-none-any.whl
Processing /cvmfs/soft.computecanada.ca/custom/python/wheelhouse/generic/tensorboard_plugin_wit-1.7.0+computecanada-py3-none-any.whl
Processing /cvmfs/soft.computecanada.ca/custom/python/wheelhouse/generic/tensorflow_gpu-2.3.0+computecanada-cp37-cp37m-linux_x86_64.whl
Processing /cvmfs/soft.computecanada.ca/custom/python/wheelhouse/generic/tensorflow_estimator-2.3.0+computecanada-py2.py3-none-any.whl
Processing /cvmfs/soft.computecanada.ca/custom/python/wheelhouse/generic/tokenizers-0.5.2+computecanada-cp37-cp37m-linux_x86_64.whl
Processing /cvmfs/soft.computecanada.ca/custom/python/wheelhouse/nix/avx2/torch-1.4.0+computecanada-cp37-cp37m-linux_x86_64.whl
Processing /cvmfs/soft.computecanada.ca/custom/python/wheelhouse/generic/torchtext-0.6.0+computecanada-py3-none-any.whl
Processing /cvmfs/soft.computecanada.ca/custom/python/wheelhouse/generic/torchvision-0.8.2+computecanada-cp37-cp37m-linux_x86_64.whl
Processing /cvmfs/soft.computecanada.ca/custom/python/wheelhouse/generic/transformers-2.5.1+computecanada-py3-none-any.whl
Processing /cvmfs/soft.computecanada.ca/custom/python/wheelhouse/generic/urllib3-1.26.7+computecanada-py2.py3-none-any.whl
Processing /cvmfs/soft.computecanada.ca/custom/python/wheelhouse/generic/click-8.0.3+computecanada-py3-none-any.whl
ERROR: Could not find a version that satisfies the requirement regex>=2021.8.3 (from nltk) (from versions: 2018.1.10+computecanada, 2019.11.1+computecanada, 2020.11.13+computecanada)
ERROR: No matching distribution found for regex>=2021.8.3
Looking in links: /cvmfs/soft.computecanada.ca/custom/python/wheelhouse/nix/avx2, /cvmfs/soft.computecanada.ca/custom/python/wheelhouse/nix/generic, /cvmfs/soft.computecanada.ca/custom/python/wheelhouse/generic
ERROR: Could not find a version that satisfies the requirement numpy==1.20.0+computacanada (from versions: 1.15.0+computecanada, 1.15.2+computecanada, 1.15.4+computecanada, 1.16.0+computecanada, 1.16.2+computecanada, 1.16.3+computecanada, 1.17.4+computecanada, 1.18.1+computecanada, 1.18.4+computecanada, 1.19.1+computecanada, 1.19.2+computecanada, 1.20.2+computecanada)
ERROR: No matching distribution found for numpy==1.20.0+computacanada
Looking in links: /cvmfs/soft.computecanada.ca/custom/python/wheelhouse/nix/avx2, /cvmfs/soft.computecanada.ca/custom/python/wheelhouse/nix/generic, /cvmfs/soft.computecanada.ca/custom/python/wheelhouse/generic
Processing /cvmfs/soft.computecanada.ca/custom/python/wheelhouse/generic/wandb-0.12.5+computecanada-py2.py3-none-any.whl
Processing /cvmfs/soft.computecanada.ca/custom/python/wheelhouse/generic/click-8.0.3+computecanada-py3-none-any.whl
Processing /cvmfs/soft.computecanada.ca/custom/python/wheelhouse/generic/subprocess32-3.5.4+computecanada-py3-none-any.whl
Processing /cvmfs/soft.computecanada.ca/custom/python/wheelhouse/generic/psutil-5.7.3+computecanada-cp37-cp37m-linux_x86_64.whl
Processing /cvmfs/soft.computecanada.ca/custom/python/wheelhouse/generic/GitPython-3.1.24+computecanada-py3-none-any.whl
Processing /cvmfs/soft.computecanada.ca/custom/python/wheelhouse/generic/sentry_sdk-1.5.0+computecanada-py2.py3-none-any.whl
Requirement already satisfied: python-dateutil>=2.6.1 in /cvmfs/soft.computecanada.ca/easybuild/software/2017/Core/scipy-stack/2019a/lib/python3.7/site-packages (from wandb) (2.7.5)
Processing /cvmfs/soft.computecanada.ca/custom/python/wheelhouse/generic/docker_pycreds-0.4.0+computecanada-py2.py3-none-any.whl
Processing /cvmfs/soft.computecanada.ca/custom/python/wheelhouse/generic/pathtools-0.1.2+computecanada-py3-none-any.whl
Processing /cvmfs/soft.computecanada.ca/custom/python/wheelhouse/generic/promise-2.3+computecanada-py3-none-any.whl
Processing /cvmfs/soft.computecanada.ca/custom/python/wheelhouse/generic/configparser-5.0.2+computecanada-py3-none-any.whl
Processing /cvmfs/soft.computecanada.ca/custom/python/wheelhouse/generic/shortuuid-1.0.1+computecanada-py3-none-any.whl
Processing /cvmfs/soft.computecanada.ca/custom/python/wheelhouse/generic/yaspin-2.1.0+computecanada-py3-none-any.whl
Processing /cvmfs/soft.computecanada.ca/custom/python/wheelhouse/generic/six-1.16.0+computecanada-py2.py3-none-any.whl
Processing /cvmfs/soft.computecanada.ca/custom/python/wheelhouse/generic/PyYAML-5.3.1+computecanada-cp37-cp37m-linux_x86_64.whl
Processing /cvmfs/soft.computecanada.ca/custom/python/wheelhouse/generic/protobuf-3.19.4+computecanada-py2.py3-none-any.whl
Requirement already satisfied: requests<3,>=2.0.0 in /cvmfs/soft.computecanada.ca/easybuild/software/2017/Core/scipy-stack/2019a/lib/python3.7/site-packages (from wandb) (2.21.0)
Requirement already satisfied: importlib-metadata in /cvmfs/soft.computecanada.ca/easybuild/software/2017/Core/scipy-stack/2019a/lib/python3.7/site-packages (from Click!=8.0.0,>=7.0->wandb) (0.8)
Processing /cvmfs/soft.computecanada.ca/custom/python/wheelhouse/generic/typing_extensions-4.0.1+computecanada-py3-none-any.whl
Processing /cvmfs/soft.computecanada.ca/custom/python/wheelhouse/generic/gitdb-4.0.9+computecanada-py3-none-any.whl
Processing /cvmfs/soft.computecanada.ca/custom/python/wheelhouse/generic/smmap-5.0.0+computecanada-py3-none-any.whl
Requirement already satisfied: urllib3<1.25,>=1.21.1 in /cvmfs/soft.computecanada.ca/easybuild/software/2017/Core/scipy-stack/2019a/lib/python3.7/site-packages (from requests<3,>=2.0.0->wandb) (1.24.1)
Requirement already satisfied: idna<2.9,>=2.5 in /cvmfs/soft.computecanada.ca/easybuild/software/2017/Core/scipy-stack/2019a/lib/python3.7/site-packages (from requests<3,>=2.0.0->wandb) (2.8)
Requirement already satisfied: certifi>=2017.4.17 in /cvmfs/soft.computecanada.ca/easybuild/software/2017/Core/scipy-stack/2019a/lib/python3.7/site-packages (from requests<3,>=2.0.0->wandb) (2018.11.29)
Requirement already satisfied: chardet<3.1.0,>=3.0.2 in /cvmfs/soft.computecanada.ca/easybuild/software/2017/Core/scipy-stack/2019a/lib/python3.7/site-packages (from requests<3,>=2.0.0->wandb) (3.0.4)
Processing /cvmfs/soft.computecanada.ca/custom/python/wheelhouse/generic/termcolor-1.1.0+computecanada-py3-none-any.whl
Requirement already satisfied: zipp>=0.3.2 in /cvmfs/soft.computecanada.ca/easybuild/software/2017/Core/scipy-stack/2019a/lib/python3.7/site-packages (from importlib-metadata->Click!=8.0.0,>=7.0->wandb) (0.3.3)
Installing collected packages: smmap, typing-extensions, termcolor, six, gitdb, yaspin, subprocess32, shortuuid, sentry-sdk, PyYAML, psutil, protobuf, promise, pathtools, GitPython, docker-pycreds, configparser, Click, wandb
  Attempting uninstall: six
    Found existing installation: six 1.12.0
    Not uninstalling six at /cvmfs/soft.computecanada.ca/easybuild/software/2017/Core/scipy-stack/2019a/lib/python3.7/site-packages, outside environment /localscratch/yinan.28721947.0/env
    Can't uninstall 'six'. No files were found to uninstall.
Successfully installed Click-8.0.3+computecanada GitPython-3.1.24+computecanada PyYAML-5.3.1+computecanada configparser-5.0.2+computecanada docker-pycreds-0.4.0+computecanada gitdb-4.0.9+computecanada pathtools-0.1.2+computecanada promise-2.3+computecanada protobuf-3.19.4+computecanada psutil-5.7.3+computecanada sentry-sdk-1.5.0+computecanada shortuuid-1.0.1+computecanada six-1.16.0+computecanada smmap-5.0.0+computecanada subprocess32-3.5.4+computecanada termcolor-1.1.0+computecanada typing-extensions-4.0.1+computecanada wandb-0.12.5+computecanada yaspin-2.1.0+computecanada
Looking in links: /cvmfs/soft.computecanada.ca/custom/python/wheelhouse/nix/avx2, /cvmfs/soft.computecanada.ca/custom/python/wheelhouse/nix/generic, /cvmfs/soft.computecanada.ca/custom/python/wheelhouse/generic
ERROR: Could not find a version that satisfies the requirement sagemaker (from versions: none)
ERROR: No matching distribution found for sagemaker
Looking in links: /cvmfs/soft.computecanada.ca/custom/python/wheelhouse/nix/avx2, /cvmfs/soft.computecanada.ca/custom/python/wheelhouse/nix/generic, /cvmfs/soft.computecanada.ca/custom/python/wheelhouse/generic
Processing /cvmfs/soft.computecanada.ca/custom/python/wheelhouse/generic/torch-1.9.1+computecanada-cp37-cp37m-linux_x86_64.whl
Requirement already satisfied: typing-extensions in /localscratch/yinan.28721947.0/env/lib/python3.7/site-packages (from torch) (4.0.1+computecanada)
Installing collected packages: torch
Successfully installed torch-1.9.1+computecanada
Looking in links: /cvmfs/soft.computecanada.ca/custom/python/wheelhouse/nix/avx2, /cvmfs/soft.computecanada.ca/custom/python/wheelhouse/nix/generic, /cvmfs/soft.computecanada.ca/custom/python/wheelhouse/generic
Processing /cvmfs/soft.computecanada.ca/custom/python/wheelhouse/generic/transformers-2.5.1+computecanada-py3-none-any.whl
Requirement already satisfied: requests in /cvmfs/soft.computecanada.ca/easybuild/software/2017/Core/scipy-stack/2019a/lib/python3.7/site-packages (from transformers==2.5.1+computecanada) (2.21.0)
Requirement already satisfied: numpy in /cvmfs/soft.computecanada.ca/easybuild/software/2017/Core/scipy-stack/2019a/lib/python3.7/site-packages (from transformers==2.5.1+computecanada) (1.16.0)
Processing /cvmfs/soft.computecanada.ca/custom/python/wheelhouse/generic/tqdm-4.63.0+computecanada-py2.py3-none-any.whl
Processing /cvmfs/soft.computecanada.ca/custom/python/wheelhouse/generic/tokenizers-0.5.2+computecanada-cp37-cp37m-linux_x86_64.whl
Processing /cvmfs/soft.computecanada.ca/custom/python/wheelhouse/generic/regex-2020.11.13+computecanada-cp37-cp37m-linux_x86_64.whl
Processing /cvmfs/soft.computecanada.ca/custom/python/wheelhouse/generic/boto3-1.20.52+computecanada-py3-none-any.whl
Processing /cvmfs/soft.computecanada.ca/custom/python/wheelhouse/generic/sacremoses-0.0.46+computecanada-py3-none-any.whl
Processing /cvmfs/soft.computecanada.ca/custom/python/wheelhouse/generic/filelock-3.4.2+computecanada-py3-none-any.whl
Processing /cvmfs/soft.computecanada.ca/custom/python/wheelhouse/generic/sentencepiece-0.1.91+computecanada-cp37-cp37m-linux_x86_64.whl
Processing /cvmfs/soft.computecanada.ca/custom/python/wheelhouse/generic/botocore-1.23.52+computecanada-py3-none-any.whl
Processing /cvmfs/soft.computecanada.ca/custom/python/wheelhouse/generic/s3transfer-0.5.1+computecanada-py3-none-any.whl
Processing /cvmfs/soft.computecanada.ca/custom/python/wheelhouse/generic/jmespath-0.10.0+computecanada-py2.py3-none-any.whl
Requirement already satisfied: python-dateutil<3.0.0,>=2.1 in /cvmfs/soft.computecanada.ca/easybuild/software/2017/Core/scipy-stack/2019a/lib/python3.7/site-packages (from botocore<1.24.0,>=1.23.52->boto3->transformers==2.5.1+computecanada) (2.7.5)
Processing /cvmfs/soft.computecanada.ca/custom/python/wheelhouse/generic/urllib3-1.26.8+computecanada-py2.py3-none-any.whl
Requirement already satisfied: six>=1.5 in /localscratch/yinan.28721947.0/env/lib/python3.7/site-packages (from python-dateutil<3.0.0,>=2.1->botocore<1.24.0,>=1.23.52->boto3->transformers==2.5.1+computecanada) (1.16.0+computecanada)
Requirement already satisfied: chardet<3.1.0,>=3.0.2 in /cvmfs/soft.computecanada.ca/easybuild/software/2017/Core/scipy-stack/2019a/lib/python3.7/site-packages (from requests->transformers==2.5.1+computecanada) (3.0.4)
Processing /cvmfs/soft.computecanada.ca/custom/python/wheelhouse/generic/requests-2.27.1+computecanada-py2.py3-none-any.whl
Processing /cvmfs/soft.computecanada.ca/custom/python/wheelhouse/generic/charset_normalizer-2.0.11+computecanada-py3-none-any.whl
Requirement already satisfied: certifi>=2017.4.17 in /cvmfs/soft.computecanada.ca/easybuild/software/2017/Core/scipy-stack/2019a/lib/python3.7/site-packages (from requests->transformers==2.5.1+computecanada) (2018.11.29)
Requirement already satisfied: idna<4,>=2.5 in /cvmfs/soft.computecanada.ca/easybuild/software/2017/Core/scipy-stack/2019a/lib/python3.7/site-packages (from requests->transformers==2.5.1+computecanada) (2.8)
Processing /cvmfs/soft.computecanada.ca/custom/python/wheelhouse/generic/joblib-1.1.0+computecanada-py2.py3-none-any.whl
Requirement already satisfied: click in /localscratch/yinan.28721947.0/env/lib/python3.7/site-packages (from sacremoses->transformers==2.5.1+computecanada) (8.0.3+computecanada)
Requirement already satisfied: importlib-metadata in /cvmfs/soft.computecanada.ca/easybuild/software/2017/Core/scipy-stack/2019a/lib/python3.7/site-packages (from click->sacremoses->transformers==2.5.1+computecanada) (0.8)
Requirement already satisfied: zipp>=0.3.2 in /cvmfs/soft.computecanada.ca/easybuild/software/2017/Core/scipy-stack/2019a/lib/python3.7/site-packages (from importlib-metadata->click->sacremoses->transformers==2.5.1+computecanada) (0.3.3)
Installing collected packages: urllib3, jmespath, botocore, tqdm, s3transfer, regex, joblib, charset-normalizer, tokenizers, sentencepiece, sacremoses, requests, filelock, boto3, transformers
  Attempting uninstall: urllib3
    Found existing installation: urllib3 1.24.1
    Not uninstalling urllib3 at /cvmfs/soft.computecanada.ca/easybuild/software/2017/Core/scipy-stack/2019a/lib/python3.7/site-packages, outside environment /localscratch/yinan.28721947.0/env
    Can't uninstall 'urllib3'. No files were found to uninstall.
  Attempting uninstall: requests
    Found existing installation: requests 2.21.0
    Not uninstalling requests at /cvmfs/soft.computecanada.ca/easybuild/software/2017/Core/scipy-stack/2019a/lib/python3.7/site-packages, outside environment /localscratch/yinan.28721947.0/env
    Can't uninstall 'requests'. No files were found to uninstall.
Successfully installed boto3-1.20.52+computecanada botocore-1.23.52+computecanada charset-normalizer-2.0.11+computecanada filelock-3.4.2+computecanada jmespath-0.10.0+computecanada joblib-1.1.0+computecanada regex-2020.11.13+computecanada requests-2.27.1+computecanada s3transfer-0.5.1+computecanada sacremoses-0.0.46+computecanada sentencepiece-0.1.91+computecanada tokenizers-0.5.2+computecanada tqdm-4.63.0+computecanada transformers-2.5.1+computecanada urllib3-1.26.8+computecanada
Looking in links: /cvmfs/soft.computecanada.ca/custom/python/wheelhouse/nix/avx2, /cvmfs/soft.computecanada.ca/custom/python/wheelhouse/nix/generic, /cvmfs/soft.computecanada.ca/custom/python/wheelhouse/generic
Processing /cvmfs/soft.computecanada.ca/custom/python/wheelhouse/generic/tensorflow_gpu-2.3.0+computecanada-cp37-cp37m-linux_x86_64.whl
Processing /cvmfs/soft.computecanada.ca/custom/python/wheelhouse/generic/tensorboard-2.8.0+computecanada-py3-none-any.whl
Processing /cvmfs/soft.computecanada.ca/custom/python/wheelhouse/generic/tensorflow_estimator-2.3.0+computecanada-py2.py3-none-any.whl
Processing /cvmfs/soft.computecanada.ca/custom/python/wheelhouse/generic/gast-0.3.3+computecanada-py3-none-any.whl
Requirement already satisfied: termcolor>=1.1.0 in /localscratch/yinan.28721947.0/env/lib/python3.7/site-packages (from tensorflow_gpu==2.3.0+computecanada) (1.1.0+computecanada)
Processing /cvmfs/soft.computecanada.ca/custom/python/wheelhouse/generic/wrapt-1.11.2+computecanada-cp37-cp37m-linux_x86_64.whl
Processing /cvmfs/soft.computecanada.ca/custom/python/wheelhouse/nix/avx2/h5py-2.10.0+computecanada-cp37-cp37m-linux_x86_64.whl
Processing /cvmfs/soft.computecanada.ca/custom/python/wheelhouse/generic/astunparse-1.6.3+computecanada-py2.py3-none-any.whl
Processing /cvmfs/soft.computecanada.ca/custom/python/wheelhouse/generic/Keras_Preprocessing-1.1.2+computecanada-py3-none-any.whl
Requirement already satisfied: six>=1.12.0 in /localscratch/yinan.28721947.0/env/lib/python3.7/site-packages (from tensorflow_gpu==2.3.0+computecanada) (1.16.0+computecanada)
Requirement already satisfied: numpy<1.19.0,>=1.16.0 in /cvmfs/soft.computecanada.ca/easybuild/software/2017/Core/scipy-stack/2019a/lib/python3.7/site-packages (from tensorflow_gpu==2.3.0+computecanada) (1.16.0)
Processing /cvmfs/soft.computecanada.ca/custom/python/wheelhouse/nix/generic/scipy-1.4.1+computecanada-cp37-cp37m-linux_x86_64.whl
Processing /cvmfs/soft.computecanada.ca/custom/python/wheelhouse/generic/grpcio-1.38.0+computecanada-cp37-cp37m-linux_x86_64.whl
Processing /cvmfs/soft.computecanada.ca/custom/python/wheelhouse/generic/absl_py-1.0.0+computecanada-py3-none-any.whl
Processing /cvmfs/soft.computecanada.ca/custom/python/wheelhouse/generic/google_pasta-0.2.0+computecanada-py3-none-any.whl
Requirement already satisfied: wheel>=0.26 in /localscratch/yinan.28721947.0/env/lib/python3.7/site-packages (from tensorflow_gpu==2.3.0+computecanada) (0.33.4)
Requirement already satisfied: protobuf>=3.9.2 in /localscratch/yinan.28721947.0/env/lib/python3.7/site-packages (from tensorflow_gpu==2.3.0+computecanada) (3.19.4+computecanada)
Processing /cvmfs/soft.computecanada.ca/custom/python/wheelhouse/generic/opt_einsum-3.3.0+computecanada-py3-none-any.whl
Processing /cvmfs/soft.computecanada.ca/custom/python/wheelhouse/generic/tensorboard_plugin_wit-1.8.0+computecanada-py3-none-any.whl
Requirement already satisfied: setuptools>=41.0.0 in /localscratch/yinan.28721947.0/env/lib/python3.7/site-packages (from tensorboard<3,>=2.3.0->tensorflow_gpu==2.3.0+computecanada) (41.0.1)
Processing /cvmfs/soft.computecanada.ca/custom/python/wheelhouse/generic/google_auth-2.3.3+computecanada-py2.py3-none-any.whl
Processing /cvmfs/soft.computecanada.ca/custom/python/wheelhouse/generic/tensorboard_data_server-0.6.1+computecanada-py3-none-linux_x86_64.whl
Processing /cvmfs/soft.computecanada.ca/custom/python/wheelhouse/generic/Werkzeug-2.0.3+computecanada-py3-none-any.whl
Processing /cvmfs/soft.computecanada.ca/custom/python/wheelhouse/generic/Markdown-3.3.6+computecanada-py3-none-any.whl
Requirement already satisfied: requests<3,>=2.21.0 in /localscratch/yinan.28721947.0/env/lib/python3.7/site-packages (from tensorboard<3,>=2.3.0->tensorflow_gpu==2.3.0+computecanada) (2.27.1+computecanada)
Processing /cvmfs/soft.computecanada.ca/custom/python/wheelhouse/generic/google_auth_oauthlib-0.4.6+computecanada-py2.py3-none-any.whl
Processing /cvmfs/soft.computecanada.ca/custom/python/wheelhouse/generic/cachetools-4.2.4+computecanada-py3-none-any.whl
Processing /cvmfs/soft.computecanada.ca/custom/python/wheelhouse/generic/pyasn1_modules-0.2.8+computecanada-py2.py3-none-any.whl
Processing /cvmfs/soft.computecanada.ca/custom/python/wheelhouse/generic/rsa-4.8+computecanada-py3-none-any.whl
Processing /cvmfs/soft.computecanada.ca/custom/python/wheelhouse/generic/requests_oauthlib-1.3.0+computecanada-py2.py3-none-any.whl
Processing /cvmfs/soft.computecanada.ca/custom/python/wheelhouse/generic/importlib_metadata-4.10.1+computecanada-py3-none-any.whl
Requirement already satisfied: typing-extensions>=3.6.4 in /localscratch/yinan.28721947.0/env/lib/python3.7/site-packages (from importlib-metadata>=4.4->markdown>=2.6.8->tensorboard<3,>=2.3.0->tensorflow_gpu==2.3.0+computecanada) (4.0.1+computecanada)
Processing /cvmfs/soft.computecanada.ca/custom/python/wheelhouse/generic/zipp-3.7.0+computecanada-py3-none-any.whl
Processing /cvmfs/soft.computecanada.ca/custom/python/wheelhouse/generic/pyasn1-0.4.8+computecanada-py2.py3-none-any.whl
Requirement already satisfied: charset-normalizer~=2.0.0 in /localscratch/yinan.28721947.0/env/lib/python3.7/site-packages (from requests<3,>=2.21.0->tensorboard<3,>=2.3.0->tensorflow_gpu==2.3.0+computecanada) (2.0.11+computecanada)
Requirement already satisfied: certifi>=2017.4.17 in /cvmfs/soft.computecanada.ca/easybuild/software/2017/Core/scipy-stack/2019a/lib/python3.7/site-packages (from requests<3,>=2.21.0->tensorboard<3,>=2.3.0->tensorflow_gpu==2.3.0+computecanada) (2018.11.29)
Requirement already satisfied: urllib3<1.27,>=1.21.1 in /localscratch/yinan.28721947.0/env/lib/python3.7/site-packages (from requests<3,>=2.21.0->tensorboard<3,>=2.3.0->tensorflow_gpu==2.3.0+computecanada) (1.26.8+computecanada)
Requirement already satisfied: idna<4,>=2.5 in /cvmfs/soft.computecanada.ca/easybuild/software/2017/Core/scipy-stack/2019a/lib/python3.7/site-packages (from requests<3,>=2.21.0->tensorboard<3,>=2.3.0->tensorflow_gpu==2.3.0+computecanada) (2.8)
Processing /cvmfs/soft.computecanada.ca/custom/python/wheelhouse/generic/oauthlib-3.1.1+computecanada-py2.py3-none-any.whl
Installing collected packages: pyasn1, zipp, rsa, pyasn1-modules, oauthlib, cachetools, requests-oauthlib, importlib-metadata, google-auth, werkzeug, tensorboard-plugin-wit, tensorboard-data-server, markdown, grpcio, google-auth-oauthlib, absl-py, wrapt, tensorflow-estimator, tensorboard, scipy, opt-einsum, keras-preprocessing, h5py, google-pasta, gast, astunparse, tensorflow-gpu
  Attempting uninstall: pyasn1
    Found existing installation: pyasn1 0.4.3
    Not uninstalling pyasn1 at /cvmfs/soft.computecanada.ca/easybuild/software/2017/Core/scipy-stack/2019a/lib/python3.7/site-packages, outside environment /localscratch/yinan.28721947.0/env
    Can't uninstall 'pyasn1'. No files were found to uninstall.
  Attempting uninstall: zipp
    Found existing installation: zipp 0.3.3
    Not uninstalling zipp at /cvmfs/soft.computecanada.ca/easybuild/software/2017/Core/scipy-stack/2019a/lib/python3.7/site-packages, outside environment /localscratch/yinan.28721947.0/env
    Can't uninstall 'zipp'. No files were found to uninstall.
  Attempting uninstall: importlib-metadata
    Found existing installation: importlib-metadata 0.8
    Not uninstalling importlib-metadata at /cvmfs/soft.computecanada.ca/easybuild/software/2017/Core/scipy-stack/2019a/lib/python3.7/site-packages, outside environment /localscratch/yinan.28721947.0/env
    Can't uninstall 'importlib-metadata'. No files were found to uninstall.
  Attempting uninstall: scipy
    Found existing installation: scipy 1.2.0
    Not uninstalling scipy at /cvmfs/soft.computecanada.ca/easybuild/software/2017/Core/scipy-stack/2019a/lib/python3.7/site-packages, outside environment /localscratch/yinan.28721947.0/env
    Can't uninstall 'scipy'. No files were found to uninstall.
Successfully installed absl-py-1.0.0+computecanada astunparse-1.6.3+computecanada cachetools-4.2.4+computecanada gast-0.3.3+computecanada google-auth-2.3.3+computecanada google-auth-oauthlib-0.4.6+computecanada google-pasta-0.2.0+computecanada grpcio-1.38.0+computecanada h5py-2.10.0+computecanada importlib-metadata-4.10.1+computecanada keras-preprocessing-1.1.2+computecanada markdown-3.3.6+computecanada oauthlib-3.1.1+computecanada opt-einsum-3.3.0+computecanada pyasn1-0.4.8+computecanada pyasn1-modules-0.2.8+computecanada requests-oauthlib-1.3.0+computecanada rsa-4.8+computecanada scipy-1.4.1+computecanada tensorboard-2.8.0+computecanada tensorboard-data-server-0.6.1+computecanada tensorboard-plugin-wit-1.8.0+computecanada tensorflow-estimator-2.3.0+computecanada tensorflow-gpu-2.3.0+computecanada werkzeug-2.0.3+computecanada wrapt-1.11.2+computecanada zipp-3.7.0+computecanada
Looking in links: /cvmfs/soft.computecanada.ca/custom/python/wheelhouse/nix/avx2, /cvmfs/soft.computecanada.ca/custom/python/wheelhouse/nix/generic, /cvmfs/soft.computecanada.ca/custom/python/wheelhouse/generic
Processing /cvmfs/soft.computecanada.ca/custom/python/wheelhouse/generic/keras-2.8.0+computecanada-py2.py3-none-any.whl
Installing collected packages: Keras
Successfully installed Keras-2.8.0+computecanada
Looking in links: /cvmfs/soft.computecanada.ca/custom/python/wheelhouse/nix/avx2, /cvmfs/soft.computecanada.ca/custom/python/wheelhouse/nix/generic, /cvmfs/soft.computecanada.ca/custom/python/wheelhouse/generic
Processing /cvmfs/soft.computecanada.ca/custom/python/wheelhouse/generic/urllib3-1.26.7+computecanada-py2.py3-none-any.whl
Installing collected packages: urllib3
  Attempting uninstall: urllib3
    Found existing installation: urllib3 1.26.8+computecanada
    Uninstalling urllib3-1.26.8+computecanada:
      Successfully uninstalled urllib3-1.26.8+computecanada
Successfully installed urllib3-1.26.7+computecanada
Looking in links: /cvmfs/soft.computecanada.ca/custom/python/wheelhouse/nix/avx2, /cvmfs/soft.computecanada.ca/custom/python/wheelhouse/nix/generic, /cvmfs/soft.computecanada.ca/custom/python/wheelhouse/generic
Processing /cvmfs/soft.computecanada.ca/custom/python/wheelhouse/generic/nltk-3.7+computecanada-py3-none-any.whl
Requirement already satisfied: joblib in /localscratch/yinan.28721947.0/env/lib/python3.7/site-packages (from nltk) (1.1.0+computecanada)
Requirement already satisfied: tqdm in /localscratch/yinan.28721947.0/env/lib/python3.7/site-packages (from nltk) (4.63.0+computecanada)
Requirement already satisfied: click in /localscratch/yinan.28721947.0/env/lib/python3.7/site-packages (from nltk) (8.0.3+computecanada)
Processing /cvmfs/soft.computecanada.ca/custom/python/wheelhouse/generic/nltk-3.6.5+computecanada-py3-none-any.whl
Processing /cvmfs/soft.computecanada.ca/custom/python/wheelhouse/generic/nltk-3.6.3+computecanada-py3-none-any.whl
Requirement already satisfied: regex in /localscratch/yinan.28721947.0/env/lib/python3.7/site-packages (from nltk) (2020.11.13+computecanada)
Requirement already satisfied: importlib-metadata in /localscratch/yinan.28721947.0/env/lib/python3.7/site-packages (from click->nltk) (4.10.1+computecanada)
Requirement already satisfied: typing-extensions>=3.6.4 in /localscratch/yinan.28721947.0/env/lib/python3.7/site-packages (from importlib-metadata->click->nltk) (4.0.1+computecanada)
Requirement already satisfied: zipp>=0.5 in /localscratch/yinan.28721947.0/env/lib/python3.7/site-packages (from importlib-metadata->click->nltk) (3.7.0+computecanada)
Installing collected packages: nltk
Successfully installed nltk-3.6.3+computecanada
Looking in links: /cvmfs/soft.computecanada.ca/custom/python/wheelhouse/nix/avx2, /cvmfs/soft.computecanada.ca/custom/python/wheelhouse/nix/generic, /cvmfs/soft.computecanada.ca/custom/python/wheelhouse/generic
Processing /cvmfs/soft.computecanada.ca/custom/python/wheelhouse/generic/scikit_learn-0.22.1+computecanada-cp37-cp37m-linux_x86_64.whl
Requirement already satisfied: joblib>=0.11 in /localscratch/yinan.28721947.0/env/lib/python3.7/site-packages (from scikit-learn==0.22.1) (1.1.0+computecanada)
Requirement already satisfied: scipy>=0.17.0 in /localscratch/yinan.28721947.0/env/lib/python3.7/site-packages (from scikit-learn==0.22.1) (1.4.1+computecanada)
Requirement already satisfied: numpy>=1.11.0 in /cvmfs/soft.computecanada.ca/easybuild/software/2017/Core/scipy-stack/2019a/lib/python3.7/site-packages (from scikit-learn==0.22.1) (1.16.0)
Installing collected packages: scikit-learn
Successfully installed scikit-learn-0.22.1+computecanada
Looking in links: /cvmfs/soft.computecanada.ca/custom/python/wheelhouse/nix/avx2, /cvmfs/soft.computecanada.ca/custom/python/wheelhouse/nix/generic, /cvmfs/soft.computecanada.ca/custom/python/wheelhouse/generic
Requirement already satisfied: tokenizers==0.5.2 in /localscratch/yinan.28721947.0/env/lib/python3.7/site-packages (0.5.2+computecanada)
wandb: Appending key for api.wandb.ai to your netrc file: /home/yinan/.netrc
Starting Task
2022-03-11 06:17:16.197816: I tensorflow/stream_executor/platform/default/dso_loader.cc:48] Successfully opened dynamic library libcudart.so.10.1
[nltk_data] Downloading package stopwords to /home/yinan/nltk_data...
[nltk_data]   Package stopwords is already up-to-date!
[nltk_data] Downloading package wordnet to /home/yinan/nltk_data...
[nltk_data]   Package wordnet is already up-to-date!
wandb: Currently logged in as: yinanazhou (use `wandb login --relogin` to force relogin)
wandb: wandb version 0.12.11 is available!  To upgrade, please run:
wandb:  $ pip install wandb --upgrade
2022-03-11 06:17:34.974816: I tensorflow/stream_executor/platform/default/dso_loader.cc:48] Successfully opened dynamic library libcudart.so.10.1
wandb: Tracking run with wandb version 0.12.5
wandb: Syncing run rural-breeze-1
wandb: ⭐️ View project at https://wandb.ai/yinanazhou/xl_512_bs_8_lr_1e07_es_5_lc_True_nr_False_sr_False_stem_True_lemma_False_repeat_1_fold_1
wandb: 🚀 View run at https://wandb.ai/yinanazhou/xl_512_bs_8_lr_1e07_es_5_lc_True_nr_False_sr_False_stem_True_lemma_False_repeat_1_fold_1/runs/coph19xh
wandb: Run data is saved locally in /project/6002780/yinan/Thesis_MER_Lyrics/lyric-emotion/wandb/run-20220311_061732-coph19xh
wandb: Run `wandb offline` to turn off syncing.

Validation loss decreased (inf --> 1.449578).  Saving model ...
Validation loss decreased (1.449578 --> 1.447147).  Saving model ...
Validation loss decreased (1.447147 --> 1.444559).  Saving model ...
Validation loss decreased (1.444559 --> 1.442044).  Saving model ...
Validation loss decreased (1.442044 --> 1.439698).  Saving model ...
Validation loss decreased (1.439698 --> 1.437353).  Saving model ...
Validation loss decreased (1.437353 --> 1.435150).  Saving model ...
Validation loss decreased (1.435150 --> 1.433059).  Saving model ...
Validation loss decreased (1.433059 --> 1.430992).  Saving model ...
Validation loss decreased (1.430992 --> 1.428788).  Saving model ...
Validation loss decreased (1.428788 --> 1.426639).  Saving model ...
Validation loss decreased (1.426639 --> 1.424678).  Saving model ...
Validation loss decreased (1.424678 --> 1.422726).  Saving model ...
Validation loss decreased (1.422726 --> 1.420836).  Saving model ...
Validation loss decreased (1.420836 --> 1.419049).  Saving model ...
Validation loss decreased (1.419049 --> 1.417274).  Saving model ...
Validation loss decreased (1.417274 --> 1.415502).  Saving model ...
Validation loss decreased (1.415502 --> 1.413719).  Saving model ...
Validation loss decreased (1.413719 --> 1.412053).  Saving model ...
Validation loss decreased (1.412053 --> 1.410404).  Saving model ...
Validation loss decreased (1.410404 --> 1.408716).  Saving model ...
Validation loss decreased (1.408716 --> 1.407108).  Saving model ...
Validation loss decreased (1.407108 --> 1.405576).  Saving model ...
Validation loss decreased (1.405576 --> 1.404155).  Saving model ...
Validation loss decreased (1.404155 --> 1.402662).  Saving model ...
Validation loss decreased (1.402662 --> 1.401251).  Saving model ...
Validation loss decreased (1.401251 --> 1.399891).  Saving model ...
Validation loss decreased (1.399891 --> 1.398511).  Saving model ...
Validation loss decreased (1.398511 --> 1.397272).  Saving model ...
Validation loss decreased (1.397272 --> 1.396006).  Saving model ...
Validation loss decreased (1.396006 --> 1.394759).  Saving model ...
Validation loss decreased (1.394759 --> 1.393491).  Saving model ...
Validation loss decreased (1.393491 --> 1.392315).  Saving model ...
Validation loss decreased (1.392315 --> 1.391170).  Saving model ...
Validation loss decreased (1.391170 --> 1.390052).  Saving model ...
Validation loss decreased (1.390052 --> 1.388835).  Saving model ...
Validation loss decreased (1.388835 --> 1.387686).  Saving model ...
Validation loss decreased (1.387686 --> 1.386686).  Saving model ...
Validation loss decreased (1.386686 --> 1.385599).  Saving model ...
Validation loss decreased (1.385599 --> 1.384586).  Saving model ...
Validation loss decreased (1.384586 --> 1.383569).  Saving model ...
Validation loss decreased (1.383569 --> 1.382600).  Saving model ...
Validation loss decreased (1.382600 --> 1.381674).  Saving model ...
Validation loss decreased (1.381674 --> 1.380745).  Saving model ...
Validation loss decreased (1.380745 --> 1.379746).  Saving model ...
Validation loss decreased (1.379746 --> 1.378807).  Saving model ...
Validation loss decreased (1.378807 --> 1.377904).  Saving model ...
Validation loss decreased (1.377904 --> 1.377017).  Saving model ...
Validation loss decreased (1.377017 --> 1.376172).  Saving model ...
Validation loss decreased (1.376172 --> 1.375298).  Saving model ...
Validation loss decreased (1.375298 --> 1.374516).  Saving model ...
Validation loss decreased (1.374516 --> 1.373792).  Saving model ...
Validation loss decreased (1.373792 --> 1.372954).  Saving model ...
Validation loss decreased (1.372954 --> 1.372139).  Saving model ...
Validation loss decreased (1.372139 --> 1.371377).  Saving model ...
Validation loss decreased (1.371377 --> 1.370596).  Saving model ...
Validation loss decreased (1.370596 --> 1.369813).  Saving model ...
Validation loss decreased (1.369813 --> 1.369014).  Saving model ...
Validation loss decreased (1.369014 --> 1.368191).  Saving model ...
Validation loss decreased (1.368191 --> 1.367505).  Saving model ...
Validation loss decreased (1.367505 --> 1.366725).  Saving model ...
Validation loss decreased (1.366725 --> 1.365980).  Saving model ...
Validation loss decreased (1.365980 --> 1.365280).  Saving model ...
Validation loss decreased (1.365280 --> 1.364577).  Saving model ...
Validation loss decreased (1.364577 --> 1.363924).  Saving model ...
Validation loss decreased (1.363924 --> 1.363255).  Saving model ...
Validation loss decreased (1.363255 --> 1.362638).  Saving model ...
Validation loss decreased (1.362638 --> 1.361978).  Saving model ...
Validation loss decreased (1.361978 --> 1.361355).  Saving model ...
Validation loss decreased (1.361355 --> 1.360763).  Saving model ...
Validation loss decreased (1.360763 --> 1.360182).  Saving model ...
Validation loss decreased (1.360182 --> 1.359560).  Saving model ...
Validation loss decreased (1.359560 --> 1.358947).  Saving model ...
Validation loss decreased (1.358947 --> 1.358342).  Saving model ...
Validation loss decreased (1.358342 --> 1.357760).  Saving model ...
Validation loss decreased (1.357760 --> 1.357176).  Saving model ...
Validation loss decreased (1.357176 --> 1.356612).  Saving model ...
Validation loss decreased (1.356612 --> 1.356058).  Saving model ...
Validation loss decreased (1.356058 --> 1.355526).  Saving model ...
Validation loss decreased (1.355526 --> 1.354982).  Saving model ...
Validation loss decreased (1.354982 --> 1.354443).  Saving model ...
Validation loss decreased (1.354443 --> 1.353964).  Saving model ...
Validation loss decreased (1.353964 --> 1.353363).  Saving model ...
Validation loss decreased (1.353363 --> 1.352880).  Saving model ...
Validation loss decreased (1.352880 --> 1.352398).  Saving model ...
Validation loss decreased (1.352398 --> 1.351823).  Saving model ...
Validation loss decreased (1.351823 --> 1.351280).  Saving model ...
Validation loss decreased (1.351280 --> 1.350744).  Saving model ...
Validation loss decreased (1.350744 --> 1.350287).  Saving model ...
Validation loss decreased (1.350287 --> 1.349764).  Saving model ...
Validation loss decreased (1.349764 --> 1.349280).  Saving model ...
Validation loss decreased (1.349280 --> 1.348828).  Saving model ...
Validation loss decreased (1.348828 --> 1.348312).  Saving model ...
Validation loss decreased (1.348312 --> 1.347788).  Saving model ...
Validation loss decreased (1.347788 --> 1.347269).  Saving model ...
Validation loss decreased (1.347269 --> 1.346794).  Saving model ...
Validation loss decreased (1.346794 --> 1.346327).  Saving model ...
Validation loss decreased (1.346327 --> 1.345805).  Saving model ...
Validation loss decreased (1.345805 --> 1.345288).  Saving model ...
Validation loss decreased (1.345288 --> 1.344821).  Saving model ...
Validation loss decreased (1.344821 --> 1.344344).  Saving model ...
Validation loss decreased (1.344344 --> 1.343873).  Saving model ...
Validation loss decreased (1.343873 --> 1.343430).  Saving model ...
Validation loss decreased (1.343430 --> 1.342987).  Saving model ...
Validation loss decreased (1.342987 --> 1.342522).  Saving model ...
Validation loss decreased (1.342522 --> 1.342050).  Saving model ...
Validation loss decreased (1.342050 --> 1.341650).  Saving model ...
Validation loss decreased (1.341650 --> 1.341209).  Saving model ...
Validation loss decreased (1.341209 --> 1.340810).  Saving model ...
Validation loss decreased (1.340810 --> 1.340352).  Saving model ...
Validation loss decreased (1.340352 --> 1.339885).  Saving model ...
Validation loss decreased (1.339885 --> 1.339488).  Saving model ...
Validation loss decreased (1.339488 --> 1.339104).  Saving model ...
Validation loss decreased (1.339104 --> 1.338682).  Saving model ...
Validation loss decreased (1.338682 --> 1.338262).  Saving model ...
Validation loss decreased (1.338262 --> 1.337832).  Saving model ...
Validation loss decreased (1.337832 --> 1.337411).  Saving model ...
Validation loss decreased (1.337411 --> 1.337025).  Saving model ...
Validation loss decreased (1.337025 --> 1.336641).  Saving model ...
Validation loss decreased (1.336641 --> 1.336236).  Saving model ...
Validation loss decreased (1.336236 --> 1.335858).  Saving model ...
Validation loss decreased (1.335858 --> 1.335410).  Saving model ...
Validation loss decreased (1.335410 --> 1.334945).  Saving model ...
Validation loss decreased (1.334945 --> 1.334521).  Saving model ...
Validation loss decreased (1.334521 --> 1.334104).  Saving model ...
Validation loss decreased (1.334104 --> 1.333693).  Saving model ...
Validation loss decreased (1.333693 --> 1.333319).  Saving model ...
Validation loss decreased (1.333319 --> 1.332855).  Saving model ...
Validation loss decreased (1.332855 --> 1.332423).  Saving model ...
Validation loss decreased (1.332423 --> 1.331949).  Saving model ...
Validation loss decreased (1.331949 --> 1.331522).  Saving model ...
Validation loss decreased (1.331522 --> 1.331115).  Saving model ...
Validation loss decreased (1.331115 --> 1.330702).  Saving model ...
Validation loss decreased (1.330702 --> 1.330282).  Saving model ...
Validation loss decreased (1.330282 --> 1.329881).  Saving model ...
Validation loss decreased (1.329881 --> 1.329471).  Saving model ...
Validation loss decreased (1.329471 --> 1.329065).  Saving model ...
Validation loss decreased (1.329065 --> 1.328631).  Saving model ...
Validation loss decreased (1.328631 --> 1.328209).  Saving model ...
Validation loss decreased (1.328209 --> 1.327803).  Saving model ...
Validation loss decreased (1.327803 --> 1.327372).  Saving model ...
Validation loss decreased (1.327372 --> 1.326993).  Saving model ...
Validation loss decreased (1.326993 --> 1.326589).  Saving model ...
Validation loss decreased (1.326589 --> 1.326154).  Saving model ...
Validation loss decreased (1.326154 --> 1.325733).  Saving model ...
Validation loss decreased (1.325733 --> 1.325302).  Saving model ...
Validation loss decreased (1.325302 --> 1.324865).  Saving model ...
Validation loss decreased (1.324865 --> 1.324388).  Saving model ...
Validation loss decreased (1.324388 --> 1.323867).  Saving model ...
Validation loss decreased (1.323867 --> 1.323428).  Saving model ...
Validation loss decreased (1.323428 --> 1.322998).  Saving model ...
Validation loss decreased (1.322998 --> 1.322550).  Saving model ...
Validation loss decreased (1.322550 --> 1.322070).  Saving model ...
Validation loss decreased (1.322070 --> 1.321686).  Saving model ...
Validation loss decreased (1.321686 --> 1.321236).  Saving model ...
Validation loss decreased (1.321236 --> 1.320820).  Saving model ...
Validation loss decreased (1.320820 --> 1.320399).  Saving model ...
Validation loss decreased (1.320399 --> 1.319971).  Saving model ...
Validation loss decreased (1.319971 --> 1.319522).  Saving model ...
Validation loss decreased (1.319522 --> 1.319039).  Saving model ...
Validation loss decreased (1.319039 --> 1.318611).  Saving model ...
Validation loss decreased (1.318611 --> 1.318146).  Saving model ...
Validation loss decreased (1.318146 --> 1.317681).  Saving model ...
Validation loss decreased (1.317681 --> 1.317217).  Saving model ...
Validation loss decreased (1.317217 --> 1.316721).  Saving model ...
Validation loss decreased (1.316721 --> 1.316286).  Saving model ...
Validation loss decreased (1.316286 --> 1.315815).  Saving model ...
Validation loss decreased (1.315815 --> 1.315361).  Saving model ...
Validation loss decreased (1.315361 --> 1.314922).  Saving model ...
Validation loss decreased (1.314922 --> 1.314500).  Saving model ...
Validation loss decreased (1.314500 --> 1.314019).  Saving model ...
Validation loss decreased (1.314019 --> 1.313590).  Saving model ...
Validation loss decreased (1.313590 --> 1.313202).  Saving model ...
Validation loss decreased (1.313202 --> 1.312708).  Saving model ...
Validation loss decreased (1.312708 --> 1.312207).  Saving model ...
Validation loss decreased (1.312207 --> 1.311767).  Saving model ...
Validation loss decreased (1.311767 --> 1.311292).  Saving model ...
Validation loss decreased (1.311292 --> 1.310834).  Saving model ...
Validation loss decreased (1.310834 --> 1.310352).  Saving model ...
Validation loss decreased (1.310352 --> 1.310002).  Saving model ...
Validation loss decreased (1.310002 --> 1.309536).  Saving model ...
Validation loss decreased (1.309536 --> 1.309058).  Saving model ...
Validation loss decreased (1.309058 --> 1.308600).  Saving model ...
Validation loss decreased (1.308600 --> 1.308125).  Saving model ...
Validation loss decreased (1.308125 --> 1.307649).  Saving model ...
Validation loss decreased (1.307649 --> 1.307126).  Saving model ...
Validation loss decreased (1.307126 --> 1.306659).  Saving model ...
Validation loss decreased (1.306659 --> 1.306177).  Saving model ...
Validation loss decreased (1.306177 --> 1.305783).  Saving model ...
Validation loss decreased (1.305783 --> 1.305307).  Saving model ...
Validation loss decreased (1.305307 --> 1.304767).  Saving model ...
Validation loss decreased (1.304767 --> 1.304311).  Saving model ...
Validation loss decreased (1.304311 --> 1.303869).  Saving model ...
Validation loss decreased (1.303869 --> 1.303364).  Saving model ...
Validation loss decreased (1.303364 --> 1.302826).  Saving model ...
Validation loss decreased (1.302826 --> 1.302348).  Saving model ...
Validation loss decreased (1.302348 --> 1.301854).  Saving model ...
Validation loss decreased (1.301854 --> 1.301353).  Saving model ...
Validation loss decreased (1.301353 --> 1.300830).  Saving model ...
Validation loss decreased (1.300830 --> 1.300312).  Saving model ...
Validation loss decreased (1.300312 --> 1.299889).  Saving model ...
Validation loss decreased (1.299889 --> 1.299407).  Saving model ...
Validation loss decreased (1.299407 --> 1.298909).  Saving model ...
Validation loss decreased (1.298909 --> 1.298446).  Saving model ...
Validation loss decreased (1.298446 --> 1.297968).  Saving model ...
Validation loss decreased (1.297968 --> 1.297480).  Saving model ...
Validation loss decreased (1.297480 --> 1.297008).  Saving model ...
Validation loss decreased (1.297008 --> 1.296549).  Saving model ...
Validation loss decreased (1.296549 --> 1.296069).  Saving model ...
Validation loss decreased (1.296069 --> 1.295604).  Saving model ...
Validation loss decreased (1.295604 --> 1.295082).  Saving model ...
Validation loss decreased (1.295082 --> 1.294398).  Saving model ...
Validation loss decreased (1.294398 --> 1.293922).  Saving model ...
Validation loss decreased (1.293922 --> 1.293459).  Saving model ...
Validation loss decreased (1.293459 --> 1.292944).  Saving model ...
Validation loss decreased (1.292944 --> 1.292467).  Saving model ...
Validation loss decreased (1.292467 --> 1.292007).  Saving model ...
Validation loss decreased (1.292007 --> 1.291484).  Saving model ...
Validation loss decreased (1.291484 --> 1.291002).  Saving model ...
Validation loss decreased (1.291002 --> 1.290346).  Saving model ...
Validation loss decreased (1.290346 --> 1.289819).  Saving model ...
Validation loss decreased (1.289819 --> 1.289279).  Saving model ...
Validation loss decreased (1.289279 --> 1.288758).  Saving model ...
Validation loss decreased (1.288758 --> 1.288176).  Saving model ...
Validation loss decreased (1.288176 --> 1.287578).  Saving model ...
Validation loss decreased (1.287578 --> 1.287032).  Saving model ...
Validation loss decreased (1.287032 --> 1.286556).  Saving model ...
Validation loss decreased (1.286556 --> 1.286046).  Saving model ...
Validation loss decreased (1.286046 --> 1.285530).  Saving model ...
Validation loss decreased (1.285530 --> 1.284924).  Saving model ...
Validation loss decreased (1.284924 --> 1.284319).  Saving model ...
Validation loss decreased (1.284319 --> 1.283753).  Saving model ...
Validation loss decreased (1.283753 --> 1.283192).  Saving model ...
Validation loss decreased (1.283192 --> 1.282694).  Saving model ...
Validation loss decreased (1.282694 --> 1.282162).  Saving model ...
Validation loss decreased (1.282162 --> 1.281643).  Saving model ...
Validation loss decreased (1.281643 --> 1.281117).  Saving model ...
Validation loss decreased (1.281117 --> 1.280589).  Saving model ...
Validation loss decreased (1.280589 --> 1.280071).  Saving model ...
Validation loss decreased (1.280071 --> 1.279583).  Saving model ...
Validation loss decreased (1.279583 --> 1.278972).  Saving model ...
Validation loss decreased (1.278972 --> 1.278476).  Saving model ...
Validation loss decreased (1.278476 --> 1.277932).  Saving model ...
Validation loss decreased (1.277932 --> 1.277331).  Saving model ...
Validation loss decreased (1.277331 --> 1.276812).  Saving model ...
Validation loss decreased (1.276812 --> 1.276301).  Saving model ...
Validation loss decreased (1.276301 --> 1.275755).  Saving model ...
Validation loss decreased (1.275755 --> 1.275279).  Saving model ...
Validation loss decreased (1.275279 --> 1.274709).  Saving model ...
Validation loss decreased (1.274709 --> 1.274309).  Saving model ...
Validation loss decreased (1.274309 --> 1.273748).  Saving model ...
Validation loss decreased (1.273748 --> 1.273246).  Saving model ...
Validation loss decreased (1.273246 --> 1.272732).  Saving model ...
Validation loss decreased (1.272732 --> 1.272242).  Saving model ...
Validation loss decreased (1.272242 --> 1.271694).  Saving model ...
Validation loss decreased (1.271694 --> 1.271117).  Saving model ...
Validation loss decreased (1.271117 --> 1.270636).  Saving model ...
Validation loss decreased (1.270636 --> 1.270183).  Saving model ...
Validation loss decreased (1.270183 --> 1.269565).  Saving model ...
Validation loss decreased (1.269565 --> 1.269041).  Saving model ...
Validation loss decreased (1.269041 --> 1.268424).  Saving model ...
Validation loss decreased (1.268424 --> 1.267919).  Saving model ...
Validation loss decreased (1.267919 --> 1.267366).  Saving model ...
Validation loss decreased (1.267366 --> 1.266806).  Saving model ...
Validation loss decreased (1.266806 --> 1.266213).  Saving model ...
Validation loss decreased (1.266213 --> 1.265580).  Saving model ...
Validation loss decreased (1.265580 --> 1.265026).  Saving model ...
Validation loss decreased (1.265026 --> 1.264388).  Saving model ...
Validation loss decreased (1.264388 --> 1.263787).  Saving model ...
Validation loss decreased (1.263787 --> 1.263297).  Saving model ...
Validation loss decreased (1.263297 --> 1.262754).  Saving model ...
Validation loss decreased (1.262754 --> 1.262172).  Saving model ...
Validation loss decreased (1.262172 --> 1.261600).  Saving model ...
Validation loss decreased (1.261600 --> 1.260841).  Saving model ...
Validation loss decreased (1.260841 --> 1.260201).  Saving model ...
Validation loss decreased (1.260201 --> 1.259676).  Saving model ...
Validation loss decreased (1.259676 --> 1.259048).  Saving model ...
Validation loss decreased (1.259048 --> 1.258542).  Saving model ...
Validation loss decreased (1.258542 --> 1.258001).  Saving model ...
Validation loss decreased (1.258001 --> 1.257371).  Saving model ...
Validation loss decreased (1.257371 --> 1.256816).  Saving model ...
Validation loss decreased (1.256816 --> 1.256241).  Saving model ...
Validation loss decreased (1.256241 --> 1.255728).  Saving model ...
Validation loss decreased (1.255728 --> 1.255033).  Saving model ...
Validation loss decreased (1.255033 --> 1.254524).  Saving model ...
Validation loss decreased (1.254524 --> 1.254100).  Saving model ...
Validation loss decreased (1.254100 --> 1.253568).  Saving model ...
Validation loss decreased (1.253568 --> 1.252954).  Saving model ...
Validation loss decreased (1.252954 --> 1.252535).  Saving model ...
Validation loss decreased (1.252535 --> 1.251998).  Saving model ...
Validation loss decreased (1.251998 --> 1.251455).  Saving model ...
Validation loss decreased (1.251455 --> 1.250884).  Saving model ...
Validation loss decreased (1.250884 --> 1.250353).  Saving model ...
Validation loss decreased (1.250353 --> 1.249896).  Saving model ...
Validation loss decreased (1.249896 --> 1.249336).  Saving model ...
Validation loss decreased (1.249336 --> 1.248815).  Saving model ...
Validation loss decreased (1.248815 --> 1.248441).  Saving model ...
Validation loss decreased (1.248441 --> 1.247916).  Saving model ...
Validation loss decreased (1.247916 --> 1.247529).  Saving model ...
Validation loss decreased (1.247529 --> 1.247007).  Saving model ...
Validation loss decreased (1.247007 --> 1.246352).  Saving model ...
Validation loss decreased (1.246352 --> 1.245783).  Saving model ...
Validation loss decreased (1.245783 --> 1.245195).  Saving model ...
Validation loss decreased (1.245195 --> 1.244600).  Saving model ...
Validation loss decreased (1.244600 --> 1.243934).  Saving model ...
Validation loss decreased (1.243934 --> 1.243272).  Saving model ...
Validation loss decreased (1.243272 --> 1.242704).  Saving model ...
Validation loss decreased (1.242704 --> 1.242242).  Saving model ...
Validation loss decreased (1.242242 --> 1.241700).  Saving model ...
Validation loss decreased (1.241700 --> 1.241114).  Saving model ...
Validation loss decreased (1.241114 --> 1.240519).  Saving model ...
Validation loss decreased (1.240519 --> 1.240003).  Saving model ...
Validation loss decreased (1.240003 --> 1.239363).  Saving model ...
Validation loss decreased (1.239363 --> 1.238768).  Saving model ...
Validation loss decreased (1.238768 --> 1.238259).  Saving model ...
Validation loss decreased (1.238259 --> 1.237661).  Saving model ...
Validation loss decreased (1.237661 --> 1.237175).  Saving model ...
Validation loss decreased (1.237175 --> 1.236587).  Saving model ...
Validation loss decreased (1.236587 --> 1.236110).  Saving model ...
Validation loss decreased (1.236110 --> 1.235686).  Saving model ...
Validation loss decreased (1.235686 --> 1.235415).  Saving model ...
Validation loss decreased (1.235415 --> 1.234790).  Saving model ...
Validation loss decreased (1.234790 --> 1.234309).  Saving model ...
Validation loss decreased (1.234309 --> 1.233759).  Saving model ...
Validation loss decreased (1.233759 --> 1.233061).  Saving model ...
Validation loss decreased (1.233061 --> 1.232533).  Saving model ...
Validation loss decreased (1.232533 --> 1.231946).  Saving model ...
Validation loss decreased (1.231946 --> 1.231434).  Saving model ...
Validation loss decreased (1.231434 --> 1.230842).  Saving model ...
Validation loss decreased (1.230842 --> 1.230308).  Saving model ...
Validation loss decreased (1.230308 --> 1.229854).  Saving model ...
Validation loss decreased (1.229854 --> 1.229246).  Saving model ...
Validation loss decreased (1.229246 --> 1.228673).  Saving model ...
Validation loss decreased (1.228673 --> 1.228231).  Saving model ...
Validation loss decreased (1.228231 --> 1.227673).  Saving model ...
Validation loss decreased (1.227673 --> 1.227159).  Saving model ...
Validation loss decreased (1.227159 --> 1.226678).  Saving model ...
Validation loss decreased (1.226678 --> 1.226261).  Saving model ...
Validation loss decreased (1.226261 --> 1.225708).  Saving model ...
Validation loss decreased (1.225708 --> 1.225235).  Saving model ...
Validation loss decreased (1.225235 --> 1.224781).  Saving model ...
Validation loss decreased (1.224781 --> 1.224332).  Saving model ...
Validation loss decreased (1.224332 --> 1.223717).  Saving model ...
Validation loss decreased (1.223717 --> 1.223302).  Saving model ...
Validation loss decreased (1.223302 --> 1.222825).  Saving model ...
Validation loss decreased (1.222825 --> 1.222397).  Saving model ...
Validation loss decreased (1.222397 --> 1.221776).  Saving model ...
Validation loss decreased (1.221776 --> 1.221212).  Saving model ...
Validation loss decreased (1.221212 --> 1.220817).  Saving model ...
Validation loss decreased (1.220817 --> 1.220276).  Saving model ...
Validation loss decreased (1.220276 --> 1.219837).  Saving model ...
Validation loss decreased (1.219837 --> 1.219164).  Saving model ...
Validation loss decreased (1.219164 --> 1.218651).  Saving model ...
Validation loss decreased (1.218651 --> 1.218401).  Saving model ...
Validation loss decreased (1.218401 --> 1.217880).  Saving model ...
Validation loss decreased (1.217880 --> 1.217489).  Saving model ...
Validation loss decreased (1.217489 --> 1.216715).  Saving model ...
Validation loss decreased (1.216715 --> 1.216091).  Saving model ...
Validation loss decreased (1.216091 --> 1.215779).  Saving model ...
Validation loss decreased (1.215779 --> 1.215405).  Saving model ...
Validation loss decreased (1.215405 --> 1.215034).  Saving model ...
Validation loss decreased (1.215034 --> 1.214509).  Saving model ...
Validation loss decreased (1.214509 --> 1.214023).  Saving model ...
Validation loss decreased (1.214023 --> 1.213431).  Saving model ...
Validation loss decreased (1.213431 --> 1.213077).  Saving model ...
Validation loss decreased (1.213077 --> 1.212607).  Saving model ...
Validation loss decreased (1.212607 --> 1.212001).  Saving model ...
Validation loss decreased (1.212001 --> 1.211465).  Saving model ...
Validation loss decreased (1.211465 --> 1.210955).  Saving model ...
Validation loss decreased (1.210955 --> 1.210679).  Saving model ...
Validation loss decreased (1.210679 --> 1.210279).  Saving model ...
Validation loss decreased (1.210279 --> 1.209847).  Saving model ...
Validation loss decreased (1.209847 --> 1.209377).  Saving model ...
Validation loss decreased (1.209377 --> 1.208964).  Saving model ...
Validation loss decreased (1.208964 --> 1.208549).  Saving model ...
Validation loss decreased (1.208549 --> 1.207948).  Saving model ...
Validation loss decreased (1.207948 --> 1.207485).  Saving model ...
Validation loss decreased (1.207485 --> 1.206933).  Saving model ...
Validation loss decreased (1.206933 --> 1.206492).  Saving model ...
Validation loss decreased (1.206492 --> 1.206057).  Saving model ...
Validation loss decreased (1.206057 --> 1.205496).  Saving model ...
Validation loss decreased (1.205496 --> 1.204995).  Saving model ...
Validation loss decreased (1.204995 --> 1.204587).  Saving model ...
Validation loss decreased (1.204587 --> 1.204049).  Saving model ...
Validation loss decreased (1.204049 --> 1.203564).  Saving model ...
Validation loss decreased (1.203564 --> 1.203328).  Saving model ...
Validation loss decreased (1.203328 --> 1.203064).  Saving model ...
Validation loss decreased (1.203064 --> 1.202497).  Saving model ...
Validation loss decreased (1.202497 --> 1.202076).  Saving model ...
Validation loss decreased (1.202076 --> 1.201756).  Saving model ...
Validation loss decreased (1.201756 --> 1.201349).  Saving model ...
Validation loss decreased (1.201349 --> 1.201027).  Saving model ...
Validation loss decreased (1.201027 --> 1.200617).  Saving model ...
Validation loss decreased (1.200617 --> 1.200324).  Saving model ...
Validation loss decreased (1.200324 --> 1.199866).  Saving model ...
Validation loss decreased (1.199866 --> 1.199286).  Saving model ...
Validation loss decreased (1.199286 --> 1.198931).  Saving model ...
Validation loss decreased (1.198931 --> 1.198484).  Saving model ...
Validation loss decreased (1.198484 --> 1.197912).  Saving model ...
Validation loss decreased (1.197912 --> 1.197426).  Saving model ...
Validation loss decreased (1.197426 --> 1.197063).  Saving model ...
Validation loss decreased (1.197063 --> 1.196895).  Saving model ...
Validation loss decreased (1.196895 --> 1.196541).  Saving model ...
Validation loss decreased (1.196541 --> 1.196016).  Saving model ...
Validation loss decreased (1.196016 --> 1.195634).  Saving model ...
Validation loss decreased (1.195634 --> 1.195265).  Saving model ...
Validation loss decreased (1.195265 --> 1.194894).  Saving model ...
Validation loss decreased (1.194894 --> 1.194738).  Saving model ...
Validation loss decreased (1.194738 --> 1.194433).  Saving model ...
Validation loss decreased (1.194433 --> 1.193996).  Saving model ...
Validation loss decreased (1.193996 --> 1.193727).  Saving model ...
Validation loss decreased (1.193727 --> 1.193276).  Saving model ...
Validation loss decreased (1.193276 --> 1.192870).  Saving model ...
Validation loss decreased (1.192870 --> 1.192433).  Saving model ...
Validation loss decreased (1.192433 --> 1.191975).  Saving model ...
Validation loss decreased (1.191975 --> 1.191635).  Saving model ...
Validation loss decreased (1.191635 --> 1.191180).  Saving model ...
Validation loss decreased (1.191180 --> 1.190849).  Saving model ...
Validation loss decreased (1.190849 --> 1.190356).  Saving model ...
Validation loss decreased (1.190356 --> 1.189910).  Saving model ...
Validation loss decreased (1.189910 --> 1.189327).  Saving model ...
Validation loss decreased (1.189327 --> 1.188781).  Saving model ...
Validation loss decreased (1.188781 --> 1.188479).  Saving model ...
Validation loss decreased (1.188479 --> 1.187900).  Saving model ...
Validation loss decreased (1.187900 --> 1.187530).  Saving model ...
Validation loss decreased (1.187530 --> 1.187267).  Saving model ...
Validation loss decreased (1.187267 --> 1.186854).  Saving model ...
Validation loss decreased (1.186854 --> 1.186739).  Saving model ...
Validation loss decreased (1.186739 --> 1.186535).  Saving model ...
Validation loss decreased (1.186535 --> 1.186166).  Saving model ...
Validation loss decreased (1.186166 --> 1.185678).  Saving model ...
Validation loss decreased (1.185678 --> 1.185155).  Saving model ...
Validation loss decreased (1.185155 --> 1.184715).  Saving model ...
Validation loss decreased (1.184715 --> 1.184364).  Saving model ...
Validation loss decreased (1.184364 --> 1.184107).  Saving model ...
Validation loss decreased (1.184107 --> 1.183576).  Saving model ...
Validation loss decreased (1.183576 --> 1.183124).  Saving model ...
Validation loss decreased (1.183124 --> 1.182801).  Saving model ...
Validation loss decreased (1.182801 --> 1.182624).  Saving model ...
Validation loss decreased (1.182624 --> 1.182076).  Saving model ...
Validation loss decreased (1.182076 --> 1.181420).  Saving model ...
Validation loss decreased (1.181420 --> 1.180875).  Saving model ...
Validation loss decreased (1.180875 --> 1.180565).  Saving model ...
Validation loss decreased (1.180565 --> 1.180278).  Saving model ...
Validation loss decreased (1.180278 --> 1.179933).  Saving model ...
Validation loss decreased (1.179933 --> 1.179495).  Saving model ...
Validation loss decreased (1.179495 --> 1.178766).  Saving model ...
Validation loss decreased (1.178766 --> 1.178150).  Saving model ...
Validation loss decreased (1.178150 --> 1.177805).  Saving model ...
Validation loss decreased (1.177805 --> 1.177752).  Saving model ...
Validation loss decreased (1.177752 --> 1.177627).  Saving model ...
Validation loss decreased (1.177627 --> 1.177325).  Saving model ...
Validation loss decreased (1.177325 --> 1.176817).  Saving model ...
Validation loss decreased (1.176817 --> 1.176469).  Saving model ...
Validation loss decreased (1.176469 --> 1.176327).  Saving model ...
Validation loss decreased (1.176327 --> 1.176313).  Saving model ...
Validation loss decreased (1.176313 --> 1.175965).  Saving model ...
Validation loss decreased (1.175965 --> 1.175576).  Saving model ...
Validation loss decreased (1.175576 --> 1.175334).  Saving model ...
Validation loss decreased (1.175334 --> 1.174940).  Saving model ...
Validation loss decreased (1.174940 --> 1.174381).  Saving model ...
Validation loss decreased (1.174381 --> 1.173969).  Saving model ...
Validation loss decreased (1.173969 --> 1.173713).  Saving model ...
Validation loss decreased (1.173713 --> 1.173215).  Saving model ...
Validation loss decreased (1.173215 --> 1.172763).  Saving model ...
Validation loss decreased (1.172763 --> 1.172468).  Saving model ...
Validation loss decreased (1.172468 --> 1.171776).  Saving model ...
Validation loss decreased (1.171776 --> 1.171417).  Saving model ...
Validation loss decreased (1.171417 --> 1.171064).  Saving model ...
Validation loss decreased (1.171064 --> 1.170692).  Saving model ...
Validation loss decreased (1.170692 --> 1.170584).  Saving model ...
Validation loss decreased (1.170584 --> 1.170235).  Saving model ...
Validation loss decreased (1.170235 --> 1.169955).  Saving model ...
Validation loss decreased (1.169955 --> 1.169560).  Saving model ...
Validation loss decreased (1.169560 --> 1.169152).  Saving model ...
Validation loss decreased (1.169152 --> 1.168859).  Saving model ...
Validation loss decreased (1.168859 --> 1.168774).  Saving model ...
Validation loss decreased (1.168774 --> 1.168436).  Saving model ...
Validation loss decreased (1.168436 --> 1.168261).  Saving model ...
Validation loss decreased (1.168261 --> 1.167744).  Saving model ...
Validation loss decreased (1.167744 --> 1.167461).  Saving model ...
Validation loss decreased (1.167461 --> 1.167006).  Saving model ...
Validation loss decreased (1.167006 --> 1.166572).  Saving model ...
EarlyStopping counter: 1 out of 5.0
Validation loss decreased (1.166572 --> 1.166252).  Saving model ...
Validation loss decreased (1.166252 --> 1.165462).  Saving model ...
Validation loss decreased (1.165462 --> 1.164879).  Saving model ...
Validation loss decreased (1.164879 --> 1.164683).  Saving model ...
Validation loss decreased (1.164683 --> 1.164517).  Saving model ...
EarlyStopping counter: 1 out of 5.0
Validation loss decreased (1.164517 --> 1.164200).  Saving model ...
Validation loss decreased (1.164200 --> 1.163765).  Saving model ...
Validation loss decreased (1.163765 --> 1.163565).  Saving model ...
Validation loss decreased (1.163565 --> 1.162900).  Saving model ...
Validation loss decreased (1.162900 --> 1.162685).  Saving model ...
EarlyStopping counter: 1 out of 5.0
Validation loss decreased (1.162685 --> 1.162205).  Saving model ...
Validation loss decreased (1.162205 --> 1.161673).  Saving model ...
Validation loss decreased (1.161673 --> 1.161383).  Saving model ...
Validation loss decreased (1.161383 --> 1.160991).  Saving model ...
/localscratch/yinan.28721947.0/env/lib/python3.7/site-packages/torch/nn/functional.py:1794: UserWarning: nn.functional.tanh is deprecated. Use torch.tanh instead.
  warnings.warn("nn.functional.tanh is deprecated. Use torch.tanh instead.")
/localscratch/yinan.28721947.0/env/lib/python3.7/site-packages/transformers/optimization.py:155: UserWarning: This overload of add_ is deprecated:
	add_(Number alpha, Tensor other)
Consider using one of the following signatures instead:
	add_(Tensor other, *, Number alpha) (Triggered internally at  ../torch/csrc/utils/python_arg_parser.cpp:1025.)
  exp_avg.mul_(beta1).add_(1.0 - beta1, grad)
wandb: Waiting for W&B process to finish, PID 78465... (success).
wandb: - 0.00MB of 0.00MB uploaded (0.00MB deduped)wandb: \ 0.00MB of 0.00MB uploaded (0.00MB deduped)wandb: | 0.00MB of 0.00MB uploaded (0.00MB deduped)wandb: / 0.00MB of 0.00MB uploaded (0.00MB deduped)wandb: - 0.00MB of 0.00MB uploaded (0.00MB deduped)wandb: \ 0.00MB of 0.00MB uploaded (0.00MB deduped)wandb: | 0.00MB of 0.00MB uploaded (0.00MB deduped)wandb: / 0.00MB of 0.00MB uploaded (0.00MB deduped)wandb: - 0.00MB of 0.00MB uploaded (0.00MB deduped)wandb: \ 0.00MB of 0.00MB uploaded (0.00MB deduped)wandb: | 0.00MB of 0.00MB uploaded (0.00MB deduped)wandb: / 0.00MB of 0.00MB uploaded (0.00MB deduped)wandb: - 0.00MB of 0.00MB uploaded (0.00MB deduped)wandb:                                                                                
wandb: Run history:
wandb:     e_F1 ▁▁▂▂▂▂▄▅▆▆▆▆▇▇▇▇▇▇▇▇▇▇▇▇▇▇▇▇▇▇██████████
wandb:   e_loss █▇▇▇▆▆▆▆▆▅▅▅▅▅▅▅▄▄▄▄▄▄▃▃▃▃▃▃▂▂▂▂▂▂▂▁▁▁▁▁
wandb:     t_F1 ▁▁▂▂▃▃▃▃▃▄▃▄▄▄▄▄▆▅▅▆▆▆▆▆▆▆▇▇▆▆▇▇▇▇▇▇▇███
wandb:   t_loss █▇▇▇▇▆▇▇▆▆▆▅▆▆▆▅▅▅▅▄▄▄▄▄▄▃▃▃▃▃▂▂▂▂▂▂▂▁▁▁
wandb: 
wandb: Run summary:
wandb:     e_F1 48.24058
wandb:   e_loss 1.16099
wandb:     t_F1 52.26019
wandb:   t_loss 1.12645
wandb: 
wandb: Synced 4 W&B file(s), 0 media file(s), 0 artifact file(s) and 0 other file(s)
wandb: Synced rural-breeze-1: https://wandb.ai/yinanazhou/xl_512_bs_8_lr_1e07_es_5_lc_True_nr_False_sr_False_stem_True_lemma_False_repeat_1_fold_1/runs/coph19xh
wandb: Find logs at: ./wandb/run-20220311_061732-coph19xh/logs/debug.log
wandb: 

wandb: wandb version 0.12.11 is available!  To upgrade, please run:
wandb:  $ pip install wandb --upgrade
2022-03-11 11:49:24.949040: I tensorflow/stream_executor/platform/default/dso_loader.cc:48] Successfully opened dynamic library libcudart.so.10.1
wandb: Tracking run with wandb version 0.12.5
wandb: Syncing run silvery-snowball-1
wandb: ⭐️ View project at https://wandb.ai/yinanazhou/xl_512_bs_8_lr_1e07_es_5_lc_True_nr_False_sr_False_stem_True_lemma_False_repeat_1_fold_2
wandb: 🚀 View run at https://wandb.ai/yinanazhou/xl_512_bs_8_lr_1e07_es_5_lc_True_nr_False_sr_False_stem_True_lemma_False_repeat_1_fold_2/runs/2fw66r65
wandb: Run data is saved locally in /project/6002780/yinan/Thesis_MER_Lyrics/lyric-emotion/wandb/run-20220311_114921-2fw66r65
wandb: Run `wandb offline` to turn off syncing.
slurmstepd: error: *** JOB 28721947 ON cdr2635 CANCELLED AT 2022-03-11T16:13:43 DUE TO TIME LIMIT ***
